number,value,datetime_start,datetime_complete,duration,params_adam_beta1,params_adam_beta2,params_adam_lr,params_adam_wd,params_batch_size,params_dropout,params_fc_hidden,params_lr_factor,params_lr_patience,params_optimizer,params_sgd_lr,params_sgd_momentum,params_sgd_wd,user_attrs_best_epoch,user_attrs_validation_accuracy,user_attrs_validation_macro_f1,state
0,0.9998435017287159,2026-10-09 21:56:04.106153,2026-10-09 22:03:17.347252,0 days 00:07:13.241099,,,,,64,0.1624074561769746,128,0.11646759543664197,20,SGD,0.0396760507705299,0.8743233534055306,0.0006796578090758161,11.0,0.9998446239900559,0.9998423794673759,COMPLETE
1,0.9996869653141338,2026-10-09 22:03:17.481648,2026-10-09 22:09:01.881624,0 days 00:05:44.399976,,,,,128,0.21649165607921678,256,0.728140769114411,8,SGD,0.0007523742884534858,0.8062449345551705,6.672367170464208e-05,31.0,0.9996892479801118,0.9996846826481557,COMPLETE
2,0.9992411543917796,2026-10-09 22:09:02.013071,2026-10-09 22:15:04.755513,0 days 00:06:02.742442,,,,,128,0.4862528132298237,512,0.19763058787582308,12,SGD,0.00019634341572933326,0.8984275776885255,5.762487216478604e-05,41.0,0.9992231199502797,0.9992591888332797,COMPLETE
3,0.9998435017287159,2026-10-09 22:15:04.888318,2026-10-09 22:20:47.812606,0 days 00:05:42.924288,,,,,200,0.17394178221021084,64,0.8374993880184934,6,SGD,0.06584106160121614,0.9594999316240181,0.0002463768595899747,37.0,0.9998446239900559,0.9998423794673759,COMPLETE
4,0.9996869653141338,2026-10-09 22:20:47.944335,2026-10-09 22:26:50.765883,0 days 00:06:02.821548,,,,,128,0.2123738038749523,256,0.717795815437326,8,SGD,0.025502980701628937,0.7216196866671335,0.008862326508576254,3.0,0.9996892479801118,0.9996846826481557,COMPLETE
5,0.9986366701692795,2026-10-09 22:26:50.900178,2026-10-09 22:28:03.477963,0 days 00:01:12.577785,,,,,128,0.1463476238100519,128,0.36014665762139764,16,SGD,0.0009833181933644897,0.7184319215829468,1.753594952976443e-05,,,,PRUNED
6,0.9996870414909829,2026-10-09 22:28:03.611593,2026-10-09 22:34:06.820400,0 days 00:06:03.208807,0.8651047997790626,0.9031397756501047,0.0007162786999897341,1.263794633808288e-06,128,0.40838687198182444,256,0.6091283290110243,10,Adam,,,,50.0,0.9996892479801118,0.9996848350018538,COMPLETE
7,0.9998435017287159,2026-10-09 22:34:06.950617,2026-10-09 22:39:53.459367,0 days 00:05:46.508750,0.9720044826262805,0.9802868404822216,0.004132765459466363,0.000341676434183297,200,0.21590058116550723,128,0.24925604710882868,19,Adam,,,,23.0,0.9998446239900559,0.9998423794673759,COMPLETE
8,0.9996869653141338,2026-10-09 22:39:53.598139,2026-10-09 22:47:07.913304,0 days 00:07:14.315165,,,,,64,0.42720590636899725,512,0.19589229386694626,10,SGD,0.0034059785435329977,0.8210491909131459,7.7344821566468e-06,11.0,0.9996892479801118,0.9996846826481557,COMPLETE
9,0.998015094406639,2026-10-09 22:47:08.147560,2026-10-09 22:48:25.644073,0 days 00:01:17.496513,,,,,128,0.20071291833014568,256,0.5021432185830892,5,SGD,0.000715354779469316,0.7106972147328144,0.000274319913977967,,,,PRUNED
10,0.9996869653141338,2026-10-09 22:48:25.785513,2026-10-09 22:55:40.190504,0 days 00:07:14.404991,0.9770730713395525,0.9958810975199475,0.00010862348973937149,0.007645683783605599,64,0.323540359302987,128,0.422359922501545,20,Adam,,,,10.0,0.9996892479801118,0.9996846826481557,COMPLETE
11,0.9976984173473098,2026-10-09 22:55:40.343978,2026-10-09 22:56:49.810164,0 days 00:01:09.466186,,,,,200,0.10321648831143171,64,0.8895190276185567,16,SGD,0.09540369840469419,0.9853625896320626,0.0010437258483189142,,,,PRUNED
12,0.9996870414909829,2026-10-09 22:56:49.954002,2026-10-09 23:02:29.570915,0 days 00:05:39.616913,,,,,200,0.28455177586829483,64,0.8889223100786534,15,SGD,0.0329684711437591,0.9690045843459457,0.0012237594247191301,39.0,0.9996892479801118,0.9996848350018538,COMPLETE
13,0.9995303905914141,2026-10-09 23:02:29.702912,2026-10-09 23:03:50.775334,0 days 00:01:21.072422,,,,,64,0.14475048819439315,64,0.34978794873769303,5,SGD,0.014043721733475028,0.9122902878584767,0.0004940538306086194,,,,PRUNED
14,0.9998435017287159,2026-10-09 23:03:50.918919,2026-10-09 23:09:29.962485,0 days 00:05:39.043566,0.859332234868209,0.9283914118467068,0.009917608120507165,1.3962100266000202e-06,200,0.28484590336045124,64,0.5779239573507515,13,Adam,,,,36.0,0.9998446239900559,0.9998423794673759,COMPLETE
15,0.9998435017287159,2026-10-09 23:09:30.100636,2026-10-09 23:16:27.637973,0 days 00:06:57.537337,,,,,64,0.15115499370132435,128,0.7769067216636688,18,SGD,0.08872754604813389,0.9015230412918347,1.1535635582566103e-06,2.0,0.9998446239900559,0.9998423794673759,COMPLETE
16,0.9995303905914141,2026-10-09 23:16:27.782680,2026-10-09 23:17:34.955738,0 days 00:01:07.173058,,,,,200,0.1019739981953502,64,0.11054337150473875,13,SGD,0.007985761920474493,0.8418220394354431,0.005928440456998787,,,,PRUNED
17,0.9998435017287159,2026-10-09 23:17:35.089192,2026-10-09 23:24:15.600397,0 days 00:06:40.511205,,,,,64,0.2802886303907517,128,0.6161529202998269,7,SGD,0.04865872266001758,0.9420750413040843,0.00018419912902158537,4.0,0.9998446239900559,0.9998423794673759,COMPLETE
18,0.9998435017287159,2026-10-09 23:24:15.736212,2026-10-09 23:30:01.178394,0 days 00:05:45.442182,0.9175988105045949,0.9554222965937597,0.00013159405537260094,7.272499656034689e-05,200,0.16242096428774086,512,0.4808837093482553,11,Adam,,,,11.0,0.9998446239900559,0.9998423794673759,COMPLETE
19,0.9996869653141338,2026-10-09 23:30:01.310639,2026-10-09 23:36:55.409935,0 days 00:06:54.099296,,,,,64,0.25112285315613164,64,0.32189058061021525,17,SGD,0.007904805314839801,0.8683099026977347,0.0018015184300938275,4.0,0.9996892479801118,0.9996846826481557,COMPLETE
20,0.9995303905914141,2026-10-09 23:36:55.543050,2026-10-09 23:39:40.022125,0 days 00:02:44.479075,,,,,200,0.3355024465027995,128,0.10052019545656138,14,SGD,0.015965157222639883,0.7806084362054304,0.0001078469806091638,,,,PRUNED
21,0.9995541890776459,2026-10-09 23:39:40.165960,2026-10-09 23:45:23.735866,0 days 00:05:43.569906,0.9881044951698003,0.9942921936228923,0.008917304840886557,0.006974425952565119,200,0.17593748017352706,128,0.22984416135707236,20,Adam,,,,1.0,0.9995338719701679,0.999574506185124,COMPLETE
22,0.9998435017287159,2026-10-09 23:45:23.867074,2026-10-09 23:51:07.680306,0 days 00:05:43.813232,0.9308628053154173,0.9589454712197419,0.0017481585047374856,0.0001154859513039242,200,0.23751664366456393,128,0.1532060883814904,19,Adam,,,,3.0,0.9998446239900559,0.9998423794673759,COMPLETE
23,0.9998435017287159,2026-10-09 23:51:07.812664,2026-10-09 23:56:52.248821,0 days 00:05:44.436157,0.9329703329131199,0.9636867553799485,0.001725603190406562,0.00023469024042169987,200,0.17351452293552047,128,0.30555063168607927,18,Adam,,,,26.0,0.9998446239900559,0.9998423794673759,COMPLETE
24,0.9996869653141338,2026-10-09 23:56:52.380962,2026-10-10 00:02:36.200072,0 days 00:05:43.819110,0.8926743955670332,0.9294884760586817,0.000377133213758307,9.812108531263387e-06,200,0.19395395705392365,128,0.2600745790387302,20,Adam,,,,8.0,0.9996892479801118,0.9996846826481557,COMPLETE
25,0.9998435017287159,2026-10-10 00:02:36.331872,2026-10-10 00:09:30.568497,0 days 00:06:54.236625,0.9611885334858584,0.9766009042852438,0.0038478378059458402,0.0007735296961565813,64,0.2525472260019426,128,0.403225658363466,18,Adam,,,,34.0,0.9998446239900559,0.9998423794673759,COMPLETE
26,0.9998435017287159,2026-10-10 00:09:30.701948,2026-10-10 00:15:13.891419,0 days 00:05:43.189471,0.9021017426397014,0.9342024035722605,0.0004789026615007842,1.1696766705514477e-05,200,0.12663279090614038,64,0.8243276494549253,16,Adam,,,,10.0,0.9998446239900559,0.9998423794673759,COMPLETE
27,0.9998435017287159,2026-10-10 00:15:14.023822,2026-10-10 00:22:10.060231,0 days 00:06:56.036409,,,,,64,0.2283128316723657,512,0.66235210996881,19,SGD,0.045954676525575375,0.9412127362378986,2.014175928618483e-05,13.0,0.9998446239900559,0.9998423794673759,COMPLETE
28,0.9998435017287159,2026-10-10 00:22:10.193925,2026-10-10 00:27:54.382058,0 days 00:05:44.188133,0.9537719087040002,0.9019498749070803,0.00312609146770175,0.0006562321864963459,200,0.18620760911460046,128,0.5306600676603215,7,Adam,,,,8.0,0.9998446239900559,0.9998423794673759,COMPLETE
29,0.9996869653141338,2026-10-10 00:27:54.519668,2026-10-10 00:34:50.332673,0 days 00:06:55.813005,,,,,64,0.12712677430002545,256,0.15968533530456372,9,SGD,0.0031056126585742383,0.8710922764261575,0.00237773112184512,9.0,0.9996892479801118,0.9996846826481557,COMPLETE
30,0.9998435017287159,2026-10-10 00:34:50.464926,2026-10-10 00:40:33.091278,0 days 00:05:42.626352,,,,,200,0.3259120532614002,64,0.2738523404189098,14,SGD,0.060314321816140874,0.7607849273370957,0.00045334971396630456,30.0,0.9998446239900559,0.9998423794673759,COMPLETE
31,0.9998435017287159,2026-10-10 00:40:33.226636,2026-10-10 00:46:16.270434,0 days 00:05:43.043798,0.8522673481767915,0.9315594927825036,0.00905968708591518,1.318310170028115e-06,200,0.2822619305724265,64,0.5807187389201455,12,Adam,,,,27.0,0.9998446239900559,0.9998423794673759,COMPLETE
32,0.9996870414909829,2026-10-10 00:46:16.402666,2026-10-10 00:51:59.324368,0 days 00:05:42.921702,0.8800642491138702,0.9192507914460447,0.003956852018080837,1.1021891677478973e-05,200,0.21920351368475616,64,0.6902964374824009,19,Adam,,,,44.0,0.9996892479801118,0.9996848350018538,COMPLETE
33,0.9996870414909829,2026-10-10 00:51:59.464237,2026-10-10 00:57:42.111178,0 days 00:05:42.646941,0.9499832297523604,0.9472041693419246,0.006062830684347942,0.0013723306484215967,200,0.3591642307355979,64,0.7811249561297593,17,Adam,,,,2.0,0.9996892479801118,0.9996848350018538,COMPLETE
34,0.9998435017287159,2026-10-10 00:57:42.243849,2026-10-10 01:03:43.524410,0 days 00:06:01.280561,0.8737215005032153,0.9826339011030635,0.001878007549175344,3.571344592510507e-05,128,0.2691621876183505,64,0.4301559792029489,6,Adam,,,,25.0,0.9998446239900559,0.9998423794673759,COMPLETE
35,0.9996870414909829,2026-10-10 01:03:43.655422,2026-10-10 01:09:28.802293,0 days 00:05:45.146871,0.9064467883529247,0.9717906799881436,0.005725931602547236,3.14951076889904e-06,200,0.2191592297886772,512,0.19351451091731453,9,Adam,,,,33.0,0.9996892479801118,0.9996848350018538,COMPLETE
36,0.9996869653141338,2026-10-10 01:09:28.933671,2026-10-10 01:15:27.864729,0 days 00:05:58.931058,,,,,128,0.4927416252585527,256,0.5540974141897079,12,SGD,0.014934398874500456,0.943498963802595,0.003700217600644205,23.0,0.9996892479801118,0.9996846826481557,COMPLETE
37,0.9996869653141338,2026-10-10 01:15:27.998234,2026-10-10 01:21:11.113532,0 days 00:05:43.115298,,,,,200,0.3700470949841718,128,0.6428518153898766,14,SGD,0.00484676048553526,0.8635522086239596,0.0005475596085810024,7.0,0.9996892479801118,0.9996846826481557,COMPLETE
38,0.9998435017287159,2026-10-10 01:21:11.245834,2026-10-10 01:27:12.374392,0 days 00:06:01.128558,0.8508790058021641,0.9177082969814523,0.0010847728787048174,0.0021278957448918443,128,0.30131490489287505,64,0.8367380085529614,11,Adam,,,,24.0,0.9998446239900559,0.9998423794673759,COMPLETE
39,0.9998435017287159,2026-10-10 01:27:12.506258,2026-10-10 01:34:08.215590,0 days 00:06:55.709332,,,,,64,0.45728313827009137,256,0.4752621545181335,8,SGD,0.028854548037241256,0.9159576405294471,2.798811584003835e-05,15.0,0.9998446239900559,0.9998423794673759,COMPLETE
40,0.9998435017287159,2026-10-10 01:34:08.347872,2026-10-10 01:39:52.695723,0 days 00:05:44.347851,0.9696958846816897,0.946742920084954,0.002684892248460483,3.8345365982766214e-05,200,0.1985494688327082,128,0.7274997588717941,17,Adam,,,,25.0,0.9998446239900559,0.9998423794673759,COMPLETE
41,0.9998435017287159,2026-10-10 01:39:52.827099,2026-10-10 01:46:47.563004,0 days 00:06:54.735905,,,,,64,0.14706801791317292,128,0.7556556187408194,18,SGD,0.07111828399201617,0.8864682032695501,1.0888266130528914e-06,7.0,0.9998446239900559,0.9998423794673759,COMPLETE
42,0.9998435017287159,2026-10-10 01:46:47.695259,2026-10-10 01:53:41.994271,0 days 00:06:54.299012,,,,,64,0.16059781446957766,128,0.801397747044994,19,SGD,0.08039402020734071,0.9222330689193644,1.5380498509820522e-06,24.0,0.9998446239900559,0.9998423794673759,COMPLETE
43,0.20117837895464794,2026-10-10 01:53:42.133523,2026-10-10 01:55:05.088224,0 days 00:01:22.954701,,,,,64,0.1259242191620459,128,0.8501296774283651,20,SGD,0.09559751575859625,0.9897529060504132,2.1226454204566717e-06,,,,PRUNED
44,0.9998435017287159,2026-10-10 01:55:05.221980,2026-10-10 02:02:01.959383,0 days 00:06:56.737403,,,,,64,0.2016970027325995,128,0.7548047330853139,15,SGD,0.021504263588611364,0.9641208454652844,4.87511190163558e-06,11.0,0.9998446239900559,0.9998423794673759,COMPLETE
45,0.9996869653141338,2026-10-10 02:02:02.095611,2026-10-10 02:08:58.864029,0 days 00:06:56.768418,,,,,64,0.15176022100641337,512,0.8898329083308972,18,SGD,0.03818415142789152,0.8383836721929481,4.167893322094595e-06,8.0,0.9996892479801118,0.9996846826481557,COMPLETE
46,0.9998435017287159,2026-10-10 02:08:58.997779,2026-10-10 02:14:59.704252,0 days 00:06:00.706473,,,,,128,0.1183505550289512,64,0.7016451685768301,16,SGD,0.049942764784848236,0.8931193149307473,9.310639929885604e-06,5.0,0.9998446239900559,0.9998423794673759,COMPLETE
47,0.9983183126688102,2026-10-10 02:14:59.835788,2026-10-10 02:16:22.495878,0 days 00:01:22.660090,,,,,64,0.17745692710475125,128,0.17112088839990247,19,SGD,0.00010581719204324586,0.931004796613328,0.00016360097919860332,,,,PRUNED
48,0.9996869653141338,2026-10-10 02:16:22.628127,2026-10-10 02:22:05.942251,0 days 00:05:43.314124,,,,,200,0.24563729147847507,64,0.2295387406022057,13,SGD,0.009928667413314558,0.7942189226027832,4.5692021826470816e-05,4.0,0.9996892479801118,0.9996846826481557,COMPLETE
49,0.9998435017287159,2026-10-10 02:22:06.080515,2026-10-10 02:28:59.798851,0 days 00:06:53.718336,,,,,64,0.3030479098270966,128,0.3848841285821598,15,SGD,0.02255395254844101,0.9575147726156037,9.531723524777628e-05,16.0,0.9998446239900559,0.9998423794673759,COMPLETE
