number,value,datetime_start,datetime_complete,duration,params_adam_beta1,params_adam_beta2,params_adam_lr,params_adam_wd,params_batch_size,params_block_0_dropout,params_block_0_filters,params_block_0_kernel,params_block_0_stride,params_block_1_dropout,params_block_1_filters,params_block_1_kernel,params_block_1_stride,params_block_2_dropout,params_block_2_filters,params_block_2_kernel,params_block_2_stride,params_block_3_dropout,params_block_3_filters,params_block_3_kernel,params_block_3_stride,params_block_4_dropout,params_block_4_filters,params_block_4_kernel,params_block_4_stride,params_fc_hidden,params_lr_factor,params_lr_patience,params_n_blocks,params_optimizer,params_sgd_lr,params_sgd_momentum,params_sgd_wd,user_attrs_best_epoch,user_attrs_validation_accuracy,user_attrs_validation_macro_f1,state
55,0.828049611856795,2026-10-05 18:50:54.296082,2026-10-05 18:52:01.909343,0 days 00:01:07.613261,0.8655590935712221,0.9344310496922423,0.0003688668834828487,2.1045341930411397e-06,128.0,0.011401408690805843,32,5,3,0.020823799295945345,32,3,1,0.036489229543727075,128,5,1,0.03264219538628603,256.0,5.0,2.0,0.03387789830383999,128.0,3.0,1.0,256,0.20713394686581077,10.0,5,Adam,,,,49.0,0.89171974522293,0.7643794784906602,COMPLETE
56,0.372595765178789,2026-10-05 18:52:02.041577,2026-10-05 18:52:08.830277,0 days 00:00:06.788700,0.9624400680199212,0.9532553505130944,0.0003417084622306643,1.6852972583502138e-06,128.0,0.01140004359585783,8,5,3,0.021033710990681867,32,3,1,0.035750457427567384,128,5,1,,,,,,,,,256,0.22834250776826095,10.0,3,Adam,,,,,,,PRUNED
57,0.22553021041072452,2026-10-05 18:52:08.980439,2026-10-05 18:52:19.218771,0 days 00:00:10.238332,,,,,128.0,0.010284959056001576,32,5,3,0.017592963158512376,32,7,1,0.037209233759884254,128,5,1,0.03304836279395852,128.0,5.0,2.0,0.03332385401675252,128.0,3.0,1.0,256,0.5166986081307325,9.0,5,SGD,0.00010114506599785716,0.7934548229014783,0.0007603216320838625,,,,PRUNED
58,0.42195762813769244,2026-10-05 18:52:19.390177,2026-10-05 18:52:41.271335,0 days 00:00:21.881158,0.8945610325872546,0.9433325684674974,0.00020217833557159437,2.001601694190991e-06,128.0,0.012313657082836684,32,5,3,0.023453527244330422,32,3,1,0.030665073776016877,128,5,1,0.03749781405061225,128.0,5.0,1.0,0.03971929084635987,256.0,3.0,1.0,512,0.36445206879666536,9.0,5,Adam,,,,,,,PRUNED
59,,2026-10-05 18:52:41.415854,2026-10-05 18:52:41.506291,0 days 00:00:00.090437,,,,,,0.017662213679327625,32,7,3,0.019330604611924568,32,5,1,0.037047837625153866,128,5,2,0.0334060460334624,128.0,5.0,2.0,0.03395081389266019,128.0,3.0,1.0,,,,5,,,,,,,,PRUNED
60,0.49774980327747703,2026-10-05 18:52:41.651163,2026-10-05 18:52:48.508385,0 days 00:00:06.857222,0.8575623401136293,0.9329817584703322,0.0006534438281597079,4.4196621508195615e-06,200.0,0.013219866532172548,32,5,3,0.020470320494985483,32,3,1,0.03898948431066084,32,3,1,0.02564629707347309,256.0,5.0,2.0,0.02944265767122732,128.0,3.0,1.0,256,0.20705995866601118,12.0,5,Adam,,,,,,,PRUNED
61,0.8052437075606032,2026-10-05 18:52:48.677389,2026-10-05 18:53:55.606486,0 days 00:01:06.929097,0.8660838930177231,0.9368551290544974,0.00042473844077414003,3.3101047483400297e-06,128.0,0.013875755357572954,32,5,3,0.016559473256044423,32,3,1,0.04247244170404793,128,5,1,0.03004415284269663,256.0,5.0,2.0,0.04591079838763214,128.0,3.0,1.0,256,0.13162481726579922,10.0,5,Adam,,,,43.0,0.8694267515923567,0.7410606635288495,COMPLETE
62,0.8086187048398596,2026-10-05 18:53:55.741660,2026-10-05 18:55:01.817211,0 days 00:01:06.075551,0.866828285814946,0.9337264729029224,0.0003680423248143932,1.1070452330001722e-06,128.0,0.011075228764202891,32,5,3,0.014177932264615143,32,3,1,0.04155170329488443,128,5,1,0.0362639832874213,256.0,5.0,2.0,0.048502387576179334,128.0,3.0,1.0,256,0.1785514437695636,11.0,5,Adam,,,,50.0,0.8757961783439491,0.7414412313357703,COMPLETE
63,0.7997898007712642,2026-10-05 18:55:01.950557,2026-10-05 18:56:08.120735,0 days 00:01:06.170178,0.867683064536546,0.9277818598710811,0.0003159984761530304,1.0828889502503338e-06,128.0,0.011234592772169726,32,5,3,0.01414669559821581,32,3,1,0.04401840273514796,128,5,1,0.036800594160612814,256.0,5.0,2.0,0.04822891959301649,128.0,3.0,1.0,256,0.2505329240406009,11.0,5,Adam,,,,50.0,0.8662420382165605,0.7333375633259678,COMPLETE
64,0.788133236812287,2026-10-05 18:56:08.254401,2026-10-05 18:57:15.148670,0 days 00:01:06.894269,0.8799542169449581,0.9493498941943818,0.00022642730378582778,1.6259452522782505e-06,128.0,0.010090936407104418,32,5,3,0.01821776011723669,32,3,1,0.04115575516464467,128,5,1,0.0400420829805937,256.0,5.0,2.0,0.047989118835966876,128.0,3.0,1.0,256,0.18114251919734928,7.0,5,Adam,,,,50.0,0.8630573248407644,0.7132091487838096,COMPLETE
65,0.7992830611305748,2026-10-05 18:57:15.333896,2026-10-05 18:58:04.375742,0 days 00:00:49.041846,0.8568519567524527,0.9420494354317415,0.00048706542158727747,1.7516002941676817e-06,128.0,0.015881538781654457,32,5,3,0.022628722721872805,32,3,1,0.03460427921452305,128,5,1,0.034206499641004265,64.0,5.0,2.0,0.045060161006935925,256.0,3.0,1.0,256,0.298094525584089,12.0,5,Adam,,,,50.0,0.8678343949044586,0.7307317273566911,COMPLETE
66,0.5290356020928517,2026-10-05 18:58:04.535730,2026-10-05 18:58:15.579301,0 days 00:00:11.043571,0.8694532998709427,0.9591308191893734,0.00035127763255672585,1.177692546183139e-05,200.0,0.012061526093516968,32,5,3,0.026136756347130675,32,3,1,0.039295455659815334,128,5,1,0.03475719039569916,128.0,5.0,2.0,0.03548883024610875,128.0,3.0,1.0,256,0.35829606298320416,10.0,5,Adam,,,,,,,PRUNED
67,0.46134828312422904,2026-10-05 18:58:15.726523,2026-10-05 18:58:25.010127,0 days 00:00:09.283604,0.9402911153012448,0.937096462769855,0.0001611698867536736,1.0663357841160419e-06,128.0,0.04529213346829053,8,5,3,0.011707661303143876,32,3,1,0.03672494809569251,128,5,1,0.037574875876587116,128.0,5.0,2.0,0.04197154479825686,128.0,3.0,1.0,256,0.2051050352280961,11.0,5,Adam,,,,,,,PRUNED
68,,2026-10-05 18:58:25.144523,2026-10-05 18:58:25.208340,0 days 00:00:00.063817,,,,,,0.02035478058371128,32,5,3,0.0129791683210758,32,3,2,0.032219649730783145,64,5,1,0.03121755149586069,256.0,3.0,2.0,0.018656275918582654,128.0,3.0,1.0,,,,5,,,,,,,,PRUNED
69,0.5273137160181003,2026-10-05 18:58:25.343484,2026-10-05 18:58:37.335186,0 days 00:00:11.991702,0.8577876101836199,0.9294589716768913,0.0010638554913715834,5.887093964213814e-06,128.0,0.01153955576160893,32,5,3,0.014235908267940894,32,3,1,0.045677103756280917,128,5,1,0.04545494398244087,128.0,5.0,2.0,0.0401957097796362,128.0,3.0,1.0,256,0.1566158800439666,8.0,5,Adam,,,,,,,PRUNED
70,0.5662735722869912,2026-10-05 18:58:37.467952,2026-10-05 18:59:11.053651,0 days 00:00:33.585699,0.8510370800242953,0.9415739477247709,0.0002456062837279451,1.9474400551679276e-06,64.0,0.015064472129440221,32,5,3,0.01635303719625741,64,3,1,0.04466331231764005,128,5,1,0.02735692680121949,128.0,5.0,1.0,0.048339018287342925,128.0,3.0,1.0,512,0.27434170308734124,12.0,5,Adam,,,,,,,PRUNED
71,0.8164485078107582,2026-10-05 18:59:11.196297,2026-10-05 19:00:16.415049,0 days 00:01:05.218752,0.8635642401202924,0.9347335171637997,0.0004035262278593683,3.4878907630365746e-06,128.0,0.013339922207710662,32,5,3,0.015463940247358407,32,3,1,0.03810916438251951,128,5,1,0.04838162879484819,256.0,5.0,2.0,0.04301571359360352,128.0,3.0,1.0,256,0.1064406108925931,14.0,5,Adam,,,,49.0,0.8773885350318471,0.7555084805896694,COMPLETE
72,0.762510949601787,2026-10-05 19:00:16.568152,2026-10-05 19:01:09.915098,0 days 00:00:53.346946,0.8691121642053743,0.9326243870243955,0.00031458091562855584,3.3555975212127496e-06,128.0,0.012912859457186954,32,5,3,0.018759038214001406,32,3,1,0.04140592651964393,128,5,1,0.04336414228914533,256.0,5.0,2.0,0.04327063826347453,128.0,3.0,1.0,256,0.1532058520175695,14.0,5,Adam,,,,,,,PRUNED
73,0.8230119679370336,2026-10-05 19:01:10.050035,2026-10-05 19:02:17.460905,0 days 00:01:07.410870,0.8566782766478787,0.9262361632023701,0.0006004766495496338,1.4066980278001164e-06,128.0,0.010821481495834779,32,5,3,0.011122340348106611,32,3,1,0.038043328846956256,128,5,1,0.04769906468469616,256.0,5.0,2.0,0.028249237134466282,128.0,3.0,1.0,256,0.33317161032098663,13.0,5,Adam,,,,47.0,0.893312101910828,0.7527118339632392,COMPLETE
74,0.8084073220875555,2026-10-05 19:02:17.603837,2026-10-05 19:03:25.699050,0 days 00:01:08.095213,0.8554645173299903,0.9180449942466095,0.0006284358325412288,1.336925208361377e-06,128.0,0.011026439285982813,32,5,3,0.017384031977841517,32,3,1,0.037794575118349175,128,5,1,0.04816691225790128,256.0,5.0,2.0,0.028595607087778294,128.0,3.0,1.0,256,0.32660049402722946,13.0,5,Adam,,,,45.0,0.8694267515923567,0.7473878925827543,COMPLETE
75,0.8249546964101471,2026-10-05 19:03:25.835752,2026-10-05 19:04:33.184931,0 days 00:01:07.349179,0.8802803997406395,0.9253824161943739,0.0003701407677468216,2.2881223701566246e-06,128.0,0.016566701169003224,32,5,3,0.014446353733291296,32,3,1,0.038315752465636586,128,5,1,0.04639954435100087,256.0,5.0,2.0,0.020129380221290273,128.0,3.0,1.0,256,0.23512860379099812,14.0,5,Adam,,,,49.0,0.893312101910828,0.7565972909094661,COMPLETE
76,0.8006578872427289,2026-10-05 19:04:33.324727,2026-10-05 19:05:32.441375,0 days 00:00:59.116648,0.8824828734749169,0.9262877237284516,0.0007029238568042114,2.353111025930382e-06,128.0,0.017109815965736984,32,5,3,0.021438469436110857,32,5,1,0.034564063654483154,128,3,1,0.04468496403364436,256.0,5.0,2.0,0.021366722238825162,128.0,3.0,1.0,256,0.2439422811242187,14.0,5,Adam,,,,35.0,0.8678343949044586,0.7334813795809992,COMPLETE
77,,2026-10-05 19:05:32.574002,2026-10-05 19:05:32.651201,0 days 00:00:00.077199,,,,,,0.014424507181320021,32,5,3,0.012934171628823687,32,3,1,0.038438899087377826,128,5,2,0.04710698924561704,256.0,5.0,2.0,0.014362931176421638,256.0,3.0,1.0,,,,5,,,,,,,,PRUNED
78,0.49385237425978745,2026-10-05 19:05:32.784675,2026-10-05 19:05:42.544566,0 days 00:00:09.759891,0.8894516190031896,0.9698591641869674,0.0002676020610371191,1.1584765145252588e-05,128.0,0.018081152106737275,32,5,3,0.02000250894737704,32,7,1,0.03646726778142166,32,5,1,0.046209755383331434,256.0,5.0,2.0,0.023130876763938782,128.0,3.0,1.0,256,0.31235719780388643,13.0,5,Adam,,,,,,,PRUNED
79,0.39890357073272575,2026-10-05 19:05:42.677948,2026-10-05 19:05:51.170310,0 days 00:00:08.492362,,,,,200.0,0.022510974986090046,32,7,3,0.015699143107578254,64,3,1,0.032309196454619014,128,3,1,0.0484297976117754,64.0,3.0,2.0,0.018385249280881574,128.0,3.0,1.0,256,0.33810054161919695,17.0,5,SGD,0.008136833339185818,0.9744508610340923,1.6618606260703467e-05,,,,PRUNED
80,,2026-10-05 19:05:51.312560,2026-10-05 19:05:51.376543,0 days 00:00:00.063983,,,,,,0.015673713265298768,32,5,3,0.011590574881801617,32,3,2,0.014827514502144205,64,5,1,0.04398640752078208,256.0,5.0,2.0,0.03640240357747251,128.0,3.0,1.0,,,,5,,,,,,,,PRUNED
81,0.8217911283375255,2026-10-05 19:05:51.510716,2026-10-05 19:06:56.617200,0 days 00:01:05.106484,0.8748618685199249,0.9246546370055049,0.00036830661328712025,1.4070065234782734e-06,128.0,0.01116579191897994,32,5,3,0.014257737652384488,32,3,1,0.039724899606700635,128,5,1,0.045498587636898936,256.0,5.0,2.0,0.02969371078981081,128.0,3.0,1.0,256,0.1881039684868625,13.0,5,Adam,,,,50.0,0.8853503184713376,0.7582319382037135,COMPLETE
82,0.8048701556842485,2026-10-05 19:06:56.764824,2026-10-05 19:08:03.044342,0 days 00:01:06.279518,0.8773112116462259,0.9251466144526204,0.0004794701452940163,3.687176497789959e-06,128.0,0.012696796076061487,32,5,3,0.01468903596322375,32,3,1,0.0397698015873652,128,5,1,0.04584368424791457,256.0,5.0,2.0,0.02761535980416947,128.0,3.0,1.0,256,0.2187196581594671,14.0,5,Adam,,,,48.0,0.8710191082802548,0.7387212030882422,COMPLETE
83,0.8260650824221083,2026-10-05 19:08:03.189954,2026-10-05 19:09:08.605662,0 days 00:01:05.415708,0.8749050032627976,0.91899208423977,0.0004298843424077345,1.5689916751721536e-06,128.0,0.010234123368627791,32,5,3,0.016517992314213824,32,3,1,0.0382209668643805,128,5,1,0.04862960374715307,256.0,5.0,2.0,0.031162677912012743,128.0,3.0,1.0,256,0.28363134747201285,13.0,5,Adam,,,,49.0,0.8964968152866242,0.7556333495575923,COMPLETE
84,0.8026661529503847,2026-10-05 19:09:08.747350,2026-10-05 19:10:15.308516,0 days 00:01:06.561166,0.8604742258526402,0.9130163108855849,0.00030529814911420364,1.487812454104778e-06,128.0,0.010247254916487862,32,5,3,0.019178040652643946,32,3,1,0.03538584170406088,128,5,1,0.04865439856915529,256.0,5.0,2.0,0.03205268919582334,128.0,3.0,1.0,256,0.289715152152783,13.0,5,Adam,,,,44.0,0.8757961783439491,0.7295361275568204,COMPLETE
85,0.373464151599605,2026-10-05 19:10:15.452396,2026-10-05 19:10:29.277142,0 days 00:00:13.824746,0.8793211143290329,0.9184198549536352,0.004487041484434012,2.2563305474852176e-06,128.0,0.013739860821655667,32,5,3,0.01672629497928223,32,3,1,0.034199751167846376,128,5,1,0.04862445524372673,256.0,5.0,2.0,0.03050478204622069,128.0,3.0,1.0,256,0.24749000520514156,15.0,5,Adam,,,,,,,PRUNED
86,0.3805027713544973,2026-10-05 19:10:29.413038,2026-10-05 19:10:56.256611,0 days 00:00:26.843573,0.8715488611580203,0.9220383496501577,0.00039288686957935883,1.489395731434834e-06,128.0,0.01482624371183015,8,5,3,0.017906814769442635,32,3,1,0.04305661797283663,128,5,1,0.04709343085087897,256.0,5.0,1.0,0.0254980710097753,128.0,3.0,1.0,256,0.10859937531539293,13.0,5,Adam,,,,,,,PRUNED
87,0.5947905633028248,2026-10-05 19:10:56.390516,2026-10-05 19:11:13.634432,0 days 00:00:17.243916,0.9057561411247173,0.9088223521351849,0.0005540585989786659,2.0660159829292662e-06,128.0,0.01664367762392136,32,5,3,0.022584959937667758,32,3,1,0.03860124219752579,128,5,1,0.044482391062092556,256.0,5.0,2.0,0.029739611220349432,128.0,3.0,1.0,256,0.19240592851376617,14.0,5,Adam,,,,,,,PRUNED
88,0.47577806128654526,2026-10-05 19:11:13.776550,2026-10-05 19:11:27.143710,0 days 00:00:13.367160,0.8541533710535779,0.9202436175063409,0.0005748804367404644,3.2411950404842134e-06,128.0,0.012764058335670792,32,5,3,0.013058697671650923,16,3,1,0.03776291504919884,128,3,1,0.04906893709872462,256.0,5.0,2.0,0.034419686176855216,512.0,3.0,1.0,256,0.7551676878229427,16.0,5,Adam,,,,,,,PRUNED
89,,2026-10-05 19:11:27.298670,2026-10-05 19:11:27.379903,0 days 00:00:00.081233,,,,,,0.010968897306774101,32,5,3,0.010992254980447503,32,3,1,0.039809747078045424,128,5,2,0.01888972729038997,256.0,5.0,2.0,0.03248831985511878,128.0,3.0,1.0,,,,5,,,,,,,,PRUNED
90,0.5388203545440283,2026-10-05 19:11:27.519523,2026-10-05 19:11:39.079908,0 days 00:00:11.560385,0.863057916242115,0.9279551519895121,0.0002749754536122167,7.714556529445239e-06,128.0,0.019593534743006916,16,5,3,0.015951800340113845,32,7,1,0.0361211154265719,128,5,1,0.04651011942226472,256.0,3.0,2.0,0.027102641305873917,128.0,3.0,1.0,256,0.37778189647607285,13.0,5,Adam,,,,,,,PRUNED
91,0.8141480560383494,2026-10-05 19:11:39.217305,2026-10-05 19:12:45.175468,0 days 00:01:05.958163,0.8732035785754672,0.9303692445769232,0.0004395500407910212,5.272284197609899e-06,128.0,0.012117828421776156,32,5,3,0.01509912507168142,32,3,1,0.04053271241537776,128,5,1,0.045616866748928335,256.0,5.0,2.0,0.04496379686173587,128.0,3.0,1.0,256,0.26848438503325994,12.0,5,Adam,,,,48.0,0.8789808917197452,0.7493152203569536,COMPLETE
92,0.8136513705877695,2026-10-05 19:12:45.320462,2026-10-05 19:13:52.085432,0 days 00:01:06.764970,0.8860755908094654,0.9297507290441862,0.00044146144537051156,6.054214014499502e-06,128.0,0.013729095836726286,32,5,3,0.013879972099492776,32,3,1,0.03800935855847562,128,5,1,0.047363258885535386,256.0,5.0,2.0,0.03102573326050146,128.0,3.0,1.0,256,0.26135796986992793,13.0,5,Adam,,,,50.0,0.8805732484076433,0.7467294927678957,COMPLETE
93,0.8173004443185641,2026-10-05 19:13:52.229899,2026-10-05 19:14:59.331298,0 days 00:01:07.101399,0.8727150956169526,0.9250009137701335,0.0003615362664209684,2.3700810535064704e-06,128.0,0.01227602836307504,32,5,3,0.014842853169229333,32,3,1,0.03966372019179233,128,5,1,0.04996877687031118,256.0,5.0,2.0,0.04490891892258641,128.0,3.0,1.0,256,0.30444177090944263,15.0,5,Adam,,,,44.0,0.8821656050955414,0.7524352835415868,COMPLETE
94,0.8030929546761882,2026-10-05 19:14:59.477460,2026-10-05 19:16:05.233953,0 days 00:01:05.756493,0.8713894903026405,0.9236639435873187,0.00033930562724607797,1.3913002606451666e-06,128.0,0.010004990121644283,32,5,3,0.01697080694671848,32,3,1,0.04043902816954496,128,5,1,0.04566467071601844,256.0,5.0,2.0,0.0378585540176294,128.0,3.0,1.0,128,0.3100746176372804,15.0,5,Adam,,,,50.0,0.8726114649681529,0.7335744443842237,COMPLETE
95,0.517463073044137,2026-10-05 19:16:05.367827,2026-10-05 19:16:17.834681,0 days 00:00:12.466854,0.8752777953749855,0.9248342431215966,0.0007532900340739901,2.1249714080310844e-06,128.0,0.012086469264481028,32,5,3,0.014803618739788351,32,5,1,0.03711953605475257,128,5,1,0.047834931908613626,256.0,5.0,2.0,0.02813937994423306,128.0,3.0,1.0,256,0.4215584153591491,12.0,5,Adam,,,,,,,PRUNED
96,0.55294477284986,2026-10-05 19:16:17.979594,2026-10-05 19:16:32.375510,0 days 00:00:14.395916,0.8823733987890344,0.9139414773316553,0.0005542157527860864,3.553867468748343e-06,128.0,0.01091749518361173,32,7,3,0.012262266158799377,32,3,1,0.03934001706619526,128,5,1,0.040948017158253885,256.0,5.0,2.0,0.04525088635828519,128.0,3.0,1.0,256,0.3372779239651841,14.0,5,Adam,,,,,,,PRUNED
97,0.34421168063279894,2026-10-05 19:16:32.528089,2026-10-05 19:16:40.785968,0 days 00:00:08.257879,,,,,128.0,0.011952624494125994,32,5,3,0.020626026478745153,32,3,1,0.03338144868672316,32,5,1,0.043928417669032674,256.0,5.0,2.0,0.02618918065578082,128.0,3.0,1.0,256,0.2893142215429911,15.0,5,SGD,0.0007663481807819139,0.8606986998156295,0.0001641789971727372,,,,PRUNED
98,,2026-10-05 19:16:40.928532,2026-10-05 19:16:41.002955,0 days 00:00:00.074423,,,,,,0.013205129954402251,32,5,3,0.013536488061023762,64,3,2,0.03532280169591092,128,3,1,0.04294856675549195,256.0,5.0,2.0,0.042131767233937516,256.0,3.0,1.0,,,,5,,,,,,,,PRUNED
99,0.4812488613506377,2026-10-05 19:16:41.141041,2026-10-05 19:17:00.883792,0 days 00:00:19.742751,0.8996015732362795,0.9204715116726849,0.0003568458043719488,5.05923895930967e-06,128.0,0.015553296369387614,32,5,3,0.018820670099355327,32,3,1,0.04304422704931559,64,5,1,0.04632859900834482,256.0,5.0,1.0,0.012051189081252474,128.0,3.0,1.0,256,0.2284317338825254,13.0,5,Adam,,,,,,,PRUNED
