number,value,datetime_start,datetime_complete,duration,params_adam_beta1,params_adam_beta2,params_adam_lr,params_adam_wd,params_batch_size,params_block_0_dropout,params_block_0_filters,params_block_0_kernel,params_block_0_stride,params_block_1_dropout,params_block_1_filters,params_block_1_kernel,params_block_1_stride,params_block_2_dropout,params_block_2_filters,params_block_2_kernel,params_block_2_stride,params_block_3_dropout,params_block_3_filters,params_block_3_kernel,params_block_3_stride,params_block_4_dropout,params_block_4_filters,params_block_4_kernel,params_block_4_stride,params_fc_hidden,params_lr_factor,params_lr_patience,params_n_blocks,params_optimizer,params_sgd_lr,params_sgd_momentum,params_sgd_wd,user_attrs_best_epoch,user_attrs_validation_accuracy,user_attrs_validation_macro_f1,state
0,0.2987324832334802,2026-10-05 18:23:37.280044,2026-10-05 18:24:01.430262,0 days 00:00:24.150218,,,,,128.0,0.012323344486727979,8,7,3,0.017336180394137354,16,5,2,0.02465447373174767,64,3,1,0.016820964947491662,128.0,3.0,1.0,,,,,512,0.19763058787582308,12.0,4,SGD,0.00019634341572933326,0.8984275776885255,5.762487216478604e-05,48.0,0.3359872611464968,0.26147770532046355,COMPLETE
1,0.3346139969543852,2026-10-05 18:24:01.564443,2026-10-05 18:24:34.533103,0 days 00:00:32.968660,,,,,128.0,0.041005312934444586,32,5,3,0.02554709158757928,16,7,1,0.012982025747190833,64,3,1,0.04085081386743783,64.0,3.0,1.0,,,,,256,0.36014665762139764,16.0,4,SGD,0.0009833181933644897,0.7184319215829468,1.753594952976443e-05,50.0,0.37261146496815284,0.2966165289406176,COMPLETE
2,0.470651705144573,2026-10-05 18:24:34.666316,2026-10-05 18:24:57.568101,0 days 00:00:22.901785,0.9754527819892891,0.9317685471496893,0.0011986281799901185,0.0016973078532467015,200.0,0.030909313175279764,16,7,3,0.019971689165955,16,5,1,0.04232481518257668,64,3,1,,,,,,,,,256,0.18804153962214143,8.0,3,Adam,,,,45.0,0.4968152866242038,0.44448812366494217,COMPLETE
3,0.5558488744525012,2026-10-05 18:24:57.700691,2026-10-05 18:25:46.043879,0 days 00:00:48.343188,0.9519502888056603,0.9367415349586534,0.003336101309469784,8.923807143379781e-06,200.0,0.04771638815650077,8,5,3,0.022035132392670787,64,5,1,0.019582475626678898,128,5,1,,,,,,,,,512,0.6058446644748636,15.0,3,Adam,,,,49.0,0.5907643312101911,0.5209334176948114,COMPLETE
4,0.44569724556605944,2026-10-05 18:25:46.176882,2026-10-05 18:26:18.861616,0 days 00:00:32.684734,,,,,64.0,0.03048372233197124,32,7,3,0.014538940849623563,32,3,1,0.01967409163601807,32,3,2,,,,,,,,,512,0.8096691394120938,17.0,3,SGD,0.0011159088550343414,0.9105271468723695,0.0038765111709116325,45.0,0.4745222929936306,0.4168721981384883,COMPLETE
5,,2026-10-05 18:26:19.000238,2026-10-05 18:26:19.049783,0 days 00:00:00.049545,,,,,,0.016432322056699946,8,7,3,0.035985315961888587,32,5,1,0.048920422190097824,32,3,2,0.01780971951192178,128.0,5.0,2.0,0.03581889183628671,128.0,3.0,1.0,,,,5,,,,,,,,PRUNED
6,,2026-10-05 18:26:19.184125,2026-10-05 18:26:19.214197,0 days 00:00:00.030072,,,,,,0.04713274250350902,16,7,3,0.0167797098674437,32,7,2,0.015603360609460961,64,5,1,,,,,,,,,,,,3,,,,,,,,PRUNED
7,,2026-10-05 18:26:19.349366,2026-10-05 18:26:19.388820,0 days 00:00:00.039454,,,,,,0.021743673770579737,8,7,3,0.038078675090308135,64,7,2,0.02862392072529841,64,5,2,0.015082420506075393,256.0,3.0,2.0,,,,,,,,4,,,,,,,,PRUNED
8,,2026-10-05 18:26:19.523354,2026-10-05 18:26:19.565030,0 days 00:00:00.041676,,,,,,0.03125418526272592,8,7,3,0.027558856828225446,64,7,2,0.016257481706843442,128,5,2,0.032174162100456025,256.0,5.0,2.0,,,,,,,,4,,,,,,,,PRUNED
9,,2026-10-05 18:26:19.697783,2026-10-05 18:26:19.736748,0 days 00:00:00.038965,,,,,,0.01464290562027665,8,7,3,0.016928074796400606,64,7,2,0.030125450343203505,128,5,1,0.04760920965699831,64.0,3.0,1.0,,,,,,,,4,,,,,,,,PRUNED
10,0.625960996749932,2026-10-05 18:26:19.870811,2026-10-05 18:27:18.481229,0 days 00:00:58.610418,0.9068515559725695,0.9652028519024756,0.008094454562649891,1.1990413778055588e-06,200.0,0.047396519251223214,16,5,3,0.04780785829889703,64,3,1,0.03788623593360378,128,5,1,0.03128492670279544,64.0,5.0,2.0,0.010567689211659854,256.0,3.0,1.0,128,0.8770937470127276,5.0,5,Adam,,,,48.0,0.6671974522292994,0.5847245412705647,COMPLETE
11,0.6072136738473506,2026-10-05 18:27:18.645617,2026-10-05 18:28:21.210350,0 days 00:01:02.564733,0.9234044305725273,0.9541833898470133,0.008680399316661742,1.4211537482266188e-06,200.0,0.04997449754566205,16,5,3,0.04976482875798626,64,3,1,0.03726749621045093,128,5,1,0.02941240784789848,64.0,5.0,2.0,0.012725290807332416,256.0,3.0,1.0,128,0.8797484766742464,5.0,5,Adam,,,,49.0,0.6480891719745223,0.566338175720179,COMPLETE
12,0.3036371482258735,2026-10-05 18:28:21.377399,2026-10-05 18:28:33.841114,0 days 00:00:12.463715,0.8842650747520039,0.9829644884150359,0.009256762816668472,1.0020121013332432e-06,200.0,0.04126429735539777,16,5,3,0.04967760384215255,64,3,1,0.03794030830388812,128,5,1,0.02886808751750585,64.0,5.0,2.0,0.010834250085608765,256.0,3.0,1.0,128,0.8946581082665175,5.0,5,Adam,,,,,,,PRUNED
13,0.2968507476713438,2026-10-05 18:28:33.989347,2026-10-05 18:28:46.699546,0 days 00:00:12.710199,0.9043638827215468,0.9672303787053823,0.007466393343635783,1.1645392808873212e-06,200.0,0.0497381665119616,16,5,3,0.049971258501778,64,3,1,0.037581906674513214,128,5,1,0.028905316894243097,64.0,5.0,2.0,0.010558299437951753,256.0,3.0,1.0,128,0.7332333606709378,5.0,5,Adam,,,,,,,PRUNED
14,0.7647382001249512,2026-10-05 18:28:46.837641,2026-10-05 18:29:48.064113,0 days 00:01:01.226472,0.9217784886480835,0.9607099819112636,0.00013179982344396247,1.8666928397367735e-05,200.0,0.040954048580510015,16,5,3,0.0441744120387903,64,3,1,0.03549707505149007,128,5,1,0.03553907373527548,64.0,5.0,2.0,0.017058928980271296,512.0,3.0,1.0,128,0.6543261158465403,9.0,5,Adam,,,,49.0,0.821656050955414,0.7078203492944883,COMPLETE
15,0.7837857828637083,2026-10-05 18:29:48.199204,2026-10-05 18:30:53.561652,0 days 00:01:05.362448,0.8508587635225544,0.9960149769319939,0.00010514656534853,6.998907217081271e-05,64.0,0.03996117736107983,16,5,3,0.04297306225674198,64,3,1,0.045589316936129505,128,5,1,0.035235026580630525,64.0,5.0,2.0,0.024575433637159888,512.0,3.0,1.0,128,0.6306461315971073,10.0,5,Adam,,,,50.0,0.8455414012738853,0.7220301644535312,COMPLETE
16,0.7077055950034821,2026-10-05 18:30:53.694659,2026-10-05 18:31:34.508245,0 days 00:00:40.813586,0.8508692453267567,0.9984291679345484,0.00010297263449467139,8.020067416565281e-05,64.0,0.03730594842751044,16,5,3,0.04148490235149839,64,3,1,0.04816550571478299,32,5,1,0.038894055204612886,64.0,5.0,2.0,0.0265113085936092,512.0,3.0,1.0,128,0.5706710741510875,10.0,5,Adam,,,,50.0,0.7627388535031847,0.6526723365037795,COMPLETE
17,0.7758198029948775,2026-10-05 18:31:34.643564,2026-10-05 18:32:39.711330,0 days 00:01:05.067766,0.857978405990891,0.909691209915485,0.00010684925414537049,8.50453357106909e-05,64.0,0.037550182073090466,16,5,3,0.04406667811194803,64,3,1,0.04425397644805816,128,5,1,0.03863187015762283,64.0,5.0,2.0,0.022489505746835198,512.0,3.0,1.0,128,0.5675659352994934,20.0,5,Adam,,,,45.0,0.8407643312101911,0.7108752747795639,COMPLETE
18,,2026-10-05 18:32:39.844133,2026-10-05 18:32:39.925712,0 days 00:00:00.081579,,,,,,0.03577417931619781,32,5,3,0.03301606349793072,16,3,1,0.04361862909788972,128,5,2,0.04620810756919335,256.0,5.0,1.0,0.025528317564951164,512.0,3.0,1.0,,,,5,,,,,,,,PRUNED
19,0.768348554163482,2026-10-05 18:32:40.061348,2026-10-05 18:33:26.349741,0 days 00:00:46.288393,0.8532828326139528,0.904236063644917,0.00027202788797810987,0.00030020078037771187,64.0,0.024197110697070985,16,5,3,0.043151725085439456,32,3,1,0.043256113246328484,128,5,1,0.02293523535550366,128.0,5.0,2.0,,,,,128,0.4479635611656422,19.0,4,Adam,,,,47.0,0.8328025477707006,0.7038945605562635,COMPLETE
20,0.28527490861028887,2026-10-05 18:33:26.484034,2026-10-05 18:33:34.690931,0 days 00:00:08.206897,,,,,64.0,0.03558608362226791,16,5,3,0.033555601489618864,64,3,1,0.049642431711765814,32,5,1,0.04065063007450462,64.0,5.0,2.0,0.02467869666997235,512.0,3.0,1.0,128,0.4691280354409951,20.0,5,SGD,0.07423548261306721,0.7025496148252909,1.5821478894942855e-06,,,,PRUNED
21,0.7562685624166391,2026-10-05 18:33:34.825493,2026-10-05 18:34:20.978788,0 days 00:00:46.153295,0.8508581821388483,0.9028043212243057,0.0002980127566719616,0.0003421358713150666,64.0,0.023611185958911766,16,5,3,0.043587617289535814,32,3,1,0.04229950704869403,128,5,1,0.023022994667891723,128.0,5.0,2.0,,,,,128,0.468300381744801,20.0,4,Adam,,,,49.0,0.821656050955414,0.6908810738778641,COMPLETE
22,0.7703696029165267,2026-10-05 18:34:21.113990,2026-10-05 18:35:09.640782,0 days 00:00:48.526792,0.8723134163266831,0.9012625862167812,0.00029562549784287575,0.0001976353417375697,64.0,0.025375947291179392,16,5,3,0.04000304616249367,32,3,1,0.04532929469562384,128,5,1,0.02314666263167278,128.0,5.0,2.0,,,,,128,0.46820388065529356,18.0,4,Adam,,,,49.0,0.8359872611464968,0.7047519446865566,COMPLETE
23,0.7831148102777226,2026-10-05 18:35:09.775386,2026-10-05 18:36:07.603939,0 days 00:00:57.828553,0.8757784897572027,0.9167541257794273,0.00025783721395597356,8.709250874271045e-05,64.0,0.026608226455230623,16,5,3,0.03725182463595083,32,3,1,0.044784383661897874,128,5,1,0.011251475519382846,128.0,5.0,2.0,0.03631411040101238,512.0,3.0,1.0,128,0.3250074477301096,13.0,5,Adam,,,,48.0,0.8471337579617835,0.7190958625936618,COMPLETE
24,0.7987489618620365,2026-10-05 18:36:07.735278,2026-10-05 18:37:05.755213,0 days 00:00:58.019935,0.8747113656247212,0.922821824006934,0.00017492131754807003,3.9911548029184e-05,64.0,0.028442228098549762,16,5,3,0.02962231528482656,32,3,1,0.046387765847945725,128,5,1,0.04486969262130614,128.0,5.0,2.0,0.043596451823814886,512.0,3.0,1.0,256,0.31353384663190953,13.0,5,Adam,,,,48.0,0.8694267515923567,0.7280711721317161,COMPLETE
25,0.7866522987511106,2026-10-05 18:37:05.886546,2026-10-05 18:38:06.526085,0 days 00:01:00.639539,0.883379926533081,0.9222692267592292,0.0005702475039597394,2.5630171146215337e-05,64.0,0.01916988491334744,32,5,3,0.029634185060028805,32,3,1,0.045895915278068744,128,5,1,0.010764264886183235,128.0,5.0,2.0,0.04998475702651723,512.0,3.0,1.0,256,0.32453974069841274,13.0,5,Adam,,,,48.0,0.856687898089172,0.7166166994130492,COMPLETE
26,,2026-10-05 18:38:06.659368,2026-10-05 18:38:06.720134,0 days 00:00:00.060766,,,,,,0.019300141353869617,32,5,3,0.030237947268133766,32,3,2,0.04003955883984316,128,3,2,0.049338875544010626,128.0,3.0,1.0,0.04948217440997906,512.0,3.0,1.0,,,,5,,,,,,,,PRUNED
27,0.8022989955904012,2026-10-05 18:38:06.852883,2026-10-05 18:39:01.732150,0 days 00:00:54.879267,0.8868712095626512,0.929642100102022,0.000816020465837082,2.111830503903507e-05,64.0,0.019071922446727292,32,5,3,0.02708167341164499,32,3,1,0.033824296946862537,128,5,1,0.04349290592047468,128.0,5.0,2.0,0.04970947799150626,128.0,3.0,1.0,256,0.2647084919198496,13.0,5,Adam,,,,48.0,0.8439490445859873,0.7606489465948151,COMPLETE
28,0.46380201230880735,2026-10-05 18:39:01.867402,2026-10-05 18:39:10.747344,0 days 00:00:08.879942,0.8906818114473769,0.9264982483073337,0.0008978069304287275,1.1963549862151083e-05,64.0,0.01847074230803266,32,5,3,0.024521556946254193,32,5,1,0.031595217145228394,32,5,1,0.0445010961320258,128.0,5.0,2.0,0.049771847874536757,128.0,3.0,1.0,256,0.26267807763052103,13.0,5,Adam,,,,,,,PRUNED
29,,2026-10-05 18:39:10.881023,2026-10-05 18:39:10.948289,0 days 00:00:00.067266,,,,,,0.010253744231705931,32,5,3,0.02911183876392334,32,3,2,0.033258062657317795,128,3,1,0.0436732800363415,128.0,5.0,2.0,0.04360957586847687,128.0,3.0,1.0,,,,5,,,,,,,,PRUNED
30,0.4473647327599377,2026-10-05 18:39:11.080631,2026-10-05 18:39:21.864779,0 days 00:00:10.784148,0.8969555595419101,0.9387688374676568,0.0008762560358833516,2.427794276889259e-05,128.0,0.028534137814028283,32,5,3,0.03197738679009284,32,5,1,0.026409605313434337,64,5,1,0.0107660744508449,128.0,3.0,1.0,0.04412273518999848,128.0,3.0,1.0,256,0.101281216009692,14.0,5,Adam,,,,,,,PRUNED
31,0.7965745527118319,2026-10-05 18:39:21.998002,2026-10-05 18:40:22.732509,0 days 00:01:00.734507,0.8684629213093847,0.9233015108691405,0.0006274564869222418,4.046736008434388e-05,64.0,0.014524705695112158,32,5,3,0.023851726290303427,32,3,1,0.046989594698406245,128,5,1,0.04327402487843156,128.0,5.0,2.0,0.04436435099221189,512.0,3.0,1.0,256,0.35441502011316767,11.0,5,Adam,,,,48.0,0.85828025477707,0.7348688506465937,COMPLETE
32,0.8068642048523904,2026-10-05 18:40:22.866874,2026-10-05 18:41:23.724604,0 days 00:01:00.857730,0.8748613901238258,0.9216220122359281,0.0005431256588635207,7.091129665479034e-06,64.0,0.01475596259648007,32,5,3,0.010017715077958064,32,3,1,0.04752205605937563,128,5,1,0.04199798297285095,128.0,5.0,2.0,0.04430982500680749,512.0,3.0,1.0,256,0.35881072842792394,12.0,5,Adam,,,,50.0,0.8805732484076433,0.7331551612971376,COMPLETE
33,0.8085572314118332,2026-10-05 18:41:23.891387,2026-10-05 18:42:18.723990,0 days 00:00:54.832603,0.866671299418682,0.9412821499257301,0.000520414743313382,4.4576222301561385e-06,64.0,0.013211169920925542,32,5,3,0.01109760684035063,32,3,1,0.0402426242792665,128,5,1,0.0427715163966303,128.0,5.0,2.0,0.043273121520196786,128.0,3.0,1.0,256,0.3894949534260148,11.0,5,Adam,,,,45.0,0.8773885350318471,0.7397259277918193,COMPLETE
34,0.7988322706410838,2026-10-05 18:42:18.856589,2026-10-05 18:43:07.278811,0 days 00:00:48.422222,0.8706274412367188,0.9463367109645051,0.0005289608191807519,5.1447088357673755e-06,64.0,0.012011103526792515,32,5,3,0.011916184435020705,16,3,1,0.03983248282087818,128,3,1,0.0417076099852386,128.0,5.0,2.0,0.038305826555534835,128.0,3.0,1.0,256,0.4036784468955992,11.0,5,Adam,,,,44.0,0.8694267515923567,0.7282377896898107,COMPLETE
35,0.056287717077903934,2026-10-05 18:43:07.431857,2026-10-05 18:43:17.369454,0 days 00:00:09.937597,,,,,64.0,0.010015842078756316,32,5,3,0.010528682966646268,16,3,1,0.04067790923397991,64,3,1,0.041591472096058076,128.0,5.0,2.0,0.03750435501970979,128.0,3.0,1.0,256,0.4177640862461907,8.0,5,SGD,0.06800657499454138,0.9806877471512496,0.007375912279691642,,,,PRUNED
36,0.3931173447290266,2026-10-05 18:43:17.544788,2026-10-05 18:43:30.841673,0 days 00:00:13.296885,0.8648703044139535,0.9459818033811845,0.0016410613166539278,4.345229343870703e-06,64.0,0.013090083494157346,32,5,3,0.010544584047159494,16,5,1,0.0332783913644113,128,3,1,0.035976284283053266,128.0,3.0,1.0,0.04179172560884475,128.0,3.0,1.0,256,0.24110392825450316,11.0,5,Adam,,,,,,,PRUNED
37,,2026-10-05 18:43:30.999109,2026-10-05 18:43:31.074139,0 days 00:00:00.075030,,,,,,0.01716708792449786,32,5,3,0.012567863663331132,16,7,1,0.04049963162289606,128,3,2,0.048750791013970826,128.0,5.0,2.0,0.03921814843992676,128.0,3.0,1.0,,,,5,,,,,,,,PRUNED
38,0.4194132343053215,2026-10-05 18:43:31.232558,2026-10-05 18:43:39.438842,0 days 00:00:08.206284,0.8832238915923004,0.9470081265947801,0.00045894803256634923,4.318553192607999e-06,64.0,0.02145987295704739,32,7,3,0.013741383285234497,16,3,1,0.03507361099676801,64,3,1,0.03842410223023081,128.0,3.0,2.0,,,,,256,0.40352676076801164,11.0,4,Adam,,,,,,,PRUNED
39,,2026-10-05 18:43:39.577534,2026-10-05 18:43:39.647569,0 days 00:00:00.070035,,,,,,0.012619870033937813,32,7,3,0.019988810674223874,16,5,2,0.02349151223073407,32,3,1,0.04103085221993417,256.0,5.0,2.0,0.03159275309371348,128.0,3.0,1.0,,,,5,,,,,,,,PRUNED
40,0.3833824404581013,2026-10-05 18:43:39.785141,2026-10-05 18:43:48.243740,0 days 00:00:08.458599,,,,,128.0,0.015557637277020768,32,5,3,0.01895967659930692,32,7,1,0.027409214041495426,128,3,2,0.046984545999501116,128.0,5.0,1.0,,,,,256,0.18162411552569668,12.0,4,SGD,0.007596321103798129,0.8046757257096796,0.00035682669816070663,,,,PRUNED
41,0.8111195931934091,2026-10-05 18:43:48.385878,2026-10-05 18:44:42.694729,0 days 00:00:54.308851,0.8737026815787711,0.9324821305504709,0.0004713454660641188,4.4315880291800925e-06,64.0,0.01197446924077424,32,5,3,0.015492978691374204,32,3,1,0.041623710673301395,128,5,1,0.04519975663575282,128.0,5.0,2.0,0.046154748423810746,128.0,3.0,1.0,256,0.26671560530192573,12.0,5,Adam,,,,49.0,0.8837579617834395,0.7384812246033787,COMPLETE
42,0.8266130711873929,2026-10-05 18:44:42.830709,2026-10-05 18:45:35.176103,0 days 00:00:52.345394,0.8663980839094361,0.9458794023372269,0.0004889151391421475,3.7226142083348474e-06,64.0,0.011712227868429433,32,5,3,0.01485932168094566,32,3,1,0.041920691504889834,128,3,1,0.042375084679802416,128.0,5.0,2.0,0.046095901518701875,128.0,3.0,1.0,256,0.2553287485789639,12.0,5,Adam,,,,46.0,0.8853503184713376,0.7678758239034481,COMPLETE
43,0.8139717776839792,2026-10-05 18:45:35.329290,2026-10-05 18:46:26.178235,0 days 00:00:50.848945,0.8620119068489175,0.9354325984915817,0.00040944520366667313,2.827300244325652e-06,128.0,0.01409842265985269,32,5,3,0.015136216405214191,32,3,1,0.041721810906182516,128,5,1,0.0499225557553402,128.0,5.0,2.0,0.0467053315293624,128.0,3.0,1.0,256,0.21978635442817102,14.0,5,Adam,,,,50.0,0.8853503184713376,0.7425932368966208,COMPLETE
44,0.8074054499360601,2026-10-05 18:46:26.317856,2026-10-05 18:47:33.367572,0 days 00:01:07.049716,0.8618210676385364,0.9350422132464797,0.0004040198421042819,2.8619017747782424e-06,128.0,0.014191625761174206,32,5,3,0.015574215807958171,32,3,1,0.042498300904847776,128,5,1,0.04975088844966763,256.0,5.0,2.0,0.046529560280865336,128.0,3.0,1.0,256,0.11759807770870848,15.0,5,Adam,,,,44.0,0.8773885350318471,0.7374223648402732,COMPLETE
45,0.4353141959806098,2026-10-05 18:47:33.544515,2026-10-05 18:47:38.722071,0 days 00:00:05.177556,0.8640517707102521,0.938560396688789,0.0003869892568832532,2.5996130393671126e-06,128.0,0.012093570350137988,8,7,3,0.015389177662679793,32,3,2,0.04082601287815473,128,5,1,,,,,,,,,256,0.12758759994533558,15.0,3,Adam,,,,,,,PRUNED
46,0.47442854319780486,2026-10-05 18:47:38.863597,2026-10-05 18:47:48.804776,0 days 00:00:09.941179,,,,,128.0,0.01729960464035086,32,5,3,0.01550373303908106,32,7,1,0.04209168746427319,64,5,1,0.04656453889366635,256.0,5.0,2.0,0.04601855276798685,128.0,3.0,1.0,512,0.1650185629089641,15.0,5,SGD,0.008947219961939987,0.8083192871427547,1.6005134307843987e-06,,,,PRUNED
47,0.5150471459260186,2026-10-05 18:47:48.950582,2026-10-05 18:48:01.504405,0 days 00:00:12.553823,0.8616813457953142,0.9531000121689706,0.0003907114790609698,2.6926160095525465e-06,128.0,0.013324772139635045,32,5,3,0.018109059822265558,32,3,1,0.03861023665743167,128,3,1,0.0495452165812326,256.0,3.0,2.0,0.04689277930653094,128.0,3.0,1.0,256,0.225974543359461,16.0,5,Adam,,,,,,,PRUNED
48,,2026-10-05 18:48:01.639153,2026-10-05 18:48:01.704279,0 days 00:00:00.065126,,,,,,0.011141508764218586,32,7,3,0.02178625656461279,32,3,1,0.03604610014783063,128,5,2,0.04764312403994162,256.0,5.0,2.0,0.0410774726782507,128.0,3.0,1.0,,,,5,,,,,,,,PRUNED
49,0.5109650648445592,2026-10-05 18:48:01.836486,2026-10-05 18:48:10.442359,0 days 00:00:08.605873,0.8609621575459467,0.9338875654963344,0.0012588016284410682,2.673055069271468e-06,128.0,0.015897922692263148,8,5,3,0.016648106935575314,32,3,1,0.011986153678314914,32,5,1,0.04547835100099494,256.0,5.0,2.0,0.046240800056354406,128.0,3.0,1.0,512,0.15766100213266687,14.0,5,Adam,,,,,,,PRUNED
50,,2026-10-05 18:48:10.587273,2026-10-05 18:48:10.653199,0 days 00:00:00.065926,,,,,,0.013969991409047644,32,5,3,0.013338192018935989,32,3,2,0.04194947968612746,128,5,1,0.04994861349317598,256.0,5.0,2.0,0.04118013734297711,128.0,3.0,1.0,,,,5,,,,,,,,PRUNED
51,0.7982669485261684,2026-10-05 18:48:10.799084,2026-10-05 18:49:01.209844,0 days 00:00:50.410760,0.8744154117883117,0.9413073668841632,0.0007392141785513521,9.048458449694e-06,128.0,0.014979970595714076,32,5,3,0.010008333655665606,32,3,1,0.03890453671550125,128,5,1,0.04771512010957394,128.0,5.0,2.0,0.04719860502245577,128.0,3.0,1.0,256,0.2788861818799159,12.0,5,Adam,,,,50.0,0.8662420382165605,0.7302918588357763,COMPLETE
52,0.47831102526390584,2026-10-05 18:49:01.365420,2026-10-05 18:49:12.086084,0 days 00:00:10.720664,0.9818840605614844,0.9308459577947101,0.0004597485206942553,0.005947463991406266,128.0,0.020998163291726078,32,5,3,0.015008619629321672,32,3,1,0.04797597830223798,128,5,1,0.04237515729623728,128.0,5.0,2.0,0.046633749258639674,256.0,3.0,1.0,256,0.20898707054420113,14.0,5,Adam,,,,,,,PRUNED
53,0.8006935750297867,2026-10-05 18:49:12.221279,2026-10-05 18:50:02.713769,0 days 00:00:50.492490,0.8782956269553511,0.9146505860579374,0.00020736511638040273,6.793200881579803e-06,128.0,0.016343002684266226,32,5,3,0.012096450550173485,32,3,1,0.04353217346169706,128,5,1,0.039536230140584515,128.0,5.0,2.0,0.042731332200215355,128.0,3.0,1.0,256,0.293758708814419,16.0,5,Adam,,,,47.0,0.8694267515923567,0.7319603984672166,COMPLETE
54,0.8161498439777861,2026-10-05 18:50:02.848785,2026-10-05 18:50:54.155460,0 days 00:00:51.306675,0.8660540338546726,0.9342636127518532,0.00036766900731029993,2.20499151632864e-06,128.0,0.011314898644554823,32,5,3,0.02005242713573225,32,3,1,0.03679249403877326,128,5,1,0.036996542290207,128.0,5.0,2.0,0.0400706105593654,128.0,3.0,1.0,256,0.35767348243724395,12.0,5,Adam,,,,42.0,0.8535031847133758,0.7787965032421963,COMPLETE
