number,value,datetime_start,datetime_complete,duration,params_adam_beta1,params_adam_beta2,params_adam_lr,params_adam_wd,params_batch_size,params_block_0_dropout,params_block_0_filters,params_block_0_kernel,params_block_0_stride,params_block_1_dropout,params_block_1_filters,params_block_1_kernel,params_block_1_stride,params_block_2_dropout,params_block_2_filters,params_block_2_kernel,params_block_2_stride,params_block_3_dropout,params_block_3_filters,params_block_3_kernel,params_block_3_stride,params_fc_hidden,params_first_conv_filters,params_first_conv_kernel_size,params_lr_factor,params_lr_patience,params_n_blocks,params_optimizer,params_sgd_lr,params_sgd_momentum,params_sgd_wd,user_attrs_best_epoch,user_attrs_validation_accuracy,user_attrs_validation_macro_f1,state
0,0.3381219209170915,2026-09-30 10:55:28.869884,2026-09-30 10:58:58.317609,0 days 00:03:29.447725,0.8926459276842719,0.9097574441892378,0.00853618986286683,0.0017123375973163992,128.0,0.08491983767203796,8,5,3,0.06506676052501416,16,3,2,0.06331731119758383,128,3,1,,,,,256,256,7,0.5105398159072941,12.0,3,Adam,,,,45.0,0.3391304347826087,0.3371134070515742,COMPLETE
1,0.4754210637566726,2026-09-30 10:58:58.445393,2026-09-30 11:02:49.729438,0 days 00:03:51.284045,,,,,128.0,0.06381099809299767,16,7,3,0.08458637582367365,16,3,2,0.07950202923669918,128,3,1,0.07361716094628554,256.0,3.0,1.0,256,256,7,0.13813501017161417,9.0,4,SGD,0.038842777547031436,0.8807564567799918,2.106648601704221e-05,50.0,0.47391304347826085,0.4769290840350843,COMPLETE
2,0.5340330454439289,2026-09-30 11:02:49.855452,2026-09-30 11:04:53.243454,0 days 00:02:03.388002,0.970502281655888,0.9006945178400659,0.0007148510793512986,0.0018709365688887364,64.0,0.019710228429397403,8,7,3,0.07799960246887438,32,3,1,0.0884314531168946,128,3,2,0.05854080177240857,256.0,3.0,1.0,256,256,3,0.4064483815465394,11.0,4,Adam,,,,47.0,0.5391304347826087,0.5289356561052492,COMPLETE
3,,2026-09-30 11:04:53.368404,2026-09-30 11:04:53.414785,0 days 00:00:00.046381,,,,,,0.013319825261907952,8,7,3,0.05405074842498068,16,3,2,0.06690752475342215,32,5,2,0.08517722460303143,64.0,3.0,1.0,,256,5,,,4,,,,,,,,PRUNED
4,0.48482001133786845,2026-09-30 11:04:53.536491,2026-09-30 11:06:31.495816,0 days 00:01:37.959325,0.8642060160012445,0.9662838267338948,0.0016325185294676916,1.088399181393814e-06,128.0,0.09430569898630611,16,7,3,0.08354999801810943,32,5,1,0.04051268119438307,32,3,2,0.08983777818386056,256.0,3.0,1.0,128,128,5,0.10303695030773122,7.0,4,Adam,,,,45.0,0.5,0.46964002267573696,COMPLETE
5,,2026-09-30 11:06:31.619065,2026-09-30 11:06:31.665410,0 days 00:00:00.046345,,,,,,0.03386821309135529,8,5,3,0.06192134961637233,32,5,2,0.09464127259176229,128,5,2,0.011391095487598068,64.0,3.0,1.0,,512,3,,,4,,,,,,,,PRUNED
6,0.3899408678459573,2026-09-30 11:06:31.788692,2026-09-30 11:16:20.061547,0 days 00:09:48.272855,0.897319321959215,0.9375207369687304,0.0039046790191830895,0.0036309591863459105,128.0,0.07264268170074757,8,5,3,0.0766691755978784,64,5,1,0.09219164973008243,64,3,1,,,,,512,512,7,0.1563891639045214,14.0,3,Adam,,,,45.0,0.39565217391304347,0.3842295617788711,COMPLETE
7,0.6679412538295585,2026-09-30 11:16:20.187798,2026-09-30 11:20:01.399056,0 days 00:03:41.211258,0.8891907455724319,0.9953910415382531,0.0026865309327169084,0.00043731009905162676,64.0,0.01768127184943912,32,5,3,0.03906608256471214,64,3,2,0.07263767854843282,32,5,2,,,,,128,512,3,0.5427381500174611,13.0,3,Adam,,,,45.0,0.6695652173913044,0.6663172902678126,COMPLETE
8,0.30575941903536974,2026-09-30 11:20:01.527756,2026-09-30 11:21:07.309255,0 days 00:01:05.781499,,,,,64.0,0.05261245937025092,8,5,3,0.06632739241428127,32,3,1,0.0627198023146117,64,5,2,,,,,128,512,5,0.6767143382943485,19.0,3,SGD,0.004333615420461955,0.9730247945451923,3.502761367842316e-05,,,,PRUNED
9,0.2615100565411124,2026-09-30 11:21:07.432585,2026-09-30 11:21:45.652118,0 days 00:00:38.219533,,,,,128.0,0.06660485621018956,16,5,3,0.0991454627800606,16,5,1,0.07757839610123476,128,3,2,0.05547271352030715,256.0,3.0,1.0,512,128,7,0.6700371802304829,20.0,4,SGD,0.0520170752104338,0.7264731362679787,1.8934530915191556e-05,,,,PRUNED
10,0.37964585759300284,2026-09-30 11:21:45.779075,2026-09-30 11:23:03.836511,0 days 00:01:18.057436,0.9740823912733333,0.9925265187462552,0.00011276182231780688,1.0341591364653288e-05,64.0,0.04094807897017133,32,5,3,0.020186058701089256,64,3,2,0.02058969429153098,32,5,1,,,,,128,512,3,0.31969431875426024,5.0,3,Adam,,,,,,,PRUNED
11,0.6010883116375108,2026-09-30 11:23:03.967730,2026-09-30 11:25:09.709193,0 days 00:02:05.741463,0.9852476075458594,0.9052569298453264,0.0006793020634935387,0.0002502055290331605,64.0,0.014814626394445182,32,7,3,0.032021946338044796,64,3,1,0.042404344302139935,32,5,2,,,,,256,256,3,0.4354764493512368,13.0,3,Adam,,,,48.0,0.6,0.6021766232750215,COMPLETE
12,0.6027115713297007,2026-09-30 11:25:09.833899,2026-09-30 11:29:26.109011,0 days 00:04:16.275112,0.9352541592559447,0.9930885003326854,0.0005209314402340293,0.00019814443844464304,64.0,0.026478020292159198,32,7,3,0.03166898356738668,64,3,1,0.042720060046579134,32,5,2,,,,,128,512,3,0.5170355251346896,15.0,3,Adam,,,,47.0,0.5956521739130435,0.6097709687463577,COMPLETE
13,0.6976984565361429,2026-09-30 11:29:26.241656,2026-09-30 11:33:38.714100,0 days 00:04:12.472444,0.9315109299364555,0.9998112242293015,0.00014070491491018593,0.00011363827435224601,64.0,0.03139272888949878,32,7,3,0.04016602252388541,64,3,2,0.044151450596321834,32,5,2,,,,,128,512,3,0.5570146712928443,16.0,3,Adam,,,,44.0,0.6956521739130435,0.6997447391592424,COMPLETE
14,0.6821865538120988,2026-09-30 11:33:38.837133,2026-09-30 11:37:19.324515,0 days 00:03:40.487382,0.9318716418646565,0.9990823732096435,0.0001327434453791919,9.55134780433756e-05,64.0,0.042624450962023844,32,5,3,0.04838457746182886,64,3,2,0.01146628302509687,32,5,2,,,,,128,512,3,0.5838709878493044,17.0,3,Adam,,,,45.0,0.6826086956521739,0.6817644119720238,COMPLETE
15,0.3264959248626347,2026-09-30 11:37:19.451820,2026-09-30 11:38:10.756801,0 days 00:00:51.304981,0.9322177185345477,0.9718248795646633,0.00010685306981634688,4.297966101894924e-05,64.0,0.04469847542258758,32,7,3,0.0447728219378202,64,3,2,0.01222737537085461,32,5,2,,,,,128,512,3,0.5964741745445724,17.0,3,Adam,,,,,,,PRUNED
16,0.16640111474548563,2026-09-30 11:38:10.888379,2026-09-30 11:38:54.719305,0 days 00:00:43.830926,,,,,64.0,0.05353708710577318,32,5,3,0.011945467796052822,64,3,2,0.028498733781045907,32,5,2,,,,,128,512,3,0.6030574753851858,17.0,3,SGD,0.00011877964997161456,0.7040126788907952,0.002144225215662579,,,,PRUNED
17,0.7355442701147797,2026-09-30 11:38:54.849227,2026-09-30 11:40:48.256417,0 days 00:01:53.407190,0.9312541299165971,0.973025314966548,0.00023521174049224636,3.535083290458082e-05,64.0,0.034775978756312456,32,7,3,0.05033172266339035,64,3,2,0.052493664205424395,64,5,2,,,,,128,128,3,0.4189218602686293,17.0,3,Adam,,,,44.0,0.7521739130434782,0.7189146271860812,COMPLETE
18,,2026-09-30 11:40:48.378883,2026-09-30 11:40:48.426716,0 days 00:00:00.047833,,,,,,0.029492649189990196,32,7,3,0.027930911466422983,64,5,2,0.052918445445283825,64,5,1,,,,,,128,3,,,3,,,,,,,,PRUNED
19,0.7494087168153662,2026-09-30 11:40:48.567514,2026-09-30 11:42:48.909648,0 days 00:02:00.342134,0.9459167608602891,0.9703844265748884,0.00030730398178947034,1.0694436255076771e-05,64.0,0.037069259615922064,32,7,3,0.05080838719602214,64,3,2,0.05347509933226509,64,5,2,,,,,512,128,5,0.32086304625293255,16.0,3,Adam,,,,46.0,0.7782608695652173,0.7205565640655153,COMPLETE
20,0.7354509960788043,2026-09-30 11:42:49.048481,2026-09-30 11:44:51.182345,0 days 00:02:02.133864,0.9562420060056946,0.9609469749597669,0.0002929982846663381,8.985115601129253e-06,64.0,0.052526278686418536,32,7,3,0.054562461033032646,64,3,2,0.030520810422241057,64,5,2,,,,,512,128,5,0.2864186091893067,19.0,3,Adam,,,,46.0,0.7434782608695653,0.7274237312880433,COMPLETE
21,0.7595379925073673,2026-09-30 11:44:51.308666,2026-09-30 11:46:53.366659,0 days 00:02:02.057993,0.9541707208798718,0.9655322335157754,0.0002995458159865207,1.1771487447511418e-05,64.0,0.05364738659218842,32,7,3,0.05556179630400014,64,3,2,0.03073361084676332,64,5,2,,,,,512,128,5,0.2724446252229315,19.0,3,Adam,,,,49.0,0.7652173913043478,0.7538585937103868,COMPLETE
22,0.7116999007432542,2026-09-30 11:46:53.495245,2026-09-30 11:48:53.054290,0 days 00:01:59.559045,0.94880432375148,0.9518111416954808,0.00028736430593156754,1.3295540073339712e-05,64.0,0.03744169239860906,32,7,3,0.05157769625896062,64,3,2,0.05157597030082698,64,5,2,,,,,512,128,5,0.3005495255459248,18.0,3,Adam,,,,50.0,0.7217391304347827,0.7016606710517257,COMPLETE
23,0.753729551043676,2026-09-30 11:48:53.179777,2026-09-30 11:50:49.732352,0 days 00:01:56.552575,0.9144525668053402,0.9767587871842748,0.0002876425956787131,2.453439537710636e-06,64.0,0.06004909735560234,32,7,3,0.05905543839325637,64,3,2,0.05140601879762381,64,5,2,,,,,512,128,5,0.2284207064055367,20.0,3,Adam,,,,46.0,0.7565217391304347,0.7509373629569173,COMPLETE
24,0.7705268869061972,2026-09-30 11:50:49.859579,2026-09-30 11:52:46.396655,0 days 00:01:56.537076,0.9140139002386563,0.9814486095823979,0.0004661276199979329,1.7817442667897556e-06,64.0,0.060160560359295664,32,7,3,0.059907694293170874,64,3,2,0.03186661508901435,64,5,2,,,,,512,128,5,0.22178067553547756,20.0,3,Adam,,,,46.0,0.7869565217391304,0.7540972520732641,COMPLETE
25,0.15074948647747333,2026-09-30 11:52:46.519229,2026-09-30 11:53:09.581900,0 days 00:00:23.062671,,,,,64.0,0.07854125408121351,16,7,3,0.059280177597402395,64,3,2,0.027176238342064705,64,5,2,,,,,512,128,5,0.23558236661809662,20.0,3,SGD,0.00010594134428257736,0.8319921111667751,0.0072142505027882504,,,,PRUNED
26,,2026-09-30 11:53:09.706150,2026-09-30 11:53:09.758244,0 days 00:00:00.052094,,,,,,0.06136841225224195,32,7,3,0.07111679997735358,64,5,2,0.03627469902777183,64,5,1,,,,,,128,5,,,3,,,,,,,,PRUNED
27,0.7526315639007974,2026-09-30 11:53:09.881162,2026-09-30 11:55:10.872434,0 days 00:02:00.991272,0.9062742068779077,0.9821783946848106,0.00045126151127120593,1.7516101268946989e-06,64.0,0.05837880065141673,32,7,3,0.06934994545755625,64,3,2,0.022412400467109017,64,5,2,,,,,512,128,5,0.24329500030527365,20.0,3,Adam,,,,36.0,0.7565217391304347,0.7487413886711602,COMPLETE
28,0.7087116168513041,2026-09-30 11:55:11.016818,2026-09-30 11:57:12.395490,0 days 00:02:01.378672,0.9136979790128777,0.9487560949261098,0.0008614135658153577,3.1698689342438948e-06,64.0,0.0703682928371378,32,7,3,0.060018169323591046,32,3,2,0.03431849214446015,64,5,2,,,,,512,128,5,0.20147314989966947,19.0,3,Adam,,,,44.0,0.717391304347826,0.7000319293547822,COMPLETE
29,0.3708149835916271,2026-09-30 11:57:12.517455,2026-09-30 11:57:35.338179,0 days 00:00:22.820724,0.867649732267406,0.982216028999088,0.001296151548378336,3.39434854276121e-06,64.0,0.08308960922293417,16,7,3,0.042408318625081494,16,3,2,0.019460298944071294,64,3,1,,,,,512,128,5,0.3690084244980644,18.0,3,Adam,,,,,,,PRUNED
30,0.3365737446503386,2026-09-30 11:57:35.460206,2026-09-30 11:57:54.511605,0 days 00:00:19.051399,,,,,128.0,0.07669403955158186,32,7,3,0.09057305684589148,16,3,2,0.04798464109939529,64,5,2,,,,,512,128,5,0.1898582695805236,20.0,3,SGD,0.002111240265367905,0.9860873441297298,1.4504086346104061e-06,,,,PRUNED
31,0.737760336094337,2026-09-30 11:57:54.632802,2026-09-30 11:59:54.588422,0 days 00:01:59.955620,0.9119466698023336,0.9831136302434327,0.00046477232724814244,1.0167164155120251e-06,64.0,0.05956060331915301,32,7,3,0.0676747477236185,64,3,2,0.021452292381963892,64,5,2,,,,,512,128,5,0.25828957368436983,20.0,3,Adam,,,,46.0,0.7391304347826086,0.7363902374060655,COMPLETE
32,0.7294333792315062,2026-09-30 11:59:54.709410,2026-09-30 12:01:50.886092,0 days 00:01:56.176682,0.912723773583731,0.9825006985126994,0.00020717938980561456,2.2949444904549453e-06,64.0,0.058210125979310266,32,7,3,0.07214272723510151,64,3,2,0.02436909824497803,64,5,2,,,,,512,128,5,0.22632642097968106,18.0,3,Adam,,,,47.0,0.7217391304347827,0.7371276280282297,COMPLETE
33,0.7587445123072225,2026-09-30 12:01:51.007279,2026-09-30 12:03:46.785958,0 days 00:01:55.778679,0.9026523992666475,0.9810185941554193,0.00043395962240674505,4.725724874435351e-06,64.0,0.05024689938454144,32,7,3,0.060693432955072735,64,3,2,0.01515692147258713,64,5,2,,,,,512,128,5,0.26193754857241835,19.0,3,Adam,,,,50.0,0.7739130434782608,0.7435759811361841,COMPLETE
34,0.3739608737736213,2026-09-30 12:03:46.907009,2026-09-30 12:04:27.688896,0 days 00:00:40.781887,0.8831265001435903,0.9582277972745448,0.00039722153286228604,5.24117491495843e-06,64.0,0.046884709798194146,32,7,3,0.05668107173149194,64,3,2,0.015502765984808474,64,3,2,,,,,512,256,7,0.16459976991178935,19.0,3,Adam,,,,,,,PRUNED
35,0.38087806840391664,2026-09-30 12:04:27.818870,2026-09-30 12:04:51.178488,0 days 00:00:23.359618,0.8741780834255811,0.9772679837856096,0.00019999506297534376,2.3664590406506215e-05,64.0,0.06631286485564428,16,7,3,0.06289094135969958,16,3,2,0.059229765439524434,128,5,2,,,,,512,128,5,0.356766276642202,18.0,3,Adam,,,,,,,PRUNED
36,0.3399308385743496,2026-09-30 12:04:51.301039,2026-09-30 12:05:10.169788,0 days 00:00:18.868749,0.9199444548330677,0.96354277578694,0.0011551950591141297,4.21865248707714e-06,128.0,0.0481352656156013,8,7,3,0.07546713574157814,32,3,2,0.03543544504623359,64,3,1,0.010348776473821666,128.0,3.0,1.0,512,128,5,0.2707687785288116,19.0,4,Adam,,,,,,,PRUNED
37,,2026-09-30 12:05:10.292357,2026-09-30 12:05:10.354282,0 days 00:00:00.061925,,,,,,0.0949271407586911,32,7,3,0.08246542587262531,64,5,2,0.032056255384025456,128,5,2,0.033882198714111376,128.0,3.0,1.0,,256,5,,,4,,,,,,,,PRUNED
38,0.36428689864690805,2026-09-30 12:05:10.473887,2026-09-30 12:05:36.945301,0 days 00:00:26.471414,0.8542411736804021,0.9864868363157013,0.0003583993212969971,6.44320415881658e-06,64.0,0.049886712938367314,8,7,3,0.046508274442270826,64,3,1,0.038199378036968996,64,5,2,,,,,256,128,7,0.19772616135868976,16.0,3,Adam,,,,,,,PRUNED
39,0.30574224547412565,2026-09-30 12:05:37.069775,2026-09-30 12:05:56.470384,0 days 00:00:19.400609,0.9028396120547646,0.9433890116419545,0.00016433188986461665,1.9209635410120934e-05,128.0,0.05541526075631341,32,7,3,0.06392765712055679,32,3,2,0.01488053535603645,64,3,2,,,,,512,128,5,0.10473212874813995,10.0,3,Adam,,,,,,,PRUNED
40,,2026-09-30 12:05:56.592160,2026-09-30 12:05:56.641426,0 days 00:00:00.049266,,,,,,0.0699760483020414,16,7,3,0.05817446530793581,16,5,2,0.017635806784599844,64,5,1,,,,,,128,5,,,3,,,,,,,,PRUNED
41,0.4319540365859598,2026-09-30 12:05:56.762480,2026-09-30 12:06:20.047464,0 days 00:00:23.284984,0.904061742157748,0.9761430861354086,0.000563503064727288,2.029572917460902e-06,64.0,0.06370986319369429,32,7,3,0.0673610251446249,64,3,2,0.02459422341758106,64,5,2,,,,,512,128,5,0.24197279190989635,20.0,3,Adam,,,,,,,PRUNED
42,0.7332022015743234,2026-09-30 12:06:20.171455,2026-09-30 12:08:16.654591,0 days 00:01:56.483136,0.9199543635353619,0.9883750726794771,0.00040183129163774386,1.6369785112895633e-06,64.0,0.05671077398478479,32,7,3,0.07065960129702384,64,3,2,0.025333629803328983,64,5,2,,,,,512,128,5,0.34712152481763875,20.0,3,Adam,,,,38.0,0.7217391304347827,0.7446652727138642,COMPLETE
43,0.33115290972891054,2026-09-30 12:08:16.777932,2026-09-30 12:08:40.010697,0 days 00:00:23.232765,0.8890476269912063,0.9771329978527735,0.008472172648968133,2.277136096124753e-06,64.0,0.062396472268376336,32,7,3,0.07971767577856266,64,3,2,0.06956565575023295,64,5,2,,,,,512,128,5,0.21616692779094976,18.0,3,Adam,,,,,,,PRUNED
44,0.40421045162302316,2026-09-30 12:08:40.133767,2026-09-30 12:09:12.066979,0 days 00:00:31.933212,0.8996731394008907,0.9207456992327535,0.0006146377600732336,5.434701450067067e-06,64.0,0.0659408003040472,32,7,3,0.054759962323755906,64,3,1,0.030423395252536692,128,5,2,,,,,256,256,5,0.14613567010740783,19.0,3,Adam,,,,,,,PRUNED
45,0.45282414548513045,2026-09-30 12:09:12.191165,2026-09-30 12:09:43.325259,0 days 00:00:31.134094,0.9215764393640806,0.9669054856119866,0.0008409725278262639,1.5978557689853895e-06,64.0,0.050540759954287216,8,7,3,0.09062605161303952,64,3,2,0.09875364272018551,64,5,2,,,,,512,128,7,0.2726889253398734,20.0,3,Adam,,,,,,,PRUNED
46,0.3400730959165088,2026-09-30 12:09:43.446744,2026-09-30 12:10:00.897934,0 days 00:00:17.451190,,,,,128.0,0.0998272820401807,32,5,3,0.0631802983098764,64,3,2,0.05917323763186556,64,5,2,,,,,512,128,5,0.1754762706834872,19.0,3,SGD,0.00380606600437781,0.8106156545052814,0.000508266792188062,,,,PRUNED
47,0.33770080017134385,2026-09-30 12:10:01.018855,2026-09-30 12:10:24.884145,0 days 00:00:23.865290,0.8802265440434561,0.9790722868577288,0.00046001135871872933,1.0461418948905617e-06,64.0,0.07252296968487688,32,7,3,0.07503329190008429,32,3,1,0.02100944804307739,64,3,2,,,,,512,128,5,0.30211202521529,18.0,3,Adam,,,,,,,PRUNED
48,,2026-09-30 12:10:25.006650,2026-09-30 12:10:25.058422,0 days 00:00:00.051772,,,,,,0.05669724930723818,32,5,3,0.06011812186559502,64,5,2,0.04590064451324339,128,5,2,,,,,,256,5,,,3,,,,,,,,PRUNED
49,0.3968949698095795,2026-09-30 12:10:25.178023,2026-09-30 12:10:47.912089,0 days 00:00:22.734066,0.8952962041075461,0.987615759050317,0.00023197952825371987,2.896069306163868e-06,64.0,0.04539720986350137,8,7,3,0.03698049966076136,64,3,2,0.011224520853312051,64,5,2,,,,,256,128,5,0.2460494572882403,20.0,3,Adam,,,,,,,PRUNED
50,,2026-09-30 12:10:48.034273,2026-09-30 12:10:48.094230,0 days 00:00:00.059957,,,,,,0.04011096494940796,32,7,3,0.06680475425810244,64,3,2,0.04015281133750668,64,5,2,0.040170574582532606,64.0,3.0,1.0,,128,7,,,4,,,,,,,,PRUNED
51,0.7363045885320517,2026-09-30 12:10:48.221819,2026-09-30 12:12:44.121438,0 days 00:01:55.899619,0.952858146710488,0.9695616043391783,0.0003041804793823099,7.70823098296674e-06,64.0,0.022403348627661048,32,7,3,0.0523783243582584,64,3,2,0.08447682315843198,64,5,2,,,,,512,128,5,0.34195614584951195,15.0,3,Adam,,,,45.0,0.7478260869565218,0.7247830901075817,COMPLETE
52,0.43261379257112753,2026-09-30 12:12:44.243342,2026-09-30 12:13:07.681440,0 days 00:00:23.438098,0.9634585066908374,0.9705480278686357,0.0003240223336246305,1.3960042826353322e-05,64.0,0.05300709583312215,32,7,3,0.04867108085808996,64,3,2,0.05792484167561179,64,5,2,,,,,512,128,5,0.38033354783583284,15.0,3,Adam,,,,,,,PRUNED
53,0.7748904143509734,2026-09-30 12:13:07.803964,2026-09-30 12:15:18.164927,0 days 00:02:10.360963,0.9424447925072624,0.9546340325126761,0.0002607210865007241,4.391816682396512e-06,64.0,0.038237521648947344,32,7,3,0.054819846766344264,64,3,2,0.04982885974702709,64,5,2,,,,,512,128,5,0.3222199066057488,13.0,3,Adam,,,,50.0,0.7782608695652173,0.7715199591367295,COMPLETE
54,0.4185158676529209,2026-09-30 12:15:18.290100,2026-09-30 12:15:47.096135,0 days 00:00:28.806035,0.9071993811672916,0.9550109099348877,0.00017578966456932327,4.351534755985594e-06,64.0,0.060153588768272294,32,7,3,0.05565730767659508,64,3,2,0.0643259455726253,64,5,2,,,,,512,128,5,0.3078376113950522,7.0,3,Adam,,,,,,,PRUNED
55,0.4368506713913393,2026-09-30 12:15:47.222607,2026-09-30 12:16:13.632061,0 days 00:00:26.409454,0.9433529064693137,0.9357904518763566,0.0002447869240741606,1.5877669235311151e-06,64.0,0.042873482410728275,32,7,3,0.043998542651684236,64,3,1,0.07489909360379637,64,5,2,,,,,512,128,5,0.460643424670544,13.0,3,Adam,,,,,,,PRUNED
56,0.7835466506796611,2026-09-30 12:16:13.759172,2026-09-30 12:18:15.086175,0 days 00:02:01.327003,0.9252295493728543,0.963963981691589,0.0007948285035713989,3.50219286325467e-06,64.0,0.04952664216815683,32,5,3,0.06065380718353111,64,3,2,0.04791315674889945,64,5,2,,,,,512,128,5,0.26984796090781704,10.0,3,Adam,,,,45.0,0.7913043478260869,0.7757889535332353,COMPLETE
57,0.2400612729913833,2026-09-30 12:18:15.214208,2026-09-30 12:19:15.195951,0 days 00:00:59.981743,,,,,64.0,0.03942843705758742,32,5,3,0.0611948814171696,64,3,2,0.04888181175331927,32,5,1,,,,,512,512,5,0.3247234167337577,12.0,3,SGD,0.0006383244995240713,0.9056284194174951,0.00026388681856047885,,,,PRUNED
58,,2026-09-30 12:19:15.319769,2026-09-30 12:19:15.372125,0 days 00:00:00.052356,,,,,,0.033123350323211044,16,5,3,0.05724481040374425,64,5,2,0.04101838410827492,64,5,2,,,,,,128,5,,,3,,,,,,,,PRUNED
59,0.7431985480574483,2026-09-30 12:19:15.494779,2026-09-30 12:21:19.546734,0 days 00:02:04.051955,0.9412895821240103,0.9633999711064878,0.0008884810056974584,0.0009005662425592278,64.0,0.026683903400049593,32,5,3,0.052671197466048245,16,3,2,0.05478264852500664,64,5,2,,,,,512,128,5,0.2754842670916319,8.0,3,Adam,,,,40.0,0.7521739130434782,0.7342231830714183,COMPLETE
60,0.41185483815935475,2026-09-30 12:21:19.681929,2026-09-30 12:21:38.607046,0 days 00:00:18.925117,0.9238250934428607,0.9590176923102168,0.0006333290150826402,6.547222450394177e-06,128.0,0.04984128886399493,32,5,3,0.06472321902459693,64,3,2,0.049105794132687806,64,5,2,,,,,256,128,5,0.3901223733421499,12.0,3,Adam,,,,,,,PRUNED
61,0.41329976736735974,2026-09-30 12:21:38.734353,2026-09-30 12:22:03.071949,0 days 00:00:24.337596,0.9616258081769217,0.9909386217014358,0.00044951892431767973,3.464806326061896e-06,64.0,0.05457376710190976,32,5,3,0.06801145736475599,64,3,2,0.04378218586766238,64,5,2,,,,,512,128,5,0.21529295839985801,10.0,3,Adam,,,,,,,PRUNED
