number,value,datetime_start,datetime_complete,duration,params_adam_beta1,params_adam_beta2,params_adam_lr,params_adam_wd,params_batch_size,params_block_0_dropout,params_block_0_filters,params_block_0_kernel,params_block_0_stride,params_block_1_dropout,params_block_1_filters,params_block_1_kernel,params_block_1_stride,params_block_2_dropout,params_block_2_filters,params_block_2_kernel,params_block_2_stride,params_block_3_dropout,params_block_3_filters,params_block_3_kernel,params_block_3_stride,params_fc_hidden,params_first_conv_filters,params_first_conv_kernel_size,params_lr_factor,params_lr_patience,params_n_blocks,params_optimizer,params_sgd_lr,params_sgd_momentum,params_sgd_wd,user_attrs_best_epoch,user_attrs_validation_accuracy,user_attrs_validation_macro_f1,state
62,0.772001763235105,2026-09-30 12:22:03.197398,2026-09-30 12:24:13.804634,0 days 00:02:10.607236,0.9258761020953109,0.9754420415496015,0.0007570771796852385,1.3777864515251478e-06,64.0,0.04408640163038194,32,7,3,0.04825046288121665,64,3,2,0.0332208288107775,64,5,2,,,,,512,128,5,0.2531270543944634,5.0,3,Adam,,,,40.0,0.7695652173913043,0.7744383090789058,COMPLETE
63,0.7860773270883104,2026-09-30 12:24:13.927483,2026-09-30 12:26:19.961630,0 days 00:02:06.034147,0.9381027861398629,0.9662750829928461,0.0010987487049171267,2.5685382080304476e-06,64.0,0.044217737194750924,32,7,3,0.047094240740878715,64,3,2,0.038228981834002786,64,5,2,,,,,512,128,5,0.2900480713201079,5.0,3,Adam,,,,43.0,0.7956521739130434,0.7765024802635773,COMPLETE
64,0.4196794773878928,2026-09-30 12:26:20.085729,2026-09-30 12:26:44.457663,0 days 00:00:24.371934,0.9255802304699291,0.9664772116475651,0.0022276140096716014,4.379035606611712e-06,64.0,0.04568507040098432,32,5,3,0.047769359306962654,64,3,2,0.038491644828783124,64,5,2,,,,,512,128,5,0.2907172225860239,6.0,3,Adam,,,,,,,PRUNED
65,0.6519398151335639,2026-09-30 12:26:44.583026,2026-09-30 12:28:10.757911,0 days 00:01:26.174885,0.9347090915429077,0.954769724640278,0.0011243080699642584,0.004055343982978079,64.0,0.04416033799128693,32,7,3,0.035917054946727575,64,3,2,0.03310431914525218,64,5,2,,,,,512,128,5,0.3319460667991565,5.0,3,Adam,,,,,,,PRUNED
66,0.7878234195948441,2026-09-30 12:28:10.881404,2026-09-30 12:32:28.445351,0 days 00:04:17.563947,0.9392088310689589,0.9467789918138678,0.0007642866682085046,1.0089750962087236e-05,64.0,0.03708369399745112,32,7,3,0.042587629343057855,64,3,2,0.027619704044138972,32,5,2,,,,,512,512,3,0.2631764499649945,6.0,3,Adam,,,,46.0,0.8,0.7756468391896882,COMPLETE
67,0.42269933247247293,2026-09-30 12:32:28.566516,2026-09-30 12:33:20.484382,0 days 00:00:51.917866,0.9386468714481411,0.9454319097197628,0.0018218085259988997,3.6696927792978555e-05,64.0,0.035695667148998876,32,7,3,0.04241907000417476,32,3,2,0.028434604601073613,32,3,2,,,,,512,512,3,0.2918104720119428,6.0,3,Adam,,,,,,,PRUNED
68,0.319633779426453,2026-09-30 12:33:20.621327,2026-09-30 12:34:13.309335,0 days 00:00:52.688008,,,,,64.0,0.03163429865807414,32,7,3,0.03079746611804141,64,3,1,0.031186927277054195,32,5,1,,,,,128,512,3,0.31683722172112333,5.0,3,SGD,0.015048953805213266,0.7840149851776501,1.5151426926856414e-06,,,,PRUNED
69,0.42862829735694474,2026-09-30 12:34:13.433050,2026-09-30 12:34:57.680878,0 days 00:00:44.247828,0.9293359384331333,0.9372956910574144,0.0007376227932072651,0.009261796460991968,64.0,0.039013801753487974,32,5,3,0.040456913297113685,64,3,2,0.03742080030668133,32,5,2,,,,,512,512,3,0.25904101413700237,6.0,3,Adam,,,,,,,PRUNED
70,,2026-09-30 12:34:57.802773,2026-09-30 12:34:57.853497,0 days 00:00:00.050724,,,,,,0.04226830514421773,8,7,3,0.045889713294249804,64,5,2,0.046881462945618416,32,5,2,,,,,,512,3,,,3,,,,,,,,PRUNED
71,0.5537649476329438,2026-09-30 12:34:57.973637,2026-09-30 12:36:34.893090,0 days 00:01:36.919453,0.9503222517451922,0.9619622840206994,0.001029002386996837,1.1177278709607756e-05,64.0,0.05116838986487787,32,7,3,0.05045727893883732,64,3,2,0.03495714510129559,32,5,2,,,,,512,512,3,0.2581468554822081,8.0,3,Adam,,,,,,,PRUNED
72,0.7850621533671929,2026-09-30 12:36:35.015073,2026-09-30 12:38:45.406673,0 days 00:02:10.391600,0.9396685997985016,0.9736212577358688,0.0014237033349085504,1.9800028512699282e-05,64.0,0.04735887993226546,32,7,3,0.05408807151649863,64,3,2,0.026855661582660624,64,5,2,,,,,512,128,5,0.28113284808462513,5.0,3,Adam,,,,48.0,0.7956521739130434,0.7744721328213423,COMPLETE
73,0.7419590073195506,2026-09-30 12:38:45.534580,2026-09-30 12:42:25.311271,0 days 00:03:39.776691,0.9388155850974772,0.9743089956634363,0.0013204589142880117,2.4113432341386695e-05,64.0,0.04813468124285669,32,7,3,0.05420282535510267,64,3,2,0.026905194329108054,128,5,2,,,,,512,256,7,0.2959312226991718,5.0,3,Adam,,,,47.0,0.7565217391304347,0.7273962755086664,COMPLETE
74,0.5173646495410077,2026-09-30 12:42:25.435044,2026-09-30 12:43:15.038990,0 days 00:00:49.603946,0.95882711967383,0.9544815091727343,0.0014944163294199305,7.109124202132097e-05,64.0,0.037874503085917936,32,7,3,0.04926611309177506,64,3,2,0.029470064960218235,64,5,2,,,,,512,128,5,0.21330040296508218,7.0,3,Adam,,,,,,,PRUNED
75,0.6882368361339695,2026-09-30 12:43:15.165859,2026-09-30 12:45:25.843661,0 days 00:02:10.677802,0.9697669448466794,0.9485376117437736,0.0007740343736280262,1.5899468620235917e-05,64.0,0.029165781615715154,32,7,3,0.03791710549798502,64,3,2,0.03334228349932535,64,5,2,,,,,512,128,5,0.1814418586251705,6.0,3,Adam,,,,,,,PRUNED
76,0.39597219864857436,2026-09-30 12:45:25.966805,2026-09-30 12:45:53.085393,0 days 00:00:27.118588,0.9457618391979743,0.9674321959988426,0.001851513929661552,9.747025044274685e-06,64.0,0.04204248343196689,16,7,3,0.035055781862464275,16,3,2,0.04117304649499412,64,5,2,,,,,512,128,3,0.2822578741548518,7.0,3,Adam,,,,,,,PRUNED
77,0.7683828507733446,2026-09-30 12:45:53.212261,2026-09-30 12:51:09.135543,0 days 00:05:15.923282,0.9312092118604964,0.9731501156400988,0.0009829114355328317,1.289575838590426e-06,64.0,0.04725452186600895,32,7,3,0.04322613173032665,64,3,2,0.044807583861635615,32,5,2,,,,,512,512,5,0.3610151808721046,5.0,3,Adam,,,,41.0,0.7739130434782608,0.7628526580684284,COMPLETE
78,0.3765600229775422,2026-09-30 12:51:09.258744,2026-09-30 12:52:11.059794,0 days 00:01:01.801050,0.9273582362052323,0.9730301068897806,0.0010027299587637738,1.2595377776954093e-06,64.0,0.03410973512049194,32,7,3,0.04089153640946585,64,3,2,0.04512112245462244,32,3,2,,,,,128,512,5,0.43163699536569844,5.0,3,Adam,,,,,,,PRUNED
79,0.3944999321054873,2026-09-30 12:52:11.192574,2026-09-30 12:53:13.547248,0 days 00:01:02.354674,0.93621168960935,0.9417728793236306,0.0030640298104603536,2.590922582130223e-06,64.0,0.03666417787143273,32,7,3,0.04378785267422876,64,3,2,0.05591732998107196,32,5,1,,,,,512,512,5,0.3499959892201499,6.0,3,Adam,,,,,,,PRUNED
80,0.4317001824406043,2026-09-30 12:53:13.672902,2026-09-30 12:54:22.773278,0 days 00:01:09.100376,0.9317693931710666,0.9588229697858418,0.0005356016438987278,1.3796412314061913e-06,128.0,0.0472249804448471,32,7,3,0.02494015644215404,32,3,2,0.03650682178262491,32,5,2,,,,,512,512,5,0.36388339827937244,5.0,3,Adam,,,,,,,PRUNED
81,0.46316639308776,2026-09-30 12:54:22.897585,2026-09-30 12:55:30.842331,0 days 00:01:07.944746,0.9457530319299251,0.9645565057024039,0.0006724614891306109,3.2669499207881212e-06,64.0,0.04487278305300276,32,7,3,0.046391529291608655,64,3,2,0.02331237141045137,32,5,2,,,,,512,512,5,0.24067528623859696,5.0,3,Adam,,,,,,,PRUNED
82,0.8099887348481043,2026-09-30 12:55:30.964289,2026-09-30 12:57:27.881095,0 days 00:01:56.916806,0.9180434170741435,0.97022585417498,0.00138851819866522,8.210406497590182e-06,64.0,0.041248185179516644,32,7,3,0.052391453786639,64,3,2,0.026977182454194344,64,5,2,,,,,512,128,5,0.3334099645698363,11.0,3,Adam,,,,50.0,0.8130434782608695,0.8069339914353391,COMPLETE
83,0.5529123160374436,2026-09-30 12:57:28.001200,2026-09-30 12:59:33.203359,0 days 00:02:05.202159,0.9178783370083189,0.9698522397497799,0.0014580463403196114,7.839784849620366e-06,64.0,0.040871253691507986,32,7,3,0.05090830606832814,64,3,2,0.0431100604950545,32,5,2,,,,,512,512,5,0.4045040144603733,11.0,3,Adam,,,,,,,PRUNED
84,0.7644878223649798,2026-09-30 12:59:33.332497,2026-09-30 13:01:43.701804,0 days 00:02:10.369307,0.9264794776573606,0.9738083754217647,0.0009615622987169212,2.054939892677047e-06,64.0,0.043691848479782996,32,7,3,0.057104231124784154,64,3,2,0.027358771736820064,64,5,2,,,,,512,128,5,0.33022537515312433,9.0,3,Adam,,,,49.0,0.782608695652174,0.7463669490777856,COMPLETE
85,0.7800931846374353,2026-09-30 13:01:43.839380,2026-09-30 13:03:54.216333,0 days 00:02:10.376953,0.9101141709357515,0.9843186806502822,0.001115155445139925,1.261443742107399e-06,64.0,0.04755843978859534,32,7,3,0.05217122835445168,64,3,2,0.01878956241536091,64,5,2,,,,,512,128,5,0.3076491915005089,11.0,3,Adam,,,,50.0,0.7869565217391304,0.7732298475357402,COMPLETE
86,0.32966714552080145,2026-09-30 13:03:54.353826,2026-09-30 13:04:20.433862,0 days 00:00:26.080036,,,,,64.0,0.04014285442385454,32,7,3,0.05418778166217924,64,3,2,0.02387209370672323,64,5,2,,,,,512,128,5,0.31502387712145274,11.0,3,SGD,0.0004903708493423217,0.9153738551860595,0.00011594898537387315,,,,PRUNED
87,0.37485556362568967,2026-09-30 13:04:20.557488,2026-09-30 13:04:50.135563,0 days 00:00:29.578075,0.9087460111542883,0.9791935348676055,0.0012839063168313682,5.722985147822209e-06,64.0,0.036190391758851054,32,7,3,0.05308611956981639,64,3,1,0.01883020488591982,64,5,2,,,,,256,128,7,0.2267462191635305,10.0,3,Adam,,,,,,,PRUNED
88,,2026-09-30 13:04:50.271670,2026-09-30 13:04:50.323694,0 days 00:00:00.052024,,,,,,0.03029987127516964,8,7,3,0.04705308159424851,64,5,2,0.026242958607739356,64,5,2,,,,,,128,3,,,3,,,,,,,,PRUNED
89,0.658179287073821,2026-09-30 13:04:50.443969,2026-09-30 13:06:10.000903,0 days 00:01:19.556934,0.9126049748062308,0.9517794149724611,0.0016941035108506265,3.706458192535542e-06,64.0,0.05128946985715803,16,5,3,0.05904310412938524,64,3,2,0.01396238025196695,64,5,2,,,,,512,128,5,0.2542914108929588,11.0,3,Adam,,,,,,,PRUNED
90,0.4977887826413576,2026-09-30 13:06:10.131029,2026-09-30 13:06:48.920630,0 days 00:00:38.789601,0.9180957582921345,0.9957904156302081,0.0011556715041981165,2.0653520144627924e-05,64.0,0.04868090543071182,32,7,3,0.048923263857517434,16,3,2,0.039163169691165574,64,5,2,,,,,512,128,5,0.27983309056831956,14.0,3,Adam,,,,,,,PRUNED
91,0.4939666827909884,2026-09-30 13:06:49.041512,2026-09-30 13:07:26.119568,0 days 00:00:37.078056,0.9346346389587812,0.9853117155193406,0.0021296637216990503,1.2530380613017458e-06,64.0,0.04700158323197908,32,7,3,0.042458862708780576,64,3,2,0.03236862118029538,128,5,2,,,,,512,256,5,0.3061287336346415,13.0,3,Adam,,,,,,,PRUNED
92,0.782335496713808,2026-09-30 13:07:26.241782,2026-09-30 13:09:36.530383,0 days 00:02:10.288601,0.9153742842117379,0.9805299511982946,0.0007991730018671264,2.1602912046164013e-06,64.0,0.045778499359526895,32,7,3,0.05161076376325803,64,3,2,0.05011764617649426,64,5,2,,,,,512,128,5,0.33749017113264,6.0,3,Adam,,,,43.0,0.7869565217391304,0.7777144716884855,COMPLETE
93,0.7899445873479014,2026-09-30 13:09:36.656768,2026-09-30 13:11:47.138493,0 days 00:02:10.481725,0.9236994332730771,0.9782095940966476,0.0007805024039307239,2.478094145776348e-06,64.0,0.03839661528677736,32,7,3,0.05645992457923278,64,3,2,0.022304400831640307,64,5,2,,,,,512,128,5,0.634495580495667,9.0,3,Adam,,,,48.0,0.7913043478260869,0.7885848268697159,COMPLETE
94,0.765842549628432,2026-09-30 13:11:47.274900,2026-09-30 13:13:57.538403,0 days 00:02:10.263503,0.9229941178204002,0.9838093022404463,0.0008212610799202991,2.5180847067120314e-06,64.0,0.03806496600018183,32,7,3,0.05161904345054896,64,3,2,0.0210756964764442,64,5,2,,,,,512,128,5,0.46386193936491793,9.0,3,Adam,,,,50.0,0.7739130434782608,0.7577720557786032,COMPLETE
95,0.7640160184231364,2026-09-30 13:13:57.675089,2026-09-30 13:16:02.340006,0 days 00:02:04.664917,0.9172067616318288,0.9781272696407358,0.0011763965209301613,2.8390762719147156e-06,64.0,0.03326922472741631,32,7,3,0.05710484228616562,64,3,2,0.016135391599374656,64,5,2,,,,,512,128,5,0.6360164196361495,8.0,3,Adam,,,,49.0,0.7739130434782608,0.7541189933680119,COMPLETE
96,0.3933711021516534,2026-09-30 13:16:02.469215,2026-09-30 13:16:28.665894,0 days 00:00:26.196679,0.9094335051543958,0.9896697373070389,0.0014835126066444593,2.094042743596222e-06,64.0,0.04142893320809825,32,7,3,0.05556418872481219,64,3,2,0.052775170057303825,64,3,2,,,,,512,128,5,0.5684060795007694,12.0,3,Adam,,,,,,,PRUNED
97,0.45568174677179646,2026-09-30 13:16:28.793453,2026-09-30 13:16:54.968383,0 days 00:00:26.174930,0.9398014716137487,0.968699672083488,0.000701537088307352,7.259917906613461e-06,64.0,0.04340110448137439,32,7,3,0.06240166598891384,64,3,2,0.04913917660831042,64,5,2,,,,,128,128,5,0.5336049986917974,9.0,3,Adam,,,,,,,PRUNED
98,0.3871906389627483,2026-09-30 13:16:55.103838,2026-09-30 13:17:16.205227,0 days 00:00:21.101389,0.9289978299753069,0.9751463818138403,0.0005896212897138528,1.7492655523622407e-06,128.0,0.052659196801550665,32,7,3,0.04501754523831071,64,3,2,0.017621998916945526,64,5,1,,,,,512,128,5,0.6839215742263887,11.0,3,Adam,,,,,,,PRUNED
99,0.7788819641075528,2026-09-30 13:17:16.327600,2026-09-30 13:19:17.452947,0 days 00:02:01.125347,0.9499959742181802,0.9806134922283519,0.0009003170037737695,5.008627601811186e-06,64.0,0.027493049670057133,32,5,3,0.04941339328801289,64,3,2,0.019601692228948708,64,5,2,,,,,512,128,5,0.4971315879065725,7.0,3,Adam,,,,50.0,0.7913043478260869,0.7664595803890187,COMPLETE
