number,value,datetime_start,datetime_complete,duration,params_adam_beta1,params_adam_beta2,params_adam_lr,params_adam_wd,params_batch_size,params_block_0_dropout,params_block_0_filters,params_block_0_kernel,params_block_0_stride,params_block_1_dropout,params_block_1_filters,params_block_1_kernel,params_block_1_stride,params_block_2_dropout,params_block_2_filters,params_block_2_kernel,params_block_2_stride,params_fc_hidden,params_first_conv_filters,params_first_conv_kernel_freq,params_first_conv_kernel_time,params_lr_factor,params_lr_patience,params_n_blocks,params_optimizer,params_sgd_lr,params_sgd_momentum,params_sgd_wd,user_attrs_best_epoch,user_attrs_validation_accuracy,user_attrs_validation_macro_f1,state
0,0.4504021847218567,2026-09-14 22:27:17.823408,2026-09-14 22:29:13.379670,0 days 00:01:55.556262,,,,,64.0,0.15579754426081674,16,7,3,,,,,,,,,256,32,3,3,0.464526911140863,7.0,1,SGD,0.003489018845491387,0.8718002249699923,1.5339162591163623e-06,48.0,0.4645161290322581,0.43628824041145536,COMPLETE
1,0.4966953517448244,2026-09-14 22:29:13.540220,2026-09-14 22:31:15.867623,0 days 00:02:02.327403,,,,,64.0,0.1353970008207678,64,3,3,0.42087879230161584,128.0,5.0,2.0,,,,,128,16,7,5,0.5627622080115674,6.0,2,SGD,0.02795015916508337,0.904988629715809,0.0008241925264876454,45.0,0.5,0.4933907034896487,COMPLETE
2,0.4268380538569957,2026-09-14 22:31:16.023451,2026-09-14 22:33:43.628144,0 days 00:02:27.604693,0.8667811514267155,0.9337277556232224,0.0006836314065022728,7.7344821566468e-06,32.0,0.22574239243053068,64,3,3,0.4232481518257668,32.0,3.0,3.0,0.1911740650167767,32.0,3.0,1.0,256,16,5,3,0.6657458223475115,10.0,3,Adam,,,,12.0,0.44516129032258067,0.40851481739141077,COMPLETE
3,0.3874965813630057,2026-09-14 22:33:43.779903,2026-09-14 22:35:34.741670,0 days 00:01:50.961767,0.8557085198176669,0.9590302050245054,0.0004380867619725788,5.5728075000299646e-06,64.0,0.2471132530877013,16,3,1,,,,,,,,,128,16,3,3,0.5065386171053694,5.0,1,Adam,,,,49.0,0.3967741935483871,0.3782189691776243,COMPLETE
4,0.3504355047232164,2026-09-14 22:35:34.893102,2026-09-14 22:47:44.817154,0 days 00:12:09.924052,,,,,32.0,0.3903822715480958,16,7,1,0.3654007076432223,16.0,7.0,1.0,,,,,256,128,5,3,0.2952398188955606,16.0,2,SGD,0.0004707690774317695,0.9065319741907854,8.891936446296244e-06,40.0,0.36451612903225805,0.3363548804141748,COMPLETE
5,0.29855524636098174,2026-09-14 22:47:44.968196,2026-09-14 22:48:24.083748,0 days 00:00:39.115552,,,,,16.0,0.46594575608817945,128,7,3,0.22676880206251107,64.0,3.0,3.0,,,,,256,16,5,3,0.18405040914191442,13.0,2,SGD,0.00019567235921447355,0.8783520957427592,0.009124632886689911,,,,PRUNED
6,0.3050080502777336,2026-09-14 22:48:24.231627,2026-09-14 22:49:56.127115,0 days 00:01:31.895488,0.8952139062117744,0.9794391008573935,0.008947550514356688,0.00011619873314872935,64.0,0.21461650085131379,64,7,3,0.1341389859975072,128.0,7.0,1.0,,,,,256,128,7,7,0.2624993507572445,12.0,2,Adam,,,,,,,PRUNED
7,0.24600967432844423,2026-09-14 22:49:56.284053,2026-09-14 22:50:34.887401,0 days 00:00:38.603348,,,,,16.0,0.11629152092758806,16,7,2,0.3540374603470575,16.0,3.0,3.0,0.3343102325093853,64.0,3.0,2.0,64,16,7,3,0.6767143382943485,19.0,3,SGD,0.004333615420461955,0.9730247945451923,3.502761367842316e-05,,,,PRUNED
8,0.26880007805789763,2026-09-14 22:50:35.038327,2026-09-14 22:51:25.265928,0 days 00:00:50.227601,0.8627688544268166,0.9493925884397879,0.0038296412064459167,0.0014403650379563883,32.0,0.24880723431711327,32,7,2,0.43058298644309667,64.0,7.0,2.0,0.3527348848679197,32.0,3.0,2.0,64,64,5,3,0.13453525600998656,13.0,3,Adam,,,,,,,PRUNED
9,0.34027180526679623,2026-09-14 22:51:25.425591,2026-09-14 22:52:41.202966,0 days 00:01:15.777375,0.8578824585954572,0.9118699098351805,0.0001053676488803293,7.492772870670286e-05,64.0,0.41085876637097474,32,7,1,,,,,,,,,256,64,7,5,0.17051574806626293,15.0,1,Adam,,,,,,,PRUNED
10,0.25406456348462375,2026-09-14 22:52:41.366958,2026-09-14 22:53:11.459810,0 days 00:00:30.092852,,,,,64.0,0.3496334108689463,64,5,3,0.2602131081792819,128.0,5.0,2.0,,,,,128,32,7,5,0.45501018155803585,19.0,2,SGD,0.09393327146849992,0.7138010907768535,0.008596414414739363,,,,PRUNED
11,0.498926843469834,2026-09-14 22:53:11.610082,2026-09-14 22:55:17.410429,0 days 00:02:05.800347,,,,,64.0,0.10517513283997565,128,3,3,,,,,,,,,128,32,3,5,0.4980438571671895,6.0,1,SGD,0.015591157326895026,0.8480005966407345,1.2653130267405912e-06,50.0,0.5032258064516129,0.49462788048805517,COMPLETE
12,0.5358599987589137,2026-09-14 22:55:17.565329,2026-09-14 22:57:23.331516,0 days 00:02:05.766187,,,,,64.0,0.123204910284249,128,3,3,,,,,,,,,128,32,3,5,0.5686231864821761,8.0,1,SGD,0.03507507816885387,0.8021100896646203,0.00022913275045852968,48.0,0.5387096774193548,0.5330103200984725,COMPLETE
13,0.5042652955007834,2026-09-14 22:57:23.486491,2026-09-14 22:59:26.898907,0 days 00:02:03.412416,,,,,64.0,0.10508245013433398,128,3,3,,,,,,,,,128,32,3,5,0.3676870252449375,9.0,1,SGD,0.01382742104386195,0.7800304253213812,0.00016722178877651053,50.0,0.5129032258064516,0.4956273651951152,COMPLETE
14,0.3870211023649054,2026-09-14 22:59:27.070624,2026-09-14 23:00:03.385821,0 days 00:00:36.315197,,,,,64.0,0.174655016561246,128,3,3,,,,,,,,,128,32,3,5,0.35401483554906177,9.0,1,SGD,0.015018580927677794,0.768658955541035,0.00021291989980840335,,,,PRUNED
15,0.29174370598807997,2026-09-14 23:00:03.561118,2026-09-14 23:00:52.170650,0 days 00:00:48.609532,,,,,16.0,0.29844287641152617,128,5,2,,,,,,,,,128,32,3,7,0.39458732033516886,9.0,1,SGD,0.09782084808243353,0.7924353528388854,0.0004978446118266614,,,,PRUNED
16,0.4744537640710571,2026-09-14 23:00:52.324813,2026-09-14 23:02:50.692090,0 days 00:01:58.367277,,,,,64.0,0.18942930198970998,128,3,3,,,,,,,,,128,32,3,5,0.6093663613174813,8.0,1,SGD,0.0042073287015818505,0.7931756860638831,8.261900636047076e-05,45.0,0.47419354838709676,0.4747139797550174,COMPLETE
17,0.5247545530150461,2026-09-14 23:02:50.850540,2026-09-14 23:04:51.649073,0 days 00:02:00.798533,,,,,64.0,0.10092577607962665,128,3,3,,,,,,,,,64,32,3,5,0.4019291467234961,11.0,1,SGD,0.030804765254645296,0.7348646394477129,0.001199961776546694,49.0,0.5193548387096775,0.5301542673204148,COMPLETE
18,0.3524018079303758,2026-09-14 23:04:51.808266,2026-09-14 23:06:24.541623,0 days 00:01:32.733357,,,,,16.0,0.16150122477422066,128,3,1,0.10158914403735211,32.0,5.0,1.0,,,,,64,32,3,5,0.5584917727720003,11.0,2,SGD,0.04772716145256086,0.7012745404482426,0.0016019128082544968,,,,PRUNED
19,0.3909942845277349,2026-09-14 23:06:24.694487,2026-09-14 23:09:15.574200,0 days 00:02:50.879713,,,,,32.0,0.2911655537772432,128,5,2,,,,,,,,,64,64,3,7,0.4171696849305699,15.0,1,SGD,0.0012006955506702966,0.7422198984587228,0.0022046367325174736,,,,PRUNED
20,0.34429247111862193,2026-09-14 23:09:15.728085,2026-09-14 23:10:14.334455,0 days 00:00:58.606370,,,,,64.0,0.1925462730840251,32,3,3,,,,,,,,,64,128,3,5,0.29186666305897546,17.0,1,SGD,0.03642798041159163,0.8261592485554714,2.6595024517499022e-05,,,,PRUNED
21,0.49967347215770797,2026-09-14 23:10:14.488630,2026-09-14 23:12:05.221989,0 days 00:01:50.733359,,,,,64.0,0.10801915214932503,128,3,3,,,,,,,,,128,32,3,5,0.3414904967239829,10.0,1,SGD,0.01007855493100361,0.7532233478264727,0.0001776399920103196,47.0,0.5,0.499346944315416,COMPLETE
22,0.42741810611636766,2026-09-14 23:12:05.378171,2026-09-14 23:13:29.470132,0 days 00:01:24.091961,,,,,64.0,0.13699795791407243,128,3,3,,,,,,,,,64,32,3,5,0.37196412185713285,8.0,1,SGD,0.00864080727650821,0.812440686097904,0.00030196733819048646,,,,PRUNED
23,0.5136139931235488,2026-09-14 23:13:29.618468,2026-09-14 23:15:20.320187,0 days 00:01:50.701719,,,,,64.0,0.10162108079193023,128,3,3,,,,,,,,,128,32,3,5,0.24528876417912748,11.0,1,SGD,0.028938123303029105,0.7348258509423042,6.893053018879352e-05,47.0,0.5096774193548387,0.5175505668922589,COMPLETE
24,0.5121876265310727,2026-09-14 23:15:20.489215,2026-09-14 23:17:11.214983,0 days 00:01:50.725768,,,,,64.0,0.14231956468575604,128,3,3,,,,,,,,,128,32,3,5,0.23565612376085315,12.0,1,SGD,0.04386450755458354,0.7322168972465063,5.2820150560337214e-05,48.0,0.5193548387096775,0.5050204143524681,COMPLETE
25,0.37692816500580784,2026-09-14 23:17:11.365117,2026-09-14 23:17:33.643801,0 days 00:00:22.278684,,,,,64.0,0.14120852559016334,128,3,3,,,,,,,,,64,32,3,5,0.21146552126645543,11.0,1,SGD,0.028411512624942382,0.7314966443225248,1.5541728851495446e-05,,,,PRUNED
26,0.2866033180518708,2026-09-14 23:17:33.793771,2026-09-14 23:17:57.549270,0 days 00:00:23.755499,0.9887098222608925,0.9922019759183536,0.001608637677319293,0.006721745240881962,64.0,0.17933659441722594,128,5,3,0.48923918932764704,16.0,3.0,2.0,,,,,128,32,3,7,0.11417461936755266,14.0,2,Adam,,,,,,,PRUNED
27,0.3346905810984009,2026-09-14 23:17:57.697840,2026-09-14 23:18:19.965178,0 days 00:00:22.267338,,,,,64.0,0.1019529440028588,128,3,3,,,,,,,,,64,32,3,5,0.30646699812466544,11.0,1,SGD,0.06215780240153665,0.7617312421409452,0.0025721491059605994,,,,PRUNED
28,0.32917972598838324,2026-09-14 23:18:20.113751,2026-09-14 23:19:36.542911,0 days 00:01:16.429160,,,,,32.0,0.20427794653432224,32,3,1,,,,,,,,,128,128,5,5,0.6042523602936727,7.0,1,SGD,0.02138883334735699,0.8091467973393419,0.0008810537766887082,,,,PRUNED
29,0.37255942247084706,2026-09-14 23:19:36.693582,2026-09-14 23:20:31.137232,0 days 00:00:54.443650,,,,,16.0,0.15849108982894242,16,3,2,,,,,,,,,64,32,3,5,0.4552205582878227,7.0,1,SGD,0.008444522253577282,0.7118390727022923,8.273472831793974e-05,,,,PRUNED
30,0.66772572324145,2026-09-14 23:20:31.290553,2026-09-14 23:23:28.146862,0 days 00:02:56.856309,,,,,64.0,0.12680324625018077,128,5,3,0.23681411147294104,64.0,7.0,3.0,,,,,128,64,3,7,0.4288051262860765,13.0,2,SGD,0.05837815995751738,0.8374683344797462,5.392822214349262e-06,49.0,0.667741935483871,0.667709510999029,COMPLETE
31,0.674452393266173,2026-09-14 23:23:28.306142,2026-09-14 23:26:25.848829,0 days 00:02:57.542687,,,,,64.0,0.12913002154632852,128,5,3,0.21254726343166114,64.0,7.0,3.0,,,,,128,64,3,7,0.5250062423648092,13.0,2,SGD,0.0719531808605366,0.849839254776462,5.3222587303181946e-06,49.0,0.6774193548387096,0.6714854316936363,COMPLETE
32,0.6522813145519472,2026-09-14 23:26:26.003208,2026-09-14 23:29:23.400351,0 days 00:02:57.397143,,,,,64.0,0.13872200196068163,128,5,3,0.21411171519946232,64.0,7.0,3.0,,,,,128,64,3,7,0.5469420800786949,13.0,2,SGD,0.06062375901012441,0.8511683162610555,4.1220822612412145e-06,45.0,0.6419354838709678,0.6626271452329265,COMPLETE
33,0.6740838554840742,2026-09-14 23:29:23.553069,2026-09-14 23:32:20.920521,0 days 00:02:57.367452,,,,,64.0,0.1319337350445851,128,5,3,0.2135079007688265,64.0,7.0,3.0,,,,,128,64,3,7,0.5482852747962818,17.0,2,SGD,0.06690152638876369,0.8527867477589802,3.654700170498752e-06,47.0,0.6580645161290323,0.6901031948391163,COMPLETE
34,0.36366853467188864,2026-09-14 23:32:21.071172,2026-09-14 23:32:55.106014,0 days 00:00:34.034842,,,,,64.0,0.1587048757431928,64,5,3,0.22294127808983566,64.0,7.0,3.0,,,,,128,64,3,7,0.5152143620372036,20.0,2,SGD,0.06948276598181048,0.8507886432888355,4.116297282380578e-06,,,,PRUNED
35,0.623127752561498,2026-09-14 23:32:55.260597,2026-09-14 23:35:52.747322,0 days 00:02:57.486725,0.9570210344506328,0.9009410644069563,0.00010125691741945705,1.4729506947331335e-06,64.0,0.24228839929852686,128,5,3,0.1879246755780514,64.0,7.0,3.0,,,,,128,64,3,7,0.6450346147088271,17.0,2,Adam,,,,46.0,0.6193548387096774,0.6269006664133187,COMPLETE
36,0.39368203384840394,2026-09-14 23:35:52.901279,2026-09-14 23:36:36.993556,0 days 00:00:44.092277,,,,,64.0,0.13529852923457547,16,5,3,0.2891514667276135,64.0,7.0,3.0,,,,,128,64,5,7,0.5349412095445643,15.0,2,SGD,0.06395605595531824,0.8342194295065007,4.056242764317473e-06,,,,PRUNED
37,0.2912043574800922,2026-09-14 23:36:37.148038,2026-09-14 23:37:36.182084,0 days 00:00:59.034046,,,,,32.0,0.22317109522534495,64,5,1,0.1835922409095435,64.0,7.0,3.0,,,,,128,64,7,7,0.4834384066384883,13.0,2,SGD,0.09584369180912299,0.8809395629743302,3.0990635126868326e-06,,,,PRUNED
38,,2026-09-14 23:37:36.339480,2026-09-14 23:37:36.509280,0 days 00:00:00.169800,,,,,,0.1686591521177298,128,5,3,0.25465335438361203,64.0,7.0,3.0,0.10422027834563105,16.0,7.0,3.0,,64,3,7,,,3,,,,,,,,PRUNED
39,0.7122663561097018,2026-09-14 23:37:36.689160,2026-09-14 23:40:41.129168,0 days 00:03:04.440008,0.9211762462089519,0.923108028259328,0.0002953036283896378,0.0003004994392655018,64.0,0.1313547196192454,128,5,3,0.1796288053458804,64.0,7.0,3.0,,,,,256,64,5,7,0.594954061619303,14.0,2,Adam,,,,49.0,0.7096774193548387,0.714855292864565,COMPLETE
40,0.5991130847716919,2026-09-14 23:40:41.284410,2026-09-14 23:45:14.497932,0 days 00:04:33.213522,0.9279846357906066,0.9264419168458133,0.00032588436148161696,0.0003346010166640396,16.0,0.2021021286837173,16,5,3,0.15696349186613912,64.0,7.0,3.0,,,,,256,64,5,7,0.6121216211601866,17.0,2,Adam,,,,48.0,0.6096774193548387,0.5885487501885451,COMPLETE
41,0.31844582756272016,2026-09-14 23:45:14.651201,2026-09-14 23:45:55.218828,0 days 00:00:40.567627,0.9163359868993455,0.9666571732450828,0.0016469818351521573,0.009941138102772784,64.0,0.12579728285132388,128,5,3,0.20781990821105872,64.0,7.0,3.0,,,,,256,64,5,7,0.5563075704882213,14.0,2,Adam,,,,,,,PRUNED
42,0.3628509748750459,2026-09-14 23:45:55.367148,2026-09-14 23:46:32.318529,0 days 00:00:36.951381,0.9586536483083243,0.9402205510713818,0.009093528690607578,2.2643008841211617e-05,64.0,0.14883782707837442,128,5,3,0.2722016144790114,64.0,7.0,3.0,,,,,256,64,5,7,0.6482553764912755,14.0,2,Adam,,,,,,,PRUNED
43,0.7444256796905928,2026-09-14 23:46:32.466045,2026-09-14 23:49:36.541261,0 days 00:03:04.075216,0.8892116895604629,0.9956037879488793,0.00023846277838643573,0.0010648108239693706,64.0,0.1285734471116471,128,5,3,0.16343437001768907,64.0,7.0,3.0,,,,,256,64,5,7,0.6981190522629597,16.0,2,Adam,,,,50.0,0.7419354838709677,0.7469158755102179,COMPLETE
44,0.6687729724208049,2026-09-14 23:49:36.702078,2026-09-14 23:52:27.844413,0 days 00:02:51.142335,0.8944965261261697,0.9985276634759254,0.000222401453918422,0.0011050586290400248,64.0,0.12622760714797163,32,5,3,0.15383452807479836,64.0,7.0,3.0,,,,,256,64,5,7,0.5863618442908596,16.0,2,Adam,,,,50.0,0.6580645161290323,0.6794814287125777,COMPLETE
45,,2026-09-14 23:52:27.998429,2026-09-14 23:52:28.156291,0 days 00:00:00.157862,,,,,,0.18167899216521,32,5,2,0.1536664584677009,64.0,7.0,3.0,0.49986827850852317,128.0,5.0,3.0,,16,5,7,,,3,,,,,,,,PRUNED
46,0.3698231705555257,2026-09-14 23:52:28.333356,2026-09-14 23:53:09.497504,0 days 00:00:41.164148,0.8971086657907467,0.9993126387779039,0.00023670746339436326,0.0008845189880717421,64.0,0.48800385422440185,32,5,1,0.17141551408329758,64.0,7.0,3.0,,,,,256,64,5,3,0.6897014859244003,16.0,2,Adam,,,,,,,PRUNED
47,0.6704243482182135,2026-09-14 23:53:09.645641,2026-09-14 23:56:36.721752,0 days 00:03:27.076111,0.8936525107830137,0.9838312803487378,0.00020609460649485866,0.001423644885965516,32.0,0.12231971222269268,32,5,3,0.12124668044660229,64.0,7.0,3.0,,,,,256,64,5,7,0.5883813514290757,18.0,2,Adam,,,,40.0,0.667741935483871,0.6731067609525562,COMPLETE
48,0.6955877101682569,2026-09-14 23:56:36.889170,2026-09-15 00:00:09.499082,0 days 00:03:32.609912,0.9161301034240658,0.980429193726068,0.0006356414341441293,0.0003863053712171635,32.0,0.15894130132034495,32,7,3,0.1062904769384269,64.0,7.0,3.0,,,,,256,64,5,7,0.6329122375318491,18.0,2,Adam,,,,47.0,0.6838709677419355,0.7073044525945784,COMPLETE
49,0.5940754545176059,2026-09-15 00:00:09.653566,2026-09-15 00:02:35.013808,0 days 00:02:25.360242,0.924357048897947,0.9737644574849694,0.0008994100577216489,0.0002507438892742407,32.0,0.2404888226558583,32,7,3,0.1053365838923549,32.0,7.0,3.0,,,,,256,16,5,7,0.6396227052355279,18.0,2,Adam,,,,42.0,0.5967741935483871,0.5913767154868247,COMPLETE
