number,value,datetime_start,datetime_complete,duration,params_adam_beta1,params_adam_beta2,params_adam_lr,params_adam_wd,params_batch_size,params_block_0_dropout,params_block_0_filters,params_block_0_kernel,params_block_0_stride,params_block_1_dropout,params_block_1_filters,params_block_1_kernel,params_block_1_stride,params_block_2_dropout,params_block_2_filters,params_block_2_kernel,params_block_2_stride,params_block_3_dropout,params_block_3_filters,params_block_3_kernel,params_block_3_stride,params_block_4_dropout,params_block_4_filters,params_block_4_kernel,params_block_4_stride,params_fc_hidden,params_lr_factor,params_lr_patience,params_n_blocks,params_optimizer,params_sgd_lr,params_sgd_momentum,params_sgd_wd,user_attrs_best_epoch,user_attrs_validation_accuracy,user_attrs_validation_macro_f1,system_attrs_tpe:relative_params:0,state
34,0.7904095535604589,2026-10-04 15:25:46.336349,2026-10-04 15:26:00.321544,0 days 00:00:13.985195,0.8643132245129487,0.9002877119147332,0.00010257572511103322,2.9180873511935278e-05,64.0,0.021857455915237124,32,5,3,0.012166454949419472,16,3,2,0.029524366853822745,128,5,1,0.031830814066426245,64.0,5.0,2.0,,,,,128,0.7630044008318762,9.0,4,Adam,,,,49.0,0.8210059171597633,0.7598131899611545,"{""block_0_dropout"": 0.021857455915237124, ""block_0_filters"": 32, ""block_0_kernel"": 5, ""block_1_dropout"": 0.012166454949419472, ""block_1_filters"": 16, ""block_1_kernel"": 3, ""block_1_stride"": 2, ""block_2_dropout"": 0.029524366853822745, ""block_2_filters"": 128, ""block_2_kernel"": 5, ""block_2_stride"": 1, ""n_blocks"": 4}",COMPLETE
35,,2026-10-04 15:26:00.377166,2026-10-04 15:26:00.395784,0 days 00:00:00.018618,,,,,,0.030288219697990715,32,5,3,0.021560636697004493,64,3,2,0.026135758436985755,128,5,1,0.04149712304911844,64.0,5.0,2.0,0.021255418654561216,128.0,3.0,1.0,,,,5,,,,,,,,"{""block_0_dropout"": 0.030288219697990715, ""block_0_filters"": 32, ""block_0_kernel"": 5, ""block_1_dropout"": 0.021560636697004493, ""block_1_filters"": 64, ""block_1_kernel"": 3, ""block_1_stride"": 2, ""block_2_dropout"": 0.026135758436985755, ""block_2_filters"": 128, ""block_2_kernel"": 5, ""block_2_stride"": 1, ""n_blocks"": 5}",PRUNED
36,0.3753227330949147,2026-10-04 15:26:00.457084,2026-10-04 15:26:03.865566,0 days 00:00:03.408482,0.862387569574997,0.9235940329133578,0.0007635962276164285,0.00010865614892421054,64.0,0.037820027461378115,16,5,3,0.019455803249523222,64,3,1,0.023016916864391578,128,5,1,0.035546246771901456,128.0,5.0,2.0,0.032820998987181216,256.0,3.0,1.0,128,0.8509890867427247,6.0,5,Adam,,,,,,,"{""block_0_dropout"": 0.037820027461378115, ""block_0_filters"": 16, ""block_0_kernel"": 5, ""block_1_dropout"": 0.019455803249523222, ""block_1_filters"": 64, ""block_1_kernel"": 3, ""block_1_stride"": 1, ""block_2_dropout"": 0.023016916864391578, ""block_2_filters"": 128, ""block_2_kernel"": 5, ""block_2_stride"": 1, ""n_blocks"": 5}",PRUNED
37,0.09916133421514052,2026-10-04 15:26:03.922505,2026-10-04 15:26:10.545817,0 days 00:00:06.623312,,,,,64.0,0.04674908338762662,16,5,3,0.016552854279094975,64,3,1,0.03790460918702621,128,5,1,0.03885848202829216,256.0,3.0,1.0,0.01728459871452355,256.0,3.0,1.0,256,0.8989499767719364,8.0,5,SGD,0.09531134218732039,0.9755927883076517,0.0077955204414085,,,,"{""block_0_dropout"": 0.04674908338762662, ""block_0_filters"": 16, ""block_0_kernel"": 5, ""block_1_dropout"": 0.016552854279094975, ""block_1_filters"": 64, ""block_1_kernel"": 3, ""block_1_stride"": 1, ""block_2_dropout"": 0.03790460918702621, ""block_2_filters"": 128, ""block_2_kernel"": 5, ""block_2_stride"": 1, ""n_blocks"": 5}",PRUNED
38,0.8519149700584228,2026-10-04 15:26:10.607180,2026-10-04 15:26:24.051810,0 days 00:00:13.444630,0.8585693051597436,0.9110292695828339,0.00018616324033833873,0.0022175876832867536,64.0,0.045816982087823345,32,5,3,0.01829545504526042,64,3,2,0.03923949965714756,128,5,1,0.03326235380812688,64.0,5.0,2.0,,,,,128,0.756892222150673,6.0,4,Adam,,,,41.0,0.878698224852071,0.8251317152647745,"{""block_0_dropout"": 0.045816982087823345, ""block_0_filters"": 32, ""block_0_kernel"": 5, ""block_1_dropout"": 0.01829545504526042, ""block_1_filters"": 64, ""block_1_kernel"": 3, ""block_1_stride"": 2, ""block_2_dropout"": 0.03923949965714756, ""block_2_filters"": 128, ""block_2_kernel"": 5, ""block_2_stride"": 1, ""n_blocks"": 4}",COMPLETE
39,0.8618373619631446,2026-10-04 15:26:24.108393,2026-10-04 15:26:39.472297,0 days 00:00:15.363904,0.850568731703374,0.9109679959349013,0.0003025071360154749,0.00039084018962828523,64.0,0.012424445005576764,32,5,3,0.022031738666001267,64,3,2,0.030873097924677184,128,5,1,0.04938316331089104,64.0,5.0,2.0,,,,,128,0.6544187681563811,8.0,4,Adam,,,,49.0,0.886094674556213,0.8375800493700762,"{""block_0_dropout"": 0.012424445005576764, ""block_0_filters"": 32, ""block_0_kernel"": 5, ""block_1_dropout"": 0.022031738666001267, ""block_1_filters"": 64, ""block_1_kernel"": 3, ""block_1_stride"": 2, ""block_2_dropout"": 0.030873097924677184, ""block_2_filters"": 128, ""block_2_kernel"": 5, ""block_2_stride"": 1, ""n_blocks"": 4}",COMPLETE
40,0.31950355946637876,2026-10-04 15:26:39.540564,2026-10-04 15:26:41.963445,0 days 00:00:02.422881,,,,,128.0,0.015016660131398647,32,5,3,0.029312753781898508,64,3,2,0.03668553340123159,128,5,1,0.049487865880930126,128.0,3.0,1.0,,,,,512,0.34360668189894883,13.0,4,SGD,0.00812537926122702,0.8119418944004533,0.00030203584633877275,,,,"{""block_0_dropout"": 0.015016660131398647, ""block_0_filters"": 32, ""block_0_kernel"": 5, ""block_1_dropout"": 0.029312753781898508, ""block_1_filters"": 64, ""block_1_kernel"": 3, ""block_1_stride"": 2, ""block_2_dropout"": 0.03668553340123159, ""block_2_filters"": 128, ""block_2_kernel"": 5, ""block_2_stride"": 1, ""n_blocks"": 4}",PRUNED
41,0.8368406716280479,2026-10-04 15:26:42.019060,2026-10-04 15:26:55.111448,0 days 00:00:13.092388,0.850237129353526,0.91014916361918,0.0003358497536561029,0.00038474675940861774,64.0,0.012728879467565636,32,5,3,0.01969281303044606,64,3,2,0.03518795504933841,128,5,1,0.010490502663269102,64.0,5.0,2.0,,,,,128,0.38479440164950524,9.0,4,Adam,,,,39.0,0.871301775147929,0.8023795681081669,"{""block_0_dropout"": 0.012728879467565636, ""block_0_filters"": 32, ""block_0_kernel"": 5, ""block_1_dropout"": 0.01969281303044606, ""block_1_filters"": 64, ""block_1_kernel"": 3, ""block_1_stride"": 2, ""block_2_dropout"": 0.03518795504933841, ""block_2_filters"": 128, ""block_2_kernel"": 5, ""block_2_stride"": 1, ""n_blocks"": 4}",COMPLETE
42,0.835831756804785,2026-10-04 15:26:55.167284,2026-10-04 15:27:09.235800,0 days 00:00:14.068516,0.8674259109489765,0.9223363023752155,0.00021163435095727104,0.0005832341134554624,64.0,0.018009320936619992,32,5,3,0.011833032457492926,64,3,2,0.03657602038484166,128,5,1,0.0461996340483471,64.0,5.0,2.0,,,,,128,0.6596051706839139,8.0,4,Adam,,,,38.0,0.856508875739645,0.8151546378699251,"{""block_0_dropout"": 0.018009320936619992, ""block_0_filters"": 32, ""block_0_kernel"": 5, ""block_1_dropout"": 0.011833032457492926, ""block_1_filters"": 64, ""block_1_kernel"": 3, ""block_1_stride"": 2, ""block_2_dropout"": 0.03657602038484166, ""block_2_filters"": 128, ""block_2_kernel"": 5, ""block_2_stride"": 1, ""n_blocks"": 4}",COMPLETE
43,0.8262688759819956,2026-10-04 15:27:09.301425,2026-10-04 15:27:21.941394,0 days 00:00:12.639969,0.8505602860752268,0.9091480598004206,0.00015255015693590898,0.00010525562955866675,128.0,0.029469820713047334,32,5,3,0.024178076514839723,64,3,2,0.04764451525665299,128,5,1,0.040572620911460695,64.0,5.0,2.0,,,,,128,0.4847624366347311,6.0,4,Adam,,,,44.0,0.8594674556213018,0.7930702963426893,"{""block_0_dropout"": 0.029469820713047334, ""block_0_filters"": 32, ""block_0_kernel"": 5, ""block_1_dropout"": 0.024178076514839723, ""block_1_filters"": 64, ""block_1_kernel"": 3, ""block_1_stride"": 2, ""block_2_dropout"": 0.04764451525665299, ""block_2_filters"": 128, ""block_2_kernel"": 5, ""block_2_stride"": 1, ""n_blocks"": 4}",COMPLETE
44,0.4009641049356253,2026-10-04 15:27:22.009011,2026-10-04 15:27:24.453976,0 days 00:00:02.444965,0.8760858151012554,0.9180814310587042,0.00033493017681927634,0.00025509593367185055,64.0,0.01829987255565959,32,5,3,0.02491302117426801,64,3,2,0.038459555913935496,128,5,1,,,,,,,,,256,0.10764672998968366,11.0,3,Adam,,,,,,,"{""block_0_dropout"": 0.01829987255565959, ""block_0_filters"": 32, ""block_0_kernel"": 5, ""block_1_dropout"": 0.02491302117426801, ""block_1_filters"": 64, ""block_1_kernel"": 3, ""block_1_stride"": 2, ""block_2_dropout"": 0.038459555913935496, ""block_2_filters"": 128, ""block_2_kernel"": 5, ""block_2_stride"": 1, ""n_blocks"": 3}",PRUNED
45,0.8535981997005679,2026-10-04 15:27:24.512888,2026-10-04 15:27:37.930919,0 days 00:00:13.418031,0.8612863334562801,0.9291856145720495,0.0007272197269339581,0.0012694309911486297,64.0,0.022198519085540026,32,5,3,0.019231543691679707,64,3,2,0.040455917254194916,128,5,1,0.03022224690438165,64.0,5.0,2.0,,,,,128,0.8425948925742562,5.0,4,Adam,,,,40.0,0.8698224852071006,0.8373739141940354,"{""block_0_dropout"": 0.022198519085540026, ""block_0_filters"": 32, ""block_0_kernel"": 5, ""block_1_dropout"": 0.019231543691679707, ""block_1_filters"": 64, ""block_1_kernel"": 3, ""block_1_stride"": 2, ""block_2_dropout"": 0.040455917254194916, ""block_2_filters"": 128, ""block_2_kernel"": 5, ""block_2_stride"": 1, ""n_blocks"": 4}",COMPLETE
46,0.45999879792053733,2026-10-04 15:27:38.003097,2026-10-04 15:27:41.124431,0 days 00:00:03.121334,,,,,64.0,0.02207690859692169,32,5,3,0.01702493688247182,64,3,1,0.014318945297949007,128,5,1,0.0267866514457027,64.0,3.0,2.0,0.031678705265910316,128.0,3.0,1.0,128,0.8461215303038976,5.0,5,SGD,0.011135322869291248,0.8078436334157676,1.0040115722749957e-06,,,,"{""block_0_dropout"": 0.02207690859692169, ""block_0_filters"": 32, ""block_0_kernel"": 5, ""block_1_dropout"": 0.01702493688247182, ""block_1_filters"": 64, ""block_1_kernel"": 3, ""block_1_stride"": 1, ""block_2_dropout"": 0.014318945297949007, ""block_2_filters"": 128, ""block_2_kernel"": 5, ""block_2_stride"": 1, ""n_blocks"": 5}",PRUNED
47,0.44534221310208655,2026-10-04 15:27:41.198345,2026-10-04 15:27:43.994030,0 days 00:00:02.795685,0.8619195287453139,0.9312681482019718,0.0008691391105826633,0.001769152970494217,64.0,0.02165157479213738,32,5,3,0.02102346622735459,64,3,2,0.0439094198341263,128,5,1,,,,,,,,,512,0.7509373830519439,6.0,3,Adam,,,,,,,"{""block_0_dropout"": 0.02165157479213738, ""block_0_filters"": 32, ""block_0_kernel"": 5, ""block_1_dropout"": 0.02102346622735459, ""block_1_filters"": 64, ""block_1_kernel"": 3, ""block_1_stride"": 2, ""block_2_dropout"": 0.0439094198341263, ""block_2_filters"": 128, ""block_2_kernel"": 5, ""block_2_stride"": 1, ""n_blocks"": 3}",PRUNED
48,0.4587959434229565,2026-10-04 15:27:44.047404,2026-10-04 15:27:46.421006,0 days 00:00:02.373602,0.8912874625750636,0.9431319276378067,0.0009715628008196503,0.0016751488526381586,128.0,0.019303153385448735,32,5,3,0.026945068412181247,64,3,2,0.02674680597741528,128,5,1,0.030277352947036137,256.0,5.0,1.0,,,,,256,0.6489923580371058,5.0,4,Adam,,,,,,,"{""block_0_dropout"": 0.019303153385448735, ""block_0_filters"": 32, ""block_0_kernel"": 5, ""block_1_dropout"": 0.026945068412181247, ""block_1_filters"": 64, ""block_1_kernel"": 3, ""block_1_stride"": 2, ""block_2_dropout"": 0.02674680597741528, ""block_2_filters"": 128, ""block_2_kernel"": 5, ""block_2_stride"": 1, ""n_blocks"": 4}",PRUNED
49,0.2992263045901087,2026-10-04 15:27:46.477498,2026-10-04 15:27:49.731954,0 days 00:00:03.254456,,,,,64.0,0.014754560570315042,32,5,3,0.01724450768771308,64,3,2,0.019020900161563832,128,5,1,0.03457038056292667,128.0,5.0,2.0,,,,,128,0.8063017492120416,7.0,4,SGD,0.00021657378233613667,0.7972248447559067,0.0006083414475530486,,,,"{""block_0_dropout"": 0.014754560570315042, ""block_0_filters"": 32, ""block_0_kernel"": 5, ""block_1_dropout"": 0.01724450768771308, ""block_1_filters"": 64, ""block_1_kernel"": 3, ""block_1_stride"": 2, ""block_2_dropout"": 0.019020900161563832, ""block_2_filters"": 128, ""block_2_kernel"": 5, ""block_2_stride"": 1, ""n_blocks"": 4}",PRUNED
50,0.337889714743001,2026-10-04 15:27:49.793187,2026-10-04 15:27:52.376386,0 days 00:00:02.583199,0.9855376349259064,0.9248349950448818,0.0017732326079922807,0.004797769898608764,64.0,0.03345402850352208,32,5,3,0.017450174431180056,64,3,2,0.02925596873144051,128,5,1,0.01875758910414496,64.0,3.0,2.0,,,,,128,0.5377407925808634,6.0,4,Adam,,,,,,,"{""block_0_dropout"": 0.03345402850352208, ""block_0_filters"": 32, ""block_0_kernel"": 5, ""block_1_dropout"": 0.017450174431180056, ""block_1_filters"": 64, ""block_1_kernel"": 3, ""block_1_stride"": 2, ""block_2_dropout"": 0.02925596873144051, ""block_2_filters"": 128, ""block_2_kernel"": 5, ""block_2_stride"": 1, ""n_blocks"": 4}",PRUNED
51,0.49106926264591544,2026-10-04 15:27:52.433440,2026-10-04 15:27:55.969571,0 days 00:00:03.536131,0.8591315935410483,0.9315761350497043,0.0005872780135738976,0.0011169198286487198,64.0,0.024190777804235702,32,5,3,0.024148573136987768,64,3,1,0.022429600774075565,128,5,1,0.029845021044449756,64.0,5.0,2.0,0.03792246005323477,512.0,3.0,1.0,128,0.8556662243296661,8.0,5,Adam,,,,,,,"{""block_0_dropout"": 0.024190777804235702, ""block_0_filters"": 32, ""block_0_kernel"": 5, ""block_1_dropout"": 0.024148573136987768, ""block_1_filters"": 64, ""block_1_kernel"": 3, ""block_1_stride"": 1, ""block_2_dropout"": 0.022429600774075565, ""block_2_filters"": 128, ""block_2_kernel"": 5, ""block_2_stride"": 1, ""n_blocks"": 5}",PRUNED
52,0.839341868010961,2026-10-04 15:27:56.022561,2026-10-04 15:28:09.130077,0 days 00:00:13.107516,0.8585356432944045,0.9075161312564577,0.0002539967900638409,0.00036092327154449373,64.0,0.02115190146801409,32,5,3,0.016535034693539227,64,3,2,0.029647835334616516,128,5,1,0.031154660033344744,64.0,5.0,2.0,,,,,128,0.8474075392045051,18.0,4,Adam,,,,48.0,0.8757396449704142,0.8029440910515079,"{""block_0_dropout"": 0.02115190146801409, ""block_0_filters"": 32, ""block_0_kernel"": 5, ""block_1_dropout"": 0.016535034693539227, ""block_1_filters"": 64, ""block_1_kernel"": 3, ""block_1_stride"": 2, ""block_2_dropout"": 0.029647835334616516, ""block_2_filters"": 128, ""block_2_kernel"": 5, ""block_2_stride"": 1, ""n_blocks"": 4}",COMPLETE
53,0.8535500232044398,2026-10-04 15:28:09.182615,2026-10-04 15:28:22.853083,0 days 00:00:13.670468,0.8697364343080908,0.91589457249157,0.00013211985684490768,5.7664953220429255e-05,64.0,0.026090788967224943,32,5,3,0.019923564870967417,64,3,2,0.03949421545438096,128,5,1,0.03772006469667283,64.0,5.0,2.0,,,,,128,0.7990573503136443,8.0,4,Adam,,,,40.0,0.8831360946745562,0.8239639517343235,"{""block_0_dropout"": 0.026090788967224943, ""block_0_filters"": 32, ""block_0_kernel"": 5, ""block_1_dropout"": 0.019923564870967417, ""block_1_filters"": 64, ""block_1_kernel"": 3, ""block_1_stride"": 2, ""block_2_dropout"": 0.03949421545438096, ""block_2_filters"": 128, ""block_2_kernel"": 5, ""block_2_stride"": 1, ""n_blocks"": 4}",COMPLETE
54,0.8338955038052132,2026-10-04 15:28:22.906338,2026-10-04 15:28:36.780151,0 days 00:00:13.873813,0.8707415808752041,0.9385989187114129,0.00012561718262314213,3.853851852862292e-05,64.0,0.02631371996788999,32,5,3,0.012417339886317552,64,3,2,0.03334332730621221,128,5,1,0.033652271237687485,64.0,5.0,2.0,,,,,128,0.7853451049593251,10.0,4,Adam,,,,35.0,0.8550295857988166,0.8127614218116098,"{""block_0_dropout"": 0.02631371996788999, ""block_0_filters"": 32, ""block_0_kernel"": 5, ""block_1_dropout"": 0.012417339886317552, ""block_1_filters"": 64, ""block_1_kernel"": 3, ""block_1_stride"": 2, ""block_2_dropout"": 0.03334332730621221, ""block_2_filters"": 128, ""block_2_kernel"": 5, ""block_2_stride"": 1, ""n_blocks"": 4}",COMPLETE
55,0.8377809810077788,2026-10-04 15:28:36.835364,2026-10-04 15:28:47.113155,0 days 00:00:10.277791,0.9616899996126766,0.927840063271207,0.00017583581287529764,0.0001580410502456064,200.0,0.01812027972493425,32,5,3,0.02374614770221981,64,3,2,0.04846057408176706,128,5,1,0.027501345194582413,64.0,5.0,2.0,,,,,512,0.8064734868181802,5.0,4,Adam,,,,35.0,0.8624260355029586,0.8131359265125988,"{""block_0_dropout"": 0.01812027972493425, ""block_0_filters"": 32, ""block_0_kernel"": 5, ""block_1_dropout"": 0.02374614770221981, ""block_1_filters"": 64, ""block_1_kernel"": 3, ""block_1_stride"": 2, ""block_2_dropout"": 0.04846057408176706, ""block_2_filters"": 128, ""block_2_kernel"": 5, ""block_2_stride"": 1, ""n_blocks"": 4}",COMPLETE
56,0.8591827542228454,2026-10-04 15:28:47.190665,2026-10-04 15:29:03.305839,0 days 00:00:16.115174,0.8839093867212419,0.9955591314775023,0.0001394868927007164,0.0005173611107810959,64.0,0.01941022003789298,32,5,3,0.012979482552901066,64,3,1,0.015366113111538331,128,5,1,0.03694617718554822,64.0,5.0,2.0,0.015019031310543126,256.0,3.0,1.0,128,0.7382147989061565,7.0,5,Adam,,,,50.0,0.8698224852071006,0.8485430232385903,"{""block_0_dropout"": 0.01941022003789298, ""block_0_filters"": 32, ""block_0_kernel"": 5, ""block_1_dropout"": 0.012979482552901066, ""block_1_filters"": 64, ""block_1_kernel"": 3, ""block_1_stride"": 1, ""block_2_dropout"": 0.015366113111538331, ""block_2_filters"": 128, ""block_2_kernel"": 5, ""block_2_stride"": 1, ""n_blocks"": 5}",COMPLETE
57,0.8426332577760622,2026-10-04 15:29:03.360015,2026-10-04 15:29:17.293663,0 days 00:00:13.933648,0.8855423656310599,0.9912509922865916,0.00022230453080035364,0.0005522931522061494,64.0,0.018746265674461214,32,5,3,0.018404532201182267,64,3,2,0.023228801885261267,128,5,1,0.032290622204877564,64.0,5.0,2.0,,,,,128,0.635359173131405,6.0,4,Adam,,,,47.0,0.8668639053254438,0.8184026102266808,"{""block_0_dropout"": 0.018746265674461214, ""block_0_filters"": 32, ""block_0_kernel"": 5, ""block_1_dropout"": 0.018404532201182267, ""block_1_filters"": 64, ""block_1_kernel"": 3, ""block_1_stride"": 2, ""block_2_dropout"": 0.023228801885261267, ""block_2_filters"": 128, ""block_2_kernel"": 5, ""block_2_stride"": 1, ""n_blocks"": 4}",COMPLETE
58,0.4243278941541123,2026-10-04 15:29:17.350190,2026-10-04 15:29:25.892343,0 days 00:00:08.542153,0.9104282774938531,0.9766491753310825,0.0001776917116842915,0.0011247899576487977,200.0,0.013851606078357984,32,5,3,0.012689549934578659,64,3,1,0.01192111631270006,128,5,1,0.020826736051460563,256.0,5.0,1.0,0.01630559480761821,256.0,3.0,1.0,128,0.7346713248328867,7.0,5,Adam,,,,,,,"{""block_0_dropout"": 0.013851606078357984, ""block_0_filters"": 32, ""block_0_kernel"": 5, ""block_1_dropout"": 0.012689549934578659, ""block_1_filters"": 64, ""block_1_kernel"": 3, ""block_1_stride"": 1, ""block_2_dropout"": 0.01192111631270006, ""block_2_filters"": 128, ""block_2_kernel"": 5, ""block_2_stride"": 1, ""n_blocks"": 5}",PRUNED
59,0.38277272489005343,2026-10-04 15:29:25.944905,2026-10-04 15:29:28.626176,0 days 00:00:02.681271,0.8959297093115673,0.9744809566300012,0.005224966284196257,0.0002547881227539489,64.0,0.01968789367319714,32,5,3,0.019890635363229568,64,3,2,0.034121136155605275,128,5,1,0.0408392381738288,64.0,5.0,2.0,,,,,128,0.5756761309879137,5.0,4,Adam,,,,,,,"{""block_0_dropout"": 0.01968789367319714, ""block_0_filters"": 32, ""block_0_kernel"": 5, ""block_1_dropout"": 0.019890635363229568, ""block_1_filters"": 64, ""block_1_kernel"": 3, ""block_1_stride"": 2, ""block_2_dropout"": 0.034121136155605275, ""block_2_filters"": 128, ""block_2_kernel"": 5, ""block_2_stride"": 1, ""n_blocks"": 4}",PRUNED
60,0.3166522777526853,2026-10-04 15:29:28.678797,2026-10-04 15:29:31.832258,0 days 00:00:03.153461,0.8794873547695687,0.9977565456913301,0.001600490175103673,0.003097883813710955,64.0,0.027916067855843774,32,5,3,0.013680853806427066,64,3,1,0.016614862198195118,128,5,1,0.02880231264816421,64.0,3.0,2.0,0.01635143296588607,256.0,3.0,1.0,512,0.6856165873790154,6.0,5,Adam,,,,,,,"{""block_0_dropout"": 0.027916067855843774, ""block_0_filters"": 32, ""block_0_kernel"": 5, ""block_1_dropout"": 0.013680853806427066, ""block_1_filters"": 64, ""block_1_kernel"": 3, ""block_1_stride"": 1, ""block_2_dropout"": 0.016614862198195118, ""block_2_filters"": 128, ""block_2_kernel"": 5, ""block_2_stride"": 1, ""n_blocks"": 5}",PRUNED
61,0.4579480830897088,2026-10-04 15:29:31.893378,2026-10-04 15:29:34.262974,0 days 00:00:02.369596,0.8592584707672255,0.9622361388482302,0.00013347727714406696,1.788818729597077e-05,64.0,0.023875772696227437,32,5,3,0.011615240084071525,64,3,2,0.035237427975324545,128,5,1,,,,,,,,,128,0.7852519327284373,7.0,3,Adam,,,,,,,"{""block_0_dropout"": 0.023875772696227437, ""block_0_filters"": 32, ""block_0_kernel"": 5, ""block_1_dropout"": 0.011615240084071525, ""block_1_filters"": 64, ""block_1_kernel"": 3, ""block_1_stride"": 2, ""block_2_dropout"": 0.035237427975324545, ""block_2_filters"": 128, ""block_2_kernel"": 5, ""block_2_stride"": 1, ""n_blocks"": 3}",PRUNED
62,0.48945352957229976,2026-10-04 15:29:34.336324,2026-10-04 15:29:37.702993,0 days 00:00:03.366669,0.8722130598916427,0.9040951244827601,0.00013811125489846812,0.000167666066084795,64.0,0.018771252250324878,32,5,3,0.014317770497664115,64,3,1,0.03678667195495908,128,5,1,0.03638428785497558,64.0,5.0,2.0,0.0237884781892869,256.0,3.0,1.0,128,0.8674301666843177,8.0,5,Adam,,,,,,,"{""block_0_dropout"": 0.018771252250324878, ""block_0_filters"": 32, ""block_0_kernel"": 5, ""block_1_dropout"": 0.014317770497664115, ""block_1_filters"": 64, ""block_1_kernel"": 3, ""block_1_stride"": 1, ""block_2_dropout"": 0.03678667195495908, ""block_2_filters"": 128, ""block_2_kernel"": 5, ""block_2_stride"": 1, ""n_blocks"": 5}",PRUNED
