number,value,datetime_start,datetime_complete,duration,params_adam_beta1,params_adam_beta2,params_adam_lr,params_adam_wd,params_batch_size,params_block_0_dropout,params_block_0_filters,params_block_0_kernel,params_block_0_stride,params_block_1_dropout,params_block_1_filters,params_block_1_kernel,params_block_1_stride,params_block_2_dropout,params_block_2_filters,params_block_2_kernel,params_block_2_stride,params_block_3_dropout,params_block_3_filters,params_block_3_kernel,params_block_3_stride,params_block_4_dropout,params_block_4_filters,params_block_4_kernel,params_block_4_stride,params_fc_hidden,params_lr_factor,params_lr_patience,params_n_blocks,params_optimizer,params_sgd_lr,params_sgd_momentum,params_sgd_wd,user_attrs_best_epoch,user_attrs_validation_accuracy,user_attrs_validation_macro_f1,system_attrs_tpe:relative_params:0,state
92,0.882738142885267,2026-10-04 15:33:13.237957,2026-10-04 15:33:33.511851,0 days 00:00:20.273894,0.9376658195881096,0.9342161603503113,0.00019995749155747483,0.0007875888511961848,64.0,0.014022031949569,32,5,3,0.010014155943363409,64,3,1,0.015610157916206015,128,5,1,0.04704369226806285,256.0,5.0,2.0,0.015530430510703038,256.0,3.0,1.0,128,0.6650893261493425,7.0,5,Adam,,,,42.0,0.9053254437869822,0.8601508419835519,"{""block_0_dropout"": 0.014022031949569, ""block_0_filters"": 32, ""block_0_kernel"": 5, ""block_1_dropout"": 0.010014155943363409, ""block_1_filters"": 64, ""block_1_kernel"": 3, ""block_1_stride"": 1, ""block_2_dropout"": 0.015610157916206015, ""block_2_filters"": 128, ""block_2_kernel"": 5, ""block_2_stride"": 1, ""n_blocks"": 5}",COMPLETE
93,0.6001804804445936,2026-10-04 15:33:33.569473,2026-10-04 15:33:38.100993,0 days 00:00:04.531520,0.936187212993786,0.9342915586509177,0.0002001574241158541,0.0008325534829346324,64.0,0.010777040037415704,32,5,3,0.012865007016485158,64,3,1,0.018297242656501223,128,5,1,0.04729284402623739,256.0,5.0,2.0,0.015508891848723772,256.0,3.0,1.0,128,0.670237047200331,6.0,5,Adam,,,,,,,"{""block_0_dropout"": 0.010777040037415704, ""block_0_filters"": 32, ""block_0_kernel"": 5, ""block_1_dropout"": 0.012865007016485158, ""block_1_filters"": 64, ""block_1_kernel"": 3, ""block_1_stride"": 1, ""block_2_dropout"": 0.018297242656501223, ""block_2_filters"": 128, ""block_2_kernel"": 5, ""block_2_stride"": 1, ""n_blocks"": 5}",PRUNED
94,0.8574005646051204,2026-10-04 15:33:38.160423,2026-10-04 15:33:50.846935,0 days 00:00:12.686512,0.9404970045347834,0.9261447181754714,0.00018309058487906685,0.0006797124555383682,64.0,0.017295846283117512,32,5,3,0.015517079863784438,64,3,2,0.024366987635224165,128,5,1,0.04554214490157854,256.0,5.0,2.0,,,,,128,0.7107234491398404,7.0,4,Adam,,,,47.0,0.8757396449704142,0.8390614842398264,"{""block_0_dropout"": 0.017295846283117512, ""block_0_filters"": 32, ""block_0_kernel"": 5, ""block_1_dropout"": 0.015517079863784438, ""block_1_filters"": 64, ""block_1_kernel"": 3, ""block_1_stride"": 2, ""block_2_dropout"": 0.024366987635224165, ""block_2_filters"": 128, ""block_2_kernel"": 5, ""block_2_stride"": 1, ""n_blocks"": 4}",COMPLETE
95,0.4903941952919414,2026-10-04 15:33:50.900005,2026-10-04 15:33:54.590885,0 days 00:00:03.690880,0.9409965866225721,0.9255100325660178,0.00019035155321947593,0.0006618644066355973,64.0,0.043840429193077304,16,5,3,0.022081292289422648,64,3,1,0.025322280991859413,128,5,1,0.04507698745342197,256.0,5.0,2.0,0.012437049481954777,256.0,3.0,1.0,128,0.6493128602737147,7.0,5,Adam,,,,,,,"{""block_0_dropout"": 0.043840429193077304, ""block_0_filters"": 16, ""block_0_kernel"": 5, ""block_1_dropout"": 0.022081292289422648, ""block_1_filters"": 64, ""block_1_kernel"": 3, ""block_1_stride"": 1, ""block_2_dropout"": 0.025322280991859413, ""block_2_filters"": 128, ""block_2_kernel"": 5, ""block_2_stride"": 1, ""n_blocks"": 5}",PRUNED
96,0.8815833446204591,2026-10-04 15:33:54.648312,2026-10-04 15:34:13.293838,0 days 00:00:18.645526,0.9225946617710761,0.9301505444636408,0.00023212117819966543,0.0015355604919223358,64.0,0.023367917923958925,32,5,3,0.015974403575929087,64,3,1,0.011807470864089096,128,5,1,0.04832500603565953,256.0,5.0,2.0,0.017453831852003228,256.0,3.0,1.0,128,0.7004474338957296,7.0,5,Adam,,,,37.0,0.8964497041420119,0.8667169850989064,"{""block_0_dropout"": 0.023367917923958925, ""block_0_filters"": 32, ""block_0_kernel"": 5, ""block_1_dropout"": 0.015974403575929087, ""block_1_filters"": 64, ""block_1_kernel"": 3, ""block_1_stride"": 1, ""block_2_dropout"": 0.011807470864089096, ""block_2_filters"": 128, ""block_2_kernel"": 5, ""block_2_stride"": 1, ""n_blocks"": 5}",COMPLETE
97,0.5474396016907406,2026-10-04 15:34:13.353030,2026-10-04 15:34:17.976668,0 days 00:00:04.623638,0.9491318416516216,0.9301343502594795,0.00023829830979961873,0.0015772603592262553,64.0,0.013204286790704428,32,5,3,0.010716140800628703,64,3,1,0.027591552914586093,128,5,1,0.0483975994340487,256.0,3.0,2.0,0.018112757226836307,256.0,3.0,1.0,128,0.6872206184688481,8.0,5,Adam,,,,,,,"{""block_0_dropout"": 0.013204286790704428, ""block_0_filters"": 32, ""block_0_kernel"": 5, ""block_1_dropout"": 0.010716140800628703, ""block_1_filters"": 64, ""block_1_kernel"": 3, ""block_1_stride"": 1, ""block_2_dropout"": 0.027591552914586093, ""block_2_filters"": 128, ""block_2_kernel"": 5, ""block_2_stride"": 1, ""n_blocks"": 5}",PRUNED
98,0.58389654070934,2026-10-04 15:34:18.037652,2026-10-04 15:34:23.591328,0 days 00:00:05.553676,0.9235906708861045,0.9218374431355034,0.0001722999259651375,0.0030326763379847845,64.0,0.018718457716162207,32,5,3,0.010180095679860534,64,3,1,0.018692700695933588,128,5,1,0.04371035046899841,256.0,5.0,2.0,0.04526654943488855,128.0,3.0,1.0,128,0.5927024276091357,7.0,5,Adam,,,,,,,"{""block_0_dropout"": 0.018718457716162207, ""block_0_filters"": 32, ""block_0_kernel"": 5, ""block_1_dropout"": 0.010180095679860534, ""block_1_filters"": 64, ""block_1_kernel"": 3, ""block_1_stride"": 1, ""block_2_dropout"": 0.018692700695933588, ""block_2_filters"": 128, ""block_2_kernel"": 5, ""block_2_stride"": 1, ""n_blocks"": 5}",PRUNED
99,0.616447426810903,2026-10-04 15:34:23.664437,2026-10-04 15:34:28.720387,0 days 00:00:05.055950,0.9174870905910801,0.9328757452953875,0.00014858916996970852,0.0009984388969802493,128.0,0.01564649637737039,32,5,3,0.015823416274718668,64,3,1,0.018210765241672693,128,5,1,0.045038377439085585,256.0,5.0,2.0,0.0215717030284042,512.0,3.0,1.0,128,0.6258001203089932,7.0,5,Adam,,,,,,,"{""block_0_dropout"": 0.01564649637737039, ""block_0_filters"": 32, ""block_0_kernel"": 5, ""block_1_dropout"": 0.015823416274718668, ""block_1_filters"": 64, ""block_1_kernel"": 3, ""block_1_stride"": 1, ""block_2_dropout"": 0.018210765241672693, ""block_2_filters"": 128, ""block_2_kernel"": 5, ""block_2_stride"": 1, ""n_blocks"": 5}",PRUNED
