number,value,datetime_start,datetime_complete,duration,params_adam_beta1,params_adam_beta2,params_adam_lr,params_adam_wd,params_batch_size,params_block_0_dropout,params_block_0_filters,params_block_0_kernel,params_block_0_stride,params_block_1_dropout,params_block_1_filters,params_block_1_kernel,params_block_1_stride,params_block_2_dropout,params_block_2_filters,params_block_2_kernel,params_block_2_stride,params_block_3_dropout,params_block_3_filters,params_block_3_kernel,params_block_3_stride,params_block_4_dropout,params_block_4_filters,params_block_4_kernel,params_block_4_stride,params_fc_hidden,params_lr_factor,params_lr_patience,params_n_blocks,params_optimizer,params_sgd_lr,params_sgd_momentum,params_sgd_wd,user_attrs_best_epoch,user_attrs_validation_accuracy,user_attrs_validation_macro_f1,system_attrs_tpe:relative_params:0,state
0,0.25764057402186663,2026-10-04 15:20:33.908001,2026-10-04 15:20:43.412829,0 days 00:00:09.504828,,,,,128.0,0.012323344486727979,8,7,3,0.017336180394137354,16,5,2,0.02465447373174767,64,3,1,0.016820964947491662,128.0,3.0,1.0,,,,,512,0.19763058787582308,12.0,4,SGD,0.00019634341572933326,0.8984275776885255,5.762487216478604e-05,47.0,0.26479289940828404,0.2504882486354492,,COMPLETE
1,0.2900911432858012,2026-10-04 15:20:43.464396,2026-10-04 15:20:55.873137,0 days 00:00:12.408741,,,,,128.0,0.041005312934444586,32,5,3,0.02554709158757928,16,7,1,0.012982025747190833,64,3,1,0.04085081386743783,64.0,3.0,1.0,,,,,256,0.36014665762139764,16.0,4,SGD,0.0009833181933644897,0.7184319215829468,1.753594952976443e-05,50.0,0.30177514792899407,0.2784071386426083,,COMPLETE
2,0.4179081058353646,2026-10-04 15:20:55.935722,2026-10-04 15:21:04.474250,0 days 00:00:08.538528,0.9754527819892891,0.9317685471496893,0.0011986281799901185,0.0016973078532467015,200.0,0.030909313175279764,16,7,3,0.019971689165955,16,5,1,0.04232481518257668,64,3,1,,,,,,,,,256,0.18804153962214143,8.0,3,Adam,,,,48.0,0.42159763313609466,0.4142185785346345,,COMPLETE
3,0.6110388278801543,2026-10-04 15:21:04.600564,2026-10-04 15:21:17.410817,0 days 00:00:12.810253,0.9519502888056603,0.9367415349586534,0.003336101309469784,8.923807143379781e-06,200.0,0.04771638815650077,8,5,3,0.022035132392670787,64,5,1,0.019582475626678898,128,5,1,,,,,,,,,512,0.6058446644748636,15.0,3,Adam,,,,50.0,0.6331360946745562,0.5889415610857524,,COMPLETE
4,0.391759383816004,2026-10-04 15:21:17.462493,2026-10-04 15:21:28.127827,0 days 00:00:10.665334,,,,,64.0,0.03048372233197124,32,7,3,0.014538940849623563,32,3,1,0.01967409163601807,32,3,2,,,,,,,,,512,0.8096691394120938,17.0,3,SGD,0.0011159088550343414,0.9105271468723695,0.0038765111709116325,48.0,0.3979289940828402,0.3855897735491678,,COMPLETE
5,,2026-10-04 15:21:28.181063,2026-10-04 15:21:28.198298,0 days 00:00:00.017235,,,,,,0.016432322056699946,8,7,3,0.035985315961888587,32,5,1,0.048920422190097824,32,3,2,0.01780971951192178,128.0,5.0,2.0,0.03581889183628671,128.0,3.0,1.0,,,,5,,,,,,,,,PRUNED
6,,2026-10-04 15:21:28.260163,2026-10-04 15:21:28.272040,0 days 00:00:00.011877,,,,,,0.04713274250350902,16,7,3,0.0167797098674437,32,7,2,0.015603360609460961,64,5,1,,,,,,,,,,,,3,,,,,,,,,PRUNED
7,,2026-10-04 15:21:28.429248,2026-10-04 15:21:28.452836,0 days 00:00:00.023588,,,,,,0.021743673770579737,8,7,3,0.038078675090308135,64,7,2,0.02862392072529841,64,5,2,0.015082420506075393,256.0,3.0,2.0,,,,,,,,4,,,,,,,,,PRUNED
8,,2026-10-04 15:21:28.609230,2026-10-04 15:21:28.632285,0 days 00:00:00.023055,,,,,,0.03125418526272592,8,7,3,0.027558856828225446,64,7,2,0.016257481706843442,128,5,2,0.032174162100456025,256.0,5.0,2.0,,,,,,,,4,,,,,,,,,PRUNED
9,,2026-10-04 15:21:28.721391,2026-10-04 15:21:28.732041,0 days 00:00:00.010650,,,,,,0.01464290562027665,8,7,3,0.016928074796400606,64,7,2,0.030125450343203505,128,5,1,0.04760920965699831,64.0,3.0,1.0,,,,,,,,4,,,,,,,,,PRUNED
10,0.6357587291062875,2026-10-04 15:21:28.790331,2026-10-04 15:21:41.425011,0 days 00:00:12.634680,0.9079517194939879,0.9627768386841636,0.009444811794638241,1.5681694641610638e-06,200.0,0.04036207752276006,32,5,3,0.013699189578280573,64,3,1,0.013446685364581459,128,5,1,,,,,,,,,128,0.8155565840291188,20.0,3,Adam,,,,50.0,0.6420118343195266,0.6295056238930484,"{""block_0_dropout"": 0.04036207752276006, ""block_0_filters"": 32, ""block_0_kernel"": 5, ""block_1_dropout"": 0.013699189578280573, ""block_1_filters"": 64, ""block_1_kernel"": 3, ""block_1_stride"": 1, ""block_2_dropout"": 0.013446685364581459, ""block_2_filters"": 128, ""block_2_kernel"": 5, ""block_2_stride"": 1, ""n_blocks"": 3}",COMPLETE
11,0.6076735454176503,2026-10-04 15:21:41.512514,2026-10-04 15:21:51.333458,0 days 00:00:09.820944,0.9250098755312106,0.9537484795905934,0.00960994055704251,1.5530519390924744e-06,200.0,0.031203171371680355,32,5,3,0.012287072940566609,64,3,1,0.014801873104301276,32,5,1,,,,,,,,,128,0.7775968987109323,20.0,3,Adam,,,,50.0,0.6198224852071006,0.5955246056282,"{""block_0_dropout"": 0.031203171371680355, ""block_0_filters"": 32, ""block_0_kernel"": 5, ""block_1_dropout"": 0.012287072940566609, ""block_1_filters"": 64, ""block_1_kernel"": 3, ""block_1_stride"": 1, ""block_2_dropout"": 0.014801873104301276, ""block_2_filters"": 32, ""block_2_kernel"": 5, ""block_2_stride"": 1, ""n_blocks"": 3}",COMPLETE
12,0.32509320063294794,2026-10-04 15:21:51.385831,2026-10-04 15:21:54.824522,0 days 00:00:03.438691,0.8803589415775793,0.988665254922613,0.007683307692264288,2.385153804750212e-06,200.0,0.04422035953099479,8,5,3,0.01742968798925993,64,7,1,0.01739631759436531,128,3,1,,,,,,,,,128,0.6154498750504773,20.0,3,Adam,,,,,,,"{""block_0_dropout"": 0.04422035953099479, ""block_0_filters"": 8, ""block_0_kernel"": 5, ""block_1_dropout"": 0.01742968798925993, ""block_1_filters"": 64, ""block_1_kernel"": 7, ""block_1_stride"": 1, ""block_2_dropout"": 0.01739631759436531, ""block_2_filters"": 128, ""block_2_kernel"": 3, ""block_2_stride"": 1, ""n_blocks"": 3}",PRUNED
13,,2026-10-04 15:21:54.876845,2026-10-04 15:21:54.886983,0 days 00:00:00.010138,,,,,,0.039479442432784506,8,5,3,0.030904042098632716,64,5,2,0.02812134517058052,128,5,1,,,,,,,,,,,,3,,,,,,,,"{""block_0_dropout"": 0.039479442432784506, ""block_0_filters"": 8, ""block_0_kernel"": 5, ""block_1_dropout"": 0.030904042098632716, ""block_1_filters"": 64, ""block_1_kernel"": 5, ""block_1_stride"": 2, ""block_2_dropout"": 0.02812134517058052, ""block_2_filters"": 128, ""block_2_kernel"": 5, ""block_2_stride"": 1, ""n_blocks"": 3}",PRUNED
14,0.5357285380844072,2026-10-04 15:21:54.936715,2026-10-04 15:22:06.598942,0 days 00:00:11.662227,0.9360364420157866,0.9545495628657985,0.002474959199039115,1.4026979990955342e-05,200.0,0.04481565671596139,8,7,3,0.011238023104286801,64,3,1,0.030196082120544577,128,5,1,,,,,,,,,512,0.5533579516648615,14.0,3,Adam,,,,46.0,0.5576923076923077,0.5137647684765068,"{""block_0_dropout"": 0.04481565671596139, ""block_0_filters"": 8, ""block_0_kernel"": 7, ""block_1_dropout"": 0.011238023104286801, ""block_1_filters"": 64, ""block_1_kernel"": 3, ""block_1_stride"": 1, ""block_2_dropout"": 0.030196082120544577, ""block_2_filters"": 128, ""block_2_kernel"": 5, ""block_2_stride"": 1, ""n_blocks"": 3}",COMPLETE
15,0.7406671737511865,2026-10-04 15:22:06.651639,2026-10-04 15:22:19.973980,0 days 00:00:13.322341,0.9061352732713149,0.904315764869144,0.0032890677899770813,3.2949000789371815e-05,200.0,0.0242034051928445,8,5,3,0.014919563937216569,64,3,1,0.017978754584460188,128,5,1,0.028616837093783966,64.0,5.0,2.0,,,,,128,0.8871741312503645,10.0,4,Adam,,,,47.0,0.7544378698224852,0.7268964776798877,"{""block_0_dropout"": 0.0242034051928445, ""block_0_filters"": 8, ""block_0_kernel"": 5, ""block_1_dropout"": 0.014919563937216569, ""block_1_filters"": 64, ""block_1_kernel"": 3, ""block_1_stride"": 1, ""block_2_dropout"": 0.017978754584460188, ""block_2_filters"": 128, ""block_2_kernel"": 5, ""block_2_stride"": 1, ""n_blocks"": 4}",COMPLETE
16,0.8365309545538382,2026-10-04 15:22:20.026028,2026-10-04 15:22:35.409416,0 days 00:00:15.383388,0.8918486539285322,0.9048019511660206,0.0002511179985392224,0.00015110289014993428,64.0,0.021697065264187746,32,5,3,0.015827784686246696,64,3,1,0.017695202698649576,128,5,1,0.029958875338639824,64.0,5.0,2.0,,,,,128,0.8823041129236102,5.0,4,Adam,,,,46.0,0.856508875739645,0.8165530333680315,"{""block_0_dropout"": 0.021697065264187746, ""block_0_filters"": 32, ""block_0_kernel"": 5, ""block_1_dropout"": 0.015827784686246696, ""block_1_filters"": 64, ""block_1_kernel"": 3, ""block_1_stride"": 1, ""block_2_dropout"": 0.017695202698649576, ""block_2_filters"": 128, ""block_2_kernel"": 5, ""block_2_stride"": 1, ""n_blocks"": 4}",COMPLETE
17,0.8564014614085088,2026-10-04 15:22:35.462076,2026-10-04 15:22:51.573641,0 days 00:00:16.111565,0.8520151488410588,0.9033007908566301,0.0001628373852899579,0.00010765528145353019,64.0,0.028457128326938017,32,5,3,0.01923623062171214,64,3,1,0.013156207123801196,128,5,1,0.030701030722136858,64.0,5.0,2.0,0.01167976045187091,256.0,3.0,1.0,128,0.890727448460168,5.0,5,Adam,,,,48.0,0.871301775147929,0.8415011476690887,"{""block_0_dropout"": 0.028457128326938017, ""block_0_filters"": 32, ""block_0_kernel"": 5, ""block_1_dropout"": 0.01923623062171214, ""block_1_filters"": 64, ""block_1_kernel"": 3, ""block_1_stride"": 1, ""block_2_dropout"": 0.013156207123801196, ""block_2_filters"": 128, ""block_2_kernel"": 5, ""block_2_stride"": 1, ""n_blocks"": 5}",COMPLETE
18,0.7370928733958341,2026-10-04 15:22:51.639576,2026-10-04 15:23:05.644381,0 days 00:00:14.004805,0.8554176226062357,0.9013501149825812,0.00013756995256972466,0.0002082825807342894,64.0,0.022691938877415305,32,5,3,0.02113849246323411,32,3,1,0.025423747260335618,128,5,1,0.027507374537610835,64.0,5.0,2.0,,,,,128,0.7215835619495994,5.0,4,Adam,,,,48.0,0.7440828402366864,0.7301029065549818,"{""block_0_dropout"": 0.022691938877415305, ""block_0_filters"": 32, ""block_0_kernel"": 5, ""block_1_dropout"": 0.02113849246323411, ""block_1_filters"": 32, ""block_1_kernel"": 3, ""block_1_stride"": 1, ""block_2_dropout"": 0.025423747260335618, ""block_2_filters"": 128, ""block_2_kernel"": 5, ""block_2_stride"": 1, ""n_blocks"": 4}",COMPLETE
19,0.8667712483311101,2026-10-04 15:23:05.700521,2026-10-04 15:23:18.734452,0 days 00:00:13.033931,0.8504391790170258,0.920368399516568,0.00016287186614643523,0.00020619925071110878,64.0,0.023470778673075007,32,5,3,0.013708804807598717,64,3,2,0.028130641937709977,128,5,1,0.034696659797652164,64.0,5.0,2.0,,,,,128,0.8684704887285327,5.0,4,Adam,,,,41.0,0.886094674556213,0.8474478221060072,"{""block_0_dropout"": 0.023470778673075007, ""block_0_filters"": 32, ""block_0_kernel"": 5, ""block_1_dropout"": 0.013708804807598717, ""block_1_filters"": 64, ""block_1_kernel"": 3, ""block_1_stride"": 2, ""block_2_dropout"": 0.028130641937709977, ""block_2_filters"": 128, ""block_2_kernel"": 5, ""block_2_stride"": 1, ""n_blocks"": 4}",COMPLETE
20,0.31380204876066486,2026-10-04 15:23:18.790101,2026-10-04 15:23:22.217921,0 days 00:00:03.427820,,,,,64.0,0.03348235104972528,32,5,3,0.017296137760722776,64,3,1,0.0299631993973375,128,5,1,0.03767684916921925,64.0,5.0,2.0,0.011534909309561827,256.0,3.0,1.0,128,0.6826003789104034,7.0,5,SGD,0.09418993635138886,0.7059761919118797,1.101773524738362e-06,,,,"{""block_0_dropout"": 0.03348235104972528, ""block_0_filters"": 32, ""block_0_kernel"": 5, ""block_1_dropout"": 0.017296137760722776, ""block_1_filters"": 64, ""block_1_kernel"": 3, ""block_1_stride"": 1, ""block_2_dropout"": 0.0299631993973375, ""block_2_filters"": 128, ""block_2_kernel"": 5, ""block_2_stride"": 1, ""n_blocks"": 5}",PRUNED
21,,2026-10-04 15:23:22.286080,2026-10-04 15:23:22.323231,0 days 00:00:00.037151,,,,,,0.024161139055138427,32,5,3,0.021659752189503674,64,3,2,0.014941234145923474,128,5,1,0.03326793284234388,64.0,5.0,2.0,0.010638895550626306,512.0,3.0,1.0,,,,5,,,,,,,,"{""block_0_dropout"": 0.024161139055138427, ""block_0_filters"": 32, ""block_0_kernel"": 5, ""block_1_dropout"": 0.021659752189503674, ""block_1_filters"": 64, ""block_1_kernel"": 3, ""block_1_stride"": 2, ""block_2_dropout"": 0.014941234145923474, ""block_2_filters"": 128, ""block_2_kernel"": 5, ""block_2_stride"": 1, ""n_blocks"": 5}",PRUNED
22,0.8481644386309763,2026-10-04 15:23:22.476179,2026-10-04 15:23:38.179127,0 days 00:00:15.702948,0.8515125209533827,0.9169743691252418,0.00015855553052319891,0.0002603003407610542,64.0,0.03823835740030625,32,5,3,0.017447391913260866,64,3,1,0.01405870699033479,128,5,1,0.02516735275218224,64.0,5.0,2.0,0.048576088999744055,256.0,3.0,1.0,128,0.8944583144629199,5.0,5,Adam,,,,48.0,0.8624260355029586,0.833902841758994,"{""block_0_dropout"": 0.03823835740030625, ""block_0_filters"": 32, ""block_0_kernel"": 5, ""block_1_dropout"": 0.017447391913260866, ""block_1_filters"": 64, ""block_1_kernel"": 3, ""block_1_stride"": 1, ""block_2_dropout"": 0.01405870699033479, ""block_2_filters"": 128, ""block_2_kernel"": 5, ""block_2_stride"": 1, ""n_blocks"": 5}",COMPLETE
23,0.8336946000204086,2026-10-04 15:23:38.235392,2026-10-04 15:23:53.933954,0 days 00:00:15.698562,0.8514942005579504,0.9240057978981093,0.0002641585703598209,0.00043035592955676494,64.0,0.031249556047836864,32,5,3,0.017137962930002776,32,3,1,0.01203530773803012,128,5,1,0.023239422283115478,64.0,5.0,2.0,0.04626089517889655,256.0,3.0,1.0,128,0.8937798382020236,7.0,5,Adam,,,,43.0,0.8594674556213018,0.8079217444195155,"{""block_0_dropout"": 0.031249556047836864, ""block_0_filters"": 32, ""block_0_kernel"": 5, ""block_1_dropout"": 0.017137962930002776, ""block_1_filters"": 32, ""block_1_kernel"": 3, ""block_1_stride"": 1, ""block_2_dropout"": 0.01203530773803012, ""block_2_filters"": 128, ""block_2_kernel"": 5, ""block_2_stride"": 1, ""n_blocks"": 5}",COMPLETE
24,0.7617427389537814,2026-10-04 15:23:53.985907,2026-10-04 15:24:09.252479,0 days 00:00:15.266572,0.868908435238994,0.9204622562916274,0.00011230869571624036,0.0008419427981140602,64.0,0.03329288275591481,32,5,3,0.027631448852340836,64,3,1,0.016288578901518018,128,5,1,0.02273239559957231,64.0,5.0,2.0,,,,,128,0.7850407238382819,5.0,4,Adam,,,,48.0,0.764792899408284,0.7586925784992788,"{""block_0_dropout"": 0.03329288275591481, ""block_0_filters"": 32, ""block_0_kernel"": 5, ""block_1_dropout"": 0.027631448852340836, ""block_1_filters"": 64, ""block_1_kernel"": 3, ""block_1_stride"": 1, ""block_2_dropout"": 0.016288578901518018, ""block_2_filters"": 128, ""block_2_kernel"": 5, ""block_2_stride"": 1, ""n_blocks"": 4}",COMPLETE
25,0.852012005547254,2026-10-04 15:24:09.309343,2026-10-04 15:24:24.352348,0 days 00:00:15.043005,0.8506241539833636,0.9169449033124298,0.00033489133523676833,8.43559471314402e-05,64.0,0.030565969754210415,32,5,3,0.01851554934740956,64,3,2,0.03863357574623872,128,5,1,0.03777844825179965,64.0,5.0,2.0,,,,,128,0.8982158796201293,8.0,4,Adam,,,,26.0,0.8816568047337278,0.8223672063607801,"{""block_0_dropout"": 0.030565969754210415, ""block_0_filters"": 32, ""block_0_kernel"": 5, ""block_1_dropout"": 0.01851554934740956, ""block_1_filters"": 64, ""block_1_kernel"": 3, ""block_1_stride"": 2, ""block_2_dropout"": 0.03863357574623872, ""block_2_filters"": 128, ""block_2_kernel"": 5, ""block_2_stride"": 1, ""n_blocks"": 4}",COMPLETE
26,,2026-10-04 15:24:24.408646,2026-10-04 15:24:24.422745,0 days 00:00:00.014099,,,,,,0.026954865620218798,32,5,3,0.013925760647030978,64,5,2,0.03889640358876771,128,5,1,0.038895586523868105,128.0,5.0,2.0,,,,,,,,4,,,,,,,,"{""block_0_dropout"": 0.026954865620218798, ""block_0_filters"": 32, ""block_0_kernel"": 5, ""block_1_dropout"": 0.013925760647030978, ""block_1_filters"": 64, ""block_1_kernel"": 5, ""block_1_stride"": 2, ""block_2_dropout"": 0.03889640358876771, ""block_2_filters"": 128, ""block_2_kernel"": 5, ""block_2_stride"": 1, ""n_blocks"": 4}",PRUNED
27,0.5433243879052101,2026-10-04 15:24:24.472859,2026-10-04 15:24:32.266642,0 days 00:00:07.793783,0.8697708951354952,0.9153130244678097,0.0004765021642736438,0.009488721648613708,64.0,0.02795270751691319,32,7,3,0.01920860748448068,64,3,2,0.044459289176636954,128,5,1,,,,,,,,,256,0.7154546192764923,9.0,3,Adam,,,,,,,"{""block_0_dropout"": 0.02795270751691319, ""block_0_filters"": 32, ""block_0_kernel"": 7, ""block_1_dropout"": 0.01920860748448068, ""block_1_filters"": 64, ""block_1_kernel"": 3, ""block_1_stride"": 2, ""block_2_dropout"": 0.044459289176636954, ""block_2_filters"": 128, ""block_2_kernel"": 5, ""block_2_stride"": 1, ""n_blocks"": 3}",PRUNED
28,0.8401179920545224,2026-10-04 15:24:32.319612,2026-10-04 15:24:52.632935,0 days 00:00:20.313323,0.8754337436195198,0.940266197863036,0.0005749933174878625,5.397529010163556e-05,64.0,0.029315893062019132,32,5,3,0.013008574792432304,16,3,2,0.03493789892109662,128,5,1,0.04400871879656978,256.0,5.0,1.0,0.026177415653335763,512.0,3.0,1.0,128,0.8191673677118292,7.0,5,Adam,,,,42.0,0.8609467455621301,0.8192892385469147,"{""block_0_dropout"": 0.029315893062019132, ""block_0_filters"": 32, ""block_0_kernel"": 5, ""block_1_dropout"": 0.013008574792432304, ""block_1_filters"": 16, ""block_1_kernel"": 3, ""block_1_stride"": 2, ""block_2_dropout"": 0.03493789892109662, ""block_2_filters"": 128, ""block_2_kernel"": 5, ""block_2_stride"": 1, ""n_blocks"": 5}",COMPLETE
29,0.8314147514857093,2026-10-04 15:24:52.696369,2026-10-04 15:25:05.762648,0 days 00:00:13.066279,0.8640684381206336,0.9144202468331325,0.00029994063716233906,6.461648469656803e-05,64.0,0.028347621218960888,8,5,3,0.02331030599377011,64,3,2,0.024703048012172987,128,5,1,0.03503325966098643,64.0,5.0,2.0,,,,,128,0.708614962889756,11.0,4,Adam,,,,49.0,0.8653846153846154,0.7974448875868031,"{""block_0_dropout"": 0.028347621218960888, ""block_0_filters"": 8, ""block_0_kernel"": 5, ""block_1_dropout"": 0.02331030599377011, ""block_1_filters"": 64, ""block_1_kernel"": 3, ""block_1_stride"": 2, ""block_2_dropout"": 0.024703048012172987, ""block_2_filters"": 128, ""block_2_kernel"": 5, ""block_2_stride"": 1, ""n_blocks"": 4}",COMPLETE
30,0.8481252613062795,2026-10-04 15:25:05.816090,2026-10-04 15:25:15.331807,0 days 00:00:09.515717,0.8846098367081021,0.9286623486122414,0.00040214202016450746,0.0001190706787337007,128.0,0.03879069524293761,32,5,3,0.021256697879283998,64,3,2,0.0384237393354271,128,5,1,0.04329162508711231,64.0,5.0,2.0,,,,,128,0.8235898935840084,7.0,4,Adam,,,,48.0,0.8668639053254438,0.8293866172871153,"{""block_0_dropout"": 0.03879069524293761, ""block_0_filters"": 32, ""block_0_kernel"": 5, ""block_1_dropout"": 0.021256697879283998, ""block_1_filters"": 64, ""block_1_kernel"": 3, ""block_1_stride"": 2, ""block_2_dropout"": 0.0384237393354271, ""block_2_filters"": 128, ""block_2_kernel"": 5, ""block_2_stride"": 1, ""n_blocks"": 4}",COMPLETE
31,,2026-10-04 15:25:15.389309,2026-10-04 15:25:15.410674,0 days 00:00:00.021365,,,,,,0.03869976991282936,32,5,3,0.014073014212560062,64,3,1,0.013216682723823583,128,5,2,0.02383886872439067,64.0,5.0,2.0,0.04996404666508754,256.0,3.0,1.0,,,,5,,,,,,,,"{""block_0_dropout"": 0.03869976991282936, ""block_0_filters"": 32, ""block_0_kernel"": 5, ""block_1_dropout"": 0.014073014212560062, ""block_1_filters"": 64, ""block_1_kernel"": 3, ""block_1_stride"": 1, ""block_2_dropout"": 0.013216682723823583, ""block_2_filters"": 128, ""block_2_kernel"": 5, ""block_2_stride"": 2, ""n_blocks"": 5}",PRUNED
32,0.8582675891130845,2026-10-04 15:25:15.566856,2026-10-04 15:25:30.820045,0 days 00:00:15.253189,0.850644923536016,0.9136446929236126,0.00016924001941146722,0.0003179059387702186,64.0,0.039266324318468444,16,5,3,0.021734842768269758,64,3,1,0.024516362813293405,128,5,1,0.03602524685401912,64.0,5.0,2.0,0.026595575640081155,256.0,3.0,1.0,128,0.8994673546814215,5.0,5,Adam,,,,50.0,0.8757396449704142,0.8407955332557548,"{""block_0_dropout"": 0.039266324318468444, ""block_0_filters"": 16, ""block_0_kernel"": 5, ""block_1_dropout"": 0.021734842768269758, ""block_1_filters"": 64, ""block_1_kernel"": 3, ""block_1_stride"": 1, ""block_2_dropout"": 0.024516362813293405, ""block_2_filters"": 128, ""block_2_kernel"": 5, ""block_2_stride"": 1, ""n_blocks"": 5}",COMPLETE
33,0.8381470206028998,2026-10-04 15:25:30.876402,2026-10-04 15:25:46.278384,0 days 00:00:15.401982,0.8512007177032543,0.9108192307378039,0.00019447332841987007,0.0007510992528981694,64.0,0.02688994501525009,16,5,3,0.02526106801693852,64,3,1,0.03966231109751143,128,5,1,0.03636514320161345,64.0,5.0,2.0,0.021222366319883456,256.0,3.0,1.0,128,0.8497612478882394,6.0,5,Adam,,,,40.0,0.8579881656804734,0.8183058755253262,"{""block_0_dropout"": 0.02688994501525009, ""block_0_filters"": 16, ""block_0_kernel"": 5, ""block_1_dropout"": 0.02526106801693852, ""block_1_filters"": 64, ""block_1_kernel"": 3, ""block_1_stride"": 1, ""block_2_dropout"": 0.03966231109751143, ""block_2_filters"": 128, ""block_2_kernel"": 5, ""block_2_stride"": 1, ""n_blocks"": 5}",COMPLETE
