number,value,datetime_start,datetime_complete,duration,params_adam_beta1,params_adam_beta2,params_adam_lr,params_adam_wd,params_batch_size,params_block_0_dropout,params_block_0_filters,params_block_0_kernel,params_block_0_stride,params_block_1_dropout,params_block_1_filters,params_block_1_kernel,params_block_1_stride,params_block_2_dropout,params_block_2_filters,params_block_2_kernel,params_block_2_stride,params_block_3_dropout,params_block_3_filters,params_block_3_kernel,params_block_3_stride,params_block_4_dropout,params_block_4_filters,params_block_4_kernel,params_block_4_stride,params_fc_hidden,params_lr_factor,params_lr_patience,params_n_blocks,params_optimizer,params_sgd_lr,params_sgd_momentum,params_sgd_wd,user_attrs_best_epoch,user_attrs_validation_accuracy,user_attrs_validation_macro_f1,system_attrs_tpe:relative_params:0,state
63,0.844914914291742,2026-10-04 15:29:37.771564,2026-10-04 15:29:52.594379,0 days 00:00:14.822815,0.8573055668043839,0.947368434122051,0.00010320707342986567,6.337483388929572e-06,64.0,0.024868717475166908,32,5,3,0.01638690253364968,64,3,2,0.024622722655125405,128,5,1,0.037479505192140064,64.0,5.0,2.0,,,,,128,0.8278142096901578,5.0,4,Adam,,,,45.0,0.8727810650887574,0.8170487634947267,"{""block_0_dropout"": 0.024868717475166908, ""block_0_filters"": 32, ""block_0_kernel"": 5, ""block_1_dropout"": 0.01638690253364968, ""block_1_filters"": 64, ""block_1_kernel"": 3, ""block_1_stride"": 2, ""block_2_dropout"": 0.024622722655125405, ""block_2_filters"": 128, ""block_2_kernel"": 5, ""block_2_stride"": 1, ""n_blocks"": 4}",COMPLETE
64,0.8405899975314104,2026-10-04 15:29:52.668217,2026-10-04 15:30:06.057434,0 days 00:00:13.389217,0.8654039095214073,0.9126737841594103,0.0001540875772484622,0.00034131112870076826,64.0,0.013844339293341884,32,5,3,0.025670143942773126,64,3,2,0.032541713312583105,128,5,1,0.045191571499600784,64.0,5.0,2.0,,,,,128,0.7905637775869776,9.0,4,Adam,,,,37.0,0.8727810650887574,0.8083989299740634,"{""block_0_dropout"": 0.013844339293341884, ""block_0_filters"": 32, ""block_0_kernel"": 5, ""block_1_dropout"": 0.025670143942773126, ""block_1_filters"": 64, ""block_1_kernel"": 3, ""block_1_stride"": 2, ""block_2_dropout"": 0.032541713312583105, ""block_2_filters"": 128, ""block_2_kernel"": 5, ""block_2_stride"": 1, ""n_blocks"": 4}",COMPLETE
65,0.849385132517606,2026-10-04 15:30:06.118014,2026-10-04 15:30:19.977868,0 days 00:00:13.859854,0.8563000138612142,0.9047535711604763,0.00022461305899599705,0.0005763907207894238,64.0,0.022561970973945435,32,5,3,0.02151205603769387,64,3,2,0.04120018489451718,128,5,1,0.03947204209613284,64.0,5.0,2.0,,,,,128,0.6946112632153488,10.0,4,Adam,,,,36.0,0.8742603550295858,0.8245099100056261,"{""block_0_dropout"": 0.022561970973945435, ""block_0_filters"": 32, ""block_0_kernel"": 5, ""block_1_dropout"": 0.02151205603769387, ""block_1_filters"": 64, ""block_1_kernel"": 3, ""block_1_stride"": 2, ""block_2_dropout"": 0.04120018489451718, ""block_2_filters"": 128, ""block_2_kernel"": 5, ""block_2_stride"": 1, ""n_blocks"": 4}",COMPLETE
66,0.6592322188186355,2026-10-04 15:30:20.035443,2026-10-04 15:30:25.869670,0 days 00:00:05.834227,0.8734384482941455,0.919499670214504,0.00011767859872746113,0.00022668645099407594,64.0,0.027437682987659032,32,5,3,0.010462093337072403,64,3,1,0.013454784728955591,128,5,1,0.025954930911218702,64.0,5.0,2.0,0.013551925759142394,256.0,3.0,1.0,128,0.7508836152189879,7.0,5,Adam,,,,,,,"{""block_0_dropout"": 0.027437682987659032, ""block_0_filters"": 32, ""block_0_kernel"": 5, ""block_1_dropout"": 0.010462093337072403, ""block_1_filters"": 64, ""block_1_kernel"": 3, ""block_1_stride"": 1, ""block_2_dropout"": 0.013454784728955591, ""block_2_filters"": 128, ""block_2_kernel"": 5, ""block_2_stride"": 1, ""n_blocks"": 5}",PRUNED
67,0.407659622485685,2026-10-04 15:30:25.926630,2026-10-04 15:30:28.888299,0 days 00:00:02.961669,,,,,200.0,0.026668205098239063,32,5,3,0.018068682312871343,64,3,1,0.010257160537373144,128,5,1,0.04236845894459988,64.0,5.0,2.0,0.027430676456011188,256.0,3.0,1.0,128,0.871711299898324,5.0,5,SGD,0.013420356625638966,0.977441321177105,1.8921816617262917e-05,,,,"{""block_0_dropout"": 0.026668205098239063, ""block_0_filters"": 32, ""block_0_kernel"": 5, ""block_1_dropout"": 0.018068682312871343, ""block_1_filters"": 64, ""block_1_kernel"": 3, ""block_1_stride"": 1, ""block_2_dropout"": 0.010257160537373144, ""block_2_filters"": 128, ""block_2_kernel"": 5, ""block_2_stride"": 1, ""n_blocks"": 5}",PRUNED
68,0.8562957633534778,2026-10-04 15:30:28.950374,2026-10-04 15:30:44.774956,0 days 00:00:15.824582,0.8669474295138416,0.9146299008539631,0.0002723610102150939,7.184955204070846e-05,64.0,0.0177533198178751,32,5,3,0.012995810668165865,64,3,1,0.020000386545445923,128,5,1,0.03368605360783725,64.0,5.0,2.0,0.019265605439019406,256.0,3.0,1.0,256,0.8259171380120598,8.0,5,Adam,,,,42.0,0.8801775147928994,0.8324140119140563,"{""block_0_dropout"": 0.0177533198178751, ""block_0_filters"": 32, ""block_0_kernel"": 5, ""block_1_dropout"": 0.012995810668165865, ""block_1_filters"": 64, ""block_1_kernel"": 3, ""block_1_stride"": 1, ""block_2_dropout"": 0.020000386545445923, ""block_2_filters"": 128, ""block_2_kernel"": 5, ""block_2_stride"": 1, ""n_blocks"": 5}",COMPLETE
69,0.8451389604062275,2026-10-04 15:30:44.832336,2026-10-04 15:30:54.615830,0 days 00:00:09.783494,0.9006397874061709,0.9750533738511522,0.00045173154834146417,0.0010671830614210277,128.0,0.019884381292086254,32,5,3,0.013014359387842915,64,3,2,0.02573332430393593,128,5,1,0.028763507934110064,64.0,5.0,2.0,,,,,256,0.8764524845845421,6.0,4,Adam,,,,47.0,0.8683431952662722,0.8219347255461827,"{""block_0_dropout"": 0.019884381292086254, ""block_0_filters"": 32, ""block_0_kernel"": 5, ""block_1_dropout"": 0.013014359387842915, ""block_1_filters"": 64, ""block_1_kernel"": 3, ""block_1_stride"": 2, ""block_2_dropout"": 0.02573332430393593, ""block_2_filters"": 128, ""block_2_kernel"": 5, ""block_2_stride"": 1, ""n_blocks"": 4}",COMPLETE
70,0.4129622841974782,2026-10-04 15:30:54.672892,2026-10-04 15:30:57.137325,0 days 00:00:02.464433,0.8821336225926405,0.9065944567989808,0.000292568440338654,7.466763827305037e-05,64.0,0.02218588998162897,32,5,3,0.02145988398954589,64,3,2,0.031245833247704784,128,5,1,,,,,,,,,256,0.839943513332513,5.0,3,Adam,,,,,,,"{""block_0_dropout"": 0.02218588998162897, ""block_0_filters"": 32, ""block_0_kernel"": 5, ""block_1_dropout"": 0.02145988398954589, ""block_1_filters"": 64, ""block_1_kernel"": 3, ""block_1_stride"": 2, ""block_2_dropout"": 0.031245833247704784, ""block_2_filters"": 128, ""block_2_kernel"": 5, ""block_2_stride"": 1, ""n_blocks"": 3}",PRUNED
71,0.5503056131340454,2026-10-04 15:30:57.204130,2026-10-04 15:31:00.785048,0 days 00:00:03.580918,0.8557175465768342,0.9143458598132809,0.00016093549405998036,4.003111189734777e-05,64.0,0.018101775769745233,32,5,3,0.014606087891203753,64,3,1,0.02254937468362452,128,5,1,0.03456750076650318,64.0,5.0,2.0,0.019432354767702626,256.0,3.0,1.0,256,0.819908831836265,8.0,5,Adam,,,,,,,"{""block_0_dropout"": 0.018101775769745233, ""block_0_filters"": 32, ""block_0_kernel"": 5, ""block_1_dropout"": 0.014606087891203753, ""block_1_filters"": 64, ""block_1_kernel"": 3, ""block_1_stride"": 1, ""block_2_dropout"": 0.02254937468362452, ""block_2_filters"": 128, ""block_2_kernel"": 5, ""block_2_stride"": 1, ""n_blocks"": 5}",PRUNED
72,0.5377834804714361,2026-10-04 15:31:00.841279,2026-10-04 15:31:04.627411,0 days 00:00:03.786132,0.8674462528194747,0.9187815537698075,0.0002265780895089984,5.687013741897727e-05,64.0,0.018855980563213363,8,5,3,0.011109373262941568,64,3,1,0.021989311116447238,128,5,1,0.03711333048097353,64.0,5.0,2.0,0.01407262403510012,256.0,3.0,1.0,256,0.8787158658003578,9.0,5,Adam,,,,,,,"{""block_0_dropout"": 0.018855980563213363, ""block_0_filters"": 8, ""block_0_kernel"": 5, ""block_1_dropout"": 0.011109373262941568, ""block_1_filters"": 64, ""block_1_kernel"": 3, ""block_1_stride"": 1, ""block_2_dropout"": 0.021989311116447238, ""block_2_filters"": 128, ""block_2_kernel"": 5, ""block_2_stride"": 1, ""n_blocks"": 5}",PRUNED
73,0.47389610528576026,2026-10-04 15:31:04.685636,2026-10-04 15:31:07.922983,0 days 00:00:03.237347,0.8771014493682907,0.9144119998920833,0.0001295626585820143,0.00014721213172858147,64.0,0.016151389095468597,32,5,3,0.01583168259006623,64,3,1,0.013031157295784577,128,5,1,0.032875000803489256,64.0,5.0,2.0,0.024147216493881664,256.0,3.0,1.0,128,0.7277585199299554,7.0,5,Adam,,,,,,,"{""block_0_dropout"": 0.016151389095468597, ""block_0_filters"": 32, ""block_0_kernel"": 5, ""block_1_dropout"": 0.01583168259006623, ""block_1_filters"": 64, ""block_1_kernel"": 3, ""block_1_stride"": 1, ""block_2_dropout"": 0.013031157295784577, ""block_2_filters"": 128, ""block_2_kernel"": 5, ""block_2_stride"": 1, ""n_blocks"": 5}",PRUNED
74,0.7375543932177451,2026-10-04 15:31:07.980721,2026-10-04 15:31:15.321530,0 days 00:00:07.340809,0.8646215492559939,0.9020525237593143,0.00019438707050989647,2.275175973230372e-05,64.0,0.016803566396611756,32,5,3,0.01358831758922423,64,3,1,0.01933147069643894,128,5,1,0.030905614866775274,64.0,5.0,2.0,0.010000805043989532,256.0,3.0,1.0,128,0.8982244422214953,8.0,5,Adam,,,,,,,"{""block_0_dropout"": 0.016803566396611756, ""block_0_filters"": 32, ""block_0_kernel"": 5, ""block_1_dropout"": 0.01358831758922423, ""block_1_filters"": 64, ""block_1_kernel"": 3, ""block_1_stride"": 1, ""block_2_dropout"": 0.01933147069643894, ""block_2_filters"": 128, ""block_2_kernel"": 5, ""block_2_stride"": 1, ""n_blocks"": 5}",PRUNED
75,0.5832575082542195,2026-10-04 15:31:15.377657,2026-10-04 15:31:19.278787,0 days 00:00:03.901130,0.8538379889623218,0.9350555855788837,0.00026150326723518885,0.0001015316315200876,64.0,0.04392231282298417,32,5,3,0.019072043373179016,64,3,1,0.014763197512035033,128,5,1,0.03556240754944907,128.0,5.0,2.0,0.01941078329472112,128.0,3.0,1.0,256,0.8046679922577704,10.0,5,Adam,,,,,,,"{""block_0_dropout"": 0.04392231282298417, ""block_0_filters"": 32, ""block_0_kernel"": 5, ""block_1_dropout"": 0.019072043373179016, ""block_1_filters"": 64, ""block_1_kernel"": 3, ""block_1_stride"": 1, ""block_2_dropout"": 0.014763197512035033, ""block_2_filters"": 128, ""block_2_kernel"": 5, ""block_2_stride"": 1, ""n_blocks"": 5}",PRUNED
76,0.8634993718864985,2026-10-04 15:31:19.335318,2026-10-04 15:31:32.401808,0 days 00:00:13.066490,0.8885583698360473,0.9264531026980339,0.0003785564085421485,0.00019545892540516835,64.0,0.025422621353366676,32,5,3,0.019491316958772997,64,3,2,0.034465126806628665,128,5,1,0.034298732472086785,64.0,5.0,2.0,,,,,128,0.7727335780892991,6.0,4,Adam,,,,38.0,0.886094674556213,0.8409040692167841,"{""block_0_dropout"": 0.025422621353366676, ""block_0_filters"": 32, ""block_0_kernel"": 5, ""block_1_dropout"": 0.019491316958772997, ""block_1_filters"": 64, ""block_1_kernel"": 3, ""block_1_stride"": 2, ""block_2_dropout"": 0.034465126806628665, ""block_2_filters"": 128, ""block_2_kernel"": 5, ""block_2_stride"": 1, ""n_blocks"": 4}",COMPLETE
77,0.5843639887221721,2026-10-04 15:31:32.454392,2026-10-04 15:31:37.609084,0 days 00:00:05.154692,0.9079854010322352,0.9268379369814842,0.0003940448374305054,0.00043736842954629387,64.0,0.02120848308808987,32,5,3,0.022773533218332094,64,3,2,0.04092921333904999,128,5,1,0.033503987977535774,256.0,5.0,1.0,0.014572389781895187,512.0,3.0,1.0,128,0.7680810390516171,6.0,5,Adam,,,,,,,"{""block_0_dropout"": 0.02120848308808987, ""block_0_filters"": 32, ""block_0_kernel"": 5, ""block_1_dropout"": 0.022773533218332094, ""block_1_filters"": 64, ""block_1_kernel"": 3, ""block_1_stride"": 2, ""block_2_dropout"": 0.04092921333904999, ""block_2_filters"": 128, ""block_2_kernel"": 5, ""block_2_stride"": 1, ""n_blocks"": 5}",PRUNED
78,0.4838323647532915,2026-10-04 15:31:37.664245,2026-10-04 15:31:40.873571,0 days 00:00:03.209326,0.8885453682154939,0.9226321673742054,0.0006563526653141487,0.00032344446019797916,64.0,0.02000213731598642,32,5,3,0.019565447107276833,64,3,1,0.015935468744117304,128,5,1,0.049938257114103025,64.0,5.0,2.0,0.018223631714564554,256.0,3.0,1.0,128,0.6098934882015478,7.0,5,Adam,,,,,,,"{""block_0_dropout"": 0.02000213731598642, ""block_0_filters"": 32, ""block_0_kernel"": 5, ""block_1_dropout"": 0.019565447107276833, ""block_1_filters"": 64, ""block_1_kernel"": 3, ""block_1_stride"": 1, ""block_2_dropout"": 0.015935468744117304, ""block_2_filters"": 128, ""block_2_kernel"": 5, ""block_2_stride"": 1, ""n_blocks"": 5}",PRUNED
79,0.4121680332149753,2026-10-04 15:31:40.926377,2026-10-04 15:31:44.115447,0 days 00:00:03.189070,,,,,64.0,0.021398883800066767,32,5,3,0.011576930880137297,64,3,1,0.023476431008210445,128,5,1,0.03222849043588137,64.0,5.0,2.0,0.02997121136076006,256.0,3.0,1.0,128,0.8342267737764161,6.0,5,SGD,0.001933433142836827,0.8767447393223554,0.0007297150332179855,,,,"{""block_0_dropout"": 0.021398883800066767, ""block_0_filters"": 32, ""block_0_kernel"": 5, ""block_1_dropout"": 0.011576930880137297, ""block_1_filters"": 64, ""block_1_kernel"": 3, ""block_1_stride"": 1, ""block_2_dropout"": 0.023476431008210445, ""block_2_filters"": 128, ""block_2_kernel"": 5, ""block_2_stride"": 1, ""n_blocks"": 5}",PRUNED
80,0.5253651144678593,2026-10-04 15:31:44.170614,2026-10-04 15:31:47.503326,0 days 00:00:03.332712,0.9000485069709868,0.9532343334390837,0.0003919534014495485,0.0001741624851316286,128.0,0.021974707737316995,32,5,3,0.01393323743210753,64,3,1,0.013404632626642283,128,5,1,0.02970399740542675,64.0,5.0,2.0,0.022301412102982376,128.0,3.0,1.0,512,0.6687779783237929,5.0,5,Adam,,,,,,,"{""block_0_dropout"": 0.021974707737316995, ""block_0_filters"": 32, ""block_0_kernel"": 5, ""block_1_dropout"": 0.01393323743210753, ""block_1_filters"": 64, ""block_1_kernel"": 3, ""block_1_stride"": 1, ""block_2_dropout"": 0.013404632626642283, ""block_2_filters"": 128, ""block_2_kernel"": 5, ""block_2_stride"": 1, ""n_blocks"": 5}",PRUNED
81,0.8619839662400988,2026-10-04 15:31:47.559584,2026-10-04 15:32:03.258838,0 days 00:00:15.699254,0.853682090470365,0.9159225539263913,0.00028725220688323206,7.350597730688731e-05,64.0,0.01464948648986434,32,5,3,0.01406773246841436,64,3,1,0.023261409527369433,128,5,1,0.03959076094460646,64.0,5.0,2.0,0.037568117547090225,256.0,3.0,1.0,128,0.7114725755000304,7.0,5,Adam,,,,50.0,0.8757396449704142,0.8482282875097832,"{""block_0_dropout"": 0.01464948648986434, ""block_0_filters"": 32, ""block_0_kernel"": 5, ""block_1_dropout"": 0.01406773246841436, ""block_1_filters"": 64, ""block_1_kernel"": 3, ""block_1_stride"": 1, ""block_2_dropout"": 0.023261409527369433, ""block_2_filters"": 128, ""block_2_kernel"": 5, ""block_2_stride"": 1, ""n_blocks"": 5}",COMPLETE
82,0.49714784658777467,2026-10-04 15:32:03.317120,2026-10-04 15:32:06.607478,0 days 00:00:03.290358,0.8504451443691804,0.9093281670944109,0.0004950787417797391,9.028349010064444e-05,64.0,0.030338378732241,32,5,3,0.019942676880233486,64,3,1,0.016964968064429365,128,5,1,0.03908483016897132,64.0,5.0,2.0,0.040457608125063355,256.0,3.0,1.0,128,0.7050709963291381,7.0,5,Adam,,,,,,,"{""block_0_dropout"": 0.030338378732241, ""block_0_filters"": 32, ""block_0_kernel"": 5, ""block_1_dropout"": 0.019942676880233486, ""block_1_filters"": 64, ""block_1_kernel"": 3, ""block_1_stride"": 1, ""block_2_dropout"": 0.016964968064429365, ""block_2_filters"": 128, ""block_2_kernel"": 5, ""block_2_stride"": 1, ""n_blocks"": 5}",PRUNED
83,0.5787376930173769,2026-10-04 15:32:06.663644,2026-10-04 15:32:10.652309,0 days 00:00:03.988665,0.8547764351765024,0.9210234016244842,0.00029401886444702644,0.0007380836858071243,64.0,0.012436122164295151,32,5,3,0.01346852100106914,64,3,1,0.02511876913076328,128,5,1,0.03587429015987815,64.0,5.0,2.0,0.043429544959139664,256.0,3.0,1.0,128,0.73754426121988,6.0,5,Adam,,,,,,,"{""block_0_dropout"": 0.012436122164295151, ""block_0_filters"": 32, ""block_0_kernel"": 5, ""block_1_dropout"": 0.01346852100106914, ""block_1_filters"": 64, ""block_1_kernel"": 3, ""block_1_stride"": 1, ""block_2_dropout"": 0.02511876913076328, ""block_2_filters"": 128, ""block_2_kernel"": 5, ""block_2_stride"": 1, ""n_blocks"": 5}",PRUNED
84,0.5855434799266737,2026-10-04 15:32:10.726661,2026-10-04 15:32:14.631389,0 days 00:00:03.904728,0.8613128880408277,0.9118334894914452,0.0003512995865934803,0.0001292855941235945,64.0,0.03248055129164263,32,5,3,0.021855758377527592,64,3,1,0.012160546728448263,128,5,1,0.03398734524956361,64.0,5.0,2.0,0.03614981633940962,256.0,3.0,1.0,128,0.7697638035747612,5.0,5,Adam,,,,,,,"{""block_0_dropout"": 0.03248055129164263, ""block_0_filters"": 32, ""block_0_kernel"": 5, ""block_1_dropout"": 0.021855758377527592, ""block_1_filters"": 64, ""block_1_kernel"": 3, ""block_1_stride"": 1, ""block_2_dropout"": 0.012160546728448263, ""block_2_filters"": 128, ""block_2_kernel"": 5, ""block_2_stride"": 1, ""n_blocks"": 5}",PRUNED
85,0.4949808373152893,2026-10-04 15:32:14.707610,2026-10-04 15:32:17.938756,0 days 00:00:03.231146,0.8542437665974584,0.9188226548685631,0.000246123336742312,0.00020549313261321157,64.0,0.014694900769473279,32,5,3,0.017114635064779476,64,3,1,0.026017893105464,128,5,1,0.03470041675258923,64.0,3.0,2.0,0.013023096581306681,256.0,3.0,1.0,128,0.6282749202543765,6.0,5,Adam,,,,,,,"{""block_0_dropout"": 0.014694900769473279, ""block_0_filters"": 32, ""block_0_kernel"": 5, ""block_1_dropout"": 0.017114635064779476, ""block_1_filters"": 64, ""block_1_kernel"": 3, ""block_1_stride"": 1, ""block_2_dropout"": 0.026017893105464, ""block_2_filters"": 128, ""block_2_kernel"": 5, ""block_2_stride"": 1, ""n_blocks"": 5}",PRUNED
86,0.397494663977927,2026-10-04 15:32:18.005432,2026-10-04 15:32:21.588869,0 days 00:00:03.583437,0.8616567523701495,0.9803088865718013,0.0011973634571463296,0.0004837170741128528,64.0,0.016174677466441544,32,5,3,0.012824967180201706,64,3,1,0.025264245919631133,128,5,1,0.031458656875294144,128.0,5.0,2.0,0.011909263985094174,256.0,3.0,1.0,256,0.8765934481430314,7.0,5,Adam,,,,,,,"{""block_0_dropout"": 0.016174677466441544, ""block_0_filters"": 32, ""block_0_kernel"": 5, ""block_1_dropout"": 0.012824967180201706, ""block_1_filters"": 64, ""block_1_kernel"": 3, ""block_1_stride"": 1, ""block_2_dropout"": 0.025264245919631133, ""block_2_filters"": 128, ""block_2_kernel"": 5, ""block_2_stride"": 1, ""n_blocks"": 5}",PRUNED
87,0.6367081908803305,2026-10-04 15:32:21.645643,2026-10-04 15:32:25.947388,0 days 00:00:04.301745,0.850945099886157,0.9000462198051914,0.0002964544446073758,0.00029195915759896144,200.0,0.01371004036410984,32,5,3,0.017849679717790147,64,3,1,0.021488532802217415,128,5,1,0.04849204220815384,64.0,5.0,2.0,0.027800701757660175,512.0,3.0,1.0,128,0.8301595529734306,9.0,5,Adam,,,,,,,"{""block_0_dropout"": 0.01371004036410984, ""block_0_filters"": 32, ""block_0_kernel"": 5, ""block_1_dropout"": 0.017849679717790147, ""block_1_filters"": 64, ""block_1_kernel"": 3, ""block_1_stride"": 1, ""block_2_dropout"": 0.021488532802217415, ""block_2_filters"": 128, ""block_2_kernel"": 5, ""block_2_stride"": 1, ""n_blocks"": 5}",PRUNED
88,0.6288828770887633,2026-10-04 15:32:26.003913,2026-10-04 15:32:30.705718,0 days 00:00:04.701805,0.8663228045326078,0.9075544728136625,0.00016301128898513683,7.709569176941875e-05,64.0,0.014145488769481192,32,5,3,0.010476688130472256,64,3,1,0.022915638162473346,128,5,1,0.036549524799781345,64.0,5.0,2.0,0.03394661674542279,256.0,3.0,1.0,128,0.8611876178224169,16.0,5,Adam,,,,,,,"{""block_0_dropout"": 0.014145488769481192, ""block_0_filters"": 32, ""block_0_kernel"": 5, ""block_1_dropout"": 0.010476688130472256, ""block_1_filters"": 64, ""block_1_kernel"": 3, ""block_1_stride"": 1, ""block_2_dropout"": 0.022915638162473346, ""block_2_filters"": 128, ""block_2_kernel"": 5, ""block_2_stride"": 1, ""n_blocks"": 5}",PRUNED
89,0.1591874979903516,2026-10-04 15:32:30.767675,2026-10-04 15:32:33.994348,0 days 00:00:03.226673,,,,,64.0,0.027385587724786987,32,5,3,0.013928878893555227,64,3,2,0.028415465802278925,128,5,1,0.039242773111455555,64.0,5.0,1.0,,,,,128,0.583989394907044,5.0,4,SGD,0.00012581527519334743,0.7515623593496444,5.6415675572086855e-06,,,,"{""block_0_dropout"": 0.027385587724786987, ""block_0_filters"": 32, ""block_0_kernel"": 5, ""block_1_dropout"": 0.013928878893555227, ""block_1_filters"": 64, ""block_1_kernel"": 3, ""block_1_stride"": 2, ""block_2_dropout"": 0.028415465802278925, ""block_2_filters"": 128, ""block_2_kernel"": 5, ""block_2_stride"": 1, ""n_blocks"": 4}",PRUNED
90,0.8568778258233953,2026-10-04 15:32:34.054130,2026-10-04 15:32:54.553926,0 days 00:00:20.499796,0.9244460169206712,0.9264347469615867,0.0002051465713696145,0.0007217689084116005,64.0,0.02035168704427993,32,5,3,0.018810534358016138,64,3,1,0.012112877072832415,128,5,1,0.046576919621569124,256.0,5.0,2.0,0.01582452224759468,256.0,3.0,1.0,128,0.7124392740064018,6.0,5,Adam,,,,39.0,0.8698224852071006,0.8439331664396902,"{""block_0_dropout"": 0.02035168704427993, ""block_0_filters"": 32, ""block_0_kernel"": 5, ""block_1_dropout"": 0.018810534358016138, ""block_1_filters"": 64, ""block_1_kernel"": 3, ""block_1_stride"": 1, ""block_2_dropout"": 0.012112877072832415, ""block_2_filters"": 128, ""block_2_kernel"": 5, ""block_2_stride"": 1, ""n_blocks"": 5}",COMPLETE
91,0.8665135892403178,2026-10-04 15:32:54.615524,2026-10-04 15:33:13.181145,0 days 00:00:18.565621,0.9357236634844246,0.9260663957468741,0.00020307525946072858,0.0007284037722305575,64.0,0.017038539946843654,32,5,3,0.011225520504920039,64,3,1,0.013747882023869028,128,5,1,0.04710246814323854,256.0,5.0,2.0,0.015333824775936415,256.0,3.0,1.0,128,0.6791256062757371,6.0,5,Adam,,,,33.0,0.8875739644970414,0.8454532139835943,"{""block_0_dropout"": 0.017038539946843654, ""block_0_filters"": 32, ""block_0_kernel"": 5, ""block_1_dropout"": 0.011225520504920039, ""block_1_filters"": 64, ""block_1_kernel"": 3, ""block_1_stride"": 1, ""block_2_dropout"": 0.013747882023869028, ""block_2_filters"": 128, ""block_2_kernel"": 5, ""block_2_stride"": 1, ""n_blocks"": 5}",COMPLETE
