number,value,datetime_start,datetime_complete,duration,params_adam_beta1,params_adam_beta2,params_adam_lr,params_adam_wd,params_batch_size,params_dropout,params_fc_hidden,params_lr_factor,params_lr_patience,params_optimizer,params_sgd_lr,params_sgd_momentum,params_sgd_wd,user_attrs_best_epoch,user_attrs_validation_accuracy,user_attrs_validation_macro_f1,state
0,1.0,2026-10-08 16:27:31.872041,2026-10-08 16:28:02.381026,0 days 00:00:30.508985,,,,,64,0.07800932022121826,128,0.11646759543664197,20,SGD,0.0396760507705299,0.8743233534055306,0.0006796578090758161,1.0,1.0,1.0,COMPLETE
1,1.0,2026-10-08 16:28:02.525112,2026-10-08 16:28:25.540201,0 days 00:00:23.015089,,,,,128,0.14561457009902096,256,0.728140769114411,8,SGD,0.0007523742884534858,0.8062449345551705,6.672367170464208e-05,20.0,1.0,1.0,COMPLETE
2,1.0,2026-10-08 16:28:25.679502,2026-10-08 16:28:48.925385,0 days 00:00:23.245883,,,,,128,0.4828160165372797,512,0.19763058787582308,12,SGD,0.00019634341572933326,0.8984275776885255,5.762487216478604e-05,40.0,1.0,1.0,COMPLETE
3,1.0,2026-10-08 16:28:49.071468,2026-10-08 16:29:08.783874,0 days 00:00:19.712406,,,,,200,0.09242722776276352,64,0.8374993880184934,6,SGD,0.06584106160121614,0.9594999316240181,0.0002463768595899747,2.0,1.0,1.0,COMPLETE
4,1.0,2026-10-08 16:29:08.936134,2026-10-08 16:29:31.772835,0 days 00:00:22.836701,,,,,128,0.14046725484369038,256,0.717795815437326,8,SGD,0.025502980701628937,0.7216196866671335,0.008862326508576254,1.0,1.0,1.0,COMPLETE
5,0.9983440886646049,2026-10-08 16:29:31.907747,2026-10-08 16:29:36.450016,0 days 00:00:04.542269,,,,,128,0.05793452976256486,128,0.36014665762139764,16,SGD,0.0009833181933644897,0.7184319215829468,1.753594952976443e-05,,,,PRUNED
6,1.0,2026-10-08 16:29:36.585664,2026-10-08 16:29:59.669033,0 days 00:00:23.083369,0.8651047997790626,0.9031397756501047,0.0007162786999897341,1.263794633808288e-06,128,0.3854835899772805,256,0.6091283290110243,10,Adam,,,,1.0,1.0,1.0,COMPLETE
7,1.0,2026-10-08 16:29:59.804107,2026-10-08 16:30:19.184917,0 days 00:00:19.380810,0.9720044826262805,0.9802868404822216,0.004132765459466363,0.000341676434183297,200,0.144875726456884,128,0.24925604710882868,19,Adam,,,,1.0,1.0,1.0,COMPLETE
8,1.0,2026-10-08 16:30:19.327498,2026-10-08 16:30:48.842845,0 days 00:00:29.515347,,,,,64,0.40900738296124656,512,0.19589229386694626,10,SGD,0.0034059785435329977,0.8210491909131459,7.7344821566468e-06,3.0,1.0,1.0,COMPLETE
9,0.9824507129026581,2026-10-08 16:30:48.981740,2026-10-08 16:30:53.548226,0 days 00:00:04.566486,,,,,128,0.12589114791268208,256,0.5021432185830892,5,SGD,0.000715354779469316,0.7106972147328144,0.000274319913977967,,,,PRUNED
10,1.0,2026-10-08 16:30:53.689778,2026-10-08 16:31:24.094912,0 days 00:00:30.405134,0.9770730713395525,0.9958810975199475,0.00010862348973937149,0.007645683783605599,64,0.2794254491287337,128,0.422359922501545,20,Adam,,,,5.0,1.0,1.0,COMPLETE
11,1.0,2026-10-08 16:31:24.228884,2026-10-08 16:31:54.435511,0 days 00:00:30.206627,,,,,64,0.0040206103892895945,64,0.8889443507086571,14,SGD,0.011172508747844114,0.8317290273423104,0.0013941165518456247,1.0,1.0,1.0,COMPLETE
12,0.9411681269331709,2026-10-08 16:31:54.574316,2026-10-08 16:32:00.744161,0 days 00:00:06.169845,,,,,64,0.23068971983536865,256,0.6527521939995483,17,SGD,0.0001454699438128176,0.8257384029307472,1.94099403289878e-06,,,,PRUNED
13,1.0,2026-10-08 16:32:00.880799,2026-10-08 16:32:30.481855,0 days 00:00:29.601056,,,,,64,0.22827167832548137,128,0.3448400509416969,14,SGD,0.003987009996875617,0.8846418190929981,0.00045042834710787066,3.0,1.0,1.0,COMPLETE
14,1.0,2026-10-08 16:32:30.628426,2026-10-08 16:32:50.028084,0 days 00:00:19.399658,0.859332234868209,0.9283914118467068,0.009917608120507165,1.3962100266000202e-06,200,0.20012223661700074,256,0.49555582910893176,17,Adam,,,,1.0,1.0,1.0,COMPLETE
15,1.0,2026-10-08 16:32:50.159746,2026-10-08 16:33:12.732934,0 days 00:00:22.573188,,,,,128,0.005494594621885618,128,0.7614864950156898,8,SGD,0.08872754604813389,0.7753829087944386,0.0022569599258310505,1.0,1.0,1.0,COMPLETE
16,0.9968475350378407,2026-10-08 16:33:12.870517,2026-10-08 16:33:19.029583,0 days 00:00:06.159066,,,,,64,0.3109102367083049,64,0.11054337150473875,13,SGD,0.0008496318594228032,0.8905721382549928,5.718796004394957e-05,,,,PRUNED
17,1.0,2026-10-08 16:33:19.185482,2026-10-08 16:33:40.708311,0 days 00:00:21.522829,,,,,128,0.06614042897739132,512,0.5716299599149587,11,SGD,0.008974835513193231,0.7807178289715576,2.8315782940027832e-05,1.0,1.0,1.0,COMPLETE
18,1.0,2026-10-08 16:33:40.845141,2026-10-08 16:34:09.317241,0 days 00:00:28.472100,0.9175988105045949,0.9554222965937597,0.00013159405537260094,7.272499656034689e-05,64,0.17835198485403547,128,0.10754858444071225,15,Adam,,,,3.0,1.0,1.0,COMPLETE
19,0.9983440886646049,2026-10-08 16:34:09.448329,2026-10-08 16:34:13.193113,0 days 00:00:03.744784,,,,,200,0.0721849249816835,256,0.32190494173729983,7,SGD,0.00038490209497786716,0.9542143574176719,0.00012063488952886118,,,,PRUNED
20,1.0,2026-10-08 16:34:13.326283,2026-10-08 16:34:46.198890,0 days 00:00:32.872607,,,,,64,0.2663574662944546,256,0.7800510130195956,18,SGD,0.0033905085927758323,0.8573230306073899,0.0008868308571530527,2.0,1.0,1.0,COMPLETE
21,0.9322659059343157,2026-10-08 16:34:46.341528,2026-10-08 16:34:51.097723,0 days 00:00:04.756195,,,,,128,0.48671457051424577,512,0.20764214114449422,12,SGD,0.00010325284363778834,0.9150611709356693,7.572849695261565e-05,,,,PRUNED
22,0.9918069656201678,2026-10-08 16:34:51.231313,2026-10-08 16:34:55.789268,0 days 00:00:04.557955,,,,,128,0.4813647280510102,512,0.2658936277714672,9,SGD,0.0003111115930724189,0.9138922708972126,1.0831838530636372e-05,,,,PRUNED
23,0.988657419489535,2026-10-08 16:34:55.926961,2026-10-08 16:35:00.578371,0 days 00:00:04.651410,,,,,128,0.35193716444897627,512,0.1747896538973724,5,SGD,0.00028976713527133067,0.877053970685817,2.8083433326867717e-06,,,,PRUNED
24,1.0,2026-10-08 16:35:00.720801,2026-10-08 16:35:25.849095,0 days 00:00:25.128294,,,,,128,0.4348239405179214,512,0.43275256127832784,13,SGD,0.0016754641888188629,0.7782425465170097,0.004768845380805224,7.0,1.0,1.0,COMPLETE
25,0.978993270645107,2026-10-08 16:35:25.988223,2026-10-08 16:35:31.137528,0 days 00:00:05.149305,,,,,128,0.33433075010990165,512,0.1599918467994662,20,SGD,0.0001871439595321716,0.9119482062187728,3.564788674411224e-05,,,,PRUNED
26,1.0,2026-10-08 16:35:31.272068,2026-10-08 16:35:55.253508,0 days 00:00:23.981440,0.9185651757105271,0.952569116087763,0.0008891959815138327,0.008053548891769556,128,0.03162591736260346,128,0.27913266463501046,11,Adam,,,,1.0,1.0,1.0,COMPLETE
27,1.0,2026-10-08 16:35:55.395473,2026-10-08 16:36:17.110152,0 days 00:00:21.714679,,,,,128,0.10332159059098132,64,0.6926704655607323,7,SGD,0.03158600684184047,0.8562030112718952,0.0005182607569692148,1.0,1.0,1.0,COMPLETE
28,1.0,2026-10-08 16:36:17.246377,2026-10-08 16:36:35.700036,0 days 00:00:18.453659,,,,,200,0.19328305680893143,128,0.1039124478740838,9,SGD,0.001587608292541265,0.9406563191658766,0.0001463243643326611,10.0,1.0,1.0,COMPLETE
29,1.0,2026-10-08 16:36:35.832352,2026-10-08 16:37:03.720777,0 days 00:00:27.888425,,,,,64,0.4517695010726546,64,0.8225127556710291,7,SGD,0.00048789725985653093,0.9881471786207305,4.2484746755840044e-06,3.0,1.0,1.0,COMPLETE
30,1.0,2026-10-08 16:37:03.853098,2026-10-08 16:37:22.213365,0 days 00:00:18.360267,,,,,200,0.09433672757972174,512,0.5339352171822247,6,SGD,0.007506176619890013,0.8053039978538832,4.9548073937280195e-05,3.0,1.0,1.0,COMPLETE
31,1.0,2026-10-08 16:37:22.345142,2026-10-08 16:37:40.718622,0 days 00:00:18.373480,,,,,200,0.1573698151459858,64,0.8517931931043382,6,SGD,0.059610888931774304,0.9784150436313195,0.0001326331314769226,2.0,1.0,1.0,COMPLETE
32,1.0,2026-10-08 16:37:40.851368,2026-10-08 16:37:59.206831,0 days 00:00:18.355463,,,,,200,0.10966090194838485,64,0.7184697045885658,8,SGD,0.02442549718111793,0.9399846038295605,0.00028909709530549216,1.0,1.0,1.0,COMPLETE
33,1.0,2026-10-08 16:37:59.338477,2026-10-08 16:38:17.703066,0 days 00:00:18.364589,,,,,200,0.041856849204203815,256,0.8945909491092041,6,SGD,0.05090066780727239,0.9603266356207153,0.00022297159364709622,3.0,1.0,1.0,COMPLETE
34,1.0,2026-10-08 16:38:17.835662,2026-10-08 16:38:39.239781,0 days 00:00:21.404119,,,,,128,0.08659641323940064,64,0.793239466977818,9,SGD,0.012719951564299817,0.857674668512006,0.0006884288789779973,2.0,1.0,1.0,COMPLETE
35,1.0,2026-10-08 16:38:39.371478,2026-10-08 16:38:57.994011,0 days 00:00:18.622533,0.9285227087660517,0.9024953252619158,0.0009392449615052684,3.571344592510507e-05,200,0.1405945324376946,256,0.7330553580635045,10,Adam,,,,1.0,1.0,1.0,COMPLETE
36,1.0,2026-10-08 16:38:58.125999,2026-10-08 16:39:19.466444,0 days 00:00:21.340445,,,,,128,0.03982910805784364,128,0.6112032339360634,16,SGD,0.09972583815944672,0.7446905869018761,0.001825374623087064,1.0,1.0,1.0,COMPLETE
37,1.0,2026-10-08 16:39:19.598830,2026-10-08 16:39:41.000646,0 days 00:00:21.401816,,,,,128,0.1616904419437957,64,0.2217003196039945,5,SGD,0.02203857409922358,0.9040029400742283,8.126047278839931e-05,1.0,1.0,1.0,COMPLETE
38,1.0,2026-10-08 16:39:41.132017,2026-10-08 16:40:09.664883,0 days 00:00:28.532866,0.8888380730757438,0.9351849276495087,0.0002622940430973794,0.0007410785953495474,64,0.3865243379334844,256,0.3969822278574724,19,Adam,,,,1.0,1.0,1.0,COMPLETE
39,1.0,2026-10-08 16:40:09.796520,2026-10-08 16:40:28.240964,0 days 00:00:18.444444,,,,,200,0.13397186102561193,128,0.6626305348973824,11,SGD,0.04001379601481075,0.7536206512910402,0.00976751412838765,2.0,1.0,1.0,COMPLETE
40,1.0,2026-10-08 16:40:28.377867,2026-10-08 16:40:56.215616,0 days 00:00:27.837749,,,,,64,0.244668022520035,512,0.8431315728641406,15,SGD,0.019506296000167934,0.9319164632323204,2.628257096990347e-05,1.0,1.0,1.0,COMPLETE
41,1.0,2026-10-08 16:40:56.351356,2026-10-08 16:41:17.757615,0 days 00:00:21.406259,,,,,128,0.11657018395970685,256,0.1426663923459629,8,SGD,0.05740122362792441,0.7375805181791293,1.6283135533217465e-05,1.0,1.0,1.0,COMPLETE
42,1.0,2026-10-08 16:41:17.890774,2026-10-08 16:41:39.201764,0 days 00:00:21.310990,,,,,128,0.20813717289835748,256,0.6344111039956182,10,SGD,0.06885693074855619,0.7996728399931052,0.005304341423323241,1.0,1.0,1.0,COMPLETE
43,1.0,2026-10-08 16:41:39.334929,2026-10-08 16:42:00.746229,0 days 00:00:21.411300,,,,,128,0.06330286904087515,256,0.7041757379137551,7,SGD,0.04031672554236196,0.7054592974087066,0.0002341769201799679,1.0,1.0,1.0,COMPLETE
44,1.0,2026-10-08 16:42:00.879642,2026-10-08 16:42:22.176907,0 days 00:00:21.297265,,,,,128,0.017025222325870226,256,0.803940280540763,8,SGD,0.001379392865944049,0.8423953171888641,0.0010007016508767693,7.0,1.0,1.0,COMPLETE
45,1.0,2026-10-08 16:42:22.311372,2026-10-08 16:42:51.006138,0 days 00:00:28.694766,0.9446140182524503,0.9742590952683388,0.002527500324479543,1.0638297999881121e-05,64,0.30097630117436636,128,0.7649114881102964,12,Adam,,,,1.0,1.0,1.0,COMPLETE
46,1.0,2026-10-08 16:42:51.139500,2026-10-08 16:43:12.606848,0 days 00:00:21.467348,,,,,128,0.17210324834350366,256,0.5671581950579433,6,SGD,0.004697749555689616,0.8105331057963048,0.0030512634862925997,2.0,1.0,1.0,COMPLETE
47,1.0,2026-10-08 16:43:12.740202,2026-10-08 16:43:40.598991,0 days 00:00:27.858789,,,,,64,0.08713676364133016,64,0.8616345758943657,17,SGD,0.016163809271715224,0.8761116822350488,0.00038906042108498344,2.0,1.0,1.0,COMPLETE
48,0.9902708880451239,2026-10-08 16:43:40.731592,2026-10-08 16:43:45.071727,0 days 00:00:04.340135,,,,,128,0.13196907260244373,256,0.3081990289968161,19,SGD,0.0005816831834861195,0.7306204425292449,8.643196528822587e-05,,,,PRUNED
49,0.4617449654282729,2026-10-08 16:43:45.207104,2026-10-08 16:43:49.000386,0 days 00:00:03.793282,,,,,200,0.21759745164530725,128,0.499931575830211,9,SGD,0.00016519516680951643,0.7617107097145466,1.4454553964539816e-05,,,,PRUNED
