number,value,datetime_start,datetime_complete,duration,params_adam_beta1,params_adam_beta2,params_adam_lr,params_adam_wd,params_batch_size,params_block_0_dropout,params_block_0_filters,params_block_0_kernel,params_block_0_stride,params_block_1_dropout,params_block_1_filters,params_block_1_kernel,params_block_1_stride,params_block_2_dropout,params_block_2_filters,params_block_2_kernel,params_block_2_stride,params_block_3_dropout,params_block_3_filters,params_block_3_kernel,params_block_3_stride,params_fc_hidden,params_first_conv_filters,params_first_conv_kernel_size,params_lr_factor,params_lr_patience,params_n_blocks,params_optimizer,params_sgd_lr,params_sgd_momentum,params_sgd_wd,user_attrs_best_epoch,user_attrs_validation_accuracy,user_attrs_validation_macro_f1,system_attrs_tpe:relative_params:0,state
61,0.38968653804601144,2026-09-27 02:12:14.434906,2026-09-27 02:15:30.959087,0 days 00:03:16.524181,0.892403851809294,0.9302313004610462,0.000863342679050702,0.0016014182263953062,200.0,0.03217004645361039,32,7,3,0.013956419166373434,64,3,2,0.04563423809462012,64,3,2,,,,,512,256,7,0.320589324285903,7.0,3,Adam,,,,,,,"{""block_0_dropout"": 0.03217004645361039, ""block_0_filters"": 32, ""block_0_kernel"": 7, ""block_1_dropout"": 0.013956419166373434, ""block_1_filters"": 64, ""block_1_kernel"": 3, ""block_1_stride"": 2, ""block_2_dropout"": 0.04563423809462012, ""block_2_filters"": 64, ""block_2_kernel"": 3, ""block_2_stride"": 2, ""first_conv_filters"": 256, ""first_conv_kernel_size"": 7, ""n_blocks"": 3}",PRUNED
62,0.7321878902859121,2026-09-27 02:15:31.043951,2026-09-27 02:22:17.672191,0 days 00:06:46.628240,0.9036004161533027,0.9133983907697326,0.0005330431657163573,0.0043309770087045455,200.0,0.016350282450707902,32,7,3,0.018728620553011707,64,5,2,0.04954563258421491,64,3,2,,,,,512,256,3,0.4008909760888136,5.0,3,Adam,,,,50.0,0.7692307692307693,0.695145011341055,"{""block_0_dropout"": 0.016350282450707902, ""block_0_filters"": 32, ""block_0_kernel"": 7, ""block_1_dropout"": 0.018728620553011707, ""block_1_filters"": 64, ""block_1_kernel"": 5, ""block_1_stride"": 2, ""block_2_dropout"": 0.04954563258421491, ""block_2_filters"": 64, ""block_2_kernel"": 3, ""block_2_stride"": 2, ""first_conv_filters"": 256, ""first_conv_kernel_size"": 3, ""n_blocks"": 3}",COMPLETE
63,0.8273335073712529,2026-09-27 02:22:17.754046,2026-09-27 02:31:22.365789,0 days 00:09:04.611743,0.8864130859572659,0.9414255544115729,0.001081400288024049,0.0027980210820343875,200.0,0.014759101866489873,32,7,3,0.021820409945213927,64,5,2,0.037407727292130814,64,3,2,,,,,512,256,5,0.28023248909892506,8.0,3,Adam,,,,44.0,0.834319526627219,0.8203474881152868,"{""block_0_dropout"": 0.014759101866489873, ""block_0_filters"": 32, ""block_0_kernel"": 7, ""block_1_dropout"": 0.021820409945213927, ""block_1_filters"": 64, ""block_1_kernel"": 5, ""block_1_stride"": 2, ""block_2_dropout"": 0.037407727292130814, ""block_2_filters"": 64, ""block_2_kernel"": 3, ""block_2_stride"": 2, ""first_conv_filters"": 256, ""first_conv_kernel_size"": 5, ""n_blocks"": 3}",COMPLETE
64,0.40059034149090433,2026-09-27 02:31:22.447205,2026-09-27 02:34:39.000445,0 days 00:03:16.553240,0.8894887927792942,0.9362537131972786,0.001199971034890673,0.0025236562929664345,200.0,0.026843534244797018,32,7,3,0.01201275996656136,64,3,2,0.038886174690268324,64,3,2,,,,,512,256,7,0.28874930067745497,8.0,3,Adam,,,,,,,"{""block_0_dropout"": 0.026843534244797018, ""block_0_filters"": 32, ""block_0_kernel"": 7, ""block_1_dropout"": 0.01201275996656136, ""block_1_filters"": 64, ""block_1_kernel"": 3, ""block_1_stride"": 2, ""block_2_dropout"": 0.038886174690268324, ""block_2_filters"": 64, ""block_2_kernel"": 3, ""block_2_stride"": 2, ""first_conv_filters"": 256, ""first_conv_kernel_size"": 7, ""n_blocks"": 3}",PRUNED
65,0.7945892661613151,2026-09-27 02:34:39.094497,2026-09-27 02:43:43.297614,0 days 00:09:04.203117,0.8704518177082695,0.9245296272940036,0.0006564910804378432,0.005709734702478101,200.0,0.014910149778403686,32,7,3,0.010770565549458072,64,5,2,0.03407391125965973,64,3,2,,,,,512,256,5,0.3403990960093076,9.0,3,Adam,,,,47.0,0.8106508875739645,0.7785276447486656,"{""block_0_dropout"": 0.014910149778403686, ""block_0_filters"": 32, ""block_0_kernel"": 7, ""block_1_dropout"": 0.010770565549458072, ""block_1_filters"": 64, ""block_1_kernel"": 5, ""block_1_stride"": 2, ""block_2_dropout"": 0.03407391125965973, ""block_2_filters"": 64, ""block_2_kernel"": 3, ""block_2_stride"": 2, ""first_conv_filters"": 256, ""first_conv_kernel_size"": 5, ""n_blocks"": 3}",COMPLETE
66,0.8020428216708936,2026-09-27 02:43:43.377151,2026-09-27 02:52:47.877692,0 days 00:09:04.500541,0.8673761347469141,0.9228691166505102,0.000669884026059472,0.006124126844505828,200.0,0.022997468075790364,32,7,3,0.014868390693895289,64,5,2,0.033694790538182376,64,3,2,,,,,512,256,5,0.33872355117764896,10.0,3,Adam,,,,47.0,0.8165680473372781,0.7875175960045091,"{""block_0_dropout"": 0.022997468075790364, ""block_0_filters"": 32, ""block_0_kernel"": 7, ""block_1_dropout"": 0.014868390693895289, ""block_1_filters"": 64, ""block_1_kernel"": 5, ""block_1_stride"": 2, ""block_2_dropout"": 0.033694790538182376, ""block_2_filters"": 64, ""block_2_kernel"": 3, ""block_2_stride"": 2, ""first_conv_filters"": 256, ""first_conv_kernel_size"": 5, ""n_blocks"": 3}",COMPLETE
67,0.8051481812496237,2026-09-27 02:52:47.956929,2026-09-27 03:01:52.404063,0 days 00:09:04.447134,0.8659316323223869,0.9215328590025123,0.0006482318088314514,0.006381972533299079,200.0,0.019882789779737845,32,7,3,0.018350146360426305,64,5,2,0.033816502424943155,64,3,2,,,,,512,256,5,0.34340841081089074,10.0,3,Adam,,,,41.0,0.7988165680473372,0.8114797944519102,"{""block_0_dropout"": 0.019882789779737845, ""block_0_filters"": 32, ""block_0_kernel"": 7, ""block_1_dropout"": 0.018350146360426305, ""block_1_filters"": 64, ""block_1_kernel"": 5, ""block_1_stride"": 2, ""block_2_dropout"": 0.033816502424943155, ""block_2_filters"": 64, ""block_2_kernel"": 3, ""block_2_stride"": 2, ""first_conv_filters"": 256, ""first_conv_kernel_size"": 5, ""n_blocks"": 3}",COMPLETE
68,0.45064495198673027,2026-09-27 03:01:52.484309,2026-09-27 03:06:27.499348,0 days 00:04:35.015039,0.8606848147916646,0.92115591955981,0.0006353406629659329,0.009690429889110575,200.0,0.02283231112736621,32,7,3,0.013314137243053687,64,3,2,0.042077040413162424,64,3,2,,,,,512,256,7,0.339250823467256,10.0,3,Adam,,,,,,,"{""block_0_dropout"": 0.02283231112736621, ""block_0_filters"": 32, ""block_0_kernel"": 7, ""block_1_dropout"": 0.013314137243053687, ""block_1_filters"": 64, ""block_1_kernel"": 3, ""block_1_stride"": 2, ""block_2_dropout"": 0.042077040413162424, ""block_2_filters"": 64, ""block_2_kernel"": 3, ""block_2_stride"": 2, ""first_conv_filters"": 256, ""first_conv_kernel_size"": 7, ""n_blocks"": 3}",PRUNED
69,0.7995651342906895,2026-09-27 03:06:27.579108,2026-09-27 03:15:31.754422,0 days 00:09:04.175314,0.8689904258147074,0.914291690606887,0.00034098022794184254,0.005641929237984014,200.0,0.026019237863344553,32,7,3,0.01166065772600835,64,5,2,0.03431420114717211,64,3,2,,,,,512,256,5,0.30846054911707893,9.0,3,Adam,,,,46.0,0.8106508875739645,0.7884793810074144,"{""block_0_dropout"": 0.026019237863344553, ""block_0_filters"": 32, ""block_0_kernel"": 7, ""block_1_dropout"": 0.01166065772600835, ""block_1_filters"": 64, ""block_1_kernel"": 5, ""block_1_stride"": 2, ""block_2_dropout"": 0.03431420114717211, ""block_2_filters"": 64, ""block_2_kernel"": 3, ""block_2_stride"": 2, ""first_conv_filters"": 256, ""first_conv_kernel_size"": 5, ""n_blocks"": 3}",COMPLETE
70,0.40700192822208736,2026-09-27 03:15:31.832147,2026-09-27 03:16:57.175405,0 days 00:01:25.343258,0.8684399622083575,0.9140946758583334,0.00012858192710007462,0.005989769203821413,128.0,0.025967053696387705,32,7,3,0.010861848650649177,16,5,2,0.033544766315776,64,3,2,,,,,512,256,5,0.3066234105654738,9.0,3,Adam,,,,,,,"{""block_0_dropout"": 0.025967053696387705, ""block_0_filters"": 32, ""block_0_kernel"": 7, ""block_1_dropout"": 0.010861848650649177, ""block_1_filters"": 16, ""block_1_kernel"": 5, ""block_1_stride"": 2, ""block_2_dropout"": 0.033544766315776, ""block_2_filters"": 64, ""block_2_kernel"": 3, ""block_2_stride"": 2, ""first_conv_filters"": 256, ""first_conv_kernel_size"": 5, ""n_blocks"": 3}",PRUNED
71,0.41374985941793746,2026-09-27 03:16:57.265867,2026-09-27 03:18:46.225100,0 days 00:01:48.959233,0.8697903128906979,0.9040808573622261,0.0003852932374651701,0.006130404975260706,200.0,0.013215227008602299,32,7,3,0.010620760842996456,64,5,2,0.03485806770624156,64,3,2,,,,,512,256,5,0.3453676712727131,10.0,3,Adam,,,,,,,"{""block_0_dropout"": 0.013215227008602299, ""block_0_filters"": 32, ""block_0_kernel"": 7, ""block_1_dropout"": 0.010620760842996456, ""block_1_filters"": 64, ""block_1_kernel"": 5, ""block_1_stride"": 2, ""block_2_dropout"": 0.03485806770624156, ""block_2_filters"": 64, ""block_2_kernel"": 3, ""block_2_stride"": 2, ""first_conv_filters"": 256, ""first_conv_kernel_size"": 5, ""n_blocks"": 3}",PRUNED
72,0.7945136860299358,2026-09-27 03:18:46.306275,2026-09-27 03:27:50.429073,0 days 00:09:04.122798,0.8627095115845553,0.9260296283878887,0.0005253600052595393,0.003628994400757743,200.0,0.022080127262465735,32,7,3,0.01493736205236941,64,5,2,0.0348110671344989,64,3,2,,,,,512,256,5,0.393563673269883,10.0,3,Adam,,,,44.0,0.8106508875739645,0.7783764844859069,"{""block_0_dropout"": 0.022080127262465735, ""block_0_filters"": 32, ""block_0_kernel"": 7, ""block_1_dropout"": 0.01493736205236941, ""block_1_filters"": 64, ""block_1_kernel"": 5, ""block_1_stride"": 2, ""block_2_dropout"": 0.0348110671344989, ""block_2_filters"": 64, ""block_2_kernel"": 3, ""block_2_stride"": 2, ""first_conv_filters"": 256, ""first_conv_kernel_size"": 5, ""n_blocks"": 3}",COMPLETE
73,0.4591262645743821,2026-09-27 03:27:50.518492,2026-09-27 03:30:44.566960,0 days 00:02:54.048468,0.8532451037183137,0.9179960357991737,0.00029986699618787246,0.004189547623344488,200.0,0.01142736175535029,32,7,3,0.012457716364661605,64,5,2,0.03848708447096643,64,3,2,,,,,512,256,5,0.40713512375892535,10.0,3,Adam,,,,,,,"{""block_0_dropout"": 0.01142736175535029, ""block_0_filters"": 32, ""block_0_kernel"": 7, ""block_1_dropout"": 0.012457716364661605, ""block_1_filters"": 64, ""block_1_kernel"": 5, ""block_1_stride"": 2, ""block_2_dropout"": 0.03848708447096643, ""block_2_filters"": 64, ""block_2_kernel"": 3, ""block_2_stride"": 2, ""first_conv_filters"": 256, ""first_conv_kernel_size"": 5, ""n_blocks"": 3}",PRUNED
74,0.7999769486168435,2026-09-27 03:30:44.652926,2026-09-27 03:39:48.611502,0 days 00:09:03.958576,0.8626727870984957,0.9262064942136179,0.0005530316375095678,0.007444503240443851,200.0,0.024603737425272117,32,7,3,0.015545601623393577,64,5,2,0.03327317651999907,64,3,2,,,,,512,256,5,0.33312351373973415,9.0,3,Adam,,,,47.0,0.8106508875739645,0.7893030096597224,"{""block_0_dropout"": 0.024603737425272117, ""block_0_filters"": 32, ""block_0_kernel"": 7, ""block_1_dropout"": 0.015545601623393577, ""block_1_filters"": 64, ""block_1_kernel"": 5, ""block_1_stride"": 2, ""block_2_dropout"": 0.03327317651999907, ""block_2_filters"": 64, ""block_2_kernel"": 3, ""block_2_stride"": 2, ""first_conv_filters"": 256, ""first_conv_kernel_size"": 5, ""n_blocks"": 3}",COMPLETE
75,0.7723342508227071,2026-09-27 03:39:48.691296,2026-09-27 03:48:52.850827,0 days 00:09:04.159531,0.8599762271990563,0.927459416821906,0.0005018986416690488,0.0072628577047766886,200.0,0.015509487353712808,32,7,3,0.012928937908524452,64,5,2,0.03206224073156716,64,3,2,,,,,512,256,5,0.45195874842511996,9.0,3,Adam,,,,47.0,0.7869822485207101,0.7576862531247041,"{""block_0_dropout"": 0.015509487353712808, ""block_0_filters"": 32, ""block_0_kernel"": 7, ""block_1_dropout"": 0.012928937908524452, ""block_1_filters"": 64, ""block_1_kernel"": 5, ""block_1_stride"": 2, ""block_2_dropout"": 0.03206224073156716, ""block_2_filters"": 64, ""block_2_kernel"": 3, ""block_2_stride"": 2, ""first_conv_filters"": 256, ""first_conv_kernel_size"": 5, ""n_blocks"": 3}",COMPLETE
76,0.39682824914075054,2026-09-27 03:48:52.946677,2026-09-27 03:50:41.907615,0 days 00:01:48.960938,0.8762654026080271,0.9084668853212314,0.000292256862524401,0.004478442733189172,200.0,0.01731052002599226,32,7,3,0.01609851073546989,64,5,2,0.03715350278281416,64,3,2,,,,,512,256,5,0.3258987157870614,11.0,3,Adam,,,,,,,"{""block_0_dropout"": 0.01731052002599226, ""block_0_filters"": 32, ""block_0_kernel"": 7, ""block_1_dropout"": 0.01609851073546989, ""block_1_filters"": 64, ""block_1_kernel"": 5, ""block_1_stride"": 2, ""block_2_dropout"": 0.03715350278281416, ""block_2_filters"": 64, ""block_2_kernel"": 3, ""block_2_stride"": 2, ""first_conv_filters"": 256, ""first_conv_kernel_size"": 5, ""n_blocks"": 3}",PRUNED
77,0.8047754909362453,2026-09-27 03:50:41.986194,2026-09-27 03:59:46.153491,0 days 00:09:04.167297,0.864097412007902,0.9234465623515978,0.00043260398967811734,0.002251044072281579,200.0,0.023400793532564385,32,7,3,0.010886916452567817,64,5,2,0.03750820973872232,64,3,2,,,,,512,256,5,0.38857853118095653,10.0,3,Adam,,,,50.0,0.8461538461538461,0.7633971357186445,"{""block_0_dropout"": 0.023400793532564385, ""block_0_filters"": 32, ""block_0_kernel"": 7, ""block_1_dropout"": 0.010886916452567817, ""block_1_filters"": 64, ""block_1_kernel"": 5, ""block_1_stride"": 2, ""block_2_dropout"": 0.03750820973872232, ""block_2_filters"": 64, ""block_2_kernel"": 3, ""block_2_stride"": 2, ""first_conv_filters"": 256, ""first_conv_kernel_size"": 5, ""n_blocks"": 3}",COMPLETE
78,0.8062789702958044,2026-09-27 03:59:46.240173,2026-09-27 04:08:50.151502,0 days 00:09:03.911329,0.8621051419600717,0.9226598361695917,0.00042172519577477954,0.00816574440791979,200.0,0.024993683390644637,32,7,3,0.021154776466890277,64,5,2,0.03200627144316588,64,3,2,,,,,512,256,5,0.2685926689024804,9.0,3,Adam,,,,43.0,0.8165680473372781,0.7959898932543309,"{""block_0_dropout"": 0.024993683390644637, ""block_0_filters"": 32, ""block_0_kernel"": 7, ""block_1_dropout"": 0.021154776466890277, ""block_1_filters"": 64, ""block_1_kernel"": 5, ""block_1_stride"": 2, ""block_2_dropout"": 0.03200627144316588, ""block_2_filters"": 64, ""block_2_kernel"": 3, ""block_2_stride"": 2, ""first_conv_filters"": 256, ""first_conv_kernel_size"": 5, ""n_blocks"": 3}",COMPLETE
79,0.38729694135298565,2026-09-27 04:08:50.231478,2026-09-27 04:10:39.365458,0 days 00:01:49.133980,0.8662731334194861,0.9219966044774174,0.00023261116866857281,0.008290367510375303,200.0,0.031618313463303585,32,7,3,0.014896212932489813,64,5,2,0.0330339619140898,64,3,2,,,,,512,256,5,0.2709359746994062,9.0,3,Adam,,,,,,,"{""block_0_dropout"": 0.031618313463303585, ""block_0_filters"": 32, ""block_0_kernel"": 7, ""block_1_dropout"": 0.014896212932489813, ""block_1_filters"": 64, ""block_1_kernel"": 5, ""block_1_stride"": 2, ""block_2_dropout"": 0.0330339619140898, ""block_2_filters"": 64, ""block_2_kernel"": 3, ""block_2_stride"": 2, ""first_conv_filters"": 256, ""first_conv_kernel_size"": 5, ""n_blocks"": 3}",PRUNED
80,0.7897968539726782,2026-09-27 04:10:39.444680,2026-09-27 04:19:43.746693,0 days 00:09:04.302013,0.8500881902045406,0.9146790343600121,0.0004293614659703244,0.005959630287054514,200.0,0.022973752487513138,32,7,3,0.016738492311831055,64,5,2,0.030321160299058687,64,3,2,,,,,512,256,5,0.30348675153410964,9.0,3,Adam,,,,47.0,0.8106508875739645,0.7689428203713918,"{""block_0_dropout"": 0.022973752487513138, ""block_0_filters"": 32, ""block_0_kernel"": 7, ""block_1_dropout"": 0.016738492311831055, ""block_1_filters"": 64, ""block_1_kernel"": 5, ""block_1_stride"": 2, ""block_2_dropout"": 0.030321160299058687, ""block_2_filters"": 64, ""block_2_kernel"": 3, ""block_2_stride"": 2, ""first_conv_filters"": 256, ""first_conv_kernel_size"": 5, ""n_blocks"": 3}",COMPLETE
81,0.7604264548082343,2026-09-27 04:19:43.832338,2026-09-27 04:28:47.644655,0 days 00:09:03.812317,0.8625294148749646,0.9258949846866711,0.0005535539069477774,0.0020571833905341018,200.0,0.029466255387126147,32,7,3,0.01677801587288191,64,5,2,0.036710525949244587,64,3,2,,,,,512,256,5,0.3313445483879622,11.0,3,Adam,,,,50.0,0.7751479289940828,0.7457049806223859,"{""block_0_dropout"": 0.029466255387126147, ""block_0_filters"": 32, ""block_0_kernel"": 7, ""block_1_dropout"": 0.01677801587288191, ""block_1_filters"": 64, ""block_1_kernel"": 5, ""block_1_stride"": 2, ""block_2_dropout"": 0.036710525949244587, ""block_2_filters"": 64, ""block_2_kernel"": 3, ""block_2_stride"": 2, ""first_conv_filters"": 256, ""first_conv_kernel_size"": 5, ""n_blocks"": 3}",COMPLETE
82,0.7950252285336842,2026-09-27 04:28:47.725939,2026-09-27 04:37:51.503951,0 days 00:09:03.778012,0.8732541754246839,0.9100239475071292,0.0003690320400095428,0.004959521191596173,200.0,0.019802624590210587,32,7,3,0.012222798562542134,64,5,2,0.035426218099891556,64,3,2,,,,,512,256,5,0.28581989363881355,12.0,3,Adam,,,,46.0,0.8224852071005917,0.7675652499667767,"{""block_0_dropout"": 0.019802624590210587, ""block_0_filters"": 32, ""block_0_kernel"": 7, ""block_1_dropout"": 0.012222798562542134, ""block_1_filters"": 64, ""block_1_kernel"": 5, ""block_1_stride"": 2, ""block_2_dropout"": 0.035426218099891556, ""block_2_filters"": 64, ""block_2_kernel"": 3, ""block_2_stride"": 2, ""first_conv_filters"": 256, ""first_conv_kernel_size"": 5, ""n_blocks"": 3}",COMPLETE
83,0.3823876457351799,2026-09-27 04:37:51.574133,2026-09-27 04:39:51.175138,0 days 00:01:59.601005,0.8767236023807016,0.9075488662992061,0.0003345193845000176,0.005033936371246775,200.0,0.02503749597116431,32,7,3,0.015512279823519371,64,5,2,0.03903747252009041,64,3,2,,,,,512,256,5,0.25244342099518646,9.0,3,Adam,,,,,,,"{""block_0_dropout"": 0.02503749597116431, ""block_0_filters"": 32, ""block_0_kernel"": 7, ""block_1_dropout"": 0.015512279823519371, ""block_1_filters"": 64, ""block_1_kernel"": 5, ""block_1_stride"": 2, ""block_2_dropout"": 0.03903747252009041, ""block_2_filters"": 64, ""block_2_kernel"": 3, ""block_2_stride"": 2, ""first_conv_filters"": 256, ""first_conv_kernel_size"": 5, ""n_blocks"": 3}",PRUNED
84,0.7505146817196029,2026-09-27 04:39:51.253435,2026-09-27 04:48:55.358428,0 days 00:09:04.104993,0.8716336941080947,0.9183648694370397,0.0007075011873828006,0.00979857068345611,200.0,0.027466646177789933,32,7,3,0.023335662516917467,64,5,2,0.03413779678809994,64,3,2,,,,,512,256,5,0.29029587534406975,12.0,3,Adam,,,,46.0,0.7751479289940828,0.7258814344451231,"{""block_0_dropout"": 0.027466646177789933, ""block_0_filters"": 32, ""block_0_kernel"": 7, ""block_1_dropout"": 0.023335662516917467, ""block_1_filters"": 64, ""block_1_kernel"": 5, ""block_1_stride"": 2, ""block_2_dropout"": 0.03413779678809994, ""block_2_filters"": 64, ""block_2_kernel"": 3, ""block_2_stride"": 2, ""first_conv_filters"": 256, ""first_conv_kernel_size"": 5, ""n_blocks"": 3}",COMPLETE
85,0.7718397334313865,2026-09-27 04:48:55.436837,2026-09-27 04:57:59.512260,0 days 00:09:04.075423,0.8653351200702771,0.9113218716379651,0.00022659065793471738,0.005618289532231221,200.0,0.01914797727991498,32,7,3,0.020447281939856204,64,5,2,0.037031620833122135,64,3,2,,,,,512,256,5,0.3150222995396813,12.0,3,Adam,,,,41.0,0.8047337278106509,0.7389457390521219,"{""block_0_dropout"": 0.01914797727991498, ""block_0_filters"": 32, ""block_0_kernel"": 7, ""block_1_dropout"": 0.020447281939856204, ""block_1_filters"": 64, ""block_1_kernel"": 5, ""block_1_stride"": 2, ""block_2_dropout"": 0.037031620833122135, ""block_2_filters"": 64, ""block_2_kernel"": 3, ""block_2_stride"": 2, ""first_conv_filters"": 256, ""first_conv_kernel_size"": 5, ""n_blocks"": 3}",COMPLETE
86,0.8098849784754205,2026-09-27 04:57:59.607021,2026-09-27 05:07:03.450833,0 days 00:09:03.843812,0.8589689382827534,0.9169623977026482,0.00043077714785815364,0.007469138543836451,200.0,0.012252380731439735,32,7,3,0.015157749620403189,64,5,2,0.03321117877170129,64,3,2,,,,,512,256,5,0.275489798402047,10.0,3,Adam,,,,43.0,0.8165680473372781,0.803201909613563,"{""block_0_dropout"": 0.012252380731439735, ""block_0_filters"": 32, ""block_0_kernel"": 7, ""block_1_dropout"": 0.015157749620403189, ""block_1_filters"": 64, ""block_1_kernel"": 5, ""block_1_stride"": 2, ""block_2_dropout"": 0.03321117877170129, ""block_2_filters"": 64, ""block_2_kernel"": 3, ""block_2_stride"": 2, ""first_conv_filters"": 256, ""first_conv_kernel_size"": 5, ""n_blocks"": 3}",COMPLETE
87,0.5017654219598955,2026-09-27 05:07:03.530377,2026-09-27 05:09:36.002996,0 days 00:02:32.472619,0.8564543833426391,0.9049977378545557,0.00040235540518200293,0.007572941672385641,200.0,0.018662258751150372,32,7,3,0.018784325165823047,64,5,2,0.028094460394583305,64,3,2,,,,,512,256,5,0.2716260659182702,10.0,3,Adam,,,,,,,"{""block_0_dropout"": 0.018662258751150372, ""block_0_filters"": 32, ""block_0_kernel"": 7, ""block_1_dropout"": 0.018784325165823047, ""block_1_filters"": 64, ""block_1_kernel"": 5, ""block_1_stride"": 2, ""block_2_dropout"": 0.028094460394583305, ""block_2_filters"": 64, ""block_2_kernel"": 3, ""block_2_stride"": 2, ""first_conv_filters"": 256, ""first_conv_kernel_size"": 5, ""n_blocks"": 3}",PRUNED
88,0.807568654458557,2026-09-27 05:09:36.084625,2026-09-27 05:18:40.013827,0 days 00:09:03.929202,0.8582308326270252,0.9167152535976236,0.00035482856450098915,0.0009130105847730581,200.0,0.011906317952309146,32,7,3,0.018233682735277323,64,5,2,0.03162300608334122,64,3,2,,,,,512,256,5,0.23455891825535521,13.0,3,Adam,,,,46.0,0.8224852071005917,0.7926521018165223,"{""block_0_dropout"": 0.011906317952309146, ""block_0_filters"": 32, ""block_0_kernel"": 7, ""block_1_dropout"": 0.018233682735277323, ""block_1_filters"": 64, ""block_1_kernel"": 5, ""block_1_stride"": 2, ""block_2_dropout"": 0.03162300608334122, ""block_2_filters"": 64, ""block_2_kernel"": 3, ""block_2_stride"": 2, ""first_conv_filters"": 256, ""first_conv_kernel_size"": 5, ""n_blocks"": 3}",COMPLETE
