number,value,datetime_start,datetime_complete,duration,params_adam_beta1,params_adam_beta2,params_adam_lr,params_adam_wd,params_batch_size,params_block_0_dropout,params_block_0_filters,params_block_0_kernel,params_block_0_stride,params_block_1_dropout,params_block_1_filters,params_block_1_kernel,params_block_1_stride,params_block_2_dropout,params_block_2_filters,params_block_2_kernel,params_block_2_stride,params_block_3_dropout,params_block_3_filters,params_block_3_kernel,params_block_3_stride,params_fc_hidden,params_first_conv_filters,params_first_conv_kernel_size,params_lr_factor,params_lr_patience,params_n_blocks,params_optimizer,params_sgd_lr,params_sgd_momentum,params_sgd_wd,user_attrs_best_epoch,user_attrs_validation_accuracy,user_attrs_validation_macro_f1,system_attrs_tpe:relative_params:0,state
0,0.5050738192423343,2026-09-26 15:55:52.946630,2026-09-26 16:09:35.615232,0 days 00:13:42.668602,0.8926459276842719,0.9097574441892378,0.00853618986286683,0.0017123375973163992,128.0,0.043297705632016875,8,5,3,0.03447411578889518,16,3,2,0.0336965827544817,128,3,1,,,,,256,256,7,0.5105398159072941,12.0,3,Adam,,,,49.0,0.5207100591715976,0.48943757931307086,,COMPLETE
1,0.4805095342709349,2026-09-26 16:09:35.745131,2026-09-26 16:12:28.498087,0 days 00:02:52.752956,0.8662216683335181,0.9862240322449718,0.00014063366777718192,2.7155819552829413e-05,200.0,0.04687496940092468,8,7,3,0.024270133067743574,32,3,1,0.017948627261366895,64,5,2,,,,,256,128,3,0.4739788760965348,10.0,3,Adam,,,,49.0,0.47337278106508873,0.487646287476781,,COMPLETE
2,,2026-09-26 16:12:28.601192,2026-09-26 16:12:28.811475,0 days 00:00:00.210283,,,,,,0.011016765069763807,16,7,3,0.026415316921425187,64,3,2,0.03533615026041694,32,5,2,0.04570235993959911,64.0,3.0,1.0,,512,3,,,4,,,,,,,,,PRUNED
3,0.5924469967584112,2026-09-26 16:12:28.931392,2026-09-26 16:41:58.711017,0 days 00:29:29.779625,,,,,128.0,0.01888431241882921,16,7,3,0.04887128330883843,64,3,2,0.030107160929154463,32,5,1,,,,,512,512,7,0.5032813284435271,17.0,3,SGD,0.002940074130903307,0.9858386316920742,9.294394155644998e-06,32.0,0.5976331360946746,0.5872608574221478,,COMPLETE
4,0.513597652191575,2026-09-26 16:41:58.837583,2026-09-26 16:48:21.141662,0 days 00:06:22.304079,,,,,64.0,0.01905983100791752,32,5,3,0.014538940849623563,64,3,1,0.01967409163601807,32,3,2,,,,,512,256,5,0.6322518545590703,17.0,3,SGD,0.0011159088550343414,0.9105271468723695,0.0038765111709116325,49.0,0.5207100591715976,0.5064852452115524,,COMPLETE
5,0.36472093365682323,2026-09-26 16:48:21.245543,2026-09-26 16:51:29.906577,0 days 00:03:08.661034,,,,,64.0,0.019489963499872004,16,5,3,0.024708632122377342,32,5,2,0.030105483724207682,128,3,1,,,,,128,128,5,0.6642751506117486,20.0,3,SGD,0.00011828996391101285,0.8871869658130787,5.110256715654393e-06,49.0,0.378698224852071,0.35074364246157547,,COMPLETE
6,0.3814911990227288,2026-09-26 16:51:30.015410,2026-09-26 19:12:42.719529,0 days 02:21:12.704119,0.897319321959215,0.9375207369687304,0.0039046790191830895,0.0036309591863459105,200.0,0.03784119186699892,8,5,3,0.03963074471016818,64,5,1,0.046529622102258854,64,3,1,,,,,512,512,7,0.1563891639045214,14.0,3,Adam,,,,,,,,PRUNED
7,0.7215513459959145,2026-09-26 19:12:42.964336,2026-09-26 19:19:34.477461,0 days 00:06:51.513125,0.9836811392928472,0.9737159019779072,0.0020911960669713066,1.3174543864342763e-05,64.0,0.01206726884674431,16,7,3,0.04180744779074815,64,3,2,0.026358117776570794,64,3,2,,,,,512,256,5,0.43261243150684037,14.0,3,Adam,,,,49.0,0.7514792899408284,0.6916234020510007,,COMPLETE
8,0.1815961194228558,2026-09-26 19:19:34.560205,2026-09-26 19:20:09.253833,0 days 00:00:34.693628,,,,,200.0,0.02735406596951892,32,7,3,0.044259593647532895,64,3,2,0.03301896711503516,32,5,1,0.031824671572637395,128.0,3.0,1.0,512,128,3,0.15666577645355703,15.0,4,SGD,0.0001614670469622493,0.7292256203994537,1.1827346017839088e-06,,,,,PRUNED
9,,2026-09-26 19:20:09.355452,2026-09-26 19:20:09.555152,0 days 00:00:00.199700,,,,,,0.042273389570690566,16,5,3,0.027159761095000734,16,5,2,0.04582092913984802,64,5,2,0.013651467071445343,256.0,3.0,1.0,,256,5,,,4,,,,,,,,,PRUNED
10,,2026-09-26 19:20:09.623814,2026-09-26 19:20:09.829898,0 days 00:00:00.206084,,,,,,0.04418348932435133,8,7,3,0.04023574026175831,64,3,2,0.026057880854674156,64,3,2,0.013107701648057433,256.0,3.0,1.0,,256,3,,,4,,,,,,,,"{""block_0_dropout"": 0.04418348932435133, ""block_0_filters"": 8, ""block_0_kernel"": 7, ""block_1_dropout"": 0.04023574026175831, ""block_1_filters"": 64, ""block_1_kernel"": 3, ""block_1_stride"": 2, ""block_2_dropout"": 0.026057880854674156, ""block_2_filters"": 64, ""block_2_kernel"": 3, ""block_2_stride"": 2, ""first_conv_filters"": 256, ""first_conv_kernel_size"": 3, ""n_blocks"": 4}",PRUNED
11,0.6195018192509831,2026-09-26 19:20:09.908200,2026-09-26 19:50:10.797421,0 days 00:30:00.889221,,,,,128.0,0.0249291234419154,16,7,3,0.044689760857455484,64,3,2,0.03491156113616455,32,5,1,,,,,512,512,7,0.3812231313327053,6.0,3,SGD,0.04805481567542254,0.9776211723045666,0.00018837804404186193,47.0,0.621301775147929,0.6177018633540372,"{""block_0_dropout"": 0.0249291234419154, ""block_0_filters"": 16, ""block_0_kernel"": 7, ""block_1_dropout"": 0.044689760857455484, ""block_1_filters"": 64, ""block_1_kernel"": 3, ""block_1_stride"": 2, ""block_2_dropout"": 0.03491156113616455, ""block_2_filters"": 32, ""block_2_kernel"": 5, ""block_2_stride"": 1, ""first_conv_filters"": 512, ""first_conv_kernel_size"": 7, ""n_blocks"": 3}",COMPLETE
12,0.6940763816283921,2026-09-26 19:50:10.877571,2026-09-26 19:57:13.282012,0 days 00:07:02.404441,0.9781389931626887,0.9977352441512432,0.0006827657674063943,1.1020325755035095e-06,128.0,0.01675335575169469,16,7,3,0.044528902730937486,64,3,2,0.021320461953088326,32,3,2,,,,,512,256,5,0.37000171940270243,5.0,3,Adam,,,,44.0,0.6982248520710059,0.6899279111857782,"{""block_0_dropout"": 0.01675335575169469, ""block_0_filters"": 16, ""block_0_kernel"": 7, ""block_1_dropout"": 0.044528902730937486, ""block_1_filters"": 64, ""block_1_kernel"": 3, ""block_1_stride"": 2, ""block_2_dropout"": 0.021320461953088326, ""block_2_filters"": 32, ""block_2_kernel"": 3, ""block_2_stride"": 2, ""first_conv_filters"": 256, ""first_conv_kernel_size"": 5, ""n_blocks"": 3}",COMPLETE
13,0.7090526330474618,2026-09-26 19:57:13.373082,2026-09-26 20:02:22.701563,0 days 00:05:09.328481,0.9868173051833109,0.9969485387912187,0.0009208436400307092,1.0819881402414253e-06,64.0,0.01937623438176781,16,7,3,0.03566214177867799,64,3,2,0.02228141270425396,64,3,2,,,,,128,256,3,0.3148127081082248,5.0,3,Adam,,,,47.0,0.7159763313609467,0.7021289347339768,"{""block_0_dropout"": 0.01937623438176781, ""block_0_filters"": 16, ""block_0_kernel"": 7, ""block_1_dropout"": 0.03566214177867799, ""block_1_filters"": 64, ""block_1_kernel"": 3, ""block_1_stride"": 2, ""block_2_dropout"": 0.02228141270425396, ""block_2_filters"": 64, ""block_2_kernel"": 3, ""block_2_stride"": 2, ""first_conv_filters"": 256, ""first_conv_kernel_size"": 3, ""n_blocks"": 3}",COMPLETE
14,0.6932999904739211,2026-09-26 20:02:22.804255,2026-09-26 20:07:33.766765,0 days 00:05:10.962510,0.9808658540078671,0.964199298677756,0.0013078264286251657,1.7145313996320934e-06,64.0,0.016350992054056115,16,7,3,0.03239312687984212,64,5,2,0.02951680635440429,64,3,2,,,,,128,256,3,0.3406924233465925,9.0,3,Adam,,,,39.0,0.727810650887574,0.6587893300602682,"{""block_0_dropout"": 0.016350992054056115, ""block_0_filters"": 16, ""block_0_kernel"": 7, ""block_1_dropout"": 0.03239312687984212, ""block_1_filters"": 64, ""block_1_kernel"": 5, ""block_1_stride"": 2, ""block_2_dropout"": 0.02951680635440429, ""block_2_filters"": 64, ""block_2_kernel"": 3, ""block_2_stride"": 2, ""first_conv_filters"": 256, ""first_conv_kernel_size"": 3, ""n_blocks"": 3}",COMPLETE
15,0.4315513975270989,2026-09-26 20:07:33.871333,2026-09-26 20:10:10.204215,0 days 00:02:36.332882,0.9897742823182601,0.9713582735063624,0.0011392074927631631,2.4043732124447767e-05,64.0,0.030256626187942455,16,7,3,0.02751926282575386,16,3,2,0.01931755008133892,64,3,2,,,,,128,256,5,0.25830990155713673,8.0,3,Adam,,,,,,,"{""block_0_dropout"": 0.030256626187942455, ""block_0_filters"": 16, ""block_0_kernel"": 7, ""block_1_dropout"": 0.02751926282575386, ""block_1_filters"": 16, ""block_1_kernel"": 3, ""block_1_stride"": 2, ""block_2_dropout"": 0.01931755008133892, ""block_2_filters"": 64, ""block_2_kernel"": 3, ""block_2_stride"": 2, ""first_conv_filters"": 256, ""first_conv_kernel_size"": 5, ""n_blocks"": 3}",PRUNED
16,0.6852245583953066,2026-09-26 20:10:10.281233,2026-09-26 20:17:01.599565,0 days 00:06:51.318332,0.9449626943825141,0.9670816669394986,0.00043695646526183997,1.808665594272692e-05,64.0,0.02183029813179116,8,7,3,0.047154856038792464,64,3,2,0.045913448857347675,64,3,2,,,,,128,256,5,0.27482484849160677,12.0,3,Adam,,,,47.0,0.6982248520710059,0.6722242647196073,"{""block_0_dropout"": 0.02183029813179116, ""block_0_filters"": 8, ""block_0_kernel"": 7, ""block_1_dropout"": 0.047154856038792464, ""block_1_filters"": 64, ""block_1_kernel"": 3, ""block_1_stride"": 2, ""block_2_dropout"": 0.045913448857347675, ""block_2_filters"": 64, ""block_2_kernel"": 3, ""block_2_stride"": 2, ""first_conv_filters"": 256, ""first_conv_kernel_size"": 5, ""n_blocks"": 3}",COMPLETE
17,0.7282767153961806,2026-09-26 20:17:01.686190,2026-09-26 20:23:59.342129,0 days 00:06:57.655939,0.9457611801853549,0.9998294183606689,0.0026013574607684936,5.535433228019298e-06,64.0,0.013190270829007198,32,7,3,0.03932327732808364,64,3,2,0.03983716908399463,64,3,2,,,,,128,256,5,0.4288946936710526,20.0,3,Adam,,,,43.0,0.727810650887574,0.7287427799047871,"{""block_0_dropout"": 0.013190270829007198, ""block_0_filters"": 32, ""block_0_kernel"": 7, ""block_1_dropout"": 0.03932327732808364, ""block_1_filters"": 64, ""block_1_kernel"": 3, ""block_1_stride"": 2, ""block_2_dropout"": 0.03983716908399463, ""block_2_filters"": 64, ""block_2_kernel"": 3, ""block_2_stride"": 2, ""first_conv_filters"": 256, ""first_conv_kernel_size"": 5, ""n_blocks"": 3}",COMPLETE
18,0.7591166464159843,2026-09-26 20:23:59.428782,2026-09-26 20:28:28.435858,0 days 00:04:29.007076,0.9447401836395868,0.9480457963155487,0.0026983591433470786,9.262189472710166e-05,64.0,0.01195169915937606,32,5,3,0.036750025636609486,64,3,2,0.03859066651035279,64,3,2,,,,,256,256,3,0.43690252115604644,18.0,3,Adam,,,,45.0,0.7810650887573964,0.7371682040745722,"{""block_0_dropout"": 0.01195169915937606, ""block_0_filters"": 32, ""block_0_kernel"": 5, ""block_1_dropout"": 0.036750025636609486, ""block_1_filters"": 64, ""block_1_kernel"": 3, ""block_1_stride"": 2, ""block_2_dropout"": 0.03859066651035279, ""block_2_filters"": 64, ""block_2_kernel"": 3, ""block_2_stride"": 2, ""first_conv_filters"": 256, ""first_conv_kernel_size"": 3, ""n_blocks"": 3}",COMPLETE
19,0.4718498697328397,2026-09-26 20:28:28.523364,2026-09-26 20:31:07.435686,0 days 00:02:38.912322,0.9391767521775821,0.9408278670683826,0.003364151613279175,0.0002077986154912855,64.0,0.010654144100524015,32,7,3,0.04616328913029501,64,3,2,0.03798306290392969,64,3,1,,,,,256,256,5,0.600581510093044,20.0,3,Adam,,,,,,,"{""block_0_dropout"": 0.010654144100524015, ""block_0_filters"": 32, ""block_0_kernel"": 7, ""block_1_dropout"": 0.04616328913029501, ""block_1_filters"": 64, ""block_1_kernel"": 3, ""block_1_stride"": 2, ""block_2_dropout"": 0.03798306290392969, ""block_2_filters"": 64, ""block_2_kernel"": 3, ""block_2_stride"": 1, ""first_conv_filters"": 256, ""first_conv_kernel_size"": 5, ""n_blocks"": 3}",PRUNED
20,0.3291032479174321,2026-09-26 20:31:07.539070,2026-09-26 20:32:10.906385,0 days 00:01:03.367315,0.9420432559644014,0.9007362280719391,0.008745462716710442,0.0002125506390864818,64.0,0.030149176867753272,32,7,3,0.03424009548883715,64,3,2,0.04894052248952825,64,3,2,,,,,256,256,3,0.5517772418396863,18.0,3,Adam,,,,,,,"{""block_0_dropout"": 0.030149176867753272, ""block_0_filters"": 32, ""block_0_kernel"": 7, ""block_1_dropout"": 0.03424009548883715, ""block_1_filters"": 64, ""block_1_kernel"": 3, ""block_1_stride"": 2, ""block_2_dropout"": 0.04894052248952825, ""block_2_filters"": 64, ""block_2_kernel"": 3, ""block_2_stride"": 2, ""first_conv_filters"": 256, ""first_conv_kernel_size"": 3, ""n_blocks"": 3}",PRUNED
21,0.586091803631043,2026-09-26 20:32:11.001994,2026-09-26 20:36:28.600356,0 days 00:04:17.598362,0.9582684129617148,0.9518201237182103,0.002824930607781319,5.46976058298318e-06,64.0,0.013364391900956573,32,7,3,0.032631156747350135,16,3,2,0.03787627301682078,64,3,2,,,,,256,256,5,0.43053280421074547,18.0,3,Adam,,,,,,,"{""block_0_dropout"": 0.013364391900956573, ""block_0_filters"": 32, ""block_0_kernel"": 7, ""block_1_dropout"": 0.032631156747350135, ""block_1_filters"": 16, ""block_1_kernel"": 3, ""block_1_stride"": 2, ""block_2_dropout"": 0.03787627301682078, ""block_2_filters"": 64, ""block_2_kernel"": 3, ""block_2_stride"": 2, ""first_conv_filters"": 256, ""first_conv_kernel_size"": 5, ""n_blocks"": 3}",PRUNED
22,,2026-09-26 20:36:28.700711,2026-09-26 20:36:28.898754,0 days 00:00:00.198043,,,,,,0.014629103964781063,16,7,3,0.04074081443936233,64,3,2,0.019952039517301266,64,3,2,0.04538278766345186,128.0,3.0,1.0,,256,5,,,4,,,,,,,,"{""block_0_dropout"": 0.014629103964781063, ""block_0_filters"": 16, ""block_0_kernel"": 7, ""block_1_dropout"": 0.04074081443936233, ""block_1_filters"": 64, ""block_1_kernel"": 3, ""block_1_stride"": 2, ""block_2_dropout"": 0.019952039517301266, ""block_2_filters"": 64, ""block_2_kernel"": 3, ""block_2_stride"": 2, ""first_conv_filters"": 256, ""first_conv_kernel_size"": 5, ""n_blocks"": 4}",PRUNED
23,0.7479644563189365,2026-09-26 20:36:28.971980,2026-09-26 20:48:28.136923,0 days 00:11:59.164943,0.9161326120544618,0.9794713275565603,0.002111955659108705,9.402835412056356e-05,64.0,0.010955728555943907,32,5,3,0.03477421787507316,64,3,2,0.0471195108990899,64,3,2,,,,,128,512,5,0.42797432898625787,15.0,3,Adam,,,,50.0,0.757396449704142,0.7385324629337309,"{""block_0_dropout"": 0.010955728555943907, ""block_0_filters"": 32, ""block_0_kernel"": 5, ""block_1_dropout"": 0.03477421787507316, ""block_1_filters"": 64, ""block_1_kernel"": 3, ""block_1_stride"": 2, ""block_2_dropout"": 0.0471195108990899, ""block_2_filters"": 64, ""block_2_kernel"": 3, ""block_2_stride"": 2, ""first_conv_filters"": 512, ""first_conv_kernel_size"": 5, ""n_blocks"": 3}",COMPLETE
24,0.5778467107949872,2026-09-26 20:48:28.232586,2026-09-26 20:58:47.411417,0 days 00:10:19.178831,0.9140153180864968,0.9855026565656124,0.004318376699034439,0.00014179903082997173,64.0,0.012424790280632796,32,5,3,0.0331663316834811,64,5,2,0.04303616449062308,64,3,2,,,,,128,512,5,0.4071360619753442,16.0,3,Adam,,,,,,,"{""block_0_dropout"": 0.012424790280632796, ""block_0_filters"": 32, ""block_0_kernel"": 5, ""block_1_dropout"": 0.0331663316834811, ""block_1_filters"": 64, ""block_1_kernel"": 5, ""block_1_stride"": 2, ""block_2_dropout"": 0.04303616449062308, ""block_2_filters"": 64, ""block_2_kernel"": 3, ""block_2_stride"": 2, ""first_conv_filters"": 512, ""first_conv_kernel_size"": 5, ""n_blocks"": 3}",PRUNED
25,0.6884595159636528,2026-09-26 20:58:47.489467,2026-09-26 21:10:23.668412,0 days 00:11:36.178945,0.9225491941152297,0.9258003743240226,0.0018601861921889783,9.237226918638435e-05,64.0,0.015870056399388235,16,5,3,0.04288548386825759,64,3,2,0.04445352233285007,64,3,2,,,,,128,512,5,0.5644037684473915,19.0,3,Adam,,,,50.0,0.7218934911242604,0.6550255408030452,"{""block_0_dropout"": 0.015870056399388235, ""block_0_filters"": 16, ""block_0_kernel"": 5, ""block_1_dropout"": 0.04288548386825759, ""block_1_filters"": 64, ""block_1_kernel"": 3, ""block_1_stride"": 2, ""block_2_dropout"": 0.04445352233285007, ""block_2_filters"": 64, ""block_2_kernel"": 3, ""block_2_stride"": 2, ""first_conv_filters"": 512, ""first_conv_kernel_size"": 5, ""n_blocks"": 3}",COMPLETE
26,0.37822354989210255,2026-09-26 21:10:23.747648,2026-09-26 21:11:38.470416,0 days 00:01:14.722768,0.9238773105922443,0.9840967366075748,0.005184882699804722,0.0010778810462005826,64.0,0.020736273453326105,32,5,3,0.048787117045994845,64,3,2,0.03367614655489349,64,3,2,,,,,128,256,3,0.48209551385244886,19.0,3,Adam,,,,,,,"{""block_0_dropout"": 0.020736273453326105, ""block_0_filters"": 32, ""block_0_kernel"": 5, ""block_1_dropout"": 0.048787117045994845, ""block_1_filters"": 64, ""block_1_kernel"": 3, ""block_1_stride"": 2, ""block_2_dropout"": 0.03367614655489349, ""block_2_filters"": 64, ""block_2_kernel"": 3, ""block_2_stride"": 2, ""first_conv_filters"": 256, ""first_conv_kernel_size"": 3, ""n_blocks"": 3}",PRUNED
27,0.7636003856596123,2026-09-26 21:11:38.562670,2026-09-26 21:18:26.024678,0 days 00:06:47.462008,0.95988386682593,0.953304033882642,0.002096255301633271,6.0755649322367233e-05,200.0,0.017745012376839203,32,7,3,0.02518831870330409,64,3,2,0.044914094049307816,64,3,2,,,,,256,256,3,0.25993465453347986,16.0,3,Adam,,,,46.0,0.7869822485207101,0.7402185227985146,"{""block_0_dropout"": 0.017745012376839203, ""block_0_filters"": 32, ""block_0_kernel"": 7, ""block_1_dropout"": 0.02518831870330409, ""block_1_filters"": 64, ""block_1_kernel"": 3, ""block_1_stride"": 2, ""block_2_dropout"": 0.044914094049307816, ""block_2_filters"": 64, ""block_2_kernel"": 3, ""block_2_stride"": 2, ""first_conv_filters"": 256, ""first_conv_kernel_size"": 3, ""n_blocks"": 3}",COMPLETE
28,0.727700460893949,2026-09-26 21:18:26.096610,2026-09-26 23:49:20.335849,0 days 02:30:54.239239,0.9637493332394145,0.9524350598168564,0.0016729178626427625,6.713108166111627e-05,200.0,0.015423360671484067,32,5,3,0.02093944739164109,64,3,2,0.044543719859859505,64,3,2,,,,,256,512,5,0.10112507788374642,15.0,3,Adam,,,,50.0,0.757396449704142,0.6980044720837559,"{""block_0_dropout"": 0.015423360671484067, ""block_0_filters"": 32, ""block_0_kernel"": 5, ""block_1_dropout"": 0.02093944739164109, ""block_1_filters"": 64, ""block_1_kernel"": 3, ""block_1_stride"": 2, ""block_2_dropout"": 0.044543719859859505, ""block_2_filters"": 64, ""block_2_kernel"": 3, ""block_2_stride"": 2, ""first_conv_filters"": 512, ""first_conv_kernel_size"": 5, ""n_blocks"": 3}",COMPLETE
29,0.41561396208252827,2026-09-26 23:49:20.418447,2026-09-26 23:49:57.341828,0 days 00:00:36.923381,0.9628384952862236,0.9538857585545222,0.0006238704598600496,0.0005814055993797605,200.0,0.019468207855037164,32,5,3,0.04005526167518736,64,3,2,0.04128687829994691,64,3,2,,,,,256,128,3,0.2204066464153931,13.0,3,Adam,,,,,,,"{""block_0_dropout"": 0.019468207855037164, ""block_0_filters"": 32, ""block_0_kernel"": 5, ""block_1_dropout"": 0.04005526167518736, ""block_1_filters"": 64, ""block_1_kernel"": 3, ""block_1_stride"": 2, ""block_2_dropout"": 0.04128687829994691, ""block_2_filters"": 64, ""block_2_kernel"": 3, ""block_2_stride"": 2, ""first_conv_filters"": 128, ""first_conv_kernel_size"": 3, ""n_blocks"": 3}",PRUNED
30,0.432306156041497,2026-09-26 23:49:57.439163,2026-09-26 23:52:08.926354,0 days 00:02:11.487191,,,,,200.0,0.019028510961293127,32,5,3,0.04037716916943457,64,3,1,0.03410705674677117,128,3,2,,,,,256,256,3,0.32571596606228453,16.0,3,SGD,0.09994353768827602,0.7081537273670832,0.005705839983829345,,,,"{""block_0_dropout"": 0.019028510961293127, ""block_0_filters"": 32, ""block_0_kernel"": 5, ""block_1_dropout"": 0.04037716916943457, ""block_1_filters"": 64, ""block_1_kernel"": 3, ""block_1_stride"": 1, ""block_2_dropout"": 0.03410705674677117, ""block_2_filters"": 128, ""block_2_kernel"": 3, ""block_2_stride"": 2, ""first_conv_filters"": 256, ""first_conv_kernel_size"": 3, ""n_blocks"": 3}",PRUNED
31,,2026-09-26 23:52:09.019286,2026-09-26 23:52:09.202937,0 days 00:00:00.183651,,,,,,0.012142108106195678,32,5,3,0.032186241913708655,64,3,2,0.037416615564875785,64,3,2,0.027298880092758777,64.0,3.0,1.0,,256,3,,,4,,,,,,,,"{""block_0_dropout"": 0.012142108106195678, ""block_0_filters"": 32, ""block_0_kernel"": 5, ""block_1_dropout"": 0.032186241913708655, ""block_1_filters"": 64, ""block_1_kernel"": 3, ""block_1_stride"": 2, ""block_2_dropout"": 0.037416615564875785, ""block_2_filters"": 64, ""block_2_kernel"": 3, ""block_2_stride"": 2, ""first_conv_filters"": 256, ""first_conv_kernel_size"": 3, ""n_blocks"": 4}",PRUNED
32,0.7368973505499383,2026-09-26 23:52:09.278635,2026-09-26 23:58:55.587006,0 days 00:06:46.308371,0.9518796778768057,0.9393843344587398,0.002433603918674907,5.450650975758455e-05,200.0,0.0195494142390252,32,7,3,0.020475258727512328,64,3,2,0.04902763412276701,64,5,2,,,,,128,256,3,0.46306142629851565,18.0,3,Adam,,,,48.0,0.7514792899408284,0.7223154111590483,"{""block_0_dropout"": 0.0195494142390252, ""block_0_filters"": 32, ""block_0_kernel"": 7, ""block_1_dropout"": 0.020475258727512328, ""block_1_filters"": 64, ""block_1_kernel"": 3, ""block_1_stride"": 2, ""block_2_dropout"": 0.04902763412276701, ""block_2_filters"": 64, ""block_2_kernel"": 5, ""block_2_stride"": 2, ""first_conv_filters"": 256, ""first_conv_kernel_size"": 3, ""n_blocks"": 3}",COMPLETE
