number,value,datetime_start,datetime_complete,duration,params_adam_beta1,params_adam_beta2,params_adam_lr,params_adam_wd,params_batch_size,params_block_0_dropout,params_block_0_filters,params_block_0_kernel,params_block_0_stride,params_block_1_dropout,params_block_1_filters,params_block_1_kernel,params_block_1_stride,params_block_2_dropout,params_block_2_filters,params_block_2_kernel,params_block_2_stride,params_block_3_dropout,params_block_3_filters,params_block_3_kernel,params_block_3_stride,params_fc_hidden,params_first_conv_filters,params_first_conv_kernel_size,params_lr_factor,params_lr_patience,params_n_blocks,params_optimizer,params_sgd_lr,params_sgd_momentum,params_sgd_wd,user_attrs_best_epoch,user_attrs_validation_accuracy,user_attrs_validation_macro_f1,system_attrs_tpe:relative_params:0,state
33,0.738134150442022,2026-09-26 23:58:55.663932,2026-09-27 00:05:42.039291,0 days 00:06:46.375359,0.9559875851619852,0.9359647829625172,0.0017829385967905317,6.668699750999625e-05,200.0,0.02604777560252602,32,7,3,0.0264996978549169,64,3,2,0.04349331781559557,64,3,2,,,,,256,256,3,0.5354912429244968,17.0,3,Adam,,,,48.0,0.7455621301775148,0.7307061707065293,"{""block_0_dropout"": 0.02604777560252602, ""block_0_filters"": 32, ""block_0_kernel"": 7, ""block_1_dropout"": 0.0264996978549169, ""block_1_filters"": 64, ""block_1_kernel"": 3, ""block_1_stride"": 2, ""block_2_dropout"": 0.04349331781559557, ""block_2_filters"": 64, ""block_2_kernel"": 3, ""block_2_stride"": 2, ""first_conv_filters"": 256, ""first_conv_kernel_size"": 3, ""n_blocks"": 3}",COMPLETE
34,0.6974776357062697,2026-09-27 00:05:42.115487,2026-09-27 00:12:28.573631,0 days 00:06:46.458144,0.9305616221208505,0.9299593036447428,0.001384493434900469,0.00025737540400364814,200.0,0.0305093261621319,32,7,3,0.02628914461228132,64,3,2,0.04567488092820407,64,3,2,,,,,256,256,3,0.592780180650225,16.0,3,Adam,,,,34.0,0.7218934911242604,0.6730617802882791,"{""block_0_dropout"": 0.0305093261621319, ""block_0_filters"": 32, ""block_0_kernel"": 7, ""block_1_dropout"": 0.02628914461228132, ""block_1_filters"": 64, ""block_1_kernel"": 3, ""block_1_stride"": 2, ""block_2_dropout"": 0.04567488092820407, ""block_2_filters"": 64, ""block_2_kernel"": 3, ""block_2_stride"": 2, ""first_conv_filters"": 256, ""first_conv_kernel_size"": 3, ""n_blocks"": 3}",COMPLETE
35,0.34084056696381076,2026-09-27 00:12:28.653768,2026-09-27 00:13:40.363310,0 days 00:01:11.709542,0.9684393792205716,0.9240040215887902,0.006261708836590877,4.079784700390731e-05,200.0,0.012881473346713648,32,5,3,0.02657618105147559,32,3,2,0.032879059140506824,64,3,2,,,,,256,256,3,0.5310511775014876,12.0,3,Adam,,,,,,,"{""block_0_dropout"": 0.012881473346713648, ""block_0_filters"": 32, ""block_0_kernel"": 5, ""block_1_dropout"": 0.02657618105147559, ""block_1_filters"": 32, ""block_1_kernel"": 3, ""block_1_stride"": 2, ""block_2_dropout"": 0.032879059140506824, ""block_2_filters"": 64, ""block_2_kernel"": 3, ""block_2_stride"": 2, ""first_conv_filters"": 256, ""first_conv_kernel_size"": 3, ""n_blocks"": 3}",PRUNED
36,0.7678753939418369,2026-09-27 00:13:40.459031,2026-09-27 00:20:27.223601,0 days 00:06:46.764570,0.9082764233277926,0.9601918202237422,0.000866317182240367,0.00036070165097998433,200.0,0.029137860592870463,32,7,3,0.024064030503434034,64,3,2,0.03807168605315083,64,3,2,,,,,256,256,3,0.6926947861864119,17.0,3,Adam,,,,48.0,0.7810650887573964,0.7546856991262774,"{""block_0_dropout"": 0.029137860592870463, ""block_0_filters"": 32, ""block_0_kernel"": 7, ""block_1_dropout"": 0.024064030503434034, ""block_1_filters"": 64, ""block_1_kernel"": 3, ""block_1_stride"": 2, ""block_2_dropout"": 0.03807168605315083, ""block_2_filters"": 64, ""block_2_kernel"": 3, ""block_2_stride"": 2, ""first_conv_filters"": 256, ""first_conv_kernel_size"": 3, ""n_blocks"": 3}",COMPLETE
37,0.36099424984288275,2026-09-27 00:20:27.300529,2026-09-27 00:23:05.331778,0 days 00:02:38.031249,0.9043057478704882,0.9597821577713863,0.0002257560399977608,0.00043774445413678265,128.0,0.014674639059378705,32,5,3,0.03663904533043505,64,3,2,0.04964474028396605,64,3,2,,,,,256,512,3,0.6822367416458887,15.0,3,Adam,,,,,,,"{""block_0_dropout"": 0.014674639059378705, ""block_0_filters"": 32, ""block_0_kernel"": 5, ""block_1_dropout"": 0.03663904533043505, ""block_1_filters"": 64, ""block_1_kernel"": 3, ""block_1_stride"": 2, ""block_2_dropout"": 0.04964474028396605, ""block_2_filters"": 64, ""block_2_kernel"": 3, ""block_2_stride"": 2, ""first_conv_filters"": 512, ""first_conv_kernel_size"": 3, ""n_blocks"": 3}",PRUNED
38,0.7341094297065958,2026-09-27 00:23:05.423449,2026-09-27 00:29:51.978043,0 days 00:06:46.554594,0.8817401472912718,0.9466307201727235,0.00038545918470075794,0.0004887239165704099,200.0,0.023305921916587435,32,7,3,0.03267475988018134,64,3,2,0.03270056808338107,64,3,2,,,,,256,256,3,0.21107628885566104,14.0,3,Adam,,,,46.0,0.7455621301775148,0.7226567292356767,"{""block_0_dropout"": 0.023305921916587435, ""block_0_filters"": 32, ""block_0_kernel"": 7, ""block_1_dropout"": 0.03267475988018134, ""block_1_filters"": 64, ""block_1_kernel"": 3, ""block_1_stride"": 2, ""block_2_dropout"": 0.03270056808338107, ""block_2_filters"": 64, ""block_2_kernel"": 3, ""block_2_stride"": 2, ""first_conv_filters"": 256, ""first_conv_kernel_size"": 3, ""n_blocks"": 3}",COMPLETE
39,0.37488159464969417,2026-09-27 00:29:52.053960,2026-09-27 00:32:02.454979,0 days 00:02:10.401019,0.9131430934000433,0.9787563736564825,0.0007631458851650925,0.0001254400479080616,200.0,0.040337388503437224,32,7,3,0.017187819299497406,64,3,2,0.038787476338557524,64,3,2,,,,,256,256,3,0.2766012833862815,17.0,3,Adam,,,,,,,"{""block_0_dropout"": 0.040337388503437224, ""block_0_filters"": 32, ""block_0_kernel"": 7, ""block_1_dropout"": 0.017187819299497406, ""block_1_filters"": 64, ""block_1_kernel"": 3, ""block_1_stride"": 2, ""block_2_dropout"": 0.038787476338557524, ""block_2_filters"": 64, ""block_2_kernel"": 3, ""block_2_stride"": 2, ""first_conv_filters"": 256, ""first_conv_kernel_size"": 3, ""n_blocks"": 3}",PRUNED
40,0.7553900236377351,2026-09-27 00:32:02.533095,2026-09-27 00:37:24.499223,0 days 00:05:21.966128,,,,,128.0,0.019639214856032067,32,7,3,0.022326066523624382,64,5,2,0.041389862082804665,64,3,2,,,,,256,256,3,0.6373601807606808,11.0,3,SGD,0.012248019024363281,0.8038320111226813,0.00010358294386803749,47.0,0.7869822485207101,0.7237977987547602,"{""block_0_dropout"": 0.019639214856032067, ""block_0_filters"": 32, ""block_0_kernel"": 7, ""block_1_dropout"": 0.022326066523624382, ""block_1_filters"": 64, ""block_1_kernel"": 5, ""block_1_stride"": 2, ""block_2_dropout"": 0.041389862082804665, ""block_2_filters"": 64, ""block_2_kernel"": 3, ""block_2_stride"": 2, ""first_conv_filters"": 256, ""first_conv_kernel_size"": 3, ""n_blocks"": 3}",COMPLETE
41,0.40148851222907006,2026-09-27 00:37:24.584096,2026-09-27 00:38:29.164845,0 days 00:01:04.580749,,,,,128.0,0.029074079481421062,32,7,3,0.027015335973953197,64,3,2,0.03503244652763797,64,3,2,,,,,256,256,3,0.6970996832707725,9.0,3,SGD,0.010706429457091467,0.7949255160011427,0.0002495015141985337,,,,"{""block_0_dropout"": 0.029074079481421062, ""block_0_filters"": 32, ""block_0_kernel"": 7, ""block_1_dropout"": 0.027015335973953197, ""block_1_filters"": 64, ""block_1_kernel"": 3, ""block_1_stride"": 2, ""block_2_dropout"": 0.03503244652763797, ""block_2_filters"": 64, ""block_2_kernel"": 3, ""block_2_stride"": 2, ""first_conv_filters"": 256, ""first_conv_kernel_size"": 3, ""n_blocks"": 3}",PRUNED
42,0.24616617667583163,2026-09-27 00:38:29.255527,2026-09-27 00:39:33.889726,0 days 00:01:04.634199,,,,,128.0,0.02042394227263558,32,7,3,0.012615458655945662,64,5,2,0.039535692483403384,64,3,2,,,,,256,256,3,0.641543202379213,11.0,3,SGD,0.0008491743939690547,0.8154301318419049,0.00013188937299934782,,,,"{""block_0_dropout"": 0.02042394227263558, ""block_0_filters"": 32, ""block_0_kernel"": 7, ""block_1_dropout"": 0.012615458655945662, ""block_1_filters"": 64, ""block_1_kernel"": 5, ""block_1_stride"": 2, ""block_2_dropout"": 0.039535692483403384, ""block_2_filters"": 64, ""block_2_kernel"": 3, ""block_2_stride"": 2, ""first_conv_filters"": 256, ""first_conv_kernel_size"": 3, ""n_blocks"": 3}",PRUNED
43,0.42503966732339127,2026-09-27 00:39:33.988772,2026-09-27 00:41:16.662201,0 days 00:01:42.673429,,,,,128.0,0.011338434178422943,32,7,3,0.011673005546785298,64,3,2,0.049119616104036375,64,3,2,,,,,256,256,5,0.642842254920246,16.0,3,SGD,0.011786332224970062,0.7900424905181809,0.0008469682432846602,,,,"{""block_0_dropout"": 0.011338434178422943, ""block_0_filters"": 32, ""block_0_kernel"": 7, ""block_1_dropout"": 0.011673005546785298, ""block_1_filters"": 64, ""block_1_kernel"": 3, ""block_1_stride"": 2, ""block_2_dropout"": 0.049119616104036375, ""block_2_filters"": 64, ""block_2_kernel"": 3, ""block_2_stride"": 2, ""first_conv_filters"": 256, ""first_conv_kernel_size"": 5, ""n_blocks"": 3}",PRUNED
44,0.5558494038574722,2026-09-27 00:41:16.746798,2026-09-27 00:44:42.933907,0 days 00:03:26.187109,,,,,128.0,0.024580482367187108,32,7,3,0.038057453177257165,64,3,2,0.04829262354834466,64,3,2,,,,,256,256,3,0.6033702599494274,19.0,3,SGD,0.019018444174189072,0.8608109837461076,2.8211722061702515e-05,,,,"{""block_0_dropout"": 0.024580482367187108, ""block_0_filters"": 32, ""block_0_kernel"": 7, ""block_1_dropout"": 0.038057453177257165, ""block_1_filters"": 64, ""block_1_kernel"": 3, ""block_1_stride"": 2, ""block_2_dropout"": 0.04829262354834466, ""block_2_filters"": 64, ""block_2_kernel"": 3, ""block_2_stride"": 2, ""first_conv_filters"": 256, ""first_conv_kernel_size"": 3, ""n_blocks"": 3}",PRUNED
45,0.18357419352894466,2026-09-27 00:44:43.020377,2026-09-27 00:46:04.474265,0 days 00:01:21.453888,,,,,200.0,0.021472198518327483,32,7,3,0.0212885092619987,32,5,2,0.040449375275242234,32,3,2,,,,,256,256,3,0.4985121534133128,13.0,3,SGD,0.0005519189646887965,0.9271238528335342,3.111924813139973e-05,,,,"{""block_0_dropout"": 0.021472198518327483, ""block_0_filters"": 32, ""block_0_kernel"": 7, ""block_1_dropout"": 0.0212885092619987, ""block_1_filters"": 32, ""block_1_kernel"": 5, ""block_1_stride"": 2, ""block_2_dropout"": 0.040449375275242234, ""block_2_filters"": 32, ""block_2_kernel"": 3, ""block_2_stride"": 2, ""first_conv_filters"": 256, ""first_conv_kernel_size"": 3, ""n_blocks"": 3}",PRUNED
46,0.3196964175805912,2026-09-27 00:46:04.551673,2026-09-27 00:48:58.249723,0 days 00:02:53.698050,,,,,128.0,0.02151472003754671,32,5,3,0.035091252460216854,64,3,2,0.04384495196195069,64,3,2,,,,,256,512,5,0.6645665725813477,18.0,3,SGD,0.005028325027149469,0.7548796355361779,0.0014416498667057169,,,,"{""block_0_dropout"": 0.02151472003754671, ""block_0_filters"": 32, ""block_0_kernel"": 5, ""block_1_dropout"": 0.035091252460216854, ""block_1_filters"": 64, ""block_1_kernel"": 3, ""block_1_stride"": 2, ""block_2_dropout"": 0.04384495196195069, ""block_2_filters"": 64, ""block_2_kernel"": 3, ""block_2_stride"": 2, ""first_conv_filters"": 512, ""first_conv_kernel_size"": 5, ""n_blocks"": 3}",PRUNED
47,0.7759759463401081,2026-09-27 00:48:58.360653,2026-09-27 00:57:12.001791,0 days 00:08:13.641138,0.9287437467615081,0.9590761144116516,0.0010655582951163965,0.0014812780396436494,200.0,0.01022651688432415,32,5,3,0.04685602580606559,64,3,2,0.04528523115246004,64,3,2,,,,,256,256,5,0.36923071452387524,7.0,3,Adam,,,,48.0,0.8047337278106509,0.7472181648695655,"{""block_0_dropout"": 0.01022651688432415, ""block_0_filters"": 32, ""block_0_kernel"": 5, ""block_1_dropout"": 0.04685602580606559, ""block_1_filters"": 64, ""block_1_kernel"": 3, ""block_1_stride"": 2, ""block_2_dropout"": 0.04528523115246004, ""block_2_filters"": 64, ""block_2_kernel"": 3, ""block_2_stride"": 2, ""first_conv_filters"": 256, ""first_conv_kernel_size"": 5, ""n_blocks"": 3}",COMPLETE
48,0.2714385027605568,2026-09-27 00:57:12.081405,2026-09-27 00:58:50.909675,0 days 00:01:38.828270,,,,,200.0,0.014969778140489772,32,5,3,0.04311491481356393,64,3,2,0.04933240621712378,64,3,2,,,,,256,256,5,0.3642812759457521,7.0,3,SGD,0.0025566575531486926,0.837020524133885,1.4736197692647035e-06,,,,"{""block_0_dropout"": 0.014969778140489772, ""block_0_filters"": 32, ""block_0_kernel"": 5, ""block_1_dropout"": 0.04311491481356393, ""block_1_filters"": 64, ""block_1_kernel"": 3, ""block_1_stride"": 2, ""block_2_dropout"": 0.04933240621712378, ""block_2_filters"": 64, ""block_2_kernel"": 3, ""block_2_stride"": 2, ""first_conv_filters"": 256, ""first_conv_kernel_size"": 5, ""n_blocks"": 3}",PRUNED
49,0.39837870121906815,2026-09-27 00:58:50.988850,2026-09-27 01:00:29.832012,0 days 00:01:38.843162,0.9314096973021634,0.9594360395121545,0.0004930781640147343,0.00662552466005812,200.0,0.011883160466048497,32,5,3,0.04839944938839302,64,3,2,0.044383529340315045,64,3,2,,,,,256,256,5,0.2967564799629128,11.0,3,Adam,,,,,,,"{""block_0_dropout"": 0.011883160466048497, ""block_0_filters"": 32, ""block_0_kernel"": 5, ""block_1_dropout"": 0.04839944938839302, ""block_1_filters"": 64, ""block_1_kernel"": 3, ""block_1_stride"": 2, ""block_2_dropout"": 0.044383529340315045, ""block_2_filters"": 64, ""block_2_kernel"": 3, ""block_2_stride"": 2, ""first_conv_filters"": 256, ""first_conv_kernel_size"": 5, ""n_blocks"": 3}",PRUNED
50,0.7612824093523212,2026-09-27 01:00:29.921224,2026-09-27 01:07:16.830471,0 days 00:06:46.909247,0.8838173527008216,0.9452518918964748,0.0009631080796530752,0.0017065314468187396,200.0,0.013720601753610083,32,7,3,0.021621622434219067,64,5,2,0.04041399948007422,64,3,2,,,,,512,256,3,0.20959706956525093,7.0,3,Adam,,,,50.0,0.7810650887573964,0.7414997299472458,"{""block_0_dropout"": 0.013720601753610083, ""block_0_filters"": 32, ""block_0_kernel"": 7, ""block_1_dropout"": 0.021621622434219067, ""block_1_filters"": 64, ""block_1_kernel"": 5, ""block_1_stride"": 2, ""block_2_dropout"": 0.04041399948007422, ""block_2_filters"": 64, ""block_2_kernel"": 3, ""block_2_stride"": 2, ""first_conv_filters"": 256, ""first_conv_kernel_size"": 3, ""n_blocks"": 3}",COMPLETE
51,0.7368034240313528,2026-09-27 01:07:16.922680,2026-09-27 01:14:02.882700,0 days 00:06:45.960020,0.856067023040525,0.9454169019686475,0.0010114080293022693,0.0018717481795067108,200.0,0.012886975648345598,32,7,3,0.026952654760470644,64,3,2,0.03732329630484989,64,3,2,,,,,512,256,3,0.17540801626841576,7.0,3,Adam,,,,43.0,0.7751479289940828,0.6984589190686228,"{""block_0_dropout"": 0.012886975648345598, ""block_0_filters"": 32, ""block_0_kernel"": 7, ""block_1_dropout"": 0.026952654760470644, ""block_1_filters"": 64, ""block_1_kernel"": 3, ""block_1_stride"": 2, ""block_2_dropout"": 0.03732329630484989, ""block_2_filters"": 64, ""block_2_kernel"": 3, ""block_2_stride"": 2, ""first_conv_filters"": 256, ""first_conv_kernel_size"": 3, ""n_blocks"": 3}",COMPLETE
52,0.7059557252009846,2026-09-27 01:14:02.961681,2026-09-27 01:20:00.986468,0 days 00:05:58.024787,0.8837145628632721,0.9568882408185538,0.000926862879618537,0.0012794114616385649,200.0,0.015850133245707942,32,5,3,0.03767033484196951,64,3,2,0.030446715226230454,64,3,2,,,,,512,256,3,0.23114076188926028,6.0,3,Adam,,,,37.0,0.7218934911242604,0.6900179592777088,"{""block_0_dropout"": 0.015850133245707942, ""block_0_filters"": 32, ""block_0_kernel"": 5, ""block_1_dropout"": 0.03767033484196951, ""block_1_filters"": 64, ""block_1_kernel"": 3, ""block_1_stride"": 2, ""block_2_dropout"": 0.030446715226230454, ""block_2_filters"": 64, ""block_2_kernel"": 3, ""block_2_stride"": 2, ""first_conv_filters"": 256, ""first_conv_kernel_size"": 3, ""n_blocks"": 3}",COMPLETE
53,0.5735620915494781,2026-09-27 01:20:01.068695,2026-09-27 01:24:13.207181,0 days 00:04:12.138486,0.880326547348983,0.9467138079110743,0.0014970867899877136,0.009641876872216288,200.0,0.017479953744781444,32,7,3,0.02966429911303505,64,5,2,0.03994790397757206,64,3,2,,,,,512,256,3,0.18551137229496495,9.0,3,Adam,,,,,,,"{""block_0_dropout"": 0.017479953744781444, ""block_0_filters"": 32, ""block_0_kernel"": 7, ""block_1_dropout"": 0.02966429911303505, ""block_1_filters"": 64, ""block_1_kernel"": 5, ""block_1_stride"": 2, ""block_2_dropout"": 0.03994790397757206, ""block_2_filters"": 64, ""block_2_kernel"": 3, ""block_2_stride"": 2, ""first_conv_filters"": 256, ""first_conv_kernel_size"": 3, ""n_blocks"": 3}",PRUNED
54,0.5447547078540215,2026-09-27 01:24:13.284482,2026-09-27 01:27:04.265961,0 days 00:02:50.981479,0.8740516977760826,0.9653734917436992,0.0003103535755942353,0.00283086260779222,200.0,0.011281680557853516,32,7,3,0.021480103926541913,64,5,2,0.041049452319198355,64,3,2,,,,,512,256,3,0.10686218924512567,8.0,3,Adam,,,,,,,"{""block_0_dropout"": 0.011281680557853516, ""block_0_filters"": 32, ""block_0_kernel"": 7, ""block_1_dropout"": 0.021480103926541913, ""block_1_filters"": 64, ""block_1_kernel"": 5, ""block_1_stride"": 2, ""block_2_dropout"": 0.041049452319198355, ""block_2_filters"": 64, ""block_2_kernel"": 3, ""block_2_stride"": 2, ""first_conv_filters"": 256, ""first_conv_kernel_size"": 3, ""n_blocks"": 3}",PRUNED
55,0.3573576977009648,2026-09-27 01:27:04.353192,2026-09-27 01:28:15.317518,0 days 00:01:10.964326,0.8980597419513262,0.9480353178361273,0.0006255043084157139,0.0008394149494251938,200.0,0.011705893919232569,8,5,3,0.04484484966334456,64,3,2,0.04165111213330689,64,3,2,,,,,512,256,3,0.24635624818241478,6.0,3,Adam,,,,,,,"{""block_0_dropout"": 0.011705893919232569, ""block_0_filters"": 8, ""block_0_kernel"": 5, ""block_1_dropout"": 0.04484484966334456, ""block_1_filters"": 64, ""block_1_kernel"": 3, ""block_1_stride"": 2, ""block_2_dropout"": 0.04165111213330689, ""block_2_filters"": 64, ""block_2_kernel"": 3, ""block_2_stride"": 2, ""first_conv_filters"": 256, ""first_conv_kernel_size"": 3, ""n_blocks"": 3}",PRUNED
56,0.7902925804199874,2026-09-27 01:28:15.392700,2026-09-27 01:33:36.366518,0 days 00:05:20.973818,0.9045774541975414,0.9329039802632965,0.0011132543641290237,0.002713657801144159,128.0,0.027449631343255308,32,7,3,0.01676561964930022,64,3,2,0.04398611469432869,64,3,2,,,,,256,256,3,0.3948017430194516,10.0,3,Adam,,,,43.0,0.7988165680473372,0.7817685927926376,"{""block_0_dropout"": 0.027449631343255308, ""block_0_filters"": 32, ""block_0_kernel"": 7, ""block_1_dropout"": 0.01676561964930022, ""block_1_filters"": 64, ""block_1_kernel"": 3, ""block_1_stride"": 2, ""block_2_dropout"": 0.04398611469432869, ""block_2_filters"": 64, ""block_2_kernel"": 3, ""block_2_stride"": 2, ""first_conv_filters"": 256, ""first_conv_kernel_size"": 3, ""n_blocks"": 3}",COMPLETE
57,0.7861493858016375,2026-09-27 01:33:36.475061,2026-09-27 01:49:58.629070,0 days 00:16:22.154009,0.9050526347548841,0.9325102574846235,0.0008432664585033508,0.0029385838305184928,200.0,0.021676900639455033,32,7,3,0.013084618500988278,64,3,2,0.04439201767366282,64,3,2,,,,,256,256,7,0.36363142474366933,8.0,3,Adam,,,,45.0,0.8047337278106509,0.7675650437926242,"{""block_0_dropout"": 0.021676900639455033, ""block_0_filters"": 32, ""block_0_kernel"": 7, ""block_1_dropout"": 0.013084618500988278, ""block_1_filters"": 64, ""block_1_kernel"": 3, ""block_1_stride"": 2, ""block_2_dropout"": 0.04439201767366282, ""block_2_filters"": 64, ""block_2_kernel"": 3, ""block_2_stride"": 2, ""first_conv_filters"": 256, ""first_conv_kernel_size"": 7, ""n_blocks"": 3}",COMPLETE
58,0.7893570798547536,2026-09-27 01:49:58.703346,2026-09-27 02:06:20.672283,0 days 00:16:21.968937,0.8923652580533457,0.9324511220061477,0.0008020175917039002,0.003388160413959018,200.0,0.021627737463818596,32,7,3,0.016532053123968472,64,3,2,0.04506979235741054,64,3,2,,,,,512,256,7,0.3519657460965113,8.0,3,Adam,,,,48.0,0.8047337278106509,0.7739804318988562,"{""block_0_dropout"": 0.021627737463818596, ""block_0_filters"": 32, ""block_0_kernel"": 7, ""block_1_dropout"": 0.016532053123968472, ""block_1_filters"": 64, ""block_1_kernel"": 3, ""block_1_stride"": 2, ""block_2_dropout"": 0.04506979235741054, ""block_2_filters"": 64, ""block_2_kernel"": 3, ""block_2_stride"": 2, ""first_conv_filters"": 256, ""first_conv_kernel_size"": 7, ""n_blocks"": 3}",COMPLETE
59,0.3554234466955578,2026-09-27 02:06:20.751849,2026-09-27 02:09:27.329712,0 days 00:03:06.577863,0.9045306830260532,0.9187664101140302,0.0007719419664485485,0.004610359530864708,200.0,0.019618858931890793,32,5,3,0.011957462863146438,64,3,2,0.04333294110135353,64,3,2,,,,,256,256,7,0.35099594264019485,8.0,3,Adam,,,,,,,"{""block_0_dropout"": 0.019618858931890793, ""block_0_filters"": 32, ""block_0_kernel"": 5, ""block_1_dropout"": 0.011957462863146438, ""block_1_filters"": 64, ""block_1_kernel"": 3, ""block_1_stride"": 2, ""block_2_dropout"": 0.04333294110135353, ""block_2_filters"": 64, ""block_2_kernel"": 3, ""block_2_stride"": 2, ""first_conv_filters"": 256, ""first_conv_kernel_size"": 7, ""n_blocks"": 3}",PRUNED
60,0.7562976240086832,2026-09-27 02:09:27.406310,2026-09-27 02:12:14.358203,0 days 00:02:46.951893,0.8925520465890422,0.9326658030930173,0.0011760712745506909,0.00280749053600394,200.0,0.026601653759857884,32,7,3,0.018041857603373207,64,3,2,0.046457663751746134,64,3,2,,,,,256,128,3,0.3879316924189737,10.0,3,Adam,,,,50.0,0.7928994082840237,0.7196958397333427,"{""block_0_dropout"": 0.026601653759857884, ""block_0_filters"": 32, ""block_0_kernel"": 7, ""block_1_dropout"": 0.018041857603373207, ""block_1_filters"": 64, ""block_1_kernel"": 3, ""block_1_stride"": 2, ""block_2_dropout"": 0.046457663751746134, ""block_2_filters"": 64, ""block_2_kernel"": 3, ""block_2_stride"": 2, ""first_conv_filters"": 128, ""first_conv_kernel_size"": 3, ""n_blocks"": 3}",COMPLETE
