number,value,datetime_start,datetime_complete,duration,params_adam_beta1,params_adam_beta2,params_adam_lr,params_adam_wd,params_batch_size,params_block_0_dropout,params_block_0_filters,params_block_0_kernel,params_block_0_stride,params_block_1_dropout,params_block_1_filters,params_block_1_kernel,params_block_1_stride,params_block_2_dropout,params_block_2_filters,params_block_2_kernel,params_block_2_stride,params_block_3_dropout,params_block_3_filters,params_block_3_kernel,params_block_3_stride,params_fc_hidden,params_first_conv_filters,params_first_conv_kernel_size,params_lr_factor,params_lr_patience,params_n_blocks,params_optimizer,params_sgd_lr,params_sgd_momentum,params_sgd_wd,user_attrs_best_epoch,user_attrs_validation_accuracy,user_attrs_validation_macro_f1,system_attrs_tpe:relative_params:0,state
89,0.3091462013401878,2026-09-27 05:18:40.088242,2026-09-27 05:20:27.137516,0 days 00:01:47.049274,0.8572665124232909,0.9212800327747268,0.00017557580039954945,0.0010851620094235205,200.0,0.011241569217876952,8,7,3,0.01912731711117824,64,5,2,0.031469120520735666,64,3,2,,,,,512,256,5,0.234060235491394,11.0,3,Adam,,,,,,,"{""block_0_dropout"": 0.011241569217876952, ""block_0_filters"": 8, ""block_0_kernel"": 7, ""block_1_dropout"": 0.01912731711117824, ""block_1_filters"": 64, ""block_1_kernel"": 5, ""block_1_stride"": 2, ""block_2_dropout"": 0.031469120520735666, ""block_2_filters"": 64, ""block_2_kernel"": 3, ""block_2_stride"": 2, ""first_conv_filters"": 256, ""first_conv_kernel_size"": 5, ""n_blocks"": 3}",PRUNED
90,0.41713978692948606,2026-09-27 05:20:27.216673,2026-09-27 05:22:27.235145,0 days 00:02:00.018472,0.8509464954183832,0.9151438422230413,0.0002531734572748259,0.000752107588588964,200.0,0.014114380026948068,32,7,3,0.021058223848110864,64,5,2,0.03003985632098937,64,3,2,,,,,512,256,5,0.3775637613635545,13.0,3,Adam,,,,,,,"{""block_0_dropout"": 0.014114380026948068, ""block_0_filters"": 32, ""block_0_kernel"": 7, ""block_1_dropout"": 0.021058223848110864, ""block_1_filters"": 64, ""block_1_kernel"": 5, ""block_1_stride"": 2, ""block_2_dropout"": 0.03003985632098937, ""block_2_filters"": 64, ""block_2_kernel"": 3, ""block_2_stride"": 2, ""first_conv_filters"": 256, ""first_conv_kernel_size"": 5, ""n_blocks"": 3}",PRUNED
91,0.6380310004624752,2026-09-27 05:22:27.314702,2026-09-27 05:30:47.571734,0 days 00:08:20.257032,0.8649984719940913,0.9110972248769738,0.00036854917951054605,0.003785193127882132,200.0,0.015113670692031574,32,7,3,0.021022858554936387,64,5,2,0.03762438407798263,64,3,2,,,,,512,256,5,0.28279187100660086,13.0,3,Adam,,,,,,,"{""block_0_dropout"": 0.015113670692031574, ""block_0_filters"": 32, ""block_0_kernel"": 7, ""block_1_dropout"": 0.021022858554936387, ""block_1_filters"": 64, ""block_1_kernel"": 5, ""block_1_stride"": 2, ""block_2_dropout"": 0.03762438407798263, ""block_2_filters"": 64, ""block_2_kernel"": 3, ""block_2_stride"": 2, ""first_conv_filters"": 256, ""first_conv_kernel_size"": 5, ""n_blocks"": 3}",PRUNED
92,0.4974043247987644,2026-09-27 05:30:47.667129,2026-09-27 05:33:20.101501,0 days 00:02:32.434372,0.8741201542316486,0.9166532753647355,0.0004668621564765263,0.0020918126148151764,200.0,0.0308386572595363,32,7,3,0.01052476268189742,64,5,2,0.03673418839287173,64,3,2,,,,,512,256,5,0.2624156251032807,11.0,3,Adam,,,,,,,"{""block_0_dropout"": 0.0308386572595363, ""block_0_filters"": 32, ""block_0_kernel"": 7, ""block_1_dropout"": 0.01052476268189742, ""block_1_filters"": 64, ""block_1_kernel"": 5, ""block_1_stride"": 2, ""block_2_dropout"": 0.03673418839287173, ""block_2_filters"": 64, ""block_2_kernel"": 3, ""block_2_stride"": 2, ""first_conv_filters"": 256, ""first_conv_kernel_size"": 5, ""n_blocks"": 3}",PRUNED
93,0.47728650852534515,2026-09-27 05:33:20.196660,2026-09-27 05:35:30.866568,0 days 00:02:10.669908,0.8595701280988575,0.9217731402005844,0.00034185411751732215,0.00761829427173391,200.0,0.025580698769342543,32,7,3,0.010978419941755822,64,5,2,0.02910046390733572,64,3,2,,,,,512,256,5,0.23793230657386807,12.0,3,Adam,,,,,,,"{""block_0_dropout"": 0.025580698769342543, ""block_0_filters"": 32, ""block_0_kernel"": 7, ""block_1_dropout"": 0.010978419941755822, ""block_1_filters"": 64, ""block_1_kernel"": 5, ""block_1_stride"": 2, ""block_2_dropout"": 0.02910046390733572, ""block_2_filters"": 64, ""block_2_kernel"": 3, ""block_2_stride"": 2, ""first_conv_filters"": 256, ""first_conv_kernel_size"": 5, ""n_blocks"": 3}",PRUNED
94,0.4417400007895451,2026-09-27 05:35:30.963002,2026-09-27 05:37:41.458255,0 days 00:02:10.495253,0.8799597586387302,0.9011469141150841,0.0004393815455860153,0.0021940593422732028,200.0,0.020930171035486295,32,7,3,0.014365355770220266,64,5,2,0.030740381497036087,64,3,2,,,,,512,256,5,0.3105644441162122,14.0,3,Adam,,,,,,,"{""block_0_dropout"": 0.020930171035486295, ""block_0_filters"": 32, ""block_0_kernel"": 7, ""block_1_dropout"": 0.014365355770220266, ""block_1_filters"": 64, ""block_1_kernel"": 5, ""block_1_stride"": 2, ""block_2_dropout"": 0.030740381497036087, ""block_2_filters"": 64, ""block_2_kernel"": 3, ""block_2_stride"": 2, ""first_conv_filters"": 256, ""first_conv_kernel_size"": 5, ""n_blocks"": 3}",PRUNED
95,0.4238816115209248,2026-09-27 05:37:41.569125,2026-09-27 05:39:41.563032,0 days 00:01:59.993907,0.8876351989082373,0.9289540208217429,0.000266477730624656,0.0035131510572789307,200.0,0.01482486317620001,32,7,3,0.021948916273309957,64,5,2,0.03370823723666891,64,3,2,,,,,512,256,5,0.1984677002608921,10.0,3,Adam,,,,,,,"{""block_0_dropout"": 0.01482486317620001, ""block_0_filters"": 32, ""block_0_kernel"": 7, ""block_1_dropout"": 0.021948916273309957, ""block_1_filters"": 64, ""block_1_kernel"": 5, ""block_1_stride"": 2, ""block_2_dropout"": 0.03370823723666891, ""block_2_filters"": 64, ""block_2_kernel"": 3, ""block_2_stride"": 2, ""first_conv_filters"": 256, ""first_conv_kernel_size"": 5, ""n_blocks"": 3}",PRUNED
96,0.7185739646171478,2026-09-27 05:39:41.642755,2026-09-27 05:48:02.020326,0 days 00:08:20.377571,0.8543748208222849,0.9189842887299844,0.0005892922523701002,0.005066408350861872,200.0,0.016162237296515235,32,7,3,0.016121727849419468,64,5,2,0.030774961727706385,64,3,2,,,,,512,256,5,0.29648178768673367,9.0,3,Adam,,,,,,,"{""block_0_dropout"": 0.016162237296515235, ""block_0_filters"": 32, ""block_0_kernel"": 7, ""block_1_dropout"": 0.016121727849419468, ""block_1_filters"": 64, ""block_1_kernel"": 5, ""block_1_stride"": 2, ""block_2_dropout"": 0.030774961727706385, ""block_2_filters"": 64, ""block_2_kernel"": 3, ""block_2_stride"": 2, ""first_conv_filters"": 256, ""first_conv_kernel_size"": 5, ""n_blocks"": 3}",PRUNED
97,0.802093438344337,2026-09-27 05:48:02.115267,2026-09-27 05:58:01.453881,0 days 00:09:59.338614,0.8682946862862937,0.9422591181060138,0.000465194638236229,0.00764968582711821,64.0,0.02384553335772609,32,7,3,0.011048821772724279,64,5,2,0.03578574446655792,64,3,2,,,,,512,256,7,0.21931037459936903,8.0,3,Adam,,,,48.0,0.8106508875739645,0.7935359891147095,"{""block_0_dropout"": 0.02384553335772609, ""block_0_filters"": 32, ""block_0_kernel"": 7, ""block_1_dropout"": 0.011048821772724279, ""block_1_filters"": 64, ""block_1_kernel"": 5, ""block_1_stride"": 2, ""block_2_dropout"": 0.03578574446655792, ""block_2_filters"": 64, ""block_2_kernel"": 3, ""block_2_stride"": 2, ""first_conv_filters"": 256, ""first_conv_kernel_size"": 7, ""n_blocks"": 3}",COMPLETE
98,0.4733023804421795,2026-09-27 05:58:01.548578,2026-09-27 05:59:40.947877,0 days 00:01:39.399299,0.8670935075294698,0.9421365986153454,0.00046184481630517666,0.00853570918225476,64.0,0.026103032853485482,32,7,3,0.017566135281200136,64,5,2,0.029499165796204332,64,3,2,,,,,512,256,5,0.42079311742652614,8.0,3,Adam,,,,,,,"{""block_0_dropout"": 0.026103032853485482, ""block_0_filters"": 32, ""block_0_kernel"": 7, ""block_1_dropout"": 0.017566135281200136, ""block_1_filters"": 64, ""block_1_kernel"": 5, ""block_1_stride"": 2, ""block_2_dropout"": 0.029499165796204332, ""block_2_filters"": 64, ""block_2_kernel"": 3, ""block_2_stride"": 2, ""first_conv_filters"": 256, ""first_conv_kernel_size"": 5, ""n_blocks"": 3}",PRUNED
99,0.4391910592245916,2026-09-27 05:59:41.043834,2026-09-27 06:01:53.886329,0 days 00:02:12.842495,0.8629879454100717,0.9404223713034201,0.0005695447790281551,0.006985388627540169,64.0,0.02901319978380227,32,7,3,0.014997976312496206,64,5,2,0.02829033886078324,64,3,2,,,,,128,256,5,0.14681573736349413,8.0,3,Adam,,,,,,,"{""block_0_dropout"": 0.02901319978380227, ""block_0_filters"": 32, ""block_0_kernel"": 7, ""block_1_dropout"": 0.014997976312496206, ""block_1_filters"": 64, ""block_1_kernel"": 5, ""block_1_stride"": 2, ""block_2_dropout"": 0.02829033886078324, ""block_2_filters"": 64, ""block_2_kernel"": 3, ""block_2_stride"": 2, ""first_conv_filters"": 256, ""first_conv_kernel_size"": 5, ""n_blocks"": 3}",PRUNED
