number,value,datetime_start,datetime_complete,duration,params_adam_beta1,params_adam_beta2,params_adam_lr,params_adam_wd,params_batch_size,params_block_0_dropout,params_block_0_filters,params_block_0_kernel,params_block_0_stride,params_block_1_dropout,params_block_1_filters,params_block_1_kernel,params_block_1_stride,params_block_2_dropout,params_block_2_filters,params_block_2_kernel,params_block_2_stride,params_block_3_dropout,params_block_3_filters,params_block_3_kernel,params_block_3_stride,params_block_4_dropout,params_block_4_filters,params_block_4_kernel,params_block_4_stride,params_fc_hidden,params_lr_factor,params_lr_patience,params_n_blocks,params_optimizer,params_sgd_lr,params_sgd_momentum,params_sgd_wd,user_attrs_best_epoch,user_attrs_validation_accuracy,user_attrs_validation_macro_f1,system_attrs_tpe:relative_params:0,state
0,0.3513466550181388,2026-10-04 16:17:56.077425,2026-10-04 16:18:14.585665,0 days 00:00:18.508240,,,,,128.0,0.012323344486727979,8,7,3,0.017336180394137354,16,5,2,0.02465447373174767,64,3,1,0.016820964947491662,128.0,3.0,1.0,,,,,512,0.19763058787582308,12.0,4,SGD,0.00019634341572933326,0.8984275776885255,5.762487216478604e-05,50.0,0.3714689265536723,0.3312243834826053,,COMPLETE
1,0.43216171932268477,2026-10-04 16:18:14.641237,2026-10-04 16:18:35.828977,0 days 00:00:21.187740,,,,,128.0,0.041005312934444586,32,5,3,0.02554709158757928,16,7,1,0.012982025747190833,64,3,1,0.04085081386743783,64.0,3.0,1.0,,,,,256,0.36014665762139764,16.0,4,SGD,0.0009833181933644897,0.7184319215829468,1.753594952976443e-05,47.0,0.4611581920903955,0.4031652465549741,,COMPLETE
2,0.5266844556449612,2026-10-04 16:18:35.884496,2026-10-04 16:18:52.656460,0 days 00:00:16.771964,0.9754527819892891,0.9317685471496893,0.0011986281799901185,0.0016973078532467015,200.0,0.030909313175279764,16,7,3,0.019971689165955,16,5,1,0.04232481518257668,64,3,1,,,,,,,,,256,0.18804153962214143,8.0,3,Adam,,,,34.0,0.5444915254237288,0.5088773858661938,,COMPLETE
3,0.5594670686610537,2026-10-04 16:18:52.711106,2026-10-04 16:19:18.917866,0 days 00:00:26.206760,0.9519502888056603,0.9367415349586534,0.003336101309469784,8.923807143379781e-06,200.0,0.04771638815650077,8,5,3,0.022035132392670787,64,5,1,0.019582475626678898,128,5,1,,,,,,,,,512,0.6058446644748636,15.0,3,Adam,,,,42.0,0.5805084745762712,0.538425662745836,,COMPLETE
4,0.4959839131047232,2026-10-04 16:19:18.972707,2026-10-04 16:19:42.548186,0 days 00:00:23.575479,,,,,64.0,0.03048372233197124,32,7,3,0.014538940849623563,32,3,1,0.01967409163601807,32,3,2,,,,,,,,,512,0.8096691394120938,17.0,3,SGD,0.0011159088550343414,0.9105271468723695,0.0038765111709116325,45.0,0.5225988700564972,0.46936895615294916,,COMPLETE
5,,2026-10-04 16:19:42.602267,2026-10-04 16:19:42.615139,0 days 00:00:00.012872,,,,,,0.016432322056699946,8,7,3,0.035985315961888587,32,5,1,0.048920422190097824,32,3,2,0.01780971951192178,128.0,5.0,2.0,0.03581889183628671,128.0,3.0,1.0,,,,5,,,,,,,,,PRUNED
6,,2026-10-04 16:19:42.665148,2026-10-04 16:19:42.673995,0 days 00:00:00.008847,,,,,,0.04713274250350902,16,7,3,0.0167797098674437,32,7,2,0.015603360609460961,64,5,1,,,,,,,,,,,,3,,,,,,,,,PRUNED
7,,2026-10-04 16:19:42.725312,2026-10-04 16:19:42.736095,0 days 00:00:00.010783,,,,,,0.021743673770579737,8,7,3,0.038078675090308135,64,7,2,0.02862392072529841,64,5,2,0.015082420506075393,256.0,3.0,2.0,,,,,,,,4,,,,,,,,,PRUNED
8,,2026-10-04 16:19:42.907515,2026-10-04 16:19:42.939954,0 days 00:00:00.032439,,,,,,0.03125418526272592,8,7,3,0.027558856828225446,64,7,2,0.016257481706843442,128,5,2,0.032174162100456025,256.0,5.0,2.0,,,,,,,,4,,,,,,,,,PRUNED
9,,2026-10-04 16:19:43.057419,2026-10-04 16:19:43.097420,0 days 00:00:00.040001,,,,,,0.01464290562027665,8,7,3,0.016928074796400606,64,7,2,0.030125450343203505,128,5,1,0.04760920965699831,64.0,3.0,1.0,,,,,,,,4,,,,,,,,,PRUNED
10,0.6831183828171558,2026-10-04 16:19:43.198168,2026-10-04 16:20:09.070019,0 days 00:00:25.871851,0.9079517194939879,0.9627768386841636,0.009444811794638241,1.5681694641610638e-06,200.0,0.04036207752276006,32,5,3,0.013699189578280573,64,3,1,0.013446685364581459,128,5,1,,,,,,,,,128,0.8155565840291188,20.0,3,Adam,,,,45.0,0.6956214689265536,0.6706152967077579,"{""block_0_dropout"": 0.04036207752276006, ""block_0_filters"": 32, ""block_0_kernel"": 5, ""block_1_dropout"": 0.013699189578280573, ""block_1_filters"": 64, ""block_1_kernel"": 3, ""block_1_stride"": 1, ""block_2_dropout"": 0.013446685364581459, ""block_2_filters"": 128, ""block_2_kernel"": 5, ""block_2_stride"": 1, ""n_blocks"": 3}",COMPLETE
11,0.6389825082299176,2026-10-04 16:20:09.126611,2026-10-04 16:20:29.399471,0 days 00:00:20.272860,0.9250098755312106,0.9537484795905934,0.00960994055704251,1.5530519390924744e-06,200.0,0.031203171371680355,32,5,3,0.012287072940566609,64,3,1,0.014801873104301276,32,5,1,,,,,,,,,128,0.7775968987109323,20.0,3,Adam,,,,43.0,0.6588983050847458,0.6190667113750895,"{""block_0_dropout"": 0.031203171371680355, ""block_0_filters"": 32, ""block_0_kernel"": 5, ""block_1_dropout"": 0.012287072940566609, ""block_1_filters"": 64, ""block_1_kernel"": 3, ""block_1_stride"": 1, ""block_2_dropout"": 0.014801873104301276, ""block_2_filters"": 32, ""block_2_kernel"": 5, ""block_2_stride"": 1, ""n_blocks"": 3}",COMPLETE
12,0.5921990513076352,2026-10-04 16:20:29.463724,2026-10-04 16:20:49.135785,0 days 00:00:19.672061,0.8886271018971063,0.9854818784290856,0.00770481704338813,1.085035078085121e-06,200.0,0.019110479025544646,32,5,3,0.013871202281622821,64,3,1,0.025282035849599042,32,5,1,,,,,,,,,128,0.8862327488926018,20.0,3,Adam,,,,43.0,0.606638418079096,0.5777596845361742,"{""block_0_dropout"": 0.019110479025544646, ""block_0_filters"": 32, ""block_0_kernel"": 5, ""block_1_dropout"": 0.013871202281622821, ""block_1_filters"": 64, ""block_1_kernel"": 3, ""block_1_stride"": 1, ""block_2_dropout"": 0.025282035849599042, ""block_2_filters"": 32, ""block_2_kernel"": 5, ""block_2_stride"": 1, ""n_blocks"": 3}",COMPLETE
13,0.6657742250321701,2026-10-04 16:20:49.193440,2026-10-04 16:21:29.138802,0 days 00:00:39.945362,0.9093692615403042,0.9678049982672224,0.009228065426658247,2.119468087068158e-06,200.0,0.0339556881315554,32,5,3,0.019257692394789628,64,3,1,0.01791723747677757,32,5,1,0.02899434815991921,256.0,5.0,1.0,,,,,128,0.6893115839071993,20.0,4,Adam,,,,47.0,0.6822033898305084,0.6493450602338317,"{""block_0_dropout"": 0.0339556881315554, ""block_0_filters"": 32, ""block_0_kernel"": 5, ""block_1_dropout"": 0.019257692394789628, ""block_1_filters"": 64, ""block_1_kernel"": 3, ""block_1_stride"": 1, ""block_2_dropout"": 0.01791723747677757, ""block_2_filters"": 32, ""block_2_kernel"": 5, ""block_2_stride"": 1, ""n_blocks"": 4}",COMPLETE
14,0.5672095554925995,2026-10-04 16:21:29.191478,2026-10-04 16:21:55.611144,0 days 00:00:26.419666,0.8948830403387327,0.9756578275500098,0.00019983715570842382,2.0269341263311523e-05,200.0,0.03223457655682849,32,5,3,0.02392507072290981,64,3,1,0.024985870956176003,128,5,1,,,,,,,,,128,0.6086522912035955,20.0,3,Adam,,,,48.0,0.5847457627118644,0.5496733482733347,"{""block_0_dropout"": 0.03223457655682849, ""block_0_filters"": 32, ""block_0_kernel"": 5, ""block_1_dropout"": 0.02392507072290981, ""block_1_filters"": 64, ""block_1_kernel"": 3, ""block_1_stride"": 1, ""block_2_dropout"": 0.024985870956176003, ""block_2_filters"": 128, ""block_2_kernel"": 5, ""block_2_stride"": 1, ""n_blocks"": 3}",COMPLETE
15,0.7772777430647766,2026-10-04 16:21:55.668899,2026-10-04 16:22:54.776641,0 days 00:00:59.107742,0.8629747737593416,0.9613952006569058,0.0028255101447831293,1.7538625082523154e-05,64.0,0.03945445957589961,32,5,3,0.016245086317919162,64,5,1,0.01964576654121865,128,5,1,0.029602387925886632,256.0,5.0,1.0,,,,,128,0.6221791022437602,17.0,4,Adam,,,,50.0,0.7994350282485876,0.7551204578809657,"{""block_0_dropout"": 0.03945445957589961, ""block_0_filters"": 32, ""block_0_kernel"": 5, ""block_1_dropout"": 0.016245086317919162, ""block_1_filters"": 64, ""block_1_kernel"": 5, ""block_1_stride"": 1, ""block_2_dropout"": 0.01964576654121865, ""block_2_filters"": 128, ""block_2_kernel"": 5, ""block_2_stride"": 1, ""n_blocks"": 4}",COMPLETE
16,0.7199181190229365,2026-10-04 16:22:54.832831,2026-10-04 16:23:24.191190,0 days 00:00:29.358359,0.8506513591707937,0.9572964430599716,0.001598238311139762,7.485994481580853e-05,64.0,0.02982664419267133,32,5,3,0.02572500716943299,64,5,1,0.012906251400636566,128,5,1,,,,,,,,,128,0.4803671023903446,14.0,3,Adam,,,,50.0,0.739406779661017,0.7004294583848559,"{""block_0_dropout"": 0.02982664419267133, ""block_0_filters"": 32, ""block_0_kernel"": 5, ""block_1_dropout"": 0.02572500716943299, ""block_1_filters"": 64, ""block_1_kernel"": 5, ""block_1_stride"": 1, ""block_2_dropout"": 0.012906251400636566, ""block_2_filters"": 128, ""block_2_kernel"": 5, ""block_2_stride"": 1, ""n_blocks"": 3}",COMPLETE
17,0.7758399152907813,2026-10-04 16:23:24.246228,2026-10-04 16:24:21.168688,0 days 00:00:56.922460,0.8516724172339795,0.9030028901165339,0.0010664246171095551,0.00012900291926438745,64.0,0.04763899808589307,32,5,3,0.011977325167953079,64,3,1,0.02723866989524816,128,5,1,0.02803320013574118,256.0,5.0,1.0,,,,,128,0.4469339921709722,12.0,4,Adam,,,,49.0,0.7888418079096046,0.7628380226719581,"{""block_0_dropout"": 0.04763899808589307, ""block_0_filters"": 32, ""block_0_kernel"": 5, ""block_1_dropout"": 0.011977325167953079, ""block_1_filters"": 64, ""block_1_kernel"": 3, ""block_1_stride"": 1, ""block_2_dropout"": 0.02723866989524816, ""block_2_filters"": 128, ""block_2_kernel"": 5, ""block_2_stride"": 1, ""n_blocks"": 4}",COMPLETE
18,,2026-10-04 16:24:21.245894,2026-10-04 16:24:21.268998,0 days 00:00:00.023104,,,,,,0.04857820193954354,32,5,3,0.018411030397685584,64,3,2,0.03548190091982556,128,5,2,0.029496960374500735,256.0,5.0,1.0,,,,,,,,4,,,,,,,,"{""block_0_dropout"": 0.04857820193954354, ""block_0_filters"": 32, ""block_0_kernel"": 5, ""block_1_dropout"": 0.018411030397685584, ""block_1_filters"": 64, ""block_1_kernel"": 3, ""block_1_stride"": 2, ""block_2_dropout"": 0.03548190091982556, ""block_2_filters"": 128, ""block_2_kernel"": 5, ""block_2_stride"": 2, ""n_blocks"": 4}",PRUNED
19,,2026-10-04 16:24:21.424614,2026-10-04 16:24:21.461336,0 days 00:00:00.036722,,,,,,0.03959837696789346,32,5,3,0.017412208419094327,64,3,1,0.03141928432290418,128,5,2,0.024790906538112976,256.0,5.0,1.0,,,,,,,,4,,,,,,,,"{""block_0_dropout"": 0.03959837696789346, ""block_0_filters"": 32, ""block_0_kernel"": 5, ""block_1_dropout"": 0.017412208419094327, ""block_1_filters"": 64, ""block_1_kernel"": 3, ""block_1_stride"": 1, ""block_2_dropout"": 0.03141928432290418, ""block_2_filters"": 128, ""block_2_kernel"": 5, ""block_2_stride"": 2, ""n_blocks"": 4}",PRUNED
20,0.7443780393899089,2026-10-04 16:24:21.549844,2026-10-04 16:25:06.421612,0 days 00:00:44.871768,0.8513224835663449,0.9027875030686384,0.0005452612277907098,0.00020431305618963941,64.0,0.04563415674788026,32,5,3,0.010010595517825193,64,7,1,0.029224010833803462,64,5,1,0.037800463804198194,256.0,5.0,1.0,,,,,128,0.4051195869996215,10.0,4,Adam,,,,50.0,0.7535310734463276,0.73522500533349,"{""block_0_dropout"": 0.04563415674788026, ""block_0_filters"": 32, ""block_0_kernel"": 5, ""block_1_dropout"": 0.010010595517825193, ""block_1_filters"": 64, ""block_1_kernel"": 7, ""block_1_stride"": 1, ""block_2_dropout"": 0.029224010833803462, ""block_2_filters"": 64, ""block_2_kernel"": 5, ""block_2_stride"": 1, ""n_blocks"": 4}",COMPLETE
21,0.7701954148631313,2026-10-04 16:25:06.478022,2026-10-04 16:26:45.766641,0 days 00:01:39.288619,0.8536236479087035,0.9021855951019185,0.0006490908528285701,0.00032666874015215827,64.0,0.04494457279041307,32,5,3,0.02138901457672085,64,7,1,0.031071202139446946,64,5,1,0.03915093425783368,256.0,5.0,1.0,0.011316140879532536,512.0,3.0,1.0,128,0.4061274743817827,9.0,5,Adam,,,,47.0,0.7846045197740112,0.7557863099522513,"{""block_0_dropout"": 0.04494457279041307, ""block_0_filters"": 32, ""block_0_kernel"": 5, ""block_1_dropout"": 0.02138901457672085, ""block_1_filters"": 64, ""block_1_kernel"": 7, ""block_1_stride"": 1, ""block_2_dropout"": 0.031071202139446946, ""block_2_filters"": 64, ""block_2_kernel"": 5, ""block_2_stride"": 1, ""n_blocks"": 5}",COMPLETE
22,0.7839060766004076,2026-10-04 16:26:45.819339,2026-10-04 16:28:35.008139,0 days 00:01:49.188800,0.8703945500354008,0.9137370633448991,0.0006258017677438719,0.0003098059485062505,64.0,0.046081873334132,32,5,3,0.02556899124168102,64,3,1,0.028209380735111676,128,5,1,0.03701350554053416,256.0,5.0,1.0,0.011103710426289949,512.0,3.0,1.0,128,0.49257726284768344,5.0,5,Adam,,,,49.0,0.798728813559322,0.7690833396414931,"{""block_0_dropout"": 0.046081873334132, ""block_0_filters"": 32, ""block_0_kernel"": 5, ""block_1_dropout"": 0.02556899124168102, ""block_1_filters"": 64, ""block_1_kernel"": 3, ""block_1_stride"": 1, ""block_2_dropout"": 0.028209380735111676, ""block_2_filters"": 128, ""block_2_kernel"": 5, ""block_2_stride"": 1, ""n_blocks"": 5}",COMPLETE
23,0.12516936711559107,2026-10-04 16:28:35.065814,2026-10-04 16:28:47.210969,0 days 00:00:12.145155,0.8749315729460947,0.9208127624791814,0.002363520142015394,0.0014193615042459248,64.0,0.04128168355149322,32,5,3,0.024497837397465232,64,5,1,0.028136284708438028,128,5,1,0.023023022423285404,256.0,5.0,1.0,,,,,128,0.5287666985086878,6.0,4,Adam,,,,,,,"{""block_0_dropout"": 0.04128168355149322, ""block_0_filters"": 32, ""block_0_kernel"": 5, ""block_1_dropout"": 0.024497837397465232, ""block_1_filters"": 64, ""block_1_kernel"": 5, ""block_1_stride"": 1, ""block_2_dropout"": 0.028136284708438028, ""block_2_filters"": 128, ""block_2_kernel"": 5, ""block_2_stride"": 1, ""n_blocks"": 4}",PRUNED
24,0.7864719581550472,2026-10-04 16:28:47.269838,2026-10-04 16:30:37.195854,0 days 00:01:49.926016,0.8730327921328536,0.9146723899997737,0.0006549990278117852,4.5503058639670574e-05,64.0,0.03488414409740776,32,5,3,0.030984053289229346,64,3,1,0.028474239846050835,128,5,1,0.03429815073858919,256.0,5.0,1.0,0.04873053814221254,512.0,3.0,1.0,128,0.29338747650294783,5.0,5,Adam,,,,50.0,0.7902542372881356,0.782689679021959,"{""block_0_dropout"": 0.03488414409740776, ""block_0_filters"": 32, ""block_0_kernel"": 5, ""block_1_dropout"": 0.030984053289229346, ""block_1_filters"": 64, ""block_1_kernel"": 3, ""block_1_stride"": 1, ""block_2_dropout"": 0.028474239846050835, ""block_2_filters"": 128, ""block_2_kernel"": 5, ""block_2_stride"": 1, ""n_blocks"": 5}",COMPLETE
25,0.4577493158351665,2026-10-04 16:30:37.251265,2026-10-04 16:31:15.463521,0 days 00:00:38.212256,,,,,64.0,0.033975601836564034,16,7,3,0.027364855927151918,64,3,1,0.023261315543723203,128,5,1,0.03442059585942814,256.0,5.0,1.0,0.04989784048089947,512.0,3.0,1.0,256,0.3258178170569556,5.0,5,SGD,0.08304125804479663,0.7004205034198985,1.5513794277993726e-06,,,,"{""block_0_dropout"": 0.033975601836564034, ""block_0_filters"": 16, ""block_0_kernel"": 7, ""block_1_dropout"": 0.027364855927151918, ""block_1_filters"": 64, ""block_1_kernel"": 3, ""block_1_stride"": 1, ""block_2_dropout"": 0.023261315543723203, ""block_2_filters"": 128, ""block_2_kernel"": 5, ""block_2_stride"": 1, ""n_blocks"": 5}",PRUNED
26,0.7828581579123932,2026-10-04 16:31:15.516076,2026-10-04 16:31:58.231046,0 days 00:00:42.714970,0.8739894427311893,0.9211624553958834,0.0002259980679576992,2.7895308523747125e-05,64.0,0.0378610837219022,32,5,3,0.011950370865471377,64,5,1,0.026550949605676333,128,5,1,0.045576188053778215,128.0,5.0,1.0,,,,,128,0.2991838160045181,7.0,4,Adam,,,,48.0,0.7959039548022598,0.7698123610225267,"{""block_0_dropout"": 0.0378610837219022, ""block_0_filters"": 32, ""block_0_kernel"": 5, ""block_1_dropout"": 0.011950370865471377, ""block_1_filters"": 64, ""block_1_kernel"": 5, ""block_1_stride"": 1, ""block_2_dropout"": 0.026550949605676333, ""block_2_filters"": 128, ""block_2_kernel"": 5, ""block_2_stride"": 1, ""n_blocks"": 4}",COMPLETE
27,0.868802646884534,2026-10-04 16:31:58.286297,2026-10-04 16:32:34.100864,0 days 00:00:35.814567,0.8776007224232453,0.9226249441734242,0.00019734179311617074,5.299602766369828e-05,64.0,0.037503565054312946,32,5,3,0.033768746038697214,64,3,1,0.029157236409912288,128,5,1,0.046322694955101204,128.0,5.0,2.0,0.012888835409935084,256.0,3.0,1.0,128,0.102344764616667,7.0,5,Adam,,,,45.0,0.8834745762711864,0.8541307174978815,"{""block_0_dropout"": 0.037503565054312946, ""block_0_filters"": 32, ""block_0_kernel"": 5, ""block_1_dropout"": 0.033768746038697214, ""block_1_filters"": 64, ""block_1_kernel"": 3, ""block_1_stride"": 1, ""block_2_dropout"": 0.029157236409912288, ""block_2_filters"": 128, ""block_2_kernel"": 5, ""block_2_stride"": 1, ""n_blocks"": 5}",COMPLETE
28,0.872657493116134,2026-10-04 16:32:34.155114,2026-10-04 16:33:11.192529,0 days 00:00:37.037415,0.880517891439412,0.9207615436363867,0.0001254289309810744,0.0006752162583628173,64.0,0.042818501829504516,32,5,3,0.030818340363979596,64,3,1,0.031693589337089,128,5,1,0.042796403539935975,128.0,5.0,2.0,0.01152882003511774,256.0,3.0,1.0,128,0.111404522820952,6.0,5,Adam,,,,49.0,0.8884180790960452,0.8568969071362229,"{""block_0_dropout"": 0.042818501829504516, ""block_0_filters"": 32, ""block_0_kernel"": 5, ""block_1_dropout"": 0.030818340363979596, ""block_1_filters"": 64, ""block_1_kernel"": 3, ""block_1_stride"": 1, ""block_2_dropout"": 0.031693589337089, ""block_2_filters"": 128, ""block_2_kernel"": 5, ""block_2_stride"": 1, ""n_blocks"": 5}",COMPLETE
29,0.8300733858555691,2026-10-04 16:33:11.264232,2026-10-04 16:33:42.568506,0 days 00:00:31.304274,0.890656711674095,0.9394773510722549,0.00011361244548972574,0.0073780811837133396,128.0,0.03446988916117553,32,5,3,0.03404847538197699,64,3,1,0.030474129740715537,128,5,1,0.04373092699049058,128.0,5.0,2.0,0.02142725692761,256.0,3.0,1.0,512,0.12245727897426137,7.0,5,Adam,,,,50.0,0.846045197740113,0.8141015739710253,"{""block_0_dropout"": 0.03446988916117553, ""block_0_filters"": 32, ""block_0_kernel"": 5, ""block_1_dropout"": 0.03404847538197699, ""block_1_filters"": 64, ""block_1_kernel"": 3, ""block_1_stride"": 1, ""block_2_dropout"": 0.030474129740715537, ""block_2_filters"": 128, ""block_2_kernel"": 5, ""block_2_stride"": 1, ""n_blocks"": 5}",COMPLETE
30,0.12047496294864857,2026-10-04 16:33:42.621489,2026-10-04 16:33:49.162488,0 days 00:00:06.540999,,,,,128.0,0.037964427269362694,32,5,3,0.02772721543653884,64,3,1,0.02203257212513382,128,5,1,0.04363256381199864,128.0,5.0,2.0,0.02022430443147953,256.0,3.0,1.0,512,0.10267047901713174,7.0,5,SGD,0.06388870157667656,0.9767748672367906,0.006493251542474661,,,,"{""block_0_dropout"": 0.037964427269362694, ""block_0_filters"": 32, ""block_0_kernel"": 5, ""block_1_dropout"": 0.02772721543653884, ""block_1_filters"": 64, ""block_1_kernel"": 3, ""block_1_stride"": 1, ""block_2_dropout"": 0.02203257212513382, ""block_2_filters"": 128, ""block_2_kernel"": 5, ""block_2_stride"": 1, ""n_blocks"": 5}",PRUNED
31,0.8461743896481322,2026-10-04 16:33:49.220327,2026-10-04 16:34:20.857496,0 days 00:00:31.637169,0.8886114303018104,0.9399965760158888,0.00010449796424929784,0.009886150070477313,128.0,0.03339395414002899,32,5,3,0.02906445552191265,64,3,1,0.03174352581957456,128,5,1,0.04232391416441591,128.0,5.0,2.0,0.019651189859217655,256.0,3.0,1.0,512,0.10145386198461304,7.0,5,Adam,,,,47.0,0.864406779661017,0.8279419996352475,"{""block_0_dropout"": 0.03339395414002899, ""block_0_filters"": 32, ""block_0_kernel"": 5, ""block_1_dropout"": 0.02906445552191265, ""block_1_filters"": 64, ""block_1_kernel"": 3, ""block_1_stride"": 1, ""block_2_dropout"": 0.03174352581957456, ""block_2_filters"": 128, ""block_2_kernel"": 5, ""block_2_stride"": 1, ""n_blocks"": 5}",COMPLETE
32,0.8393198832700668,2026-10-04 16:34:20.911865,2026-10-04 16:34:52.004210,0 days 00:00:31.092345,0.8884049874201659,0.9421523867322638,0.00010278530451048112,0.006047720432066232,128.0,0.020269427988417882,32,5,3,0.03353817663613029,64,3,1,0.031695853239965426,128,5,1,0.04942536620589566,128.0,5.0,2.0,0.02118236433328664,256.0,3.0,1.0,512,0.11075743010611469,9.0,5,Adam,,,,50.0,0.8615819209039548,0.8170578456361787,"{""block_0_dropout"": 0.020269427988417882, ""block_0_filters"": 32, ""block_0_kernel"": 5, ""block_1_dropout"": 0.03353817663613029, ""block_1_filters"": 64, ""block_1_kernel"": 3, ""block_1_stride"": 1, ""block_2_dropout"": 0.031695853239965426, ""block_2_filters"": 128, ""block_2_kernel"": 5, ""block_2_stride"": 1, ""n_blocks"": 5}",COMPLETE
33,0.828119140721427,2026-10-04 16:34:52.059976,2026-10-04 16:35:22.928446,0 days 00:00:30.868470,0.9037072456993404,0.9441181045114576,0.00011227445108833905,0.00980873867093541,128.0,0.044369321710091614,32,5,3,0.03044034218586008,64,3,1,0.0466141766395963,128,5,1,0.04904613949936533,128.0,5.0,2.0,0.01931411933940649,256.0,3.0,1.0,512,0.19324584191391048,10.0,5,Adam,,,,49.0,0.8488700564971752,0.8073682249456787,"{""block_0_dropout"": 0.044369321710091614, ""block_0_filters"": 32, ""block_0_kernel"": 5, ""block_1_dropout"": 0.03044034218586008, ""block_1_filters"": 64, ""block_1_kernel"": 3, ""block_1_stride"": 1, ""block_2_dropout"": 0.0466141766395963, ""block_2_filters"": 128, ""block_2_kernel"": 5, ""block_2_stride"": 1, ""n_blocks"": 5}",COMPLETE
