number,value,datetime_start,datetime_complete,duration,params_adam_beta1,params_adam_beta2,params_adam_lr,params_adam_wd,params_batch_size,params_block_0_dropout,params_block_0_filters,params_block_0_kernel,params_block_0_stride,params_block_1_dropout,params_block_1_filters,params_block_1_kernel,params_block_1_stride,params_block_2_dropout,params_block_2_filters,params_block_2_kernel,params_block_2_stride,params_block_3_dropout,params_block_3_filters,params_block_3_kernel,params_block_3_stride,params_block_4_dropout,params_block_4_filters,params_block_4_kernel,params_block_4_stride,params_fc_hidden,params_lr_factor,params_lr_patience,params_n_blocks,params_optimizer,params_sgd_lr,params_sgd_momentum,params_sgd_wd,user_attrs_best_epoch,user_attrs_validation_accuracy,user_attrs_validation_macro_f1,system_attrs_tpe:relative_params:0,state
34,0.8296730661013896,2026-10-04 16:35:22.986650,2026-10-04 16:35:47.676845,0 days 00:00:24.690195,0.8832982126455219,0.9288049907458426,0.00019869195945081914,0.003186654735478299,128.0,0.028029181967021276,32,5,3,0.027740716515446833,64,3,1,0.033355204895639104,32,5,1,0.04920021252860572,128.0,5.0,2.0,0.016490208467189776,256.0,3.0,1.0,512,0.13816181161930408,9.0,5,Adam,,,,50.0,0.846045197740113,0.8133009344626663,"{""block_0_dropout"": 0.028029181967021276, ""block_0_filters"": 32, ""block_0_kernel"": 5, ""block_1_dropout"": 0.027740716515446833, ""block_1_filters"": 64, ""block_1_kernel"": 3, ""block_1_stride"": 1, ""block_2_dropout"": 0.033355204895639104, ""block_2_filters"": 32, ""block_2_kernel"": 5, ""block_2_stride"": 1, ""n_blocks"": 5}",COMPLETE
35,0.8548331934342561,2026-10-04 16:35:47.734106,2026-10-04 16:36:16.202114,0 days 00:00:28.468008,0.9179430508231835,0.9454110835289671,0.00030357399909672605,0.0010325987882705112,128.0,0.04180102135492786,32,5,3,0.038690641451784205,64,3,1,0.03236167052759313,128,5,1,0.04207207738744905,128.0,5.0,2.0,,,,,512,0.24291096786629252,8.0,4,Adam,,,,49.0,0.867231638418079,0.8424347484504332,"{""block_0_dropout"": 0.04180102135492786, ""block_0_filters"": 32, ""block_0_kernel"": 5, ""block_1_dropout"": 0.038690641451784205, ""block_1_filters"": 64, ""block_1_kernel"": 3, ""block_1_stride"": 1, ""block_2_dropout"": 0.03236167052759313, ""block_2_filters"": 128, ""block_2_kernel"": 5, ""block_2_stride"": 1, ""n_blocks"": 4}",COMPLETE
36,0.7849037401974179,2026-10-04 16:36:16.256717,2026-10-04 16:36:43.727628,0 days 00:00:27.470911,0.942492668852778,0.9492828335457846,0.00034839370172858497,0.0008963470506398631,128.0,0.045066399454497856,32,5,3,0.045432347504309196,64,3,1,0.028944575233000827,128,5,1,0.041747543744765823,128.0,3.0,2.0,,,,,512,0.2491970241220563,6.0,4,Adam,,,,47.0,0.7994350282485876,0.7703724521462482,"{""block_0_dropout"": 0.045066399454497856, ""block_0_filters"": 32, ""block_0_kernel"": 5, ""block_1_dropout"": 0.045432347504309196, ""block_1_filters"": 64, ""block_1_kernel"": 3, ""block_1_stride"": 1, ""block_2_dropout"": 0.028944575233000827, ""block_2_filters"": 128, ""block_2_kernel"": 5, ""block_2_stride"": 1, ""n_blocks"": 4}",COMPLETE
37,0.8084707166466207,2026-10-04 16:36:43.779666,2026-10-04 16:37:14.367980,0 days 00:00:30.588314,,,,,128.0,0.04429115716242691,8,5,3,0.032273533594446735,64,3,1,0.020384164153948225,128,5,1,0.0446587522941381,128.0,5.0,2.0,0.028880359363214207,256.0,3.0,1.0,512,0.23727493312942335,11.0,5,SGD,0.0077729574791776295,0.8037712989511621,0.0002586626575799043,49.0,0.8255649717514124,0.7913764615418291,"{""block_0_dropout"": 0.04429115716242691, ""block_0_filters"": 8, ""block_0_kernel"": 5, ""block_1_dropout"": 0.032273533594446735, ""block_1_filters"": 64, ""block_1_kernel"": 3, ""block_1_stride"": 1, ""block_2_dropout"": 0.020384164153948225, ""block_2_filters"": 128, ""block_2_kernel"": 5, ""block_2_stride"": 1, ""n_blocks"": 5}",COMPLETE
38,0.8298417206315811,2026-10-04 16:37:14.423115,2026-10-04 16:37:43.560009,0 days 00:00:29.136894,0.9288822507348046,0.924848145238955,0.000159345372128669,0.0008186516807011958,128.0,0.049393270298761255,32,5,3,0.03921448343402197,64,3,1,0.037582110335251454,128,5,1,0.04072406413337754,128.0,5.0,2.0,,,,,512,0.18101637258258185,8.0,4,Adam,,,,50.0,0.838276836158192,0.8214066051049701,"{""block_0_dropout"": 0.049393270298761255, ""block_0_filters"": 32, ""block_0_kernel"": 5, ""block_1_dropout"": 0.03921448343402197, ""block_1_filters"": 64, ""block_1_kernel"": 3, ""block_1_stride"": 1, ""block_2_dropout"": 0.037582110335251454, ""block_2_filters"": 128, ""block_2_kernel"": 5, ""block_2_stride"": 1, ""n_blocks"": 4}",COMPLETE
39,0.41778973795516733,2026-10-04 16:37:43.613281,2026-10-04 16:37:50.271224,0 days 00:00:06.657943,,,,,128.0,0.036153609918059874,32,5,3,0.04090226999607309,64,3,1,0.02919843791308375,128,5,1,0.04652215412638143,128.0,3.0,2.0,,,,,256,0.2408149055317779,6.0,4,SGD,0.006735103887240507,0.8183739286094268,1.9882915928093502e-06,,,,"{""block_0_dropout"": 0.036153609918059874, ""block_0_filters"": 32, ""block_0_kernel"": 5, ""block_1_dropout"": 0.04090226999607309, ""block_1_filters"": 64, ""block_1_kernel"": 3, ""block_1_stride"": 1, ""block_2_dropout"": 0.02919843791308375, ""block_2_filters"": 128, ""block_2_kernel"": 5, ""block_2_stride"": 1, ""n_blocks"": 4}",PRUNED
40,0.8751560805713665,2026-10-04 16:37:50.335704,2026-10-04 16:38:22.640298,0 days 00:00:32.304594,0.9187821231165292,0.9990394696351423,0.0002674956583662289,0.0005224513950676783,128.0,0.04324133002739777,32,5,3,0.017266045890189305,64,3,1,0.028536593028034924,128,5,1,0.04349043538697524,128.0,5.0,2.0,0.014245705651888589,256.0,3.0,1.0,256,0.1643238068122792,8.0,5,Adam,,,,49.0,0.8940677966101694,0.8562443645325636,"{""block_0_dropout"": 0.04324133002739777, ""block_0_filters"": 32, ""block_0_kernel"": 5, ""block_1_dropout"": 0.017266045890189305, ""block_1_filters"": 64, ""block_1_kernel"": 3, ""block_1_stride"": 1, ""block_2_dropout"": 0.028536593028034924, ""block_2_filters"": 128, ""block_2_kernel"": 5, ""block_2_stride"": 1, ""n_blocks"": 5}",COMPLETE
41,0.8344892944380313,2026-10-04 16:38:22.699537,2026-10-04 16:38:53.973736,0 days 00:00:31.274199,0.9220502369897923,0.9972351323815944,0.0003136991597068755,0.000561064947912491,128.0,0.035656593889939255,32,5,3,0.0362788799315975,64,3,1,0.03729335650386745,128,5,1,0.04331812296151602,128.0,5.0,2.0,0.013536373827058823,256.0,3.0,1.0,256,0.16869329651323972,8.0,5,Adam,,,,48.0,0.8629943502824858,0.8059842385935768,"{""block_0_dropout"": 0.035656593889939255, ""block_0_filters"": 32, ""block_0_kernel"": 5, ""block_1_dropout"": 0.0362788799315975, ""block_1_filters"": 64, ""block_1_kernel"": 3, ""block_1_stride"": 1, ""block_2_dropout"": 0.03729335650386745, ""block_2_filters"": 128, ""block_2_kernel"": 5, ""block_2_stride"": 1, ""n_blocks"": 5}",COMPLETE
42,0.8462426981875597,2026-10-04 16:38:54.028470,2026-10-04 16:39:23.257509,0 days 00:00:29.229039,0.9011944065168482,0.9162834876412423,0.0003080867275641303,0.0025685370972266027,128.0,0.04895856143411062,32,7,3,0.031710550566656684,64,3,1,0.027874697586535144,128,5,1,0.04053283245485993,64.0,5.0,2.0,0.010116925644833059,256.0,3.0,1.0,256,0.15654626127869622,7.0,5,Adam,,,,46.0,0.8608757062146892,0.8316096901604301,"{""block_0_dropout"": 0.04895856143411062, ""block_0_filters"": 32, ""block_0_kernel"": 7, ""block_1_dropout"": 0.031710550566656684, ""block_1_filters"": 64, ""block_1_kernel"": 3, ""block_1_stride"": 1, ""block_2_dropout"": 0.027874697586535144, ""block_2_filters"": 128, ""block_2_kernel"": 5, ""block_2_stride"": 1, ""n_blocks"": 5}",COMPLETE
43,0.841929996584474,2026-10-04 16:39:23.327420,2026-10-04 16:39:53.776158,0 days 00:00:30.448738,0.9003033229616292,0.9128122860571048,0.0003953874143757571,0.00270463836936778,128.0,0.0397103075480832,32,5,3,0.032678794761470786,64,3,1,0.03323387997485648,128,5,1,0.04029040535750831,64.0,5.0,2.0,0.010355447039935108,128.0,3.0,1.0,256,0.21924326168962355,8.0,5,Adam,,,,50.0,0.8637005649717514,0.8201594281971966,"{""block_0_dropout"": 0.0397103075480832, ""block_0_filters"": 32, ""block_0_kernel"": 5, ""block_1_dropout"": 0.032678794761470786, ""block_1_filters"": 64, ""block_1_kernel"": 3, ""block_1_stride"": 1, ""block_2_dropout"": 0.03323387997485648, ""block_2_filters"": 128, ""block_2_kernel"": 5, ""block_2_stride"": 1, ""n_blocks"": 5}",COMPLETE
44,0.8228347687493254,2026-10-04 16:39:53.832965,2026-10-04 16:40:25.087070,0 days 00:00:31.254105,0.914524635830748,0.9105702505695089,0.0002662120723892792,0.00042573113695624956,128.0,0.040600626120575536,32,5,3,0.041558964877286844,64,3,1,0.03599895822413513,128,5,1,0.036770688143913856,64.0,3.0,2.0,0.015387339342720746,256.0,3.0,1.0,256,0.15877714567453574,6.0,5,Adam,,,,47.0,0.8290960451977402,0.8165734923009105,"{""block_0_dropout"": 0.040600626120575536, ""block_0_filters"": 32, ""block_0_kernel"": 5, ""block_1_dropout"": 0.041558964877286844, ""block_1_filters"": 64, ""block_1_kernel"": 3, ""block_1_stride"": 1, ""block_2_dropout"": 0.03599895822413513, ""block_2_filters"": 128, ""block_2_kernel"": 5, ""block_2_stride"": 1, ""n_blocks"": 5}",COMPLETE
45,0.36115356456277925,2026-10-04 16:40:25.140829,2026-10-04 16:40:29.809042,0 days 00:00:04.668213,0.9887177764738704,0.9327353552114597,0.0001612963095765516,0.0021986183498669846,128.0,0.04014139441492954,32,5,3,0.03276609912123098,64,3,1,0.027227930165879904,64,5,1,0.04608013764855948,64.0,5.0,2.0,,,,,256,0.26692118607709114,10.0,4,Adam,,,,,,,"{""block_0_dropout"": 0.04014139441492954, ""block_0_filters"": 32, ""block_0_kernel"": 5, ""block_1_dropout"": 0.03276609912123098, ""block_1_filters"": 64, ""block_1_kernel"": 3, ""block_1_stride"": 1, ""block_2_dropout"": 0.027227930165879904, ""block_2_filters"": 64, ""block_2_kernel"": 5, ""block_2_stride"": 1, ""n_blocks"": 4}",PRUNED
46,0.8493249774041474,2026-10-04 16:40:29.863546,2026-10-04 16:40:59.534899,0 days 00:00:29.671353,0.916462875907069,0.9984021039574595,0.00015653174498977043,0.0013189173603079156,64.0,0.04452493076292411,32,5,3,0.0400302700565324,64,3,1,0.03279980053329209,128,3,1,0.011861152142789103,64.0,5.0,2.0,0.015541214310703527,256.0,3.0,1.0,256,0.20350628997356576,7.0,5,Adam,,,,49.0,0.8665254237288136,0.8321245310794811,"{""block_0_dropout"": 0.04452493076292411, ""block_0_filters"": 32, ""block_0_kernel"": 5, ""block_1_dropout"": 0.0400302700565324, ""block_1_filters"": 64, ""block_1_kernel"": 3, ""block_1_stride"": 1, ""block_2_dropout"": 0.03279980053329209, ""block_2_filters"": 128, ""block_2_kernel"": 3, ""block_2_stride"": 1, ""n_blocks"": 5}",COMPLETE
47,0.47607045590494584,2026-10-04 16:40:59.592207,2026-10-04 16:41:06.816923,0 days 00:00:07.224716,,,,,64.0,0.044825857463170304,8,5,3,0.03854923299048627,64,7,1,0.03205632281059861,128,5,1,0.01683136201493026,128.0,3.0,2.0,0.015854695177513655,256.0,3.0,1.0,256,0.20290901905764447,9.0,5,SGD,0.00011257800316314656,0.9885133124842272,0.0005588118489429241,,,,"{""block_0_dropout"": 0.044825857463170304, ""block_0_filters"": 8, ""block_0_kernel"": 5, ""block_1_dropout"": 0.03854923299048627, ""block_1_filters"": 64, ""block_1_kernel"": 7, ""block_1_stride"": 1, ""block_2_dropout"": 0.03205632281059861, ""block_2_filters"": 128, ""block_2_kernel"": 5, ""block_2_stride"": 1, ""n_blocks"": 5}",PRUNED
48,0.8652228026117114,2026-10-04 16:41:06.869450,2026-10-04 16:41:38.822693,0 days 00:00:31.953243,0.9382136688809547,0.9949474739046176,0.00015542640914952496,0.0011809759297692574,64.0,0.042629122180937735,32,5,3,0.014718955898286281,64,3,1,0.025128441659060547,128,5,1,0.010764424534583324,64.0,5.0,2.0,0.025123509831387107,256.0,3.0,1.0,256,0.32627870433159567,8.0,5,Adam,,,,49.0,0.8792372881355932,0.8512083170878295,"{""block_0_dropout"": 0.042629122180937735, ""block_0_filters"": 32, ""block_0_kernel"": 5, ""block_1_dropout"": 0.014718955898286281, ""block_1_filters"": 64, ""block_1_kernel"": 3, ""block_1_stride"": 1, ""block_2_dropout"": 0.025128441659060547, ""block_2_filters"": 128, ""block_2_kernel"": 5, ""block_2_stride"": 1, ""n_blocks"": 5}",COMPLETE
49,0.8509163695697737,2026-10-04 16:41:38.896805,2026-10-04 16:42:13.367539,0 days 00:00:34.470734,0.9582744510309974,0.9866488775581087,0.00040153723076338793,0.00018577527457623697,64.0,0.03602969829287836,32,5,3,0.014665711676943699,64,3,1,0.02546254013239112,128,5,1,0.02030982864998744,128.0,5.0,2.0,0.026247067149479344,128.0,3.0,1.0,256,0.3562834504494804,12.0,5,Adam,,,,50.0,0.875,0.8268327391395474,"{""block_0_dropout"": 0.03602969829287836, ""block_0_filters"": 32, ""block_0_kernel"": 5, ""block_1_dropout"": 0.014665711676943699, ""block_1_filters"": 64, ""block_1_kernel"": 3, ""block_1_stride"": 1, ""block_2_dropout"": 0.02546254013239112, ""block_2_filters"": 128, ""block_2_kernel"": 5, ""block_2_stride"": 1, ""n_blocks"": 5}",COMPLETE
50,0.872473415858285,2026-10-04 16:42:13.424279,2026-10-04 16:42:48.527649,0 days 00:00:35.103370,0.9351699807914253,0.9920838831557182,0.00014662695904306175,0.0008255565832727805,64.0,0.04543722866891954,32,5,3,0.01993301079634656,64,3,1,0.026530876619868398,128,5,1,0.01106924505425317,128.0,5.0,2.0,0.02666274853351087,256.0,3.0,1.0,256,0.3416702753492993,8.0,5,Adam,,,,47.0,0.893361581920904,0.8515852497956661,"{""block_0_dropout"": 0.04543722866891954, ""block_0_filters"": 32, ""block_0_kernel"": 5, ""block_1_dropout"": 0.01993301079634656, ""block_1_filters"": 64, ""block_1_kernel"": 3, ""block_1_stride"": 1, ""block_2_dropout"": 0.026530876619868398, ""block_2_filters"": 128, ""block_2_kernel"": 5, ""block_2_stride"": 1, ""n_blocks"": 5}",COMPLETE
51,0.8690296063123042,2026-10-04 16:42:48.597555,2026-10-04 16:43:24.044835,0 days 00:00:35.447280,0.9409536771461928,0.9906604605587926,0.00015000394629941777,0.0007251239055537176,64.0,0.044618162214657225,32,5,3,0.012365109533718718,64,3,1,0.030201574988450934,128,5,1,0.014027486800746523,128.0,5.0,2.0,0.027888926453539936,256.0,3.0,1.0,256,0.2730446681546806,8.0,5,Adam,,,,45.0,0.884180790960452,0.8538784216641565,"{""block_0_dropout"": 0.044618162214657225, ""block_0_filters"": 32, ""block_0_kernel"": 5, ""block_1_dropout"": 0.012365109533718718, ""block_1_filters"": 64, ""block_1_kernel"": 3, ""block_1_stride"": 1, ""block_2_dropout"": 0.030201574988450934, ""block_2_filters"": 128, ""block_2_kernel"": 5, ""block_2_stride"": 1, ""n_blocks"": 5}",COMPLETE
52,0.8741222485193444,2026-10-04 16:43:24.101499,2026-10-04 16:43:59.300855,0 days 00:00:35.199356,0.9354167757659103,0.9918769093481223,0.0001444831137916564,0.0007086589362249329,64.0,0.04240777086729918,32,5,3,0.0175578824876131,64,3,1,0.034331548085416344,128,5,1,0.010619942351301247,128.0,5.0,2.0,0.02960353052173243,256.0,3.0,1.0,256,0.34493035387095117,8.0,5,Adam,,,,50.0,0.8912429378531074,0.8570015591855814,"{""block_0_dropout"": 0.04240777086729918, ""block_0_filters"": 32, ""block_0_kernel"": 5, ""block_1_dropout"": 0.0175578824876131, ""block_1_filters"": 64, ""block_1_kernel"": 3, ""block_1_stride"": 1, ""block_2_dropout"": 0.034331548085416344, ""block_2_filters"": 128, ""block_2_kernel"": 5, ""block_2_stride"": 1, ""n_blocks"": 5}",COMPLETE
53,0.864151841087877,2026-10-04 16:43:59.354033,2026-10-04 16:44:35.399109,0 days 00:00:36.045076,0.9557690300879228,0.9897374673990912,0.00013653828181625025,0.0005853745085349448,64.0,0.046100729327463515,32,5,3,0.010999901921903671,64,3,1,0.036411193935093185,128,5,1,0.014296910121316023,128.0,5.0,2.0,0.03234785748971343,256.0,3.0,1.0,256,0.3666496136120241,6.0,5,Adam,,,,48.0,0.885593220338983,0.842710461836771,"{""block_0_dropout"": 0.046100729327463515, ""block_0_filters"": 32, ""block_0_kernel"": 5, ""block_1_dropout"": 0.010999901921903671, ""block_1_filters"": 64, ""block_1_kernel"": 3, ""block_1_stride"": 1, ""block_2_dropout"": 0.036411193935093185, ""block_2_filters"": 128, ""block_2_kernel"": 5, ""block_2_stride"": 1, ""n_blocks"": 5}",COMPLETE
54,0.8590506103494749,2026-10-04 16:44:35.455284,2026-10-04 16:45:16.729194,0 days 00:00:41.273910,0.9400881482053117,0.9799337983031419,0.00022029500731090337,5.363095915906323e-06,64.0,0.0481804001458809,32,5,3,0.02107391030522674,64,3,1,0.023225724058810723,128,5,1,0.014144450856312768,128.0,5.0,2.0,0.03189539250325183,256.0,3.0,1.0,256,0.41998082256969554,11.0,5,Adam,,,,42.0,0.8778248587570622,0.8402763619418877,"{""block_0_dropout"": 0.0481804001458809, ""block_0_filters"": 32, ""block_0_kernel"": 5, ""block_1_dropout"": 0.02107391030522674, ""block_1_filters"": 64, ""block_1_kernel"": 3, ""block_1_stride"": 1, ""block_2_dropout"": 0.023225724058810723, ""block_2_filters"": 128, ""block_2_kernel"": 5, ""block_2_stride"": 1, ""n_blocks"": 5}",COMPLETE
55,0.8757746258191625,2026-10-04 16:45:16.805171,2026-10-04 16:45:56.167115,0 days 00:00:39.361944,0.9312021212246937,0.9916997450368611,0.0001890025085068312,0.00010742364169345258,64.0,0.044566168154927185,32,5,3,0.017735298954656233,64,3,1,0.03900269174709564,128,5,1,0.012864548914012593,128.0,5.0,2.0,0.035247019371780264,256.0,3.0,1.0,256,0.2835968671579553,9.0,5,Adam,,,,50.0,0.8940677966101694,0.8574814550281556,"{""block_0_dropout"": 0.044566168154927185, ""block_0_filters"": 32, ""block_0_kernel"": 5, ""block_1_dropout"": 0.017735298954656233, ""block_1_filters"": 64, ""block_1_kernel"": 3, ""block_1_stride"": 1, ""block_2_dropout"": 0.03900269174709564, ""block_2_filters"": 128, ""block_2_kernel"": 5, ""block_2_stride"": 1, ""n_blocks"": 5}",COMPLETE
56,0.8507137063139816,2026-10-04 16:45:56.220410,2026-10-04 16:46:33.689919,0 days 00:00:37.469509,0.9335235880993844,0.9908925837726394,0.0001303395143599314,0.00010918137749391519,64.0,0.03938802541629635,32,5,3,0.020029454561763877,64,3,1,0.0417195192349127,128,5,1,0.010126748627025305,128.0,5.0,2.0,0.03778804247663038,256.0,3.0,1.0,256,0.30516899879926046,9.0,5,Adam,,,,49.0,0.8700564971751412,0.8313709154528219,"{""block_0_dropout"": 0.03938802541629635, ""block_0_filters"": 32, ""block_0_kernel"": 5, ""block_1_dropout"": 0.020029454561763877, ""block_1_filters"": 64, ""block_1_kernel"": 3, ""block_1_stride"": 1, ""block_2_dropout"": 0.0417195192349127, ""block_2_filters"": 128, ""block_2_kernel"": 5, ""block_2_stride"": 1, ""n_blocks"": 5}",COMPLETE
57,0.826750813457837,2026-10-04 16:46:33.747505,2026-10-04 16:47:05.337360,0 days 00:00:31.589855,0.9482969085313434,0.9790130713914423,0.0002486505639515836,0.0006199804425630785,200.0,0.04440088840026325,32,5,3,0.014228437649822474,64,3,1,0.02922178006073429,128,5,1,0.012310747624418996,128.0,3.0,2.0,0.04238480585895666,256.0,3.0,1.0,256,0.3710263016117971,10.0,5,Adam,,,,49.0,0.846045197740113,0.807456429175561,"{""block_0_dropout"": 0.04440088840026325, ""block_0_filters"": 32, ""block_0_kernel"": 5, ""block_1_dropout"": 0.014228437649822474, ""block_1_filters"": 64, ""block_1_kernel"": 3, ""block_1_stride"": 1, ""block_2_dropout"": 0.02922178006073429, ""block_2_filters"": 128, ""block_2_kernel"": 5, ""block_2_stride"": 1, ""n_blocks"": 5}",COMPLETE
58,0.8462639002339407,2026-10-04 16:47:05.392166,2026-10-04 16:47:45.290572,0 days 00:00:39.898406,0.9660057957461663,0.96967291116403,0.00017607692883312993,0.0002724688689602422,64.0,0.04785196061527378,32,5,3,0.018152653256038483,64,3,1,0.04077720113224644,128,5,1,0.01784444956545774,128.0,5.0,2.0,0.02943041575598113,256.0,3.0,1.0,256,0.2638402431363546,11.0,5,Adam,,,,50.0,0.8707627118644068,0.8217650886034745,"{""block_0_dropout"": 0.04785196061527378, ""block_0_filters"": 32, ""block_0_kernel"": 5, ""block_1_dropout"": 0.018152653256038483, ""block_1_filters"": 64, ""block_1_kernel"": 3, ""block_1_stride"": 1, ""block_2_dropout"": 0.04077720113224644, ""block_2_filters"": 128, ""block_2_kernel"": 5, ""block_2_stride"": 1, ""n_blocks"": 5}",COMPLETE
59,0.8690765006654833,2026-10-04 16:47:45.343448,2026-10-04 16:48:18.894989,0 days 00:00:33.551541,0.9281436118362191,0.9831679141382679,0.0001230895784123214,0.00048193961159741645,64.0,0.03965518185777883,32,5,3,0.019147755389679125,64,3,1,0.029718783155608587,128,5,1,0.01307960056053937,128.0,5.0,2.0,0.03849730186054834,128.0,3.0,1.0,256,0.3336779295683035,14.0,5,Adam,,,,45.0,0.885593220338983,0.8525597809919835,"{""block_0_dropout"": 0.03965518185777883, ""block_0_filters"": 32, ""block_0_kernel"": 5, ""block_1_dropout"": 0.019147755389679125, ""block_1_filters"": 64, ""block_1_kernel"": 3, ""block_1_stride"": 1, ""block_2_dropout"": 0.029718783155608587, ""block_2_filters"": 128, ""block_2_kernel"": 5, ""block_2_stride"": 1, ""n_blocks"": 5}",COMPLETE
60,0.5004978275672055,2026-10-04 16:48:18.948333,2026-10-04 16:48:27.099537,0 days 00:00:08.151204,,,,,64.0,0.0475648020332885,32,5,3,0.024689631340872306,64,3,1,0.03981441660118567,128,5,1,0.01948791906371554,128.0,5.0,2.0,0.03897478634626041,128.0,3.0,1.0,256,0.3398412722867814,14.0,5,SGD,0.015943499525026286,0.7850394854321417,2.0473871810389287e-05,,,,"{""block_0_dropout"": 0.0475648020332885, ""block_0_filters"": 32, ""block_0_kernel"": 5, ""block_1_dropout"": 0.024689631340872306, ""block_1_filters"": 64, ""block_1_kernel"": 3, ""block_1_stride"": 1, ""block_2_dropout"": 0.03981441660118567, ""block_2_filters"": 128, ""block_2_kernel"": 5, ""block_2_stride"": 1, ""n_blocks"": 5}",PRUNED
61,0.8496040148387498,2026-10-04 16:48:27.153541,2026-10-04 16:49:00.941856,0 days 00:00:33.788315,0.9293035120670942,0.9915577269616637,0.00012954474186944635,0.00048597039063432373,64.0,0.04311119459807787,32,5,3,0.019763153978317825,64,3,1,0.029275354913503467,128,5,1,0.012968731286972792,128.0,5.0,2.0,0.034863620945352274,128.0,3.0,1.0,256,0.2843647877441432,18.0,5,Adam,,,,50.0,0.8679378531073446,0.8312701765701551,"{""block_0_dropout"": 0.04311119459807787, ""block_0_filters"": 32, ""block_0_kernel"": 5, ""block_1_dropout"": 0.019763153978317825, ""block_1_filters"": 64, ""block_1_kernel"": 3, ""block_1_stride"": 1, ""block_2_dropout"": 0.029275354913503467, ""block_2_filters"": 128, ""block_2_kernel"": 5, ""block_2_stride"": 1, ""n_blocks"": 5}",COMPLETE
