number,value,datetime_start,datetime_complete,duration,params_adam_beta1,params_adam_beta2,params_adam_lr,params_adam_wd,params_batch_size,params_block_0_dropout,params_block_0_filters,params_block_0_kernel,params_block_0_stride,params_block_1_dropout,params_block_1_filters,params_block_1_kernel,params_block_1_stride,params_block_2_dropout,params_block_2_filters,params_block_2_kernel,params_block_2_stride,params_block_3_dropout,params_block_3_filters,params_block_3_kernel,params_block_3_stride,params_block_4_dropout,params_block_4_filters,params_block_4_kernel,params_block_4_stride,params_fc_hidden,params_lr_factor,params_lr_patience,params_n_blocks,params_optimizer,params_sgd_lr,params_sgd_momentum,params_sgd_wd,user_attrs_best_epoch,user_attrs_validation_accuracy,user_attrs_validation_macro_f1,system_attrs_tpe:relative_params:0,state
90,0.379212684310163,2026-10-04 16:59:44.692234,2026-10-04 16:59:51.956213,0 days 00:00:07.263979,,,,,64.0,0.04882901522786113,32,5,3,0.011802609106139075,64,3,1,0.029501752455445594,128,5,1,0.03437417297714461,128.0,5.0,2.0,0.03869762829498768,256.0,3.0,1.0,256,0.5133489779303384,7.0,5,SGD,0.00029701263608291007,0.7570019428128413,0.00010287354612147991,,,,"{""block_0_dropout"": 0.04882901522786113, ""block_0_filters"": 32, ""block_0_kernel"": 5, ""block_1_dropout"": 0.011802609106139075, ""block_1_filters"": 64, ""block_1_kernel"": 3, ""block_1_stride"": 1, ""block_2_dropout"": 0.029501752455445594, ""block_2_filters"": 128, ""block_2_kernel"": 5, ""block_2_stride"": 1, ""n_blocks"": 5}",PRUNED
91,0.8691883657316156,2026-10-04 16:59:52.013147,2026-10-04 17:00:30.709879,0 days 00:00:38.696732,0.9424355287124726,0.9907695229284759,0.0001573342164544827,0.0007231816476198737,64.0,0.04039064055041936,32,5,3,0.019805515573662957,64,3,1,0.024398243423287714,128,5,1,0.014633014623920897,128.0,5.0,2.0,0.027603951123744776,256.0,3.0,1.0,256,0.2782987573092688,8.0,5,Adam,,,,47.0,0.8877118644067796,0.8506648670564516,"{""block_0_dropout"": 0.04039064055041936, ""block_0_filters"": 32, ""block_0_kernel"": 5, ""block_1_dropout"": 0.019805515573662957, ""block_1_filters"": 64, ""block_1_kernel"": 3, ""block_1_stride"": 1, ""block_2_dropout"": 0.024398243423287714, ""block_2_filters"": 128, ""block_2_kernel"": 5, ""block_2_stride"": 1, ""n_blocks"": 5}",COMPLETE
92,0.8691338288171624,2026-10-04 17:00:30.763348,2026-10-04 17:01:07.707025,0 days 00:00:36.943677,0.9436169082445561,0.9908443805982396,0.00022910998941389832,0.0007488322329679246,64.0,0.04729747714175426,32,5,3,0.017562655444270187,64,3,1,0.02732119544770353,128,5,1,0.014831859530774238,128.0,5.0,2.0,0.025744909290465218,256.0,3.0,1.0,256,0.27588309068667444,8.0,5,Adam,,,,46.0,0.8891242937853108,0.8491433638490141,"{""block_0_dropout"": 0.04729747714175426, ""block_0_filters"": 32, ""block_0_kernel"": 5, ""block_1_dropout"": 0.017562655444270187, ""block_1_filters"": 64, ""block_1_kernel"": 3, ""block_1_stride"": 1, ""block_2_dropout"": 0.02732119544770353, ""block_2_filters"": 128, ""block_2_kernel"": 5, ""block_2_stride"": 1, ""n_blocks"": 5}",COMPLETE
93,0.8524795991161587,2026-10-04 17:01:07.760490,2026-10-04 17:01:43.197996,0 days 00:00:35.437506,0.959668447068466,0.9960513187961769,0.00023802237993067173,0.0007555595899542706,64.0,0.049770058144606916,32,5,3,0.020958332555722416,64,3,1,0.03457341550964731,128,5,1,0.014845512731998732,128.0,5.0,2.0,0.025985684607843142,256.0,3.0,1.0,256,0.22650281445298662,8.0,5,Adam,,,,39.0,0.8679378531073446,0.8370213451249727,"{""block_0_dropout"": 0.049770058144606916, ""block_0_filters"": 32, ""block_0_kernel"": 5, ""block_1_dropout"": 0.020958332555722416, ""block_1_filters"": 64, ""block_1_kernel"": 3, ""block_1_stride"": 1, ""block_2_dropout"": 0.03457341550964731, ""block_2_filters"": 128, ""block_2_kernel"": 5, ""block_2_stride"": 1, ""n_blocks"": 5}",COMPLETE
94,0.8738082295571195,2026-10-04 17:01:43.257651,2026-10-04 17:02:19.492490,0 days 00:00:36.234839,0.9502222477321975,0.988178634751381,0.0002094820842759174,0.0010541463449996328,64.0,0.04715463157087259,32,5,3,0.012056444145947143,64,3,1,0.0271863883445635,128,5,1,0.01768737970897974,128.0,5.0,2.0,0.02740504511672996,256.0,3.0,1.0,256,0.2570878647332943,9.0,5,Adam,,,,45.0,0.8919491525423728,0.8556673065718661,"{""block_0_dropout"": 0.04715463157087259, ""block_0_filters"": 32, ""block_0_kernel"": 5, ""block_1_dropout"": 0.012056444145947143, ""block_1_filters"": 64, ""block_1_kernel"": 3, ""block_1_stride"": 1, ""block_2_dropout"": 0.0271863883445635, ""block_2_filters"": 128, ""block_2_kernel"": 5, ""block_2_stride"": 1, ""n_blocks"": 5}",COMPLETE
95,0.8706391246228349,2026-10-04 17:02:19.545554,2026-10-04 17:02:54.829695,0 days 00:00:35.284141,0.9502737425288692,0.9882459342404842,0.00015835172501838115,0.0042637335675899035,64.0,0.040588771679139636,32,5,3,0.011084548125964431,64,3,1,0.030956732680835305,128,5,1,0.017461451866541394,128.0,5.0,2.0,0.027679263307683756,256.0,3.0,1.0,256,0.2467944529052944,9.0,5,Adam,,,,45.0,0.8891242937853108,0.852153955460359,"{""block_0_dropout"": 0.040588771679139636, ""block_0_filters"": 32, ""block_0_kernel"": 5, ""block_1_dropout"": 0.011084548125964431, ""block_1_filters"": 64, ""block_1_kernel"": 3, ""block_1_stride"": 1, ""block_2_dropout"": 0.030956732680835305, ""block_2_filters"": 128, ""block_2_kernel"": 5, ""block_2_stride"": 1, ""n_blocks"": 5}",COMPLETE
96,0.5302747377556067,2026-10-04 17:02:54.903234,2026-10-04 17:03:07.229216,0 days 00:00:12.325982,0.9631622079719762,0.986746260661822,0.00020177662321332987,0.0030420183713778743,64.0,0.0421169455559361,32,5,3,0.019872750068615254,64,3,1,0.03235094843798989,128,5,1,0.01806389986392253,128.0,5.0,1.0,0.029727794351576284,256.0,3.0,1.0,128,0.25379489420214835,9.0,5,Adam,,,,,,,"{""block_0_dropout"": 0.0421169455559361, ""block_0_filters"": 32, ""block_0_kernel"": 5, ""block_1_dropout"": 0.019872750068615254, ""block_1_filters"": 64, ""block_1_kernel"": 3, ""block_1_stride"": 1, ""block_2_dropout"": 0.03235094843798989, ""block_2_filters"": 128, ""block_2_kernel"": 5, ""block_2_stride"": 1, ""n_blocks"": 5}",PRUNED
97,0.1717759625653572,2026-10-04 17:03:07.286330,2026-10-04 17:03:16.228169,0 days 00:00:08.941839,0.9481196354211271,0.9768971009016897,0.0011314341206221676,0.001871916788885365,64.0,0.04888554238610973,32,5,3,0.011270537502390475,64,3,1,0.033952552226823265,128,5,1,0.02198561599389972,128.0,5.0,2.0,0.014499912723215276,256.0,3.0,1.0,256,0.16669605499430107,10.0,5,Adam,,,,,,,"{""block_0_dropout"": 0.04888554238610973, ""block_0_filters"": 32, ""block_0_kernel"": 5, ""block_1_dropout"": 0.011270537502390475, ""block_1_filters"": 64, ""block_1_kernel"": 3, ""block_1_stride"": 1, ""block_2_dropout"": 0.033952552226823265, ""block_2_filters"": 128, ""block_2_kernel"": 5, ""block_2_stride"": 1, ""n_blocks"": 5}",PRUNED
98,,2026-10-04 17:03:16.293360,2026-10-04 17:03:16.323403,0 days 00:00:00.030043,,,,,,0.0420761226153421,32,5,3,0.013139357600209591,64,3,1,0.030349058227094262,128,5,2,0.016499282455900557,64.0,5.0,2.0,0.028768809912039006,256.0,3.0,1.0,,,,5,,,,,,,,"{""block_0_dropout"": 0.0420761226153421, ""block_0_filters"": 32, ""block_0_kernel"": 5, ""block_1_dropout"": 0.013139357600209591, ""block_1_filters"": 64, ""block_1_kernel"": 3, ""block_1_stride"": 1, ""block_2_dropout"": 0.030349058227094262, ""block_2_filters"": 128, ""block_2_kernel"": 5, ""block_2_stride"": 2, ""n_blocks"": 5}",PRUNED
99,0.8649356052075335,2026-10-04 17:03:16.416879,2026-10-04 17:03:52.232864,0 days 00:00:35.815985,0.9524504454220626,0.9970846401087555,0.00016571361672615423,0.0034964946346315094,64.0,0.04897129259309944,32,5,3,0.014537154430047305,64,3,1,0.02487618710206705,128,5,1,0.012127184572174328,128.0,5.0,2.0,0.024249728613505894,256.0,3.0,1.0,256,0.4702255392281943,9.0,5,Adam,,,,49.0,0.8862994350282486,0.8435717753868185,"{""block_0_dropout"": 0.04897129259309944, ""block_0_filters"": 32, ""block_0_kernel"": 5, ""block_1_dropout"": 0.014537154430047305, ""block_1_filters"": 64, ""block_1_kernel"": 3, ""block_1_stride"": 1, ""block_2_dropout"": 0.02487618710206705, ""block_2_filters"": 128, ""block_2_kernel"": 5, ""block_2_stride"": 1, ""n_blocks"": 5}",COMPLETE
