number,value,datetime_start,datetime_complete,duration,params_adam_beta1,params_adam_beta2,params_adam_lr,params_adam_wd,params_batch_size,params_block_0_dropout,params_block_0_filters,params_block_0_kernel,params_block_0_stride,params_block_1_dropout,params_block_1_filters,params_block_1_kernel,params_block_1_stride,params_block_2_dropout,params_block_2_filters,params_block_2_kernel,params_block_2_stride,params_block_3_dropout,params_block_3_filters,params_block_3_kernel,params_block_3_stride,params_block_4_dropout,params_block_4_filters,params_block_4_kernel,params_block_4_stride,params_fc_hidden,params_lr_factor,params_lr_patience,params_n_blocks,params_optimizer,params_sgd_lr,params_sgd_momentum,params_sgd_wd,user_attrs_best_epoch,user_attrs_validation_accuracy,user_attrs_validation_macro_f1,system_attrs_tpe:relative_params:0,state
62,0.8443919600410763,2026-10-04 16:49:00.997801,2026-10-04 16:49:34.668463,0 days 00:00:33.670662,0.9492687590497927,0.983679442577796,0.00012412870870584145,0.00019015901383151446,64.0,0.03947786678709941,32,5,3,0.01597812367202358,64,3,1,0.035933604033145085,128,5,1,0.015580527650447882,128.0,5.0,2.0,0.041438100541369184,128.0,3.0,1.0,256,0.39281583096949524,15.0,5,Adam,,,,49.0,0.8707627118644068,0.8180212082177459,"{""block_0_dropout"": 0.03947786678709941, ""block_0_filters"": 32, ""block_0_kernel"": 5, ""block_1_dropout"": 0.01597812367202358, ""block_1_filters"": 64, ""block_1_kernel"": 3, ""block_1_stride"": 1, ""block_2_dropout"": 0.035933604033145085, ""block_2_filters"": 128, ""block_2_kernel"": 5, ""block_2_stride"": 1, ""n_blocks"": 5}",COMPLETE
63,0.8696493482677643,2026-10-04 16:49:34.720773,2026-10-04 16:50:07.945476,0 days 00:00:33.224703,0.9349971490902839,0.9943496322446131,0.00019140944303817217,0.0003466769939232906,64.0,0.038652895116003526,32,5,3,0.022344459046227998,64,3,1,0.023445348050259312,128,5,1,0.013085174264253084,128.0,5.0,2.0,0.03487703548763659,128.0,3.0,1.0,256,0.4495784631371311,14.0,5,Adam,,,,50.0,0.8884180790960452,0.8508806174394833,"{""block_0_dropout"": 0.038652895116003526, ""block_0_filters"": 32, ""block_0_kernel"": 5, ""block_1_dropout"": 0.022344459046227998, ""block_1_filters"": 64, ""block_1_kernel"": 3, ""block_1_stride"": 1, ""block_2_dropout"": 0.023445348050259312, ""block_2_filters"": 128, ""block_2_kernel"": 5, ""block_2_stride"": 1, ""n_blocks"": 5}",COMPLETE
64,0.8706244243244534,2026-10-04 16:50:08.002680,2026-10-04 16:50:41.737445,0 days 00:00:33.734765,0.9249190909668151,0.994582808652277,0.0001906980614611891,0.0001231950219091998,64.0,0.04648353325060242,32,5,3,0.020360895878263563,64,3,1,0.03472638039724886,128,5,1,0.01150227157634924,128.0,5.0,2.0,0.034662180485395704,128.0,3.0,1.0,256,0.4519236454173115,13.0,5,Adam,,,,50.0,0.8834745762711864,0.8577742723777205,"{""block_0_dropout"": 0.04648353325060242, ""block_0_filters"": 32, ""block_0_kernel"": 5, ""block_1_dropout"": 0.020360895878263563, ""block_1_filters"": 64, ""block_1_kernel"": 3, ""block_1_stride"": 1, ""block_2_dropout"": 0.03472638039724886, ""block_2_filters"": 128, ""block_2_kernel"": 5, ""block_2_stride"": 1, ""n_blocks"": 5}",COMPLETE
65,0.8681879188108148,2026-10-04 16:50:41.795199,2026-10-04 16:51:12.358441,0 days 00:00:30.563242,0.9342188299883847,0.9984802587975476,0.00024331933921796197,7.20950207167184e-05,200.0,0.04674806814442601,32,5,3,0.017943628841464134,64,3,1,0.035779188394339904,128,5,1,0.01013237886424376,128.0,5.0,2.0,0.0345240168092395,128.0,3.0,1.0,256,0.5480559332782339,13.0,5,Adam,,,,47.0,0.884180790960452,0.8521950466611775,"{""block_0_dropout"": 0.04674806814442601, ""block_0_filters"": 32, ""block_0_kernel"": 5, ""block_1_dropout"": 0.017943628841464134, ""block_1_filters"": 64, ""block_1_kernel"": 3, ""block_1_stride"": 1, ""block_2_dropout"": 0.035779188394339904, ""block_2_filters"": 128, ""block_2_kernel"": 5, ""block_2_stride"": 1, ""n_blocks"": 5}",COMPLETE
66,0.8461920718196871,2026-10-04 16:51:12.417051,2026-10-04 16:51:46.080472,0 days 00:00:33.663421,0.9232062792547336,0.9942697889099539,0.000190397392090534,0.00013097897874265657,64.0,0.03289915650870236,32,5,3,0.016564869980733195,64,3,1,0.027929811595198823,128,5,1,0.01595423691115518,128.0,5.0,2.0,0.03132044014050154,128.0,3.0,1.0,256,0.4593521721044564,16.0,5,Adam,,,,47.0,0.8686440677966102,0.8237400758427642,"{""block_0_dropout"": 0.03289915650870236, ""block_0_filters"": 32, ""block_0_kernel"": 5, ""block_1_dropout"": 0.016564869980733195, ""block_1_filters"": 64, ""block_1_kernel"": 3, ""block_1_stride"": 1, ""block_2_dropout"": 0.027929811595198823, ""block_2_filters"": 128, ""block_2_kernel"": 5, ""block_2_stride"": 1, ""n_blocks"": 5}",COMPLETE
67,0.3105894582598028,2026-10-04 16:51:46.133637,2026-10-04 16:51:53.626566,0 days 00:00:07.492929,0.9126722254746328,0.9749021458266671,0.004494215888899228,0.0002872166848663285,64.0,0.042688697448349855,32,5,3,0.022722754803564404,64,3,1,0.026022267966153048,128,5,1,0.024508391625040333,128.0,5.0,2.0,0.036184815444309654,512.0,3.0,1.0,256,0.5174892548151692,13.0,5,Adam,,,,,,,"{""block_0_dropout"": 0.042688697448349855, ""block_0_filters"": 32, ""block_0_kernel"": 5, ""block_1_dropout"": 0.022722754803564404, ""block_1_filters"": 64, ""block_1_kernel"": 3, ""block_1_stride"": 1, ""block_2_dropout"": 0.026022267966153048, ""block_2_filters"": 128, ""block_2_kernel"": 5, ""block_2_stride"": 1, ""n_blocks"": 5}",PRUNED
68,0.851013689559761,2026-10-04 16:51:53.683120,2026-10-04 16:52:31.475420,0 days 00:00:37.792300,0.9455874240071171,0.9864915775448656,0.0001836806634123994,0.00011124163096195094,64.0,0.04323582296322601,32,5,3,0.013462116185374979,64,3,1,0.03407073009156031,128,5,1,0.011389177849444975,128.0,5.0,2.0,0.033495285886211396,512.0,3.0,1.0,128,0.42545512392273777,18.0,5,Adam,,,,46.0,0.8757062146892656,0.8263211644302564,"{""block_0_dropout"": 0.04323582296322601, ""block_0_filters"": 32, ""block_0_kernel"": 5, ""block_1_dropout"": 0.013462116185374979, ""block_1_filters"": 64, ""block_1_kernel"": 3, ""block_1_stride"": 1, ""block_2_dropout"": 0.03407073009156031, ""block_2_filters"": 128, ""block_2_kernel"": 5, ""block_2_stride"": 1, ""n_blocks"": 5}",COMPLETE
69,0.8609870444067462,2026-10-04 16:52:31.528827,2026-10-04 16:53:05.811667,0 days 00:00:34.282840,0.9349501257316188,0.999737977801484,0.00026768492996423346,0.00034837168668186717,64.0,0.03848534807863892,32,5,3,0.01333759752680802,64,3,1,0.028224599088552755,128,5,1,0.01706395197597816,128.0,5.0,2.0,0.024203075216575512,128.0,3.0,1.0,256,0.5661153145108538,15.0,5,Adam,,,,50.0,0.8806497175141242,0.8413243712993682,"{""block_0_dropout"": 0.03848534807863892, ""block_0_filters"": 32, ""block_0_kernel"": 5, ""block_1_dropout"": 0.01333759752680802, ""block_1_filters"": 64, ""block_1_kernel"": 3, ""block_1_stride"": 1, ""block_2_dropout"": 0.028224599088552755, ""block_2_filters"": 128, ""block_2_kernel"": 5, ""block_2_stride"": 1, ""n_blocks"": 5}",COMPLETE
70,0.8550428387397068,2026-10-04 16:53:05.864999,2026-10-04 16:53:38.661532,0 days 00:00:32.796533,0.8641352383904772,0.9939934834178963,0.00021263889786936612,0.00020553689208657543,64.0,0.04359050183573455,32,5,3,0.01809925571914911,16,3,1,0.034160764231217285,128,5,1,0.018707320291126206,128.0,5.0,2.0,0.04272857488724295,128.0,3.0,1.0,256,0.4548854668606458,13.0,5,Adam,,,,42.0,0.8728813559322034,0.8372043215472101,"{""block_0_dropout"": 0.04359050183573455, ""block_0_filters"": 32, ""block_0_kernel"": 5, ""block_1_dropout"": 0.01809925571914911, ""block_1_filters"": 16, ""block_1_kernel"": 3, ""block_1_stride"": 1, ""block_2_dropout"": 0.034160764231217285, ""block_2_filters"": 128, ""block_2_kernel"": 5, ""block_2_stride"": 1, ""n_blocks"": 5}",COMPLETE
71,0.5020024759348579,2026-10-04 16:53:38.716141,2026-10-04 16:53:47.520049,0 days 00:00:08.803908,0.928132327483804,0.9828888709326736,0.00010018047432598854,0.00184685583125088,64.0,0.03541289482607503,32,5,3,0.01928833108779679,64,3,1,0.02390360928335052,128,5,1,0.013028446785917453,128.0,5.0,2.0,0.03767769550786987,128.0,3.0,1.0,256,0.48804419239464825,12.0,5,Adam,,,,,,,"{""block_0_dropout"": 0.03541289482607503, ""block_0_filters"": 32, ""block_0_kernel"": 5, ""block_1_dropout"": 0.01928833108779679, ""block_1_filters"": 64, ""block_1_kernel"": 3, ""block_1_stride"": 1, ""block_2_dropout"": 0.02390360928335052, ""block_2_filters"": 128, ""block_2_kernel"": 5, ""block_2_stride"": 1, ""n_blocks"": 5}",PRUNED
72,0.8479671356533649,2026-10-04 16:53:47.576584,2026-10-04 16:54:21.970765,0 days 00:00:34.394181,0.9230495857214532,0.9863770999620841,0.0001387283480831052,0.00039530869115747254,64.0,0.04456205335246714,32,5,3,0.022240717568869674,64,3,1,0.03496898384002099,128,5,1,0.021694025018580778,128.0,5.0,2.0,0.040138017095766566,128.0,3.0,1.0,256,0.39365712072353487,14.0,5,Adam,,,,48.0,0.867231638418079,0.8287026328886506,"{""block_0_dropout"": 0.04456205335246714, ""block_0_filters"": 32, ""block_0_kernel"": 5, ""block_1_dropout"": 0.022240717568869674, ""block_1_filters"": 64, ""block_1_kernel"": 3, ""block_1_stride"": 1, ""block_2_dropout"": 0.03496898384002099, ""block_2_filters"": 128, ""block_2_kernel"": 5, ""block_2_stride"": 1, ""n_blocks"": 5}",COMPLETE
73,0.8527114613393756,2026-10-04 16:54:22.025189,2026-10-04 16:54:55.333404,0 days 00:00:33.308215,0.929990330953859,0.9953825750822602,0.00017825542065750532,0.000260722589639557,64.0,0.037898278585489636,32,5,3,0.02101721871962758,64,3,1,0.02714252181187819,128,5,1,0.012890277426247416,128.0,5.0,2.0,0.04648646231829358,128.0,3.0,1.0,256,0.3149999018902958,16.0,5,Adam,,,,40.0,0.8637005649717514,0.8417223577069999,"{""block_0_dropout"": 0.037898278585489636, ""block_0_filters"": 32, ""block_0_kernel"": 5, ""block_1_dropout"": 0.02101721871962758, ""block_1_filters"": 64, ""block_1_kernel"": 3, ""block_1_stride"": 1, ""block_2_dropout"": 0.02714252181187819, ""block_2_filters"": 128, ""block_2_kernel"": 5, ""block_2_stride"": 1, ""n_blocks"": 5}",COMPLETE
74,,2026-10-04 16:54:55.399264,2026-10-04 16:54:55.455626,0 days 00:00:00.056362,,,,,,0.03981041676405036,32,5,3,0.02062272895215084,64,3,2,0.0320635294294542,128,5,1,0.015030600571568738,128.0,5.0,2.0,0.01236957743003456,256.0,3.0,1.0,,,,5,,,,,,,,"{""block_0_dropout"": 0.03981041676405036, ""block_0_filters"": 32, ""block_0_kernel"": 5, ""block_1_dropout"": 0.02062272895215084, ""block_1_filters"": 64, ""block_1_kernel"": 3, ""block_1_stride"": 2, ""block_2_dropout"": 0.0320635294294542, ""block_2_filters"": 128, ""block_2_kernel"": 5, ""block_2_stride"": 1, ""n_blocks"": 5}",PRUNED
75,0.48750131105451844,2026-10-04 16:54:55.589293,2026-10-04 16:55:10.308028,0 days 00:00:14.718735,0.9200058294620441,0.9889530650188654,0.00047734293208798255,3.531808097539221e-05,64.0,0.03910195042375587,32,5,3,0.024245672958925754,64,3,1,0.02478839855505563,128,5,1,0.011830431113235299,128.0,5.0,1.0,0.03715419041370211,512.0,3.0,1.0,128,0.3472315350816807,14.0,5,Adam,,,,,,,"{""block_0_dropout"": 0.03910195042375587, ""block_0_filters"": 32, ""block_0_kernel"": 5, ""block_1_dropout"": 0.024245672958925754, ""block_1_filters"": 64, ""block_1_kernel"": 3, ""block_1_stride"": 1, ""block_2_dropout"": 0.02478839855505563, ""block_2_filters"": 128, ""block_2_kernel"": 5, ""block_2_stride"": 1, ""n_blocks"": 5}",PRUNED
76,0.47409091903919487,2026-10-04 16:55:10.361621,2026-10-04 16:55:15.073160,0 days 00:00:04.711539,0.9090298569068666,0.9806239684283047,0.00011952427325357567,6.873333962232971e-05,200.0,0.040906022922552514,32,5,3,0.01775780361557366,64,3,1,0.027800840241517716,32,5,1,0.026431862983328665,128.0,5.0,2.0,0.033321287843448705,256.0,3.0,1.0,256,0.42644997031185716,5.0,5,Adam,,,,,,,"{""block_0_dropout"": 0.040906022922552514, ""block_0_filters"": 32, ""block_0_kernel"": 5, ""block_1_dropout"": 0.01775780361557366, ""block_1_filters"": 64, ""block_1_kernel"": 3, ""block_1_stride"": 1, ""block_2_dropout"": 0.027800840241517716, ""block_2_filters"": 32, ""block_2_kernel"": 5, ""block_2_stride"": 1, ""n_blocks"": 5}",PRUNED
77,0.6136792818064287,2026-10-04 16:55:15.126111,2026-10-04 16:55:23.532595,0 days 00:00:08.406484,0.9259072265309709,0.9742588998380166,0.00022158691936050815,0.00014889892851560163,64.0,0.04456959619307674,32,5,3,0.02387204664794232,64,3,1,0.022959378178828246,128,5,1,0.011060371978682055,128.0,3.0,2.0,0.03019808387950143,128.0,3.0,1.0,256,0.3705910652730407,13.0,5,Adam,,,,,,,"{""block_0_dropout"": 0.04456959619307674, ""block_0_filters"": 32, ""block_0_kernel"": 5, ""block_1_dropout"": 0.02387204664794232, ""block_1_filters"": 64, ""block_1_kernel"": 3, ""block_1_stride"": 1, ""block_2_dropout"": 0.022959378178828246, ""block_2_filters"": 128, ""block_2_kernel"": 5, ""block_2_stride"": 1, ""n_blocks"": 5}",PRUNED
78,,2026-10-04 16:55:23.585842,2026-10-04 16:55:23.606967,0 days 00:00:00.021125,,,,,,0.046613781221030326,32,5,3,0.01981761033438563,64,3,2,0.031528485243072175,128,5,1,0.031655544242260726,256.0,5.0,2.0,0.03467212519330774,256.0,3.0,1.0,,,,5,,,,,,,,"{""block_0_dropout"": 0.046613781221030326, ""block_0_filters"": 32, ""block_0_kernel"": 5, ""block_1_dropout"": 0.01981761033438563, ""block_1_filters"": 64, ""block_1_kernel"": 3, ""block_1_stride"": 2, ""block_2_dropout"": 0.031528485243072175, ""block_2_filters"": 128, ""block_2_kernel"": 5, ""block_2_stride"": 1, ""n_blocks"": 5}",PRUNED
79,0.39521691585757257,2026-10-04 16:55:23.663427,2026-10-04 16:55:31.569037,0 days 00:00:07.905610,,,,,64.0,0.038385384301814034,32,5,3,0.01553293787716195,64,3,1,0.03292000903381157,128,5,1,0.01364363521297308,128.0,5.0,2.0,0.045196228097859115,256.0,3.0,1.0,128,0.12604707502673956,15.0,5,SGD,0.0012437050978869996,0.8757215625121495,0.001009585259531268,,,,"{""block_0_dropout"": 0.038385384301814034, ""block_0_filters"": 32, ""block_0_kernel"": 5, ""block_1_dropout"": 0.01553293787716195, ""block_1_filters"": 64, ""block_1_kernel"": 3, ""block_1_stride"": 1, ""block_2_dropout"": 0.03292000903381157, ""block_2_filters"": 128, ""block_2_kernel"": 5, ""block_2_stride"": 1, ""n_blocks"": 5}",PRUNED
80,0.5215442179091463,2026-10-04 16:55:31.637390,2026-10-04 16:55:46.721586,0 days 00:00:15.084196,0.9367378547945062,0.9933181177033117,0.00017655155132066086,0.0009309910314450099,64.0,0.04074654928866719,32,5,3,0.019780121461963653,64,3,1,0.03581299836201847,128,5,1,0.01485348740496319,128.0,5.0,1.0,0.023253587637347927,256.0,3.0,1.0,256,0.671196500125345,9.0,5,Adam,,,,,,,"{""block_0_dropout"": 0.04074654928866719, ""block_0_filters"": 32, ""block_0_kernel"": 5, ""block_1_dropout"": 0.019780121461963653, ""block_1_filters"": 64, ""block_1_kernel"": 3, ""block_1_stride"": 1, ""block_2_dropout"": 0.03581299836201847, ""block_2_filters"": 128, ""block_2_kernel"": 5, ""block_2_stride"": 1, ""n_blocks"": 5}",PRUNED
81,0.8792996587974238,2026-10-04 16:55:46.775431,2026-10-04 16:56:22.177464,0 days 00:00:35.402033,0.9395886443531026,0.9880174486696454,0.00014148591376866886,0.0006820462930565923,64.0,0.04791160516606081,32,5,3,0.01159990767885003,64,3,1,0.029713953691241635,128,5,1,0.0134286998655914,128.0,5.0,2.0,0.028620957456786045,256.0,3.0,1.0,256,0.2877485470829725,8.0,5,Adam,,,,47.0,0.8961864406779662,0.8624128769168815,"{""block_0_dropout"": 0.04791160516606081, ""block_0_filters"": 32, ""block_0_kernel"": 5, ""block_1_dropout"": 0.01159990767885003, ""block_1_filters"": 64, ""block_1_kernel"": 3, ""block_1_stride"": 1, ""block_2_dropout"": 0.029713953691241635, ""block_2_filters"": 128, ""block_2_kernel"": 5, ""block_2_stride"": 1, ""n_blocks"": 5}",COMPLETE
82,0.8639790054780085,2026-10-04 16:56:22.238027,2026-10-04 16:56:59.083474,0 days 00:00:36.845447,0.9453175697194663,0.9882665565642494,0.00014521452951105318,0.00048080583027884297,64.0,0.045942771102923025,32,5,3,0.013613665589797909,64,3,1,0.042782366012755195,128,5,1,0.010039946589801141,128.0,5.0,2.0,0.018391016359422308,256.0,3.0,1.0,256,0.32689244488747465,8.0,5,Adam,,,,42.0,0.8834745762711864,0.8444834346848306,"{""block_0_dropout"": 0.045942771102923025, ""block_0_filters"": 32, ""block_0_kernel"": 5, ""block_1_dropout"": 0.013613665589797909, ""block_1_filters"": 64, ""block_1_kernel"": 3, ""block_1_stride"": 1, ""block_2_dropout"": 0.042782366012755195, ""block_2_filters"": 128, ""block_2_kernel"": 5, ""block_2_stride"": 1, ""n_blocks"": 5}",COMPLETE
83,0.8625899901500644,2026-10-04 16:56:59.144130,2026-10-04 16:57:35.496046,0 days 00:00:36.351916,0.9336437983449747,0.9629963688977448,0.00011558496209526989,0.0006940862014918362,64.0,0.04517402497663013,32,5,3,0.022258052901406974,64,3,1,0.027846667070672012,128,5,1,0.01600100617447615,128.0,5.0,2.0,0.027038470728121836,256.0,3.0,1.0,256,0.29775470390121156,7.0,5,Adam,,,,48.0,0.884180790960452,0.840999189339677,"{""block_0_dropout"": 0.04517402497663013, ""block_0_filters"": 32, ""block_0_kernel"": 5, ""block_1_dropout"": 0.022258052901406974, ""block_1_filters"": 64, ""block_1_kernel"": 3, ""block_1_stride"": 1, ""block_2_dropout"": 0.027846667070672012, ""block_2_filters"": 128, ""block_2_kernel"": 5, ""block_2_stride"": 1, ""n_blocks"": 5}",COMPLETE
84,0.5256282888824289,2026-10-04 16:57:35.550469,2026-10-04 16:57:44.133739,0 days 00:00:08.583270,0.9534267061578785,0.9963278045015448,0.0002016235888767421,0.001631075964785865,64.0,0.04592773443677969,32,5,3,0.016343887551305152,64,3,1,0.032331946105148085,128,5,1,0.012017587823384667,128.0,5.0,2.0,0.030823263478883922,256.0,3.0,1.0,256,0.21857857504113476,14.0,5,Adam,,,,,,,"{""block_0_dropout"": 0.04592773443677969, ""block_0_filters"": 32, ""block_0_kernel"": 5, ""block_1_dropout"": 0.016343887551305152, ""block_1_filters"": 64, ""block_1_kernel"": 3, ""block_1_stride"": 1, ""block_2_dropout"": 0.032331946105148085, ""block_2_filters"": 128, ""block_2_kernel"": 5, ""block_2_stride"": 1, ""n_blocks"": 5}",PRUNED
85,0.5911753874176537,2026-10-04 16:57:44.186986,2026-10-04 16:57:54.790323,0 days 00:00:10.603337,0.9425497530375733,0.9998157378424005,0.0002862100154633015,0.0009041519948747716,64.0,0.04128373679513713,32,5,3,0.023348873957565443,64,3,1,0.03060007002102227,128,5,1,0.03877772389316246,128.0,5.0,2.0,0.013093002723307783,256.0,3.0,1.0,256,0.14342376517868288,9.0,5,Adam,,,,,,,"{""block_0_dropout"": 0.04128373679513713, ""block_0_filters"": 32, ""block_0_kernel"": 5, ""block_1_dropout"": 0.023348873957565443, ""block_1_filters"": 64, ""block_1_kernel"": 3, ""block_1_stride"": 1, ""block_2_dropout"": 0.03060007002102227, ""block_2_filters"": 128, ""block_2_kernel"": 5, ""block_2_stride"": 1, ""n_blocks"": 5}",PRUNED
86,0.8621623937785287,2026-10-04 16:57:54.846442,2026-10-04 16:58:30.714729,0 days 00:00:35.868287,0.9307592233795288,0.9841276981626644,0.0001689304212770191,0.00037968460106836666,64.0,0.048561864993237364,32,5,3,0.01403841108897309,64,3,1,0.03298167906655441,128,5,1,0.04795338824200324,128.0,5.0,2.0,0.036457747810404964,256.0,3.0,1.0,256,0.8864969327385632,10.0,5,Adam,,,,50.0,0.8884180790960452,0.8359067084610121,"{""block_0_dropout"": 0.048561864993237364, ""block_0_filters"": 32, ""block_0_kernel"": 5, ""block_1_dropout"": 0.01403841108897309, ""block_1_filters"": 64, ""block_1_kernel"": 3, ""block_1_stride"": 1, ""block_2_dropout"": 0.03298167906655441, ""block_2_filters"": 128, ""block_2_kernel"": 5, ""block_2_stride"": 1, ""n_blocks"": 5}",COMPLETE
87,0.8599029573128943,2026-10-04 16:58:30.768852,2026-10-04 16:59:05.603562,0 days 00:00:34.834710,0.9260166930150047,0.9927000215658673,0.00014094444733557873,0.0012178535367315614,64.0,0.04585312662997729,32,5,3,0.018859279451401298,64,3,1,0.023267156002171805,128,5,1,0.012947555517537915,128.0,5.0,2.0,0.02221894414167333,128.0,3.0,1.0,128,0.3849879444133113,6.0,5,Adam,,,,50.0,0.8778248587570622,0.8419810558687265,"{""block_0_dropout"": 0.04585312662997729, ""block_0_filters"": 32, ""block_0_kernel"": 5, ""block_1_dropout"": 0.018859279451401298, ""block_1_filters"": 64, ""block_1_kernel"": 3, ""block_1_stride"": 1, ""block_2_dropout"": 0.023267156002171805, ""block_2_filters"": 128, ""block_2_kernel"": 5, ""block_2_stride"": 1, ""n_blocks"": 5}",COMPLETE
88,0.5232537834433164,2026-10-04 16:59:05.665861,2026-10-04 16:59:13.001635,0 days 00:00:07.335774,0.9378569306877448,0.9526519482825296,0.00011470412278705845,9.125369744033061e-05,64.0,0.04526441416770053,32,5,3,0.017599973148419584,64,3,1,0.038622807647219426,64,5,1,0.011195126417726,256.0,3.0,2.0,0.02840888349251569,256.0,3.0,1.0,256,0.1822075900669237,8.0,5,Adam,,,,,,,"{""block_0_dropout"": 0.04526441416770053, ""block_0_filters"": 32, ""block_0_kernel"": 5, ""block_1_dropout"": 0.017599973148419584, ""block_1_filters"": 64, ""block_1_kernel"": 3, ""block_1_stride"": 1, ""block_2_dropout"": 0.038622807647219426, ""block_2_filters"": 64, ""block_2_kernel"": 5, ""block_2_stride"": 1, ""n_blocks"": 5}",PRUNED
89,0.8460647721833638,2026-10-04 16:59:13.057962,2026-10-04 16:59:44.628560,0 days 00:00:31.570598,0.9124497402152372,0.9062564612884542,0.00036651917512890475,0.0005196974428839175,200.0,0.045897765374798324,32,5,3,0.011604270956151219,64,3,1,0.023542124277443836,128,5,1,0.013783731752316458,128.0,5.0,2.0,0.01155909683578664,256.0,3.0,1.0,256,0.437834204099645,16.0,5,Adam,,,,40.0,0.8629943502824858,0.8291351940842417,"{""block_0_dropout"": 0.045897765374798324, ""block_0_filters"": 32, ""block_0_kernel"": 5, ""block_1_dropout"": 0.011604270956151219, ""block_1_filters"": 64, ""block_1_kernel"": 3, ""block_1_stride"": 1, ""block_2_dropout"": 0.023542124277443836, ""block_2_filters"": 128, ""block_2_kernel"": 5, ""block_2_stride"": 1, ""n_blocks"": 5}",COMPLETE
