number,value,datetime_start,datetime_complete,duration,params_adam_beta1,params_adam_beta2,params_adam_lr,params_adam_wd,params_batch_size,params_block_0_dropout,params_block_0_filters,params_block_0_kernel,params_block_0_stride,params_block_1_dropout,params_block_1_filters,params_block_1_kernel,params_block_1_stride,params_block_2_dropout,params_block_2_filters,params_block_2_kernel,params_block_2_stride,params_block_3_dropout,params_block_3_filters,params_block_3_kernel,params_block_3_stride,params_block_4_dropout,params_block_4_filters,params_block_4_kernel,params_block_4_stride,params_fc_hidden,params_lr_factor,params_lr_patience,params_n_blocks,params_optimizer,params_sgd_lr,params_sgd_momentum,params_sgd_wd,user_attrs_best_epoch,user_attrs_validation_accuracy,user_attrs_validation_macro_f1,system_attrs_tpe:relative_params:0,state
64,0.4980352409378448,2026-10-02 15:17:25.812712,2026-10-02 15:17:34.713723,0 days 00:00:08.901011,,,,,128.0,0.02509921481933226,32,5,3,0.012652128673957899,64,3,2,0.031961036096824796,128,5,1,0.01282795244866997,256.0,3.0,2.0,,,,,512,0.2143548532815415,16.0,4,SGD,0.07390211190200323,0.8904531728849986,3.9343884606400324e-05,,,,"{""block_0_dropout"": 0.02509921481933226, ""block_0_filters"": 32, ""block_0_kernel"": 5, ""block_1_dropout"": 0.012652128673957899, ""block_1_filters"": 64, ""block_1_kernel"": 3, ""block_1_stride"": 2, ""block_2_dropout"": 0.031961036096824796, ""block_2_filters"": 128, ""block_2_kernel"": 5, ""block_2_stride"": 1, ""n_blocks"": 4}",PRUNED
65,0.8857159981936138,2026-10-02 15:17:34.768557,2026-10-02 15:18:15.781859,0 days 00:00:41.013302,,,,,200.0,0.019500958102551515,32,5,3,0.01418300306289263,64,3,2,0.02950213058142464,128,5,1,0.012893785618190939,256.0,3.0,2.0,,,,,512,0.14797876444040511,17.0,4,SGD,0.04668586615053681,0.9184799340345187,4.933068331999063e-05,50.0,0.9037247474747475,0.8677072489124801,"{""block_0_dropout"": 0.019500958102551515, ""block_0_filters"": 32, ""block_0_kernel"": 5, ""block_1_dropout"": 0.01418300306289263, ""block_1_filters"": 64, ""block_1_kernel"": 3, ""block_1_stride"": 2, ""block_2_dropout"": 0.02950213058142464, ""block_2_filters"": 128, ""block_2_kernel"": 5, ""block_2_stride"": 1, ""n_blocks"": 4}",COMPLETE
66,0.8925818788641893,2026-10-02 15:18:15.838402,2026-10-02 15:18:55.934030,0 days 00:00:40.095628,,,,,200.0,0.01653233734733625,32,5,3,0.010367689902352883,64,3,2,0.035278472338791604,128,5,1,0.010479658194896468,256.0,3.0,2.0,,,,,512,0.14247365726809505,17.0,4,SGD,0.05175765852475485,0.9257290277706356,2.2298829085237085e-05,47.0,0.9087752525252525,0.8763885052031261,"{""block_0_dropout"": 0.01653233734733625, ""block_0_filters"": 32, ""block_0_kernel"": 5, ""block_1_dropout"": 0.010367689902352883, ""block_1_filters"": 64, ""block_1_kernel"": 3, ""block_1_stride"": 2, ""block_2_dropout"": 0.035278472338791604, ""block_2_filters"": 128, ""block_2_kernel"": 5, ""block_2_stride"": 1, ""n_blocks"": 4}",COMPLETE
67,0.4827442791591977,2026-10-02 15:18:55.990199,2026-10-02 15:19:04.098798,0 days 00:00:08.108599,,,,,200.0,0.01941185847167185,32,5,3,0.016509980013656337,64,3,2,0.02774457151224058,128,5,1,0.011051614163953593,256.0,3.0,2.0,,,,,512,0.2439408459569252,17.0,4,SGD,0.05564429533312838,0.9249009155477053,1.982962623361067e-05,,,,"{""block_0_dropout"": 0.01941185847167185, ""block_0_filters"": 32, ""block_0_kernel"": 5, ""block_1_dropout"": 0.016509980013656337, ""block_1_filters"": 64, ""block_1_kernel"": 3, ""block_1_stride"": 2, ""block_2_dropout"": 0.02774457151224058, ""block_2_filters"": 128, ""block_2_kernel"": 5, ""block_2_stride"": 1, ""n_blocks"": 4}",PRUNED
68,0.42287492560897455,2026-10-02 15:19:04.151869,2026-10-02 15:19:12.377596,0 days 00:00:08.225727,,,,,200.0,0.0192204425390728,32,5,3,0.012221870382306503,64,3,2,0.03193316775680917,128,5,1,0.01640138517475731,256.0,3.0,2.0,,,,,512,0.2848856008730727,18.0,4,SGD,0.05308494462191563,0.9630972222356408,1.9301107098126256e-05,,,,"{""block_0_dropout"": 0.0192204425390728, ""block_0_filters"": 32, ""block_0_kernel"": 5, ""block_1_dropout"": 0.012221870382306503, ""block_1_filters"": 64, ""block_1_kernel"": 3, ""block_1_stride"": 2, ""block_2_dropout"": 0.03193316775680917, ""block_2_filters"": 128, ""block_2_kernel"": 5, ""block_2_stride"": 1, ""n_blocks"": 4}",PRUNED
69,0.8917679200183777,2026-10-02 15:19:12.431270,2026-10-02 15:19:53.853414,0 days 00:00:41.422144,,,,,200.0,0.019325811198223384,32,5,3,0.02049085037886809,64,3,2,0.025845278900681754,128,5,1,0.010016649127473973,256.0,3.0,2.0,,,,,512,0.19171524963503717,18.0,4,SGD,0.03858997088619064,0.904683744949516,8.437021661470551e-06,48.0,0.9106691919191919,0.8728666481175635,"{""block_0_dropout"": 0.019325811198223384, ""block_0_filters"": 32, ""block_0_kernel"": 5, ""block_1_dropout"": 0.02049085037886809, ""block_1_filters"": 64, ""block_1_kernel"": 3, ""block_1_stride"": 2, ""block_2_dropout"": 0.025845278900681754, ""block_2_filters"": 128, ""block_2_kernel"": 5, ""block_2_stride"": 1, ""n_blocks"": 4}",COMPLETE
70,0.8706737098418775,2026-10-02 15:19:53.905812,2026-10-02 15:20:33.977898,0 days 00:00:40.072086,,,,,200.0,0.014774589967559308,32,5,3,0.01969484126244757,64,3,2,0.020532289130521623,128,5,1,0.010175462469250551,256.0,3.0,2.0,,,,,512,0.13551028991608907,18.0,4,SGD,0.03883839721585119,0.9082400549207469,8.06335185450538e-06,40.0,0.8926767676767676,0.8486706520069875,"{""block_0_dropout"": 0.014774589967559308, ""block_0_filters"": 32, ""block_0_kernel"": 5, ""block_1_dropout"": 0.01969484126244757, ""block_1_filters"": 64, ""block_1_kernel"": 3, ""block_1_stride"": 2, ""block_2_dropout"": 0.020532289130521623, ""block_2_filters"": 128, ""block_2_kernel"": 5, ""block_2_stride"": 1, ""n_blocks"": 4}",COMPLETE
71,0.5117975930878589,2026-10-02 15:20:34.030306,2026-10-02 15:20:42.127947,0 days 00:00:08.097641,,,,,200.0,0.013885634335490409,32,5,3,0.014538991981148426,64,3,2,0.025824136373857297,128,5,1,0.01357953453163482,256.0,3.0,2.0,,,,,512,0.19131746037838276,19.0,4,SGD,0.061669374547671026,0.9259101536707574,2.8187150305959556e-05,,,,"{""block_0_dropout"": 0.013885634335490409, ""block_0_filters"": 32, ""block_0_kernel"": 5, ""block_1_dropout"": 0.014538991981148426, ""block_1_filters"": 64, ""block_1_kernel"": 3, ""block_1_stride"": 2, ""block_2_dropout"": 0.025824136373857297, ""block_2_filters"": 128, ""block_2_kernel"": 5, ""block_2_stride"": 1, ""n_blocks"": 4}",PRUNED
72,0.8855216903978446,2026-10-02 15:20:42.182764,2026-10-02 15:21:22.417651,0 days 00:00:40.234887,,,,,200.0,0.014224106896960487,32,5,3,0.010168960351288517,64,3,2,0.03537540462923254,128,5,1,0.01595423691115518,256.0,3.0,2.0,,,,,512,0.20533261129440422,15.0,4,SGD,0.036774990623050896,0.9056230538398637,5.943274082159238e-05,50.0,0.9068813131313131,0.864162067664376,"{""block_0_dropout"": 0.014224106896960487, ""block_0_filters"": 32, ""block_0_kernel"": 5, ""block_1_dropout"": 0.010168960351288517, ""block_1_filters"": 64, ""block_1_kernel"": 3, ""block_1_stride"": 2, ""block_2_dropout"": 0.03537540462923254, ""block_2_filters"": 128, ""block_2_kernel"": 5, ""block_2_stride"": 1, ""n_blocks"": 4}",COMPLETE
73,0.8946595206512764,2026-10-02 15:21:22.475598,2026-10-02 15:22:02.937715,0 days 00:00:40.462117,,,,,200.0,0.01019308669159256,32,5,3,0.01564984739876563,64,3,2,0.03166044194742722,128,5,1,0.011753753862069309,256.0,3.0,2.0,,,,,512,0.2277586627928968,15.0,4,SGD,0.03544230712931937,0.9031551237047736,6.171628647453217e-05,50.0,0.9138257575757576,0.8754932837267954,"{""block_0_dropout"": 0.01019308669159256, ""block_0_filters"": 32, ""block_0_kernel"": 5, ""block_1_dropout"": 0.01564984739876563, ""block_1_filters"": 64, ""block_1_kernel"": 3, ""block_1_stride"": 2, ""block_2_dropout"": 0.03166044194742722, ""block_2_filters"": 128, ""block_2_kernel"": 5, ""block_2_stride"": 1, ""n_blocks"": 4}",COMPLETE
74,0.8785744320720843,2026-10-02 15:22:02.995157,2026-10-02 15:22:43.307925,0 days 00:00:40.312768,,,,,200.0,0.013906354291311618,32,5,3,0.012226763675022597,64,3,2,0.029838628047781257,128,5,1,0.011722548964347773,256.0,3.0,2.0,,,,,512,0.327476952876806,15.0,4,SGD,0.03899149546388861,0.9028462505574866,6.898588663358967e-05,46.0,0.8986742424242424,0.8584746217199262,"{""block_0_dropout"": 0.013906354291311618, ""block_0_filters"": 32, ""block_0_kernel"": 5, ""block_1_dropout"": 0.012226763675022597, ""block_1_filters"": 64, ""block_1_kernel"": 3, ""block_1_stride"": 2, ""block_2_dropout"": 0.029838628047781257, ""block_2_filters"": 128, ""block_2_kernel"": 5, ""block_2_stride"": 1, ""n_blocks"": 4}",COMPLETE
75,0.5310618697758167,2026-10-02 15:22:43.365076,2026-10-02 15:22:51.461254,0 days 00:00:08.096178,,,,,200.0,0.017496897612317017,32,5,3,0.010966653123115419,64,3,2,0.03485560592677508,128,5,1,0.014137980413150564,256.0,3.0,2.0,,,,,512,0.22997273862570816,16.0,4,SGD,0.06645571668081456,0.9205488675518374,1.0553098913856644e-05,,,,"{""block_0_dropout"": 0.017496897612317017, ""block_0_filters"": 32, ""block_0_kernel"": 5, ""block_1_dropout"": 0.010966653123115419, ""block_1_filters"": 64, ""block_1_kernel"": 3, ""block_1_stride"": 2, ""block_2_dropout"": 0.03485560592677508, ""block_2_filters"": 128, ""block_2_kernel"": 5, ""block_2_stride"": 1, ""n_blocks"": 4}",PRUNED
76,0.8909623859251876,2026-10-02 15:22:51.516487,2026-10-02 15:23:32.776223,0 days 00:00:41.259736,,,,,200.0,0.013368093288643086,32,5,3,0.01591006640197818,64,3,2,0.037745177953561235,128,5,1,0.015283981800984829,256.0,3.0,2.0,,,,,512,0.2689543814890939,14.0,4,SGD,0.033710788027381144,0.9038841453207923,4.034551130818847e-06,48.0,0.9056186868686869,0.8763060849816885,"{""block_0_dropout"": 0.013368093288643086, ""block_0_filters"": 32, ""block_0_kernel"": 5, ""block_1_dropout"": 0.01591006640197818, ""block_1_filters"": 64, ""block_1_kernel"": 3, ""block_1_stride"": 2, ""block_2_dropout"": 0.037745177953561235, ""block_2_filters"": 128, ""block_2_kernel"": 5, ""block_2_stride"": 1, ""n_blocks"": 4}",COMPLETE
77,0.38139034593137455,2026-10-02 15:23:32.831694,2026-10-02 15:23:42.587786,0 days 00:00:09.756092,,,,,200.0,0.010866704905200747,32,5,3,0.015647628796375396,64,3,2,0.041756363849640786,128,5,1,0.010015939051404084,256.0,3.0,1.0,,,,,512,0.278548553708836,14.0,4,SGD,0.08790604973915263,0.8913776215692866,4.025916304311842e-06,,,,"{""block_0_dropout"": 0.010866704905200747, ""block_0_filters"": 32, ""block_0_kernel"": 5, ""block_1_dropout"": 0.015647628796375396, ""block_1_filters"": 64, ""block_1_kernel"": 3, ""block_1_stride"": 2, ""block_2_dropout"": 0.041756363849640786, ""block_2_filters"": 128, ""block_2_kernel"": 5, ""block_2_stride"": 1, ""n_blocks"": 4}",PRUNED
78,0.41077910702402387,2026-10-02 15:23:42.641087,2026-10-02 15:23:50.714082,0 days 00:00:08.072995,,,,,200.0,0.010251967666534958,32,5,3,0.018136032119994892,64,3,2,0.030954498815163378,128,5,1,0.011949932608437675,256.0,3.0,2.0,,,,,512,0.36189293165495773,19.0,4,SGD,0.03267473271267627,0.962920556269143,2.9221918289866707e-06,,,,"{""block_0_dropout"": 0.010251967666534958, ""block_0_filters"": 32, ""block_0_kernel"": 5, ""block_1_dropout"": 0.018136032119994892, ""block_1_filters"": 64, ""block_1_kernel"": 3, ""block_1_stride"": 2, ""block_2_dropout"": 0.030954498815163378, ""block_2_filters"": 128, ""block_2_kernel"": 5, ""block_2_stride"": 1, ""n_blocks"": 4}",PRUNED
79,0.884999376668239,2026-10-02 15:23:50.772208,2026-10-02 15:24:32.564765,0 days 00:00:41.792557,,,,,200.0,0.014064802858148307,32,5,3,0.01625752349757913,64,3,2,0.031376103152640236,128,5,1,0.01508347143676393,256.0,3.0,2.0,,,,,512,0.2684657382529992,14.0,4,SGD,0.04762832142846657,0.8817751705679786,1.4300725766534123e-05,48.0,0.9040404040404041,0.865958349296074,"{""block_0_dropout"": 0.014064802858148307, ""block_0_filters"": 32, ""block_0_kernel"": 5, ""block_1_dropout"": 0.01625752349757913, ""block_1_filters"": 64, ""block_1_kernel"": 3, ""block_1_stride"": 2, ""block_2_dropout"": 0.031376103152640236, ""block_2_filters"": 128, ""block_2_kernel"": 5, ""block_2_stride"": 1, ""n_blocks"": 4}",COMPLETE
80,0.29924664853920335,2026-10-02 15:24:32.618070,2026-10-02 15:24:40.589145,0 days 00:00:07.971075,,,,,200.0,0.025247479016729496,32,5,3,0.016800763889353976,64,3,2,0.027402177660693916,128,5,1,0.013608874541853421,256.0,3.0,2.0,,,,,512,0.1360467224177266,17.0,4,SGD,0.00048138558200833055,0.8673311562290482,2.3552098883936105e-05,,,,"{""block_0_dropout"": 0.025247479016729496, ""block_0_filters"": 32, ""block_0_kernel"": 5, ""block_1_dropout"": 0.016800763889353976, ""block_1_filters"": 64, ""block_1_kernel"": 3, ""block_1_stride"": 2, ""block_2_dropout"": 0.027402177660693916, ""block_2_filters"": 128, ""block_2_kernel"": 5, ""block_2_stride"": 1, ""n_blocks"": 4}",PRUNED
81,,2026-10-02 15:24:40.643122,2026-10-02 15:24:40.657612,0 days 00:00:00.014490,,,,,,0.01467944630374112,32,5,3,0.013774049670772425,64,7,2,0.03914333397985849,128,5,1,0.015588841923035154,256.0,3.0,2.0,,,,,,,,4,,,,,,,,"{""block_0_dropout"": 0.01467944630374112, ""block_0_filters"": 32, ""block_0_kernel"": 5, ""block_1_dropout"": 0.013774049670772425, ""block_1_filters"": 64, ""block_1_kernel"": 7, ""block_1_stride"": 2, ""block_2_dropout"": 0.03914333397985849, ""block_2_filters"": 128, ""block_2_kernel"": 5, ""block_2_stride"": 1, ""n_blocks"": 4}",PRUNED
82,0.8878088120482572,2026-10-02 15:24:40.708357,2026-10-02 15:25:21.990274,0 days 00:00:41.281917,,,,,200.0,0.015610185524266011,32,5,3,0.020991976246520393,64,3,2,0.03536204455422056,128,5,1,0.0115410653282079,256.0,3.0,2.0,,,,,512,0.2044351010474012,15.0,4,SGD,0.0331789358695239,0.9013225007112335,5.0591591755794225e-05,46.0,0.9087752525252525,0.8668423715712619,"{""block_0_dropout"": 0.015610185524266011, ""block_0_filters"": 32, ""block_0_kernel"": 5, ""block_1_dropout"": 0.020991976246520393, ""block_1_filters"": 64, ""block_1_kernel"": 3, ""block_1_stride"": 2, ""block_2_dropout"": 0.03536204455422056, ""block_2_filters"": 128, ""block_2_kernel"": 5, ""block_2_stride"": 1, ""n_blocks"": 4}",COMPLETE
83,0.8946876418140721,2026-10-02 15:25:22.049112,2026-10-02 15:26:03.769613,0 days 00:00:41.720501,,,,,200.0,0.01591139952048087,32,5,3,0.023401866439002758,64,3,2,0.03365912430383117,128,5,1,0.011384072200132635,256.0,3.0,2.0,,,,,512,0.19702027371749437,16.0,4,SGD,0.030861945940535252,0.9000131424581386,5.716315876274858e-05,50.0,0.9097222222222222,0.8796530614059221,"{""block_0_dropout"": 0.01591139952048087, ""block_0_filters"": 32, ""block_0_kernel"": 5, ""block_1_dropout"": 0.023401866439002758, ""block_1_filters"": 64, ""block_1_kernel"": 3, ""block_1_stride"": 2, ""block_2_dropout"": 0.03365912430383117, ""block_2_filters"": 128, ""block_2_kernel"": 5, ""block_2_stride"": 1, ""n_blocks"": 4}",COMPLETE
84,0.8853310270262427,2026-10-02 15:26:03.827784,2026-10-02 15:26:47.419719,0 days 00:00:43.591935,,,,,200.0,0.011575612758987677,32,5,3,0.017190816287410985,64,3,2,0.037259189699011035,128,5,1,0.011353243610113925,256.0,3.0,2.0,,,,,512,0.3248697299332643,16.0,4,SGD,0.027493847764912625,0.89954037738922,2.173154897877825e-06,47.0,0.9030934343434344,0.867568619709051,"{""block_0_dropout"": 0.011575612758987677, ""block_0_filters"": 32, ""block_0_kernel"": 5, ""block_1_dropout"": 0.017190816287410985, ""block_1_filters"": 64, ""block_1_kernel"": 3, ""block_1_stride"": 2, ""block_2_dropout"": 0.037259189699011035, ""block_2_filters"": 128, ""block_2_kernel"": 5, ""block_2_stride"": 1, ""n_blocks"": 4}",COMPLETE
85,0.8687893510716884,2026-10-02 15:26:47.473085,2026-10-02 15:27:27.862632,0 days 00:00:40.389547,,,,,200.0,0.014681347240024683,32,5,3,0.013842543120928924,64,3,2,0.03371522329491574,128,5,1,0.011337378907122126,256.0,3.0,2.0,,,,,512,0.23069736808453056,15.0,4,SGD,0.011797790379427306,0.8957067377551029,0.00018376629049718048,32.0,0.8933080808080808,0.8442706213352961,"{""block_0_dropout"": 0.014681347240024683, ""block_0_filters"": 32, ""block_0_kernel"": 5, ""block_1_dropout"": 0.013842543120928924, ""block_1_filters"": 64, ""block_1_kernel"": 3, ""block_1_stride"": 2, ""block_2_dropout"": 0.03371522329491574, ""block_2_filters"": 128, ""block_2_kernel"": 5, ""block_2_stride"": 1, ""n_blocks"": 4}",COMPLETE
86,0.49116772957624927,2026-10-02 15:27:27.919441,2026-10-02 15:27:36.179732,0 days 00:00:08.260291,,,,,200.0,0.017928920373432296,32,5,3,0.023667996850835666,64,3,2,0.03660569896816986,128,5,1,0.010076310945665835,256.0,3.0,2.0,,,,,256,0.25786063613370735,16.0,4,SGD,0.07463026910922747,0.8749994322768193,6.953592538451244e-05,,,,"{""block_0_dropout"": 0.017928920373432296, ""block_0_filters"": 32, ""block_0_kernel"": 5, ""block_1_dropout"": 0.023667996850835666, ""block_1_filters"": 64, ""block_1_kernel"": 3, ""block_1_stride"": 2, ""block_2_dropout"": 0.03660569896816986, ""block_2_filters"": 128, ""block_2_kernel"": 5, ""block_2_stride"": 1, ""n_blocks"": 4}",PRUNED
87,0.8783888419549103,2026-10-02 15:27:36.232777,2026-10-02 15:28:16.881272,0 days 00:00:40.648495,,,,,200.0,0.018626486188840472,32,5,3,0.02281105852580051,64,3,2,0.03313071973995817,128,5,1,0.0198925524679221,256.0,3.0,2.0,,,,,512,0.20066988453862222,15.0,4,SGD,0.022350426082517,0.8670743467402481,6.941810051469634e-06,38.0,0.9008838383838383,0.8558938455259822,"{""block_0_dropout"": 0.018626486188840472, ""block_0_filters"": 32, ""block_0_kernel"": 5, ""block_1_dropout"": 0.02281105852580051, ""block_1_filters"": 64, ""block_1_kernel"": 3, ""block_1_stride"": 2, ""block_2_dropout"": 0.03313071973995817, ""block_2_filters"": 128, ""block_2_kernel"": 5, ""block_2_stride"": 1, ""n_blocks"": 4}",COMPLETE
88,0.6285751642456869,2026-10-02 15:28:16.934785,2026-10-02 15:28:27.051209,0 days 00:00:10.116424,,,,,200.0,0.019704292526270536,32,5,3,0.02152280383715944,64,3,2,0.02527096340904979,128,5,1,0.012542808200435327,256.0,3.0,2.0,,,,,512,0.19224264036974942,14.0,4,SGD,0.032121729779097774,0.9298425324496358,3.147859809495549e-05,,,,"{""block_0_dropout"": 0.019704292526270536, ""block_0_filters"": 32, ""block_0_kernel"": 5, ""block_1_dropout"": 0.02152280383715944, ""block_1_filters"": 64, ""block_1_kernel"": 3, ""block_1_stride"": 2, ""block_2_dropout"": 0.02527096340904979, ""block_2_filters"": 128, ""block_2_kernel"": 5, ""block_2_stride"": 1, ""n_blocks"": 4}",PRUNED
89,0.3920026874997945,2026-10-02 15:28:27.109967,2026-10-02 15:28:36.213810,0 days 00:00:09.103843,,,,,200.0,0.0240362900861463,32,5,3,0.010789514777203975,64,3,2,0.03888541241468384,128,5,1,0.01395809917642918,256.0,3.0,1.0,,,,,512,0.2324173573736165,18.0,4,SGD,0.06342404446746683,0.9116625136119175,1.3114636178551508e-05,,,,"{""block_0_dropout"": 0.0240362900861463, ""block_0_filters"": 32, ""block_0_kernel"": 5, ""block_1_dropout"": 0.010789514777203975, ""block_1_filters"": 64, ""block_1_kernel"": 3, ""block_1_stride"": 2, ""block_2_dropout"": 0.03888541241468384, ""block_2_filters"": 128, ""block_2_kernel"": 5, ""block_2_stride"": 1, ""n_blocks"": 4}",PRUNED
90,0.8753899297075871,2026-10-02 15:28:36.272686,2026-10-02 15:29:17.696900,0 days 00:00:41.424214,,,,,200.0,0.016064989077554388,32,5,3,0.020509523429238216,64,3,2,0.038714121484817,128,5,1,0.017026430543515964,256.0,3.0,2.0,,,,,512,0.13468824086729392,16.0,4,SGD,0.03226394306131149,0.8877112877373485,8.801769256167916e-05,37.0,0.8974116161616161,0.8533682432535582,"{""block_0_dropout"": 0.016064989077554388, ""block_0_filters"": 32, ""block_0_kernel"": 5, ""block_1_dropout"": 0.020509523429238216, ""block_1_filters"": 64, ""block_1_kernel"": 3, ""block_1_stride"": 2, ""block_2_dropout"": 0.038714121484817, ""block_2_filters"": 128, ""block_2_kernel"": 5, ""block_2_stride"": 1, ""n_blocks"": 4}",COMPLETE
91,0.6555450036024966,2026-10-02 15:29:17.749542,2026-10-02 15:29:28.224881,0 days 00:00:10.475339,,,,,200.0,0.01556998071155748,32,5,3,0.0171916438236666,64,3,2,0.03579163106825374,128,5,1,0.012949695323552874,256.0,3.0,2.0,,,,,512,0.14705950831750786,17.0,4,SGD,0.04478161495645043,0.9150911345972345,4.989628043496678e-05,,,,"{""block_0_dropout"": 0.01556998071155748, ""block_0_filters"": 32, ""block_0_kernel"": 5, ""block_1_dropout"": 0.0171916438236666, ""block_1_filters"": 64, ""block_1_kernel"": 3, ""block_1_stride"": 2, ""block_2_dropout"": 0.03579163106825374, ""block_2_filters"": 128, ""block_2_kernel"": 5, ""block_2_stride"": 1, ""n_blocks"": 4}",PRUNED
92,0.5274772574037738,2026-10-02 15:29:28.281818,2026-10-02 15:29:36.253091,0 days 00:00:07.971273,,,,,200.0,0.02351673634369434,32,5,3,0.010150859728254653,16,3,2,0.035757184397576885,128,5,1,0.011167237736045176,256.0,3.0,2.0,,,,,512,0.18358800226316752,17.0,4,SGD,0.04427165524580206,0.9033187282902478,3.9343028673367906e-05,,,,"{""block_0_dropout"": 0.02351673634369434, ""block_0_filters"": 32, ""block_0_kernel"": 5, ""block_1_dropout"": 0.010150859728254653, ""block_1_filters"": 16, ""block_1_kernel"": 3, ""block_1_stride"": 2, ""block_2_dropout"": 0.035757184397576885, ""block_2_filters"": 128, ""block_2_kernel"": 5, ""block_2_stride"": 1, ""n_blocks"": 4}",PRUNED
93,0.5890213114856346,2026-10-02 15:29:36.311535,2026-10-02 15:29:46.326177,0 days 00:00:10.014642,,,,,200.0,0.013221496654894218,32,5,3,0.01881677409184376,64,3,2,0.0331001834710924,128,5,1,0.014681055937420261,256.0,3.0,2.0,,,,,512,0.2024386776233785,15.0,4,SGD,0.022767635210486338,0.9553308010128899,0.00014891250977847278,,,,"{""block_0_dropout"": 0.013221496654894218, ""block_0_filters"": 32, ""block_0_kernel"": 5, ""block_1_dropout"": 0.01881677409184376, ""block_1_filters"": 64, ""block_1_kernel"": 3, ""block_1_stride"": 2, ""block_2_dropout"": 0.0331001834710924, ""block_2_filters"": 128, ""block_2_kernel"": 5, ""block_2_stride"": 1, ""n_blocks"": 4}",PRUNED
