number,value,datetime_start,datetime_complete,duration,params_adam_beta1,params_adam_beta2,params_adam_lr,params_adam_wd,params_batch_size,params_block_0_dropout,params_block_0_filters,params_block_0_kernel,params_block_0_stride,params_block_1_dropout,params_block_1_filters,params_block_1_kernel,params_block_1_stride,params_block_2_dropout,params_block_2_filters,params_block_2_kernel,params_block_2_stride,params_block_3_dropout,params_block_3_filters,params_block_3_kernel,params_block_3_stride,params_block_4_dropout,params_block_4_filters,params_block_4_kernel,params_block_4_stride,params_fc_hidden,params_lr_factor,params_lr_patience,params_n_blocks,params_optimizer,params_sgd_lr,params_sgd_momentum,params_sgd_wd,user_attrs_best_epoch,user_attrs_validation_accuracy,user_attrs_validation_macro_f1,system_attrs_tpe:relative_params:0,state
94,0.4786567763646279,2026-10-02 15:29:46.381509,2026-10-02 15:29:54.496226,0 days 00:00:08.114717,,,,,200.0,0.012693587435332353,32,5,3,0.02138298103904704,64,3,2,0.039937646153751165,128,5,1,0.012300809701397429,256.0,3.0,2.0,,,,,512,0.17221082630800652,16.0,4,SGD,0.056303158962573784,0.9321494581923996,2.6963571540309006e-05,,,,"{""block_0_dropout"": 0.012693587435332353, ""block_0_filters"": 32, ""block_0_kernel"": 5, ""block_1_dropout"": 0.02138298103904704, ""block_1_filters"": 64, ""block_1_kernel"": 3, ""block_1_stride"": 2, ""block_2_dropout"": 0.039937646153751165, ""block_2_filters"": 128, ""block_2_kernel"": 5, ""block_2_stride"": 1, ""n_blocks"": 4}",PRUNED
95,0.886167690066204,2026-10-02 15:29:54.551695,2026-10-02 15:30:41.192597,0 days 00:00:46.640902,,,,,200.0,0.010900924288784147,32,5,3,0.013193037453860024,64,3,2,0.03531543090668354,128,5,1,0.017159193638058384,256.0,3.0,2.0,,,,,512,0.1311590118532088,18.0,4,SGD,0.0323879171603324,0.9194145823002895,6.814516384828052e-05,50.0,0.9065656565656566,0.8657697235667514,"{""block_0_dropout"": 0.010900924288784147, ""block_0_filters"": 32, ""block_0_kernel"": 5, ""block_1_dropout"": 0.013193037453860024, ""block_1_filters"": 64, ""block_1_kernel"": 3, ""block_1_stride"": 2, ""block_2_dropout"": 0.03531543090668354, ""block_2_filters"": 128, ""block_2_kernel"": 5, ""block_2_stride"": 1, ""n_blocks"": 4}",COMPLETE
96,0.8768358598979289,2026-10-02 15:30:41.249138,2026-10-02 15:31:23.516875,0 days 00:00:42.267737,,,,,200.0,0.011360273663981893,32,5,3,0.015208781791414949,64,3,2,0.0347402296671164,128,5,1,0.0216498532534243,256.0,3.0,2.0,,,,,256,0.10026128944384463,18.0,4,SGD,0.03074583333529654,0.8997069324353935,7.498981075782571e-05,46.0,0.9002525252525253,0.8534191945433326,"{""block_0_dropout"": 0.011360273663981893, ""block_0_filters"": 32, ""block_0_kernel"": 5, ""block_1_dropout"": 0.015208781791414949, ""block_1_filters"": 64, ""block_1_kernel"": 3, ""block_1_stride"": 2, ""block_2_dropout"": 0.0347402296671164, ""block_2_filters"": 128, ""block_2_kernel"": 5, ""block_2_stride"": 1, ""n_blocks"": 4}",COMPLETE
97,0.8780580870334462,2026-10-02 15:31:23.576739,2026-10-02 15:32:06.056929,0 days 00:00:42.480190,,,,,200.0,0.016373146089448735,32,5,3,0.01958726948681077,64,3,2,0.030002803512090913,128,5,1,0.01685991673229837,256.0,3.0,2.0,,,,,512,0.12476608204630406,12.0,4,SGD,0.02375906846018239,0.866951738696384,1.708375453078867e-05,49.0,0.8996212121212122,0.8564949619456804,"{""block_0_dropout"": 0.016373146089448735, ""block_0_filters"": 32, ""block_0_kernel"": 5, ""block_1_dropout"": 0.01958726948681077, ""block_1_filters"": 64, ""block_1_kernel"": 3, ""block_1_stride"": 2, ""block_2_dropout"": 0.030002803512090913, ""block_2_filters"": 128, ""block_2_kernel"": 5, ""block_2_stride"": 1, ""n_blocks"": 4}",COMPLETE
98,0.510942353179181,2026-10-02 15:32:06.124148,2026-10-02 15:32:15.273993,0 days 00:00:09.149845,,,,,200.0,0.016432824924536536,32,5,3,0.022455117597832128,64,3,2,0.027804583633031222,128,5,1,0.020300065702090038,256.0,3.0,2.0,,,,,512,0.2424330940823219,19.0,4,SGD,0.03682985436187341,0.9439305856692298,3.610906802695768e-05,,,,"{""block_0_dropout"": 0.016432824924536536, ""block_0_filters"": 32, ""block_0_kernel"": 5, ""block_1_dropout"": 0.022455117597832128, ""block_1_filters"": 64, ""block_1_kernel"": 3, ""block_1_stride"": 2, ""block_2_dropout"": 0.027804583633031222, ""block_2_filters"": 128, ""block_2_kernel"": 5, ""block_2_stride"": 1, ""n_blocks"": 4}",PRUNED
99,0.48682355134977473,2026-10-02 15:32:15.327432,2026-10-02 15:32:23.894773,0 days 00:00:08.567341,,,,,200.0,0.010093026524854973,32,5,3,0.022054706772866434,64,3,2,0.03242059684852801,128,5,1,0.01522983304034792,256.0,3.0,2.0,,,,,512,0.2634850019636301,20.0,4,SGD,0.09416195983715156,0.8854620816553176,5.444705319730616e-05,,,,"{""block_0_dropout"": 0.010093026524854973, ""block_0_filters"": 32, ""block_0_kernel"": 5, ""block_1_dropout"": 0.022054706772866434, ""block_1_filters"": 64, ""block_1_kernel"": 3, ""block_1_stride"": 2, ""block_2_dropout"": 0.03242059684852801, ""block_2_filters"": 128, ""block_2_kernel"": 5, ""block_2_stride"": 1, ""n_blocks"": 4}",PRUNED
