number,value,datetime_start,datetime_complete,duration,params_adam_beta1,params_adam_beta2,params_adam_lr,params_adam_wd,params_batch_size,params_block_0_dropout,params_block_0_filters,params_block_0_kernel,params_block_0_stride,params_block_1_dropout,params_block_1_filters,params_block_1_kernel,params_block_1_stride,params_block_2_dropout,params_block_2_filters,params_block_2_kernel,params_block_2_stride,params_block_3_dropout,params_block_3_filters,params_block_3_kernel,params_block_3_stride,params_block_4_dropout,params_block_4_filters,params_block_4_kernel,params_block_4_stride,params_fc_hidden,params_lr_factor,params_lr_patience,params_n_blocks,params_optimizer,params_sgd_lr,params_sgd_momentum,params_sgd_wd,user_attrs_best_epoch,user_attrs_validation_accuracy,user_attrs_validation_macro_f1,system_attrs_tpe:relative_params:0,state
34,0.8290881071739754,2026-10-02 14:58:24.705744,2026-10-02 14:59:42.454161,0 days 00:01:17.748417,0.8860370004502637,0.9275888163347472,0.0006074517711872113,0.0007088880979182384,64.0,0.026568216341786084,32,5,3,0.010516749319434325,64,5,1,0.022681489122113117,128,5,1,0.031703124477083296,64.0,5.0,2.0,,,,,128,0.8465254509711516,6.0,4,Adam,,,,50.0,0.8456439393939394,0.8125322749540114,"{""block_0_dropout"": 0.026568216341786084, ""block_0_filters"": 32, ""block_0_kernel"": 5, ""block_1_dropout"": 0.010516749319434325, ""block_1_filters"": 64, ""block_1_kernel"": 5, ""block_1_stride"": 1, ""block_2_dropout"": 0.022681489122113117, ""block_2_filters"": 128, ""block_2_kernel"": 5, ""block_2_stride"": 1, ""n_blocks"": 4}",COMPLETE
35,0.8335996846832836,2026-10-02 14:59:42.512206,2026-10-02 15:00:57.164485,0 days 00:01:14.652279,0.866404974621365,0.9121219237873152,0.00018894837492844778,0.00624095981111752,64.0,0.04241734141383044,32,5,3,0.01766601382736512,64,3,1,0.035810413035722376,128,5,1,0.035708527143340205,64.0,5.0,2.0,,,,,256,0.6548220181288241,8.0,4,Adam,,,,50.0,0.8544823232323232,0.8127170461342439,"{""block_0_dropout"": 0.04241734141383044, ""block_0_filters"": 32, ""block_0_kernel"": 5, ""block_1_dropout"": 0.01766601382736512, ""block_1_filters"": 64, ""block_1_kernel"": 3, ""block_1_stride"": 1, ""block_2_dropout"": 0.035810413035722376, ""block_2_filters"": 128, ""block_2_kernel"": 5, ""block_2_stride"": 1, ""n_blocks"": 4}",COMPLETE
36,0.07217203175583697,2026-10-02 15:00:57.215926,2026-10-02 15:01:12.920986,0 days 00:00:15.705060,,,,,64.0,0.03888577021890633,32,5,3,0.02808703697281429,64,3,1,0.028456215111024325,128,5,1,0.03738396343605356,128.0,5.0,2.0,0.01569362368315918,256.0,3.0,1.0,128,0.5301010005377076,5.0,5,SGD,0.09134027952768675,0.9884250537821042,1.058267614021419e-05,,,,"{""block_0_dropout"": 0.03888577021890633, ""block_0_filters"": 32, ""block_0_kernel"": 5, ""block_1_dropout"": 0.02808703697281429, ""block_1_filters"": 64, ""block_1_kernel"": 3, ""block_1_stride"": 1, ""block_2_dropout"": 0.028456215111024325, ""block_2_filters"": 128, ""block_2_kernel"": 5, ""block_2_stride"": 1, ""n_blocks"": 5}",PRUNED
37,0.3605704179932797,2026-10-02 15:01:12.976674,2026-10-02 15:01:35.954277,0 days 00:00:22.977603,0.8503455969960834,0.944678064200285,0.00010288353837752335,6.288176311321179e-05,64.0,0.030509291515913247,32,5,3,0.014969602438908786,64,3,1,0.01378362090492721,128,5,1,0.02695352081950878,256.0,3.0,1.0,,,,,128,0.836138093271934,7.0,4,Adam,,,,,,,"{""block_0_dropout"": 0.030509291515913247, ""block_0_filters"": 32, ""block_0_kernel"": 5, ""block_1_dropout"": 0.014969602438908786, ""block_1_filters"": 64, ""block_1_kernel"": 3, ""block_1_stride"": 1, ""block_2_dropout"": 0.01378362090492721, ""block_2_filters"": 128, ""block_2_kernel"": 5, ""block_2_stride"": 1, ""n_blocks"": 4}",PRUNED
38,0.8806010949921395,2026-10-02 15:01:36.016468,2026-10-02 15:02:19.009053,0 days 00:00:42.992585,,,,,128.0,0.02345206554306953,32,5,3,0.013349103254472455,64,3,2,0.03325773056130078,128,5,1,0.030356582502954917,64.0,5.0,2.0,,,,,512,0.10483929065879416,10.0,4,SGD,0.007002618878883694,0.8779115521891643,0.0003893235720840619,48.0,0.9011994949494949,0.860002695034784,"{""block_0_dropout"": 0.02345206554306953, ""block_0_filters"": 32, ""block_0_kernel"": 5, ""block_1_dropout"": 0.013349103254472455, ""block_1_filters"": 64, ""block_1_kernel"": 3, ""block_1_stride"": 2, ""block_2_dropout"": 0.03325773056130078, ""block_2_filters"": 128, ""block_2_kernel"": 5, ""block_2_stride"": 1, ""n_blocks"": 4}",COMPLETE
39,0.8323639356949355,2026-10-02 15:02:19.063301,2026-10-02 15:03:24.603911,0 days 00:01:05.540610,0.8677310608746336,0.9110155632351179,0.00032588436148161696,0.0026526226784381124,128.0,0.026974539517586476,32,5,3,0.01989344394195551,64,3,1,0.016411765654794064,128,5,1,0.03003442991825033,64.0,5.0,2.0,,,,,512,0.3073805333392501,12.0,4,Adam,,,,45.0,0.8516414141414141,0.8130864572484567,"{""block_0_dropout"": 0.026974539517586476, ""block_0_filters"": 32, ""block_0_kernel"": 5, ""block_1_dropout"": 0.01989344394195551, ""block_1_filters"": 64, ""block_1_kernel"": 3, ""block_1_stride"": 1, ""block_2_dropout"": 0.016411765654794064, ""block_2_filters"": 128, ""block_2_kernel"": 5, ""block_2_stride"": 1, ""n_blocks"": 4}",COMPLETE
40,0.3227630377790667,2026-10-02 15:03:24.655670,2026-10-02 15:03:52.794222,0 days 00:00:28.138552,,,,,128.0,0.027691686123148953,32,7,3,0.01885664018584061,64,3,1,0.011914156850184815,128,5,1,0.021591199887675133,128.0,3.0,1.0,0.029655740394170186,512.0,3.0,1.0,512,0.2550311916704454,10.0,5,SGD,0.0009835308282936197,0.878393163778588,0.0007277974952025188,,,,"{""block_0_dropout"": 0.027691686123148953, ""block_0_filters"": 32, ""block_0_kernel"": 7, ""block_1_dropout"": 0.01885664018584061, ""block_1_filters"": 64, ""block_1_kernel"": 3, ""block_1_stride"": 1, ""block_2_dropout"": 0.011914156850184815, ""block_2_filters"": 128, ""block_2_kernel"": 5, ""block_2_stride"": 1, ""n_blocks"": 5}",PRUNED
41,0.8651384393909557,2026-10-02 15:03:52.867921,2026-10-02 15:04:35.318732,0 days 00:00:42.450811,,,,,128.0,0.01819978008460929,32,5,3,0.010468807067246292,64,3,2,0.02696521683385485,64,5,1,0.03425784341729051,64.0,5.0,2.0,,,,,512,0.3869033674506749,6.0,4,SGD,0.013180642564594136,0.7535413880140427,5.387719676957363e-06,48.0,0.8892045454545454,0.841072333327366,"{""block_0_dropout"": 0.01819978008460929, ""block_0_filters"": 32, ""block_0_kernel"": 5, ""block_1_dropout"": 0.010468807067246292, ""block_1_filters"": 64, ""block_1_kernel"": 3, ""block_1_stride"": 2, ""block_2_dropout"": 0.02696521683385485, ""block_2_filters"": 64, ""block_2_kernel"": 5, ""block_2_stride"": 1, ""n_blocks"": 4}",COMPLETE
42,0.8747101128298806,2026-10-02 15:04:35.382761,2026-10-02 15:05:23.922795,0 days 00:00:48.540034,,,,,128.0,0.023338915712718716,32,5,3,0.014500194059790188,64,3,2,0.038880671090021926,128,5,1,0.03321399419306752,64.0,5.0,2.0,,,,,512,0.11653658789145643,6.0,4,SGD,0.009628688988849854,0.8451682868317869,0.00010186729730150577,39.0,0.898989898989899,0.8504303266698623,"{""block_0_dropout"": 0.023338915712718716, ""block_0_filters"": 32, ""block_0_kernel"": 5, ""block_1_dropout"": 0.014500194059790188, ""block_1_filters"": 64, ""block_1_kernel"": 3, ""block_1_stride"": 2, ""block_2_dropout"": 0.038880671090021926, ""block_2_filters"": 128, ""block_2_kernel"": 5, ""block_2_stride"": 1, ""n_blocks"": 4}",COMPLETE
43,0.866925461739151,2026-10-02 15:05:23.976013,2026-10-02 15:06:11.977316,0 days 00:00:48.001303,,,,,128.0,0.019678760394442232,32,5,3,0.015423903719966305,32,3,2,0.036931172703358515,128,5,1,0.03377091043236553,64.0,5.0,2.0,,,,,512,0.10602729454179553,9.0,4,SGD,0.008518811239659717,0.8571684382088333,0.00011300176948573686,44.0,0.8914141414141414,0.8424367820641605,"{""block_0_dropout"": 0.019678760394442232, ""block_0_filters"": 32, ""block_0_kernel"": 5, ""block_1_dropout"": 0.015423903719966305, ""block_1_filters"": 32, ""block_1_kernel"": 3, ""block_1_stride"": 2, ""block_2_dropout"": 0.036931172703358515, ""block_2_filters"": 128, ""block_2_kernel"": 5, ""block_2_stride"": 1, ""n_blocks"": 4}",COMPLETE
44,0.8696577331775597,2026-10-02 15:06:12.051120,2026-10-02 15:06:58.756536,0 days 00:00:46.705416,,,,,128.0,0.02797797458396837,32,5,3,0.01811673547446649,64,3,2,0.039845008415970364,128,5,1,0.04114132198254904,64.0,5.0,2.0,,,,,512,0.10889402451859513,9.0,4,SGD,0.0029933002373285296,0.8539892639364242,0.00010886652661857669,49.0,0.891729797979798,0.8475856683753212,"{""block_0_dropout"": 0.02797797458396837, ""block_0_filters"": 32, ""block_0_kernel"": 5, ""block_1_dropout"": 0.01811673547446649, ""block_1_filters"": 64, ""block_1_kernel"": 3, ""block_1_stride"": 2, ""block_2_dropout"": 0.039845008415970364, ""block_2_filters"": 128, ""block_2_kernel"": 5, ""block_2_stride"": 1, ""n_blocks"": 4}",COMPLETE
45,0.8540076698982436,2026-10-02 15:06:58.815560,2026-10-02 15:07:47.311134,0 days 00:00:48.495574,,,,,128.0,0.02228013988755356,32,5,3,0.021109938173781873,64,3,2,0.045039652271860936,128,5,1,0.04138880765973846,128.0,3.0,2.0,,,,,512,0.12747212191690244,12.0,4,SGD,0.0029711191068904318,0.850598994942138,8.976969729150005e-05,49.0,0.8746843434343434,0.8333309963621438,"{""block_0_dropout"": 0.02228013988755356, ""block_0_filters"": 32, ""block_0_kernel"": 5, ""block_1_dropout"": 0.021109938173781873, ""block_1_filters"": 64, ""block_1_kernel"": 3, ""block_1_stride"": 2, ""block_2_dropout"": 0.045039652271860936, ""block_2_filters"": 128, ""block_2_kernel"": 5, ""block_2_stride"": 1, ""n_blocks"": 4}",COMPLETE
46,0.3809232554554278,2026-10-02 15:07:47.379208,2026-10-02 15:07:58.240734,0 days 00:00:10.861526,,,,,128.0,0.0191214695393601,32,5,3,0.011100124668672266,64,3,2,0.04230059754779097,128,5,1,0.04905437196968751,64.0,5.0,1.0,,,,,512,0.11000993354349736,9.0,4,SGD,0.00341248880903589,0.848434743769895,0.00013230697344857826,,,,"{""block_0_dropout"": 0.0191214695393601, ""block_0_filters"": 32, ""block_0_kernel"": 5, ""block_1_dropout"": 0.011100124668672266, ""block_1_filters"": 64, ""block_1_kernel"": 3, ""block_1_stride"": 2, ""block_2_dropout"": 0.04230059754779097, ""block_2_filters"": 128, ""block_2_kernel"": 5, ""block_2_stride"": 1, ""n_blocks"": 4}",PRUNED
47,0.8825576311509252,2026-10-02 15:07:58.306982,2026-10-02 15:08:46.065797,0 days 00:00:47.758815,,,,,128.0,0.02688924768611191,32,5,3,0.017416857949134758,64,3,2,0.032559864970669816,128,5,1,0.016707413115565943,256.0,5.0,2.0,,,,,512,0.18160399416028766,10.0,4,SGD,0.017547955640327843,0.8551528133267439,3.937474670919456e-05,50.0,0.9046717171717171,0.8604435451301333,"{""block_0_dropout"": 0.02688924768611191, ""block_0_filters"": 32, ""block_0_kernel"": 5, ""block_1_dropout"": 0.017416857949134758, ""block_1_filters"": 64, ""block_1_kernel"": 3, ""block_1_stride"": 2, ""block_2_dropout"": 0.032559864970669816, ""block_2_filters"": 128, ""block_2_kernel"": 5, ""block_2_stride"": 1, ""n_blocks"": 4}",COMPLETE
48,0.8929174072500673,2026-10-02 15:08:46.130208,2026-10-02 15:09:30.381092,0 days 00:00:44.250884,,,,,128.0,0.014750530491142727,32,5,3,0.01423686226373188,64,3,2,0.029605574888499183,128,5,1,0.017094235392630677,256.0,3.0,2.0,,,,,512,0.185018365266779,13.0,4,SGD,0.02137718789341389,0.9315297852776003,3.9000246107510855e-05,47.0,0.9097222222222222,0.8761125922779124,"{""block_0_dropout"": 0.014750530491142727, ""block_0_filters"": 32, ""block_0_kernel"": 5, ""block_1_dropout"": 0.01423686226373188, ""block_1_filters"": 64, ""block_1_kernel"": 3, ""block_1_stride"": 2, ""block_2_dropout"": 0.029605574888499183, ""block_2_filters"": 128, ""block_2_kernel"": 5, ""block_2_stride"": 1, ""n_blocks"": 4}",COMPLETE
49,,2026-10-02 15:09:30.437925,2026-10-02 15:09:30.449700,0 days 00:00:00.011775,,,,,,0.02478205288040708,32,5,3,0.019320173209186418,64,5,2,0.031331620861595764,128,5,1,,,,,,,,,,,,3,,,,,,,,"{""block_0_dropout"": 0.02478205288040708, ""block_0_filters"": 32, ""block_0_kernel"": 5, ""block_1_dropout"": 0.019320173209186418, ""block_1_filters"": 64, ""block_1_kernel"": 5, ""block_1_stride"": 2, ""block_2_dropout"": 0.031331620861595764, ""block_2_filters"": 128, ""block_2_kernel"": 5, ""block_2_stride"": 1, ""n_blocks"": 3}",PRUNED
50,0.4247582887965033,2026-10-02 15:09:30.500067,2026-10-02 15:09:42.453731,0 days 00:00:11.953664,,,,,128.0,0.012798560634712746,32,5,3,0.0102191570223095,64,3,2,0.04144733204201969,128,5,1,,,,,,,,,512,0.18050099452493162,15.0,3,SGD,0.02692743547961392,0.9461622760333414,3.1316170149263856e-05,,,,"{""block_0_dropout"": 0.012798560634712746, ""block_0_filters"": 32, ""block_0_kernel"": 5, ""block_1_dropout"": 0.0102191570223095, ""block_1_filters"": 64, ""block_1_kernel"": 3, ""block_1_stride"": 2, ""block_2_dropout"": 0.04144733204201969, ""block_2_filters"": 128, ""block_2_kernel"": 5, ""block_2_stride"": 1, ""n_blocks"": 3}",PRUNED
51,0.8805177555545081,2026-10-02 15:09:42.508210,2026-10-02 15:10:29.962859,0 days 00:00:47.454649,,,,,128.0,0.02890447162540582,32,5,3,0.013694663872848498,64,3,2,0.025038889096161546,128,5,1,0.018406016157770842,256.0,3.0,2.0,,,,,512,0.16174135735677903,13.0,4,SGD,0.023041803348678374,0.8245837748355336,0.0003473731154281862,48.0,0.8999368686868687,0.8610986424221473,"{""block_0_dropout"": 0.02890447162540582, ""block_0_filters"": 32, ""block_0_kernel"": 5, ""block_1_dropout"": 0.013694663872848498, ""block_1_filters"": 64, ""block_1_kernel"": 3, ""block_1_stride"": 2, ""block_2_dropout"": 0.025038889096161546, ""block_2_filters"": 128, ""block_2_kernel"": 5, ""block_2_stride"": 1, ""n_blocks"": 4}",COMPLETE
52,0.87958195876345,2026-10-02 15:10:30.015336,2026-10-02 15:11:13.430671,0 days 00:00:43.415335,,,,,128.0,0.034522535190846484,32,5,3,0.01412538833990934,64,3,2,0.036282257713935395,128,5,1,0.017648302601041912,256.0,3.0,2.0,,,,,512,0.17240580645392023,13.0,4,SGD,0.027182778959267052,0.8273412019876629,0.00043344713607954775,50.0,0.9011994949494949,0.8579644225774051,"{""block_0_dropout"": 0.034522535190846484, ""block_0_filters"": 32, ""block_0_kernel"": 5, ""block_1_dropout"": 0.01412538833990934, ""block_1_filters"": 64, ""block_1_kernel"": 3, ""block_1_stride"": 2, ""block_2_dropout"": 0.036282257713935395, ""block_2_filters"": 128, ""block_2_kernel"": 5, ""block_2_stride"": 1, ""n_blocks"": 4}",COMPLETE
53,0.862013289783252,2026-10-02 15:11:13.483838,2026-10-02 15:11:56.633429,0 days 00:00:43.149591,,,,,128.0,0.032135415960870155,32,5,3,0.015512381708274445,64,3,2,0.033580167369870746,128,5,1,0.017935217609129726,256.0,3.0,2.0,,,,,512,0.22243204372168893,13.0,4,SGD,0.025865123658908685,0.8152986604643194,0.0011053963101459905,38.0,0.8841540404040404,0.8398725391624634,"{""block_0_dropout"": 0.032135415960870155, ""block_0_filters"": 32, ""block_0_kernel"": 5, ""block_1_dropout"": 0.015512381708274445, ""block_1_filters"": 64, ""block_1_kernel"": 3, ""block_1_stride"": 2, ""block_2_dropout"": 0.033580167369870746, ""block_2_filters"": 128, ""block_2_kernel"": 5, ""block_2_stride"": 1, ""n_blocks"": 4}",COMPLETE
54,,2026-10-02 15:11:56.692630,2026-10-02 15:11:56.746175,0 days 00:00:00.053545,,,,,,0.017502892751537824,32,5,3,0.01684993645021706,64,3,2,0.034733840797206705,128,5,1,0.014530100003880208,256.0,3.0,2.0,0.04371524832750949,128.0,3.0,1.0,,,,5,,,,,,,,"{""block_0_dropout"": 0.017502892751537824, ""block_0_filters"": 32, ""block_0_kernel"": 5, ""block_1_dropout"": 0.01684993645021706, ""block_1_filters"": 64, ""block_1_kernel"": 3, ""block_1_stride"": 2, ""block_2_dropout"": 0.034733840797206705, ""block_2_filters"": 128, ""block_2_kernel"": 5, ""block_2_stride"": 1, ""n_blocks"": 5}",PRUNED
55,0.8837489526521505,2026-10-02 15:11:56.883447,2026-10-02 15:12:41.592062,0 days 00:00:44.708615,,,,,128.0,0.024728202991033812,32,5,3,0.019918445743774656,64,3,2,0.023201074557741938,128,5,1,0.01895551809623792,256.0,3.0,2.0,,,,,512,0.16290667546938087,17.0,4,SGD,0.018914708859699144,0.9377511142734685,0.0003303485069557549,46.0,0.9021464646464646,0.8653514406578363,"{""block_0_dropout"": 0.024728202991033812, ""block_0_filters"": 32, ""block_0_kernel"": 5, ""block_1_dropout"": 0.019918445743774656, ""block_1_filters"": 64, ""block_1_kernel"": 3, ""block_1_stride"": 2, ""block_2_dropout"": 0.023201074557741938, ""block_2_filters"": 128, ""block_2_kernel"": 5, ""block_2_stride"": 1, ""n_blocks"": 4}",COMPLETE
56,0.873542529746838,2026-10-02 15:12:41.645296,2026-10-02 15:13:27.917557,0 days 00:00:46.272261,,,,,128.0,0.027079447525839944,32,5,3,0.01690059698234177,64,3,2,0.0226106382271287,128,5,1,0.018702947615692272,256.0,3.0,2.0,,,,,512,0.16499726002310852,18.0,4,SGD,0.018688919540127795,0.9371274838659442,0.0004139124371682558,49.0,0.8964646464646465,0.8506204130290295,"{""block_0_dropout"": 0.027079447525839944, ""block_0_filters"": 32, ""block_0_kernel"": 5, ""block_1_dropout"": 0.01690059698234177, ""block_1_filters"": 64, ""block_1_kernel"": 3, ""block_1_stride"": 2, ""block_2_dropout"": 0.0226106382271287, ""block_2_filters"": 128, ""block_2_kernel"": 5, ""block_2_stride"": 1, ""n_blocks"": 4}",COMPLETE
57,0.3273110796348325,2026-10-02 15:13:27.972383,2026-10-02 15:13:36.547796,0 days 00:00:08.575413,,,,,128.0,0.022815241791166296,32,5,3,0.021823203909678544,64,3,2,0.021989610811815635,128,5,1,0.014895658426980598,256.0,3.0,2.0,,,,,512,0.24787372126351942,17.0,4,SGD,0.04514694486510228,0.9455291906324799,0.0013326311675297764,,,,"{""block_0_dropout"": 0.022815241791166296, ""block_0_filters"": 32, ""block_0_kernel"": 5, ""block_1_dropout"": 0.021823203909678544, ""block_1_filters"": 64, ""block_1_kernel"": 3, ""block_1_stride"": 2, ""block_2_dropout"": 0.021989610811815635, ""block_2_filters"": 128, ""block_2_kernel"": 5, ""block_2_stride"": 1, ""n_blocks"": 4}",PRUNED
58,0.4486501263357652,2026-10-02 15:13:36.608347,2026-10-02 15:13:46.859317,0 days 00:00:10.250970,,,,,128.0,0.032672588362413754,32,5,3,0.019235434032658608,64,3,2,0.02882857393598228,128,5,1,0.012181131308570832,256.0,3.0,1.0,,,,,512,0.15860053171933913,14.0,4,SGD,0.036635898515192174,0.9143139673778834,0.00023920733070057908,,,,"{""block_0_dropout"": 0.032672588362413754, ""block_0_filters"": 32, ""block_0_kernel"": 5, ""block_1_dropout"": 0.019235434032658608, ""block_1_filters"": 64, ""block_1_kernel"": 3, ""block_1_stride"": 2, ""block_2_dropout"": 0.02882857393598228, ""block_2_filters"": 128, ""block_2_kernel"": 5, ""block_2_stride"": 1, ""n_blocks"": 4}",PRUNED
59,0.8704395749853302,2026-10-02 15:13:46.928894,2026-10-02 15:14:30.541920,0 days 00:00:43.613026,,,,,128.0,0.029365024568357365,32,5,3,0.011753146520360502,64,3,2,0.03865772118699044,128,5,1,0.016105108407752755,256.0,3.0,2.0,,,,,512,0.21122133102238877,13.0,4,SGD,0.015262505309700069,0.8254525038802394,0.0017088574730476968,50.0,0.8945707070707071,0.8463084428999533,"{""block_0_dropout"": 0.029365024568357365, ""block_0_filters"": 32, ""block_0_kernel"": 5, ""block_1_dropout"": 0.011753146520360502, ""block_1_filters"": 64, ""block_1_kernel"": 3, ""block_1_stride"": 2, ""block_2_dropout"": 0.03865772118699044, ""block_2_filters"": 128, ""block_2_kernel"": 5, ""block_2_stride"": 1, ""n_blocks"": 4}",COMPLETE
60,0.8728412396693856,2026-10-02 15:14:30.594355,2026-10-02 15:15:13.570257,0 days 00:00:42.975902,,,,,128.0,0.03908079978900561,32,5,3,0.012886737944786578,64,3,2,0.03770917845931586,128,5,1,0.020178682805326337,256.0,3.0,2.0,,,,,512,0.2919323160770453,19.0,4,SGD,0.018090465830431123,0.8789918143526918,0.00032722222212194085,44.0,0.8942550505050505,0.8514274288337209,"{""block_0_dropout"": 0.03908079978900561, ""block_0_filters"": 32, ""block_0_kernel"": 5, ""block_1_dropout"": 0.012886737944786578, ""block_1_filters"": 64, ""block_1_kernel"": 3, ""block_1_stride"": 2, ""block_2_dropout"": 0.03770917845931586, ""block_2_filters"": 128, ""block_2_kernel"": 5, ""block_2_stride"": 1, ""n_blocks"": 4}",COMPLETE
61,0.8917257584522291,2026-10-02 15:15:13.623288,2026-10-02 15:15:58.996246,0 days 00:00:45.372958,,,,,128.0,0.02596039611379707,32,5,3,0.015914181411566156,64,3,2,0.03238938870923365,128,5,1,0.018503780937160957,256.0,3.0,2.0,,,,,512,0.15725008224434212,16.0,4,SGD,0.053203295787528415,0.8811897900656187,4.019650037791672e-05,49.0,0.9097222222222222,0.873729294682236,"{""block_0_dropout"": 0.02596039611379707, ""block_0_filters"": 32, ""block_0_kernel"": 5, ""block_1_dropout"": 0.015914181411566156, ""block_1_filters"": 64, ""block_1_kernel"": 3, ""block_1_stride"": 2, ""block_2_dropout"": 0.03238938870923365, ""block_2_filters"": 128, ""block_2_kernel"": 5, ""block_2_stride"": 1, ""n_blocks"": 4}",COMPLETE
62,0.8824696179866451,2026-10-02 15:15:59.049504,2026-10-02 15:16:42.249951,0 days 00:00:43.200447,,,,,128.0,0.025440448985390596,32,5,3,0.017760365587347844,64,3,2,0.032661702318041747,128,5,1,0.01306309472673934,256.0,3.0,2.0,,,,,512,0.14972943899881952,16.0,4,SGD,0.05002500017504514,0.8917253247456186,4.588060327226197e-05,44.0,0.9011994949494949,0.8637397410237954,"{""block_0_dropout"": 0.025440448985390596, ""block_0_filters"": 32, ""block_0_kernel"": 5, ""block_1_dropout"": 0.017760365587347844, ""block_1_filters"": 64, ""block_1_kernel"": 3, ""block_1_stride"": 2, ""block_2_dropout"": 0.032661702318041747, ""block_2_filters"": 128, ""block_2_kernel"": 5, ""block_2_stride"": 1, ""n_blocks"": 4}",COMPLETE
63,0.8922013963680617,2026-10-02 15:16:42.303346,2026-10-02 15:17:25.745706,0 days 00:00:43.442360,,,,,128.0,0.022944912864784818,32,5,3,0.01011831746211346,64,3,2,0.03497443860544524,128,5,1,0.01314012496114641,256.0,3.0,2.0,,,,,512,0.1391726778606724,17.0,4,SGD,0.049009696075172526,0.8804203944211653,3.196170514599795e-05,49.0,0.9090909090909091,0.8753118836452144,"{""block_0_dropout"": 0.022944912864784818, ""block_0_filters"": 32, ""block_0_kernel"": 5, ""block_1_dropout"": 0.01011831746211346, ""block_1_filters"": 64, ""block_1_kernel"": 3, ""block_1_stride"": 2, ""block_2_dropout"": 0.03497443860544524, ""block_2_filters"": 128, ""block_2_kernel"": 5, ""block_2_stride"": 1, ""n_blocks"": 4}",COMPLETE
