number,value,datetime_start,datetime_complete,duration,params_adam_beta1,params_adam_beta2,params_adam_lr,params_adam_wd,params_batch_size,params_block_0_dropout,params_block_0_filters,params_block_0_kernel,params_block_0_stride,params_block_1_dropout,params_block_1_filters,params_block_1_kernel,params_block_1_stride,params_block_2_dropout,params_block_2_filters,params_block_2_kernel,params_block_2_stride,params_block_3_dropout,params_block_3_filters,params_block_3_kernel,params_block_3_stride,params_block_4_dropout,params_block_4_filters,params_block_4_kernel,params_block_4_stride,params_fc_hidden,params_lr_factor,params_lr_patience,params_n_blocks,params_optimizer,params_sgd_lr,params_sgd_momentum,params_sgd_wd,user_attrs_best_epoch,user_attrs_validation_accuracy,user_attrs_validation_macro_f1,system_attrs_tpe:relative_params:0,state
0,0.2822707854772294,2026-10-02 14:35:18.181534,2026-10-02 14:35:59.656624,0 days 00:00:41.475090,,,,,128.0,0.012323344486727979,8,7,3,0.017336180394137354,16,5,2,0.02465447373174767,64,3,1,0.016820964947491662,128.0,3.0,1.0,,,,,512,0.19763058787582308,12.0,4,SGD,0.00019634341572933326,0.8984275776885255,5.762487216478604e-05,50.0,0.29261363636363635,0.2719279345908224,,COMPLETE
1,0.2992586778363485,2026-10-02 14:35:59.711063,2026-10-02 14:36:46.430659,0 days 00:00:46.719596,,,,,128.0,0.041005312934444586,32,5,3,0.02554709158757928,16,7,1,0.012982025747190833,64,3,1,0.04085081386743783,64.0,3.0,1.0,,,,,256,0.36014665762139764,16.0,4,SGD,0.0009833181933644897,0.7184319215829468,1.753594952976443e-05,49.0,0.3090277777777778,0.2894895778949193,,COMPLETE
2,0.3810819023227262,2026-10-02 14:36:46.494326,2026-10-02 14:37:25.598070,0 days 00:00:39.103744,0.9754527819892891,0.9317685471496893,0.0011986281799901185,0.0016973078532467015,200.0,0.030909313175279764,16,7,3,0.019971689165955,16,5,1,0.04232481518257668,64,3,1,,,,,,,,,256,0.18804153962214143,8.0,3,Adam,,,,46.0,0.38478535353535354,0.3773784511100989,,COMPLETE
3,0.6416444941885541,2026-10-02 14:37:25.675652,2026-10-02 14:38:25.331657,0 days 00:00:59.656005,0.9519502888056603,0.9367415349586534,0.003336101309469784,8.923807143379781e-06,200.0,0.04771638815650077,8,5,3,0.022035132392670787,64,5,1,0.019582475626678898,128,5,1,,,,,,,,,512,0.6058446644748636,15.0,3,Adam,,,,50.0,0.6448863636363636,0.6384026247407445,,COMPLETE
4,0.40358549706587327,2026-10-02 14:38:25.398127,2026-10-02 14:39:16.114632,0 days 00:00:50.716505,,,,,64.0,0.03048372233197124,32,7,3,0.014538940849623563,32,3,1,0.01967409163601807,32,3,2,,,,,,,,,512,0.8096691394120938,17.0,3,SGD,0.0011159088550343414,0.9105271468723695,0.0038765111709116325,50.0,0.41224747474747475,0.3949235193842718,,COMPLETE
5,,2026-10-02 14:39:16.167039,2026-10-02 14:39:16.183828,0 days 00:00:00.016789,,,,,,0.016432322056699946,8,7,3,0.035985315961888587,32,5,1,0.048920422190097824,32,3,2,0.01780971951192178,128.0,5.0,2.0,0.03581889183628671,128.0,3.0,1.0,,,,5,,,,,,,,,PRUNED
6,,2026-10-02 14:39:16.316728,2026-10-02 14:39:16.335103,0 days 00:00:00.018375,,,,,,0.04713274250350902,16,7,3,0.0167797098674437,32,7,2,0.015603360609460961,64,5,1,,,,,,,,,,,,3,,,,,,,,,PRUNED
7,,2026-10-02 14:39:16.516515,2026-10-02 14:39:16.547846,0 days 00:00:00.031331,,,,,,0.021743673770579737,8,7,3,0.038078675090308135,64,7,2,0.02862392072529841,64,5,2,0.015082420506075393,256.0,3.0,2.0,,,,,,,,4,,,,,,,,,PRUNED
8,,2026-10-02 14:39:16.728145,2026-10-02 14:39:16.756735,0 days 00:00:00.028590,,,,,,0.03125418526272592,8,7,3,0.027558856828225446,64,7,2,0.016257481706843442,128,5,2,0.032174162100456025,256.0,5.0,2.0,,,,,,,,4,,,,,,,,,PRUNED
9,,2026-10-02 14:39:16.934044,2026-10-02 14:39:16.966214,0 days 00:00:00.032170,,,,,,0.01464290562027665,8,7,3,0.016928074796400606,64,7,2,0.030125450343203505,128,5,1,0.04760920965699831,64.0,3.0,1.0,,,,,,,,4,,,,,,,,,PRUNED
10,0.6840641450104025,2026-10-02 14:39:17.076281,2026-10-02 14:40:15.455665,0 days 00:00:58.379384,0.9079517194939879,0.9627768386841636,0.009444811794638241,1.5681694641610638e-06,200.0,0.04036207752276006,32,5,3,0.013699189578280573,64,3,1,0.013446685364581459,128,5,1,,,,,,,,,128,0.8155565840291188,20.0,3,Adam,,,,50.0,0.6963383838383839,0.6717899061824211,"{""block_0_dropout"": 0.04036207752276006, ""block_0_filters"": 32, ""block_0_kernel"": 5, ""block_1_dropout"": 0.013699189578280573, ""block_1_filters"": 64, ""block_1_kernel"": 3, ""block_1_stride"": 1, ""block_2_dropout"": 0.013446685364581459, ""block_2_filters"": 128, ""block_2_kernel"": 5, ""block_2_stride"": 1, ""n_blocks"": 3}",COMPLETE
11,0.5528869208758368,2026-10-02 14:40:15.512352,2026-10-02 14:41:00.245977,0 days 00:00:44.733625,0.9250098755312106,0.9537484795905934,0.00960994055704251,1.5530519390924744e-06,200.0,0.031203171371680355,32,5,3,0.012287072940566609,64,3,1,0.014801873104301276,32,5,1,,,,,,,,,128,0.7775968987109323,20.0,3,Adam,,,,48.0,0.5508207070707071,0.5549531346809665,"{""block_0_dropout"": 0.031203171371680355, ""block_0_filters"": 32, ""block_0_kernel"": 5, ""block_1_dropout"": 0.012287072940566609, ""block_1_filters"": 64, ""block_1_kernel"": 3, ""block_1_stride"": 1, ""block_2_dropout"": 0.014801873104301276, ""block_2_filters"": 32, ""block_2_kernel"": 5, ""block_2_stride"": 1, ""n_blocks"": 3}",COMPLETE
12,0.2312717180424514,2026-10-02 14:41:00.298495,2026-10-02 14:41:10.680475,0 days 00:00:10.381980,0.8803589415775793,0.988665254922613,0.007683307692264288,2.385153804750212e-06,200.0,0.04422035953099479,8,5,3,0.01742968798925993,64,7,1,0.01739631759436531,128,3,1,,,,,,,,,128,0.6154498750504773,20.0,3,Adam,,,,,,,"{""block_0_dropout"": 0.04422035953099479, ""block_0_filters"": 8, ""block_0_kernel"": 5, ""block_1_dropout"": 0.01742968798925993, ""block_1_filters"": 64, ""block_1_kernel"": 7, ""block_1_stride"": 1, ""block_2_dropout"": 0.01739631759436531, ""block_2_filters"": 128, ""block_2_kernel"": 3, ""block_2_stride"": 1, ""n_blocks"": 3}",PRUNED
13,,2026-10-02 14:41:10.731865,2026-10-02 14:41:10.746333,0 days 00:00:00.014468,,,,,,0.039479442432784506,8,5,3,0.030904042098632716,64,5,2,0.02812134517058052,128,5,1,,,,,,,,,,,,3,,,,,,,,"{""block_0_dropout"": 0.039479442432784506, ""block_0_filters"": 8, ""block_0_kernel"": 5, ""block_1_dropout"": 0.030904042098632716, ""block_1_filters"": 64, ""block_1_kernel"": 5, ""block_1_stride"": 2, ""block_2_dropout"": 0.02812134517058052, ""block_2_filters"": 128, ""block_2_kernel"": 5, ""block_2_stride"": 1, ""n_blocks"": 3}",PRUNED
14,0.591655695323897,2026-10-02 14:41:10.798735,2026-10-02 14:42:05.047824,0 days 00:00:54.249089,0.9360364420157866,0.9545495628657985,0.002474959199039115,1.4026979990955342e-05,200.0,0.04481565671596139,8,7,3,0.011238023104286801,64,3,1,0.030196082120544577,128,5,1,,,,,,,,,512,0.5533579516648615,14.0,3,Adam,,,,44.0,0.5940656565656566,0.5892457340821373,"{""block_0_dropout"": 0.04481565671596139, ""block_0_filters"": 8, ""block_0_kernel"": 7, ""block_1_dropout"": 0.011238023104286801, ""block_1_filters"": 64, ""block_1_kernel"": 3, ""block_1_stride"": 1, ""block_2_dropout"": 0.030196082120544577, ""block_2_filters"": 128, ""block_2_kernel"": 5, ""block_2_stride"": 1, ""n_blocks"": 3}",COMPLETE
15,0.8156222754998548,2026-10-02 14:42:05.100489,2026-10-02 14:43:07.335934,0 days 00:01:02.235445,0.9061352732713149,0.904315764869144,0.0032890677899770813,3.2949000789371815e-05,200.0,0.0242034051928445,8,5,3,0.014919563937216569,64,3,1,0.017978754584460188,128,5,1,0.028616837093783966,64.0,5.0,2.0,,,,,128,0.8871741312503645,10.0,4,Adam,,,,47.0,0.8295454545454546,0.8016990964542549,"{""block_0_dropout"": 0.0242034051928445, ""block_0_filters"": 8, ""block_0_kernel"": 5, ""block_1_dropout"": 0.014919563937216569, ""block_1_filters"": 64, ""block_1_kernel"": 3, ""block_1_stride"": 1, ""block_2_dropout"": 0.017978754584460188, ""block_2_filters"": 128, ""block_2_kernel"": 5, ""block_2_stride"": 1, ""n_blocks"": 4}",COMPLETE
16,0.8399171251410446,2026-10-02 14:43:07.393155,2026-10-02 14:44:15.025730,0 days 00:01:07.632575,0.8918486539285322,0.9048019511660206,0.0002511179985392224,0.00015110289014993428,64.0,0.021697065264187746,32,5,3,0.015827784686246696,64,3,1,0.017695202698649576,128,5,1,0.029958875338639824,64.0,5.0,2.0,,,,,128,0.8823041129236102,5.0,4,Adam,,,,50.0,0.8598484848484849,0.8199857654336042,"{""block_0_dropout"": 0.021697065264187746, ""block_0_filters"": 32, ""block_0_kernel"": 5, ""block_1_dropout"": 0.015827784686246696, ""block_1_filters"": 64, ""block_1_kernel"": 3, ""block_1_stride"": 1, ""block_2_dropout"": 0.017695202698649576, ""block_2_filters"": 128, ""block_2_kernel"": 5, ""block_2_stride"": 1, ""n_blocks"": 4}",COMPLETE
17,0.8624935161015075,2026-10-02 14:44:15.095827,2026-10-02 14:45:28.757635,0 days 00:01:13.661808,0.8520151488410588,0.9033007908566301,0.0001628373852899579,0.00010765528145353019,64.0,0.028457128326938017,32,5,3,0.01923623062171214,64,3,1,0.013156207123801196,128,5,1,0.030701030722136858,64.0,5.0,2.0,0.01167976045187091,256.0,3.0,1.0,128,0.890727448460168,5.0,5,Adam,,,,49.0,0.8803661616161617,0.8446208705868534,"{""block_0_dropout"": 0.028457128326938017, ""block_0_filters"": 32, ""block_0_kernel"": 5, ""block_1_dropout"": 0.01923623062171214, ""block_1_filters"": 64, ""block_1_kernel"": 3, ""block_1_stride"": 1, ""block_2_dropout"": 0.013156207123801196, ""block_2_filters"": 128, ""block_2_kernel"": 5, ""block_2_stride"": 1, ""n_blocks"": 5}",COMPLETE
18,0.7610279878465014,2026-10-02 14:45:28.825345,2026-10-02 14:46:35.184494,0 days 00:01:06.359149,0.8554176226062357,0.9013501149825812,0.00013756995256972466,0.0002082825807342894,64.0,0.022691938877415305,32,5,3,0.02113849246323411,32,3,1,0.025423747260335618,128,5,1,0.027507374537610835,64.0,5.0,2.0,,,,,128,0.7215835619495994,5.0,4,Adam,,,,49.0,0.7689393939393939,0.753116581753609,"{""block_0_dropout"": 0.022691938877415305, ""block_0_filters"": 32, ""block_0_kernel"": 5, ""block_1_dropout"": 0.02113849246323411, ""block_1_filters"": 32, ""block_1_kernel"": 3, ""block_1_stride"": 1, ""block_2_dropout"": 0.025423747260335618, ""block_2_filters"": 128, ""block_2_kernel"": 5, ""block_2_stride"": 1, ""n_blocks"": 4}",COMPLETE
19,0.8665163560129168,2026-10-02 14:46:35.240190,2026-10-02 14:47:36.864122,0 days 00:01:01.623932,0.8504391790170258,0.920368399516568,0.00016287186614643523,0.00020619925071110878,64.0,0.023470778673075007,32,5,3,0.013708804807598717,64,3,2,0.028130641937709977,128,5,1,0.034696659797652164,64.0,5.0,2.0,,,,,128,0.8684704887285327,5.0,4,Adam,,,,45.0,0.8888888888888888,0.8441438231369446,"{""block_0_dropout"": 0.023470778673075007, ""block_0_filters"": 32, ""block_0_kernel"": 5, ""block_1_dropout"": 0.013708804807598717, ""block_1_filters"": 64, ""block_1_kernel"": 3, ""block_1_stride"": 2, ""block_2_dropout"": 0.028130641937709977, ""block_2_filters"": 128, ""block_2_kernel"": 5, ""block_2_stride"": 1, ""n_blocks"": 4}",COMPLETE
20,0.8609180550569517,2026-10-02 14:47:36.918576,2026-10-02 14:48:50.948438,0 days 00:01:14.029862,,,,,64.0,0.03348235104972528,32,5,3,0.017296137760722776,64,3,1,0.0299631993973375,128,5,1,0.03767684916921925,64.0,5.0,2.0,0.011534909309561827,256.0,3.0,1.0,128,0.6826003789104034,7.0,5,SGD,0.09418993635138886,0.7059761919118797,1.101773524738362e-06,47.0,0.8718434343434344,0.849992675770469,"{""block_0_dropout"": 0.03348235104972528, ""block_0_filters"": 32, ""block_0_kernel"": 5, ""block_1_dropout"": 0.017296137760722776, ""block_1_filters"": 64, ""block_1_kernel"": 3, ""block_1_stride"": 1, ""block_2_dropout"": 0.0299631993973375, ""block_2_filters"": 128, ""block_2_kernel"": 5, ""block_2_stride"": 1, ""n_blocks"": 5}",COMPLETE
21,0.4283939194028821,2026-10-02 14:48:51.000971,2026-10-02 14:49:19.115181,0 days 00:00:28.114210,,,,,64.0,0.0293990807185385,32,5,3,0.031116269311819544,64,3,1,0.032976115713873204,128,5,1,0.03861620802425084,64.0,5.0,2.0,0.010266286203215121,256.0,3.0,1.0,128,0.6927354631169759,7.0,5,SGD,0.0964330790123687,0.7046966497947824,1.0515605902381835e-06,,,,"{""block_0_dropout"": 0.0293990807185385, ""block_0_filters"": 32, ""block_0_kernel"": 5, ""block_1_dropout"": 0.031116269311819544, ""block_1_filters"": 64, ""block_1_kernel"": 3, ""block_1_stride"": 1, ""block_2_dropout"": 0.032976115713873204, ""block_2_filters"": 128, ""block_2_kernel"": 5, ""block_2_stride"": 1, ""n_blocks"": 5}",PRUNED
22,0.27405873989481966,2026-10-02 14:49:19.168801,2026-10-02 14:49:33.227011,0 days 00:00:14.058210,,,,,64.0,0.04086875660365878,32,5,3,0.012799995714014887,64,3,1,0.01612916290813193,128,5,1,0.037703703710711765,64.0,5.0,2.0,0.012939803584040413,256.0,3.0,1.0,128,0.4509606623631852,7.0,5,SGD,0.029605790119289536,0.8093926126500152,0.006781619843784668,,,,"{""block_0_dropout"": 0.04086875660365878, ""block_0_filters"": 32, ""block_0_kernel"": 5, ""block_1_dropout"": 0.012799995714014887, ""block_1_filters"": 64, ""block_1_kernel"": 3, ""block_1_stride"": 1, ""block_2_dropout"": 0.01612916290813193, ""block_2_filters"": 128, ""block_2_kernel"": 5, ""block_2_stride"": 1, ""n_blocks"": 5}",PRUNED
23,0.2484124125343759,2026-10-02 14:49:33.279943,2026-10-02 14:49:47.001041,0 days 00:00:13.721098,,,,,64.0,0.025519382600441957,32,5,3,0.012586759800067408,64,3,1,0.010247379286903755,128,3,1,0.02386821081085221,64.0,5.0,2.0,0.016993001335286185,512.0,3.0,1.0,128,0.8932811225605851,9.0,5,SGD,0.007182304146168199,0.9878785633286664,0.0002741901450999999,,,,"{""block_0_dropout"": 0.025519382600441957, ""block_0_filters"": 32, ""block_0_kernel"": 5, ""block_1_dropout"": 0.012586759800067408, ""block_1_filters"": 64, ""block_1_kernel"": 3, ""block_1_stride"": 1, ""block_2_dropout"": 0.010247379286903755, ""block_2_filters"": 128, ""block_2_kernel"": 3, ""block_2_stride"": 1, ""n_blocks"": 5}",PRUNED
24,0.837756397544006,2026-10-02 14:49:47.054823,2026-10-02 14:50:57.551918,0 days 00:01:10.497095,,,,,64.0,0.042918549995721506,8,5,3,0.017648465800741784,64,3,1,0.03566260481587056,128,5,1,0.03524747040213406,64.0,5.0,2.0,0.02436928764240131,256.0,3.0,1.0,128,0.7073221961745272,5.0,5,SGD,0.006965193333382369,0.7950998832260381,1.203874437823015e-06,49.0,0.8547979797979798,0.8207148152900322,"{""block_0_dropout"": 0.042918549995721506, ""block_0_filters"": 8, ""block_0_kernel"": 5, ""block_1_dropout"": 0.017648465800741784, ""block_1_filters"": 64, ""block_1_kernel"": 3, ""block_1_stride"": 1, ""block_2_dropout"": 0.03566260481587056, ""block_2_filters"": 128, ""block_2_kernel"": 5, ""block_2_stride"": 1, ""n_blocks"": 5}",COMPLETE
25,,2026-10-02 14:50:57.604073,2026-10-02 14:50:57.621936,0 days 00:00:00.017863,,,,,,0.020393529308214222,32,5,3,0.02748721827634059,64,3,2,0.012074427122364695,128,5,1,0.04430491992981139,64.0,5.0,2.0,0.022847227440318214,256.0,3.0,1.0,,,,5,,,,,,,,"{""block_0_dropout"": 0.020393529308214222, ""block_0_filters"": 32, ""block_0_kernel"": 5, ""block_1_dropout"": 0.02748721827634059, ""block_1_filters"": 64, ""block_1_kernel"": 3, ""block_1_stride"": 2, ""block_2_dropout"": 0.012074427122364695, ""block_2_filters"": 128, ""block_2_kernel"": 5, ""block_2_stride"": 1, ""n_blocks"": 5}",PRUNED
26,0.877370875279557,2026-10-02 14:50:57.672344,2026-10-02 14:52:18.462191,0 days 00:01:20.789847,0.851286577211636,0.9255459381602288,0.00035804067309581255,0.001114127141870737,64.0,0.0264488877513962,32,5,3,0.018700148596677502,64,3,1,0.016227916492630556,128,5,1,0.023450549725119875,128.0,5.0,2.0,0.0104367743097173,256.0,3.0,1.0,256,0.7810789101103562,7.0,5,Adam,,,,50.0,0.8977272727272727,0.8570144778318415,"{""block_0_dropout"": 0.0264488877513962, ""block_0_filters"": 32, ""block_0_kernel"": 5, ""block_1_dropout"": 0.018700148596677502, ""block_1_filters"": 64, ""block_1_kernel"": 3, ""block_1_stride"": 1, ""block_2_dropout"": 0.016227916492630556, ""block_2_filters"": 128, ""block_2_kernel"": 5, ""block_2_stride"": 1, ""n_blocks"": 5}",COMPLETE
27,0.795514653087586,2026-10-02 14:52:18.514543,2026-10-02 14:54:41.322154,0 days 00:02:22.807611,0.851243705248787,0.9234123247426573,0.00034623953928291637,0.0013375473478879597,64.0,0.030401699004393195,32,5,3,0.01844777678788192,64,3,1,0.017299128657916524,64,3,1,0.022826440324419064,128.0,5.0,1.0,0.022070227557300863,512.0,3.0,1.0,256,0.7887640641292779,11.0,5,Adam,,,,50.0,0.8077651515151515,0.7832641546600204,"{""block_0_dropout"": 0.030401699004393195, ""block_0_filters"": 32, ""block_0_kernel"": 5, ""block_1_dropout"": 0.01844777678788192, ""block_1_filters"": 64, ""block_1_kernel"": 3, ""block_1_stride"": 1, ""block_2_dropout"": 0.017299128657916524, ""block_2_filters"": 64, ""block_2_kernel"": 3, ""block_2_stride"": 1, ""n_blocks"": 5}",COMPLETE
28,0.6250723153404183,2026-10-02 14:54:41.390855,2026-10-02 14:55:21.136990,0 days 00:00:39.746135,0.870241449080488,0.9196821415676074,0.00010676756931076619,0.00024773935836372636,64.0,0.023616245374032986,32,5,3,0.025137364098000027,64,3,1,0.010737502356388082,128,3,1,0.02109944639167778,128.0,5.0,2.0,,,,,256,0.842512983726505,6.0,4,Adam,,,,,,,"{""block_0_dropout"": 0.023616245374032986, ""block_0_filters"": 32, ""block_0_kernel"": 5, ""block_1_dropout"": 0.025137364098000027, ""block_1_filters"": 64, ""block_1_kernel"": 3, ""block_1_stride"": 1, ""block_2_dropout"": 0.010737502356388082, ""block_2_filters"": 128, ""block_2_kernel"": 3, ""block_2_stride"": 1, ""n_blocks"": 4}",PRUNED
29,0.8475036496116872,2026-10-02 14:55:21.193281,2026-10-02 14:56:29.418862,0 days 00:01:08.225581,0.8627935294631511,0.9166257377930793,0.0003990704646087172,0.007749040167942608,128.0,0.038877846728144705,32,5,3,0.022168786206360445,64,3,1,0.015982236939530332,128,5,1,0.033600375786251205,128.0,5.0,2.0,0.048932405989059444,128.0,3.0,1.0,256,0.7691084483559463,9.0,5,Adam,,,,49.0,0.8721590909090909,0.8228482083142836,"{""block_0_dropout"": 0.038877846728144705, ""block_0_filters"": 32, ""block_0_kernel"": 5, ""block_1_dropout"": 0.022168786206360445, ""block_1_filters"": 64, ""block_1_kernel"": 3, ""block_1_stride"": 1, ""block_2_dropout"": 0.015982236939530332, ""block_2_filters"": 128, ""block_2_kernel"": 5, ""block_2_stride"": 1, ""n_blocks"": 5}",COMPLETE
30,,2026-10-02 14:56:29.475698,2026-10-02 14:56:29.492682,0 days 00:00:00.016984,,,,,,0.025239308485438906,32,5,3,0.014079715593505501,64,3,2,0.021544102255926678,128,5,1,0.010701087290058194,256.0,5.0,2.0,0.018272535230741203,256.0,3.0,1.0,,,,5,,,,,,,,"{""block_0_dropout"": 0.025239308485438906, ""block_0_filters"": 32, ""block_0_kernel"": 5, ""block_1_dropout"": 0.014079715593505501, ""block_1_filters"": 64, ""block_1_kernel"": 3, ""block_1_stride"": 2, ""block_2_dropout"": 0.021544102255926678, ""block_2_filters"": 128, ""block_2_kernel"": 5, ""block_2_stride"": 1, ""n_blocks"": 5}",PRUNED
31,0.4450785089165831,2026-10-02 14:56:29.543491,2026-10-02 14:56:50.380000,0 days 00:00:20.836509,0.8505971908035571,0.9373595554187275,0.00019875875961951464,0.0006029308911410864,64.0,0.017925993035684686,32,5,3,0.01717551621622983,64,3,2,0.0260318906896158,128,5,1,,,,,,,,,128,0.6887366591162494,7.0,3,Adam,,,,,,,"{""block_0_dropout"": 0.017925993035684686, ""block_0_filters"": 32, ""block_0_kernel"": 5, ""block_1_dropout"": 0.01717551621622983, ""block_1_filters"": 64, ""block_1_kernel"": 3, ""block_1_stride"": 2, ""block_2_dropout"": 0.0260318906896158, ""block_2_filters"": 128, ""block_2_kernel"": 5, ""block_2_stride"": 1, ""n_blocks"": 3}",PRUNED
32,0.8346699796328275,2026-10-02 14:56:50.433400,2026-10-02 14:58:09.032932,0 days 00:01:18.599532,0.875215842717508,0.9140016207158259,0.0006008542586063983,6.0869758239582845e-05,64.0,0.02917435078366418,32,5,3,0.024240574534652164,64,7,1,0.02181061925821885,128,5,1,0.02563873981203577,64.0,5.0,2.0,0.01012617582713859,256.0,3.0,1.0,256,0.6303301512841337,6.0,5,Adam,,,,50.0,0.8462752525252525,0.8230647067404026,"{""block_0_dropout"": 0.02917435078366418, ""block_0_filters"": 32, ""block_0_kernel"": 5, ""block_1_dropout"": 0.024240574534652164, ""block_1_filters"": 64, ""block_1_kernel"": 7, ""block_1_stride"": 1, ""block_2_dropout"": 0.02181061925821885, ""block_2_filters"": 128, ""block_2_kernel"": 5, ""block_2_stride"": 1, ""n_blocks"": 5}",COMPLETE
33,0.2658918716636467,2026-10-02 14:58:09.091368,2026-10-02 14:58:24.648801,0 days 00:00:15.557433,,,,,64.0,0.030125566519554933,32,5,3,0.025908230139437473,64,3,1,0.010871189917634168,128,5,1,0.04194832413083063,128.0,5.0,2.0,,,,,128,0.7509729379457619,8.0,4,SGD,0.00013207685064435545,0.7927441308699665,0.0006070240151325587,,,,"{""block_0_dropout"": 0.030125566519554933, ""block_0_filters"": 32, ""block_0_kernel"": 5, ""block_1_dropout"": 0.025908230139437473, ""block_1_filters"": 64, ""block_1_kernel"": 3, ""block_1_stride"": 1, ""block_2_dropout"": 0.010871189917634168, ""block_2_filters"": 128, ""block_2_kernel"": 5, ""block_2_stride"": 1, ""n_blocks"": 4}",PRUNED
