number,value,datetime_start,datetime_complete,duration,params_adam_beta1,params_adam_beta2,params_adam_lr,params_adam_wd,params_batch_size,params_block_0_dropout,params_block_0_filters,params_block_0_kernel,params_block_0_stride,params_block_1_dropout,params_block_1_filters,params_block_1_kernel,params_block_1_stride,params_block_2_dropout,params_block_2_filters,params_block_2_kernel,params_block_2_stride,params_block_3_dropout,params_block_3_filters,params_block_3_kernel,params_block_3_stride,params_fc_hidden,params_first_conv_filters,params_first_conv_kernel_size,params_lr_factor,params_lr_patience,params_n_blocks,params_optimizer,params_sgd_lr,params_sgd_momentum,params_sgd_wd,user_attrs_best_epoch,user_attrs_validation_accuracy,user_attrs_validation_macro_f1,state
62,0.7392387837203981,2026-10-01 13:54:58.208864,2026-10-01 13:59:51.584870,0 days 00:04:53.376006,0.8930270460520957,0.9091450436245055,0.0005298062385802017,1.4074624545521266e-06,64.0,0.015231612565613147,32,5,3,0.06586135951935558,64,3,2,0.05779168800885749,32,5,2,,,,,256,512,7,0.4603481244773586,5.0,3,Adam,,,,49.0,0.821656050955414,0.6568215164853821,COMPLETE
63,0.7393558574038912,2026-10-01 13:59:51.724545,2026-10-01 14:04:45.106742,0 days 00:04:53.382197,0.9045416852707546,0.9141691228425866,0.0007844341126470571,1.0045133837384582e-06,64.0,0.0101946447597864,32,5,3,0.07191177745727924,64,3,2,0.0664267015208934,32,5,2,,,,,256,512,7,0.4466087272478786,5.0,3,Adam,,,,47.0,0.802547770700637,0.6761639441071455,COMPLETE
64,0.7383071860626274,2026-10-01 14:04:45.239192,2026-10-01 14:09:38.604162,0 days 00:04:53.364970,0.9056691181733892,0.9010638632156276,0.0007854857001374707,3.1917719690632598e-06,64.0,0.01004355595464981,32,5,3,0.07253763112562095,64,3,2,0.07101757808832203,32,5,2,,,,,256,512,7,0.377312917610961,6.0,3,Adam,,,,49.0,0.8152866242038217,0.6613277479214329,COMPLETE
65,0.7275210717246898,2026-10-01 14:09:38.742815,2026-10-01 14:14:32.118912,0 days 00:04:53.376097,0.915587014561419,0.9143506044672188,0.0004527111291805203,1.0697077475435475e-06,64.0,0.017074043095119458,32,5,3,0.06917561635949196,64,3,2,0.07479660489990292,32,5,2,,,,,256,512,7,0.4951624040382895,6.0,3,Adam,,,,46.0,0.802547770700637,0.6524943727487428,COMPLETE
66,0.45568058708146375,2026-10-01 14:14:32.265168,2026-10-01 14:15:42.767805,0 days 00:01:10.502637,0.8969105755655573,0.9052338082565045,0.002030978845833044,2.1783330215179714e-06,64.0,0.011621720530349308,32,5,3,0.06404498729259926,64,3,2,0.06860522281289966,128,3,2,,,,,256,512,7,0.42750644826308754,5.0,3,Adam,,,,,,,PRUNED
67,0.4982564807365436,2026-10-01 14:15:42.898767,2026-10-01 14:17:17.120744,0 days 00:01:34.221977,0.9270644137919286,0.9242226871972867,0.0002920658920615018,4.751769796243287e-06,64.0,0.016247160632964316,32,5,3,0.056099426666610566,64,3,2,0.06518196535654994,64,5,1,,,,,256,512,7,0.45217151683455764,8.0,3,Adam,,,,,,,PRUNED
68,0.3856436334821013,2026-10-01 14:17:17.258141,2026-10-01 14:18:16.178685,0 days 00:00:58.920544,,,,,64.0,0.03172134367990322,32,5,3,0.08047356828534219,16,3,1,0.055403528890044476,32,5,2,,,,,256,512,7,0.4036802090952458,6.0,3,SGD,0.015048953805213266,0.7840149851776501,0.0002436372230999069,,,,PRUNED
69,0.4394349250011792,2026-10-01 14:18:16.311269,2026-10-01 14:19:20.618625,0 days 00:01:04.307356,0.8808738794775992,0.9317418464667674,0.00036231784110665543,0.009261796460991968,64.0,0.049576568000657996,8,5,3,0.08925406066724359,64,3,2,0.04985197345411573,32,5,2,,,,,256,512,7,0.5628392711360918,7.0,3,Adam,,,,,,,PRUNED
70,,2026-10-01 14:19:20.752245,2026-10-01 14:19:20.810672,0 days 00:00:00.058427,,,,,,0.042008462461602336,16,5,3,0.06071809534401269,64,5,2,0.08213939598642084,32,5,2,,,,,,256,7,,,3,,,,,,,,PRUNED
71,0.7224680445426579,2026-10-01 14:19:20.942883,2026-10-01 14:24:13.463741,0 days 00:04:52.520858,0.8946820068323077,0.9139167864433337,0.0006596956106527642,1.3424942104874118e-06,64.0,0.014815565265777413,32,5,3,0.07366356223524977,64,3,2,0.05934795909271627,32,5,2,,,,,256,512,7,0.47453478173610425,5.0,3,Adam,,,,41.0,0.7834394904458599,0.6614965986394558,COMPLETE
72,0.40970201450150645,2026-10-01 14:24:13.596826,2026-10-01 14:25:15.945498,0 days 00:01:02.348672,0.9054871900208168,0.9066016546845148,0.000497273153266969,1.3865890404570008e-06,64.0,0.026167755717770882,32,5,3,0.06694697204703684,64,3,2,0.055661429176919554,32,5,2,,,,,256,512,7,0.4463672837041951,5.0,3,Adam,,,,,,,PRUNED
73,0.7299760426912438,2026-10-01 14:25:16.079010,2026-10-01 14:30:01.744196,0 days 00:04:45.665186,0.9011792737289451,0.9231369186330319,0.0008607440544772338,3.2380787548214845e-06,64.0,0.01848095043048349,32,5,3,0.06983696004977606,64,3,2,0.06181126331649819,32,5,2,,,,,256,512,7,0.4050061382681704,7.0,3,Adam,,,,40.0,0.8089171974522293,0.6510348879302584,COMPLETE
74,0.43716802984711056,2026-10-01 14:30:01.884358,2026-10-01 14:31:06.580304,0 days 00:01:04.695946,0.9088726517218153,0.9108901306047138,0.000493733766026598,1.0680523879944673e-06,64.0,0.03587359710875368,32,5,3,0.07896108138811186,64,3,2,0.050519954125290104,32,5,2,,,,,256,512,7,0.512613908018533,6.0,3,Adam,,,,,,,PRUNED
75,0.7827978083365971,2026-10-01 14:31:06.712786,2026-10-01 14:36:00.079115,0 days 00:04:53.366329,0.9165713145445558,0.9339832806859694,0.0006276337215297025,2.4191292456445264e-06,64.0,0.014121761312272316,32,5,3,0.06329844514162616,64,3,2,0.055744259898297996,32,5,2,,,,,256,512,7,0.4910877750113183,5.0,3,Adam,,,,49.0,0.8535031847133758,0.7120924319598183,COMPLETE
76,0.45986003078738236,2026-10-01 14:36:00.228219,2026-10-01 14:37:22.434483,0 days 00:01:22.206264,0.9147765641344207,0.9328431124456749,0.0006570639053892351,0.00018488532913316777,64.0,0.03169770845403398,32,5,3,0.05616815564724146,64,3,2,0.06503969347524324,32,5,2,,,,,256,512,7,0.4930617570541851,10.0,3,Adam,,,,,,,PRUNED
77,0.3564195250457681,2026-10-01 14:37:22.577619,2026-10-01 14:38:21.272878,0 days 00:00:58.695259,0.9275420760994232,0.934218783481657,0.0002239161237736332,2.3578727665680927e-06,64.0,0.012754491373352198,32,5,3,0.06291888901706137,64,3,2,0.04715769312115113,32,3,2,,,,,256,512,7,0.6890988166391374,6.0,3,Adam,,,,,,,PRUNED
78,0.43409644747182896,2026-10-01 14:38:21.420289,2026-10-01 14:39:48.223262,0 days 00:01:26.802973,0.9192254896387405,0.951930839352067,0.00039623254534446007,9.434175081188874e-06,128.0,0.02010393052861428,32,5,3,0.04895358065215126,16,3,2,0.07488763720119299,128,5,1,,,,,256,512,7,0.5457487847471423,7.0,3,Adam,,,,,,,PRUNED
79,0.7651074455246145,2026-10-01 14:39:48.357688,2026-10-01 14:44:41.921779,0 days 00:04:53.564091,0.9368067918582274,0.9168242427854051,0.0003338891877569149,3.694749212735421e-06,64.0,0.010205606929194847,32,5,3,0.05949523816637425,64,3,2,0.06144924127198492,64,5,2,,,,,512,512,7,0.5975333881439188,5.0,3,Adam,,,,44.0,0.8407643312101911,0.689450559839038,COMPLETE
80,0.3535887084878673,2026-10-01 14:44:42.053647,2026-10-01 14:45:41.143427,0 days 00:00:59.089780,,,,,64.0,0.055896060133138206,32,5,3,0.0604615791550554,64,3,1,0.06158993778383392,64,5,2,,,,,512,512,7,0.5873984505341591,8.0,3,SGD,0.0005453277856609637,0.9123808579774355,0.00016286657854296688,,,,PRUNED
81,0.4195464591793421,2026-10-01 14:45:41.282302,2026-10-01 14:46:45.944868,0 days 00:01:04.662566,0.9366236405747749,0.9172431669676927,0.00032531758138907056,4.468339502227511e-06,64.0,0.0100505701082351,32,5,3,0.06900023153824963,64,3,2,0.055339833118012674,64,5,2,,,,,512,512,7,0.5411332421848088,5.0,3,Adam,,,,,,,PRUNED
82,0.7388703094087117,2026-10-01 14:46:46.077604,2026-10-01 14:51:36.813546,0 days 00:04:50.735942,0.942638635621547,0.9245077037813297,0.00044136795145484695,3.316645643798568e-06,64.0,0.01423641933751879,32,5,3,0.057925721679638956,64,3,2,0.06993095198238578,64,5,2,,,,,512,512,7,0.6038464988353343,5.0,3,Adam,,,,39.0,0.8152866242038217,0.6624539946136018,COMPLETE
83,0.7762169762230269,2026-10-01 14:51:36.949068,2026-10-01 14:56:30.461289,0 days 00:04:53.512221,0.9075885811297023,0.9435836165328547,0.00025228428802236775,7.2658738535591325e-06,64.0,0.0235800145979589,32,5,3,0.05809680010255696,64,3,2,0.05260091649244227,64,5,2,,,,,512,512,7,0.681043132266301,6.0,3,Adam,,,,38.0,0.8471337579617835,0.7053001944842702,COMPLETE
84,0.7527254561267089,2026-10-01 14:56:30.608055,2026-10-01 15:01:24.109433,0 days 00:04:53.501378,0.9626370969856431,0.9435683321754954,0.00024114174041470324,6.983737326820977e-06,64.0,0.028298883590437463,32,5,3,0.058008055069580296,64,3,2,0.05230847098018053,64,5,2,,,,,512,512,7,0.6775188383039071,6.0,3,Adam,,,,48.0,0.8343949044585988,0.6710560077948192,COMPLETE
85,0.4996768543351139,2026-10-01 15:01:24.242032,2026-10-01 15:02:58.242203,0 days 00:01:34.000171,0.9624016170377703,0.9369073247212701,0.00021732063958303488,6.610629098445149e-06,64.0,0.028059891054428108,32,5,3,0.05882455382635218,64,3,2,0.05271797385390742,64,5,2,,,,,512,512,7,0.6768731862144993,6.0,3,Adam,,,,,,,PRUNED
86,0.4245367879588875,2026-10-01 15:02:58.378616,2026-10-01 15:03:25.605792,0 days 00:00:27.227176,0.9860230709787869,0.9434551601216159,0.00026859087590207963,8.08615099068518e-06,64.0,0.023263170208204183,32,5,3,0.056513540479906726,64,3,2,0.042984975305721165,64,5,2,,,,,512,256,7,0.6489992748661599,7.0,3,Adam,,,,,,,PRUNED
87,,2026-10-01 15:03:25.736547,2026-10-01 15:03:25.787434,0 days 00:00:00.050887,,,,,,0.026156934677328,8,5,3,0.0543964063170608,64,5,2,0.08863066543205174,64,5,2,,,,,,512,7,,,3,,,,,,,,PRUNED
88,0.4022533484190213,2026-10-01 15:03:25.918512,2026-10-01 15:04:24.689065,0 days 00:00:58.770553,0.9720191485045411,0.9420151537388272,0.00014250246534343243,1.6088521290397068e-05,64.0,0.02155901187542795,32,5,3,0.06206816928767869,64,3,2,0.05228237091872392,64,5,2,,,,,512,512,7,0.6784956415146894,6.0,3,Adam,,,,,,,PRUNED
89,0.42287151350338914,2026-10-01 15:04:24.822311,2026-10-01 15:05:28.325117,0 days 00:01:03.502806,0.8832299754358536,0.9480380437893241,0.0003369977168936262,2.660944684642449e-05,64.0,0.036384494811864176,16,5,3,0.05179525790955185,64,3,2,0.05639379609924169,64,3,2,,,,,512,512,7,0.6352969199273113,5.0,3,Adam,,,,,,,PRUNED
90,0.7433344055587583,2026-10-01 15:05:28.465115,2026-10-01 15:10:22.023334,0 days 00:04:53.558219,0.9570224806502633,0.9272386683609212,0.0002567717816061754,1.1095673957411986e-05,64.0,0.029899660882399752,32,5,3,0.04694225694068587,64,3,2,0.015873361339023208,64,5,2,,,,,512,512,7,0.6856401047598104,12.0,3,Adam,,,,46.0,0.8089171974522293,0.6777516136652874,COMPLETE
91,0.413514987034323,2026-10-01 15:10:22.157706,2026-10-01 15:11:20.946697,0 days 00:00:58.788991,0.9789758959729097,0.9280883561751958,0.00023704629039080158,1.1711627766959725e-05,64.0,0.0298245362285366,32,5,3,0.043414556762533,64,3,2,0.022936763215267355,64,5,2,,,,,512,512,7,0.6950683847377097,11.0,3,Adam,,,,,,,PRUNED
92,0.7433131213964268,2026-10-01 15:11:21.081938,2026-10-01 15:16:14.654331,0 days 00:04:53.572393,0.9642314587500086,0.935872234050979,0.00030965858088007525,5.350091010212768e-06,64.0,0.01800582892607793,32,5,3,0.03820653115604618,64,3,2,0.015571774801701197,64,5,2,,,,,512,512,7,0.6594161583488288,6.0,3,Adam,,,,48.0,0.8089171974522293,0.6777090453406244,COMPLETE
93,0.7430336551688695,2026-10-01 15:16:14.787130,2026-10-01 15:21:08.378833,0 days 00:04:53.591703,0.9604741448879777,0.9219792798260856,0.00037333263630984795,3.55538711201332e-06,64.0,0.024441246872064067,32,5,3,0.04861722673506996,64,3,2,0.010109833091546793,64,5,2,,,,,512,512,7,0.6822971047007041,9.0,3,Adam,,,,48.0,0.8152866242038217,0.6707806861339174,COMPLETE
94,0.7600929450864264,2026-10-01 15:21:08.512909,2026-10-01 15:26:02.042914,0 days 00:04:53.530005,0.9496921739336314,0.9543996600189029,0.00024939470787730154,9.933352573338542e-06,64.0,0.02731510770767453,32,5,3,0.04775319757866946,64,3,2,0.060351280291564995,64,5,2,,,,,512,512,7,0.6989295360815778,13.0,3,Adam,,,,49.0,0.8280254777070064,0.6921604124658466,COMPLETE
95,0.7903769717966466,2026-10-01 15:26:02.176678,2026-10-01 15:30:55.276220,0 days 00:04:53.099542,0.90888343720651,0.9627847235242785,0.00045532517301358785,8.73351205490534e-06,64.0,0.027582304298760886,32,5,3,0.05424997498446316,64,3,2,0.060393196479112336,64,5,2,,,,,512,512,7,0.6277992902996291,7.0,3,Adam,,,,48.0,0.8598726114649682,0.720881332128325,COMPLETE
96,0.4296543008413205,2026-10-01 15:30:55.414191,2026-10-01 15:32:15.498155,0 days 00:01:20.083964,0.9450715152333726,0.9630685651947039,0.00018723928322502358,8.232199565506075e-06,128.0,0.02723203027398574,32,5,3,0.05076177567075587,64,3,2,0.06145252048942308,64,5,2,,,,,512,512,7,0.6011704095452689,13.0,3,Adam,,,,,,,PRUNED
97,0.424279412144408,2026-10-01 15:32:15.635984,2026-10-01 15:33:19.255148,0 days 00:01:03.619164,0.9502230151461298,0.9463259630519686,0.00015237810215378779,2.782853528164168e-06,64.0,0.0205361957094816,32,5,3,0.05402210365794795,16,3,2,0.06017251485908665,64,5,1,,,,,512,512,7,0.624617104165233,7.0,3,Adam,,,,,,,PRUNED
98,0.3678905001621313,2026-10-01 15:33:19.404676,2026-10-01 15:34:21.387825,0 days 00:01:01.983149,0.9551393849995798,0.9170084587739346,0.00020350788954997005,6.34334971745487e-06,64.0,0.032775489016265175,32,5,3,0.05462045964450323,64,3,2,0.06377246816992584,64,5,2,,,,,512,512,7,0.5719336807178156,5.0,3,Adam,,,,,,,PRUNED
99,0.4952174525541702,2026-10-01 15:34:21.535108,2026-10-01 15:36:13.994983,0 days 00:01:52.459875,0.9241812591434913,0.9544966205750335,0.00046498871597799727,4.267155856489476e-06,64.0,0.024933610362302988,32,5,3,0.05903012815973825,64,3,1,0.05761198948598327,64,5,2,,,,,512,512,7,0.6580403434862385,6.0,3,Adam,,,,,,,PRUNED
