number,value,datetime_start,datetime_complete,duration,params_adam_beta1,params_adam_beta2,params_adam_lr,params_adam_wd,params_batch_size,params_block_0_dropout,params_block_0_filters,params_block_0_kernel,params_block_0_stride,params_block_1_dropout,params_block_1_filters,params_block_1_kernel,params_block_1_stride,params_block_2_dropout,params_block_2_filters,params_block_2_kernel,params_block_2_stride,params_block_3_dropout,params_block_3_filters,params_block_3_kernel,params_block_3_stride,params_fc_hidden,params_first_conv_filters,params_first_conv_kernel_size,params_lr_factor,params_lr_patience,params_n_blocks,params_optimizer,params_sgd_lr,params_sgd_momentum,params_sgd_wd,user_attrs_best_epoch,user_attrs_validation_accuracy,user_attrs_validation_macro_f1,state
0,0.4269504989833933,2026-10-01 12:08:00.213267,2026-10-01 12:10:23.654143,0 days 00:02:23.440876,0.8926459276842719,0.9097574441892378,0.00853618986286683,0.0017123375973163992,128.0,0.08491983767203796,8,5,3,0.06506676052501416,16,3,2,0.06331731119758383,128,3,1,,,,,256,256,7,0.5105398159072941,12.0,3,Adam,,,,47.0,0.4585987261146497,0.395302271852137,COMPLETE
1,0.5124316546542493,2026-10-01 12:10:23.795099,2026-10-01 12:13:05.413713,0 days 00:02:41.618614,,,,,128.0,0.06381099809299767,16,7,3,0.08458637582367365,16,3,2,0.07950202923669918,128,3,1,0.07361716094628554,256.0,3.0,1.0,256,256,7,0.13813501017161417,9.0,4,SGD,0.038842777547031436,0.8807564567799918,2.106648601704221e-05,49.0,0.5477707006369427,0.47709260867155606,COMPLETE
2,0.5985367645076134,2026-10-01 12:13:05.556177,2026-10-01 12:14:33.201268,0 days 00:01:27.645091,0.970502281655888,0.9006945178400659,0.0007148510793512986,0.0018709365688887364,64.0,0.019710228429397403,8,7,3,0.07799960246887438,32,3,1,0.0884314531168946,128,3,2,0.05854080177240857,256.0,3.0,1.0,256,256,3,0.4064483815465394,11.0,4,Adam,,,,47.0,0.6496815286624203,0.5473920003528064,COMPLETE
3,,2026-10-01 12:14:33.340504,2026-10-01 12:14:33.388834,0 days 00:00:00.048330,,,,,,0.013319825261907952,8,7,3,0.05405074842498068,16,3,2,0.06690752475342215,32,5,2,0.08517722460303143,64.0,3.0,1.0,,256,5,,,4,,,,,,,,PRUNED
4,0.4539545909892668,2026-10-01 12:14:33.523308,2026-10-01 12:15:42.683082,0 days 00:01:09.159774,0.8642060160012445,0.9662838267338948,0.0016325185294676916,1.088399181393814e-06,128.0,0.09430569898630611,16,7,3,0.08354999801810943,32,5,1,0.04051268119438307,32,3,2,0.08983777818386056,256.0,3.0,1.0,128,128,5,0.10303695030773122,7.0,4,Adam,,,,41.0,0.5031847133757962,0.4047244686027374,COMPLETE
5,,2026-10-01 12:15:42.819062,2026-10-01 12:15:42.868005,0 days 00:00:00.048943,,,,,,0.03386821309135529,8,5,3,0.06192134961637233,32,5,2,0.09464127259176229,128,5,2,0.011391095487598068,64.0,3.0,1.0,,512,3,,,4,,,,,,,,PRUNED
6,0.4760070535830937,2026-10-01 12:15:43.007629,2026-10-01 12:22:30.773330,0 days 00:06:47.765701,0.897319321959215,0.9375207369687304,0.0039046790191830895,0.0036309591863459105,128.0,0.07264268170074757,8,5,3,0.0766691755978784,64,5,1,0.09219164973008243,64,3,1,,,,,512,512,7,0.1563891639045214,14.0,3,Adam,,,,42.0,0.5159235668789809,0.43609054028720656,COMPLETE
7,0.6831201914162728,2026-10-01 12:22:30.905861,2026-10-01 12:25:08.071674,0 days 00:02:37.165813,0.8891907455724319,0.9953910415382531,0.0026865309327169084,0.00043731009905162676,64.0,0.01768127184943912,32,5,3,0.03906608256471214,64,3,2,0.07263767854843282,32,5,2,,,,,128,512,3,0.5427381500174611,13.0,3,Adam,,,,49.0,0.7515923566878981,0.6146480261446473,COMPLETE
8,0.3488865108926267,2026-10-01 12:25:08.208896,2026-10-01 12:25:58.894357,0 days 00:00:50.685461,,,,,64.0,0.05261245937025092,8,5,3,0.06632739241428127,32,3,1,0.0627198023146117,64,5,2,,,,,128,512,5,0.6767143382943485,19.0,3,SGD,0.004333615420461955,0.9730247945451923,3.502761367842316e-05,,,,PRUNED
9,0.579704991287186,2026-10-01 12:25:59.032961,2026-10-01 12:27:17.114587,0 days 00:01:18.081626,,,,,128.0,0.06660485621018956,16,5,3,0.0991454627800606,16,5,1,0.07757839610123476,128,3,2,0.05547271352030715,256.0,3.0,1.0,512,128,7,0.6700371802304829,20.0,4,SGD,0.0520170752104338,0.7264731362679787,1.8934530915191556e-05,41.0,0.6178343949044586,0.5415755876699134,COMPLETE
10,0.30871984172939587,2026-10-01 12:27:17.249932,2026-10-01 12:27:54.881849,0 days 00:00:37.631917,0.9740823912733333,0.9925265187462552,0.00011276182231780688,1.0341591364653288e-05,64.0,0.04094807897017133,32,5,3,0.020186058701089256,64,3,2,0.02058969429153098,32,5,1,,,,,128,512,3,0.31969431875426024,5.0,3,Adam,,,,,,,PRUNED
11,0.6008630203583308,2026-10-01 12:27:55.017058,2026-10-01 12:29:29.371182,0 days 00:01:34.354124,0.9852476075458594,0.9052569298453264,0.0006793020634935387,0.0002502055290331605,64.0,0.014814626394445182,32,7,3,0.032021946338044796,64,3,1,0.042404344302139935,32,5,2,,,,,256,256,3,0.4354764493512368,13.0,3,Adam,,,,48.0,0.6369426751592356,0.564783365557426,COMPLETE
12,0.6712237380087662,2026-10-01 12:29:29.504365,2026-10-01 12:32:34.159728,0 days 00:03:04.655363,0.9352541592559447,0.9930885003326854,0.0005209314402340293,0.00019814443844464304,64.0,0.026478020292159198,32,7,3,0.03166898356738668,64,3,1,0.042720060046579134,32,5,2,,,,,128,512,3,0.5170355251346896,15.0,3,Adam,,,,45.0,0.7133757961783439,0.6290716798391885,COMPLETE
13,0.7251034085825144,2026-10-01 12:32:34.294572,2026-10-01 12:35:35.318109,0 days 00:03:01.023537,0.9315109299364555,0.9998112242293015,0.00014070491491018593,0.00011363827435224601,64.0,0.03139272888949878,32,7,3,0.04016602252388541,64,3,2,0.044151450596321834,32,5,2,,,,,128,512,3,0.5570146712928443,16.0,3,Adam,,,,48.0,0.7961783439490446,0.6540284732159842,COMPLETE
14,0.6442958545040007,2026-10-01 12:35:35.449348,2026-10-01 12:38:07.506889,0 days 00:02:32.057541,0.9318716418646565,0.9990823732096435,0.0001327434453791919,9.55134780433756e-05,64.0,0.042624450962023844,32,5,3,0.04838457746182886,64,3,2,0.01146628302509687,32,5,2,,,,,128,512,3,0.5838709878493044,17.0,3,Adam,,,,48.0,0.7006369426751592,0.5879547663328423,COMPLETE
15,0.7287889609491419,2026-10-01 12:38:07.644711,2026-10-01 12:41:05.756540,0 days 00:02:58.111829,0.9213243183690348,0.9721962561251553,0.00025729233443773033,4.9883283478741556e-05,64.0,0.02880494980143681,32,7,3,0.04099718722963988,64,3,2,0.029625896015544047,32,5,2,,,,,128,512,3,0.5824179444080841,16.0,3,Adam,,,,39.0,0.7961783439490446,0.6613995779492392,COMPLETE
16,0.21794960112740194,2026-10-01 12:41:05.891789,2026-10-01 12:41:41.473337,0 days 00:00:35.581548,,,,,64.0,0.051294530234118486,32,7,3,0.011174357304156696,64,3,2,0.029508163441416883,32,5,2,,,,,128,512,3,0.6068694101472294,17.0,3,SGD,0.00011877964997161456,0.7040126788907952,0.002144225215662579,,,,PRUNED
17,0.7192921259318983,2026-10-01 12:41:41.614313,2026-10-01 12:43:05.957132,0 days 00:01:24.342819,0.9358472486457605,0.9670040117834151,0.00023521174049224636,2.0631413579152434e-05,64.0,0.02913463512863242,32,7,3,0.0443667790654754,64,3,2,0.052009130567976514,64,5,2,,,,,128,128,3,0.43121096852959995,16.0,3,Adam,,,,47.0,0.7961783439490446,0.6424059079147518,COMPLETE
18,,2026-10-01 12:43:06.104409,2026-10-01 12:43:06.153900,0 days 00:00:00.049491,,,,,,0.03849544837102193,32,7,3,0.02497830360189208,64,5,2,0.02953200530730864,32,5,1,,,,,,512,3,,,3,,,,,,,,PRUNED
19,0.7202996620381408,2026-10-01 12:43:06.298130,2026-10-01 12:46:58.712560,0 days 00:03:52.414430,0.9183998142707185,0.9695127677511983,0.0003242560057389607,3.141357106505821e-05,64.0,0.05102027234242075,32,7,3,0.03921744854018367,64,3,2,0.053400397608472455,32,5,2,,,,,512,512,5,0.6254922236537674,18.0,3,Adam,,,,42.0,0.7834394904458599,0.6571598336304217,COMPLETE
20,0.7134896110429323,2026-10-01 12:46:58.850974,2026-10-01 12:48:23.126768,0 days 00:01:24.275794,0.9565955671894028,0.9790949698348181,0.00022685690887526595,4.156980040991266e-06,64.0,0.02507672441015709,32,7,3,0.05603183517904324,64,3,2,0.031523996982356986,64,5,2,,,,,128,128,3,0.3504549887040559,10.0,3,Adam,,,,44.0,0.7834394904458599,0.6435397316400048,COMPLETE
21,0.7420676556098058,2026-10-01 12:48:23.260138,2026-10-01 12:52:15.992604,0 days 00:03:52.732466,0.9199418771945558,0.951896221075001,0.00029406602637621415,4.467567446308041e-05,64.0,0.0496771757854852,32,7,3,0.03490993918261719,64,3,2,0.04805235718354789,32,5,2,,,,,512,512,5,0.6194487426679912,18.0,3,Adam,,,,46.0,0.8152866242038217,0.6688486870157898,COMPLETE
22,0.7100750432935357,2026-10-01 12:52:16.139025,2026-10-01 12:56:09.198354,0 days 00:03:53.059329,0.9125204023594949,0.9465489697841872,0.0003440109505808974,5.135436062013422e-05,64.0,0.04660819649783541,32,7,3,0.029821599014102203,64,3,2,0.05350209230281427,32,5,2,,,,,512,512,5,0.5766252454567228,15.0,3,Adam,,,,48.0,0.7770700636942676,0.6430800228928036,COMPLETE
23,0.35257655983598746,2026-10-01 12:56:09.334453,2026-10-01 12:57:00.506235,0 days 00:00:51.171782,0.9506894438187973,0.9491203097838994,0.00016980402472955243,6.701018584070851e-05,64.0,0.058227898569979515,32,7,3,0.0159951460314097,64,3,2,0.03673347225157317,32,5,2,,,,,512,512,5,0.49690072378668326,18.0,3,Adam,,,,,,,PRUNED
24,0.7580775858369415,2026-10-01 12:57:00.641353,2026-10-01 13:00:53.238648,0 days 00:03:52.597295,0.9175921377932784,0.9270072323447239,0.00041394734055933026,8.237966781367579e-06,64.0,0.0341541244032314,32,7,3,0.03983011716752606,64,3,2,0.017111735591124357,32,5,2,,,,,512,512,5,0.6401444482822,20.0,3,Adam,,,,32.0,0.8343949044585988,0.6817602672152842,COMPLETE
25,0.2822054479742788,2026-10-01 13:00:53.370019,2026-10-01 13:01:36.257153,0 days 00:00:42.887134,,,,,64.0,0.03864561255040886,16,7,3,0.04871519905618388,64,3,2,0.017710220255996393,32,5,2,,,,,512,512,5,0.6937085511944324,20.0,3,SGD,0.00010594134428257736,0.8319921111667751,0.0072142505027882504,,,,PRUNED
26,,2026-10-01 13:01:36.393992,2026-10-01 13:01:36.439615,0 days 00:00:00.045623,,,,,,0.02215093026129999,32,7,3,0.024980708488199884,64,5,2,0.022577244813317014,32,5,1,,,,,,512,5,,,3,,,,,,,,PRUNED
27,0.7715559917789216,2026-10-01 13:01:36.581212,2026-10-01 13:05:29.407037,0 days 00:03:52.825825,0.9096644819468499,0.9225122800880652,0.00045924571495658184,3.950504452548795e-06,64.0,0.07388044574715866,32,7,3,0.03577339511484833,64,3,2,0.016401535585158472,32,5,2,,,,,512,512,5,0.6335694781822909,19.0,3,Adam,,,,43.0,0.8407643312101911,0.7023476523476523,COMPLETE
28,0.7276257686262272,2026-10-01 13:05:29.552554,2026-10-01 13:06:57.659978,0 days 00:01:28.107424,0.8715929175923387,0.9195941732247738,0.0010154567131172602,4.136597219779617e-06,64.0,0.07933163035485069,32,7,3,0.03519218503649264,32,3,2,0.013451876891163003,32,5,2,,,,,512,128,5,0.6347682721012764,19.0,3,Adam,,,,39.0,0.8089171974522293,0.646334339800225,COMPLETE
29,0.31684301625533573,2026-10-01 13:06:57.799283,2026-10-01 13:07:43.914685,0 days 00:00:46.115402,0.9035922999709256,0.9266684021017846,0.00045260353985125446,8.8942994828069e-06,64.0,0.09090998946654429,16,7,3,0.025143075645440487,16,3,2,0.023613158146039745,64,3,1,,,,,512,512,5,0.6432416019241973,20.0,3,Adam,,,,,,,PRUNED
30,0.38357946764653394,2026-10-01 13:07:44.046598,2026-10-01 13:08:05.120045,0 days 00:00:21.073447,,,,,128.0,0.08257473735770193,32,7,3,0.050258123785527936,16,3,2,0.011635940706303478,128,5,2,,,,,512,256,5,0.4788992410050769,18.0,3,SGD,0.002111240265367905,0.9860873441297298,1.4504086346104061e-06,,,,PRUNED
31,0.48765789830872897,2026-10-01 13:08:05.252152,2026-10-01 13:09:19.719366,0 days 00:01:14.467214,0.9179220398843214,0.9312000096862666,0.0002624540410422756,1.029587670080003e-06,64.0,0.07410254160253182,32,7,3,0.0432871536411103,64,3,2,0.02682622386598362,32,5,2,,,,,512,512,5,0.5881623978582557,17.0,3,Adam,,,,,,,PRUNED
32,0.7491377756418033,2026-10-01 13:09:19.856737,2026-10-01 13:14:39.048363,0 days 00:05:19.191626,0.9111009560384936,0.9538280821850219,0.00040944615702599344,1.3588211746230057e-05,64.0,0.06111888420283367,32,7,3,0.03689251916800613,64,3,2,0.017756345611189165,32,5,2,,,,,512,512,7,0.6973524180889377,19.0,3,Adam,,,,42.0,0.8280254777070064,0.6702500735766002,COMPLETE
33,0.7176329521324063,2026-10-01 13:14:39.181861,2026-10-01 13:19:58.423487,0 days 00:05:19.241626,0.9088067326247373,0.9526960496787358,0.0009035503781606474,4.0818553469909975e-06,64.0,0.061220555934896934,32,7,3,0.03187971815419194,64,3,2,0.017382704384456608,32,5,2,,,,,512,512,7,0.6907474496633659,19.0,3,Adam,,,,46.0,0.7834394904458599,0.6518264138189528,COMPLETE
34,0.48772952166697414,2026-10-01 13:19:58.561643,2026-10-01 13:20:45.983137,0 days 00:00:47.421494,0.8863767393351042,0.917859032655799,0.00044750067659409524,1.3602372304467516e-05,64.0,0.06745422925166951,32,7,3,0.05830477841014827,64,3,2,0.016527897532307014,32,3,2,,,,,512,256,7,0.6486305104460713,19.0,3,Adam,,,,,,,PRUNED
35,0.376203853241432,2026-10-01 13:20:46.119174,2026-10-01 13:21:49.467856,0 days 00:01:03.348682,0.8817551474051443,0.957885878559131,0.0012472139091546353,2.7541060762540087e-06,64.0,0.05430993719285343,16,7,3,0.035405118042547375,16,3,2,0.0100058692612482,128,5,2,,,,,512,512,7,0.698747539149299,20.0,3,Adam,,,,,,,PRUNED
36,0.2847387371360439,2026-10-01 13:21:49.606463,2026-10-01 13:23:12.502628,0 days 00:01:22.896165,0.9025830193951357,0.9397807716867097,0.0005761619515736774,2.206062654269828e-05,128.0,0.07166263931471384,8,7,3,0.019743573793819153,32,3,2,0.08430899920956096,32,3,1,0.010348776473821666,128.0,3.0,1.0,512,512,7,0.6227092477901137,18.0,4,Adam,,,,,,,PRUNED
37,,2026-10-01 13:23:12.637012,2026-10-01 13:23:12.697073,0 days 00:00:00.060061,,,,,,0.060228758458294646,32,7,3,0.04536019128301325,64,5,2,0.035821127350918094,32,5,2,0.033882198714111376,128.0,3.0,1.0,,256,5,,,4,,,,,,,,PRUNED
38,0.39548279041728507,2026-10-01 13:23:12.830539,2026-10-01 13:24:17.388197,0 days 00:01:04.557658,0.9492284984383489,0.9276454176502715,0.0004021623744079632,8.369102489608603e-06,64.0,0.04587576410500221,8,7,3,0.06478170513147796,64,3,1,0.0239941354618508,128,5,2,,,,,256,512,5,0.5279316363337873,19.0,3,Adam,,,,,,,PRUNED
39,0.36269348435978754,2026-10-01 13:24:17.526905,2026-10-01 13:25:41.170151,0 days 00:01:23.643246,0.9220164231059415,0.9384332498865416,0.00031801753412736666,2.747352562244021e-06,128.0,0.099273359996291,32,7,3,0.02671473824281042,32,3,2,0.06315050629850871,32,3,2,,,,,512,512,7,0.6560841945781101,17.0,3,Adam,,,,,,,PRUNED
40,,2026-10-01 13:25:41.304525,2026-10-01 13:25:41.352731,0 days 00:00:00.048206,,,,,,0.07676200534653754,16,5,3,0.05255912665775386,16,5,2,0.049002673624941755,64,5,1,,,,,,128,5,,,3,,,,,,,,PRUNED
41,0.44320934497238634,2026-10-01 13:25:41.487245,2026-10-01 13:27:10.928953,0 days 00:01:29.441708,0.9229135527153128,0.9775924550691284,0.00019556722534877188,3.7804239845391716e-05,64.0,0.033958454812514915,32,7,3,0.03717028290567735,64,3,2,0.03559126173788896,32,5,2,,,,,512,512,7,0.5919833738179041,16.0,3,Adam,,,,,,,PRUNED
42,0.3776834213628873,2026-10-01 13:27:11.062850,2026-10-01 13:28:07.035187,0 days 00:00:55.972337,0.9109722357421751,0.9588537426694613,0.00028162581353109625,1.8326330780681194e-05,64.0,0.06622741658662598,32,7,3,0.042171103328399635,64,3,2,0.017558044409858344,32,5,2,,,,,256,512,5,0.5561765239070097,18.0,3,Adam,,,,,,,PRUNED
43,0.38781209465758215,2026-10-01 13:28:07.173597,2026-10-01 13:29:03.019857,0 days 00:00:55.846260,0.927241047089718,0.9152727970294953,0.008472172648968133,6.847534098503384e-06,64.0,0.0349234037079778,32,7,3,0.03570862061494826,64,3,2,0.025722873378117395,32,5,2,,,,,512,512,5,0.6129188052198634,15.0,3,Adam,,,,,,,PRUNED
44,0.38779286200800855,2026-10-01 13:29:03.159191,2026-10-01 13:30:07.369335,0 days 00:01:04.210144,0.9416963774453674,0.9827239320501698,0.00041076718701281147,3.301211258729374e-05,64.0,0.08652618913192886,32,7,3,0.04584622914341064,64,3,1,0.05866306536497208,32,5,2,,,,,512,512,7,0.6392077106402335,20.0,3,Adam,,,,,,,PRUNED
45,0.6943579186483317,2026-10-01 13:30:07.504757,2026-10-01 13:33:56.026866,0 days 00:03:48.522109,0.8981495727074053,0.9105187806149593,0.0006973301911771095,2.1654182620731383e-06,64.0,0.019101504145515605,8,7,3,0.02976342085760052,64,3,2,0.09875364272018551,32,5,2,,,,,512,512,5,0.6630571545875379,19.0,3,Adam,,,,38.0,0.7643312101910829,0.6243846271055805,COMPLETE
46,0.37779096447335814,2026-10-01 13:33:56.157314,2026-10-01 13:34:38.046731,0 days 00:00:41.889417,,,,,128.0,0.05607301632966134,32,5,3,0.020716235691407642,64,3,2,0.02068079180522268,32,5,2,,,,,256,512,5,0.24045218672601357,17.0,3,SGD,0.00380606600437781,0.8106156545052814,0.000508266792188062,,,,PRUNED
47,0.3776352959047691,2026-10-01 13:34:38.179332,2026-10-01 13:36:08.117983,0 days 00:01:29.938651,0.8513528566036567,0.959618456524673,0.00017463313699537237,1.423473671928851e-05,64.0,0.04428475028838972,32,7,3,0.039807647974040454,32,3,1,0.06789058297244757,128,3,2,,,,,512,512,7,0.5582752114639971,14.0,3,Adam,,,,,,,PRUNED
48,,2026-10-01 13:36:08.265266,2026-10-01 13:36:08.313722,0 days 00:00:00.048456,,,,,,0.04865685529798104,32,5,3,0.0734442015244738,64,5,2,0.014580686183942967,32,5,2,,,,,,256,3,,,3,,,,,,,,PRUNED
49,0.3904029143659725,2026-10-01 13:36:08.444764,2026-10-01 13:36:58.784113,0 days 00:00:50.339349,0.9125005097110397,0.9736650378426809,0.0005333758520331716,5.915353240505111e-05,64.0,0.06336895032210238,8,7,3,0.028611679323024324,64,3,2,0.03177880142927083,32,5,2,,,,,512,512,5,0.4749138571647241,18.0,3,Adam,,,,,,,PRUNED
50,,2026-10-01 13:36:58.921357,2026-10-01 13:36:58.985936,0 days 00:00:00.064579,,,,,,0.06944354803490223,32,7,3,0.0338122191111047,64,3,2,0.038879029615123045,32,5,2,0.040170574582532606,64.0,3.0,1.0,,512,3,,,4,,,,,,,,PRUNED
51,0.7179976415425318,2026-10-01 13:36:59.136003,2026-10-01 13:38:27.206945,0 days 00:01:28.070942,0.8745506479666669,0.92042821617824,0.0007768338614317681,5.5548475485011266e-06,64.0,0.08023254928650705,32,7,3,0.03666020178082099,32,3,2,0.014094982278806508,32,5,2,,,,,512,128,5,0.6198194304402602,19.0,3,Adam,,,,47.0,0.7898089171974523,0.6461863658876114,COMPLETE
52,0.48010228393774296,2026-10-01 13:38:27.344488,2026-10-01 13:38:59.806396,0 days 00:00:32.461908,0.8755896177414688,0.9207018757997234,0.0013071663794032439,1.8880437551674931e-06,64.0,0.07634091098340039,32,7,3,0.0404548938415406,32,3,2,0.0203104462337355,32,5,2,,,,,512,128,5,0.667779439598613,20.0,3,Adam,,,,,,,PRUNED
53,0.3931738379321744,2026-10-01 13:38:59.953033,2026-10-01 13:39:16.494594,0 days 00:00:16.541561,0.8571456688505021,0.929729258943666,0.0010603132297135002,6.07946501090776e-06,64.0,0.08644014879439335,32,7,3,0.09848999086414534,32,3,2,0.027762882393770588,32,5,2,,,,,512,128,5,0.6026811575194643,19.0,3,Adam,,,,,,,PRUNED
54,0.3582792776918109,2026-10-01 13:39:16.625806,2026-10-01 13:39:34.399141,0 days 00:00:17.773335,0.8983810554701719,0.9433631092042889,0.003361827879570972,0.0014252174514442003,64.0,0.029078619988976605,32,7,3,0.04641966309715353,32,3,2,0.012817694700251864,32,5,2,,,,,128,128,5,0.6672169164333183,16.0,3,Adam,,,,,,,PRUNED
55,0.4005731662815598,2026-10-01 13:39:34.535203,2026-10-01 13:39:59.687768,0 days 00:00:25.152565,0.8662976681467166,0.9025834053414092,0.00036677899824109797,1.241849921513694e-05,64.0,0.012498362181285447,32,7,3,0.03304825806741457,32,3,1,0.03265464151135893,64,5,2,,,,,512,128,5,0.5727000283806264,19.0,3,Adam,,,,,,,PRUNED
56,0.34200733847388193,2026-10-01 13:39:59.819885,2026-10-01 13:40:16.763296,0 days 00:00:16.943411,,,,,64.0,0.03908986031779134,32,7,3,0.02203610165239397,64,3,2,0.019208164064827515,32,5,1,,,,,128,128,3,0.639537357805127,8.0,3,SGD,0.0007157384001972213,0.9122686018399905,1.1334022118522116e-06,,,,PRUNED
57,0.7372527213291544,2026-10-01 13:40:16.898144,2026-10-01 13:43:44.000583,0 days 00:03:27.102439,0.8908878154419217,0.9110920483739551,0.0005606018435478221,1.6844346550525564e-06,64.0,0.022717719034686584,32,5,3,0.052884731798493734,64,3,2,0.04475459553393795,32,5,2,,,,,256,512,5,0.5290089765461501,17.0,3,Adam,,,,48.0,0.802547770700637,0.671957671957672,COMPLETE
58,,2026-10-01 13:43:44.131502,2026-10-01 13:43:44.180326,0 days 00:00:00.048824,,,,,,0.024296210111155223,16,5,3,0.05227118056759493,64,5,2,0.046033016275091335,32,5,2,,,,,,512,3,,,3,,,,,,,,PRUNED
59,0.753739781210145,2026-10-01 13:43:44.321643,2026-10-01 13:48:37.723524,0 days 00:04:53.401881,0.8907753153010929,0.910110112877082,0.0005496319776260834,1.5269723709122912e-06,64.0,0.030726515019314515,32,5,3,0.05914996178018221,64,3,2,0.0579451144324022,32,5,2,,,,,256,512,7,0.5258414482705112,5.0,3,Adam,,,,49.0,0.8280254777070064,0.6794540847132836,COMPLETE
60,0.41227626584314486,2026-10-01 13:48:37.865967,2026-10-01 13:50:04.553190,0 days 00:01:26.687223,0.8890957438482947,0.9085656887320557,0.0006154226552960712,1.5441039656685416e-06,128.0,0.020881359197247637,32,5,3,0.06008403244942404,64,3,2,0.05921925233525015,32,5,2,,,,,256,512,7,0.5247043625081356,12.0,3,Adam,,,,,,,PRUNED
61,0.7495074726222941,2026-10-01 13:50:04.684128,2026-10-01 13:54:58.062770,0 days 00:04:53.378642,0.8941521497622195,0.9108972161934918,0.0004574219948914448,1.362245733539938e-06,64.0,0.01699416308014814,32,5,3,0.05522851574419236,64,3,2,0.05711742949148995,32,5,2,,,,,256,512,7,0.545279193809968,5.0,3,Adam,,,,48.0,0.8152866242038217,0.6837283210407665,COMPLETE
