number,value,datetime_start,datetime_complete,duration,params_adam_beta1,params_adam_beta2,params_adam_lr,params_adam_wd,params_batch_size,params_block_0_dropout,params_block_0_filters,params_block_0_kernel,params_block_0_stride,params_block_1_dropout,params_block_1_filters,params_block_1_kernel,params_block_1_stride,params_block_2_dropout,params_block_2_filters,params_block_2_kernel,params_block_2_stride,params_block_3_dropout,params_block_3_filters,params_block_3_kernel,params_block_3_stride,params_fc_hidden,params_first_conv_filters,params_first_conv_kernel_size,params_lr_factor,params_lr_patience,params_n_blocks,params_optimizer,params_sgd_lr,params_sgd_momentum,params_sgd_wd,user_attrs_best_epoch,user_attrs_validation_accuracy,user_attrs_validation_macro_f1,state
60,0.8018575280763696,2026-09-26 17:44:21.551022,2026-09-26 17:51:06.770096,0 days 00:06:45.219074,0.9095144748256879,0.9921971843428119,0.00025184148692043674,0.004359756223448938,64.0,0.03331778741016267,32,5,3,0.014966417128444012,64,3,2,0.04963023143653014,64,5,2,,,,,512,512,3,0.32103942680055453,7.0,3,Adam,,,,50.0,0.8142857142857143,0.7894293418670248,COMPLETE
61,0.8240169128059873,2026-09-26 17:51:06.896565,2026-09-26 17:57:52.084959,0 days 00:06:45.188394,0.9418124681123269,0.9760795157756234,0.0003514298461814734,0.0015776980135758464,64.0,0.025846340045173572,32,5,3,0.02068584539467785,64,3,2,0.01911117175128966,64,5,2,,,,,512,512,3,0.3927783073100636,7.0,3,Adam,,,,35.0,0.8357142857142857,0.8123195398976888,COMPLETE
62,0.805202947204173,2026-09-26 17:57:52.220604,2026-09-26 18:04:37.399634,0 days 00:06:45.179030,0.9424686878683576,0.9776553600138713,0.00032095047405721343,0.001619073186018266,64.0,0.03430616413936399,32,5,3,0.010136326322919581,64,3,2,0.019711777911022087,64,5,2,,,,,512,512,3,0.38690369701959737,7.0,3,Adam,,,,49.0,0.8166666666666667,0.7937392277416793,COMPLETE
63,0.6102552374529038,2026-09-26 18:04:37.522506,2026-09-26 18:06:22.931504,0 days 00:01:45.408998,0.9453132297009765,0.9634385527434658,0.0007218353079274448,0.0023053210200272077,64.0,0.027501599417123827,32,5,3,0.023761058752378616,64,3,2,0.01648697035263494,64,5,2,,,,,512,512,3,0.4208233277167225,6.0,3,Adam,,,,,,,PRUNED
64,0.8131660354628483,2026-09-26 18:06:23.053219,2026-09-26 18:13:08.320410,0 days 00:06:45.267191,0.9624551279080541,0.9715583031195308,0.00025652205673296795,0.0006888657970356625,64.0,0.030355578294228885,32,5,3,0.031387154662112796,64,3,2,0.015365588389618339,64,5,2,,,,,512,512,3,0.2766320182254062,7.0,3,Adam,,,,50.0,0.8285714285714286,0.7977606423542678,COMPLETE
65,0.5512049853967174,2026-09-26 18:13:08.441458,2026-09-26 18:14:29.507172,0 days 00:01:21.065714,0.9878131400183527,0.9895056026215044,0.0003676354766396993,0.0012660533277514228,64.0,0.024213522159030068,32,5,3,0.016943736249855013,64,3,2,0.022366002136999075,64,5,2,,,,,128,512,3,0.2305803016332038,5.0,3,Adam,,,,,,,PRUNED
66,0.3661927312563724,2026-09-26 18:14:29.627552,2026-09-26 18:15:50.707188,0 days 00:01:21.079636,,,,,64.0,0.02873707881446734,32,5,3,0.03413782247212469,64,3,2,0.01898348518391841,32,5,2,,,,,512,512,3,0.3078125042133659,7.0,3,SGD,0.0005342519871776279,0.7745923635186397,1.0492785831968127e-06,,,,PRUNED
67,0.5494148430486026,2026-09-26 18:15:50.833194,2026-09-26 18:17:26.190398,0 days 00:01:35.357204,0.9311016337180376,0.9985321131867522,0.00047718682317597714,0.0028194901350489833,64.0,0.03632017799858943,32,7,3,0.01891919034458335,16,3,2,0.023730934374208024,64,3,2,,,,,512,512,3,0.4540489165045314,6.0,3,Adam,,,,,,,PRUNED
68,0.477833150753904,2026-09-26 18:17:26.311781,2026-09-26 18:18:49.814065,0 days 00:01:23.502284,0.9124790415647102,0.9741985845221199,0.00023272190080718307,0.006097081860967267,64.0,0.03240760132424058,32,5,3,0.011197776122227786,64,3,1,0.025358306886602656,64,5,1,,,,,512,512,3,0.3850447066664563,9.0,3,Adam,,,,,,,PRUNED
69,0.5015719459565764,2026-09-26 18:18:49.938800,2026-09-26 18:20:11.258315,0 days 00:01:21.319515,0.9053685317222275,0.9948205560034483,0.00017484621389199782,0.0018106983360542445,64.0,0.034681986307336946,32,5,3,0.020633382349711755,32,3,2,0.02143155127484775,64,5,2,,,,,256,512,3,0.17463798985634554,5.0,3,Adam,,,,,,,PRUNED
70,0.5626324250941261,2026-09-26 18:20:11.380617,2026-09-26 18:21:31.733074,0 days 00:01:20.352457,0.9145546604212857,0.96114812090191,0.0002859974818546172,0.0005450657427042943,64.0,0.04007425296539656,8,5,3,0.028707787336469323,64,3,2,0.019677869557691977,64,5,2,,,,,512,512,3,0.3304743571499521,10.0,3,Adam,,,,,,,PRUNED
71,0.8278167074394155,2026-09-26 18:21:31.858250,2026-09-26 18:28:17.114234,0 days 00:06:45.255984,0.9244744530010635,0.9874559862441812,0.0004305396253159398,0.0009636805802861551,64.0,0.026544244511832883,32,5,3,0.021220808405457,64,3,2,0.027758750512761582,64,5,2,,,,,512,512,3,0.35475455592144806,8.0,3,Adam,,,,46.0,0.8404761904761905,0.8151572244026405,COMPLETE
72,0.8040093538653323,2026-09-26 18:28:17.234281,2026-09-26 18:35:02.446630,0 days 00:06:45.212349,0.942266380530051,0.9872908822531844,0.00037127766854800503,0.0008314306988714012,64.0,0.027516856622487398,32,5,3,0.017903679645893948,64,3,2,0.028189054214772618,64,5,2,,,,,512,512,3,0.4144393634396745,9.0,3,Adam,,,,45.0,0.8119047619047619,0.7961139458259027,COMPLETE
73,0.8062400046737896,2026-09-26 18:35:02.570857,2026-09-26 18:41:47.822448,0 days 00:06:45.251591,0.9322342286273814,0.982135410237987,0.0004642986082233236,1.0772175341997885e-06,64.0,0.03317201024985586,32,5,3,0.02210992350476686,64,3,2,0.029864347164125227,64,5,2,,,,,512,512,3,0.1109863756107092,8.0,3,Adam,,,,42.0,0.819047619047619,0.7934323902999604,COMPLETE
74,0.5487584701009807,2026-09-26 18:41:47.950151,2026-09-26 18:42:33.356729,0 days 00:00:45.406578,0.9288705641489153,0.9765455413691294,0.00012422131828414962,0.0012838946566448848,64.0,0.025615407889975843,32,5,3,0.02354165106090672,64,3,2,0.024081675118751332,64,5,2,,,,,512,256,3,0.27530944623826764,7.0,3,Adam,,,,,,,PRUNED
75,0.5672506574813936,2026-09-26 18:42:33.477479,2026-09-26 18:44:02.637702,0 days 00:01:29.160223,0.9214747840956021,0.9696688421184076,0.0005680812969680896,0.002274583922851851,64.0,0.029665356601364684,32,5,3,0.014473031685311062,64,3,2,0.02593999209029528,64,5,2,,,,,128,512,3,0.3733339420350215,6.0,3,Adam,,,,,,,PRUNED
76,,2026-09-26 18:44:02.762174,2026-09-26 18:44:02.822329,0 days 00:00:00.060155,,,,,,0.03157171893751714,16,5,3,0.019511410419647032,64,5,2,0.033707402800870825,64,5,2,,,,,,512,7,,,3,,,,,,,,PRUNED
77,0.5690380283348169,2026-09-26 18:44:02.948511,2026-09-26 18:45:41.949294,0 days 00:01:39.000783,0.8990604419220509,0.9803193777128066,0.00021469342232392189,0.0009651775991823825,128.0,0.024267088165291426,32,5,3,0.03002776952703147,32,3,2,0.022655750581580168,64,5,2,,,,,512,512,3,0.244344491047222,7.0,3,Adam,,,,,,,PRUNED
78,0.547814545993579,2026-09-26 18:45:42.069447,2026-09-26 18:47:17.142674,0 days 00:01:35.073227,0.93807041745141,0.9888270859282314,0.0003587529578835138,0.0005211460533520212,64.0,0.029408050533282753,32,7,3,0.02452388695868977,16,3,2,0.02777047783241283,32,3,2,,,,,512,512,3,0.30913473280442955,8.0,3,Adam,,,,,,,PRUNED
79,0.5716614144464196,2026-09-26 18:47:17.264101,2026-09-26 18:48:46.609508,0 days 00:01:29.345407,,,,,64.0,0.0215181839166281,32,5,3,0.015750863771360448,64,3,2,0.02956978052762245,64,5,2,,,,,512,512,3,0.33982457685999046,20.0,3,SGD,0.012398064992488756,0.8892184229278168,0.00016905672562443432,,,,PRUNED
80,0.5545227611892856,2026-09-26 18:48:46.729654,2026-09-26 18:49:29.185615,0 days 00:00:42.455961,0.9159761919237027,0.9948963928228771,0.0006960501529022365,0.003933347987796204,64.0,0.026585976413450278,32,5,3,0.036651133408472564,64,3,1,0.025832973627755725,128,5,2,,,,,512,256,3,0.3534696212429444,10.0,3,Adam,,,,,,,PRUNED
81,0.8246997419917742,2026-09-26 18:49:29.312303,2026-09-26 18:56:14.517046,0 days 00:06:45.204743,0.9257051224532323,0.9849470792045495,0.0004268606216589057,0.0002807260822045732,64.0,0.025969685496408497,32,5,3,0.02270305979915219,64,3,2,0.02740643336454686,64,5,2,,,,,512,512,3,0.3520752670335406,8.0,3,Adam,,,,45.0,0.8357142857142857,0.8136851982692627,COMPLETE
82,0.5876383236180696,2026-09-26 18:56:14.637029,2026-09-26 18:58:08.155094,0 days 00:01:53.518065,0.9226878608993647,0.9836888956391936,0.0004357811889407868,0.0014819933855372402,64.0,0.028444877818132864,32,5,3,0.02178948056149186,64,3,2,0.03056438846438262,64,5,2,,,,,512,512,3,0.3851543701005328,7.0,3,Adam,,,,,,,PRUNED
83,0.6512801838662705,2026-09-26 18:58:08.276292,2026-09-26 19:00:18.026208,0 days 00:02:09.749916,0.9071566145085613,0.9932298549669464,0.00028207518422885983,0.00027945340542047994,64.0,0.04572536733200329,32,5,3,0.02077461391051323,64,3,2,0.024374844428024317,64,5,2,,,,,512,512,3,0.31552150043461924,8.0,3,Adam,,,,,,,PRUNED
84,0.7512091729540236,2026-09-26 19:00:18.147058,2026-09-26 19:05:26.113307,0 days 00:05:07.966249,0.9473488649328284,0.9745189990220434,0.00034215447670791864,0.00010220979518959577,64.0,0.026746732921639645,32,5,3,0.026603917536903034,64,3,2,0.027602379369779804,64,5,2,,,,,512,512,3,0.5081694481710859,9.0,3,Adam,,,,,,,PRUNED
85,0.8190287195978698,2026-09-26 19:05:26.234779,2026-09-26 19:14:48.061157,0 days 00:09:21.826378,0.9185935560178566,0.9394811641135348,0.0005676245480234267,0.0010905929479785436,64.0,0.023110010961708054,32,5,3,0.029186825409177025,64,3,2,0.01811495387399029,64,5,2,,,,,512,512,5,0.4466194247237106,7.0,3,Adam,,,,50.0,0.8357142857142857,0.802343153481454,COMPLETE
86,0.5792585696196104,2026-09-26 19:14:48.181250,2026-09-26 19:15:37.868182,0 days 00:00:49.686932,0.9346551136372793,0.9880271002701945,0.00029980067954116376,0.0019667766188549815,64.0,0.03097091530637734,32,5,3,0.023124815314814397,32,3,2,0.02838576646278408,64,5,1,,,,,512,128,7,0.21668079265046328,9.0,3,Adam,,,,,,,PRUNED
87,0.5275974873925748,2026-09-26 19:15:37.995008,2026-09-26 19:17:29.671010,0 days 00:01:51.676002,0.9646931451169939,0.9498960008461548,0.00019587238113363972,0.0004120732551478082,64.0,0.011017885243155615,8,5,3,0.018094449277026498,64,3,2,0.013060342364779546,64,5,2,,,,,256,512,5,0.406139227374929,6.0,3,Adam,,,,,,,PRUNED
88,,2026-09-26 19:17:29.792727,2026-09-26 19:17:29.848927,0 days 00:00:00.056200,,,,,,0.02516186041858954,32,5,3,0.02441191287793823,64,5,2,0.03152704737729064,128,5,2,,,,,,128,3,,,3,,,,,,,,PRUNED
89,0.5211648790326457,2026-09-26 19:17:29.970570,2026-09-26 19:19:19.196438,0 days 00:01:49.225868,0.924785576717381,0.9829710799230346,0.0005105841274500775,0.0006846444635305237,128.0,0.017762717725729783,16,5,3,0.012514086231872168,64,3,2,0.021698695279955937,64,3,2,,,,,128,512,5,0.29291734458574326,19.0,3,Adam,,,,,,,PRUNED
90,0.5764038894290706,2026-09-26 19:19:19.317895,2026-09-26 19:20:08.868809,0 days 00:00:49.550914,0.9000554082523715,0.9995677240156134,0.00022807491511512353,0.0025766930315724397,64.0,0.03581367281632734,32,7,3,0.010939232496784586,16,3,2,0.02647337388190301,64,5,2,,,,,512,128,3,0.27167499941194206,8.0,3,Adam,,,,,,,PRUNED
91,0.8176690722709559,2026-09-26 19:20:08.990347,2026-09-26 19:26:54.195116,0 days 00:06:45.204769,0.9219708710231941,0.9856678709324048,0.00041752311900060293,0.00019298788229795224,64.0,0.025552480588923183,32,5,3,0.021195265189698446,64,3,2,0.026752652409286093,64,5,2,,,,,512,512,3,0.36057511077834126,8.0,3,Adam,,,,49.0,0.8261904761904761,0.8091476683514355,COMPLETE
92,0.808235955573062,2026-09-26 19:26:54.315325,2026-09-26 19:33:39.549811,0 days 00:06:45.234486,0.9298637424924571,0.9903204052682779,0.0004357949013994339,0.00031826503980501885,64.0,0.014089534378438705,32,5,3,0.022706330365004513,64,3,2,0.025281877835439257,64,5,2,,,,,512,512,3,0.3385426500213798,8.0,3,Adam,,,,49.0,0.819047619047619,0.7974242920985052,COMPLETE
93,0.818939506921714,2026-09-26 19:33:39.670591,2026-09-26 19:40:24.905016,0 days 00:06:45.234425,0.9144291239566765,0.97946938283267,0.0003391097059861812,0.00043810237593910857,64.0,0.028113465444084797,32,5,3,0.021226060814060494,64,3,2,0.029157141790230625,64,5,2,,,,,512,512,3,0.36481080152429124,9.0,3,Adam,,,,40.0,0.8238095238095238,0.8140694900339044,COMPLETE
94,0.8092109522824684,2026-09-26 19:40:25.036684,2026-09-26 19:47:10.265494,0 days 00:06:45.228810,0.925770326065716,0.9856360119477453,0.00038669908488741676,1.4769916524380103e-06,64.0,0.03240442211117133,32,5,3,0.013931360380286235,64,3,2,0.023416097389435394,64,5,2,,,,,512,512,3,0.3482655063488779,7.0,3,Adam,,,,50.0,0.8214285714285714,0.7969933331363653,COMPLETE
95,0.7981615516594189,2026-09-26 19:47:10.385583,2026-09-26 19:53:55.664165,0 days 00:06:45.278582,0.9098284850562793,0.9766255438786906,0.0002713220502246161,0.0008513709631696819,64.0,0.02165211391117404,32,5,3,0.019269807474302066,64,3,2,0.027309236639914754,64,5,2,,,,,512,512,3,0.42881752153598474,6.0,3,Adam,,,,47.0,0.8119047619047619,0.784418341414076,COMPLETE
96,0.7940661005277487,2026-09-26 19:53:55.789608,2026-09-26 19:57:59.280837,0 days 00:04:03.491229,0.9173269730016045,0.9921295356800286,0.00031190915467052674,0.0010861974911033358,64.0,0.015614488612283544,32,5,3,0.024993172268807325,64,3,2,0.020167213424852216,64,5,2,,,,,512,256,5,0.3952163085745908,10.0,3,Adam,,,,32.0,0.7952380952380952,0.7928941058174022,COMPLETE
97,0.39143685635987446,2026-09-26 19:57:59.402006,2026-09-26 19:58:42.661369,0 days 00:00:43.259363,,,,,64.0,0.01897195127063624,32,5,3,0.017505616390234038,32,3,1,0.030016677974823783,128,5,2,,,,,512,128,3,0.25345739955317526,8.0,3,SGD,0.0004174537428364235,0.7586804659181255,0.0019039772735883953,,,,PRUNED
98,0.557376996106913,2026-09-26 19:58:42.786240,2026-09-26 20:00:35.140886,0 days 00:01:52.354646,0.855527207037704,0.9822345969587983,0.0005145020364900874,0.0006165905768181396,64.0,0.024122986215526925,32,5,3,0.016353821580558318,64,3,2,0.03275040957829414,32,5,2,,,,,512,512,5,0.32095896389806466,7.0,3,Adam,,,,,,,PRUNED
99,0.5316154539652119,2026-09-26 20:00:35.265747,2026-09-26 20:01:56.707446,0 days 00:01:21.441699,0.8851977085416206,0.934462075401207,0.0006682238664260866,0.0016973988465710573,64.0,0.03359313837683623,32,5,3,0.03169887531032783,64,3,2,0.024806836918861493,64,5,1,,,,,512,512,3,0.28848120306297653,9.0,3,Adam,,,,,,,PRUNED
