number,value,datetime_start,datetime_complete,duration,params_adam_beta1,params_adam_beta2,params_adam_lr,params_adam_wd,params_batch_size,params_block_0_dropout,params_block_0_filters,params_block_0_kernel,params_block_0_stride,params_block_1_dropout,params_block_1_filters,params_block_1_kernel,params_block_1_stride,params_block_2_dropout,params_block_2_filters,params_block_2_kernel,params_block_2_stride,params_block_3_dropout,params_block_3_filters,params_block_3_kernel,params_block_3_stride,params_fc_hidden,params_first_conv_filters,params_first_conv_kernel_size,params_lr_factor,params_lr_patience,params_n_blocks,params_optimizer,params_sgd_lr,params_sgd_momentum,params_sgd_wd,user_attrs_best_epoch,user_attrs_validation_accuracy,user_attrs_validation_macro_f1,state
0,0.49137027882108714,2026-09-26 14:26:00.356744,2026-09-26 14:32:19.971341,0 days 00:06:19.614597,0.8926459276842719,0.9097574441892378,0.00853618986286683,0.0017123375973163992,128.0,0.043297705632016875,8,5,3,0.03447411578889518,16,3,2,0.0336965827544817,128,3,1,,,,,256,256,7,0.5105398159072941,12.0,3,Adam,,,,50.0,0.4928571428571429,0.4898834147850314,COMPLETE
1,0.6581182223107689,2026-09-26 14:32:20.092292,2026-09-26 14:39:20.363742,0 days 00:07:00.271450,,,,,128.0,0.03391599915244341,16,7,3,0.043149500366077176,16,3,2,0.040889790771866295,128,3,1,0.03827429375390468,256.0,3.0,1.0,256,256,7,0.13813501017161417,9.0,4,SGD,0.038842777547031436,0.8807564567799918,2.106648601704221e-05,48.0,0.6642857142857143,0.6519507303358234,COMPLETE
2,0.6406385983939009,2026-09-26 14:39:20.490355,2026-09-26 14:43:20.101099,0 days 00:03:59.610744,0.970502281655888,0.9006945178400659,0.0007148510793512986,0.0018709365688887364,64.0,0.014315657079732178,8,7,3,0.04022204554172195,32,3,1,0.04485842360750871,128,3,2,0.03157368967662603,256.0,3.0,1.0,256,256,3,0.4064483815465394,11.0,4,Adam,,,,50.0,0.6428571428571429,0.6384200539306589,COMPLETE
3,,2026-09-26 14:43:20.223965,2026-09-26 14:43:20.282187,0 days 00:00:00.058222,,,,,,0.011475477894181312,8,7,3,0.029578110411102518,16,3,2,0.03529223322374318,32,5,2,0.04341209982356952,64.0,3.0,1.0,,256,5,,,4,,,,,,,,PRUNED
4,0.6834803324096117,2026-09-26 14:43:20.402917,2026-09-26 14:46:29.184920,0 days 00:03:08.782003,0.8642060160012445,0.9662838267338948,0.0016325185294676916,1.088399181393814e-06,128.0,0.04746919954946938,16,7,3,0.04268888800804863,32,5,1,0.023561191641948028,32,3,2,0.04548345697060469,256.0,3.0,1.0,128,128,5,0.10303695030773122,7.0,4,Adam,,,,50.0,0.6857142857142857,0.6812463791049377,COMPLETE
5,,2026-09-26 14:46:29.305153,2026-09-26 14:46:29.362570,0 days 00:00:00.057417,,,,,,0.020608094707269018,8,5,3,0.033076155385054366,32,5,2,0.04761834337411657,128,5,2,0.010618264661154697,64.0,3.0,1.0,,512,3,,,4,,,,,,,,PRUNED
6,0.46390597265726685,2026-09-26 14:46:29.483938,2026-09-26 15:04:04.085748,0 days 00:17:34.601810,0.897319321959215,0.9375207369687304,0.0039046790191830895,0.0036309591863459105,128.0,0.03784119186699892,8,5,3,0.03963074471016818,64,5,1,0.046529622102258854,64,3,1,,,,,512,512,7,0.1563891639045214,14.0,3,Adam,,,,41.0,0.47619047619047616,0.4516214691240575,COMPLETE
7,0.7214927105605523,2026-09-26 15:04:04.209356,2026-09-26 15:10:51.103020,0 days 00:06:46.893664,0.8891907455724319,0.9953910415382531,0.0026865309327169084,0.00043731009905162676,64.0,0.01341389859975072,32,5,3,0.02291825891764984,64,3,2,0.03783896824374792,32,5,2,,,,,128,512,3,0.5427381500174611,13.0,3,Adam,,,,40.0,0.7261904761904762,0.7167949449306285,COMPLETE
8,0.4338548714609872,2026-09-26 15:10:51.224886,2026-09-26 15:12:54.019920,0 days 00:02:02.795034,,,,,64.0,0.02893887083122263,8,5,3,0.035034396628569456,32,3,1,0.03343102325093853,64,5,2,,,,,128,512,5,0.6767143382943485,19.0,3,SGD,0.004333615420461955,0.9730247945451923,3.502761367842316e-05,,,,PRUNED
9,0.6839565603788469,2026-09-26 15:12:54.145897,2026-09-26 15:16:17.417291,0 days 00:03:23.271394,,,,,128.0,0.03515771387119536,16,5,3,0.04962020568002694,16,5,1,0.0400348427116599,128,3,2,0.030210094897914284,256.0,3.0,1.0,512,128,7,0.6700371802304829,20.0,4,SGD,0.0520170752104338,0.7264731362679787,1.8934530915191556e-05,44.0,0.6833333333333333,0.6845797874243604,COMPLETE
10,0.7043363805944597,2026-09-26 15:16:17.538312,2026-09-26 15:23:03.265277,0 days 00:06:45.726965,0.9740823912733333,0.9925265187462552,0.00011276182231780688,1.0341591364653288e-05,64.0,0.023754701764520596,32,5,3,0.014527137200484113,64,3,2,0.014706530796235993,32,5,1,,,,,128,512,3,0.31969431875426024,5.0,3,Adam,,,,50.0,0.7119047619047619,0.6967679992841574,COMPLETE
11,0.44013363180029846,2026-09-26 15:23:03.384571,2026-09-26 15:24:32.689764,0 days 00:01:29.305193,0.9802081999542284,0.9977378168152762,0.00010183198380260875,2.1744245799734513e-05,64.0,0.022318286681588435,32,5,3,0.01677726605432757,64,3,2,0.010525612628712329,32,5,1,,,,,128,512,3,0.33998841963022897,6.0,3,Adam,,,,,,,PRUNED
12,0.6948154723904478,2026-09-26 15:24:32.809529,2026-09-26 15:31:18.549732,0 days 00:06:45.740203,0.9352541592559447,0.9970073863865141,0.00010625721497327485,6.882249550497785e-05,64.0,0.019762087009814994,32,5,3,0.013516093306298486,64,3,2,0.011097604604760218,32,5,1,,,,,128,512,3,0.288047789641548,16.0,3,Adam,,,,42.0,0.6976190476190476,0.692011897161848,COMPLETE
13,0.7291911215161115,2026-09-26 15:31:18.685374,2026-09-26 15:38:04.479100,0 days 00:06:45.793726,0.9385682549867246,0.974621929750493,0.0004033771521316264,7.454028402976004e-05,64.0,0.02507983883065513,32,5,3,0.021841838309579524,64,3,2,0.021933859692286003,32,5,1,,,,,128,512,3,0.5238009967771712,5.0,3,Adam,,,,49.0,0.7404761904761905,0.7179060525560327,COMPLETE
14,0.7901823826536154,2026-09-26 15:38:04.601522,2026-09-26 15:44:51.491643,0 days 00:06:46.890121,0.9351960194918508,0.9718018220590466,0.00047537460882882,0.00013648168332183465,64.0,0.016095483955217565,32,5,3,0.022269408534706624,64,3,2,0.023689720688391487,32,5,2,,,,,128,512,3,0.5641097201580033,17.0,3,Adam,,,,45.0,0.8023809523809524,0.7779838129262785,COMPLETE
15,0.7046800362922041,2026-09-26 15:44:51.612903,2026-09-26 15:51:37.446402,0 days 00:06:45.833499,0.9361225388378104,0.9651541604823171,0.000484910543040467,0.0001543144786055623,64.0,0.029779959784782265,32,5,3,0.022970542684926508,64,3,2,0.024758370390742742,32,5,1,,,,,128,512,3,0.532356208768795,17.0,3,Adam,,,,35.0,0.7047619047619048,0.7045981678225033,COMPLETE
16,0.16587744349159378,2026-09-26 15:51:37.566927,2026-09-26 15:52:19.403932,0 days 00:00:41.837005,,,,,64.0,0.018072808935352697,32,5,3,0.02366195675267278,64,3,2,0.023456590762789557,32,5,1,,,,,128,128,3,0.5960473828772148,10.0,3,SGD,0.00011877964997161456,0.7040126788907952,0.002144225215662579,,,,PRUNED
17,0.8156470072965429,2026-09-26 15:52:19.523617,2026-09-26 15:59:04.667221,0 days 00:06:45.143604,0.934019866434424,0.9679096852252872,0.00040950529619796725,0.00021669605594536737,64.0,0.02769377601075036,32,5,3,0.018924996367090958,64,3,2,0.017505929472155235,64,5,2,,,,,512,512,3,0.4415440476937008,8.0,3,Adam,,,,49.0,0.8261904761904761,0.8051035384026096,COMPLETE
18,,2026-09-26 15:59:04.795863,2026-09-26 15:59:04.850151,0 days 00:00:00.054288,,,,,,0.028665484356836926,32,7,3,0.01829301392693443,64,5,2,0.017873548311241994,64,5,2,,,,,,512,3,,,3,,,,,,,,PRUNED
19,0.8466321527318962,2026-09-26 15:59:04.974215,2026-09-26 16:02:43.228418,0 days 00:03:38.254203,0.9183998142707185,0.9460324353979974,0.00032391908264676523,0.000614347565728299,64.0,0.01582048925402374,32,5,3,0.010146067407161887,64,3,2,0.028361255781309054,64,5,2,,,,,512,128,5,0.44424319562396564,8.0,3,Adam,,,,48.0,0.8642857142857143,0.828978591178078,COMPLETE
20,0.7810985172125229,2026-09-26 16:02:43.348234,2026-09-26 16:06:22.071918,0 days 00:03:38.723684,0.910126853584041,0.9404815295006005,0.00024277104929083703,0.0006146766172187698,64.0,0.040070599785071014,32,5,3,0.010106718451091255,64,3,2,0.02770062988994653,64,5,2,,,,,512,128,5,0.43637988697384167,8.0,3,Adam,,,,48.0,0.8023809523809524,0.7598160820440933,COMPLETE
21,0.803559221517052,2026-09-26 16:06:22.194700,2026-09-26 16:10:00.572859,0 days 00:03:38.378159,0.9206212879905904,0.9505187476455741,0.0008262131960839082,0.0003722271724564584,64.0,0.017056248108717656,32,5,3,0.028227661340082588,64,3,2,0.030702070895666258,64,5,2,,,,,512,128,5,0.4287550221226582,15.0,3,Adam,,,,44.0,0.8119047619047619,0.795213681129342,COMPLETE
22,0.7051210318222473,2026-09-26 16:10:00.692594,2026-09-26 16:13:39.013439,0 days 00:03:38.320845,0.9166853392618833,0.9465489697841872,0.0008227775607541779,0.009376311850039775,64.0,0.010816999453559826,32,5,3,0.0283395233310973,64,3,2,0.030006342313836237,64,5,2,,,,,512,128,5,0.4366035996322068,9.0,3,Adam,,,,46.0,0.719047619047619,0.6911944445968755,COMPLETE
23,0.7913549578273846,2026-09-26 16:13:39.134704,2026-09-26 16:17:17.509306,0 days 00:03:38.374602,0.9550417936050446,0.9520688503213399,0.00022473910171768343,0.00047414991021104433,64.0,0.026470697550553222,32,5,3,0.011293074182491356,64,3,2,0.0187638462053097,64,5,2,,,,,512,128,5,0.3747761163621297,14.0,3,Adam,,,,45.0,0.8095238095238095,0.7731861061309596,COMPLETE
24,0.8182655891023349,2026-09-26 16:17:17.630904,2026-09-26 16:20:55.914734,0 days 00:03:38.283830,0.9186674067314441,0.9264082500319535,0.0012207299788758509,0.00033542421317689423,64.0,0.01653718096831271,32,5,3,0.027174135201450934,64,3,2,0.02926184583876898,64,5,2,,,,,512,128,5,0.2636735892925425,8.0,3,Adam,,,,50.0,0.8285714285714286,0.8079597496332414,COMPLETE
25,0.3125040350169712,2026-09-26 16:20:56.034491,2026-09-26 16:21:38.871956,0 days 00:00:42.837465,,,,,64.0,0.03239910335590717,16,5,3,0.01809807947201328,64,3,2,0.02867485276984562,64,5,2,,,,,512,128,5,0.23628165663252845,7.0,3,SGD,0.00010594134428257736,0.8319921111667751,0.0072142505027882504,,,,PRUNED
26,0.487158745310142,2026-09-26 16:21:38.999495,2026-09-26 16:22:26.994942,0 days 00:00:47.995447,0.9517341854254886,0.9247324548786733,0.0014517926248817958,0.0010659757457058378,64.0,0.020796674976676595,32,7,3,0.014554458736476861,64,5,1,0.0170906033973183,64,5,2,,,,,512,128,5,0.2536173781015379,10.0,3,Adam,,,,,,,PRUNED
27,0.8176154405989196,2026-09-26 16:22:27.116474,2026-09-26 16:26:05.848432,0 days 00:03:38.731958,0.8742972404351793,0.9263143870457046,0.00019428487722432413,2.4575781217919335e-05,64.0,0.014956413459041093,32,5,3,0.025551582531549988,64,3,2,0.02711112799912863,64,5,2,,,,,512,128,5,0.4835685805165203,8.0,3,Adam,,,,47.0,0.8261904761904761,0.8090404050073631,COMPLETE
28,0.8218807274081454,2026-09-26 16:26:05.968718,2026-09-26 16:29:45.569155,0 days 00:03:39.600437,0.8543323937597795,0.926347897667003,0.00022245383584177246,8.381324592288779e-06,64.0,0.014477687605697509,32,5,3,0.0270403538971208,32,3,2,0.027108208931810793,64,5,2,,,,,512,128,5,0.19859602248687797,7.0,3,Adam,,,,49.0,0.830952380952381,0.81280907386391,COMPLETE
29,0.46228069831775764,2026-09-26 16:29:45.688628,2026-09-26 16:30:18.812534,0 days 00:00:33.123906,,,,,128.0,0.011960378552679365,16,5,3,0.03226626389364453,32,3,2,0.03263121099996297,64,3,2,,,,,512,128,5,0.19808068436104628,6.0,3,SGD,0.001526864498377944,0.976516857731363,1.2489433448065917e-06,,,,PRUNED
30,0.5261467254260515,2026-09-26 16:30:18.937597,2026-09-26 16:31:20.437476,0 days 00:01:01.499879,0.8514055973716538,0.9242895730975191,0.00018162591740718384,2.1442325771165205e-06,64.0,0.01856857911592729,32,5,3,0.035020748477567365,32,3,2,0.020779200216420716,64,5,2,,,,,512,128,5,0.19722783635474395,11.0,3,Adam,,,,,,,PRUNED
31,0.7942075681430654,2026-09-26 16:31:20.558059,2026-09-26 16:35:00.029882,0 days 00:03:39.471823,0.8698609555106146,0.925528743876056,0.00020531428340269626,7.892540672163861e-06,64.0,0.014652468260313523,32,5,3,0.02560975128208621,32,3,2,0.026518327434470565,64,5,2,,,,,512,128,5,0.48443584640210885,8.0,3,Adam,,,,49.0,0.8071428571428572,0.7812722791432737,COMPLETE
32,0.7549711561279882,2026-09-26 16:35:00.159087,2026-09-26 16:38:40.759046,0 days 00:03:40.599959,0.875979764962254,0.9174631420794467,0.0002989666192760804,2.103377285441285e-05,64.0,0.01589112718216447,32,5,3,0.02570957667691884,16,3,2,0.02635172519381572,64,5,2,,,,,512,128,5,0.3681568856934663,7.0,3,Adam,,,,49.0,0.7690476190476191,0.7408946932083571,COMPLETE
33,0.7772138391361081,2026-09-26 16:38:40.887183,2026-09-26 16:42:43.873514,0 days 00:04:02.986331,0.8517010212580509,0.9344428293703859,0.00014012470086881398,4.674708965878606e-06,64.0,0.013423413679471224,32,5,3,0.030695982789221823,32,3,2,0.03581508114656703,64,5,2,,,,,256,256,5,0.481072683022704,9.0,3,Adam,,,,50.0,0.780952380952381,0.7734752973198351,COMPLETE
34,0.5310199927956722,2026-09-26 16:42:43.993495,2026-09-26 16:43:47.473662,0 days 00:01:03.480167,0.882808268121089,0.9312134530189983,0.0003119977705155259,4.970999054647846e-05,64.0,0.01758245811369288,32,7,3,0.025928701466188704,16,3,2,0.03064195915783299,64,3,2,,,,,512,128,7,0.2611567366079189,6.0,3,Adam,,,,,,,PRUNED
35,0.8092629571016472,2026-09-26 16:43:47.594390,2026-09-26 16:48:26.057842,0 days 00:04:38.463452,0.9036388748507536,0.9140239033904245,0.000635395946234004,2.3933776545148283e-05,128.0,0.010405738981713958,16,7,3,0.036728799457229566,32,3,2,0.03233043427767448,128,5,2,,,,,512,256,5,0.6110722911351327,10.0,3,Adam,,,,45.0,0.8119047619047619,0.8066211522985326,COMPLETE
36,0.5030560579368066,2026-09-26 16:48:26.179640,2026-09-26 16:49:09.921785,0 days 00:00:43.742145,0.8626009528782859,0.9055277083897825,0.0001583317094793957,3.72923759469526e-06,64.0,0.022372047808126207,8,5,3,0.01996554307607371,16,3,1,0.035586857365159805,64,3,2,0.010597634049502713,128.0,3.0,1.0,256,128,5,0.20026142114630338,11.0,4,Adam,,,,,,,PRUNED
37,,2026-09-26 16:49:10.045187,2026-09-26 16:49:10.113977,0 days 00:00:00.068790,,,,,,0.013029450197437835,32,5,3,0.029967872091967298,32,5,2,0.025686620898574333,64,5,2,0.020932813287755418,128.0,3.0,1.0,,128,5,,,4,,,,,,,,PRUNED
38,0.4378539666910817,2026-09-26 16:49:10.234093,2026-09-26 16:50:33.981991,0 days 00:01:23.747898,0.9194016772397714,0.9437198080428416,0.001451995466568729,1.2065424343224898e-05,128.0,0.015280893852846682,8,7,3,0.048318751682676735,64,3,1,0.04345061050600174,128,5,2,,,,,512,256,7,0.16465376180538457,8.0,3,Adam,,,,,,,PRUNED
39,0.5184404634831223,2026-09-26 16:50:34.104731,2026-09-26 16:51:21.867073,0 days 00:00:47.762342,0.8780210149249745,0.9562676578883526,0.00032489797301752055,3.300757873811363e-05,64.0,0.048437149393099094,32,5,3,0.038280991752247494,32,3,2,0.028960801395133132,64,3,2,,,,,256,128,5,0.12843165192045394,9.0,3,Adam,,,,,,,PRUNED
40,,2026-09-26 16:51:21.988390,2026-09-26 16:51:22.043332,0 days 00:00:00.054942,,,,,,0.02081709366434362,8,5,3,0.04260594480700784,16,5,2,0.038622399909303315,64,5,2,,,,,,128,5,,,3,,,,,,,,PRUNED
41,0.8060879357493171,2026-09-26 16:51:22.164370,2026-09-26 16:55:00.745292,0 days 00:03:38.580922,0.9264950326317419,0.9193903385484121,0.0002680277933663984,0.0001468530949745679,64.0,0.04266300623740396,32,5,3,0.0202501994468502,64,3,2,0.013368792361544191,64,5,2,,,,,512,128,5,0.4848789081046711,8.0,3,Adam,,,,50.0,0.8142857142857143,0.79789015721292,COMPLETE
42,0.4616356377038032,2026-09-26 16:55:00.865447,2026-09-26 16:56:13.606136,0 days 00:01:12.740689,0.9518843147957365,0.9299725646599647,0.005747294757325974,0.00023300088314455748,64.0,0.01006348372120332,32,5,3,0.027121330537411073,64,3,2,0.02070981140277916,64,5,2,,,,,512,256,7,0.3997528732491534,7.0,3,Adam,,,,,,,PRUNED
43,0.42754332041866683,2026-09-26 16:56:13.726971,2026-09-26 16:56:57.656221,0 days 00:00:43.929250,0.8988852361534848,0.9117688887747369,0.009628132852793875,0.0007841165713351332,64.0,0.01891880182816039,32,5,3,0.024708917346903253,64,3,2,0.03190884069759697,64,5,2,,,,,512,128,5,0.4669596701555218,9.0,3,Adam,,,,,,,PRUNED
44,0.8375932614005542,2026-09-26 16:56:57.777599,2026-09-26 17:00:37.034520,0 days 00:03:39.256921,0.9084092370714442,0.9854127624359429,0.0004081616111759802,0.0018006828169631493,64.0,0.013134681572830584,32,5,3,0.012684650661571262,64,3,2,0.027825350160705455,128,5,2,,,,,512,128,5,0.31214369227731587,7.0,3,Adam,,,,48.0,0.8523809523809524,0.8228055704201561,COMPLETE
45,0.4059183277256321,2026-09-26 17:00:37.163039,2026-09-26 17:01:11.615571,0 days 00:00:34.452532,,,,,128.0,0.014607873244504063,16,5,3,0.015875404929632738,64,3,1,0.027642279257521336,128,5,2,,,,,512,128,5,0.30161516370433533,6.0,3,SGD,0.0015074752760663947,0.8031225167955225,0.00034998445702290147,,,,PRUNED
46,0.6061109905949434,2026-09-26 17:01:11.735389,2026-09-26 17:03:09.793963,0 days 00:01:58.058574,0.9111201965395136,0.9191142625629425,0.0010782047826995095,0.002415637360475707,64.0,0.012094614521168678,32,5,3,0.012508267047116526,64,3,2,0.033862208451463795,128,5,2,,,,,512,128,5,0.3368003549737872,5.0,3,Adam,,,,,,,PRUNED
47,0.45658903150277286,2026-09-26 17:03:09.921585,2026-09-26 17:03:53.913693,0 days 00:00:43.992108,0.8606280367264474,0.9842887076722968,0.0001489333296924368,0.0013438418530007832,64.0,0.01636199438670132,32,5,3,0.032620377658695014,32,3,2,0.022436150770081077,128,3,1,,,,,512,128,5,0.2863187351760158,7.0,3,Adam,,,,,,,PRUNED
48,,2026-09-26 17:03:54.034565,2026-09-26 17:03:54.087949,0 days 00:00:00.053384,,,,,,0.013462225568420583,32,5,3,0.01580836857986241,64,5,2,0.02466861652955754,128,5,2,,,,,,128,5,,,3,,,,,,,,PRUNED
49,0.535314499547556,2026-09-26 17:03:54.207783,2026-09-26 17:04:41.879518,0 days 00:00:47.671735,0.8875395928185117,0.9027488780320237,0.0005730115745132618,0.0032055706175296577,64.0,0.02287411436709877,8,7,3,0.010133947738233867,64,3,1,0.02880695455557129,128,5,2,,,,,256,128,5,0.2269849446793193,6.0,3,Adam,,,,,,,PRUNED
50,0.5234802055302925,2026-09-26 17:04:42.002383,2026-09-26 17:05:48.247887,0 days 00:01:06.245504,,,,,64.0,0.02000048628706967,32,5,3,0.013404137805697049,64,3,2,0.037242418326571915,128,5,1,0.026121371820940424,128.0,3.0,1.0,512,128,7,0.3995164949316775,11.0,4,SGD,0.008309236236001162,0.9128546252584973,0.00030506502896567934,,,,PRUNED
51,0.8195025899145536,2026-09-26 17:05:48.374542,2026-09-26 17:12:33.577133,0 days 00:06:45.202591,0.9239346086110508,0.9853993851052627,0.00041631632413175775,0.00033851866143507305,64.0,0.02588830072550925,32,5,3,0.0212897214868481,64,3,2,0.026926521236116677,64,5,2,,,,,512,512,3,0.35550181386468055,8.0,3,Adam,,,,48.0,0.8261904761904761,0.8128147036386311,COMPLETE
52,0.4616583696299379,2026-09-26 17:12:33.696404,2026-09-26 17:13:54.811309,0 days 00:01:21.114905,0.9267120654778612,0.9862356178291732,0.00248994064700964,0.006889842812937609,64.0,0.012152627464759848,32,5,3,0.02752478449966913,64,3,2,0.026894546269599452,64,5,2,,,,,512,512,3,0.359809891719409,8.0,3,Adam,,,,,,,PRUNED
53,0.8277908035628113,2026-09-26 17:13:54.933441,2026-09-26 17:20:40.151544,0 days 00:06:45.218103,0.9062897361846074,0.9865173927142602,0.0003475657508563947,0.0015909827759872078,64.0,0.03237687683888925,32,5,3,0.03100915998063902,64,3,2,0.02481073550387337,64,5,2,,,,,512,512,3,0.3106218059183957,7.0,3,Adam,,,,48.0,0.8380952380952381,0.8174863690303845,COMPLETE
54,0.821105814366972,2026-09-26 17:20:40.272481,2026-09-26 17:27:25.519515,0 days 00:06:45.247034,0.9010116418905547,0.9784511613293885,0.0003766639665223535,0.0017798468065187089,64.0,0.031107939381110866,32,5,3,0.011900957647890304,64,3,2,0.024842127197982806,64,5,2,,,,,512,512,3,0.3008396180753098,5.0,3,Adam,,,,45.0,0.8238095238095238,0.8184021049244203,COMPLETE
55,0.8114425881056415,2026-09-26 17:27:25.651105,2026-09-26 17:34:10.845874,0 days 00:06:45.194769,0.9046188907798475,0.9815495067717002,0.00036904490548338344,0.0018412299184843394,64.0,0.03156215397307417,32,5,3,0.012322132425533457,64,3,2,0.024922327310461775,64,5,2,,,,,512,512,3,0.3234683934385654,5.0,3,Adam,,,,44.0,0.8285714285714286,0.7943137476398544,COMPLETE
56,0.5869824291137264,2026-09-26 17:34:10.966889,2026-09-26 17:35:56.402733,0 days 00:01:45.435844,0.8913090053416541,0.9907614646892767,0.0005198858183039871,0.004381795990873207,64.0,0.03767868540010414,32,5,3,0.017028378818297288,64,3,2,0.03122697060408148,64,5,2,,,,,512,512,3,0.29653177454769564,6.0,3,Adam,,,,,,,PRUNED
57,0.5391089099587899,2026-09-26 17:35:56.525640,2026-09-26 17:37:35.910200,0 days 00:01:39.384560,0.8969193464277376,0.9791790622877226,0.00041051840363350397,0.000965488721332573,128.0,0.03600256986506107,32,5,3,0.013359762462262595,64,3,2,0.023219927905917797,32,5,1,,,,,512,512,3,0.3465954806409454,5.0,3,Adam,,,,,,,PRUNED
58,0.8318892369702794,2026-09-26 17:37:36.033591,2026-09-26 17:44:21.251198,0 days 00:06:45.217607,0.9279888239936741,0.9906876084718637,0.00025707330309491876,0.0014609722042245637,64.0,0.031223010271438232,32,5,3,0.02077000905509062,64,3,2,0.020805885315281707,64,5,2,,,,,512,512,3,0.3170460163523845,7.0,3,Adam,,,,48.0,0.8380952380952381,0.8256832358453207,COMPLETE
59,,2026-09-26 17:44:21.373550,2026-09-26 17:44:21.429936,0 days 00:00:00.056386,,,,,,0.03081602498623747,16,5,3,0.011673916242527022,32,5,2,0.020904116128354775,128,5,2,,,,,,512,3,,,3,,,,,,,,PRUNED
