number,value,datetime_start,datetime_complete,duration,params_adam_beta1,params_adam_beta2,params_adam_lr,params_adam_wd,params_batch_size,params_block_0_dropout,params_block_0_filters,params_block_0_kernel,params_block_0_stride,params_block_1_dropout,params_block_1_filters,params_block_1_kernel,params_block_1_stride,params_block_2_dropout,params_block_2_filters,params_block_2_kernel,params_block_2_stride,params_block_3_dropout,params_block_3_filters,params_block_3_kernel,params_block_3_stride,params_fc_hidden,params_first_conv_filters,params_first_conv_kernel_size,params_lr_factor,params_lr_patience,params_n_blocks,params_optimizer,params_sgd_lr,params_sgd_momentum,params_sgd_wd,user_attrs_best_epoch,user_attrs_validation_accuracy,user_attrs_validation_macro_f1,system_attrs_tpe:relative_params:0,state
0,0.482516966547466,2026-09-30 17:47:47.946227,2026-09-30 17:48:53.842972,0 days 00:01:05.896745,0.8926459276842719,0.9097574441892378,0.00853618986286683,0.0017123375973163992,128.0,0.043297705632016875,8,5,3,0.03447411578889518,16,3,2,0.0336965827544817,128,3,1,,,,,256,256,7,0.5105398159072941,12.0,3,Adam,,,,49.0,0.47419354838709676,0.4908403847078353,,COMPLETE
1,0.5120551249115206,2026-09-30 17:48:53.897319,2026-09-30 17:49:26.469722,0 days 00:00:32.572403,0.8662216683335181,0.9862240322449718,0.00014063366777718192,2.7155819552829413e-05,200.0,0.04687496940092468,8,7,3,0.024270133067743574,32,3,1,0.017948627261366895,64,5,2,,,,,256,128,3,0.4739788760965348,10.0,3,Adam,,,,46.0,0.5161290322580645,0.5079812175649766,,COMPLETE
2,,2026-09-30 17:49:26.606266,2026-09-30 17:49:26.635186,0 days 00:00:00.028920,,,,,,0.011016765069763807,16,7,3,0.026415316921425187,64,3,2,0.03533615026041694,32,5,2,0.04570235993959911,64.0,3.0,1.0,,512,3,,,4,,,,,,,,,PRUNED
3,0.6731896536147961,2026-09-30 17:49:26.774733,2026-09-30 17:51:45.332203,0 days 00:02:18.557470,,,,,128.0,0.01888431241882921,16,7,3,0.04887128330883843,64,3,2,0.030107160929154463,32,5,1,,,,,512,512,7,0.5032813284435271,17.0,3,SGD,0.002940074130903307,0.9858386316920742,9.294394155644998e-06,50.0,0.667741935483871,0.6786373717457214,,COMPLETE
4,0.5924583594477825,2026-09-30 17:51:45.384242,2026-09-30 17:52:58.859636,0 days 00:01:13.475394,,,,,64.0,0.01905983100791752,32,5,3,0.014538940849623563,64,3,1,0.01967409163601807,32,3,2,,,,,512,256,5,0.6322518545590703,17.0,3,SGD,0.0011159088550343414,0.9105271468723695,0.0038765111709116325,46.0,0.5870967741935483,0.5978199447020166,,COMPLETE
5,0.42609041112576357,2026-09-30 17:52:58.912325,2026-09-30 17:53:30.445771,0 days 00:00:31.533446,,,,,64.0,0.019489963499872004,16,5,3,0.024708632122377342,32,5,2,0.030105483724207682,128,3,1,,,,,128,128,5,0.6642751506117486,20.0,3,SGD,0.00011828996391101285,0.8871869658130787,5.110256715654393e-06,50.0,0.44193548387096776,0.4102453383805594,,COMPLETE
6,0.30006384402483427,2026-09-30 17:53:30.498513,2026-09-30 17:53:51.445864,0 days 00:00:20.947351,0.897319321959215,0.9375207369687304,0.0039046790191830895,0.0036309591863459105,200.0,0.03784119186699892,8,5,3,0.03963074471016818,64,5,1,0.046529622102258854,64,3,1,,,,,512,512,7,0.1563891639045214,14.0,3,Adam,,,,,,,,PRUNED
7,0.7329799413569074,2026-09-30 17:53:51.498024,2026-09-30 17:54:55.986891,0 days 00:01:04.488867,0.9836811392928472,0.9737159019779072,0.0020911960669713066,1.3174543864342763e-05,64.0,0.01206726884674431,16,7,3,0.04180744779074815,64,3,2,0.026358117776570794,64,3,2,,,,,512,256,5,0.43261243150684037,14.0,3,Adam,,,,35.0,0.7419354838709677,0.724024398842847,,COMPLETE
8,0.19114472614711925,2026-09-30 17:54:56.117552,2026-09-30 17:55:03.280964,0 days 00:00:07.163412,,,,,200.0,0.02735406596951892,32,7,3,0.044259593647532895,64,3,2,0.03301896711503516,32,5,1,0.031824671572637395,128.0,3.0,1.0,512,128,3,0.15666577645355703,15.0,4,SGD,0.0001614670469622493,0.7292256203994537,1.1827346017839088e-06,,,,,PRUNED
9,,2026-09-30 17:55:03.339988,2026-09-30 17:55:03.353266,0 days 00:00:00.013278,,,,,,0.042273389570690566,16,5,3,0.027159761095000734,16,5,2,0.04582092913984802,64,5,2,0.013651467071445343,256.0,3.0,1.0,,256,5,,,4,,,,,,,,,PRUNED
10,,2026-09-30 17:55:03.405076,2026-09-30 17:55:03.422989,0 days 00:00:00.017913,,,,,,0.044183489324351316,8,7,3,0.040235740261758295,64,3,2,0.026057880854674156,64,3,2,0.013107701648057437,256.0,3.0,1.0,,256,3,,,4,,,,,,,,"{""block_0_dropout"": 0.044183489324351316, ""block_0_filters"": 8, ""block_0_kernel"": 7, ""block_1_dropout"": 0.040235740261758295, ""block_1_filters"": 64, ""block_1_kernel"": 3, ""block_1_stride"": 2, ""block_2_dropout"": 0.026057880854674156, ""block_2_filters"": 64, ""block_2_kernel"": 3, ""block_2_stride"": 2, ""first_conv_filters"": 256, ""first_conv_kernel_size"": 3, ""n_blocks"": 4}",PRUNED
11,0.6576297065445089,2026-09-30 17:55:03.586624,2026-09-30 17:57:19.741186,0 days 00:02:16.154562,,,,,128.0,0.0249291234419154,16,7,3,0.044689760857455484,64,3,2,0.03491156113616455,32,5,1,,,,,512,512,7,0.3812231313327053,6.0,3,SGD,0.04805481567542263,0.9776211723045665,0.00018837804404186193,46.0,0.6483870967741936,0.6668723163148244,"{""block_0_dropout"": 0.0249291234419154, ""block_0_filters"": 16, ""block_0_kernel"": 7, ""block_1_dropout"": 0.044689760857455484, ""block_1_filters"": 64, ""block_1_kernel"": 3, ""block_1_stride"": 2, ""block_2_dropout"": 0.03491156113616455, ""block_2_filters"": 32, ""block_2_kernel"": 5, ""block_2_stride"": 1, ""first_conv_filters"": 512, ""first_conv_kernel_size"": 7, ""n_blocks"": 3}",COMPLETE
12,0.7759164678371184,2026-09-30 17:57:19.884223,2026-09-30 17:57:57.121988,0 days 00:00:37.237765,0.9781389931626887,0.9977352441512432,0.0006827657674063931,1.1020325755035114e-06,64.0,0.014818367374090799,16,7,3,0.03661754503331296,64,3,2,0.02334199577063257,64,3,2,,,,,512,128,5,0.3302501562203257,17.0,3,Adam,,,,50.0,0.7870967741935484,0.7647361614806885,"{""block_0_dropout"": 0.014818367374090799, ""block_0_filters"": 16, ""block_0_kernel"": 7, ""block_1_dropout"": 0.03661754503331296, ""block_1_filters"": 64, ""block_1_kernel"": 3, ""block_1_stride"": 2, ""block_2_dropout"": 0.02334199577063257, ""block_2_filters"": 64, ""block_2_kernel"": 3, ""block_2_stride"": 2, ""first_conv_filters"": 128, ""first_conv_kernel_size"": 5, ""n_blocks"": 3}",COMPLETE
13,0.7163791453618729,2026-09-30 17:57:57.174790,2026-09-30 17:58:57.397488,0 days 00:01:00.222698,0.9868173051833109,0.9969485387912187,0.0009208436400307075,1.0819881402414234e-06,64.0,0.019376234381767804,16,7,3,0.035662141778677985,64,3,2,0.02228141270425396,64,3,2,,,,,128,256,3,0.3038562213412807,20.0,3,Adam,,,,47.0,0.7258064516129032,0.7069518391108426,"{""block_0_dropout"": 0.019376234381767804, ""block_0_filters"": 16, ""block_0_kernel"": 7, ""block_1_dropout"": 0.035662141778677985, ""block_1_filters"": 64, ""block_1_kernel"": 3, ""block_1_stride"": 2, ""block_2_dropout"": 0.02228141270425396, ""block_2_filters"": 64, ""block_2_kernel"": 3, ""block_2_stride"": 2, ""first_conv_filters"": 256, ""first_conv_kernel_size"": 3, ""n_blocks"": 3}",COMPLETE
14,0.8118024969362068,2026-09-30 17:58:57.450811,2026-09-30 17:59:34.826478,0 days 00:00:37.375667,0.9808658540078671,0.9755278632179368,0.000806241559190014,1.7156386499262848e-06,64.0,0.014486879848419967,16,7,3,0.03317413789000419,64,5,2,0.030394748917894072,64,3,2,,,,,512,128,5,0.3427906866084083,10.0,3,Adam,,,,48.0,0.8032258064516129,0.8203791874208006,"{""block_0_dropout"": 0.014486879848419967, ""block_0_filters"": 16, ""block_0_kernel"": 7, ""block_1_dropout"": 0.03317413789000419, ""block_1_filters"": 64, ""block_1_kernel"": 5, ""block_1_stride"": 2, ""block_2_dropout"": 0.030394748917894072, ""block_2_filters"": 64, ""block_2_kernel"": 3, ""block_2_stride"": 2, ""first_conv_filters"": 128, ""first_conv_kernel_size"": 5, ""n_blocks"": 3}",COMPLETE
15,,2026-09-30 17:59:34.879377,2026-09-30 17:59:34.893631,0 days 00:00:00.014254,,,,,,0.016136463587920608,16,7,3,0.03278041326619901,64,5,2,0.03979351999312278,64,5,1,,,,,,128,5,,,3,,,,,,,,"{""block_0_dropout"": 0.016136463587920608, ""block_0_filters"": 16, ""block_0_kernel"": 7, ""block_1_dropout"": 0.03278041326619901, ""block_1_filters"": 64, ""block_1_kernel"": 5, ""block_1_stride"": 2, ""block_2_dropout"": 0.03979351999312278, ""block_2_filters"": 64, ""block_2_kernel"": 5, ""block_2_stride"": 1, ""first_conv_filters"": 128, ""first_conv_kernel_size"": 5, ""n_blocks"": 3}",PRUNED
16,0.8036527240308184,2026-09-30 17:59:34.947195,2026-09-30 18:00:12.349304,0 days 00:00:37.402109,0.9582539217734976,0.9681364134947078,0.0004815438851626752,1.2849922125186388e-06,64.0,0.019712917181094296,16,7,3,0.0206718704649609,64,3,2,0.014756224904676905,64,3,2,,,,,512,128,5,0.2795530120821651,5.0,3,Adam,,,,47.0,0.8129032258064516,0.7944022222551854,"{""block_0_dropout"": 0.019712917181094296, ""block_0_filters"": 16, ""block_0_kernel"": 7, ""block_1_dropout"": 0.0206718704649609, ""block_1_filters"": 64, ""block_1_kernel"": 3, ""block_1_stride"": 2, ""block_2_dropout"": 0.014756224904676905, ""block_2_filters"": 64, ""block_2_kernel"": 3, ""block_2_stride"": 2, ""first_conv_filters"": 128, ""first_conv_kernel_size"": 5, ""n_blocks"": 3}",COMPLETE
17,0.8396188523661434,2026-09-30 18:00:12.406334,2026-09-30 18:01:03.315776,0 days 00:00:50.909442,0.9430283036467014,0.961140446612646,0.0003735575616827247,8.73908759225226e-06,64.0,0.024833994592469343,32,7,3,0.02654643249349754,64,5,2,0.028216843581457835,64,3,2,,,,,512,128,5,0.24105013781084123,5.0,3,Adam,,,,41.0,0.8451612903225807,0.834076414409706,"{""block_0_dropout"": 0.024833994592469343, ""block_0_filters"": 32, ""block_0_kernel"": 7, ""block_1_dropout"": 0.02654643249349754, ""block_1_filters"": 64, ""block_1_kernel"": 5, ""block_1_stride"": 2, ""block_2_dropout"": 0.028216843581457835, ""block_2_filters"": 64, ""block_2_kernel"": 3, ""block_2_stride"": 2, ""first_conv_filters"": 128, ""first_conv_kernel_size"": 5, ""n_blocks"": 3}",COMPLETE
18,0.7714698084529589,2026-09-30 18:01:03.369133,2026-09-30 18:01:54.050395,0 days 00:00:50.681262,0.9376705801853921,0.948739352583034,0.0002195507726325955,2.2762261494649844e-05,64.0,0.04304832579357577,32,7,3,0.01669733179029146,32,5,2,0.026483811017218934,64,3,2,,,,,128,128,5,0.2559270486345429,8.0,3,Adam,,,,47.0,0.7677419354838709,0.7751976814220468,"{""block_0_dropout"": 0.04304832579357577, ""block_0_filters"": 32, ""block_0_kernel"": 7, ""block_1_dropout"": 0.01669733179029146, ""block_1_filters"": 32, ""block_1_kernel"": 5, ""block_1_stride"": 2, ""block_2_dropout"": 0.026483811017218934, ""block_2_filters"": 64, ""block_2_kernel"": 3, ""block_2_stride"": 2, ""first_conv_filters"": 128, ""first_conv_kernel_size"": 5, ""n_blocks"": 3}",COMPLETE
19,0.7797374759474862,2026-09-30 18:01:54.103957,2026-09-30 18:02:31.486823,0 days 00:00:37.382866,0.936224765269133,0.9563139401694781,0.00037770132366329244,8.874219323697064e-06,64.0,0.025023594782391675,16,7,3,0.03770082801679771,64,5,2,0.031863875326333134,64,3,2,,,,,256,128,5,0.10015726738282776,8.0,3,Adam,,,,49.0,0.7935483870967742,0.7659265647981982,"{""block_0_dropout"": 0.025023594782391675, ""block_0_filters"": 16, ""block_0_kernel"": 7, ""block_1_dropout"": 0.03770082801679771, ""block_1_filters"": 64, ""block_1_kernel"": 5, ""block_1_stride"": 2, ""block_2_dropout"": 0.031863875326333134, ""block_2_filters"": 64, ""block_2_kernel"": 3, ""block_2_stride"": 2, ""first_conv_filters"": 128, ""first_conv_kernel_size"": 5, ""n_blocks"": 3}",COMPLETE
20,0.8519285191425258,2026-09-30 18:02:31.539931,2026-09-30 18:03:21.619143,0 days 00:00:50.079212,0.9460892778929104,0.930773129663826,0.001426156947021378,0.0003700186971463657,64.0,0.023907481499322775,32,7,3,0.03592576133863148,64,5,2,0.02149236137455212,64,3,2,,,,,512,128,5,0.22035990106472414,10.0,3,Adam,,,,49.0,0.8580645161290322,0.8457925221560193,"{""block_0_dropout"": 0.023907481499322775, ""block_0_filters"": 32, ""block_0_kernel"": 7, ""block_1_dropout"": 0.03592576133863148, ""block_1_filters"": 64, ""block_1_kernel"": 5, ""block_1_stride"": 2, ""block_2_dropout"": 0.02149236137455212, ""block_2_filters"": 64, ""block_2_kernel"": 3, ""block_2_stride"": 2, ""first_conv_filters"": 128, ""first_conv_kernel_size"": 5, ""n_blocks"": 3}",COMPLETE
21,0.8358089539939797,2026-09-30 18:03:21.677541,2026-09-30 18:04:12.138663,0 days 00:00:50.461122,0.9407236467226323,0.9250529736632468,0.001366963257346023,0.0003922177685708697,64.0,0.01121189617250207,32,7,3,0.0240266136407808,64,5,2,0.023827423145745538,128,3,2,,,,,512,128,5,0.21776957916282064,10.0,3,Adam,,,,50.0,0.8419354838709677,0.8296824241169916,"{""block_0_dropout"": 0.01121189617250207, ""block_0_filters"": 32, ""block_0_kernel"": 7, ""block_1_dropout"": 0.0240266136407808, ""block_1_filters"": 64, ""block_1_kernel"": 5, ""block_1_stride"": 2, ""block_2_dropout"": 0.023827423145745538, ""block_2_filters"": 128, ""block_2_kernel"": 3, ""block_2_stride"": 2, ""first_conv_filters"": 128, ""first_conv_kernel_size"": 5, ""n_blocks"": 3}",COMPLETE
22,0.830523366448318,2026-09-30 18:04:12.281144,2026-09-30 18:05:02.369130,0 days 00:00:50.087986,0.9359794279130187,0.9218327324874406,0.0021123287751956075,0.0004135117542037691,64.0,0.015601047368275202,32,7,3,0.021140970671200618,64,5,2,0.02301339470003249,32,3,2,,,,,512,128,5,0.21981718178294515,8.0,3,Adam,,,,43.0,0.8354838709677419,0.825562861928894,"{""block_0_dropout"": 0.015601047368275202, ""block_0_filters"": 32, ""block_0_kernel"": 7, ""block_1_dropout"": 0.021140970671200618, ""block_1_filters"": 64, ""block_1_kernel"": 5, ""block_1_stride"": 2, ""block_2_dropout"": 0.02301339470003249, ""block_2_filters"": 32, ""block_2_kernel"": 3, ""block_2_stride"": 2, ""first_conv_filters"": 128, ""first_conv_kernel_size"": 5, ""n_blocks"": 3}",COMPLETE
23,0.7747908597347436,2026-09-30 18:05:02.422162,2026-09-30 18:05:52.763036,0 days 00:00:50.340874,0.9518350745515287,0.9324781105345611,0.0015800850894327036,0.00020297857018128089,64.0,0.022005987863227765,32,7,3,0.019421357982775566,64,5,2,0.037686269344490986,128,3,2,,,,,512,128,5,0.20469358479642785,10.0,3,Adam,,,,42.0,0.7774193548387097,0.7721623646307775,"{""block_0_dropout"": 0.022005987863227765, ""block_0_filters"": 32, ""block_0_kernel"": 7, ""block_1_dropout"": 0.019421357982775566, ""block_1_filters"": 64, ""block_1_kernel"": 5, ""block_1_stride"": 2, ""block_2_dropout"": 0.037686269344490986, ""block_2_filters"": 128, ""block_2_kernel"": 3, ""block_2_stride"": 2, ""first_conv_filters"": 128, ""first_conv_kernel_size"": 5, ""n_blocks"": 3}",COMPLETE
24,0.8459634566141156,2026-09-30 18:05:52.860447,2026-09-30 18:06:31.594851,0 days 00:00:38.734404,0.9141282466390387,0.902654717418507,0.0013465866600054475,0.00019005672658683822,64.0,0.023334836033152905,32,5,3,0.03715356147884013,64,5,2,0.017530979551651317,64,3,2,,,,,512,128,5,0.2018636735717436,12.0,3,Adam,,,,44.0,0.8516129032258064,0.8403140100024248,"{""block_0_dropout"": 0.023334836033152905, ""block_0_filters"": 32, ""block_0_kernel"": 5, ""block_1_dropout"": 0.03715356147884013, ""block_1_filters"": 64, ""block_1_kernel"": 5, ""block_1_stride"": 2, ""block_2_dropout"": 0.017530979551651317, ""block_2_filters"": 64, ""block_2_kernel"": 3, ""block_2_stride"": 2, ""first_conv_filters"": 128, ""first_conv_kernel_size"": 5, ""n_blocks"": 3}",COMPLETE
25,0.4456597775485217,2026-09-30 18:06:31.648850,2026-09-30 18:06:39.355937,0 days 00:00:07.707087,0.9112570204348669,0.9040424757993495,0.003989209418248697,7.104117985305419e-05,64.0,0.021961389364239428,32,5,3,0.03411162632350443,64,5,2,0.02579251748812899,64,3,2,,,,,512,128,5,0.10232058430824563,12.0,3,Adam,,,,,,,"{""block_0_dropout"": 0.021961389364239428, ""block_0_filters"": 32, ""block_0_kernel"": 5, ""block_1_dropout"": 0.03411162632350443, ""block_1_filters"": 64, ""block_1_kernel"": 5, ""block_1_stride"": 2, ""block_2_dropout"": 0.02579251748812899, ""block_2_filters"": 64, ""block_2_kernel"": 3, ""block_2_stride"": 2, ""first_conv_filters"": 128, ""first_conv_kernel_size"": 5, ""n_blocks"": 3}",PRUNED
26,0.49057903348288173,2026-09-30 18:06:39.409381,2026-09-30 18:06:45.791786,0 days 00:00:06.382405,0.9157458333755916,0.9158084845391674,0.0002957932866824026,0.00972091902542124,200.0,0.02134292598352322,32,5,3,0.026046981839435605,64,5,2,0.020640166678383122,64,3,2,,,,,128,128,5,0.16421727845111875,12.0,3,Adam,,,,,,,"{""block_0_dropout"": 0.02134292598352322, ""block_0_filters"": 32, ""block_0_kernel"": 5, ""block_1_dropout"": 0.026046981839435605, ""block_1_filters"": 64, ""block_1_kernel"": 5, ""block_1_stride"": 2, ""block_2_dropout"": 0.020640166678383122, ""block_2_filters"": 64, ""block_2_kernel"": 3, ""block_2_stride"": 2, ""first_conv_filters"": 128, ""first_conv_kernel_size"": 5, ""n_blocks"": 3}",PRUNED
27,0.4565588063895114,2026-09-30 18:06:45.844755,2026-09-30 18:06:55.592358,0 days 00:00:09.747603,0.9212051647540003,0.9001448561780961,0.0030005991967523822,0.00010747798040599813,128.0,0.03260340300522211,32,7,3,0.03178843741578495,64,5,2,0.0214843324153954,64,3,2,,,,,256,128,5,0.2630800985064201,6.0,3,Adam,,,,,,,"{""block_0_dropout"": 0.03260340300522211, ""block_0_filters"": 32, ""block_0_kernel"": 7, ""block_1_dropout"": 0.03178843741578495, ""block_1_filters"": 64, ""block_1_kernel"": 5, ""block_1_stride"": 2, ""block_2_dropout"": 0.0214843324153954, ""block_2_filters"": 64, ""block_2_kernel"": 3, ""block_2_stride"": 2, ""first_conv_filters"": 128, ""first_conv_kernel_size"": 5, ""n_blocks"": 3}",PRUNED
28,0.48490480308088935,2026-09-30 18:06:55.646121,2026-09-30 18:07:06.018988,0 days 00:00:10.372867,0.9636214470442166,0.9459049852550329,0.00011955064895858945,0.0009546651192881636,64.0,0.020657925244730434,32,7,3,0.0386427468391752,64,5,2,0.013386161458972694,32,3,2,,,,,512,128,5,0.36170079825562074,7.0,3,Adam,,,,,,,"{""block_0_dropout"": 0.020657925244730434, ""block_0_filters"": 32, ""block_0_kernel"": 7, ""block_1_dropout"": 0.0386427468391752, ""block_1_filters"": 64, ""block_1_kernel"": 5, ""block_1_stride"": 2, ""block_2_dropout"": 0.013386161458972694, ""block_2_filters"": 32, ""block_2_kernel"": 3, ""block_2_stride"": 2, ""first_conv_filters"": 128, ""first_conv_kernel_size"": 5, ""n_blocks"": 3}",PRUNED
29,0.5362784751033247,2026-09-30 18:07:06.072230,2026-09-30 18:07:31.508618,0 days 00:00:25.436388,0.895851554113311,0.9571935955260836,0.001160159626042823,3.693311528935008e-06,64.0,0.027741300677910412,32,7,3,0.026659930795126338,16,5,2,0.02895819246023,64,3,2,,,,,512,256,5,0.19601338476715532,11.0,3,Adam,,,,,,,"{""block_0_dropout"": 0.027741300677910412, ""block_0_filters"": 32, ""block_0_kernel"": 7, ""block_1_dropout"": 0.026659930795126338, ""block_1_filters"": 16, ""block_1_kernel"": 5, ""block_1_stride"": 2, ""block_2_dropout"": 0.02895819246023, ""block_2_filters"": 64, ""block_2_kernel"": 3, ""block_2_stride"": 2, ""first_conv_filters"": 256, ""first_conv_kernel_size"": 5, ""n_blocks"": 3}",PRUNED
30,,2026-09-30 18:07:31.562085,2026-09-30 18:07:31.579744,0 days 00:00:00.017659,,,,,,0.03187551533063708,8,5,3,0.03825308976121243,64,5,2,0.02099240751612096,64,3,2,0.048004419415554056,64.0,3.0,1.0,,128,5,,,4,,,,,,,,"{""block_0_dropout"": 0.03187551533063708, ""block_0_filters"": 8, ""block_0_kernel"": 5, ""block_1_dropout"": 0.03825308976121243, ""block_1_filters"": 64, ""block_1_kernel"": 5, ""block_1_stride"": 2, ""block_2_dropout"": 0.02099240751612096, ""block_2_filters"": 64, ""block_2_kernel"": 3, ""block_2_stride"": 2, ""first_conv_filters"": 128, ""first_conv_kernel_size"": 5, ""n_blocks"": 4}",PRUNED
31,0.8234824860635448,2026-09-30 18:07:31.633159,2026-09-30 18:08:21.851744,0 days 00:00:50.218585,0.9465095681609512,0.9261494923713249,0.0013322406272839346,0.00042533772450387196,64.0,0.03121237464318266,32,7,3,0.013080088497277357,64,5,2,0.025120761751952245,128,3,2,,,,,512,128,5,0.24000991496418644,9.0,3,Adam,,,,50.0,0.832258064516129,0.8147069076109605,"{""block_0_dropout"": 0.03121237464318266, ""block_0_filters"": 32, ""block_0_kernel"": 7, ""block_1_dropout"": 0.013080088497277357, ""block_1_filters"": 64, ""block_1_kernel"": 5, ""block_1_stride"": 2, ""block_2_dropout"": 0.025120761751952245, ""block_2_filters"": 128, ""block_2_kernel"": 3, ""block_2_stride"": 2, ""first_conv_filters"": 128, ""first_conv_kernel_size"": 5, ""n_blocks"": 3}",COMPLETE
32,0.8430758020722191,2026-09-30 18:08:21.905276,2026-09-30 18:09:00.901193,0 days 00:00:38.995917,0.9256884046272502,0.9167220815700857,0.0006959118025231637,0.0003899295238390239,64.0,0.028243159134676996,32,5,3,0.04117254845603338,64,5,2,0.013468952043781656,64,3,2,,,,,512,128,5,0.17833361684900773,13.0,3,Adam,,,,41.0,0.8516129032258064,0.8345387009186318,"{""block_0_dropout"": 0.028243159134676996, ""block_0_filters"": 32, ""block_0_kernel"": 5, ""block_1_dropout"": 0.04117254845603338, ""block_1_filters"": 64, ""block_1_kernel"": 5, ""block_1_stride"": 2, ""block_2_dropout"": 0.013468952043781656, ""block_2_filters"": 64, ""block_2_kernel"": 3, ""block_2_stride"": 2, ""first_conv_filters"": 128, ""first_conv_kernel_size"": 5, ""n_blocks"": 3}",COMPLETE
