number,value,datetime_start,datetime_complete,duration,params_adam_beta1,params_adam_beta2,params_adam_lr,params_adam_wd,params_batch_size,params_block_0_dropout,params_block_0_filters,params_block_0_kernel,params_block_0_stride,params_block_1_dropout,params_block_1_filters,params_block_1_kernel,params_block_1_stride,params_block_2_dropout,params_block_2_filters,params_block_2_kernel,params_block_2_stride,params_block_3_dropout,params_block_3_filters,params_block_3_kernel,params_block_3_stride,params_fc_hidden,params_first_conv_filters,params_first_conv_kernel_size,params_lr_factor,params_lr_patience,params_n_blocks,params_optimizer,params_sgd_lr,params_sgd_momentum,params_sgd_wd,user_attrs_best_epoch,user_attrs_validation_accuracy,user_attrs_validation_macro_f1,system_attrs_tpe:relative_params:0,state
61,0.5418986025920183,2026-09-30 18:18:53.584021,2026-09-30 18:19:02.765809,0 days 00:00:09.181788,0.8765904622301508,0.9838233814025796,0.0002775693786175867,0.0008660763545752304,64.0,0.028946247585052712,32,5,3,0.04911881437534958,64,5,2,0.013703720081528453,64,3,2,,,,,256,128,5,0.24365749722466717,13.0,3,Adam,,,,,,,"{""block_0_dropout"": 0.028946247585052712, ""block_0_filters"": 32, ""block_0_kernel"": 5, ""block_1_dropout"": 0.04911881437534958, ""block_1_filters"": 64, ""block_1_kernel"": 5, ""block_1_stride"": 2, ""block_2_dropout"": 0.013703720081528453, ""block_2_filters"": 64, ""block_2_kernel"": 3, ""block_2_stride"": 2, ""first_conv_filters"": 128, ""first_conv_kernel_size"": 5, ""n_blocks"": 3}",PRUNED
62,,2026-09-30 18:19:02.818483,2026-09-30 18:19:02.831381,0 days 00:00:00.012898,,,,,,0.026690331838800475,32,7,3,0.028871748379280023,64,5,2,0.026898618728798167,64,5,2,,,,,,128,5,,,3,,,,,,,,"{""block_0_dropout"": 0.026690331838800475, ""block_0_filters"": 32, ""block_0_kernel"": 7, ""block_1_dropout"": 0.028871748379280023, ""block_1_filters"": 64, ""block_1_kernel"": 5, ""block_1_stride"": 2, ""block_2_dropout"": 0.026898618728798167, ""block_2_filters"": 64, ""block_2_kernel"": 5, ""block_2_stride"": 2, ""first_conv_filters"": 128, ""first_conv_kernel_size"": 5, ""n_blocks"": 3}",PRUNED
63,0.8162467623276923,2026-09-30 18:19:02.881765,2026-09-30 18:19:59.995372,0 days 00:00:57.113607,0.9401323420695119,0.9702403733479231,0.00048172844086682347,0.0002833718550113207,64.0,0.01557151675656918,32,7,3,0.03542273489804842,64,5,2,0.024102496358341878,128,3,2,,,,,512,128,7,0.2072988216732592,12.0,3,Adam,,,,34.0,0.8258064516129032,0.8066870730424814,"{""block_0_dropout"": 0.01557151675656918, ""block_0_filters"": 32, ""block_0_kernel"": 7, ""block_1_dropout"": 0.03542273489804842, ""block_1_filters"": 64, ""block_1_kernel"": 5, ""block_1_stride"": 2, ""block_2_dropout"": 0.024102496358341878, ""block_2_filters"": 128, ""block_2_kernel"": 3, ""block_2_stride"": 2, ""first_conv_filters"": 128, ""first_conv_kernel_size"": 7, ""n_blocks"": 3}",COMPLETE
64,0.4103435149251849,2026-09-30 18:20:00.048591,2026-09-30 18:20:10.131277,0 days 00:00:10.082686,0.9109608012013533,0.9897494041025117,0.0017245163656116063,0.000601518008374288,64.0,0.010382316714195015,32,7,3,0.02139965431810456,64,5,2,0.02834063938978147,128,3,1,,,,,256,128,5,0.1577718139171708,13.0,3,Adam,,,,,,,"{""block_0_dropout"": 0.010382316714195015, ""block_0_filters"": 32, ""block_0_kernel"": 7, ""block_1_dropout"": 0.02139965431810456, ""block_1_filters"": 64, ""block_1_kernel"": 5, ""block_1_stride"": 2, ""block_2_dropout"": 0.02834063938978147, ""block_2_filters"": 128, ""block_2_kernel"": 3, ""block_2_stride"": 1, ""first_conv_filters"": 128, ""first_conv_kernel_size"": 5, ""n_blocks"": 3}",PRUNED
65,0.8128555993766806,2026-09-30 18:20:10.185229,2026-09-30 18:21:07.046373,0 days 00:00:56.861144,0.8687576480236141,0.9177698762452173,0.00019276575945571082,0.0047331647578864305,64.0,0.014171849190287305,32,7,3,0.036189167747746206,64,5,2,0.028365392726984358,128,3,2,,,,,128,128,7,0.2986734296453817,9.0,3,Adam,,,,47.0,0.8225806451612904,0.803130553592071,"{""block_0_dropout"": 0.014171849190287305, ""block_0_filters"": 32, ""block_0_kernel"": 7, ""block_1_dropout"": 0.036189167747746206, ""block_1_filters"": 64, ""block_1_kernel"": 5, ""block_1_stride"": 2, ""block_2_dropout"": 0.028365392726984358, ""block_2_filters"": 128, ""block_2_kernel"": 3, ""block_2_stride"": 2, ""first_conv_filters"": 128, ""first_conv_kernel_size"": 7, ""n_blocks"": 3}",COMPLETE
66,0.4256867156152355,2026-09-30 18:21:07.099703,2026-09-30 18:21:14.781816,0 days 00:00:07.682113,0.9329446694623391,0.9591220125645531,0.002573592247197524,0.0014188753454760397,64.0,0.015973373653763303,32,5,3,0.0402506917992298,64,5,2,0.015261310030613505,64,3,2,,,,,512,128,5,0.2197627594639145,12.0,3,Adam,,,,,,,"{""block_0_dropout"": 0.015973373653763303, ""block_0_filters"": 32, ""block_0_kernel"": 5, ""block_1_dropout"": 0.0402506917992298, ""block_1_filters"": 64, ""block_1_kernel"": 5, ""block_1_stride"": 2, ""block_2_dropout"": 0.015261310030613505, ""block_2_filters"": 64, ""block_2_kernel"": 3, ""block_2_stride"": 2, ""first_conv_filters"": 128, ""first_conv_kernel_size"": 5, ""n_blocks"": 3}",PRUNED
67,0.5104312377807566,2026-09-30 18:21:14.839465,2026-09-30 18:21:23.689114,0 days 00:00:08.849649,0.9160318752647316,0.963831505365791,0.0003517295041238869,1.5000651709220215e-05,128.0,0.025755411928844812,16,7,3,0.034915521764329556,64,5,2,0.02119876976342477,64,3,2,,,,,512,128,5,0.11119054148153873,14.0,3,Adam,,,,,,,"{""block_0_dropout"": 0.025755411928844812, ""block_0_filters"": 16, ""block_0_kernel"": 7, ""block_1_dropout"": 0.034915521764329556, ""block_1_filters"": 64, ""block_1_kernel"": 5, ""block_1_stride"": 2, ""block_2_dropout"": 0.02119876976342477, ""block_2_filters"": 64, ""block_2_kernel"": 3, ""block_2_stride"": 2, ""first_conv_filters"": 128, ""first_conv_kernel_size"": 5, ""n_blocks"": 3}",PRUNED
68,0.5121804463552584,2026-09-30 18:21:23.743723,2026-09-30 18:21:35.243127,0 days 00:00:11.499404,0.9045853777298378,0.9120549624954947,0.0006544697101846979,2.0224489027408134e-06,64.0,0.015020186008308107,32,7,3,0.030904924006668194,64,3,2,0.020102752019466097,128,3,2,,,,,512,128,7,0.13877415494253462,15.0,3,Adam,,,,,,,"{""block_0_dropout"": 0.015020186008308107, ""block_0_filters"": 32, ""block_0_kernel"": 7, ""block_1_dropout"": 0.030904924006668194, ""block_1_filters"": 64, ""block_1_kernel"": 3, ""block_1_stride"": 2, ""block_2_dropout"": 0.020102752019466097, ""block_2_filters"": 128, ""block_2_kernel"": 3, ""block_2_stride"": 2, ""first_conv_filters"": 128, ""first_conv_kernel_size"": 7, ""n_blocks"": 3}",PRUNED
69,0.5678519973268445,2026-09-30 18:21:35.296740,2026-09-30 18:21:45.381417,0 days 00:00:10.084677,0.9562106827779056,0.935214064027681,0.0010754517828831405,0.0001386450515599012,200.0,0.012622986962693225,32,7,3,0.029774982003025068,64,5,2,0.026012911369295927,128,3,2,,,,,256,128,7,0.25544460037783595,10.0,3,Adam,,,,,,,"{""block_0_dropout"": 0.012622986962693225, ""block_0_filters"": 32, ""block_0_kernel"": 7, ""block_1_dropout"": 0.029774982003025068, ""block_1_filters"": 64, ""block_1_kernel"": 5, ""block_1_stride"": 2, ""block_2_dropout"": 0.026012911369295927, ""block_2_filters"": 128, ""block_2_kernel"": 3, ""block_2_stride"": 2, ""first_conv_filters"": 128, ""first_conv_kernel_size"": 7, ""n_blocks"": 3}",PRUNED
70,0.566660869183286,2026-09-30 18:21:45.438166,2026-09-30 18:21:56.178020,0 days 00:00:10.739854,0.9482416853070691,0.9746478859957699,0.0013360360402624456,0.00047731446119320863,64.0,0.029670747173585324,32,5,3,0.048087229696980066,64,5,2,0.022883312897425297,64,3,2,,,,,512,128,5,0.3812185730535196,19.0,3,Adam,,,,,,,"{""block_0_dropout"": 0.029670747173585324, ""block_0_filters"": 32, ""block_0_kernel"": 5, ""block_1_dropout"": 0.048087229696980066, ""block_1_filters"": 64, ""block_1_kernel"": 5, ""block_1_stride"": 2, ""block_2_dropout"": 0.022883312897425297, ""block_2_filters"": 64, ""block_2_kernel"": 3, ""block_2_stride"": 2, ""first_conv_filters"": 128, ""first_conv_kernel_size"": 5, ""n_blocks"": 3}",PRUNED
71,0.5218092672401935,2026-09-30 18:21:56.232009,2026-09-30 18:22:02.571838,0 days 00:00:06.339829,0.8801205883056028,0.905771098195957,0.0009021472317773331,4.553045016650992e-05,64.0,0.024479652691578035,16,5,3,0.04833623718440059,64,5,2,0.014041658018708608,64,3,2,,,,,512,128,5,0.12707549991626604,13.0,3,Adam,,,,,,,"{""block_0_dropout"": 0.024479652691578035, ""block_0_filters"": 16, ""block_0_kernel"": 5, ""block_1_dropout"": 0.04833623718440059, ""block_1_filters"": 64, ""block_1_kernel"": 5, ""block_1_stride"": 2, ""block_2_dropout"": 0.014041658018708608, ""block_2_filters"": 64, ""block_2_kernel"": 3, ""block_2_stride"": 2, ""first_conv_filters"": 128, ""first_conv_kernel_size"": 5, ""n_blocks"": 3}",PRUNED
72,0.864678565162436,2026-09-30 18:22:02.629676,2026-09-30 18:22:52.932999,0 days 00:00:50.303323,0.8915999775886155,0.9100648037873154,0.000917340519581857,6.081699532311203e-06,64.0,0.018913063660973593,32,7,3,0.02617370256293071,64,5,2,0.031900880878865466,64,3,2,,,,,512,128,5,0.17168108726196268,14.0,3,Adam,,,,50.0,0.8709677419354839,0.8583893883893883,"{""block_0_dropout"": 0.018913063660973593, ""block_0_filters"": 32, ""block_0_kernel"": 7, ""block_1_dropout"": 0.02617370256293071, ""block_1_filters"": 64, ""block_1_kernel"": 5, ""block_1_stride"": 2, ""block_2_dropout"": 0.031900880878865466, ""block_2_filters"": 64, ""block_2_kernel"": 3, ""block_2_stride"": 2, ""first_conv_filters"": 128, ""first_conv_kernel_size"": 5, ""n_blocks"": 3}",COMPLETE
73,0.8354946222089947,2026-09-30 18:22:53.013817,2026-09-30 18:23:43.479104,0 days 00:00:50.465287,0.8886509677391227,0.9987800781374202,0.0005488233985645245,3.495646648767446e-06,64.0,0.011616413576475776,32,7,3,0.023066252690556368,64,5,2,0.036325778613377324,64,3,2,,,,,512,128,5,0.173695632220167,14.0,3,Adam,,,,49.0,0.8451612903225807,0.8258279540954087,"{""block_0_dropout"": 0.011616413576475776, ""block_0_filters"": 32, ""block_0_kernel"": 7, ""block_1_dropout"": 0.023066252690556368, ""block_1_filters"": 64, ""block_1_kernel"": 5, ""block_1_stride"": 2, ""block_2_dropout"": 0.036325778613377324, ""block_2_filters"": 64, ""block_2_kernel"": 3, ""block_2_stride"": 2, ""first_conv_filters"": 128, ""first_conv_kernel_size"": 5, ""n_blocks"": 3}",COMPLETE
74,0.45783624405781465,2026-09-30 18:23:43.612890,2026-09-30 18:23:51.412551,0 days 00:00:07.799661,0.8898097174194932,0.9096689777521357,0.0001029969038139554,5.462498658178477e-06,64.0,0.03181240985673293,32,5,3,0.04670586484937444,64,5,2,0.01965695292007605,64,3,2,,,,,512,128,5,0.19292590892008465,14.0,3,Adam,,,,,,,"{""block_0_dropout"": 0.03181240985673293, ""block_0_filters"": 32, ""block_0_kernel"": 5, ""block_1_dropout"": 0.04670586484937444, ""block_1_filters"": 64, ""block_1_kernel"": 5, ""block_1_stride"": 2, ""block_2_dropout"": 0.01965695292007605, ""block_2_filters"": 64, ""block_2_kernel"": 3, ""block_2_stride"": 2, ""first_conv_filters"": 128, ""first_conv_kernel_size"": 5, ""n_blocks"": 3}",PRUNED
75,0.8555324337081517,2026-09-30 18:23:51.466562,2026-09-30 18:24:41.903629,0 days 00:00:50.437067,0.8966850251171317,0.9198208480681813,0.0007374028330079317,1.996342549954407e-05,64.0,0.015188769384939387,32,7,3,0.025943018261195536,64,5,2,0.027749415863464404,64,3,2,,,,,512,128,5,0.24034660645044092,5.0,3,Adam,,,,44.0,0.8580645161290322,0.8530003512872711,"{""block_0_dropout"": 0.015188769384939387, ""block_0_filters"": 32, ""block_0_kernel"": 7, ""block_1_dropout"": 0.025943018261195536, ""block_1_filters"": 64, ""block_1_kernel"": 5, ""block_1_stride"": 2, ""block_2_dropout"": 0.027749415863464404, ""block_2_filters"": 64, ""block_2_kernel"": 3, ""block_2_stride"": 2, ""first_conv_filters"": 128, ""first_conv_kernel_size"": 5, ""n_blocks"": 3}",COMPLETE
76,0.595233577313194,2026-09-30 18:24:41.956295,2026-09-30 18:24:56.360242,0 days 00:00:14.403947,0.897733277103929,0.9238781941394436,0.0007629897147383406,1.577836755748742e-05,64.0,0.018814830412345957,32,7,3,0.0232181323753538,64,5,2,0.031231823732754984,64,3,2,,,,,512,128,5,0.16560806576382242,5.0,3,Adam,,,,,,,"{""block_0_dropout"": 0.018814830412345957, ""block_0_filters"": 32, ""block_0_kernel"": 7, ""block_1_dropout"": 0.0232181323753538, ""block_1_filters"": 64, ""block_1_kernel"": 5, ""block_1_stride"": 2, ""block_2_dropout"": 0.031231823732754984, ""block_2_filters"": 64, ""block_2_kernel"": 3, ""block_2_stride"": 2, ""first_conv_filters"": 128, ""first_conv_kernel_size"": 5, ""n_blocks"": 3}",PRUNED
77,0.786835643316133,2026-09-30 18:24:56.414519,2026-09-30 18:25:45.869564,0 days 00:00:49.455045,0.8980155539019394,0.9306548539947769,0.0016717970233043533,9.107149215549667e-06,64.0,0.023866199044544237,32,7,3,0.026397522271274593,64,5,2,0.02259213688306623,64,3,2,,,,,512,128,5,0.22600702639688805,6.0,3,Adam,,,,,,,"{""block_0_dropout"": 0.023866199044544237, ""block_0_filters"": 32, ""block_0_kernel"": 7, ""block_1_dropout"": 0.026397522271274593, ""block_1_filters"": 64, ""block_1_kernel"": 5, ""block_1_stride"": 2, ""block_2_dropout"": 0.02259213688306623, ""block_2_filters"": 64, ""block_2_kernel"": 3, ""block_2_stride"": 2, ""first_conv_filters"": 128, ""first_conv_kernel_size"": 5, ""n_blocks"": 3}",PRUNED
78,0.506588585921135,2026-09-30 18:25:45.942111,2026-09-30 18:25:57.359531,0 days 00:00:11.417420,0.8938016342959557,0.9030219439527156,0.00043773991319907395,2.8101400199049475e-05,64.0,0.019468005034106863,32,7,3,0.03454966567046115,64,5,2,0.028175088318013693,64,3,2,,,,,128,128,5,0.24849579150339574,6.0,3,Adam,,,,,,,"{""block_0_dropout"": 0.019468005034106863, ""block_0_filters"": 32, ""block_0_kernel"": 7, ""block_1_dropout"": 0.03454966567046115, ""block_1_filters"": 64, ""block_1_kernel"": 5, ""block_1_stride"": 2, ""block_2_dropout"": 0.028175088318013693, ""block_2_filters"": 64, ""block_2_kernel"": 3, ""block_2_stride"": 2, ""first_conv_filters"": 128, ""first_conv_kernel_size"": 5, ""n_blocks"": 3}",PRUNED
79,0.20165782274109179,2026-09-30 18:25:57.414253,2026-09-30 18:26:05.991927,0 days 00:00:08.577674,,,,,128.0,0.01648311644667412,32,5,3,0.026857602304473868,64,5,2,0.027243500473605606,64,3,2,,,,,512,128,5,0.21544866944092672,5.0,3,SGD,0.0005450737549840872,0.7603389827199921,1.087649572919846e-06,,,,"{""block_0_dropout"": 0.01648311644667412, ""block_0_filters"": 32, ""block_0_kernel"": 5, ""block_1_dropout"": 0.026857602304473868, ""block_1_filters"": 64, ""block_1_kernel"": 5, ""block_1_stride"": 2, ""block_2_dropout"": 0.027243500473605606, ""block_2_filters"": 64, ""block_2_kernel"": 3, ""block_2_stride"": 2, ""first_conv_filters"": 128, ""first_conv_kernel_size"": 5, ""n_blocks"": 3}",PRUNED
80,0.4874409898609716,2026-09-30 18:26:06.125384,2026-09-30 18:26:16.300911,0 days 00:00:10.175527,0.9386904934816238,0.9144991130081711,0.001228324268502759,1.105633897323824e-05,64.0,0.021416463644051295,32,7,3,0.030776266222580496,64,5,1,0.02919152966168393,64,3,2,,,,,512,128,5,0.27892247825334043,8.0,3,Adam,,,,,,,"{""block_0_dropout"": 0.021416463644051295, ""block_0_filters"": 32, ""block_0_kernel"": 7, ""block_1_dropout"": 0.030776266222580496, ""block_1_filters"": 64, ""block_1_kernel"": 5, ""block_1_stride"": 1, ""block_2_dropout"": 0.02919152966168393, ""block_2_filters"": 64, ""block_2_kernel"": 3, ""block_2_stride"": 2, ""first_conv_filters"": 128, ""first_conv_kernel_size"": 5, ""n_blocks"": 3}",PRUNED
81,0.8631138977100551,2026-09-30 18:26:16.383064,2026-09-30 18:27:07.261014,0 days 00:00:50.877950,0.9063494244142459,0.91999470476148,0.0009400922598428373,6.171915665221499e-06,64.0,0.016913909133528686,32,7,3,0.02929320898841848,64,5,2,0.030001636723398742,128,3,2,,,,,512,128,5,0.19308709678033542,15.0,3,Adam,,,,46.0,0.867741935483871,0.8584858599362392,"{""block_0_dropout"": 0.016913909133528686, ""block_0_filters"": 32, ""block_0_kernel"": 7, ""block_1_dropout"": 0.02929320898841848, ""block_1_filters"": 64, ""block_1_kernel"": 5, ""block_1_stride"": 2, ""block_2_dropout"": 0.030001636723398742, ""block_2_filters"": 128, ""block_2_kernel"": 3, ""block_2_stride"": 2, ""first_conv_filters"": 128, ""first_conv_kernel_size"": 5, ""n_blocks"": 3}",COMPLETE
82,0.8593604578858866,2026-09-30 18:27:07.376781,2026-09-30 18:28:59.304915,0 days 00:01:51.928134,0.9186594712800452,0.9200239441136735,0.0010000879434620394,5.6153912379956855e-06,64.0,0.013440097238601076,32,7,3,0.024737871434748995,64,5,2,0.023298913721249915,128,3,2,,,,,512,512,5,0.19661216518213967,16.0,3,Adam,,,,48.0,0.8612903225806452,0.8574305931911279,"{""block_0_dropout"": 0.013440097238601076, ""block_0_filters"": 32, ""block_0_kernel"": 7, ""block_1_dropout"": 0.024737871434748995, ""block_1_filters"": 64, ""block_1_kernel"": 5, ""block_1_stride"": 2, ""block_2_dropout"": 0.023298913721249915, ""block_2_filters"": 128, ""block_2_kernel"": 3, ""block_2_stride"": 2, ""first_conv_filters"": 512, ""first_conv_kernel_size"": 5, ""n_blocks"": 3}",COMPLETE
83,0.8126891259108755,2026-09-30 18:28:59.358466,2026-09-30 18:29:38.133760,0 days 00:00:38.775294,0.9174419223984768,0.9200905683295411,0.0009466957247841362,5.686240017415164e-06,64.0,0.02983881887198357,32,5,3,0.041943394993601044,64,5,2,0.010452903724776664,64,3,2,,,,,512,128,5,0.19381302591138733,16.0,3,Adam,,,,49.0,0.8225806451612904,0.8027976066604605,"{""block_0_dropout"": 0.02983881887198357, ""block_0_filters"": 32, ""block_0_kernel"": 5, ""block_1_dropout"": 0.041943394993601044, ""block_1_filters"": 64, ""block_1_kernel"": 5, ""block_1_stride"": 2, ""block_2_dropout"": 0.010452903724776664, ""block_2_filters"": 64, ""block_2_kernel"": 3, ""block_2_stride"": 2, ""first_conv_filters"": 128, ""first_conv_kernel_size"": 5, ""n_blocks"": 3}",COMPLETE
84,0.5544638004050491,2026-09-30 18:29:38.190913,2026-09-30 18:29:51.156399,0 days 00:00:12.965486,0.9240196576762102,0.9083776226589849,0.0009816705811874524,3.6205757344449366e-06,64.0,0.010532332329170897,32,7,3,0.029316577547741668,64,5,2,0.02251678562133954,128,3,2,,,,,512,128,7,0.14292961322376468,15.0,3,Adam,,,,,,,"{""block_0_dropout"": 0.010532332329170897, ""block_0_filters"": 32, ""block_0_kernel"": 7, ""block_1_dropout"": 0.029316577547741668, ""block_1_filters"": 64, ""block_1_kernel"": 5, ""block_1_stride"": 2, ""block_2_dropout"": 0.02251678562133954, ""block_2_filters"": 128, ""block_2_kernel"": 3, ""block_2_stride"": 2, ""first_conv_filters"": 128, ""first_conv_kernel_size"": 7, ""n_blocks"": 3}",PRUNED
85,0.7314315796370717,2026-09-30 18:29:51.209718,2026-09-30 18:30:30.274201,0 days 00:00:39.064483,0.9139219597044347,0.9139619668213146,0.0006778314422255437,2.4858556717532203e-06,64.0,0.01995400418350449,32,7,3,0.027561638568498498,64,5,2,0.03375052253080668,64,3,2,,,,,512,128,5,0.18477478271476694,17.0,3,Adam,,,,,,,"{""block_0_dropout"": 0.01995400418350449, ""block_0_filters"": 32, ""block_0_kernel"": 7, ""block_1_dropout"": 0.027561638568498498, ""block_1_filters"": 64, ""block_1_kernel"": 5, ""block_1_stride"": 2, ""block_2_dropout"": 0.03375052253080668, ""block_2_filters"": 64, ""block_2_kernel"": 3, ""block_2_stride"": 2, ""first_conv_filters"": 128, ""first_conv_kernel_size"": 5, ""n_blocks"": 3}",PRUNED
86,0.5538433293551767,2026-09-30 18:30:30.399587,2026-09-30 18:30:41.521285,0 days 00:00:11.121698,0.9044978784825678,0.9035210379714879,0.0007889466019937091,6.414578553031495e-06,64.0,0.016029109828368564,32,7,3,0.02964507852168547,32,5,2,0.02800338658245865,64,3,2,,,,,512,128,5,0.15794324560630393,17.0,3,Adam,,,,,,,"{""block_0_dropout"": 0.016029109828368564, ""block_0_filters"": 32, ""block_0_kernel"": 7, ""block_1_dropout"": 0.02964507852168547, ""block_1_filters"": 32, ""block_1_kernel"": 5, ""block_1_stride"": 2, ""block_2_dropout"": 0.02800338658245865, ""block_2_filters"": 64, ""block_2_kernel"": 3, ""block_2_stride"": 2, ""first_conv_filters"": 128, ""first_conv_kernel_size"": 5, ""n_blocks"": 3}",PRUNED
87,0.5409057307645697,2026-09-30 18:30:41.575697,2026-09-30 18:30:49.290828,0 days 00:00:07.715131,0.9020951698622782,0.9272954739463399,0.0015226322851943281,1.8478721953359537e-05,200.0,0.02247831668666311,32,5,3,0.03189807251113682,64,5,2,0.013121136776456054,64,3,2,,,,,256,128,5,0.23430379954953634,16.0,3,Adam,,,,,,,"{""block_0_dropout"": 0.02247831668666311, ""block_0_filters"": 32, ""block_0_kernel"": 5, ""block_1_dropout"": 0.03189807251113682, ""block_1_filters"": 64, ""block_1_kernel"": 5, ""block_1_stride"": 2, ""block_2_dropout"": 0.013121136776456054, ""block_2_filters"": 64, ""block_2_kernel"": 3, ""block_2_stride"": 2, ""first_conv_filters"": 128, ""first_conv_kernel_size"": 5, ""n_blocks"": 3}",PRUNED
88,0.828531538815314,2026-09-30 18:30:49.350698,2026-09-30 18:31:39.256751,0 days 00:00:49.906053,0.9084996027370897,0.9119430514036556,0.0005732461618352808,4.260091938291773e-06,64.0,0.017443826938465256,32,7,3,0.031031262452892595,64,5,2,0.029840456550801905,128,3,2,,,,,512,128,5,0.20142754455013168,15.0,3,Adam,,,,43.0,0.8354838709677419,0.8215792066628861,"{""block_0_dropout"": 0.017443826938465256, ""block_0_filters"": 32, ""block_0_kernel"": 7, ""block_1_dropout"": 0.031031262452892595, ""block_1_filters"": 64, ""block_1_kernel"": 5, ""block_1_stride"": 2, ""block_2_dropout"": 0.029840456550801905, ""block_2_filters"": 128, ""block_2_kernel"": 3, ""block_2_stride"": 2, ""first_conv_filters"": 128, ""first_conv_kernel_size"": 5, ""n_blocks"": 3}",COMPLETE
