number,value,datetime_start,datetime_complete,duration,params_adam_beta1,params_adam_beta2,params_adam_lr,params_adam_wd,params_batch_size,params_block_0_dropout,params_block_0_filters,params_block_0_kernel,params_block_0_stride,params_block_1_dropout,params_block_1_filters,params_block_1_kernel,params_block_1_stride,params_block_2_dropout,params_block_2_filters,params_block_2_kernel,params_block_2_stride,params_block_3_dropout,params_block_3_filters,params_block_3_kernel,params_block_3_stride,params_fc_hidden,params_first_conv_filters,params_first_conv_kernel_size,params_lr_factor,params_lr_patience,params_n_blocks,params_optimizer,params_sgd_lr,params_sgd_momentum,params_sgd_wd,user_attrs_best_epoch,user_attrs_validation_accuracy,user_attrs_validation_macro_f1,system_attrs_tpe:relative_params:0,state
33,0.8121096506387476,2026-09-30 18:09:00.959425,2026-09-30 18:09:39.934141,0 days 00:00:38.974716,0.9270314278177701,0.9106834736784934,0.0005900933290541913,8.266890142573236e-05,64.0,0.0334202821159553,32,5,3,0.03654404586062405,64,5,2,0.012019421049227036,64,3,2,,,,,512,128,5,0.14720396196582952,14.0,3,Adam,,,,42.0,0.8129032258064516,0.8113160754710437,"{""block_0_dropout"": 0.0334202821159553, ""block_0_filters"": 32, ""block_0_kernel"": 5, ""block_1_dropout"": 0.03654404586062405, ""block_1_filters"": 64, ""block_1_kernel"": 5, ""block_1_stride"": 2, ""block_2_dropout"": 0.012019421049227036, ""block_2_filters"": 64, ""block_2_kernel"": 3, ""block_2_stride"": 2, ""first_conv_filters"": 128, ""first_conv_kernel_size"": 5, ""n_blocks"": 3}",COMPLETE
34,0.8357488410304083,2026-09-30 18:09:39.987179,2026-09-30 18:10:18.517846,0 days 00:00:38.530667,0.9069620184520417,0.917920585704918,0.0002222543735884069,0.001092213177628861,64.0,0.02747981907590212,32,5,3,0.048603079629976176,64,5,2,0.01668860527008302,64,3,2,,,,,512,128,5,0.29159674469757385,13.0,3,Adam,,,,48.0,0.8451612903225807,0.8263363917382358,"{""block_0_dropout"": 0.02747981907590212, ""block_0_filters"": 32, ""block_0_kernel"": 5, ""block_1_dropout"": 0.048603079629976176, ""block_1_filters"": 64, ""block_1_kernel"": 5, ""block_1_stride"": 2, ""block_2_dropout"": 0.01668860527008302, ""block_2_filters"": 64, ""block_2_kernel"": 3, ""block_2_stride"": 2, ""first_conv_filters"": 128, ""first_conv_kernel_size"": 5, ""n_blocks"": 3}",COMPLETE
35,0.8093790718081186,2026-09-30 18:10:18.652142,2026-09-30 18:11:02.894455,0 days 00:00:44.242313,0.9271127729806484,0.9346368957019602,0.0005058754889329202,0.00014990119037832636,128.0,0.018446895395688417,32,5,3,0.04949407066641898,64,5,2,0.01581995737227547,64,3,2,,,,,256,128,5,0.1756026172512782,16.0,3,Adam,,,,43.0,0.8161290322580645,0.8026291113581727,"{""block_0_dropout"": 0.018446895395688417, ""block_0_filters"": 32, ""block_0_kernel"": 5, ""block_1_dropout"": 0.04949407066641898, ""block_1_filters"": 64, ""block_1_kernel"": 5, ""block_1_stride"": 2, ""block_2_dropout"": 0.01581995737227547, ""block_2_filters"": 64, ""block_2_kernel"": 3, ""block_2_stride"": 2, ""first_conv_filters"": 128, ""first_conv_kernel_size"": 5, ""n_blocks"": 3}",COMPLETE
36,0.8337777601577818,2026-09-30 18:11:02.947607,2026-09-30 18:12:15.463161,0 days 00:01:12.515554,0.8789788746079926,0.9095616576543003,0.000886586565049806,4.679110953299777e-05,64.0,0.022326013909641992,32,5,3,0.03968574064010934,64,5,2,0.019806102395855518,64,3,2,,,,,512,256,5,0.1276546470582557,13.0,3,Adam,,,,45.0,0.8387096774193549,0.8288458428962089,"{""block_0_dropout"": 0.022326013909641992, ""block_0_filters"": 32, ""block_0_kernel"": 5, ""block_1_dropout"": 0.03968574064010934, ""block_1_filters"": 64, ""block_1_kernel"": 5, ""block_1_stride"": 2, ""block_2_dropout"": 0.019806102395855518, ""block_2_filters"": 64, ""block_2_kernel"": 3, ""block_2_stride"": 2, ""first_conv_filters"": 256, ""first_conv_kernel_size"": 5, ""n_blocks"": 3}",COMPLETE
37,0.46336351413439525,2026-09-30 18:12:15.528419,2026-09-30 18:12:22.806213,0 days 00:00:07.277794,0.9623958233299442,0.9426269030414407,0.00037869905221104487,0.00021392856490703256,200.0,0.023831624487702627,32,7,3,0.049090881118024184,64,5,2,0.021571962548076865,64,3,2,,,,,256,128,5,0.23024473071371962,11.0,3,Adam,,,,,,,"{""block_0_dropout"": 0.023831624487702627, ""block_0_filters"": 32, ""block_0_kernel"": 7, ""block_1_dropout"": 0.049090881118024184, ""block_1_filters"": 64, ""block_1_kernel"": 5, ""block_1_stride"": 2, ""block_2_dropout"": 0.021571962548076865, ""block_2_filters"": 64, ""block_2_kernel"": 3, ""block_2_stride"": 2, ""first_conv_filters"": 128, ""first_conv_kernel_size"": 5, ""n_blocks"": 3}",PRUNED
38,0.4578363194468926,2026-09-30 18:12:22.859513,2026-09-30 18:12:31.315841,0 days 00:00:08.456328,,,,,128.0,0.023585751673164727,32,5,3,0.04025529602714061,32,5,2,0.024713224747243905,64,3,2,,,,,512,128,5,0.41195176193571836,5.0,3,SGD,0.08422785120385093,0.7060283744606768,0.006494450243814496,,,,"{""block_0_dropout"": 0.023585751673164727, ""block_0_filters"": 32, ""block_0_kernel"": 5, ""block_1_dropout"": 0.04025529602714061, ""block_1_filters"": 32, ""block_1_kernel"": 5, ""block_1_stride"": 2, ""block_2_dropout"": 0.024713224747243905, ""block_2_filters"": 64, ""block_2_kernel"": 3, ""block_2_stride"": 2, ""first_conv_filters"": 128, ""first_conv_kernel_size"": 5, ""n_blocks"": 3}",PRUNED
39,0.4733756840133894,2026-09-30 18:12:31.369361,2026-09-30 18:12:43.362933,0 days 00:00:11.993572,0.9221160476732242,0.9282955020961758,0.0019521073333833253,0.0007425259046295582,64.0,0.023009620897491135,32,7,3,0.020281247068316844,64,5,2,0.02734622116566214,64,3,2,,,,,512,128,5,0.5880101509513427,11.0,3,Adam,,,,,,,"{""block_0_dropout"": 0.023009620897491135, ""block_0_filters"": 32, ""block_0_kernel"": 7, ""block_1_dropout"": 0.020281247068316844, ""block_1_filters"": 64, ""block_1_kernel"": 5, ""block_1_stride"": 2, ""block_2_dropout"": 0.02734622116566214, ""block_2_filters"": 64, ""block_2_kernel"": 3, ""block_2_stride"": 2, ""first_conv_filters"": 128, ""first_conv_kernel_size"": 5, ""n_blocks"": 3}",PRUNED
40,0.3767597013300666,2026-09-30 18:12:43.415855,2026-09-30 18:12:51.351683,0 days 00:00:07.935828,,,,,64.0,0.03569994551528288,32,5,3,0.041108941456251824,64,5,1,0.018994603079335388,64,3,2,,,,,128,128,5,0.18568106276399887,13.0,3,SGD,0.007525335146384671,0.8056582025393455,0.00019307310224174785,,,,"{""block_0_dropout"": 0.03569994551528288, ""block_0_filters"": 32, ""block_0_kernel"": 5, ""block_1_dropout"": 0.041108941456251824, ""block_1_filters"": 64, ""block_1_kernel"": 5, ""block_1_stride"": 1, ""block_2_dropout"": 0.018994603079335388, ""block_2_filters"": 64, ""block_2_kernel"": 3, ""block_2_stride"": 2, ""first_conv_filters"": 128, ""first_conv_kernel_size"": 5, ""n_blocks"": 3}",PRUNED
41,0.5875963217058484,2026-09-30 18:12:51.405436,2026-09-30 18:13:01.849317,0 days 00:00:10.443881,0.9447167507929644,0.9218718863641887,0.0011400387786443568,0.00034803017748735726,64.0,0.03671112865701433,32,5,3,0.04271792177568887,64,5,2,0.014025287203919582,64,3,2,,,,,512,128,3,0.22364281686759707,9.0,3,Adam,,,,,,,"{""block_0_dropout"": 0.03671112865701433, ""block_0_filters"": 32, ""block_0_kernel"": 5, ""block_1_dropout"": 0.04271792177568887, ""block_1_filters"": 64, ""block_1_kernel"": 5, ""block_1_stride"": 2, ""block_2_dropout"": 0.014025287203919582, ""block_2_filters"": 64, ""block_2_kernel"": 3, ""block_2_stride"": 2, ""first_conv_filters"": 128, ""first_conv_kernel_size"": 3, ""n_blocks"": 3}",PRUNED
42,0.4751149314387231,2026-09-30 18:13:01.903446,2026-09-30 18:13:11.784370,0 days 00:00:09.880924,0.9339652305242248,0.9135537752145323,0.0014339018111779336,0.0023215948413471037,64.0,0.010401482432644018,32,7,3,0.026472696354675817,64,5,2,0.02399712646349167,128,3,2,,,,,512,128,5,0.2555887857181154,10.0,3,Adam,,,,,,,"{""block_0_dropout"": 0.010401482432644018, ""block_0_filters"": 32, ""block_0_kernel"": 7, ""block_1_dropout"": 0.026472696354675817, ""block_1_filters"": 64, ""block_1_kernel"": 5, ""block_1_stride"": 2, ""block_2_dropout"": 0.02399712646349167, ""block_2_filters"": 128, ""block_2_kernel"": 3, ""block_2_stride"": 2, ""first_conv_filters"": 128, ""first_conv_kernel_size"": 5, ""n_blocks"": 3}",PRUNED
43,0.39042453225769536,2026-09-30 18:13:11.837660,2026-09-30 18:13:21.639686,0 days 00:00:09.802026,0.9047841930550089,0.9066493953644792,0.009314470370517525,0.0005792351819266208,64.0,0.03321439105260072,32,7,3,0.03406266451540601,64,5,2,0.027871470860478424,64,3,2,,,,,512,128,5,0.3040472238987577,12.0,3,Adam,,,,,,,"{""block_0_dropout"": 0.03321439105260072, ""block_0_filters"": 32, ""block_0_kernel"": 7, ""block_1_dropout"": 0.03406266451540601, ""block_1_filters"": 64, ""block_1_kernel"": 5, ""block_1_stride"": 2, ""block_2_dropout"": 0.027871470860478424, ""block_2_filters"": 64, ""block_2_kernel"": 3, ""block_2_stride"": 2, ""first_conv_filters"": 128, ""first_conv_kernel_size"": 5, ""n_blocks"": 3}",PRUNED
44,0.39564976326113954,2026-09-30 18:13:21.692962,2026-09-30 18:13:32.111359,0 days 00:00:10.418397,0.9500354160289879,0.9218753633763936,0.002911476144170282,0.001938537244196837,64.0,0.024098314583277332,32,7,3,0.022318374273138996,64,5,2,0.022723128189627594,128,3,1,,,,,512,128,5,0.20021918285221094,15.0,3,Adam,,,,,,,"{""block_0_dropout"": 0.024098314583277332, ""block_0_filters"": 32, ""block_0_kernel"": 7, ""block_1_dropout"": 0.022318374273138996, ""block_1_filters"": 64, ""block_1_kernel"": 5, ""block_1_stride"": 2, ""block_2_dropout"": 0.022723128189627594, ""block_2_filters"": 128, ""block_2_kernel"": 3, ""block_2_stride"": 1, ""first_conv_filters"": 128, ""first_conv_kernel_size"": 5, ""n_blocks"": 3}",PRUNED
45,0.5221820061332492,2026-09-30 18:13:32.164640,2026-09-30 18:13:40.630051,0 days 00:00:08.465411,,,,,200.0,0.03718239762343047,32,7,3,0.025048193596677593,64,5,2,0.02479026257605372,128,3,2,,,,,512,128,5,0.12026708093410046,9.0,3,SGD,0.01254027193183149,0.7985910780465585,0.0002740263958471168,,,,"{""block_0_dropout"": 0.03718239762343047, ""block_0_filters"": 32, ""block_0_kernel"": 7, ""block_1_dropout"": 0.025048193596677593, ""block_1_filters"": 64, ""block_1_kernel"": 5, ""block_1_stride"": 2, ""block_2_dropout"": 0.02479026257605372, ""block_2_filters"": 128, ""block_2_kernel"": 3, ""block_2_stride"": 2, ""first_conv_filters"": 128, ""first_conv_kernel_size"": 5, ""n_blocks"": 3}",PRUNED
46,0.8156010547652168,2026-09-30 18:13:40.683286,2026-09-30 18:14:19.454471,0 days 00:00:38.771185,0.8844992940266531,0.9301736056647778,0.0007318353449162363,0.00023050923255256629,64.0,0.027343316424038724,32,5,3,0.035302789185663146,64,5,2,0.024666410773828612,64,3,2,,,,,512,128,5,0.15255061977587395,11.0,3,Adam,,,,46.0,0.8290322580645161,0.8021698514659177,"{""block_0_dropout"": 0.027343316424038724, ""block_0_filters"": 32, ""block_0_kernel"": 5, ""block_1_dropout"": 0.035302789185663146, ""block_1_filters"": 64, ""block_1_kernel"": 5, ""block_1_stride"": 2, ""block_2_dropout"": 0.024666410773828612, ""block_2_filters"": 64, ""block_2_kernel"": 3, ""block_2_stride"": 2, ""first_conv_filters"": 128, ""first_conv_kernel_size"": 5, ""n_blocks"": 3}",COMPLETE
47,0.57414063115709,2026-09-30 18:14:19.554961,2026-09-30 18:14:33.844484,0 days 00:00:14.289523,0.967073114119268,0.9395562355746402,0.0010671544622345216,4.359915983099639e-05,64.0,0.02062001910007657,32,7,3,0.03357953940356039,64,5,2,0.020274403779577524,64,3,2,,,,,512,128,5,0.23664295605716273,7.0,3,Adam,,,,,,,"{""block_0_dropout"": 0.02062001910007657, ""block_0_filters"": 32, ""block_0_kernel"": 7, ""block_1_dropout"": 0.03357953940356039, ""block_1_filters"": 64, ""block_1_kernel"": 5, ""block_1_stride"": 2, ""block_2_dropout"": 0.020274403779577524, ""block_2_filters"": 64, ""block_2_kernel"": 3, ""block_2_stride"": 2, ""first_conv_filters"": 128, ""first_conv_kernel_size"": 5, ""n_blocks"": 3}",PRUNED
48,0.28662131023318493,2026-09-30 18:14:33.911012,2026-09-30 18:14:44.308059,0 days 00:00:10.397047,,,,,128.0,0.022143553572002046,32,7,3,0.044141544635496674,64,5,2,0.01729891391521693,64,3,2,,,,,512,128,5,0.2791986177657403,15.0,3,SGD,0.0006408004693702656,0.8056838147300915,2.3190527801212e-05,,,,"{""block_0_dropout"": 0.022143553572002046, ""block_0_filters"": 32, ""block_0_kernel"": 7, ""block_1_dropout"": 0.044141544635496674, ""block_1_filters"": 64, ""block_1_kernel"": 5, ""block_1_stride"": 2, ""block_2_dropout"": 0.01729891391521693, ""block_2_filters"": 64, ""block_2_kernel"": 3, ""block_2_stride"": 2, ""first_conv_filters"": 128, ""first_conv_kernel_size"": 5, ""n_blocks"": 3}",PRUNED
49,0.32566990864893874,2026-09-30 18:14:44.424342,2026-09-30 18:14:54.501047,0 days 00:00:10.076705,0.9426011059704603,0.9063994737315009,0.0056664958172989235,0.001172604658991006,64.0,0.02172819889851121,32,7,3,0.029527750802849966,64,5,2,0.023545494497297523,128,3,2,,,,,128,128,5,0.5536908225991157,18.0,3,Adam,,,,,,,"{""block_0_dropout"": 0.02172819889851121, ""block_0_filters"": 32, ""block_0_kernel"": 7, ""block_1_dropout"": 0.029527750802849966, ""block_1_filters"": 64, ""block_1_kernel"": 5, ""block_1_stride"": 2, ""block_2_dropout"": 0.023545494497297523, ""block_2_filters"": 128, ""block_2_kernel"": 3, ""block_2_stride"": 2, ""first_conv_filters"": 128, ""first_conv_kernel_size"": 5, ""n_blocks"": 3}",PRUNED
50,0.49533575812645614,2026-09-30 18:14:54.554673,2026-09-30 18:15:03.829249,0 days 00:00:09.274576,0.8548753059889602,0.9525756651654985,0.001977583855655523,0.0036786372797389805,200.0,0.010335683081770837,32,7,3,0.026622665594037732,64,5,2,0.01780358200752611,128,3,2,,,,,512,128,5,0.31813117946493347,13.0,3,Adam,,,,,,,"{""block_0_dropout"": 0.010335683081770837, ""block_0_filters"": 32, ""block_0_kernel"": 7, ""block_1_dropout"": 0.026622665594037732, ""block_1_filters"": 64, ""block_1_kernel"": 5, ""block_1_stride"": 2, ""block_2_dropout"": 0.01780358200752611, ""block_2_filters"": 128, ""block_2_kernel"": 3, ""block_2_stride"": 2, ""first_conv_filters"": 128, ""first_conv_kernel_size"": 5, ""n_blocks"": 3}",PRUNED
51,0.8258481475827075,2026-09-30 18:15:03.958196,2026-09-30 18:15:42.752540,0 days 00:00:38.794344,0.9097268139196829,0.9186512894555464,0.0001840412521594752,0.0013535298613901426,64.0,0.043058124107885884,32,5,3,0.04138035742118186,64,5,2,0.012411017794831168,64,3,2,,,,,512,128,5,0.2942043185980211,13.0,3,Adam,,,,49.0,0.8387096774193549,0.8129866177460601,"{""block_0_dropout"": 0.043058124107885884, ""block_0_filters"": 32, ""block_0_kernel"": 5, ""block_1_dropout"": 0.04138035742118186, ""block_1_filters"": 64, ""block_1_kernel"": 5, ""block_1_stride"": 2, ""block_2_dropout"": 0.012411017794831168, ""block_2_filters"": 64, ""block_2_kernel"": 3, ""block_2_stride"": 2, ""first_conv_filters"": 128, ""first_conv_kernel_size"": 5, ""n_blocks"": 3}",COMPLETE
52,0.5521708389504423,2026-09-30 18:15:42.805958,2026-09-30 18:15:53.638336,0 days 00:00:10.832378,0.9011863413263457,0.9159146431471509,0.00024669608174629953,0.0006674018289774144,64.0,0.025735967191758264,32,5,3,0.04544929314116834,32,5,2,0.018515943662079277,64,3,2,,,,,512,128,5,0.26797450055607774,14.0,3,Adam,,,,,,,"{""block_0_dropout"": 0.025735967191758264, ""block_0_filters"": 32, ""block_0_kernel"": 5, ""block_1_dropout"": 0.04544929314116834, ""block_1_filters"": 32, ""block_1_kernel"": 5, ""block_1_stride"": 2, ""block_2_dropout"": 0.018515943662079277, ""block_2_filters"": 64, ""block_2_kernel"": 3, ""block_2_stride"": 2, ""first_conv_filters"": 128, ""first_conv_kernel_size"": 5, ""n_blocks"": 3}",PRUNED
53,0.4806251366658175,2026-09-30 18:15:53.691858,2026-09-30 18:16:01.435169,0 days 00:00:07.743311,0.9294270014660452,0.9252502975057741,0.00016909526863320213,0.0028541056936993263,64.0,0.028547240653138947,32,5,3,0.04187032924280375,64,5,2,0.013966374066242373,32,3,2,,,,,512,128,5,0.2104435693884091,12.0,3,Adam,,,,,,,"{""block_0_dropout"": 0.028547240653138947, ""block_0_filters"": 32, ""block_0_kernel"": 5, ""block_1_dropout"": 0.04187032924280375, ""block_1_filters"": 64, ""block_1_kernel"": 5, ""block_1_stride"": 2, ""block_2_dropout"": 0.013966374066242373, ""block_2_filters"": 32, ""block_2_kernel"": 3, ""block_2_stride"": 2, ""first_conv_filters"": 128, ""first_conv_kernel_size"": 5, ""n_blocks"": 3}",PRUNED
54,0.825485862108766,2026-09-30 18:16:01.488648,2026-09-30 18:16:40.064305,0 days 00:00:38.575657,0.9203909820178986,0.9000061541392136,0.0003446627102574142,0.0003146525955432929,64.0,0.017677599038959865,32,5,3,0.0369715815069227,64,5,2,0.019736384674562187,64,3,2,,,,,512,128,5,0.17441775847446933,14.0,3,Adam,,,,45.0,0.832258064516129,0.818713659701403,"{""block_0_dropout"": 0.017677599038959865, ""block_0_filters"": 32, ""block_0_kernel"": 5, ""block_1_dropout"": 0.0369715815069227, ""block_1_filters"": 64, ""block_1_kernel"": 5, ""block_1_stride"": 2, ""block_2_dropout"": 0.019736384674562187, ""block_2_filters"": 64, ""block_2_kernel"": 3, ""block_2_stride"": 2, ""first_conv_filters"": 128, ""first_conv_kernel_size"": 5, ""n_blocks"": 3}",COMPLETE
55,0.5637634813691532,2026-09-30 18:16:40.122420,2026-09-30 18:16:54.187189,0 days 00:00:14.064769,0.9566855696558668,0.9659920349523785,0.0006132362733313339,8.107297564044889e-06,64.0,0.02082193880964468,32,7,3,0.02404692069953255,64,5,2,0.015058066898444628,128,3,2,,,,,512,128,5,0.3446015308332855,10.0,3,Adam,,,,,,,"{""block_0_dropout"": 0.02082193880964468, ""block_0_filters"": 32, ""block_0_kernel"": 7, ""block_1_dropout"": 0.02404692069953255, ""block_1_filters"": 64, ""block_1_kernel"": 5, ""block_1_stride"": 2, ""block_2_dropout"": 0.015058066898444628, ""block_2_filters"": 128, ""block_2_kernel"": 3, ""block_2_stride"": 2, ""first_conv_filters"": 128, ""first_conv_kernel_size"": 5, ""n_blocks"": 3}",PRUNED
56,0.8491445890925481,2026-09-30 18:16:54.240377,2026-09-30 18:17:51.164039,0 days 00:00:56.923662,0.8875384400197678,0.9850657385816899,0.00045617942094502555,0.000523649696875689,64.0,0.010766595835980834,32,7,3,0.030899983814413695,64,5,2,0.027491588934164556,128,3,2,,,,,256,128,7,0.13541522569011716,13.0,3,Adam,,,,50.0,0.8548387096774194,0.8434504685076768,"{""block_0_dropout"": 0.010766595835980834, ""block_0_filters"": 32, ""block_0_kernel"": 7, ""block_1_dropout"": 0.030899983814413695, ""block_1_filters"": 64, ""block_1_kernel"": 5, ""block_1_stride"": 2, ""block_2_dropout"": 0.027491588934164556, ""block_2_filters"": 128, ""block_2_kernel"": 3, ""block_2_stride"": 2, ""first_conv_filters"": 128, ""first_conv_kernel_size"": 7, ""n_blocks"": 3}",COMPLETE
57,0.8121562406970333,2026-09-30 18:17:51.222813,2026-09-30 18:18:35.449110,0 days 00:00:44.226297,0.8886789616381301,0.9913698916152937,0.00045309205966681965,0.00013260033992207996,64.0,0.011366838093109639,16,7,3,0.032242548253401004,64,5,2,0.023750567977058833,128,3,2,,,,,256,128,7,0.13393569614348305,16.0,3,Adam,,,,50.0,0.8032258064516129,0.8210866749424538,"{""block_0_dropout"": 0.011366838093109639, ""block_0_filters"": 16, ""block_0_kernel"": 7, ""block_1_dropout"": 0.032242548253401004, ""block_1_filters"": 64, ""block_1_kernel"": 5, ""block_1_stride"": 2, ""block_2_dropout"": 0.023750567977058833, ""block_2_filters"": 128, ""block_2_kernel"": 3, ""block_2_stride"": 2, ""first_conv_filters"": 128, ""first_conv_kernel_size"": 7, ""n_blocks"": 3}",COMPLETE
58,0.5002556975530041,2026-09-30 18:18:35.550436,2026-09-30 18:18:45.640509,0 days 00:00:10.090073,0.9699215722611781,0.9795734803475936,0.0008298746736855228,0.0004532638632840943,64.0,0.01071151199700852,32,7,3,0.02628265726812553,64,5,2,0.029701064517870728,32,3,2,,,,,256,128,5,0.6846769405081801,11.0,3,Adam,,,,,,,"{""block_0_dropout"": 0.01071151199700852, ""block_0_filters"": 32, ""block_0_kernel"": 7, ""block_1_dropout"": 0.02628265726812553, ""block_1_filters"": 64, ""block_1_kernel"": 5, ""block_1_stride"": 2, ""block_2_dropout"": 0.029701064517870728, ""block_2_filters"": 32, ""block_2_kernel"": 3, ""block_2_stride"": 2, ""first_conv_filters"": 128, ""first_conv_kernel_size"": 5, ""n_blocks"": 3}",PRUNED
59,0.48769114931202623,2026-09-30 18:18:45.700096,2026-09-30 18:18:53.436203,0 days 00:00:07.736107,,,,,64.0,0.031198383347126633,32,5,3,0.03354409403601086,64,5,2,0.016114125853393297,64,3,2,,,,,256,128,5,0.18439805085426225,7.0,3,SGD,0.023642811447958753,0.890750247547116,0.0007091487150983663,,,,"{""block_0_dropout"": 0.031198383347126633, ""block_0_filters"": 32, ""block_0_kernel"": 5, ""block_1_dropout"": 0.03354409403601086, ""block_1_filters"": 64, ""block_1_kernel"": 5, ""block_1_stride"": 2, ""block_2_dropout"": 0.016114125853393297, ""block_2_filters"": 64, ""block_2_kernel"": 3, ""block_2_stride"": 2, ""first_conv_filters"": 128, ""first_conv_kernel_size"": 5, ""n_blocks"": 3}",PRUNED
60,,2026-09-30 18:18:53.506815,2026-09-30 18:18:53.520881,0 days 00:00:00.014066,,,,,,0.015205247623696246,32,7,3,0.028910908154573207,64,5,2,0.02371439385918545,128,5,2,,,,,,128,7,,,3,,,,,,,,"{""block_0_dropout"": 0.015205247623696246, ""block_0_filters"": 32, ""block_0_kernel"": 7, ""block_1_dropout"": 0.028910908154573207, ""block_1_filters"": 64, ""block_1_kernel"": 5, ""block_1_stride"": 2, ""block_2_dropout"": 0.02371439385918545, ""block_2_filters"": 128, ""block_2_kernel"": 5, ""block_2_stride"": 2, ""first_conv_filters"": 128, ""first_conv_kernel_size"": 7, ""n_blocks"": 3}",PRUNED
