number,value,datetime_start,datetime_complete,duration,params_adam_beta1,params_adam_beta2,params_adam_lr,params_adam_wd,params_batch_size,params_block_0_dropout,params_block_0_filters,params_block_0_kernel,params_block_0_stride,params_block_1_dropout,params_block_1_filters,params_block_1_kernel,params_block_1_stride,params_block_2_dropout,params_block_2_filters,params_block_2_kernel,params_block_2_stride,params_block_3_dropout,params_block_3_filters,params_block_3_kernel,params_block_3_stride,params_fc_hidden,params_first_conv_filters,params_first_conv_kernel_size,params_lr_factor,params_lr_patience,params_n_blocks,params_optimizer,params_sgd_lr,params_sgd_momentum,params_sgd_wd,user_attrs_best_epoch,user_attrs_validation_accuracy,user_attrs_validation_macro_f1,system_attrs_tpe:relative_params:0,state
89,0.5315497868228996,2026-09-30 18:31:39.315728,2026-09-30 18:32:01.707288,0 days 00:00:22.391560,0.9311280707806714,0.9191831692866079,0.0012119162622301076,7.274003729139526e-06,64.0,0.014321242515990805,32,7,3,0.02407400227416063,64,5,2,0.02059921108706244,128,3,2,,,,,512,512,5,0.17345777829724243,15.0,3,Adam,,,,,,,"{""block_0_dropout"": 0.014321242515990805, ""block_0_filters"": 32, ""block_0_kernel"": 7, ""block_1_dropout"": 0.02407400227416063, ""block_1_filters"": 64, ""block_1_kernel"": 5, ""block_1_stride"": 2, ""block_2_dropout"": 0.02059921108706244, ""block_2_filters"": 128, ""block_2_kernel"": 3, ""block_2_stride"": 2, ""first_conv_filters"": 512, ""first_conv_kernel_size"": 5, ""n_blocks"": 3}",PRUNED
90,0.8286892495564457,2026-09-30 18:32:01.835380,2026-09-30 18:32:51.902668,0 days 00:00:50.067288,0.8838380016997798,0.9489449580127285,0.0004039138193857302,2.6278678503879334e-06,64.0,0.014844096166272056,32,7,3,0.023403066573682216,64,5,2,0.03028801551315865,128,3,2,,,,,512,128,5,0.11400297419328809,16.0,3,Adam,,,,49.0,0.832258064516129,0.8251204345967623,"{""block_0_dropout"": 0.014844096166272056, ""block_0_filters"": 32, ""block_0_kernel"": 7, ""block_1_dropout"": 0.023403066573682216, ""block_1_filters"": 64, ""block_1_kernel"": 5, ""block_1_stride"": 2, ""block_2_dropout"": 0.03028801551315865, ""block_2_filters"": 128, ""block_2_kernel"": 3, ""block_2_stride"": 2, ""first_conv_filters"": 128, ""first_conv_kernel_size"": 5, ""n_blocks"": 3}",COMPLETE
91,0.8351546870577219,2026-09-30 18:32:51.956058,2026-09-30 18:33:42.907103,0 days 00:00:50.951045,0.9245066010185534,0.9230532057599659,0.0009558624425707082,0.00020531177264000312,64.0,0.01246289386446265,32,7,3,0.022146023611269244,64,5,2,0.022370332587006457,128,3,2,,,,,512,128,5,0.2703607027743463,5.0,3,Adam,,,,50.0,0.8483870967741935,0.8219222773412502,"{""block_0_dropout"": 0.01246289386446265, ""block_0_filters"": 32, ""block_0_kernel"": 7, ""block_1_dropout"": 0.022146023611269244, ""block_1_filters"": 64, ""block_1_kernel"": 5, ""block_1_stride"": 2, ""block_2_dropout"": 0.022370332587006457, ""block_2_filters"": 128, ""block_2_kernel"": 3, ""block_2_stride"": 2, ""first_conv_filters"": 128, ""first_conv_kernel_size"": 5, ""n_blocks"": 3}",COMPLETE
92,0.7813699742268214,2026-09-30 18:33:42.988105,2026-09-30 18:34:31.858018,0 days 00:00:48.869913,0.899381825970142,0.9165326643447625,0.001295871294007627,1.0604596237539503e-05,64.0,0.011421960304185899,32,7,3,0.024934471290065197,64,5,2,0.026093417711315615,64,3,2,,,,,512,128,5,0.2133518163063573,11.0,3,Adam,,,,,,,"{""block_0_dropout"": 0.011421960304185899, ""block_0_filters"": 32, ""block_0_kernel"": 7, ""block_1_dropout"": 0.024934471290065197, ""block_1_filters"": 64, ""block_1_kernel"": 5, ""block_1_stride"": 2, ""block_2_dropout"": 0.026093417711315615, ""block_2_filters"": 64, ""block_2_kernel"": 3, ""block_2_stride"": 2, ""first_conv_filters"": 128, ""first_conv_kernel_size"": 5, ""n_blocks"": 3}",PRUNED
93,0.48724073221753395,2026-09-30 18:34:31.912209,2026-09-30 18:34:41.873424,0 days 00:00:09.961215,0.9425318405617724,0.9277842345577153,0.0014543999903831389,0.00034977981870920887,64.0,0.025413652304127825,32,7,3,0.040798420454065176,64,5,2,0.02254013931558674,64,3,2,,,,,512,128,5,0.24404292221607277,7.0,3,Adam,,,,,,,"{""block_0_dropout"": 0.025413652304127825, ""block_0_filters"": 32, ""block_0_kernel"": 7, ""block_1_dropout"": 0.040798420454065176, ""block_1_filters"": 64, ""block_1_kernel"": 5, ""block_1_stride"": 2, ""block_2_dropout"": 0.02254013931558674, ""block_2_filters"": 64, ""block_2_kernel"": 3, ""block_2_stride"": 2, ""first_conv_filters"": 128, ""first_conv_kernel_size"": 5, ""n_blocks"": 3}",PRUNED
94,0.5429269772986898,2026-09-30 18:34:41.979177,2026-09-30 18:34:53.091257,0 days 00:00:11.112080,0.9137409050966433,0.9249724780563655,0.001099495892246185,4.73109309090413e-06,64.0,0.021486861160885426,32,7,3,0.038900862695475956,64,5,2,0.025369401995525516,64,3,2,,,,,512,128,5,0.22841753696340567,12.0,3,Adam,,,,,,,"{""block_0_dropout"": 0.021486861160885426, ""block_0_filters"": 32, ""block_0_kernel"": 7, ""block_1_dropout"": 0.038900862695475956, ""block_1_filters"": 64, ""block_1_kernel"": 5, ""block_1_stride"": 2, ""block_2_dropout"": 0.025369401995525516, ""block_2_filters"": 64, ""block_2_kernel"": 3, ""block_2_stride"": 2, ""first_conv_filters"": 128, ""first_conv_kernel_size"": 5, ""n_blocks"": 3}",PRUNED
95,0.4705839123889697,2026-09-30 18:34:53.162142,2026-09-30 18:35:03.249618,0 days 00:00:10.087476,,,,,64.0,0.017702724607169623,32,7,3,0.02026187966561741,64,5,2,0.028543576936404892,64,3,2,,,,,512,128,5,0.18462850549909265,14.0,3,SGD,0.002635959910274944,0.8535292109422294,3.7362623735519484e-05,,,,"{""block_0_dropout"": 0.017702724607169623, ""block_0_filters"": 32, ""block_0_kernel"": 7, ""block_1_dropout"": 0.02026187966561741, ""block_1_filters"": 64, ""block_1_kernel"": 5, ""block_1_stride"": 2, ""block_2_dropout"": 0.028543576936404892, ""block_2_filters"": 64, ""block_2_kernel"": 3, ""block_2_stride"": 2, ""first_conv_filters"": 128, ""first_conv_kernel_size"": 5, ""n_blocks"": 3}",PRUNED
96,0.4934709717034609,2026-09-30 18:35:03.304822,2026-09-30 18:35:25.527189,0 days 00:00:22.222367,0.9197290586186251,0.9213431926327179,0.0008237716484348262,3.11406046669733e-05,64.0,0.017136416130669702,32,7,3,0.025181641870688932,64,5,2,0.022468285102292138,128,3,2,,,,,128,512,5,0.1512890587277938,18.0,3,Adam,,,,,,,"{""block_0_dropout"": 0.017136416130669702, ""block_0_filters"": 32, ""block_0_kernel"": 7, ""block_1_dropout"": 0.025181641870688932, ""block_1_filters"": 64, ""block_1_kernel"": 5, ""block_1_stride"": 2, ""block_2_dropout"": 0.022468285102292138, ""block_2_filters"": 128, ""block_2_kernel"": 3, ""block_2_stride"": 2, ""first_conv_filters"": 512, ""first_conv_kernel_size"": 5, ""n_blocks"": 3}",PRUNED
97,0.8425430100795513,2026-09-30 18:35:25.580293,2026-09-30 18:36:14.529643,0 days 00:00:48.949350,0.9365679371067052,0.9334286976503917,0.0007117309146388656,0.0005554242963682112,128.0,0.01241091220508077,32,7,3,0.028828010977246618,64,5,2,0.029021450142411587,64,3,2,,,,,256,128,5,0.19732154394671697,6.0,3,Adam,,,,50.0,0.8419354838709677,0.843150536288135,"{""block_0_dropout"": 0.01241091220508077, ""block_0_filters"": 32, ""block_0_kernel"": 7, ""block_1_dropout"": 0.028828010977246618, ""block_1_filters"": 64, ""block_1_kernel"": 5, ""block_1_stride"": 2, ""block_2_dropout"": 0.029021450142411587, ""block_2_filters"": 64, ""block_2_kernel"": 3, ""block_2_stride"": 2, ""first_conv_filters"": 128, ""first_conv_kernel_size"": 5, ""n_blocks"": 3}",COMPLETE
98,0.5315697014308713,2026-09-30 18:36:14.654725,2026-09-30 18:36:24.443082,0 days 00:00:09.788357,0.9289447476421854,0.9365821684151453,0.0007043144042315066,0.0008485932827210049,128.0,0.015517368815927666,32,7,3,0.025365916400216845,64,5,2,0.032563517871007704,64,3,2,,,,,256,128,5,0.2026601464719617,6.0,3,Adam,,,,,,,"{""block_0_dropout"": 0.015517368815927666, ""block_0_filters"": 32, ""block_0_kernel"": 7, ""block_1_dropout"": 0.025365916400216845, ""block_1_filters"": 64, ""block_1_kernel"": 5, ""block_1_stride"": 2, ""block_2_dropout"": 0.032563517871007704, ""block_2_filters"": 64, ""block_2_kernel"": 3, ""block_2_stride"": 2, ""first_conv_filters"": 128, ""first_conv_kernel_size"": 5, ""n_blocks"": 3}",PRUNED
99,0.47702520246779834,2026-09-30 18:36:24.497329,2026-09-30 18:36:34.443698,0 days 00:00:09.946369,0.9527777214655323,0.9432394169498035,0.0002969034645090048,0.0002601933517888227,128.0,0.02428772528427609,32,7,3,0.026866377172936724,64,5,2,0.03528097169456954,64,3,2,,,,,256,128,5,0.47573824793426317,5.0,3,Adam,,,,,,,"{""block_0_dropout"": 0.02428772528427609, ""block_0_filters"": 32, ""block_0_kernel"": 7, ""block_1_dropout"": 0.026866377172936724, ""block_1_filters"": 64, ""block_1_kernel"": 5, ""block_1_stride"": 2, ""block_2_dropout"": 0.03528097169456954, ""block_2_filters"": 64, ""block_2_kernel"": 3, ""block_2_stride"": 2, ""first_conv_filters"": 128, ""first_conv_kernel_size"": 5, ""n_blocks"": 3}",PRUNED
