number,value,datetime_start,datetime_complete,duration,params_adam_beta1,params_adam_beta2,params_adam_lr,params_adam_wd,params_batch_size,params_block_0_dropout,params_block_0_filters,params_block_0_kernel,params_block_0_stride,params_block_1_dropout,params_block_1_filters,params_block_1_kernel,params_block_1_stride,params_block_2_dropout,params_block_2_filters,params_block_2_kernel,params_block_2_stride,params_block_3_dropout,params_block_3_filters,params_block_3_kernel,params_block_3_stride,params_block_4_dropout,params_block_4_filters,params_block_4_kernel,params_block_4_stride,params_fc_hidden,params_lr_factor,params_lr_patience,params_n_blocks,params_optimizer,params_sgd_lr,params_sgd_momentum,params_sgd_wd,user_attrs_best_epoch,user_attrs_validation_accuracy,user_attrs_validation_macro_f1,state
0,0.2904078892632609,2026-10-06 09:37:11.262382,2026-10-06 09:37:30.106490,0 days 00:00:18.844108,,,,,128.0,0.012323344486727979,8,7,3,0.017336180394137354,16,5,2,0.02465447373174767,64,3,1,0.016820964947491662,128.0,3.0,1.0,,,,,512,0.19763058787582308,12.0,4,SGD,0.00019634341572933326,0.8984275776885255,5.762487216478604e-05,45.0,0.29318181818181815,0.2876339603447037,COMPLETE
1,0.30050066874076725,2026-10-06 09:37:30.241637,2026-10-06 09:37:53.977498,0 days 00:00:23.735861,,,,,128.0,0.041005312934444586,32,5,3,0.02554709158757928,16,7,1,0.012982025747190833,64,3,1,0.04085081386743783,64.0,3.0,1.0,,,,,256,0.36014665762139764,16.0,4,SGD,0.0009833181933644897,0.7184319215829468,1.753594952976443e-05,50.0,0.31136363636363634,0.28963770111789816,COMPLETE
2,0.5741970268127339,2026-10-06 09:37:54.113684,2026-10-06 09:38:11.928696,0 days 00:00:17.815012,0.9754527819892891,0.9317685471496893,0.0011986281799901185,0.0016973078532467015,200.0,0.030909313175279764,16,7,3,0.019971689165955,16,5,1,0.04232481518257668,64,3,1,,,,,,,,,256,0.18804153962214143,8.0,3,Adam,,,,45.0,0.575,0.5733940536254677,COMPLETE
3,0.69232773380301,2026-10-06 09:38:12.059026,2026-10-06 09:38:45.826137,0 days 00:00:33.767111,0.9519502888056603,0.9367415349586534,0.003336101309469784,8.923807143379781e-06,200.0,0.04771638815650077,8,5,3,0.022035132392670787,64,5,1,0.019582475626678898,128,5,1,,,,,,,,,512,0.6058446644748636,15.0,3,Adam,,,,50.0,0.7022727272727273,0.6823827403332929,COMPLETE
4,0.46942695661237394,2026-10-06 09:38:45.957708,2026-10-06 09:39:08.918868,0 days 00:00:22.961160,,,,,64.0,0.03048372233197124,32,7,3,0.014538940849623563,32,3,1,0.01967409163601807,32,3,2,,,,,,,,,512,0.8096691394120938,17.0,3,SGD,0.0011159088550343414,0.9105271468723695,0.0038765111709116325,44.0,0.47045454545454546,0.4683993677702024,COMPLETE
5,,2026-10-06 09:39:09.051134,2026-10-06 09:39:09.110653,0 days 00:00:00.059519,,,,,,0.016432322056699946,8,7,3,0.035985315961888587,32,5,1,0.048920422190097824,32,3,2,0.01780971951192178,128.0,5.0,2.0,0.03581889183628671,128.0,3.0,1.0,,,,5,,,,,,,,PRUNED
6,,2026-10-06 09:39:09.241885,2026-10-06 09:39:09.274609,0 days 00:00:00.032724,,,,,,0.04713274250350902,16,7,3,0.0167797098674437,32,7,2,0.015603360609460961,64,5,1,,,,,,,,,,,,3,,,,,,,,PRUNED
7,,2026-10-06 09:39:09.406668,2026-10-06 09:39:09.449773,0 days 00:00:00.043105,,,,,,0.021743673770579737,8,7,3,0.038078675090308135,64,7,2,0.02862392072529841,64,5,2,0.015082420506075393,256.0,3.0,2.0,,,,,,,,4,,,,,,,,PRUNED
8,,2026-10-06 09:39:09.581302,2026-10-06 09:39:09.626335,0 days 00:00:00.045033,,,,,,0.03125418526272592,8,7,3,0.027558856828225446,64,7,2,0.016257481706843442,128,5,2,0.032174162100456025,256.0,5.0,2.0,,,,,,,,4,,,,,,,,PRUNED
9,,2026-10-06 09:39:09.756456,2026-10-06 09:39:09.800290,0 days 00:00:00.043834,,,,,,0.01464290562027665,8,7,3,0.016928074796400606,64,7,2,0.030125450343203505,128,5,1,0.04760920965699831,64.0,3.0,1.0,,,,,,,,4,,,,,,,,PRUNED
10,0.7585601417594898,2026-10-06 09:39:09.932362,2026-10-06 09:39:50.362132,0 days 00:00:40.429770,0.9068515559725695,0.9652028519024756,0.008094454562649891,1.1990413778055588e-06,200.0,0.047396519251223214,16,5,3,0.04780785829889703,64,3,1,0.03788623593360378,128,5,1,0.03128492670279544,64.0,5.0,2.0,0.010567689211659854,256.0,3.0,1.0,128,0.8770937470127276,5.0,5,Adam,,,,49.0,0.7681818181818182,0.7489384653371616,COMPLETE
11,0.7831636709596757,2026-10-06 09:39:50.493933,2026-10-06 09:40:31.201664,0 days 00:00:40.707731,0.9234044305725273,0.9541833898470133,0.008680399316661742,1.4211537482266188e-06,200.0,0.04997449754566205,16,5,3,0.04976482875798626,64,3,1,0.03726749621045093,128,5,1,0.02941240784789848,64.0,5.0,2.0,0.012725290807332416,256.0,3.0,1.0,128,0.8797484766742464,5.0,5,Adam,,,,50.0,0.7886363636363637,0.7776909782829877,COMPLETE
12,0.3820790624036483,2026-10-06 09:40:31.349502,2026-10-06 09:40:41.210134,0 days 00:00:09.860632,0.8842650747520039,0.9829644884150359,0.009256762816668472,1.0020121013332432e-06,200.0,0.04126429735539777,16,5,3,0.04967760384215255,64,3,1,0.03794030830388812,128,5,1,0.02886808751750585,64.0,5.0,2.0,0.010834250085608765,256.0,3.0,1.0,128,0.8946581082665175,5.0,5,Adam,,,,,,,PRUNED
13,0.8085641056664515,2026-10-06 09:40:41.341843,2026-10-06 09:41:24.292327,0 days 00:00:42.950484,0.9043638827215468,0.9672303787053823,0.007466393343635783,1.1645392808873212e-06,200.0,0.0497381665119616,16,5,3,0.049971258501778,64,3,1,0.037581906674513214,128,5,1,0.028905316894243097,64.0,5.0,2.0,0.010558299437951753,256.0,3.0,1.0,128,0.7332333606709378,5.0,5,Adam,,,,49.0,0.8159090909090909,0.8012191204238122,COMPLETE
14,0.8226118657647359,2026-10-06 09:41:24.440809,2026-10-06 09:42:09.105070,0 days 00:00:44.664261,0.9230148335473551,0.9582169488961771,0.00013179982344396247,2.0545443406781412e-05,200.0,0.040584030303139056,16,5,3,0.041210754070311134,64,3,1,0.035019922580378525,128,5,1,0.02553470521396313,64.0,5.0,2.0,0.015831378651663133,512.0,3.0,1.0,128,0.6377645040077792,9.0,5,Adam,,,,49.0,0.8340909090909091,0.8111328224385626,COMPLETE
15,0.8352863871901559,2026-10-06 09:42:09.235972,2026-10-06 09:42:54.835603,0 days 00:00:45.599631,0.8509212329449024,0.9964074773138714,0.0001051157190732573,8.062074205572439e-05,64.0,0.03947292536234723,16,5,3,0.04144030414778589,64,3,1,0.04545667098500652,128,5,1,0.02237208792504588,64.0,5.0,2.0,0.02431041743613676,512.0,3.0,1.0,128,0.627440743253428,10.0,5,Adam,,,,41.0,0.8454545454545455,0.8251182289257665,COMPLETE
16,0.7645356815189955,2026-10-06 09:42:54.965353,2026-10-06 09:43:23.753032,0 days 00:00:28.787679,0.8508735526484541,0.9984291679345484,0.0001029720190831862,8.679482832481255e-05,64.0,0.036960326489334866,16,5,3,0.04148490235149839,64,3,1,0.04811179336302722,32,5,1,0.02200457578008453,64.0,5.0,2.0,0.0265113085936092,512.0,3.0,1.0,128,0.5498055165172532,10.0,5,Adam,,,,49.0,0.7727272727272727,0.7563440903107184,COMPLETE
17,0.8239652738164487,2026-10-06 09:43:23.884195,2026-10-06 09:44:09.396851,0 days 00:00:45.512656,0.857978405990891,0.909691209915485,0.00010684925414537049,8.863869502078965e-05,64.0,0.03734197234929253,16,5,3,0.03272002304008659,64,3,1,0.04407979186983002,128,5,1,0.010647813764797592,64.0,5.0,2.0,0.028137060976009834,512.0,3.0,1.0,128,0.5673256152816335,20.0,5,Adam,,,,46.0,0.8386363636363636,0.8092941839965337,COMPLETE
18,,2026-10-06 09:44:09.527430,2026-10-06 09:44:09.585170,0 days 00:00:00.057740,,,,,,0.03545951953247563,32,5,3,0.03187657521233667,16,3,1,0.04354200689528868,128,5,2,0.01046631711221219,256.0,5.0,1.0,0.02770062988994653,512.0,3.0,1.0,,,,5,,,,,,,,PRUNED
19,0.8362508462719411,2026-10-06 09:44:09.716235,2026-10-06 09:44:42.049921,0 days 00:00:32.333686,0.8532872967772989,0.904236063644917,0.00027202788797810987,0.0003109518519015786,64.0,0.024022222978350063,16,5,3,0.03276324015255924,32,3,1,0.0431768070259334,128,5,1,0.010162769296756528,128.0,5.0,2.0,,,,,128,0.44525427962379516,19.0,4,Adam,,,,49.0,0.8454545454545455,0.8270471470893368,COMPLETE
20,0.4321028523720918,2026-10-06 09:44:42.181174,2026-10-06 09:44:52.698185,0 days 00:00:10.517011,,,,,64.0,0.02284535982044104,16,5,3,0.04493397958332586,32,3,1,0.04963785980034574,32,5,1,0.02109718259201341,128.0,5.0,2.0,,,,,128,0.41916626684003677,20.0,4,SGD,0.07477810443016279,0.705514521115998,0.006721745240881962,,,,PRUNED
21,0.8245102876097408,2026-10-06 09:44:52.830592,2026-10-06 09:45:32.968807,0 days 00:00:40.138215,0.8516362958437942,0.9056111768979435,0.0002725049230791881,0.00028577909304487037,64.0,0.024944160622836213,16,5,3,0.0329744076799361,32,3,1,0.043780610600598874,128,5,1,0.011538678416981911,128.0,5.0,2.0,,,,,128,0.47068196923366784,20.0,4,Adam,,,,49.0,0.8340909090909091,0.8149296661285723,COMPLETE
22,0.8541391267950834,2026-10-06 09:45:33.125318,2026-10-06 09:46:13.916858,0 days 00:00:40.791540,0.8676786770942803,0.9020311469115347,0.00033753346418097685,0.0006641193051470933,64.0,0.024280836676781523,16,5,3,0.03162801759293095,32,3,1,0.045550765906231167,128,5,1,0.01354707674623661,128.0,5.0,2.0,,,,,128,0.4490278900980347,18.0,4,Adam,,,,49.0,0.8636363636363636,0.8446418899538032,COMPLETE
23,0.8288558823082621,2026-10-06 09:46:14.077681,2026-10-06 09:46:53.887224,0 days 00:00:39.809543,0.8765504551992077,0.9186995570788749,0.00037921136204050105,0.0014125472733176327,64.0,0.02725189523061279,16,5,3,0.02845178813915159,32,3,1,0.0463400050324307,128,5,1,0.014705776265416555,128.0,5.0,2.0,,,,,128,0.38899462381026334,18.0,4,Adam,,,,49.0,0.8409090909090909,0.8168026737074332,COMPLETE
24,0.8714881461953801,2026-10-06 09:46:54.048337,2026-10-06 09:47:33.807650,0 days 00:00:39.759313,0.8783062418041263,0.9026913695231165,0.00037407537700119396,0.007616832687209448,64.0,0.018792402434634644,16,5,3,0.03736400537839205,32,3,1,0.04125036495480082,128,5,1,0.02084332674815402,128.0,5.0,2.0,,,,,256,0.27854119981269937,14.0,4,Adam,,,,50.0,0.8772727272727273,0.8657035651180328,COMPLETE
25,0.8583314205248683,2026-10-06 09:47:33.963417,2026-10-06 09:48:16.113458,0 days 00:00:42.150041,0.8805229105021686,0.9002269719302715,0.0005499005141435169,0.009076976005706838,64.0,0.01796491213880483,32,5,3,0.010170625943873458,32,3,1,0.04116850190286736,128,5,1,0.01878105258457516,128.0,5.0,2.0,,,,,256,0.2926852653306412,14.0,4,Adam,,,,45.0,0.865909090909091,0.8507537501406457,COMPLETE
26,,2026-10-06 09:48:16.272663,2026-10-06 09:48:16.337941,0 days 00:00:00.065278,,,,,,0.018726567589865063,32,5,3,0.012191830497054761,32,3,2,0.03301502847508017,128,3,2,0.01934887481926299,128.0,3.0,2.0,,,,,,,,4,,,,,,,,PRUNED
27,0.4564469928735897,2026-10-06 09:48:16.530906,2026-10-06 09:48:30.797696,0 days 00:00:14.266790,0.8797043277629976,0.9001222284153695,0.000620766114950718,0.008402305742365671,64.0,0.010477981825823999,32,5,3,0.02399169567607011,32,3,1,0.04106809929584258,128,5,1,0.024879185795244788,128.0,5.0,1.0,,,,,256,0.25599695256504323,14.0,4,Adam,,,,,,,PRUNED
28,0.5083792576763431,2026-10-06 09:48:30.954027,2026-10-06 09:48:40.368321,0 days 00:00:09.414294,0.8903881825664222,0.9196395458007618,0.0007475719827775953,0.008682029708626532,64.0,0.01945526303758315,32,5,3,0.011460451399054168,32,5,1,0.04025862875028963,32,5,1,,,,,,,,,256,0.29893018979483976,13.0,3,Adam,,,,,,,PRUNED
29,0.9042782143092702,2026-10-06 09:48:40.526767,2026-10-06 09:49:04.664027,0 days 00:00:24.137260,0.870391747743317,0.9169721830058762,0.0011116206471658812,0.00277368690788974,128.0,0.013904730306296808,32,5,3,0.036292790099013324,32,3,2,0.03312460393230403,128,3,1,0.03598979651236012,128.0,5.0,2.0,,,,,256,0.11357549692179303,12.0,4,Adam,,,,49.0,0.9204545454545454,0.888101883163995,COMPLETE
30,,2026-10-06 09:49:04.820526,2026-10-06 09:49:04.881288,0 days 00:00:00.060762,,,,,,0.014177973727293836,32,5,3,0.03640231837274212,32,5,2,0.026180167058002767,64,3,1,0.036869344679605565,128.0,5.0,2.0,,,,,,,,4,,,,,,,,PRUNED
31,0.8850394699897031,2026-10-06 09:49:05.043231,2026-10-06 09:49:28.943246,0 days 00:00:23.900015,0.8710999068176563,0.9153408984065562,0.0017558554099558366,0.0027784787848255787,128.0,0.018321815481682355,32,5,3,0.03862428335431794,32,3,2,0.03380196431426112,128,3,1,0.04842541343163108,128.0,5.0,2.0,,,,,256,0.11348399359437611,12.0,4,Adam,,,,47.0,0.9,0.870078939979406,COMPLETE
32,0.865692336969093,2026-10-06 09:49:29.105285,2026-10-06 09:49:52.934828,0 days 00:00:23.829543,0.8954075805572278,0.9199603541526252,0.0015186088949660497,0.0034508511525593974,128.0,0.01800743525827484,32,5,3,0.038662943611342405,32,3,2,0.03265015981680854,128,3,1,0.04817317614448342,128.0,5.0,2.0,,,,,256,0.10482820231469098,13.0,4,Adam,,,,34.0,0.8795454545454545,0.8518392193927313,COMPLETE
33,0.8840101415785202,2026-10-06 09:49:53.091739,2026-10-06 09:50:16.591187,0 days 00:00:23.499448,0.8942715485688213,0.9234528345847917,0.0016810910336323148,0.003072232561971286,128.0,0.011599424958979008,32,5,3,0.03911841067329829,16,3,2,0.032690296490731664,128,3,1,0.0492743760930871,128.0,5.0,2.0,,,,,256,0.1331971001348216,12.0,4,Adam,,,,50.0,0.9,0.8680202831570404,COMPLETE
34,0.9037324714163518,2026-10-06 09:50:16.748487,2026-10-06 09:50:40.299599,0 days 00:00:23.551112,0.8673835525145402,0.9308548663721796,0.0022830941381712364,0.003086878979481405,128.0,0.01018379964401903,32,5,3,0.0433923295563674,16,3,2,0.030088650346053267,128,3,1,0.04404587733426555,128.0,5.0,2.0,,,,,256,0.10023730217173665,11.0,4,Adam,,,,47.0,0.9136363636363637,0.89382857919634,COMPLETE
35,0.5147476085354649,2026-10-06 09:50:40.456765,2026-10-06 09:50:44.386043,0 days 00:00:03.929278,,,,,128.0,0.010627901890380268,32,5,3,0.0446118121625176,16,3,2,0.02385831540418642,64,3,1,,,,,,,,,256,0.1194814684425815,11.0,3,SGD,0.0899811392224432,0.8174458025152554,1.5606650403845544e-06,,,,PRUNED
36,0.641248709571024,2026-10-06 09:50:44.546998,2026-10-06 09:50:54.084122,0 days 00:00:09.537124,0.8660367401520688,0.9333063945837597,0.002231481149748845,0.0027224454690123736,128.0,0.013212490624346013,32,5,3,0.04415585307561759,16,5,2,0.02959689670411582,128,3,1,0.04380254500898076,128.0,3.0,1.0,,,,,256,0.14792981967782204,12.0,4,Adam,,,,,,,PRUNED
37,0.8673684472803931,2026-10-06 09:50:54.249414,2026-10-06 09:51:14.562015,0 days 00:00:20.312601,0.8680024723060009,0.9408771494715051,0.003370862691404309,0.0007923111095340016,128.0,0.015357040035204958,32,5,3,0.035354869402947214,16,7,2,0.026775952664451468,128,3,2,,,,,,,,,256,0.19705706927483208,8.0,3,Adam,,,,50.0,0.8818181818181818,0.8529187127426043,COMPLETE
38,0.8708731836293377,2026-10-06 09:51:14.722962,2026-10-06 09:51:36.720860,0 days 00:00:21.997898,,,,,128.0,0.01219035502590487,32,7,3,0.039802698433687146,16,3,2,0.023038543660004532,64,3,1,0.04988343548197098,128.0,5.0,2.0,,,,,256,0.16807444710388564,12.0,4,SGD,0.008248781347019696,0.9877433819713641,0.00034986078586939984,50.0,0.8863636363636364,0.8553827308950391,COMPLETE
39,0.4836310275435477,2026-10-06 09:51:36.877077,2026-10-06 09:51:41.002812,0 days 00:00:04.125735,0.9005874819051598,0.9278266051001539,0.0013630166426345403,0.003909589211647073,128.0,0.011919003959131364,32,7,3,0.04343589575389148,16,5,2,0.03222398651685491,32,3,1,,,,,,,,,256,0.2357440608672319,11.0,3,Adam,,,,,,,PRUNED
40,,2026-10-06 09:51:41.166983,2026-10-06 09:51:41.228181,0 days 00:00:00.061198,,,,,,0.016122728039478812,32,5,3,0.029511935717293422,16,3,2,0.03512618239448932,128,3,2,0.04329854796309039,128.0,3.0,1.0,,,,,,,,4,,,,,,,,PRUNED
41,0.8941547187933923,2026-10-06 09:51:41.388099,2026-10-06 09:52:05.235394,0 days 00:00:23.847295,0.8708141601495406,0.9118450386141153,0.0023624479162869744,0.003779314448863264,128.0,0.020597978986622405,32,5,3,0.035382609454983345,16,3,2,0.03035321027354961,128,3,1,0.03811152066343595,128.0,5.0,2.0,,,,,256,0.10505291428521629,13.0,4,Adam,,,,47.0,0.9113636363636364,0.876945801223148,COMPLETE
42,0.8814927536767432,2026-10-06 09:52:05.397106,2026-10-06 09:52:29.172707,0 days 00:00:23.775601,0.8672528109075632,0.9132130678854199,0.002450088271468563,0.0018264484315061917,128.0,0.021496648683867425,32,5,3,0.0349189869085291,16,3,2,0.03100059458474592,128,3,1,0.03738880405701524,128.0,5.0,2.0,,,,,256,0.10055358543402396,11.0,4,Adam,,,,45.0,0.9,0.8629855073534863,COMPLETE
43,,2026-10-06 09:52:29.333484,2026-10-06 09:52:29.390017,0 days 00:00:00.056533,,,,,,0.02043478182639276,32,5,3,0.03863214309994234,16,7,2,0.010387946782023632,128,3,1,0.04482893726803727,128.0,5.0,2.0,,,,,,,,4,,,,,,,,PRUNED
44,0.8691369205899546,2026-10-06 09:52:29.546935,2026-10-06 09:52:52.868558,0 days 00:00:23.321623,0.9145895967728043,0.9259611230932574,0.0019056156615047826,0.0039007902297717154,128.0,0.01679999267790777,32,5,3,0.04678533904707332,16,3,2,0.028401349207826214,128,3,1,0.03939613820593629,256.0,5.0,2.0,,,,,256,0.1591032943758589,13.0,4,Adam,,,,50.0,0.884090909090909,0.8541829320890002,COMPLETE
45,0.8805857639527839,2026-10-06 09:52:53.024146,2026-10-06 09:53:15.851422,0 days 00:00:22.827276,0.8901398093802958,0.9154447350716738,0.0008799425866152513,0.0009116050098062516,128.0,0.01378062572863358,8,7,3,0.0423028488113859,16,3,2,0.034777167991380774,128,3,1,0.034811740963364514,128.0,5.0,2.0,,,,,256,0.22110509136965212,15.0,4,Adam,,,,49.0,0.8977272727272727,0.8634442551782949,COMPLETE
46,0.8620189907513616,2026-10-06 09:53:16.009994,2026-10-06 09:53:36.745716,0 days 00:00:20.735722,,,,,128.0,0.011907230487372614,32,5,3,0.039684713730026196,16,7,2,0.021198367605218052,64,3,1,0.041273260473529666,128.0,3.0,2.0,,,,,512,0.16084065629767366,10.0,4,SGD,0.008960449306033612,0.8103225946811213,1.9047803613558514e-06,50.0,0.8727272727272727,0.8513107087754503,COMPLETE
47,0.8530595963419638,2026-10-06 09:53:36.903364,2026-10-06 09:54:00.125203,0 days 00:00:23.221839,0.8713547614159222,0.9442256066429824,0.003636832651346855,0.0043201887633077096,128.0,0.016245007843447953,32,5,3,0.03492463932533688,16,3,2,0.027275233975890417,128,3,1,0.045845736672333624,128.0,5.0,2.0,,,,,256,0.14064117542091276,12.0,4,Adam,,,,44.0,0.8568181818181818,0.8493010108657459,COMPLETE
48,,2026-10-06 09:54:00.284280,2026-10-06 09:54:00.341931,0 days 00:00:00.057651,,,,,,0.010018395510551148,32,7,3,0.04682025600734342,16,3,2,0.036062672280907836,128,3,2,0.0421083910917891,256.0,5.0,1.0,,,,,,,,4,,,,,,,,PRUNED
49,0.8329537387709824,2026-10-06 09:54:00.502589,2026-10-06 09:54:21.045416,0 days 00:00:20.542827,0.8601996746089067,0.9253577883183914,0.0012559662102391907,0.0017614205235013361,128.0,0.027469958709974485,8,5,3,0.037180023442255704,16,3,2,0.031007061142745217,32,3,1,0.047922054472238386,128.0,5.0,2.0,,,,,512,0.19975072004222844,15.0,4,Adam,,,,38.0,0.8545454545454545,0.8113620229965103,COMPLETE
50,0.20540014558276554,2026-10-06 09:54:21.200569,2026-10-06 09:54:25.220417,0 days 00:00:04.019848,,,,,128.0,0.014590832832362413,32,5,3,0.04042558130703093,16,3,2,0.03365833269213413,128,3,1,,,,,,,,,256,0.10978276640999307,13.0,3,SGD,0.0001019102849329182,0.984507347169304,0.00024150262539528118,,,,PRUNED
51,0.8678371709747139,2026-10-06 09:54:25.394379,2026-10-06 09:54:49.119815,0 days 00:00:23.725436,0.9850932662020874,0.9162961478579614,0.0024933296587155893,0.0017914849008207172,128.0,0.021493672637183967,32,5,3,0.03410329733035529,16,3,2,0.03100920477670369,128,3,1,0.03873251082194646,128.0,5.0,2.0,,,,,256,0.11218924422136242,11.0,4,Adam,,,,46.0,0.8772727272727273,0.8584016146767006,COMPLETE
52,0.8946224187052775,2026-10-06 09:54:49.286266,2026-10-06 09:55:12.850654,0 days 00:00:23.564388,0.8645173597804142,0.911118289817832,0.0017487763196090726,0.0021257743931906744,128.0,0.02026327052146305,32,5,3,0.029753264771776,16,3,2,0.028871571088843192,128,3,1,0.03465541204022453,128.0,5.0,2.0,,,,,256,0.10104080745878656,11.0,4,Adam,,,,49.0,0.9090909090909091,0.8801539283196459,COMPLETE
53,0.88725652687095,2026-10-06 09:55:13.011064,2026-10-06 09:55:36.627365,0 days 00:00:23.616301,0.8614463811515187,0.9123292193201551,0.0010348985417363184,0.002760683956879331,128.0,0.017467259291420505,32,5,3,0.03040518604906725,16,3,2,0.028505585306187416,128,3,1,0.03404892742868462,128.0,5.0,2.0,,,,,256,0.18756411421406716,9.0,4,Adam,,,,45.0,0.9045454545454545,0.8699675991964455,COMPLETE
54,0.899521943888141,2026-10-06 09:55:36.786342,2026-10-06 09:56:00.600829,0 days 00:00:23.814487,0.8604020103696615,0.9110563969423803,0.0011088887977550564,0.0012175481643012182,128.0,0.02039510623850597,32,5,3,0.026034355218581433,16,3,2,0.025265040884927224,128,3,1,0.033011868167730544,128.0,5.0,2.0,,,,,256,0.19401682634626477,7.0,4,Adam,,,,47.0,0.9159090909090909,0.8831347968671911,COMPLETE
55,0.8749751644488486,2026-10-06 09:56:00.761698,2026-10-06 09:56:24.402042,0 days 00:00:23.640344,0.8610992000305414,0.9103055599731856,0.0009533460633464586,0.00046431895757920416,128.0,0.02041372141314126,32,5,3,0.019805126459104733,16,3,2,0.025032447911359987,128,3,1,0.03290255571747892,128.0,5.0,2.0,,,,,256,0.18789060562956816,7.0,4,Adam,,,,40.0,0.8909090909090909,0.8590412379886063,COMPLETE
56,0.8492421585469765,2026-10-06 09:56:24.564931,2026-10-06 09:56:47.682218,0 days 00:00:23.117287,0.9508322162290341,0.909196763034008,0.0010906576292894338,0.0011565083043419105,128.0,0.027388880306353364,8,5,3,0.026849870024611228,16,3,2,0.02837464201208663,128,3,1,0.03488654804795968,256.0,5.0,2.0,,,,,256,0.20787455280212652,7.0,4,Adam,,,,40.0,0.8681818181818182,0.8303024989121349,COMPLETE
