number,value,datetime_start,datetime_complete,duration,params_adam_beta1,params_adam_beta2,params_adam_lr,params_adam_wd,params_batch_size,params_block_0_dropout,params_block_0_filters,params_block_0_kernel,params_block_0_stride,params_block_1_dropout,params_block_1_filters,params_block_1_kernel,params_block_1_stride,params_block_2_dropout,params_block_2_filters,params_block_2_kernel,params_block_2_stride,params_block_3_dropout,params_block_3_filters,params_block_3_kernel,params_block_3_stride,params_block_4_dropout,params_block_4_filters,params_block_4_kernel,params_block_4_stride,params_fc_hidden,params_lr_factor,params_lr_patience,params_n_blocks,params_optimizer,params_sgd_lr,params_sgd_momentum,params_sgd_wd,user_attrs_best_epoch,user_attrs_validation_accuracy,user_attrs_validation_macro_f1,state
57,0.5472530074259039,2026-10-06 09:56:47.840575,2026-10-06 09:56:52.355545,0 days 00:00:04.514970,0.8609311233976036,0.908066459924711,0.005625356137817639,0.004665403633764537,128.0,0.02313875731561476,32,5,3,0.030264897950645145,16,7,2,0.021058436813157742,128,3,1,0.0337910217896914,128.0,3.0,2.0,,,,,512,0.3349977042415908,9.0,4,Adam,,,,,,,PRUNED
58,0.9077264307473147,2026-10-06 09:56:52.517828,2026-10-06 09:57:16.981372,0 days 00:00:24.463544,0.8740066843313427,0.9321711712018808,0.004393254013785451,0.0020914546913957596,128.0,0.017135392992388723,32,5,3,0.02423969450557325,16,3,2,0.029488807663406183,128,3,1,0.031606593292585666,128.0,5.0,2.0,,,,,256,0.1755809363963336,9.0,4,Adam,,,,45.0,0.9181818181818182,0.8972710433128112,COMPLETE
59,,2026-10-06 09:57:17.136392,2026-10-06 09:57:17.197669,0 days 00:00:00.061277,,,,,,0.02582088870987621,32,7,3,0.022001495927169913,16,5,2,0.016311892871015192,128,3,2,0.030650766305969687,128.0,5.0,2.0,,,,,,,,4,,,,,,,,PRUNED
60,0.8940165005991546,2026-10-06 09:57:17.352323,2026-10-06 09:57:36.274245,0 days 00:00:18.921922,0.8841957175158726,0.9340109614456354,0.005242926083809991,0.0013410266477021963,200.0,0.0201167153095728,32,5,3,0.025599759462713974,16,3,2,0.024985644897300707,32,3,1,0.026337472989762734,128.0,5.0,2.0,,,,,256,0.2568541035723821,6.0,4,Adam,,,,37.0,0.9068181818181819,0.8812148193801274,COMPLETE
61,0.8971430934568494,2026-10-06 09:57:36.433342,2026-10-06 09:57:55.456486,0 days 00:00:19.023144,0.885772019639608,0.936676684275342,0.004753459885162541,0.0013247938885129894,200.0,0.020356909774081076,32,5,3,0.025340174850535,16,3,2,0.02598804466599018,32,3,1,0.026918337177248633,128.0,5.0,2.0,,,,,256,0.23651359609332645,6.0,4,Adam,,,,50.0,0.9068181818181819,0.8874680050955169,COMPLETE
62,0.8788672359401887,2026-10-06 09:57:55.613485,2026-10-06 09:58:14.501196,0 days 00:00:18.887711,0.8745066775759849,0.9462872801355974,0.004204529525276043,0.0006301522030832564,200.0,0.022985913066129952,32,5,3,0.02432841712205395,16,3,2,0.022470017196846163,32,3,1,0.027614369540707825,128.0,5.0,2.0,,,,,256,0.1581586984939537,6.0,4,Adam,,,,42.0,0.8931818181818182,0.8645526536985592,COMPLETE
63,0.5622755219750015,2026-10-06 09:58:14.656058,2026-10-06 09:58:18.465683,0 days 00:00:03.809625,0.8840473315582041,0.9388534488522791,0.0062691933718463455,0.0020495648649689526,200.0,0.015504739554109375,32,5,3,0.022288711548526057,16,3,2,0.025864687968286074,32,3,1,0.03177682285202982,128.0,5.0,2.0,,,,,256,0.24355616529618893,8.0,4,Adam,,,,,,,PRUNED
64,0.8808872263716003,2026-10-06 09:58:18.621732,2026-10-06 09:58:37.354565,0 days 00:00:18.732833,0.8733488581840619,0.9296236520976731,0.003043828361051399,0.0009755112945600532,200.0,0.013100111813582956,32,5,3,0.02696194562901442,16,3,2,0.029841692822162785,32,3,1,0.03023644957348277,128.0,5.0,2.0,,,,,256,0.3299132288321648,7.0,4,Adam,,,,36.0,0.8954545454545455,0.866319907288655,COMPLETE
65,0.7399491461111734,2026-10-06 09:58:37.514347,2026-10-06 09:58:49.849462,0 days 00:00:12.335115,0.8563794707690437,0.9495871520250289,0.004421073372776187,0.005470543571476265,128.0,0.021977619373285257,32,5,3,0.019067513333236714,16,3,2,0.018165417123602725,32,3,1,0.0362862545930468,64.0,5.0,2.0,,,,,256,0.18122511199987631,10.0,4,Adam,,,,,,,PRUNED
66,0.8923809592411012,2026-10-06 09:58:50.007994,2026-10-06 09:59:14.392042,0 days 00:00:24.384048,0.8866286231373968,0.9217904197978926,0.0021767150387137987,0.005583505404468998,128.0,0.016939779248178216,32,5,3,0.028715673463661648,16,3,2,0.02736047812264847,128,3,1,0.03842936435773897,128.0,5.0,2.0,,,,,256,0.2250997832640113,6.0,4,Adam,,,,50.0,0.9045454545454545,0.8802164639367478,COMPLETE
67,0.4864945503117783,2026-10-06 09:59:14.551823,2026-10-06 09:59:19.417249,0 days 00:00:04.865426,0.8636641963023088,0.9353813293071539,0.007452037517494816,0.0003980980469656175,200.0,0.029659202941646614,8,5,3,0.025329182760690027,64,3,2,0.02956394535772905,64,3,1,0.040021660670925115,128.0,5.0,1.0,,,,,256,0.13837479856169396,9.0,4,Adam,,,,,,,PRUNED
68,0.8872457308196662,2026-10-06 09:59:19.572421,2026-10-06 09:59:43.656623,0 days 00:00:24.084202,0.8774403835120991,0.9326826953382001,0.0028704021880743016,0.00019892462428342607,128.0,0.04556724582365836,32,5,3,0.023751152946992177,16,3,2,0.03187820353656172,128,3,1,0.032407242782061314,256.0,5.0,2.0,,,,,512,0.1377965861356192,10.0,4,Adam,,,,46.0,0.9022727272727272,0.8722187343666052,COMPLETE
69,0.8865021190636255,2026-10-06 09:59:43.816092,2026-10-06 10:00:08.065924,0 days 00:00:24.249832,0.8560263115119291,0.9577623847431215,0.0014009218494364494,0.002230448121632523,128.0,0.01945228422277658,32,5,3,0.02222235076558946,16,3,2,0.023759443845274807,128,3,1,0.028199303101150774,128.0,5.0,2.0,,,,,256,0.2719235191190604,5.0,4,Adam,,,,36.0,0.9045454545454545,0.8684587835817966,COMPLETE
70,,2026-10-06 10:00:08.218278,2026-10-06 10:00:08.288660,0 days 00:00:00.070382,,,,,,0.025501645059237882,32,5,3,0.031131940431566363,16,3,2,0.027425814031150835,128,3,1,0.03601526439462608,128.0,5.0,2.0,0.04928771532490436,128.0,3.0,1.0,,,,5,,,,,,,,PRUNED
71,0.8769176274997881,2026-10-06 10:00:08.441919,2026-10-06 10:00:27.167619,0 days 00:00:18.725700,0.8838729884605281,0.938483878594773,0.005178750940826721,0.001120056104617674,200.0,0.020545088010008133,32,5,3,0.025653860453516045,16,3,2,0.02507723532751334,32,3,1,0.02615609259776994,128.0,5.0,2.0,,,,,256,0.23903704755936564,6.0,4,Adam,,,,46.0,0.8954545454545455,0.8583807095450308,COMPLETE
72,0.6364927097271345,2026-10-06 10:00:27.323307,2026-10-06 10:00:31.113392,0 days 00:00:03.790085,0.8746206745098127,0.930410659824098,0.00482761895602425,0.0013084713829380425,200.0,0.019505330307161374,32,5,3,0.02739416716078052,16,3,2,0.025867953128319528,32,3,1,0.02355481825146554,128.0,5.0,2.0,,,,,256,0.31730772580928546,8.0,4,Adam,,,,,,,PRUNED
73,0.5984610565173647,2026-10-06 10:00:31.272764,2026-10-06 10:00:35.048892,0 days 00:00:03.776128,0.8694706340583541,0.9427519926317806,0.006287661740417115,0.0015251921877255691,200.0,0.014948042259850339,32,5,3,0.025585829837136177,16,3,2,0.022249344354993976,32,3,1,0.0272147379168807,128.0,5.0,2.0,,,,,256,0.16946396713070516,6.0,4,Adam,,,,,,,PRUNED
74,0.8892970698923773,2026-10-06 10:00:35.213295,2026-10-06 10:00:53.935472,0 days 00:00:18.722177,0.8818330913249626,0.9061932483415455,0.003951368487434298,0.000570076859996832,200.0,0.022078028704379096,32,5,3,0.021065470687769476,16,3,2,0.029092241491332643,32,3,1,0.029372810970310786,128.0,5.0,2.0,,,,,256,0.26136544467913464,7.0,4,Adam,,,,48.0,0.9022727272727272,0.8763214125120274,COMPLETE
75,0.8368464861553935,2026-10-06 10:00:54.099214,2026-10-06 10:01:12.931651,0 days 00:00:18.832437,0.9002344785279619,0.9354026398510563,0.0028333537076037133,2.410373569875914e-06,200.0,0.024278849968739812,32,5,3,0.02817213832537215,32,3,2,0.024245095687659556,32,3,1,0.024514288795655648,64.0,5.0,2.0,,,,,256,0.3698172836321749,5.0,4,Adam,,,,,,,PRUNED
76,0.8831672168846221,2026-10-06 10:01:13.088354,2026-10-06 10:01:34.695544,0 days 00:00:21.607190,,,,,128.0,0.01790804234122506,32,5,3,0.017868868234408707,64,5,2,0.031126648000616236,32,3,1,0.02639637242891338,128.0,3.0,2.0,,,,,256,0.8312103778198523,11.0,4,SGD,0.014474486785717678,0.7794191287989466,1.4986756723136328e-05,45.0,0.8954545454545455,0.8708798883146986,COMPLETE
77,,2026-10-06 10:01:34.849541,2026-10-06 10:01:34.907444,0 days 00:00:00.057903,,,,,,0.02016010013175496,32,5,3,0.03326721218076751,16,3,2,0.02795031242072401,128,3,2,0.0330093262328536,128.0,5.0,2.0,,,,,,,,4,,,,,,,,PRUNED
78,,2026-10-06 10:01:35.065156,2026-10-06 10:01:35.133869,0 days 00:00:00.068713,,,,,,0.01899263005393606,32,7,3,0.023355221915238616,16,7,2,0.03894542559736011,128,3,1,0.03126472049788361,128.0,5.0,1.0,,,,,,,,4,,,,,,,,PRUNED
79,0.8972323861212124,2026-10-06 10:01:35.295937,2026-10-06 10:02:00.384038,0 days 00:00:25.088101,0.8883414449306104,0.9290990688290084,0.0019437465076516571,0.002087369482622243,128.0,0.013013953203072155,32,5,3,0.026150546915817367,32,3,2,0.019282131514606893,128,3,1,0.03546753815382943,128.0,5.0,2.0,,,,,256,0.21239424176778962,9.0,4,Adam,,,,49.0,0.9090909090909091,0.8853738631515158,COMPLETE
80,0.9116453828819686,2026-10-06 10:02:00.542007,2026-10-06 10:02:25.682398,0 days 00:00:25.140391,0.8889208768398807,0.923022963511253,0.0019035505139028612,0.0060104078973668585,128.0,0.011132600377575168,32,5,3,0.02877122736560452,32,3,2,0.01964763280180585,128,3,1,0.037817266600122204,128.0,5.0,2.0,,,,,256,0.20787394040888876,9.0,4,Adam,,,,50.0,0.925,0.8982907657639372,COMPLETE
81,0.9065927795098019,2026-10-06 10:02:25.839579,2026-10-06 10:02:50.804132,0 days 00:00:24.964553,0.8918790960087478,0.9237044404706115,0.001946067716187571,0.006311704116710963,128.0,0.013185625826246309,32,5,3,0.029121315475382784,32,3,2,0.01308120984625795,128,3,1,0.03749440175129463,128.0,5.0,2.0,,,,,256,0.22025044502539112,9.0,4,Adam,,,,35.0,0.9181818181818182,0.8950037408377857,COMPLETE
82,0.8879060147069573,2026-10-06 10:02:50.963218,2026-10-06 10:03:15.618047,0 days 00:00:24.654829,0.9101080671771749,0.9227353899470367,0.0019316276462782768,0.006810346230442168,128.0,0.010976765039394706,32,5,3,0.02913254132979995,32,3,2,0.013142417314578403,128,3,1,0.0352113667551888,128.0,5.0,2.0,,,,,256,0.21396310941624347,9.0,4,Adam,,,,50.0,0.9,0.8758120294139146,COMPLETE
83,0.9139047207255637,2026-10-06 10:03:15.774311,2026-10-06 10:03:40.279468,0 days 00:00:24.505157,0.8934868725522135,0.9277519870901197,0.0016363486724350665,0.002410012256123243,128.0,0.01313836425321569,32,5,3,0.026494480921705723,32,3,2,0.018922513672584757,128,3,1,0.037568871462543924,128.0,5.0,2.0,,,,,256,0.18048274452391622,9.0,4,Adam,,,,40.0,0.9272727272727272,0.9005367141784003,COMPLETE
84,0.8989501413054408,2026-10-06 10:03:40.434774,2026-10-06 10:04:05.029947,0 days 00:00:24.595173,0.8961657106013046,0.9289497544211026,0.0015289344792173518,0.005824954156080864,128.0,0.013181241531610429,32,5,3,0.026173072605694826,32,3,2,0.018052942894837474,128,3,1,0.03767059096913178,128.0,5.0,2.0,,,,,256,0.29662477673560717,8.0,4,Adam,,,,36.0,0.9090909090909091,0.8888093735199725,COMPLETE
85,0.895155491716847,2026-10-06 10:04:05.189131,2026-10-06 10:04:29.934820,0 days 00:00:24.745689,0.8956001321057837,0.9278760319620182,0.0012166726790205592,0.009733482863628606,128.0,0.01285864237651263,32,5,3,0.026586943282884308,32,3,2,0.018516357926543808,128,3,1,0.037582189509419675,128.0,5.0,2.0,,,,,256,0.298057380991615,8.0,4,Adam,,,,47.0,0.9090909090909091,0.881220074342785,COMPLETE
86,0.8743776072607056,2026-10-06 10:04:30.098113,2026-10-06 10:04:51.781763,0 days 00:00:21.683650,0.9057906960500899,0.9181323675854336,0.0014970280781526114,0.006878394685924951,128.0,0.013905292965633852,8,5,3,0.015327009099445272,32,3,2,0.01381794217409631,128,3,1,0.040845040906490986,64.0,5.0,2.0,,,,,256,0.2088186797685852,9.0,4,Adam,,,,34.0,0.8954545454545455,0.8533006690668656,COMPLETE
87,0.9048569073664594,2026-10-06 10:04:51.937496,2026-10-06 10:05:14.417467,0 days 00:00:22.479971,0.8910793538583368,0.925221756740197,0.0006904329731702265,0.0027403961307269644,128.0,0.011114025097822347,32,5,3,0.028338090455993666,32,3,2,0.016740857956465134,128,3,1,0.036192223414201447,128.0,3.0,2.0,,,,,256,0.17942747929148037,10.0,4,Adam,,,,47.0,0.9181818181818182,0.8915319965511006,COMPLETE
88,,2026-10-06 10:05:14.573125,2026-10-06 10:05:14.636502,0 days 00:00:00.063377,,,,,,0.011341238974216789,32,5,3,0.027778878120846548,32,3,2,0.015593175466564885,128,3,2,0.039997493248875256,128.0,3.0,2.0,,,,,,,,4,,,,,,,,PRUNED
89,0.900947384188509,2026-10-06 10:05:14.792348,2026-10-06 10:05:38.077752,0 days 00:00:23.285404,0.8948771978037108,0.9235780872269499,0.0008170797418796881,0.005627510987597837,128.0,0.010067497771085227,32,5,3,0.03131292702564019,32,5,2,0.016271817075462505,128,3,1,0.042435495705168774,256.0,3.0,2.0,,,,,256,0.696477496703654,10.0,4,Adam,,,,42.0,0.9113636363636364,0.8905311320133816,COMPLETE
90,0.41159291229464556,2026-10-06 10:05:38.232626,2026-10-06 10:05:42.835940,0 days 00:00:04.603314,,,,,128.0,0.010349276084674433,16,7,3,0.03129494807173188,32,5,2,0.011064374478580486,128,3,1,0.04647437102409841,256.0,3.0,1.0,,,,,128,0.686737987655642,10.0,4,SGD,0.0012654203070735653,0.9000176273354912,0.0014302974470870248,,,,PRUNED
91,0.8723573059876731,2026-10-06 10:05:42.992543,2026-10-06 10:06:06.500131,0 days 00:00:23.507588,0.8992157891756073,0.9245144969331454,0.0007866840085891485,0.00600610935894818,128.0,0.011577765678104358,32,5,3,0.032112380668994855,32,5,2,0.016214764054098475,128,3,1,0.04346150763668194,256.0,3.0,2.0,,,,,256,0.14186905154729784,10.0,4,Adam,,,,35.0,0.8886363636363637,0.8560782483389826,COMPLETE
92,0.876721087867238,2026-10-06 10:06:06.660896,2026-10-06 10:06:30.284616,0 days 00:00:23.623720,0.892921041208599,0.9206470204851348,0.0006489281002207051,0.0029382052850908656,128.0,0.012327629391894622,32,5,3,0.028256558686728928,32,5,2,0.015062840896545679,128,3,1,0.04211495327341269,256.0,3.0,2.0,,,,,256,0.5236410216210634,8.0,4,Adam,,,,46.0,0.8909090909090909,0.8625330848253853,COMPLETE
93,0.8972846108945534,2026-10-06 10:06:30.446464,2026-10-06 10:06:54.133613,0 days 00:00:23.687149,0.9114350621696036,0.9259830287709581,0.0004799280844365457,0.004612767064918992,128.0,0.014038765522160187,32,5,3,0.024670766474427126,32,5,2,0.017368084506414118,128,3,1,0.03654891193517449,256.0,3.0,2.0,,,,,256,0.7597919205844368,9.0,4,Adam,,,,34.0,0.9090909090909091,0.8854783126981977,COMPLETE
94,0.9178582111924727,2026-10-06 10:06:54.291837,2026-10-06 10:07:16.732651,0 days 00:00:22.440814,0.9003255980218202,0.9308668190121199,0.0011573929308847084,0.0030670188962493667,128.0,0.01562221012021951,32,5,3,0.03076044279731973,32,5,2,0.02032640560585411,128,3,1,0.03934595850678681,128.0,3.0,2.0,,,,,256,0.17550745459117856,10.0,4,Adam,,,,48.0,0.9295454545454546,0.9061709678394907,COMPLETE
95,0.8899817874459449,2026-10-06 10:07:16.887578,2026-10-06 10:07:40.376292,0 days 00:00:23.488714,0.921158752125777,0.917644159836649,0.0008262586631586152,0.003456991851825035,128.0,0.01004358153063829,32,5,3,0.03020265358359274,32,5,2,0.020152371659742253,128,3,1,0.0389628052014168,256.0,3.0,2.0,,,,,256,0.17643362115089586,11.0,4,Adam,,,,49.0,0.9022727272727272,0.8776908476191626,COMPLETE
96,0.8706584069400747,2026-10-06 10:07:40.534765,2026-10-06 10:08:02.815153,0 days 00:00:22.280388,0.9037107308142289,0.9314947245178572,0.0011109416000326113,0.0024642331331244703,128.0,0.015095001861960722,32,5,3,0.03389273013443407,32,5,2,0.011502595020233992,128,3,1,0.04182333806442172,128.0,3.0,2.0,,,,,256,0.594317078437147,10.0,4,Adam,,,,32.0,0.8795454545454545,0.8617713593346948,COMPLETE
97,0.8932240959087812,2026-10-06 10:08:02.976234,2026-10-06 10:08:25.149075,0 days 00:00:22.172841,0.8917650665509638,0.9718747831926743,0.0006793868599073997,0.003661893895013038,128.0,0.015950181155276254,32,5,3,0.031131188763185696,32,5,2,0.016944534899380567,128,3,1,0.04483530913049319,128.0,3.0,2.0,,,,,512,0.13191879717853888,10.0,4,Adam,,,,48.0,0.9068181818181819,0.8796300099993805,COMPLETE
98,0.6560134144395506,2026-10-06 10:08:25.313402,2026-10-06 10:08:29.625206,0 days 00:00:04.311804,0.8785388007936269,0.9228491113826229,0.0005092339018741109,0.0028313507416677253,128.0,0.012222345878078446,32,5,3,0.048722399215957904,32,5,2,0.013813523515904558,64,3,1,0.040631579376120434,128.0,3.0,2.0,,,,,256,0.16022882743980912,11.0,4,Adam,,,,,,,PRUNED
99,0.9084903715585115,2026-10-06 10:08:29.780251,2026-10-06 10:08:51.939857,0 days 00:00:22.159606,0.9037784212044084,0.9261468307971986,0.0009571862930885102,0.004457647977476725,128.0,0.016981620907962,32,5,3,0.02925268878646678,32,5,2,0.014640865724985106,128,3,1,0.03385025962539804,128.0,3.0,2.0,,,,,256,0.18647981361536625,11.0,4,Adam,,,,47.0,0.9181818181818182,0.8987989249352049,COMPLETE
