number,value,datetime_start,datetime_complete,duration,params_adam_beta1,params_adam_beta2,params_adam_lr,params_adam_wd,params_batch_size,params_block_0_dropout,params_block_0_filters,params_block_0_kernel,params_block_0_stride,params_block_1_dropout,params_block_1_filters,params_block_1_kernel,params_block_1_stride,params_block_2_dropout,params_block_2_filters,params_block_2_kernel,params_block_2_stride,params_block_3_dropout,params_block_3_filters,params_block_3_kernel,params_block_3_stride,params_fc_hidden,params_first_conv_filters,params_first_conv_kernel_size,params_lr_factor,params_lr_patience,params_n_blocks,params_optimizer,params_sgd_lr,params_sgd_momentum,params_sgd_wd,user_attrs_best_epoch,user_attrs_validation_accuracy,user_attrs_validation_macro_f1,state
61,0.41701990438139047,2026-09-29 11:43:11.097072,2026-09-29 11:44:05.654724,0 days 00:00:54.557652,0.8655599405040161,0.9422727732313282,0.00047576460786571414,2.343189105997628e-05,128.0,0.05420255908879493,32,5,3,0.023435888804206842,64,3,2,0.09225830774290569,64,5,2,,,,,128,512,5,0.60512005111018,8.0,3,Adam,,,,,,,PRUNED
62,0.4215730683286214,2026-09-29 11:44:05.776396,2026-09-29 11:44:52.810270,0 days 00:00:47.033874,0.8732004458350088,0.9373066281083958,0.0003938733591291199,2.8778007103677053e-05,128.0,0.04732955311115733,32,5,3,0.026107074760752018,64,3,2,0.09667812904492953,64,5,2,,,,,128,512,5,0.617502418855274,10.0,3,Adam,,,,,,,PRUNED
63,0.7486833345658992,2026-09-29 11:44:52.942939,2026-09-29 11:48:46.106174,0 days 00:03:53.163235,0.8555069718413885,0.9220299704424041,0.00029587701561769437,4.6851821557189564e-05,128.0,0.04306565237309465,32,5,3,0.015957476755614868,64,3,2,0.0897355368086803,64,5,2,,,,,128,512,5,0.6453338742501736,18.0,3,Adam,,,,49.0,0.757396449704142,0.7399702194276564,COMPLETE
64,0.42370634259693324,2026-09-29 11:48:46.228476,2026-09-29 11:49:32.179484,0 days 00:00:45.951008,0.8764921412576596,0.9315687038374787,0.00043997571688514776,0.009058172641934365,128.0,0.05848674565578856,32,5,3,0.01244881133245051,64,3,2,0.09757423522902398,64,5,2,,,,,128,512,5,0.5377177883401707,7.0,3,Adam,,,,,,,PRUNED
65,0.487259943849334,2026-09-29 11:49:32.309781,2026-09-29 11:50:53.790081,0 days 00:01:21.480300,0.8500236248654444,0.9500232183767666,0.0006347870767530384,6.142050776072455e-06,128.0,0.05091930198482931,32,5,3,0.01860586191536028,64,3,2,0.09983602251063094,64,5,2,,,,,128,512,5,0.5757794143035638,8.0,3,Adam,,,,,,,PRUNED
66,0.30562800496323805,2026-09-29 11:50:53.924347,2026-09-29 11:51:40.092992,0 days 00:00:46.168645,0.8633642829489249,0.9383308461358119,0.00013950518650032452,6.66616712305613e-05,128.0,0.024512923724216863,32,5,3,0.023761012202613042,32,3,2,0.09419128770259777,64,5,1,,,,,512,512,5,0.43245724291144905,9.0,3,Adam,,,,,,,PRUNED
67,0.36389282394587436,2026-09-29 11:51:40.213469,2026-09-29 11:51:53.621106,0 days 00:00:13.407637,0.8720456408772088,0.9552151786623894,0.00030907204001128126,1.3951245902165869e-05,128.0,0.03801247079064671,32,5,3,0.027919563682991855,64,3,1,0.07960670445652591,32,5,2,,,,,128,128,5,0.6004640521964972,5.0,3,Adam,,,,,,,PRUNED
68,0.7668208337665351,2026-09-29 11:51:53.745080,2026-09-29 11:55:44.054914,0 days 00:03:50.309834,,,,,128.0,0.01782600014353302,16,5,3,0.010023181021162205,64,3,2,0.06183032837547049,128,5,2,,,,,128,512,5,0.22248125685404102,10.0,3,SGD,0.015671967673983572,0.7680142994747277,5.332251359679489e-06,50.0,0.7869822485207101,0.7466594190123601,COMPLETE
69,,2026-09-29 11:55:44.189687,2026-09-29 11:55:44.249072,0 days 00:00:00.059385,,,,,,0.017679180409566057,16,5,3,0.01065337638002989,16,5,2,0.05562185831769225,128,5,2,,,,,,256,3,,,3,,,,,,,,PRUNED
70,0.7778004799217098,2026-09-29 11:55:44.397653,2026-09-29 12:03:02.032180,0 days 00:07:17.634527,,,,,128.0,0.015233236823673424,16,5,3,0.013500754861532375,64,3,2,0.0625336040554295,128,3,2,,,,,512,512,7,0.24146117090763297,10.0,3,SGD,0.01653713707656671,0.7813363132203819,5.300719755996091e-06,49.0,0.7810650887573964,0.7745358710860231,COMPLETE
71,0.39748535437888377,2026-09-29 12:03:02.154251,2026-09-29 12:04:54.131193,0 days 00:01:51.976942,,,,,128.0,0.015261853436104663,16,5,3,0.012590352751140834,64,3,2,0.06581918800994199,128,3,2,,,,,512,512,7,0.21542109132773413,10.0,3,SGD,0.01887765981384614,0.7718874023095783,3.462883378572005e-06,,,,PRUNED
72,0.41470363759944784,2026-09-29 12:04:54.252062,2026-09-29 12:06:21.988982,0 days 00:01:27.736920,,,,,128.0,0.019385117488801437,16,5,3,0.01947827928903132,64,3,2,0.05118701803326926,128,3,2,,,,,512,512,7,0.2362952759265173,12.0,3,SGD,0.014300908883271582,0.773675778051393,6.639536727370427e-06,,,,PRUNED
73,0.7330584599422904,2026-09-29 12:06:22.125318,2026-09-29 12:13:31.581231,0 days 00:07:09.455913,,,,,128.0,0.011795497578413226,16,5,3,0.014101832810849566,64,3,2,0.06274116025439255,128,3,2,,,,,512,512,7,0.28679684085216733,11.0,3,SGD,0.01494521881716919,0.8598563907152728,7.469278116919652e-05,44.0,0.7514792899408284,0.7146376299437524,COMPLETE
74,0.30003280136457416,2026-09-29 12:13:31.708626,2026-09-29 12:15:00.235768,0 days 00:01:28.527142,,,,,128.0,0.02727000640807686,16,5,3,0.01009831618736213,64,3,2,0.0576924555901533,128,3,2,,,,,512,512,7,0.12337274695842264,10.0,3,SGD,0.0014666951477992347,0.7747461743247673,4.145652329685738e-06,,,,PRUNED
75,0.3481282412518767,2026-09-29 12:15:00.366974,2026-09-29 12:16:29.676085,0 days 00:01:29.309111,,,,,128.0,0.023447258729922257,16,5,3,0.015471114785726776,64,3,2,0.047103330244615556,128,3,2,,,,,128,512,7,0.37004542330695067,9.0,3,SGD,0.008400473519249656,0.7465304940594838,9.85826091941912e-06,,,,PRUNED
76,0.7438980870565856,2026-09-29 12:16:29.798971,2026-09-29 12:19:54.411957,0 days 00:03:24.612986,,,,,64.0,0.02124422681601314,16,5,3,0.01689200645009955,64,3,2,0.07182650614323803,128,5,2,,,,,256,512,5,0.27800708253655576,14.0,3,SGD,0.026461829073175715,0.82358659970877,7.36229290504281e-05,38.0,0.7810650887573964,0.7067310853557747,COMPLETE
77,0.36998853135449167,2026-09-29 12:19:54.534560,2026-09-29 12:20:45.758512,0 days 00:00:51.223952,,,,,128.0,0.017532990353925346,16,7,3,0.012523649340742274,64,3,2,0.06934750160067434,128,5,1,,,,,512,512,5,0.1973205198793515,9.0,3,SGD,0.07262094639173129,0.8900806891076404,1.6294094686081792e-06,,,,PRUNED
78,0.37550563432073225,2026-09-29 12:20:45.879871,2026-09-29 12:21:32.184758,0 days 00:00:46.304887,,,,,128.0,0.033994071193127,8,5,3,0.019658638131654107,32,3,2,0.05905007878157284,128,5,2,,,,,128,512,5,0.15417163803450035,10.0,3,SGD,0.0021666424742070862,0.7969323105604685,3.087948250933124e-06,,,,PRUNED
79,0.4085396168377391,2026-09-29 12:21:32.306572,2026-09-29 12:22:11.448028,0 days 00:00:39.141456,,,,,128.0,0.02817533591592777,16,5,3,0.021911083691083924,64,3,2,0.06294830222196927,128,3,2,,,,,128,512,3,0.24797667508477272,11.0,3,SGD,0.0080268990601672,0.7508500972862314,1.0337972010300195e-05,,,,PRUNED
80,0.4242833944540133,2026-09-29 12:22:11.574411,2026-09-29 12:23:39.808957,0 days 00:01:28.234546,,,,,128.0,0.013176455854533302,16,5,3,0.03290992752561119,64,3,1,0.05274639043743416,128,5,2,,,,,512,512,7,0.36346612671346146,13.0,3,SGD,0.0333542096542882,0.851192317233827,9.701215111587905e-05,,,,PRUNED
81,0.7519630636867842,2026-09-29 12:23:39.939687,2026-09-29 12:27:34.176404,0 days 00:03:54.236717,0.8552405432413207,0.9648427772751114,0.0009036509483668781,2.9750101978801718e-06,128.0,0.016143706010101226,32,5,3,0.025085279980053977,64,3,2,0.091567318515957,64,5,2,,,,,128,512,5,0.6561434232177756,8.0,3,Adam,,,,50.0,0.7751479289940828,0.7287781983794857,COMPLETE
82,0.45369397563016245,2026-09-29 12:27:34.297509,2026-09-29 12:28:34.632171,0 days 00:01:00.334662,0.8804341754666262,0.9466400092229916,0.0002374281316494576,2.2029998175807972e-05,128.0,0.031879373947233204,32,5,3,0.03660607820532891,64,3,2,0.09458465477776584,64,5,2,,,,,128,512,5,0.6306060257904466,9.0,3,Adam,,,,,,,PRUNED
83,0.4289927022467258,2026-09-29 12:28:34.755254,2026-09-29 12:29:25.897454,0 days 00:00:51.142200,0.9012648706624509,0.9346382951804584,0.0003484370123251252,7.507734167153034e-06,128.0,0.023374050512761722,32,5,3,0.029326856418686584,64,3,2,0.0977125678907892,64,5,2,,,,,128,512,5,0.6875632460017312,8.0,3,Adam,,,,,,,PRUNED
84,0.8167789741128038,2026-09-29 12:29:26.037103,2026-09-29 12:31:03.523519,0 days 00:01:37.486416,0.8688182788310866,0.9289751474687024,0.0006755069858848427,0.0004547536552232208,128.0,0.026247336409227173,32,5,3,0.01307766122972167,64,3,2,0.08454835147938097,64,5,2,,,,,128,256,5,0.31264465961934357,6.0,3,Adam,,,,50.0,0.8224852071005917,0.8110727411250159,COMPLETE
85,0.39434066942835944,2026-09-29 12:31:03.644015,2026-09-29 12:31:25.158887,0 days 00:00:21.514872,0.8689866598310841,0.9874007845919216,0.0005506926724257303,0.001544175458804272,128.0,0.020371461563795337,32,5,3,0.012923886682658552,64,3,2,0.0855516792017368,64,5,2,,,,,128,256,5,0.28572395923337696,6.0,3,Adam,,,,,,,PRUNED
86,0.40247803254449255,2026-09-29 12:31:25.280028,2026-09-29 12:31:44.709932,0 days 00:00:19.429904,0.8868060855084874,0.9288229348551004,0.0006929285079074836,0.00046845052482204116,128.0,0.026253634679391423,8,5,3,0.015773229284927682,64,3,2,0.06091707908522842,64,5,2,,,,,128,256,5,0.41468388342089285,7.0,3,Adam,,,,,,,PRUNED
87,,2026-09-29 12:31:44.834326,2026-09-29 12:31:44.883876,0 days 00:00:00.049550,,,,,,0.010248689904291893,32,7,3,0.017092954850849433,16,5,2,0.08174095957881584,32,5,2,,,,,,256,5,,,3,,,,,,,,PRUNED
88,0.7630166510242955,2026-09-29 12:31:45.014851,2026-09-29 12:33:21.084435,0 days 00:01:36.069584,0.8748590606671394,0.918828078019529,0.0013938251447266718,0.00017578782722899906,128.0,0.02958915443355073,32,5,3,0.01001373237338918,64,3,2,0.06501872295762616,64,5,2,,,,,128,256,5,0.25732919286902245,6.0,3,Adam,,,,48.0,0.7810650887573964,0.7449682132911947,COMPLETE
89,0.44845177562642957,2026-09-29 12:33:21.207713,2026-09-29 12:33:42.033686,0 days 00:00:20.825973,0.8575431003572559,0.9716081664034644,0.0009298379938623535,0.0008417809220057466,128.0,0.018248424494375533,32,5,3,0.020192090710668686,64,3,2,0.07470758303852706,128,5,1,,,,,256,256,3,0.3124436623368454,11.0,3,Adam,,,,,,,PRUNED
90,0.4099356080587515,2026-09-29 12:33:42.157367,2026-09-29 12:33:57.681310,0 days 00:00:15.523943,,,,,64.0,0.03476163757375923,16,5,3,0.022756928445984596,64,3,2,0.07055782837108808,64,3,2,,,,,128,128,5,0.16829454891433657,15.0,3,SGD,0.009874686845796142,0.7009794087910381,2.6695094548385025e-05,,,,PRUNED
91,0.7429485347252454,2026-09-29 12:33:57.802938,2026-09-29 12:35:35.530467,0 days 00:01:37.727529,0.877449741165874,0.9177745083137903,0.0018113166452378314,0.0004060846581439067,128.0,0.0297416959804378,32,5,3,0.011890236240239362,64,3,2,0.06463280102307814,64,5,2,,,,,128,256,5,0.23622761506959628,6.0,3,Adam,,,,36.0,0.7692307692307693,0.7166663002197214,COMPLETE
92,0.376275820325334,2026-09-29 12:35:35.673382,2026-09-29 12:35:55.886806,0 days 00:00:20.213424,0.8704123722646372,0.9063520555019545,0.0019278816129645012,0.00028730761389865684,128.0,0.022637468672710156,32,5,3,0.010040826113731985,64,3,2,0.06746834934476355,64,5,2,,,,,128,256,5,0.26224379966540434,5.0,3,Adam,,,,,,,PRUNED
93,0.44840033547463887,2026-09-29 12:35:56.010240,2026-09-29 12:36:18.836956,0 days 00:00:22.826716,0.8755425560674853,0.9229521319809577,0.0013137439409465076,0.0001732454244406133,128.0,0.025329470760868056,32,5,3,0.015517990432432434,64,3,2,0.07698013091803277,64,5,2,,,,,128,256,5,0.21731727956053837,6.0,3,Adam,,,,,,,PRUNED
94,0.47734068989737155,2026-09-29 12:36:18.974240,2026-09-29 12:36:45.054060,0 days 00:00:26.079820,0.8813642144388354,0.9668003666991829,0.003561452997314229,0.0006865791406739047,128.0,0.03118461979129664,32,5,3,0.013900160128789947,64,3,2,0.05496365668738506,64,5,2,,,,,128,256,5,0.30906203932749315,7.0,3,Adam,,,,,,,PRUNED
95,0.750608988418578,2026-09-29 12:36:45.175845,2026-09-29 12:38:21.719878,0 days 00:01:36.544033,0.8629509833926048,0.9786439386580262,0.0010545809244915034,8.471494136759293e-05,128.0,0.02881404318668031,32,5,3,0.018440596400016773,64,3,2,0.06108228636058576,64,5,2,,,,,128,256,5,0.19126446956558293,5.0,3,Adam,,,,45.0,0.7633136094674556,0.7379043673697004,COMPLETE
96,0.6434222783727317,2026-09-29 12:38:21.854075,2026-09-29 12:39:30.093111,0 days 00:01:08.239036,0.8693728962184496,0.919987392321109,0.0027770824500714768,0.000167891493047286,128.0,0.014143647816110326,32,5,3,0.011430259296222534,32,3,2,0.08753773125776251,64,5,2,,,,,512,256,5,0.6235711184109017,10.0,3,Adam,,,,,,,PRUNED
97,0.7596753641446801,2026-09-29 12:39:30.216596,2026-09-29 12:43:26.443665,0 days 00:03:56.227069,0.8538193966028053,0.911777289710984,0.000820514995107504,3.838681234238245e-05,128.0,0.02114327270039893,32,5,3,0.0137861475250663,64,3,2,0.06800598020589452,64,5,2,,,,,128,512,5,0.2615611388235244,7.0,3,Adam,,,,46.0,0.7810650887573964,0.7382856395319637,COMPLETE
98,0.33623263914437374,2026-09-29 12:43:26.566026,2026-09-29 12:44:55.211008,0 days 00:01:28.644982,0.8659886416252878,0.9585851457436677,0.000331565295923537,0.0003743798525521162,128.0,0.07792504167565649,32,5,3,0.01733448865185984,64,3,1,0.06475313705143834,128,5,2,,,,,128,512,7,0.6610808256166827,9.0,3,Adam,,,,,,,PRUNED
99,0.40292871890344584,2026-09-29 12:44:55.334110,2026-09-29 12:45:41.317144,0 days 00:00:45.983034,0.8840358260111407,0.9143648139228645,0.00045333304865836254,6.382199333191897e-05,128.0,0.027445487129520794,32,5,3,0.02066447819675566,64,3,2,0.09515361819066652,64,5,2,,,,,128,512,5,0.5564332165042799,6.0,3,Adam,,,,,,,PRUNED
