number,value,datetime_start,datetime_complete,duration,params_adam_beta1,params_adam_beta2,params_adam_lr,params_adam_wd,params_batch_size,params_block_0_dropout,params_block_0_filters,params_block_0_kernel,params_block_0_stride,params_block_1_dropout,params_block_1_filters,params_block_1_kernel,params_block_1_stride,params_block_2_dropout,params_block_2_filters,params_block_2_kernel,params_block_2_stride,params_block_3_dropout,params_block_3_filters,params_block_3_kernel,params_block_3_stride,params_fc_hidden,params_first_conv_filters,params_first_conv_kernel_size,params_lr_factor,params_lr_patience,params_n_blocks,params_optimizer,params_sgd_lr,params_sgd_momentum,params_sgd_wd,user_attrs_best_epoch,user_attrs_validation_accuracy,user_attrs_validation_macro_f1,state
0,0.4469209236434435,2026-09-29 09:45:50.192136,2026-09-29 09:48:24.760640,0 days 00:02:34.568504,0.8926459276842719,0.9097574441892378,0.00853618986286683,0.0017123375973163992,128.0,0.08491983767203796,8,5,3,0.06506676052501416,16,3,2,0.06331731119758383,128,3,1,,,,,256,256,7,0.5105398159072941,12.0,3,Adam,,,,45.0,0.47928994082840237,0.4145519064584846,COMPLETE
1,0.5648968371002817,2026-09-29 09:48:24.897214,2026-09-29 09:51:16.696912,0 days 00:02:51.799698,,,,,128.0,0.06381099809299767,16,7,3,0.08458637582367365,16,3,2,0.07950202923669918,128,3,1,0.07361716094628554,256.0,3.0,1.0,256,256,7,0.13813501017161417,9.0,4,SGD,0.038842777547031436,0.8807564567799918,2.106648601704221e-05,47.0,0.5857988165680473,0.5439948576325161,COMPLETE
2,0.5585746384248584,2026-09-29 09:51:16.817129,2026-09-29 09:52:48.381244,0 days 00:01:31.564115,0.970502281655888,0.9006945178400659,0.0007148510793512986,0.0018709365688887364,64.0,0.019710228429397403,8,7,3,0.07799960246887438,32,3,1,0.0884314531168946,128,3,2,0.05854080177240857,256.0,3.0,1.0,256,256,3,0.4064483815465394,11.0,4,Adam,,,,45.0,0.5621301775147929,0.5550190993349241,COMPLETE
3,,2026-09-29 09:52:48.513212,2026-09-29 09:52:48.567357,0 days 00:00:00.054145,,,,,,0.013319825261907952,8,7,3,0.05405074842498068,16,3,2,0.06690752475342215,32,5,2,0.08517722460303143,64.0,3.0,1.0,,256,5,,,4,,,,,,,,PRUNED
4,0.5314407563276342,2026-09-29 09:52:48.688036,2026-09-29 09:53:58.948641,0 days 00:01:10.260605,0.8642060160012445,0.9662838267338948,0.0016325185294676916,1.088399181393814e-06,128.0,0.09430569898630611,16,7,3,0.08354999801810943,32,5,1,0.04051268119438307,32,3,2,0.08983777818386056,256.0,3.0,1.0,128,128,5,0.10303695030773122,7.0,4,Adam,,,,46.0,0.5562130177514792,0.5066684949037891,COMPLETE
5,,2026-09-29 09:53:59.068239,2026-09-29 09:53:59.117800,0 days 00:00:00.049561,,,,,,0.03386821309135529,8,5,3,0.06192134961637233,32,5,2,0.09464127259176229,128,5,2,0.011391095487598068,64.0,3.0,1.0,,512,3,,,4,,,,,,,,PRUNED
6,0.4148951084471806,2026-09-29 09:53:59.236734,2026-09-29 10:01:19.339974,0 days 00:07:20.103240,0.897319321959215,0.9375207369687304,0.0039046790191830895,0.0036309591863459105,128.0,0.07264268170074757,8,5,3,0.0766691755978784,64,5,1,0.09219164973008243,64,3,1,,,,,512,512,7,0.1563891639045214,14.0,3,Adam,,,,47.0,0.4378698224852071,0.39192039440915405,COMPLETE
7,0.7098168007178369,2026-09-29 10:01:19.462719,2026-09-29 10:04:04.304283,0 days 00:02:44.841564,0.8891907455724319,0.9953910415382531,0.0026865309327169084,0.00043731009905162676,64.0,0.01768127184943912,32,5,3,0.03906608256471214,64,3,2,0.07263767854843282,32,5,2,,,,,128,512,3,0.5427381500174611,13.0,3,Adam,,,,41.0,0.7218934911242604,0.6977401103114136,COMPLETE
8,0.5571576438754149,2026-09-29 10:04:04.432583,2026-09-29 10:07:34.044373,0 days 00:03:29.611790,,,,,64.0,0.05261245937025092,8,5,3,0.06632739241428127,32,3,1,0.0627198023146117,64,5,2,,,,,128,512,5,0.6767143382943485,19.0,3,SGD,0.004333615420461955,0.9730247945451923,3.502761367842316e-05,40.0,0.5621301775147929,0.552185110236037,COMPLETE
9,0.5991702625105987,2026-09-29 10:07:34.171045,2026-09-29 10:08:53.489283,0 days 00:01:19.318238,,,,,128.0,0.06660485621018956,16,5,3,0.0991454627800606,16,5,1,0.07757839610123476,128,3,2,0.05547271352030715,256.0,3.0,1.0,512,128,7,0.6700371802304829,20.0,4,SGD,0.0520170752104338,0.7264731362679787,1.8934530915191556e-05,43.0,0.6153846153846154,0.582955909636582,COMPLETE
10,0.34972521666366974,2026-09-29 10:08:53.617657,2026-09-29 10:09:26.426478,0 days 00:00:32.808821,0.9740823912733333,0.9925265187462552,0.00011276182231780688,1.0341591364653288e-05,64.0,0.04094807897017133,32,5,3,0.020186058701089256,64,3,2,0.02058969429153098,32,5,1,,,,,128,512,3,0.31969431875426024,5.0,3,Adam,,,,,,,PRUNED
11,0.07721850081255381,2026-09-29 10:09:26.554317,2026-09-29 10:09:46.217132,0 days 00:00:19.662815,,,,,64.0,0.031948746477721154,32,5,3,0.03486078911911274,64,5,1,0.046506275002345374,32,5,2,,,,,512,128,7,0.6880215268818788,20.0,3,SGD,0.00010400156812649853,0.7273338428578489,0.005703549233157248,,,,PRUNED
12,0.6357861743626896,2026-09-29 10:09:46.348270,2026-09-29 10:10:50.204924,0 days 00:01:03.856654,,,,,128.0,0.049862764345547775,32,5,3,0.09562486355830821,64,5,1,0.07493229922289034,128,3,2,,,,,512,128,3,0.5875275516656137,16.0,3,SGD,0.08785346492133791,0.7038219721704677,1.1475543473256436e-06,50.0,0.6627218934911243,0.6088504552342547,COMPLETE
13,,2026-09-29 10:10:50.327211,2026-09-29 10:10:50.376291,0 days 00:00:00.049080,,,,,,0.04837119994846847,32,5,3,0.0417445427700454,64,5,2,0.05137197642914039,32,5,2,,,,,,128,3,,,3,,,,,,,,PRUNED
14,0.6037223460300384,2026-09-29 10:10:50.501476,2026-09-29 10:13:33.806784,0 days 00:02:43.305308,,,,,64.0,0.022179312150807325,32,5,3,0.017684683207332796,64,5,2,0.07688378502389141,64,3,2,,,,,128,512,3,0.5391501656697284,16.0,3,SGD,0.0005881354046690198,0.8315392629274152,1.0060069412640543e-06,47.0,0.591715976331361,0.6157287157287158,COMPLETE
15,0.3912234006788959,2026-09-29 10:13:33.933881,2026-09-29 10:14:24.505698,0 days 00:00:50.571817,,,,,64.0,0.051189919620826405,32,5,3,0.09833940909298462,64,3,1,0.0326921683866188,128,5,2,,,,,512,128,3,0.5429567582938957,16.0,3,SGD,0.0035273500164911906,0.989795108354294,0.0060048894624888825,,,,PRUNED
16,0.28447454776578557,2026-09-29 10:14:24.630690,2026-09-29 10:14:37.471828,0 days 00:00:12.841138,0.9323336909485732,0.9961070587811621,0.0002203345932769055,6.361226904953444e-05,128.0,0.027548143210617493,32,5,3,0.04567322596320189,64,5,1,0.05671829326234923,32,3,2,,,,,128,128,3,0.45361471415707555,16.0,3,Adam,,,,,,,PRUNED
17,0.7839025186281772,2026-09-29 10:14:37.596573,2026-09-29 10:18:09.227123,0 days 00:03:31.630550,0.8559843252111498,0.9510695314963434,0.0006743143235518529,0.00013015611177462694,128.0,0.013353259035209585,32,5,3,0.010265853936618927,64,3,2,0.07315695884148028,128,5,2,,,,,512,512,3,0.6143787056271844,13.0,3,Adam,,,,47.0,0.8106508875739645,0.7571541496823899,COMPLETE
18,0.6636878079185772,2026-09-29 10:18:09.373580,2026-09-29 10:21:26.650981,0 days 00:03:17.277401,0.8543249673627713,0.9541876602456304,0.0009093013445340384,0.0001376757215956522,64.0,0.01009630312370305,32,7,3,0.010335430574451748,64,3,2,0.08643327458417195,32,5,1,,,,,512,512,3,0.34369164669216334,12.0,3,Adam,,,,47.0,0.6745562130177515,0.6528194028194029,COMPLETE
19,0.7394819760974789,2026-09-29 10:21:26.774714,2026-09-29 10:24:54.601213,0 days 00:03:27.826499,0.8841456492223642,0.9691521395949001,0.002329824947255535,0.0002206034723537561,128.0,0.01994903460881294,32,5,3,0.029719390388248116,64,3,2,0.06919558982642246,64,5,2,,,,,128,512,3,0.616352753642999,10.0,3,Adam,,,,50.0,0.7869822485207101,0.6919817036742478,COMPLETE
20,0.7819215795989963,2026-09-29 10:24:54.725361,2026-09-29 10:28:58.530739,0 days 00:04:03.805378,0.8714186160469966,0.9653391542867328,0.0005461985873715642,3.231474234610017e-05,128.0,0.025672462873333385,32,5,3,0.02871362870662005,64,3,2,0.09950238158028293,64,5,2,,,,,128,512,5,0.6533316589216732,9.0,3,Adam,,,,47.0,0.8047337278106509,0.7591094313873418,COMPLETE
21,0.7825374824486007,2026-09-29 10:28:58.673227,2026-09-29 10:33:06.072535,0 days 00:04:07.399308,0.86969326681111,0.9660509383589169,0.00042054721371400993,3.299400267391178e-05,128.0,0.02597160888412271,32,5,3,0.024743707877433387,64,3,2,0.0979636884891862,64,5,2,,,,,128,512,5,0.6165439318317288,9.0,3,Adam,,,,43.0,0.8106508875739645,0.7544240773232369,COMPLETE
22,0.7677333985617691,2026-09-29 10:33:06.192091,2026-09-29 10:37:00.651985,0 days 00:03:54.459894,0.8652007491857517,0.9457183578212714,0.00042050038577504724,2.510247553525056e-05,128.0,0.03778356560522919,32,5,3,0.02586636190594534,64,3,2,0.09900584208661348,64,5,2,,,,,128,512,5,0.5985031412828783,8.0,3,Adam,,,,47.0,0.7928994082840237,0.7425673888395147,COMPLETE
23,0.7815825823144136,2026-09-29 10:37:00.774237,2026-09-29 10:40:56.184652,0 days 00:03:55.410415,0.8718178003341767,0.9674693179026969,0.0003836855793831307,8.931914906243625e-06,128.0,0.0274278817663967,32,5,3,0.011589669752494132,64,3,2,0.0845956673983776,64,5,2,,,,,128,512,5,0.6191431782333133,6.0,3,Adam,,,,49.0,0.7988165680473372,0.7643485965814898,COMPLETE
24,0.7525846985737095,2026-09-29 10:40:56.308352,2026-09-29 10:45:00.115808,0 days 00:04:03.807456,0.8521246172787607,0.9757600452057338,0.0007283587994070064,3.8557447701146e-05,128.0,0.02610670310736072,32,5,3,0.021460236566589658,64,3,2,0.09869321530280503,64,5,2,,,,,128,512,5,0.46100063608718184,9.0,3,Adam,,,,42.0,0.7810650887573964,0.7241043083900226,COMPLETE
25,0.740660489585829,2026-09-29 10:45:00.239329,2026-09-29 10:48:58.174183,0 days 00:03:57.934854,0.9121413121271997,0.9261599126523204,0.0002880224290398984,6.619002411498712e-06,128.0,0.04175694190979327,16,5,3,0.030518270920270187,64,3,2,0.08452307522023345,64,5,2,,,,,512,512,5,0.6458012113582838,14.0,3,Adam,,,,49.0,0.7455621301775148,0.7357588489941431,COMPLETE
26,0.7120313266236697,2026-09-29 10:48:58.304534,2026-09-29 10:53:22.333164,0 days 00:04:24.028630,0.87530318589444,0.9532625463642586,0.0010985433343881292,0.0004860469492588381,128.0,0.010060944124005182,32,7,3,0.01722779756875907,64,3,2,0.09283687717799972,64,5,1,,,,,256,512,5,0.5877647876272973,10.0,3,Adam,,,,41.0,0.7218934911242604,0.7021691621230791,COMPLETE
27,0.439910786799927,2026-09-29 10:53:22.471465,2026-09-29 10:54:18.565591,0 days 00:00:56.094126,0.9150820130832984,0.9820270938826818,0.0005039521405684173,8.099992411569141e-05,128.0,0.03278119058521785,32,5,3,0.026054645087984395,64,3,2,0.09926983708816538,64,5,2,,,,,128,512,5,0.6964866712345188,7.0,3,Adam,,,,,,,PRUNED
28,0.37842769490797934,2026-09-29 10:54:18.689624,2026-09-29 10:55:04.029418,0 days 00:00:45.339794,0.8523280818799549,0.9539075788316407,0.00016323456232178525,2.3419738760739903e-05,128.0,0.025090798310177118,32,5,3,0.04741903854273813,16,3,2,0.018393035003751293,64,5,2,,,,,512,512,5,0.6404965909329772,8.0,3,Adam,,,,,,,PRUNED
29,0.5039694010545548,2026-09-29 10:55:04.148938,2026-09-29 10:56:03.726247,0 days 00:00:59.577309,0.8739483446334108,0.9335662138191444,0.0012428746603144216,2.4267061177100953e-06,128.0,0.016260913714536362,16,5,3,0.03405755427291585,32,3,2,0.05945368251772301,128,5,1,,,,,128,256,5,0.48773074910296177,11.0,3,Adam,,,,,,,PRUNED
30,0.6767940229441703,2026-09-29 10:56:03.857500,2026-09-29 11:00:04.005659,0 days 00:04:00.148159,0.9126126922508533,0.9619063880507593,0.0005811164282961487,0.0002618995505607023,128.0,0.0403822441239184,32,5,3,0.014725253415802955,16,3,2,0.08176439528261083,128,5,2,,,,,128,512,5,0.5679795155684018,18.0,3,Adam,,,,47.0,0.7041420118343196,0.6494460340540211,COMPLETE
31,0.7582424006592106,2026-09-29 11:00:04.125530,2026-09-29 11:04:04.750197,0 days 00:04:00.624667,0.8733474088317001,0.9794368052441256,0.0003558363846258848,9.991160749136e-06,128.0,0.028545686337367093,32,5,3,0.010128804294489353,64,3,2,0.0893859198685759,64,5,2,,,,,128,512,5,0.6261813659690781,5.0,3,Adam,,,,50.0,0.7810650887573964,0.7354197125610248,COMPLETE
32,0.39400739166570253,2026-09-29 11:04:04.869361,2026-09-29 11:04:51.465076,0 days 00:00:46.595715,0.865811133599736,0.9621798287932354,0.0002754943714277404,4.805985906656524e-06,128.0,0.02341913470562603,32,5,3,0.024314037386508648,64,3,2,0.08309605349175281,64,5,2,,,,,128,512,5,0.6307686757812586,6.0,3,Adam,,,,,,,PRUNED
33,0.7548943299361359,2026-09-29 11:04:51.587268,2026-09-29 11:06:28.634774,0 days 00:01:37.047506,0.8844774464511445,0.969818673943139,0.00040053117259766536,1.648768914387811e-05,128.0,0.016976322811907658,32,5,3,0.012536227898042335,64,3,2,0.09304552054194574,64,5,2,,,,,256,256,5,0.5107587184196413,7.0,3,Adam,,,,34.0,0.7810650887573964,0.7287235711148755,COMPLETE
34,0.4661166303900278,2026-09-29 11:06:28.754420,2026-09-29 11:08:22.550987,0 days 00:01:53.796567,0.8596544803848505,0.9462220931033681,0.00018355068884681866,4.56119524056283e-05,128.0,0.03370666871249946,32,7,3,0.020030977644875103,64,3,2,0.08683488267917826,64,5,2,,,,,128,512,7,0.6556659333388429,6.0,3,Adam,,,,,,,PRUNED
35,0.7302238309157408,2026-09-29 11:08:22.673742,2026-09-29 11:10:12.365169,0 days 00:01:49.691427,0.8776715461126965,0.9849225377809373,0.0005874272721837541,3.949374656923068e-06,128.0,0.014055473155233134,16,7,3,0.02963368344835699,16,3,2,0.06888727285593785,128,5,2,,,,,256,256,5,0.5716202720641622,9.0,3,Adam,,,,49.0,0.7633136094674556,0.697134052364026,COMPLETE
36,0.3900298660718826,2026-09-29 11:10:12.485182,2026-09-29 11:10:59.329809,0 days 00:00:46.844627,0.9023580287269765,0.9597185413916274,0.0003022111825863512,9.638068566657638e-05,128.0,0.020798437774007146,8,5,3,0.017352933305632343,32,3,2,0.0949096209058968,64,5,1,0.01343115976770451,128.0,3.0,1.0,128,512,5,0.5132849936072988,12.0,4,Adam,,,,,,,PRUNED
37,,2026-09-29 11:10:59.450604,2026-09-29 11:10:59.511768,0 days 00:00:00.061164,,,,,,0.09790287771374394,32,5,3,0.03653989901123875,64,3,2,0.08713728982727384,128,5,2,0.03940304900788949,128.0,3.0,1.0,,512,5,,,4,,,,,,,,PRUNED
38,0.7426273944431466,2026-09-29 11:10:59.635811,2026-09-29 11:13:44.611872,0 days 00:02:44.976061,0.8675837274822604,0.9759980769541964,0.0007845733308603833,1.809224015533894e-05,128.0,0.0293353424837777,8,7,3,0.014080539859975962,64,3,2,0.08027442737530069,64,5,2,,,,,256,256,7,0.6168490487861161,10.0,3,Adam,,,,43.0,0.7514792899408284,0.7337754989454649,COMPLETE
39,0.3758876176718736,2026-09-29 11:13:44.742270,2026-09-29 11:14:33.352190,0 days 00:00:48.609920,0.8804491785514544,0.9492257058620036,0.00048357803996541983,4.523007492472572e-05,128.0,0.0829142540996655,32,5,3,0.024677982203459695,32,3,2,0.07199465968953209,64,3,2,,,,,512,512,5,0.6978917652084504,8.0,3,Adam,,,,,,,PRUNED
40,0.3925782922903216,2026-09-29 11:14:33.495014,2026-09-29 11:15:20.178727,0 days 00:00:46.683713,0.8501240154869648,0.9708111182212318,0.0012106954658576698,0.00013353769757724034,128.0,0.036432044209890144,16,5,3,0.030152498826005465,16,3,2,0.09650578426657805,128,5,1,,,,,128,512,5,0.5544717846959015,11.0,3,Adam,,,,,,,PRUNED
41,0.7620863501047448,2026-09-29 11:15:20.303485,2026-09-29 11:19:11.003193,0 days 00:03:50.699708,0.8640618830945356,0.9378405568077093,0.0004174755919330513,2.410577431952643e-05,128.0,0.04526081260141013,32,5,3,0.024977453943929435,64,3,2,0.09059024554332784,64,5,2,,,,,128,512,5,0.6025772230695533,8.0,3,Adam,,,,45.0,0.7928994082840237,0.7312732919254659,COMPLETE
42,0.4476511272174537,2026-09-29 11:19:11.126437,2026-09-29 11:20:05.708086,0 days 00:00:54.581649,0.8705208238227666,0.9439963665437423,0.0003815506167522152,3.2734276081799215e-05,128.0,0.03731951130042559,32,5,3,0.0214965890319577,64,3,2,0.09512140211980502,64,5,2,,,,,128,512,5,0.590746204919165,6.0,3,Adam,,,,,,,PRUNED
43,0.7724074195725106,2026-09-29 11:20:05.829236,2026-09-29 11:23:46.843866,0 days 00:03:41.014630,0.8608038039241875,0.9254382220547323,0.0005931543542253928,1.1482529898972653e-05,128.0,0.05537704006078366,32,5,3,0.01596441006294487,64,3,2,0.09946841726189787,64,5,2,,,,,128,512,5,0.6589308134796489,9.0,3,Adam,,,,42.0,0.7928994082840237,0.7519154308609975,COMPLETE
44,0.753646872044679,2026-09-29 11:23:46.967374,2026-09-29 11:27:23.953817,0 days 00:03:36.986443,0.8931441948967034,0.9165385072452934,0.0006257004053605306,1.1309162584820317e-05,128.0,0.062869093417788,32,5,3,0.015150549505626082,64,3,2,0.0906314923025638,64,5,2,,,,,128,512,5,0.6595492082420626,13.0,3,Adam,,,,39.0,0.7692307692307693,0.7380629748585886,COMPLETE
45,0.33424155827344615,2026-09-29 11:27:24.082336,2026-09-29 11:28:48.445264,0 days 00:01:24.362928,0.8577134203177212,0.9128402565523865,0.0008342534740186747,1.9690511676865913e-06,128.0,0.07379593454906966,8,5,3,0.010800345854525478,64,3,2,0.09984826861498126,64,5,2,,,,,128,512,7,0.6579361341160396,11.0,3,Adam,,,,,,,PRUNED
46,0.3616156644231856,2026-09-29 11:28:48.570078,2026-09-29 11:29:33.489161,0 days 00:00:44.919083,0.8595533409713791,0.9018680090873161,0.00024225253280041673,7.605888499779147e-06,128.0,0.05886144040560267,32,5,3,0.05331889424922726,64,3,2,0.078903678171824,128,3,2,,,,,128,512,5,0.6762699693979017,9.0,3,Adam,,,,,,,PRUNED
47,0.3602912529847898,2026-09-29 11:29:33.609727,2026-09-29 11:30:14.194547,0 days 00:00:40.584820,,,,,128.0,0.08541097583076473,32,5,3,0.017444434688951495,32,3,1,0.06623902773904922,64,5,2,,,,,512,512,3,0.19086363673886822,13.0,3,SGD,0.005920659762105639,0.8230365175287371,0.000510217716466605,,,,PRUNED
48,,2026-09-29 11:30:14.315393,2026-09-29 11:30:14.364951,0 days 00:00:00.049558,,,,,,0.05527546915675742,32,5,3,0.02113803238818374,64,5,2,0.083103917679716,64,5,2,,,,,,512,5,,,3,,,,,,,,PRUNED
49,0.2689577461179079,2026-09-29 11:30:14.485338,2026-09-29 11:30:33.311586,0 days 00:00:18.826248,0.9879146981477471,0.9244234044402291,0.009104456067000083,0.000946317052500998,64.0,0.014279744210581613,8,7,3,0.040408385064396056,64,3,2,0.010549030856598134,128,3,2,,,,,128,256,3,0.5287325355604918,5.0,3,Adam,,,,,,,PRUNED
50,0.20084775526604096,2026-09-29 11:30:33.437305,2026-09-29 11:30:50.048098,0 days 00:00:16.610793,,,,,128.0,0.04605967106636755,32,5,3,0.03362578022045645,64,3,1,0.07441770759859932,32,5,2,0.0331746306730879,64.0,3.0,1.0,512,128,7,0.6291801671771309,7.0,4,SGD,0.00010451237418637342,0.92191743597047,0.00020120003180964233,,,,PRUNED
51,0.7364681368534325,2026-09-29 11:30:50.171558,2026-09-29 11:34:40.069988,0 days 00:03:49.898430,0.8653936488862161,0.9593437788467029,0.0005024908599647659,1.58992314284329e-05,128.0,0.030197010970866953,32,5,3,0.026898778347272573,64,3,2,0.09657360108784835,64,5,2,,,,,128,512,5,0.6004901126616627,8.0,3,Adam,,,,45.0,0.7514792899408284,0.7214569837660365,COMPLETE
52,0.4350908783348607,2026-09-29 11:34:40.208004,2026-09-29 11:35:27.351588,0 days 00:00:47.143584,0.8691725289698439,0.9413337911452746,0.0003756821804912334,5.9140875886540224e-05,128.0,0.022142883231309005,32,5,3,0.022191740386969222,64,3,2,0.09073419938619084,64,5,2,,,,,128,512,5,0.574236181289509,10.0,3,Adam,,,,,,,PRUNED
53,0.42009893974213575,2026-09-29 11:35:27.483578,2026-09-29 11:36:14.059663,0 days 00:00:46.576085,0.8869564266290995,0.9299516609429052,0.0005709866804036138,3.0508064944369252e-05,128.0,0.03562727261549009,32,5,3,0.014206797601263761,64,3,2,0.09638232494740268,64,5,2,,,,,128,512,5,0.6740353874444693,7.0,3,Adam,,,,,,,PRUNED
54,,2026-09-29 11:36:14.180116,2026-09-29 11:36:14.230438,0 days 00:00:00.050322,,,,,,0.019461887261401342,32,5,3,0.018548894543635362,64,5,2,0.0868827221257552,64,5,2,,,,,,512,5,,,3,,,,,,,,PRUNED
55,0.7228622433518616,2026-09-29 11:36:14.349777,2026-09-29 11:39:38.320434,0 days 00:03:23.970657,0.8597206892292056,0.9631158336220764,0.0009955431190108266,1.555115089433826e-05,128.0,0.039277530010307087,32,5,3,0.03830326962706794,64,3,2,0.099534332902087,64,5,2,,,,,128,512,3,0.6089791295193132,9.0,3,Adam,,,,36.0,0.757396449704142,0.6883280369995811,COMPLETE
56,0.37718294534946367,2026-09-29 11:39:38.441135,2026-09-29 11:40:20.578660,0 days 00:00:42.137525,0.8812772510477425,0.9494242420560722,0.0007155089717690807,4.348245476978123e-06,64.0,0.02568493972863036,32,5,3,0.027909732726071893,64,3,2,0.09311028201825994,64,5,1,,,,,128,512,5,0.5551926705984614,15.0,3,Adam,,,,,,,PRUNED
57,0.2889537093771553,2026-09-29 11:40:20.702182,2026-09-29 11:40:32.774262,0 days 00:00:12.072080,0.8617881118043371,0.9664489412604546,0.0015299526247093086,0.00011602721494088638,128.0,0.06814408208965171,32,5,3,0.07084443948086874,64,3,1,0.0762648917576623,32,5,2,,,,,128,128,3,0.6406529050785708,12.0,3,Adam,,,,,,,PRUNED
58,0.2807197725666354,2026-09-29 11:40:32.895548,2026-09-29 11:41:17.215402,0 days 00:00:44.319854,,,,,128.0,0.04427452026477367,16,5,3,0.04269017464417835,16,5,2,0.08907042690001306,64,3,2,,,,,512,512,5,0.5881441312891835,8.0,3,SGD,0.0007037007167522097,0.7995390180958347,0.0011001709497161978,,,,PRUNED
59,0.48255433604114245,2026-09-29 11:41:17.338369,2026-09-29 11:42:16.291968,0 days 00:00:58.953599,0.9488905197178289,0.9569191869970968,0.005496141300425879,0.0002307123076634071,128.0,0.03142518212445403,32,5,3,0.031958844875366876,64,3,2,0.03596434385525041,128,5,2,,,,,256,512,5,0.4755140199305317,6.0,3,Adam,,,,,,,PRUNED
60,0.463944554393638,2026-09-29 11:42:16.414507,2026-09-29 11:43:10.977257,0 days 00:00:54.562750,0.8914505817582951,0.974269995329322,0.0001907516954543018,9.473632109581833e-06,64.0,0.01199598049122558,32,7,3,0.09112339815365912,64,3,2,0.08449217177262071,64,5,2,,,,,128,512,3,0.6751722977969639,9.0,3,Adam,,,,,,,PRUNED
