number,value,datetime_start,datetime_complete,duration,params_adam_beta1,params_adam_beta2,params_adam_lr,params_adam_wd,params_batch_size,params_block_0_dropout,params_block_0_filters,params_block_0_kernel,params_block_0_stride,params_block_1_dropout,params_block_1_filters,params_block_1_kernel,params_block_1_stride,params_block_2_dropout,params_block_2_filters,params_block_2_kernel,params_block_2_stride,params_block_3_dropout,params_block_3_filters,params_block_3_kernel,params_block_3_stride,params_block_4_dropout,params_block_4_filters,params_block_4_kernel,params_block_4_stride,params_fc_hidden,params_lr_factor,params_lr_patience,params_n_blocks,params_optimizer,params_sgd_lr,params_sgd_momentum,params_sgd_wd,user_attrs_best_epoch,user_attrs_validation_accuracy,user_attrs_validation_macro_f1,state
57,0.5911390214997643,2026-10-05 15:06:09.142277,2026-10-05 15:07:01.845454,0 days 00:00:52.703177,0.8596655730939996,0.9165778757669907,0.0017647630949216093,1.0986168326595487e-05,200.0,0.011307038796397292,8,5,3,0.03199156299655421,32,7,1,0.04638904359655964,128,5,1,0.03883362703698355,64.0,5.0,2.0,0.012540963261067347,256.0,3.0,1.0,512,0.8644728918991098,18.0,5,Adam,,,,,,,PRUNED
58,,2026-10-05 15:07:01.984277,2026-10-05 15:07:02.042394,0 days 00:00:00.058117,,,,,,0.042226998669037785,16,5,3,0.014254537579296657,64,3,1,0.038497180048439605,128,5,2,0.03002774692502844,128.0,5.0,2.0,,,,,,,,4,,,,,,,,PRUNED
59,0.4455489210230471,2026-10-05 15:07:02.175370,2026-10-05 15:07:23.175722,0 days 00:00:21.000352,0.8912691678536439,0.9888019163932509,0.00282273270332907,6.063615166679527e-06,64.0,0.04923792886228544,16,7,3,0.027921320885929336,32,5,1,0.04327805516461195,32,5,1,0.014189426073829038,64.0,5.0,2.0,0.010083852813297574,256.0,3.0,1.0,128,0.6417222200183369,15.0,5,Adam,,,,,,,PRUNED
60,0.499078045286203,2026-10-05 15:07:23.314942,2026-10-05 15:08:43.527323,0 days 00:01:20.212381,0.9087060822486447,0.9256957831569383,0.0012486143827381898,1.0267500426192295e-06,200.0,0.03905327639081543,32,5,3,0.03043606526096525,16,3,1,0.02873707881446734,128,5,1,0.02723321395450537,256.0,5.0,1.0,0.019534696901895198,256.0,3.0,1.0,128,0.5808873380098936,8.0,5,Adam,,,,,,,PRUNED
61,0.8375536514102644,2026-10-05 15:08:43.665661,2026-10-05 15:11:10.622735,0 days 00:02:26.957074,0.8725669592016831,0.900072329287928,0.0009319862784358543,7.74727688140744e-05,200.0,0.026592809962199957,16,5,3,0.04188846939645993,32,3,1,0.04503064773246483,128,5,1,0.041468564085565145,128.0,5.0,2.0,0.04781919876429612,512.0,3.0,1.0,128,0.2992974803607458,12.0,5,Adam,,,,50.0,0.8446428571428571,0.8304644456776715,COMPLETE
62,0.8609519014668554,2026-10-05 15:11:10.784393,2026-10-05 15:13:39.150609,0 days 00:02:28.366216,0.8564596851609382,0.9047390381612336,0.000979715225416234,4.699170333326675e-05,200.0,0.019729704449225463,16,5,3,0.036215662697154496,32,3,1,0.048480702200761436,128,5,1,0.04140645302215928,128.0,5.0,2.0,0.036122950194445794,512.0,3.0,1.0,128,0.20464753227054122,12.0,5,Adam,,,,46.0,0.8732142857142857,0.8486895172194252,COMPLETE
63,0.8556409948867717,2026-10-05 15:13:39.303027,2026-10-05 15:16:02.786149,0 days 00:02:23.483122,0.8560781844216173,0.9055154146600738,0.0006248644020453727,0.00017670601092202682,200.0,0.0204464756289823,16,5,3,0.03587982505463955,32,3,1,0.047685561722319594,128,5,1,0.03585635808669127,128.0,5.0,2.0,0.038111826725492216,512.0,3.0,1.0,128,0.15123059821625467,13.0,5,Adam,,,,44.0,0.8678571428571429,0.8434248469164005,COMPLETE
64,0.8439085480790738,2026-10-05 15:16:02.918442,2026-10-05 15:18:23.442682,0 days 00:02:20.524240,0.8542873964843612,0.9689909624925453,0.0004987018235455118,0.0003358723623030083,200.0,0.019329992948588132,16,5,3,0.03855099138081699,32,3,1,0.04847777609833169,128,5,1,0.03655135969893752,128.0,5.0,2.0,0.038257972375800135,512.0,3.0,1.0,128,0.20468855695198027,13.0,5,Adam,,,,48.0,0.8553571428571428,0.8324599533010048,COMPLETE
65,0.8308363043845336,2026-10-05 15:18:23.577617,2026-10-05 15:20:47.190706,0 days 00:02:23.613089,0.8676825637673757,0.9051550866328157,0.0006876976881608202,0.0008354163495527531,200.0,0.023652502927636262,16,5,3,0.034922246303914266,32,3,1,0.04655184642103066,128,5,1,0.03545931062949345,128.0,5.0,2.0,0.0392805456571747,512.0,3.0,1.0,128,0.11520516080868656,12.0,5,Adam,,,,43.0,0.843452380952381,0.8182202278166862,COMPLETE
66,,2026-10-05 15:20:47.325676,2026-10-05 15:20:47.399486,0 days 00:00:00.073810,,,,,,0.01391926575019365,16,5,3,0.033102417559317886,32,3,2,0.04886133846650405,64,5,1,0.04166829408063302,128.0,5.0,2.0,0.034269912074438684,512.0,3.0,1.0,,,,5,,,,,,,,PRUNED
67,0.6162749616298606,2026-10-05 15:20:47.536330,2026-10-05 15:21:46.851587,0 days 00:00:59.315257,0.9283858590772186,0.9042977776897374,0.0009641340839302379,0.0001713321325401684,200.0,0.016869837208126397,16,5,3,0.036981870692915926,32,3,1,0.047017041749893906,128,5,1,0.044807824416030574,128.0,5.0,2.0,0.04174840732654038,512.0,3.0,1.0,128,0.1646228047678181,14.0,5,Adam,,,,,,,PRUNED
68,0.8658355288197809,2026-10-05 15:21:46.988737,2026-10-05 15:24:11.862334,0 days 00:02:24.873597,0.8650482324838124,0.9589454291416608,0.00042169978186913025,5.720898951665875e-05,128.0,0.01952752797911809,16,5,3,0.02524432742347403,32,3,1,0.04536566025342031,128,3,1,0.03979378597944231,128.0,5.0,2.0,0.03579746151464138,512.0,3.0,1.0,128,0.25888016663971525,15.0,5,Adam,,,,44.0,0.8785714285714286,0.8530996290681332,COMPLETE
69,0.5797145649349051,2026-10-05 15:24:12.009434,2026-10-05 15:24:51.975639,0 days 00:00:39.966205,0.8867551375918378,0.9599877683398793,0.00030000688479873207,0.00011574775082451934,128.0,0.022376785798277114,16,5,3,0.022963301527313615,32,3,1,0.04546338416237097,128,3,1,0.039413034716981876,128.0,3.0,2.0,0.03391843409677495,512.0,3.0,1.0,128,0.23725659094050827,16.0,5,Adam,,,,,,,PRUNED
70,,2026-10-05 15:24:52.107096,2026-10-05 15:24:52.179601,0 days 00:00:00.072505,,,,,,0.021077275707102265,16,5,3,0.025554697258892187,32,5,1,0.042492743637876695,128,3,2,0.030835893923721255,128.0,5.0,2.0,0.03850417014415328,512.0,3.0,1.0,,,,5,,,,,,,,PRUNED
71,0.8390664473358733,2026-10-05 15:24:52.314690,2026-10-05 15:27:07.414628,0 days 00:02:15.099938,0.8556183402435368,0.9557077560180182,0.0006007544192639022,3.67690251323184e-05,128.0,0.01914722774210048,16,5,3,0.029314465717763447,32,3,1,0.04979274697376495,128,3,1,0.03814665183625212,128.0,5.0,2.0,0.03591546097576989,512.0,3.0,1.0,128,0.15819196178131184,15.0,5,Adam,,,,44.0,0.8505952380952381,0.8275376565765086,COMPLETE
72,0.8419270171313686,2026-10-05 15:27:07.550773,2026-10-05 15:29:22.560977,0 days 00:02:15.010204,0.8646872909378213,0.9678739125022163,0.00033334671105247064,5.739162919868259e-05,128.0,0.025062853184116177,16,5,3,0.02697693122557713,32,3,1,0.04800350700685081,128,3,1,0.04327067867090034,128.0,5.0,2.0,0.04106624154671918,512.0,3.0,1.0,128,0.2462810469008572,20.0,5,Adam,,,,45.0,0.8529761904761904,0.8308778437865468,COMPLETE
73,0.8568979666152902,2026-10-05 15:29:22.695575,2026-10-05 15:31:44.213880,0 days 00:02:21.518305,0.8556035900584948,0.9708878819959642,0.0007831536543373177,0.0001349511868885387,128.0,0.01662829955398323,16,5,3,0.025039139534251693,32,3,1,0.04390725220013284,128,3,1,0.04004132612802619,128.0,5.0,2.0,0.031414859844804036,512.0,3.0,1.0,128,0.20675662563035357,13.0,5,Adam,,,,50.0,0.8696428571428572,0.8441530760877232,COMPLETE
74,0.8551991709790989,2026-10-05 15:31:44.347174,2026-10-05 15:34:07.394050,0 days 00:02:23.046876,0.8650728888516337,0.97313978182954,0.00044768128414499227,0.00015840258536374752,128.0,0.016472031430224503,16,5,3,0.0196362596386148,32,3,1,0.04401322470208892,128,3,1,0.03577089772156174,128.0,5.0,2.0,0.03096222523113162,512.0,3.0,1.0,128,0.2000813610957394,15.0,5,Adam,,,,44.0,0.8660714285714286,0.8443269133867691,COMPLETE
75,0.8643098030721155,2026-10-05 15:34:07.527904,2026-10-05 15:36:32.011787,0 days 00:02:24.483883,0.8771223713142344,0.975953525000313,0.0004271188114334633,0.00017929480191578644,128.0,0.016424748647265244,16,5,3,0.015889089376943426,32,3,1,0.04353050234285795,128,3,1,0.035638151861717454,128.0,5.0,2.0,0.03152641067341631,512.0,3.0,1.0,256,0.20826443070582948,15.0,5,Adam,,,,50.0,0.8767857142857143,0.8518338918585167,COMPLETE
76,0.45909947857031735,2026-10-05 15:36:32.163059,2026-10-05 15:36:59.362558,0 days 00:00:27.199499,,,,,128.0,0.019991823188467372,16,5,3,0.015362579324397569,32,3,1,0.043930241852689206,128,3,1,0.03356866003959828,128.0,5.0,2.0,0.031167896966285018,512.0,3.0,1.0,256,0.2083157157005929,17.0,5,SGD,0.008093753502325366,0.9812685509429896,9.633781180578252e-06,,,,PRUNED
77,0.5320019958884037,2026-10-05 15:36:59.511126,2026-10-05 15:37:48.159632,0 days 00:00:48.648506,0.8763571240980343,0.9748831710338302,0.0004383414710134862,0.0002043693089549539,128.0,0.016226094614134007,32,5,3,0.01233968825058656,32,7,1,0.040164772123766145,32,3,1,0.03606598027923934,128.0,5.0,1.0,0.03157654252856342,512.0,3.0,1.0,256,0.13954286452639286,16.0,5,Adam,,,,,,,PRUNED
78,0.8537283741672828,2026-10-05 15:37:48.302337,2026-10-05 15:39:56.347821,0 days 00:02:08.045484,0.8500866087870063,0.987690388185821,0.0002614338437293552,0.0001014499701041143,128.0,0.018401830118580664,8,5,3,0.018183261781754074,32,3,1,0.045781687789313665,128,3,1,0.035073244220777414,128.0,5.0,2.0,0.036515189577989896,512.0,3.0,1.0,256,0.23781209081904875,15.0,5,Adam,,,,42.0,0.8690476190476191,0.8384091292869466,COMPLETE
79,0.8515188118010053,2026-10-05 15:39:56.490307,2026-10-05 15:41:59.911713,0 days 00:02:03.421406,0.8648639263284005,0.9858306417695751,0.00023653002655068777,0.00011233226109337253,128.0,0.018012677957146922,8,7,3,0.018045734235835612,32,3,1,0.04573668441257502,128,3,1,0.03482783167212896,128.0,5.0,2.0,0.03643727834071825,512.0,3.0,1.0,256,0.24733428283249265,15.0,5,Adam,,,,47.0,0.8636904761904762,0.8393471474115344,COMPLETE
80,,2026-10-05 15:42:00.046475,2026-10-05 15:42:00.127636,0 days 00:00:00.081161,,,,,,0.022080084003601806,8,5,3,0.020538976432844618,32,3,2,0.04316505876269043,64,3,1,0.031981303687286654,128.0,5.0,2.0,0.03415503176280982,512.0,3.0,1.0,,,,5,,,,,,,,PRUNED
81,0.8559609135314823,2026-10-05 15:42:00.270594,2026-10-05 15:44:10.382365,0 days 00:02:10.111771,0.8501196542569802,0.9947376903960711,0.00041133854855750283,0.00037964636723228357,128.0,0.015119235790593273,8,5,3,0.018714690400522455,32,3,1,0.04452372261961271,128,3,1,0.03667530827636023,128.0,5.0,2.0,0.03703404649020124,512.0,3.0,1.0,256,0.18578594757041453,14.0,5,Adam,,,,46.0,0.8726190476190476,0.8393027794439168,COMPLETE
82,0.8495480761684788,2026-10-05 15:44:10.534925,2026-10-05 15:46:19.969151,0 days 00:02:09.434226,0.8537917620189149,0.9970183386339013,0.00039139287880592496,0.00046997574566785035,128.0,0.01672896759638102,8,5,3,0.01662440213160803,32,3,1,0.044927378402988244,128,3,1,0.037269507072042345,128.0,5.0,2.0,0.0369072883400217,512.0,3.0,1.0,256,0.18398480955013427,15.0,5,Adam,,,,47.0,0.8654761904761905,0.8336199618607673,COMPLETE
83,0.8570909464785421,2026-10-05 15:46:20.122495,2026-10-05 15:48:21.343628,0 days 00:02:01.221133,0.8560466565133833,0.976963190467729,0.0002781069125208168,0.00015320410090164326,128.0,0.014860223531940109,8,5,3,0.016086409600849425,32,3,1,0.04634354376993706,128,3,1,0.039943239457033215,128.0,5.0,2.0,0.03183503119515464,512.0,3.0,1.0,256,0.22676668693387697,17.0,5,Adam,,,,43.0,0.8708333333333333,0.843348559623751,COMPLETE
84,0.8548326195321383,2026-10-05 15:48:21.486370,2026-10-05 15:50:23.504576,0 days 00:02:02.018206,0.8613977721781478,0.9743706006514298,0.0005085412706907368,0.00015635854390714355,128.0,0.014620878415691079,8,5,3,0.013051638316670722,32,3,1,0.04703728152641182,128,3,1,0.039812354929827105,128.0,5.0,2.0,0.03296787142271244,512.0,3.0,1.0,256,0.26694197156931804,17.0,5,Adam,,,,49.0,0.8708333333333333,0.8388319057309434,COMPLETE
85,0.7288644432794222,2026-10-05 15:50:23.636758,2026-10-05 15:51:26.202992,0 days 00:01:02.566234,0.8721384153933067,0.9749289529111839,0.0002010609689279099,0.0003001398104392943,128.0,0.015651857542825817,8,5,3,0.015882473188208623,32,3,1,0.04388419820039728,128,3,1,0.041999620350176764,128.0,5.0,2.0,0.029885297622468738,512.0,3.0,1.0,256,0.13712874978087158,18.0,5,Adam,,,,,,,PRUNED
86,0.5441421146750902,2026-10-05 15:51:26.336109,2026-10-05 15:51:54.979124,0 days 00:00:28.643015,0.8568951090864407,0.9793086676735627,0.0004169299115445829,0.0009169882175278527,128.0,0.017276378210035928,8,5,3,0.018891175676562722,32,3,1,0.04245964332171316,128,3,1,0.03970880908171626,128.0,3.0,2.0,0.03248783533588668,512.0,3.0,1.0,256,0.1908316167924608,13.0,5,Adam,,,,,,,PRUNED
87,0.861277813933558,2026-10-05 15:51:55.111796,2026-10-05 15:53:55.055915,0 days 00:01:59.944119,0.8646018290517542,0.9930328213894017,0.00030487444387214836,0.0002013360584948781,128.0,0.013653580200693094,8,5,3,0.010555603073498608,32,3,1,0.044608689224548824,128,3,1,0.03272262179482835,128.0,5.0,2.0,0.029873608110952517,512.0,3.0,1.0,256,0.2181828131988905,14.0,5,Adam,,,,48.0,0.8767857142857143,0.8457699135814016,COMPLETE
88,,2026-10-05 15:53:55.188335,2026-10-05 15:53:55.268407,0 days 00:00:00.080072,,,,,,0.011592859728204206,8,5,3,0.010911732922037239,32,3,1,0.04638765171773762,128,3,2,0.032921444592806014,128.0,5.0,2.0,0.026798615518528378,512.0,3.0,1.0,,,,5,,,,,,,,PRUNED
89,0.520385068305842,2026-10-05 15:53:55.400920,2026-10-05 15:55:01.415585,0 days 00:01:06.014665,0.8552011840846139,0.9949282490041128,0.0003183947788384172,0.00040196009125036456,128.0,0.01370309916192585,8,5,3,0.013757402714438045,32,5,1,0.017631688900287275,128,3,1,0.040701451531420275,128.0,5.0,1.0,0.040331609542007534,512.0,3.0,1.0,256,0.34719801520526955,14.0,5,Adam,,,,,,,PRUNED
90,0.4130796346859929,2026-10-05 15:55:01.550832,2026-10-05 15:55:27.039527,0 days 00:00:25.488695,,,,,128.0,0.020691013271734886,8,5,3,0.012326431338089775,32,3,1,0.041841008061151014,128,3,1,0.028236545059233946,128.0,5.0,2.0,0.03463465102673353,512.0,3.0,1.0,256,0.22189592202783162,14.0,5,SGD,0.000524619934811189,0.8780473971636866,0.0005608658344912673,,,,PRUNED
91,0.837679117889176,2026-10-05 15:55:27.175429,2026-10-05 15:57:34.823663,0 days 00:02:07.648234,0.8648056762999192,0.9938351886546609,0.00017390873485634688,0.0002262643722959614,128.0,0.014990811837446896,8,5,3,0.01010731152114846,32,3,1,0.044310871416101544,128,3,1,0.03161692582481043,128.0,5.0,2.0,0.030348826557158683,512.0,3.0,1.0,256,0.1719685192501453,17.0,5,Adam,,,,49.0,0.8547619047619047,0.8205963310164474,COMPLETE
92,0.8492608471128665,2026-10-05 15:57:34.956430,2026-10-05 15:59:41.510181,0 days 00:02:06.553751,0.8809688521966964,0.970765523432835,0.0002699518822632983,0.0001504326545756637,128.0,0.01632429455134589,8,5,3,0.01719578698379165,32,3,1,0.048675485045299796,128,3,1,0.03658251516900394,128.0,5.0,2.0,0.03251528202414232,512.0,3.0,1.0,256,0.26919349193292313,14.0,5,Adam,,,,48.0,0.8642857142857143,0.8342359799400187,COMPLETE
93,0.8707404272285071,2026-10-05 15:59:41.644142,2026-10-05 16:01:47.475890,0 days 00:02:05.831748,0.8684988918771086,0.9808334393150603,0.0005344402558837688,0.0007310983231101877,128.0,0.018951113229207367,8,5,3,0.020628646434735293,32,3,1,0.04769412612073563,128,3,1,0.034372827971215436,128.0,5.0,2.0,0.037970343384113585,512.0,3.0,1.0,256,0.21467897879705375,13.0,5,Adam,,,,50.0,0.888095238095238,0.8533856163617761,COMPLETE
94,0.7822526435965116,2026-10-05 16:01:47.611638,2026-10-05 16:03:24.210182,0 days 00:01:36.598544,0.8718476737119017,0.9779697305590794,0.0003743391377241772,0.002488475605850955,128.0,0.01153192128319263,8,5,3,0.04773843396965007,32,3,1,0.047957144831067756,128,3,1,0.034156811880691085,128.0,5.0,2.0,0.03771318590021114,512.0,3.0,1.0,256,0.1434331188382349,13.0,5,Adam,,,,,,,PRUNED
95,0.7991706745476566,2026-10-05 16:03:24.349777,2026-10-05 16:04:55.865420,0 days 00:01:31.515643,0.8591978401681276,0.9831874357063075,0.0005260829031895107,0.0006707752222657502,128.0,0.019231372311115474,8,5,3,0.020973988253914985,32,3,1,0.0459955804718618,128,3,1,0.03879575315856604,128.0,5.0,2.0,0.03970781927386116,128.0,3.0,1.0,256,0.22080363399447958,13.0,5,Adam,,,,,,,PRUNED
96,0.8445744314505265,2026-10-05 16:04:56.017526,2026-10-05 16:07:48.631031,0 days 00:02:52.613505,0.8687630101951217,0.96358951600032,0.0007319031709974603,8.669662511270724e-05,128.0,0.018720291236240545,8,7,3,0.015730619509766126,32,7,1,0.04502488188880051,128,3,1,0.03320417231281534,256.0,5.0,2.0,0.03549769652594565,512.0,3.0,1.0,256,0.10301860749410893,13.0,5,Adam,,,,50.0,0.8571428571428571,0.8320060057581958,COMPLETE
97,,2026-10-05 16:07:48.766749,2026-10-05 16:07:48.847940,0 days 00:00:00.081191,,,,,,0.020038368695288376,8,5,3,0.023239210459163703,32,3,2,0.04732810761735143,32,3,1,0.0379773522305639,128.0,5.0,2.0,0.04237837323462011,512.0,3.0,1.0,,,,5,,,,,,,,PRUNED
98,0.5235228666714447,2026-10-05 16:07:48.998866,2026-10-05 16:08:13.795480,0 days 00:00:24.796614,0.904804011426622,0.9824889395653182,0.00035689023319921125,0.0002342877055575932,128.0,0.01336894110908344,8,5,3,0.04414521367661052,32,3,1,0.04320655416480798,128,3,1,0.030263778188990863,128.0,3.0,2.0,0.03528316480468668,512.0,3.0,1.0,256,0.17836320925022747,14.0,5,Adam,,,,,,,PRUNED
99,0.5464204959141081,2026-10-05 16:08:13.951596,2026-10-05 16:08:34.028836,0 days 00:00:20.077240,0.9217001997432815,0.99019653014018,0.0005813333394402017,0.0005521779212511053,128.0,0.014500200846809053,8,5,3,0.02471431640994741,32,3,1,0.04077790074377577,64,3,1,0.03151784377032337,128.0,5.0,2.0,0.04356527459333322,512.0,3.0,1.0,512,0.33425066226699723,16.0,5,Adam,,,,,,,PRUNED
