number,value,datetime_start,datetime_complete,duration,params_adam_beta1,params_adam_beta2,params_adam_lr,params_adam_wd,params_batch_size,params_block_0_dropout,params_block_0_filters,params_block_0_kernel,params_block_0_stride,params_block_1_dropout,params_block_1_filters,params_block_1_kernel,params_block_1_stride,params_block_2_dropout,params_block_2_filters,params_block_2_kernel,params_block_2_stride,params_block_3_dropout,params_block_3_filters,params_block_3_kernel,params_block_3_stride,params_block_4_dropout,params_block_4_filters,params_block_4_kernel,params_block_4_stride,params_fc_hidden,params_lr_factor,params_lr_patience,params_n_blocks,params_optimizer,params_sgd_lr,params_sgd_momentum,params_sgd_wd,user_attrs_best_epoch,user_attrs_validation_accuracy,user_attrs_validation_macro_f1,state
0,0.3701421916489621,2026-10-05 14:02:41.028859,2026-10-05 14:03:47.125172,0 days 00:01:06.096313,,,,,128.0,0.012323344486727979,8,7,3,0.017336180394137354,16,5,2,0.02465447373174767,64,3,1,0.016820964947491662,128.0,3.0,1.0,,,,,512,0.19763058787582308,12.0,4,SGD,0.00019634341572933326,0.8984275776885255,5.762487216478604e-05,48.0,0.37083333333333335,0.36945104996459094,COMPLETE
1,0.4211101287352753,2026-10-05 14:03:47.274135,2026-10-05 14:05:17.871794,0 days 00:01:30.597659,,,,,128.0,0.041005312934444586,32,5,3,0.02554709158757928,16,7,1,0.012982025747190833,64,3,1,0.04085081386743783,64.0,3.0,1.0,,,,,256,0.36014665762139764,16.0,4,SGD,0.0009833181933644897,0.7184319215829468,1.753594952976443e-05,49.0,0.425,0.41722025747055064,COMPLETE
2,0.5266860538361016,2026-10-05 14:05:18.001905,2026-10-05 14:06:19.146587,0 days 00:01:01.144682,0.9754527819892891,0.9317685471496893,0.0011986281799901185,0.0016973078532467015,200.0,0.030909313175279764,16,7,3,0.019971689165955,16,5,1,0.04232481518257668,64,3,1,,,,,,,,,256,0.18804153962214143,8.0,3,Adam,,,,48.0,0.5327380952380952,0.520634012434108,COMPLETE
3,0.6746355780741571,2026-10-05 14:06:19.279262,2026-10-05 14:08:31.299467,0 days 00:02:12.020205,0.9519502888056603,0.9367415349586534,0.003336101309469784,8.923807143379781e-06,200.0,0.04771638815650077,8,5,3,0.022035132392670787,64,5,1,0.019582475626678898,128,5,1,,,,,,,,,512,0.6058446644748636,15.0,3,Adam,,,,47.0,0.6827380952380953,0.666533060910219,COMPLETE
4,0.553952974581017,2026-10-05 14:08:31.454638,2026-10-05 14:10:06.132829,0 days 00:01:34.678191,,,,,64.0,0.03048372233197124,32,7,3,0.014538940849623563,32,3,1,0.01967409163601807,32,3,2,,,,,,,,,512,0.8096691394120938,17.0,3,SGD,0.0011159088550343414,0.9105271468723695,0.0038765111709116325,50.0,0.5595238095238095,0.5483821396382246,COMPLETE
5,,2026-10-05 14:10:06.279281,2026-10-05 14:10:06.333418,0 days 00:00:00.054137,,,,,,0.016432322056699946,8,7,3,0.035985315961888587,32,5,1,0.048920422190097824,32,3,2,0.01780971951192178,128.0,5.0,2.0,0.03581889183628671,128.0,3.0,1.0,,,,5,,,,,,,,PRUNED
6,,2026-10-05 14:10:06.475318,2026-10-05 14:10:06.520918,0 days 00:00:00.045600,,,,,,0.04713274250350902,16,7,3,0.0167797098674437,32,7,2,0.015603360609460961,64,5,1,,,,,,,,,,,,3,,,,,,,,PRUNED
7,,2026-10-05 14:10:06.661949,2026-10-05 14:10:06.709845,0 days 00:00:00.047896,,,,,,0.021743673770579737,8,7,3,0.038078675090308135,64,7,2,0.02862392072529841,64,5,2,0.015082420506075393,256.0,3.0,2.0,,,,,,,,4,,,,,,,,PRUNED
8,,2026-10-05 14:10:06.854283,2026-10-05 14:10:06.896548,0 days 00:00:00.042265,,,,,,0.03125418526272592,8,7,3,0.027558856828225446,64,7,2,0.016257481706843442,128,5,2,0.032174162100456025,256.0,5.0,2.0,,,,,,,,4,,,,,,,,PRUNED
9,,2026-10-05 14:10:07.043284,2026-10-05 14:10:07.085459,0 days 00:00:00.042175,,,,,,0.01464290562027665,8,7,3,0.016928074796400606,64,7,2,0.030125450343203505,128,5,1,0.04760920965699831,64.0,3.0,1.0,,,,,,,,4,,,,,,,,PRUNED
10,0.8563833319098901,2026-10-05 14:10:07.227509,2026-10-05 14:12:54.891053,0 days 00:02:47.663544,0.9068515559725695,0.9652028519024756,0.008094454562649891,1.1990413778055588e-06,200.0,0.047396519251223214,16,5,3,0.04780785829889703,64,3,1,0.03788623593360378,128,5,1,0.03128492670279544,64.0,5.0,2.0,0.010567689211659854,256.0,3.0,1.0,128,0.8770937470127276,5.0,5,Adam,,,,50.0,0.8672619047619048,0.8455047590578754,COMPLETE
11,0.8347801983093999,2026-10-05 14:12:55.050036,2026-10-05 14:15:45.131876,0 days 00:02:50.081840,0.9234044305725273,0.9541833898470133,0.008680399316661742,1.4211537482266188e-06,200.0,0.04997449754566205,16,5,3,0.04976482875798626,64,3,1,0.03726749621045093,128,5,1,0.02941240784789848,64.0,5.0,2.0,0.012725290807332416,256.0,3.0,1.0,128,0.8797484766742464,5.0,5,Adam,,,,49.0,0.8404761904761905,0.8290842061426094,COMPLETE
12,0.8349350574066637,2026-10-05 14:15:45.276222,2026-10-05 14:18:36.571003,0 days 00:02:51.294781,0.8842650747520039,0.9829644884150359,0.009256762816668472,1.0020121013332432e-06,200.0,0.04126429735539777,16,5,3,0.04967760384215255,64,3,1,0.03794030830388812,128,5,1,0.02886808751750585,64.0,5.0,2.0,0.010834250085608765,256.0,3.0,1.0,128,0.8946581082665175,5.0,5,Adam,,,,47.0,0.844047619047619,0.8258224957657084,COMPLETE
13,0.43805687782282,2026-10-05 14:18:36.702636,2026-10-05 14:19:11.702305,0 days 00:00:34.999669,0.8624836929647332,0.9981554800699568,0.007466393343635783,1.1645392808873212e-06,200.0,0.04042887324734776,16,5,3,0.049971055629143155,64,3,1,0.037581906674513214,128,5,1,0.028436210513169073,64.0,5.0,2.0,0.010476564507977711,256.0,3.0,1.0,128,0.7396563628835666,5.0,5,Adam,,,,,,,PRUNED
14,0.7896590920316773,2026-10-05 14:19:11.838651,2026-10-05 14:22:08.996917,0 days 00:02:57.158266,0.8829156363034194,0.9807363686906607,0.00013179982344396247,1.8666928397367735e-05,200.0,0.0400673744438435,16,5,3,0.0441744120387903,64,3,1,0.03672335505971373,128,5,1,0.03553907373527548,64.0,5.0,2.0,0.011213569359099585,512.0,3.0,1.0,128,0.6623480301363837,9.0,5,Adam,,,,49.0,0.7964285714285714,0.7828896126347832,COMPLETE
15,0.8279738859542363,2026-10-05 14:22:09.164802,2026-10-05 14:25:10.805041,0 days 00:03:01.640239,0.9021017426397014,0.966531388129982,0.003236497085884789,1.0673500349429837e-06,64.0,0.03716844621710427,16,5,3,0.04399528350105656,64,3,1,0.045589316936129505,128,5,1,0.025076200528579555,64.0,5.0,2.0,0.02431041743613676,256.0,3.0,1.0,128,0.8695603436402255,8.0,5,Adam,,,,48.0,0.8416666666666667,0.8142811052418057,COMPLETE
16,0.4176031941997318,2026-10-05 14:25:10.945021,2026-10-05 14:25:28.979346,0 days 00:00:18.034325,0.918492254667161,0.9801987044182937,0.009568767465028495,1.2477517274407184e-05,200.0,0.04425465268517182,16,5,3,0.04294817236605836,64,3,1,0.03209301070500461,32,5,1,0.021583932047031434,64.0,5.0,2.0,0.021372686217910483,256.0,3.0,1.0,128,0.5461426624765098,5.0,5,Adam,,,,,,,PRUNED
17,0.8438231341818321,2026-10-05 14:25:29.127079,2026-10-05 14:28:13.838823,0 days 00:02:44.711744,0.857978405990891,0.909691209915485,0.0027298886342351446,4.938745951938629e-06,200.0,0.03517635689193466,16,5,3,0.036134820073240564,64,3,1,0.040914745418536944,128,5,1,0.038701584914456175,64.0,5.0,2.0,0.021404414310099776,256.0,3.0,1.0,128,0.7537699875598214,10.0,5,Adam,,,,50.0,0.85,0.8376462683636641,COMPLETE
18,,2026-10-05 14:28:13.990526,2026-10-05 14:28:14.057707,0 days 00:00:00.067181,,,,,,0.035419425025027144,32,5,3,0.032678252126370114,16,3,1,0.042795086097184555,128,5,2,0.039537694277943874,256.0,5.0,1.0,0.025528317564951164,128.0,3.0,1.0,,,,5,,,,,,,,PRUNED
19,0.8464704425997137,2026-10-05 14:28:14.209575,2026-10-05 14:30:22.166326,0 days 00:02:07.956751,0.8576907654893131,0.904236063644917,0.0012109687306370652,4.444254928856299e-05,200.0,0.02427569578163709,16,5,3,0.03155972091717127,32,3,1,0.049763868400139265,128,5,1,0.010162769296756528,128.0,5.0,2.0,,,,,128,0.48177978080600037,12.0,4,Adam,,,,48.0,0.8571428571428571,0.8357980280565703,COMPLETE
20,0.3734400889508423,2026-10-05 14:30:22.307393,2026-10-05 14:30:42.094069,0 days 00:00:19.786676,,,,,64.0,0.02143876883028606,16,5,3,0.01079245353015313,32,3,1,0.04921130286471593,32,5,1,0.011823599848153165,128.0,5.0,2.0,,,,,128,0.45316022572443465,19.0,4,SGD,0.07477810443016279,0.705514521115998,0.006721745240881962,,,,PRUNED
21,0.8193331717052171,2026-10-05 14:30:42.227982,2026-10-05 14:32:51.449488,0 days 00:02:09.221506,0.8518668899691313,0.9056111768979435,0.0009265896601345207,0.00012330477771439448,200.0,0.02504153975242509,16,5,3,0.03212992068263091,32,3,1,0.04275350543039794,128,5,1,0.04941022935951693,128.0,5.0,2.0,,,,,128,0.7251460428521113,12.0,4,Adam,,,,44.0,0.8285714285714286,0.8100949148390056,COMPLETE
22,0.8426320636480884,2026-10-05 14:32:51.589362,2026-10-05 14:35:21.322734,0 days 00:02:29.733372,0.8743569285087482,0.9010672468107708,0.0010921513714980207,6.562685597990178e-05,200.0,0.025706736924002237,16,5,3,0.040080079146633356,32,3,1,0.0455687134834253,128,5,1,0.04156917666818678,128.0,5.0,2.0,0.04903191719796271,512.0,3.0,1.0,128,0.31823145239005657,12.0,5,Adam,,,,47.0,0.8505952380952381,0.8346688892009387,COMPLETE
23,0.8528590829608258,2026-10-05 14:35:21.467357,2026-10-05 14:37:43.546115,0 days 00:02:22.078758,0.8501798437630933,0.9181191308718093,0.002599886092686421,6.0612839358420665e-06,200.0,0.03328631466106441,16,5,3,0.029664425915394855,32,3,1,0.03483343172535252,128,5,1,0.03577240230697748,128.0,5.0,2.0,0.020195820113157032,256.0,3.0,1.0,128,0.5178103469648483,10.0,5,Adam,,,,49.0,0.8636904761904762,0.8420276897311754,COMPLETE
24,0.8262223266636651,2026-10-05 14:37:43.692162,2026-10-05 14:39:52.519349,0 days 00:02:08.827187,0.8956908231607827,0.9228013500568715,0.00035577969879367144,7.537947044273827e-05,128.0,0.01938026415247681,16,5,3,0.028710404857736595,32,3,1,0.032964155559628325,128,5,1,0.04513400147225334,128.0,5.0,2.0,,,,,256,0.48950616728952856,13.0,4,Adam,,,,48.0,0.8386904761904762,0.813754177136854,COMPLETE
25,0.8274239027471986,2026-10-05 14:39:52.666870,2026-10-05 14:41:57.300866,0 days 00:02:04.633996,0.8502342124036609,0.9197636894762823,0.0019692891193000186,0.0005234633008807679,200.0,0.0273477511570141,32,5,3,0.03084484405936283,32,3,1,0.02644785159992932,128,5,1,0.03350103540012836,128.0,5.0,2.0,0.017706017531390256,256.0,3.0,1.0,128,0.39617348021145404,7.0,5,Adam,,,,45.0,0.8315476190476191,0.823300186446778,COMPLETE
26,,2026-10-05 14:41:57.479515,2026-10-05 14:41:57.546067,0 days 00:00:00.066552,,,,,,0.033858500834214385,16,5,3,0.024069039075240488,32,3,2,0.03393888909082582,128,3,2,0.023297389906098927,128.0,3.0,2.0,,,,,,,,4,,,,,,,,PRUNED
27,0.5571886844286799,2026-10-05 14:41:57.688185,2026-10-05 14:43:42.643309,0 days 00:01:44.955124,0.9395071467982492,0.9494161064367521,0.00043543183384820393,3.3623495249548146e-06,200.0,0.027852992774181795,16,5,3,0.03487773908677922,32,3,1,0.045718982841976265,128,5,1,0.010109555747413089,128.0,5.0,1.0,0.0290566535935387,256.0,3.0,1.0,128,0.28058200700723485,10.0,5,Adam,,,,,,,PRUNED
28,0.4603963729298987,2026-10-05 14:43:42.792527,2026-10-05 14:44:01.159582,0 days 00:00:18.367055,0.870944830630714,0.9185653419046255,0.0045583895078081,2.793811980017031e-05,200.0,0.0236648480363515,16,5,3,0.0414014151995494,32,3,1,0.03964299939687392,32,5,1,0.02031387043758288,128.0,5.0,2.0,,,,,128,0.10806283102950798,14.0,4,Adam,,,,,,,PRUNED
29,0.5684313648434272,2026-10-05 14:44:01.300420,2026-10-05 14:44:22.286852,0 days 00:00:20.986432,0.8960349274596483,0.9434596047330943,0.0015065390886752632,5.0254802900626235e-06,128.0,0.017796005610403433,32,5,3,0.029108053049512996,16,5,2,0.022158957911959293,128,3,1,,,,,,,,,512,0.6117425889703625,10.0,3,Adam,,,,,,,PRUNED
30,0.09652675503190968,2026-10-05 14:44:22.420210,2026-10-05 14:44:51.685203,0 days 00:00:29.264993,,,,,64.0,0.04466552765883267,16,5,3,0.04644412978177976,32,5,1,0.035383801730089384,64,5,1,0.03583281343366684,256.0,5.0,2.0,0.03145307376779788,512.0,3.0,1.0,256,0.5067214069082963,7.0,5,SGD,0.06965922359337023,0.9867569523928008,2.5354279491654064e-06,,,,PRUNED
31,0.8474203836894648,2026-10-05 14:44:51.826642,2026-10-05 14:47:37.989580,0 days 00:02:46.162938,0.8573050880450448,0.9119832706589314,0.0023191747621136025,4.036734958061185e-06,200.0,0.012800814762753937,16,5,3,0.03566321859321395,64,3,1,0.041604153980789635,128,5,1,0.037997074782352244,64.0,5.0,2.0,0.01800731908695889,256.0,3.0,1.0,128,0.7624677633992991,11.0,5,Adam,,,,45.0,0.8601190476190477,0.834721719759882,COMPLETE
32,0.8515890398235524,2026-10-05 14:47:38.131892,2026-10-05 14:49:29.321613,0 days 00:01:51.189721,0.8686465784202202,0.9118141443950435,0.0006456894128126998,2.936524341377674e-06,200.0,0.010004330645200805,16,5,3,0.025600723890246053,16,3,1,0.049982657944975306,128,5,1,0.04400660208734937,64.0,5.0,2.0,0.01704107265509614,256.0,3.0,1.0,128,0.8051797268328524,11.0,5,Adam,,,,49.0,0.8589285714285714,0.8442495082185333,COMPLETE
33,0.8309363890403523,2026-10-05 14:49:29.458295,2026-10-05 14:51:20.735882,0 days 00:01:51.277587,0.8724014398770936,0.9142483070128183,0.0005687986722259532,3.2802989214757013e-06,200.0,0.012789418780514103,16,5,3,0.025466707308271455,16,3,1,0.039255490516603556,128,5,1,0.044765170378988334,64.0,5.0,2.0,0.01693970786151154,256.0,3.0,1.0,128,0.8085498124282396,11.0,5,Adam,,,,49.0,0.8488095238095238,0.8130632542711806,COMPLETE
34,0.4588153454234487,2026-10-05 14:51:20.884179,2026-10-05 14:51:41.071310,0 days 00:00:20.187131,0.868797367127756,0.9284467789144809,0.00511017614068302,3.2440260404472226e-06,200.0,0.010646036283721384,16,5,3,0.02160376993360673,16,3,1,0.030546202319872266,128,3,1,0.036888776591884026,64.0,5.0,2.0,0.01609618555273138,256.0,3.0,1.0,128,0.8053376226747776,7.0,5,Adam,,,,,,,PRUNED
35,0.4512269694674716,2026-10-05 14:51:41.220150,2026-10-05 14:52:08.510234,0 days 00:00:27.290084,0.9125571090546909,0.9117896220088882,0.00014094526510415042,8.476592161458423e-06,200.0,0.010261574035379613,16,5,3,0.02662790399189868,16,3,1,0.046848907129037415,64,5,1,0.043062781133365785,64.0,3.0,1.0,0.01701906883447369,256.0,3.0,1.0,128,0.6808813326999646,14.0,5,Adam,,,,,,,PRUNED
36,0.5681264850937562,2026-10-05 14:52:08.648325,2026-10-05 14:52:42.052579,0 days 00:00:33.404254,0.8845033105292327,0.9216341970549036,0.00021499691269782583,2.201841695164707e-06,200.0,0.014088795632125083,32,5,3,0.020182333224774397,16,5,1,0.04235776045187794,128,3,1,0.032663519969157055,64.0,5.0,2.0,0.020790038051549907,256.0,3.0,1.0,128,0.8287690211637,9.0,5,Adam,,,,,,,PRUNED
37,0.5221362664474329,2026-10-05 14:52:42.192906,2026-10-05 14:53:07.260577,0 days 00:00:25.067671,,,,,128.0,0.01513319171726217,16,5,3,0.023838992243240768,16,7,1,0.010117180968649782,128,5,2,0.038748187709746286,64.0,3.0,1.0,0.014520160214901262,128.0,3.0,1.0,512,0.7687733298322654,11.0,5,SGD,0.005923568164414008,0.8073826957175098,0.0006485507663278259,,,,PRUNED
38,0.382188467761314,2026-10-05 14:53:07.402250,2026-10-05 14:53:30.211235,0 days 00:00:22.808985,0.8634251434849076,0.9636384610194499,0.002127752149509628,0.007783597121003601,200.0,0.012336273995179007,8,7,3,0.034412580345132227,64,3,1,0.04380912704604021,64,5,1,0.042554364565603284,64.0,5.0,2.0,0.01971824456808293,256.0,3.0,1.0,128,0.6963690800174688,13.0,5,Adam,,,,,,,PRUNED
39,,2026-10-05 14:53:30.371482,2026-10-05 14:53:30.450609,0 days 00:00:00.079127,,,,,,0.017692397313985662,16,7,3,0.03968583601981713,64,5,2,0.04012387462113288,32,3,1,0.026627696340060448,64.0,3.0,2.0,0.02490991240828105,256.0,3.0,1.0,,,,5,,,,,,,,PRUNED
40,,2026-10-05 14:53:30.598603,2026-10-05 14:53:30.665934,0 days 00:00:00.067331,,,,,,0.03795347766502645,8,5,3,0.029385482677812127,16,7,1,0.035074710859978535,128,5,2,0.0322820815636212,256.0,5.0,2.0,0.014277033492791552,256.0,3.0,1.0,,,,5,,,,,,,,PRUNED
41,0.4358159788957364,2026-10-05 14:53:30.807939,2026-10-05 14:53:51.502125,0 days 00:00:20.694186,0.8515300944539282,0.9019019821778866,0.0007601694070586354,2.5282226752201803e-05,200.0,0.03133613949860505,16,5,3,0.03143406306098145,32,3,1,0.04789678059338242,128,5,1,,,,,,,,,128,0.5644038465249551,12.0,3,Adam,,,,,,,PRUNED
42,0.6623583184660129,2026-10-05 14:53:51.643683,2026-10-05 14:54:57.924342,0 days 00:01:06.280659,0.8616069594196999,0.9106180285236257,0.0015029725744969242,6.830487670775993e-06,200.0,0.029023499340233194,16,5,3,0.03764185001897109,32,3,1,0.04951317867202528,128,5,1,0.01586556106533435,128.0,5.0,2.0,,,,,128,0.8472522124001033,11.0,4,Adam,,,,,,,PRUNED
43,0.8381483759452103,2026-10-05 14:54:58.067403,2026-10-05 14:57:57.948461,0 days 00:02:59.881058,0.8775597174996126,0.9007888378297702,0.0007481751113328142,2.8363319275218953e-06,200.0,0.02060971274125451,16,5,3,0.046766492033771506,64,3,1,0.044202200152149554,128,5,1,0.04616599299050343,128.0,5.0,2.0,,,,,256,0.4300989217321716,13.0,4,Adam,,,,50.0,0.8494047619047619,0.8268919899856587,COMPLETE
44,0.4707207912857856,2026-10-05 14:57:58.087368,2026-10-05 14:58:26.600469,0 days 00:00:28.513101,0.8594223782278388,0.9263036754294435,0.005538712431449185,1.9026036984644168e-06,200.0,0.02324823339050998,16,5,3,0.03357447386594654,64,3,1,0.04997618922133531,128,5,1,,,,,,,,,128,0.6274042225730712,9.0,3,Adam,,,,,,,PRUNED
45,,2026-10-05 14:58:26.740611,2026-10-05 14:58:26.807758,0 days 00:00:00.067147,,,,,,0.04366595962093851,16,7,3,0.02643098030057152,32,3,2,0.047474289777369144,128,5,1,0.017971748688088873,128.0,5.0,2.0,0.018951082160851555,256.0,3.0,1.0,,,,5,,,,,,,,PRUNED
46,0.3286503970845802,2026-10-05 14:58:26.954266,2026-10-05 14:58:55.658587,0 days 00:00:28.704321,,,,,128.0,0.017921193969771286,8,5,3,0.024212210653257748,64,7,1,0.04130712527715026,64,5,1,0.040186081413941144,64.0,5.0,2.0,0.014855737046362503,512.0,3.0,1.0,128,0.37384949828678876,16.0,5,SGD,0.00010451237418637342,0.8054371834178015,1.149033228460804e-06,,,,PRUNED
47,0.46018095260300607,2026-10-05 14:58:55.825304,2026-10-05 14:59:52.539508,0 days 00:00:56.714204,0.8505502101995676,0.9154597516679287,0.002179505035994976,0.00026632755774300663,200.0,0.04812833725376796,16,5,3,0.018857781977439574,16,3,1,0.0271040840131709,128,5,1,0.04955496327420342,128.0,5.0,1.0,0.02277044250204217,128.0,3.0,1.0,512,0.5480390320118669,11.0,5,Adam,,,,,,,PRUNED
48,,2026-10-05 14:59:52.676740,2026-10-05 14:59:52.735800,0 days 00:00:00.059060,,,,,,0.015674382327137547,32,7,3,0.03674972864122873,64,3,1,0.03593904928387979,128,5,2,0.03741595496345377,64.0,5.0,2.0,,,,,,,,4,,,,,,,,PRUNED
49,0.4974457649584594,2026-10-05 14:59:52.876129,2026-10-05 15:00:19.843257,0 days 00:00:26.967128,0.9695997819457283,0.934308378130436,0.0015503407214613575,3.8860075899276946e-05,200.0,0.033215488973800486,16,5,3,0.030194701697144794,64,3,1,0.03851494225490183,32,5,1,0.03409759447122132,256.0,3.0,2.0,0.043833873176318566,256.0,3.0,1.0,256,0.782837580820978,14.0,5,Adam,,,,,,,PRUNED
50,0.4540891636086555,2026-10-05 15:00:20.013106,2026-10-05 15:00:38.375850,0 days 00:00:18.362744,,,,,64.0,0.013021277965571478,16,5,3,0.021941212332786956,32,3,2,0.04461215786016635,128,3,1,,,,,,,,,128,0.3087954654454423,6.0,3,SGD,0.010326905845063974,0.7977974090180242,0.00013782138409304507,,,,PRUNED
51,0.6502300879405346,2026-10-05 15:00:38.544461,2026-10-05 15:02:00.136098,0 days 00:01:21.591637,0.8604838474863266,0.9081208561903051,0.00339608579515186,4.627202153853466e-06,200.0,0.037715733372084524,16,5,3,0.035686022044950354,64,3,1,0.04091609685358871,128,5,1,0.03075966200790264,64.0,5.0,2.0,0.028424702592358957,256.0,3.0,1.0,128,0.7519562501344618,10.0,5,Adam,,,,,,,PRUNED
52,0.5037375785425834,2026-10-05 15:02:00.291795,2026-10-05 15:02:34.672402,0 days 00:00:34.380607,0.8574978055302686,0.9077097403519145,0.0025863654568227807,1.5326814740708187e-05,200.0,0.041655138729904874,16,5,3,0.02771765767625008,64,3,1,0.031178619440212312,128,5,1,0.037723022018672635,64.0,5.0,2.0,0.021345254027260875,256.0,3.0,1.0,128,0.84199480398605,10.0,5,Adam,,,,,,,PRUNED
53,0.5280792539874158,2026-10-05 15:02:34.827042,2026-10-05 15:03:16.871441,0 days 00:00:42.044399,0.8664757084001197,0.9142652106997748,0.003933517964274771,7.531699566453144e-06,200.0,0.03258114570843665,16,5,3,0.03349111794181872,64,3,1,0.03705756736777649,128,5,1,0.04061272074014495,64.0,5.0,2.0,0.018124802950296493,256.0,3.0,1.0,128,0.8916339125799085,8.0,5,Adam,,,,,,,PRUNED
54,0.32915797506797917,2026-10-05 15:03:17.027682,2026-10-05 15:03:51.712430,0 days 00:00:34.684748,0.9859906044386157,0.9073745251319554,0.002708526385075673,2.3589502633731247e-06,200.0,0.03530184374221197,16,5,3,0.0398060824025476,64,3,1,0.034233018082636,128,5,1,0.03469517339325578,64.0,5.0,2.0,0.013711296833995704,256.0,3.0,1.0,128,0.6948185967523728,9.0,5,Adam,,,,,,,PRUNED
55,0.7359779799182684,2026-10-05 15:03:51.873259,2026-10-05 15:05:34.715780,0 days 00:01:42.842521,0.937970791927288,0.9314809415503958,0.001215889287821437,4.658022320764826e-06,200.0,0.02909874150286004,16,5,3,0.038202109054485824,64,3,1,0.04801172934992583,128,5,1,0.043749285886989654,64.0,5.0,2.0,0.0235183997137796,128.0,3.0,1.0,128,0.729127724332583,12.0,5,Adam,,,,,,,PRUNED
56,0.44552929528085616,2026-10-05 15:05:34.888914,2026-10-05 15:06:08.997811,0 days 00:00:34.108897,0.879655146598557,0.9409700116382079,0.006526794882757228,1.6669965530607104e-06,200.0,0.04576921027219075,16,5,3,0.046426455820849526,64,3,1,0.041558822705936534,128,5,1,0.04708309064562709,64.0,5.0,2.0,0.027559181830598127,256.0,3.0,1.0,128,0.7834725862741481,11.0,5,Adam,,,,,,,PRUNED
