number,value,datetime_start,datetime_complete,duration,params_adam_beta1,params_adam_beta2,params_adam_lr,params_adam_wd,params_batch_size,params_dropout,params_fc_hidden,params_lr_factor,params_lr_patience,params_optimizer,params_sgd_lr,params_sgd_momentum,params_sgd_wd,user_attrs_best_epoch,user_attrs_validation_accuracy,user_attrs_validation_macro_f1,state
0,1.0,2026-10-09 16:27:21.553397,2026-10-09 16:30:26.855321,0 days 00:03:05.301924,,,,,64,0.1624074561769746,128,0.11646759543664197,20,SGD,0.0396760507705299,0.8743233534055306,0.0006796578090758161,1.0,1.0,1.0,COMPLETE
1,0.9996852282525026,2026-10-09 16:30:27.032427,2026-10-09 16:32:47.273593,0 days 00:02:20.241166,,,,,128,0.21649165607921678,256,0.728140769114411,8,SGD,0.0007523742884534858,0.8062449345551705,6.672367170464208e-05,35.0,0.9996843434343434,0.9996861130706619,COMPLETE
2,0.9978564685821141,2026-10-09 16:32:47.424287,2026-10-09 16:34:55.862032,0 days 00:02:08.437745,,,,,128,0.4862528132298237,512,0.19763058787582308,12,SGD,0.00019634341572933326,0.8984275776885255,5.762487216478604e-05,42.0,0.9977904040404041,0.9979225331238242,COMPLETE
3,1.0,2026-10-09 16:34:55.994983,2026-10-09 16:36:53.898692,0 days 00:01:57.903709,,,,,200,0.17394178221021084,64,0.8374993880184934,6,SGD,0.06584106160121614,0.9594999316240181,0.0002463768595899747,4.0,1.0,1.0,COMPLETE
4,1.0,2026-10-09 16:36:54.041701,2026-10-09 16:39:00.606547,0 days 00:02:06.564846,,,,,128,0.2123738038749523,256,0.717795815437326,8,SGD,0.025502980701628937,0.7216196866671335,0.008862326508576254,5.0,1.0,1.0,COMPLETE
5,0.994117036016442,2026-10-09 16:39:00.759827,2026-10-09 16:39:26.082605,0 days 00:00:25.322778,,,,,128,0.1463476238100519,128,0.36014665762139764,16,SGD,0.0009833181933644897,0.7184319215829468,1.753594952976443e-05,,,,PRUNED
6,1.0,2026-10-09 16:39:26.216181,2026-10-09 16:41:32.248785,0 days 00:02:06.032604,0.8651047997790626,0.9031397756501047,0.0007162786999897341,1.263794633808288e-06,128,0.40838687198182444,256,0.6091283290110243,10,Adam,,,,1.0,1.0,1.0,COMPLETE
7,1.0,2026-10-09 16:41:32.380370,2026-10-09 16:43:29.381260,0 days 00:01:57.000890,0.9720044826262805,0.9802868404822216,0.004132765459466363,0.000341676434183297,200,0.21590058116550723,128,0.24925604710882868,19,Adam,,,,1.0,1.0,1.0,COMPLETE
8,1.0,2026-10-09 16:43:29.513363,2026-10-09 16:46:07.539600,0 days 00:02:38.026237,,,,,64,0.42720590636899725,512,0.19589229386694626,10,SGD,0.0034059785435329977,0.8210491909131459,7.7344821566468e-06,5.0,1.0,1.0,COMPLETE
9,0.9911712188012729,2026-10-09 16:46:07.670169,2026-10-09 16:46:32.853977,0 days 00:00:25.183808,,,,,128,0.20071291833014568,256,0.5021432185830892,5,SGD,0.000715354779469316,0.7106972147328144,0.000274319913977967,,,,PRUNED
10,1.0,2026-10-09 16:46:32.988544,2026-10-09 16:49:14.965525,0 days 00:02:41.976981,0.9770730713395525,0.9958810975199475,0.00010862348973937149,0.007645683783605599,64,0.323540359302987,128,0.422359922501545,20,Adam,,,,5.0,1.0,1.0,COMPLETE
11,0.9970365698665116,2026-10-09 16:49:15.098044,2026-10-09 16:49:38.721963,0 days 00:00:23.623919,,,,,200,0.10321648831143171,64,0.8895190276185567,16,SGD,0.09540369840469419,0.9853625896320626,0.0010437258483189142,,,,PRUNED
12,1.0,2026-10-09 16:49:38.854278,2026-10-09 16:51:35.449872,0 days 00:01:56.595594,,,,,200,0.28455177586829483,64,0.8889223100786534,15,SGD,0.0329684711437591,0.9690045843459457,0.0012237594247191301,1.0,1.0,1.0,COMPLETE
13,1.0,2026-10-09 16:51:35.584652,2026-10-09 16:54:13.702994,0 days 00:02:38.118342,,,,,64,0.14475048819439315,64,0.34978794873769303,5,SGD,0.014043721733475028,0.9122902878584767,0.0004940538306086194,1.0,1.0,1.0,COMPLETE
14,1.0,2026-10-09 16:54:13.843255,2026-10-09 16:56:10.775764,0 days 00:01:56.932509,0.859332234868209,0.9283914118467068,0.009917608120507165,1.3962100266000202e-06,200,0.28484590336045124,64,0.5779239573507515,13,Adam,,,,2.0,1.0,1.0,COMPLETE
15,1.0,2026-10-09 16:56:10.907644,2026-10-09 16:58:48.945229,0 days 00:02:38.037585,,,,,64,0.15115499370132435,128,0.7769067216636688,18,SGD,0.08872754604813389,0.9015230412918347,1.1535635582566103e-06,1.0,1.0,1.0,COMPLETE
16,1.0,2026-10-09 16:58:49.078314,2026-10-09 17:00:45.680849,0 days 00:01:56.602535,,,,,200,0.1019739981953502,64,0.11054337150473875,13,SGD,0.007985761920474493,0.8418220394354431,0.005928440456998787,6.0,1.0,1.0,COMPLETE
17,1.0,2026-10-09 17:00:45.813630,2026-10-09 17:03:26.039502,0 days 00:02:40.225872,,,,,64,0.2802886303907517,128,0.6161529202998269,7,SGD,0.04865872266001758,0.9420750413040843,0.00018419912902158537,2.0,1.0,1.0,COMPLETE
18,1.0,2026-10-09 17:03:26.180547,2026-10-09 17:05:24.763113,0 days 00:01:58.582566,0.9175988105045949,0.9554222965937597,0.00013159405537260094,7.272499656034689e-05,200,0.16242096428774086,512,0.4808837093482553,11,Adam,,,,2.0,1.0,1.0,COMPLETE
19,1.0,2026-10-09 17:05:24.896381,2026-10-09 17:08:20.157841,0 days 00:02:55.261460,,,,,64,0.25112285315613164,64,0.32189058061021525,17,SGD,0.007904805314839801,0.8683099026977347,0.0018015184300938275,4.0,1.0,1.0,COMPLETE
20,1.0,2026-10-09 17:08:20.305330,2026-10-09 17:10:19.639736,0 days 00:01:59.334406,,,,,200,0.3355024465027995,128,0.10052019545656138,14,SGD,0.015965157222639883,0.7806084362054304,0.0001078469806091638,9.0,1.0,1.0,COMPLETE
21,1.0,2026-10-09 17:10:19.775325,2026-10-09 17:12:27.870224,0 days 00:02:08.094899,,,,,128,0.17593748017352706,256,0.7899847193444565,7,SGD,0.031806234045992615,0.9455882799604204,0.008687604383983314,3.0,1.0,1.0,COMPLETE
22,1.0,2026-10-09 17:12:28.003194,2026-10-09 17:15:20.835856,0 days 00:02:52.832662,,,,,64,0.2435557078373038,256,0.6875530565987236,8,SGD,0.034642969884045756,0.7537241115189037,0.003151334239797008,2.0,1.0,1.0,COMPLETE
23,1.0,2026-10-09 17:15:20.981332,2026-10-09 17:17:34.495916,0 days 00:02:13.514584,,,,,128,0.1929272849955364,256,0.8309823368306355,6,SGD,0.01585096233272086,0.8649803885047864,0.0005990890881842158,3.0,1.0,1.0,COMPLETE
24,1.0,2026-10-09 17:17:34.631009,2026-10-09 17:19:48.386199,0 days 00:02:13.755190,,,,,128,0.1260993536492537,64,0.6729311268196287,8,SGD,0.06078024894476485,0.7477015329783653,2.717650484796996e-05,2.0,1.0,1.0,COMPLETE
25,1.0,2026-10-09 17:19:48.523695,2026-10-09 17:22:40.967599,0 days 00:02:52.443904,,,,,64,0.23862673496347722,256,0.8149693176335305,10,SGD,0.023080059917593005,0.9297487864176102,0.004330257038320239,1.0,1.0,1.0,COMPLETE
26,1.0,2026-10-09 17:22:41.099433,2026-10-09 17:24:42.881405,0 days 00:02:01.781972,0.9185651757105271,0.952569116087763,0.0008891959815138327,0.008053548891769556,200,0.18237688438206237,128,0.5511788137509634,9,Adam,,,,1.0,1.0,1.0,COMPLETE
27,1.0,2026-10-09 17:24:43.021881,2026-10-09 17:26:58.249972,0 days 00:02:15.228091,,,,,128,0.3227387767515332,512,0.7168831307027279,6,SGD,0.004316025324168695,0.8748506103069287,0.0004304557258375311,6.0,1.0,1.0,COMPLETE
28,1.0,2026-10-09 17:26:58.385369,2026-10-09 17:29:55.693008,0 days 00:02:57.307639,,,,,64,0.13006472108693184,64,0.4330223720899338,20,SGD,0.053590649852850995,0.7908522907625807,0.002432152169061005,1.0,1.0,1.0,COMPLETE
29,1.0,2026-10-09 17:29:55.826554,2026-10-09 17:31:58.993266,0 days 00:02:03.166712,,,,,200,0.22128726520506686,256,0.7361726834315148,8,SGD,0.009196173262142109,0.8447969835515098,0.0001614630394349034,4.0,1.0,1.0,COMPLETE
30,1.0,2026-10-09 17:31:59.126896,2026-10-09 17:34:12.774055,0 days 00:02:13.647159,,,,,128,0.20827413788288976,128,0.8509244476845115,6,SGD,0.024208210521437807,0.9657627558265043,0.00954284625093652,2.0,1.0,1.0,COMPLETE
31,1.0,2026-10-09 17:34:12.916361,2026-10-09 17:36:32.864577,0 days 00:02:19.948216,0.8550469970103358,0.9054532775776134,0.000730031421084033,1.05794324980846e-06,128,0.39378378529398717,256,0.6426263861297492,10,Adam,,,,1.0,1.0,1.0,COMPLETE
32,1.0,2026-10-09 17:36:33.005103,2026-10-09 17:38:52.907399,0 days 00:02:19.902296,0.8974149708742907,0.9032441640206469,0.0006880355725676238,2.736743459428975e-05,128,0.49588957924312227,256,0.7599564440619538,9,Adam,,,,1.0,1.0,1.0,COMPLETE
33,1.0,2026-10-09 17:38:53.047911,2026-10-09 17:41:19.286456,0 days 00:02:26.238545,0.9453555538416395,0.9351077263316279,0.001914163193132958,1.0909808492855201e-05,128,0.46089646403157003,256,0.6202488105651071,7,Adam,,,,3.0,1.0,1.0,COMPLETE
34,1.0,2026-10-09 17:41:19.446088,2026-10-09 17:43:40.390533,0 days 00:02:20.944445,0.8867095050006737,0.9695190918632326,0.0003672346900776047,0.0007645275194737403,128,0.37120437217388835,256,0.2721627044185306,11,Adam,,,,2.0,1.0,1.0,COMPLETE
35,1.0,2026-10-09 17:43:40.533760,2026-10-09 17:45:58.212600,0 days 00:02:17.678840,0.9376002367030948,0.927785364020744,0.00031141547881483603,6.297902417249958e-06,128,0.4554477427050652,512,0.7020198078788971,12,Adam,,,,1.0,1.0,1.0,COMPLETE
36,1.0,2026-10-09 17:45:58.381780,2026-10-09 17:48:13.999272,0 days 00:02:15.617492,0.8792831066795331,0.9967813332695186,0.002699308201120589,0.0006984368719625207,128,0.39556103730469017,256,0.5368137885969357,5,Adam,,,,1.0,1.0,1.0,COMPLETE
37,0.9993637071032249,2026-10-09 17:48:14.139420,2026-10-09 17:48:39.991825,0 days 00:00:25.852405,,,,,128,0.16698175911686367,128,0.14991897708025084,9,SGD,0.003952067128010677,0.7674922334062051,0.0009543579540578042,,,,PRUNED
38,1.0,2026-10-09 17:48:40.125368,2026-10-09 17:51:39.451904,0 days 00:02:59.326536,0.9547612583103963,0.9174920568078124,0.006687175291279572,9.816848495844863e-05,64,0.2592911060461327,256,0.24211186015143454,19,Adam,,,,2.0,1.0,1.0,COMPLETE
39,1.0,2026-10-09 17:51:39.590579,2026-10-09 17:53:49.137663,0 days 00:02:09.547084,,,,,200,0.12405682916963609,128,0.4320692700576615,16,SGD,0.06032687601316249,0.7342052680198315,0.00030584688962074233,2.0,1.0,1.0,COMPLETE
40,1.0,2026-10-09 17:53:49.285830,2026-10-09 17:56:04.042417,0 days 00:02:14.756587,,,,,128,0.22847227440318219,512,0.8718029908842322,7,SGD,0.09400378095025448,0.8351271395136565,1.0663116550726851e-05,2.0,1.0,1.0,COMPLETE
41,1.0,2026-10-09 17:56:04.183013,2026-10-09 17:58:07.552405,0 days 00:02:03.369392,0.9832355991829506,0.977963583235087,0.002886403626939268,0.0005224250285139532,200,0.19379945677391933,128,0.23670805906741674,18,Adam,,,,1.0,1.0,1.0,COMPLETE
42,1.0,2026-10-09 17:58:07.691194,2026-10-09 18:00:09.116800,0 days 00:02:01.425606,0.9653578067425459,0.9518550583897389,0.004891842567809801,5.884047896670292e-06,200,0.22359249376214824,128,0.18994569655172838,19,Adam,,,,2.0,1.0,1.0,COMPLETE
43,1.0,2026-10-09 18:00:09.283265,2026-10-09 18:02:14.472216,0 days 00:02:05.188951,0.9226849890193556,0.9790584575901853,0.001677078326531742,0.002091285102882918,200,0.26916001663974515,128,0.15004679051432943,20,Adam,,,,1.0,1.0,1.0,COMPLETE
44,1.0,2026-10-09 18:02:14.618581,2026-10-09 18:04:13.564385,0 days 00:01:58.945804,0.9011701680154409,0.9672431242995675,0.0002300500709992446,0.00015687435279362506,200,0.29625373297924423,64,0.39459484519018123,17,Adam,,,,4.0,1.0,1.0,COMPLETE
45,1.0,2026-10-09 18:04:13.696624,2026-10-09 18:06:18.331909,0 days 00:02:04.635285,0.8732612479723227,0.944159117522892,0.003988892114095563,2.7391703223955087e-05,200,0.15077674387997475,128,0.29508735185082924,19,Adam,,,,2.0,1.0,1.0,COMPLETE
46,1.0,2026-10-09 18:06:18.468868,2026-10-09 18:09:15.778667,0 days 00:02:57.309799,,,,,64,0.20843884172912058,64,0.4802895321972399,15,SGD,0.021531773375220817,0.987442686755426,1.5362389317093334e-06,6.0,1.0,1.0,COMPLETE
47,1.0,2026-10-09 18:09:15.925243,2026-10-09 18:11:20.234164,0 days 00:02:04.308921,,,,,200,0.35346685291103663,128,0.15959021248881272,18,SGD,0.011278580150648749,0.8183964861393469,8.643196528822587e-05,4.0,1.0,1.0,COMPLETE
48,1.0,2026-10-09 18:11:20.385927,2026-10-09 18:14:19.123585,0 days 00:02:58.737658,0.9347365130381847,0.918036140672352,0.001042421334758701,2.1219292276027154e-06,64,0.4212179742598085,64,0.7954996029735264,5,Adam,,,,1.0,1.0,1.0,COMPLETE
49,0.9990551605323288,2026-10-09 18:14:19.269272,2026-10-09 18:14:44.117360,0 days 00:00:24.848088,,,,,200,0.3030479098270966,256,0.3424742105667715,14,SGD,0.002074122874845528,0.8873398622145205,3.210286198562211e-05,,,,PRUNED
