number,value,datetime_start,datetime_complete,duration,params_adam_beta1,params_adam_beta2,params_adam_lr,params_adam_wd,params_batch_size,params_fc_dropout,params_fc_hidden,params_gru_hidden,params_lr_factor,params_lr_patience,params_optimizer,params_sgd_lr,params_sgd_momentum,params_sgd_wd,user_attrs_best_epoch,user_attrs_validation_accuracy,user_attrs_validation_macro_f1,state
0,1.0,2026-10-08 15:12:42.493721,2026-10-08 15:13:06.392780,0 days 00:00:23.899059,,,,,128,0.06011150117432088,512,128,0.24545997376568052,7,SGD,0.0812324508558869,0.9414083658321223,7.068974950624607e-06,1.0,1.0,1.0,COMPLETE
1,1.0,2026-10-08 15:13:06.542811,2026-10-08 15:13:38.994929,0 days 00:00:32.452118,,,,,64,0.05142344384136116,256,128,0.8591084298026667,20,SGD,0.006647135865318031,0.7494519958693145,1.8205657658407268e-06,3.0,1.0,1.0,COMPLETE
2,1.0,2026-10-08 15:13:39.140230,2026-10-08 15:14:13.587047,0 days 00:00:34.446817,0.958518595270556,0.9938559442622625,0.00023426581058204064,0.00755681014127443,64,0.031171107608941095,128,64,0.815861880342119,14,Adam,,,,2.0,1.0,1.0,COMPLETE
3,1.0,2026-10-08 15:14:13.729975,2026-10-08 15:14:33.221105,0 days 00:00:19.491130,,,,,200,0.014092422497476265,64,256,0.10441769369888193,18,SGD,0.09133995846860977,0.9239509830960306,6.235377135673162e-06,1.0,1.0,1.0,COMPLETE
4,1.0,2026-10-08 15:14:33.360391,2026-10-08 15:14:56.987882,0 days 00:00:23.627491,,,,,128,0.03251833220267471,64,512,0.670595829778396,17,SGD,0.04588156549160976,0.8369423282969652,3.0086868214458464e-06,1.0,1.0,1.0,COMPLETE
5,1.0,2026-10-08 15:14:57.130043,2026-10-08 15:15:17.019313,0 days 00:00:19.889270,0.860777187376031,0.9289461701460855,0.0032441600887341587,8.22607494622104e-06,200,0.0907566473926093,128,64,0.22897702980320356,19,Adam,,,,1.0,1.0,1.0,COMPLETE
6,1.0,2026-10-08 15:15:17.161705,2026-10-08 15:15:40.469396,0 days 00:00:23.307691,0.9215046223608592,0.941699359214563,0.005265761277157428,1.0661259689433902e-06,128,0.02279351625419417,128,256,0.2776862483765842,6,Adam,,,,1.0,1.0,1.0,COMPLETE
7,1.0,2026-10-08 15:15:40.609185,2026-10-08 15:16:03.757518,0 days 00:00:23.148333,0.8890105049931256,0.9907357620080687,0.0010124137770478635,1.6066267921727714e-06,128,0.028484049437746763,64,512,0.29164951253357796,7,Adam,,,,1.0,1.0,1.0,COMPLETE
8,0.6951726970556951,2026-10-08 15:16:03.897262,2026-10-08 15:16:07.814631,0 days 00:00:03.917369,,,,,200,0.00902897700544083,256,128,0.642051489473826,5,SGD,0.0003627066608804413,0.7118247910508815,0.00023097861492693574,,,,PRUNED
9,1.0,2026-10-08 15:16:07.963254,2026-10-08 15:16:39.895474,0 days 00:00:31.932220,0.9241510809698409,0.9241610438609551,0.004309673808203458,0.00016626592254031863,64,0.0877339353380981,512,512,0.17448221424471938,19,Adam,,,,1.0,1.0,1.0,COMPLETE
10,0.8941394700813073,2026-10-08 15:16:40.040023,2026-10-08 15:16:44.659357,0 days 00:00:04.619334,,,,,128,0.0696117803358321,512,128,0.42621278356998393,10,SGD,0.00012637268261792882,0.9632227906319301,0.0069037170554346996,,,,PRUNED
11,1.0,2026-10-08 15:16:44.801369,2026-10-08 15:17:15.480582,0 days 00:00:30.679213,,,,,64,0.05772063306768966,256,128,0.897983462713807,13,SGD,0.006500680205231919,0.7082391522748519,1.12480264296506e-06,3.0,1.0,1.0,COMPLETE
12,1.0,2026-10-08 15:17:15.630417,2026-10-08 15:17:46.165910,0 days 00:00:30.535493,,,,,64,0.057738869287433714,256,128,0.47129274322054915,10,SGD,0.0069527727260754015,0.8226334120666466,2.260939122696824e-05,3.0,1.0,1.0,COMPLETE
13,1.0,2026-10-08 15:17:46.313747,2026-10-08 15:18:16.860153,0 days 00:00:30.546406,,,,,64,0.048338751144136785,512,128,0.5383950547702598,15,SGD,0.008311692998519249,0.8338074034511974,2.7340679272843e-05,2.0,1.0,1.0,COMPLETE
14,0.9983806975807064,2026-10-08 15:18:17.000123,2026-10-08 15:18:21.578604,0 days 00:00:04.578481,,,,,128,0.07542231764611138,256,128,0.7357162912896711,10,SGD,0.0015543415970421359,0.8927392115942876,2.0464153798486234e-05,,,,PRUNED
15,1.0,2026-10-08 15:18:21.719920,2026-10-08 15:18:44.066508,0 days 00:00:22.346588,,,,,128,0.0426031224528568,512,128,0.41373566355554947,12,SGD,0.02866538450261492,0.7692481501878534,1.0048802521731842e-06,1.0,1.0,1.0,COMPLETE
16,1.0,2026-10-08 15:18:44.211476,2026-10-08 15:19:14.876721,0 days 00:00:30.665245,,,,,64,0.06975052483978317,256,128,0.599797007271762,20,SGD,0.0015770063038952262,0.9702268778426302,0.0001353113314143317,2.0,1.0,1.0,COMPLETE
17,1.0,2026-10-08 15:19:15.018641,2026-10-08 15:19:45.486230,0 days 00:00:30.467589,,,,,64,0.0569748595969751,512,64,0.3792831738634399,16,SGD,0.01962116917992928,0.7702215615998731,6.096393461206913e-06,1.0,1.0,1.0,COMPLETE
18,1.0,2026-10-08 15:19:45.629244,2026-10-08 15:20:08.384567,0 days 00:00:22.755323,,,,,128,0.04421081280503257,512,256,0.7773625227496351,7,SGD,0.0019750284592868544,0.8878906339931918,0.00011363827435224601,7.0,1.0,1.0,COMPLETE
19,1.0,2026-10-08 15:20:08.531809,2026-10-08 15:20:27.758806,0 days 00:00:19.226997,,,,,200,0.09962253844052456,256,128,0.885050469406635,12,SGD,0.09725501632936334,0.7696227629333837,3.5898785633183133e-06,1.0,1.0,1.0,COMPLETE
20,1.0,2026-10-08 15:20:27.898407,2026-10-08 15:20:58.662590,0 days 00:00:30.764183,,,,,64,0.08039015812761509,256,128,0.529464932626945,8,SGD,0.014329089650875093,0.9209725080040257,0.006974425952565119,1.0,1.0,1.0,COMPLETE
21,1.0,2026-10-08 15:20:58.806903,2026-10-08 15:21:30.056511,0 days 00:00:31.249608,0.9858531726862527,0.9966783836700993,0.000128776051317125,0.009769656942728053,64,0.03588892695932593,128,64,0.7991962372901166,14,Adam,,,,5.0,1.0,1.0,COMPLETE
22,1.0,2026-10-08 15:21:30.196911,2026-10-08 15:22:01.565851,0 days 00:00:31.368940,0.989917889172276,0.961406526107593,0.00015592909915154122,0.007609571827388239,64,0.0010602731370874773,128,64,0.8148318564734891,16,Adam,,,,3.0,1.0,1.0,COMPLETE
23,1.0,2026-10-08 15:22:01.709469,2026-10-08 15:22:33.136598,0 days 00:00:31.427129,0.9450895617598649,0.9654953516119078,0.0005581364395161335,0.0003873914417855201,64,0.052213498850095526,128,64,0.7081338241112414,9,Adam,,,,1.0,1.0,1.0,COMPLETE
24,1.0,2026-10-08 15:22:33.282983,2026-10-08 15:23:04.892411,0 days 00:00:31.609428,0.9561641336902341,0.9013161786866084,0.00048205638280334514,0.00012113264883906514,64,0.02296603518080169,128,64,0.8412978801704134,12,Adam,,,,2.0,1.0,1.0,COMPLETE
25,1.0,2026-10-08 15:23:05.033147,2026-10-08 15:23:27.860803,0 days 00:00:22.827656,0.8510871962787233,0.9750167539336848,0.001579359289049003,0.0011158833004946606,128,0.06496830621791903,128,64,0.7364614056654826,14,Adam,,,,1.0,1.0,1.0,COMPLETE
26,1.0,2026-10-08 15:23:28.001704,2026-10-08 15:23:59.416811,0 days 00:00:31.415107,0.8877305624105759,0.9025225743564163,0.0002802287426947312,1.961127995666095e-05,64,0.04124169750389836,512,256,0.6059253809608157,20,Adam,,,,1.0,1.0,1.0,COMPLETE
27,1.0,2026-10-08 15:23:59.556631,2026-10-08 15:24:30.517930,0 days 00:00:30.961299,,,,,64,0.0520103824956812,64,512,0.31571428135599877,17,SGD,0.003177006711905028,0.9855988572155746,0.0007335484607354498,2.0,1.0,1.0,COMPLETE
28,1.0,2026-10-08 15:24:30.663163,2026-10-08 15:24:50.111231,0 days 00:00:19.448068,0.9611689288337257,0.949475917503,0.007721995018057831,0.0013671857892267889,200,0.06515516384266572,512,128,0.8599145345397455,5,Adam,,,,1.0,1.0,1.0,COMPLETE
29,0.953062127972518,2026-10-08 15:24:50.251907,2026-10-08 15:24:54.829067,0 days 00:00:04.577160,,,,,128,0.016294255203300738,64,256,0.11295627529595176,18,SGD,0.00038866764924773043,0.7421985470916721,1.0631921076731615e-05,,,,PRUNED
30,0.8066454382710556,2026-10-08 15:24:54.971392,2026-10-08 15:24:58.889063,0 days 00:00:03.917671,,,,,200,0.0367642247660753,128,64,0.7692257635872495,11,SGD,0.0005553602525053792,0.8016797594344486,5.495658412540857e-05,,,,PRUNED
31,1.0,2026-10-08 15:24:59.036899,2026-10-08 15:25:18.292736,0 days 00:00:19.255837,,,,,200,0.011110454005644747,64,256,0.13697201660631045,18,SGD,0.09459526454484286,0.9241563848654223,2.6296383393546625e-06,1.0,1.0,1.0,COMPLETE
32,1.0,2026-10-08 15:25:18.440469,2026-10-08 15:25:37.736472,0 days 00:00:19.296003,,,,,200,0.030844623596032874,64,256,0.19627439829618254,18,SGD,0.04361666609430634,0.8767842204779352,7.907353700148394e-06,1.0,1.0,1.0,COMPLETE
33,1.0,2026-10-08 15:25:37.876011,2026-10-08 15:25:57.063414,0 days 00:00:19.187403,,,,,200,0.02478462535920837,64,256,0.2378795055103487,19,SGD,0.046761882281658576,0.9532749582708,2.15379138926181e-06,2.0,1.0,1.0,COMPLETE
34,1.0,2026-10-08 15:25:57.206686,2026-10-08 15:26:16.558776,0 days 00:00:19.352090,,,,,200,0.0004069232418913091,64,512,0.3297327495381107,17,SGD,0.06484691104519225,0.8628081711693605,9.224922476430067e-06,1.0,1.0,1.0,COMPLETE
35,1.0,2026-10-08 15:26:16.698028,2026-10-08 15:26:39.680732,0 days 00:00:22.982704,0.8987952830152882,0.9823614220397617,0.0017647974238785382,2.2127075293602086e-05,128,0.015763090128970654,128,256,0.16992118969906625,20,Adam,,,,1.0,1.0,1.0,COMPLETE
36,1.0,2026-10-08 15:26:39.824826,2026-10-08 15:26:59.146970,0 days 00:00:19.322144,,,,,200,0.01846565406006473,64,512,0.24202617466530169,16,SGD,0.019911183323715626,0.9173727306226784,5.34288210628721e-06,2.0,1.0,1.0,COMPLETE
37,1.0,2026-10-08 15:26:59.287517,2026-10-08 15:27:22.244207,0 days 00:00:22.956690,0.9161343218814132,0.9158676678192704,0.0002526952424276043,4.960033626323705e-06,128,0.00977305446941995,256,128,0.11184050451402494,19,Adam,,,,2.0,1.0,1.0,COMPLETE
38,1.0,2026-10-08 15:27:22.385505,2026-10-08 15:27:52.811656,0 days 00:00:30.426151,,,,,64,0.029127882487926908,256,64,0.690466060666597,17,SGD,0.004156501096397349,0.9325531197128918,1.8276011030466825e-06,2.0,1.0,1.0,COMPLETE
39,1.0,2026-10-08 15:27:52.953733,2026-10-08 15:28:15.992253,0 days 00:00:23.038520,0.8714596939488823,0.9415848380932806,0.009741006954424015,5.305239654822781e-05,128,0.03547321394780162,512,128,0.6305755571445564,14,Adam,,,,1.0,1.0,1.0,COMPLETE
40,1.0,2026-10-08 15:28:16.132701,2026-10-08 15:28:35.322355,0 days 00:00:19.189654,,,,,200,0.0621897694235007,128,256,0.26369992005109266,6,SGD,0.012320392897935116,0.9899108150152339,1.1590301153287804e-05,3.0,1.0,1.0,COMPLETE
41,1.0,2026-10-08 15:28:35.461571,2026-10-08 15:28:58.246259,0 days 00:00:22.784688,,,,,128,0.04864259826849168,64,512,0.6707618337793745,19,SGD,0.03940088019382188,0.8497991859764288,2.8768716759267707e-06,1.0,1.0,1.0,COMPLETE
42,1.0,2026-10-08 15:28:58.392928,2026-10-08 15:29:21.244541,0 days 00:00:22.851613,,,,,128,0.03053752617325497,64,512,0.8354145369700846,15,SGD,0.06612067255226423,0.8063410562936757,3.891933956162947e-06,1.0,1.0,1.0,COMPLETE
43,1.0,2026-10-08 15:29:21.390165,2026-10-08 15:29:44.319439,0 days 00:00:22.929274,,,,,128,0.006463843718871459,64,512,0.5475922445294001,18,SGD,0.029898596349477412,0.9463159822746094,1.6311597499021766e-06,2.0,1.0,1.0,COMPLETE
44,1.0,2026-10-08 15:29:44.461438,2026-10-08 15:30:07.125828,0 days 00:00:22.664390,,,,,128,0.07642668601970215,64,128,0.881473516485439,20,SGD,0.060531996941319645,0.9034490147680533,1.512275138690136e-05,1.0,1.0,1.0,COMPLETE
45,1.0,2026-10-08 15:30:07.269527,2026-10-08 15:30:38.232970,0 days 00:00:30.963443,,,,,64,0.025558241034439023,256,512,0.20194103568446164,17,SGD,0.09067202308774634,0.7331207509967839,4.879871979333212e-06,1.0,1.0,1.0,COMPLETE
46,1.0,2026-10-08 15:30:38.372323,2026-10-08 15:31:01.193753,0 days 00:00:22.821430,,,,,128,0.019718409041015864,512,128,0.4859081978520516,15,SGD,0.0293589625949398,0.862596195665745,4.363156858073536e-05,1.0,1.0,1.0,COMPLETE
47,0.9967240696737336,2026-10-08 15:31:01.336756,2026-10-08 15:31:07.560425,0 days 00:00:06.223669,,,,,64,0.04045467924082683,256,128,0.7620172324818267,8,SGD,0.000760386233575988,0.7974971577111692,0.000603848225395029,,,,PRUNED
48,0.8367155707069815,2026-10-08 15:31:07.705586,2026-10-08 15:31:12.378447,0 days 00:00:04.672861,,,,,128,0.05153072895915477,512,512,0.37810146642587183,19,SGD,0.00020102822262786974,0.7027399416202574,1.472224016892928e-06,,,,PRUNED
49,1.0,2026-10-08 15:31:12.525905,2026-10-08 15:31:43.835147,0 days 00:00:31.309242,0.9714721061103088,0.9571275926732231,0.00010414112000381409,0.002400497743110368,64,0.046416153723017974,64,128,0.8045649646787965,13,Adam,,,,3.0,1.0,1.0,COMPLETE
