number,value,datetime_start,datetime_complete,duration,params_adam_beta1,params_adam_beta2,params_adam_lr,params_adam_wd,params_batch_size,params_block_0_dropout,params_block_0_filters,params_block_0_kernel,params_block_0_stride,params_block_1_dropout,params_block_1_filters,params_block_1_kernel,params_block_1_stride,params_block_2_dropout,params_block_2_filters,params_block_2_kernel,params_block_2_stride,params_block_3_dropout,params_block_3_filters,params_block_3_kernel,params_block_3_stride,params_fc_hidden,params_first_conv_filters,params_first_conv_kernel_size,params_lr_factor,params_lr_patience,params_n_blocks,params_optimizer,params_sgd_lr,params_sgd_momentum,params_sgd_wd,user_attrs_best_epoch,user_attrs_validation_accuracy,user_attrs_validation_macro_f1,state
59,0.5921662782878649,2026-09-29 18:19:14.779552,2026-09-29 18:21:44.828744,0 days 00:02:30.049192,0.8666741640434711,0.9190216595410237,0.0017350871382071978,4.02284902381226e-05,64.0,0.08148599786958707,16,5,3,0.02144410545773676,32,5,2,0.06876391096271611,64,3,2,,,,,256,256,5,0.3231102451462239,9.0,3,Adam,,,,,,,PRUNED
60,0.31710172493343697,2026-09-29 18:21:44.959743,2026-09-29 18:22:27.048241,0 days 00:00:42.088498,,,,,64.0,0.0891790880484978,32,5,3,0.017567240520935938,32,3,2,0.06206556506169135,64,3,2,,,,,256,256,5,0.25777857680635957,10.0,3,SGD,0.0006145729901490876,0.7717527765444834,0.00038417728054326546,,,,PRUNED
61,0.7718279672357373,2026-09-29 18:22:27.183721,2026-09-29 18:25:54.277589,0 days 00:03:27.093868,0.8525997737856394,0.912490933585387,0.000971080543560307,3.0490228080698098e-05,64.0,0.0914432619516045,32,5,3,0.016479211295415,32,3,2,0.05049112310015855,64,3,2,,,,,256,256,5,0.21042519256215178,8.0,3,Adam,,,,45.0,0.7853107344632768,0.7583452000081978,COMPLETE
62,0.698653410228,2026-09-29 18:25:54.404002,2026-09-29 18:29:23.972485,0 days 00:03:29.568483,0.8534354207297568,0.9124137893831095,0.001486643981792601,2.9375805306877422e-05,64.0,0.09508055263607477,32,5,3,0.015032306143970161,32,3,2,0.0512656452708236,64,3,2,,,,,256,256,5,0.2187964756309722,7.0,3,Adam,,,,50.0,0.7146892655367232,0.6826175549192769,COMPLETE
63,0.7315719735290378,2026-09-29 18:29:24.104091,2026-09-29 18:32:52.635142,0 days 00:03:28.531051,0.8599484500409217,0.9056647176328345,0.0009912531720206014,9.463419492046481e-05,64.0,0.08370749414652331,32,5,3,0.0193935974587562,32,3,2,0.09823768205180837,64,3,2,,,,,256,256,5,0.13297814424584004,8.0,3,Adam,,,,36.0,0.7401129943502824,0.723030952707793,COMPLETE
64,0.780718380668575,2026-09-29 18:32:52.760836,2026-09-29 18:36:18.334026,0 days 00:03:25.573190,0.8582493341518023,0.911187110951295,0.001354255802250529,1.9168837905156026e-05,64.0,0.0794465020076961,32,5,3,0.0102940292363325,32,3,2,0.0581958294545773,64,3,2,,,,,256,256,5,0.3105224558886164,8.0,3,Adam,,,,49.0,0.7796610169491526,0.7817757443879975,COMPLETE
65,0.7271858001078055,2026-09-29 18:36:18.466340,2026-09-29 18:39:49.015749,0 days 00:03:30.549409,0.8743949059658485,0.9107712395221647,0.001338314980017168,1.7358184400465928e-05,64.0,0.09072599315340983,32,5,3,0.01721402646798756,32,3,2,0.058893243331167584,64,3,2,,,,,256,256,5,0.2999006352146294,8.0,3,Adam,,,,49.0,0.7372881355932204,0.7170834646223908,COMPLETE
66,0.6843016748232849,2026-09-29 18:39:49.143714,2026-09-29 18:42:44.254800,0 days 00:02:55.111086,0.8621251715469211,0.9193768651058852,0.0020216309019357114,4.7871124806920884e-05,64.0,0.0796314945128199,32,5,3,0.01260930615610766,32,3,2,0.06537025447420726,32,3,2,,,,,256,256,3,0.2601079175815355,6.0,3,Adam,,,,39.0,0.7005649717514124,0.6680383778951572,COMPLETE
67,0.37092871135894445,2026-09-29 18:42:44.380936,2026-09-29 18:43:30.708707,0 days 00:00:46.327771,0.8583259792327681,0.9040130261657855,0.0024068195985644035,3.45172102742114e-05,64.0,0.08649415841262595,32,5,3,0.021838359566875572,32,3,2,0.050967105521995036,64,3,2,,,,,256,256,5,0.23625319193801086,10.0,3,Adam,,,,,,,PRUNED
68,0.44099233906726987,2026-09-29 18:43:30.843692,2026-09-29 18:44:40.020615,0 days 00:01:09.176923,0.8696258252071011,0.9103035079065851,0.003428183411382622,8.966178476871943e-05,64.0,0.074274215370364,32,7,3,0.02913157892809929,32,3,1,0.04684787103565662,64,3,2,,,,,256,256,7,0.2028406748229877,10.0,3,Adam,,,,,,,PRUNED
69,0.7579173166302147,2026-09-29 18:44:40.150333,2026-09-29 18:48:11.392085,0 days 00:03:31.241752,0.8816700106020585,0.9212535521186357,0.0009985079788078187,1.4236938268302397e-05,64.0,0.08539735802175587,32,5,3,0.012379779221232724,32,3,2,0.07303210629959671,128,3,2,,,,,256,256,5,0.3508098883791773,6.0,3,Adam,,,,41.0,0.7768361581920904,0.7389984750683388,COMPLETE
70,0.47958208793594936,2026-09-29 18:48:11.530839,2026-09-29 18:48:54.865012,0 days 00:00:43.334173,0.8822316782795604,0.9218990296542431,0.001405873876931647,2.5805763351069974e-05,128.0,0.07921725966134152,32,5,3,0.01567300926340452,32,3,2,0.07856140839882104,128,3,2,,,,,128,256,5,0.35965046885691865,6.0,3,Adam,,,,,,,PRUNED
71,0.7513269338525109,2026-09-29 18:48:54.989854,2026-09-29 18:52:23.888819,0 days 00:03:28.898965,0.8727126486379406,0.9158338593157244,0.0009906553890311229,1.0752637931900599e-05,64.0,0.08455877709835408,32,5,3,0.011784088513879068,32,3,2,0.08253553988610957,128,3,2,,,,,256,256,5,0.3135627001546623,7.0,3,Adam,,,,50.0,0.7740112994350282,0.7286425682699936,COMPLETE
72,0.7322840838679101,2026-09-29 18:52:24.014709,2026-09-29 18:55:53.783456,0 days 00:03:29.768747,0.8736183742436344,0.9180881563468801,0.0009200862913028768,1.9506640218932067e-05,64.0,0.08933842924601929,32,5,3,0.02014359985567893,32,3,2,0.08519920373622095,128,3,2,,,,,256,256,5,0.33262151311398075,7.0,3,Adam,,,,49.0,0.748587570621469,0.7159805971143511,COMPLETE
73,0.762579174984943,2026-09-29 18:55:53.920231,2026-09-29 18:59:20.252028,0 days 00:03:26.331797,0.8889287098536226,0.9148594611505771,0.0010282437474252648,1.2077592378661508e-05,64.0,0.09470837408603362,32,5,3,0.013114558979894128,32,3,2,0.08558529699808531,128,3,2,,,,,256,256,5,0.30754569337283566,6.0,3,Adam,,,,46.0,0.7655367231638418,0.7596216268060442,COMPLETE
74,0.7151122078101034,2026-09-29 18:59:20.377293,2026-09-29 19:02:41.903578,0 days 00:03:21.526285,0.8927640169254945,0.9144432030875097,0.0009930330000759067,1.0818339495488002e-05,64.0,0.09630480684434824,32,5,3,0.013244519423492591,32,3,2,0.07423341496680971,128,3,2,,,,,256,256,5,0.2951157536171954,6.0,3,Adam,,,,40.0,0.7231638418079096,0.7070605738122973,COMPLETE
75,0.7431315219656772,2026-09-29 19:02:42.033674,2026-09-29 19:05:56.664287,0 days 00:03:14.630613,0.8892800521098618,0.9124634725043284,0.0007677121041339944,9.700777802905808e-06,64.0,0.09365790422987298,32,5,3,0.010569319458524214,32,3,2,0.08954837122723122,128,3,2,,,,,256,256,5,0.35806650400812035,6.0,3,Adam,,,,47.0,0.7542372881355932,0.7320257557957612,COMPLETE
76,0.3403918222059144,2026-09-29 19:05:56.785536,2026-09-29 19:06:28.578716,0 days 00:00:31.793180,,,,,64.0,0.08368515190174598,8,5,3,0.017448462379211584,32,3,2,0.0853961635767056,128,3,2,,,,,256,256,3,0.38915348369080194,5.0,3,SGD,0.00046524604387484435,0.9073507574975153,0.00013275050426700419,,,,PRUNED
77,0.6640214624480265,2026-09-29 19:06:28.705086,2026-09-29 19:09:34.579679,0 days 00:03:05.874593,0.8652827676596987,0.9001559320752469,0.0010829736036640234,8.539874864037437e-06,64.0,0.07318215853282475,16,5,3,0.01300001745608094,32,5,2,0.07678422057556104,128,3,2,,,,,256,256,5,0.30371121548650465,7.0,3,Adam,,,,,,,PRUNED
78,0.7207985469183773,2026-09-29 19:09:34.702835,2026-09-29 19:12:58.829112,0 days 00:03:24.126277,0.8580790613387761,0.9166323884479639,0.001331759491300827,1.8672693995537443e-05,64.0,0.08748912129306446,32,5,3,0.025238717726075353,16,3,2,0.08197394865480738,128,3,2,,,,,256,256,5,0.3756949935446668,8.0,3,Adam,,,,48.0,0.7429378531073446,0.69865924072941,COMPLETE
79,0.3941140628519445,2026-09-29 19:12:58.954294,2026-09-29 19:14:37.276089,0 days 00:01:38.321795,0.879060780457947,0.9067585426118608,0.0087093316214453,4.603338187722611e-06,64.0,0.07986913917695614,32,7,3,0.015850582620079424,32,3,2,0.09514076109989159,128,3,2,,,,,128,512,5,0.3144570686701122,7.0,3,Adam,,,,,,,PRUNED
80,0.774083022402841,2026-09-29 19:14:37.400025,2026-09-29 19:17:59.072454,0 days 00:03:21.672429,0.885942797744778,0.923522904056912,0.0005384679148627864,2.781217994626386e-05,64.0,0.09308853303654373,32,5,3,0.010143533592221086,32,3,2,0.09044128898439695,128,3,2,,,,,256,256,5,0.34113640800766737,8.0,3,Adam,,,,45.0,0.7824858757062146,0.7656801690994673,COMPLETE
81,0.7517563674503984,2026-09-29 19:17:59.207598,2026-09-29 19:21:20.834674,0 days 00:03:21.627076,0.8856062524152252,0.9236165855665367,0.000902737482393936,1.4092588975759856e-05,64.0,0.09297839209132765,32,5,3,0.012724907445364982,32,3,2,0.0927082276677862,128,3,2,,,,,256,256,5,0.3424117199310789,8.0,3,Adam,,,,45.0,0.7542372881355932,0.7492754467652036,COMPLETE
82,0.7465400114764298,2026-09-29 19:21:20.959987,2026-09-29 19:24:39.106518,0 days 00:03:18.146531,0.886944332624551,0.9279151114973003,0.0005197541610906391,2.7572564273148816e-05,64.0,0.08518239434317838,32,5,3,0.010062209608475873,32,3,2,0.09184115401721257,128,3,2,,,,,256,256,5,0.27437002758116047,7.0,3,Adam,,,,46.0,0.7570621468926554,0.7360178760602042,COMPLETE
83,0.7647256248391382,2026-09-29 19:24:39.237709,2026-09-29 19:27:57.568502,0 days 00:03:18.330793,0.8508486987198911,0.9244388395062665,0.0008826135437893393,6.353775642475732e-05,64.0,0.09336983636060847,32,5,3,0.013268292160880884,32,3,2,0.08752465785728358,128,3,2,,,,,256,256,5,0.3531274571931959,8.0,3,Adam,,,,43.0,0.7796610169491526,0.7497902327291238,COMPLETE
84,0.7485976278976976,2026-09-29 19:27:57.692250,2026-09-29 19:31:20.123134,0 days 00:03:22.430884,0.8506868252256506,0.9246377748958597,0.0004315033837600134,6.583126298579547e-05,64.0,0.09292243937357227,32,5,3,0.018988362119565252,32,3,2,0.08859936820318672,128,3,2,,,,,256,256,5,0.341727350877964,8.0,3,Adam,,,,38.0,0.7655367231638418,0.7316585326315534,COMPLETE
85,0.7692436543789278,2026-09-29 19:31:20.247747,2026-09-29 19:36:16.774878,0 days 00:04:56.527131,0.8547909999140059,0.9228577648955297,0.0006024768098808561,0.00029358011956974505,64.0,0.0969597969674786,32,5,3,0.013577587831735767,32,3,2,0.09920288642461418,128,3,2,,,,,256,256,7,0.3462123596167115,8.0,3,Adam,,,,45.0,0.788135593220339,0.7503517155375166,COMPLETE
86,0.4341132483781589,2026-09-29 19:36:16.900438,2026-09-29 19:37:15.642813,0 days 00:00:58.742375,0.8559834636638922,0.9338491529507659,0.0005758098620548109,0.0008159900200927568,64.0,0.09732037538440787,32,5,3,0.02300417045307976,32,3,1,0.09869889954135173,128,3,2,,,,,256,256,7,0.4166739646880491,5.0,3,Adam,,,,,,,PRUNED
87,0.7693355391493104,2026-09-29 19:37:15.766149,2026-09-29 19:42:33.556688,0 days 00:05:17.790539,0.8640900320525974,0.9226858053722897,0.0008908078525875954,0.00027873789042362945,128.0,0.09772244921477438,32,5,3,0.013322463476043838,32,3,2,0.09560613055562342,128,3,2,,,,,256,256,7,0.3693533191569012,10.0,3,Adam,,,,46.0,0.7909604519774012,0.7477106263212198,COMPLETE
88,0.47454367034647993,2026-09-29 19:42:33.687951,2026-09-29 19:43:36.296671,0 days 00:01:02.608720,,,,,128.0,0.09826381775408145,8,5,3,0.01464488735565064,32,3,2,0.09532866174600306,128,3,2,,,,,256,256,7,0.3705688490557131,10.0,3,SGD,0.013222258823105272,0.8481847908843528,5.034008698792136e-06,,,,PRUNED
89,0.7113052801225126,2026-09-29 19:43:36.420536,2026-09-29 19:48:51.427679,0 days 00:05:15.007143,0.8628831353888643,0.9290771649423173,0.0007488005066220124,0.00022873718961410801,128.0,0.09970640449204526,32,5,3,0.01876885958429321,16,5,2,0.0908244641580988,128,3,2,,,,,256,256,7,0.3917133156618703,6.0,3,Adam,,,,36.0,0.7203389830508474,0.7022715771941778,COMPLETE
90,0.40148391998422284,2026-09-29 19:48:51.549609,2026-09-29 19:49:54.938921,0 days 00:01:03.389312,0.8664765536869532,0.984851195926482,0.0011292448419055216,0.00042056610591031924,128.0,0.09603790266912689,32,5,3,0.01697956928270574,32,3,2,0.08681099429908984,128,3,2,,,,,128,256,7,0.3320841400724125,12.0,3,Adam,,,,,,,PRUNED
91,0.7445356197649389,2026-09-29 19:49:55.063100,2026-09-29 19:55:11.412101,0 days 00:05:16.349001,0.850196199637813,0.9230716159614155,0.0008639125775928374,0.0002583362141267322,128.0,0.09315338632992755,32,5,3,0.013369617980793879,32,3,2,0.09352823671694459,128,3,2,,,,,256,256,7,0.34813287515774344,9.0,3,Adam,,,,43.0,0.7542372881355932,0.7348339513942844,COMPLETE
92,0.7561480226768784,2026-09-29 19:55:11.536184,2026-09-29 20:00:34.159651,0 days 00:05:22.623467,0.8543543372544455,0.9262124796571304,0.0005870097593027909,0.0018015797022039985,128.0,0.08808959998289573,32,5,3,0.013082795874482946,32,3,2,0.0965698360481163,128,3,2,,,,,256,256,7,0.374573859849552,8.0,3,Adam,,,,48.0,0.7627118644067796,0.7495841809469772,COMPLETE
93,0.7586951344648086,2026-09-29 20:00:34.298255,2026-09-29 20:06:04.445595,0 days 00:05:30.147340,0.8532726935339627,0.9282495905752194,0.0005536999143994446,0.001526434764432999,128.0,0.08952824857225589,32,5,3,0.014569779187462141,32,3,2,0.09774204010932479,128,3,2,,,,,256,256,7,0.3683795491008218,9.0,3,Adam,,,,47.0,0.7655367231638418,0.7518535457657755,COMPLETE
94,0.7625710894086888,2026-09-29 20:06:04.569324,2026-09-29 20:11:36.945433,0 days 00:05:32.376109,0.8553544175140341,0.9277642225750661,0.0005488385573797311,0.0018840527654716036,128.0,0.0880086525226322,32,5,3,0.014791045996560824,32,3,2,0.09711057092133477,128,3,2,,,,,256,256,7,0.367587946805487,9.0,3,Adam,,,,42.0,0.7711864406779662,0.7539557381394115,COMPLETE
95,0.755814550359856,2026-09-29 20:11:37.076481,2026-09-29 20:17:05.807623,0 days 00:05:28.731142,0.856534693934809,0.9325015693047761,0.0004500010795798458,0.0013650909062227054,128.0,0.09691286086579447,32,5,3,0.015298830141728519,32,3,2,0.09976916155797652,128,3,2,,,,,256,256,7,0.4262167743571055,9.0,3,Adam,,,,45.0,0.7796610169491526,0.7319680837705594,COMPLETE
96,0.5991152172235095,2026-09-29 20:17:05.943311,2026-09-29 20:20:14.315386,0 days 00:03:08.372075,0.8610726058704421,0.9278364136206109,0.0005418626042078238,0.0029143459988353907,128.0,0.090124340610322,16,5,3,0.01999092982059123,32,3,2,0.09625724202417496,128,3,2,,,,,256,256,7,0.39703257069224474,10.0,3,Adam,,,,,,,PRUNED
97,0.4468469917759988,2026-09-29 20:20:14.443775,2026-09-29 20:21:52.520476,0 days 00:01:38.076701,0.8505702935285023,0.9353627166696814,0.0006881712853918192,0.007734280132732847,128.0,0.0945548631640236,32,7,3,0.023615733342390716,32,3,2,0.09053239475488443,128,3,2,,,,,256,256,7,0.28042876783308357,11.0,3,Adam,,,,,,,PRUNED
98,0.3841439686322887,2026-09-29 20:21:52.648991,2026-09-29 20:23:04.196990,0 days 00:01:11.547999,0.8549299318333524,0.9224154036975207,0.0003889410729869033,0.0011587530920462454,128.0,0.0916090644495589,32,5,3,0.025944967822966895,32,3,1,0.09737570717394407,128,3,2,,,,,256,256,7,0.31488509775281087,9.0,3,Adam,,,,,,,PRUNED
99,0.34350684630343925,2026-09-29 20:23:04.323895,2026-09-29 20:24:07.751991,0 days 00:01:03.428096,0.8633615033628099,0.941150289297523,0.006206094400795031,0.003500878628647473,128.0,0.08763161166678472,32,5,3,0.01771181805542396,32,3,2,0.09364145019917747,128,3,2,,,,,256,256,7,0.3606258672135069,10.0,3,Adam,,,,,,,PRUNED
