number,value,datetime_start,datetime_complete,duration,params_adam_beta1,params_adam_beta2,params_adam_lr,params_adam_wd,params_batch_size,params_block_0_dropout,params_block_0_filters,params_block_0_kernel,params_block_0_stride,params_block_1_dropout,params_block_1_filters,params_block_1_kernel,params_block_1_stride,params_block_2_dropout,params_block_2_filters,params_block_2_kernel,params_block_2_stride,params_block_3_dropout,params_block_3_filters,params_block_3_kernel,params_block_3_stride,params_fc_hidden,params_first_conv_filters,params_first_conv_kernel_size,params_lr_factor,params_lr_patience,params_n_blocks,params_optimizer,params_sgd_lr,params_sgd_momentum,params_sgd_wd,user_attrs_best_epoch,user_attrs_validation_accuracy,user_attrs_validation_macro_f1,state
0,0.45424665110871904,2026-09-29 15:21:34.407649,2026-09-29 15:26:51.096836,0 days 00:05:16.689187,0.8926459276842719,0.9097574441892378,0.00853618986286683,0.0017123375973163992,128.0,0.08491983767203796,8,5,3,0.06506676052501416,16,3,2,0.06331731119758383,128,3,1,,,,,256,256,7,0.5105398159072941,12.0,3,Adam,,,,49.0,0.5141242937853108,0.3943690084321273,COMPLETE
1,0.6032228866082024,2026-09-29 15:26:51.218399,2026-09-29 15:32:42.749242,0 days 00:05:51.530843,,,,,128.0,0.06381099809299767,16,7,3,0.08458637582367365,16,3,2,0.07950202923669918,128,3,1,0.07361716094628554,256.0,3.0,1.0,256,256,7,0.13813501017161417,9.0,4,SGD,0.038842777547031436,0.8807564567799918,2.106648601704221e-05,49.0,0.6412429378531074,0.5652028353632975,COMPLETE
2,0.6166911871759169,2026-09-29 15:32:42.888776,2026-09-29 15:35:52.661758,0 days 00:03:09.772982,0.970502281655888,0.9006945178400659,0.0007148510793512986,0.0018709365688887364,64.0,0.019710228429397403,8,7,3,0.07799960246887438,32,3,1,0.0884314531168946,128,3,2,0.05854080177240857,256.0,3.0,1.0,256,256,3,0.4064483815465394,11.0,4,Adam,,,,48.0,0.6412429378531074,0.5921394364987264,COMPLETE
3,,2026-09-29 15:35:52.802845,2026-09-29 15:35:52.854974,0 days 00:00:00.052129,,,,,,0.013319825261907952,8,7,3,0.05405074842498068,16,3,2,0.06690752475342215,32,5,2,0.08517722460303143,64.0,3.0,1.0,,256,5,,,4,,,,,,,,PRUNED
4,0.5561337398060118,2026-09-29 15:35:52.993638,2026-09-29 15:38:24.570066,0 days 00:02:31.576428,0.8642060160012445,0.9662838267338948,0.0016325185294676916,1.088399181393814e-06,128.0,0.09430569898630611,16,7,3,0.08354999801810943,32,5,1,0.04051268119438307,32,3,2,0.08983777818386056,256.0,3.0,1.0,128,128,5,0.10303695030773122,7.0,4,Adam,,,,44.0,0.5847457627118644,0.527521716900159,COMPLETE
5,,2026-09-29 15:38:24.698269,2026-09-29 15:38:24.746940,0 days 00:00:00.048671,,,,,,0.03386821309135529,8,5,3,0.06192134961637233,32,5,2,0.09464127259176229,128,5,2,0.011391095487598068,64.0,3.0,1.0,,512,3,,,4,,,,,,,,PRUNED
6,0.48782028865354476,2026-09-29 15:38:24.867139,2026-09-29 15:53:37.138370,0 days 00:15:12.271231,0.897319321959215,0.9375207369687304,0.0039046790191830895,0.0036309591863459105,128.0,0.07264268170074757,8,5,3,0.0766691755978784,64,5,1,0.09219164973008243,64,3,1,,,,,512,512,7,0.1563891639045214,14.0,3,Adam,,,,42.0,0.5141242937853108,0.4615162835217787,COMPLETE
7,0.6633062291702649,2026-09-29 15:53:37.268007,2026-09-29 15:59:18.561561,0 days 00:05:41.293554,0.8891907455724319,0.9953910415382531,0.0026865309327169084,0.00043731009905162676,64.0,0.01768127184943912,32,5,3,0.03906608256471214,64,3,2,0.07263767854843282,32,5,2,,,,,128,512,3,0.5427381500174611,13.0,3,Adam,,,,47.0,0.692090395480226,0.6345220628603039,COMPLETE
8,0.5768884166314614,2026-09-29 15:59:18.682603,2026-09-29 16:06:58.879125,0 days 00:07:40.196522,,,,,64.0,0.05261245937025092,8,5,3,0.06632739241428127,32,3,1,0.0627198023146117,64,5,2,,,,,128,512,5,0.6767143382943485,19.0,3,SGD,0.004333615420461955,0.9730247945451923,3.502761367842316e-05,42.0,0.5988700564971752,0.5549067767657475,COMPLETE
9,0.5907465795777966,2026-09-29 16:06:59.001065,2026-09-29 16:09:50.449121,0 days 00:02:51.448056,,,,,128.0,0.06660485621018956,16,5,3,0.0991454627800606,16,5,1,0.07757839610123476,128,3,2,0.05547271352030715,256.0,3.0,1.0,512,128,7,0.6700371802304829,20.0,4,SGD,0.0520170752104338,0.7264731362679787,1.8934530915191556e-05,49.0,0.6101694915254238,0.5713236676301695,COMPLETE
10,0.6696101649521373,2026-09-29 16:09:50.582855,2026-09-29 16:15:31.617740,0 days 00:05:41.034885,0.9740823912733333,0.9925265187462552,0.00011276182231780688,1.0341591364653288e-05,64.0,0.04094807897017133,32,5,3,0.020186058701089256,64,3,2,0.02058969429153098,32,5,1,,,,,128,512,3,0.31969431875426024,5.0,3,Adam,,,,48.0,0.6892655367231638,0.6499547931811109,COMPLETE
11,0.6430428441403986,2026-09-29 16:15:31.743250,2026-09-29 16:21:11.979195,0 days 00:05:40.235945,0.9802081999542284,0.9977378168152762,0.00010183198380260875,2.1744245799734513e-05,64.0,0.03771614503357396,32,5,3,0.025248848622237034,64,3,2,0.011182628414602769,32,5,1,,,,,128,512,3,0.33998841963022897,6.0,3,Adam,,,,43.0,0.6610169491525424,0.6250687391282549,COMPLETE
12,0.6843520076566373,2026-09-29 16:21:12.102593,2026-09-29 16:26:52.269509,0 days 00:05:40.166916,0.9352541592559447,0.9970073863865141,0.00010625721497327485,6.882249550497785e-05,64.0,0.031964695772083725,32,5,3,0.017911209939171592,64,3,2,0.012469610360710495,32,5,1,,,,,128,512,3,0.288047789641548,16.0,3,Adam,,,,47.0,0.7090395480225988,0.6596644672906757,COMPLETE
13,0.6691217466112036,2026-09-29 16:26:52.392011,2026-09-29 16:32:30.411840,0 days 00:05:38.019829,0.9418630101329559,0.9754394022248283,0.00011510417099496487,3.719907394332208e-05,64.0,0.04084398052182567,32,5,3,0.01041205792182287,64,3,2,0.011103032601416561,32,5,1,,,,,128,512,3,0.2754833581816809,17.0,3,Adam,,,,49.0,0.6864406779661016,0.6518028152563057,COMPLETE
14,0.712079101456403,2026-09-29 16:32:30.538809,2026-09-29 16:38:07.989536,0 days 00:05:37.450727,0.9391551343936658,0.9763505034389456,0.0002693445665578602,2.2921719778299334e-05,64.0,0.05183890112758876,32,5,3,0.011057302587529717,64,3,2,0.028260254370252803,32,5,1,,,,,128,512,3,0.24666358315073578,16.0,3,Adam,,,,45.0,0.7231638418079096,0.7009943611048962,COMPLETE
15,0.7017025051368599,2026-09-29 16:38:08.119642,2026-09-29 16:43:46.997333,0 days 00:05:38.877691,0.9334149850657532,0.9657928592954949,0.0003301193877092133,0.00018355423125793842,64.0,0.05242544246089793,32,5,3,0.03481227473949124,64,3,2,0.03474122170200355,32,5,1,,,,,128,512,3,0.21688328456368888,16.0,3,Adam,,,,41.0,0.7203389830508474,0.6830660272228724,COMPLETE
16,0.07589923856484528,2026-09-29 16:43:47.131079,2026-09-29 16:44:22.293334,0 days 00:00:35.162255,,,,,64.0,0.05353708710577318,32,5,3,0.034589201184554386,64,3,2,0.03751016943802629,32,5,1,,,,,128,128,3,0.2266950729776337,16.0,3,SGD,0.00011877964997161456,0.7040126788907952,0.002144225215662579,,,,PRUNED
17,0.7176546774891022,2026-09-29 16:44:22.417351,2026-09-29 16:50:03.587081,0 days 00:05:41.169730,0.9332091604230679,0.9599640923586635,0.00033165581530399986,0.00020685728914116887,64.0,0.05108004069531923,32,5,3,0.04117763112961256,64,3,2,0.03786395894931677,64,5,1,,,,,512,512,3,0.2064540660021534,18.0,3,Adam,,,,50.0,0.7259887005649718,0.7093206544132327,COMPLETE
18,,2026-09-29 16:50:03.717294,2026-09-29 16:50:03.765455,0 days 00:00:00.048161,,,,,,0.07721350923345933,32,7,3,0.045232344979465156,64,5,2,0.05266032504476937,64,5,1,,,,,,512,3,,,3,,,,,,,,PRUNED
19,0.7379902751190799,2026-09-29 16:50:03.889494,2026-09-29 16:53:11.247263,0 days 00:03:07.357769,0.9183998142707185,0.9446067667195267,0.00038226293595699015,6.2360399203972475e-06,64.0,0.05918429340771437,32,5,3,0.010120838206121292,64,3,2,0.026435745310868057,64,5,1,,,,,512,128,5,0.40938913659251763,18.0,3,Adam,,,,41.0,0.7372881355932204,0.7386924146449395,COMPLETE
20,0.721333185998879,2026-09-29 16:53:11.371647,2026-09-29 16:56:19.208058,0 days 00:03:07.836411,0.910126853584041,0.9392785953208942,0.0005275781068444595,3.4056898412916412e-06,64.0,0.0625603759745467,32,5,3,0.04949276949415996,64,3,2,0.04938907126363506,64,5,1,,,,,512,128,5,0.42735667738950706,18.0,3,Adam,,,,49.0,0.731638418079096,0.7110279539186619,COMPLETE
21,0.6665768047170348,2026-09-29 16:56:19.328655,2026-09-29 16:59:27.152776,0 days 00:03:07.824121,0.9127486103095869,0.9434140249657167,0.0005128273648275461,2.170849803152002e-06,64.0,0.061916562770308006,32,5,3,0.05101223801518583,64,3,2,0.04805235718354789,64,5,1,,,,,512,128,5,0.43773942682689143,18.0,3,Adam,,,,30.0,0.6807909604519774,0.6523626489820923,COMPLETE
22,0.6874539544677896,2026-09-29 16:59:27.276303,2026-09-29 17:02:35.064479,0 days 00:03:07.788176,0.9182251812532902,0.94369564931489,0.0008227775607541779,4.247712846027521e-06,64.0,0.05888078459165429,32,5,3,0.027678939342646692,64,3,2,0.05112710762170068,64,5,1,,,,,512,128,5,0.3964491884177376,20.0,3,Adam,,,,45.0,0.7005649717514124,0.6743429371841668,COMPLETE
23,0.7272149142527162,2026-09-29 17:02:35.195830,2026-09-29 17:05:43.140031,0 days 00:03:07.944201,0.9144525668053402,0.9285750169494545,0.0002976652558653382,6.645706433583015e-06,64.0,0.07588811411469223,32,5,3,0.04395520066825104,64,3,2,0.027229653218647606,64,5,1,,,,,512,128,5,0.5151580640258544,19.0,3,Adam,,,,49.0,0.7288135593220338,0.7256162691833987,COMPLETE
24,0.698857871792073,2026-09-29 17:05:43.262170,2026-09-29 17:08:51.145391,0 days 00:03:07.883221,0.9108041372689133,0.9262305123396842,0.00022510163452456376,7.730693408330904e-06,64.0,0.08200828343237973,32,5,3,0.05411545416283805,64,3,2,0.024336037514065,64,5,1,,,,,512,128,5,0.5163282480536622,18.0,3,Adam,,,,44.0,0.692090395480226,0.70562534810392,COMPLETE
25,0.23636654591446016,2026-09-29 17:08:51.267298,2026-09-29 17:09:27.947592,0 days 00:00:36.680294,,,,,64.0,0.09838853000637966,16,5,3,0.04798329564274127,64,3,2,0.020587996597187276,64,5,1,,,,,512,128,5,0.5949976253383951,14.0,3,SGD,0.00010594134428257736,0.8319921111667751,0.0072142505027882504,,,,PRUNED
26,0.4744496843414282,2026-09-29 17:09:28.071757,2026-09-29 17:10:18.424487,0 days 00:00:50.352730,0.8704106195977882,0.92493241317718,0.001020474024823306,4.212945180057304e-06,64.0,0.07155179275194587,32,7,3,0.059845131279421086,64,5,1,0.031513266706577586,64,5,1,,,,,512,128,5,0.4664922604747665,20.0,3,Adam,,,,,,,PRUNED
27,0.47606756612364753,2026-09-29 17:10:18.556132,2026-09-29 17:11:03.614567,0 days 00:00:45.058435,0.9538849001927252,0.9311586181937426,0.0004795941642632098,1.2464135934738337e-06,64.0,0.08786506620307331,32,5,3,0.030635683437463736,64,3,2,0.04689011975900758,64,5,1,,,,,512,128,5,0.579550038734195,18.0,3,Adam,,,,,,,PRUNED
28,0.6415972958608621,2026-09-29 17:11:03.739154,2026-09-29 17:14:07.261768,0 days 00:03:03.522614,0.9186994748151904,0.9537245557968208,0.00019331325070553264,9.303134749928022e-06,64.0,0.07117494038732602,32,5,3,0.06990906473199449,32,3,2,0.05904975776873155,64,5,1,,,,,512,128,5,0.380092636852218,15.0,3,Adam,,,,49.0,0.6638418079096046,0.6193527838121197,COMPLETE
29,0.3388720986408958,2026-09-29 17:14:07.382269,2026-09-29 17:14:35.353264,0 days 00:00:27.970995,,,,,128.0,0.08703183626117479,16,5,3,0.019544233700994784,16,3,2,0.04303391135065424,64,3,1,,,,,512,128,5,0.4483776064130662,19.0,3,SGD,0.001526864498377944,0.976516857731363,1.2489433448065917e-06,,,,PRUNED
30,0.4382245882238434,2026-09-29 17:14:35.473552,2026-09-29 17:15:19.309464,0 days 00:00:43.835912,0.8798482741985723,0.9170410312010022,0.0004485955678723107,3.580353519899774e-06,64.0,0.07758078214599416,32,5,3,0.043230217612606085,16,3,2,0.05689337587790386,64,5,1,,,,,512,128,5,0.4842559164528533,17.0,3,Adam,,,,,,,PRUNED
31,0.7106307636579777,2026-09-29 17:15:19.438881,2026-09-29 17:18:27.184401,0 days 00:03:07.745520,0.9246666730047096,0.9517053069477454,0.0003675793086460072,0.00014376660869988038,64.0,0.04523013662027072,32,5,3,0.040886370498700114,64,3,2,0.028390931107090723,64,5,1,,,,,512,128,5,0.5658987513921526,19.0,3,Adam,,,,40.0,0.7288135593220338,0.6924479679939216,COMPLETE
32,0.7170102271875115,2026-09-29 17:18:27.306827,2026-09-29 17:23:35.050134,0 days 00:05:07.743307,0.9009619712721636,0.9565367945545667,0.00018709448131181767,0.0005032474071216302,64.0,0.06641630839567628,32,5,3,0.05615971650705597,64,3,2,0.019806575300039677,64,5,1,,,,,512,256,7,0.3542793612209649,18.0,3,Adam,,,,40.0,0.7203389830508474,0.7136814713241756,COMPLETE
33,0.4995612621407487,2026-09-29 17:23:35.170691,2026-09-29 17:25:26.338276,0 days 00:01:51.167585,0.951348691970652,0.9375416002600357,0.0005807275899340891,0.008013561719261476,64.0,0.0586119434012577,32,5,3,0.03559600117437286,64,3,2,0.036482659906639694,64,5,1,,,,,256,256,5,0.6275624150891445,17.0,3,Adam,,,,,,,PRUNED
34,0.6720458671481917,2026-09-29 17:25:26.461590,2026-09-29 17:29:08.201206,0 days 00:03:41.739616,0.9231994656927047,0.9455306427652163,0.0011699410747325893,1.6198093376627593e-05,64.0,0.058404368194157036,32,7,3,0.047048929336536725,64,3,2,0.041489550715464375,64,3,1,,,,,512,128,7,0.5130755237005266,19.0,3,Adam,,,,49.0,0.6694915254237288,0.6746002088726547,COMPLETE
35,0.42464774369421443,2026-09-29 17:29:08.321413,2026-09-29 17:30:04.959491,0 days 00:00:56.638078,0.907179582472022,0.9612247542646271,0.0002705119916199924,5.54986161562425e-05,128.0,0.06446488476887645,16,7,3,0.09406951179528734,16,3,2,0.03198651757497145,128,5,1,,,,,512,256,5,0.44310127005585187,17.0,3,Adam,,,,,,,PRUNED
36,0.39970038414182785,2026-09-29 17:30:05.080809,2026-09-29 17:30:50.971963,0 days 00:00:45.891154,0.95696547720658,0.9330972877467962,0.00015938989664913736,2.1703950264241945e-06,64.0,0.048470061711334445,8,5,3,0.07120500043022061,32,3,1,0.02543614431633217,64,3,1,0.011344676611381124,128.0,3.0,1.0,256,128,5,0.41009514949107256,15.0,4,Adam,,,,,,,PRUNED
37,,2026-09-29 17:30:51.101618,2026-09-29 17:30:51.162750,0 days 00:00:00.061132,,,,,,0.07674218952925534,32,5,3,0.059049019775325694,64,5,2,0.015988446393141797,64,5,2,0.03459882989744971,128.0,3.0,1.0,,128,5,,,4,,,,,,,,PRUNED
38,0.5268305877165809,2026-09-29 17:30:51.287754,2026-09-29 17:34:09.356467,0 days 00:03:18.068713,0.927960078129904,0.9151072365607757,0.00033736188272776556,6.494852133845143e-06,128.0,0.03075811395659847,8,7,3,0.05084464405618355,64,3,1,0.045267848566365565,128,5,1,,,,,512,256,7,0.6212423894814151,11.0,3,Adam,,,,,,,PRUNED
39,0.7298167576666035,2026-09-29 17:34:09.478989,2026-09-29 17:37:13.496960,0 days 00:03:04.017971,0.9053785412713041,0.9481747452209189,0.0007295801226505324,1.933741253843027e-06,64.0,0.09209710943648018,32,5,3,0.02579698237417455,32,3,2,0.038831482765739875,64,3,2,,,,,256,128,5,0.18312805946006136,20.0,3,Adam,,,,50.0,0.7542372881355932,0.7053962271976139,COMPLETE
40,0.44387729626551475,2026-09-29 17:37:13.625779,2026-09-29 17:37:53.735282,0 days 00:00:40.109503,,,,,64.0,0.09185141829177307,8,5,3,0.01301582969663227,32,5,2,0.06529289945074354,64,3,2,,,,,256,128,5,0.1363652034690889,20.0,3,SGD,0.002295562494336947,0.8049968846034791,0.0005176584427167771,,,,PRUNED
41,0.7170585370135332,2026-09-29 17:37:53.859007,2026-09-29 17:40:58.366159,0 days 00:03:04.507152,0.9049163993393662,0.946613080841321,0.0006606451955929177,2.020372891941284e-06,64.0,0.06829067756418646,32,5,3,0.024123319713329223,32,3,2,0.036545375533846666,64,3,2,,,,,256,128,5,0.18365181404213377,19.0,3,Adam,,,,40.0,0.7146892655367232,0.719427808490343,COMPLETE
42,0.7140117652048001,2026-09-29 17:40:58.487201,2026-09-29 17:44:02.448358,0 days 00:03:03.961157,0.8907022324083598,0.9364614426768694,0.00039154433826865627,3.493723520606842e-06,64.0,0.08319140081192407,32,5,3,0.037426274069826126,32,3,2,0.03993802058745288,64,3,2,,,,,256,128,5,0.28761270141571305,18.0,3,Adam,,,,49.0,0.7372881355932204,0.6907353948163799,COMPLETE
43,0.7183544448048844,2026-09-29 17:44:02.572141,2026-09-29 17:47:06.653009,0 days 00:03:04.080868,0.9146020072162582,0.9254382220547323,0.0012134958704220233,1.6832122906842734e-06,64.0,0.09905040080727802,32,5,3,0.016236853884646824,32,3,2,0.0543470367810738,64,3,2,,,,,256,128,5,0.10429696777240621,20.0,3,Adam,,,,50.0,0.748587570621469,0.6881213189882999,COMPLETE
44,0.7129575534289484,2026-09-29 17:47:06.774471,2026-09-29 17:49:29.056575,0 days 00:02:22.282104,0.9151429398600589,0.9226895395770883,0.0016216460186955321,1.7184834792807082e-06,128.0,0.09753883900877064,32,5,3,0.015150549505626082,32,3,2,0.05597812051466478,128,3,2,,,,,256,128,5,0.10724936238726754,20.0,3,Adam,,,,50.0,0.7259887005649718,0.699926406292925,COMPLETE
45,0.5239607116717382,2026-09-29 17:49:29.178253,2026-09-29 17:51:05.011195,0 days 00:01:35.832942,0.8528317471701143,0.9306671005613388,0.0008490786295218431,1.0081810844206632e-06,64.0,0.09184592051267683,16,5,3,0.023718358471773296,32,3,1,0.08241561973335503,64,3,2,,,,,256,128,5,0.1584658673907561,19.0,3,Adam,,,,,,,PRUNED
46,0.7466732164707499,2026-09-29 17:51:05.131910,2026-09-29 17:54:09.138615,0 days 00:03:04.006705,0.8961539050749308,0.9030670849597927,0.001412592686743357,4.9571438879228915e-06,64.0,0.09512182475435914,32,5,3,0.016008214031952062,32,3,2,0.04998389146070813,64,3,2,,,,,256,128,5,0.10325754055072783,9.0,3,Adam,,,,44.0,0.7598870056497176,0.7334594272917823,COMPLETE
47,0.708706460465597,2026-09-29 17:54:09.269269,2026-09-29 17:57:12.780151,0 days 00:03:03.510882,0.8849628829503969,0.9027552969714108,0.002478475797401469,5.7281291727868875e-06,64.0,0.0818007140367207,32,5,3,0.03091534073123619,32,3,2,0.04882458104563718,64,3,2,,,,,256,128,5,0.4807470041647351,9.0,3,Adam,,,,50.0,0.7203389830508474,0.6970739378803466,COMPLETE
48,0.5703994091775562,2026-09-29 17:57:12.908909,2026-09-29 17:58:53.077622,0 days 00:01:40.168713,,,,,64.0,0.0938837062352366,32,5,3,0.02190484426020445,32,5,2,0.0698097617294023,128,3,2,,,,,256,128,5,0.5360087736946072,11.0,3,SGD,0.011605794718058738,0.900756468795903,1.9047803613558514e-06,,,,PRUNED
49,0.43366252457642507,2026-09-29 17:58:53.200799,2026-09-29 17:59:24.208150,0 days 00:00:31.007351,0.8966609191752052,0.9067838405791575,0.001856656910863414,1.1730254366726532e-05,128.0,0.08879565337164044,8,7,3,0.027936434548199978,32,3,1,0.03226184819399329,64,3,2,,,,,256,128,5,0.14915732784479774,7.0,3,Adam,,,,,,,PRUNED
50,,2026-09-29 17:59:24.337826,2026-09-29 17:59:24.394544,0 days 00:00:00.056718,,,,,,0.07661575451139561,32,5,3,0.018276696370689804,16,3,2,0.043877658316885906,64,3,2,0.03681806406703807,64.0,3.0,1.0,,128,7,,,4,,,,,,,,PRUNED
51,0.7102293257523152,2026-09-29 17:59:24.518092,2026-09-29 18:02:28.597605,0 days 00:03:04.079513,0.9030494628193846,0.9141323229161785,0.0011623637006257092,2.890912127800721e-06,64.0,0.09549555947546004,32,5,3,0.014197947925748388,32,3,2,0.05399027416759465,64,3,2,,,,,256,128,5,0.12204126836677415,9.0,3,Adam,,,,47.0,0.7203389830508474,0.700119668453783,COMPLETE
52,0.46082294251642597,2026-09-29 18:02:28.719707,2026-09-29 18:03:05.535805,0 days 00:00:36.816098,0.8958504280648064,0.9384369159488726,0.004098817081421088,5.722562591163577e-06,64.0,0.09998257033497092,32,5,3,0.013976596303175048,32,3,2,0.06228851571497625,64,3,2,,,,,256,128,5,0.16816615749277047,12.0,3,Adam,,,,,,,PRUNED
53,0.7515394828697352,2026-09-29 18:03:05.674722,2026-09-29 18:06:09.699477,0 days 00:03:04.024755,0.9084479214979221,0.9192920705950927,0.0006671457757201799,1.7074539405749994e-06,64.0,0.09017091604061549,32,5,3,0.010662820193279547,32,3,2,0.05040327760940913,64,3,2,,,,,256,128,5,0.10023265250472596,8.0,3,Adam,,,,44.0,0.7598870056497176,0.7431919600897527,COMPLETE
54,0.7414477882494037,2026-09-29 18:06:09.828856,2026-09-29 18:09:13.814845,0 days 00:03:03.985989,0.9077171673770281,0.908450210395654,0.0006335594125136325,1.4147171955295713e-05,64.0,0.08549992027987594,32,5,3,0.011056771190951761,32,3,2,0.05050140995276925,64,3,2,,,,,256,128,5,0.25630914177183783,8.0,3,Adam,,,,47.0,0.7570621468926554,0.725833429606152,COMPLETE
55,0.7524356272634452,2026-09-29 18:09:13.938280,2026-09-29 18:12:17.145348,0 days 00:03:03.207068,0.8801166286273246,0.9066800401939203,0.0007818964626861917,1.7804824321879955e-05,64.0,0.08591100892479406,32,5,3,0.010005620235010223,32,3,2,0.06116884278343023,64,3,2,,,,,256,128,5,0.1929357715957406,8.0,3,Adam,,,,43.0,0.7740112994350282,0.7308599550918622,COMPLETE
56,0.728730248489662,2026-09-29 18:12:17.268409,2026-09-29 18:15:11.457638,0 days 00:02:54.189229,0.8775662015751362,0.900763957556684,0.0008154037525189301,2.3377744039556003e-05,64.0,0.08584534441445621,32,5,3,0.011541026456383455,32,3,2,0.058944611124029295,64,3,2,,,,,256,128,5,0.1903211965085206,8.0,3,Adam,,,,50.0,0.748587570621469,0.7088729263578549,COMPLETE
57,0.31727816537901105,2026-09-29 18:15:11.586033,2026-09-29 18:15:46.690311,0 days 00:00:35.104278,0.8846004351475457,0.9085205245185819,0.0006467789557027402,1.3204652711286349e-05,64.0,0.025221874518659766,32,5,3,0.010180801759078864,32,3,2,0.07279716212491003,32,3,2,,,,,256,128,5,0.24474830877316767,5.0,3,Adam,,,,,,,PRUNED
58,0.7462815709973717,2026-09-29 18:15:46.820672,2026-09-29 18:19:14.641075,0 days 00:03:27.820403,0.8703913675242976,0.9203121453960056,0.0015616476663133305,4.5548402446157195e-05,64.0,0.09095155870452443,32,5,3,0.021072535138097134,32,3,2,0.05987711943448445,64,3,2,,,,,256,256,5,0.257678216676461,9.0,3,Adam,,,,47.0,0.751412429378531,0.7411507126162123,COMPLETE
