number,value,datetime_start,datetime_complete,duration,params_adam_beta1,params_adam_beta2,params_adam_lr,params_adam_wd,params_batch_size,params_block_0_dropout,params_block_0_filters,params_block_0_kernel,params_block_0_stride,params_block_1_dropout,params_block_1_filters,params_block_1_kernel,params_block_1_stride,params_block_2_dropout,params_block_2_filters,params_block_2_kernel,params_block_2_stride,params_block_3_dropout,params_block_3_filters,params_block_3_kernel,params_block_3_stride,params_block_4_dropout,params_block_4_filters,params_block_4_kernel,params_block_4_stride,params_fc_hidden,params_lr_factor,params_lr_patience,params_n_blocks,params_optimizer,params_sgd_lr,params_sgd_momentum,params_sgd_wd,user_attrs_best_epoch,user_attrs_validation_accuracy,user_attrs_validation_macro_f1,state
56,,2026-10-06 12:01:11.737183,2026-10-06 12:01:11.804627,0 days 00:00:00.067444,,,,,,0.013023970235844583,8,5,3,0.043939443211434205,32,7,2,0.01240369397250582,64,5,1,0.040098023250210266,256.0,5.0,2.0,0.04613286939889138,128.0,3.0,1.0,,,,5,,,,,,,,PRUNED
57,0.311299206744923,2026-10-06 12:01:11.939053,2026-10-06 12:01:20.285694,0 days 00:00:08.346641,,,,,200.0,0.01761698073033688,8,5,3,0.03596772460266539,32,7,1,0.017342633282588532,64,5,1,,,,,,,,,512,0.13356823230383277,15.0,3,SGD,0.023953151394967752,0.9457215818919769,3.690537564621212e-06,,,,PRUNED
58,,2026-10-06 12:01:20.419821,2026-10-06 12:01:20.489115,0 days 00:00:00.069294,,,,,,0.013253917680295518,8,5,3,0.04114824632997411,32,7,1,0.02280179979432302,64,5,2,0.03179823630196657,256.0,5.0,1.0,0.027354335284001052,128.0,3.0,1.0,,,,5,,,,,,,,PRUNED
59,0.734851181241202,2026-10-06 12:01:20.624458,2026-10-06 12:02:18.663098,0 days 00:00:58.038640,,,,,64.0,0.010286467218105574,8,7,3,0.03440280854782276,32,7,1,0.027311352212958367,64,5,1,0.029161627604782935,256.0,5.0,2.0,0.0350794712796129,128.0,3.0,1.0,512,0.1859792903487411,13.0,5,SGD,0.003528920329555305,0.8428942462642085,6.550490907461046e-05,,,,PRUNED
60,0.41997385292256817,2026-10-06 12:02:18.801069,2026-10-06 12:02:33.804071,0 days 00:00:15.003002,,,,,64.0,0.01594158053633936,8,5,3,0.03707505448875212,32,7,1,0.01982982115038118,64,3,1,0.03877103384142167,256.0,5.0,2.0,0.019914426299859553,128.0,3.0,1.0,512,0.10183465996289193,15.0,5,SGD,0.03181877397516371,0.9225976971787759,5.424006614260489e-06,,,,PRUNED
61,0.41416381343526165,2026-10-06 12:02:33.935790,2026-10-06 12:02:49.353925,0 days 00:00:15.418135,,,,,64.0,0.011139557591720764,8,5,3,0.04909794135602347,32,7,1,0.014417735678320349,64,5,1,0.03961207002377364,256.0,5.0,2.0,0.032489735440366596,128.0,3.0,1.0,512,0.22691243802002775,17.0,5,SGD,0.0046351954248103205,0.8248654340519638,2.0577711964016267e-06,,,,PRUNED
62,0.8026875700043171,2026-10-06 12:02:49.488408,2026-10-06 12:04:06.219102,0 days 00:01:16.730694,,,,,64.0,0.01258301561391744,8,5,3,0.044554809850864296,32,7,1,0.029862280032479666,64,5,1,0.043504001105322224,256.0,5.0,2.0,0.030236667406315334,128.0,3.0,1.0,512,0.19782603717036856,16.0,5,SGD,0.014973244077868573,0.7635518263453696,3.6788289524044043e-06,39.0,0.808695652173913,0.7966794878347212,COMPLETE
63,0.7948105750604642,2026-10-06 12:04:06.353663,2026-10-06 12:05:23.008428,0 days 00:01:16.654765,,,,,64.0,0.011440931749580531,8,5,3,0.04306826583655203,32,7,1,0.02127961758922113,64,5,1,0.038226521687774066,256.0,5.0,2.0,0.038166981086167485,128.0,3.0,1.0,512,0.14401452065416778,19.0,5,SGD,0.006577782672785166,0.8788136603844949,1.7020110602285495e-05,50.0,0.8054347826086956,0.7841863675122326,COMPLETE
64,0.3248519836838231,2026-10-06 12:05:23.141272,2026-10-06 12:05:36.611303,0 days 00:00:13.470031,,,,,200.0,0.02023848805075192,8,5,3,0.03881934786423625,32,7,1,0.01899886122596566,64,5,1,0.03451040106917269,256.0,5.0,2.0,0.048454023659154265,128.0,3.0,1.0,512,0.26814677969928846,18.0,5,SGD,0.0021680670714352623,0.8663943670898271,3.2911137967905115e-06,,,,PRUNED
65,0.808671663301562,2026-10-06 12:05:36.745384,2026-10-06 12:07:16.325354,0 days 00:01:39.579970,,,,,64.0,0.013933966278764084,32,5,3,0.04543113309285285,32,7,1,0.020878073915311067,64,5,1,0.03682517773136066,256.0,5.0,2.0,0.025741497424226878,512.0,3.0,1.0,512,0.23106991473145655,14.0,5,SGD,0.016368469093575585,0.8297736135809615,1.0600425649238487e-05,46.0,0.8152173913043478,0.8021259352987763,COMPLETE
66,0.40611027927865473,2026-10-06 12:07:16.462610,2026-10-06 12:07:36.482777,0 days 00:00:20.020167,,,,,64.0,0.013829139103383951,32,5,3,0.04040365955257252,32,7,1,0.02558795568889895,64,5,1,0.03608008398571973,256.0,5.0,2.0,0.021035196851154576,512.0,3.0,1.0,512,0.32372321839060914,14.0,5,SGD,0.036830454034342576,0.8325069747551623,1.8836354424863255e-05,,,,PRUNED
67,,2026-10-06 12:07:36.616932,2026-10-06 12:07:36.685021,0 days 00:00:00.068089,,,,,,0.01646886145161686,32,5,3,0.04197617758236551,32,5,2,0.020432011145497343,64,5,1,0.045899079526297945,128.0,3.0,2.0,0.030726450476306563,512.0,3.0,1.0,,,,5,,,,,,,,PRUNED
68,0.31512655170098086,2026-10-06 12:07:36.817353,2026-10-06 12:07:56.112911,0 days 00:00:19.295558,,,,,64.0,0.010039043226268718,32,5,3,0.04537760746370191,16,7,1,0.03681296325779264,64,5,1,0.04130594643202122,256.0,5.0,2.0,0.02471341079336553,512.0,3.0,1.0,512,0.3795938340627018,13.0,5,SGD,0.01676664452936692,0.9398048262204834,8.150755032018655e-06,,,,PRUNED
69,0.32845686823003645,2026-10-06 12:07:56.248581,2026-10-06 12:08:54.820994,0 days 00:00:58.572413,,,,,64.0,0.015749602054033064,32,5,3,0.04379598112272276,32,7,1,0.022957815173914604,128,5,1,0.036657688341846226,256.0,5.0,1.0,0.026329410998266058,512.0,3.0,1.0,512,0.18394049019834277,12.0,5,SGD,0.04692381374799359,0.8857234300534134,8.094660098000663e-05,,,,PRUNED
70,,2026-10-06 12:08:54.955764,2026-10-06 12:08:55.032323,0 days 00:00:00.076559,,,,,,0.02490074616204712,32,5,3,0.03703294223582658,32,7,1,0.017430249196684993,64,3,2,0.03008269608640368,128.0,5.0,2.0,0.01413283686644266,512.0,3.0,1.0,,,,5,,,,,,,,PRUNED
71,0.4830113469948202,2026-10-06 12:08:55.166191,2026-10-06 12:09:15.125429,0 days 00:00:19.959238,,,,,64.0,0.012128457152661646,8,5,3,0.04743008197876646,32,7,1,0.024082823764623777,64,5,1,0.03270572664468228,256.0,5.0,2.0,0.03298912341374869,128.0,3.0,1.0,512,0.24616441275346052,15.0,5,SGD,0.011654594991618462,0.7658461214414217,1.0412671857056682e-06,,,,PRUNED
72,0.8117489766597752,2026-10-06 12:09:15.258473,2026-10-06 12:10:42.780426,0 days 00:01:27.521953,,,,,64.0,0.01386898149918904,32,5,3,0.049152230879911,32,7,1,0.020547008463970354,64,5,1,0.03921027195817073,256.0,5.0,2.0,0.03595199426720902,128.0,3.0,1.0,512,0.2348861939659502,16.0,5,SGD,0.005884888097495626,0.8150055382499078,6.405954256263817e-06,45.0,0.8206521739130435,0.802845779406507,COMPLETE
73,0.8221716294744612,2026-10-06 12:10:42.920956,2026-10-06 12:12:14.906641,0 days 00:01:31.985685,,,,,64.0,0.014057479702096138,32,5,3,0.04600219596706252,32,7,1,0.01841382804948942,64,5,1,0.03501220795214994,256.0,5.0,2.0,0.03570585861262808,256.0,3.0,1.0,512,0.1290663086901452,16.0,5,SGD,0.005742181774689024,0.8344945878527795,1.0082825943906953e-05,46.0,0.8315217391304348,0.8128215198184875,COMPLETE
74,0.8150540575817755,2026-10-06 12:12:15.051602,2026-10-06 12:13:46.995321,0 days 00:01:31.943719,,,,,64.0,0.01692484498596344,32,5,3,0.04887048127914806,32,7,1,0.015508798861307887,64,5,1,0.03451540029429413,256.0,5.0,2.0,0.035261539605174565,256.0,3.0,1.0,512,0.11898968157101153,16.0,5,SGD,0.006080613155322036,0.776077395666316,2.8335165150485815e-05,49.0,0.8239130434782609,0.8061950716852901,COMPLETE
75,0.827109247570082,2026-10-06 12:13:47.129512,2026-10-06 12:15:19.112559,0 days 00:01:31.983047,,,,,64.0,0.016683052455662938,32,5,3,0.04979298474693413,32,7,1,0.014297617249746201,64,5,1,0.034215549574664515,256.0,5.0,2.0,0.03613195687901448,256.0,3.0,1.0,512,0.12816909589730766,16.0,5,SGD,0.00542397517179862,0.7796275731595758,2.3055907507351237e-05,49.0,0.8369565217391305,0.8172619734010335,COMPLETE
76,0.3409187253729655,2026-10-06 12:15:19.248193,2026-10-06 12:15:34.741169,0 days 00:00:15.492976,,,,,200.0,0.017252600668505567,32,5,3,0.04865772469981663,32,7,1,0.015374455800752569,64,5,1,0.03793861685008213,256.0,5.0,2.0,0.03608599379409249,256.0,3.0,1.0,512,0.13697049676877782,16.0,5,SGD,0.005138338721119173,0.7685160825525281,2.2500985758752577e-05,,,,PRUNED
77,0.8304970354291614,2026-10-06 12:15:34.880397,2026-10-06 12:17:06.819299,0 days 00:01:31.938902,,,,,64.0,0.018919705714904447,32,5,3,0.049216472047496795,32,7,1,0.011343740972813314,64,5,1,0.034019883057811375,256.0,5.0,2.0,0.036918667829309706,256.0,3.0,1.0,512,0.13019371719440445,17.0,5,SGD,0.005348896483662239,0.782910745399524,3.265721061904441e-05,49.0,0.8369565217391305,0.8240375491191924,COMPLETE
78,0.3884801836596795,2026-10-06 12:17:06.955420,2026-10-06 12:17:24.611693,0 days 00:00:17.656273,,,,,64.0,0.019005788622536705,32,5,3,0.04977749375053423,32,7,1,0.010122917734051325,64,5,1,0.034700616021590164,256.0,3.0,2.0,0.03781761795207559,256.0,3.0,1.0,512,0.12757707089178558,17.0,5,SGD,0.0032477760514739106,0.7793788794764518,4.2771962587595164e-05,,,,PRUNED
79,0.43498228284332974,2026-10-06 12:17:24.749016,2026-10-06 12:17:40.549540,0 days 00:00:15.800524,,,,,128.0,0.021533282857347454,32,7,3,0.046716241072497285,32,7,1,0.01177041712868726,64,5,1,0.027417475983028877,256.0,5.0,2.0,0.03470571402889334,256.0,3.0,1.0,512,0.1498170349449295,15.0,5,SGD,0.0074238072513770886,0.7415906779176887,3.882154752988138e-05,,,,PRUNED
80,,2026-10-06 12:17:40.681897,2026-10-06 12:17:40.752019,0 days 00:00:00.070122,,,,,,0.021399480141521272,32,5,3,0.047049521593276855,32,7,2,0.013581995587580248,64,5,1,0.012268173754843716,256.0,5.0,1.0,0.029103875787750675,256.0,3.0,1.0,,,,5,,,,,,,,PRUNED
81,0.8225410523390772,2026-10-06 12:17:40.884516,2026-10-06 12:19:12.790119,0 days 00:01:31.905603,,,,,64.0,0.015357861671205845,32,5,3,0.04966374281452495,32,7,1,0.015284193552745807,64,5,1,0.032179561910600916,256.0,5.0,2.0,0.03657782460409253,256.0,3.0,1.0,512,0.18886582335435634,16.0,5,SGD,0.005254502882907941,0.7898212008284455,6.0345468848204825e-06,49.0,0.8336956521739131,0.8113864525042412,COMPLETE
82,0.4045791856278076,2026-10-06 12:19:12.927383,2026-10-06 12:19:31.405203,0 days 00:00:18.477820,,,,,64.0,0.01704479619436543,32,5,3,0.04994113744133256,32,7,1,0.015974789287126645,64,5,1,0.03205878430118159,256.0,5.0,2.0,0.03747095881190074,256.0,3.0,1.0,512,0.12428573550700905,16.0,5,SGD,0.0020023102016173805,0.7845097362819508,1.3810362708300963e-05,,,,PRUNED
83,0.819117522024071,2026-10-06 12:19:31.538358,2026-10-06 12:21:03.420694,0 days 00:01:31.882336,,,,,64.0,0.014933376659117616,32,5,3,0.04633123246795618,32,7,1,0.015113794310998121,64,5,1,0.033508930768389275,256.0,5.0,2.0,0.041645952060414854,256.0,3.0,1.0,512,0.18594583049501873,16.0,5,SGD,0.005163044924353149,0.7421381804216705,0.00013550402572946865,50.0,0.8304347826086956,0.8078002614394464,COMPLETE
84,0.6383489939170727,2026-10-06 12:21:03.556123,2026-10-06 12:21:50.415034,0 days 00:00:46.858911,,,,,64.0,0.015172700045489538,32,5,3,0.04606077390228919,32,7,1,0.011290367536558304,64,5,1,0.030614251498389252,256.0,5.0,2.0,0.042257073944992916,256.0,3.0,1.0,512,0.19018745797876327,17.0,5,SGD,0.003938069132027248,0.738819384555743,0.00011024855263155278,,,,PRUNED
85,0.8314061747457204,2026-10-06 12:21:50.553341,2026-10-06 12:23:14.068842,0 days 00:01:23.515501,,,,,64.0,0.01841509170636673,32,5,3,0.044491244550414054,32,7,1,0.013331462390783167,64,5,1,0.028078513520515883,256.0,5.0,2.0,0.038488624257841796,256.0,3.0,1.0,512,0.17032746529498136,15.0,5,SGD,0.010167330106284518,0.7500326758814817,5.810926598959377e-06,47.0,0.842391304347826,0.8204210451436147,COMPLETE
86,0.8319023737001097,2026-10-06 12:23:14.205734,2026-10-06 12:24:38.084788,0 days 00:01:23.879054,,,,,64.0,0.018330481328395723,32,5,3,0.04343127520376346,32,7,1,0.01316703824680536,64,5,1,0.0279881710798471,256.0,5.0,2.0,0.03912326791091687,256.0,3.0,1.0,512,0.17973890845454732,15.0,5,SGD,0.010850837954222117,0.7526785785147834,0.00016668666015509694,49.0,0.841304347826087,0.8225003995741323,COMPLETE
87,0.5032698764511379,2026-10-06 12:24:38.216768,2026-10-06 12:25:00.195655,0 days 00:00:21.978887,,,,,64.0,0.018811302267781844,32,5,3,0.04373576694661161,32,7,1,0.013384587381121511,64,5,1,0.026686074935054878,256.0,5.0,2.0,0.03869530188605653,256.0,3.0,1.0,512,0.283891441181331,15.0,5,SGD,0.009703716927329986,0.9042318674530273,5.446369796265226e-06,,,,PRUNED
88,0.8471986952663779,2026-10-06 12:25:00.330620,2026-10-06 12:26:24.292656,0 days 00:01:23.962036,,,,,64.0,0.020441340508397757,32,5,3,0.04213101958866846,32,7,1,0.01250780554176248,64,5,1,0.029530781320748795,256.0,5.0,2.0,0.03668636612493304,256.0,3.0,1.0,512,0.1681630275163855,15.0,5,SGD,0.012898294815156782,0.7561740999919863,1.3018804817110247e-05,50.0,0.8576086956521739,0.8367886948805818,COMPLETE
89,,2026-10-06 12:26:24.424909,2026-10-06 12:26:24.501116,0 days 00:00:00.076207,,,,,,0.020458506327023528,32,5,3,0.04445257487689174,32,7,1,0.011388466981672236,64,5,2,0.025130218846691962,256.0,5.0,2.0,0.03702478613350505,256.0,3.0,1.0,,,,5,,,,,,,,PRUNED
90,0.8446405355739284,2026-10-06 12:26:24.636150,2026-10-06 12:27:52.788438,0 days 00:01:28.152288,,,,,64.0,0.023057105970790897,32,5,3,0.04778511001577101,32,7,1,0.012421173460422565,64,5,1,0.028326777161486287,256.0,5.0,2.0,0.03940563605543228,256.0,3.0,1.0,512,0.168673623436856,13.0,5,SGD,0.014566456284253354,0.7574558075724767,0.0003784415979805857,47.0,0.8532608695652174,0.8360202015826393,COMPLETE
91,0.834374673530383,2026-10-06 12:27:52.936606,2026-10-06 12:29:24.704812,0 days 00:01:31.768206,,,,,64.0,0.024019183875461755,32,5,3,0.047477683728529944,32,7,1,0.01281121155470646,64,5,1,0.029036061486969845,256.0,5.0,2.0,0.03906570353749727,256.0,3.0,1.0,512,0.1743462126233316,13.0,5,SGD,0.014428092771871055,0.7538502074666358,0.00028933026125370787,50.0,0.8434782608695652,0.8252710861912008,COMPLETE
92,0.8416556419102746,2026-10-06 12:29:24.840250,2026-10-06 12:30:54.469063,0 days 00:01:29.628813,,,,,64.0,0.024153603192210684,32,5,3,0.047254144325922204,32,7,1,0.01257523611727551,64,5,1,0.028254899904319515,256.0,5.0,2.0,0.03897682303725063,256.0,3.0,1.0,512,0.1640829125368301,13.0,5,SGD,0.01839628964981371,0.7544413384710679,0.00039371123783042987,48.0,0.8489130434782609,0.8343982403422884,COMPLETE
93,0.8316722155123697,2026-10-06 12:30:54.606228,2026-10-06 12:32:28.164355,0 days 00:01:33.558127,,,,,64.0,0.023586434724548508,32,5,3,0.04749523384865975,32,7,1,0.010802292064515452,64,5,1,0.028549340385206796,256.0,5.0,2.0,0.041354379603754064,256.0,3.0,1.0,512,0.16550275644629842,13.0,5,SGD,0.019005063654523684,0.7528841592370838,0.00038552341390393264,47.0,0.8391304347826087,0.8242139962421305,COMPLETE
94,0.8415228610577661,2026-10-06 12:32:28.307425,2026-10-06 12:33:49.608037,0 days 00:01:21.300612,,,,,64.0,0.024442279213929337,32,5,3,0.04713527765205748,32,5,1,0.012285811582884436,64,5,1,0.028002811920354087,256.0,5.0,2.0,0.04091174516234771,256.0,3.0,1.0,512,0.16286711513546098,11.0,5,SGD,0.02273730963029614,0.7529470444062085,0.0004694988142032773,49.0,0.8489130434782609,0.8341326786372711,COMPLETE
95,0.47674923148178844,2026-10-06 12:33:49.765760,2026-10-06 12:34:09.768721,0 days 00:00:20.002961,,,,,64.0,0.024238373766083912,32,5,3,0.04766180989759667,32,5,1,0.012851742207954603,64,5,1,0.028538305720827516,256.0,5.0,2.0,0.04096069820826172,256.0,3.0,1.0,512,0.16397560861329055,11.0,5,SGD,0.024796582560764995,0.7524573910279658,0.0005894665112345608,,,,PRUNED
96,0.5575499286829797,2026-10-06 12:34:09.906016,2026-10-06 12:34:40.236229,0 days 00:00:30.330213,,,,,64.0,0.025904440567214193,32,5,3,0.047471598502877174,16,5,1,0.010771923062589278,128,5,1,0.027944174299840644,256.0,3.0,2.0,0.03940905104246399,256.0,3.0,1.0,512,0.16147561902938568,11.0,5,SGD,0.019851319058203736,0.7196711892281945,0.00024233162710248133,,,,PRUNED
97,0.8383371012089655,2026-10-06 12:34:40.407119,2026-10-06 12:36:02.504096,0 days 00:01:22.096977,,,,,64.0,0.022971990658891453,32,7,3,0.04308097196893439,32,5,1,0.012042183042512245,64,5,1,0.02341414927880884,256.0,5.0,2.0,0.04336582928951859,256.0,3.0,1.0,512,0.20865087346193992,13.0,5,SGD,0.013027122630326774,0.7210637595433377,0.0011388897960041234,45.0,0.8510869565217392,0.8255872458961918,COMPLETE
98,0.43574368525332674,2026-10-06 12:36:02.672270,2026-10-06 12:36:17.525446,0 days 00:00:14.853176,,,,,128.0,0.022837359863481593,32,7,3,0.04496984219898528,32,5,1,0.012221100953031028,64,5,1,0.020868960449456485,256.0,5.0,2.0,0.04369919729207464,256.0,3.0,1.0,512,0.21384950496926514,13.0,5,SGD,0.013099765101907372,0.7283004822371517,0.0009372355914217649,,,,PRUNED
99,,2026-10-06 12:36:17.682347,2026-10-06 12:36:17.753263,0 days 00:00:00.070916,,,,,,0.026716870328982463,32,7,3,0.04323557858940613,32,5,2,0.013101571987843279,64,5,1,0.023735521265003178,256.0,5.0,1.0,0.044854411746815995,256.0,3.0,1.0,,,,5,,,,,,,,PRUNED
