number,value,datetime_start,datetime_complete,duration,params_adam_beta1,params_adam_beta2,params_adam_lr,params_adam_wd,params_batch_size,params_block_0_dropout,params_block_0_filters,params_block_0_kernel,params_block_0_stride,params_block_1_dropout,params_block_1_filters,params_block_1_kernel,params_block_1_stride,params_block_2_dropout,params_block_2_filters,params_block_2_kernel,params_block_2_stride,params_block_3_dropout,params_block_3_filters,params_block_3_kernel,params_block_3_stride,params_block_4_dropout,params_block_4_filters,params_block_4_kernel,params_block_4_stride,params_fc_hidden,params_lr_factor,params_lr_patience,params_n_blocks,params_optimizer,params_sgd_lr,params_sgd_momentum,params_sgd_wd,user_attrs_best_epoch,user_attrs_validation_accuracy,user_attrs_validation_macro_f1,state
0,0.24868403387700722,2026-10-06 11:25:31.864213,2026-10-06 11:26:08.705331,0 days 00:00:36.841118,,,,,128.0,0.012323344486727979,8,7,3,0.017336180394137354,16,5,2,0.02465447373174767,64,3,1,0.016820964947491662,128.0,3.0,1.0,,,,,512,0.19763058787582308,12.0,4,SGD,0.00019634341572933326,0.8984275776885255,5.762487216478604e-05,50.0,0.24891304347826088,0.24845502427575356,COMPLETE
1,0.2684310252951956,2026-10-06 11:26:08.837412,2026-10-06 11:26:59.970977,0 days 00:00:51.133565,,,,,128.0,0.041005312934444586,32,5,3,0.02554709158757928,16,7,1,0.012982025747190833,64,3,1,0.04085081386743783,64.0,3.0,1.0,,,,,256,0.36014665762139764,16.0,4,SGD,0.0009833181933644897,0.7184319215829468,1.753594952976443e-05,44.0,0.27065217391304347,0.26620987667734763,COMPLETE
2,0.45121051021391356,2026-10-06 11:27:00.110748,2026-10-06 11:27:35.376650,0 days 00:00:35.265902,0.9754527819892891,0.9317685471496893,0.0011986281799901185,0.0016973078532467015,200.0,0.030909313175279764,16,7,3,0.019971689165955,16,5,1,0.04232481518257668,64,3,1,,,,,,,,,256,0.18804153962214143,8.0,3,Adam,,,,45.0,0.44021739130434784,0.4622036291234793,COMPLETE
3,0.638183961214503,2026-10-06 11:27:35.520544,2026-10-06 11:28:49.939587,0 days 00:01:14.419043,0.9519502888056603,0.9367415349586534,0.003336101309469784,8.923807143379781e-06,200.0,0.04771638815650077,8,5,3,0.022035132392670787,64,5,1,0.019582475626678898,128,5,1,,,,,,,,,512,0.6058446644748636,15.0,3,Adam,,,,50.0,0.633695652173913,0.6426722702550931,COMPLETE
4,0.4264013941971031,2026-10-06 11:28:50.074494,2026-10-06 11:29:37.626479,0 days 00:00:47.551985,,,,,64.0,0.03048372233197124,32,7,3,0.014538940849623563,32,3,1,0.01967409163601807,32,3,2,,,,,,,,,512,0.8096691394120938,17.0,3,SGD,0.0011159088550343414,0.9105271468723695,0.0038765111709116325,48.0,0.42282608695652174,0.42997670143768446,COMPLETE
5,,2026-10-06 11:29:37.757457,2026-10-06 11:29:37.806819,0 days 00:00:00.049362,,,,,,0.016432322056699946,8,7,3,0.035985315961888587,32,5,1,0.048920422190097824,32,3,2,0.01780971951192178,128.0,5.0,2.0,0.03581889183628671,128.0,3.0,1.0,,,,5,,,,,,,,PRUNED
6,,2026-10-06 11:29:37.938447,2026-10-06 11:29:37.969437,0 days 00:00:00.030990,,,,,,0.04713274250350902,16,7,3,0.0167797098674437,32,7,2,0.015603360609460961,64,5,1,,,,,,,,,,,,3,,,,,,,,PRUNED
7,,2026-10-06 11:29:38.102911,2026-10-06 11:29:38.146194,0 days 00:00:00.043283,,,,,,0.021743673770579737,8,7,3,0.038078675090308135,64,7,2,0.02862392072529841,64,5,2,0.015082420506075393,256.0,3.0,2.0,,,,,,,,4,,,,,,,,PRUNED
8,,2026-10-06 11:29:38.278558,2026-10-06 11:29:38.323475,0 days 00:00:00.044917,,,,,,0.03125418526272592,8,7,3,0.027558856828225446,64,7,2,0.016257481706843442,128,5,2,0.032174162100456025,256.0,5.0,2.0,,,,,,,,4,,,,,,,,PRUNED
9,,2026-10-06 11:29:38.455564,2026-10-06 11:29:38.497245,0 days 00:00:00.041681,,,,,,0.01464290562027665,8,7,3,0.016928074796400606,64,7,2,0.030125450343203505,128,5,1,0.04760920965699831,64.0,3.0,1.0,,,,,,,,4,,,,,,,,PRUNED
10,0.7767878670964387,2026-10-06 11:29:38.633409,2026-10-06 11:31:03.338463,0 days 00:01:24.705054,0.9068515559725695,0.9652028519024756,0.008094454562649891,1.1990413778055588e-06,200.0,0.047396519251223214,16,5,3,0.04780785829889703,64,3,1,0.03788623593360378,128,5,1,0.03128492670279544,64.0,5.0,2.0,0.010567689211659854,256.0,3.0,1.0,128,0.8770937470127276,5.0,5,Adam,,,,49.0,0.7793478260869565,0.7742279081059208,COMPLETE
11,0.7508474934509771,2026-10-06 11:31:03.477695,2026-10-06 11:32:28.671498,0 days 00:01:25.193803,0.9234044305725273,0.9541833898470133,0.008680399316661742,1.4211537482266188e-06,200.0,0.04997449754566205,16,5,3,0.04976482875798626,64,3,1,0.03726749621045093,128,5,1,0.02941240784789848,64.0,5.0,2.0,0.012725290807332416,256.0,3.0,1.0,128,0.8797484766742464,5.0,5,Adam,,,,50.0,0.7554347826086957,0.7462602042932586,COMPLETE
12,0.22518915669072082,2026-10-06 11:32:28.802440,2026-10-06 11:32:45.956511,0 days 00:00:17.154071,0.8842650747520039,0.9829644884150359,0.009256762816668472,1.0020121013332432e-06,200.0,0.04126429735539777,16,5,3,0.04967760384215255,64,3,1,0.03794030830388812,128,5,1,0.02886808751750585,64.0,5.0,2.0,0.010834250085608765,256.0,3.0,1.0,128,0.8946581082665175,5.0,5,Adam,,,,,,,PRUNED
13,0.2829913554923757,2026-10-06 11:32:46.089742,2026-10-06 11:33:03.263003,0 days 00:00:17.173261,0.9043638827215468,0.9672303787053823,0.007466393343635783,1.1645392808873212e-06,200.0,0.0497381665119616,16,5,3,0.049971258501778,64,3,1,0.037581906674513214,128,5,1,0.028905316894243097,64.0,5.0,2.0,0.010558299437951753,256.0,3.0,1.0,128,0.7332333606709378,5.0,5,Adam,,,,,,,PRUNED
14,0.7215473160644078,2026-10-06 11:33:03.395679,2026-10-06 11:34:36.624547,0 days 00:01:33.228868,0.9217784886480835,0.9607099819112636,0.00013179982344396247,1.8666928397367735e-05,200.0,0.040954048580510015,16,5,3,0.0441744120387903,64,3,1,0.03549707505149007,128,5,1,0.03553907373527548,64.0,5.0,2.0,0.017058928980271296,512.0,3.0,1.0,128,0.6543261158465403,9.0,5,Adam,,,,48.0,0.717391304347826,0.7257033277809896,COMPLETE
15,0.7947745283006562,2026-10-06 11:34:36.758035,2026-10-06 11:36:16.073542,0 days 00:01:39.315507,0.8509419900850601,0.9567288445360268,0.0031364606031396057,9.73967438852068e-06,64.0,0.04431330071178569,16,5,3,0.04399528350105656,64,3,1,0.045589316936129505,128,5,1,0.025535920841954357,64.0,5.0,2.0,0.02431041743613676,256.0,3.0,1.0,128,0.8695603436402255,8.0,5,Adam,,,,48.0,0.8,0.7895490566013122,COMPLETE
16,0.7683669742732138,2026-10-06 11:36:16.204417,2026-10-06 11:37:16.227779,0 days 00:01:00.023362,0.850790322896079,0.9984291679345484,0.0016307490915525207,3.38856662304592e-05,64.0,0.03677411649703226,16,5,3,0.041238667223847655,64,3,1,0.04863948025786451,32,5,1,0.02201061942356882,64.0,5.0,2.0,0.0265113085936092,256.0,3.0,1.0,128,0.5417321749266961,9.0,5,Adam,,,,50.0,0.7695652173913043,0.7671687311551232,COMPLETE
17,0.300522101775339,2026-10-06 11:37:16.363035,2026-10-06 11:37:40.275406,0 days 00:00:23.912371,0.857978405990891,0.909691209915485,0.0026728497669002323,0.00013089222484074034,64.0,0.04410578628484395,16,5,3,0.03246958191690325,64,3,1,0.04474193796499794,128,5,1,0.023002600459416395,64.0,5.0,2.0,0.049920194525199926,256.0,3.0,1.0,128,0.7536181542991809,12.0,5,Adam,,,,,,,PRUNED
18,,2026-10-06 11:37:40.407285,2026-10-06 11:37:40.487492,0 days 00:00:00.080207,,,,,,0.03632767799996413,32,5,3,0.04417656577809194,16,3,1,0.04307072152534587,128,5,2,0.03860714579193617,256.0,5.0,1.0,0.024184771783017495,128.0,3.0,1.0,,,,5,,,,,,,,PRUNED
19,0.7670401449244678,2026-10-06 11:37:40.618394,2026-10-06 11:38:52.891803,0 days 00:01:12.273409,0.8806110953130223,0.9420651281231285,0.0005087747252350556,7.94574028098002e-06,64.0,0.03788646692531936,16,5,3,0.04488604915021586,32,3,1,0.03134215480389208,128,5,1,0.010162769296756528,128.0,5.0,2.0,,,,,128,0.891314312658893,7.0,4,Adam,,,,46.0,0.7728260869565218,0.7612542028924139,COMPLETE
20,0.30779898691743246,2026-10-06 11:38:53.024979,2026-10-06 11:39:05.556586,0 days 00:00:12.531607,,,,,64.0,0.04434146773740203,16,5,3,0.033555601489618864,64,3,1,0.045275897945435385,32,5,1,0.02430723438926532,64.0,5.0,2.0,0.02417491421120089,512.0,3.0,1.0,128,0.46611297554571707,11.0,5,SGD,0.07423548261306721,0.7025496148252909,1.5821478894942855e-06,,,,PRUNED
21,0.5627666931465678,2026-10-06 11:39:05.690389,2026-10-06 11:39:42.836591,0 days 00:00:37.146202,0.8506062877037555,0.9967439507639335,0.002407413921521261,5.17670270961761e-05,64.0,0.03450714046609262,16,5,3,0.04011258616329395,64,3,1,0.04994863835548238,32,5,1,0.02355786492064929,64.0,5.0,2.0,0.028877131705990697,256.0,3.0,1.0,128,0.5429664266345255,9.0,5,Adam,,,,,,,PRUNED
22,0.7749067354197391,2026-10-06 11:39:42.968847,2026-10-06 11:40:42.812502,0 days 00:00:59.843655,0.8701078719210427,0.9789939801105444,0.0010522188238844341,0.00015661925872525665,64.0,0.0448862315977744,16,5,3,0.04155938362471812,64,3,1,0.041135953200012,32,5,1,0.02034727924173838,64.0,5.0,2.0,0.036430602188730274,256.0,3.0,1.0,128,0.3471820646666154,20.0,5,Adam,,,,46.0,0.782608695652174,0.7672047751873042,COMPLETE
23,0.794632115603811,2026-10-06 11:40:42.947405,2026-10-06 11:41:42.729618,0 days 00:00:59.782213,0.8806840383913358,0.9748262563183668,0.0006382209346108153,0.0007445839211790109,64.0,0.044841308873651606,16,5,3,0.04566114497674971,64,3,1,0.0403201843959313,32,5,1,0.033373779800535665,64.0,5.0,2.0,0.037671941175222046,256.0,3.0,1.0,128,0.3378984260330751,20.0,5,Adam,,,,49.0,0.7956521739130434,0.7936120572945786,COMPLETE
24,0.811284095914212,2026-10-06 11:41:42.865567,2026-10-06 11:42:42.771295,0 days 00:00:59.905728,0.8996487742464244,0.973478734984652,0.00040312399523588776,0.0052891082013398075,64.0,0.04333981275911345,16,5,3,0.04569189691262446,64,3,1,0.034626540784563856,32,5,1,0.033220556843253625,64.0,5.0,2.0,0.046152806014601686,256.0,3.0,1.0,256,0.1034125188774691,20.0,5,Adam,,,,50.0,0.825,0.7975681918284241,COMPLETE
25,0.8184188742051784,2026-10-06 11:42:42.903765,2026-10-06 11:43:43.912839,0 days 00:01:01.009074,0.8892782821195921,0.9795698006776681,0.0003642078915663144,0.007325174363213626,64.0,0.04070860703980199,32,5,3,0.04524290064800988,64,3,1,0.03348599275769725,32,5,1,0.036258997465623784,64.0,5.0,2.0,0.04870850910494715,256.0,3.0,1.0,256,0.14730657037350087,20.0,5,Adam,,,,48.0,0.8260869565217391,0.8107507918886178,COMPLETE
26,,2026-10-06 11:43:44.044776,2026-10-06 11:43:44.116029,0 days 00:00:00.071253,,,,,,0.024526738424039345,32,5,3,0.03786342787754736,64,3,2,0.033627456310369744,32,3,2,0.04474242974009948,128.0,3.0,1.0,0.04802014184318667,256.0,3.0,1.0,,,,5,,,,,,,,PRUNED
27,0.6061940141761477,2026-10-06 11:43:44.248664,2026-10-06 11:44:24.494282,0 days 00:00:40.245618,0.9023345631239363,0.9503113538102578,0.00021783196525930828,0.00967528491302878,64.0,0.040563840534731666,32,5,3,0.04219300941323033,64,3,1,0.026201532908751095,32,5,1,0.037579184027706165,256.0,5.0,2.0,,,,,256,0.11038579901618918,18.0,4,Adam,,,,,,,PRUNED
28,0.7575375468651429,2026-10-06 11:44:24.631092,2026-10-06 11:45:30.094984,0 days 00:01:05.463892,0.9274606937249816,0.9846806951440544,0.0003444392635697454,0.008525735967392385,64.0,0.034736030804479366,32,5,3,0.046541178300182305,32,3,1,0.024471821445207802,32,5,1,0.042238648503227845,64.0,5.0,2.0,0.04408752827190627,512.0,3.0,1.0,256,0.11468975751106751,18.0,5,Adam,,,,48.0,0.7608695652173914,0.7542055285128944,COMPLETE
29,,2026-10-06 11:45:30.229161,2026-10-06 11:45:30.299819,0 days 00:00:00.070658,,,,,,0.03919809996659226,32,5,3,0.03163190289287669,16,5,2,0.033330215039572994,32,3,1,0.027449476759838772,64.0,5.0,2.0,0.04331117606123754,128.0,3.0,1.0,,,,5,,,,,,,,PRUNED
30,0.29401680099683536,2026-10-06 11:45:30.432342,2026-10-06 11:45:39.413222,0 days 00:00:08.980880,0.8939300236418313,0.9731434012282734,0.0001033815451247034,0.002352607219277626,128.0,0.04268932187496741,32,5,3,0.03756954216848256,16,5,1,0.025792872822353357,32,5,1,0.035384997285881216,64.0,3.0,1.0,,,,,256,0.2465605631109602,15.0,4,Adam,,,,,,,PRUNED
31,0.8053545228358396,2026-10-06 11:45:39.545810,2026-10-06 11:46:39.282638,0 days 00:00:59.736828,0.8702735277091609,0.9864811072072924,0.0005551389233491954,0.0020054550516251856,64.0,0.04520143969609518,16,5,3,0.04643064589815307,64,3,1,0.04017826335670778,32,5,1,0.033659811033175745,64.0,5.0,2.0,0.0405904864058511,256.0,3.0,1.0,256,0.3041517562342494,20.0,5,Adam,,,,43.0,0.816304347826087,0.7944046978455922,COMPLETE
32,0.7770564251952701,2026-10-06 11:46:39.416671,2026-10-06 11:47:39.100807,0 days 00:00:59.684136,0.8670983460870345,0.9895395057249972,0.0003002216416487412,0.0033107420865673078,64.0,0.04637824458555834,16,5,3,0.046424553140872515,64,3,1,0.045488821414132505,32,5,1,0.026051030166261566,64.0,5.0,2.0,0.04433335871655513,256.0,3.0,1.0,256,0.2586341457614733,19.0,5,Adam,,,,48.0,0.7815217391304348,0.7725911112601055,COMPLETE
33,0.8011534865705586,2026-10-06 11:47:39.235807,2026-10-06 11:48:38.949518,0 days 00:00:59.713711,0.8658417489541359,0.9720169488426899,0.0006187968974019657,0.0006711008190299186,64.0,0.04246964009250784,16,5,3,0.043146952007275086,64,3,1,0.03452234728607464,32,5,1,0.03507709204217675,64.0,5.0,2.0,0.040703202050757364,256.0,3.0,1.0,256,0.16364000506255327,20.0,5,Adam,,,,50.0,0.8141304347826087,0.7881765383585085,COMPLETE
34,0.8097108321087014,2026-10-06 11:48:39.081487,2026-10-06 11:49:37.776677,0 days 00:00:58.695190,0.8701730271781798,0.9906122776200068,0.0005928905308434312,0.0007305169802110498,64.0,0.03889449657343428,32,5,3,0.03977171926638044,64,3,1,0.03395736612535788,32,3,1,0.035090692129713295,128.0,5.0,2.0,0.040164684528444565,256.0,3.0,1.0,256,0.17323462948631324,20.0,5,Adam,,,,50.0,0.8108695652173913,0.8085520990000116,COMPLETE
35,0.12084706051745006,2026-10-06 11:49:37.908776,2026-10-06 11:49:49.520017,0 days 00:00:11.611241,,,,,64.0,0.03940236313078109,32,5,3,0.039528709227061795,16,3,1,0.03166359427474141,32,3,1,0.038659831733230926,128.0,5.0,2.0,0.040013180986496436,256.0,3.0,1.0,256,0.27929873071704137,18.0,5,SGD,0.06800657499454138,0.9806877471512496,0.007375912279691642,,,,PRUNED
36,0.6144445331463437,2026-10-06 11:49:49.651495,2026-10-06 11:50:47.727803,0 days 00:00:58.076308,0.8894924375564907,0.9903815831778302,0.000417328243306061,0.001013285319699922,64.0,0.03302740482646239,32,5,3,0.01110966085776546,64,5,1,0.027962863341252468,64,3,1,0.042005400802248086,128.0,3.0,1.0,0.04662555230932999,256.0,3.0,1.0,256,0.1002599342505892,19.0,5,Adam,,,,,,,PRUNED
37,,2026-10-06 11:50:47.862463,2026-10-06 11:50:47.940508,0 days 00:00:00.078045,,,,,,0.02838832056535779,32,5,3,0.03570743193995806,32,7,1,0.02367455796919209,32,3,2,0.03316435578413095,128.0,5.0,2.0,0.03229080301598532,256.0,3.0,1.0,,,,5,,,,,,,,PRUNED
38,0.38137768401059763,2026-10-06 11:50:48.074005,2026-10-06 11:50:58.347951,0 days 00:00:10.273946,0.8749638693421344,0.988178219139457,0.00022459961481110575,0.004426161883304063,64.0,0.037846797831111965,32,7,3,0.04677605581591773,64,3,1,0.010295078754732002,32,3,1,0.04044923606395335,128.0,3.0,2.0,,,,,256,0.21023450410900107,19.0,4,Adam,,,,,,,PRUNED
39,,2026-10-06 11:50:58.480675,2026-10-06 11:50:58.543670,0 days 00:00:00.062995,,,,,,0.02861006961928585,32,7,3,0.028087394871675796,64,5,2,0.0355427031643943,64,3,1,0.03072584411263264,128.0,5.0,2.0,0.042156187520897316,512.0,3.0,1.0,,,,5,,,,,,,,PRUNED
40,0.2938142382980258,2026-10-06 11:50:58.676153,2026-10-06 11:51:07.087511,0 days 00:00:08.411358,,,,,128.0,0.04249827110729786,8,5,3,0.03518122737503806,16,7,1,0.04028363431279384,32,3,2,0.04996427840987869,256.0,5.0,1.0,,,,,256,0.29517922255249396,20.0,4,SGD,0.007596321103798129,0.8046757257096796,0.00035682669816070663,,,,PRUNED
41,0.8053584439077388,2026-10-06 11:51:07.219617,2026-10-06 11:52:07.258880,0 days 00:01:00.039263,0.8663902151849746,0.9720980553679225,0.0007377035931794291,0.00042857487130767833,64.0,0.04224447955546474,16,5,3,0.04265174431625708,64,3,1,0.033732713210529,32,5,1,0.03549292007826042,64.0,5.0,2.0,0.0394363755770578,256.0,3.0,1.0,256,0.17229223360138307,20.0,5,Adam,,,,50.0,0.8065217391304348,0.8041951486850428,COMPLETE
42,0.7841008884260672,2026-10-06 11:52:07.392021,2026-10-06 11:53:03.413809,0 days 00:00:56.021788,0.8962467026788118,0.9828410636109117,0.0008978928695989644,0.00024027160239000907,64.0,0.04643142895000207,32,5,3,0.04818043667762162,64,3,1,0.032069805067378734,32,3,1,0.03644208638860414,64.0,5.0,2.0,0.04634770548677465,256.0,3.0,1.0,256,0.16508222657044502,19.0,5,Adam,,,,50.0,0.7847826086956522,0.7834191681564823,COMPLETE
43,0.5295186447954507,2026-10-06 11:53:03.548928,2026-10-06 11:53:26.556260,0 days 00:00:23.007332,0.8653479590749752,0.9781507301533242,0.0006584420149020343,0.0004201309048739728,128.0,0.0395444924039992,8,5,3,0.04025343512850595,64,3,1,0.029297121962880958,32,5,1,0.033629299246538194,128.0,5.0,2.0,0.039315804999050304,256.0,3.0,1.0,256,0.21176336643111154,17.0,5,Adam,,,,,,,PRUNED
44,0.427413428176566,2026-10-06 11:53:26.708489,2026-10-06 11:53:39.915271,0 days 00:00:13.206782,0.8786234605707287,0.9930591041271302,0.0004349723635514236,0.004472528215160116,64.0,0.04805567995231104,16,5,3,0.042835765736340965,64,3,1,0.036192969867397826,32,5,1,0.031228914211971784,64.0,5.0,2.0,0.04993261410626654,256.0,3.0,1.0,256,0.4076590631535324,20.0,5,Adam,,,,,,,PRUNED
45,0.39985463933641197,2026-10-06 11:53:40.051139,2026-10-06 11:53:48.699639,0 days 00:00:08.648500,0.8875615118203983,0.966142601673739,0.0008165292650191532,0.001001320927368215,64.0,0.04209571279367196,16,7,3,0.03835381323947584,64,3,2,0.03893287861496809,32,5,1,,,,,,,,,256,0.15875328592007293,17.0,3,Adam,,,,,,,PRUNED
46,0.8085874729878826,2026-10-06 11:53:48.838949,2026-10-06 11:55:05.460643,0 days 00:01:16.621694,,,,,64.0,0.0118260228054488,8,5,3,0.048166117029582164,32,7,1,0.021118746240191326,64,5,1,0.03911197345657963,256.0,5.0,2.0,0.03345506933408442,128.0,3.0,1.0,512,0.21954618528260694,18.0,5,SGD,0.008947219961939987,0.8083192871427547,1.6005134307843987e-06,48.0,0.816304347826087,0.8008705981496781,COMPLETE
47,0.4260592147591521,2026-10-06 11:55:05.592182,2026-10-06 11:55:19.428017,0 days 00:00:13.835835,,,,,64.0,0.019453280858833424,8,5,3,0.048196009334809296,32,7,1,0.022054811100869647,64,3,1,0.04401221414801615,256.0,3.0,2.0,0.033709682212022356,128.0,3.0,1.0,512,0.22253981205811568,16.0,5,SGD,0.00927464389379523,0.8014180633179372,1.1856309037468526e-06,,,,PRUNED
48,,2026-10-06 11:55:19.561895,2026-10-06 11:55:19.638381,0 days 00:00:00.076486,,,,,,0.014782921565277616,8,7,3,0.021398481671567337,32,7,1,0.01929050774680218,64,5,2,0.040276795307654066,256.0,5.0,2.0,0.03154675123439731,128.0,3.0,1.0,,,,5,,,,,,,,PRUNED
49,0.16797841717588008,2026-10-06 11:55:19.773661,2026-10-06 11:55:33.446208,0 days 00:00:13.672547,,,,,128.0,0.02261300408300036,8,5,3,0.047885431093923715,32,7,1,0.014275875700531963,64,5,1,0.03733963022657056,256.0,5.0,2.0,0.03668853657393956,128.0,3.0,1.0,512,0.15154608586989354,18.0,5,SGD,0.00013152158997287608,0.8006020127445803,0.0004837602564355944,,,,PRUNED
50,0.8212751872702244,2026-10-06 11:55:33.579696,2026-10-06 11:56:50.186575,0 days 00:01:16.606879,,,,,64.0,0.018620020432638024,8,5,3,0.041844480617613235,32,7,1,0.018167911876420702,64,5,1,0.039077910452129105,256.0,5.0,2.0,0.03412446501846037,128.0,3.0,1.0,512,0.19346315674175205,16.0,5,SGD,0.010302457072856009,0.8853283954954806,1.2217847685019409e-05,47.0,0.825,0.8175503745404489,COMPLETE
51,0.8291201227597909,2026-10-06 11:56:50.321402,2026-10-06 11:58:06.916665,0 days 00:01:16.595263,,,,,64.0,0.011111656097654613,8,5,3,0.04234503046729322,32,7,1,0.020665000447018335,64,5,1,0.03913037732333643,256.0,5.0,2.0,0.03421417697270368,128.0,3.0,1.0,512,0.18274521717377015,16.0,5,SGD,0.010854452566453471,0.8688723391073107,5.817162211121828e-06,44.0,0.8434782608695652,0.8147619846500166,COMPLETE
52,0.805198424854155,2026-10-06 11:58:07.052137,2026-10-06 11:59:23.665536,0 days 00:01:16.613399,,,,,64.0,0.011040297878123773,8,5,3,0.045336842383896424,32,7,1,0.01803398005391412,64,5,1,0.04509300405369769,256.0,5.0,2.0,0.03444373514225835,128.0,3.0,1.0,512,0.13517853672762933,14.0,5,SGD,0.011943181370887918,0.8585799504062838,8.731019643208694e-06,48.0,0.8065217391304348,0.8038751105778752,COMPLETE
53,0.8270666439433486,2026-10-06 11:59:23.799452,2026-10-06 12:00:40.482522,0 days 00:01:16.683070,,,,,64.0,0.010096319627933364,8,5,3,0.04057314470798433,32,7,1,0.022193457300963303,64,5,1,0.03913628181220504,256.0,5.0,2.0,0.029596482148890154,128.0,3.0,1.0,512,0.19732700102337242,15.0,5,SGD,0.015602125792437414,0.8591278081761474,6.583938799075364e-06,50.0,0.8391304347826087,0.8150028531040885,COMPLETE
54,0.4135859398489381,2026-10-06 12:00:40.620432,2026-10-06 12:00:56.025916,0 days 00:00:15.405484,,,,,64.0,0.018263302866289955,8,5,3,0.039204892639937546,32,7,1,0.016455376930803827,64,5,1,0.04228825623122143,256.0,5.0,2.0,0.030138404286368176,128.0,3.0,1.0,512,0.19419962542409572,14.0,5,SGD,0.02319831041050396,0.8860579724041853,9.655547077263065e-06,,,,PRUNED
55,0.3648241390956918,2026-10-06 12:00:56.158231,2026-10-06 12:01:11.603837,0 days 00:00:15.445606,,,,,64.0,0.014834254251672237,8,5,3,0.04106310704821333,32,7,1,0.02150899113692946,64,5,1,0.03716926581358728,256.0,5.0,2.0,0.028268971705424202,128.0,3.0,1.0,512,0.2503257011252927,16.0,5,SGD,0.002933547809949056,0.8542016368208221,3.3299485808936706e-05,,,,PRUNED
