number,value,datetime_start,datetime_complete,duration,params_adam_beta1,params_adam_beta2,params_adam_lr,params_adam_wd,params_batch_size,params_block_0_dropout,params_block_0_filters,params_block_0_kernel,params_block_0_stride,params_block_1_dropout,params_block_1_filters,params_block_1_kernel,params_block_1_stride,params_block_2_dropout,params_block_2_filters,params_block_2_kernel,params_block_2_stride,params_block_3_dropout,params_block_3_filters,params_block_3_kernel,params_block_3_stride,params_block_4_dropout,params_block_4_filters,params_block_4_kernel,params_block_4_stride,params_fc_hidden,params_lr_factor,params_lr_patience,params_n_blocks,params_optimizer,params_sgd_lr,params_sgd_momentum,params_sgd_wd,user_attrs_best_epoch,user_attrs_validation_accuracy,user_attrs_validation_macro_f1,state
0,0.24425749632663907,2026-10-05 17:28:30.510642,2026-10-05 17:28:53.963107,0 days 00:00:23.452465,,,,,128.0,0.012323344486727979,8,7,3,0.017336180394137354,16,5,2,0.02465447373174767,64,3,1,0.016820964947491662,128.0,3.0,1.0,,,,,512,0.19763058787582308,12.0,4,SGD,0.00019634341572933326,0.8984275776885255,5.762487216478604e-05,49.0,0.24642857142857144,0.24208642122470672,COMPLETE
1,0.27404223545374545,2026-10-05 17:28:54.102324,2026-10-05 17:29:26.214039,0 days 00:00:32.111715,,,,,128.0,0.041005312934444586,32,5,3,0.02554709158757928,16,7,1,0.012982025747190833,64,3,1,0.04085081386743783,64.0,3.0,1.0,,,,,256,0.36014665762139764,16.0,4,SGD,0.0009833181933644897,0.7184319215829468,1.753594952976443e-05,48.0,0.275,0.2730844709074909,COMPLETE
2,0.3994703892434525,2026-10-05 17:29:26.402277,2026-10-05 17:29:47.749239,0 days 00:00:21.346962,0.9754527819892891,0.9317685471496893,0.0011986281799901185,0.0016973078532467015,200.0,0.030909313175279764,16,7,3,0.019971689165955,16,5,1,0.04232481518257668,64,3,1,,,,,,,,,256,0.18804153962214143,8.0,3,Adam,,,,33.0,0.3982142857142857,0.40072649277261935,COMPLETE
3,0.515962927727472,2026-10-05 17:29:47.881580,2026-10-05 17:30:34.271768,0 days 00:00:46.390188,0.9519502888056603,0.9367415349586534,0.003336101309469784,8.923807143379781e-06,200.0,0.04771638815650077,8,5,3,0.022035132392670787,64,5,1,0.019582475626678898,128,5,1,,,,,,,,,512,0.6058446644748636,15.0,3,Adam,,,,50.0,0.5053571428571428,0.5265687125978012,COMPLETE
4,0.3805689286491891,2026-10-05 17:30:34.416064,2026-10-05 17:31:05.974275,0 days 00:00:31.558211,,,,,64.0,0.03048372233197124,32,7,3,0.014538940849623563,32,3,1,0.01967409163601807,32,3,2,,,,,,,,,512,0.8096691394120938,17.0,3,SGD,0.0011159088550343414,0.9105271468723695,0.0038765111709116325,49.0,0.3821428571428571,0.37899500015552107,COMPLETE
5,,2026-10-05 17:31:06.107847,2026-10-05 17:31:06.160781,0 days 00:00:00.052934,,,,,,0.016432322056699946,8,7,3,0.035985315961888587,32,5,1,0.048920422190097824,32,3,2,0.01780971951192178,128.0,5.0,2.0,0.03581889183628671,128.0,3.0,1.0,,,,5,,,,,,,,PRUNED
6,,2026-10-05 17:31:06.306239,2026-10-05 17:31:06.337168,0 days 00:00:00.030929,,,,,,0.04713274250350902,16,7,3,0.0167797098674437,32,7,2,0.015603360609460961,64,5,1,,,,,,,,,,,,3,,,,,,,,PRUNED
7,,2026-10-05 17:31:06.481063,2026-10-05 17:31:06.523304,0 days 00:00:00.042241,,,,,,0.021743673770579737,8,7,3,0.038078675090308135,64,7,2,0.02862392072529841,64,5,2,0.015082420506075393,256.0,3.0,2.0,,,,,,,,4,,,,,,,,PRUNED
8,,2026-10-05 17:31:06.667542,2026-10-05 17:31:06.709010,0 days 00:00:00.041468,,,,,,0.03125418526272592,8,7,3,0.027558856828225446,64,7,2,0.016257481706843442,128,5,2,0.032174162100456025,256.0,5.0,2.0,,,,,,,,4,,,,,,,,PRUNED
9,,2026-10-05 17:31:06.855374,2026-10-05 17:31:06.899494,0 days 00:00:00.044120,,,,,,0.01464290562027665,8,7,3,0.016928074796400606,64,7,2,0.030125450343203505,128,5,1,0.04760920965699831,64.0,3.0,1.0,,,,,,,,4,,,,,,,,PRUNED
10,0.23358417731782005,2026-10-05 17:31:07.036390,2026-10-05 17:31:18.867952,0 days 00:00:11.831562,0.9068515559725695,0.9652028519024756,0.008094454562649891,1.1990413778055588e-06,200.0,0.047396519251223214,16,5,3,0.04780785829889703,64,3,1,0.03788623593360378,128,5,1,0.03128492670279544,64.0,5.0,2.0,0.010567689211659854,256.0,3.0,1.0,128,0.8770937470127276,5.0,5,Adam,,,,,,,PRUNED
11,0.42303546758211164,2026-10-05 17:31:19.006247,2026-10-05 17:31:42.271116,0 days 00:00:23.264869,0.9743300167552185,0.9304858104215302,0.0020065771485986692,0.0023597424401067394,200.0,0.0354532806144828,16,5,3,0.025746455892697792,16,5,1,0.0488173115584665,128,3,1,,,,,,,,,256,0.5634591201111635,8.0,3,Adam,,,,44.0,0.42142857142857143,0.4246423637356519,COMPLETE
12,0.4308264530818934,2026-10-05 17:31:42.406985,2026-10-05 17:32:08.046271,0 days 00:00:25.639286,0.9680783722699641,0.9236480338033906,0.0022065783639434815,0.0011628680652866746,200.0,0.03992679205436335,16,5,3,0.02674668861238302,16,5,1,0.03665833242089088,128,5,1,,,,,,,,,512,0.579705723946148,13.0,3,Adam,,,,48.0,0.43392857142857144,0.4277243347352154,COMPLETE
13,0.55122997773312,2026-10-05 17:32:08.177369,2026-10-05 17:32:52.980323,0 days 00:00:44.802954,0.933581734417974,0.902071620887885,0.0036672715800356516,1.600007333824542e-05,200.0,0.039196113622823485,16,5,3,0.032883180633573136,64,5,1,0.03503937196749998,128,5,1,,,,,,,,,512,0.6061043142098547,14.0,3,Adam,,,,45.0,0.5428571428571428,0.5596028126090971,COMPLETE
14,0.6405097541000668,2026-10-05 17:32:53.112199,2026-10-05 17:33:39.194373,0 days 00:00:46.082174,0.9140384269048337,0.9009530704679678,0.007684564732577637,1.2931740464554139e-05,200.0,0.042269373600087645,32,5,3,0.034749995572525595,64,5,1,0.022269408534706624,128,5,1,,,,,,,,,512,0.6270318195214168,20.0,3,Adam,,,,46.0,0.6446428571428572,0.6363766510572765,COMPLETE
15,0.5521213253613677,2026-10-05 17:33:39.325094,2026-10-05 17:34:28.879457,0 days 00:00:49.554363,0.9079580691763782,0.9007352240304961,0.0001639198796578031,3.3728610267667366e-05,64.0,0.040718954004602625,32,5,3,0.03562120533462521,64,5,1,0.03250429132208936,128,5,1,,,,,,,,,512,0.7266278620466019,20.0,3,Adam,,,,49.0,0.55,0.5542426507227354,COMPLETE
16,0.4744740109252821,2026-10-05 17:34:29.015168,2026-10-05 17:35:18.728296,0 days 00:00:49.713128,0.8686519500853945,0.9042103513491436,0.00011066458861901487,6.584038955540712e-05,64.0,0.042299962594141156,32,5,3,0.04398770580467641,64,5,1,0.02552033789375153,128,5,1,,,,,,,,,128,0.787636080092639,20.0,3,Adam,,,,48.0,0.46785714285714286,0.4810908789934213,COMPLETE
17,0.6736004517421701,2026-10-05 17:35:18.863680,2026-10-05 17:35:58.944744,0 days 00:00:40.081064,0.9040416600510774,0.9054963357136347,0.00037145354207289546,0.00011896812973004832,64.0,0.025271205739488534,32,5,3,0.04103682069171009,64,3,1,0.010108198384805195,32,5,1,0.027724116912608,128.0,5.0,1.0,,,,,512,0.6939581633775135,20.0,4,Adam,,,,49.0,0.6660714285714285,0.6811294749129116,COMPLETE
18,,2026-10-05 17:35:59.078389,2026-10-05 17:35:59.146628,0 days 00:00:00.068239,,,,,,0.02412112367186019,32,5,3,0.041316583497190536,64,3,1,0.011324589117905817,32,5,2,0.026313178283576738,128.0,5.0,1.0,0.04993986750197682,512.0,3.0,1.0,,,,5,,,,,,,,PRUNED
19,0.6628674022856473,2026-10-05 17:35:59.280733,2026-10-05 17:36:41.166553,0 days 00:00:41.885820,0.8914035631473721,0.9992245447700119,0.0006328276798049737,0.0001792322285375131,64.0,0.02443717405934418,32,5,3,0.04978968044765302,64,3,1,0.021033164298723046,32,5,1,0.04150526698005562,128.0,5.0,1.0,,,,,512,0.44754140707782425,18.0,4,Adam,,,,46.0,0.6607142857142857,0.6650205188570089,COMPLETE
20,0.7013436527067625,2026-10-05 17:36:41.303039,2026-10-05 17:37:22.913362,0 days 00:00:41.610323,,,,,64.0,0.023189164199813594,32,5,3,0.048450285008818955,32,3,1,0.010424809608513712,32,5,1,0.040027190624629394,128.0,5.0,1.0,,,,,512,0.3915460906510256,18.0,4,SGD,0.099501797171425,0.701238065573195,1.2825175665905507e-06,48.0,0.6964285714285714,0.7062587339849536,COMPLETE
21,0.6249995199082659,2026-10-05 17:37:23.045809,2026-10-05 17:38:03.520788,0 days 00:00:40.474979,,,,,64.0,0.023032383342324304,32,5,3,0.04969393491661899,32,3,1,0.010316588508664553,32,5,1,0.04139577533751798,128.0,5.0,1.0,,,,,512,0.39102484266393694,18.0,4,SGD,0.061216229469642613,0.7181552632771508,1.3247649135137908e-06,44.0,0.6125,0.6374990398165317,COMPLETE
22,0.236681194160963,2026-10-05 17:38:03.653780,2026-10-05 17:38:11.887643,0 days 00:00:08.233863,,,,,64.0,0.019403115502643467,32,5,3,0.04501745515632044,32,3,1,0.01487956049671467,32,5,1,0.03955317089447136,128.0,5.0,1.0,,,,,512,0.410844787888295,18.0,4,SGD,0.0822121165902521,0.8194323645877598,0.006255304501300119,,,,PRUNED
23,0.36957590563526155,2026-10-05 17:38:12.021142,2026-10-05 17:38:28.317441,0 days 00:00:16.296299,,,,,64.0,0.025153619230310127,32,5,3,0.04130999433391756,32,3,1,0.017895087497491514,32,5,1,0.048736316622195616,128.0,5.0,1.0,,,,,512,0.46769752096469563,18.0,4,SGD,0.00943953268101916,0.9850941343014012,0.00028380476316389544,,,,PRUNED
24,0.33921844148852226,2026-10-05 17:38:28.452708,2026-10-05 17:38:40.699249,0 days 00:00:12.246541,,,,,64.0,0.0273804197396406,32,5,3,0.04642696554910944,32,3,1,0.013478705059110065,32,5,1,0.03606916541279375,128.0,5.0,1.0,,,,,128,0.2857209238671848,18.0,4,SGD,0.00567349336125424,0.7981797409615192,2.1021015009706397e-06,,,,PRUNED
25,0.7504772716562451,2026-10-05 17:38:40.834609,2026-10-05 17:39:42.204198,0 days 00:01:01.369589,0.8682738550264217,0.9918441949195915,0.00045878401249395775,0.00020009711396435983,64.0,0.01792220812481272,32,5,3,0.04167282023417219,64,3,1,0.010406958414225422,32,5,1,0.02574569917588304,128.0,5.0,1.0,0.01132601582488561,256.0,3.0,1.0,512,0.4863262248343498,16.0,5,Adam,,,,50.0,0.7589285714285714,0.7420259718839188,COMPLETE
26,,2026-10-05 17:39:42.341983,2026-10-05 17:39:42.415709,0 days 00:00:00.073726,,,,,,0.018920803784193866,32,5,3,0.040982803677917956,32,3,2,0.010528794971908142,32,5,2,0.023490268675567322,128.0,5.0,1.0,0.013032184854084129,256.0,3.0,1.0,,,,5,,,,,,,,PRUNED
27,0.7531591121110569,2026-10-05 17:39:42.558748,2026-10-05 17:40:43.275226,0 days 00:01:00.716478,0.8514592188943673,0.9958674084858701,0.00036310869142893863,0.0004252231892673872,64.0,0.01043955303774471,32,5,3,0.03051411287205643,64,3,1,0.01280416250292343,32,5,1,0.02602143446755508,128.0,5.0,1.0,0.027886065247748632,256.0,3.0,1.0,512,0.507843728980337,16.0,5,Adam,,,,45.0,0.7553571428571428,0.750961081364971,COMPLETE
28,0.22261799536638577,2026-10-05 17:40:43.411615,2026-10-05 17:40:59.957817,0 days 00:00:16.546202,,,,,64.0,0.010490168662187748,32,5,3,0.030335661559388067,64,3,1,0.01664845231394939,32,5,1,0.010564700545815365,256.0,5.0,1.0,0.025731778159637918,256.0,3.0,1.0,512,0.5007139244618616,11.0,5,SGD,0.00010271201967080836,0.7960526734796869,0.0006468196619805152,,,,PRUNED
29,0.7716812339572744,2026-10-05 17:41:00.094494,2026-10-05 17:41:27.040718,0 days 00:00:26.946224,0.8524377184647917,0.9980174921726295,0.00033042668118287767,0.0004235478212673874,128.0,0.013868834919184565,32,5,3,0.011393410700732461,32,3,2,0.013517052222617232,32,3,1,0.0221148587997105,128.0,5.0,1.0,0.027770663239953162,256.0,3.0,1.0,128,0.2933218463144752,15.0,5,Adam,,,,49.0,0.7767857142857143,0.7665767536288345,COMPLETE
30,0.7479304559797159,2026-10-05 17:41:27.173708,2026-10-05 17:41:53.904802,0 days 00:00:26.731094,0.8502430995919099,0.9992061523083313,0.0003251523203562309,0.000425498661853564,128.0,0.014900941449773462,32,5,3,0.010671369670716767,16,3,2,0.024288941591590056,32,3,1,0.02239650477627147,128.0,5.0,1.0,0.027407087211881336,256.0,3.0,1.0,128,0.2911946780305241,15.0,5,Adam,,,,48.0,0.7535714285714286,0.7422894833880032,COMPLETE
31,0.7320211994386427,2026-10-05 17:41:54.038319,2026-10-05 17:42:20.764825,0 days 00:00:26.726506,0.85129768831188,0.9993737430033058,0.00029716354481897376,0.00048124620669222216,128.0,0.012885960054378415,32,5,3,0.011210106584084866,16,3,2,0.025152096965059514,32,3,1,0.021725190754865335,128.0,5.0,1.0,0.027601922408317273,256.0,3.0,1.0,128,0.102763581717082,15.0,5,Adam,,,,48.0,0.7375,0.7265423988772854,COMPLETE
32,0.7604303468538538,2026-10-05 17:42:20.896447,2026-10-05 17:42:47.583790,0 days 00:00:26.687343,0.8507252407337333,0.9832365715124488,0.00043209526498985944,0.00039629417419621577,128.0,0.01002922863467773,32,5,3,0.010378744626484625,16,3,2,0.013471173997476679,32,3,1,0.021182926501789153,128.0,5.0,1.0,0.026529010925603655,256.0,3.0,1.0,128,0.3027190783665784,16.0,5,Adam,,,,48.0,0.7553571428571428,0.7655035508505648,COMPLETE
33,0.7511611709154431,2026-10-05 17:42:47.718236,2026-10-05 17:43:14.433728,0 days 00:00:26.715492,0.8714721190550769,0.9808378106998032,0.000658773772789621,0.00711277835764074,128.0,0.010238504245879134,32,5,3,0.022884259777473333,16,3,2,0.01344175239904308,32,3,1,0.025956693908857333,128.0,5.0,1.0,0.022181720428501864,256.0,3.0,1.0,128,0.31166775615747994,16.0,5,Adam,,,,46.0,0.7535714285714286,0.7487509132594576,COMPLETE
34,0.740225137496628,2026-10-05 17:43:14.566504,2026-10-05 17:43:41.194706,0 days 00:00:26.628202,0.8705877032794178,0.9778452425764373,0.000764469973437795,0.004777978899122397,128.0,0.010119414699840481,32,5,3,0.02211700727142022,16,3,2,0.013474306086443474,32,3,1,0.020429218572159794,128.0,5.0,1.0,0.022372047808126207,256.0,3.0,1.0,128,0.2899940608916821,13.0,5,Adam,,,,48.0,0.7446428571428572,0.7358074178503989,COMPLETE
35,0.730858474933118,2026-10-05 17:43:41.327562,2026-10-05 17:44:11.373950,0 days 00:00:30.046388,0.8627137029245856,0.9800514389602216,0.00021438757728424611,0.009969816922119124,128.0,0.012461764820211572,32,5,3,0.013599452324389083,16,3,2,0.018224776064110017,64,3,1,0.02946773756153149,128.0,5.0,1.0,0.0331776749990016,256.0,3.0,1.0,128,0.20345424180590124,16.0,5,Adam,,,,50.0,0.7392857142857143,0.7224312355805215,COMPLETE
36,0.7881354815955672,2026-10-05 17:44:11.509449,2026-10-05 17:44:49.578952,0 days 00:00:38.069503,0.8865445324545882,0.9814200589897112,0.0007138824871941128,0.000566556458534724,128.0,0.014562670129826828,32,5,3,0.01988049604111968,16,3,2,0.012814037576114014,32,3,1,0.024593608792990176,256.0,5.0,1.0,0.020822079093361007,512.0,3.0,1.0,128,0.3344388806662243,14.0,5,Adam,,,,50.0,0.7964285714285714,0.7798423917625631,COMPLETE
37,,2026-10-05 17:44:49.721823,2026-10-05 17:44:49.791140,0 days 00:00:00.069317,,,,,,0.015017091561671188,32,5,3,0.01922477770886862,16,3,2,0.01994765913117203,32,3,2,0.019226002698782732,256.0,3.0,2.0,0.03215105234089818,512.0,3.0,1.0,,,,5,,,,,,,,PRUNED
38,0.7822544534889841,2026-10-05 17:44:49.932218,2026-10-05 17:45:37.166518,0 days 00:00:47.234300,0.8873142177292964,0.9675179092731042,0.0010583990126941192,0.0006059473072578006,128.0,0.01664343615907485,8,7,3,0.013920852158793535,16,3,2,0.014766770478222354,64,3,1,0.024444893139136854,256.0,5.0,1.0,0.018664727813995155,512.0,3.0,1.0,128,0.1877534320242955,11.0,5,Adam,,,,49.0,0.7839285714285714,0.7805803355493968,COMPLETE
39,,2026-10-05 17:45:37.299522,2026-10-05 17:45:37.365311,0 days 00:00:00.065789,,,,,,0.017134593473991912,8,7,3,0.013876450923938558,16,7,2,0.015319994037515496,64,3,1,0.014710867972583898,256.0,5.0,1.0,0.01808719741071438,512.0,3.0,1.0,,,,5,,,,,,,,PRUNED
40,,2026-10-05 17:45:37.504425,2026-10-05 17:45:37.574039,0 days 00:00:00.069614,,,,,,0.02080552276272982,8,7,3,0.01926611537047929,16,3,2,0.018007787301874287,64,3,2,0.02348322447546972,256.0,3.0,1.0,0.017562480043150107,512.0,3.0,1.0,,,,5,,,,,,,,PRUNED
41,0.7905445283246055,2026-10-05 17:45:37.706917,2026-10-05 17:46:25.238928,0 days 00:00:47.532011,0.8851737347441967,0.9664500295544097,0.0009429180689116677,0.0006503545132800367,128.0,0.013307722307604151,8,7,3,0.01219954157585736,16,3,2,0.01261440182528009,64,3,1,0.024142547476663438,256.0,5.0,1.0,0.021992417506150507,512.0,3.0,1.0,128,0.2197270690323593,11.0,5,Adam,,,,49.0,0.8,0.7810890566492111,COMPLETE
42,0.7543814771231615,2026-10-05 17:46:25.372715,2026-10-05 17:47:13.042278,0 days 00:00:47.669563,0.8871694025558248,0.9641700379326847,0.0010338743342121015,0.0007993888655783548,128.0,0.013356266173782877,8,7,3,0.012337990909737534,16,3,2,0.012705966890450344,64,3,1,0.01789674657492922,256.0,5.0,1.0,0.020399733911018073,512.0,3.0,1.0,128,0.21556555501253644,11.0,5,Adam,,,,49.0,0.7732142857142857,0.7355486685320373,COMPLETE
43,0.3940446429588103,2026-10-05 17:47:13.176393,2026-10-05 17:47:24.737240,0 days 00:00:11.560847,0.8871743865035261,0.9662558036678628,0.0011407026068715345,0.0005816209489428934,128.0,0.016273158861773163,8,7,3,0.015603207734885119,16,3,2,0.015179440783482186,64,3,1,0.020408702249312502,256.0,5.0,1.0,0.016610857222672474,512.0,3.0,1.0,128,0.12603784506753407,10.0,5,Adam,,,,,,,PRUNED
44,,2026-10-05 17:47:24.870393,2026-10-05 17:47:24.945355,0 days 00:00:00.074962,,,,,,0.014504705661225656,8,7,3,0.015673771484284164,16,7,2,0.017033238648185255,64,3,1,0.023349258972483664,256.0,5.0,1.0,0.02394282052207296,512.0,3.0,1.0,,,,5,,,,,,,,PRUNED
45,,2026-10-05 17:47:25.080229,2026-10-05 17:47:25.147006,0 days 00:00:00.066777,,,,,,0.020352526005343877,8,7,3,0.010388720230297497,16,3,2,0.02280968599287099,64,3,1,0.02878392640349056,256.0,3.0,2.0,0.03076995285398313,128.0,3.0,1.0,,,,5,,,,,,,,PRUNED
46,0.7947379687252292,2026-10-05 17:47:25.282267,2026-10-05 17:48:12.947487,0 days 00:00:47.665220,0.884306660626896,0.9544353792660412,0.0005375774648274141,0.0002314006181520995,128.0,0.01657515752153206,8,7,3,0.013575679520448055,16,3,2,0.019546358308023523,64,3,1,0.015393689882245213,256.0,5.0,1.0,0.02035244992605746,512.0,3.0,1.0,128,0.23301402898584356,9.0,5,Adam,,,,46.0,0.8,0.7894759374504583,COMPLETE
47,,2026-10-05 17:48:13.082239,2026-10-05 17:48:13.153452,0 days 00:00:00.071213,,,,,,0.016846432235238178,8,7,3,0.017971748688088873,16,7,2,0.01904077150535008,64,3,1,0.01598582328748207,256.0,5.0,1.0,0.019569844767489426,512.0,3.0,1.0,,,,5,,,,,,,,PRUNED
48,,2026-10-05 17:48:13.289573,2026-10-05 17:48:13.354597,0 days 00:00:00.065024,,,,,,0.018284445070468166,8,7,3,0.012922623265900476,16,3,2,0.020751452414458357,64,3,2,0.013832454972669751,256.0,3.0,2.0,0.015758116361643402,512.0,3.0,1.0,,,,5,,,,,,,,PRUNED
49,0.8216216752612766,2026-10-05 17:48:13.489927,2026-10-05 17:48:42.430648,0 days 00:00:28.940721,0.8822615865009736,0.9518253492888011,0.0008128665313171832,0.00021833920166726054,128.0,0.015485139396307461,8,7,3,0.02110845542232981,16,3,2,0.0271040840131709,64,3,1,0.0106184502885174,64.0,5.0,1.0,0.022834552319959858,512.0,3.0,1.0,128,0.16092667454800635,9.0,5,Adam,,,,50.0,0.8267857142857142,0.816457636236839,COMPLETE
50,,2026-10-05 17:48:42.566141,2026-10-05 17:48:42.631460,0 days 00:00:00.065319,,,,,,0.015796043421269848,8,7,3,0.021356947412745974,16,3,2,0.027935082157845445,64,3,1,0.010189651538928838,64.0,5.0,2.0,0.02161311664421903,512.0,3.0,1.0,,,,5,,,,,,,,PRUNED
51,0.757014975517509,2026-10-05 17:48:42.764463,2026-10-05 17:49:11.724177,0 days 00:00:28.959714,0.8825973163247078,0.9549171306187032,0.0008573256750953394,0.0001858490556796498,128.0,0.012439510328973268,8,7,3,0.023654407269996017,16,3,2,0.027589607616363584,64,3,1,0.012716579175408813,64.0,5.0,1.0,0.0239619944361905,512.0,3.0,1.0,128,0.23049968254623754,9.0,5,Adam,,,,49.0,0.7714285714285715,0.7426013796064465,COMPLETE
52,0.7215671481585582,2026-10-05 17:49:11.860929,2026-10-05 17:49:40.781779,0 days 00:00:28.920850,0.8958660961316149,0.9549136019754306,0.0013721842630259778,0.001128395321632488,128.0,0.013785810481762337,8,7,3,0.015560089956816493,16,3,2,0.011910661703028383,64,3,1,0.017406593953368063,64.0,5.0,1.0,0.01988873680329781,512.0,3.0,1.0,128,0.18070597660668258,7.0,5,Adam,,,,43.0,0.7303571428571428,0.7127771534599735,COMPLETE
53,0.7672778615049328,2026-10-05 17:49:40.914123,2026-10-05 17:50:28.359201,0 days 00:00:47.445078,0.8790393818732999,0.9504155189854815,0.0006216216170027324,0.0002914291227599745,128.0,0.020936378918036888,8,7,3,0.017561975666380458,16,3,2,0.0166213843307181,64,3,1,0.012512980084336274,256.0,5.0,1.0,0.014575600596686172,512.0,3.0,1.0,128,0.1686529058875551,10.0,5,Adam,,,,48.0,0.775,0.7595557230098656,COMPLETE
54,0.7802067885331212,2026-10-05 17:50:28.495424,2026-10-05 17:50:53.405457,0 days 00:00:24.910033,0.894724741974781,0.9725903114654272,0.001698023940739008,0.0001042160999290153,128.0,0.01801826783008764,16,7,3,0.011836804223171021,32,3,2,0.014348166693502102,64,3,1,0.03097184657065361,64.0,5.0,1.0,0.023860571752907518,128.0,3.0,1.0,256,0.24193033638105366,12.0,5,Adam,,,,46.0,0.7928571428571428,0.7675564342090997,COMPLETE
55,,2026-10-05 17:50:53.538893,2026-10-05 17:50:53.603945,0 days 00:00:00.065052,,,,,,0.019631349715465964,16,7,3,0.020743461122315503,16,5,2,0.0427023625747613,64,3,1,0.03331906300837553,64.0,5.0,1.0,0.02349723348937971,128.0,3.0,1.0,,,,5,,,,,,,,PRUNED
56,0.4095268748129528,2026-10-05 17:50:53.745595,2026-10-05 17:50:59.251547,0 days 00:00:05.505952,0.8940254870670278,0.9721082834591264,0.0016689500956252263,8.937712068266911e-05,128.0,0.0223433173791609,16,7,3,0.014823646168744911,16,3,2,0.031371396196946795,64,3,1,0.03469517339325578,64.0,5.0,1.0,0.019517856557937297,128.0,3.0,1.0,256,0.14900464753791043,12.0,5,Adam,,,,,,,PRUNED
57,,2026-10-05 17:50:59.389610,2026-10-05 17:50:59.498818,0 days 00:00:00.109208,,,,,,0.017366245964127062,16,7,3,0.024874016343081593,32,7,2,0.022154024407205403,64,3,1,0.030922099426153284,64.0,5.0,1.0,0.02477536873206076,128.0,3.0,1.0,,,,5,,,,,,,,PRUNED
