number,value,datetime_start,datetime_complete,duration,params_adam_beta1,params_adam_beta2,params_adam_lr,params_adam_wd,params_batch_size,params_block_0_dropout,params_block_0_filters,params_block_0_kernel,params_block_0_stride,params_block_1_dropout,params_block_1_filters,params_block_1_kernel,params_block_1_stride,params_block_2_dropout,params_block_2_filters,params_block_2_kernel,params_block_2_stride,params_block_3_dropout,params_block_3_filters,params_block_3_kernel,params_block_3_stride,params_block_4_dropout,params_block_4_filters,params_block_4_kernel,params_block_4_stride,params_fc_hidden,params_lr_factor,params_lr_patience,params_n_blocks,params_optimizer,params_sgd_lr,params_sgd_momentum,params_sgd_wd,user_attrs_best_epoch,user_attrs_validation_accuracy,user_attrs_validation_macro_f1,state
58,0.7479101738143921,2026-10-05 17:50:59.639877,2026-10-05 17:51:36.680836,0 days 00:00:37.040959,0.898642709537565,0.9586082332499265,0.0009419885608185508,0.0021685521800690714,128.0,0.04933011942848325,16,7,3,0.018217371670096773,16,3,2,0.015023390082762149,64,3,1,0.03785419443394569,256.0,3.0,1.0,0.019087099185824307,512.0,3.0,1.0,256,0.24516157981896186,8.0,5,Adam,,,,49.0,0.7517857142857143,0.74403463334307,COMPLETE
59,,2026-10-05 17:51:36.814819,2026-10-05 17:51:36.880845,0 days 00:00:00.066026,,,,,,0.01178915531691249,8,7,3,0.01650577943270083,32,3,2,0.03346244135841511,64,3,2,0.028345821483785547,64.0,5.0,1.0,0.04445388012534915,128.0,3.0,1.0,,,,5,,,,,,,,PRUNED
60,,2026-10-05 17:51:37.015522,2026-10-05 17:51:37.086744,0 days 00:00:00.071222,,,,,,0.015589216310921642,8,7,3,0.012545913168256961,16,5,2,0.011823451821864927,64,3,1,0.04362731410211089,256.0,5.0,2.0,0.013507985856243455,512.0,3.0,1.0,,,,5,,,,,,,,PRUNED
61,0.7798396443084672,2026-10-05 17:51:37.220898,2026-10-05 17:52:06.089906,0 days 00:00:28.869008,0.8785134139339167,0.9466284341622001,0.0005273566239119163,0.0002469239910085035,128.0,0.01844791432251671,16,7,3,0.01184061860028881,32,3,2,0.014003845013534235,64,3,1,0.02482217911200661,64.0,5.0,1.0,0.02152351972768115,512.0,3.0,1.0,256,0.34106323087495977,12.0,5,Adam,,,,39.0,0.7875,0.7721792886169344,COMPLETE
62,0.8009628957408039,2026-10-05 17:52:06.225903,2026-10-05 17:52:35.794455,0 days 00:00:29.568552,0.877252933989702,0.9451742625949109,0.0005441858901241638,5.12605406918296e-05,128.0,0.018446595768369597,16,7,3,0.012170436675934993,32,3,2,0.014580844388033998,64,3,1,0.02749757230014136,64.0,5.0,1.0,0.021587966571846254,512.0,3.0,1.0,256,0.3480011522218605,12.0,5,Adam,,,,49.0,0.8125,0.7894257914816079,COMPLETE
63,0.7884644761796776,2026-10-05 17:52:35.927677,2026-10-05 17:53:05.558350,0 days 00:00:29.630673,0.8799308213060215,0.9438033248633594,0.0013704761493618233,3.425852133614219e-05,128.0,0.016274378849337925,16,7,3,0.014059439285775086,32,3,2,0.011856308662590314,64,3,1,0.030591142711691183,64.0,5.0,1.0,0.021978194545003018,512.0,3.0,1.0,256,0.25388306265560034,11.0,5,Adam,,,,48.0,0.7982142857142858,0.7787146666450695,COMPLETE
64,0.7897254542115417,2026-10-05 17:53:05.691550,2026-10-05 17:53:35.399032,0 days 00:00:29.707482,0.8772111889365236,0.9425554509165903,0.0012623284397957131,3.7840522636109795e-05,128.0,0.011874916500112232,16,7,3,0.0139035638914986,32,3,2,0.011992074529691678,64,3,1,0.027537830354107437,64.0,5.0,1.0,0.017054590876024924,512.0,3.0,1.0,256,0.35229462986731347,11.0,5,Adam,,,,48.0,0.8,0.7794509084230835,COMPLETE
65,0.7777694541452996,2026-10-05 17:53:35.536001,2026-10-05 17:54:05.052542,0 days 00:00:29.516541,0.8780286171416527,0.939828259542164,0.0013572702207222522,3.531808097539221e-05,128.0,0.011266392558212435,16,7,3,0.016868941762883276,32,3,2,0.011955997270308561,64,3,1,0.02741060143685574,64.0,5.0,1.0,0.01182119650899051,512.0,3.0,1.0,256,0.35242080235079715,10.0,5,Adam,,,,49.0,0.7857142857142857,0.7698246225763136,COMPLETE
66,0.7698539720667356,2026-10-05 17:54:05.187872,2026-10-05 17:54:34.761039,0 days 00:00:29.573167,0.8616807128207308,0.94328242064894,0.0007576914130474399,3.837040608432386e-05,128.0,0.01435025843956836,16,7,3,0.01999938898504362,32,3,2,0.016043576518790584,64,3,1,0.03266821607987793,64.0,5.0,1.0,0.016070416397583186,512.0,3.0,1.0,256,0.2569833441058696,13.0,5,Adam,,,,48.0,0.7785714285714286,0.7611365155620425,COMPLETE
67,0.38468309556424096,2026-10-05 17:54:34.896560,2026-10-05 17:54:41.531911,0 days 00:00:06.635351,0.8768444259329206,0.9350332855294685,0.002418666063705236,4.870360881008129e-05,128.0,0.012031525394653719,16,7,3,0.014761474227689381,32,3,2,0.011227339701378836,128,3,1,0.02745342071762109,64.0,5.0,1.0,0.021258207998947915,512.0,3.0,1.0,256,0.3405061304079924,9.0,5,Adam,,,,,,,PRUNED
68,0.755543662176351,2026-10-05 17:54:41.666168,2026-10-05 17:55:11.186550,0 days 00:00:29.520382,0.8836275139513015,0.929998553268593,0.0005535692474563805,6.044258476997367e-06,128.0,0.015359525781249914,16,7,3,0.01877346526835682,32,3,2,0.041050447944052465,64,3,1,0.029394215689874357,64.0,5.0,1.0,0.02624127169870835,512.0,3.0,1.0,256,0.42671061875093885,7.0,5,Adam,,,,46.0,0.7607142857142857,0.7503730386384164,COMPLETE
69,0.787187764716343,2026-10-05 17:55:11.322750,2026-10-05 17:55:40.858756,0 days 00:00:29.536006,0.9233797918091875,0.9466642070979354,0.0012996049702322036,2.2251252211118815e-05,128.0,0.026455530536983622,16,7,3,0.010053215315603922,32,3,2,0.026773357368900713,64,3,1,0.011406996820098143,64.0,5.0,1.0,0.022725276594668473,512.0,3.0,1.0,256,0.3827423038199812,9.0,5,Adam,,,,48.0,0.7910714285714285,0.7833041008612575,COMPLETE
70,,2026-10-05 17:55:40.991323,2026-10-05 17:55:41.060148,0 days 00:00:00.068825,,,,,,0.019972295110076848,16,7,3,0.01335805396914208,32,5,2,0.017494894895908872,64,3,1,0.02671440282260555,64.0,5.0,1.0,0.025621349375303647,512.0,3.0,1.0,,,,5,,,,,,,,PRUNED
71,0.417799121880633,2026-10-05 17:55:41.195993,2026-10-05 17:55:47.184758,0 days 00:00:05.988765,0.9258162856133485,0.9478640164870727,0.0014525701091515574,1.9673586259267115e-05,128.0,0.03816886864193319,16,7,3,0.010305043610536937,32,3,2,0.026546035689743456,64,3,1,0.01121209784539163,64.0,5.0,1.0,0.022805251061325294,512.0,3.0,1.0,256,0.37527045538714965,9.0,5,Adam,,,,,,,PRUNED
72,0.7881152435731329,2026-10-05 17:55:47.317203,2026-10-05 17:56:16.927903,0 days 00:00:29.610700,0.924948779870457,0.9420966001901449,0.0008681970141548059,7.1725686826818914e-06,128.0,0.027660934192383205,16,7,3,0.016014291534393987,32,3,2,0.029318184985898454,64,3,1,0.011940326941265957,64.0,5.0,1.0,0.028761140195544443,512.0,3.0,1.0,256,0.33782928278191476,11.0,5,Adam,,,,50.0,0.7857142857142857,0.79051620143198,COMPLETE
73,0.4185400157427402,2026-10-05 17:56:17.063998,2026-10-05 17:56:23.515806,0 days 00:00:06.451808,0.946436535345174,0.9409126585328451,0.000841740066555912,4.908959124350217e-06,200.0,0.029259754145390768,16,7,3,0.0163964538472749,32,3,2,0.029105550452455962,64,3,1,0.013734438118819468,64.0,5.0,1.0,0.030895433448306257,512.0,3.0,1.0,256,0.26429031691593774,11.0,5,Adam,,,,,,,PRUNED
74,0.7833965552890537,2026-10-05 17:56:23.648778,2026-10-05 17:56:53.274555,0 days 00:00:29.625777,0.9020332587319239,0.9523336897207689,0.0007695929753910724,2.6826029426067003e-06,128.0,0.0324269651474355,16,7,3,0.014596441859962332,32,3,2,0.030333027136213046,64,3,1,0.01869742804073575,64.0,5.0,1.0,0.03745690209911394,512.0,3.0,1.0,256,0.33136217654690664,14.0,5,Adam,,,,50.0,0.7875,0.7792931105781075,COMPLETE
75,0.7919791361615964,2026-10-05 17:56:53.409483,2026-10-05 17:57:26.156487,0 days 00:00:32.747004,0.9628603705629428,0.9590704650121782,0.0004957448215332355,9.907116300662408e-06,128.0,0.03610367685983215,16,7,3,0.01741367292432324,32,3,2,0.0237299256252598,128,3,1,0.015862731681128575,64.0,5.0,1.0,0.029270888317632193,512.0,3.0,1.0,256,0.15047400883451578,10.0,5,Adam,,,,49.0,0.7964285714285714,0.7875297008946214,COMPLETE
76,,2026-10-05 17:57:26.290330,2026-10-05 17:57:26.355020,0 days 00:00:00.064690,,,,,,0.033762336964631545,16,7,3,0.017373803369245582,32,3,2,0.019271449530650835,128,3,2,0.01588929522914813,64.0,5.0,1.0,0.017512188418346418,512.0,3.0,1.0,,,,5,,,,,,,,PRUNED
77,0.4138658424040768,2026-10-05 17:57:26.489228,2026-10-05 17:57:39.337440,0 days 00:00:12.848212,0.98601178461778,0.959931136301467,0.00044295429801293314,6.0748476433974787e-05,128.0,0.044199978811491854,16,7,3,0.02077280945657167,32,3,2,0.021782886595743685,128,3,1,0.030365050450868132,256.0,5.0,1.0,0.03623634758994095,512.0,3.0,1.0,256,0.14882830259571989,10.0,5,Adam,,,,,,,PRUNED
78,0.4977859730554838,2026-10-05 17:57:39.473338,2026-10-05 17:57:49.997982,0 days 00:00:10.524644,0.8730206926679436,0.9597500462680179,0.0005367101284056967,1.200083719104971e-05,128.0,0.037674841727822664,8,7,3,0.02398769584938137,32,3,2,0.02290637997130484,128,3,1,0.02481137757684703,64.0,3.0,1.0,0.020654259907925535,512.0,3.0,1.0,256,0.2104859740874111,13.0,5,Adam,,,,,,,PRUNED
79,,2026-10-05 17:57:50.133688,2026-10-05 17:57:50.207105,0 days 00:00:00.073417,,,,,,0.04569346568451463,16,7,3,0.019694322133170912,32,7,2,0.02370911037225073,128,3,1,0.0164747636729321,256.0,5.0,1.0,0.02938036364364141,512.0,3.0,1.0,,,,5,,,,,,,,PRUNED
80,0.4083913057809458,2026-10-05 17:57:50.340653,2026-10-05 17:57:59.212534,0 days 00:00:08.871881,0.9513932768263123,0.9364497339696096,0.0006770605567847183,0.0010099652939586246,200.0,0.013525693855098967,8,7,3,0.013136015654657978,16,3,2,0.0128114931700783,128,3,1,0.01925533720354314,256.0,5.0,1.0,,,,,128,0.15399132483284877,8.0,4,Adam,,,,,,,PRUNED
81,0.5006957303905982,2026-10-05 17:57:59.346602,2026-10-05 17:58:08.295549,0 days 00:00:08.948947,0.9104241968758777,0.9436743111018095,0.0009512258280299925,6.034451974810561e-06,128.0,0.03034357310593147,16,7,3,0.01574541515662501,32,3,2,0.029446781323397096,64,3,1,0.012330935729407543,64.0,5.0,1.0,0.033398042219412456,512.0,3.0,1.0,256,0.26849262330306356,11.0,5,Adam,,,,,,,PRUNED
82,0.3071757054810419,2026-10-05 17:58:08.431417,2026-10-05 17:58:14.463391,0 days 00:00:06.031974,0.9665649306998702,0.9260206941871129,0.0027208758007569687,3.004641414272077e-06,128.0,0.028512193231478807,16,7,3,0.014231719138587805,32,3,2,0.010141914956777607,64,3,1,0.012897639447427927,64.0,5.0,1.0,0.029111674251147596,512.0,3.0,1.0,256,0.32134314501952854,10.0,5,Adam,,,,,,,PRUNED
83,0.7766017562763751,2026-10-05 17:58:14.615129,2026-10-05 17:58:44.075564,0 days 00:00:29.460435,0.862064306483643,0.9529331352411216,0.0018190501779144367,2.4501509723787672e-05,128.0,0.01137025551977315,16,7,3,0.02208594886765943,32,3,2,0.024997783146336855,64,3,1,0.014173137524063212,64.0,5.0,1.0,0.02755016566746779,512.0,3.0,1.0,256,0.10788436490747433,12.0,5,Adam,,,,50.0,0.7785714285714286,0.7746320839813216,COMPLETE
84,0.7826567012139655,2026-10-05 17:58:44.209180,2026-10-05 17:59:13.738548,0 days 00:00:29.529368,0.8890364886868838,0.9489172377213093,0.0004857209926061158,6.849676181399987e-05,128.0,0.03549703524690887,16,7,3,0.018324958671155786,32,3,2,0.02613912150078919,64,3,1,0.025588002477043226,64.0,5.0,1.0,0.01774435958173383,512.0,3.0,1.0,256,0.3688515435481734,11.0,5,Adam,,,,46.0,0.7857142857142857,0.7795991167136452,COMPLETE
85,,2026-10-05 17:59:13.874478,2026-10-05 17:59:13.944338,0 days 00:00:00.069860,,,,,,0.021572169416473608,16,7,3,0.012656886680450901,32,3,2,0.02056589047442592,64,3,1,0.01474651144512931,64.0,5.0,2.0,0.0256751122004546,512.0,3.0,1.0,,,,5,,,,,,,,PRUNED
86,0.3153536475580334,2026-10-05 17:59:14.080187,2026-10-05 17:59:25.516796,0 days 00:00:11.436609,,,,,128.0,0.016265903155187465,8,7,3,0.011280406564856852,16,3,2,0.011295153287282492,128,3,1,0.02321893000506525,256.0,5.0,1.0,0.02086019043322318,512.0,3.0,1.0,128,0.4331604246966523,14.0,5,SGD,0.011130468911759507,0.9747616438914666,1.5306234015369517e-05,,,,PRUNED
87,0.7941702010075278,2026-10-05 17:59:25.653887,2026-10-05 17:59:55.457665,0 days 00:00:29.803778,0.9397337943512014,0.9860774910372209,0.0011357516358076415,1.0529610737686944e-05,128.0,0.013454965714940932,16,7,3,0.028137228225480433,64,3,2,0.015748086318243277,64,3,1,0.010159250280077687,64.0,5.0,1.0,0.028954797672292882,512.0,3.0,1.0,128,0.22819947158382115,12.0,5,Adam,,,,50.0,0.7910714285714285,0.7972689734436269,COMPLETE
88,,2026-10-05 17:59:55.592389,2026-10-05 17:59:55.659487,0 days 00:00:00.067098,,,,,,0.012576735650793982,8,7,3,0.027424780132975123,64,3,2,0.016071058126680277,64,3,2,0.010304652869318308,256.0,5.0,1.0,0.014937110783134635,256.0,3.0,1.0,,,,5,,,,,,,,PRUNED
89,0.38964174712170874,2026-10-05 17:59:55.794080,2026-10-05 18:00:01.453976,0 days 00:00:05.659896,0.9626560810207583,0.9871404326344803,0.0011941023577424147,1.1658273710918184e-05,128.0,0.015161828202300349,16,7,3,0.014982478606324222,64,3,2,0.012380760014852363,64,3,1,0.03185594095529244,64.0,3.0,1.0,0.024861709408368415,512.0,3.0,1.0,128,0.22748572483822235,7.0,5,Adam,,,,,,,PRUNED
90,,2026-10-05 18:00:01.590212,2026-10-05 18:00:01.659654,0 days 00:00:00.069442,,,,,,0.013358109663172241,8,7,3,0.03341583473205937,64,5,2,0.01830863701774327,64,3,1,0.021256407117288555,64.0,5.0,1.0,0.018491643470741025,512.0,3.0,1.0,,,,5,,,,,,,,PRUNED
91,0.7822263868885422,2026-10-05 18:00:01.805104,2026-10-05 18:00:31.609991,0 days 00:00:29.804887,0.9361983884513412,0.991404319155016,0.0006379136771451659,6.9589012893772036e-06,128.0,0.017350549797968885,16,7,3,0.038622780448096805,64,3,2,0.014431980174043936,64,3,1,0.011310080735431704,64.0,5.0,1.0,0.029048757392770873,512.0,3.0,1.0,128,0.18085111700044973,10.0,5,Adam,,,,49.0,0.7839285714285714,0.780524202348513,COMPLETE
92,0.7868057521576697,2026-10-05 18:00:31.745720,2026-10-05 18:01:01.586036,0 days 00:00:29.840316,0.8828227449768138,0.9428990744876219,0.0009501135696948679,0.0001529645175605447,128.0,0.014185873205414664,16,7,3,0.02940232358468251,64,3,2,0.013108231876294122,64,3,1,0.01343280858453334,64.0,5.0,1.0,0.022275699416694616,512.0,3.0,1.0,128,0.2811028292284282,11.0,5,Adam,,,,45.0,0.7910714285714285,0.7825400757439109,COMPLETE
93,0.5895514009126903,2026-10-05 18:01:01.736005,2026-10-05 18:01:14.609289,0 days 00:00:12.873284,0.9157237371753709,0.9853596426583373,0.0003860363273163974,9.577913575745578e-06,128.0,0.011078176663813312,16,7,3,0.016232817991959917,16,3,2,0.015547216817163655,64,3,1,0.011881206349659027,64.0,5.0,1.0,0.03228245583126769,512.0,3.0,1.0,128,0.13166903463205026,12.0,5,Adam,,,,,,,PRUNED
94,0.7824718239109176,2026-10-05 18:01:14.745330,2026-10-05 18:01:44.281545,0 days 00:00:29.536215,0.8731168228243863,0.9387678783992708,0.0007436937016048532,3.646747022391168e-06,128.0,0.018959207611228664,16,7,3,0.013720055703651446,32,3,2,0.017019609191357494,64,3,1,0.015189455876689219,64.0,5.0,1.0,0.020103510032543355,512.0,3.0,1.0,128,0.2039640505950805,11.0,5,Adam,,,,49.0,0.7839285714285714,0.7810150763932638,COMPLETE
95,0.4395391408373278,2026-10-05 18:01:44.417291,2026-10-05 18:01:54.100870,0 days 00:00:09.683579,0.9415239357592602,0.9575314637171466,0.0011111780631469581,1.758220485524179e-05,128.0,0.014681121118450205,16,7,3,0.02591822660994511,16,3,2,0.028063744725987404,64,3,1,0.030103061569267713,256.0,5.0,1.0,0.027198751429560016,512.0,3.0,1.0,256,0.4094147083907125,8.0,5,Adam,,,,,,,PRUNED
96,,2026-10-05 18:01:54.236989,2026-10-05 18:01:54.315553,0 days 00:00:00.078564,,,,,,0.0129960761559606,8,7,3,0.012364224842868424,16,7,2,0.03115985055892621,32,3,1,0.028249155020464975,64.0,5.0,2.0,0.030296255913804616,512.0,3.0,1.0,,,,5,,,,,,,,PRUNED
97,0.812219821330729,2026-10-05 18:01:54.450301,2026-10-05 18:02:42.606395,0 days 00:00:48.156094,0.9594218260605676,0.9749732130031699,0.0002788370593762485,2.7801324914435174e-05,128.0,0.01593974482373063,16,7,3,0.02902921778840216,32,3,2,0.01436710357364189,64,3,1,0.010233123340032861,256.0,5.0,1.0,0.024674338134670643,512.0,3.0,1.0,128,0.31377683515399507,13.0,5,Adam,,,,48.0,0.825,0.7994396426614582,COMPLETE
98,0.2751411767057882,2026-10-05 18:02:42.739060,2026-10-05 18:02:52.572599,0 days 00:00:09.833539,,,,,200.0,0.016453289886779836,16,7,3,0.029564711486792242,64,3,2,0.014006848738694375,128,3,1,0.010156135167193802,256.0,5.0,1.0,0.02337575034988601,256.0,3.0,1.0,128,0.3002057323296559,14.0,5,SGD,0.0006049648023942305,0.8749592322115233,0.0008509237473346497,,,,PRUNED
99,0.4406114625024351,2026-10-05 18:02:52.706564,2026-10-05 18:03:02.433314,0 days 00:00:09.726750,0.9566978241173685,0.9728797940021852,0.0002483183733885373,3.0147914314912584e-05,128.0,0.015853804046730344,8,5,3,0.028663212232137532,16,3,2,0.011695519683913217,64,3,1,0.026890165456452335,256.0,5.0,1.0,0.024667887043892653,512.0,3.0,1.0,128,0.23432666279795042,13.0,5,Adam,,,,,,,PRUNED
