number,value,datetime_start,datetime_complete,duration,params_adam_beta1,params_adam_beta2,params_adam_lr,params_adam_wd,params_batch_size,params_fc_dropout,params_fc_hidden,params_gru_hidden,params_lr_factor,params_lr_patience,params_optimizer,params_sgd_lr,params_sgd_momentum,params_sgd_wd,user_attrs_best_epoch,user_attrs_validation_accuracy,user_attrs_validation_macro_f1,state
0,1.0,2026-10-08 17:36:31.067484,2026-10-08 17:36:53.659837,0 days 00:00:22.592353,,,,,128,0.34044600469728353,512,128,0.24545997376568052,7,SGD,0.0812324508558869,0.9414083658321223,7.068974950624607e-06,2.0,1.0,1.0,COMPLETE
1,1.0,2026-10-08 17:36:53.799105,2026-10-08 17:37:24.600469,0 days 00:00:30.801364,,,,,64,0.3056937753654446,256,128,0.8591084298026667,20,SGD,0.006647135865318031,0.7494519958693145,1.8205657658407268e-06,3.0,1.0,1.0,COMPLETE
2,1.0,2026-10-08 17:37:24.742117,2026-10-08 17:37:56.339620,0 days 00:00:31.597503,0.958518595270556,0.9938559442622625,0.00023426581058204064,0.00755681014127443,64,0.2246844304357644,128,64,0.815861880342119,14,Adam,,,,2.0,1.0,1.0,COMPLETE
3,1.0,2026-10-08 17:37:56.482203,2026-10-08 17:38:15.715134,0 days 00:00:19.232931,,,,,200,0.15636968998990508,64,256,0.10441769369888193,18,SGD,0.09133995846860977,0.9239509830960306,6.235377135673162e-06,1.0,1.0,1.0,COMPLETE
4,1.0,2026-10-08 17:38:15.856585,2026-10-08 17:38:38.785693,0 days 00:00:22.929108,,,,,128,0.23007332881069884,64,512,0.670595829778396,17,SGD,0.04588156549160976,0.8369423282969652,3.0086868214458464e-06,1.0,1.0,1.0,COMPLETE
5,1.0,2026-10-08 17:38:38.928535,2026-10-08 17:38:58.411524,0 days 00:00:19.482989,0.860777187376031,0.9289461701460855,0.0032441600887341587,8.22607494622104e-06,200,0.4630265895704372,128,64,0.22897702980320356,19,Adam,,,,1.0,1.0,1.0,COMPLETE
6,1.0,2026-10-08 17:38:58.552993,2026-10-08 17:39:21.789669,0 days 00:00:23.236676,0.9215046223608592,0.941699359214563,0.005265761277157428,1.0661259689433902e-06,128,0.1911740650167767,128,256,0.2776862483765842,6,Adam,,,,1.0,1.0,1.0,COMPLETE
7,1.0,2026-10-08 17:39:21.930977,2026-10-08 17:39:45.408266,0 days 00:00:23.477289,0.8890105049931256,0.9907357620080687,0.0010124137770478635,1.6066267921727714e-06,128,0.21393619775098704,64,512,0.29164951253357796,7,Adam,,,,1.0,1.0,1.0,COMPLETE
8,0.6937313819844177,2026-10-08 17:39:45.552004,2026-10-08 17:39:49.496225,0 days 00:00:03.944221,,,,,200,0.13611590802176332,256,128,0.642051489473826,5,SGD,0.0003627066608804413,0.7118247910508815,0.00023097861492693574,,,,PRUNED
9,1.0,2026-10-08 17:39:49.643188,2026-10-08 17:40:21.879040,0 days 00:00:32.235852,0.9241510809698409,0.9241610438609551,0.004309673808203458,0.00016626592254031863,64,0.45093574135239245,512,512,0.17448221424471938,19,Adam,,,,2.0,1.0,1.0,COMPLETE
10,0.895569354451359,2026-10-08 17:40:22.023061,2026-10-08 17:40:26.638053,0 days 00:00:04.614992,,,,,128,0.3784471213433284,512,128,0.42621278356998393,10,SGD,0.00012637268261792882,0.9632227906319301,0.0069037170554346996,,,,PRUNED
11,1.0,2026-10-08 17:40:26.779232,2026-10-08 17:40:57.571907,0 days 00:00:30.792675,,,,,64,0.33088253227075864,256,128,0.897983462713807,13,SGD,0.006500680205231919,0.7082391522748519,1.12480264296506e-06,3.0,1.0,1.0,COMPLETE
12,1.0,2026-10-08 17:40:57.719239,2026-10-08 17:41:28.604565,0 days 00:00:30.885326,,,,,64,0.33095547714973483,256,128,0.47129274322054915,10,SGD,0.0069527727260754015,0.8226334120666466,2.260939122696824e-05,3.0,1.0,1.0,COMPLETE
13,1.0,2026-10-08 17:41:28.747127,2026-10-08 17:41:59.659915,0 days 00:00:30.912788,,,,,64,0.2933550045765471,512,128,0.5383950547702598,15,SGD,0.008311692998519249,0.8338074034511974,2.7340679272843e-05,2.0,1.0,1.0,COMPLETE
14,0.9983806975807064,2026-10-08 17:41:59.802818,2026-10-08 17:42:04.462651,0 days 00:00:04.659833,,,,,128,0.4016892705844455,256,128,0.7357162912896711,10,SGD,0.0015543415970421359,0.8927392115942876,2.0464153798486234e-05,,,,PRUNED
15,1.0,2026-10-08 17:42:04.606596,2026-10-08 17:42:27.469761,0 days 00:00:22.863165,,,,,128,0.2704124898114272,512,128,0.41373566355554947,12,SGD,0.02866538450261492,0.7692481501878534,1.0048802521731842e-06,1.0,1.0,1.0,COMPLETE
16,1.0,2026-10-08 17:42:27.610930,2026-10-08 17:42:58.580236,0 days 00:00:30.969306,,,,,64,0.3790020993591327,256,128,0.599797007271762,20,SGD,0.0015770063038952262,0.9702268778426302,0.0001353113314143317,2.0,1.0,1.0,COMPLETE
17,1.0,2026-10-08 17:42:58.722382,2026-10-08 17:43:29.610583,0 days 00:00:30.888201,,,,,64,0.3278994383879004,512,64,0.3792831738634399,16,SGD,0.01962116917992928,0.7702215615998731,6.096393461206913e-06,2.0,1.0,1.0,COMPLETE
18,1.0,2026-10-08 17:43:29.751297,2026-10-08 17:43:52.852138,0 days 00:00:23.100841,,,,,128,0.27684325122013026,512,256,0.7773625227496351,7,SGD,0.0019750284592868544,0.8878906339931918,0.00011363827435224601,7.0,1.0,1.0,COMPLETE
19,1.0,2026-10-08 17:43:53.003193,2026-10-08 17:44:12.365869,0 days 00:00:19.362676,,,,,200,0.49849015376209815,256,128,0.885050469406635,12,SGD,0.09725501632936334,0.7696227629333837,3.5898785633183133e-06,1.0,1.0,1.0,COMPLETE
20,1.0,2026-10-08 17:44:12.506444,2026-10-08 17:44:43.333057,0 days 00:00:30.826613,,,,,64,0.42156063251046033,256,128,0.529464932626945,8,SGD,0.014329089650875093,0.9209725080040257,0.006974425952565119,1.0,1.0,1.0,COMPLETE
21,1.0,2026-10-08 17:44:43.478001,2026-10-08 17:45:15.143080,0 days 00:00:31.665079,0.9858531726862527,0.9966783836700993,0.000128776051317125,0.009769656942728053,64,0.2435557078373038,128,64,0.7991962372901166,14,Adam,,,,6.0,1.0,1.0,COMPLETE
22,1.0,2026-10-08 17:45:15.283081,2026-10-08 17:45:47.140567,0 days 00:00:31.857486,0.989917889172276,0.961406526107593,0.00015592909915154122,0.007609571827388239,64,0.10424109254834989,128,64,0.8148318564734891,16,Adam,,,,3.0,1.0,1.0,COMPLETE
23,1.0,2026-10-08 17:45:47.283682,2026-10-08 17:46:19.026667,0 days 00:00:31.742985,0.9450895617598649,0.9654953516119078,0.0005581364395161335,0.0003873914417855201,64,0.3088539954003821,128,64,0.7081338241112414,9,Adam,,,,1.0,1.0,1.0,COMPLETE
24,1.0,2026-10-08 17:46:19.171346,2026-10-08 17:46:50.844146,0 days 00:00:31.672800,0.9561641336902341,0.9013161786866084,0.00048205638280334514,0.00012113264883906514,64,0.19186414072320676,128,64,0.8412978801704134,12,Adam,,,,2.0,1.0,1.0,COMPLETE
25,1.0,2026-10-08 17:46:50.987975,2026-10-08 17:47:14.173198,0 days 00:00:23.185223,0.8510871962787233,0.9750167539336848,0.001579359289049003,0.0011158833004946606,128,0.3598732248716761,128,64,0.7364614056654826,14,Adam,,,,1.0,1.0,1.0,COMPLETE
26,1.0,2026-10-08 17:47:14.315388,2026-10-08 17:47:46.377583,0 days 00:00:32.062195,0.8877305624105759,0.9025225743564163,0.0002802287426947312,1.961127995666095e-05,64,0.2649667900155934,512,256,0.6059253809608157,20,Adam,,,,1.0,1.0,1.0,COMPLETE
27,1.0,2026-10-08 17:47:46.521834,2026-10-08 17:48:17.627620,0 days 00:00:31.105786,,,,,64,0.30804152998272477,64,512,0.31571428135599877,17,SGD,0.003177006711905028,0.9855988572155746,0.0007335484607354498,2.0,1.0,1.0,COMPLETE
28,1.0,2026-10-08 17:48:17.773134,2026-10-08 17:48:37.417070,0 days 00:00:19.643936,0.9611689288337257,0.949475917503,0.007721995018057831,0.0013671857892267889,200,0.36062065537066273,512,128,0.8599145345397455,5,Adam,,,,1.0,1.0,1.0,COMPLETE
29,0.9492745711174497,2026-10-08 17:48:37.559257,2026-10-08 17:48:42.187334,0 days 00:00:04.628077,,,,,128,0.16517702081320296,64,256,0.11295627529595176,18,SGD,0.00038866764924773043,0.7421985470916721,1.0631921076731615e-05,,,,PRUNED
30,0.8066454382710556,2026-10-08 17:48:42.329350,2026-10-08 17:48:46.260972,0 days 00:00:03.931622,,,,,200,0.24705689906430117,128,64,0.7692257635872495,11,SGD,0.0005553602525053792,0.8016797594344486,5.495658412540857e-05,,,,PRUNED
31,1.0,2026-10-08 17:48:46.402338,2026-10-08 17:49:05.832840,0 days 00:00:19.430502,,,,,200,0.14444181602257905,64,256,0.13697201660631045,18,SGD,0.09459526454484286,0.9241563848654223,2.6296383393546625e-06,1.0,1.0,1.0,COMPLETE
32,1.0,2026-10-08 17:49:05.974766,2026-10-08 17:49:25.366690,0 days 00:00:19.391924,,,,,200,0.2233784943841315,64,256,0.19627439829618254,18,SGD,0.04361666609430634,0.8767842204779352,7.907353700148394e-06,1.0,1.0,1.0,COMPLETE
33,1.0,2026-10-08 17:49:25.507950,2026-10-08 17:49:44.878547,0 days 00:00:19.370597,,,,,200,0.1991385014368335,64,256,0.2378795055103487,19,SGD,0.046761882281658576,0.9532749582708,2.15379138926181e-06,2.0,1.0,1.0,COMPLETE
34,1.0,2026-10-08 17:49:45.021035,2026-10-08 17:50:04.484498,0 days 00:00:19.463463,,,,,200,0.1016276929675653,64,512,0.3297327495381107,17,SGD,0.06484691104519225,0.8628081711693605,9.224922476430067e-06,1.0,1.0,1.0,COMPLETE
35,1.0,2026-10-08 17:50:04.624891,2026-10-08 17:50:27.992927,0 days 00:00:23.368036,0.8987952830152882,0.9823614220397617,0.0017647974238785382,2.2127075293602086e-05,128,0.16305236051588262,128,256,0.16992118969906625,20,Adam,,,,1.0,1.0,1.0,COMPLETE
36,1.0,2026-10-08 17:50:28.135370,2026-10-08 17:50:47.568293,0 days 00:00:19.432923,,,,,200,0.17386261624025892,64,512,0.24202617466530169,16,SGD,0.019911183323715626,0.9173727306226784,5.34288210628721e-06,2.0,1.0,1.0,COMPLETE
37,1.0,2026-10-08 17:50:47.710832,2026-10-08 17:51:10.868889,0 days 00:00:23.158057,0.9161343218814132,0.9158676678192704,0.0002526952424276043,4.960033626323705e-06,128,0.1390922178776799,256,128,0.11184050451402494,19,Adam,,,,2.0,1.0,1.0,COMPLETE
38,1.0,2026-10-08 17:51:11.008919,2026-10-08 17:51:41.854758,0 days 00:00:30.845839,,,,,64,0.21651152995170764,256,64,0.690466060666597,17,SGD,0.004156501096397349,0.9325531197128918,1.8276011030466825e-06,2.0,1.0,1.0,COMPLETE
39,1.0,2026-10-08 17:51:41.997443,2026-10-08 17:52:05.463750,0 days 00:00:23.466307,0.8714596939488823,0.9415848380932806,0.009741006954424015,5.305239654822781e-05,128,0.24189285579120645,512,128,0.6305755571445564,14,Adam,,,,2.0,1.0,1.0,COMPLETE
40,1.0,2026-10-08 17:52:05.617626,2026-10-08 17:52:24.976591,0 days 00:00:19.358965,,,,,200,0.3487590776940027,128,256,0.26369992005109266,6,SGD,0.012320392897935116,0.9899108150152339,1.1590301153287804e-05,3.0,1.0,1.0,COMPLETE
41,1.0,2026-10-08 17:52:25.126462,2026-10-08 17:52:47.974362,0 days 00:00:22.847900,,,,,128,0.2945703930739667,64,512,0.6707618337793745,19,SGD,0.03940088019382188,0.8497991859764288,2.8768716759267707e-06,1.0,1.0,1.0,COMPLETE
42,1.0,2026-10-08 17:52:48.121215,2026-10-08 17:53:11.192348,0 days 00:00:23.071133,,,,,128,0.22215010469301988,64,512,0.8354145369700846,15,SGD,0.06612067255226423,0.8063410562936757,3.891933956162947e-06,1.0,1.0,1.0,COMPLETE
43,1.0,2026-10-08 17:53:11.332670,2026-10-08 17:53:34.967153,0 days 00:00:23.634483,,,,,128,0.12585537487548587,64,512,0.5475922445294001,18,SGD,0.029898596349477412,0.9463159822746094,1.6311597499021766e-06,2.0,1.0,1.0,COMPLETE
44,1.0,2026-10-08 17:53:35.128607,2026-10-08 17:53:58.515432,0 days 00:00:23.386825,,,,,128,0.4057067440788086,64,128,0.881473516485439,20,SGD,0.060531996941319645,0.9034490147680533,1.512275138690136e-05,2.0,1.0,1.0,COMPLETE
45,1.0,2026-10-08 17:53:58.655983,2026-10-08 17:54:29.902662,0 days 00:00:31.246679,,,,,64,0.2022329641377561,256,512,0.20194103568446164,17,SGD,0.09067202308774634,0.7331207509967839,4.879871979333212e-06,1.0,1.0,1.0,COMPLETE
46,1.0,2026-10-08 17:54:30.046802,2026-10-08 17:54:52.924569,0 days 00:00:22.877767,,,,,128,0.17887363616406343,512,128,0.4859081978520516,15,SGD,0.0293589625949398,0.862596195665745,4.363156858073536e-05,1.0,1.0,1.0,COMPLETE
47,0.9967240696737336,2026-10-08 17:54:53.066851,2026-10-08 17:54:59.312131,0 days 00:00:06.245280,,,,,64,0.26181871696330733,256,128,0.7620172324818267,8,SGD,0.000760386233575988,0.7974971577111692,0.000603848225395029,,,,PRUNED
48,0.8367155707069815,2026-10-08 17:54:59.455359,2026-10-08 17:55:04.179393,0 days 00:00:04.724034,,,,,128,0.30612291583661905,512,512,0.37810146642587183,19,SGD,0.00020102822262786974,0.7027399416202574,1.472224016892928e-06,,,,PRUNED
49,1.0,2026-10-08 17:55:04.320892,2026-10-08 17:55:35.967516,0 days 00:00:31.646624,0.9714721061103088,0.9571275926732231,0.00010414112000381409,0.002400497743110368,64,0.28566461489207184,64,128,0.8045649646787965,13,Adam,,,,3.0,1.0,1.0,COMPLETE
