number,value,datetime_start,datetime_complete,duration,params_adam_beta1,params_adam_beta2,params_adam_lr,params_adam_wd,params_batch_size,params_block_0_dropout,params_block_0_filters,params_block_0_kernel,params_block_0_stride,params_block_1_dropout,params_block_1_filters,params_block_1_kernel,params_block_1_stride,params_block_2_dropout,params_block_2_filters,params_block_2_kernel,params_block_2_stride,params_block_3_dropout,params_block_3_filters,params_block_3_kernel,params_block_3_stride,params_fc_hidden,params_first_conv_filters,params_first_conv_kernel_size,params_lr_factor,params_lr_patience,params_n_blocks,params_optimizer,params_sgd_lr,params_sgd_momentum,params_sgd_wd,user_attrs_best_epoch,user_attrs_validation_accuracy,user_attrs_validation_macro_f1,state
63,0.8334179368636658,2026-09-29 13:47:04.925728,2026-09-29 13:48:27.838560,0 days 00:01:22.912832,0.9084747740745998,0.9642288631016843,0.002514701139205727,2.0107914527113552e-05,64.0,0.02829736867336214,32,7,3,0.012709635533814344,64,3,2,0.01990517471278693,32,5,2,,,,,256,256,5,0.2189075210665024,18.0,3,Adam,,,,50.0,0.84251968503937,0.8243161886879615,COMPLETE
64,0.8543802979138522,2026-09-29 13:48:27.986970,2026-09-29 13:49:48.635811,0 days 00:01:20.648841,0.8889080299219633,0.9553483724926349,0.0012217555463429556,4.038237027770716e-05,64.0,0.01195973717624621,32,7,3,0.01834653992507449,64,3,2,0.03410020427272979,32,5,2,,,,,256,256,5,0.3090499718924731,17.0,3,Adam,,,,50.0,0.8582677165354331,0.8504928792922714,COMPLETE
65,0.5479989586594769,2026-09-29 13:49:48.758949,2026-09-29 13:50:01.930842,0 days 00:00:13.171893,0.8856660350125046,0.9438515726975,0.0012846729279867102,0.004055343982978079,64.0,0.010041050190834365,32,7,3,0.020424350025342868,64,3,2,0.035221067477376855,32,5,2,,,,,256,128,5,0.45439430227777444,15.0,3,Adam,,,,,,,PRUNED
66,0.6162066945477922,2026-09-29 13:50:02.052554,2026-09-29 13:50:24.290799,0 days 00:00:22.238245,0.9300615402362146,0.9483498483394701,0.0017117529531455115,1.0125698832691839e-05,64.0,0.012345603695340726,32,7,3,0.03759165686718367,32,3,2,0.03201925117379845,128,5,2,,,,,128,256,5,0.3168056840164274,16.0,3,Adam,,,,,,,PRUNED
67,0.30857338719780536,2026-09-29 13:50:24.413980,2026-09-29 13:50:40.417410,0 days 00:00:16.003430,,,,,64.0,0.0168103018466335,32,7,3,0.033190957375383426,64,3,2,0.054122175781170054,32,5,1,,,,,512,256,5,0.17854355407277436,17.0,3,SGD,0.014512986463035329,0.7836552591018312,0.0002851057039418362,,,,PRUNED
68,0.3917804233980545,2026-09-29 13:50:40.539297,2026-09-29 13:51:08.934770,0 days 00:00:28.395473,0.8733362275050128,0.9727954913859054,0.0010890020172150806,3.0456508905133015e-05,64.0,0.021798540751361856,32,7,3,0.030353345371136774,64,3,1,0.047276329235008366,32,5,2,,,,,256,512,3,0.49994471924768324,5.0,3,Adam,,,,,,,PRUNED
69,0.24866037327492768,2026-09-29 13:51:09.066300,2026-09-29 13:51:24.983462,0 days 00:00:15.917162,0.8999704236987915,0.9356808055415134,0.00012160097051673226,0.009261796460991968,64.0,0.018848041078993842,8,7,3,0.023831710360728592,64,3,2,0.04221869341741914,32,5,2,,,,,256,256,5,0.3395509057347691,17.0,3,Adam,,,,,,,PRUNED
70,,2026-09-29 13:51:25.112668,2026-09-29 13:51:25.166243,0 days 00:00:00.053575,,,,,,0.012611464249754973,16,5,3,0.01973743697587969,16,5,2,0.027335234254871374,32,5,2,,,,,,256,5,,,3,,,,,,,,PRUNED
71,0.8335628265948811,2026-09-29 13:51:25.292672,2026-09-29 13:52:45.167403,0 days 00:01:19.874731,0.9134160349833549,0.9571866832665961,0.0010259833802199127,3.96273279704853e-05,64.0,0.03495614195089994,32,7,3,0.013041253732714878,64,3,2,0.06031041225865009,32,5,2,,,,,256,256,5,0.2765791210142818,19.0,3,Adam,,,,46.0,0.8346456692913385,0.8324799838984236,COMPLETE
72,0.6102810292991965,2026-09-29 13:52:45.288086,2026-09-29 13:53:07.885652,0 days 00:00:22.597566,0.8947559756008419,0.9523417767832459,0.0007668988849334555,9.284934321247873e-05,64.0,0.042836770782825356,32,7,3,0.018765263273283077,64,3,2,0.019583518917557576,32,5,2,,,,,256,256,5,0.23942307394118534,18.0,3,Adam,,,,,,,PRUNED
73,0.5193425238773621,2026-09-29 13:53:08.007689,2026-09-29 13:53:24.041189,0 days 00:00:16.033500,0.905819225963823,0.9619398773771324,0.0017358905782751794,5.938470933863071e-05,64.0,0.015401390062553338,32,7,3,0.026782945285350326,64,3,2,0.03052104383218158,32,5,2,,,,,256,256,5,0.30295835868925874,20.0,3,Adam,,,,,,,PRUNED
74,0.6175533264956476,2026-09-29 13:53:24.165272,2026-09-29 13:53:46.464400,0 days 00:00:22.299128,0.9363450684472339,0.9553768879708537,0.0013046357853393961,2.356590137561318e-05,64.0,0.025227477821408634,32,7,3,0.035375454487747524,64,3,2,0.06396728826643992,32,5,2,,,,,256,256,5,0.22418091499468853,15.0,3,Adam,,,,,,,PRUNED
75,0.5257990169684847,2026-09-29 13:53:46.588946,2026-09-29 13:54:02.691520,0 days 00:00:16.102574,0.9214099795892827,0.9012515083502709,0.0005718813814338712,1.2904589224585555e-05,64.0,0.03272396214927866,32,7,3,0.01628246076675972,64,3,2,0.014609035476334006,32,5,2,,,,,256,256,5,0.42877396733078965,17.0,3,Adam,,,,,,,PRUNED
76,0.4474906482798141,2026-09-29 13:54:02.815791,2026-09-29 13:54:25.360554,0 days 00:00:22.544763,0.9122639485346428,0.9689324397562767,0.0009876028165481758,3.210406074279611e-05,64.0,0.03872926505560879,32,7,3,0.043568502592947964,64,3,2,0.025204315615332137,32,3,2,,,,,128,256,7,0.538624894265719,19.0,3,Adam,,,,,,,PRUNED
77,0.4328122315206473,2026-09-29 13:54:25.488508,2026-09-29 13:54:41.930477,0 days 00:00:16.441969,0.8898932379234381,0.9414246736279811,0.0022635601495858975,8.089947524050374e-05,128.0,0.0120611055684277,32,7,3,0.023168305252517014,32,3,2,0.0678835336058213,128,5,1,,,,,256,256,5,0.45947396617251673,18.0,3,Adam,,,,,,,PRUNED
78,0.7761611319859796,2026-09-29 13:54:42.056668,2026-09-29 13:55:43.888813,0 days 00:01:01.832145,0.9244692110968978,0.9490739578667858,0.0004187947149195351,4.738999064716292e-05,64.0,0.02914138314618732,32,7,3,0.05167712635584355,64,3,2,0.056837110908693346,64,5,2,,,,,256,128,5,0.35817911638626887,16.0,3,Adam,,,,,,,PRUNED
79,0.2998687007172359,2026-09-29 13:55:44.010850,2026-09-29 13:55:57.280311,0 days 00:00:13.269461,,,,,64.0,0.019298967550280786,32,7,3,0.03817214359800052,64,3,2,0.04342251467557765,32,5,2,,,,,256,256,3,0.3863836223699896,18.0,3,SGD,0.0005800290373232365,0.9178569635671426,0.00020431868732155546,,,,PRUNED
80,0.3662246339432216,2026-09-29 13:55:57.407329,2026-09-29 13:56:13.011498,0 days 00:00:15.604169,0.8841519763309962,0.9206338071334307,0.0030475379867085073,1.8758572073469805e-05,64.0,0.08767660381976239,16,7,3,0.04785200344974287,64,5,1,0.05037180571175413,32,5,2,,,,,512,256,5,0.3280841300341634,16.0,3,Adam,,,,,,,PRUNED
81,0.8189998325959591,2026-09-29 13:56:13.132464,2026-09-29 13:57:32.948377,0 days 00:01:19.815913,0.9175140148051089,0.9466601558225785,0.0010832075194651466,5.776205832989606e-05,64.0,0.01723016174748426,32,7,3,0.03506200675329822,32,3,2,0.02214587705671297,64,5,2,,,,,256,256,5,0.31187952226353277,14.0,3,Adam,,,,37.0,0.8346456692913385,0.8033539959005797,COMPLETE
82,0.836974290141566,2026-09-29 13:57:33.078681,2026-09-29 13:58:54.460573,0 days 00:01:21.381892,0.9201270030028015,0.9281725831247314,0.0014392908588783592,3.3752037712008136e-05,64.0,0.02242257719016356,32,7,3,0.04046136960320886,32,3,2,0.01863904639248721,64,5,2,,,,,256,256,5,0.2743881736546617,16.0,3,Adam,,,,46.0,0.84251968503937,0.8314288952437618,COMPLETE
83,0.9003956019092714,2026-09-29 13:58:54.596591,2026-09-29 14:00:13.576070,0 days 00:01:18.979479,0.934539215488327,0.9272865958024438,0.0015258202917575092,2.5828971999082497e-05,64.0,0.021815106741966565,32,7,3,0.040555250595021075,32,3,2,0.01844415334430831,64,5,2,,,,,256,256,5,0.2816096909097179,15.0,3,Adam,,,,45.0,0.905511811023622,0.8952793927949206,COMPLETE
84,0.8717913629806922,2026-09-29 14:00:13.698299,2026-09-29 14:01:32.741796,0 days 00:01:19.043497,0.9340597412478215,0.9160161459153707,0.0019345166271338592,9.04602202412352e-06,64.0,0.014281220524116012,32,7,3,0.013738998670007302,32,3,2,0.013484552661621926,64,5,2,,,,,256,256,5,0.2827985977107683,13.0,3,Adam,,,,38.0,0.8740157480314961,0.8695669779298884,COMPLETE
85,0.747539080215712,2026-09-29 14:01:32.865385,2026-09-29 14:02:32.891887,0 days 00:01:00.026502,0.9351431541690067,0.9159010808866513,0.0018814383667197317,1.0350052602058352e-05,64.0,0.014513718480789108,32,7,3,0.04270088661252012,32,3,2,0.014031326116577592,64,5,2,,,,,256,256,5,0.28655778369795115,12.0,3,Adam,,,,,,,PRUNED
86,0.46577721228495184,2026-09-29 14:02:33.028912,2026-09-29 14:02:48.792706,0 days 00:00:15.763794,0.9394975782778233,0.9067591038421112,0.0017469046737010434,7.725872653024442e-06,64.0,0.01558998050068745,32,7,3,0.05794243077811247,32,3,2,0.028196192351511728,64,5,2,,,,,256,256,5,0.6280037828297717,13.0,3,Adam,,,,,,,PRUNED
87,0.5264617101186886,2026-09-29 14:02:48.916777,2026-09-29 14:03:20.255542,0 days 00:00:31.338765,0.9484646947119411,0.9238957271875058,0.002717429291495394,4.512631769087482e-06,64.0,0.011714798394030137,8,5,3,0.01289033632037533,32,3,2,0.03758695288109046,64,5,2,,,,,128,512,5,0.29861992017237254,15.0,3,Adam,,,,,,,PRUNED
88,0.5238405615468583,2026-09-29 14:03:20.386492,2026-09-29 14:03:34.926985,0 days 00:00:14.540493,0.9303916566384028,0.9326873854360109,0.0015548729049328584,1.717530804202144e-05,64.0,0.020045089418926125,32,7,3,0.04586447788196162,32,3,2,0.023867851400320793,64,3,2,,,,,256,256,3,0.2466708348756491,12.0,3,Adam,,,,,,,PRUNED
89,0.5784803534189158,2026-09-29 14:03:35.054215,2026-09-29 14:03:58.660367,0 days 00:00:23.606152,0.9271825752796528,0.9120911726651761,0.0022058609447170854,0.00011960619390038458,128.0,0.025335517828255143,32,7,3,0.03962658785609153,32,3,2,0.013750757247561717,64,5,2,,,,,256,256,5,0.1930677357632387,13.0,3,Adam,,,,,,,PRUNED
90,0.5718374488903173,2026-09-29 14:03:58.813320,2026-09-29 14:04:21.853034,0 days 00:00:23.039714,0.9319849687039101,0.9254587755474045,0.0013884982712329495,2.988162072302164e-06,64.0,0.023187049569241048,32,7,3,0.030716510817508008,32,3,2,0.05526170385868441,64,5,1,,,,,256,256,7,0.2310861623794656,10.0,3,Adam,,,,,,,PRUNED
91,0.5405002677340918,2026-09-29 14:04:21.977520,2026-09-29 14:04:38.384614,0 days 00:00:16.407094,0.9006544875375754,0.9166037476471084,0.0011786878188433897,2.4412151111512368e-05,64.0,0.017434152440666706,32,7,3,0.01422513588370779,16,3,2,0.010398218549870672,32,5,2,,,,,256,256,5,0.2747076798834175,17.0,3,Adam,,,,,,,PRUNED
92,0.5399752672220139,2026-09-29 14:04:38.522872,2026-09-29 14:04:54.896735,0 days 00:00:16.373863,0.907057386770379,0.929719501393993,0.00151539503472295,4.638484813690629e-05,64.0,0.014080603245407927,32,7,3,0.018777706351042225,64,3,2,0.01726665821692939,32,5,2,,,,,256,256,5,0.325477704016811,20.0,3,Adam,,,,,,,PRUNED
93,0.5828212018963224,2026-09-29 14:04:55.026425,2026-09-29 14:05:14.627458,0 days 00:00:19.601033,0.9607489707963035,0.9213580946464853,0.0009293079215881896,2.6528840322226046e-05,64.0,0.02756204023998177,32,7,3,0.02209071247710697,64,3,2,0.02004260584184368,32,5,2,,,,,256,256,5,0.2595598700482959,18.0,3,Adam,,,,,,,PRUNED
94,0.6290902436760202,2026-09-29 14:05:14.754037,2026-09-29 14:05:38.036175,0 days 00:00:23.282138,0.9154461289607497,0.9348940018480453,0.0019687260761810715,6.571868862051187e-05,64.0,0.030476425191817685,32,7,3,0.011995982340392838,64,3,2,0.02584234290265122,64,5,2,,,,,256,256,5,0.21664771570350516,15.0,3,Adam,,,,,,,PRUNED
95,0.5150144926008942,2026-09-29 14:05:38.171012,2026-09-29 14:05:54.537328,0 days 00:00:16.366316,0.9125056185538687,0.9585587394043447,0.0011511832847858122,1.4432649353958484e-05,64.0,0.07131416279384761,32,7,3,0.017237203753084174,32,3,2,0.021206398262695964,32,5,2,,,,,128,256,5,0.2901713412985047,19.0,3,Adam,,,,,,,PRUNED
96,0.8042144712726231,2026-09-29 14:05:54.661429,2026-09-29 14:07:02.040350,0 days 00:01:07.378921,,,,,64.0,0.010117701525405512,32,7,3,0.027672480185509673,64,3,2,0.016027560471605178,128,5,2,,,,,256,128,5,0.4148051366758667,19.0,3,SGD,0.01941181635283223,0.7529594623611476,4.2328965825390105e-06,49.0,0.8031496062992126,0.8052793362460337,COMPLETE
97,0.40458936481949087,2026-09-29 14:07:02.171214,2026-09-29 14:07:18.448417,0 days 00:00:16.277203,0.9230092495065936,0.939012060277497,0.001588626077782991,3.731407030362646e-05,64.0,0.03702424207796377,32,7,3,0.05063329258150715,64,3,1,0.04768630017769175,32,5,2,,,,,256,256,5,0.37039828286000803,20.0,3,Adam,,,,,,,PRUNED
98,,2026-09-29 14:07:18.573635,2026-09-29 14:07:18.631279,0 days 00:00:00.057644,,,,,,0.021354373202674373,32,7,3,0.03796750376113983,64,5,2,0.052513469760088104,32,5,2,,,,,,256,3,,,3,,,,,,,,PRUNED
99,0.618715132274706,2026-09-29 14:07:18.757256,2026-09-29 14:07:38.926289,0 days 00:00:20.169033,0.9028991206449309,0.9547275089658597,0.0007764044423394353,4.837008461443511e-05,64.0,0.033657117971305155,32,5,3,0.03298895564782858,32,3,2,0.03440485414068563,32,5,2,,,,,256,256,5,0.39352446131525987,17.0,3,Adam,,,,,,,PRUNED
