number,value,datetime_start,datetime_complete,duration,params_adam_beta1,params_adam_beta2,params_adam_lr,params_adam_wd,params_batch_size,params_block_0_dropout,params_block_0_filters,params_block_0_kernel,params_block_0_stride,params_block_1_dropout,params_block_1_filters,params_block_1_kernel,params_block_1_stride,params_block_2_dropout,params_block_2_filters,params_block_2_kernel,params_block_2_stride,params_block_3_dropout,params_block_3_filters,params_block_3_kernel,params_block_3_stride,params_fc_hidden,params_first_conv_filters,params_first_conv_kernel_size,params_lr_factor,params_lr_patience,params_n_blocks,params_optimizer,params_sgd_lr,params_sgd_momentum,params_sgd_wd,user_attrs_best_epoch,user_attrs_validation_accuracy,user_attrs_validation_macro_f1,state
0,0.4427277601251135,2026-09-29 13:03:17.273406,2026-09-29 13:05:12.228808,0 days 00:01:54.955402,0.8926459276842719,0.9097574441892378,0.00853618986286683,0.0017123375973163992,128.0,0.08491983767203796,8,5,3,0.06506676052501416,16,3,2,0.06331731119758383,128,3,1,,,,,256,256,7,0.5105398159072941,12.0,3,Adam,,,,46.0,0.44881889763779526,0.4366366226124317,COMPLETE
1,0.6487644248511468,2026-09-29 13:05:12.364423,2026-09-29 13:07:19.301517,0 days 00:02:06.937094,,,,,128.0,0.06381099809299767,16,7,3,0.08458637582367365,16,3,2,0.07950202923669918,128,3,1,0.07361716094628554,256.0,3.0,1.0,256,256,7,0.13813501017161417,9.0,4,SGD,0.038842777547031436,0.8807564567799918,2.106648601704221e-05,48.0,0.6535433070866141,0.6439855426156795,COMPLETE
2,0.6790492385905623,2026-09-29 13:07:19.432978,2026-09-29 13:08:28.922371,0 days 00:01:09.489393,0.970502281655888,0.9006945178400659,0.0007148510793512986,0.0018709365688887364,64.0,0.019710228429397403,8,7,3,0.07799960246887438,32,3,1,0.0884314531168946,128,3,2,0.05854080177240857,256.0,3.0,1.0,256,256,3,0.4064483815465394,11.0,4,Adam,,,,49.0,0.6771653543307087,0.680933122850416,COMPLETE
3,,2026-09-29 13:08:29.045924,2026-09-29 13:08:29.091707,0 days 00:00:00.045783,,,,,,0.013319825261907952,8,7,3,0.05405074842498068,16,3,2,0.06690752475342215,32,5,2,0.08517722460303143,64.0,3.0,1.0,,256,5,,,4,,,,,,,,PRUNED
4,0.6484372587217537,2026-09-29 13:08:29.215116,2026-09-29 13:09:24.333019,0 days 00:00:55.117903,0.8642060160012445,0.9662838267338948,0.0016325185294676916,1.088399181393814e-06,128.0,0.09430569898630611,16,7,3,0.08354999801810943,32,5,1,0.04051268119438307,32,3,2,0.08983777818386056,256.0,3.0,1.0,128,128,5,0.10303695030773122,7.0,4,Adam,,,,31.0,0.6299212598425197,0.6669532576009879,COMPLETE
5,,2026-09-29 13:09:24.457583,2026-09-29 13:09:24.502595,0 days 00:00:00.045012,,,,,,0.03386821309135529,8,5,3,0.06192134961637233,32,5,2,0.09464127259176229,128,5,2,0.011391095487598068,64.0,3.0,1.0,,512,3,,,4,,,,,,,,PRUNED
6,0.4625364660812532,2026-09-29 13:09:24.629669,2026-09-29 13:14:48.905729,0 days 00:05:24.276060,0.897319321959215,0.9375207369687304,0.0039046790191830895,0.0036309591863459105,128.0,0.07264268170074757,8,5,3,0.0766691755978784,64,5,1,0.09219164973008243,64,3,1,,,,,512,512,7,0.1563891639045214,14.0,3,Adam,,,,48.0,0.44881889763779526,0.47625403452471116,COMPLETE
7,0.7936351211254495,2026-09-29 13:14:49.030121,2026-09-29 13:16:47.348467,0 days 00:01:58.318346,0.8891907455724319,0.9953910415382531,0.0026865309327169084,0.00043731009905162676,64.0,0.01768127184943912,32,5,3,0.03906608256471214,64,3,2,0.07263767854843282,32,5,2,,,,,128,512,3,0.5427381500174611,13.0,3,Adam,,,,47.0,0.7952755905511811,0.7919946516997178,COMPLETE
8,0.27298408813267844,2026-09-29 13:16:47.469754,2026-09-29 13:17:17.168800,0 days 00:00:29.699046,,,,,64.0,0.05261245937025092,8,5,3,0.06632739241428127,32,3,1,0.0627198023146117,64,5,2,,,,,128,512,5,0.6767143382943485,19.0,3,SGD,0.004333615420461955,0.9730247945451923,3.502761367842316e-05,,,,PRUNED
9,0.35157389552496415,2026-09-29 13:17:17.291935,2026-09-29 13:17:32.311443,0 days 00:00:15.019508,,,,,128.0,0.06660485621018956,16,5,3,0.0991454627800606,16,5,1,0.07757839610123476,128,3,2,0.05547271352030715,256.0,3.0,1.0,512,128,7,0.6700371802304829,20.0,4,SGD,0.0520170752104338,0.7264731362679787,1.8934530915191556e-05,,,,PRUNED
10,0.32911119682857803,2026-09-29 13:17:32.434306,2026-09-29 13:18:02.938385,0 days 00:00:30.504079,0.9740823912733333,0.9925265187462552,0.00011276182231780688,1.0341591364653288e-05,64.0,0.04094807897017133,32,5,3,0.020186058701089256,64,3,2,0.02058969429153098,32,5,1,,,,,128,512,3,0.31969431875426024,5.0,3,Adam,,,,,,,PRUNED
11,0.7365808170082636,2026-09-29 13:18:03.075499,2026-09-29 13:19:11.139278,0 days 00:01:08.063779,0.9852476075458594,0.9052569298453264,0.0006793020634935387,0.0002502055290331605,64.0,0.014814626394445182,32,7,3,0.032021946338044796,64,3,1,0.042404344302139935,32,5,2,,,,,256,256,3,0.4354764493512368,13.0,3,Adam,,,,48.0,0.7322834645669292,0.7408781694495981,COMPLETE
12,0.33031649953870046,2026-09-29 13:19:11.260498,2026-09-29 13:19:38.738564,0 days 00:00:27.478066,0.9352541592559447,0.9930885003326854,0.0005209314402340293,0.00019814443844464304,64.0,0.026478020292159198,32,7,3,0.03166898356738668,64,3,1,0.042720060046579134,32,5,2,,,,,128,512,3,0.5170355251346896,15.0,3,Adam,,,,,,,PRUNED
13,0.8324299414658652,2026-09-29 13:19:38.860509,2026-09-29 13:20:45.858939,0 days 00:01:06.998430,0.9315109299364555,0.9453206875214537,0.0010605108858326026,0.00013255240424677166,64.0,0.014191125444735503,32,7,3,0.040416735206225574,64,3,2,0.044151450596321834,32,5,2,,,,,256,256,3,0.5204876179357624,16.0,3,Adam,,,,45.0,0.8346456692913385,0.8302142136403919,COMPLETE
14,0.7890667036703292,2026-09-29 13:20:45.981910,2026-09-29 13:21:42.336037,0 days 00:00:56.354127,0.9318716418646565,0.9590930357312728,0.0020999218164904072,0.00010910101541984225,64.0,0.03965364925026098,32,5,3,0.048588223595397176,64,3,2,0.01146628302509687,32,5,2,,,,,256,128,3,0.5790673497740515,17.0,3,Adam,,,,49.0,0.8031496062992126,0.7749838010414457,COMPLETE
15,0.8601190782894814,2026-09-29 13:21:42.457567,2026-09-29 13:22:48.617252,0 days 00:01:06.159685,0.9213243183690348,0.9350406186336556,0.001925463306288408,2.720872558514796e-05,64.0,0.026950659351922063,32,7,3,0.04099718722963988,64,3,2,0.029625896015544047,32,5,2,,,,,128,256,3,0.3073846276570938,16.0,3,Adam,,,,50.0,0.8582677165354331,0.8619704400435297,COMPLETE
16,0.11678956852755551,2026-09-29 13:22:48.743557,2026-09-29 13:23:02.069548,0 days 00:00:13.325991,,,,,64.0,0.029890913390364857,32,7,3,0.011174357304156696,64,3,2,0.029508163441416883,32,5,2,,,,,512,256,3,0.2975087809454108,17.0,3,SGD,0.00011877964997161456,0.7040126788907952,0.002144225215662579,,,,PRUNED
17,0.8041898111786825,2026-09-29 13:23:02.189817,2026-09-29 13:24:08.879124,0 days 00:01:06.689307,0.9358472486457605,0.9375572528048509,0.0002543022851487786,2.2325053496111326e-05,64.0,0.05219769378919019,32,7,3,0.044565460809156736,64,3,2,0.052009130567976514,64,5,2,,,,,128,256,3,0.23527122130561212,16.0,3,Adam,,,,49.0,0.8031496062992126,0.8052300160581524,COMPLETE
18,,2026-09-29 13:24:09.000353,2026-09-29 13:24:09.055381,0 days 00:00:00.055028,,,,,,0.025221421897720444,32,7,3,0.02497830360189208,64,5,2,0.02953200530730864,32,5,1,,,,,,256,3,,,3,,,,,,,,PRUNED
19,0.8419234124068077,2026-09-29 13:24:09.180288,2026-09-29 13:25:27.324670,0 days 00:01:18.144382,0.9183998142707185,0.9315586865148993,0.0014754171871364653,3.5815433001440884e-05,64.0,0.010307338885979695,32,7,3,0.03940754556848981,64,3,2,0.053400397608472455,32,5,2,,,,,256,256,5,0.3861663834626331,18.0,3,Adam,,,,50.0,0.8503937007874016,0.8334531240262137,COMPLETE
20,0.3836699129604734,2026-09-29 13:25:27.447871,2026-09-29 13:25:43.188385,0 days 00:00:15.740514,0.910126853584041,0.9238482309595746,0.005518506152430769,1.1767825545187287e-05,64.0,0.0431649277465154,32,7,3,0.054704966718028346,64,3,2,0.031012651600624948,64,5,2,,,,,128,256,5,0.37155286971845314,19.0,3,Adam,,,,,,,PRUNED
21,0.8646490422600017,2026-09-29 13:25:43.312361,2026-09-29 13:27:01.729381,0 days 00:01:18.417020,0.9199418771945558,0.9450535106913638,0.001247019433835883,4.275351178520466e-05,64.0,0.013552101123098443,32,7,3,0.03490993918261719,64,3,2,0.04805235718354789,32,5,2,,,,,256,256,5,0.4595844328319353,17.0,3,Adam,,,,50.0,0.8740157480314961,0.8552823364885075,COMPLETE
22,0.8537994471270345,2026-09-29 13:27:01.854531,2026-09-29 13:28:20.250896,0 days 00:01:18.396365,0.9160360004912584,0.9217186085875956,0.0015643813361450147,3.746978988515334e-05,64.0,0.010966725962248637,32,7,3,0.033135365752752055,64,3,2,0.05285577659650581,32,5,2,,,,,256,256,5,0.45076163921511714,18.0,3,Adam,,,,50.0,0.8582677165354331,0.8493311777186358,COMPLETE
23,0.8082594160051053,2026-09-29 13:28:20.370937,2026-09-29 13:29:38.700347,0 days 00:01:18.329410,0.9508442739550835,0.9192578798722815,0.0030439916789090555,4.548664081936517e-06,64.0,0.022836835779129497,32,7,3,0.028231383869279716,64,3,2,0.05293903275883051,32,5,2,,,,,256,256,5,0.4435050782347363,15.0,3,Adam,,,,32.0,0.8031496062992126,0.8133692257109979,COMPLETE
24,0.8406379675520266,2026-09-29 13:29:38.820368,2026-09-29 13:30:57.171996,0 days 00:01:18.351628,0.9092415485149338,0.9551017128021796,0.0011351752760012646,4.132913016642919e-05,64.0,0.0341541244032314,32,7,3,0.014763410250628457,64,3,2,0.020089686877481992,32,5,2,,,,,256,256,5,0.2636735892925425,20.0,3,Adam,,,,39.0,0.8503937007874016,0.8308822343166515,COMPLETE
25,0.20516166201110136,2026-09-29 13:30:57.292144,2026-09-29 13:31:10.155862,0 days 00:00:12.863718,,,,,64.0,0.010223895703796027,16,7,3,0.02159081658630132,64,3,2,0.034615338977073404,32,5,2,,,,,256,128,5,0.6078172768169197,18.0,3,SGD,0.00010594134428257736,0.8319921111667751,0.0072142505027882504,,,,PRUNED
26,,2026-09-29 13:31:10.277124,2026-09-29 13:31:10.322546,0 days 00:00:00.045422,,,,,,0.02221133579816267,32,7,3,0.03448324842845568,64,5,2,0.05892147221985592,32,5,1,,,,,,256,5,,,3,,,,,,,,PRUNED
27,0.4873313283351746,2026-09-29 13:31:10.443540,2026-09-29 13:31:26.198473,0 days 00:00:15.754933,0.8752609238669327,0.9225122800880652,0.00028563048794827054,3.950504452548795e-06,64.0,0.03228149088168758,32,7,3,0.0490421929706193,64,3,2,0.04923598775614359,32,5,2,,,,,512,256,5,0.44653689612629344,17.0,3,Adam,,,,,,,PRUNED
28,0.8346882524860597,2026-09-29 13:31:26.324618,2026-09-29 13:32:48.244951,0 days 00:01:21.920333,0.9189883167863404,0.9471035580367531,0.0010440439287427868,5.6648666081313203e-05,64.0,0.01859293583227483,32,7,3,0.03569407383526348,32,3,2,0.02128474946013873,64,5,2,,,,,256,256,5,0.3236808309873508,16.0,3,Adam,,,,46.0,0.8346456692913385,0.834730835680781,COMPLETE
29,0.28974104299831804,2026-09-29 13:32:48.374775,2026-09-29 13:33:11.812788,0 days 00:00:23.438013,0.9520945816540682,0.9715995824950293,0.004009375166025617,1.3468074734538989e-05,64.0,0.04665875820157264,16,7,3,0.05975999637233037,16,3,2,0.03683411411057971,32,3,1,,,,,128,256,7,0.21970904069202365,18.0,3,Adam,,,,,,,PRUNED
30,0.4606617724118062,2026-09-29 13:33:11.947509,2026-09-29 13:33:22.954734,0 days 00:00:11.007225,,,,,128.0,0.030056774185437438,32,7,3,0.04560852989057792,16,3,2,0.05702650486985869,128,5,2,,,,,256,128,5,0.47453776039103934,14.0,3,SGD,0.002111240265367905,0.9860873441297298,1.4504086346104061e-06,,,,PRUNED
31,0.7943563795500483,2026-09-29 13:33:23.078329,2026-09-29 13:34:41.873359,0 days 00:01:18.795030,0.916050378758957,0.9314636947369058,0.0016719942973786252,4.5210466541171604e-05,64.0,0.013479091084918533,32,7,3,0.03885658073631263,64,3,2,0.04900552003881993,32,5,2,,,,,256,256,5,0.3786716628493611,18.0,3,Adam,,,,43.0,0.7952755905511811,0.7934371685489154,COMPLETE
32,0.831131843097535,2026-09-29 13:34:41.995737,2026-09-29 13:36:03.748870,0 days 00:01:21.753133,0.9224166412108183,0.9308420200717525,0.0015501661651311535,2.6367874394712127e-05,64.0,0.020490498697404096,32,7,3,0.027427009158982427,64,3,2,0.06539213136787585,32,5,2,,,,,256,256,5,0.3646664038184196,19.0,3,Adam,,,,40.0,0.8346456692913385,0.8276180169037313,COMPLETE
33,0.5360732162836975,2026-09-29 13:36:03.879553,2026-09-29 13:36:20.812800,0 days 00:00:16.933247,0.9025515326473896,0.9464271385768216,0.002078908034604922,8.74305222702164e-05,64.0,0.010579394866771886,32,7,3,0.018295445407311435,64,3,2,0.05732572980471432,32,5,2,,,,,256,256,5,0.47396967609399365,17.0,3,Adam,,,,,,,PRUNED
34,0.37415310446128097,2026-09-29 13:36:20.955187,2026-09-29 13:36:43.633746,0 days 00:00:22.678559,0.9525162883988649,0.9115680493664363,0.0011835549231944383,7.317017602084003e-06,64.0,0.026532650904424693,32,7,3,0.041166384153182724,64,3,2,0.07044940301381292,32,3,2,,,,,256,256,7,0.33198124237879845,15.0,3,Adam,,,,,,,PRUNED
35,0.6348827583547534,2026-09-29 13:36:43.757187,2026-09-29 13:37:21.569476,0 days 00:00:37.812289,0.9240021236184823,0.9319278759016935,0.0007207395927472687,0.0005656486477127541,64.0,0.010004858384530158,16,7,3,0.05401974312406466,16,3,2,0.04684313352871711,128,5,2,,,,,256,256,5,0.4078345881273926,18.0,3,Adam,,,,,,,PRUNED
36,0.32670751029730405,2026-09-29 13:37:21.697838,2026-09-29 13:37:38.002296,0 days 00:00:16.304458,0.8808453309312594,0.9187198100073276,0.0004247584720562297,2.3298099389036497e-05,128.0,0.017805455830067943,8,7,3,0.029482329184211235,32,3,2,0.08430899920956096,32,3,1,0.010348776473821666,128.0,3.0,1.0,256,256,5,0.4838028604773972,11.0,4,Adam,,,,,,,PRUNED
37,,2026-09-29 13:37:38.127103,2026-09-29 13:37:38.189170,0 days 00:00:00.062067,,,,,,0.0949271407586911,32,7,3,0.05109418698596085,64,5,2,0.03778435795076817,32,5,2,0.033882198714111376,128.0,3.0,1.0,,256,5,,,4,,,,,,,,PRUNED
38,0.46503640964653714,2026-09-29 13:37:38.311939,2026-09-29 13:38:00.883063,0 days 00:00:22.571124,0.9121322056223474,0.9390028145812656,0.0024640748862390614,6.81110434133634e-05,64.0,0.03697084795236529,8,7,3,0.024885298875902705,64,3,1,0.05440644902903763,128,5,2,,,,,256,256,7,0.4046680914579466,20.0,3,Adam,,,,,,,PRUNED
39,0.4323231662534257,2026-09-29 13:38:01.006860,2026-09-29 13:38:17.308350,0 days 00:00:16.301490,0.9414424514505745,0.9273914490425131,0.0014349119981799897,2.8468107757181388e-05,128.0,0.017018014123530874,32,7,3,0.07102262799804998,32,3,2,0.012376405402797889,32,3,2,,,,,128,256,5,0.3455822782045129,16.0,3,Adam,,,,,,,PRUNED
40,,2026-09-29 13:38:17.428953,2026-09-29 13:38:17.481917,0 days 00:00:00.052964,,,,,,0.08422211955233457,16,5,3,0.0443744941592452,16,5,2,0.06130067432077807,64,5,1,,,,,,128,5,,,3,,,,,,,,PRUNED
41,0.8439515968080504,2026-09-29 13:38:17.601677,2026-09-29 13:39:36.487849,0 days 00:01:18.886172,0.9024070855109766,0.9525331695434684,0.0009051558381145026,4.458250579740881e-05,64.0,0.03419605304021966,32,7,3,0.01787685400311841,64,3,2,0.021721213736741823,32,5,2,,,,,256,256,5,0.2717898660579714,20.0,3,Adam,,,,49.0,0.8503937007874016,0.8375094928286992,COMPLETE
42,0.5381432292729107,2026-09-29 13:39:36.614685,2026-09-29 13:39:53.491704,0 days 00:00:16.877019,0.8983844627274495,0.9530528911509757,0.0008720435201802202,4.7738172904829685e-05,64.0,0.02373087934269902,32,7,3,0.03531195364140675,64,3,2,0.016166738389809525,32,5,2,,,,,256,256,5,0.28146304390411386,19.0,3,Adam,,,,,,,PRUNED
43,0.4985756605760594,2026-09-29 13:39:53.621795,2026-09-29 13:40:09.483582,0 days 00:00:15.861787,0.8882514866121841,0.9146784874725596,0.008472172648968133,1.7301312451027558e-05,64.0,0.0284561524196038,32,7,3,0.015363583058374144,64,3,2,0.027500009526710265,32,5,2,,,,,256,256,5,0.20139469281041084,20.0,3,Adam,,,,,,,PRUNED
44,0.43588447590071633,2026-09-29 13:40:09.606875,2026-09-29 13:40:44.819528,0 days 00:00:35.212653,0.9046090026398363,0.9424100130483848,0.0017750087524149084,0.00012366150914561923,64.0,0.02087952359774426,32,7,3,0.022375473575983018,64,3,1,0.024646506446608808,32,5,2,,,,,256,512,5,0.2684169699231993,18.0,3,Adam,,,,,,,PRUNED
45,0.5270489087107272,2026-09-29 13:40:44.944456,2026-09-29 13:41:00.301395,0 days 00:00:15.356939,0.9252480528345031,0.9653362355669853,0.0008409725278262639,6.935805866870162e-06,64.0,0.0158594422303613,8,7,3,0.03737295304158914,64,3,2,0.09875364272018551,32,5,2,,,,,512,256,5,0.1654205282221827,19.0,3,Adam,,,,,,,PRUNED
46,0.2807092561518001,2026-09-29 13:41:00.446180,2026-09-29 13:41:13.290792,0 days 00:00:12.844612,,,,,128.0,0.03549080483716553,32,5,3,0.04200006246921474,64,3,2,0.03983969488139757,32,5,2,,,,,256,256,3,0.40075678857052754,9.0,3,SGD,0.00380606600437781,0.8106156545052814,0.000508266792188062,,,,PRUNED
47,0.46784399441585384,2026-09-29 13:41:13.417444,2026-09-29 13:42:05.852496,0 days 00:00:52.435052,0.8513528566036567,0.9527382069261772,0.001238131127269883,3.212503348801317e-05,64.0,0.014421878987207473,32,7,3,0.03160705752489233,32,3,1,0.04546209449300595,128,3,2,,,,,128,512,7,0.30547827301647956,17.0,3,Adam,,,,,,,PRUNED
48,,2026-09-29 13:42:05.978547,2026-09-29 13:42:06.029542,0 days 00:00:00.050995,,,,,,0.04695940989407523,32,5,3,0.09105869395162319,64,5,2,0.033227341867050016,32,5,2,,,,,,256,3,,,3,,,,,,,,PRUNED
49,0.3870288968725796,2026-09-29 13:42:06.159282,2026-09-29 13:42:22.102698,0 days 00:00:15.943416,0.9442258681597985,0.9771176727526355,0.0033156461830317722,1.9919675304103467e-06,64.0,0.019895425036569672,8,7,3,0.011217170970267712,64,3,2,0.07109265797338471,32,5,2,,,,,256,256,5,0.35167276948622195,14.0,3,Adam,,,,,,,PRUNED
50,,2026-09-29 13:42:22.231432,2026-09-29 13:42:22.292402,0 days 00:00:00.060970,,,,,,0.0312019242656359,32,7,3,0.06076459968788597,64,3,2,0.02314759709817331,32,5,2,0.040170574582532606,64.0,3.0,1.0,,128,3,,,4,,,,,,,,PRUNED
51,0.8566048938094075,2026-09-29 13:42:22.417121,2026-09-29 13:43:44.083026,0 days 00:01:21.665905,0.9106092179085091,0.9531219671381154,0.0013340592162242389,4.4006526123135996e-05,64.0,0.03604763049571096,32,7,3,0.019530077747665832,64,3,2,0.01712556852267278,32,5,2,,,,,256,256,5,0.2518489698819442,20.0,3,Adam,,,,49.0,0.8661417322834646,0.8470680553353503,COMPLETE
52,0.6100462798198185,2026-09-29 13:43:44.208731,2026-09-29 13:44:07.050078,0 days 00:00:22.841347,0.9160257516640489,0.959196357998956,0.002137344646198975,6.95425093371309e-05,64.0,0.040913469829822434,32,7,3,0.01745244707443166,64,3,2,0.017528879456372146,32,5,2,,,,,256,256,5,0.24981956762063828,19.0,3,Adam,,,,,,,PRUNED
53,0.525314481219993,2026-09-29 13:44:07.171331,2026-09-29 13:44:24.716126,0 days 00:00:17.544795,0.8941760715571809,0.9382484091037278,0.001427958812821712,1.6334527793777846e-05,64.0,0.05131709987116441,32,7,3,0.025124687529537514,64,3,2,0.01549573201246622,32,5,2,,,,,256,256,5,0.20142482868267525,20.0,3,Adam,,,,,,,PRUNED
54,0.5183855373526215,2026-09-29 13:44:24.838967,2026-09-29 13:44:40.637136,0 days 00:00:15.798169,0.9033331831842991,0.9513222580118758,0.0005747626556310378,3.837554830646104e-05,64.0,0.05624969182388293,32,7,3,0.0326021260961252,64,3,2,0.02481029958427492,32,5,2,,,,,256,256,5,0.42508348811581015,18.0,3,Adam,,,,,,,PRUNED
55,0.5294681438725486,2026-09-29 13:44:40.760545,2026-09-29 13:44:57.026723,0 days 00:00:16.266178,0.9278163488705279,0.9348149704736131,0.000859082103967027,0.0002043816949224094,64.0,0.0366861957926901,32,7,3,0.02912684579575255,64,3,1,0.012290057385078622,64,5,2,,,,,128,256,5,0.5567115847304429,20.0,3,Adam,,,,,,,PRUNED
56,0.2918483299139346,2026-09-29 13:44:57.150236,2026-09-29 13:45:24.435945,0 days 00:00:27.285709,,,,,64.0,0.026828154881092844,32,7,3,0.02131290909898869,64,3,2,0.02727150476734023,32,5,1,,,,,512,512,3,0.10543891322480012,17.0,3,SGD,0.0007157384001972213,0.9122686018399905,1.1334022118522116e-06,,,,PRUNED
57,0.653762345583767,2026-09-29 13:45:24.562523,2026-09-29 13:45:53.665552,0 days 00:00:29.103029,0.9169094173397926,0.9420862407506817,0.0014487535456504544,0.000371930582009658,64.0,0.04428309425933873,32,5,3,0.010176523837089592,64,3,2,0.050942106178229425,32,5,2,,,,,256,256,5,0.29141908931194554,19.0,3,Adam,,,,,,,PRUNED
58,,2026-09-29 13:45:53.791389,2026-09-29 13:45:53.842343,0 days 00:00:00.050954,,,,,,0.013662102716022678,16,7,3,0.04676809649679625,64,5,2,0.04057982699366208,32,5,2,,,,,,256,5,,,3,,,,,,,,PRUNED
59,0.4993311747779396,2026-09-29 13:45:53.963865,2026-09-29 13:46:07.500273,0 days 00:00:13.536408,0.9080261610580365,0.961301306553247,0.001964947147345131,8.721778789646942e-05,64.0,0.02408557624584885,32,7,3,0.015289737451622373,16,3,2,0.010067132689336426,32,5,2,,,,,128,256,3,0.48705178869761956,16.0,3,Adam,,,,,,,PRUNED
60,0.4433510218320862,2026-09-29 13:46:07.622070,2026-09-29 13:46:32.095923,0 days 00:00:24.473853,0.8974590531301175,0.9267184674222925,0.0009348019457438643,0.00016081215857170883,128.0,0.03843432765881911,32,7,3,0.041758432719175835,64,3,2,0.07763232516539172,64,3,2,,,,,256,256,7,0.3810864247353358,19.0,3,Adam,,,,,,,PRUNED
61,0.5139932635535487,2026-09-29 13:46:32.220837,2026-09-29 13:46:48.401303,0 days 00:00:16.180466,0.9105066097030602,0.9557484679061027,0.0012161388838311613,4.1166796112700196e-05,64.0,0.0315206011274064,32,7,3,0.01567141739232863,64,3,2,0.017303718901216087,32,5,2,,,,,256,256,5,0.2524527301860905,20.0,3,Adam,,,,,,,PRUNED
62,0.5062958324265254,2026-09-29 13:46:48.532249,2026-09-29 13:47:04.802485,0 days 00:00:16.270236,0.9197492449510144,0.948165405749238,0.000675701287520662,5.679551170772263e-05,64.0,0.033759178565078526,32,7,3,0.025709047153204906,64,3,2,0.021942053447360166,32,5,2,,,,,256,256,5,0.26134851155518274,20.0,3,Adam,,,,,,,PRUNED
