number,value,datetime_start,datetime_complete,duration,params_adam_beta1,params_adam_beta2,params_adam_lr,params_adam_wd,params_batch_size,params_dropout,params_fc_hidden,params_lr_factor,params_lr_patience,params_optimizer,params_sgd_lr,params_sgd_momentum,params_sgd_wd,user_attrs_best_epoch,user_attrs_validation_accuracy,user_attrs_validation_macro_f1,state
0,1.0,2026-10-08 14:56:03.190381,2026-10-08 14:56:33.992586,0 days 00:00:30.802205,,,,,64,0.015601864044243652,128,0.11646759543664197,20,SGD,0.0396760507705299,0.8743233534055306,0.0006796578090758161,1.0,1.0,1.0,COMPLETE
1,1.0,2026-10-08 14:56:34.154751,2026-10-08 14:56:56.782433,0 days 00:00:22.627682,,,,,128,0.029122914019804193,256,0.728140769114411,8,SGD,0.0007523742884534858,0.8062449345551705,6.672367170464208e-05,18.0,1.0,1.0,COMPLETE
2,1.0,2026-10-08 14:56:56.929557,2026-10-08 14:57:20.521525,0 days 00:00:23.591968,,,,,128,0.09656320330745594,512,0.19763058787582308,12,SGD,0.00019634341572933326,0.8984275776885255,5.762487216478604e-05,34.0,1.0,1.0,COMPLETE
3,1.0,2026-10-08 14:57:20.665272,2026-10-08 14:57:40.304636,0 days 00:00:19.639364,,,,,200,0.018485445552552705,64,0.8374993880184934,6,SGD,0.06584106160121614,0.9594999316240181,0.0002463768595899747,2.0,1.0,1.0,COMPLETE
4,1.0,2026-10-08 14:57:40.440378,2026-10-08 14:58:03.532958,0 days 00:00:23.092580,,,,,128,0.02809345096873808,256,0.717795815437326,8,SGD,0.025502980701628937,0.7216196866671335,0.008862326508576254,1.0,1.0,1.0,COMPLETE
5,0.9983440886646049,2026-10-08 14:58:03.682540,2026-10-08 14:58:08.504934,0 days 00:00:04.822394,,,,,128,0.011586905952512973,128,0.36014665762139764,16,SGD,0.0009833181933644897,0.7184319215829468,1.753594952976443e-05,,,,PRUNED
6,1.0,2026-10-08 14:58:08.654275,2026-10-08 14:58:31.875211,0 days 00:00:23.220936,0.8651047997790626,0.9031397756501047,0.0007162786999897341,1.263794633808288e-06,128,0.0770967179954561,256,0.6091283290110243,10,Adam,,,,1.0,1.0,1.0,COMPLETE
7,1.0,2026-10-08 14:58:32.032831,2026-10-08 14:58:53.466289,0 days 00:00:21.433458,0.9720044826262805,0.9802868404822216,0.004132765459466363,0.000341676434183297,200,0.028975145291376805,128,0.24925604710882868,19,Adam,,,,1.0,1.0,1.0,COMPLETE
8,1.0,2026-10-08 14:58:53.619436,2026-10-08 14:59:23.185883,0 days 00:00:29.566447,,,,,64,0.08180147659224932,512,0.19589229386694626,10,SGD,0.0034059785435329977,0.8210491909131459,7.7344821566468e-06,3.0,1.0,1.0,COMPLETE
9,0.987353558771948,2026-10-08 14:59:23.319710,2026-10-08 14:59:27.752970,0 days 00:00:04.433260,,,,,128,0.02517822958253642,256,0.5021432185830892,5,SGD,0.000715354779469316,0.7106972147328144,0.000274319913977967,,,,PRUNED
10,1.0,2026-10-08 14:59:27.891408,2026-10-08 14:59:57.837281,0 days 00:00:29.945873,0.9770730713395525,0.9958810975199475,0.00010862348973937149,0.007645683783605599,64,0.05588508982574674,128,0.422359922501545,20,Adam,,,,4.0,1.0,1.0,COMPLETE
11,1.0,2026-10-08 14:59:57.997275,2026-10-08 15:00:28.398129,0 days 00:00:30.400854,,,,,64,0.0008041220778579189,64,0.8889443507086571,14,SGD,0.011172508747844114,0.8317290273423104,0.0013941165518456247,1.0,1.0,1.0,COMPLETE
12,0.9425625489686815,2026-10-08 15:00:28.542296,2026-10-08 15:00:34.419109,0 days 00:00:05.876813,,,,,64,0.046137943967073734,256,0.6527521939995483,17,SGD,0.0001454699438128176,0.8257384029307472,1.94099403289878e-06,,,,PRUNED
13,1.0,2026-10-08 15:00:34.564088,2026-10-08 15:01:04.375663,0 days 00:00:29.811575,,,,,64,0.045654335665096274,128,0.3448400509416969,14,SGD,0.003987009996875617,0.8846418190929981,0.00045042834710787066,3.0,1.0,1.0,COMPLETE
14,1.0,2026-10-08 15:01:04.519401,2026-10-08 15:01:24.115375,0 days 00:00:19.595974,0.859332234868209,0.9283914118467068,0.009917608120507165,1.3962100266000202e-06,200,0.04002444732340015,256,0.49555582910893176,17,Adam,,,,1.0,1.0,1.0,COMPLETE
15,1.0,2026-10-08 15:01:24.254880,2026-10-08 15:01:46.712668,0 days 00:00:22.457788,,,,,128,0.0010989189243771208,128,0.7614864950156898,8,SGD,0.08872754604813389,0.7753829087944386,0.0022569599258310505,1.0,1.0,1.0,COMPLETE
16,0.9983806975807064,2026-10-08 15:01:46.881898,2026-10-08 15:01:53.263410,0 days 00:00:06.381512,,,,,64,0.06218204734166099,64,0.11054337150473875,13,SGD,0.0008496318594228032,0.8905721382549928,5.718796004394957e-05,,,,PRUNED
17,1.0,2026-10-08 15:01:53.399480,2026-10-08 15:02:14.437773,0 days 00:00:21.038293,,,,,128,0.013228085795478264,512,0.5716299599149587,11,SGD,0.008974835513193231,0.7807178289715576,2.8315782940027832e-05,1.0,1.0,1.0,COMPLETE
18,1.0,2026-10-08 15:02:14.568628,2026-10-08 15:02:42.939622,0 days 00:00:28.370994,0.9175988105045949,0.9554222965937597,0.00013159405537260094,7.272499656034689e-05,64,0.035670396970807094,128,0.10754858444071225,15,Adam,,,,3.0,1.0,1.0,COMPLETE
19,0.9983440886646049,2026-10-08 15:02:43.072678,2026-10-08 15:02:46.860064,0 days 00:00:03.787386,,,,,200,0.0144369849963367,256,0.32190494173729983,7,SGD,0.00038490209497786716,0.9542143574176719,0.00012063488952886118,,,,PRUNED
20,1.0,2026-10-08 15:02:46.995636,2026-10-08 15:03:14.612700,0 days 00:00:27.617064,,,,,64,0.053271493258890926,256,0.7800510130195956,18,SGD,0.0033905085927758323,0.8573230306073899,0.0008868308571530527,1.0,1.0,1.0,COMPLETE
21,0.9396282080806464,2026-10-08 15:03:14.745567,2026-10-08 15:03:19.001946,0 days 00:00:04.256379,,,,,128,0.09734291410284916,512,0.20764214114449422,12,SGD,0.00010325284363778834,0.9150611709356693,7.572849695261565e-05,,,,PRUNED
22,0.9934374408159212,2026-10-08 15:03:19.138337,2026-10-08 15:03:23.410688,0 days 00:00:04.272351,,,,,128,0.09627294561020205,512,0.2658936277714672,9,SGD,0.0003111115930724189,0.9138922708972126,1.0831838530636372e-05,,,,PRUNED
23,0.988657419489535,2026-10-08 15:03:23.542423,2026-10-08 15:03:27.789687,0 days 00:00:04.247264,,,,,128,0.07038743288979527,512,0.1747896538973724,5,SGD,0.00028976713527133067,0.877053970685817,2.8083433326867717e-06,,,,PRUNED
24,1.0,2026-10-08 15:03:27.928767,2026-10-08 15:03:48.795865,0 days 00:00:20.867098,,,,,128,0.08696478810358427,512,0.43275256127832784,13,SGD,0.0016754641888188629,0.7782425465170097,0.004768845380805224,7.0,1.0,1.0,COMPLETE
25,0.9805711042049295,2026-10-08 15:03:48.931689,2026-10-08 15:03:53.166091,0 days 00:00:04.234402,,,,,128,0.06686615002198033,512,0.1599918467994662,20,SGD,0.0001871439595321716,0.9119482062187728,3.564788674411224e-05,,,,PRUNED
26,1.0,2026-10-08 15:03:53.301627,2026-10-08 15:04:14.554922,0 days 00:00:21.253295,0.9185651757105271,0.952569116087763,0.0008891959815138327,0.008053548891769556,128,0.0063251834725206926,128,0.27913266463501046,11,Adam,,,,1.0,1.0,1.0,COMPLETE
27,1.0,2026-10-08 15:04:14.687293,2026-10-08 15:04:35.573576,0 days 00:00:20.886283,,,,,128,0.020664318118196266,64,0.6926704655607323,7,SGD,0.03158600684184047,0.8562030112718952,0.0005182607569692148,1.0,1.0,1.0,COMPLETE
28,1.0,2026-10-08 15:04:35.712211,2026-10-08 15:04:54.094531,0 days 00:00:18.382320,,,,,200,0.03865661136178628,128,0.1039124478740838,9,SGD,0.001587608292541265,0.9406563191658766,0.0001463243643326611,9.0,1.0,1.0,COMPLETE
29,1.0,2026-10-08 15:04:54.225303,2026-10-08 15:05:21.937771,0 days 00:00:27.712468,,,,,64,0.09035390021453094,64,0.8225127556710291,7,SGD,0.00048789725985653093,0.9881471786207305,4.2484746755840044e-06,3.0,1.0,1.0,COMPLETE
30,1.0,2026-10-08 15:05:22.071548,2026-10-08 15:05:40.434742,0 days 00:00:18.363194,,,,,200,0.018867345515944347,512,0.5339352171822247,6,SGD,0.007506176619890013,0.8053039978538832,4.9548073937280195e-05,3.0,1.0,1.0,COMPLETE
31,1.0,2026-10-08 15:05:40.566389,2026-10-08 15:05:58.871776,0 days 00:00:18.305387,,,,,200,0.031473963029197166,64,0.8517931931043382,6,SGD,0.059610888931774304,0.9784150436313195,0.0001326331314769226,4.0,1.0,1.0,COMPLETE
32,1.0,2026-10-08 15:05:59.002816,2026-10-08 15:06:17.372588,0 days 00:00:18.369772,,,,,200,0.02193218038967697,64,0.7184697045885658,8,SGD,0.02442549718111793,0.9399846038295605,0.00028909709530549216,1.0,1.0,1.0,COMPLETE
33,1.0,2026-10-08 15:06:17.508964,2026-10-08 15:06:35.951668,0 days 00:00:18.442704,,,,,200,0.008371369840840763,256,0.8945909491092041,6,SGD,0.05090066780727239,0.9603266356207153,0.00022297159364709622,3.0,1.0,1.0,COMPLETE
34,1.0,2026-10-08 15:06:36.085346,2026-10-08 15:06:56.985322,0 days 00:00:20.899976,,,,,128,0.01731928264788013,64,0.793239466977818,9,SGD,0.012719951564299817,0.857674668512006,0.0006884288789779973,2.0,1.0,1.0,COMPLETE
35,1.0,2026-10-08 15:06:57.118946,2026-10-08 15:07:15.658737,0 days 00:00:18.539791,0.9285227087660517,0.9024953252619158,0.0009392449615052684,3.571344592510507e-05,200,0.02811890648753892,256,0.7330553580635045,10,Adam,,,,1.0,1.0,1.0,COMPLETE
36,1.0,2026-10-08 15:07:15.795861,2026-10-08 15:07:36.636032,0 days 00:00:20.840171,,,,,128,0.007965821611568728,128,0.6112032339360634,16,SGD,0.09972583815944672,0.7446905869018761,0.001825374623087064,1.0,1.0,1.0,COMPLETE
37,1.0,2026-10-08 15:07:36.767916,2026-10-08 15:07:57.774645,0 days 00:00:21.006729,,,,,128,0.03233808838875914,64,0.2217003196039945,5,SGD,0.02203857409922358,0.9040029400742283,8.126047278839931e-05,1.0,1.0,1.0,COMPLETE
38,1.0,2026-10-08 15:07:57.908325,2026-10-08 15:08:26.389372,0 days 00:00:28.481047,0.8888380730757438,0.9351849276495087,0.0002622940430973794,0.0007410785953495474,64,0.07730486758669688,256,0.3969822278574724,19,Adam,,,,1.0,1.0,1.0,COMPLETE
39,1.0,2026-10-08 15:08:26.527351,2026-10-08 15:08:44.783860,0 days 00:00:18.256509,,,,,200,0.026794372205122388,128,0.6626305348973824,11,SGD,0.04001379601481075,0.7536206512910402,0.00976751412838765,2.0,1.0,1.0,COMPLETE
40,1.0,2026-10-08 15:08:44.915360,2026-10-08 15:09:14.623456,0 days 00:00:29.708096,,,,,64,0.048933604504007,512,0.8431315728641406,15,SGD,0.019506296000167934,0.9319164632323204,2.628257096990347e-05,1.0,1.0,1.0,COMPLETE
41,1.0,2026-10-08 15:09:14.767653,2026-10-08 15:09:37.685640,0 days 00:00:22.917987,,,,,128,0.02331403679194137,256,0.1426663923459629,8,SGD,0.05740122362792441,0.7375805181791293,1.6283135533217465e-05,1.0,1.0,1.0,COMPLETE
42,1.0,2026-10-08 15:09:37.826310,2026-10-08 15:10:01.515849,0 days 00:00:23.689539,,,,,128,0.041627434579671496,256,0.6344111039956182,10,SGD,0.06885693074855619,0.7996728399931052,0.005304341423323241,1.0,1.0,1.0,COMPLETE
43,1.0,2026-10-08 15:10:01.684043,2026-10-08 15:10:25.737586,0 days 00:00:24.053543,,,,,128,0.012660573808175028,256,0.7041757379137551,7,SGD,0.04031672554236196,0.7054592974087066,0.0002341769201799679,1.0,1.0,1.0,COMPLETE
44,1.0,2026-10-08 15:10:25.904755,2026-10-08 15:10:50.961633,0 days 00:00:25.056878,,,,,128,0.003405044465174034,256,0.803940280540763,8,SGD,0.001379392865944049,0.8423953171888641,0.0010007016508767693,7.0,1.0,1.0,COMPLETE
45,1.0,2026-10-08 15:10:51.097902,2026-10-08 15:11:21.000192,0 days 00:00:29.902290,0.9446140182524503,0.9742590952683388,0.002527500324479543,1.0638297999881121e-05,64,0.060195260234873274,128,0.7649114881102964,12,Adam,,,,1.0,1.0,1.0,COMPLETE
46,1.0,2026-10-08 15:11:21.134467,2026-10-08 15:11:44.071261,0 days 00:00:22.936794,,,,,128,0.03442064966870073,256,0.5671581950579433,6,SGD,0.004697749555689616,0.8105331057963048,0.0030512634862925997,2.0,1.0,1.0,COMPLETE
47,1.0,2026-10-08 15:11:44.213241,2026-10-08 15:12:15.093927,0 days 00:00:30.880686,,,,,64,0.017427352728266038,64,0.8616345758943657,17,SGD,0.016163809271715224,0.8761116822350488,0.00038906042108498344,1.0,1.0,1.0,COMPLETE
48,0.9902708880451239,2026-10-08 15:12:15.249698,2026-10-08 15:12:19.992243,0 days 00:00:04.742545,,,,,128,0.026393814520488744,256,0.3081990289968161,19,SGD,0.0005816831834861195,0.7306204425292449,8.643196528822587e-05,,,,PRUNED
49,0.4618187172267263,2026-10-08 15:12:20.134726,2026-10-08 15:12:24.309578,0 days 00:00:04.174852,,,,,200,0.04351949032906145,128,0.499931575830211,9,SGD,0.00016519516680951643,0.7617107097145466,1.4454553964539816e-05,,,,PRUNED
