number,value,datetime_start,datetime_complete,duration,params_adam_beta1,params_adam_beta2,params_adam_lr,params_adam_wd,params_batch_size,params_fc_dropout,params_fc_hidden,params_gru_hidden,params_lr_factor,params_lr_patience,params_optimizer,params_sgd_lr,params_sgd_momentum,params_sgd_wd,user_attrs_best_epoch,user_attrs_validation_accuracy,user_attrs_validation_macro_f1,state
0,0.9967756667884544,2026-10-09 09:33:37.131302,2026-10-09 09:34:00.025435,0 days 00:00:22.894133,,,,,128,0.34044600469728353,512,128,0.24545997376568052,7,SGD,0.0812324508558869,0.9414083658321223,7.068974950624607e-06,5.0,0.9964285714285714,0.9971227621483375,COMPLETE
1,0.9967756667884544,2026-10-09 09:34:00.169728,2026-10-09 09:34:30.727354,0 days 00:00:30.557626,,,,,64,0.3056937753654446,256,128,0.8591084298026667,20,SGD,0.006647135865318031,0.7494519958693145,1.8205657658407268e-06,10.0,0.9964285714285714,0.9971227621483375,COMPLETE
2,0.9968990379670404,2026-10-09 09:34:30.875180,2026-10-09 09:35:04.581199,0 days 00:00:33.706019,0.958518595270556,0.9938559442622625,0.00023426581058204064,0.00755681014127443,64,0.2246844304357644,128,64,0.815861880342119,14,Adam,,,,15.0,0.9964285714285714,0.9973695045055094,COMPLETE
3,0.9967756667884544,2026-10-09 09:35:04.729622,2026-10-09 09:35:25.578967,0 days 00:00:20.849345,,,,,200,0.15636968998990508,64,256,0.10441769369888193,18,SGD,0.09133995846860977,0.9239509830960306,6.235377135673162e-06,6.0,0.9964285714285714,0.9971227621483375,COMPLETE
4,0.9967756667884544,2026-10-09 09:35:25.718482,2026-10-09 09:35:48.844760,0 days 00:00:23.126278,,,,,128,0.23007332881069884,64,512,0.670595829778396,17,SGD,0.04588156549160976,0.8369423282969652,3.0086868214458464e-06,4.0,0.9964285714285714,0.9971227621483375,COMPLETE
5,0.9934614609692372,2026-10-09 09:35:48.988735,2026-10-09 09:35:53.116756,0 days 00:00:04.128021,0.860777187376031,0.9289461701460855,0.0032441600887341587,8.22607494622104e-06,200,0.4630265895704372,128,64,0.22897702980320356,19,Adam,,,,,,,PRUNED
6,0.9968965472574304,2026-10-09 09:35:53.258631,2026-10-09 09:36:16.264645,0 days 00:00:23.006014,0.9215046223608592,0.941699359214563,0.005265761277157428,1.0661259689433902e-06,128,0.1911740650167767,128,256,0.2776862483765842,6,Adam,,,,9.0,0.9964285714285714,0.9973645230862893,COMPLETE
7,0.9967756667884544,2026-10-09 09:36:16.407109,2026-10-09 09:36:39.920256,0 days 00:00:23.513147,0.8890105049931256,0.9907357620080687,0.0010124137770478635,1.6066267921727714e-06,128,0.21393619775098704,64,512,0.29164951253357796,7,Adam,,,,9.0,0.9964285714285714,0.9971227621483375,COMPLETE
8,0.481058215443786,2026-10-09 09:36:40.084513,2026-10-09 09:36:44.449369,0 days 00:00:04.364856,,,,,200,0.13611590802176332,256,128,0.642051489473826,5,SGD,0.0003627066608804413,0.7118247910508815,0.00023097861492693574,,,,PRUNED
9,0.9983911381633344,2026-10-09 09:36:44.595385,2026-10-09 09:37:21.401443,0 days 00:00:36.806058,0.9241510809698409,0.9241610438609551,0.004309673808203458,0.00016626592254031863,64,0.45093574135239245,512,512,0.17448221424471938,19,Adam,,,,19.0,0.9982142857142857,0.9985679906123829,COMPLETE
10,0.9952835723722824,2026-10-09 09:37:21.545605,2026-10-09 09:37:28.447128,0 days 00:00:06.901523,0.9843679044323588,0.9016920859429696,0.00011725656392458978,0.00039929059398053404,64,0.48781484431514655,512,512,0.4957154411376433,11,Adam,,,,,,,PRUNED
11,0.9968990379670404,2026-10-09 09:37:28.590880,2026-10-09 09:38:02.036283,0 days 00:00:33.445403,0.9483423582980172,0.9886564308648812,0.00017095619701832672,0.008244999781425327,64,0.3700318009673796,128,64,0.8419743835910882,14,Adam,,,,10.0,0.9964285714285714,0.9973695045055094,COMPLETE
12,0.9950917340219909,2026-10-09 09:38:02.178651,2026-10-09 09:38:08.801034,0 days 00:00:06.622383,0.9469712263418,0.9602863009741408,0.0007819724492732212,0.000495971356573714,64,0.4087696049520286,512,64,0.4768935327030339,15,Adam,,,,,,,PRUNED
13,0.9983911381633344,2026-10-09 09:38:08.944862,2026-10-09 09:38:41.813470,0 days 00:00:32.868608,0.9333886485699406,0.9658341155182645,0.0006070174602510761,0.008227491414396236,64,0.2791437787024873,512,64,0.4884259145348496,11,Adam,,,,13.0,0.9982142857142857,0.9985679906123829,COMPLETE
14,0.9937949429173032,2026-10-09 09:38:41.965671,2026-10-09 09:38:49.127173,0 days 00:00:07.161502,0.9129132069929524,0.9630412801511702,0.0016055253152326566,0.00018830480578896635,64,0.2817093297434319,512,512,0.4280808638551649,11,Adam,,,,,,,PRUNED
15,0.9892791487234771,2026-10-09 09:38:49.277187,2026-10-09 09:38:55.978603,0 days 00:00:06.701416,0.9182527208630035,0.9013166035166543,0.008345164947907388,4.856634213875753e-05,64,0.4196154753386481,512,64,0.10711617685271257,11,Adam,,,,,,,PRUNED
16,0.9983911381633344,2026-10-09 09:38:56.126883,2026-10-09 09:39:30.902625,0 days 00:00:34.775742,0.8911089396607084,0.9262547760804125,0.000460280564169032,0.0016697515541520592,64,0.27443993342891204,512,512,0.3675002833288365,9,Adam,,,,3.0,0.9982142857142857,0.9985679906123829,COMPLETE
17,0.989656794519193,2026-10-09 09:39:31.049119,2026-10-09 09:39:37.397197,0 days 00:00:06.348078,0.9356179536197521,0.9675433865471619,0.0024568198957438856,3.2949000789371815e-05,64,0.4262919349238171,512,256,0.6069446772624741,16,Adam,,,,,,,PRUNED
18,0.9983911381633344,2026-10-09 09:39:37.539748,2026-10-09 09:40:09.587514,0 days 00:00:32.047766,0.9750514484473475,0.9430244691142918,0.00040490690892195345,0.0014229022620494557,64,0.3506069966101463,512,512,0.7359603416007705,13,Adam,,,,41.0,0.9982142857142857,0.9985679906123829,COMPLETE
19,0.9857829899139913,2026-10-09 09:40:09.733235,2026-10-09 09:40:13.898518,0 days 00:00:04.165283,0.8979140224093702,0.9191302428226048,0.00884826828128799,7.956647069076004e-05,200,0.4544833724126026,256,64,0.5502646669122511,9,Adam,,,,,,,PRUNED
20,0.9983911381633344,2026-10-09 09:40:14.038854,2026-10-09 09:40:45.052956,0 days 00:00:31.014102,0.8682105052248709,0.9767182745158589,0.001350420832736693,1.2820957768741975e-05,64,0.3704629734317111,512,64,0.36149134271799177,20,Adam,,,,23.0,0.9982142857142857,0.9985679906123829,COMPLETE
21,0.9983911381633344,2026-10-09 09:40:45.193295,2026-10-09 09:41:17.360414,0 days 00:00:32.167119,0.8910602221610264,0.9188898821146271,0.00047459919134739895,0.002073081391015361,64,0.265836702637975,512,512,0.3807037022484895,9,Adam,,,,19.0,0.9982142857142857,0.9985679906123829,COMPLETE
22,0.9983911381633344,2026-10-09 09:41:17.501640,2026-10-09 09:41:49.537576,0 days 00:00:32.035936,0.9297212374111017,0.9443322285503502,0.0005150587952469139,0.00198784681080632,64,0.31081987861328325,512,512,0.17361620447899123,9,Adam,,,,26.0,0.9982142857142857,0.9985679906123829,COMPLETE
23,0.9983911381633344,2026-10-09 09:41:49.689381,2026-10-09 09:42:21.993107,0 days 00:00:32.303726,0.9025330562036952,0.9291374758667653,0.00029454969571921446,0.0037520483505900475,64,0.10010484492188515,512,512,0.3507404803092323,12,Adam,,,,26.0,0.9982142857142857,0.9985679906123829,COMPLETE
24,0.9983911381633344,2026-10-09 09:42:22.145524,2026-10-09 09:42:54.280678,0 days 00:00:32.135154,0.8782118017780749,0.915613649374701,0.0007386876964895533,0.0006568934101324157,64,0.24649298295270655,512,512,0.18326385718143767,8,Adam,,,,7.0,0.9982142857142857,0.9985679906123829,COMPLETE
25,0.9968990379670404,2026-10-09 09:42:54.420796,2026-10-09 09:43:27.784527,0 days 00:00:33.363731,0.8516570059214714,0.9324542268672431,0.0024474789187426175,0.0044043546722715345,64,0.29256957328599736,512,512,0.5369701288713273,10,Adam,,,,11.0,0.9964285714285714,0.9973695045055094,COMPLETE
26,0.42881713941362365,2026-10-09 09:43:27.930602,2026-10-09 09:43:34.458142,0 days 00:00:06.527540,,,,,64,0.18652478614458728,512,128,0.43134441078235397,17,SGD,0.00010717164696961851,0.8322380937132038,0.00769733641690921,,,,PRUNED
27,0.9983911381633344,2026-10-09 09:43:34.610393,2026-10-09 09:44:06.141735,0 days 00:00:31.531342,0.9094327536858672,0.9773559999015548,0.004932897638531318,0.0001558257603859938,64,0.32928355691694283,256,256,0.3191033364745526,5,Adam,,,,12.0,0.9982142857142857,0.9985679906123829,COMPLETE
28,0.9983911381633344,2026-10-09 09:44:06.282907,2026-10-09 09:44:29.819744,0 days 00:00:23.536837,0.9352559078581307,0.9554699186897557,0.00031985189410854215,0.0008198524676465988,128,0.39152821127479626,64,512,0.4164538174873943,13,Adam,,,,36.0,0.9982142857142857,0.9985679906123829,COMPLETE
29,0.9952835723722824,2026-10-09 09:44:29.960247,2026-10-09 09:44:37.681721,0 days 00:00:07.721474,,,,,200,0.34331339774136016,512,128,0.16664769347477654,7,SGD,0.0036412109708555507,0.9850264612429793,0.009793426963839487,,,,PRUNED
30,0.9967756667884544,2026-10-09 09:44:37.825256,2026-10-09 09:45:00.808858,0 days 00:00:22.983602,0.9571446906936751,0.9505474917479221,0.0006253822596746713,0.00024006861871101178,128,0.25852039212963257,512,64,0.2201824206087295,8,Adam,,,,4.0,0.9964285714285714,0.9971227621483375,COMPLETE
31,0.9983911381633344,2026-10-09 09:45:00.949170,2026-10-09 09:45:32.899803,0 days 00:00:31.950633,0.986601532044674,0.9389644991733956,0.00042170037959733214,0.0018942950458886243,64,0.3516789324828022,512,512,0.7526780919057579,12,Adam,,,,16.0,0.9982142857142857,0.9985679906123829,COMPLETE
32,0.9983911381633344,2026-10-09 09:45:33.051435,2026-10-09 09:46:05.113852,0 days 00:00:32.062417,0.973595214175221,0.9128305990597738,0.00019737104439953142,0.0012982791648009661,64,0.49945637302371454,512,512,0.7461178174637179,13,Adam,,,,16.0,0.9982142857142857,0.9985679906123829,COMPLETE
33,0.9983911381633344,2026-10-09 09:46:05.254433,2026-10-09 09:46:37.151402,0 days 00:00:31.896969,0.9722688799025913,0.9258573744850486,0.0003637158071936687,0.003942201782155297,64,0.3101535899667511,512,512,0.579816307357632,10,Adam,,,,49.0,0.9982142857142857,0.9985679906123829,COMPLETE
34,0.981103082815967,2026-10-09 09:46:37.293099,2026-10-09 09:46:43.538371,0 days 00:00:06.245272,,,,,64,0.2775082895661383,512,512,0.8989691994287865,15,SGD,0.0017825848643782736,0.8173170014229112,0.00011688568994715665,,,,PRUNED
35,0.9983911381633344,2026-10-09 09:46:43.684353,2026-10-09 09:47:15.558307,0 days 00:00:31.873954,0.8805004753418139,0.9366103040232581,0.00010066998956294575,0.0011019704955357523,64,0.38336356529727145,256,512,0.7184060859245843,19,Adam,,,,13.0,0.9982142857142857,0.9985679906123829,COMPLETE
36,0.9983911381633344,2026-10-09 09:47:15.705754,2026-10-09 09:47:46.522695,0 days 00:00:30.816941,0.9662688285512476,0.9479960416864921,0.001090465378153504,0.0033670972618429786,64,0.32709726591837157,128,128,0.48432407935146804,13,Adam,,,,8.0,0.9982142857142857,0.9985679906123829,COMPLETE
37,0.8451115917162764,2026-10-09 09:47:46.665537,2026-10-09 09:47:50.879379,0 days 00:00:04.213842,,,,,200,0.44716140766663265,64,256,0.7840212982765946,17,SGD,0.0008152069814598049,0.8855161503903932,0.0006305365466037913,,,,PRUNED
38,0.9983911381633344,2026-10-09 09:47:51.020376,2026-10-09 09:48:13.944246,0 days 00:00:22.923870,0.9447776753688093,0.9230480782396664,0.00025903786630104104,0.00034639919629272025,128,0.22736391215274449,512,64,0.6873213044818113,12,Adam,,,,38.0,0.9982142857142857,0.9985679906123829,COMPLETE
39,0.9983911381633344,2026-10-09 09:48:14.085100,2026-10-09 09:48:45.765065,0 days 00:00:31.679965,0.9260390783736029,0.9348638919165074,0.00016691615679447148,0.005631815090153655,64,0.20735166401436178,128,512,0.2971625215442475,19,Adam,,,,8.0,0.9982142857142857,0.9985679906123829,COMPLETE
40,0.9968990379670404,2026-10-09 09:48:45.904510,2026-10-09 09:49:16.362186,0 days 00:00:30.457676,,,,,64,0.30035554325185565,64,512,0.26385179679051496,10,SGD,0.016872860302131636,0.7713194557701728,3.489710945508505e-05,13.0,0.9964285714285714,0.9973695045055094,COMPLETE
41,0.9983911381633344,2026-10-09 09:49:16.501940,2026-10-09 09:49:47.271444,0 days 00:00:30.769504,0.8702051070719419,0.9756302351169075,0.001318120661981693,1.6259228565197623e-05,64,0.35610838469827616,512,64,0.37582421434983426,20,Adam,,,,36.0,0.9982142857142857,0.9985679906123829,COMPLETE
42,0.9983911381633344,2026-10-09 09:49:47.413502,2026-10-09 09:50:20.592242,0 days 00:00:33.178740,0.8651379345119818,0.9768133838378116,0.0017604623720955405,4.852772787503761e-06,64,0.40014251580898585,512,64,0.3564406837527433,18,Adam,,,,44.0,0.9982142857142857,0.9985679906123829,COMPLETE
43,0.9983911381633344,2026-10-09 09:50:20.733263,2026-10-09 09:50:52.388952,0 days 00:00:31.655689,0.8757722878649943,0.9849728714612556,0.0006586079248086546,0.00968541924373576,64,0.36913705583836576,512,64,0.22224883077943913,20,Adam,,,,24.0,0.9982142857142857,0.9985679906123829,COMPLETE
44,0.9983911381633344,2026-10-09 09:50:52.529240,2026-10-09 09:51:23.383481,0 days 00:00:30.854241,0.889200021457329,0.9957903770282825,0.004927049161764602,4.212945180057304e-06,64,0.4373566298068465,512,64,0.32104391338025734,18,Adam,,,,45.0,0.9982142857142857,0.9985679906123829,COMPLETE
45,0.9983911381633344,2026-10-09 09:51:23.524997,2026-10-09 09:51:54.556885,0 days 00:00:31.031888,0.8576584675886514,0.9089350679124122,0.0009043137751070896,0.00011880809092733008,64,0.4696455860758578,512,64,0.5145228897557047,19,Adam,,,,3.0,0.9982142857142857,0.9985679906123829,COMPLETE
46,0.9983911381633344,2026-10-09 09:51:54.698002,2026-10-09 09:52:15.134701,0 days 00:00:20.436699,0.9037568279759732,0.9541929092567344,0.0031953085145095665,1.2377334591904286e-05,200,0.24371378341662137,512,64,0.4600888029237367,16,Adam,,,,35.0,0.9982142857142857,0.9985679906123829,COMPLETE
47,0.9983911381633344,2026-10-09 09:52:15.275053,2026-10-09 09:52:38.329858,0 days 00:00:23.054805,0.9574518872614391,0.9693475128644841,0.0005005850799559956,2.5981875506131044e-05,128,0.3724612718483296,256,256,0.6261786809720105,8,Adam,,,,22.0,0.9982142857142857,0.9985679906123829,COMPLETE
48,0.9983911381633344,2026-10-09 09:52:38.470297,2026-10-09 09:53:09.449241,0 days 00:00:30.978944,0.8958538529357865,0.9859750530341744,0.0003711752292494447,0.0025830174243489674,64,0.3327610902458644,128,128,0.10473026151410418,14,Adam,,,,17.0,0.9982142857142857,0.9985679906123829,COMPLETE
49,0.9983911381633344,2026-10-09 09:53:09.592268,2026-10-09 09:53:41.774387,0 days 00:00:32.182119,0.9415868404247022,0.9421402676926706,0.00114758503730194,0.0011491561669980056,64,0.4747076314751412,512,512,0.40490647570570315,6,Adam,,,,13.0,0.9982142857142857,0.9985679906123829,COMPLETE
