number,value,datetime_start,datetime_complete,duration,params_adam_beta1,params_adam_beta2,params_adam_lr,params_adam_wd,params_batch_size,params_fc_dropout,params_fc_hidden,params_gru_hidden,params_lr_factor,params_lr_patience,params_optimizer,params_sgd_lr,params_sgd_momentum,params_sgd_wd,user_attrs_best_epoch,user_attrs_validation_accuracy,user_attrs_validation_macro_f1,system_attrs_tpe:relative_params:0,state
0,1.0,2026-10-10 18:25:55.016087,2026-10-10 18:26:19.412587,0 days 00:00:24.396500,,,,,128,0.34044600469728353,512,128,0.24545997376568052,7,SGD,0.0812324508558869,0.9414083658321223,7.068974950624607e-06,2.0,1.0,1.0,,COMPLETE
1,1.0,2026-10-10 18:26:19.483017,2026-10-10 18:26:49.731207,0 days 00:00:30.248190,,,,,64,0.3056937753654446,256,128,0.8591084298026667,20,SGD,0.006647135865318031,0.7494519958693145,1.8205657658407268e-06,3.0,1.0,1.0,,COMPLETE
2,1.0,2026-10-10 18:26:49.823701,2026-10-10 18:27:19.673889,0 days 00:00:29.850188,0.958518595270556,0.9938559442622625,0.00023426581058204064,0.00755681014127443,64,0.2246844304357644,128,64,0.815861880342119,14,Adam,,,,1.0,1.0,1.0,,COMPLETE
3,1.0,2026-10-10 18:27:19.736522,2026-10-10 18:27:42.604461,0 days 00:00:22.867939,,,,,200,0.15636968998990508,64,256,0.10441769369888193,18,SGD,0.09133995846860977,0.9239509830960306,6.235377135673162e-06,2.0,1.0,1.0,,COMPLETE
4,1.0,2026-10-10 18:27:42.674625,2026-10-10 18:28:04.423788,0 days 00:00:21.749163,,,,,128,0.23007332881069884,64,512,0.670595829778396,17,SGD,0.04588156549160976,0.8369423282969652,3.0086868214458464e-06,1.0,1.0,1.0,,COMPLETE
5,1.0,2026-10-10 18:28:04.501765,2026-10-10 18:28:25.210753,0 days 00:00:20.708988,0.860777187376031,0.9289461701460855,0.0032441600887341587,8.22607494622104e-06,200,0.4630265895704372,128,64,0.22897702980320356,19,Adam,,,,6.0,1.0,1.0,,COMPLETE
6,1.0,2026-10-10 18:28:25.273243,2026-10-10 18:28:49.490691,0 days 00:00:24.217448,0.9215046223608592,0.941699359214563,0.005265761277157428,1.0661259689433902e-06,128,0.1911740650167767,128,256,0.2776862483765842,6,Adam,,,,4.0,1.0,1.0,,COMPLETE
7,1.0,2026-10-10 18:28:49.554006,2026-10-10 18:29:11.835572,0 days 00:00:22.281566,0.8890105049931256,0.9907357620080687,0.0010124137770478635,1.6066267921727714e-06,128,0.21393619775098704,64,512,0.29164951253357796,7,Adam,,,,1.0,1.0,1.0,,COMPLETE
8,0.8985236645720247,2026-10-10 18:29:11.913269,2026-10-10 18:29:17.119207,0 days 00:00:05.205938,,,,,200,0.13611590802176332,256,128,0.642051489473826,5,SGD,0.0003627066608804413,0.7118247910508815,0.00023097861492693574,,,,,PRUNED
9,0.9981236859356156,2026-10-10 18:29:17.184540,2026-10-10 18:29:23.611857,0 days 00:00:06.427317,0.9241510809698409,0.9241610438609551,0.004309673808203458,0.00016626592254031863,64,0.45093574135239245,512,512,0.17448221424471938,19,Adam,,,,,,,,PRUNED
10,0.994856613004694,2026-10-10 18:29:23.675476,2026-10-10 18:29:28.022943,0 days 00:00:04.347467,,,,,128,0.4263380806691902,512,128,0.8009431865023557,14,SGD,0.00012637268261792882,0.9632227906319301,0.0069037170554346996,,,,"{""batch_size"": 128, ""fc_dropout"": 0.4263380806691902, ""fc_hidden"": 512, ""gru_hidden"": 128, ""lr_factor"": 0.8009431865023557, ""lr_patience"": 14, ""optimizer"": ""SGD""}",PRUNED
11,1.0,2026-10-10 18:29:28.090796,2026-10-10 18:29:57.634742,0 days 00:00:29.543946,,,,,64,0.19804134821694666,256,128,0.6047942010766869,17,SGD,0.007034141884024398,0.7194214722682553,1.3609878797304248e-06,2.0,1.0,1.0,"{""batch_size"": 64, ""fc_dropout"": 0.19804134821694666, ""fc_hidden"": 256, ""gru_hidden"": 128, ""lr_factor"": 0.6047942010766869, ""lr_patience"": 17, ""optimizer"": ""SGD""}",COMPLETE
12,1.0,2026-10-10 18:29:57.700649,2026-10-10 18:30:22.303252,0 days 00:00:24.602603,,,,,128,0.3359116102910983,512,128,0.5200842939740074,5,SGD,0.0057865676906060405,0.8417237627028324,2.832101405577729e-05,2.0,1.0,1.0,"{""batch_size"": 128, ""fc_dropout"": 0.3359116102910983, ""fc_hidden"": 512, ""gru_hidden"": 128, ""lr_factor"": 0.5200842939740074, ""lr_patience"": 5, ""optimizer"": ""SGD""}",COMPLETE
13,1.0,2026-10-10 18:30:22.395525,2026-10-10 18:30:46.416137,0 days 00:00:24.020612,,,,,128,0.3037610333131809,256,128,0.2538135868683995,20,SGD,0.010817904551323624,0.8213913384017654,2.522348399717643e-05,2.0,1.0,1.0,"{""batch_size"": 128, ""fc_dropout"": 0.3037610333131809, ""fc_hidden"": 256, ""gru_hidden"": 128, ""lr_factor"": 0.2538135868683995, ""lr_patience"": 20, ""optimizer"": ""SGD""}",COMPLETE
14,1.0,2026-10-10 18:30:46.502494,2026-10-10 18:31:07.611817,0 days 00:00:21.109323,,,,,128,0.22328992398935982,512,128,0.3788326690654604,12,SGD,0.001438505319076043,0.773705533165201,1.773943337541542e-05,9.0,1.0,1.0,"{""batch_size"": 128, ""fc_dropout"": 0.22328992398935982, ""fc_hidden"": 512, ""gru_hidden"": 128, ""lr_factor"": 0.3788326690654604, ""lr_patience"": 12, ""optimizer"": ""SGD""}",COMPLETE
15,1.0,2026-10-10 18:31:07.677962,2026-10-10 18:31:37.986858,0 days 00:00:30.308896,,,,,64,0.40129153674912543,512,128,0.4025383433500536,19,SGD,0.024783866147136107,0.921803892746769,1.2497206148412616e-06,1.0,1.0,1.0,"{""batch_size"": 64, ""fc_dropout"": 0.40129153674912543, ""fc_hidden"": 512, ""gru_hidden"": 128, ""lr_factor"": 0.4025383433500536, ""lr_patience"": 19, ""optimizer"": ""SGD""}",COMPLETE
16,1.0,2026-10-10 18:31:38.049938,2026-10-10 18:31:59.850683,0 days 00:00:21.800745,,,,,128,0.31469071628498557,256,128,0.8865271375198006,16,SGD,0.0014340411871148681,0.9810882570941282,0.00021033202515101796,4.0,1.0,1.0,"{""batch_size"": 128, ""fc_dropout"": 0.31469071628498557, ""fc_hidden"": 256, ""gru_hidden"": 128, ""lr_factor"": 0.8865271375198006, ""lr_patience"": 16, ""optimizer"": ""SGD""}",COMPLETE
17,1.0,2026-10-10 18:31:59.916018,2026-10-10 18:32:21.038423,0 days 00:00:21.122405,,,,,128,0.33061939837369286,512,128,0.14418464777567053,15,SGD,0.001900153697738678,0.9016077192182802,6.431386862484421e-06,3.0,1.0,1.0,"{""batch_size"": 128, ""fc_dropout"": 0.33061939837369286, ""fc_hidden"": 512, ""gru_hidden"": 128, ""lr_factor"": 0.14418464777567053, ""lr_patience"": 15, ""optimizer"": ""SGD""}",COMPLETE
18,1.0,2026-10-10 18:32:21.108323,2026-10-10 18:32:49.138774,0 days 00:00:28.030451,,,,,64,0.33916762262926436,64,128,0.8481651790023066,8,SGD,0.0189303796334692,0.7816101352778981,8.983720867699325e-05,1.0,1.0,1.0,"{""batch_size"": 64, ""fc_dropout"": 0.33916762262926436, ""fc_hidden"": 64, ""gru_hidden"": 128, ""lr_factor"": 0.8481651790023066, ""lr_patience"": 8, ""optimizer"": ""SGD""}",COMPLETE
19,1.0,2026-10-10 18:32:49.223028,2026-10-10 18:33:11.757223,0 days 00:00:22.534195,,,,,128,0.321247211876746,512,128,0.46277918072474766,11,SGD,0.07069287910732099,0.883333296764554,0.001802913216152519,1.0,1.0,1.0,"{""batch_size"": 128, ""fc_dropout"": 0.321247211876746, ""fc_hidden"": 512, ""gru_hidden"": 128, ""lr_factor"": 0.46277918072474766, ""lr_patience"": 11, ""optimizer"": ""SGD""}",COMPLETE
20,1.0,2026-10-10 18:33:11.819792,2026-10-10 18:33:34.184263,0 days 00:00:22.364471,,,,,128,0.38484760087056513,256,128,0.2727976479399866,15,SGD,0.004484441235960991,0.7574449042492319,6.096393461206913e-06,3.0,1.0,1.0,"{""batch_size"": 128, ""fc_dropout"": 0.38484760087056513, ""fc_hidden"": 256, ""gru_hidden"": 128, ""lr_factor"": 0.2727976479399866, ""lr_patience"": 15, ""optimizer"": ""SGD""}",COMPLETE
21,1.0,2026-10-10 18:33:34.254243,2026-10-10 18:34:03.170115,0 days 00:00:28.915872,0.9767253504480514,0.9990285918947457,0.00010324106331974228,0.007705575865146891,64,0.20224170187045454,128,64,0.2891841436197745,15,Adam,,,,2.0,1.0,1.0,"{""batch_size"": 64, ""fc_dropout"": 0.20224170187045454, ""fc_hidden"": 128, ""gru_hidden"": 64, ""lr_factor"": 0.2891841436197745, ""lr_patience"": 15, ""optimizer"": ""Adam""}",COMPLETE
22,1.0,2026-10-10 18:34:03.236598,2026-10-10 18:34:31.419637,0 days 00:00:28.183039,,,,,64,0.32847636917907574,256,128,0.8839295494928953,20,SGD,0.02884017264879498,0.8724767170220291,1.0280243279079564e-06,1.0,1.0,1.0,"{""batch_size"": 64, ""fc_dropout"": 0.32847636917907574, ""fc_hidden"": 256, ""gru_hidden"": 128, ""lr_factor"": 0.8839295494928953, ""lr_patience"": 20, ""optimizer"": ""SGD""}",COMPLETE
23,1.0,2026-10-10 18:34:31.486484,2026-10-10 18:35:00.558960,0 days 00:00:29.072476,0.9891379899069592,0.9629224376744384,0.0001248376602328932,0.00841884176790426,64,0.11127872146495428,128,64,0.42505039465168515,10,Adam,,,,5.0,1.0,1.0,"{""batch_size"": 64, ""fc_dropout"": 0.11127872146495428, ""fc_hidden"": 128, ""gru_hidden"": 64, ""lr_factor"": 0.42505039465168515, ""lr_patience"": 10, ""optimizer"": ""Adam""}",COMPLETE
24,1.0,2026-10-10 18:35:00.621732,2026-10-10 18:35:27.647266,0 days 00:00:27.025534,,,,,64,0.27287482189791595,256,128,0.770555681698031,18,SGD,0.0006301399943418395,0.803796710600992,6.755684203367479e-05,10.0,1.0,1.0,"{""batch_size"": 64, ""fc_dropout"": 0.27287482189791595, ""fc_hidden"": 256, ""gru_hidden"": 128, ""lr_factor"": 0.770555681698031, ""lr_patience"": 18, ""optimizer"": ""SGD""}",COMPLETE
25,1.0,2026-10-10 18:35:27.763956,2026-10-10 18:35:56.764213,0 days 00:00:29.000257,0.9475952057867243,0.9054862634503761,0.000525250071963958,0.00012594933453311487,64,0.22553025137576632,128,64,0.5153714285236308,12,Adam,,,,1.0,1.0,1.0,"{""batch_size"": 64, ""fc_dropout"": 0.22553025137576632, ""fc_hidden"": 128, ""gru_hidden"": 64, ""lr_factor"": 0.5153714285236308, ""lr_patience"": 12, ""optimizer"": ""Adam""}",COMPLETE
26,1.0,2026-10-10 18:35:56.837905,2026-10-10 18:36:20.919183,0 days 00:00:24.081278,,,,,128,0.3734638660521435,512,128,0.12333700979492561,8,SGD,0.002847228536508383,0.7396575367262468,4.638653404648949e-06,5.0,1.0,1.0,"{""batch_size"": 128, ""fc_dropout"": 0.3734638660521435, ""fc_hidden"": 512, ""gru_hidden"": 128, ""lr_factor"": 0.12333700979492561, ""lr_patience"": 8, ""optimizer"": ""SGD""}",COMPLETE
27,1.0,2026-10-10 18:36:21.008550,2026-10-10 18:36:50.408668,0 days 00:00:29.400118,0.8544010248554437,0.9694657522805871,0.00042889205913210996,0.0005449276850811102,64,0.303061242618602,128,64,0.568919735834833,18,Adam,,,,1.0,1.0,1.0,"{""batch_size"": 64, ""fc_dropout"": 0.303061242618602, ""fc_hidden"": 128, ""gru_hidden"": 64, ""lr_factor"": 0.568919735834833, ""lr_patience"": 18, ""optimizer"": ""Adam""}",COMPLETE
28,1.0,2026-10-10 18:36:50.471724,2026-10-10 18:37:12.035463,0 days 00:00:21.563739,,,,,128,0.43912154832227485,512,128,0.3256517148334721,10,SGD,0.013197716228885235,0.9501962482600422,1.541674295863059e-05,1.0,1.0,1.0,"{""batch_size"": 128, ""fc_dropout"": 0.43912154832227485, ""fc_hidden"": 512, ""gru_hidden"": 128, ""lr_factor"": 0.3256517148334721, ""lr_patience"": 10, ""optimizer"": ""SGD""}",COMPLETE
29,0.9982567774182818,2026-10-10 18:37:12.098558,2026-10-10 18:37:16.476813,0 days 00:00:04.378255,,,,,128,0.24701729978499581,256,128,0.792407634245772,14,SGD,0.00048077431498039024,0.8557769243860938,3.054376054019775e-06,,,,"{""batch_size"": 128, ""fc_dropout"": 0.24701729978499581, ""fc_hidden"": 256, ""gru_hidden"": 128, ""lr_factor"": 0.792407634245772, ""lr_patience"": 14, ""optimizer"": ""SGD""}",PRUNED
30,1.0,2026-10-10 18:37:16.546813,2026-10-10 18:37:46.006098,0 days 00:00:29.459285,0.8908332995129845,0.968648098046343,0.001359295065641698,0.001079595243777931,64,0.17113697085989288,128,64,0.6529563168865129,18,Adam,,,,1.0,1.0,1.0,"{""batch_size"": 64, ""fc_dropout"": 0.17113697085989288, ""fc_hidden"": 128, ""gru_hidden"": 64, ""lr_factor"": 0.6529563168865129, ""lr_patience"": 18, ""optimizer"": ""Adam""}",COMPLETE
31,1.0,2026-10-10 18:37:46.070670,2026-10-10 18:38:06.271484,0 days 00:00:20.200814,,,,,200,0.13650596632654052,64,256,0.16870508320436556,18,SGD,0.060624457087867,0.9276712170075928,9.54390240377562e-06,1.0,1.0,1.0,"{""batch_size"": 200, ""fc_dropout"": 0.13650596632654052, ""fc_hidden"": 64, ""gru_hidden"": 256, ""lr_factor"": 0.16870508320436556, ""lr_patience"": 18, ""optimizer"": ""SGD""}",COMPLETE
32,1.0,2026-10-10 18:38:06.334335,2026-10-10 18:38:26.744882,0 days 00:00:20.410547,,,,,200,0.1392852085397132,64,256,0.3328829131448502,20,SGD,0.07909192903414156,0.9853664549192008,2.268074936370517e-06,1.0,1.0,1.0,"{""batch_size"": 200, ""fc_dropout"": 0.1392852085397132, ""fc_hidden"": 64, ""gru_hidden"": 256, ""lr_factor"": 0.3328829131448502, ""lr_patience"": 20, ""optimizer"": ""SGD""}",COMPLETE
33,1.0,2026-10-10 18:38:26.807634,2026-10-10 18:38:55.167410,0 days 00:00:28.359776,,,,,64,0.18934446750873918,64,256,0.14279608555566048,20,SGD,0.03208085383677544,0.9372923504606272,5.359357233147312e-05,2.0,1.0,1.0,"{""batch_size"": 64, ""fc_dropout"": 0.18934446750873918, ""fc_hidden"": 64, ""gru_hidden"": 256, ""lr_factor"": 0.14279608555566048, ""lr_patience"": 20, ""optimizer"": ""SGD""}",COMPLETE
34,1.0,2026-10-10 18:38:55.231146,2026-10-10 18:39:16.181349,0 days 00:00:20.950203,,,,,200,0.2403729341486578,64,256,0.17167498626433847,14,SGD,0.0814598826921841,0.909548223027242,9.139997988048723e-06,1.0,1.0,1.0,"{""batch_size"": 200, ""fc_dropout"": 0.2403729341486578, ""fc_hidden"": 64, ""gru_hidden"": 256, ""lr_factor"": 0.17167498626433847, ""lr_patience"": 14, ""optimizer"": ""SGD""}",COMPLETE
35,1.0,2026-10-10 18:39:16.248135,2026-10-10 18:39:45.783845,0 days 00:00:29.535710,,,,,64,0.40583695925889535,256,256,0.8438091159885851,18,SGD,0.0385347594074108,0.8865899289926148,2.7081680165812613e-06,1.0,1.0,1.0,"{""batch_size"": 64, ""fc_dropout"": 0.40583695925889535, ""fc_hidden"": 256, ""gru_hidden"": 256, ""lr_factor"": 0.8438091159885851, ""lr_patience"": 18, ""optimizer"": ""SGD""}",COMPLETE
36,1.0,2026-10-10 18:39:45.873260,2026-10-10 18:40:14.394976,0 days 00:00:28.521716,,,,,64,0.26937400418227736,512,128,0.7886550728216979,20,SGD,0.015721019972716167,0.9505171512196657,1.1538202921783127e-05,1.0,1.0,1.0,"{""batch_size"": 64, ""fc_dropout"": 0.26937400418227736, ""fc_hidden"": 512, ""gru_hidden"": 128, ""lr_factor"": 0.7886550728216979, ""lr_patience"": 20, ""optimizer"": ""SGD""}",COMPLETE
37,1.0,2026-10-10 18:40:14.457826,2026-10-10 18:40:35.968765,0 days 00:00:21.510939,,,,,200,0.1927317689926089,64,256,0.28949955183023235,14,SGD,0.0904887308772402,0.7930570928414671,3.6256472654439425e-05,1.0,1.0,1.0,"{""batch_size"": 200, ""fc_dropout"": 0.1927317689926089, ""fc_hidden"": 64, ""gru_hidden"": 256, ""lr_factor"": 0.28949955183023235, ""lr_patience"": 14, ""optimizer"": ""SGD""}",COMPLETE
38,1.0,2026-10-10 18:40:36.035147,2026-10-10 18:40:58.504982,0 days 00:00:22.469835,,,,,200,0.10374674935080892,64,64,0.2743520398725716,14,SGD,0.04698701336093294,0.8608159595016913,4.343964590660716e-06,1.0,1.0,1.0,"{""batch_size"": 200, ""fc_dropout"": 0.10374674935080892, ""fc_hidden"": 64, ""gru_hidden"": 64, ""lr_factor"": 0.2743520398725716, ""lr_patience"": 14, ""optimizer"": ""SGD""}",COMPLETE
39,1.0,2026-10-10 18:40:58.605990,2026-10-10 18:41:26.162858,0 days 00:00:27.556868,,,,,64,0.14799170016321878,256,128,0.8210794575967082,18,SGD,0.009636703444565603,0.8180789489654474,2.1379178315761246e-06,1.0,1.0,1.0,"{""batch_size"": 64, ""fc_dropout"": 0.14799170016321878, ""fc_hidden"": 256, ""gru_hidden"": 128, ""lr_factor"": 0.8210794575967082, ""lr_patience"": 18, ""optimizer"": ""SGD""}",COMPLETE
40,1.0,2026-10-10 18:41:26.225732,2026-10-10 18:41:54.443400,0 days 00:00:28.217668,,,,,64,0.3509444286683631,256,128,0.7986601252470161,16,SGD,0.04828564899853689,0.9010711363700503,0.00015453388404117627,1.0,1.0,1.0,"{""batch_size"": 64, ""fc_dropout"": 0.3509444286683631, ""fc_hidden"": 256, ""gru_hidden"": 128, ""lr_factor"": 0.7986601252470161, ""lr_patience"": 16, ""optimizer"": ""SGD""}",COMPLETE
41,1.0,2026-10-10 18:41:54.528054,2026-10-10 18:42:24.511699,0 days 00:00:29.983645,0.9573693416399771,0.9002665293316005,0.0003148093084077925,1.864185686985697e-05,64,0.26383580137258894,128,64,0.725815854462916,8,Adam,,,,2.0,1.0,1.0,"{""batch_size"": 64, ""fc_dropout"": 0.26383580137258894, ""fc_hidden"": 128, ""gru_hidden"": 64, ""lr_factor"": 0.725815854462916, ""lr_patience"": 8, ""optimizer"": ""Adam""}",COMPLETE
42,1.0,2026-10-10 18:42:24.574680,2026-10-10 18:42:47.258960,0 days 00:00:22.684280,,,,,200,0.1887089861492164,128,256,0.14158288877912634,17,SGD,0.022068688166485547,0.7041722340366244,3.4283097098235712e-06,1.0,1.0,1.0,"{""batch_size"": 200, ""fc_dropout"": 0.1887089861492164, ""fc_hidden"": 128, ""gru_hidden"": 256, ""lr_factor"": 0.14158288877912634, ""lr_patience"": 17, ""optimizer"": ""SGD""}",COMPLETE
43,1.0,2026-10-10 18:42:47.326616,2026-10-10 18:43:07.590906,0 days 00:00:20.264290,,,,,200,0.23813564145103255,64,256,0.19263054737273017,18,SGD,0.04359273441832032,0.8351180347024543,1.8155667019882234e-06,1.0,1.0,1.0,"{""batch_size"": 200, ""fc_dropout"": 0.23813564145103255, ""fc_hidden"": 64, ""gru_hidden"": 256, ""lr_factor"": 0.19263054737273017, ""lr_patience"": 18, ""optimizer"": ""SGD""}",COMPLETE
44,0.8529435328889334,2026-10-10 18:43:07.657328,2026-10-10 18:43:12.050720,0 days 00:00:04.393392,,,,,128,0.28879486043543845,64,512,0.5817132339797512,16,SGD,0.000194875464820897,0.7309035093523819,6.5364208219820515e-06,,,,"{""batch_size"": 128, ""fc_dropout"": 0.28879486043543845, ""fc_hidden"": 64, ""gru_hidden"": 512, ""lr_factor"": 0.5817132339797512, ""lr_patience"": 16, ""optimizer"": ""SGD""}",PRUNED
45,1.0,2026-10-10 18:43:12.115113,2026-10-10 18:43:33.375097,0 days 00:00:21.259984,,,,,128,0.24386827683540127,64,512,0.8565741725033551,16,SGD,0.09845429601208217,0.9628671387878869,0.0009395580343696493,3.0,1.0,1.0,"{""batch_size"": 128, ""fc_dropout"": 0.24386827683540127, ""fc_hidden"": 64, ""gru_hidden"": 512, ""lr_factor"": 0.8565741725033551, ""lr_patience"": 16, ""optimizer"": ""SGD""}",COMPLETE
46,1.0,2026-10-10 18:43:33.438789,2026-10-10 18:43:55.438701,0 days 00:00:21.999912,,,,,128,0.2653512780553495,64,512,0.32461874152241765,17,SGD,0.00803408432065121,0.7544316181935771,2.1759752537219886e-05,2.0,1.0,1.0,"{""batch_size"": 128, ""fc_dropout"": 0.2653512780553495, ""fc_hidden"": 64, ""gru_hidden"": 512, ""lr_factor"": 0.32461874152241765, ""lr_patience"": 17, ""optimizer"": ""SGD""}",COMPLETE
47,1.0,2026-10-10 18:43:55.502838,2026-10-10 18:44:26.113222,0 days 00:00:30.610384,,,,,64,0.24893166516163745,256,128,0.8919572311511459,20,SGD,0.004647737460660203,0.8426297351965428,1.8387379835036885e-06,1.0,1.0,1.0,"{""batch_size"": 64, ""fc_dropout"": 0.24893166516163745, ""fc_hidden"": 256, ""gru_hidden"": 128, ""lr_factor"": 0.8919572311511459, ""lr_patience"": 20, ""optimizer"": ""SGD""}",COMPLETE
48,1.0,2026-10-10 18:44:26.183846,2026-10-10 18:44:48.139979,0 days 00:00:21.956133,,,,,128,0.1962335659834853,64,512,0.5974415914087788,16,SGD,0.053226049575396873,0.9698105787884611,1.225358533238747e-05,4.0,1.0,1.0,"{""batch_size"": 128, ""fc_dropout"": 0.1962335659834853, ""fc_hidden"": 64, ""gru_hidden"": 512, ""lr_factor"": 0.5974415914087788, ""lr_patience"": 16, ""optimizer"": ""SGD""}",COMPLETE
49,1.0,2026-10-10 18:44:48.203525,2026-10-10 18:45:09.359078,0 days 00:00:21.155553,,,,,128,0.324879737721468,512,128,0.21793378498484442,6,SGD,0.0007944960631457965,0.9180600302245661,0.00593633033642904,5.0,1.0,1.0,"{""batch_size"": 128, ""fc_dropout"": 0.324879737721468, ""fc_hidden"": 512, ""gru_hidden"": 128, ""lr_factor"": 0.21793378498484442, ""lr_patience"": 6, ""optimizer"": ""SGD""}",COMPLETE
