number,value,datetime_start,datetime_complete,duration,params_adam_beta1,params_adam_beta2,params_adam_lr,params_adam_wd,params_batch_size,params_block_0_dropout,params_block_0_filters,params_block_0_kernel,params_block_0_stride,params_block_1_dropout,params_block_1_filters,params_block_1_kernel,params_block_1_stride,params_block_2_dropout,params_block_2_filters,params_block_2_kernel,params_block_2_stride,params_block_3_dropout,params_block_3_filters,params_block_3_kernel,params_block_3_stride,params_fc_hidden,params_first_conv_filters,params_first_conv_kernel_size,params_lr_factor,params_lr_patience,params_n_blocks,params_optimizer,params_sgd_lr,params_sgd_momentum,params_sgd_wd,user_attrs_best_epoch,user_attrs_validation_accuracy,user_attrs_validation_macro_f1,state
0,0.43050821122888083,2026-10-01 16:01:43.073369,2026-10-01 16:03:48.280134,0 days 00:02:05.206765,0.8926459276842719,0.9097574441892378,0.00853618986286683,0.0017123375973163992,128.0,0.08491983767203796,8,5,3,0.06506676052501416,16,3,2,0.06331731119758383,128,3,1,,,,,256,256,7,0.5105398159072941,12.0,3,Adam,,,,48.0,0.40714285714285714,0.4538735653149045,COMPLETE
1,0.5659035305651847,2026-10-01 16:03:48.433862,2026-10-01 16:06:03.096525,0 days 00:02:14.662663,,,,,128.0,0.06381099809299767,16,7,3,0.08458637582367365,16,3,2,0.07950202923669918,128,3,1,0.07361716094628554,256.0,3.0,1.0,256,256,7,0.13813501017161417,9.0,4,SGD,0.038842777547031436,0.8807564567799918,2.106648601704221e-05,50.0,0.5428571428571428,0.5889499182732265,COMPLETE
2,0.5398691951323531,2026-10-01 16:06:03.228180,2026-10-01 16:07:16.204984,0 days 00:01:12.976804,0.970502281655888,0.9006945178400659,0.0007148510793512986,0.0018709365688887364,64.0,0.019710228429397403,8,7,3,0.07799960246887438,32,3,1,0.0884314531168946,128,3,2,0.05854080177240857,256.0,3.0,1.0,256,256,3,0.4064483815465394,11.0,4,Adam,,,,47.0,0.5285714285714286,0.5511669616932775,COMPLETE
3,,2026-10-01 16:07:16.340139,2026-10-01 16:07:16.390743,0 days 00:00:00.050604,,,,,,0.013319825261907952,8,7,3,0.05405074842498068,16,3,2,0.06690752475342215,32,5,2,0.08517722460303143,64.0,3.0,1.0,,256,5,,,4,,,,,,,,PRUNED
4,0.5343019299541039,2026-10-01 16:07:16.521786,2026-10-01 16:08:14.476122,0 days 00:00:57.954336,0.8642060160012445,0.9662838267338948,0.0016325185294676916,1.088399181393814e-06,128.0,0.09430569898630611,16,7,3,0.08354999801810943,32,5,1,0.04051268119438307,32,3,2,0.08983777818386056,256.0,3.0,1.0,128,128,5,0.10303695030773122,7.0,4,Adam,,,,50.0,0.5142857142857142,0.5543181456224934,COMPLETE
5,,2026-10-01 16:08:14.609554,2026-10-01 16:08:14.655879,0 days 00:00:00.046325,,,,,,0.03386821309135529,8,5,3,0.06192134961637233,32,5,2,0.09464127259176229,128,5,2,0.011391095487598068,64.0,3.0,1.0,,512,3,,,4,,,,,,,,PRUNED
6,0.44246456038532994,2026-10-01 16:08:14.789479,2026-10-01 16:14:03.829664,0 days 00:05:49.040185,0.897319321959215,0.9375207369687304,0.0039046790191830895,0.0036309591863459105,128.0,0.07264268170074757,8,5,3,0.0766691755978784,64,5,1,0.09219164973008243,64,3,1,,,,,512,512,7,0.1563891639045214,14.0,3,Adam,,,,50.0,0.42142857142857143,0.46350054934208845,COMPLETE
7,0.6687117484901882,2026-10-01 16:14:03.964899,2026-10-01 16:16:17.026450,0 days 00:02:13.061551,0.8891907455724319,0.9953910415382531,0.0026865309327169084,0.00043731009905162676,64.0,0.01768127184943912,32,5,3,0.03906608256471214,64,3,2,0.07263767854843282,32,5,2,,,,,128,512,3,0.5427381500174611,13.0,3,Adam,,,,43.0,0.6642857142857143,0.6731377826946622,COMPLETE
8,0.4708874458874459,2026-10-01 16:16:17.161260,2026-10-01 16:18:46.731353,0 days 00:02:29.570093,,,,,64.0,0.05261245937025092,8,5,3,0.06632739241428127,32,3,1,0.0627198023146117,64,5,2,,,,,128,512,5,0.6767143382943485,19.0,3,SGD,0.004333615420461955,0.9730247945451923,3.502761367842316e-05,,,,PRUNED
9,0.41036468328958164,2026-10-01 16:18:46.884797,2026-10-01 16:19:20.733492,0 days 00:00:33.848695,,,,,128.0,0.06660485621018956,16,5,3,0.0991454627800606,16,5,1,0.07757839610123476,128,3,2,0.05547271352030715,256.0,3.0,1.0,512,128,7,0.6700371802304829,20.0,4,SGD,0.0520170752104338,0.7264731362679787,1.8934530915191556e-05,,,,PRUNED
10,0.3236082146220395,2026-10-01 16:19:20.874441,2026-10-01 16:19:47.786858,0 days 00:00:26.912417,0.9740823912733333,0.9925265187462552,0.00011276182231780688,1.0341591364653288e-05,64.0,0.04094807897017133,32,5,3,0.020186058701089256,64,3,2,0.02058969429153098,32,5,1,,,,,128,512,3,0.31969431875426024,5.0,3,Adam,,,,,,,PRUNED
11,0.26495225254787824,2026-10-01 16:19:47.927935,2026-10-01 16:20:14.604475,0 days 00:00:26.676540,,,,,64.0,0.05474278032756174,32,7,3,0.03215496353211566,64,3,2,0.04943896375719893,32,5,1,,,,,256,256,7,0.3177416615263008,9.0,3,SGD,0.00010400156812649853,0.8848086369790308,0.005705816531711808,,,,PRUNED
12,0.6118487220915998,2026-10-01 16:20:14.746652,2026-10-01 16:23:24.377926,0 days 00:03:09.631274,,,,,128.0,0.02780713011132846,32,7,3,0.04052620465083341,64,3,2,0.07873726554233679,128,5,1,,,,,256,512,3,0.5469726530650095,15.0,3,SGD,0.08770466341870434,0.7748633071337755,1.1494338890576943e-06,37.0,0.6,0.6236974441831995,COMPLETE
13,0.24822506077529827,2026-10-01 16:23:24.514670,2026-10-01 16:23:55.649440,0 days 00:00:31.134770,,,,,64.0,0.027409945933096754,32,7,3,0.04301363510188566,64,3,2,0.04838014889167688,32,5,1,,,,,128,512,3,0.5363969848801425,16.0,3,SGD,0.0004018748820180409,0.7125282463668845,1.64624946561417e-06,,,,PRUNED
14,0.7035426535490028,2026-10-01 16:23:55.786148,2026-10-01 16:26:12.183705,0 days 00:02:16.397557,,,,,64.0,0.01135190904631185,32,5,3,0.014062816185896242,64,3,2,0.07626637791897475,64,5,2,,,,,256,512,3,0.5493913734323097,15.0,3,SGD,0.003563399746549474,0.8106783293633659,0.008205861333568558,47.0,0.6857142857142857,0.7213710213837199,COMPLETE
15,0.7019286816326684,2026-10-01 16:26:12.316643,2026-10-01 16:28:28.688393,0 days 00:02:16.371750,0.9324487593740935,0.9978913110722498,0.0002459664609285075,0.00011113176267146461,64.0,0.01149126182557575,32,5,3,0.011648097828146041,64,3,2,0.011295452826394908,64,5,2,,,,,128,512,3,0.4375515319789716,18.0,3,Adam,,,,50.0,0.7,0.7038573632653369,COMPLETE
16,0.6855548263792944,2026-10-01 16:28:28.829448,2026-10-01 16:30:47.894277,0 days 00:02:19.064829,0.9428901946384546,0.9558170071902496,0.00010396631086103255,5.391582437926513e-05,64.0,0.012927664026031798,32,5,3,0.010109392171065124,64,3,2,0.010629798180888446,64,5,2,,,,,512,512,3,0.4112631666828256,17.0,3,Adam,,,,47.0,0.6785714285714286,0.6925382241871603,COMPLETE
17,0.6407590036150755,2026-10-01 16:30:48.042914,2026-10-01 16:31:56.243246,0 days 00:01:08.200332,,,,,64.0,0.010621623256753934,32,5,3,0.013389964967656562,64,3,2,0.03190228214789166,64,5,2,,,,,128,128,3,0.4079914719265406,18.0,3,SGD,0.002889060562106991,0.8310525155477934,0.008683774511215606,49.0,0.6357142857142857,0.6458037215158654,COMPLETE
18,,2026-10-01 16:31:56.388383,2026-10-01 16:31:56.436974,0 days 00:00:00.048591,,,,,,0.04051177357733958,32,5,3,0.02545961003363274,64,5,2,0.027234308705213556,64,5,2,,,,,,512,3,,,3,,,,,,,,PRUNED
19,0.721457634437174,2026-10-01 16:31:56.585357,2026-10-01 16:34:15.587911,0 days 00:02:19.002554,0.9356353017544174,0.9311832310294694,0.00041777823802691794,9.402835412056373e-05,64.0,0.024627580602645104,32,5,3,0.023096100821553438,64,3,2,0.010416571531681351,64,5,2,,,,,256,512,3,0.6198583552628971,18.0,3,Adam,,,,45.0,0.7214285714285714,0.7214866974457766,COMPLETE
20,0.6633547116730676,2026-10-01 16:34:15.735326,2026-10-01 16:35:26.463513,0 days 00:01:10.728187,,,,,64.0,0.02480200716756613,32,5,3,0.0277158225375146,64,3,2,0.04771062997302536,64,5,2,,,,,256,128,5,0.6100286446066985,16.0,3,SGD,0.0055164961029087675,0.972213314060963,0.0007389294789918227,50.0,0.6785714285714286,0.6481379947747067,COMPLETE
21,0.7246941464332769,2026-10-01 16:35:26.607148,2026-10-01 16:37:47.106808,0 days 00:02:20.499660,0.9276550282449169,0.9309061352298735,0.00038046138536119496,0.00010244023100394814,64.0,0.03711568455461405,32,5,3,0.017251806197489304,64,3,2,0.01055057938002089,64,5,2,,,,,256,512,3,0.4706064610289656,18.0,3,Adam,,,,48.0,0.7285714285714285,0.7208168642951253,COMPLETE
22,0.7198756542510749,2026-10-01 16:37:47.249386,2026-10-01 16:40:07.534819,0 days 00:02:20.285433,0.924221431370582,0.9257966742218475,0.0004894891439576128,3.4172173115060086e-05,64.0,0.03781151654332422,32,5,3,0.02114173543812118,64,3,2,0.020075891879109624,64,5,2,,,,,256,512,3,0.6176266172649747,20.0,3,Adam,,,,43.0,0.7142857142857143,0.7254655942164356,COMPLETE
23,0.7252579583049972,2026-10-01 16:40:07.684020,2026-10-01 16:42:21.212198,0 days 00:02:13.528178,0.9278211483032114,0.9282573263501348,0.00051111263166128,3.7920064615375336e-05,64.0,0.04336878522750039,32,5,3,0.021829944781333346,64,3,2,0.020935626134405166,64,5,2,,,,,256,512,3,0.6169543538358434,20.0,3,Adam,,,,34.0,0.7285714285714285,0.7219444880385657,COMPLETE
24,0.6959179482331992,2026-10-01 16:42:21.359748,2026-10-01 16:44:39.780463,0 days 00:02:18.420715,0.9459660027025968,0.9316439266066616,0.00044638413990332533,0.00021698830406680048,64.0,0.047922427618054965,32,5,3,0.03256835419610136,64,3,2,0.016825966187488738,64,5,2,,,,,256,512,3,0.6083888398941267,18.0,3,Adam,,,,50.0,0.6928571428571428,0.6989787536092557,COMPLETE
25,0.7111310031258881,2026-10-01 16:44:39.927637,2026-10-01 16:46:54.756126,0 days 00:02:14.828489,0.9092842481633935,0.9437513644015448,0.0009349570110169394,1.2741212521585344e-05,64.0,0.046582483210819675,16,5,3,0.048636037746743174,64,3,2,0.02947773560567248,64,5,2,,,,,256,512,3,0.492374800919969,20.0,3,Adam,,,,43.0,0.7071428571428572,0.7151191491089189,COMPLETE
26,0.3931398936706323,2026-10-01 16:46:54.905654,2026-10-01 16:47:23.698881,0 days 00:00:28.793227,0.9547158917052554,0.9196986906319748,0.0002699109240387953,0.0004516658165720393,64.0,0.032425557580808076,32,5,3,0.02055006238723975,64,5,1,0.03551049799238836,64,5,2,,,,,256,512,3,0.6902648169466212,17.0,3,Adam,,,,,,,PRUNED
27,0.7065931225344769,2026-10-01 16:47:23.834994,2026-10-01 16:49:39.217445,0 days 00:02:15.382451,0.9210607488473439,0.9499746234161853,0.0002704362182715803,1.2102159887893576e-05,64.0,0.05760483746714402,32,5,3,0.030119725347402922,64,3,2,0.02331276143682179,64,5,2,,,,,256,512,3,0.3334521472288823,19.0,3,Adam,,,,50.0,0.7071428571428572,0.7060433879260967,COMPLETE
28,0.710005053426106,2026-10-01 16:49:39.365798,2026-10-01 16:50:49.856759,0 days 00:01:10.490961,0.9563561711276296,0.9169245622226672,0.0011017982010719,4.6040553829393946e-05,64.0,0.046113789776446514,32,5,3,0.03592032921277794,32,3,2,0.014563338268533295,64,5,2,,,,,256,128,5,0.4735126040253268,17.0,3,Adam,,,,50.0,0.7142857142857143,0.7057243925664978,COMPLETE
29,0.3626569039825043,2026-10-01 16:50:50.014694,2026-10-01 16:51:17.563686,0 days 00:00:27.548992,0.919998517647056,0.9331160771033532,0.0004493972792402483,3.428271437855318e-06,64.0,0.07678537900722746,16,5,3,0.022283053897696064,16,3,2,0.02401251563243948,64,3,2,,,,,512,512,3,0.6081041236622955,19.0,3,Adam,,,,,,,PRUNED
30,0.34592108124275867,2026-10-01 16:51:17.718050,2026-10-01 16:51:41.257466,0 days 00:00:23.539416,0.9354572660350469,0.9642070465404923,0.0001904969105067827,0.00012962078057774087,64.0,0.033610184979197405,32,5,3,0.019330326632855742,16,3,2,0.03728195519191389,64,5,2,,,,,256,256,7,0.6417955708203757,16.0,3,Adam,,,,,,,PRUNED
31,0.6846004872320661,2026-10-01 16:51:41.394746,2026-10-01 16:53:57.162891,0 days 00:02:15.768145,0.924124012067935,0.9240324784332009,0.000511941153469675,2.683637399793596e-05,64.0,0.03980622972254391,32,5,3,0.016394472647476677,64,3,2,0.018167421285204044,64,5,2,,,,,256,512,3,0.5861371987620219,20.0,3,Adam,,,,49.0,0.6857142857142857,0.6834866887498465,COMPLETE
32,0.7373734464460271,2026-10-01 16:53:57.313007,2026-10-01 16:56:14.263719,0 days 00:02:16.950712,0.9058358714593568,0.9265977391837665,0.0005804118811822564,3.976608552097703e-05,64.0,0.03636067078790648,32,5,3,0.026300809422112933,64,3,2,0.01632695697279051,64,5,2,,,,,256,512,3,0.5807200601641836,20.0,3,Adam,,,,49.0,0.7428571428571429,0.7318897500349114,COMPLETE
33,0.7196365481083197,2026-10-01 16:56:14.420266,2026-10-01 16:58:25.337055,0 days 00:02:10.916789,0.906692076962861,0.9401154895761392,0.0007158853076448437,9.062804814765576e-05,64.0,0.022849907270683888,32,5,3,0.0260764584991188,64,3,2,0.011124088499480603,64,5,2,,,,,256,512,3,0.4725170150996637,18.0,3,Adam,,,,43.0,0.7142857142857143,0.724987381930925,COMPLETE
34,0.40074199533562727,2026-10-01 16:58:25.471554,2026-10-01 16:58:38.178251,0 days 00:00:12.706697,0.8763674404798178,0.9147918498579202,0.00034786863719333535,0.00027769294298183943,64.0,0.030470935912036787,32,5,3,0.03498761384848528,64,3,2,0.02577854117085921,64,3,2,,,,,256,256,3,0.5672584376977972,19.0,3,Adam,,,,,,,PRUNED
35,0.3962534916740132,2026-10-01 16:58:38.314075,2026-10-01 16:59:14.360532,0 days 00:00:36.046457,0.9112331896764674,0.9299316044942547,0.00016885969306158172,2.1792432371819125e-05,128.0,0.01768106378300948,16,7,3,0.0486846595699271,16,3,2,0.016049777233265734,128,5,2,,,,,256,512,3,0.6503960878900937,20.0,3,Adam,,,,,,,PRUNED
36,0.29039990256211357,2026-10-01 16:59:14.494656,2026-10-01 16:59:40.841405,0 days 00:00:26.346749,0.933779883703942,0.9430218750996634,0.000715578869486236,8.386152803783223e-05,64.0,0.03685089648378377,8,5,3,0.02583900652412467,32,3,1,0.030823078652815594,64,3,1,0.011404045248349273,128.0,3.0,1.0,256,512,3,0.512734911857497,17.0,4,Adam,,,,,,,PRUNED
37,,2026-10-01 16:59:40.976962,2026-10-01 16:59:41.035759,0 days 00:00:00.058797,,,,,,0.044058520009818254,32,5,3,0.04550840184669451,64,5,2,0.014720442267317523,64,5,2,0.03950639677523354,128.0,3.0,1.0,,256,5,,,4,,,,,,,,PRUNED
38,0.3310364375635312,2026-10-01 16:59:41.166898,2026-10-01 17:00:55.387410,0 days 00:01:14.220512,0.9572110045011074,0.9119462186556436,0.0013181391129676685,5.575083240586507e-06,128.0,0.050083520866174264,8,7,3,0.017473342796171704,64,3,1,0.02354920029696155,128,5,2,,,,,256,512,7,0.5112403220055132,19.0,3,Adam,,,,,,,PRUNED
39,0.3874703237335808,2026-10-01 17:00:55.522353,2026-10-01 17:01:21.966401,0 days 00:00:26.444048,0.9028100363759751,0.9255617627431559,0.00038238137713700814,0.000621475654801484,64.0,0.06175285441098693,32,5,3,0.03765704424341143,32,3,2,0.01036470350446931,64,3,2,,,,,256,512,3,0.25567411073653723,18.0,3,Adam,,,,,,,PRUNED
40,,2026-10-01 17:01:22.101431,2026-10-01 17:01:22.156250,0 days 00:00:00.054819,,,,,,0.0973321218446248,16,5,3,0.0300888365535141,16,5,2,0.019458214354437262,32,5,1,,,,,,128,3,,,3,,,,,,,,PRUNED
41,0.7266313633399177,2026-10-01 17:01:22.291555,2026-10-01 17:03:33.465303,0 days 00:02:11.173748,0.9197169747169052,0.9260964488134755,0.0005928698519347545,3.369127626468003e-05,64.0,0.03806232836050877,32,5,3,0.02311310816404668,64,3,2,0.020925228814858306,64,5,2,,,,,256,512,3,0.6316474878413468,20.0,3,Adam,,,,46.0,0.7285714285714285,0.7246912981084069,COMPLETE
42,0.7163255602508758,2026-10-01 17:03:33.602825,2026-10-01 17:05:46.708212,0 days 00:02:13.105387,0.9178817102546913,0.9341599761859384,0.0006189134767673669,4.4458491371774155e-05,64.0,0.01988581598067295,32,5,3,0.02526822117148129,64,3,2,0.014948463845035242,64,5,2,,,,,256,512,3,0.6396657127995528,20.0,3,Adam,,,,43.0,0.7142857142857143,0.7183654062160373,COMPLETE
43,0.7423677979637443,2026-10-01 17:05:46.882999,2026-10-01 17:08:02.755741,0 days 00:02:15.872742,0.9414793443758659,0.9215657227789492,0.00031897418350786984,0.0002069641246404785,64.0,0.03618880087820053,32,5,3,0.015352839550174021,64,3,2,0.020934474233863264,64,5,2,,,,,256,512,3,0.6985095317658901,19.0,3,Adam,,,,49.0,0.7428571428571429,0.7418784530703457,COMPLETE
44,0.4071588862817854,2026-10-01 17:08:02.897982,2026-10-01 17:08:30.973912,0 days 00:00:28.075930,0.9464808445709553,0.9048974667083037,0.00031216106741407636,0.00017115005223180212,64.0,0.04338013644278086,32,5,3,0.013950016716309306,64,3,2,0.03983283472715589,64,5,2,,,,,256,512,3,0.6937821597077076,19.0,3,Adam,,,,,,,PRUNED
45,0.30159988820703104,2026-10-01 17:08:31.125145,2026-10-01 17:09:46.544000,0 days 00:01:15.418855,0.9284847520579556,0.9209733227462001,0.00018673928142736557,2.0318116420068858e-05,128.0,0.03431817647700489,8,5,3,0.01009437333530194,64,3,1,0.03357071599971209,64,5,2,,,,,512,512,7,0.5803014878649286,20.0,3,Adam,,,,,,,PRUNED
46,0.7367803283634132,2026-10-01 17:09:46.682775,2026-10-01 17:13:06.062810,0 days 00:03:19.380035,0.8888856392875139,0.9141136079577179,0.0008078740441053947,5.965812715070293e-05,64.0,0.052679678391206124,32,7,3,0.01619933284891754,64,3,2,0.02725130616972013,128,5,2,,,,,256,512,5,0.6635157668331103,19.0,3,Adam,,,,42.0,0.7428571428571429,0.7307035138696836,COMPLETE
47,0.3306372747744635,2026-10-01 17:13:06.208682,2026-10-01 17:13:24.301693,0 days 00:00:18.093011,0.989342262848356,0.9018788147146617,0.0009914086465609758,6.238092695272258e-05,64.0,0.05129582726023584,32,7,3,0.029240852851510866,32,3,2,0.04427078686961722,128,3,1,,,,,256,256,5,0.6677593828913605,11.0,3,Adam,,,,,,,PRUNED
48,,2026-10-01 17:13:24.448806,2026-10-01 17:13:24.498801,0 days 00:00:00.049995,,,,,,0.06457769315878256,32,7,3,0.0990937390466191,64,5,2,0.028508076235474838,128,5,2,,,,,,512,5,,,3,,,,,,,,PRUNED
49,0.40890456661133356,2026-10-01 17:13:24.636835,2026-10-01 17:14:02.954017,0 days 00:00:38.317182,0.8850185454195088,0.9074598432618727,0.0007086144324001097,0.0008841157010846449,64.0,0.06013036837338519,8,7,3,0.016477718178146597,64,3,1,0.06124470533878275,128,5,2,,,,,256,512,5,0.6980213835806025,19.0,3,Adam,,,,,,,PRUNED
50,,2026-10-01 17:14:03.087557,2026-10-01 17:14:03.145769,0 days 00:00:00.058212,,,,,,0.05469132398510842,32,7,3,0.0332366821910402,64,3,2,0.08758493615419388,128,5,2,0.030163236478069108,64.0,3.0,1.0,,512,5,,,4,,,,,,,,PRUNED
51,0.707332071573664,2026-10-01 17:14:03.276657,2026-10-01 17:16:38.105195,0 days 00:02:34.828538,0.8810461211829697,0.9120584149345836,0.0005924262740136042,0.0002260539757689022,64.0,0.029568419115246266,32,7,3,0.017023191988215468,64,3,2,0.021291218815373533,32,5,2,,,,,256,512,3,0.6620039860212751,19.0,3,Adam,,,,46.0,0.7142857142857143,0.7003784288616135,COMPLETE
52,0.7363429169005287,2026-10-01 17:16:38.251024,2026-10-01 17:19:42.224425,0 days 00:03:03.973401,0.8937442223831371,0.9258615688952296,0.0008533415003947205,3.2552577851679785e-05,64.0,0.03665968298351423,32,5,3,0.02332300945469579,64,3,2,0.026814789545682956,128,5,2,,,,,256,512,5,0.6365549164573341,20.0,3,Adam,,,,49.0,0.7571428571428571,0.7155429766582003,COMPLETE
53,0.25504091021833364,2026-10-01 17:19:42.357822,2026-10-01 17:20:23.800254,0 days 00:00:41.442432,0.893892512507087,0.9228007890524257,0.001946684189175024,0.008988101098060168,64.0,0.041629219166773826,32,7,3,0.022670190836195758,64,3,2,0.02677733064149221,128,5,2,,,,,256,512,5,0.6395543685810907,20.0,3,Adam,,,,,,,PRUNED
54,0.7259301085388041,2026-10-01 17:20:23.942879,2026-10-01 17:23:27.721163,0 days 00:03:03.778284,0.8728374444455915,0.9176191404860112,0.0008916416279757904,1.8585062310619757e-05,64.0,0.048503606094036276,32,5,3,0.013121329948650623,64,3,2,0.032330484947754194,128,5,2,,,,,256,512,5,0.5836588443886741,20.0,3,Adam,,,,34.0,0.7214285714285714,0.730431645649037,COMPLETE
55,0.6896144210299163,2026-10-01 17:23:27.860991,2026-10-01 17:24:24.650750,0 days 00:00:56.789759,0.8565163580103514,0.916801183708491,0.0008725328986717469,5.5521535042628e-06,128.0,0.04891194630157468,32,5,3,0.013170276084004017,64,3,2,0.04157974310038516,128,5,2,,,,,512,128,5,0.5780580192251178,19.0,3,Adam,,,,44.0,0.7142857142857143,0.6649431277741183,COMPLETE
56,0.37402521382880966,2026-10-01 17:24:24.791096,2026-10-01 17:25:01.874147,0 days 00:00:37.083051,0.8715449964013186,0.9100553704466792,0.0014110967106210149,1.8324187449834327e-05,64.0,0.07378834904963821,32,5,3,0.013807432910850652,64,3,2,0.03369555702680491,128,5,1,,,,,128,512,5,0.6675232259110954,20.0,3,Adam,,,,,,,PRUNED
57,0.3266111117235905,2026-10-01 17:25:02.013857,2026-10-01 17:25:43.430565,0 days 00:00:41.416708,0.8987329188084149,0.9843950459696075,0.00699924233108663,7.2942359552081554e-06,64.0,0.05452634419465964,32,7,3,0.06783539251850755,64,3,2,0.03787642133469031,128,5,2,,,,,256,512,5,0.5354263107155519,19.0,3,Adam,,,,,,,PRUNED
58,0.3876650526791504,2026-10-01 17:25:43.566436,2026-10-01 17:26:20.346860,0 days 00:00:36.780424,,,,,64.0,0.06858066679297858,32,5,3,0.018522067532629086,64,3,2,0.029622531669183293,128,5,2,,,,,256,512,5,0.5620461143885294,18.0,3,SGD,0.0006876381797116688,0.9105945643874157,0.00033935980480862026,,,,PRUNED
59,,2026-10-01 17:26:20.481112,2026-10-01 17:26:20.532889,0 days 00:00:00.051777,,,,,,0.0880670535324474,16,5,3,0.024358744562326513,16,5,2,0.053469207896672144,128,5,2,,,,,,512,5,,,3,,,,,,,,PRUNED
60,0.5437456116754449,2026-10-01 17:26:20.670938,2026-10-01 17:27:30.573306,0 days 00:01:09.902368,0.8906909630457497,0.9205384941753807,0.0016410641665615196,6.140900910400983e-05,64.0,0.03816389327988369,32,5,3,0.028098089481183704,64,3,2,0.024835752575176367,128,5,2,,,,,256,512,5,0.6364485969506642,17.0,3,Adam,,,,,,,PRUNED
