number,value,datetime_start,datetime_complete,duration,params_adam_beta1,params_adam_beta2,params_adam_lr,params_adam_wd,params_batch_size,params_block_0_dropout,params_block_0_filters,params_block_0_kernel,params_block_0_stride,params_block_1_dropout,params_block_1_filters,params_block_1_kernel,params_block_1_stride,params_block_2_dropout,params_block_2_filters,params_block_2_kernel,params_block_2_stride,params_block_3_dropout,params_block_3_filters,params_block_3_kernel,params_block_3_stride,params_fc_hidden,params_first_conv_filters,params_first_conv_kernel_size,params_lr_factor,params_lr_patience,params_n_blocks,params_optimizer,params_sgd_lr,params_sgd_momentum,params_sgd_wd,user_attrs_best_epoch,user_attrs_validation_accuracy,user_attrs_validation_macro_f1,state
61,0.7154560880455068,2026-10-01 17:27:30.709659,2026-10-01 17:30:34.686007,0 days 00:03:03.976348,0.8680484867788243,0.9284837210038407,0.0008359755452243163,2.677785055895543e-05,64.0,0.04411655012609708,32,5,3,0.020808440755634736,64,3,2,0.021224258277140355,128,5,2,,,,,256,512,5,0.5925607013947607,20.0,3,Adam,,,,44.0,0.7214285714285714,0.7094836046624421,COMPLETE
62,0.42660981760360644,2026-10-01 17:30:34.818766,2026-10-01 17:31:11.509531,0 days 00:00:36.690765,0.8841269458333656,0.9386146382924172,0.0006056800407695904,3.465176906366063e-05,64.0,0.035573341307685954,32,5,3,0.015491759692728814,64,3,2,0.032361094576303165,32,5,2,,,,,256,512,5,0.626284470256223,19.0,3,Adam,,,,,,,PRUNED
63,0.45451980351265053,2026-10-01 17:31:11.646244,2026-10-01 17:32:04.057966,0 days 00:00:52.411722,0.8598164861587195,0.9263991233052763,0.0011445785170768803,1.817655882157951e-05,64.0,0.030707473373905437,32,5,3,0.010000756865037971,64,3,2,0.09957430791330735,128,5,2,,,,,256,512,7,0.5976096532015805,6.0,3,Adam,,,,,,,PRUNED
64,0.6402889124998659,2026-10-01 17:32:04.192495,2026-10-01 17:34:09.048387,0 days 00:02:04.855892,0.914872353812072,0.9159482014444285,0.0005336280797539938,3.9898327090927155e-05,64.0,0.05777993218610991,32,5,3,0.020394374818191466,64,3,2,0.018100432692192383,128,5,2,,,,,128,512,5,0.6780557579207804,20.0,3,Adam,,,,,,,PRUNED
65,0.5430339329407652,2026-10-01 17:34:09.183414,2026-10-01 17:34:52.088240,0 days 00:00:42.904826,0.8986755725388416,0.9213094615347811,0.0006355217561464213,6.250585938538169e-05,64.0,0.04633227341926856,32,5,3,0.023820317102192817,64,3,2,0.027124040291199438,64,5,2,,,,,256,512,3,0.5523476833591517,8.0,3,Adam,,,,,,,PRUNED
66,0.5048858328971099,2026-10-01 17:34:52.225020,2026-10-01 17:35:11.846410,0 days 00:00:19.621390,,,,,64.0,0.04148828070318886,32,5,3,0.030760811952237125,64,3,2,0.02327476068031581,64,5,2,,,,,256,128,3,0.6508645370960244,20.0,3,SGD,0.02059911965622044,0.7657023833039857,0.0002534033490867903,,,,PRUNED
67,0.4191964942255299,2026-10-01 17:35:11.982618,2026-10-01 17:35:29.748036,0 days 00:00:17.765418,0.9417533682436773,0.926784329163262,0.0008226875115258618,1.3690651424442425e-05,64.0,0.02569060562935527,32,5,3,0.012857285003341169,32,3,2,0.021448473078688912,128,3,2,,,,,256,256,5,0.6220983154873884,18.0,3,Adam,,,,,,,PRUNED
68,0.3579145510663282,2026-10-01 17:35:29.883782,2026-10-01 17:35:57.195448,0 days 00:00:27.311666,0.904540747898603,0.934697692346323,0.0004748537558636894,0.00013649592144628203,64.0,0.03280136721039318,32,5,3,0.04123929782802114,64,3,1,0.014662612772858932,32,5,1,,,,,512,512,3,0.530404841778025,19.0,3,Adam,,,,,,,PRUNED
69,0.4496586375524201,2026-10-01 17:35:57.348220,2026-10-01 17:36:35.027415,0 days 00:00:37.679195,0.8514208802865556,0.9180444167856386,0.002049244766774703,8.557309919207083e-06,128.0,0.052601710946880806,32,7,3,0.027642433495103338,64,3,2,0.017826821574939384,64,5,2,,,,,256,512,3,0.6760039076712759,13.0,3,Adam,,,,,,,PRUNED
70,0.2557512208469688,2026-10-01 17:36:35.160945,2026-10-01 17:37:27.177092,0 days 00:00:52.016147,,,,,64.0,0.03876679555981556,8,5,3,0.018998167846803075,64,3,2,0.035210057986920104,64,5,2,,,,,256,512,7,0.6031641248599564,20.0,3,SGD,0.0001262917916420523,0.9458799394844105,4.802083396846412e-06,,,,PRUNED
71,0.4700607688872297,2026-10-01 17:37:27.310627,2026-10-01 17:37:54.132186,0 days 00:00:26.821559,0.9300188972016715,0.9297668164975611,0.0003452460335664335,8.017271182288883e-05,64.0,0.04365253328128955,32,5,3,0.022618818668867554,64,3,2,0.013075852312738731,64,5,2,,,,,256,512,3,0.38647332891530845,18.0,3,Adam,,,,,,,PRUNED
72,0.39707558017102496,2026-10-01 17:37:54.274469,2026-10-01 17:38:21.112800,0 days 00:00:26.838331,0.914240136937605,0.9349496247975111,0.000234389683035185,3.2179270161619785e-05,64.0,0.039224109757571415,32,5,3,0.015244807526883992,64,3,2,0.01312478226153958,64,5,2,,,,,256,512,3,0.43683337864786154,18.0,3,Adam,,,,,,,PRUNED
73,0.6962511314378886,2026-10-01 17:38:21.256065,2026-10-01 17:40:35.061988,0 days 00:02:13.805923,0.9247556699909696,0.9243418911000042,0.00042313586021256583,0.00011374378506323782,64.0,0.036463965847572714,32,5,3,0.01899829861600791,64,3,2,0.029770157471772328,64,5,2,,,,,256,512,3,0.6526077046850214,19.0,3,Adam,,,,42.0,0.6928571428571428,0.6996451200186344,COMPLETE
74,0.5188209394091747,2026-10-01 17:40:35.210572,2026-10-01 17:41:10.060006,0 days 00:00:34.849434,0.9383234203945807,0.9306773716245669,0.00029927919787108373,0.00030166753490763705,64.0,0.04673072902540841,32,5,3,0.02678881688476524,64,3,2,0.019664980271015844,64,5,2,,,,,256,512,3,0.14716288107484837,16.0,3,Adam,,,,,,,PRUNED
75,,2026-10-01 17:41:10.194519,2026-10-01 17:41:10.243265,0 days 00:00:00.048746,,,,,,0.02888104642392482,16,5,3,0.012020555561494409,16,5,2,0.017022360604524098,64,5,2,,,,,,512,3,,,3,,,,,,,,PRUNED
76,0.6033089136089763,2026-10-01 17:41:10.374703,2026-10-01 17:42:25.346408,0 days 00:01:14.971705,0.9508157916659795,0.9196837639076504,0.001075100895808875,5.662832129984346e-05,64.0,0.03491005695237901,32,5,3,0.03471040711729977,64,3,2,0.02493189547974435,64,5,2,,,,,256,512,3,0.6996554678118697,17.0,3,Adam,,,,,,,PRUNED
77,0.3550489055925139,2026-10-01 17:42:25.488231,2026-10-01 17:42:52.313526,0 days 00:00:26.825295,0.8957457209564429,0.9137400788483756,0.0005291848920662307,0.00017060696932285369,64.0,0.031822309270917386,32,5,3,0.021265008289019192,64,3,2,0.022721802914414776,64,3,2,,,,,128,512,3,0.22631902807231635,19.0,3,Adam,,,,,,,PRUNED
78,0.7057490190534403,2026-10-01 17:42:52.449414,2026-10-01 17:44:13.378669,0 days 00:01:20.929255,0.9263492722143237,0.9423535199140779,0.000849227978939116,2.5786591783793085e-05,64.0,0.04145675643079978,32,5,3,0.016975012203904977,64,3,2,0.027074254615799383,128,5,2,,,,,256,256,5,0.6232465031490818,20.0,3,Adam,,,,41.0,0.7071428571428572,0.7043551809640235,COMPLETE
79,0.39869522867854346,2026-10-01 17:44:13.519756,2026-10-01 17:44:27.887398,0 days 00:00:14.367642,0.8765810988804222,0.936081697061503,0.0003964630875946943,4.069099790585593e-05,64.0,0.048735810585751604,32,5,3,0.031792491709808635,32,3,1,0.013013293537458923,64,5,2,,,,,256,128,3,0.5688547978837976,18.0,3,Adam,,,,,,,PRUNED
80,0.3921181798626791,2026-10-01 17:44:28.024684,2026-10-01 17:44:59.717633,0 days 00:00:31.692949,0.9111429635105361,0.9483855446708862,0.0007600179258821684,1.2930636638903962e-05,64.0,0.02757751997033904,32,7,3,0.023366741933850212,64,3,2,0.020006315065496095,64,5,1,,,,,256,512,3,0.35487308016768004,20.0,3,Adam,,,,,,,PRUNED
81,0.47584254832153994,2026-10-01 17:44:59.853752,2026-10-01 17:45:26.507548,0 days 00:00:26.653796,0.9367999921847772,0.9309855800559873,0.0004486555402835732,9.912235866810736e-05,64.0,0.023889343698431244,32,5,3,0.02491913984137077,64,3,2,0.011978575989823608,64,5,2,,,,,256,512,3,0.6069924830178691,18.0,3,Adam,,,,,,,PRUNED
82,0.7271889595069574,2026-10-01 17:45:26.643540,2026-10-01 17:47:35.233169,0 days 00:02:08.589629,0.9181728893016011,0.9323732083012432,0.0002467164924329385,8.562869401515901e-05,64.0,0.01718178718012898,32,5,3,0.015261987704121825,64,3,2,0.018660785424294224,64,5,2,,,,,256,512,3,0.681836381153337,19.0,3,Adam,,,,46.0,0.7285714285714285,0.7258064904424864,COMPLETE
83,0.459368691902434,2026-10-01 17:47:35.366858,2026-10-01 17:48:01.186775,0 days 00:00:25.819917,0.9194209363886274,0.9239169977072214,0.0002247186978071228,7.601948996300499e-05,64.0,0.01740501645817085,32,5,3,0.015161992475987722,64,3,2,0.017831233337289615,64,5,2,,,,,256,512,3,0.6799655740458266,19.0,3,Adam,,,,,,,PRUNED
84,0.4281989257472104,2026-10-01 17:48:01.321652,2026-10-01 17:48:27.143496,0 days 00:00:25.821844,0.9022972340173798,0.9288843975460974,0.00014755984986433615,4.7628362419891304e-05,64.0,0.05075599326343923,32,5,3,0.012005899978285798,64,3,2,0.03156878141839328,64,5,2,,,,,256,512,3,0.6595920487572132,20.0,3,Adam,,,,,,,PRUNED
85,0.7037439300044341,2026-10-01 17:48:27.279625,2026-10-01 17:50:36.428212,0 days 00:02:09.148587,0.9079534098594569,0.938474794864783,0.00033843740015477105,0.00015406504670383088,64.0,0.014675295486708942,32,5,3,0.018571823112147366,64,3,2,0.016016607120269866,64,5,2,,,,,256,512,3,0.6319635440524574,19.0,3,Adam,,,,32.0,0.7,0.7074878600088684,COMPLETE
86,0.3914724024999201,2026-10-01 17:50:36.563763,2026-10-01 17:51:14.693476,0 days 00:00:38.129713,0.9630001816849981,0.9257445294503387,0.00027975484253841567,3.368121176627568e-05,128.0,0.020744285134538423,8,5,3,0.020899151493039857,64,3,2,0.02789150423922799,128,5,2,,,,,256,512,5,0.6836474686593936,19.0,3,Adam,,,,,,,PRUNED
87,,2026-10-01 17:51:14.836163,2026-10-01 17:51:14.891205,0 days 00:00:00.055042,,,,,,0.058118220625265636,32,5,3,0.017282448738537806,64,5,2,0.010051213816573205,64,5,2,,,,,,512,3,,,3,,,,,,,,PRUNED
88,0.42677318419006405,2026-10-01 17:51:15.040555,2026-10-01 17:52:11.491353,0 days 00:00:56.450798,0.9310581421041599,0.9321094594116459,0.000641744927079033,1.6596745246862318e-05,64.0,0.04418707218662894,16,7,3,0.015337803996030375,64,3,2,0.02274951755185679,32,5,2,,,,,512,512,7,0.5889966538172239,20.0,3,Adam,,,,,,,PRUNED
89,0.23016515827575734,2026-10-01 17:52:11.625291,2026-10-01 17:52:47.675986,0 days 00:00:36.050695,,,,,64.0,0.05308652528152324,32,5,3,0.028704444575928773,16,3,2,0.03673126676396612,64,3,2,,,,,256,512,5,0.49906399902010407,17.0,3,SGD,0.0007605952995320929,0.8459622897075598,0.0013953637090489232,,,,PRUNED
90,0.4151193695894604,2026-10-01 17:52:47.813847,2026-10-01 17:53:14.825292,0 days 00:00:27.011445,0.9232761132536739,0.9082663148952005,0.0005413938824383539,2.4501509723787672e-05,64.0,0.03718038412365037,32,5,3,0.02649954838074647,64,3,1,0.015853784509548195,128,5,2,,,,,256,512,3,0.10591327368060582,18.0,3,Adam,,,,,,,PRUNED
91,0.4944997705827199,2026-10-01 17:53:14.961784,2026-10-01 17:53:44.498122,0 days 00:00:29.536338,0.9406875935461307,0.9227015386042133,0.0003839722724224499,0.00010298648259757763,64.0,0.026648627482933902,32,5,3,0.022868338333366017,64,3,2,0.024988337604914104,64,5,2,,,,,256,512,3,0.6235811480339241,18.0,3,Adam,,,,,,,PRUNED
92,0.7145890454385384,2026-10-01 17:53:44.631781,2026-10-01 17:55:58.459193,0 days 00:02:13.827412,0.9159417747743247,0.9274356950029341,0.0009989682227947395,0.0002409445673010576,64.0,0.022503428692802457,32,5,3,0.011641287143640135,64,3,2,0.018777872157541203,64,5,2,,,,,256,512,3,0.6533190697274516,19.0,3,Adam,,,,36.0,0.7,0.7291780908770769,COMPLETE
93,0.6898996476497286,2026-10-01 17:55:58.595833,2026-10-01 17:58:12.448995,0 days 00:02:13.853162,0.9326177273957272,0.9183103361559949,0.0002643164087152764,6.74774433001431e-05,64.0,0.013651691222395278,32,5,3,0.01964197548567697,64,3,2,0.01355799141518799,64,5,2,,,,,256,512,3,0.6147493603644613,20.0,3,Adam,,,,36.0,0.6857142857142857,0.6940850095851715,COMPLETE
94,0.7151687261525537,2026-10-01 17:58:12.583466,2026-10-01 18:00:26.407040,0 days 00:02:13.823574,0.8891128045517874,0.9333071517674192,0.0006885884509509247,4.731742194245848e-05,64.0,0.03986216213674428,32,5,3,0.024573629946935134,64,3,2,0.022007883065528026,64,5,2,,,,,256,512,3,0.6652787388218062,17.0,3,Adam,,,,49.0,0.7214285714285714,0.7089088808765359,COMPLETE
95,0.5812267483624428,2026-10-01 18:00:26.540394,2026-10-01 18:01:02.089817,0 days 00:00:35.549423,0.9457019230679439,0.9148340288078205,0.0012352809061976441,0.00035082695425290504,64.0,0.0334572910119194,32,5,3,0.01441338085321043,64,3,2,0.011276179515416746,64,5,2,,,,,256,256,5,0.6378762973902027,19.0,3,Adam,,,,,,,PRUNED
96,0.40469842335167416,2026-10-01 18:01:02.227117,2026-10-01 18:01:33.931167,0 days 00:00:31.704050,0.9221457843155936,0.9230692899662635,0.00047681737171713476,0.0001854057885749822,64.0,0.0451505173382377,32,7,3,0.016927816152221522,32,3,2,0.020057641382178623,128,5,1,,,,,128,512,3,0.5719551141353748,20.0,3,Adam,,,,,,,PRUNED
97,0.46371672988354445,2026-10-01 18:01:34.072639,2026-10-01 18:01:49.582343,0 days 00:00:15.509704,0.927795463531482,0.9285692481559531,0.0005635069960043568,0.0001283855845888311,64.0,0.04204266289931466,32,5,3,0.022233087320609492,64,3,2,0.02551617324363175,64,5,2,,,,,256,128,3,0.45736860522862655,19.0,3,Adam,,,,,,,PRUNED
98,0.7095079632220085,2026-10-01 18:01:49.715911,2026-10-01 18:04:53.511583,0 days 00:03:03.795672,0.9342355627138041,0.9375112125063075,0.0003518625012972729,1.8228270415164441e-06,64.0,0.03495624992018003,32,5,3,0.01900121129428658,64,3,2,0.01613605787482556,128,5,2,,,,,256,512,5,0.6846862364839663,18.0,3,Adam,,,,40.0,0.7214285714285714,0.6975873550154457,COMPLETE
99,,2026-10-01 18:04:53.650313,2026-10-01 18:04:53.708943,0 days 00:00:00.058630,,,,,,0.031434187834446334,32,5,3,0.06096001762760853,64,5,2,0.03004851302748116,64,5,2,,,,,,512,3,,,3,,,,,,,,PRUNED
