number,value,datetime_start,datetime_complete,duration,params_adam_beta1,params_adam_beta2,params_adam_lr,params_adam_wd,params_batch_size,params_block_0_dropout,params_block_0_filters,params_block_0_kernel,params_block_0_stride,params_block_1_dropout,params_block_1_filters,params_block_1_kernel,params_block_1_stride,params_block_2_dropout,params_block_2_filters,params_block_2_kernel,params_block_2_stride,params_block_3_dropout,params_block_3_filters,params_block_3_kernel,params_block_3_stride,params_fc_hidden,params_first_conv_filters,params_first_conv_kernel_size,params_lr_factor,params_lr_patience,params_n_blocks,params_optimizer,params_sgd_lr,params_sgd_momentum,params_sgd_wd,user_attrs_best_epoch,user_attrs_validation_accuracy,user_attrs_validation_macro_f1,system_attrs_tpe:relative_params:0,state
62,0.6098312769407426,2026-09-20 13:15:42.233089,2026-09-20 13:46:32.546560,0 days 00:30:50.313471,0.8763600897336662,0.9652329139167959,0.0033345996476286154,2.1392143482682022e-05,128.0,0.10213065579165323,32,7,3,0.15006293263571882,32,7,1,0.13257321013520904,32,5,2,,,,,512,512,7,0.6987603463772992,20.0,3,Adam,,,,48.0,0.6331360946745562,0.5865264592069288,"{""block_0_dropout"": 0.10213065579165323, ""block_0_filters"": 32, ""block_0_kernel"": 7, ""block_1_dropout"": 0.15006293263571882, ""block_1_filters"": 32, ""block_1_kernel"": 7, ""block_1_stride"": 1, ""block_2_dropout"": 0.13257321013520904, ""block_2_filters"": 32, ""block_2_kernel"": 5, ""block_2_stride"": 2, ""first_conv_filters"": 512, ""first_conv_kernel_size"": 7, ""n_blocks"": 3}",COMPLETE
63,0.24328469451421536,2026-09-20 13:46:32.658647,2026-09-20 13:52:42.434249,0 days 00:06:09.775602,0.8775205727570482,0.965351455387844,0.0024051509817017663,2.066861480154365e-06,128.0,0.10365661520636157,32,7,3,0.15654022999267891,32,3,1,0.19101109869923547,32,5,2,,,,,512,512,7,0.6234826627167054,20.0,3,Adam,,,,,,,"{""block_0_dropout"": 0.10365661520636157, ""block_0_filters"": 32, ""block_0_kernel"": 7, ""block_1_dropout"": 0.15654022999267891, ""block_1_filters"": 32, ""block_1_kernel"": 3, ""block_1_stride"": 1, ""block_2_dropout"": 0.19101109869923547, ""block_2_filters"": 32, ""block_2_kernel"": 5, ""block_2_stride"": 2, ""first_conv_filters"": 512, ""first_conv_kernel_size"": 7, ""n_blocks"": 3}",PRUNED
64,0.29631023101575593,2026-09-20 13:52:42.541867,2026-09-20 13:58:51.480157,0 days 00:06:08.938290,0.8724960275465868,0.9703769519177309,0.00352300376482906,1.4001009317923556e-05,128.0,0.1047482157087397,16,7,3,0.15105578294255048,32,7,1,0.1328367107697805,32,5,2,,,,,512,512,7,0.6752255880126404,20.0,3,Adam,,,,,,,"{""block_0_dropout"": 0.1047482157087397, ""block_0_filters"": 16, ""block_0_kernel"": 7, ""block_1_dropout"": 0.15105578294255048, ""block_1_filters"": 32, ""block_1_kernel"": 7, ""block_1_stride"": 1, ""block_2_dropout"": 0.1328367107697805, ""block_2_filters"": 32, ""block_2_kernel"": 5, ""block_2_stride"": 2, ""first_conv_filters"": 512, ""first_conv_kernel_size"": 7, ""n_blocks"": 3}",PRUNED
65,0.2997772979646901,2026-09-20 13:58:51.607244,2026-09-20 14:05:01.678794,0 days 00:06:10.071550,0.9014920326152801,0.9876664891396865,0.002155684057014721,2.12207328133232e-05,128.0,0.10912005644539377,32,7,3,0.17534253209094453,32,7,1,0.21247488551337979,32,5,2,,,,,512,512,7,0.6534471971376781,20.0,3,Adam,,,,,,,"{""block_0_dropout"": 0.10912005644539377, ""block_0_filters"": 32, ""block_0_kernel"": 7, ""block_1_dropout"": 0.17534253209094453, ""block_1_filters"": 32, ""block_1_kernel"": 7, ""block_1_stride"": 1, ""block_2_dropout"": 0.21247488551337979, ""block_2_filters"": 32, ""block_2_kernel"": 5, ""block_2_stride"": 2, ""first_conv_filters"": 512, ""first_conv_kernel_size"": 7, ""n_blocks"": 3}",PRUNED
66,0.6666734802792041,2026-09-20 14:05:01.795696,2026-09-20 14:35:51.587783,0 days 00:30:49.792087,0.8623710712012261,0.9741976584794216,0.0013722552641739574,2.4183538098000163e-06,128.0,0.10407411132492558,32,7,3,0.15679064841754708,32,7,1,0.11050091123096244,32,5,2,,,,,512,512,7,0.67588976766429,19.0,3,Adam,,,,48.0,0.6804733727810651,0.6528735877773432,"{""block_0_dropout"": 0.10407411132492558, ""block_0_filters"": 32, ""block_0_kernel"": 7, ""block_1_dropout"": 0.15679064841754708, ""block_1_filters"": 32, ""block_1_kernel"": 7, ""block_1_stride"": 1, ""block_2_dropout"": 0.11050091123096244, ""block_2_filters"": 32, ""block_2_kernel"": 5, ""block_2_stride"": 2, ""first_conv_filters"": 512, ""first_conv_kernel_size"": 7, ""n_blocks"": 3}",COMPLETE
67,0.29132354301807784,2026-09-20 14:35:51.683279,2026-09-20 14:42:01.989762,0 days 00:06:10.306483,0.8581166243395215,0.9737979334181412,0.0013451736777502327,1.6477758235587527e-06,128.0,0.1247894352736538,32,7,3,0.15841864069409023,32,7,1,0.198517356887516,32,5,2,,,,,512,512,7,0.17330516030187842,19.0,3,Adam,,,,,,,"{""block_0_dropout"": 0.1247894352736538, ""block_0_filters"": 32, ""block_0_kernel"": 7, ""block_1_dropout"": 0.15841864069409023, ""block_1_filters"": 32, ""block_1_kernel"": 7, ""block_1_stride"": 1, ""block_2_dropout"": 0.198517356887516, ""block_2_filters"": 32, ""block_2_kernel"": 5, ""block_2_stride"": 2, ""first_conv_filters"": 512, ""first_conv_kernel_size"": 7, ""n_blocks"": 3}",PRUNED
68,0.27172175269511367,2026-09-20 14:42:02.104124,2026-09-20 14:45:19.091392,0 days 00:03:16.987268,0.8643334571863676,0.962625566496392,0.006105195372429196,2.493057835966577e-06,128.0,0.12925578954111633,16,7,3,0.12902541128217995,32,7,1,0.19133696058347835,32,5,2,,,,,512,512,5,0.6218876747715234,6.0,3,Adam,,,,,,,"{""block_0_dropout"": 0.12925578954111633, ""block_0_filters"": 16, ""block_0_kernel"": 7, ""block_1_dropout"": 0.12902541128217995, ""block_1_filters"": 32, ""block_1_kernel"": 7, ""block_1_stride"": 1, ""block_2_dropout"": 0.19133696058347835, ""block_2_filters"": 32, ""block_2_kernel"": 5, ""block_2_stride"": 2, ""first_conv_filters"": 512, ""first_conv_kernel_size"": 5, ""n_blocks"": 3}",PRUNED
69,0.6466062436955147,2026-09-20 14:45:19.217727,2026-09-20 18:55:45.021527,0 days 04:10:25.803800,0.8792129644180164,0.978444629130904,0.0015718731847946521,8.10939571858524e-06,256.0,0.13448798086809668,32,7,3,0.12767695792150427,32,7,1,0.20358553089255016,32,5,2,,,,,512,512,7,0.5655376647522359,18.0,3,Adam,,,,49.0,0.6627218934911243,0.630490593899905,"{""block_0_dropout"": 0.13448798086809668, ""block_0_filters"": 32, ""block_0_kernel"": 7, ""block_1_dropout"": 0.12767695792150427, ""block_1_filters"": 32, ""block_1_kernel"": 7, ""block_1_stride"": 1, ""block_2_dropout"": 0.20358553089255016, ""block_2_filters"": 32, ""block_2_kernel"": 5, ""block_2_stride"": 2, ""first_conv_filters"": 512, ""first_conv_kernel_size"": 7, ""n_blocks"": 3}",COMPLETE
70,0.6055796226495784,2026-09-20 18:55:45.106036,2026-09-20 19:18:43.980148,0 days 00:22:58.874112,0.8792589901134722,0.9699949701774015,0.0019429362916930002,7.329982254222732e-06,32.0,0.1364535251106942,32,7,3,0.14006548725662316,32,7,1,0.19884942095947317,32,5,2,,,,,512,512,7,0.563904416344227,18.0,3,Adam,,,,44.0,0.621301775147929,0.5898574701512278,"{""block_0_dropout"": 0.1364535251106942, ""block_0_filters"": 32, ""block_0_kernel"": 7, ""block_1_dropout"": 0.14006548725662316, ""block_1_filters"": 32, ""block_1_kernel"": 7, ""block_1_stride"": 1, ""block_2_dropout"": 0.19884942095947317, ""block_2_filters"": 32, ""block_2_kernel"": 5, ""block_2_stride"": 2, ""first_conv_filters"": 512, ""first_conv_kernel_size"": 7, ""n_blocks"": 3}",COMPLETE
71,0.4534087161085759,2026-09-20 19:18:44.099963,2026-09-20 19:34:22.142886,0 days 00:15:38.042923,0.8789436659077646,0.9685406116046152,0.002080049423265184,7.193284042678647e-06,32.0,0.14429027955079263,32,7,3,0.15112727568392095,32,7,1,0.22060365997608758,32,5,2,,,,,512,512,7,0.569306678542185,18.0,3,Adam,,,,,,,"{""block_0_dropout"": 0.14429027955079263, ""block_0_filters"": 32, ""block_0_kernel"": 7, ""block_1_dropout"": 0.15112727568392095, ""block_1_filters"": 32, ""block_1_kernel"": 7, ""block_1_stride"": 1, ""block_2_dropout"": 0.22060365997608758, ""block_2_filters"": 32, ""block_2_kernel"": 5, ""block_2_stride"": 2, ""first_conv_filters"": 512, ""first_conv_kernel_size"": 7, ""n_blocks"": 3}",PRUNED
72,0.5711234362640427,2026-09-20 19:34:22.259405,2026-09-20 19:57:21.565587,0 days 00:22:59.306182,0.8692674601506716,0.9533898978798122,0.001590759028435479,5.447406631415715e-06,32.0,0.11575310108781652,32,7,3,0.13086960720066587,32,7,1,0.17342491027334384,32,5,2,,,,,512,512,7,0.6828965078194864,19.0,3,Adam,,,,38.0,0.5857988165680473,0.556448055960038,"{""block_0_dropout"": 0.11575310108781652, ""block_0_filters"": 32, ""block_0_kernel"": 7, ""block_1_dropout"": 0.13086960720066587, ""block_1_filters"": 32, ""block_1_kernel"": 7, ""block_1_stride"": 1, ""block_2_dropout"": 0.17342491027334384, ""block_2_filters"": 32, ""block_2_kernel"": 5, ""block_2_stride"": 2, ""first_conv_filters"": 512, ""first_conv_kernel_size"": 7, ""n_blocks"": 3}",COMPLETE
73,0.3433194041202471,2026-09-20 19:57:21.677642,2026-09-20 20:01:57.811104,0 days 00:04:36.133462,0.8513870675601,0.9713268589427948,0.0032693164035185614,8.61346309149412e-06,32.0,0.1290287712993438,32,7,3,0.13923350446530477,32,7,1,0.2029049986609442,32,5,2,,,,,512,512,7,0.6001723085793567,17.0,3,Adam,,,,,,,"{""block_0_dropout"": 0.1290287712993438, ""block_0_filters"": 32, ""block_0_kernel"": 7, ""block_1_dropout"": 0.13923350446530477, ""block_1_filters"": 32, ""block_1_kernel"": 7, ""block_1_stride"": 1, ""block_2_dropout"": 0.2029049986609442, ""block_2_filters"": 32, ""block_2_kernel"": 5, ""block_2_stride"": 2, ""first_conv_filters"": 512, ""first_conv_kernel_size"": 7, ""n_blocks"": 3}",PRUNED
74,0.3854423534391108,2026-09-20 20:01:57.889980,2026-09-20 20:03:46.485969,0 days 00:01:48.595989,0.8870994400417281,0.9811689989352658,0.0022585547865183707,3.181090139501706e-06,32.0,0.12037249992302956,32,7,3,0.12255078425881392,32,7,1,0.19655015158391498,32,5,2,,,,,512,128,7,0.6378023486054418,18.0,3,Adam,,,,,,,"{""block_0_dropout"": 0.12037249992302956, ""block_0_filters"": 32, ""block_0_kernel"": 7, ""block_1_dropout"": 0.12255078425881392, ""block_1_filters"": 32, ""block_1_kernel"": 7, ""block_1_stride"": 1, ""block_2_dropout"": 0.19655015158391498, ""block_2_filters"": 32, ""block_2_kernel"": 5, ""block_2_stride"": 2, ""first_conv_filters"": 128, ""first_conv_kernel_size"": 7, ""n_blocks"": 3}",PRUNED
75,0.5859668300660203,2026-09-20 20:03:46.574697,2026-09-20 20:34:37.523418,0 days 00:30:50.948721,0.8745403767730904,0.9592282062163804,0.0017895805784134678,4.925000412236374e-06,128.0,0.14297985180189604,32,7,3,0.15180610678161302,32,7,1,0.20092469027099788,32,5,2,,,,,512,512,7,0.5582954850657934,19.0,3,Adam,,,,45.0,0.5976331360946746,0.5743005240373662,"{""block_0_dropout"": 0.14297985180189604, ""block_0_filters"": 32, ""block_0_kernel"": 7, ""block_1_dropout"": 0.15180610678161302, ""block_1_filters"": 32, ""block_1_kernel"": 7, ""block_1_stride"": 1, ""block_2_dropout"": 0.20092469027099788, ""block_2_filters"": 32, ""block_2_kernel"": 5, ""block_2_stride"": 2, ""first_conv_filters"": 512, ""first_conv_kernel_size"": 7, ""n_blocks"": 3}",COMPLETE
76,0.4694210690757001,2026-09-20 20:34:37.634809,2026-09-20 20:52:31.551283,0 days 00:17:53.916474,0.864288485407241,0.9766154171383863,0.0035394540840688344,1.9792251194532615e-05,128.0,0.1311404393725519,32,7,3,0.1310264066458355,32,7,1,0.23325936225320257,32,5,2,,,,,512,512,7,0.6785663727454607,20.0,3,Adam,,,,,,,"{""block_0_dropout"": 0.1311404393725519, ""block_0_filters"": 32, ""block_0_kernel"": 7, ""block_1_dropout"": 0.1310264066458355, ""block_1_filters"": 32, ""block_1_kernel"": 7, ""block_1_stride"": 1, ""block_2_dropout"": 0.23325936225320257, ""block_2_filters"": 32, ""block_2_kernel"": 5, ""block_2_stride"": 2, ""first_conv_filters"": 512, ""first_conv_kernel_size"": 7, ""n_blocks"": 3}",PRUNED
77,0.6576071646083703,2026-09-20 20:52:31.662228,2026-09-20 23:01:43.950413,0 days 02:09:12.288185,0.8795426957508785,0.9866255654055179,0.0009888892336883867,1.108170408611041e-05,256.0,0.1192256218803401,32,7,3,0.12177402407093396,32,7,1,0.11253208627227317,32,5,2,,,,,512,512,3,0.6216538376488017,16.0,3,Adam,,,,45.0,0.6686390532544378,0.6465752759623029,"{""block_0_dropout"": 0.1192256218803401, ""block_0_filters"": 32, ""block_0_kernel"": 7, ""block_1_dropout"": 0.12177402407093396, ""block_1_filters"": 32, ""block_1_kernel"": 7, ""block_1_stride"": 1, ""block_2_dropout"": 0.11253208627227317, ""block_2_filters"": 32, ""block_2_kernel"": 5, ""block_2_stride"": 2, ""first_conv_filters"": 512, ""first_conv_kernel_size"": 3, ""n_blocks"": 3}",COMPLETE
78,0.3464325277257305,2026-09-20 23:01:44.056309,2026-09-20 23:27:33.905961,0 days 00:25:49.849652,0.8823332875194989,0.9881323713306494,0.001047296090564942,6.76824872513154e-05,256.0,0.11778705679551497,32,7,3,0.1305933964211559,32,7,1,0.1078074673439041,32,5,2,,,,,512,512,3,0.6218413141168666,16.0,3,Adam,,,,,,,"{""block_0_dropout"": 0.11778705679551497, ""block_0_filters"": 32, ""block_0_kernel"": 7, ""block_1_dropout"": 0.1305933964211559, ""block_1_filters"": 32, ""block_1_kernel"": 7, ""block_1_stride"": 1, ""block_2_dropout"": 0.1078074673439041, ""block_2_filters"": 32, ""block_2_kernel"": 5, ""block_2_stride"": 2, ""first_conv_filters"": 512, ""first_conv_kernel_size"": 3, ""n_blocks"": 3}",PRUNED
79,0.6396969598446313,2026-09-20 23:27:33.999368,2026-09-20 23:30:33.013026,0 days 00:02:59.013658,0.8891138914167157,0.9831101199974174,0.0014596762897130708,1.1307054805834792e-05,256.0,0.12365740844674435,32,7,3,0.1149851664167528,32,7,1,0.11815401715870283,32,5,2,,,,,512,128,3,0.6447552868834393,15.0,3,Adam,,,,50.0,0.6568047337278107,0.6225891859614519,"{""block_0_dropout"": 0.12365740844674435, ""block_0_filters"": 32, ""block_0_kernel"": 7, ""block_1_dropout"": 0.1149851664167528, ""block_1_filters"": 32, ""block_1_kernel"": 7, ""block_1_stride"": 1, ""block_2_dropout"": 0.11815401715870283, ""block_2_filters"": 32, ""block_2_kernel"": 5, ""block_2_stride"": 2, ""first_conv_filters"": 128, ""first_conv_kernel_size"": 3, ""n_blocks"": 3}",COMPLETE
80,0.6062860415044816,2026-09-20 23:30:33.131845,2026-09-21 01:39:41.787950,0 days 02:09:08.656105,0.8915984938929744,0.9905637169776503,0.0014445297219652425,1.2950822860644709e-06,256.0,0.12114839578374087,32,7,3,0.11161218911072467,32,7,1,0.11669765011696542,32,5,2,,,,,512,512,3,0.6027776196525801,15.0,3,Adam,,,,50.0,0.6390532544378699,0.5735188285710934,"{""block_0_dropout"": 0.12114839578374087, ""block_0_filters"": 32, ""block_0_kernel"": 7, ""block_1_dropout"": 0.11161218911072467, ""block_1_filters"": 32, ""block_1_kernel"": 7, ""block_1_stride"": 1, ""block_2_dropout"": 0.11669765011696542, ""block_2_filters"": 32, ""block_2_kernel"": 5, ""block_2_stride"": 2, ""first_conv_filters"": 512, ""first_conv_kernel_size"": 3, ""n_blocks"": 3}",COMPLETE
81,0.5920052922393189,2026-09-21 01:39:41.895777,2026-09-21 03:48:52.288198,0 days 02:09:10.392421,0.8860057806727174,0.9841526408370538,0.0009185027037710641,1.0854673059731865e-05,256.0,0.11849953334289501,32,7,3,0.14131929331764137,32,7,1,0.12087262393021374,32,5,2,,,,,512,512,3,0.6508860335364317,14.0,3,Adam,,,,45.0,0.5976331360946746,0.5863774483839632,"{""block_0_dropout"": 0.11849953334289501, ""block_0_filters"": 32, ""block_0_kernel"": 7, ""block_1_dropout"": 0.14131929331764137, ""block_1_filters"": 32, ""block_1_kernel"": 7, ""block_1_stride"": 1, ""block_2_dropout"": 0.12087262393021374, ""block_2_filters"": 32, ""block_2_kernel"": 5, ""block_2_stride"": 2, ""first_conv_filters"": 512, ""first_conv_kernel_size"": 3, ""n_blocks"": 3}",COMPLETE
82,0.31527670921419637,2026-09-21 03:48:52.413936,2026-09-21 04:39:07.569051,0 days 00:50:15.155115,0.8936220894860043,0.9788953717813843,0.005287036104016468,1.0456309552424637e-05,256.0,0.15148855967100017,32,7,3,0.13067469686153269,32,7,1,0.21100398232460588,32,5,2,,,,,512,512,7,0.6316316691203909,16.0,3,Adam,,,,,,,"{""block_0_dropout"": 0.15148855967100017, ""block_0_filters"": 32, ""block_0_kernel"": 7, ""block_1_dropout"": 0.13067469686153269, ""block_1_filters"": 32, ""block_1_kernel"": 7, ""block_1_stride"": 1, ""block_2_dropout"": 0.21100398232460588, ""block_2_filters"": 32, ""block_2_kernel"": 5, ""block_2_stride"": 2, ""first_conv_filters"": 512, ""first_conv_kernel_size"": 7, ""n_blocks"": 3}",PRUNED
83,0.2806507776778705,2026-09-21 04:39:07.664075,2026-09-21 05:04:57.744179,0 days 00:25:50.080104,0.8842508952515058,0.9924249216794291,0.0006694690931480105,2.511957698527828e-06,256.0,0.10479560956906336,32,7,3,0.11187859200026526,32,7,1,0.10738273291797708,32,5,2,,,,,512,512,3,0.6852764091429682,13.0,3,Adam,,,,,,,"{""block_0_dropout"": 0.10479560956906336, ""block_0_filters"": 32, ""block_0_kernel"": 7, ""block_1_dropout"": 0.11187859200026526, ""block_1_filters"": 32, ""block_1_kernel"": 7, ""block_1_stride"": 1, ""block_2_dropout"": 0.10738273291797708, ""block_2_filters"": 32, ""block_2_kernel"": 5, ""block_2_stride"": 2, ""first_conv_filters"": 512, ""first_conv_kernel_size"": 3, ""n_blocks"": 3}",PRUNED
84,0.35604586497402735,2026-09-21 05:04:57.835933,2026-09-21 05:55:13.538718,0 days 00:50:15.702785,0.8601194592451822,0.9741552349356203,0.0012307382905522258,2.615358394286497e-05,256.0,0.14948764001176745,32,7,3,0.10883793396159772,32,7,1,0.18794311470814803,32,5,2,,,,,512,512,7,0.6999678385460488,20.0,3,Adam,,,,,,,"{""block_0_dropout"": 0.14948764001176745, ""block_0_filters"": 32, ""block_0_kernel"": 7, ""block_1_dropout"": 0.10883793396159772, ""block_1_filters"": 32, ""block_1_kernel"": 7, ""block_1_stride"": 1, ""block_2_dropout"": 0.18794311470814803, ""block_2_filters"": 32, ""block_2_kernel"": 5, ""block_2_stride"": 2, ""first_conv_filters"": 512, ""first_conv_kernel_size"": 7, ""n_blocks"": 3}",PRUNED
85,0.26412759239676675,2026-09-21 05:55:13.655045,2026-09-21 06:45:29.877235,0 days 00:50:16.222190,0.9045796923216933,0.9658078919799157,0.0001405283348077439,5.013087607365441e-05,256.0,0.1251713340923019,32,7,3,0.11266493407355091,32,7,1,0.2069374314658611,32,5,2,,,,,512,512,7,0.5881290384323795,15.0,3,Adam,,,,,,,"{""block_0_dropout"": 0.1251713340923019, ""block_0_filters"": 32, ""block_0_kernel"": 7, ""block_1_dropout"": 0.11266493407355091, ""block_1_filters"": 32, ""block_1_kernel"": 7, ""block_1_stride"": 1, ""block_2_dropout"": 0.2069374314658611, ""block_2_filters"": 32, ""block_2_kernel"": 5, ""block_2_stride"": 2, ""first_conv_filters"": 512, ""first_conv_kernel_size"": 7, ""n_blocks"": 3}",PRUNED
86,0.32261844775805215,2026-09-21 06:45:29.989586,2026-09-21 06:46:05.736906,0 days 00:00:35.747320,0.8730599231933587,0.9474230702360541,0.0004960564953892414,4.061194313606997e-06,256.0,0.11247897019969931,32,7,3,0.1200898723213209,32,7,1,0.11680378912015311,32,5,2,,,,,512,128,3,0.6641390985225328,17.0,3,Adam,,,,,,,"{""block_0_dropout"": 0.11247897019969931, ""block_0_filters"": 32, ""block_0_kernel"": 7, ""block_1_dropout"": 0.1200898723213209, ""block_1_filters"": 32, ""block_1_kernel"": 7, ""block_1_stride"": 1, ""block_2_dropout"": 0.11680378912015311, ""block_2_filters"": 32, ""block_2_kernel"": 5, ""block_2_stride"": 2, ""first_conv_filters"": 128, ""first_conv_kernel_size"": 3, ""n_blocks"": 3}",PRUNED
87,0.6121998940397532,2026-09-21 06:46:05.843412,2026-09-21 07:16:58.711753,0 days 00:30:52.868341,0.8889514300940097,0.9940508314861463,0.002614561708704544,1.9745393591544164e-05,128.0,0.10821629889405644,32,7,3,0.1352934565375069,32,7,1,0.11336279470418045,64,5,2,,,,,512,512,7,0.6134254795154415,15.0,3,Adam,,,,39.0,0.6272189349112426,0.5971808531682637,"{""block_0_dropout"": 0.10821629889405644, ""block_0_filters"": 32, ""block_0_kernel"": 7, ""block_1_dropout"": 0.1352934565375069, ""block_1_filters"": 32, ""block_1_kernel"": 7, ""block_1_stride"": 1, ""block_2_dropout"": 0.11336279470418045, ""block_2_filters"": 64, ""block_2_kernel"": 5, ""block_2_stride"": 2, ""first_conv_filters"": 512, ""first_conv_kernel_size"": 7, ""n_blocks"": 3}",COMPLETE
88,0.6036634634502083,2026-09-21 07:16:58.823263,2026-09-21 11:27:39.853432,0 days 04:10:41.030169,0.8905141499737096,0.9959462090395421,0.002683716479930648,6.549406141992355e-06,256.0,0.10072446255261563,32,7,3,0.17187838926238158,64,7,1,0.10143244730488483,32,5,2,,,,,512,512,7,0.6128732688860531,14.0,3,Adam,,,,45.0,0.6153846153846154,0.5919423115158012,"{""block_0_dropout"": 0.10072446255261563, ""block_0_filters"": 32, ""block_0_kernel"": 7, ""block_1_dropout"": 0.17187838926238158, ""block_1_filters"": 64, ""block_1_kernel"": 7, ""block_1_stride"": 1, ""block_2_dropout"": 0.10143244730488483, ""block_2_filters"": 32, ""block_2_kernel"": 5, ""block_2_stride"": 2, ""first_conv_filters"": 512, ""first_conv_kernel_size"": 7, ""n_blocks"": 3}",COMPLETE
89,0.31433299310728285,2026-09-21 11:27:39.964518,2026-09-21 11:33:51.113631,0 days 00:06:11.149113,0.906740529614998,0.984166234330108,0.00153225837295263,1.0157367842972673e-05,128.0,0.12771474197352659,32,7,3,0.1274151524765323,32,7,1,0.1147735388766247,64,5,2,,,,,512,512,7,0.6407228312963359,15.0,3,Adam,,,,,,,"{""block_0_dropout"": 0.12771474197352659, ""block_0_filters"": 32, ""block_0_kernel"": 7, ""block_1_dropout"": 0.1274151524765323, ""block_1_filters"": 32, ""block_1_kernel"": 7, ""block_1_stride"": 1, ""block_2_dropout"": 0.1147735388766247, ""block_2_filters"": 64, ""block_2_kernel"": 5, ""block_2_stride"": 2, ""first_conv_filters"": 512, ""first_conv_kernel_size"": 7, ""n_blocks"": 3}",PRUNED
