number,value,datetime_start,datetime_complete,duration,params_adam_beta1,params_adam_beta2,params_adam_lr,params_adam_wd,params_batch_size,params_block_0_dropout,params_block_0_filters,params_block_0_kernel,params_block_0_stride,params_block_1_dropout,params_block_1_filters,params_block_1_kernel,params_block_1_stride,params_block_2_dropout,params_block_2_filters,params_block_2_kernel,params_block_2_stride,params_block_3_dropout,params_block_3_filters,params_block_3_kernel,params_block_3_stride,params_fc_hidden,params_first_conv_filters,params_first_conv_kernel_size,params_lr_factor,params_lr_patience,params_n_blocks,params_optimizer,params_sgd_lr,params_sgd_momentum,params_sgd_wd,user_attrs_best_epoch,user_attrs_validation_accuracy,user_attrs_validation_macro_f1,system_attrs_tpe:relative_params:0,state
90,0.2581674267962268,2026-09-21 11:33:51.234754,2026-09-21 11:38:25.648671,0 days 00:04:34.413917,0.9103122791812891,0.9937989131711897,0.0011487231188057486,0.0061442617165942,64.0,0.11276787505078784,32,7,3,0.12334979374233312,32,7,1,0.2262487787881124,32,5,2,,,,,512,512,7,0.5401827175425151,13.0,3,Adam,,,,,,,"{""block_0_dropout"": 0.11276787505078784, ""block_0_filters"": 32, ""block_0_kernel"": 7, ""block_1_dropout"": 0.12334979374233312, ""block_1_filters"": 32, ""block_1_kernel"": 7, ""block_1_stride"": 1, ""block_2_dropout"": 0.2262487787881124, ""block_2_filters"": 32, ""block_2_kernel"": 5, ""block_2_stride"": 2, ""first_conv_filters"": 512, ""first_conv_kernel_size"": 7, ""n_blocks"": 3}",PRUNED
91,0.318599982589457,2026-09-21 11:38:25.768949,2026-09-21 11:44:37.027693,0 days 00:06:11.258744,0.8684316820157166,0.9850816794672467,0.0034577141084230346,2.044379388103715e-05,128.0,0.11443592790015913,32,7,3,0.14890388099547627,32,7,1,0.10661911832635892,32,5,2,,,,,512,512,7,0.6508711952257561,15.0,3,Adam,,,,,,,"{""block_0_dropout"": 0.11443592790015913, ""block_0_filters"": 32, ""block_0_kernel"": 7, ""block_1_dropout"": 0.14890388099547627, ""block_1_filters"": 32, ""block_1_kernel"": 7, ""block_1_stride"": 1, ""block_2_dropout"": 0.10661911832635892, ""block_2_filters"": 32, ""block_2_kernel"": 5, ""block_2_stride"": 2, ""first_conv_filters"": 512, ""first_conv_kernel_size"": 7, ""n_blocks"": 3}",PRUNED
92,0.3184136438754885,2026-09-21 11:44:37.143522,2026-09-21 11:47:14.153851,0 days 00:02:37.010329,0.8814038800942339,0.9779830006209144,0.002440259162435998,1.6133717377714466e-05,128.0,0.13907796664517227,32,7,3,0.12170802696153087,32,7,1,0.11410668616812858,32,5,2,,,,,512,512,3,0.6784649830952942,19.0,3,Adam,,,,,,,"{""block_0_dropout"": 0.13907796664517227, ""block_0_filters"": 32, ""block_0_kernel"": 7, ""block_1_dropout"": 0.12170802696153087, ""block_1_filters"": 32, ""block_1_kernel"": 7, ""block_1_stride"": 1, ""block_2_dropout"": 0.11410668616812858, ""block_2_filters"": 32, ""block_2_kernel"": 5, ""block_2_stride"": 2, ""first_conv_filters"": 512, ""first_conv_kernel_size"": 3, ""n_blocks"": 3}",PRUNED
93,0.6312673937152906,2026-09-21 11:47:14.256243,2026-09-21 12:18:09.318031,0 days 00:30:55.061788,0.877373141122377,0.9821013016712158,0.0009137742928024833,3.054254937131156e-05,128.0,0.10798483210784451,32,7,3,0.10891627443416096,32,7,1,0.16900348798910247,32,5,2,,,,,512,512,7,0.3700319344734549,16.0,3,Adam,,,,49.0,0.6449704142011834,0.617564373229398,"{""block_0_dropout"": 0.10798483210784451, ""block_0_filters"": 32, ""block_0_kernel"": 7, ""block_1_dropout"": 0.10891627443416096, ""block_1_filters"": 32, ""block_1_kernel"": 7, ""block_1_stride"": 1, ""block_2_dropout"": 0.16900348798910247, ""block_2_filters"": 32, ""block_2_kernel"": 5, ""block_2_stride"": 2, ""first_conv_filters"": 512, ""first_conv_kernel_size"": 7, ""n_blocks"": 3}",COMPLETE
94,0.425155128356275,2026-09-21 12:18:09.439793,2026-09-21 12:31:14.693995,0 days 00:13:05.254202,0.896133426146275,0.9905202025299187,0.0009444413302632815,0.00017342646725114727,128.0,0.10550238706709485,32,7,3,0.12148110409507865,32,7,1,0.18615250353544352,32,5,2,,,,,512,512,7,0.2863902248458174,16.0,3,Adam,,,,,,,"{""block_0_dropout"": 0.10550238706709485, ""block_0_filters"": 32, ""block_0_kernel"": 7, ""block_1_dropout"": 0.12148110409507865, ""block_1_filters"": 32, ""block_1_kernel"": 7, ""block_1_stride"": 1, ""block_2_dropout"": 0.18615250353544352, ""block_2_filters"": 32, ""block_2_kernel"": 5, ""block_2_stride"": 2, ""first_conv_filters"": 512, ""first_conv_kernel_size"": 7, ""n_blocks"": 3}",PRUNED
95,0.569430376746928,2026-09-21 12:31:14.814680,2026-09-21 13:02:08.967802,0 days 00:30:54.153122,0.8841481622168387,0.9825321434644979,0.0005597036989059222,3.329533293424291e-05,128.0,0.1125247760918607,32,7,3,0.13277523631778024,32,7,1,0.11966238896687,64,5,2,,,,,512,512,7,0.33308961512236074,16.0,3,Adam,,,,49.0,0.5621301775147929,0.5767305759790632,"{""block_0_dropout"": 0.1125247760918607, ""block_0_filters"": 32, ""block_0_kernel"": 7, ""block_1_dropout"": 0.13277523631778024, ""block_1_filters"": 32, ""block_1_kernel"": 7, ""block_1_stride"": 1, ""block_2_dropout"": 0.11966238896687, ""block_2_filters"": 64, ""block_2_kernel"": 5, ""block_2_stride"": 2, ""first_conv_filters"": 512, ""first_conv_kernel_size"": 7, ""n_blocks"": 3}",COMPLETE
96,0.37165412682815707,2026-09-21 13:02:09.124846,2026-09-21 13:33:46.743924,0 days 00:31:37.619078,0.8882945946452627,0.9360770899815474,0.0008554928851627217,1.1927109111343353e-05,256.0,0.13192337831520173,32,7,3,0.11203446334000618,32,7,1,0.10531960382835398,32,5,2,,,,,512,512,3,0.1722804204672363,17.0,3,Adam,,,,,,,"{""block_0_dropout"": 0.13192337831520173, ""block_0_filters"": 32, ""block_0_kernel"": 7, ""block_1_dropout"": 0.11203446334000618, ""block_1_filters"": 32, ""block_1_kernel"": 7, ""block_1_stride"": 1, ""block_2_dropout"": 0.10531960382835398, ""block_2_filters"": 32, ""block_2_kernel"": 5, ""block_2_stride"": 2, ""first_conv_filters"": 512, ""first_conv_kernel_size"": 3, ""n_blocks"": 3}",PRUNED
97,0.6614598429820737,2026-09-21 13:33:46.887047,2026-09-21 14:05:39.956140,0 days 00:31:53.069093,0.9027962685421446,0.9305038891420134,0.0007696374472469519,9.320157327940417e-06,128.0,0.1084516036699596,32,7,3,0.11298236093445059,32,7,1,0.17270365179076394,32,5,2,,,,,512,512,7,0.42573691327015434,14.0,3,Adam,,,,47.0,0.6804733727810651,0.6424463131830824,"{""block_0_dropout"": 0.1084516036699596, ""block_0_filters"": 32, ""block_0_kernel"": 7, ""block_1_dropout"": 0.11298236093445059, ""block_1_filters"": 32, ""block_1_kernel"": 7, ""block_1_stride"": 1, ""block_2_dropout"": 0.17270365179076394, ""block_2_filters"": 32, ""block_2_kernel"": 5, ""block_2_stride"": 2, ""first_conv_filters"": 512, ""first_conv_kernel_size"": 7, ""n_blocks"": 3}",COMPLETE
98,0.4053322514843276,2026-09-21 14:05:40.074478,2026-09-21 14:13:32.832221,0 days 00:07:52.757743,0.9151032110559238,0.9259631372767256,0.0006630250521460774,8.481147931335336e-06,64.0,0.11325400150606782,32,7,3,0.13796707722602075,32,7,1,0.22632831467198344,32,5,2,,,,,512,512,7,0.38162840743668314,14.0,3,Adam,,,,,,,"{""block_0_dropout"": 0.11325400150606782, ""block_0_filters"": 32, ""block_0_kernel"": 7, ""block_1_dropout"": 0.13796707722602075, ""block_1_filters"": 32, ""block_1_kernel"": 7, ""block_1_stride"": 1, ""block_2_dropout"": 0.22632831467198344, ""block_2_filters"": 32, ""block_2_kernel"": 5, ""block_2_stride"": 2, ""first_conv_filters"": 512, ""first_conv_kernel_size"": 7, ""n_blocks"": 3}",PRUNED
99,0.3178057952399563,2026-09-21 14:13:32.958978,2026-09-21 14:19:55.114395,0 days 00:06:22.155417,0.90146909139919,0.9295876302416333,0.0003731696150305304,2.9376994841530983e-06,128.0,0.10720707662917175,32,7,3,0.10474981656412417,32,7,1,0.18025924177537267,32,5,2,,,,,512,512,7,0.36695205840623263,12.0,3,Adam,,,,,,,"{""block_0_dropout"": 0.10720707662917175, ""block_0_filters"": 32, ""block_0_kernel"": 7, ""block_1_dropout"": 0.10474981656412417, ""block_1_filters"": 32, ""block_1_kernel"": 7, ""block_1_stride"": 1, ""block_2_dropout"": 0.18025924177537267, ""block_2_filters"": 32, ""block_2_kernel"": 5, ""block_2_stride"": 2, ""first_conv_filters"": 512, ""first_conv_kernel_size"": 7, ""n_blocks"": 3}",PRUNED
