number,value,datetime_start,datetime_complete,duration,params_adam_beta1,params_adam_beta2,params_adam_lr,params_adam_wd,params_batch_size,params_block_0_dropout,params_block_0_filters,params_block_0_kernel,params_block_0_stride,params_block_1_dropout,params_block_1_filters,params_block_1_kernel,params_block_1_stride,params_block_2_dropout,params_block_2_filters,params_block_2_kernel,params_block_2_stride,params_block_3_dropout,params_block_3_filters,params_block_3_kernel,params_block_3_stride,params_fc_hidden,params_first_conv_filters,params_first_conv_kernel_size,params_lr_factor,params_lr_patience,params_n_blocks,params_optimizer,params_sgd_lr,params_sgd_momentum,params_sgd_wd,user_attrs_best_epoch,user_attrs_validation_accuracy,user_attrs_validation_macro_f1,system_attrs_tpe:relative_params:0,state
33,0.32935897553254273,2026-09-20 01:12:44.409347,2026-09-20 01:15:15.333043,0 days 00:02:30.923696,,,,,64.0,0.1023466089860912,32,7,3,0.14990420249550598,16,7,1,0.1812556576589422,32,5,2,,,,,128,512,3,0.5956256580470556,19.0,3,SGD,0.03686892153451205,0.7369951031706039,4.004268039489325e-06,,,,"{""block_0_dropout"": 0.1023466089860912, ""block_0_filters"": 32, ""block_0_kernel"": 7, ""block_1_dropout"": 0.14990420249550598, ""block_1_filters"": 16, ""block_1_kernel"": 7, ""block_1_stride"": 1, ""block_2_dropout"": 0.1812556576589422, ""block_2_filters"": 32, ""block_2_kernel"": 5, ""block_2_stride"": 2, ""first_conv_filters"": 512, ""first_conv_kernel_size"": 3, ""n_blocks"": 3}",PRUNED
34,0.5406246334257468,2026-09-20 01:15:15.436528,2026-09-20 01:25:46.544694,0 days 00:10:31.108166,,,,,64.0,0.16878008021395466,32,7,3,0.1416634007696809,32,7,1,0.12235471301732873,64,5,2,,,,,128,512,3,0.6568412892928314,17.0,3,SGD,0.017166861685424434,0.811552703725604,4.149551611869223e-06,48.0,0.591715976331361,0.48953329052013267,"{""block_0_dropout"": 0.16878008021395466, ""block_0_filters"": 32, ""block_0_kernel"": 7, ""block_1_dropout"": 0.1416634007696809, ""block_1_filters"": 32, ""block_1_kernel"": 7, ""block_1_stride"": 1, ""block_2_dropout"": 0.12235471301732873, ""block_2_filters"": 64, ""block_2_kernel"": 5, ""block_2_stride"": 2, ""first_conv_filters"": 512, ""first_conv_kernel_size"": 3, ""n_blocks"": 3}",COMPLETE
35,0.3384864004992397,2026-09-20 01:25:46.647982,2026-09-20 01:26:32.042075,0 days 00:00:45.394093,,,,,128.0,0.11788129559095842,16,7,3,0.12494472166093878,32,7,1,0.14052757780547437,32,5,1,,,,,128,128,3,0.461020110994562,14.0,3,SGD,0.09896241246326694,0.737743173653252,6.40659395604667e-05,,,,"{""block_0_dropout"": 0.11788129559095842, ""block_0_filters"": 16, ""block_0_kernel"": 7, ""block_1_dropout"": 0.12494472166093878, ""block_1_filters"": 32, ""block_1_kernel"": 7, ""block_1_stride"": 1, ""block_2_dropout"": 0.14052757780547437, ""block_2_filters"": 32, ""block_2_kernel"": 5, ""block_2_stride"": 1, ""first_conv_filters"": 128, ""first_conv_kernel_size"": 3, ""n_blocks"": 3}",PRUNED
36,0.27644224229389064,2026-09-20 01:26:32.150596,2026-09-20 01:28:35.825837,0 days 00:02:03.675241,,,,,64.0,0.1247661216149763,16,7,3,0.10883513849617893,32,5,1,0.1871560421449633,32,5,1,,,,,512,512,3,0.3029812841883608,18.0,3,SGD,0.0066633426126332254,0.7016893192043991,1.0400077863477331e-06,,,,"{""block_0_dropout"": 0.1247661216149763, ""block_0_filters"": 16, ""block_0_kernel"": 7, ""block_1_dropout"": 0.10883513849617893, ""block_1_filters"": 32, ""block_1_kernel"": 5, ""block_1_stride"": 1, ""block_2_dropout"": 0.1871560421449633, ""block_2_filters"": 32, ""block_2_kernel"": 5, ""block_2_stride"": 1, ""first_conv_filters"": 512, ""first_conv_kernel_size"": 3, ""n_blocks"": 3}",PRUNED
37,0.601753537303874,2026-09-20 01:28:35.937482,2026-09-20 05:38:53.571292,0 days 04:10:17.633810,0.9171652108510058,0.9796247916927099,0.0012608252384107095,0.002104571493307998,256.0,0.10135813636892355,32,7,3,0.137754719262613,32,7,1,0.14637738148683851,32,5,2,,,,,256,512,7,0.5301021604105443,5.0,3,Adam,,,,44.0,0.6331360946745562,0.5703709799331919,"{""block_0_dropout"": 0.10135813636892355, ""block_0_filters"": 32, ""block_0_kernel"": 7, ""block_1_dropout"": 0.137754719262613, ""block_1_filters"": 32, ""block_1_kernel"": 7, ""block_1_stride"": 1, ""block_2_dropout"": 0.14637738148683851, ""block_2_filters"": 32, ""block_2_kernel"": 5, ""block_2_stride"": 2, ""first_conv_filters"": 512, ""first_conv_kernel_size"": 7, ""n_blocks"": 3}",COMPLETE
38,0.3217685491985307,2026-09-20 05:38:53.681938,2026-09-20 06:28:57.354089,0 days 00:50:03.672151,0.9158290666332569,0.9863718146532761,0.0012238517447060633,0.001947811023645757,256.0,0.14211937166105232,32,7,3,0.13985978623271733,32,3,1,0.15484251428012738,32,5,2,,,,,256,512,7,0.520299243779019,5.0,3,Adam,,,,,,,"{""block_0_dropout"": 0.14211937166105232, ""block_0_filters"": 32, ""block_0_kernel"": 7, ""block_1_dropout"": 0.13985978623271733, ""block_1_filters"": 32, ""block_1_kernel"": 3, ""block_1_stride"": 1, ""block_2_dropout"": 0.15484251428012738, ""block_2_filters"": 32, ""block_2_kernel"": 5, ""block_2_stride"": 2, ""first_conv_filters"": 512, ""first_conv_kernel_size"": 7, ""n_blocks"": 3}",PRUNED
39,,2026-09-20 06:28:57.452537,2026-09-20 06:28:57.611143,0 days 00:00:00.158606,,,,,,0.11607528995020715,32,7,3,0.15021262544625527,32,7,2,0.14195467169129172,32,5,2,,,,,,512,7,,,3,,,,,,,,"{""block_0_dropout"": 0.11607528995020715, ""block_0_filters"": 32, ""block_0_kernel"": 7, ""block_1_dropout"": 0.15021262544625527, ""block_1_filters"": 32, ""block_1_kernel"": 7, ""block_1_stride"": 2, ""block_2_dropout"": 0.14195467169129172, ""block_2_filters"": 32, ""block_2_kernel"": 5, ""block_2_stride"": 2, ""first_conv_filters"": 512, ""first_conv_kernel_size"": 7, ""n_blocks"": 3}",PRUNED
40,0.23888349212477467,2026-09-20 06:28:57.722584,2026-09-20 07:19:01.346787,0 days 00:50:03.624203,0.8862064120449973,0.9757724614397344,0.00045478480838307545,0.00852571817032043,256.0,0.1240528982980829,32,7,3,0.16391217027167135,32,7,1,0.11310940785181883,32,5,2,,,,,256,512,7,0.454125476489404,7.0,3,Adam,,,,,,,"{""block_0_dropout"": 0.1240528982980829, ""block_0_filters"": 32, ""block_0_kernel"": 7, ""block_1_dropout"": 0.16391217027167135, ""block_1_filters"": 32, ""block_1_kernel"": 7, ""block_1_stride"": 1, ""block_2_dropout"": 0.11310940785181883, ""block_2_filters"": 32, ""block_2_kernel"": 5, ""block_2_stride"": 2, ""first_conv_filters"": 512, ""first_conv_kernel_size"": 7, ""n_blocks"": 3}",PRUNED
41,0.27383156226271854,2026-09-20 07:19:01.473975,2026-09-20 08:19:08.394477,0 days 01:00:06.920502,0.9546880004696413,0.9992569305791577,0.0010049611710633189,0.002977694044837487,256.0,0.14973289814803753,32,7,3,0.1274915441954919,64,7,1,0.12941800512820836,32,5,2,,,,,256,512,7,0.5744151801099324,8.0,3,Adam,,,,,,,"{""block_0_dropout"": 0.14973289814803753, ""block_0_filters"": 32, ""block_0_kernel"": 7, ""block_1_dropout"": 0.1274915441954919, ""block_1_filters"": 64, ""block_1_kernel"": 7, ""block_1_stride"": 1, ""block_2_dropout"": 0.12941800512820836, ""block_2_filters"": 32, ""block_2_kernel"": 5, ""block_2_stride"": 2, ""first_conv_filters"": 512, ""first_conv_kernel_size"": 7, ""n_blocks"": 3}",PRUNED
42,0.4363816640353455,2026-09-20 08:19:08.505934,2026-09-20 08:24:59.127925,0 days 00:05:50.621991,0.917291271293584,0.9807232604401468,0.001814628940396446,0.000664248785817273,32.0,0.12712369644074845,32,7,3,0.14134114314216303,32,7,1,0.17131060267736092,32,5,2,,,,,256,512,3,0.6103201565164844,9.0,3,Adam,,,,,,,"{""block_0_dropout"": 0.12712369644074845, ""block_0_filters"": 32, ""block_0_kernel"": 7, ""block_1_dropout"": 0.14134114314216303, ""block_1_filters"": 32, ""block_1_kernel"": 7, ""block_1_stride"": 1, ""block_2_dropout"": 0.17131060267736092, ""block_2_filters"": 32, ""block_2_kernel"": 5, ""block_2_stride"": 2, ""first_conv_filters"": 512, ""first_conv_kernel_size"": 3, ""n_blocks"": 3}",PRUNED
43,0.18646855169961546,2026-09-20 08:24:59.241922,2026-09-20 08:51:17.937109,0 days 00:26:18.695187,0.98893047040984,0.9543576781254404,0.0004061974325362713,0.00014793347140051443,256.0,0.15725920603366167,16,7,3,0.10010081476397117,32,5,1,0.22145848063702572,32,5,2,,,,,256,512,3,0.492005132733274,19.0,3,Adam,,,,,,,"{""block_0_dropout"": 0.15725920603366167, ""block_0_filters"": 16, ""block_0_kernel"": 7, ""block_1_dropout"": 0.10010081476397117, ""block_1_filters"": 32, ""block_1_kernel"": 5, ""block_1_stride"": 1, ""block_2_dropout"": 0.22145848063702572, ""block_2_filters"": 32, ""block_2_kernel"": 5, ""block_2_stride"": 2, ""first_conv_filters"": 512, ""first_conv_kernel_size"": 3, ""n_blocks"": 3}",PRUNED
44,0.3591353228807276,2026-09-20 08:51:18.029971,2026-09-20 08:55:24.345126,0 days 00:04:06.315155,,,,,32.0,0.12747751006176716,16,7,3,0.1120030930850666,32,3,1,0.16035971599903906,32,5,2,,,,,128,512,3,0.6644328355929111,5.0,3,SGD,0.04409422669708329,0.7587972169431907,5.861699843017543e-06,,,,"{""block_0_dropout"": 0.12747751006176716, ""block_0_filters"": 16, ""block_0_kernel"": 7, ""block_1_dropout"": 0.1120030930850666, ""block_1_filters"": 32, ""block_1_kernel"": 3, ""block_1_stride"": 1, ""block_2_dropout"": 0.16035971599903906, ""block_2_filters"": 32, ""block_2_kernel"": 5, ""block_2_stride"": 2, ""first_conv_filters"": 512, ""first_conv_kernel_size"": 3, ""n_blocks"": 3}",PRUNED
45,0.29892794910366993,2026-09-20 08:55:24.463406,2026-09-20 09:21:43.044952,0 days 00:26:18.581546,0.8698022037816573,0.9288217184876246,0.00019088422465448566,3.5097680140287996e-06,256.0,0.10242655393977049,16,7,3,0.11907511987153253,32,7,1,0.16808054521974242,128,5,2,,,,,512,512,3,0.5486948164157313,12.0,3,Adam,,,,,,,"{""block_0_dropout"": 0.10242655393977049, ""block_0_filters"": 16, ""block_0_kernel"": 7, ""block_1_dropout"": 0.11907511987153253, ""block_1_filters"": 32, ""block_1_kernel"": 7, ""block_1_stride"": 1, ""block_2_dropout"": 0.16808054521974242, ""block_2_filters"": 128, ""block_2_kernel"": 5, ""block_2_stride"": 2, ""first_conv_filters"": 512, ""first_conv_kernel_size"": 3, ""n_blocks"": 3}",PRUNED
46,0.5827379173370094,2026-09-20 09:21:43.143003,2026-09-20 09:52:32.294004,0 days 00:30:49.151001,0.9343625885691635,0.9134503005078431,0.004058304424022921,3.6248578030896134e-05,128.0,0.1036276848545267,32,7,3,0.12347413105411967,32,7,1,0.1499904730673558,32,5,2,,,,,256,512,7,0.6995071918794826,19.0,3,Adam,,,,45.0,0.591715976331361,0.5737598583426579,"{""block_0_dropout"": 0.1036276848545267, ""block_0_filters"": 32, ""block_0_kernel"": 7, ""block_1_dropout"": 0.12347413105411967, ""block_1_filters"": 32, ""block_1_kernel"": 7, ""block_1_stride"": 1, ""block_2_dropout"": 0.1499904730673558, ""block_2_filters"": 32, ""block_2_kernel"": 5, ""block_2_stride"": 2, ""first_conv_filters"": 512, ""first_conv_kernel_size"": 7, ""n_blocks"": 3}",COMPLETE
47,0.3242662615832464,2026-09-20 09:52:32.435386,2026-09-20 09:58:41.929408,0 days 00:06:09.494022,0.9341086110369098,0.9144715731192347,0.004322998167624966,2.6183225358743775e-05,128.0,0.14655735375793805,32,7,3,0.15042765587907098,32,5,1,0.13184801993595607,32,5,2,,,,,256,512,7,0.6780699553325387,20.0,3,Adam,,,,,,,"{""block_0_dropout"": 0.14655735375793805, ""block_0_filters"": 32, ""block_0_kernel"": 7, ""block_1_dropout"": 0.15042765587907098, ""block_1_filters"": 32, ""block_1_kernel"": 5, ""block_1_stride"": 1, ""block_2_dropout"": 0.13184801993595607, ""block_2_filters"": 32, ""block_2_kernel"": 5, ""block_2_stride"": 2, ""first_conv_filters"": 512, ""first_conv_kernel_size"": 7, ""n_blocks"": 3}",PRUNED
48,0.3077066951230635,2026-09-20 09:58:42.021866,2026-09-20 10:04:51.405356,0 days 00:06:09.383490,0.9465107825790283,0.9130177151085768,0.00800775468594393,4.103517246993599e-05,128.0,0.10063558389722088,32,7,3,0.10553594600702881,32,5,1,0.11545207499062982,32,5,2,,,,,256,512,7,0.69236601715887,19.0,3,Adam,,,,,,,"{""block_0_dropout"": 0.10063558389722088, ""block_0_filters"": 32, ""block_0_kernel"": 7, ""block_1_dropout"": 0.10553594600702881, ""block_1_filters"": 32, ""block_1_kernel"": 5, ""block_1_stride"": 1, ""block_2_dropout"": 0.11545207499062982, ""block_2_filters"": 32, ""block_2_kernel"": 5, ""block_2_stride"": 2, ""first_conv_filters"": 512, ""first_conv_kernel_size"": 7, ""n_blocks"": 3}",PRUNED
49,0.3049859096681839,2026-09-20 10:04:51.526546,2026-09-20 10:11:01.533890,0 days 00:06:10.007344,0.9256729275339772,0.9444547691937442,0.00407170487876634,7.421747550087199e-05,128.0,0.10154455323379837,32,7,3,0.11825311477258274,32,7,1,0.13659271496978745,32,5,2,,,,,256,512,7,0.39705974022318674,18.0,3,Adam,,,,,,,"{""block_0_dropout"": 0.10154455323379837, ""block_0_filters"": 32, ""block_0_kernel"": 7, ""block_1_dropout"": 0.11825311477258274, ""block_1_filters"": 32, ""block_1_kernel"": 7, ""block_1_stride"": 1, ""block_2_dropout"": 0.13659271496978745, ""block_2_filters"": 32, ""block_2_kernel"": 5, ""block_2_stride"": 2, ""first_conv_filters"": 512, ""first_conv_kernel_size"": 7, ""n_blocks"": 3}",PRUNED
50,,2026-09-20 10:11:01.645632,2026-09-20 10:11:01.829779,0 days 00:00:00.184147,,,,,,0.12314813628266737,32,7,3,0.11877292557223192,32,7,2,0.15888667207931717,32,5,2,,,,,,512,7,,,3,,,,,,,,"{""block_0_dropout"": 0.12314813628266737, ""block_0_filters"": 32, ""block_0_kernel"": 7, ""block_1_dropout"": 0.11877292557223192, ""block_1_filters"": 32, ""block_1_kernel"": 7, ""block_1_stride"": 2, ""block_2_dropout"": 0.15888667207931717, ""block_2_filters"": 32, ""block_2_kernel"": 5, ""block_2_stride"": 2, ""first_conv_filters"": 512, ""first_conv_kernel_size"": 7, ""n_blocks"": 3}",PRUNED
51,0.33462427709923653,2026-09-20 10:11:01.929778,2026-09-20 10:17:09.802704,0 days 00:06:07.872926,0.9081664256733327,0.9002913724253686,0.0008033415365192018,0.0002991537586038178,128.0,0.1037302597469799,8,7,3,0.13530199481888083,32,7,1,0.15531924517086135,32,5,2,,,,,512,512,7,0.6356048902572613,16.0,3,Adam,,,,,,,"{""block_0_dropout"": 0.1037302597469799, ""block_0_filters"": 8, ""block_0_kernel"": 7, ""block_1_dropout"": 0.13530199481888083, ""block_1_filters"": 32, ""block_1_kernel"": 7, ""block_1_stride"": 1, ""block_2_dropout"": 0.15531924517086135, ""block_2_filters"": 32, ""block_2_kernel"": 5, ""block_2_stride"": 2, ""first_conv_filters"": 512, ""first_conv_kernel_size"": 7, ""n_blocks"": 3}",PRUNED
52,0.23310948610902368,2026-09-20 10:17:09.926518,2026-09-20 10:23:19.980730,0 days 00:06:10.054212,0.9708541539386477,0.9264997314814255,0.0016432057130156556,0.0012123256679579576,128.0,0.13280391277820106,32,7,3,0.11958671583655929,32,7,1,0.17647865618802394,32,5,2,,,,,256,512,7,0.5871864541184894,18.0,3,Adam,,,,,,,"{""block_0_dropout"": 0.13280391277820106, ""block_0_filters"": 32, ""block_0_kernel"": 7, ""block_1_dropout"": 0.11958671583655929, ""block_1_filters"": 32, ""block_1_kernel"": 7, ""block_1_stride"": 1, ""block_2_dropout"": 0.17647865618802394, ""block_2_filters"": 32, ""block_2_kernel"": 5, ""block_2_stride"": 2, ""first_conv_filters"": 512, ""first_conv_kernel_size"": 7, ""n_blocks"": 3}",PRUNED
53,0.6306300469285763,2026-09-20 10:23:20.089630,2026-09-20 10:54:09.193671,0 days 00:30:49.104041,0.8965946908399103,0.9376157850917523,0.0028188716013014662,4.335517601239894e-06,128.0,0.10626654223011665,32,7,3,0.11213787950965198,32,7,1,0.18779520751364817,32,5,2,,,,,512,512,7,0.6516397762622139,20.0,3,Adam,,,,49.0,0.6627218934911243,0.5985382003660282,"{""block_0_dropout"": 0.10626654223011665, ""block_0_filters"": 32, ""block_0_kernel"": 7, ""block_1_dropout"": 0.11213787950965198, ""block_1_filters"": 32, ""block_1_kernel"": 7, ""block_1_stride"": 1, ""block_2_dropout"": 0.18779520751364817, ""block_2_filters"": 32, ""block_2_kernel"": 5, ""block_2_stride"": 2, ""first_conv_filters"": 512, ""first_conv_kernel_size"": 7, ""n_blocks"": 3}",COMPLETE
54,0.6146940332620628,2026-09-20 10:54:09.316394,2026-09-20 11:24:58.863907,0 days 00:30:49.547513,0.8973712138533441,0.9383489680852162,0.0027330260998030703,7.080158720543942e-06,128.0,0.1214236306760817,32,7,3,0.1447163272580977,32,7,1,0.20995302122592957,32,5,2,,,,,512,512,7,0.6953469314526095,20.0,3,Adam,,,,45.0,0.6331360946745562,0.5962519718495695,"{""block_0_dropout"": 0.1214236306760817, ""block_0_filters"": 32, ""block_0_kernel"": 7, ""block_1_dropout"": 0.1447163272580977, ""block_1_filters"": 32, ""block_1_kernel"": 7, ""block_1_stride"": 1, ""block_2_dropout"": 0.20995302122592957, ""block_2_filters"": 32, ""block_2_kernel"": 5, ""block_2_stride"": 2, ""first_conv_filters"": 512, ""first_conv_kernel_size"": 7, ""n_blocks"": 3}",COMPLETE
55,0.5643014928440029,2026-09-20 11:24:58.991729,2026-09-20 11:55:49.230196,0 days 00:30:50.238467,0.8956999189596978,0.9378255981068501,0.0027834895949980214,4.619110232587135e-06,128.0,0.1142873210039324,32,7,3,0.13033103522726797,32,7,1,0.13583786705499634,32,5,2,,,,,512,512,7,0.6990829690783196,20.0,3,Adam,,,,41.0,0.5857988165680473,0.5428041691199585,"{""block_0_dropout"": 0.1142873210039324, ""block_0_filters"": 32, ""block_0_kernel"": 7, ""block_1_dropout"": 0.13033103522726797, ""block_1_filters"": 32, ""block_1_kernel"": 7, ""block_1_stride"": 1, ""block_2_dropout"": 0.13583786705499634, ""block_2_filters"": 32, ""block_2_kernel"": 5, ""block_2_stride"": 2, ""first_conv_filters"": 512, ""first_conv_kernel_size"": 7, ""n_blocks"": 3}",COMPLETE
56,0.32644747496162674,2026-09-20 11:55:49.341596,2026-09-20 12:01:59.695051,0 days 00:06:10.353455,0.9123911929780425,0.9391129591677093,0.004757667258441377,3.655506814301311e-06,128.0,0.10571773034701591,32,7,3,0.10643217108735724,32,7,1,0.19889434668673983,32,5,2,,,,,512,512,7,0.6604840765976303,19.0,3,Adam,,,,,,,"{""block_0_dropout"": 0.10571773034701591, ""block_0_filters"": 32, ""block_0_kernel"": 7, ""block_1_dropout"": 0.10643217108735724, ""block_1_filters"": 32, ""block_1_kernel"": 7, ""block_1_stride"": 1, ""block_2_dropout"": 0.19889434668673983, ""block_2_filters"": 32, ""block_2_kernel"": 5, ""block_2_stride"": 2, ""first_conv_filters"": 512, ""first_conv_kernel_size"": 7, ""n_blocks"": 3}",PRUNED
57,,2026-09-20 12:01:59.817539,2026-09-20 12:01:59.979111,0 days 00:00:00.161572,,,,,,0.1165084156617324,32,7,3,0.12004485085810834,32,7,2,0.18004088513708805,32,5,2,,,,,,512,7,,,3,,,,,,,,"{""block_0_dropout"": 0.1165084156617324, ""block_0_filters"": 32, ""block_0_kernel"": 7, ""block_1_dropout"": 0.12004485085810834, ""block_1_filters"": 32, ""block_1_kernel"": 7, ""block_1_stride"": 2, ""block_2_dropout"": 0.18004088513708805, ""block_2_filters"": 32, ""block_2_kernel"": 5, ""block_2_stride"": 2, ""first_conv_filters"": 512, ""first_conv_kernel_size"": 7, ""n_blocks"": 3}",PRUNED
58,0.5920453454097258,2026-09-20 12:02:00.092789,2026-09-20 12:32:50.183801,0 days 00:30:50.091012,0.8981986583585537,0.9148274183641089,0.0029848909623109146,1.538893786104087e-05,128.0,0.10291393530632469,32,7,3,0.16284118870274822,32,7,1,0.12932394611926018,32,5,2,,,,,512,512,7,0.6643961549840506,20.0,3,Adam,,,,33.0,0.6153846153846154,0.5687060754348361,"{""block_0_dropout"": 0.10291393530632469, ""block_0_filters"": 32, ""block_0_kernel"": 7, ""block_1_dropout"": 0.16284118870274822, ""block_1_filters"": 32, ""block_1_kernel"": 7, ""block_1_stride"": 1, ""block_2_dropout"": 0.12932394611926018, ""block_2_filters"": 32, ""block_2_kernel"": 5, ""block_2_stride"": 2, ""first_conv_filters"": 512, ""first_conv_kernel_size"": 7, ""n_blocks"": 3}",COMPLETE
59,0.3268866627347277,2026-09-20 12:32:50.292292,2026-09-20 12:39:00.622088,0 days 00:06:10.329796,0.8996102347545099,0.9147016986084673,0.0029296461495945465,1.3027604908743485e-05,128.0,0.1392040286588948,32,7,3,0.15843662759168628,32,7,1,0.24171386770459286,32,5,2,,,,,512,512,7,0.6685012742076785,20.0,3,Adam,,,,,,,"{""block_0_dropout"": 0.1392040286588948, ""block_0_filters"": 32, ""block_0_kernel"": 7, ""block_1_dropout"": 0.15843662759168628, ""block_1_filters"": 32, ""block_1_kernel"": 7, ""block_1_stride"": 1, ""block_2_dropout"": 0.24171386770459286, ""block_2_filters"": 32, ""block_2_kernel"": 5, ""block_2_stride"": 2, ""first_conv_filters"": 512, ""first_conv_kernel_size"": 7, ""n_blocks"": 3}",PRUNED
60,0.3209106504654672,2026-09-20 12:39:00.749551,2026-09-20 12:44:51.772818,0 days 00:05:51.023267,0.8903892772832357,0.9588253271270626,0.006194296230837978,6.099375952713941e-06,128.0,0.11595310812488858,32,5,3,0.1707661225647438,32,7,1,0.16229156656103044,32,5,2,,,,,512,512,7,0.643913746967903,19.0,3,Adam,,,,,,,"{""block_0_dropout"": 0.11595310812488858, ""block_0_filters"": 32, ""block_0_kernel"": 5, ""block_1_dropout"": 0.1707661225647438, ""block_1_filters"": 32, ""block_1_kernel"": 7, ""block_1_stride"": 1, ""block_2_dropout"": 0.16229156656103044, ""block_2_filters"": 32, ""block_2_kernel"": 5, ""block_2_stride"": 2, ""first_conv_filters"": 512, ""first_conv_kernel_size"": 7, ""n_blocks"": 3}",PRUNED
61,0.624265284882233,2026-09-20 12:44:51.883712,2026-09-20 13:15:42.122452,0 days 00:30:50.238740,0.877766825430488,0.9678703507561377,0.003235525447785475,1.8138764840678453e-05,128.0,0.1202737382076943,32,7,3,0.12419697681796334,32,7,1,0.20541664922724903,32,5,2,,,,,512,512,7,0.6965618344719297,20.0,3,Adam,,,,48.0,0.6449704142011834,0.6035601555632825,"{""block_0_dropout"": 0.1202737382076943, ""block_0_filters"": 32, ""block_0_kernel"": 7, ""block_1_dropout"": 0.12419697681796334, ""block_1_filters"": 32, ""block_1_kernel"": 7, ""block_1_stride"": 1, ""block_2_dropout"": 0.20541664922724903, ""block_2_filters"": 32, ""block_2_kernel"": 5, ""block_2_stride"": 2, ""first_conv_filters"": 512, ""first_conv_kernel_size"": 7, ""n_blocks"": 3}",COMPLETE
