number,value,datetime_start,datetime_complete,duration,params_adam_beta1,params_adam_beta2,params_adam_lr,params_adam_wd,params_batch_size,params_dropout,params_fc_hidden,params_lr_factor,params_lr_patience,params_optimizer,params_sgd_lr,params_sgd_momentum,params_sgd_wd,user_attrs_best_epoch,user_attrs_validation_accuracy,user_attrs_validation_macro_f1,state
0,1.0,2026-10-09 10:21:03.770211,2026-10-09 10:21:43.570376,0 days 00:00:39.800165,,,,,64,0.1624074561769746,128,0.11646759543664197,20,SGD,0.0396760507705299,0.8743233534055306,0.0006796578090758161,2.0,1.0,1.0,COMPLETE
1,0.99862777599134,2026-10-09 10:21:43.724893,2026-10-09 10:22:17.237702,0 days 00:00:33.512809,,,,,128,0.21649165607921678,256,0.728140769114411,8,SGD,0.0007523742884534858,0.8062449345551705,6.672367170464208e-05,47.0,0.9984076433121019,0.9988479086705783,COMPLETE
2,0.9903902732391314,2026-10-09 10:22:17.370770,2026-10-09 10:22:50.396534,0 days 00:00:33.025764,,,,,128,0.4862528132298237,512,0.19763058787582308,12,SGD,0.00019634341572933326,0.8984275776885255,5.762487216478604e-05,5.0,0.9888535031847133,0.9919270432935495,COMPLETE
3,1.0,2026-10-09 10:22:50.532669,2026-10-09 10:23:22.975754,0 days 00:00:32.443085,,,,,200,0.17394178221021084,64,0.8374993880184934,6,SGD,0.06584106160121614,0.9594999316240181,0.0002463768595899747,5.0,1.0,1.0,COMPLETE
4,1.0,2026-10-09 10:23:23.126703,2026-10-09 10:23:57.103399,0 days 00:00:33.976696,,,,,128,0.2123738038749523,256,0.717795815437326,8,SGD,0.025502980701628937,0.7216196866671335,0.008862326508576254,4.0,1.0,1.0,COMPLETE
5,0.9875845523334499,2026-10-09 10:23:57.245437,2026-10-09 10:24:04.145025,0 days 00:00:06.899588,,,,,128,0.1463476238100519,128,0.36014665762139764,16,SGD,0.0009833181933644897,0.7184319215829468,1.753594952976443e-05,,,,PRUNED
6,1.0,2026-10-09 10:24:04.285310,2026-10-09 10:24:38.377396,0 days 00:00:34.092086,0.8651047997790626,0.9031397756501047,0.0007162786999897341,1.263794633808288e-06,128,0.40838687198182444,256,0.6091283290110243,10,Adam,,,,3.0,1.0,1.0,COMPLETE
7,1.0,2026-10-09 10:24:38.522009,2026-10-09 10:25:11.700535,0 days 00:00:33.178526,0.9720044826262805,0.9802868404822216,0.004132765459466363,0.000341676434183297,200,0.21590058116550723,128,0.24925604710882868,19,Adam,,,,1.0,1.0,1.0,COMPLETE
8,0.99862777599134,2026-10-09 10:25:11.864959,2026-10-09 10:25:20.180433,0 days 00:00:08.315474,,,,,64,0.42720590636899725,512,0.19589229386694626,10,SGD,0.0034059785435329977,0.8210491909131459,7.7344821566468e-06,,,,PRUNED
9,0.9701914452165876,2026-10-09 10:25:20.331658,2026-10-09 10:25:27.191209,0 days 00:00:06.859551,,,,,128,0.20071291833014568,256,0.5021432185830892,5,SGD,0.000715354779469316,0.7106972147328144,0.000274319913977967,,,,PRUNED
10,0.99862777599134,2026-10-09 10:25:27.328104,2026-10-09 10:25:35.592116,0 days 00:00:08.264012,0.9770730713395525,0.9958810975199475,0.00010862348973937149,0.007645683783605599,64,0.323540359302987,128,0.422359922501545,20,Adam,,,,,,,PRUNED
11,1.0,2026-10-09 10:25:35.735046,2026-10-09 10:26:07.823597,0 days 00:00:32.088551,,,,,200,0.10321648831143171,64,0.8895190276185567,16,SGD,0.09540369840469419,0.9853625896320626,0.0010437258483189142,3.0,1.0,1.0,COMPLETE
12,1.0,2026-10-09 10:26:07.976182,2026-10-09 10:26:39.942852,0 days 00:00:31.966670,,,,,200,0.28455177586829483,64,0.8889223100786534,15,SGD,0.0329684711437591,0.9690045843459457,0.0012237594247191301,5.0,1.0,1.0,COMPLETE
13,1.0,2026-10-09 10:26:40.083341,2026-10-09 10:27:20.137295,0 days 00:00:40.053954,,,,,64,0.14475048819439315,64,0.34978794873769303,5,SGD,0.014043721733475028,0.9122902878584767,0.0004940538306086194,4.0,1.0,1.0,COMPLETE
14,1.0,2026-10-09 10:27:20.279605,2026-10-09 10:27:51.392904,0 days 00:00:31.113299,0.859332234868209,0.9283914118467068,0.009917608120507165,1.3962100266000202e-06,200,0.28484590336045124,64,0.5779239573507515,13,Adam,,,,1.0,1.0,1.0,COMPLETE
15,0.9910488777212905,2026-10-09 10:27:51.530698,2026-10-09 10:27:59.128027,0 days 00:00:07.597329,,,,,64,0.15115499370132435,128,0.7769067216636688,18,SGD,0.08872754604813389,0.9015230412918347,1.1535635582566103e-06,,,,PRUNED
16,0.9972532421577007,2026-10-09 10:27:59.269683,2026-10-09 10:28:05.346177,0 days 00:00:06.076494,,,,,200,0.1019739981953502,64,0.11054337150473875,13,SGD,0.007985761920474493,0.8418220394354431,0.005928440456998787,,,,PRUNED
17,1.0,2026-10-09 10:28:05.479786,2026-10-09 10:28:42.186628,0 days 00:00:36.706842,,,,,64,0.2802886303907517,128,0.6161529202998269,7,SGD,0.04865872266001758,0.9420750413040843,0.00018419912902158537,2.0,1.0,1.0,COMPLETE
18,1.0,2026-10-09 10:28:42.324116,2026-10-09 10:29:11.666975,0 days 00:00:29.342859,0.9175988105045949,0.9554222965937597,0.00013159405537260094,7.272499656034689e-05,200,0.16242096428774086,512,0.4808837093482553,11,Adam,,,,8.0,1.0,1.0,COMPLETE
19,1.0,2026-10-09 10:29:11.799773,2026-10-09 10:29:49.151626,0 days 00:00:37.351853,,,,,64,0.25112285315613164,64,0.32189058061021525,17,SGD,0.007904805314839801,0.8683099026977347,0.0018015184300938275,6.0,1.0,1.0,COMPLETE
20,1.0,2026-10-09 10:29:49.294700,2026-10-09 10:30:19.947489,0 days 00:00:30.652789,,,,,200,0.3355024465027995,128,0.10052019545656138,14,SGD,0.015965157222639883,0.7806084362054304,0.0001078469806091638,4.0,1.0,1.0,COMPLETE
21,1.0,2026-10-09 10:30:20.109238,2026-10-09 10:30:52.259109,0 days 00:00:32.149871,,,,,128,0.17593748017352706,256,0.7899847193444565,7,SGD,0.031806234045992615,0.9455882799604204,0.008687604383983314,2.0,1.0,1.0,COMPLETE
22,1.0,2026-10-09 10:30:52.393869,2026-10-09 10:31:32.137467,0 days 00:00:39.743598,,,,,64,0.2435557078373038,256,0.6875530565987236,8,SGD,0.034642969884045756,0.7537241115189037,0.003151334239797008,3.0,1.0,1.0,COMPLETE
23,1.0,2026-10-09 10:31:32.281564,2026-10-09 10:32:06.207097,0 days 00:00:33.925533,,,,,128,0.1929272849955364,256,0.8309823368306355,6,SGD,0.01585096233272086,0.8649803885047864,0.0005990890881842158,3.0,1.0,1.0,COMPLETE
24,1.0,2026-10-09 10:32:06.355497,2026-10-09 10:32:40.082914,0 days 00:00:33.727417,,,,,128,0.1260993536492537,64,0.6729311268196287,8,SGD,0.06078024894476485,0.7477015329783653,2.717650484796996e-05,2.0,1.0,1.0,COMPLETE
25,1.0,2026-10-09 10:32:40.236633,2026-10-09 10:33:18.575910,0 days 00:00:38.339277,,,,,64,0.23862673496347722,256,0.8149693176335305,10,SGD,0.023080059917593005,0.9297487864176102,0.004330257038320239,1.0,1.0,1.0,COMPLETE
26,1.0,2026-10-09 10:33:18.711755,2026-10-09 10:33:47.774618,0 days 00:00:29.062863,0.9185651757105271,0.952569116087763,0.0008891959815138327,0.008053548891769556,200,0.18237688438206237,128,0.5511788137509634,9,Adam,,,,4.0,1.0,1.0,COMPLETE
27,0.9972532421577007,2026-10-09 10:33:47.908761,2026-10-09 10:33:54.163492,0 days 00:00:06.254731,,,,,128,0.3227387767515332,512,0.7168831307027279,6,SGD,0.004316025324168695,0.8748506103069287,0.0004304557258375311,,,,PRUNED
28,1.0,2026-10-09 10:33:54.297969,2026-10-09 10:34:29.984928,0 days 00:00:35.686959,,,,,64,0.13006472108693184,64,0.4330223720899338,20,SGD,0.053590649852850995,0.7908522907625807,0.002432152169061005,2.0,1.0,1.0,COMPLETE
29,1.0,2026-10-09 10:34:30.117280,2026-10-09 10:34:59.281054,0 days 00:00:29.163774,,,,,200,0.22128726520506686,256,0.7361726834315148,8,SGD,0.009196173262142109,0.8447969835515098,0.0001614630394349034,7.0,1.0,1.0,COMPLETE
30,1.0,2026-10-09 10:34:59.423135,2026-10-09 10:35:29.963483,0 days 00:00:30.540348,,,,,128,0.20827413788288976,128,0.8509244476845115,6,SGD,0.024208210521437807,0.9657627558265043,0.00954284625093652,6.0,1.0,1.0,COMPLETE
31,1.0,2026-10-09 10:35:30.095577,2026-10-09 10:36:00.829824,0 days 00:00:30.734247,0.8550469970103358,0.9054532775776134,0.000730031421084033,1.05794324980846e-06,128,0.39378378529398717,256,0.6426263861297492,10,Adam,,,,3.0,1.0,1.0,COMPLETE
32,1.0,2026-10-09 10:36:00.966508,2026-10-09 10:36:31.691823,0 days 00:00:30.725315,0.8974149708742907,0.9032441640206469,0.0006880355725676238,2.736743459428975e-05,128,0.49588957924312227,256,0.7599564440619538,9,Adam,,,,3.0,1.0,1.0,COMPLETE
33,1.0,2026-10-09 10:36:31.826262,2026-10-09 10:37:02.567569,0 days 00:00:30.741307,0.9453555538416395,0.9351077263316279,0.001914163193132958,1.0909808492855201e-05,128,0.46089646403157003,256,0.6202488105651071,7,Adam,,,,2.0,1.0,1.0,COMPLETE
34,1.0,2026-10-09 10:37:02.702320,2026-10-09 10:37:33.431298,0 days 00:00:30.728978,0.8867095050006737,0.9695190918632326,0.0003672346900776047,0.0007645275194737403,128,0.37120437217388835,256,0.2721627044185306,11,Adam,,,,4.0,1.0,1.0,COMPLETE
35,1.0,2026-10-09 10:37:33.568207,2026-10-09 10:38:04.412924,0 days 00:00:30.844717,0.9376002367030948,0.927785364020744,0.00031141547881483603,6.297902417249958e-06,128,0.4554477427050652,512,0.7020198078788971,12,Adam,,,,3.0,1.0,1.0,COMPLETE
36,1.0,2026-10-09 10:38:04.546318,2026-10-09 10:38:36.254443,0 days 00:00:31.708125,0.8792831066795331,0.9967813332695186,0.002699308201120589,0.0006984368719625207,128,0.39556103730469017,256,0.5368137885969357,5,Adam,,,,2.0,1.0,1.0,COMPLETE
37,0.9958763313606742,2026-10-09 10:38:36.387993,2026-10-09 10:38:42.822008,0 days 00:00:06.434015,,,,,128,0.16698175911686367,128,0.14991897708025084,9,SGD,0.003952067128010677,0.7674922334062051,0.0009543579540578042,,,,PRUNED
38,1.0,2026-10-09 10:38:42.960173,2026-10-09 10:39:21.252074,0 days 00:00:38.291901,0.9547612583103963,0.9174920568078124,0.006687175291279572,9.816848495844863e-05,64,0.2592911060461327,256,0.24211186015143454,19,Adam,,,,5.0,1.0,1.0,COMPLETE
39,1.0,2026-10-09 10:39:21.382634,2026-10-09 10:39:51.600543,0 days 00:00:30.217909,,,,,200,0.12405682916963609,128,0.4320692700576615,16,SGD,0.06032687601316249,0.7342052680198315,0.00030584688962074233,2.0,1.0,1.0,COMPLETE
40,1.0,2026-10-09 10:39:51.733086,2026-10-09 10:40:23.660148,0 days 00:00:31.927062,,,,,128,0.22847227440318219,512,0.8718029908842322,7,SGD,0.09400378095025448,0.8351271395136565,1.0663116550726851e-05,1.0,1.0,1.0,COMPLETE
41,1.0,2026-10-09 10:40:23.796447,2026-10-09 10:40:54.085163,0 days 00:00:30.288716,0.9832355991829506,0.977963583235087,0.002886403626939268,0.0005224250285139532,200,0.19379945677391933,128,0.23670805906741674,18,Adam,,,,2.0,1.0,1.0,COMPLETE
42,1.0,2026-10-09 10:40:54.218225,2026-10-09 10:41:24.550078,0 days 00:00:30.331853,0.9653578067425459,0.9518550583897389,0.004891842567809801,5.884047896670292e-06,200,0.22359249376214824,128,0.18994569655172838,19,Adam,,,,2.0,1.0,1.0,COMPLETE
43,1.0,2026-10-09 10:41:24.683845,2026-10-09 10:41:54.991972,0 days 00:00:30.308127,0.9226849890193556,0.9790584575901853,0.001677078326531742,0.002091285102882918,200,0.26916001663974515,128,0.15004679051432943,20,Adam,,,,3.0,1.0,1.0,COMPLETE
44,0.9958763313606742,2026-10-09 10:41:55.126177,2026-10-09 10:42:01.280007,0 days 00:00:06.153830,0.9011701680154409,0.9672431242995675,0.0002300500709992446,0.00015687435279362506,200,0.29625373297924423,64,0.39459484519018123,17,Adam,,,,,,,PRUNED
45,1.0,2026-10-09 10:42:01.413729,2026-10-09 10:42:31.723770,0 days 00:00:30.310041,0.8732612479723227,0.944159117522892,0.003988892114095563,2.7391703223955087e-05,200,0.15077674387997475,128,0.29508735185082924,19,Adam,,,,2.0,1.0,1.0,COMPLETE
46,1.0,2026-10-09 10:42:31.857258,2026-10-09 10:43:07.740352,0 days 00:00:35.883094,,,,,64,0.20843884172912058,64,0.4802895321972399,15,SGD,0.021531773375220817,0.987442686755426,1.5362389317093334e-06,10.0,1.0,1.0,COMPLETE
47,0.99862777599134,2026-10-09 10:43:07.871623,2026-10-09 10:43:13.821686,0 days 00:00:05.950063,,,,,200,0.35346685291103663,128,0.15959021248881272,18,SGD,0.011278580150648749,0.8183964861393469,8.643196528822587e-05,,,,PRUNED
48,1.0,2026-10-09 10:43:13.956910,2026-10-09 10:43:49.660114,0 days 00:00:35.703204,0.9347365130381847,0.918036140672352,0.001042421334758701,2.1219292276027154e-06,64,0.4212179742598085,64,0.7954996029735264,5,Adam,,,,2.0,1.0,1.0,COMPLETE
49,0.9931151053762519,2026-10-09 10:43:49.793030,2026-10-09 10:43:55.663130,0 days 00:00:05.870100,,,,,200,0.3030479098270966,256,0.3424742105667715,14,SGD,0.002074122874845528,0.8873398622145205,3.210286198562211e-05,,,,PRUNED
