number,value,datetime_start,datetime_complete,duration,params_adam_beta1,params_adam_beta2,params_adam_lr,params_adam_wd,params_batch_size,params_block_0_dropout,params_block_0_filters,params_block_0_kernel,params_block_0_stride,params_block_1_dropout,params_block_1_filters,params_block_1_kernel,params_block_1_stride,params_block_2_dropout,params_block_2_filters,params_block_2_kernel,params_block_2_stride,params_block_3_dropout,params_block_3_filters,params_block_3_kernel,params_block_3_stride,params_fc_hidden,params_first_conv_filters,params_first_conv_kernel_size,params_lr_factor,params_lr_patience,params_n_blocks,params_optimizer,params_sgd_lr,params_sgd_momentum,params_sgd_wd,user_attrs_best_epoch,user_attrs_validation_accuracy,user_attrs_validation_macro_f1,system_attrs_tpe:relative_params:0,state
0,0.3077290117266502,2026-09-28 15:38:24.500977,2026-09-28 15:44:05.966717,0 days 00:05:41.465740,0.8926459276842719,0.9097574441892378,0.00853618986286683,0.0017123375973163992,128.0,0.043297705632016875,8,5,3,0.03447411578889518,16,3,2,0.0336965827544817,128,3,1,,,,,256,256,7,0.5105398159072941,12.0,3,Adam,,,,50.0,0.326911124922312,0.28854689853098836,,COMPLETE
1,0.43424669178385433,2026-09-28 15:44:06.020780,2026-09-28 15:46:55.131639,0 days 00:02:49.110859,0.8662216683335181,0.9862240322449718,0.00014063366777718192,2.7155819552829413e-05,200.0,0.04687496940092468,8,7,3,0.024270133067743574,32,3,1,0.017948627261366895,64,5,2,,,,,256,128,3,0.4739788760965348,10.0,3,Adam,,,,46.0,0.44623990055935364,0.4222534830083551,,COMPLETE
2,,2026-09-28 15:46:55.190864,2026-09-28 15:46:55.205444,0 days 00:00:00.014580,,,,,,0.011016765069763807,16,7,3,0.026415316921425187,64,3,2,0.03533615026041694,32,5,2,0.04570235993959911,64.0,3.0,1.0,,512,3,,,4,,,,,,,,,PRUNED
3,0.49816030110991044,2026-09-28 15:46:55.344911,2026-09-28 15:58:49.895594,0 days 00:11:54.550683,,,,,128.0,0.01888431241882921,16,7,3,0.04887128330883843,64,3,2,0.030107160929154463,32,5,1,,,,,512,512,7,0.5032813284435271,17.0,3,SGD,0.002940074130903307,0.9858386316920742,9.294394155644998e-06,50.0,0.49720323182100684,0.49911737039881404,,COMPLETE
4,0.47921179286407495,2026-09-28 15:58:49.949236,2026-09-28 16:05:09.615681,0 days 00:06:19.666445,,,,,64.0,0.01905983100791752,32,5,3,0.014538940849623563,64,3,1,0.01967409163601807,32,3,2,,,,,512,256,5,0.6322518545590703,17.0,3,SGD,0.0011159088550343414,0.9105271468723695,0.0038765111709116325,47.0,0.4810441267868241,0.4773794589413258,,COMPLETE
5,0.39445930855755584,2026-09-28 16:05:09.667543,2026-09-28 16:07:55.229023,0 days 00:02:45.561480,,,,,64.0,0.019489963499872004,16,5,3,0.024708632122377342,32,5,2,0.030105483724207682,128,3,1,,,,,128,128,5,0.6642751506117486,20.0,3,SGD,0.00011828996391101285,0.8871869658130787,5.110256715654393e-06,45.0,0.42510876320696084,0.36380985390815085,,COMPLETE
6,0.18320849932976643,2026-09-28 16:07:55.282272,2026-09-28 16:09:41.878195,0 days 00:01:46.595923,0.897319321959215,0.9375207369687304,0.0039046790191830895,0.0036309591863459105,200.0,0.03784119186699892,8,5,3,0.03963074471016818,64,5,1,0.046529622102258854,64,3,1,,,,,512,512,7,0.1563891639045214,14.0,3,Adam,,,,,,,,PRUNED
7,0.554934182794036,2026-09-28 16:09:41.930568,2026-09-28 16:15:18.516393,0 days 00:05:36.585825,0.9836811392928472,0.9737159019779072,0.0020911960669713066,1.3174543864342763e-05,64.0,0.01206726884674431,16,7,3,0.04180744779074815,64,3,2,0.026358117776570794,64,3,2,,,,,512,256,5,0.43261243150684037,14.0,3,Adam,,,,49.0,0.5556246115599751,0.5542437540280967,,COMPLETE
8,0.18475432107136702,2026-09-28 16:15:18.569764,2026-09-28 16:15:53.792774,0 days 00:00:35.223010,,,,,200.0,0.02735406596951892,32,7,3,0.044259593647532895,64,3,2,0.03301896711503516,32,5,1,0.031824671572637395,128.0,3.0,1.0,512,128,3,0.15666577645355703,15.0,4,SGD,0.0001614670469622493,0.7292256203994537,1.1827346017839088e-06,,,,,PRUNED
9,,2026-09-28 16:15:53.918845,2026-09-28 16:15:53.945582,0 days 00:00:00.026737,,,,,,0.042273389570690566,16,5,3,0.027159761095000734,16,5,2,0.04582092913984802,64,5,2,0.013651467071445343,256.0,3.0,1.0,,256,5,,,4,,,,,,,,,PRUNED
10,,2026-09-28 16:15:54.096213,2026-09-28 16:15:54.125314,0 days 00:00:00.029101,,,,,,0.044183489324351316,8,7,3,0.040235740261758295,64,3,2,0.026057880854674156,64,3,2,0.013107701648057437,256.0,3.0,1.0,,256,3,,,4,,,,,,,,"{""block_0_dropout"": 0.044183489324351316, ""block_0_filters"": 8, ""block_0_kernel"": 7, ""block_1_dropout"": 0.040235740261758295, ""block_1_filters"": 64, ""block_1_kernel"": 3, ""block_1_stride"": 2, ""block_2_dropout"": 0.026057880854674156, ""block_2_filters"": 64, ""block_2_kernel"": 3, ""block_2_stride"": 2, ""first_conv_filters"": 256, ""first_conv_kernel_size"": 3, ""n_blocks"": 4}",PRUNED
11,0.32538179730201294,2026-09-28 16:15:54.274787,2026-09-28 16:19:26.907442,0 days 00:03:32.632655,,,,,128.0,0.0249291234419154,16,7,3,0.044689760857455484,64,3,2,0.03491156113616455,32,5,1,,,,,512,512,7,0.3812231313327053,6.0,3,SGD,0.04805481567542263,0.9776211723045665,0.00018837804404186193,,,,"{""block_0_dropout"": 0.0249291234419154, ""block_0_filters"": 16, ""block_0_kernel"": 7, ""block_1_dropout"": 0.044689760857455484, ""block_1_filters"": 64, ""block_1_kernel"": 3, ""block_1_stride"": 2, ""block_2_dropout"": 0.03491156113616455, ""block_2_filters"": 32, ""block_2_kernel"": 5, ""block_2_stride"": 1, ""first_conv_filters"": 512, ""first_conv_kernel_size"": 7, ""n_blocks"": 3}",PRUNED
12,0.5550201051244863,2026-09-28 16:19:26.961046,2026-09-28 16:22:41.203509,0 days 00:03:14.242463,0.9781389931626887,0.9977352441512432,0.0006827657674063931,1.1020325755035114e-06,64.0,0.014818367374090799,16,7,3,0.03661754503331296,64,3,2,0.02334199577063257,64,3,2,,,,,512,128,5,0.3302501562203257,17.0,3,Adam,,,,49.0,0.559975139838409,0.5500650704105635,"{""block_0_dropout"": 0.014818367374090799, ""block_0_filters"": 16, ""block_0_kernel"": 7, ""block_1_dropout"": 0.03661754503331296, ""block_1_filters"": 64, ""block_1_kernel"": 3, ""block_1_stride"": 2, ""block_2_dropout"": 0.02334199577063257, ""block_2_filters"": 64, ""block_2_kernel"": 3, ""block_2_stride"": 2, ""first_conv_filters"": 128, ""first_conv_kernel_size"": 5, ""n_blocks"": 3}",COMPLETE
13,0.5234448463301303,2026-09-28 16:22:41.256209,2026-09-28 16:27:54.478867,0 days 00:05:13.222658,0.9868173051833109,0.9969485387912187,0.0009208436400307075,1.0819881402414234e-06,64.0,0.019376234381767804,16,7,3,0.035662141778677985,64,3,2,0.02228141270425396,64,3,2,,,,,128,256,3,0.3038562213412807,20.0,3,Adam,,,,48.0,0.5226848974518334,0.5242047952084272,"{""block_0_dropout"": 0.019376234381767804, ""block_0_filters"": 16, ""block_0_kernel"": 7, ""block_1_dropout"": 0.035662141778677985, ""block_1_filters"": 64, ""block_1_kernel"": 3, ""block_1_stride"": 2, ""block_2_dropout"": 0.02228141270425396, ""block_2_filters"": 64, ""block_2_kernel"": 3, ""block_2_stride"": 2, ""first_conv_filters"": 256, ""first_conv_kernel_size"": 3, ""n_blocks"": 3}",COMPLETE
14,0.6384957530853492,2026-09-28 16:27:54.531965,2026-09-28 16:31:10.405124,0 days 00:03:15.873159,0.9808658540078671,0.9755278632179368,0.000806241559190014,1.7156386499262848e-06,64.0,0.014486879848419967,16,7,3,0.03317413789000419,64,5,2,0.030394748917894072,64,3,2,,,,,512,128,5,0.3427906866084083,10.0,3,Adam,,,,50.0,0.6326911124922312,0.6443003936784674,"{""block_0_dropout"": 0.014486879848419967, ""block_0_filters"": 16, ""block_0_kernel"": 7, ""block_1_dropout"": 0.03317413789000419, ""block_1_filters"": 64, ""block_1_kernel"": 5, ""block_1_stride"": 2, ""block_2_dropout"": 0.030394748917894072, ""block_2_filters"": 64, ""block_2_kernel"": 3, ""block_2_stride"": 2, ""first_conv_filters"": 128, ""first_conv_kernel_size"": 5, ""n_blocks"": 3}",COMPLETE
15,,2026-09-28 16:31:10.456992,2026-09-28 16:31:10.471138,0 days 00:00:00.014146,,,,,,0.016136463587920608,16,7,3,0.03278041326619901,64,5,2,0.03979351999312278,64,5,1,,,,,,128,5,,,3,,,,,,,,"{""block_0_dropout"": 0.016136463587920608, ""block_0_filters"": 16, ""block_0_kernel"": 7, ""block_1_dropout"": 0.03278041326619901, ""block_1_filters"": 64, ""block_1_kernel"": 5, ""block_1_stride"": 2, ""block_2_dropout"": 0.03979351999312278, ""block_2_filters"": 64, ""block_2_kernel"": 5, ""block_2_stride"": 1, ""first_conv_filters"": 128, ""first_conv_kernel_size"": 5, ""n_blocks"": 3}",PRUNED
16,0.5748399277598236,2026-09-28 16:31:10.523281,2026-09-28 16:34:24.350883,0 days 00:03:13.827602,0.9582539217734976,0.9681364134947078,0.0004815438851626752,1.2849922125186388e-06,64.0,0.019712917181094296,16,7,3,0.0206718704649609,64,3,2,0.014756224904676905,64,3,2,,,,,512,128,5,0.2795530120821651,5.0,3,Adam,,,,50.0,0.5730267246737104,0.5766531308459368,"{""block_0_dropout"": 0.019712917181094296, ""block_0_filters"": 16, ""block_0_kernel"": 7, ""block_1_dropout"": 0.0206718704649609, ""block_1_filters"": 64, ""block_1_kernel"": 3, ""block_1_stride"": 2, ""block_2_dropout"": 0.014756224904676905, ""block_2_filters"": 64, ""block_2_kernel"": 3, ""block_2_stride"": 2, ""first_conv_filters"": 128, ""first_conv_kernel_size"": 5, ""n_blocks"": 3}",COMPLETE
17,0.6108961316670007,2026-09-28 16:34:24.430591,2026-09-28 16:38:44.515440,0 days 00:04:20.084849,0.9430283036467014,0.961140446612646,0.0003735575616827247,8.73908759225226e-06,64.0,0.024833994592469343,32,7,3,0.02654643249349754,64,5,2,0.028216843581457835,64,3,2,,,,,512,128,5,0.24105013781084123,5.0,3,Adam,,,,49.0,0.6084524549409571,0.6133398083930443,"{""block_0_dropout"": 0.024833994592469343, ""block_0_filters"": 32, ""block_0_kernel"": 7, ""block_1_dropout"": 0.02654643249349754, ""block_1_filters"": 64, ""block_1_kernel"": 5, ""block_1_stride"": 2, ""block_2_dropout"": 0.028216843581457835, ""block_2_filters"": 64, ""block_2_kernel"": 3, ""block_2_stride"": 2, ""first_conv_filters"": 128, ""first_conv_kernel_size"": 5, ""n_blocks"": 3}",COMPLETE
18,0.575642458102219,2026-09-28 16:38:44.571459,2026-09-28 16:43:06.963476,0 days 00:04:22.392017,0.9376705801853921,0.948739352583034,0.0002195507726325955,2.2762261494649844e-05,64.0,0.04304832579357577,32,7,3,0.01669733179029146,32,5,2,0.026483811017218934,64,3,2,,,,,128,128,5,0.2559270486345429,8.0,3,Adam,,,,49.0,0.5773772529521441,0.573907663252294,"{""block_0_dropout"": 0.04304832579357577, ""block_0_filters"": 32, ""block_0_kernel"": 7, ""block_1_dropout"": 0.01669733179029146, ""block_1_filters"": 32, ""block_1_kernel"": 5, ""block_1_stride"": 2, ""block_2_dropout"": 0.026483811017218934, ""block_2_filters"": 64, ""block_2_kernel"": 3, ""block_2_stride"": 2, ""first_conv_filters"": 128, ""first_conv_kernel_size"": 5, ""n_blocks"": 3}",COMPLETE
19,0.5764223658341481,2026-09-28 16:43:07.016712,2026-09-28 16:46:19.278920,0 days 00:03:12.262208,0.936224765269133,0.9563139401694781,0.00037770132366329244,8.874219323697064e-06,64.0,0.025023594782391675,16,7,3,0.03770082801679771,64,5,2,0.031863875326333134,64,3,2,,,,,256,128,5,0.10015726738282776,8.0,3,Adam,,,,49.0,0.579241765071473,0.5736029665968232,"{""block_0_dropout"": 0.025023594782391675, ""block_0_filters"": 16, ""block_0_kernel"": 7, ""block_1_dropout"": 0.03770082801679771, ""block_1_filters"": 64, ""block_1_kernel"": 5, ""block_1_stride"": 2, ""block_2_dropout"": 0.031863875326333134, ""block_2_filters"": 64, ""block_2_kernel"": 3, ""block_2_stride"": 2, ""first_conv_filters"": 128, ""first_conv_kernel_size"": 5, ""n_blocks"": 3}",COMPLETE
20,0.3946922040222792,2026-09-28 16:46:19.331195,2026-09-28 16:47:16.951746,0 days 00:00:57.620551,0.9460892778929104,0.930773129663826,0.001426156947021378,0.0003700186971463657,64.0,0.023907481499322775,32,7,3,0.03592576133863148,64,5,2,0.02149236137455212,64,3,2,,,,,512,128,5,0.22035990106472414,10.0,3,Adam,,,,,,,"{""block_0_dropout"": 0.023907481499322775, ""block_0_filters"": 32, ""block_0_kernel"": 7, ""block_1_dropout"": 0.03592576133863148, ""block_1_filters"": 64, ""block_1_kernel"": 5, ""block_1_stride"": 2, ""block_2_dropout"": 0.02149236137455212, ""block_2_filters"": 64, ""block_2_kernel"": 3, ""block_2_stride"": 2, ""first_conv_filters"": 128, ""first_conv_kernel_size"": 5, ""n_blocks"": 3}",PRUNED
21,0.6623399689702498,2026-09-28 16:47:17.012175,2026-09-28 16:51:36.430958,0 days 00:04:19.418783,0.9218646767828594,0.9590842634410068,0.0003396679411342465,7.068638270745182e-06,64.0,0.01128040554460818,32,7,3,0.0240266136407808,64,5,2,0.02382742314574554,128,3,2,,,,,256,128,5,0.10620906338145791,8.0,3,Adam,,,,42.0,0.6575512740832815,0.6671286638572183,"{""block_0_dropout"": 0.01128040554460818, ""block_0_filters"": 32, ""block_0_kernel"": 7, ""block_1_dropout"": 0.0240266136407808, ""block_1_filters"": 64, ""block_1_kernel"": 5, ""block_1_stride"": 2, ""block_2_dropout"": 0.02382742314574554, ""block_2_filters"": 128, ""block_2_kernel"": 3, ""block_2_stride"": 2, ""first_conv_filters"": 128, ""first_conv_kernel_size"": 5, ""n_blocks"": 3}",COMPLETE
22,0.6628473639471609,2026-09-28 16:51:36.490591,2026-09-28 16:55:58.218840,0 days 00:04:21.728249,0.9100906753112259,0.9665708148674191,0.0003113849915023646,4.277740557781614e-06,64.0,0.02185667942151924,32,7,3,0.02961955437285364,64,5,2,0.033015669806260584,128,3,2,,,,,256,128,5,0.19767868114390633,7.0,3,Adam,,,,49.0,0.6656308266003729,0.660063901293949,"{""block_0_dropout"": 0.02185667942151924, ""block_0_filters"": 32, ""block_0_kernel"": 7, ""block_1_dropout"": 0.02961955437285364, ""block_1_filters"": 64, ""block_1_kernel"": 5, ""block_1_stride"": 2, ""block_2_dropout"": 0.033015669806260584, ""block_2_filters"": 128, ""block_2_kernel"": 3, ""block_2_stride"": 2, ""first_conv_filters"": 128, ""first_conv_kernel_size"": 5, ""n_blocks"": 3}",COMPLETE
23,0.6461323286337204,2026-09-28 16:55:58.271448,2026-09-28 17:00:17.670079,0 days 00:04:19.398631,0.9124215122557239,0.9781194878158801,0.0002389019299968708,5.488879773849255e-06,64.0,0.025093192327898386,32,7,3,0.025239317822986208,64,5,2,0.04150249865414843,128,3,2,,,,,256,128,5,0.1691644435478096,8.0,3,Adam,,,,49.0,0.6457426973275326,0.646521959939908,"{""block_0_dropout"": 0.025093192327898386, ""block_0_filters"": 32, ""block_0_kernel"": 7, ""block_1_dropout"": 0.025239317822986208, ""block_1_filters"": 64, ""block_1_kernel"": 5, ""block_1_stride"": 2, ""block_2_dropout"": 0.04150249865414843, ""block_2_filters"": 128, ""block_2_kernel"": 3, ""block_2_stride"": 2, ""first_conv_filters"": 128, ""first_conv_kernel_size"": 5, ""n_blocks"": 3}",COMPLETE
24,0.6165801759433566,2026-09-28 17:00:17.724379,2026-09-28 17:04:37.477657,0 days 00:04:19.753278,0.911022229785492,0.9817801874309496,0.00010173405395425705,5.095195255493926e-06,64.0,0.012319066666433244,32,7,3,0.021577339001902444,64,5,2,0.02697570652854789,128,3,2,,,,,256,128,5,0.17695313502693227,7.0,3,Adam,,,,49.0,0.6270975761342449,0.6060627757524683,"{""block_0_dropout"": 0.012319066666433244, ""block_0_filters"": 32, ""block_0_kernel"": 7, ""block_1_dropout"": 0.021577339001902444, ""block_1_filters"": 64, ""block_1_kernel"": 5, ""block_1_stride"": 2, ""block_2_dropout"": 0.02697570652854789, ""block_2_filters"": 128, ""block_2_kernel"": 3, ""block_2_stride"": 2, ""first_conv_filters"": 128, ""first_conv_kernel_size"": 5, ""n_blocks"": 3}",COMPLETE
25,0.6515960042330027,2026-09-28 17:04:37.532469,2026-09-28 17:08:58.130168,0 days 00:04:20.597699,0.9161633783553829,0.9502403307657835,0.0002272309249191174,6.009345796257192e-05,64.0,0.023494567961890846,32,7,3,0.022989649673973607,64,5,2,0.045664905320348434,128,3,2,,,,,256,128,5,0.10184498355190806,8.0,3,Adam,,,,50.0,0.6451211932877564,0.6580708151782488,"{""block_0_dropout"": 0.023494567961890846, ""block_0_filters"": 32, ""block_0_kernel"": 7, ""block_1_dropout"": 0.022989649673973607, ""block_1_filters"": 64, ""block_1_kernel"": 5, ""block_1_stride"": 2, ""block_2_dropout"": 0.045664905320348434, ""block_2_filters"": 128, ""block_2_kernel"": 3, ""block_2_stride"": 2, ""first_conv_filters"": 128, ""first_conv_kernel_size"": 5, ""n_blocks"": 3}",COMPLETE
26,,2026-09-28 17:08:58.182604,2026-09-28 17:08:58.199440,0 days 00:00:00.016836,,,,,,0.021022600365830087,32,7,3,0.023011466674563347,64,5,2,0.04085849644335418,128,3,2,0.04949646329967205,64.0,3.0,1.0,,128,5,,,4,,,,,,,,"{""block_0_dropout"": 0.021022600365830087, ""block_0_filters"": 32, ""block_0_kernel"": 7, ""block_1_dropout"": 0.023011466674563347, ""block_1_filters"": 64, ""block_1_kernel"": 5, ""block_1_stride"": 2, ""block_2_dropout"": 0.04085849644335418, ""block_2_filters"": 128, ""block_2_kernel"": 3, ""block_2_stride"": 2, ""first_conv_filters"": 128, ""first_conv_kernel_size"": 5, ""n_blocks"": 4}",PRUNED
27,0.36537364526741833,2026-09-28 17:08:58.353076,2026-09-28 17:09:35.975592,0 days 00:00:37.622516,0.9215222319820611,0.9422243522190021,0.00021365145585064467,0.00013127871303202367,128.0,0.03138285410233382,8,7,3,0.019606637896233535,64,3,2,0.02970260932028711,128,3,2,,,,,256,128,5,0.10096086676404867,9.0,3,Adam,,,,,,,"{""block_0_dropout"": 0.03138285410233382, ""block_0_filters"": 8, ""block_0_kernel"": 7, ""block_1_dropout"": 0.019606637896233535, ""block_1_filters"": 64, ""block_1_kernel"": 3, ""block_1_stride"": 2, ""block_2_dropout"": 0.02970260932028711, ""block_2_filters"": 128, ""block_2_kernel"": 3, ""block_2_stride"": 2, ""first_conv_filters"": 128, ""first_conv_kernel_size"": 5, ""n_blocks"": 3}",PRUNED
28,,2026-09-28 17:09:36.030064,2026-09-28 17:09:36.042814,0 days 00:00:00.012750,,,,,,0.017382053957483677,32,7,3,0.017741493306439295,64,5,2,0.049157905125231015,128,5,2,,,,,,128,5,,,3,,,,,,,,"{""block_0_dropout"": 0.017382053957483677, ""block_0_filters"": 32, ""block_0_kernel"": 7, ""block_1_dropout"": 0.017741493306439295, ""block_1_filters"": 64, ""block_1_kernel"": 5, ""block_1_stride"": 2, ""block_2_dropout"": 0.049157905125231015, ""block_2_filters"": 128, ""block_2_kernel"": 5, ""block_2_stride"": 2, ""first_conv_filters"": 128, ""first_conv_kernel_size"": 5, ""n_blocks"": 3}",PRUNED
29,0.3945075583375941,2026-09-28 17:09:36.094255,2026-09-28 17:10:16.048871,0 days 00:00:39.954616,0.8821087009354465,0.9559726091614013,0.0003007430068233165,7.224387481161545e-05,200.0,0.022179432318528938,32,7,3,0.017748525876139044,16,5,2,0.02142882991730889,128,3,2,,,,,256,128,5,0.21054294666019918,12.0,3,Adam,,,,,,,"{""block_0_dropout"": 0.022179432318528938, ""block_0_filters"": 32, ""block_0_kernel"": 7, ""block_1_dropout"": 0.017748525876139044, ""block_1_filters"": 16, ""block_1_kernel"": 5, ""block_1_stride"": 2, ""block_2_dropout"": 0.02142882991730889, ""block_2_filters"": 128, ""block_2_kernel"": 3, ""block_2_stride"": 2, ""first_conv_filters"": 128, ""first_conv_kernel_size"": 5, ""n_blocks"": 3}",PRUNED
30,,2026-09-28 17:10:16.155929,2026-09-28 17:10:16.179191,0 days 00:00:00.023262,,,,,,0.013043051251357164,32,7,3,0.026370082887850796,16,5,2,0.038366879796421074,128,5,2,,,,,,128,5,,,3,,,,,,,,"{""block_0_dropout"": 0.013043051251357164, ""block_0_filters"": 32, ""block_0_kernel"": 7, ""block_1_dropout"": 0.026370082887850796, ""block_1_filters"": 16, ""block_1_kernel"": 5, ""block_1_stride"": 2, ""block_2_dropout"": 0.038366879796421074, ""block_2_filters"": 128, ""block_2_kernel"": 5, ""block_2_stride"": 2, ""first_conv_filters"": 128, ""first_conv_kernel_size"": 5, ""n_blocks"": 3}",PRUNED
31,0.6258636796454321,2026-09-28 17:10:16.272840,2026-09-28 17:14:37.145601,0 days 00:04:20.872761,0.9160216322019634,0.9650209125748174,0.00019343511512345208,4.637953281854203e-06,64.0,0.02280824684777406,32,7,3,0.0217738006220397,64,5,2,0.038863197988098105,128,3,2,,,,,256,128,5,0.14372501401481086,7.0,3,Adam,,,,48.0,0.6289620882535737,0.6227652710372905,"{""block_0_dropout"": 0.02280824684777406, ""block_0_filters"": 32, ""block_0_kernel"": 7, ""block_1_dropout"": 0.0217738006220397, ""block_1_filters"": 64, ""block_1_kernel"": 5, ""block_1_stride"": 2, ""block_2_dropout"": 0.038863197988098105, ""block_2_filters"": 128, ""block_2_kernel"": 3, ""block_2_stride"": 2, ""first_conv_filters"": 128, ""first_conv_kernel_size"": 5, ""n_blocks"": 3}",COMPLETE
32,0.6466962834074146,2026-09-28 17:14:37.199337,2026-09-28 17:18:58.126707,0 days 00:04:20.927370,0.9060701580639549,0.9513046934004755,0.0002759197947370611,3.5137986930483846e-06,64.0,0.032712172204397885,32,7,3,0.02171594510145834,64,5,2,0.04319972017415418,128,3,2,,,,,256,128,5,0.19547100950794585,8.0,3,Adam,,,,48.0,0.6451211932877564,0.6482713735270729,"{""block_0_dropout"": 0.032712172204397885, ""block_0_filters"": 32, ""block_0_kernel"": 7, ""block_1_dropout"": 0.02171594510145834, ""block_1_filters"": 64, ""block_1_kernel"": 5, ""block_1_stride"": 2, ""block_2_dropout"": 0.04319972017415418, ""block_2_filters"": 128, ""block_2_kernel"": 3, ""block_2_stride"": 2, ""first_conv_filters"": 128, ""first_conv_kernel_size"": 5, ""n_blocks"": 3}",COMPLETE
