number,value,datetime_start,datetime_complete,duration,params_adam_beta1,params_adam_beta2,params_adam_lr,params_adam_wd,params_batch_size,params_block_0_dropout,params_block_0_filters,params_block_0_kernel,params_block_0_stride,params_block_1_dropout,params_block_1_filters,params_block_1_kernel,params_block_1_stride,params_block_2_dropout,params_block_2_filters,params_block_2_kernel,params_block_2_stride,params_block_3_dropout,params_block_3_filters,params_block_3_kernel,params_block_3_stride,params_fc_hidden,params_first_conv_filters,params_first_conv_kernel_size,params_lr_factor,params_lr_patience,params_n_blocks,params_optimizer,params_sgd_lr,params_sgd_momentum,params_sgd_wd,user_attrs_best_epoch,user_attrs_validation_accuracy,user_attrs_validation_macro_f1,system_attrs_tpe:relative_params:0,state
61,0.41079708510469803,2026-09-28 18:22:31.653740,2026-09-28 18:23:33.629059,0 days 00:01:01.975319,0.8915466314245146,0.9148031958951699,0.0009268012175845245,4.080110814542138e-06,64.0,0.019202851315800802,32,7,3,0.013183586278261003,64,5,2,0.034624705715885974,128,3,2,,,,,256,128,5,0.12007339535572423,10.0,3,Adam,,,,,,,"{""block_0_dropout"": 0.019202851315800802, ""block_0_filters"": 32, ""block_0_kernel"": 7, ""block_1_dropout"": 0.013183586278261003, ""block_1_filters"": 64, ""block_1_kernel"": 5, ""block_1_stride"": 2, ""block_2_dropout"": 0.034624705715885974, ""block_2_filters"": 128, ""block_2_kernel"": 3, ""block_2_stride"": 2, ""first_conv_filters"": 128, ""first_conv_kernel_size"": 5, ""n_blocks"": 3}",PRUNED
62,0.3970830677769793,2026-09-28 18:23:33.681699,2026-09-28 18:24:26.723016,0 days 00:00:53.041317,0.8946066848337214,0.9062506065791855,0.0004528445877458754,2.958347282446816e-06,64.0,0.016120716331748323,32,7,3,0.013446596834096694,64,5,1,0.01985899496371697,128,3,2,,,,,256,128,5,0.1566615127245035,7.0,3,Adam,,,,,,,"{""block_0_dropout"": 0.016120716331748323, ""block_0_filters"": 32, ""block_0_kernel"": 7, ""block_1_dropout"": 0.013446596834096694, ""block_1_filters"": 64, ""block_1_kernel"": 5, ""block_1_stride"": 1, ""block_2_dropout"": 0.01985899496371697, ""block_2_filters"": 128, ""block_2_kernel"": 3, ""block_2_stride"": 2, ""first_conv_filters"": 128, ""first_conv_kernel_size"": 5, ""n_blocks"": 3}",PRUNED
63,0.6778701667232023,2026-09-28 18:24:26.795158,2026-09-28 18:28:48.744811,0 days 00:04:21.949653,0.8883310339550021,0.9232884852431903,0.0002874370608742675,1.9003851211072009e-06,64.0,0.0216190325706235,32,7,3,0.03039882307747261,64,5,2,0.03813271459479001,128,3,2,,,,,256,128,5,0.124166947314036,12.0,3,Adam,,,,48.0,0.6786824114356743,0.6770579220107305,"{""block_0_dropout"": 0.0216190325706235, ""block_0_filters"": 32, ""block_0_kernel"": 7, ""block_1_dropout"": 0.03039882307747261, ""block_1_filters"": 64, ""block_1_kernel"": 5, ""block_1_stride"": 2, ""block_2_dropout"": 0.03813271459479001, ""block_2_filters"": 128, ""block_2_kernel"": 3, ""block_2_stride"": 2, ""first_conv_filters"": 128, ""first_conv_kernel_size"": 5, ""n_blocks"": 3}",COMPLETE
64,,2026-09-28 18:28:48.798861,2026-09-28 18:28:48.814247,0 days 00:00:00.015386,,,,,,0.012932725637899548,32,7,3,0.010296923676446825,64,5,2,0.02262184488357806,128,5,2,,,,,,128,5,,,3,,,,,,,,"{""block_0_dropout"": 0.012932725637899548, ""block_0_filters"": 32, ""block_0_kernel"": 7, ""block_1_dropout"": 0.010296923676446825, ""block_1_filters"": 64, ""block_1_kernel"": 5, ""block_1_stride"": 2, ""block_2_dropout"": 0.02262184488357806, ""block_2_filters"": 128, ""block_2_kernel"": 5, ""block_2_stride"": 2, ""first_conv_filters"": 128, ""first_conv_kernel_size"": 5, ""n_blocks"": 3}",PRUNED
65,0.4014967555485081,2026-09-28 18:28:48.870371,2026-09-28 18:29:41.126182,0 days 00:00:52.255811,0.8777278805484595,0.924248826057044,0.0002640442982764577,1.0948418499257237e-06,64.0,0.01280349209518365,32,7,3,0.01125520950989077,32,5,2,0.02721817321722765,128,3,2,,,,,256,128,5,0.15938884440628556,12.0,3,Adam,,,,,,,"{""block_0_dropout"": 0.01280349209518365, ""block_0_filters"": 32, ""block_0_kernel"": 7, ""block_1_dropout"": 0.01125520950989077, ""block_1_filters"": 32, ""block_1_kernel"": 5, ""block_1_stride"": 2, ""block_2_dropout"": 0.02721817321722765, ""block_2_filters"": 128, ""block_2_kernel"": 3, ""block_2_stride"": 2, ""first_conv_filters"": 128, ""first_conv_kernel_size"": 5, ""n_blocks"": 3}",PRUNED
66,0.6692718843745333,2026-09-28 18:29:41.195250,2026-09-28 18:34:03.706731,0 days 00:04:22.511481,0.8655790820891852,0.9358588296421115,0.00037988100300345587,7.3612371761548665e-06,64.0,0.024392734371582434,32,7,3,0.029679608192032948,64,5,2,0.038679175443459855,128,3,2,,,,,512,128,5,0.12050254486134557,15.0,3,Adam,,,,49.0,0.670602858918583,0.6679409098304837,"{""block_0_dropout"": 0.024392734371582434, ""block_0_filters"": 32, ""block_0_kernel"": 7, ""block_1_dropout"": 0.029679608192032948, ""block_1_filters"": 64, ""block_1_kernel"": 5, ""block_1_stride"": 2, ""block_2_dropout"": 0.038679175443459855, ""block_2_filters"": 128, ""block_2_kernel"": 3, ""block_2_stride"": 2, ""first_conv_filters"": 128, ""first_conv_kernel_size"": 5, ""n_blocks"": 3}",COMPLETE
67,0.6784093851420457,2026-09-28 18:34:03.780328,2026-09-28 18:38:25.343889,0 days 00:04:21.563561,0.8671500548092219,0.9337291333882767,0.0005698171928567107,1.6582657821634255e-06,64.0,0.01918622229556617,32,7,3,0.025367854898439943,64,5,2,0.03164106564296703,128,3,2,,,,,512,128,5,0.18341599826679167,14.0,3,Adam,,,,48.0,0.675574891236793,0.6812438790472984,"{""block_0_dropout"": 0.01918622229556617, ""block_0_filters"": 32, ""block_0_kernel"": 7, ""block_1_dropout"": 0.025367854898439943, ""block_1_filters"": 64, ""block_1_kernel"": 5, ""block_1_stride"": 2, ""block_2_dropout"": 0.03164106564296703, ""block_2_filters"": 128, ""block_2_kernel"": 3, ""block_2_stride"": 2, ""first_conv_filters"": 128, ""first_conv_kernel_size"": 5, ""n_blocks"": 3}",COMPLETE
68,0.4375460191084563,2026-09-28 18:38:25.396989,2026-09-28 18:40:28.391660,0 days 00:02:02.994671,,,,,64.0,0.011797624470833426,32,7,3,0.015630003051330013,64,5,2,0.03505804141146128,128,3,2,,,,,512,256,5,0.1852555010034154,15.0,3,SGD,0.016584563975731388,0.7004554338754445,2.7448107637542636e-05,,,,"{""block_0_dropout"": 0.011797624470833426, ""block_0_filters"": 32, ""block_0_kernel"": 7, ""block_1_dropout"": 0.015630003051330013, ""block_1_filters"": 64, ""block_1_kernel"": 5, ""block_1_stride"": 2, ""block_2_dropout"": 0.03505804141146128, ""block_2_filters"": 128, ""block_2_kernel"": 3, ""block_2_stride"": 2, ""first_conv_filters"": 256, ""first_conv_kernel_size"": 5, ""n_blocks"": 3}",PRUNED
69,0.6923219485054355,2026-09-28 18:40:28.444593,2026-09-28 18:44:49.328867,0 days 00:04:20.884274,0.850507326966455,0.9331979483291334,0.00040917960309651524,1.1383080499255007e-05,64.0,0.018055248487483577,32,7,3,0.015458959709371042,64,5,2,0.028575707743983582,128,3,2,,,,,512,128,5,0.12289339204235529,18.0,3,Adam,,,,50.0,0.6942200124300808,0.6904238845807901,"{""block_0_dropout"": 0.018055248487483577, ""block_0_filters"": 32, ""block_0_kernel"": 7, ""block_1_dropout"": 0.015458959709371042, ""block_1_filters"": 64, ""block_1_kernel"": 5, ""block_1_stride"": 2, ""block_2_dropout"": 0.028575707743983582, ""block_2_filters"": 128, ""block_2_kernel"": 3, ""block_2_stride"": 2, ""first_conv_filters"": 128, ""first_conv_kernel_size"": 5, ""n_blocks"": 3}",COMPLETE
70,0.6938576519835837,2026-09-28 18:44:49.381229,2026-09-28 18:49:04.661976,0 days 00:04:15.280747,0.8528857919324,0.9355632769097011,0.0004239913287254956,4.080355285729336e-05,128.0,0.018501723735327942,32,7,3,0.03176038144552727,64,5,2,0.037612589282161525,128,3,2,,,,,512,128,5,0.12285626293471354,18.0,3,Adam,,,,49.0,0.6917339962709758,0.6959813076961918,"{""block_0_dropout"": 0.018501723735327942, ""block_0_filters"": 32, ""block_0_kernel"": 7, ""block_1_dropout"": 0.03176038144552727, ""block_1_filters"": 64, ""block_1_kernel"": 5, ""block_1_stride"": 2, ""block_2_dropout"": 0.037612589282161525, ""block_2_filters"": 128, ""block_2_kernel"": 3, ""block_2_stride"": 2, ""first_conv_filters"": 128, ""first_conv_kernel_size"": 5, ""n_blocks"": 3}",COMPLETE
71,0.701639197298642,2026-09-28 18:49:04.714852,2026-09-28 18:53:18.305934,0 days 00:04:13.591082,0.8501486232333008,0.9342488102198503,0.00039293607602446437,4.0391027950747e-05,128.0,0.01643671582034333,32,7,3,0.015134683075752895,64,5,2,0.03146010286402307,128,3,2,,,,,512,128,5,0.12087264154182897,18.0,3,Adam,,,,43.0,0.6979490366687383,0.7053293579285457,"{""block_0_dropout"": 0.01643671582034333, ""block_0_filters"": 32, ""block_0_kernel"": 7, ""block_1_dropout"": 0.015134683075752895, ""block_1_filters"": 64, ""block_1_kernel"": 5, ""block_1_stride"": 2, ""block_2_dropout"": 0.03146010286402307, ""block_2_filters"": 128, ""block_2_kernel"": 3, ""block_2_stride"": 2, ""first_conv_filters"": 128, ""first_conv_kernel_size"": 5, ""n_blocks"": 3}",COMPLETE
72,0.5419875200326524,2026-09-28 18:53:18.395827,2026-09-28 18:55:29.928927,0 days 00:02:11.533100,0.8500888078638377,0.9373722050058827,0.00038880444186096153,3.422608782727823e-05,128.0,0.021564765080914663,16,7,3,0.030637480161319827,64,5,2,0.04015309810322094,128,3,2,,,,,512,128,5,0.12018183183968066,18.0,3,Adam,,,,,,,"{""block_0_dropout"": 0.021564765080914663, ""block_0_filters"": 16, ""block_0_kernel"": 7, ""block_1_dropout"": 0.030637480161319827, ""block_1_filters"": 64, ""block_1_kernel"": 5, ""block_1_stride"": 2, ""block_2_dropout"": 0.04015309810322094, ""block_2_filters"": 128, ""block_2_kernel"": 3, ""block_2_stride"": 2, ""first_conv_filters"": 128, ""first_conv_kernel_size"": 5, ""n_blocks"": 3}",PRUNED
73,0.6747688141765065,2026-09-28 18:55:29.988275,2026-09-28 19:00:16.224156,0 days 00:04:46.235881,0.8508542053270638,0.932573827670941,0.0004336195195411964,4.287431184214083e-05,128.0,0.016785135443206645,32,7,3,0.031077999465449032,64,5,2,0.04101212746050987,128,3,2,,,,,512,128,7,0.6989216071708313,18.0,3,Adam,,,,48.0,0.6830329397141082,0.6665046886389048,"{""block_0_dropout"": 0.016785135443206645, ""block_0_filters"": 32, ""block_0_kernel"": 7, ""block_1_dropout"": 0.031077999465449032, ""block_1_filters"": 64, ""block_1_kernel"": 5, ""block_1_stride"": 2, ""block_2_dropout"": 0.04101212746050987, ""block_2_filters"": 128, ""block_2_kernel"": 3, ""block_2_stride"": 2, ""first_conv_filters"": 128, ""first_conv_kernel_size"": 7, ""n_blocks"": 3}",COMPLETE
74,0.6995942087060063,2026-09-28 19:00:16.277517,2026-09-28 19:04:36.984797,0 days 00:04:20.707280,0.852320621731504,0.9329261554162906,0.000386753925581035,1.2177989637047e-05,128.0,0.016878665880874003,32,7,3,0.023674125054948765,64,5,2,0.028783829430211755,128,3,2,,,,,512,128,5,0.6918671361864759,18.0,3,Adam,,,,49.0,0.7078931013051585,0.6912953161068541,"{""block_0_dropout"": 0.016878665880874003, ""block_0_filters"": 32, ""block_0_kernel"": 7, ""block_1_dropout"": 0.023674125054948765, ""block_1_filters"": 64, ""block_1_kernel"": 5, ""block_1_stride"": 2, ""block_2_dropout"": 0.028783829430211755, ""block_2_filters"": 128, ""block_2_kernel"": 3, ""block_2_stride"": 2, ""first_conv_filters"": 128, ""first_conv_kernel_size"": 5, ""n_blocks"": 3}",COMPLETE
75,0.6875109305365221,2026-09-28 19:04:37.038111,2026-09-28 19:08:53.087509,0 days 00:04:16.049398,0.8512202411443484,0.932919334351123,0.0005215945689281454,3.876413979870366e-05,128.0,0.017434162241481605,32,7,3,0.014644757508009114,64,5,2,0.031069475444953296,128,3,2,,,,,512,128,5,0.6878851291801075,18.0,3,Adam,,,,47.0,0.6942200124300808,0.6808018486429636,"{""block_0_dropout"": 0.017434162241481605, ""block_0_filters"": 32, ""block_0_kernel"": 7, ""block_1_dropout"": 0.014644757508009114, ""block_1_filters"": 64, ""block_1_kernel"": 5, ""block_1_stride"": 2, ""block_2_dropout"": 0.031069475444953296, ""block_2_filters"": 128, ""block_2_kernel"": 3, ""block_2_stride"": 2, ""first_conv_filters"": 128, ""first_conv_kernel_size"": 5, ""n_blocks"": 3}",COMPLETE
76,0.6794653997822468,2026-09-28 19:08:53.141298,2026-09-28 19:13:07.914707,0 days 00:04:14.773409,0.8524128727039785,0.9313746047014385,0.00047811993754101444,4.630864340155501e-05,128.0,0.01624227130916977,32,7,3,0.03192074303575285,64,5,2,0.0335621899077704,128,3,2,,,,,512,128,5,0.6924635021553733,18.0,3,Adam,,,,50.0,0.6848974518334369,0.6740333477310567,"{""block_0_dropout"": 0.01624227130916977, ""block_0_filters"": 32, ""block_0_kernel"": 7, ""block_1_dropout"": 0.03192074303575285, ""block_1_filters"": 64, ""block_1_kernel"": 5, ""block_1_stride"": 2, ""block_2_dropout"": 0.0335621899077704, ""block_2_filters"": 128, ""block_2_kernel"": 3, ""block_2_stride"": 2, ""first_conv_filters"": 128, ""first_conv_kernel_size"": 5, ""n_blocks"": 3}",COMPLETE
77,0.6758397050812017,2026-09-28 19:13:07.970158,2026-09-28 19:17:22.265249,0 days 00:04:14.295091,0.8582282990419514,0.9414059076120329,0.000530887948972658,1.7743071216197472e-05,128.0,0.01590507293493498,32,7,3,0.018958259571452595,64,5,2,0.02842501422895971,128,3,2,,,,,512,128,5,0.6257762472488315,18.0,3,Adam,,,,45.0,0.6817899316345556,0.6698894785278477,"{""block_0_dropout"": 0.01590507293493498, ""block_0_filters"": 32, ""block_0_kernel"": 7, ""block_1_dropout"": 0.018958259571452595, ""block_1_filters"": 64, ""block_1_kernel"": 5, ""block_1_stride"": 2, ""block_2_dropout"": 0.02842501422895971, ""block_2_filters"": 128, ""block_2_kernel"": 3, ""block_2_stride"": 2, ""first_conv_filters"": 128, ""first_conv_kernel_size"": 5, ""n_blocks"": 3}",COMPLETE
78,0.667747254653773,2026-09-28 19:17:22.318480,2026-09-28 19:21:37.535886,0 days 00:04:15.217406,0.8635820502397201,0.930707209435542,0.0002588640356926,9.52935002123497e-05,128.0,0.016525219631196804,32,7,3,0.010389289402090138,64,5,2,0.026881420643929725,128,3,2,,,,,512,128,5,0.6934095908629773,19.0,3,Adam,,,,49.0,0.6712243629583592,0.6642701463491869,"{""block_0_dropout"": 0.016525219631196804, ""block_0_filters"": 32, ""block_0_kernel"": 7, ""block_1_dropout"": 0.010389289402090138, ""block_1_filters"": 64, ""block_1_kernel"": 5, ""block_1_stride"": 2, ""block_2_dropout"": 0.026881420643929725, ""block_2_filters"": 128, ""block_2_kernel"": 3, ""block_2_stride"": 2, ""first_conv_filters"": 128, ""first_conv_kernel_size"": 5, ""n_blocks"": 3}",COMPLETE
79,0.2727210794763425,2026-09-28 19:21:37.588961,2026-09-28 19:22:28.289306,0 days 00:00:50.700345,0.8565852608846328,0.9453677986605451,0.000594828807092065,4.359914369995986e-05,128.0,0.025789013657981023,32,7,3,0.03661680349154736,64,5,2,0.04083234884439297,128,3,2,,,,,512,128,5,0.6422314279982562,17.0,3,Adam,,,,,,,"{""block_0_dropout"": 0.025789013657981023, ""block_0_filters"": 32, ""block_0_kernel"": 7, ""block_1_dropout"": 0.03661680349154736, ""block_1_filters"": 64, ""block_1_kernel"": 5, ""block_1_stride"": 2, ""block_2_dropout"": 0.04083234884439297, ""block_2_filters"": 128, ""block_2_kernel"": 3, ""block_2_stride"": 2, ""first_conv_filters"": 128, ""first_conv_kernel_size"": 5, ""n_blocks"": 3}",PRUNED
80,0.6547906325988022,2026-09-28 19:22:28.343803,2026-09-28 19:26:41.566855,0 days 00:04:13.223052,0.8530687817425456,0.9264789530872889,0.0003712201736247194,1.1885649768663273e-05,128.0,0.016558645170673687,32,7,3,0.03163807604111359,64,5,2,0.03742197855588745,128,3,2,,,,,512,128,5,0.4936900326649206,19.0,3,Adam,,,,43.0,0.6575512740832815,0.6520299911143229,"{""block_0_dropout"": 0.016558645170673687, ""block_0_filters"": 32, ""block_0_kernel"": 7, ""block_1_dropout"": 0.03163807604111359, ""block_1_filters"": 64, ""block_1_kernel"": 5, ""block_1_stride"": 2, ""block_2_dropout"": 0.03742197855588745, ""block_2_filters"": 128, ""block_2_kernel"": 3, ""block_2_stride"": 2, ""first_conv_filters"": 128, ""first_conv_kernel_size"": 5, ""n_blocks"": 3}",COMPLETE
81,0.4333197034115376,2026-09-28 19:26:41.621024,2026-09-28 19:27:47.204710,0 days 00:01:05.583686,0.8596662821748224,0.9404994095483818,0.0005484302248466942,2.0294609704933143e-05,128.0,0.021733852858494086,32,7,3,0.020160534804692976,64,5,2,0.02604596795274547,128,3,2,,,,,512,128,5,0.5677433137482374,18.0,3,Adam,,,,,,,"{""block_0_dropout"": 0.021733852858494086, ""block_0_filters"": 32, ""block_0_kernel"": 7, ""block_1_dropout"": 0.020160534804692976, ""block_1_filters"": 64, ""block_1_kernel"": 5, ""block_1_stride"": 2, ""block_2_dropout"": 0.02604596795274547, ""block_2_filters"": 128, ""block_2_kernel"": 3, ""block_2_stride"": 2, ""first_conv_filters"": 128, ""first_conv_kernel_size"": 5, ""n_blocks"": 3}",PRUNED
82,0.6607688342237721,2026-09-28 19:27:47.258381,2026-09-28 19:32:05.656695,0 days 00:04:18.398314,0.8548938185411649,0.939497246781105,0.00047669718596863355,1.5954972572975727e-05,128.0,0.019401114878569842,32,7,3,0.024871421359376256,64,5,2,0.03099350234994771,128,3,2,,,,,512,128,5,0.6745963561719875,17.0,3,Adam,,,,47.0,0.6637663144810442,0.6577713539665,"{""block_0_dropout"": 0.019401114878569842, ""block_0_filters"": 32, ""block_0_kernel"": 7, ""block_1_dropout"": 0.024871421359376256, ""block_1_filters"": 64, ""block_1_kernel"": 5, ""block_1_stride"": 2, ""block_2_dropout"": 0.03099350234994771, ""block_2_filters"": 128, ""block_2_kernel"": 3, ""block_2_stride"": 2, ""first_conv_filters"": 128, ""first_conv_kernel_size"": 5, ""n_blocks"": 3}",COMPLETE
83,0.6715576041658458,2026-09-28 19:32:05.713621,2026-09-28 19:36:30.327753,0 days 00:04:24.614132,0.8701844287717894,0.9325794601521809,0.0008502231036656069,4.160925450465714e-05,128.0,0.01823191522913113,32,7,3,0.016547020646639446,64,5,2,0.030837192604058185,128,3,2,,,,,512,128,5,0.6106947838388803,20.0,3,Adam,,,,50.0,0.6693598508390305,0.6737553574926609,"{""block_0_dropout"": 0.01823191522913113, ""block_0_filters"": 32, ""block_0_kernel"": 7, ""block_1_dropout"": 0.016547020646639446, ""block_1_filters"": 64, ""block_1_kernel"": 5, ""block_1_stride"": 2, ""block_2_dropout"": 0.030837192604058185, ""block_2_filters"": 128, ""block_2_kernel"": 3, ""block_2_stride"": 2, ""first_conv_filters"": 128, ""first_conv_kernel_size"": 5, ""n_blocks"": 3}",COMPLETE
84,0.6803227529161893,2026-09-28 19:36:30.380072,2026-09-28 19:40:45.908411,0 days 00:04:15.528339,0.8621079335581531,0.932643901807554,0.0005127051909311153,2.4161029142170764e-05,128.0,0.020528916703039277,32,7,3,0.014950562300979933,64,5,2,0.028496867479132215,128,3,2,,,,,512,128,5,0.6602390052165865,16.0,3,Adam,,,,46.0,0.6873834679925419,0.6732620378398366,"{""block_0_dropout"": 0.020528916703039277, ""block_0_filters"": 32, ""block_0_kernel"": 7, ""block_1_dropout"": 0.014950562300979933, ""block_1_filters"": 64, ""block_1_kernel"": 5, ""block_1_stride"": 2, ""block_2_dropout"": 0.028496867479132215, ""block_2_filters"": 128, ""block_2_kernel"": 3, ""block_2_stride"": 2, ""first_conv_filters"": 128, ""first_conv_kernel_size"": 5, ""n_blocks"": 3}",COMPLETE
85,0.6702109926924219,2026-09-28 19:40:45.961851,2026-09-28 19:45:02.648702,0 days 00:04:16.686851,0.8637416707697687,0.9331414858023316,0.00030334914671630253,2.6383615319537803e-05,128.0,0.017208559095000894,32,7,3,0.020526900492513843,64,5,2,0.024191231417167895,128,3,2,,,,,512,128,5,0.6631536151967014,16.0,3,Adam,,,,49.0,0.6780609073958981,0.6623610779889457,"{""block_0_dropout"": 0.017208559095000894, ""block_0_filters"": 32, ""block_0_kernel"": 7, ""block_1_dropout"": 0.020526900492513843, ""block_1_filters"": 64, ""block_1_kernel"": 5, ""block_1_stride"": 2, ""block_2_dropout"": 0.024191231417167895, ""block_2_filters"": 128, ""block_2_kernel"": 3, ""block_2_stride"": 2, ""first_conv_filters"": 128, ""first_conv_kernel_size"": 5, ""n_blocks"": 3}",COMPLETE
86,0.6645300091542498,2026-09-28 19:45:02.701124,2026-09-28 19:49:19.157208,0 days 00:04:16.456084,0.8681779175007144,0.9287289805759175,0.00038343416921994734,5.247362221841837e-05,128.0,0.017219236310947485,32,7,3,0.028392658666927507,64,5,2,0.026650686667511515,128,3,2,,,,,512,128,5,0.6712096183732001,16.0,3,Adam,,,,48.0,0.673088875077688,0.6559711432308115,"{""block_0_dropout"": 0.017219236310947485, ""block_0_filters"": 32, ""block_0_kernel"": 7, ""block_1_dropout"": 0.028392658666927507, ""block_1_filters"": 64, ""block_1_kernel"": 5, ""block_1_stride"": 2, ""block_2_dropout"": 0.026650686667511515, ""block_2_filters"": 128, ""block_2_kernel"": 3, ""block_2_stride"": 2, ""first_conv_filters"": 128, ""first_conv_kernel_size"": 5, ""n_blocks"": 3}",COMPLETE
87,0.6631289482399739,2026-09-28 19:49:19.210232,2026-09-28 19:53:37.351064,0 days 00:04:18.140832,0.8500372321148487,0.937742073290387,0.00020224631771113756,9.047237357200171e-05,128.0,0.02246839252790387,32,7,3,0.012507616732697574,64,5,2,0.033845636152992915,128,3,2,,,,,512,128,5,0.6527851957671614,19.0,3,Adam,,,,50.0,0.6724673710379118,0.6537905254420361,"{""block_0_dropout"": 0.02246839252790387, ""block_0_filters"": 32, ""block_0_kernel"": 7, ""block_1_dropout"": 0.012507616732697574, ""block_1_filters"": 64, ""block_1_kernel"": 5, ""block_1_stride"": 2, ""block_2_dropout"": 0.033845636152992915, ""block_2_filters"": 128, ""block_2_kernel"": 3, ""block_2_stride"": 2, ""first_conv_filters"": 128, ""first_conv_kernel_size"": 5, ""n_blocks"": 3}",COMPLETE
88,0.32180452948558214,2026-09-28 19:53:37.404344,2026-09-28 19:54:27.641167,0 days 00:00:50.236823,,,,,128.0,0.01623832184396022,32,7,3,0.015417842578545416,64,5,2,0.03536814958285046,128,3,2,,,,,512,128,5,0.6794781980469768,18.0,3,SGD,0.00041075262728745816,0.9088142502164305,0.001228596892952313,,,,"{""block_0_dropout"": 0.01623832184396022, ""block_0_filters"": 32, ""block_0_kernel"": 7, ""block_1_dropout"": 0.015417842578545416, ""block_1_filters"": 64, ""block_1_kernel"": 5, ""block_1_stride"": 2, ""block_2_dropout"": 0.03536814958285046, ""block_2_filters"": 128, ""block_2_kernel"": 3, ""block_2_stride"": 2, ""first_conv_filters"": 128, ""first_conv_kernel_size"": 5, ""n_blocks"": 3}",PRUNED
