number,value,datetime_start,datetime_complete,duration,params_adam_beta1,params_adam_beta2,params_adam_lr,params_adam_wd,params_batch_size,params_block_0_dropout,params_block_0_filters,params_block_0_kernel,params_block_0_stride,params_block_1_dropout,params_block_1_filters,params_block_1_kernel,params_block_1_stride,params_block_2_dropout,params_block_2_filters,params_block_2_kernel,params_block_2_stride,params_block_3_dropout,params_block_3_filters,params_block_3_kernel,params_block_3_stride,params_fc_hidden,params_first_conv_filters,params_first_conv_kernel_size,params_lr_factor,params_lr_patience,params_n_blocks,params_optimizer,params_sgd_lr,params_sgd_momentum,params_sgd_wd,user_attrs_best_epoch,user_attrs_validation_accuracy,user_attrs_validation_macro_f1,system_attrs_tpe:relative_params:0,state
33,0.6483520897999513,2026-09-28 17:18:58.207945,2026-09-28 17:23:20.600816,0 days 00:04:22.392871,0.897865073454674,0.9279055721384022,0.0005298045950079051,6.068803159822692e-05,64.0,0.04129091036297837,32,7,3,0.03741888081150459,64,5,2,0.03035270034761503,128,3,2,,,,,256,128,5,0.10256604526222428,7.0,3,Adam,,,,48.0,0.6413921690490988,0.6553120105508038,"{""block_0_dropout"": 0.04129091036297837, ""block_0_filters"": 32, ""block_0_kernel"": 7, ""block_1_dropout"": 0.03741888081150459, ""block_1_filters"": 64, ""block_1_kernel"": 5, ""block_1_stride"": 2, ""block_2_dropout"": 0.03035270034761503, ""block_2_filters"": 128, ""block_2_kernel"": 3, ""block_2_stride"": 2, ""first_conv_filters"": 128, ""first_conv_kernel_size"": 5, ""n_blocks"": 3}",COMPLETE
34,0.617353670714536,2026-09-28 17:23:20.660166,2026-09-28 17:27:42.281073,0 days 00:04:21.620907,0.9253186794580185,0.9284443451369936,0.0005429780680299994,6.559987744896465e-05,64.0,0.03386284179463479,32,7,3,0.03177294992294614,64,5,2,0.029351994053347416,128,3,2,,,,,256,128,5,0.1024660966049208,6.0,3,Adam,,,,50.0,0.6103169670602859,0.624390374368786,"{""block_0_dropout"": 0.03386284179463479, ""block_0_filters"": 32, ""block_0_kernel"": 7, ""block_1_dropout"": 0.03177294992294614, ""block_1_filters"": 64, ""block_1_kernel"": 5, ""block_1_stride"": 2, ""block_2_dropout"": 0.029351994053347416, ""block_2_filters"": 128, ""block_2_kernel"": 3, ""block_2_stride"": 2, ""first_conv_filters"": 128, ""first_conv_kernel_size"": 5, ""n_blocks"": 3}",COMPLETE
35,0.6638920245612486,2026-09-28 17:27:42.358402,2026-09-28 17:32:04.030338,0 days 00:04:21.671936,0.8854427310130465,0.9163622418169803,0.0001418862642229798,0.0003107584151045025,64.0,0.012150497271387143,32,7,3,0.0146721231552546,64,5,2,0.02012175380030989,128,3,2,,,,,256,128,5,0.13484113847898593,6.0,3,Adam,,,,50.0,0.6656308266003729,0.6621532225221244,"{""block_0_dropout"": 0.012150497271387143, ""block_0_filters"": 32, ""block_0_kernel"": 7, ""block_1_dropout"": 0.0146721231552546, ""block_1_filters"": 64, ""block_1_kernel"": 5, ""block_1_stride"": 2, ""block_2_dropout"": 0.02012175380030989, ""block_2_filters"": 128, ""block_2_kernel"": 3, ""block_2_stride"": 2, ""first_conv_filters"": 128, ""first_conv_kernel_size"": 5, ""n_blocks"": 3}",COMPLETE
36,0.6117524635173189,2026-09-28 17:32:04.082678,2026-09-28 17:36:21.142739,0 days 00:04:17.060061,0.8740078341427172,0.9038128287926362,0.000137016078679106,0.0005004106773724987,64.0,0.015938810158623355,32,7,3,0.027943644225021286,64,5,2,0.018979123346133858,128,3,2,,,,,256,128,5,0.14148362750953203,6.0,3,Adam,,,,47.0,0.6096954630205096,0.6138094640141283,"{""block_0_dropout"": 0.015938810158623355, ""block_0_filters"": 32, ""block_0_kernel"": 7, ""block_1_dropout"": 0.027943644225021286, ""block_1_filters"": 64, ""block_1_kernel"": 5, ""block_1_stride"": 2, ""block_2_dropout"": 0.018979123346133858, ""block_2_filters"": 128, ""block_2_kernel"": 3, ""block_2_stride"": 2, ""first_conv_filters"": 128, ""first_conv_kernel_size"": 5, ""n_blocks"": 3}",COMPLETE
37,0.4304012364814356,2026-09-28 17:36:21.194844,2026-09-28 17:37:27.504290,0 days 00:01:06.309446,0.8846390606318485,0.9179867083662927,0.00015062477552941982,0.0003233380001403865,128.0,0.02023102977898217,32,7,3,0.017378938618631413,64,5,2,0.03327224511951688,128,3,2,,,,,256,128,5,0.20658825949818177,11.0,3,Adam,,,,,,,"{""block_0_dropout"": 0.02023102977898217, ""block_0_filters"": 32, ""block_0_kernel"": 7, ""block_1_dropout"": 0.017378938618631413, ""block_1_filters"": 64, ""block_1_kernel"": 5, ""block_1_stride"": 2, ""block_2_dropout"": 0.03327224511951688, ""block_2_filters"": 128, ""block_2_kernel"": 3, ""block_2_stride"": 2, ""first_conv_filters"": 128, ""first_conv_kernel_size"": 5, ""n_blocks"": 3}",PRUNED
38,0.6107277933003825,2026-09-28 17:37:27.557331,2026-09-28 17:41:48.715922,0 days 00:04:21.158591,0.9313656110160446,0.9436638513616503,0.00010531850715002282,0.000886225513355985,64.0,0.028798455511605876,32,7,3,0.01787388147264978,64,5,2,0.015662439946274503,128,3,2,,,,,256,128,5,0.13855356292822518,9.0,3,Adam,,,,50.0,0.6171535114978247,0.6043020751029404,"{""block_0_dropout"": 0.028798455511605876, ""block_0_filters"": 32, ""block_0_kernel"": 7, ""block_1_dropout"": 0.01787388147264978, ""block_1_filters"": 64, ""block_1_kernel"": 5, ""block_1_stride"": 2, ""block_2_dropout"": 0.015662439946274503, ""block_2_filters"": 128, ""block_2_kernel"": 3, ""block_2_stride"": 2, ""first_conv_filters"": 128, ""first_conv_kernel_size"": 5, ""n_blocks"": 3}",COMPLETE
39,0.3655724492880629,2026-09-28 17:41:48.793301,2026-09-28 17:42:31.203666,0 days 00:00:42.410365,0.8572032833270444,0.9191667058017718,0.0003427034548560458,2.608594480121924e-05,200.0,0.014356360085012319,32,7,3,0.017716044642339383,64,5,2,0.033143317975488855,128,3,1,,,,,256,128,5,0.2543278701578935,5.0,3,Adam,,,,,,,"{""block_0_dropout"": 0.014356360085012319, ""block_0_filters"": 32, ""block_0_kernel"": 7, ""block_1_dropout"": 0.017716044642339383, ""block_1_filters"": 64, ""block_1_kernel"": 5, ""block_1_stride"": 2, ""block_2_dropout"": 0.033143317975488855, ""block_2_filters"": 128, ""block_2_kernel"": 3, ""block_2_stride"": 1, ""first_conv_filters"": 128, ""first_conv_kernel_size"": 5, ""n_blocks"": 3}",PRUNED
40,0.35584908536621584,2026-09-28 17:42:31.279993,2026-09-28 17:43:23.455959,0 days 00:00:52.175966,,,,,128.0,0.01586488879747028,32,7,3,0.02453215387999022,16,5,2,0.02370444725392666,128,3,2,,,,,256,256,5,0.5847216519846329,9.0,3,SGD,0.056455331597056686,0.7351688868386401,0.008200681390283042,,,,"{""block_0_dropout"": 0.01586488879747028, ""block_0_filters"": 32, ""block_0_kernel"": 7, ""block_1_dropout"": 0.02453215387999022, ""block_1_filters"": 16, ""block_1_kernel"": 5, ""block_1_stride"": 2, ""block_2_dropout"": 0.02370444725392666, ""block_2_filters"": 128, ""block_2_kernel"": 3, ""block_2_stride"": 2, ""first_conv_filters"": 256, ""first_conv_kernel_size"": 5, ""n_blocks"": 3}",PRUNED
41,0.6665402644946401,2026-09-28 17:43:23.508981,2026-09-28 17:47:45.071089,0 days 00:04:21.562108,0.9019360513387815,0.9142093547292555,0.00047653915516453064,0.00012115379106520826,64.0,0.02778831613201145,32,7,3,0.03385675600438536,64,5,2,0.03736755803422997,128,3,2,,,,,256,128,5,0.13019116717443138,7.0,3,Adam,,,,50.0,0.6606587942821628,0.6724217347071173,"{""block_0_dropout"": 0.02778831613201145, ""block_0_filters"": 32, ""block_0_kernel"": 7, ""block_1_dropout"": 0.03385675600438536, ""block_1_filters"": 64, ""block_1_kernel"": 5, ""block_1_stride"": 2, ""block_2_dropout"": 0.03736755803422997, ""block_2_filters"": 128, ""block_2_kernel"": 3, ""block_2_stride"": 2, ""first_conv_filters"": 128, ""first_conv_kernel_size"": 5, ""n_blocks"": 3}",COMPLETE
42,0.4209032347558489,2026-09-28 17:47:45.124807,2026-09-28 17:48:47.233529,0 days 00:01:02.108722,0.9035677824107016,0.917711632860761,0.0004392063887392466,0.00021422064620265626,64.0,0.021757884755513837,32,7,3,0.026558364641083698,64,5,2,0.01935311693885454,128,3,2,,,,,256,128,5,0.13002028969203713,7.0,3,Adam,,,,,,,"{""block_0_dropout"": 0.021757884755513837, ""block_0_filters"": 32, ""block_0_kernel"": 7, ""block_1_dropout"": 0.026558364641083698, ""block_1_filters"": 64, ""block_1_kernel"": 5, ""block_1_stride"": 2, ""block_2_dropout"": 0.01935311693885454, ""block_2_filters"": 128, ""block_2_kernel"": 3, ""block_2_stride"": 2, ""first_conv_filters"": 128, ""first_conv_kernel_size"": 5, ""n_blocks"": 3}",PRUNED
43,0.5562345055380225,2026-09-28 17:48:47.286276,2026-09-28 17:52:10.282787,0 days 00:03:22.996511,0.8842608901845838,0.901118954449714,0.00016639052830461288,0.00013272976220315435,64.0,0.028283330579703236,32,7,3,0.03427808490277549,64,5,2,0.04869235882039672,128,3,2,,,,,256,128,5,0.18448484443050384,6.0,3,Adam,,,,,,,"{""block_0_dropout"": 0.028283330579703236, ""block_0_filters"": 32, ""block_0_kernel"": 7, ""block_1_dropout"": 0.03427808490277549, ""block_1_filters"": 64, ""block_1_kernel"": 5, ""block_1_stride"": 2, ""block_2_dropout"": 0.04869235882039672, ""block_2_filters"": 128, ""block_2_kernel"": 3, ""block_2_stride"": 2, ""first_conv_filters"": 128, ""first_conv_kernel_size"": 5, ""n_blocks"": 3}",PRUNED
44,0.6604098152794875,2026-09-28 17:52:10.338562,2026-09-28 17:56:29.609041,0 days 00:04:19.270479,0.8917423255634348,0.9079393777791291,0.0003283102672821137,2.2801471703732893e-06,64.0,0.02172446897566974,32,7,3,0.03630555001639131,64,5,2,0.03636765994207551,128,3,2,,,,,256,128,5,0.13259724820345548,9.0,3,Adam,,,,49.0,0.6619018023617154,0.6589178281972597,"{""block_0_dropout"": 0.02172446897566974, ""block_0_filters"": 32, ""block_0_kernel"": 7, ""block_1_dropout"": 0.03630555001639131, ""block_1_filters"": 64, ""block_1_kernel"": 5, ""block_1_stride"": 2, ""block_2_dropout"": 0.03636765994207551, ""block_2_filters"": 128, ""block_2_kernel"": 3, ""block_2_stride"": 2, ""first_conv_filters"": 128, ""first_conv_kernel_size"": 5, ""n_blocks"": 3}",COMPLETE
45,0.39204203193814,2026-09-28 17:56:29.661729,2026-09-28 17:57:21.174239,0 days 00:00:51.512510,,,,,64.0,0.020321340921221367,32,7,3,0.039994464401592364,64,5,2,0.03767444195729268,128,3,2,,,,,128,128,5,0.17496479675722276,11.0,3,SGD,0.00612913278925449,0.8303078188276818,0.00026508540072615704,,,,"{""block_0_dropout"": 0.020321340921221367, ""block_0_filters"": 32, ""block_0_kernel"": 7, ""block_1_dropout"": 0.039994464401592364, ""block_1_filters"": 64, ""block_1_kernel"": 5, ""block_1_stride"": 2, ""block_2_dropout"": 0.03767444195729268, ""block_2_filters"": 128, ""block_2_kernel"": 3, ""block_2_stride"": 2, ""first_conv_filters"": 128, ""first_conv_kernel_size"": 5, ""n_blocks"": 3}",PRUNED
46,0.6627934982148351,2026-09-28 17:57:21.227145,2026-09-28 18:01:40.106547,0 days 00:04:18.879402,0.8887952090326742,0.9083714306470031,0.0006345641197712332,2.492075087155113e-06,64.0,0.010380390673248066,32,7,3,0.015626706955107254,64,5,2,0.024959260894197872,128,3,2,,,,,256,128,5,0.226097742385726,9.0,3,Adam,,,,46.0,0.6587942821628341,0.6667927142668362,"{""block_0_dropout"": 0.010380390673248066, ""block_0_filters"": 32, ""block_0_kernel"": 7, ""block_1_dropout"": 0.015626706955107254, ""block_1_filters"": 64, ""block_1_kernel"": 5, ""block_1_stride"": 2, ""block_2_dropout"": 0.024959260894197872, ""block_2_filters"": 128, ""block_2_kernel"": 3, ""block_2_stride"": 2, ""first_conv_filters"": 128, ""first_conv_kernel_size"": 5, ""n_blocks"": 3}",COMPLETE
47,0.39370060873114393,2026-09-28 18:01:40.186857,2026-09-28 18:02:15.012746,0 days 00:00:34.825889,,,,,200.0,0.010803827909466962,32,7,3,0.025445524987251437,16,5,2,0.029076912850158728,64,3,2,,,,,256,128,5,0.2808390289402976,7.0,3,SGD,0.01251982291375717,0.8040516560408912,0.0001704017405841804,,,,"{""block_0_dropout"": 0.010803827909466962, ""block_0_filters"": 32, ""block_0_kernel"": 7, ""block_1_dropout"": 0.025445524987251437, ""block_1_filters"": 16, ""block_1_kernel"": 5, ""block_1_stride"": 2, ""block_2_dropout"": 0.029076912850158728, ""block_2_filters"": 64, ""block_2_kernel"": 3, ""block_2_stride"": 2, ""first_conv_filters"": 128, ""first_conv_kernel_size"": 5, ""n_blocks"": 3}",PRUNED
48,0.35805339385727675,2026-09-28 18:02:15.119827,2026-09-28 18:03:06.882746,0 days 00:00:51.762919,0.8744574603545506,0.9130383411560603,0.0011332900659526194,0.0013996915710625013,64.0,0.011063534913813495,32,7,3,0.01630027433863033,64,5,2,0.024769334490992608,128,3,1,,,,,256,128,5,0.22980414898899776,10.0,3,Adam,,,,,,,"{""block_0_dropout"": 0.011063534913813495, ""block_0_filters"": 32, ""block_0_kernel"": 7, ""block_1_dropout"": 0.01630027433863033, ""block_1_filters"": 64, ""block_1_kernel"": 5, ""block_1_stride"": 2, ""block_2_dropout"": 0.024769334490992608, ""block_2_filters"": 128, ""block_2_kernel"": 3, ""block_2_stride"": 1, ""first_conv_filters"": 128, ""first_conv_kernel_size"": 5, ""n_blocks"": 3}",PRUNED
49,0.4037138976367448,2026-09-28 18:03:06.935729,2026-09-28 18:04:04.574752,0 days 00:00:57.639023,0.8938070204445763,0.9104375098020204,0.000578874876069279,2.449030502304734e-06,64.0,0.020260597504825457,32,7,3,0.029172695150428075,64,5,2,0.03415920165853967,128,3,2,,,,,128,128,5,0.19988166778370137,6.0,3,Adam,,,,,,,"{""block_0_dropout"": 0.020260597504825457, ""block_0_filters"": 32, ""block_0_kernel"": 7, ""block_1_dropout"": 0.029172695150428075, ""block_1_filters"": 64, ""block_1_kernel"": 5, ""block_1_stride"": 2, ""block_2_dropout"": 0.03415920165853967, ""block_2_filters"": 128, ""block_2_kernel"": 3, ""block_2_stride"": 2, ""first_conv_filters"": 128, ""first_conv_kernel_size"": 5, ""n_blocks"": 3}",PRUNED
50,0.34945689554004167,2026-09-28 18:04:04.643520,2026-09-28 18:04:56.429312,0 days 00:00:51.785792,,,,,128.0,0.011513594374489407,32,7,3,0.024164487640219376,64,5,2,0.012904857658359858,128,3,2,,,,,256,128,5,0.1602842809431777,11.0,3,SGD,0.0007848917987481615,0.8072713392433886,0.0009671279368491195,,,,"{""block_0_dropout"": 0.011513594374489407, ""block_0_filters"": 32, ""block_0_kernel"": 7, ""block_1_dropout"": 0.024164487640219376, ""block_1_filters"": 64, ""block_1_kernel"": 5, ""block_1_stride"": 2, ""block_2_dropout"": 0.012904857658359858, ""block_2_filters"": 128, ""block_2_kernel"": 3, ""block_2_stride"": 2, ""first_conv_filters"": 128, ""first_conv_kernel_size"": 5, ""n_blocks"": 3}",PRUNED
51,0.5256031773467345,2026-09-28 18:04:56.487608,2026-09-28 18:07:38.312543,0 days 00:02:41.824935,0.890649200232482,0.9080327359536129,0.00031315470160157155,2.3711762838443706e-06,64.0,0.03580345348094718,32,7,3,0.03670427797680413,64,5,2,0.03727332828392739,128,3,2,,,,,256,128,5,0.13612290452591863,9.0,3,Adam,,,,,,,"{""block_0_dropout"": 0.03580345348094718, ""block_0_filters"": 32, ""block_0_kernel"": 7, ""block_1_dropout"": 0.03670427797680413, ""block_1_filters"": 64, ""block_1_kernel"": 5, ""block_1_stride"": 2, ""block_2_dropout"": 0.03727332828392739, ""block_2_filters"": 128, ""block_2_kernel"": 3, ""block_2_stride"": 2, ""first_conv_filters"": 128, ""first_conv_kernel_size"": 5, ""n_blocks"": 3}",PRUNED
52,0.38127269914603423,2026-09-28 18:07:38.364339,2026-09-28 18:08:38.145679,0 days 00:00:59.781340,0.9017494409070919,0.9078295205107683,0.006133097585580502,2.5409018785938988e-06,64.0,0.012181667739384113,32,7,3,0.012503900606133699,64,5,2,0.014552265433405572,128,3,2,,,,,256,128,7,0.13022108596315501,9.0,3,Adam,,,,,,,"{""block_0_dropout"": 0.012181667739384113, ""block_0_filters"": 32, ""block_0_kernel"": 7, ""block_1_dropout"": 0.012503900606133699, ""block_1_filters"": 64, ""block_1_kernel"": 5, ""block_1_stride"": 2, ""block_2_dropout"": 0.014552265433405572, ""block_2_filters"": 128, ""block_2_kernel"": 3, ""block_2_stride"": 2, ""first_conv_filters"": 128, ""first_conv_kernel_size"": 7, ""n_blocks"": 3}",PRUNED
53,0.670538372957222,2026-09-28 18:08:38.220123,2026-09-28 18:12:59.671948,0 days 00:04:21.451825,0.8903523377405287,0.9225231804472049,0.0007167858858151693,7.429914797838017e-06,64.0,0.012459631149032351,32,7,3,0.013817741046405308,64,5,2,0.03189020268543171,128,3,2,,,,,256,128,5,0.16936706201329277,12.0,3,Adam,,,,49.0,0.6693598508390305,0.6717168950754134,"{""block_0_dropout"": 0.012459631149032351, ""block_0_filters"": 32, ""block_0_kernel"": 7, ""block_1_dropout"": 0.013817741046405308, ""block_1_filters"": 64, ""block_1_kernel"": 5, ""block_1_stride"": 2, ""block_2_dropout"": 0.03189020268543171, ""block_2_filters"": 128, ""block_2_kernel"": 3, ""block_2_stride"": 2, ""first_conv_filters"": 128, ""first_conv_kernel_size"": 5, ""n_blocks"": 3}",COMPLETE
54,0.3085223970982134,2026-09-28 18:12:59.724811,2026-09-28 18:13:51.891297,0 days 00:00:52.166486,0.8701240836767319,0.9240903584027489,0.0007696035946515141,0.008678441537492641,64.0,0.012804739117136124,32,7,3,0.03083067331045765,64,5,2,0.02483532127396851,128,3,2,,,,,256,128,5,0.23556749646355127,13.0,3,Adam,,,,,,,"{""block_0_dropout"": 0.012804739117136124, ""block_0_filters"": 32, ""block_0_kernel"": 7, ""block_1_dropout"": 0.03083067331045765, ""block_1_filters"": 64, ""block_1_kernel"": 5, ""block_1_stride"": 2, ""block_2_dropout"": 0.02483532127396851, ""block_2_filters"": 128, ""block_2_kernel"": 3, ""block_2_stride"": 2, ""first_conv_filters"": 128, ""first_conv_kernel_size"": 5, ""n_blocks"": 3}",PRUNED
55,0.4094665321041447,2026-09-28 18:13:51.944701,2026-09-28 18:14:49.953511,0 days 00:00:58.008810,0.8608011264909914,0.9352010404683732,0.0011003684238134275,9.794780149578377e-06,64.0,0.0226941758419915,32,7,3,0.03215147468623147,64,5,2,0.02955993319030461,128,3,2,,,,,256,128,5,0.2700332307509153,13.0,3,Adam,,,,,,,"{""block_0_dropout"": 0.0226941758419915, ""block_0_filters"": 32, ""block_0_kernel"": 7, ""block_1_dropout"": 0.03215147468623147, ""block_1_filters"": 64, ""block_1_kernel"": 5, ""block_1_stride"": 2, ""block_2_dropout"": 0.02955993319030461, ""block_2_filters"": 128, ""block_2_kernel"": 3, ""block_2_stride"": 2, ""first_conv_filters"": 128, ""first_conv_kernel_size"": 5, ""n_blocks"": 3}",PRUNED
56,0.36718185696625066,2026-09-28 18:14:50.006081,2026-09-28 18:15:22.322468,0 days 00:00:32.316387,0.8795218957235081,0.9211713640957988,0.0007054121730682563,1.7963561702917483e-05,64.0,0.011437288842810547,8,7,3,0.011709483305781181,64,5,2,0.029679113404495385,128,3,2,,,,,256,128,5,0.3067769827262934,16.0,3,Adam,,,,,,,"{""block_0_dropout"": 0.011437288842810547, ""block_0_filters"": 8, ""block_0_kernel"": 7, ""block_1_dropout"": 0.011709483305781181, ""block_1_filters"": 64, ""block_1_kernel"": 5, ""block_1_stride"": 2, ""block_2_dropout"": 0.029679113404495385, ""block_2_filters"": 128, ""block_2_kernel"": 3, ""block_2_stride"": 2, ""first_conv_filters"": 128, ""first_conv_kernel_size"": 5, ""n_blocks"": 3}",PRUNED
57,0.3995236837112177,2026-09-28 18:15:22.375541,2026-09-28 18:16:04.173672,0 days 00:00:41.798131,0.9077141602797845,0.9129917436525041,0.0014782178855418692,6.50873662982839e-06,200.0,0.035544204167084294,32,7,3,0.02998265136946824,64,5,2,0.03506782560769572,128,3,2,,,,,128,128,5,0.16546349912003666,19.0,3,Adam,,,,,,,"{""block_0_dropout"": 0.035544204167084294, ""block_0_filters"": 32, ""block_0_kernel"": 7, ""block_1_dropout"": 0.02998265136946824, ""block_1_filters"": 64, ""block_1_kernel"": 5, ""block_1_stride"": 2, ""block_2_dropout"": 0.03506782560769572, ""block_2_filters"": 128, ""block_2_kernel"": 3, ""block_2_stride"": 2, ""first_conv_filters"": 128, ""first_conv_kernel_size"": 5, ""n_blocks"": 3}",PRUNED
58,0.38053543806935375,2026-09-28 18:16:04.240383,2026-09-28 18:16:55.828285,0 days 00:00:51.587902,0.8895514115959229,0.9692693027667318,0.0023799833679090006,1.4301427105293589e-05,64.0,0.010226409780736884,32,7,3,0.02909250096077465,64,5,2,0.03481151395801872,128,3,2,,,,,256,128,5,0.3896725278469768,5.0,3,Adam,,,,,,,"{""block_0_dropout"": 0.010226409780736884, ""block_0_filters"": 32, ""block_0_kernel"": 7, ""block_1_dropout"": 0.02909250096077465, ""block_1_filters"": 64, ""block_1_kernel"": 5, ""block_1_stride"": 2, ""block_2_dropout"": 0.03481151395801872, ""block_2_filters"": 128, ""block_2_kernel"": 3, ""block_2_stride"": 2, ""first_conv_filters"": 128, ""first_conv_kernel_size"": 5, ""n_blocks"": 3}",PRUNED
59,0.6482357838167588,2026-09-28 18:16:55.881300,2026-09-28 18:21:18.177226,0 days 00:04:22.295926,0.8988406531382335,0.9874279013536296,0.0004220446908297285,3.301063582636714e-05,64.0,0.016593975290494604,32,7,3,0.012867524581857866,64,5,2,0.03809566252582641,128,3,2,,,,,256,128,5,0.18918911780493802,8.0,3,Adam,,,,41.0,0.637041640770665,0.6594299268628526,"{""block_0_dropout"": 0.016593975290494604, ""block_0_filters"": 32, ""block_0_kernel"": 7, ""block_1_dropout"": 0.012867524581857866, ""block_1_filters"": 64, ""block_1_kernel"": 5, ""block_1_stride"": 2, ""block_2_dropout"": 0.03809566252582641, ""block_2_filters"": 128, ""block_2_kernel"": 3, ""block_2_stride"": 2, ""first_conv_filters"": 128, ""first_conv_kernel_size"": 5, ""n_blocks"": 3}",COMPLETE
60,0.4259401158168461,2026-09-28 18:21:18.229708,2026-09-28 18:22:31.601089,0 days 00:01:13.371381,0.9209348314988843,0.9012336317608246,0.0006460803809177208,1.546194643718491e-06,64.0,0.015339889012388988,32,7,3,0.0197376031433028,64,5,2,0.021784353058454532,64,3,2,,,,,256,128,5,0.2273925790917277,6.0,3,Adam,,,,,,,"{""block_0_dropout"": 0.015339889012388988, ""block_0_filters"": 32, ""block_0_kernel"": 7, ""block_1_dropout"": 0.0197376031433028, ""block_1_filters"": 64, ""block_1_kernel"": 5, ""block_1_stride"": 2, ""block_2_dropout"": 0.021784353058454532, ""block_2_filters"": 64, ""block_2_kernel"": 3, ""block_2_stride"": 2, ""first_conv_filters"": 128, ""first_conv_kernel_size"": 5, ""n_blocks"": 3}",PRUNED
