number,value,datetime_start,datetime_complete,duration,params_adam_beta1,params_adam_beta2,params_adam_lr,params_adam_wd,params_batch_size,params_block_0_dropout,params_block_0_filters,params_block_0_kernel,params_block_0_stride,params_block_1_dropout,params_block_1_filters,params_block_1_kernel,params_block_1_stride,params_block_2_dropout,params_block_2_filters,params_block_2_kernel,params_block_2_stride,params_block_3_dropout,params_block_3_filters,params_block_3_kernel,params_block_3_stride,params_fc_hidden,params_first_conv_filters,params_first_conv_kernel_size,params_lr_factor,params_lr_patience,params_n_blocks,params_optimizer,params_sgd_lr,params_sgd_momentum,params_sgd_wd,user_attrs_best_epoch,user_attrs_validation_accuracy,user_attrs_validation_macro_f1,system_attrs_tpe:relative_params:0,state
89,0.672092741667363,2026-09-28 19:54:27.694767,2026-09-28 19:58:41.829388,0 days 00:04:14.134621,0.8554380637532302,0.946305564797969,0.0005099030749594767,3.238156412301832e-05,128.0,0.02255124940651616,32,7,3,0.012217616080521573,64,5,2,0.02972340258097497,128,3,2,,,,,512,128,5,0.5585485422750532,16.0,3,Adam,,,,48.0,0.6786824114356743,0.6655030718990516,"{""block_0_dropout"": 0.02255124940651616, ""block_0_filters"": 32, ""block_0_kernel"": 7, ""block_1_dropout"": 0.012217616080521573, ""block_1_filters"": 64, ""block_1_kernel"": 5, ""block_1_stride"": 2, ""block_2_dropout"": 0.02972340258097497, ""block_2_filters"": 128, ""block_2_kernel"": 3, ""block_2_stride"": 2, ""first_conv_filters"": 128, ""first_conv_kernel_size"": 5, ""n_blocks"": 3}",COMPLETE
90,0.460899015219494,2026-09-28 19:58:41.883638,2026-09-28 19:59:52.887085,0 days 00:01:11.003447,0.8605407167479955,0.9267565052809295,0.00029164779450901866,1.0835769280305881e-05,128.0,0.02177444528931662,32,7,3,0.026775072868860883,64,5,2,0.029821271499942095,128,3,2,,,,,512,128,5,0.4503574536544729,17.0,3,Adam,,,,,,,"{""block_0_dropout"": 0.02177444528931662, ""block_0_filters"": 32, ""block_0_kernel"": 7, ""block_1_dropout"": 0.026775072868860883, ""block_1_filters"": 64, ""block_1_kernel"": 5, ""block_1_stride"": 2, ""block_2_dropout"": 0.029821271499942095, ""block_2_filters"": 128, ""block_2_kernel"": 3, ""block_2_stride"": 2, ""first_conv_filters"": 128, ""first_conv_kernel_size"": 5, ""n_blocks"": 3}",PRUNED
91,0.6928264167698208,2026-09-28 19:59:52.940317,2026-09-28 20:04:06.383308,0 days 00:04:13.442991,0.8591468237029602,0.9414604625714038,0.0004900833289199837,2.050046072570812e-05,128.0,0.01620293683124017,32,7,3,0.011111629530747867,64,5,2,0.03238026260497246,128,3,2,,,,,512,128,5,0.6396459234924319,18.0,3,Adam,,,,49.0,0.6942200124300808,0.6914328211095607,"{""block_0_dropout"": 0.01620293683124017, ""block_0_filters"": 32, ""block_0_kernel"": 7, ""block_1_dropout"": 0.011111629530747867, ""block_1_filters"": 64, ""block_1_kernel"": 5, ""block_1_stride"": 2, ""block_2_dropout"": 0.03238026260497246, ""block_2_filters"": 128, ""block_2_kernel"": 3, ""block_2_stride"": 2, ""first_conv_filters"": 128, ""first_conv_kernel_size"": 5, ""n_blocks"": 3}",COMPLETE
92,0.4525024590714757,2026-09-28 20:04:06.436902,2026-09-28 20:05:16.945253,0 days 00:01:10.508351,0.853847318234392,0.9340418673477211,0.0004169379458293502,2.1392257864331282e-05,128.0,0.01828141685433478,32,7,3,0.03236623198464027,64,5,2,0.030734012192758123,128,3,2,,,,,512,128,5,0.6120309398874533,19.0,3,Adam,,,,,,,"{""block_0_dropout"": 0.01828141685433478, ""block_0_filters"": 32, ""block_0_kernel"": 7, ""block_1_dropout"": 0.03236623198464027, ""block_1_filters"": 64, ""block_1_kernel"": 5, ""block_1_stride"": 2, ""block_2_dropout"": 0.030734012192758123, ""block_2_filters"": 128, ""block_2_kernel"": 3, ""block_2_stride"": 2, ""first_conv_filters"": 128, ""first_conv_kernel_size"": 5, ""n_blocks"": 3}",PRUNED
93,0.4517508780831547,2026-09-28 20:05:17.077387,2026-09-28 20:06:33.295044,0 days 00:01:16.217657,0.8619969695924543,0.9302697718005963,0.0003415495615607367,2.688834119254146e-05,128.0,0.016202410755303598,32,7,3,0.030729108572597693,64,5,2,0.032639830392495205,128,3,2,,,,,512,128,5,0.6506717898706295,14.0,3,Adam,,,,,,,"{""block_0_dropout"": 0.016202410755303598, ""block_0_filters"": 32, ""block_0_kernel"": 7, ""block_1_dropout"": 0.030729108572597693, ""block_1_filters"": 64, ""block_1_kernel"": 5, ""block_1_stride"": 2, ""block_2_dropout"": 0.032639830392495205, ""block_2_filters"": 128, ""block_2_kernel"": 3, ""block_2_stride"": 2, ""first_conv_filters"": 128, ""first_conv_kernel_size"": 5, ""n_blocks"": 3}",PRUNED
94,0.6718676313389298,2026-09-28 20:06:33.360420,2026-09-28 20:10:50.199253,0 days 00:04:16.838833,0.8668506613792102,0.9386912533836517,0.0006163673451943771,1.5466130567254285e-06,128.0,0.014904854305650708,32,7,3,0.011497160685218218,64,5,2,0.03189897513669235,128,3,2,,,,,512,128,5,0.6860621482247248,18.0,3,Adam,,,,48.0,0.6699813548788067,0.6737539077990528,"{""block_0_dropout"": 0.014904854305650708, ""block_0_filters"": 32, ""block_0_kernel"": 7, ""block_1_dropout"": 0.011497160685218218, ""block_1_filters"": 64, ""block_1_kernel"": 5, ""block_1_stride"": 2, ""block_2_dropout"": 0.03189897513669235, ""block_2_filters"": 128, ""block_2_kernel"": 3, ""block_2_stride"": 2, ""first_conv_filters"": 128, ""first_conv_kernel_size"": 5, ""n_blocks"": 3}",COMPLETE
95,0.6645240606927378,2026-09-28 20:10:50.253232,2026-09-28 20:15:05.954175,0 days 00:04:15.700943,0.9714488095044748,0.9440868689053779,0.0004933033118772977,5.101618821725128e-05,128.0,0.01802791651182023,32,7,3,0.03424406995658397,64,5,2,0.03591956312241764,128,3,2,,,,,512,128,5,0.6365521222835657,20.0,3,Adam,,,,49.0,0.6668738346799254,0.6621742867055501,"{""block_0_dropout"": 0.01802791651182023, ""block_0_filters"": 32, ""block_0_kernel"": 7, ""block_1_dropout"": 0.03424406995658397, ""block_1_filters"": 64, ""block_1_kernel"": 5, ""block_1_stride"": 2, ""block_2_dropout"": 0.03591956312241764, ""block_2_filters"": 128, ""block_2_kernel"": 3, ""block_2_stride"": 2, ""first_conv_filters"": 128, ""first_conv_kernel_size"": 5, ""n_blocks"": 3}",COMPLETE
96,0.6483936129469168,2026-09-28 20:15:06.007098,2026-09-28 20:19:25.032259,0 days 00:04:19.025161,0.8736210085562748,0.9254907208501165,0.00023618049583756678,6.948372347641845e-05,128.0,0.021077068804661384,32,7,3,0.016051988720342608,64,5,2,0.028536159289439353,128,3,2,,,,,512,128,5,0.6585908638284822,17.0,3,Adam,,,,48.0,0.6550652579241765,0.6417219679696571,"{""block_0_dropout"": 0.021077068804661384, ""block_0_filters"": 32, ""block_0_kernel"": 7, ""block_1_dropout"": 0.016051988720342608, ""block_1_filters"": 64, ""block_1_kernel"": 5, ""block_1_stride"": 2, ""block_2_dropout"": 0.028536159289439353, ""block_2_filters"": 128, ""block_2_kernel"": 3, ""block_2_stride"": 2, ""first_conv_filters"": 128, ""first_conv_kernel_size"": 5, ""n_blocks"": 3}",COMPLETE
97,0.6714216703840468,2026-09-28 20:19:25.085029,2026-09-28 20:23:43.140649,0 days 00:04:18.055620,0.8573699591959585,0.9367659319168281,0.0003346972466330114,1.3159634164924631e-05,128.0,0.018135475347246317,32,7,3,0.010403678942903956,64,5,2,0.03225108712626134,128,3,2,,,,,512,128,5,0.3620393222381107,18.0,3,Adam,,,,48.0,0.6768178993163455,0.6660254414517481,"{""block_0_dropout"": 0.018135475347246317, ""block_0_filters"": 32, ""block_0_kernel"": 7, ""block_1_dropout"": 0.010403678942903956, ""block_1_filters"": 64, ""block_1_kernel"": 5, ""block_1_stride"": 2, ""block_2_dropout"": 0.03225108712626134, ""block_2_filters"": 128, ""block_2_kernel"": 3, ""block_2_stride"": 2, ""first_conv_filters"": 128, ""first_conv_kernel_size"": 5, ""n_blocks"": 3}",COMPLETE
98,0.3225440230089281,2026-09-28 20:23:43.192641,2026-09-28 20:25:09.137900,0 days 00:01:25.945259,0.8533428378711899,0.9208200018075198,0.00045690801574997116,3.4273051246229545e-05,128.0,0.020951565880166265,32,7,3,0.01175934434980098,64,5,2,0.024906480915693453,128,3,2,,,,,512,128,5,0.6121041657005317,17.0,3,Adam,,,,,,,"{""block_0_dropout"": 0.020951565880166265, ""block_0_filters"": 32, ""block_0_kernel"": 7, ""block_1_dropout"": 0.01175934434980098, ""block_1_filters"": 64, ""block_1_kernel"": 5, ""block_1_stride"": 2, ""block_2_dropout"": 0.024906480915693453, ""block_2_filters"": 128, ""block_2_kernel"": 3, ""block_2_stride"": 2, ""first_conv_filters"": 128, ""first_conv_kernel_size"": 5, ""n_blocks"": 3}",PRUNED
99,0.39280715955424356,2026-09-28 20:25:09.191325,2026-09-28 20:26:50.383536,0 days 00:01:41.192211,0.8596212913334348,0.9485782622701917,0.0006508688217802671,7.665443543132155e-05,128.0,0.01648704780340183,32,7,3,0.027914524393459376,64,5,2,0.03549602099614018,128,3,2,,,,,512,128,5,0.6973652922727446,19.0,3,Adam,,,,,,,"{""block_0_dropout"": 0.01648704780340183, ""block_0_filters"": 32, ""block_0_kernel"": 7, ""block_1_dropout"": 0.027914524393459376, ""block_1_filters"": 64, ""block_1_kernel"": 5, ""block_1_stride"": 2, ""block_2_dropout"": 0.03549602099614018, ""block_2_filters"": 128, ""block_2_kernel"": 3, ""block_2_stride"": 2, ""first_conv_filters"": 128, ""first_conv_kernel_size"": 5, ""n_blocks"": 3}",PRUNED
