number,value,datetime_start,datetime_complete,duration,params_adam_beta1,params_adam_beta2,params_adam_lr,params_adam_wd,params_batch_size,params_dropout,params_fc_hidden,params_lr_factor,params_lr_patience,params_optimizer,params_sgd_lr,params_sgd_momentum,params_sgd_wd,user_attrs_best_epoch,user_attrs_validation_accuracy,user_attrs_validation_macro_f1,system_attrs_tpe:relative_params:0,state
0,1.0,2026-10-10 18:09:14.655994,2026-10-10 18:09:42.342210,0 days 00:00:27.686216,,,,,64,0.1624074561769746,128,0.11646759543664197,20,SGD,0.0396760507705299,0.8743233534055306,0.0006796578090758161,1.0,1.0,1.0,,COMPLETE
1,1.0,2026-10-10 18:09:42.402433,2026-10-10 18:10:05.634552,0 days 00:00:23.232119,,,,,128,0.21649165607921678,256,0.728140769114411,8,SGD,0.0007523742884534858,0.8062449345551705,6.672367170464208e-05,11.0,1.0,1.0,,COMPLETE
2,1.0,2026-10-10 18:10:05.692753,2026-10-10 18:10:29.858025,0 days 00:00:24.165272,,,,,128,0.4862528132298237,512,0.19763058787582308,12,SGD,0.00019634341572933326,0.8984275776885255,5.762487216478604e-05,5.0,1.0,1.0,,COMPLETE
3,1.0,2026-10-10 18:10:29.919118,2026-10-10 18:10:50.473852,0 days 00:00:20.554734,,,,,200,0.17394178221021084,64,0.8374993880184934,6,SGD,0.06584106160121614,0.9594999316240181,0.0002463768595899747,10.0,1.0,1.0,,COMPLETE
4,1.0,2026-10-10 18:10:50.557721,2026-10-10 18:11:11.828807,0 days 00:00:21.271086,,,,,128,0.2123738038749523,256,0.717795815437326,8,SGD,0.025502980701628937,0.7216196866671335,0.008862326508576254,2.0,1.0,1.0,,COMPLETE
5,1.0,2026-10-10 18:11:11.894280,2026-10-10 18:11:33.689805,0 days 00:00:21.795525,,,,,128,0.1463476238100519,128,0.36014665762139764,16,SGD,0.0009833181933644897,0.7184319215829468,1.753594952976443e-05,7.0,1.0,1.0,,COMPLETE
6,1.0,2026-10-10 18:11:33.751180,2026-10-10 18:11:56.105930,0 days 00:00:22.354750,0.8651047997790626,0.9031397756501047,0.0007162786999897341,1.263794633808288e-06,128,0.40838687198182444,256,0.6091283290110243,10,Adam,,,,1.0,1.0,1.0,,COMPLETE
7,1.0,2026-10-10 18:11:56.193352,2026-10-10 18:12:17.465473,0 days 00:00:21.272121,0.9720044826262805,0.9802868404822216,0.004132765459466363,0.000341676434183297,200,0.21590058116550723,128,0.24925604710882868,19,Adam,,,,2.0,1.0,1.0,,COMPLETE
8,1.0,2026-10-10 18:12:17.525292,2026-10-10 18:12:45.611550,0 days 00:00:28.086258,,,,,64,0.42720590636899725,512,0.19589229386694626,10,SGD,0.0034059785435329977,0.8210491909131459,7.7344821566468e-06,1.0,1.0,1.0,,COMPLETE
9,0.9994419809660046,2026-10-10 18:12:45.667656,2026-10-10 18:12:49.771167,0 days 00:00:04.103511,,,,,128,0.20071291833014568,256,0.5021432185830892,5,SGD,0.000715354779469316,0.7106972147328144,0.000274319913977967,,,,,PRUNED
10,1.0,2026-10-10 18:12:49.828253,2026-10-10 18:13:15.260600,0 days 00:00:25.432347,,,,,64,0.29278165346610885,128,0.3085747263361618,8,SGD,0.009392067394552754,0.9868348159470827,1.354035154708487e-06,2.0,1.0,1.0,"{""batch_size"": 64, ""dropout"": 0.29278165346610885, ""fc_hidden"": 128, ""lr_factor"": 0.3085747263361618, ""lr_patience"": 8, ""optimizer"": ""SGD""}",COMPLETE
11,0.9973096072832262,2026-10-10 18:13:15.329709,2026-10-10 18:13:22.606662,0 days 00:00:07.276953,,,,,64,0.18648969904941048,512,0.15123812869289766,15,SGD,0.00011887284822210094,0.8275852693132019,0.0023156791360246995,,,,"{""batch_size"": 64, ""dropout"": 0.18648969904941048, ""fc_hidden"": 512, ""lr_factor"": 0.15123812869289766, ""lr_patience"": 15, ""optimizer"": ""SGD""}",PRUNED
12,1.0,2026-10-10 18:13:22.677860,2026-10-10 18:13:44.081004,0 days 00:00:21.403144,,,,,128,0.15842395727205288,256,0.8276190875665932,17,SGD,0.0040523382686527155,0.8223563611864626,0.0005991137788630627,2.0,1.0,1.0,"{""batch_size"": 128, ""dropout"": 0.15842395727205288, ""fc_hidden"": 256, ""lr_factor"": 0.8276190875665932, ""lr_patience"": 17, ""optimizer"": ""SGD""}",COMPLETE
13,1.0,2026-10-10 18:13:44.152942,2026-10-10 18:14:09.639872,0 days 00:00:25.486930,,,,,64,0.20417872206103027,128,0.37258026376148795,20,SGD,0.04552317758235957,0.8820164541242254,7.063101398120578e-05,1.0,1.0,1.0,"{""batch_size"": 64, ""dropout"": 0.20417872206103027, ""fc_hidden"": 128, ""lr_factor"": 0.37258026376148795, ""lr_patience"": 20, ""optimizer"": ""SGD""}",COMPLETE
14,1.0,2026-10-10 18:14:09.720784,2026-10-10 18:14:40.946123,0 days 00:00:31.225339,,,,,64,0.31410570455824105,128,0.5464123108651021,15,SGD,0.0010399511195952297,0.771153293025695,0.0012083195714867765,3.0,1.0,1.0,"{""batch_size"": 64, ""dropout"": 0.31410570455824105, ""fc_hidden"": 128, ""lr_factor"": 0.5464123108651021, ""lr_patience"": 15, ""optimizer"": ""SGD""}",COMPLETE
15,1.0,2026-10-10 18:14:41.002708,2026-10-10 18:15:10.966791,0 days 00:00:29.964083,,,,,64,0.15640932563848314,256,0.39884353699691427,12,SGD,0.015036751311457718,0.8897261716656205,7.054382978969143e-05,1.0,1.0,1.0,"{""batch_size"": 64, ""dropout"": 0.15640932563848314, ""fc_hidden"": 256, ""lr_factor"": 0.39884353699691427, ""lr_patience"": 12, ""optimizer"": ""SGD""}",COMPLETE
16,0.997870085794807,2026-10-10 18:15:11.028557,2026-10-10 18:15:16.669512,0 days 00:00:05.640955,,,,,128,0.158736319680555,128,0.13592708513761728,20,SGD,0.0003495971188535529,0.775427535016384,0.004436114586345259,,,,"{""batch_size"": 128, ""dropout"": 0.158736319680555, ""fc_hidden"": 128, ""lr_factor"": 0.13592708513761728, ""lr_patience"": 20, ""optimizer"": ""SGD""}",PRUNED
17,1.0,2026-10-10 18:15:16.731259,2026-10-10 18:15:43.913467,0 days 00:00:27.182208,,,,,64,0.22018558040091302,256,0.101361254560345,19,SGD,0.0033390479974689594,0.8598007201053557,0.0002594563100285808,1.0,1.0,1.0,"{""batch_size"": 64, ""dropout"": 0.22018558040091302, ""fc_hidden"": 256, ""lr_factor"": 0.101361254560345, ""lr_patience"": 19, ""optimizer"": ""SGD""}",COMPLETE
18,1.0,2026-10-10 18:15:43.993397,2026-10-10 18:16:04.721662,0 days 00:00:20.728265,,,,,128,0.2906477887737142,256,0.7298129996429842,18,SGD,0.08793966532405814,0.9242845105752556,1.1706610849462176e-05,1.0,1.0,1.0,"{""batch_size"": 128, ""dropout"": 0.2906477887737142, ""fc_hidden"": 256, ""lr_factor"": 0.7298129996429842, ""lr_patience"": 18, ""optimizer"": ""SGD""}",COMPLETE
19,1.0,2026-10-10 18:16:04.780815,2026-10-10 18:16:35.196170,0 days 00:00:30.415355,,,,,64,0.16362123815725652,512,0.6333125953170211,20,SGD,0.007251815117092199,0.777483374125313,2.4761901971327987e-06,1.0,1.0,1.0,"{""batch_size"": 64, ""dropout"": 0.16362123815725652, ""fc_hidden"": 512, ""lr_factor"": 0.6333125953170211, ""lr_patience"": 20, ""optimizer"": ""SGD""}",COMPLETE
20,1.0,2026-10-10 18:16:35.259585,2026-10-10 18:17:00.475103,0 days 00:00:25.215518,,,,,64,0.10044431105564032,128,0.37780430759491573,6,SGD,0.0018347836952167641,0.8464557238020292,2.9007439681505372e-05,3.0,1.0,1.0,"{""batch_size"": 64, ""dropout"": 0.10044431105564032, ""fc_hidden"": 128, ""lr_factor"": 0.37780430759491573, ""lr_patience"": 6, ""optimizer"": ""SGD""}",COMPLETE
21,0.9953392151385423,2026-10-10 18:17:00.536264,2026-10-10 18:17:04.650851,0 days 00:00:04.114587,,,,,128,0.30326400229888495,256,0.8924949382109065,9,SGD,0.00010107102183950448,0.9185015219135303,5.262452042419572e-05,,,,"{""batch_size"": 128, ""dropout"": 0.30326400229888495, ""fc_hidden"": 256, ""lr_factor"": 0.8924949382109065, ""lr_patience"": 9, ""optimizer"": ""SGD""}",PRUNED
22,0.9992890519259685,2026-10-10 18:17:04.716062,2026-10-10 18:17:09.686667,0 days 00:00:04.970605,,,,,64,0.1067283306527051,128,0.1785542522282472,14,SGD,0.0003188461078102302,0.915524510905251,0.00012472661099925412,,,,"{""batch_size"": 64, ""dropout"": 0.1067283306527051, ""fc_hidden"": 128, ""lr_factor"": 0.1785542522282472, ""lr_patience"": 14, ""optimizer"": ""SGD""}",PRUNED
23,1.0,2026-10-10 18:17:09.749316,2026-10-10 18:17:30.095805,0 days 00:00:20.346489,,,,,128,0.25999383575954665,256,0.13375672596006705,7,SGD,0.0002764238023210023,0.8849611873514845,0.0008162015375369941,8.0,1.0,1.0,"{""batch_size"": 128, ""dropout"": 0.25999383575954665, ""fc_hidden"": 256, ""lr_factor"": 0.13375672596006705, ""lr_patience"": 7, ""optimizer"": ""SGD""}",COMPLETE
24,0.9976996557888378,2026-10-10 18:17:30.158281,2026-10-10 18:17:34.351158,0 days 00:00:04.192877,,,,,128,0.3335346029389131,512,0.2833280544412835,8,SGD,0.0001812840501129548,0.7979234892570138,3.1406390179884276e-05,,,,"{""batch_size"": 128, ""dropout"": 0.3335346029389131, ""fc_hidden"": 512, ""lr_factor"": 0.2833280544412835, ""lr_patience"": 8, ""optimizer"": ""SGD""}",PRUNED
25,1.0,2026-10-10 18:17:34.408186,2026-10-10 18:17:55.699716,0 days 00:00:21.291530,,,,,128,0.4474806545249672,256,0.7984215182504077,5,SGD,0.0005568783322854674,0.9438825407183781,6.162009445461692e-06,3.0,1.0,1.0,"{""batch_size"": 128, ""dropout"": 0.4474806545249672, ""fc_hidden"": 256, ""lr_factor"": 0.7984215182504077, ""lr_patience"": 5, ""optimizer"": ""SGD""}",COMPLETE
26,1.0,2026-10-10 18:17:55.772793,2026-10-10 18:18:16.257607,0 days 00:00:20.484814,,,,,128,0.14003189546134281,256,0.7971286052737308,11,SGD,0.029031599802971198,0.856277030851626,0.00017092871382262488,1.0,1.0,1.0,"{""batch_size"": 128, ""dropout"": 0.14003189546134281, ""fc_hidden"": 256, ""lr_factor"": 0.7971286052737308, ""lr_patience"": 11, ""optimizer"": ""SGD""}",COMPLETE
27,1.0,2026-10-10 18:18:16.317438,2026-10-10 18:18:38.614353,0 days 00:00:22.296915,,,,,128,0.4900017544076605,512,0.48176459506918756,7,SGD,0.0019136831639968914,0.9000790392756451,0.0005522184546331955,2.0,1.0,1.0,"{""batch_size"": 128, ""dropout"": 0.4900017544076605, ""fc_hidden"": 512, ""lr_factor"": 0.48176459506918756, ""lr_patience"": 7, ""optimizer"": ""SGD""}",COMPLETE
28,0.9928318037521364,2026-10-10 18:18:38.694671,2026-10-10 18:18:44.598806,0 days 00:00:05.904135,,,,,128,0.4015451003769398,512,0.12523478299926571,19,SGD,0.00016848815057339019,0.7438569400086803,0.002032974676887174,,,,"{""batch_size"": 128, ""dropout"": 0.4015451003769398, ""fc_hidden"": 512, ""lr_factor"": 0.12523478299926571, ""lr_patience"": 19, ""optimizer"": ""SGD""}",PRUNED
29,0.9992766812446894,2026-10-10 18:18:44.672022,2026-10-10 18:18:50.150547,0 days 00:00:05.478525,,,,,64,0.2084959375179194,128,0.3382125088035904,14,SGD,0.000600633331698708,0.8664153729290811,0.00010946372685038388,,,,"{""batch_size"": 64, ""dropout"": 0.2084959375179194, ""fc_hidden"": 128, ""lr_factor"": 0.3382125088035904, ""lr_patience"": 14, ""optimizer"": ""SGD""}",PRUNED
30,1.0,2026-10-10 18:18:50.208098,2026-10-10 18:19:14.780641,0 days 00:00:24.572543,,,,,64,0.19120245413476467,128,0.24213348003453072,7,SGD,0.0016049018424114285,0.8364992485956998,2.515406913088781e-05,2.0,1.0,1.0,"{""batch_size"": 64, ""dropout"": 0.19120245413476467, ""fc_hidden"": 128, ""lr_factor"": 0.24213348003453072, ""lr_patience"": 7, ""optimizer"": ""SGD""}",COMPLETE
31,1.0,2026-10-10 18:19:14.837758,2026-10-10 18:19:35.400869,0 days 00:00:20.563111,,,,,200,0.14663638005153767,64,0.7960013131776225,6,SGD,0.09957469290376939,0.9854786002074936,0.00032298554720163836,3.0,1.0,1.0,"{""batch_size"": 200, ""dropout"": 0.14663638005153767, ""fc_hidden"": 64, ""lr_factor"": 0.7960013131776225, ""lr_patience"": 6, ""optimizer"": ""SGD""}",COMPLETE
32,1.0,2026-10-10 18:19:35.462612,2026-10-10 18:19:57.424938,0 days 00:00:21.962326,,,,,200,0.21003054643845565,512,0.7066774688695692,6,SGD,0.051932285071971174,0.9591840413048073,0.0004006749983990789,1.0,1.0,1.0,"{""batch_size"": 200, ""dropout"": 0.21003054643845565, ""fc_hidden"": 512, ""lr_factor"": 0.7066774688695692, ""lr_patience"": 6, ""optimizer"": ""SGD""}",COMPLETE
33,1.0,2026-10-10 18:19:57.483273,2026-10-10 18:20:17.881336,0 days 00:00:20.398063,,,,,200,0.20120017968349238,64,0.8726634315539792,8,SGD,0.03478555153933689,0.9583704939033623,0.00014839143110666008,1.0,1.0,1.0,"{""batch_size"": 200, ""dropout"": 0.20120017968349238, ""fc_hidden"": 64, ""lr_factor"": 0.8726634315539792, ""lr_patience"": 8, ""optimizer"": ""SGD""}",COMPLETE
34,1.0,2026-10-10 18:20:17.942734,2026-10-10 18:20:38.327429,0 days 00:00:20.384695,,,,,200,0.33313986123946504,64,0.7668220574065554,6,SGD,0.0169544195125435,0.8053838281916279,5.651793348814472e-05,1.0,1.0,1.0,"{""batch_size"": 200, ""dropout"": 0.33313986123946504, ""fc_hidden"": 64, ""lr_factor"": 0.7668220574065554, ""lr_patience"": 6, ""optimizer"": ""SGD""}",COMPLETE
35,1.0,2026-10-10 18:20:38.385030,2026-10-10 18:20:58.409931,0 days 00:00:20.024901,,,,,200,0.1722216695202322,64,0.6750402018615028,5,SGD,0.06313687653959625,0.9330132596072066,0.0011924799785139792,1.0,1.0,1.0,"{""batch_size"": 200, ""dropout"": 0.1722216695202322, ""fc_hidden"": 64, ""lr_factor"": 0.6750402018615028, ""lr_patience"": 5, ""optimizer"": ""SGD""}",COMPLETE
36,1.0,2026-10-10 18:20:58.469867,2026-10-10 18:21:20.618546,0 days 00:00:22.148679,,,,,128,0.12742618592989752,64,0.894594982101159,8,SGD,0.018137512427967812,0.9616406467369985,0.00018769216490841255,1.0,1.0,1.0,"{""batch_size"": 128, ""dropout"": 0.12742618592989752, ""fc_hidden"": 64, ""lr_factor"": 0.894594982101159, ""lr_patience"": 8, ""optimizer"": ""SGD""}",COMPLETE
37,1.0,2026-10-10 18:21:20.695116,2026-10-10 18:21:43.407913,0 days 00:00:22.712797,,,,,128,0.2779255700070957,512,0.692905277494065,8,SGD,0.008163494350837614,0.9055724902026845,1.790605150053235e-05,1.0,1.0,1.0,"{""batch_size"": 128, ""dropout"": 0.2779255700070957, ""fc_hidden"": 512, ""lr_factor"": 0.692905277494065, ""lr_patience"": 8, ""optimizer"": ""SGD""}",COMPLETE
38,0.9960141348148281,2026-10-10 18:21:43.469052,2026-10-10 18:21:48.836219,0 days 00:00:05.367167,,,,,64,0.24704972509597128,128,0.2112543580231856,19,SGD,0.00020848591617695042,0.7523534172302054,0.008331298824360935,,,,"{""batch_size"": 64, ""dropout"": 0.24704972509597128, ""fc_hidden"": 128, ""lr_factor"": 0.2112543580231856, ""lr_patience"": 19, ""optimizer"": ""SGD""}",PRUNED
39,1.0,2026-10-10 18:21:48.897677,2026-10-10 18:22:10.468527,0 days 00:00:21.570850,,,,,128,0.1471539695475355,256,0.10780226918167635,9,SGD,0.0052238659162474055,0.8717969042422957,6.228322890111693e-06,1.0,1.0,1.0,"{""batch_size"": 128, ""dropout"": 0.1471539695475355, ""fc_hidden"": 256, ""lr_factor"": 0.10780226918167635, ""lr_patience"": 9, ""optimizer"": ""SGD""}",COMPLETE
40,0.989389735908335,2026-10-10 18:22:10.527321,2026-10-10 18:22:14.591085,0 days 00:00:04.063764,,,,,200,0.27525641099179265,64,0.7829072182967891,8,SGD,0.00041943788980526125,0.8087287313422751,9.491196324663618e-05,,,,"{""batch_size"": 200, ""dropout"": 0.27525641099179265, ""fc_hidden"": 64, ""lr_factor"": 0.7829072182967891, ""lr_patience"": 8, ""optimizer"": ""SGD""}",PRUNED
41,1.0,2026-10-10 18:22:14.653876,2026-10-10 18:22:35.674386,0 days 00:00:21.020510,,,,,128,0.23056198042391188,256,0.6767255662824034,9,SGD,0.026167636873695832,0.7038638054096592,0.0065157326605414425,1.0,1.0,1.0,"{""batch_size"": 128, ""dropout"": 0.23056198042391188, ""fc_hidden"": 256, ""lr_factor"": 0.6767255662824034, ""lr_patience"": 9, ""optimizer"": ""SGD""}",COMPLETE
42,1.0,2026-10-10 18:22:35.733920,2026-10-10 18:22:55.831488,0 days 00:00:20.097568,0.986859586242184,0.9951334439895403,0.00010969758588491288,0.0072045838458049795,200,0.15984125199785063,64,0.8662543707760418,6,Adam,,,,5.0,1.0,1.0,"{""batch_size"": 200, ""dropout"": 0.15984125199785063, ""fc_hidden"": 64, ""lr_factor"": 0.8662543707760418, ""lr_patience"": 6, ""optimizer"": ""Adam""}",COMPLETE
43,1.0,2026-10-10 18:22:55.890885,2026-10-10 18:23:18.292597,0 days 00:00:22.401712,,,,,128,0.23990610648769864,256,0.7970934813692319,6,SGD,0.06821927074389275,0.7280787017176382,0.0035641938559152603,1.0,1.0,1.0,"{""batch_size"": 128, ""dropout"": 0.23990610648769864, ""fc_hidden"": 256, ""lr_factor"": 0.7970934813692319, ""lr_patience"": 6, ""optimizer"": ""SGD""}",COMPLETE
44,1.0,2026-10-10 18:23:18.352596,2026-10-10 18:23:39.717363,0 days 00:00:21.364767,,,,,128,0.23797156412686638,256,0.8292535277661441,9,SGD,0.012191316763448128,0.7260058445313118,4.8457810934960655e-05,5.0,1.0,1.0,"{""batch_size"": 128, ""dropout"": 0.23797156412686638, ""fc_hidden"": 256, ""lr_factor"": 0.8292535277661441, ""lr_patience"": 9, ""optimizer"": ""SGD""}",COMPLETE
45,1.0,2026-10-10 18:23:39.777354,2026-10-10 18:24:07.755458,0 days 00:00:27.978104,,,,,64,0.15761472936075066,128,0.252247860341372,18,SGD,0.040764896885371785,0.8369021716173524,0.0002517024613548676,1.0,1.0,1.0,"{""batch_size"": 64, ""dropout"": 0.15761472936075066, ""fc_hidden"": 128, ""lr_factor"": 0.252247860341372, ""lr_patience"": 18, ""optimizer"": ""SGD""}",COMPLETE
46,1.0,2026-10-10 18:24:07.816416,2026-10-10 18:24:36.031238,0 days 00:00:28.214822,,,,,64,0.10240402573651589,128,0.1681669482035552,19,SGD,0.0009817698931118566,0.9810475983154483,0.0004925885425020484,1.0,1.0,1.0,"{""batch_size"": 64, ""dropout"": 0.10240402573651589, ""fc_hidden"": 128, ""lr_factor"": 0.1681669482035552, ""lr_patience"": 19, ""optimizer"": ""SGD""}",COMPLETE
47,1.0,2026-10-10 18:24:36.090134,2026-10-10 18:24:56.624637,0 days 00:00:20.534503,,,,,128,0.15043249365703673,256,0.6989575650732663,9,SGD,0.02302157196442526,0.9426009384132694,0.0021525270362468137,1.0,1.0,1.0,"{""batch_size"": 128, ""dropout"": 0.15043249365703673, ""fc_hidden"": 256, ""lr_factor"": 0.6989575650732663, ""lr_patience"": 9, ""optimizer"": ""SGD""}",COMPLETE
48,1.0,2026-10-10 18:24:56.682493,2026-10-10 18:25:18.552877,0 days 00:00:21.870384,,,,,128,0.17578405790499957,256,0.7264174950435379,7,SGD,0.06985212838644189,0.7486501549632447,0.0009433248584496619,1.0,1.0,1.0,"{""batch_size"": 128, ""dropout"": 0.17578405790499957, ""fc_hidden"": 256, ""lr_factor"": 0.7264174950435379, ""lr_patience"": 7, ""optimizer"": ""SGD""}",COMPLETE
49,1.0,2026-10-10 18:25:18.612191,2026-10-10 18:25:43.477434,0 days 00:00:24.865243,,,,,64,0.13239397639956452,128,0.15229308653721957,10,SGD,0.0030966113300689266,0.7858273349390784,4.275351178520466e-05,9.0,1.0,1.0,"{""batch_size"": 64, ""dropout"": 0.13239397639956452, ""fc_hidden"": 128, ""lr_factor"": 0.15229308653721957, ""lr_patience"": 10, ""optimizer"": ""SGD""}",COMPLETE
