number,value,datetime_start,datetime_complete,duration,params_adam_beta1,params_adam_beta2,params_adam_lr,params_adam_wd,params_batch_size,params_block_0_dropout,params_block_0_filters,params_block_0_kernel,params_block_0_stride,params_block_1_dropout,params_block_1_filters,params_block_1_kernel,params_block_1_stride,params_block_2_dropout,params_block_2_filters,params_block_2_kernel,params_block_2_stride,params_block_3_dropout,params_block_3_filters,params_block_3_kernel,params_block_3_stride,params_block_4_dropout,params_block_4_filters,params_block_4_kernel,params_block_4_stride,params_fc_hidden,params_lr_factor,params_lr_patience,params_n_blocks,params_optimizer,params_sgd_lr,params_sgd_momentum,params_sgd_wd,user_attrs_best_epoch,user_attrs_validation_accuracy,user_attrs_validation_macro_f1,system_attrs_tpe:relative_params:0,state
34,0.31592596059319156,2026-10-02 11:26:26.974103,2026-10-02 11:26:52.445795,0 days 00:00:25.471692,0.8826013749260109,0.9097350481769769,0.0009350881279380402,0.004186239902998692,128.0,0.04902812356714046,8,5,3,0.01474154068633682,64,5,1,0.018732381879729903,128,5,1,0.020384675758485623,64.0,5.0,2.0,,,,,128,0.8544992522237919,11.0,4,Adam,,,,,,,"{""block_0_dropout"": 0.04902812356714046, ""block_0_filters"": 8, ""block_0_kernel"": 5, ""block_1_dropout"": 0.01474154068633682, ""block_1_filters"": 64, ""block_1_kernel"": 5, ""block_1_stride"": 1, ""block_2_dropout"": 0.018732381879729903, ""block_2_filters"": 128, ""block_2_kernel"": 5, ""block_2_stride"": 1, ""n_blocks"": 4}",PRUNED
35,0.5082809506768156,2026-10-02 11:26:52.499371,2026-10-02 11:27:58.802702,0 days 00:01:06.303331,0.9217526147486678,0.9270211283559401,0.0006864313842299229,0.00012138081215605182,200.0,0.03742719841733731,16,7,3,0.019310996081691637,64,3,1,0.015499715349047581,128,3,1,0.026129839424129976,64.0,5.0,2.0,,,,,128,0.6630342095484527,12.0,4,Adam,,,,,,,"{""block_0_dropout"": 0.03742719841733731, ""block_0_filters"": 16, ""block_0_kernel"": 7, ""block_1_dropout"": 0.019310996081691637, ""block_1_filters"": 64, ""block_1_kernel"": 3, ""block_1_stride"": 1, ""block_2_dropout"": 0.015499715349047581, ""block_2_filters"": 128, ""block_2_kernel"": 3, ""block_2_stride"": 1, ""n_blocks"": 4}",PRUNED
36,0.7843498471514081,2026-10-02 11:27:58.855762,2026-10-02 11:30:04.753664,0 days 00:02:05.897902,0.866692908944018,0.9179586823453366,0.00032743859841141546,0.0009344346128688302,200.0,0.03422660284446019,16,5,3,0.012634513449435983,64,3,1,0.02422583252352842,128,5,1,0.035002194383954056,64.0,5.0,2.0,,,,,256,0.7721274235132745,14.0,4,Adam,,,,48.0,0.7876009944064637,0.7810986998963525,"{""block_0_dropout"": 0.03422660284446019, ""block_0_filters"": 16, ""block_0_kernel"": 5, ""block_1_dropout"": 0.012634513449435983, ""block_1_filters"": 64, ""block_1_kernel"": 3, ""block_1_stride"": 1, ""block_2_dropout"": 0.02422583252352842, ""block_2_filters"": 128, ""block_2_kernel"": 5, ""block_2_stride"": 1, ""n_blocks"": 4}",COMPLETE
37,0.4722066862508699,2026-10-02 11:30:04.817864,2026-10-02 11:31:01.586055,0 days 00:00:56.768191,,,,,128.0,0.029380994712353968,8,5,3,0.038274726911602004,64,5,1,0.018576638427315526,128,5,1,0.03462893245765078,64.0,5.0,2.0,,,,,256,0.7813163653947869,15.0,4,SGD,0.00887486459825613,0.8049233806416899,0.00031713064173621267,,,,"{""block_0_dropout"": 0.029380994712353968, ""block_0_filters"": 8, ""block_0_kernel"": 5, ""block_1_dropout"": 0.038274726911602004, ""block_1_filters"": 64, ""block_1_kernel"": 5, ""block_1_stride"": 1, ""block_2_dropout"": 0.018576638427315526, ""block_2_filters"": 128, ""block_2_kernel"": 5, ""block_2_stride"": 1, ""n_blocks"": 4}",PRUNED
38,0.8271559083290536,2026-10-02 11:31:01.642780,2026-10-02 11:33:44.403079,0 days 00:02:42.760299,0.856249986119195,0.9145720348818231,0.0002562627322313297,0.0008360620819255417,64.0,0.03867201262466313,8,5,3,0.013998078749141045,64,3,1,0.015359380704185355,128,5,1,0.03876625259708739,128.0,5.0,2.0,0.04967601373990671,256.0,3.0,1.0,256,0.7430494757750167,10.0,5,Adam,,,,48.0,0.8391858297078931,0.8151259869502141,"{""block_0_dropout"": 0.03867201262466313, ""block_0_filters"": 8, ""block_0_kernel"": 5, ""block_1_dropout"": 0.013998078749141045, ""block_1_filters"": 64, ""block_1_kernel"": 3, ""block_1_stride"": 1, ""block_2_dropout"": 0.015359380704185355, ""block_2_filters"": 128, ""block_2_kernel"": 5, ""block_2_stride"": 1, ""n_blocks"": 5}",COMPLETE
39,0.2258191066261645,2026-10-02 11:33:44.469776,2026-10-02 11:34:27.664247,0 days 00:00:43.194471,,,,,128.0,0.043700669098096584,8,5,3,0.011629763824577526,64,3,1,0.014797636004671712,128,5,1,0.040203210942960754,128.0,3.0,1.0,0.04905478738895367,256.0,3.0,1.0,256,0.4964428797819609,8.0,5,SGD,0.00010008285163044571,0.802498417405142,1.0550729169324781e-06,,,,"{""block_0_dropout"": 0.043700669098096584, ""block_0_filters"": 8, ""block_0_kernel"": 5, ""block_1_dropout"": 0.011629763824577526, ""block_1_filters"": 64, ""block_1_kernel"": 3, ""block_1_stride"": 1, ""block_2_dropout"": 0.014797636004671712, ""block_2_filters"": 128, ""block_2_kernel"": 5, ""block_2_stride"": 1, ""n_blocks"": 5}",PRUNED
40,0.818751011667136,2026-10-02 11:34:27.716771,2026-10-02 11:36:45.879983,0 days 00:02:18.163212,0.8531079580259384,0.9108856401692392,0.00023129512608704666,0.0024283317137223015,200.0,0.0421846225657658,8,5,3,0.017784191201022627,64,3,1,0.0250132608117605,128,5,1,0.04023575186819061,128.0,5.0,2.0,0.03718555953644008,256.0,3.0,1.0,256,0.26912216289232543,10.0,5,Adam,,,,48.0,0.8300186451211933,0.8074833782130788,"{""block_0_dropout"": 0.0421846225657658, ""block_0_filters"": 8, ""block_0_kernel"": 5, ""block_1_dropout"": 0.017784191201022627, ""block_1_filters"": 64, ""block_1_kernel"": 3, ""block_1_stride"": 1, ""block_2_dropout"": 0.0250132608117605, ""block_2_filters"": 128, ""block_2_kernel"": 5, ""block_2_stride"": 1, ""n_blocks"": 5}",COMPLETE
41,0.8422219355865432,2026-10-02 11:36:45.961123,2026-10-02 11:39:04.628843,0 days 00:02:18.667720,0.850370659455922,0.9077206340973643,0.0002221305339025416,0.0024759211637036364,200.0,0.04602504980100284,8,5,3,0.016560385371224805,64,3,1,0.025431160972996164,128,5,1,0.04012249726934151,128.0,5.0,2.0,0.0402134971190089,256.0,3.0,1.0,256,0.11789146297703035,10.0,5,Adam,,,,48.0,0.8564325668116842,0.8280113043614022,"{""block_0_dropout"": 0.04602504980100284, ""block_0_filters"": 8, ""block_0_kernel"": 5, ""block_1_dropout"": 0.016560385371224805, ""block_1_filters"": 64, ""block_1_kernel"": 3, ""block_1_stride"": 1, ""block_2_dropout"": 0.025431160972996164, ""block_2_filters"": 128, ""block_2_kernel"": 5, ""block_2_stride"": 1, ""n_blocks"": 5}",COMPLETE
42,0.8364349859302114,2026-10-02 11:39:04.701902,2026-10-02 11:41:23.573477,0 days 00:02:18.871575,0.8528939028810049,0.9081187410125805,0.00018929272575736252,0.0031148626406271285,200.0,0.029878440022298336,8,5,3,0.01714805215928622,64,3,1,0.01459307560906589,128,5,1,0.042696449991883885,128.0,5.0,2.0,0.039846687834096006,256.0,3.0,1.0,256,0.10814433238374696,9.0,5,Adam,,,,48.0,0.8466438781852083,0.8262260936752146,"{""block_0_dropout"": 0.029878440022298336, ""block_0_filters"": 8, ""block_0_kernel"": 5, ""block_1_dropout"": 0.01714805215928622, ""block_1_filters"": 64, ""block_1_kernel"": 3, ""block_1_stride"": 1, ""block_2_dropout"": 0.01459307560906589, ""block_2_filters"": 128, ""block_2_kernel"": 5, ""block_2_stride"": 1, ""n_blocks"": 5}",COMPLETE
43,0.7979047782124052,2026-10-02 11:41:23.627232,2026-10-02 11:43:42.165780,0 days 00:02:18.538548,0.852711614062162,0.9072563913684721,0.00017192285275693375,0.0035509030658506407,200.0,0.0452412092472601,8,5,3,0.013632993359178827,64,3,1,0.023773116325212094,128,5,1,0.04552845186329424,128.0,5.0,2.0,0.038703155272911315,256.0,3.0,1.0,256,0.10661236126733721,9.0,5,Adam,,,,41.0,0.8121504039776258,0.7836591524471846,"{""block_0_dropout"": 0.0452412092472601, ""block_0_filters"": 8, ""block_0_kernel"": 5, ""block_1_dropout"": 0.013632993359178827, ""block_1_filters"": 64, ""block_1_kernel"": 3, ""block_1_stride"": 1, ""block_2_dropout"": 0.023773116325212094, ""block_2_filters"": 128, ""block_2_kernel"": 5, ""block_2_stride"": 1, ""n_blocks"": 5}",COMPLETE
44,,2026-10-02 11:43:42.223926,2026-10-02 11:43:42.257471,0 days 00:00:00.033545,,,,,,0.04360151174967311,8,5,3,0.016991661988479064,64,3,2,0.011453236331341671,128,5,1,0.041120686995641365,128.0,5.0,2.0,0.039885533920026396,256.0,3.0,1.0,,,,5,,,,,,,,"{""block_0_dropout"": 0.04360151174967311, ""block_0_filters"": 8, ""block_0_kernel"": 5, ""block_1_dropout"": 0.016991661988479064, ""block_1_filters"": 64, ""block_1_kernel"": 3, ""block_1_stride"": 2, ""block_2_dropout"": 0.011453236331341671, ""block_2_filters"": 128, ""block_2_kernel"": 5, ""block_2_stride"": 1, ""n_blocks"": 5}",PRUNED
45,0.3308023653111041,2026-10-02 11:43:42.427324,2026-10-02 11:44:31.080006,0 days 00:00:48.652682,0.8577971135321791,0.908808203088637,0.00010744232163163591,0.002760413529420177,200.0,0.04858742489884072,8,5,3,0.018739998038620656,64,3,1,0.018804533345677957,128,5,1,0.043117278321160454,128.0,3.0,1.0,0.042956822449299076,256.0,3.0,1.0,256,0.2222850443848296,7.0,5,Adam,,,,,,,"{""block_0_dropout"": 0.04858742489884072, ""block_0_filters"": 8, ""block_0_kernel"": 5, ""block_1_dropout"": 0.018739998038620656, ""block_1_filters"": 64, ""block_1_kernel"": 3, ""block_1_stride"": 1, ""block_2_dropout"": 0.018804533345677957, ""block_2_filters"": 128, ""block_2_kernel"": 5, ""block_2_stride"": 1, ""n_blocks"": 5}",PRUNED
46,0.8238152996228587,2026-10-02 11:44:31.136444,2026-10-02 11:46:50.046382,0 days 00:02:18.909938,0.850530324810147,0.9105160804947258,0.0002206935548791952,0.008029913113683151,200.0,0.030871401561793823,8,5,3,0.011473274098496355,64,3,1,0.013654011541606325,128,5,1,0.03851246031925011,128.0,5.0,2.0,0.03271627835454269,256.0,3.0,1.0,256,0.10412785416430882,9.0,5,Adam,,,,49.0,0.8332815413300186,0.8143490579156987,"{""block_0_dropout"": 0.030871401561793823, ""block_0_filters"": 8, ""block_0_kernel"": 5, ""block_1_dropout"": 0.011473274098496355, ""block_1_filters"": 64, ""block_1_kernel"": 3, ""block_1_stride"": 1, ""block_2_dropout"": 0.013654011541606325, ""block_2_filters"": 128, ""block_2_kernel"": 5, ""block_2_stride"": 1, ""n_blocks"": 5}",COMPLETE
47,0.3776222375831749,2026-10-02 11:46:50.105076,2026-10-02 11:47:23.777837,0 days 00:00:33.672761,,,,,200.0,0.038570809063263725,8,5,3,0.015113921057215336,64,3,1,0.022002161072265217,128,5,1,0.038694621113354095,128.0,3.0,2.0,0.03426073314806998,256.0,3.0,1.0,256,0.10812682010249518,9.0,5,SGD,0.009996711120043324,0.8045793273293335,0.0005616230089729857,,,,"{""block_0_dropout"": 0.038570809063263725, ""block_0_filters"": 8, ""block_0_kernel"": 5, ""block_1_dropout"": 0.015113921057215336, ""block_1_filters"": 64, ""block_1_kernel"": 3, ""block_1_stride"": 1, ""block_2_dropout"": 0.022002161072265217, ""block_2_filters"": 128, ""block_2_kernel"": 5, ""block_2_stride"": 1, ""n_blocks"": 5}",PRUNED
48,0.32261933299481543,2026-10-02 11:47:23.834280,2026-10-02 11:48:19.375488,0 days 00:00:55.541208,0.8602379162324234,0.9077838558208245,0.0002052299334405754,0.009875288701058058,200.0,0.02371173048910476,8,5,3,0.01398870790444718,64,3,1,0.013778930562136915,128,5,1,0.043894905161343666,128.0,5.0,1.0,0.03173851651334259,256.0,3.0,1.0,256,0.2299680515453012,8.0,5,Adam,,,,,,,"{""block_0_dropout"": 0.02371173048910476, ""block_0_filters"": 8, ""block_0_kernel"": 5, ""block_1_dropout"": 0.01398870790444718, ""block_1_filters"": 64, ""block_1_kernel"": 3, ""block_1_stride"": 1, ""block_2_dropout"": 0.013778930562136915, ""block_2_filters"": 128, ""block_2_kernel"": 5, ""block_2_stride"": 1, ""n_blocks"": 5}",PRUNED
49,0.828931543133157,2026-10-02 11:48:19.428006,2026-10-02 11:51:02.336629,0 days 00:02:42.908623,0.8501342296542991,0.9116204184000104,0.0002387224364040424,0.0019560506509509416,64.0,0.04879402911682991,8,5,3,0.010346515241421729,64,3,1,0.01469452353205314,128,5,1,0.03830477810555938,128.0,5.0,2.0,0.044282070135593286,256.0,3.0,1.0,256,0.17348789152004362,10.0,5,Adam,,,,48.0,0.8430702299564947,0.8147928563098193,"{""block_0_dropout"": 0.04879402911682991, ""block_0_filters"": 8, ""block_0_kernel"": 5, ""block_1_dropout"": 0.010346515241421729, ""block_1_filters"": 64, ""block_1_kernel"": 3, ""block_1_stride"": 1, ""block_2_dropout"": 0.01469452353205314, ""block_2_filters"": 128, ""block_2_kernel"": 5, ""block_2_stride"": 1, ""n_blocks"": 5}",COMPLETE
50,0.7957049952549695,2026-10-02 11:51:02.394000,2026-10-02 11:53:50.038523,0 days 00:02:47.644523,0.8503384386767614,0.9328861444416111,0.00015028138866694267,0.0059018136873816,64.0,0.03808327267956694,8,5,3,0.01632535925569176,64,3,1,0.015080079925953808,128,5,1,0.04908466700908232,128.0,3.0,2.0,0.044116939178633505,256.0,3.0,1.0,256,0.15567139572861996,6.0,5,Adam,,,,44.0,0.8057799875699192,0.78563000294002,"{""block_0_dropout"": 0.03808327267956694, ""block_0_filters"": 8, ""block_0_kernel"": 5, ""block_1_dropout"": 0.01632535925569176, ""block_1_filters"": 64, ""block_1_kernel"": 3, ""block_1_stride"": 1, ""block_2_dropout"": 0.015080079925953808, ""block_2_filters"": 128, ""block_2_kernel"": 5, ""block_2_stride"": 1, ""n_blocks"": 5}",COMPLETE
51,0.8239212242362335,2026-10-02 11:53:50.131354,2026-10-02 11:56:32.580379,0 days 00:02:42.449025,0.8594874356569308,0.9130261220524755,0.00024915953883218774,0.0021377944823581505,64.0,0.035393703218931656,8,5,3,0.012752646909254858,64,3,1,0.011717721323208552,128,5,1,0.038063920701419646,128.0,5.0,2.0,0.04239780251999775,256.0,3.0,1.0,256,0.28474040238874176,10.0,5,Adam,,,,44.0,0.8366998135487881,0.811142634923679,"{""block_0_dropout"": 0.035393703218931656, ""block_0_filters"": 8, ""block_0_kernel"": 5, ""block_1_dropout"": 0.012752646909254858, ""block_1_filters"": 64, ""block_1_kernel"": 3, ""block_1_stride"": 1, ""block_2_dropout"": 0.011717721323208552, ""block_2_filters"": 128, ""block_2_kernel"": 5, ""block_2_stride"": 1, ""n_blocks"": 5}",COMPLETE
52,0.8227149027191734,2026-10-02 11:56:32.638246,2026-10-02 11:59:21.387177,0 days 00:02:48.748931,0.8618576121265056,0.9137154529080715,0.0002678503539732204,0.0019222462803488178,64.0,0.04561549399143081,8,5,3,0.013319742355577688,64,3,1,0.019286328266265314,128,5,1,0.03834077775740691,128.0,5.0,2.0,0.04367098887888993,256.0,3.0,1.0,256,0.1601338918282821,9.0,5,Adam,,,,45.0,0.8370105655686761,0.8084192398696705,"{""block_0_dropout"": 0.04561549399143081, ""block_0_filters"": 8, ""block_0_kernel"": 5, ""block_1_dropout"": 0.013319742355577688, ""block_1_filters"": 64, ""block_1_kernel"": 3, ""block_1_stride"": 1, ""block_2_dropout"": 0.019286328266265314, ""block_2_filters"": 128, ""block_2_kernel"": 5, ""block_2_stride"": 1, ""n_blocks"": 5}",COMPLETE
53,0.8460115754618781,2026-10-02 11:59:21.456582,2026-10-02 12:02:05.180105,0 days 00:02:43.723523,0.8741971480909657,0.9041874762532456,0.0001369757749954292,0.0013296437315891373,64.0,0.0444341173368628,8,5,3,0.013283334262348316,64,3,1,0.02998388043266782,128,5,1,0.03761211824992517,128.0,5.0,2.0,0.045122300708875365,256.0,3.0,1.0,256,0.28855002402840235,10.0,5,Adam,,,,47.0,0.8568986948415165,0.8351244560822397,"{""block_0_dropout"": 0.0444341173368628, ""block_0_filters"": 8, ""block_0_kernel"": 5, ""block_1_dropout"": 0.013283334262348316, ""block_1_filters"": 64, ""block_1_kernel"": 3, ""block_1_stride"": 1, ""block_2_dropout"": 0.02998388043266782, ""block_2_filters"": 128, ""block_2_kernel"": 5, ""block_2_stride"": 1, ""n_blocks"": 5}",COMPLETE
54,0.8268949443425786,2026-10-02 12:02:05.236080,2026-10-02 12:04:49.498878,0 days 00:02:44.262798,0.8742276090845037,0.9034710466270379,0.00013113487421973527,0.0011877422659399585,64.0,0.04884107154459277,8,5,3,0.012951939720823926,64,3,1,0.01301800509763907,128,5,1,0.032431388551082005,128.0,5.0,2.0,0.04706460701373151,256.0,3.0,1.0,256,0.2930195304642652,10.0,5,Adam,,,,50.0,0.8356121814791796,0.8181777072059777,"{""block_0_dropout"": 0.04884107154459277, ""block_0_filters"": 8, ""block_0_kernel"": 5, ""block_1_dropout"": 0.012951939720823926, ""block_1_filters"": 64, ""block_1_kernel"": 3, ""block_1_stride"": 1, ""block_2_dropout"": 0.01301800509763907, ""block_2_filters"": 128, ""block_2_kernel"": 5, ""block_2_stride"": 1, ""n_blocks"": 5}",COMPLETE
55,0.8295661248637098,2026-10-02 12:04:49.556616,2026-10-02 12:07:29.449042,0 days 00:02:39.892426,0.8752840453879072,0.9005286620835055,0.00012537566436970115,0.0009970170320937847,64.0,0.04646593459940586,8,5,3,0.017391682141167618,64,3,1,0.014863745186649475,128,5,1,0.03276192116855533,128.0,5.0,2.0,0.047044568465977155,256.0,3.0,1.0,256,0.32779453342732556,10.0,5,Adam,,,,49.0,0.8466438781852083,0.8124883715422115,"{""block_0_dropout"": 0.04646593459940586, ""block_0_filters"": 8, ""block_0_kernel"": 5, ""block_1_dropout"": 0.017391682141167618, ""block_1_filters"": 64, ""block_1_kernel"": 3, ""block_1_stride"": 1, ""block_2_dropout"": 0.014863745186649475, ""block_2_filters"": 128, ""block_2_kernel"": 5, ""block_2_stride"": 1, ""n_blocks"": 5}",COMPLETE
56,0.817965280567072,2026-10-02 12:07:29.527966,2026-10-02 12:10:12.487610,0 days 00:02:42.959644,0.8748659009408157,0.988593998829017,0.00012617666241367784,0.0014625610409937859,64.0,0.04991491361346755,8,5,3,0.01517964577507007,64,3,1,0.02416199989422794,128,5,1,0.04260601160048303,128.0,5.0,2.0,0.04989849481548985,256.0,3.0,1.0,256,0.3587289266139735,7.0,5,Adam,,,,47.0,0.8309509011808577,0.8049796599532862,"{""block_0_dropout"": 0.04991491361346755, ""block_0_filters"": 8, ""block_0_kernel"": 5, ""block_1_dropout"": 0.01517964577507007, ""block_1_filters"": 64, ""block_1_kernel"": 3, ""block_1_stride"": 1, ""block_2_dropout"": 0.02416199989422794, ""block_2_filters"": 128, ""block_2_kernel"": 5, ""block_2_stride"": 1, ""n_blocks"": 5}",COMPLETE
57,0.8285771660462886,2026-10-02 12:10:12.543282,2026-10-02 12:13:11.291752,0 days 00:02:58.748470,0.8646233993674838,0.9000558167263403,0.00017434508492178866,0.0007851239528034882,64.0,0.04632806820822873,8,5,3,0.01841953677683249,64,3,1,0.027501652330563085,128,5,1,0.0321535995950976,256.0,5.0,2.0,0.045543415660599953,256.0,3.0,1.0,256,0.15671607642573304,11.0,5,Adam,,,,49.0,0.8455562461155998,0.8115980859769774,"{""block_0_dropout"": 0.04632806820822873, ""block_0_filters"": 8, ""block_0_kernel"": 5, ""block_1_dropout"": 0.01841953677683249, ""block_1_filters"": 64, ""block_1_kernel"": 3, ""block_1_stride"": 1, ""block_2_dropout"": 0.027501652330563085, ""block_2_filters"": 128, ""block_2_kernel"": 5, ""block_2_stride"": 1, ""n_blocks"": 5}",COMPLETE
58,0.3393146409632677,2026-10-02 12:13:11.349082,2026-10-02 12:14:23.846810,0 days 00:01:12.497728,0.8642634389595136,0.9012777401202492,0.00016651690613095468,0.004739987502479159,64.0,0.04542358481442516,8,5,3,0.011867293928912384,64,3,1,0.030661713684357557,128,5,1,0.03233618648340489,256.0,5.0,1.0,0.04529893262163648,256.0,3.0,1.0,256,0.17879859991891633,8.0,5,Adam,,,,,,,"{""block_0_dropout"": 0.04542358481442516, ""block_0_filters"": 8, ""block_0_kernel"": 5, ""block_1_dropout"": 0.011867293928912384, ""block_1_filters"": 64, ""block_1_kernel"": 3, ""block_1_stride"": 1, ""block_2_dropout"": 0.030661713684357557, ""block_2_filters"": 128, ""block_2_kernel"": 5, ""block_2_stride"": 1, ""n_blocks"": 5}",PRUNED
59,0.28968569716942,2026-10-02 12:14:23.929786,2026-10-02 12:14:58.882489,0 days 00:00:34.952703,0.9874532613633105,0.9054715315005807,0.00018377788766332252,0.0030464836260405068,64.0,0.03730402859979257,8,5,3,0.012276290759183826,64,3,1,0.027493185241367724,128,5,1,0.03337467284318362,256.0,5.0,2.0,0.040702970222222246,256.0,3.0,1.0,512,0.3352354101747834,11.0,5,Adam,,,,,,,"{""block_0_dropout"": 0.03730402859979257, ""block_0_filters"": 8, ""block_0_kernel"": 5, ""block_1_dropout"": 0.012276290759183826, ""block_1_filters"": 64, ""block_1_kernel"": 3, ""block_1_stride"": 1, ""block_2_dropout"": 0.027493185241367724, ""block_2_filters"": 128, ""block_2_kernel"": 5, ""block_2_stride"": 1, ""n_blocks"": 5}",PRUNED
60,0.8061586086441339,2026-10-02 12:14:58.939181,2026-10-02 12:17:42.737104,0 days 00:02:43.797923,0.872962644055056,0.9015049510293808,0.0001323550109826847,0.0017156923576483638,64.0,0.04560501247271444,8,5,3,0.01761499366080041,64,3,1,0.037716295641224126,128,5,1,0.04566111271399203,256.0,3.0,2.0,0.04549126032644371,128.0,3.0,1.0,256,0.41861955446964466,11.0,5,Adam,,,,46.0,0.8129272840273462,0.7993899332609217,"{""block_0_dropout"": 0.04560501247271444, ""block_0_filters"": 8, ""block_0_kernel"": 5, ""block_1_dropout"": 0.01761499366080041, ""block_1_filters"": 64, ""block_1_kernel"": 3, ""block_1_stride"": 1, ""block_2_dropout"": 0.037716295641224126, ""block_2_filters"": 128, ""block_2_kernel"": 5, ""block_2_stride"": 1, ""n_blocks"": 5}",COMPLETE
61,0.8294268736261075,2026-10-02 12:17:42.794035,2026-10-02 12:20:27.718937,0 days 00:02:44.924902,0.8567446633425823,0.9055514304095894,0.00028527357395022074,0.0010590493258919194,64.0,0.04914649197532317,8,5,3,0.01367246542728092,64,3,1,0.01809028870182063,128,5,1,0.03673106239406052,128.0,5.0,2.0,0.04625295834863042,256.0,3.0,1.0,256,0.1406540060235671,10.0,5,Adam,,,,42.0,0.8419825978868862,0.8168711493653288,"{""block_0_dropout"": 0.04914649197532317, ""block_0_filters"": 8, ""block_0_kernel"": 5, ""block_1_dropout"": 0.01367246542728092, ""block_1_filters"": 64, ""block_1_kernel"": 3, ""block_1_stride"": 1, ""block_2_dropout"": 0.01809028870182063, ""block_2_filters"": 128, ""block_2_kernel"": 5, ""block_2_stride"": 1, ""n_blocks"": 5}",COMPLETE
