number,value,datetime_start,datetime_complete,duration,params_adam_beta1,params_adam_beta2,params_adam_lr,params_adam_wd,params_batch_size,params_block_0_dropout,params_block_0_filters,params_block_0_kernel,params_block_0_stride,params_block_1_dropout,params_block_1_filters,params_block_1_kernel,params_block_1_stride,params_block_2_dropout,params_block_2_filters,params_block_2_kernel,params_block_2_stride,params_block_3_dropout,params_block_3_filters,params_block_3_kernel,params_block_3_stride,params_block_4_dropout,params_block_4_filters,params_block_4_kernel,params_block_4_stride,params_fc_hidden,params_lr_factor,params_lr_patience,params_n_blocks,params_optimizer,params_sgd_lr,params_sgd_momentum,params_sgd_wd,user_attrs_best_epoch,user_attrs_validation_accuracy,user_attrs_validation_macro_f1,system_attrs_tpe:relative_params:0,state
62,0.7845780266337687,2026-10-02 12:20:27.773530,2026-10-02 12:22:51.671310,0 days 00:02:23.897780,0.8652797485027781,0.9054184003984118,0.00015035043243508505,0.000698069116238626,64.0,0.04704947143368461,8,5,3,0.014736289878141993,64,3,1,0.0351562703375152,128,5,1,0.0369846914176963,128.0,5.0,2.0,,,,,256,0.14713328106744533,9.0,4,Adam,,,,47.0,0.790863890615289,0.7782921626522485,"{""block_0_dropout"": 0.04704947143368461, ""block_0_filters"": 8, ""block_0_kernel"": 5, ""block_1_dropout"": 0.014736289878141993, ""block_1_filters"": 64, ""block_1_kernel"": 3, ""block_1_stride"": 1, ""block_2_dropout"": 0.0351562703375152, ""block_2_filters"": 128, ""block_2_kernel"": 5, ""block_2_stride"": 1, ""n_blocks"": 4}",COMPLETE
63,0.8272302714795594,2026-10-02 12:22:51.728242,2026-10-02 12:25:45.979924,0 days 00:02:54.251682,0.8561770565739694,0.9045812691248245,0.00019361266534296517,0.0011774926007787768,64.0,0.04931685879565537,8,5,3,0.01673858374108969,64,3,1,0.014227872324460775,128,5,1,0.03053430999943381,256.0,5.0,2.0,0.04130794212327665,256.0,3.0,1.0,256,0.21021050766204577,12.0,5,Adam,,,,48.0,0.8357675574891237,0.818692985469995,"{""block_0_dropout"": 0.04931685879565537, ""block_0_filters"": 8, ""block_0_kernel"": 5, ""block_1_dropout"": 0.01673858374108969, ""block_1_filters"": 64, ""block_1_kernel"": 3, ""block_1_stride"": 1, ""block_2_dropout"": 0.014227872324460775, ""block_2_filters"": 128, ""block_2_kernel"": 5, ""block_2_stride"": 1, ""n_blocks"": 5}",COMPLETE
64,0.2913264406445233,2026-10-02 12:25:46.032690,2026-10-02 12:26:18.141831,0 days 00:00:32.109141,0.8637031079096584,0.9000751477924427,0.005507516491483201,5.708445294190706e-06,64.0,0.043456264574522854,8,5,3,0.02075593312197288,64,3,1,0.02994893830518246,128,5,1,0.034108189173670235,128.0,5.0,2.0,0.045779015932883915,256.0,3.0,1.0,256,0.13563506910736234,8.0,5,Adam,,,,,,,"{""block_0_dropout"": 0.043456264574522854, ""block_0_filters"": 8, ""block_0_kernel"": 5, ""block_1_dropout"": 0.02075593312197288, ""block_1_filters"": 64, ""block_1_kernel"": 3, ""block_1_stride"": 1, ""block_2_dropout"": 0.02994893830518246, ""block_2_filters"": 128, ""block_2_kernel"": 5, ""block_2_stride"": 1, ""n_blocks"": 5}",PRUNED
65,0.8114959679081173,2026-10-02 12:26:18.203932,2026-10-02 12:29:00.843946,0 days 00:02:42.640014,0.8775746137944882,0.9060294582774118,0.00035196761537063234,0.0003145745551025678,64.0,0.04391692728953511,8,5,3,0.015867411425640677,64,3,1,0.016730804522043802,128,5,1,0.03656170929255223,128.0,5.0,2.0,0.042639665648500774,256.0,3.0,1.0,256,0.24885118996492636,11.0,5,Adam,,,,49.0,0.8194530764449969,0.8035388593712377,"{""block_0_dropout"": 0.04391692728953511, ""block_0_filters"": 8, ""block_0_kernel"": 5, ""block_1_dropout"": 0.015867411425640677, ""block_1_filters"": 64, ""block_1_kernel"": 3, ""block_1_stride"": 1, ""block_2_dropout"": 0.016730804522043802, ""block_2_filters"": 128, ""block_2_kernel"": 5, ""block_2_stride"": 1, ""n_blocks"": 5}",COMPLETE
66,0.8211714195802233,2026-10-02 12:29:00.921595,2026-10-02 12:31:24.205339,0 days 00:02:23.283744,0.8886132027656957,0.9006339836801747,0.00012117966480278234,0.0006303333919204484,64.0,0.04051697515629102,8,5,3,0.011816275843878014,64,3,1,0.018646400042228322,128,3,1,0.031216845999418354,128.0,5.0,2.0,0.037564441903275354,128.0,3.0,1.0,256,0.18992736653352849,10.0,5,Adam,,,,47.0,0.8311062771908018,0.8112365619696448,"{""block_0_dropout"": 0.04051697515629102, ""block_0_filters"": 8, ""block_0_kernel"": 5, ""block_1_dropout"": 0.011816275843878014, ""block_1_filters"": 64, ""block_1_kernel"": 3, ""block_1_stride"": 1, ""block_2_dropout"": 0.018646400042228322, ""block_2_filters"": 128, ""block_2_kernel"": 3, ""block_2_stride"": 1, ""n_blocks"": 5}",COMPLETE
67,0.355598675288898,2026-10-02 12:31:24.264718,2026-10-02 12:31:58.361768,0 days 00:00:34.097050,,,,,64.0,0.04634221014443277,8,5,3,0.026827823255341728,64,3,1,0.015403726816062044,128,5,1,0.02810288263242982,256.0,5.0,2.0,0.046722769610801726,256.0,3.0,1.0,256,0.314166245228418,9.0,5,SGD,0.00930087711481641,0.9568702603313753,1.2157432772818745e-05,,,,"{""block_0_dropout"": 0.04634221014443277, ""block_0_filters"": 8, ""block_0_kernel"": 5, ""block_1_dropout"": 0.026827823255341728, ""block_1_filters"": 64, ""block_1_kernel"": 3, ""block_1_stride"": 1, ""block_2_dropout"": 0.015403726816062044, ""block_2_filters"": 128, ""block_2_kernel"": 5, ""block_2_stride"": 1, ""n_blocks"": 5}",PRUNED
68,0.821324700602929,2026-10-02 12:31:58.415730,2026-10-02 12:34:41.756466,0 days 00:02:43.340736,0.8559793204723966,0.909843959142195,0.00027649980253221634,0.0013646583211010487,64.0,0.04792885710462021,8,5,3,0.014544236280018854,64,3,1,0.02881814257624222,128,5,1,0.041870400603514296,128.0,5.0,2.0,0.040392984885574856,256.0,3.0,1.0,512,0.18115300255080563,11.0,5,Adam,,,,45.0,0.836544437538844,0.8061049636670138,"{""block_0_dropout"": 0.04792885710462021, ""block_0_filters"": 8, ""block_0_kernel"": 5, ""block_1_dropout"": 0.014544236280018854, ""block_1_filters"": 64, ""block_1_kernel"": 3, ""block_1_stride"": 1, ""block_2_dropout"": 0.02881814257624222, ""block_2_filters"": 128, ""block_2_kernel"": 5, ""block_2_stride"": 1, ""n_blocks"": 5}",COMPLETE
69,0.834645199401122,2026-10-02 12:34:41.814792,2026-10-02 12:37:30.353052,0 days 00:02:48.538260,0.8704888788340696,0.9802340199656439,0.00015346726335977159,0.0028794915227709893,64.0,0.04785618003881448,16,5,3,0.015617733841847918,64,3,1,0.011086445057458042,128,5,1,0.037003237086575734,128.0,5.0,2.0,0.04742036500210498,256.0,3.0,1.0,256,0.12734903438667508,12.0,5,Adam,,,,43.0,0.8422933499067744,0.8269970488954697,"{""block_0_dropout"": 0.04785618003881448, ""block_0_filters"": 16, ""block_0_kernel"": 5, ""block_1_dropout"": 0.015617733841847918, ""block_1_filters"": 64, ""block_1_kernel"": 3, ""block_1_stride"": 1, ""block_2_dropout"": 0.011086445057458042, ""block_2_filters"": 128, ""block_2_kernel"": 5, ""block_2_stride"": 1, ""n_blocks"": 5}",COMPLETE
70,0.8207824795318375,2026-10-02 12:37:30.408508,2026-10-02 12:40:21.525509,0 days 00:02:51.117001,0.8716300861773918,0.9779451013414754,0.0001511924715278075,0.004737311361048006,64.0,0.043327311246512096,8,5,3,0.020541300269199418,64,3,1,0.016417083354782282,128,5,1,0.044947739444660476,128.0,5.0,2.0,0.04769079234789717,512.0,3.0,1.0,256,0.24934821321603287,12.0,5,Adam,,,,46.0,0.8320385332504662,0.8095264258132089,"{""block_0_dropout"": 0.043327311246512096, ""block_0_filters"": 8, ""block_0_kernel"": 5, ""block_1_dropout"": 0.020541300269199418, ""block_1_filters"": 64, ""block_1_kernel"": 3, ""block_1_stride"": 1, ""block_2_dropout"": 0.016417083354782282, ""block_2_filters"": 128, ""block_2_kernel"": 5, ""block_2_stride"": 1, ""n_blocks"": 5}",COMPLETE
71,0.8153631211810679,2026-10-02 12:40:21.582860,2026-10-02 12:43:09.013936,0 days 00:02:47.431076,0.8624581990564376,0.9692090857882538,0.0001935213070457263,0.0027435845129599205,64.0,0.047672199628737214,8,5,3,0.015649825787959887,64,5,1,0.011041658085412843,128,5,1,0.03694157531602646,128.0,5.0,2.0,0.044655839004678656,256.0,3.0,1.0,256,0.13851441150596355,10.0,5,Adam,,,,48.0,0.8247358607830951,0.8059903815790408,"{""block_0_dropout"": 0.047672199628737214, ""block_0_filters"": 8, ""block_0_kernel"": 5, ""block_1_dropout"": 0.015649825787959887, ""block_1_filters"": 64, ""block_1_kernel"": 5, ""block_1_stride"": 1, ""block_2_dropout"": 0.011041658085412843, ""block_2_filters"": 128, ""block_2_kernel"": 5, ""block_2_stride"": 1, ""n_blocks"": 5}",COMPLETE
72,0.8441330975529316,2026-10-02 12:43:09.076008,2026-10-02 12:45:50.997425,0 days 00:02:41.921417,0.8687031226061706,0.9953359710831373,0.00014963157972827207,0.0020596460701561917,64.0,0.045421834345728426,16,5,3,0.016872241373796865,64,3,1,0.01396064732267836,128,5,1,0.03993525046661146,128.0,5.0,2.0,0.047377112547740574,256.0,3.0,1.0,256,0.12360935711646678,12.0,5,Adam,,,,49.0,0.8587632069608453,0.829502988145018,"{""block_0_dropout"": 0.045421834345728426, ""block_0_filters"": 16, ""block_0_kernel"": 5, ""block_1_dropout"": 0.016872241373796865, ""block_1_filters"": 64, ""block_1_kernel"": 3, ""block_1_stride"": 1, ""block_2_dropout"": 0.01396064732267836, ""block_2_filters"": 128, ""block_2_kernel"": 5, ""block_2_stride"": 1, ""n_blocks"": 5}",COMPLETE
73,,2026-10-02 12:45:51.054528,2026-10-02 12:45:51.072295,0 days 00:00:00.017767,,,,,,0.04983244038057867,8,5,3,0.010494570518568693,64,3,2,0.015246232062126394,128,5,1,0.03956576907605451,128.0,5.0,2.0,0.04856892719284841,256.0,3.0,1.0,,,,5,,,,,,,,"{""block_0_dropout"": 0.04983244038057867, ""block_0_filters"": 8, ""block_0_kernel"": 5, ""block_1_dropout"": 0.010494570518568693, ""block_1_filters"": 64, ""block_1_kernel"": 3, ""block_1_stride"": 2, ""block_2_dropout"": 0.015246232062126394, ""block_2_filters"": 128, ""block_2_kernel"": 5, ""block_2_stride"": 1, ""n_blocks"": 5}",PRUNED
74,0.8178077963755244,2026-10-02 12:45:51.123103,2026-10-02 12:48:32.066970,0 days 00:02:40.943867,0.8795228391901838,0.9972864217838484,0.00010376701731548447,0.0020737707496011545,64.0,0.04941714206153194,8,5,3,0.014678123860587748,64,3,1,0.01818144495949538,128,5,1,0.04138770612873976,128.0,5.0,2.0,0.04720292109835135,256.0,3.0,1.0,256,0.20187254042104996,12.0,5,Adam,,,,49.0,0.8289310130515848,0.8066845796994638,"{""block_0_dropout"": 0.04941714206153194, ""block_0_filters"": 8, ""block_0_kernel"": 5, ""block_1_dropout"": 0.014678123860587748, ""block_1_filters"": 64, ""block_1_kernel"": 3, ""block_1_stride"": 1, ""block_2_dropout"": 0.01818144495949538, ""block_2_filters"": 128, ""block_2_kernel"": 5, ""block_2_stride"": 1, ""n_blocks"": 5}",COMPLETE
75,0.8196944284825274,2026-10-02 12:48:32.120478,2026-10-02 12:50:53.030475,0 days 00:02:20.909997,0.8709094466969386,0.9523386564911923,0.00014433500108256952,0.0029442600211891444,128.0,0.0458649493644661,16,5,3,0.016917275855435576,64,3,1,0.013652900492680187,128,5,1,0.037036407358440354,128.0,5.0,2.0,0.04352991896646603,256.0,3.0,1.0,256,0.4231583726412505,10.0,5,Adam,,,,48.0,0.8307955251709136,0.8085933317941411,"{""block_0_dropout"": 0.0458649493644661, ""block_0_filters"": 16, ""block_0_kernel"": 5, ""block_1_dropout"": 0.016917275855435576, ""block_1_filters"": 64, ""block_1_kernel"": 3, ""block_1_stride"": 1, ""block_2_dropout"": 0.013652900492680187, ""block_2_filters"": 128, ""block_2_kernel"": 5, ""block_2_stride"": 1, ""n_blocks"": 5}",COMPLETE
76,0.3228522065860616,2026-10-02 12:50:53.101430,2026-10-02 12:51:25.492800,0 days 00:00:32.391370,0.8860972330522678,0.987042915008987,0.0003988895071298003,0.0054472358879487275,64.0,0.0483259699088642,8,7,3,0.011610398881096847,64,3,1,0.018812938484334782,128,5,1,0.03487051479329435,128.0,5.0,2.0,0.04788301833237686,512.0,3.0,1.0,256,0.12275099336833785,12.0,5,Adam,,,,,,,"{""block_0_dropout"": 0.0483259699088642, ""block_0_filters"": 8, ""block_0_kernel"": 7, ""block_1_dropout"": 0.011610398881096847, ""block_1_filters"": 64, ""block_1_kernel"": 3, ""block_1_stride"": 1, ""block_2_dropout"": 0.018812938484334782, ""block_2_filters"": 128, ""block_2_kernel"": 5, ""block_2_stride"": 1, ""n_blocks"": 5}",PRUNED
77,0.4044789898522525,2026-10-02 12:51:25.549433,2026-10-02 12:52:12.487227,0 days 00:00:46.937794,0.9610416653669585,0.9962988237086494,0.00030074577185048836,0.0011421981628755543,64.0,0.0441980432200695,16,5,3,0.012368508555622168,64,3,1,0.010743716938387302,128,5,1,0.03960092413592024,128.0,5.0,1.0,0.0413162829849658,128.0,3.0,1.0,512,0.17198810441482726,19.0,5,Adam,,,,,,,"{""block_0_dropout"": 0.0441980432200695, ""block_0_filters"": 16, ""block_0_kernel"": 5, ""block_1_dropout"": 0.012368508555622168, ""block_1_filters"": 64, ""block_1_kernel"": 3, ""block_1_stride"": 1, ""block_2_dropout"": 0.010743716938387302, ""block_2_filters"": 128, ""block_2_kernel"": 5, ""block_2_stride"": 1, ""n_blocks"": 5}",PRUNED
78,0.8270256181626792,2026-10-02 12:52:12.546410,2026-10-02 12:55:00.081687,0 days 00:02:47.535277,0.856057411788496,0.9812451419805909,0.00020830233702992122,0.0037048711340308045,64.0,0.04843332382259226,32,5,3,0.021509384420460752,64,3,1,0.010648701817069905,128,5,1,0.035665329331757194,128.0,5.0,2.0,0.0390449023222165,256.0,3.0,1.0,256,0.12180162142073268,14.0,5,Adam,,,,45.0,0.8410503418272218,0.8130008944981366,"{""block_0_dropout"": 0.04843332382259226, ""block_0_filters"": 32, ""block_0_kernel"": 5, ""block_1_dropout"": 0.021509384420460752, ""block_1_filters"": 64, ""block_1_kernel"": 3, ""block_1_stride"": 1, ""block_2_dropout"": 0.010648701817069905, ""block_2_filters"": 128, ""block_2_kernel"": 5, ""block_2_stride"": 1, ""n_blocks"": 5}",COMPLETE
79,0.3725859964205574,2026-10-02 12:55:00.134817,2026-10-02 12:55:31.870871,0 days 00:00:31.736054,,,,,64.0,0.04317438709020462,16,5,3,0.021817027681310962,64,3,1,0.012589745388988886,128,5,1,0.04760504830478986,128.0,5.0,2.0,0.049744202071786335,256.0,3.0,1.0,256,0.23580244482660212,9.0,5,SGD,0.0022017721798304776,0.867807369677136,0.0007438424438138287,,,,"{""block_0_dropout"": 0.04317438709020462, ""block_0_filters"": 16, ""block_0_kernel"": 5, ""block_1_dropout"": 0.021817027681310962, ""block_1_filters"": 64, ""block_1_kernel"": 3, ""block_1_stride"": 1, ""block_2_dropout"": 0.012589745388988886, ""block_2_filters"": 128, ""block_2_kernel"": 5, ""block_2_stride"": 1, ""n_blocks"": 5}",PRUNED
80,0.6170204337499867,2026-10-02 12:55:31.993416,2026-10-02 12:56:39.289894,0 days 00:01:07.296478,0.8502076847126522,0.964348393597753,0.00011856480282336681,0.0017019720380589969,128.0,0.04662630147078254,16,5,3,0.019920349523283705,64,3,1,0.015364059835699684,128,5,1,0.04401912552064207,128.0,5.0,2.0,0.020371520100662774,256.0,3.0,1.0,256,0.38812765296478385,11.0,5,Adam,,,,,,,"{""block_0_dropout"": 0.04662630147078254, ""block_0_filters"": 16, ""block_0_kernel"": 5, ""block_1_dropout"": 0.019920349523283705, ""block_1_filters"": 64, ""block_1_kernel"": 3, ""block_1_stride"": 1, ""block_2_dropout"": 0.015364059835699684, ""block_2_filters"": 128, ""block_2_kernel"": 5, ""block_2_stride"": 1, ""n_blocks"": 5}",PRUNED
81,0.8466004728375085,2026-10-02 12:56:39.343563,2026-10-02 12:59:35.499653,0 days 00:02:56.156090,0.8686457539314663,0.9927330266437444,0.00016888949758226896,0.0008307585630933612,64.0,0.04383702866999049,16,7,3,0.014857689271126972,64,3,1,0.01350744956802447,128,5,1,0.03335184249758063,256.0,5.0,2.0,0.04582217801005317,256.0,3.0,1.0,256,0.14879295330042638,11.0,5,Adam,,,,43.0,0.857986326911125,0.8352146187638919,"{""block_0_dropout"": 0.04383702866999049, ""block_0_filters"": 16, ""block_0_kernel"": 7, ""block_1_dropout"": 0.014857689271126972, ""block_1_filters"": 64, ""block_1_kernel"": 3, ""block_1_stride"": 1, ""block_2_dropout"": 0.01350744956802447, ""block_2_filters"": 128, ""block_2_kernel"": 5, ""block_2_stride"": 1, ""n_blocks"": 5}",COMPLETE
82,0.8227485634634331,2026-10-02 12:59:35.555543,2026-10-02 13:02:18.175012,0 days 00:02:42.619469,0.8698770322635361,0.9927262072093712,0.0001635921908811001,0.0008826321316685265,64.0,0.042097634675450926,16,5,3,0.017769359182271464,64,3,1,0.014132342779277404,128,5,1,0.03361713168696808,128.0,5.0,2.0,0.04646566407998684,256.0,3.0,1.0,256,0.1001650370702556,10.0,5,Adam,,,,45.0,0.8335922933499068,0.8119048335769594,"{""block_0_dropout"": 0.042097634675450926, ""block_0_filters"": 16, ""block_0_kernel"": 5, ""block_1_dropout"": 0.017769359182271464, ""block_1_filters"": 64, ""block_1_kernel"": 3, ""block_1_stride"": 1, ""block_2_dropout"": 0.014132342779277404, ""block_2_filters"": 128, ""block_2_kernel"": 5, ""block_2_stride"": 1, ""n_blocks"": 5}",COMPLETE
83,0.8433076740060408,2026-10-02 13:02:18.233650,2026-10-02 13:05:01.278023,0 days 00:02:43.044373,0.8787916505541601,0.9918592230576637,0.0002356842461749084,0.0013965473122295323,64.0,0.04218223818045392,16,5,3,0.017859338047246175,64,3,1,0.019290833411559745,128,5,1,0.04103415349840925,128.0,5.0,2.0,0.044102494851211954,256.0,3.0,1.0,256,0.13257712378174535,13.0,5,Adam,,,,43.0,0.853480422622747,0.8331349253893345,"{""block_0_dropout"": 0.04218223818045392, ""block_0_filters"": 16, ""block_0_kernel"": 5, ""block_1_dropout"": 0.017859338047246175, ""block_1_filters"": 64, ""block_1_kernel"": 3, ""block_1_stride"": 1, ""block_2_dropout"": 0.019290833411559745, ""block_2_filters"": 128, ""block_2_kernel"": 5, ""block_2_stride"": 1, ""n_blocks"": 5}",COMPLETE
84,0.827630625504685,2026-10-02 13:05:01.349039,2026-10-02 13:07:44.919418,0 days 00:02:43.570379,0.8790223331106681,0.9927176039541953,0.00013912132508690122,0.0005211195966291222,64.0,0.043717589703694305,8,5,3,0.016250790183229013,64,3,1,0.022068777968087032,128,5,1,0.04039582180441046,128.0,5.0,2.0,0.04239970673352637,256.0,3.0,1.0,256,0.13193751432120857,13.0,5,Adam,,,,49.0,0.8416718458669982,0.8135894051423718,"{""block_0_dropout"": 0.043717589703694305, ""block_0_filters"": 8, ""block_0_kernel"": 5, ""block_1_dropout"": 0.016250790183229013, ""block_1_filters"": 64, ""block_1_kernel"": 3, ""block_1_stride"": 1, ""block_2_dropout"": 0.022068777968087032, ""block_2_filters"": 128, ""block_2_kernel"": 5, ""block_2_stride"": 1, ""n_blocks"": 5}",COMPLETE
85,0.8287250076235693,2026-10-02 13:07:44.975602,2026-10-02 13:11:07.881898,0 days 00:03:22.906296,0.8920420379771787,0.9835431418382969,0.00020961544656102952,0.001368195861728711,64.0,0.041591605767497895,16,7,3,0.016676407553079125,64,3,1,0.011183479934547583,128,5,1,0.03722581875053974,256.0,3.0,2.0,0.04824775055609923,512.0,3.0,1.0,256,0.21040787147116483,13.0,5,Adam,,,,47.0,0.8359229334990678,0.8215270817480709,"{""block_0_dropout"": 0.041591605767497895, ""block_0_filters"": 16, ""block_0_kernel"": 7, ""block_1_dropout"": 0.016676407553079125, ""block_1_filters"": 64, ""block_1_kernel"": 3, ""block_1_stride"": 1, ""block_2_dropout"": 0.011183479934547583, ""block_2_filters"": 128, ""block_2_kernel"": 5, ""block_2_stride"": 1, ""n_blocks"": 5}",COMPLETE
86,0.8180982855349661,2026-10-02 13:11:07.938673,2026-10-02 13:13:20.660986,0 days 00:02:12.722313,0.8828462846416029,0.9992113683233098,0.00017558922315331175,0.0002736358884449601,200.0,0.03940974418124852,16,7,3,0.018852766835534638,64,3,1,0.0140167560760479,128,5,1,0.04242963345861601,128.0,5.0,2.0,0.03602335621982342,256.0,3.0,1.0,256,0.1246296088728202,13.0,5,Adam,,,,50.0,0.8247358607830951,0.8114607102868371,"{""block_0_dropout"": 0.03940974418124852, ""block_0_filters"": 16, ""block_0_kernel"": 7, ""block_1_dropout"": 0.018852766835534638, ""block_1_filters"": 64, ""block_1_kernel"": 3, ""block_1_stride"": 1, ""block_2_dropout"": 0.0140167560760479, ""block_2_filters"": 128, ""block_2_kernel"": 5, ""block_2_stride"": 1, ""n_blocks"": 5}",COMPLETE
87,0.5105607133801114,2026-10-02 13:13:20.716928,2026-10-02 13:14:13.347909,0 days 00:00:52.630981,0.8760538552261211,0.9922218796967218,0.00036888337866011495,0.0006107753326759451,64.0,0.04876464102095755,16,7,3,0.01808588126972801,64,3,1,0.01083150068049597,128,5,1,0.035536546246739915,128.0,5.0,2.0,0.04453183805522246,256.0,3.0,1.0,256,0.1541771952413081,11.0,5,Adam,,,,,,,"{""block_0_dropout"": 0.04876464102095755, ""block_0_filters"": 16, ""block_0_kernel"": 7, ""block_1_dropout"": 0.01808588126972801, ""block_1_filters"": 64, ""block_1_kernel"": 3, ""block_1_stride"": 1, ""block_2_dropout"": 0.01083150068049597, ""block_2_filters"": 128, ""block_2_kernel"": 5, ""block_2_stride"": 1, ""n_blocks"": 5}",PRUNED
88,0.38859122345454816,2026-10-02 13:14:13.410971,2026-10-02 13:15:04.278843,0 days 00:00:50.867872,0.8686830104978047,0.9851052925190897,0.00028776871089863313,0.000896351676436358,200.0,0.04478247719103485,16,7,3,0.015538871021753243,64,3,1,0.01921537615229784,128,5,1,0.04100085611587392,128.0,5.0,1.0,0.03864634191343136,256.0,3.0,1.0,256,0.19200773340700278,12.0,5,Adam,,,,,,,"{""block_0_dropout"": 0.04478247719103485, ""block_0_filters"": 16, ""block_0_kernel"": 7, ""block_1_dropout"": 0.015538871021753243, ""block_1_filters"": 64, ""block_1_kernel"": 3, ""block_1_stride"": 1, ""block_2_dropout"": 0.01921537615229784, ""block_2_filters"": 128, ""block_2_kernel"": 5, ""block_2_stride"": 1, ""n_blocks"": 5}",PRUNED
89,0.8197006788383846,2026-10-02 13:15:04.338392,2026-10-02 13:17:51.576496,0 days 00:02:47.238104,0.8668048091539017,0.9757134709233245,0.00011336054269605143,0.0036526065888099874,64.0,0.03134969087428419,8,5,3,0.01807482224111224,64,3,1,0.016412157106858956,128,5,1,0.04410882651582066,128.0,5.0,2.0,0.046542249219330395,256.0,3.0,1.0,256,0.10041501268952938,12.0,5,Adam,,,,47.0,0.8311062771908018,0.8082950804859674,"{""block_0_dropout"": 0.03134969087428419, ""block_0_filters"": 8, ""block_0_kernel"": 5, ""block_1_dropout"": 0.01807482224111224, ""block_1_filters"": 64, ""block_1_kernel"": 3, ""block_1_stride"": 1, ""block_2_dropout"": 0.016412157106858956, ""block_2_filters"": 128, ""block_2_kernel"": 5, ""block_2_stride"": 1, ""n_blocks"": 5}",COMPLETE
