number,value,datetime_start,datetime_complete,duration,params_adam_beta1,params_adam_beta2,params_adam_lr,params_adam_wd,params_batch_size,params_block_0_dropout,params_block_0_filters,params_block_0_kernel,params_block_0_stride,params_block_1_dropout,params_block_1_filters,params_block_1_kernel,params_block_1_stride,params_block_2_dropout,params_block_2_filters,params_block_2_kernel,params_block_2_stride,params_block_3_dropout,params_block_3_filters,params_block_3_kernel,params_block_3_stride,params_block_4_dropout,params_block_4_filters,params_block_4_kernel,params_block_4_stride,params_fc_hidden,params_lr_factor,params_lr_patience,params_n_blocks,params_optimizer,params_sgd_lr,params_sgd_momentum,params_sgd_wd,user_attrs_best_epoch,user_attrs_validation_accuracy,user_attrs_validation_macro_f1,system_attrs_tpe:relative_params:0,state
0,0.30031324029694295,2026-10-02 10:38:43.600447,2026-10-02 10:40:08.062892,0 days 00:01:24.462445,,,,,128.0,0.012323344486727979,8,7,3,0.017336180394137354,16,5,2,0.02465447373174767,64,3,1,0.016820964947491662,128.0,3.0,1.0,,,,,512,0.19763058787582308,12.0,4,SGD,0.00019634341572933326,0.8984275776885255,5.762487216478604e-05,49.0,0.3141702921068987,0.2864561884869873,,COMPLETE
1,0.3145827365415561,2026-10-02 10:40:08.117386,2026-10-02 10:41:48.036573,0 days 00:01:39.919187,,,,,128.0,0.041005312934444586,32,5,3,0.02554709158757928,16,7,1,0.012982025747190833,64,3,1,0.04085081386743783,64.0,3.0,1.0,,,,,256,0.36014665762139764,16.0,4,SGD,0.0009833181933644897,0.7184319215829468,1.753594952976443e-05,44.0,0.3259788688626476,0.30318660422046456,,COMPLETE
2,0.38113588951967203,2026-10-02 10:41:48.093284,2026-10-02 10:43:06.275884,0 days 00:01:18.182600,0.9754527819892891,0.9317685471496893,0.0011986281799901185,0.0016973078532467015,200.0,0.030909313175279764,16,7,3,0.019971689165955,16,5,1,0.04232481518257668,64,3,1,,,,,,,,,256,0.18804153962214143,8.0,3,Adam,,,,48.0,0.3879738968303294,0.3742978822090146,,COMPLETE
3,0.5867782232240625,2026-10-02 10:43:06.332580,2026-10-02 10:45:05.350368,0 days 00:01:59.017788,0.9519502888056603,0.9367415349586534,0.003336101309469784,8.923807143379781e-06,200.0,0.04771638815650077,8,5,3,0.022035132392670787,64,5,1,0.019582475626678898,128,5,1,,,,,,,,,512,0.6058446644748636,15.0,3,Adam,,,,49.0,0.5849906774394034,0.5885657690087216,,COMPLETE
4,0.38266158505214537,2026-10-02 10:45:05.448343,2026-10-02 10:46:46.304563,0 days 00:01:40.856220,,,,,64.0,0.03048372233197124,32,7,3,0.014538940849623563,32,3,1,0.01967409163601807,32,3,2,,,,,,,,,512,0.8096691394120938,17.0,3,SGD,0.0011159088550343414,0.9105271468723695,0.0038765111709116325,47.0,0.3931013051584835,0.3722218649458072,,COMPLETE
5,,2026-10-02 10:46:46.360265,2026-10-02 10:46:46.373660,0 days 00:00:00.013395,,,,,,0.016432322056699946,8,7,3,0.035985315961888587,32,5,1,0.048920422190097824,32,3,2,0.01780971951192178,128.0,5.0,2.0,0.03581889183628671,128.0,3.0,1.0,,,,5,,,,,,,,,PRUNED
6,,2026-10-02 10:46:46.425655,2026-10-02 10:46:46.433674,0 days 00:00:00.008019,,,,,,0.04713274250350902,16,7,3,0.0167797098674437,32,7,2,0.015603360609460961,64,5,1,,,,,,,,,,,,3,,,,,,,,,PRUNED
7,,2026-10-02 10:46:46.483919,2026-10-02 10:46:46.493270,0 days 00:00:00.009351,,,,,,0.021743673770579737,8,7,3,0.038078675090308135,64,7,2,0.02862392072529841,64,5,2,0.015082420506075393,256.0,3.0,2.0,,,,,,,,4,,,,,,,,,PRUNED
8,,2026-10-02 10:46:46.544923,2026-10-02 10:46:46.558490,0 days 00:00:00.013567,,,,,,0.03125418526272592,8,7,3,0.027558856828225446,64,7,2,0.016257481706843442,128,5,2,0.032174162100456025,256.0,5.0,2.0,,,,,,,,4,,,,,,,,,PRUNED
9,,2026-10-02 10:46:46.622528,2026-10-02 10:46:46.636527,0 days 00:00:00.013999,,,,,,0.01464290562027665,8,7,3,0.016928074796400606,64,7,2,0.030125450343203505,128,5,1,0.04760920965699831,64.0,3.0,1.0,,,,,,,,4,,,,,,,,,PRUNED
10,0.5718043478439618,2026-10-02 10:46:46.697807,2026-10-02 10:48:45.297628,0 days 00:01:58.599821,0.9079517194939879,0.9627768386841636,0.009444811794638241,1.5681694641610638e-06,200.0,0.04036207752276006,32,5,3,0.013699189578280573,64,3,1,0.013446685364581459,128,5,1,,,,,,,,,128,0.8155565840291188,20.0,3,Adam,,,,48.0,0.5663455562461156,0.577263139441808,"{""block_0_dropout"": 0.04036207752276006, ""block_0_filters"": 32, ""block_0_kernel"": 5, ""block_1_dropout"": 0.013699189578280573, ""block_1_filters"": 64, ""block_1_kernel"": 3, ""block_1_stride"": 1, ""block_2_dropout"": 0.013446685364581459, ""block_2_filters"": 128, ""block_2_kernel"": 5, ""block_2_stride"": 1, ""n_blocks"": 3}",COMPLETE
11,0.4531266823990492,2026-10-02 10:48:45.361116,2026-10-02 10:50:16.198602,0 days 00:01:30.837486,0.9250098755312106,0.9537484795905934,0.00960994055704251,1.5530519390924744e-06,200.0,0.031203171371680355,32,5,3,0.012287072940566609,64,3,1,0.014801873104301276,32,5,1,,,,,,,,,128,0.7775968987109323,20.0,3,Adam,,,,46.0,0.4538533250466128,0.45240003975148557,"{""block_0_dropout"": 0.031203171371680355, ""block_0_filters"": 32, ""block_0_kernel"": 5, ""block_1_dropout"": 0.012287072940566609, ""block_1_filters"": 64, ""block_1_kernel"": 3, ""block_1_stride"": 1, ""block_2_dropout"": 0.014801873104301276, ""block_2_filters"": 32, ""block_2_kernel"": 5, ""block_2_stride"": 1, ""n_blocks"": 3}",COMPLETE
12,0.5021207117941348,2026-10-02 10:50:16.251488,2026-10-02 10:52:01.750099,0 days 00:01:45.498611,0.8803589415775793,0.988665254922613,0.007683307692264288,2.385153804750212e-06,200.0,0.04422035953099479,8,5,3,0.01742968798925993,64,7,1,0.01739631759436531,128,3,1,,,,,,,,,128,0.6154498750504773,20.0,3,Adam,,,,49.0,0.5038844002486016,0.5003570233396679,"{""block_0_dropout"": 0.04422035953099479, ""block_0_filters"": 8, ""block_0_kernel"": 5, ""block_1_dropout"": 0.01742968798925993, ""block_1_filters"": 64, ""block_1_kernel"": 7, ""block_1_stride"": 1, ""block_2_dropout"": 0.01739631759436531, ""block_2_filters"": 128, ""block_2_kernel"": 3, ""block_2_stride"": 1, ""n_blocks"": 3}",COMPLETE
13,,2026-10-02 10:52:01.811286,2026-10-02 10:52:01.835814,0 days 00:00:00.024528,,,,,,0.039479442432784506,8,5,3,0.030904042098632716,64,5,2,0.02812134517058052,128,5,1,,,,,,,,,,,,3,,,,,,,,"{""block_0_dropout"": 0.039479442432784506, ""block_0_filters"": 8, ""block_0_kernel"": 5, ""block_1_dropout"": 0.030904042098632716, ""block_1_filters"": 64, ""block_1_kernel"": 5, ""block_1_stride"": 2, ""block_2_dropout"": 0.02812134517058052, ""block_2_filters"": 128, ""block_2_kernel"": 5, ""block_2_stride"": 1, ""n_blocks"": 3}",PRUNED
14,0.5639917185800905,2026-10-02 10:52:01.976784,2026-10-02 10:53:51.152631,0 days 00:01:49.175847,0.9360364420157866,0.9545495628657985,0.002474959199039115,1.4026979990955342e-05,200.0,0.04481565671596139,8,7,3,0.011238023104286801,64,3,1,0.030196082120544577,128,5,1,,,,,,,,,512,0.5533579516648615,14.0,3,Adam,,,,49.0,0.5629272840273462,0.5650561531328346,"{""block_0_dropout"": 0.04481565671596139, ""block_0_filters"": 8, ""block_0_kernel"": 7, ""block_1_dropout"": 0.011238023104286801, ""block_1_filters"": 64, ""block_1_kernel"": 3, ""block_1_stride"": 1, ""block_2_dropout"": 0.030196082120544577, ""block_2_filters"": 128, ""block_2_kernel"": 5, ""block_2_stride"": 1, ""n_blocks"": 3}",COMPLETE
15,0.7107085591001563,2026-10-02 10:53:51.204936,2026-10-02 10:55:57.039632,0 days 00:02:05.834696,0.9061352732713149,0.904315764869144,0.0032890677899770813,3.2949000789371815e-05,200.0,0.0242034051928445,8,5,3,0.014919563937216569,64,3,1,0.017978754584460188,128,5,1,0.028616837093783966,64.0,5.0,2.0,,,,,128,0.8871741312503645,10.0,4,Adam,,,,45.0,0.7106898694841517,0.710727248716161,"{""block_0_dropout"": 0.0242034051928445, ""block_0_filters"": 8, ""block_0_kernel"": 5, ""block_1_dropout"": 0.014919563937216569, ""block_1_filters"": 64, ""block_1_kernel"": 3, ""block_1_stride"": 1, ""block_2_dropout"": 0.017978754584460188, ""block_2_filters"": 128, ""block_2_kernel"": 5, ""block_2_stride"": 1, ""n_blocks"": 4}",COMPLETE
16,0.3418610784389187,2026-10-02 10:55:57.111038,2026-10-02 10:56:39.031906,0 days 00:00:41.920868,0.8515050923965366,0.9005973932797255,0.00016726582362148679,6.586606989815088e-05,64.0,0.01549816515365481,8,5,3,0.018400642703093828,64,3,1,0.016398419575366294,128,5,1,,,,,,,,,128,0.5982810805775545,5.0,3,Adam,,,,,,,"{""block_0_dropout"": 0.01549816515365481, ""block_0_filters"": 8, ""block_0_kernel"": 5, ""block_1_dropout"": 0.018400642703093828, ""block_1_filters"": 64, ""block_1_kernel"": 3, ""block_1_stride"": 1, ""block_2_dropout"": 0.016398419575366294, ""block_2_filters"": 128, ""block_2_kernel"": 5, ""block_2_stride"": 1, ""n_blocks"": 3}",PRUNED
17,0.5799865488949155,2026-10-02 10:56:39.085058,2026-10-02 10:58:34.177841,0 days 00:01:55.092783,0.9735512433945706,0.9011118842116314,0.0017617118629004902,8.282455490889113e-05,200.0,0.02430203942108962,16,5,3,0.013080411065254292,64,3,1,0.02793242980705086,128,5,1,,,,,,,,,512,0.4018590061034555,9.0,3,Adam,,,,49.0,0.5747358607830951,0.5852372370067359,"{""block_0_dropout"": 0.02430203942108962, ""block_0_filters"": 16, ""block_0_kernel"": 5, ""block_1_dropout"": 0.013080411065254292, ""block_1_filters"": 64, ""block_1_kernel"": 3, ""block_1_stride"": 1, ""block_2_dropout"": 0.02793242980705086, ""block_2_filters"": 128, ""block_2_kernel"": 5, ""block_2_stride"": 1, ""n_blocks"": 3}",COMPLETE
18,0.7357793741727172,2026-10-02 10:58:34.232073,2026-10-02 11:00:42.425705,0 days 00:02:08.193632,0.9456681578622963,0.926954099552343,0.0028527009754909303,2.2006479137781834e-05,200.0,0.03485938067964825,8,5,3,0.025978721612393868,64,3,1,0.020731012639323313,128,5,1,0.029866212810640048,64.0,5.0,2.0,,,,,512,0.6882184882451937,11.0,4,Adam,,,,50.0,0.7405220633934121,0.7310366849520223,"{""block_0_dropout"": 0.03485938067964825, ""block_0_filters"": 8, ""block_0_kernel"": 5, ""block_1_dropout"": 0.025978721612393868, ""block_1_filters"": 64, ""block_1_kernel"": 3, ""block_1_stride"": 1, ""block_2_dropout"": 0.020731012639323313, ""block_2_filters"": 128, ""block_2_kernel"": 5, ""block_2_stride"": 1, ""n_blocks"": 4}",COMPLETE
19,0.8082213155927731,2026-10-02 11:00:42.483630,2026-10-02 11:03:01.241635,0 days 00:02:18.758005,0.8986591133906017,0.9205948938628772,0.0005841316832930559,0.0001331454993435141,200.0,0.027238492907093723,8,5,3,0.033358765389447945,64,3,1,0.0182538638255587,128,5,1,0.029479454081967314,64.0,5.0,2.0,0.010404039518868473,512.0,3.0,1.0,128,0.8720764431584729,11.0,5,Adam,,,,50.0,0.814791796146675,0.8016508350388712,"{""block_0_dropout"": 0.027238492907093723, ""block_0_filters"": 8, ""block_0_kernel"": 5, ""block_1_dropout"": 0.033358765389447945, ""block_1_filters"": 64, ""block_1_kernel"": 3, ""block_1_stride"": 1, ""block_2_dropout"": 0.0182538638255587, ""block_2_filters"": 128, ""block_2_kernel"": 5, ""block_2_stride"": 1, ""n_blocks"": 5}",COMPLETE
20,,2026-10-02 11:03:01.295051,2026-10-02 11:03:01.316640,0 days 00:00:00.021589,,,,,,0.027399985532792746,8,5,3,0.0380544482027754,64,3,2,0.013479359503709976,128,5,1,0.029428203260591073,64.0,5.0,2.0,0.01060460045247686,512.0,3.0,1.0,,,,5,,,,,,,,"{""block_0_dropout"": 0.027399985532792746, ""block_0_filters"": 8, ""block_0_kernel"": 5, ""block_1_dropout"": 0.0380544482027754, ""block_1_filters"": 64, ""block_1_kernel"": 3, ""block_1_stride"": 2, ""block_2_dropout"": 0.013479359503709976, ""block_2_filters"": 128, ""block_2_kernel"": 5, ""block_2_stride"": 1, ""n_blocks"": 5}",PRUNED
21,0.7561371984271532,2026-10-02 11:03:01.471761,2026-10-02 11:05:06.758118,0 days 00:02:05.286357,0.8943512263399774,0.9206244710637181,0.0005080394225881807,0.00016168170287363714,200.0,0.030836190990247633,8,5,3,0.024941316135041927,64,3,1,0.019318210715255326,128,5,1,0.029137578465885224,64.0,5.0,2.0,,,,,128,0.8963457494493953,11.0,4,Adam,,,,50.0,0.7527967681789932,0.7594776286753133,"{""block_0_dropout"": 0.030836190990247633, ""block_0_filters"": 8, ""block_0_kernel"": 5, ""block_1_dropout"": 0.024941316135041927, ""block_1_filters"": 64, ""block_1_kernel"": 3, ""block_1_stride"": 1, ""block_2_dropout"": 0.019318210715255326, ""block_2_filters"": 128, ""block_2_kernel"": 5, ""block_2_stride"": 1, ""n_blocks"": 4}",COMPLETE
22,0.7883751895239619,2026-10-02 11:05:06.815360,2026-10-02 11:07:12.217290,0 days 00:02:05.401930,0.8849594376450796,0.9233989625323518,0.0005008803603538381,0.00039764025484902496,200.0,0.034955581337100174,8,5,3,0.022894240809360127,64,3,1,0.013156573241138544,128,5,1,0.026055142727369,64.0,5.0,2.0,,,,,128,0.7077909413157396,12.0,4,Adam,,,,46.0,0.7949036668738346,0.7818467121740893,"{""block_0_dropout"": 0.034955581337100174, ""block_0_filters"": 8, ""block_0_kernel"": 5, ""block_1_dropout"": 0.022894240809360127, ""block_1_filters"": 64, ""block_1_kernel"": 3, ""block_1_stride"": 1, ""block_2_dropout"": 0.013156573241138544, ""block_2_filters"": 128, ""block_2_kernel"": 5, ""block_2_stride"": 1, ""n_blocks"": 4}",COMPLETE
23,0.7722813234961117,2026-10-02 11:07:12.283802,2026-10-02 11:09:18.335823,0 days 00:02:06.052021,0.8830616427106369,0.9205840071731343,0.00043307309736090766,0.0004021188328064561,200.0,0.037804000674852976,16,5,3,0.01756838270375589,64,3,1,0.01741844589114832,128,5,1,0.023564152443352925,64.0,5.0,2.0,,,,,128,0.8852807500899943,13.0,4,Adam,,,,46.0,0.7745494095711623,0.770013237421061,"{""block_0_dropout"": 0.037804000674852976, ""block_0_filters"": 16, ""block_0_kernel"": 5, ""block_1_dropout"": 0.01756838270375589, ""block_1_filters"": 64, ""block_1_kernel"": 3, ""block_1_stride"": 1, ""block_2_dropout"": 0.01741844589114832, ""block_2_filters"": 128, ""block_2_kernel"": 5, ""block_2_stride"": 1, ""n_blocks"": 4}",COMPLETE
24,0.7736825554848508,2026-10-02 11:09:18.394898,2026-10-02 11:11:37.114996,0 days 00:02:18.720098,0.8685804148695696,0.9189848198909898,0.0004296931749340161,0.0006616793528461299,64.0,0.046030000437663234,8,5,3,0.01635707016842456,64,3,1,0.022098155106111496,128,5,1,0.021750890313392633,64.0,5.0,2.0,,,,,128,0.7202997811218196,13.0,4,Adam,,,,46.0,0.7793660658794282,0.7679990450902733,"{""block_0_dropout"": 0.046030000437663234, ""block_0_filters"": 8, ""block_0_kernel"": 5, ""block_1_dropout"": 0.01635707016842456, ""block_1_filters"": 64, ""block_1_kernel"": 3, ""block_1_stride"": 1, ""block_2_dropout"": 0.022098155106111496, ""block_2_filters"": 128, ""block_2_kernel"": 5, ""block_2_stride"": 1, ""n_blocks"": 4}",COMPLETE
25,0.26977708297064806,2026-10-02 11:11:37.174275,2026-10-02 11:12:07.260615,0 days 00:00:30.086340,,,,,64.0,0.04943848606652388,8,5,3,0.02225807610262216,64,3,1,0.024650994791914887,128,5,1,0.02267003444325665,64.0,5.0,2.0,0.04745643964803738,512.0,3.0,1.0,128,0.7200520956024111,7.0,5,SGD,0.06197185425347531,0.7007966917861643,0.006716161194385709,,,,"{""block_0_dropout"": 0.04943848606652388, ""block_0_filters"": 8, ""block_0_kernel"": 5, ""block_1_dropout"": 0.02225807610262216, ""block_1_filters"": 64, ""block_1_kernel"": 3, ""block_1_stride"": 1, ""block_2_dropout"": 0.024650994791914887, ""block_2_filters"": 128, ""block_2_kernel"": 5, ""block_2_stride"": 1, ""n_blocks"": 5}",PRUNED
26,0.30332175854920185,2026-10-02 11:12:07.315283,2026-10-02 11:12:39.210619,0 days 00:00:31.895336,0.8604590911793965,0.9141723396682543,0.0004687498993371795,0.0010490841810087814,64.0,0.038321744213849415,8,5,3,0.0348380837706589,64,7,1,0.01001888056027194,128,5,1,0.03603561336500253,64.0,5.0,2.0,,,,,128,0.6974202430368267,13.0,4,Adam,,,,,,,"{""block_0_dropout"": 0.038321744213849415, ""block_0_filters"": 8, ""block_0_kernel"": 5, ""block_1_dropout"": 0.0348380837706589, ""block_1_filters"": 64, ""block_1_kernel"": 7, ""block_1_stride"": 1, ""block_2_dropout"": 0.01001888056027194, ""block_2_filters"": 128, ""block_2_kernel"": 5, ""block_2_stride"": 1, ""n_blocks"": 4}",PRUNED
27,0.7548079731398962,2026-10-02 11:12:39.267307,2026-10-02 11:15:05.937105,0 days 00:02:26.669798,0.8697818485989663,0.9397149663969525,0.00022473910171768343,0.007107679767369473,64.0,0.042516272510717136,8,5,3,0.027189831541186836,32,3,1,0.023495848312938036,128,5,1,0.023338288061568173,64.0,5.0,2.0,0.012569562819849719,256.0,3.0,1.0,128,0.5031007144760494,12.0,5,Adam,,,,49.0,0.7566811684275948,0.7529347778521978,"{""block_0_dropout"": 0.042516272510717136, ""block_0_filters"": 8, ""block_0_kernel"": 5, ""block_1_dropout"": 0.027189831541186836, ""block_1_filters"": 32, ""block_1_kernel"": 3, ""block_1_stride"": 1, ""block_2_dropout"": 0.023495848312938036, ""block_2_filters"": 128, ""block_2_kernel"": 5, ""block_2_stride"": 1, ""n_blocks"": 5}",COMPLETE
28,0.7215878976669412,2026-10-02 11:15:05.994389,2026-10-02 11:17:26.971850,0 days 00:02:20.977461,0.8955350718784068,0.9159874516783725,0.0009201099410217315,0.0005178222688672971,128.0,0.04155258588648163,8,5,3,0.01783976233890539,64,3,1,0.025506267319783206,128,5,1,0.0110832187727657,256.0,5.0,2.0,,,,,256,0.7490149091797693,10.0,4,Adam,,,,48.0,0.7198570540708514,0.7233187412630311,"{""block_0_dropout"": 0.04155258588648163, ""block_0_filters"": 8, ""block_0_kernel"": 5, ""block_1_dropout"": 0.01783976233890539, ""block_1_filters"": 64, ""block_1_kernel"": 3, ""block_1_stride"": 1, ""block_2_dropout"": 0.025506267319783206, ""block_2_filters"": 128, ""block_2_kernel"": 5, ""block_2_stride"": 1, ""n_blocks"": 4}",COMPLETE
29,0.7419821483727966,2026-10-02 11:17:27.026412,2026-10-02 11:22:57.099850,0 days 00:05:30.073438,0.8767185929765451,0.9437513644015448,0.00031177766405951745,0.00023579258500831048,64.0,0.026214931422121564,8,5,3,0.027564144116706907,64,3,1,0.018930404610381993,128,5,1,0.035557687697278774,128.0,5.0,1.0,0.027201911962392238,512.0,3.0,1.0,128,0.8149777166727381,18.0,5,Adam,,,,45.0,0.7473586078309509,0.7366056889146424,"{""block_0_dropout"": 0.026214931422121564, ""block_0_filters"": 8, ""block_0_kernel"": 5, ""block_1_dropout"": 0.027564144116706907, ""block_1_filters"": 64, ""block_1_kernel"": 3, ""block_1_stride"": 1, ""block_2_dropout"": 0.018930404610381993, ""block_2_filters"": 128, ""block_2_kernel"": 5, ""block_2_stride"": 1, ""n_blocks"": 5}",COMPLETE
30,0.02496015237256937,2026-10-02 11:22:57.155683,2026-10-02 11:23:25.006139,0 days 00:00:27.850456,,,,,64.0,0.048346906499972295,32,5,3,0.016910246731617028,64,3,1,0.011110411063648115,128,5,1,0.021298019129182118,64.0,5.0,2.0,,,,,128,0.6698173368380944,14.0,4,SGD,0.09273572336093586,0.9867674345389478,1.2051955558050328e-06,,,,"{""block_0_dropout"": 0.048346906499972295, ""block_0_filters"": 32, ""block_0_kernel"": 5, ""block_1_dropout"": 0.016910246731617028, ""block_1_filters"": 64, ""block_1_kernel"": 3, ""block_1_stride"": 1, ""block_2_dropout"": 0.011110411063648115, ""block_2_filters"": 128, ""block_2_kernel"": 5, ""block_2_stride"": 1, ""n_blocks"": 4}",PRUNED
31,0.7638814305486938,2026-10-02 11:23:25.081910,2026-10-02 11:25:28.717039,0 days 00:02:03.635129,0.8891028163105898,0.9213938516815333,0.0006054059381846536,0.0004635539009327812,200.0,0.034651657952923146,8,5,3,0.033943073659294325,32,3,1,0.022833379461617037,128,5,1,0.02498987919247805,64.0,5.0,2.0,0.02515458945161248,128.0,3.0,1.0,128,0.8789101967127608,13.0,5,Adam,,,,48.0,0.7745494095711623,0.7532134515262253,"{""block_0_dropout"": 0.034651657952923146, ""block_0_filters"": 8, ""block_0_kernel"": 5, ""block_1_dropout"": 0.033943073659294325, ""block_1_filters"": 32, ""block_1_kernel"": 3, ""block_1_stride"": 1, ""block_2_dropout"": 0.022833379461617037, ""block_2_filters"": 128, ""block_2_kernel"": 5, ""block_2_stride"": 1, ""n_blocks"": 5}",COMPLETE
32,0.36015087568504295,2026-10-02 11:25:28.769547,2026-10-02 11:26:03.991216,0 days 00:00:35.221669,0.8685313770376614,0.9123731490799205,0.00010260667329221694,0.001665071940307865,200.0,0.0391753800443893,16,5,3,0.01084689549895618,64,3,1,0.013864583281431201,128,5,1,0.0244199022531467,64.0,5.0,2.0,,,,,128,0.8253987516540753,13.0,4,Adam,,,,,,,"{""block_0_dropout"": 0.0391753800443893, ""block_0_filters"": 16, ""block_0_kernel"": 5, ""block_1_dropout"": 0.01084689549895618, ""block_1_filters"": 64, ""block_1_kernel"": 3, ""block_1_stride"": 1, ""block_2_dropout"": 0.013864583281431201, ""block_2_filters"": 128, ""block_2_kernel"": 5, ""block_2_stride"": 1, ""n_blocks"": 4}",PRUNED
33,0.3212927436621254,2026-10-02 11:26:04.059795,2026-10-02 11:26:26.898075,0 days 00:00:22.838280,0.9058475042221209,0.9276266578588774,0.0003407049358531491,0.0003951477280253321,200.0,0.02529287015697148,8,5,3,0.022526947244420014,64,3,1,0.014858981385773753,128,5,1,,,,,,,,,128,0.7486684410635301,15.0,3,Adam,,,,,,,"{""block_0_dropout"": 0.02529287015697148, ""block_0_filters"": 8, ""block_0_kernel"": 5, ""block_1_dropout"": 0.022526947244420014, ""block_1_filters"": 64, ""block_1_kernel"": 3, ""block_1_stride"": 1, ""block_2_dropout"": 0.014858981385773753, ""block_2_filters"": 128, ""block_2_kernel"": 5, ""block_2_stride"": 1, ""n_blocks"": 3}",PRUNED
