number,value,datetime_start,datetime_complete,duration,params_adam_beta1,params_adam_beta2,params_adam_lr,params_adam_wd,params_batch_size,params_block_0_dropout,params_block_0_filters,params_block_0_kernel,params_block_0_stride,params_block_1_dropout,params_block_1_filters,params_block_1_kernel,params_block_1_stride,params_block_2_dropout,params_block_2_filters,params_block_2_kernel,params_block_2_stride,params_block_3_dropout,params_block_3_filters,params_block_3_kernel,params_block_3_stride,params_block_4_dropout,params_block_4_filters,params_block_4_kernel,params_block_4_stride,params_fc_hidden,params_lr_factor,params_lr_patience,params_n_blocks,params_optimizer,params_sgd_lr,params_sgd_momentum,params_sgd_wd,user_attrs_best_epoch,user_attrs_validation_accuracy,user_attrs_validation_macro_f1,system_attrs_tpe:relative_params:0,state
90,0.8187239798260086,2026-10-02 13:17:51.630368,2026-10-02 13:20:37.668549,0 days 00:02:46.038181,0.8811805384788883,0.9493438967581035,0.0002282390360944942,0.002521482534313798,64.0,0.04558037838987565,8,5,3,0.022047747069525704,64,3,1,0.02368853244700552,128,5,1,0.03958613365818794,128.0,5.0,2.0,0.04215965027290092,256.0,3.0,1.0,512,0.4631297576576233,9.0,5,Adam,,,,48.0,0.8339030453697949,0.8035449142822225,"{""block_0_dropout"": 0.04558037838987565, ""block_0_filters"": 8, ""block_0_kernel"": 5, ""block_1_dropout"": 0.022047747069525704, ""block_1_filters"": 64, ""block_1_kernel"": 3, ""block_1_stride"": 1, ""block_2_dropout"": 0.02368853244700552, ""block_2_filters"": 128, ""block_2_kernel"": 5, ""block_2_stride"": 1, ""n_blocks"": 5}",COMPLETE
91,0.8225807443995135,2026-10-02 13:20:37.740713,2026-10-02 13:23:14.525080,0 days 00:02:36.784367,0.8592293640715073,0.9915035130075813,0.00024982096303329535,0.001978936343205666,64.0,0.047817079232109115,16,7,3,0.011901413650252667,64,3,1,0.01072918430242341,128,5,1,0.03787840417177671,128.0,5.0,2.0,0.04424136807523349,256.0,3.0,1.0,256,0.17032301363155192,10.0,5,Adam,,,,47.0,0.8337476693598508,0.8114138194391762,"{""block_0_dropout"": 0.047817079232109115, ""block_0_filters"": 16, ""block_0_kernel"": 7, ""block_1_dropout"": 0.011901413650252667, ""block_1_filters"": 64, ""block_1_kernel"": 3, ""block_1_stride"": 1, ""block_2_dropout"": 0.01072918430242341, ""block_2_filters"": 128, ""block_2_kernel"": 5, ""block_2_stride"": 1, ""n_blocks"": 5}",COMPLETE
92,0.3878977761367236,2026-10-02 13:23:14.581538,2026-10-02 13:23:47.937147,0 days 00:00:33.355609,0.8539479312092064,0.917074155736448,0.00023368965977503306,0.0015027373992387689,64.0,0.047120068668168494,8,5,3,0.013459665373375562,64,3,1,0.01572417809102284,128,5,1,0.039157375334569734,128.0,5.0,2.0,0.04870051612805887,256.0,3.0,1.0,256,0.147697556242293,10.0,5,Adam,,,,,,,"{""block_0_dropout"": 0.047120068668168494, ""block_0_filters"": 8, ""block_0_kernel"": 5, ""block_1_dropout"": 0.013459665373375562, ""block_1_filters"": 64, ""block_1_kernel"": 3, ""block_1_stride"": 1, ""block_2_dropout"": 0.01572417809102284, ""block_2_filters"": 128, ""block_2_kernel"": 5, ""block_2_stride"": 1, ""n_blocks"": 5}",PRUNED
93,0.45664955195568935,2026-10-02 13:23:48.015573,2026-10-02 13:24:30.659220,0 days 00:00:42.643647,0.8590543239492763,0.9082256738624518,0.00018847355148889438,0.0010666091232856118,64.0,0.04657856918103025,16,5,3,0.01943889626362836,64,3,1,0.011864682206011633,32,5,1,0.0358614532886901,128.0,5.0,2.0,0.04378627892438168,256.0,3.0,1.0,256,0.12460858192495766,11.0,5,Adam,,,,,,,"{""block_0_dropout"": 0.04657856918103025, ""block_0_filters"": 16, ""block_0_kernel"": 5, ""block_1_dropout"": 0.01943889626362836, ""block_1_filters"": 64, ""block_1_kernel"": 3, ""block_1_stride"": 1, ""block_2_dropout"": 0.011864682206011633, ""block_2_filters"": 32, ""block_2_kernel"": 5, ""block_2_stride"": 1, ""n_blocks"": 5}",PRUNED
94,0.8456747913248098,2026-10-02 13:24:30.728660,2026-10-02 13:27:24.421000,0 days 00:02:53.692340,0.8725165508869503,0.9972687589274303,0.00015929090681045813,0.0023019587138915555,64.0,0.039622543563587076,8,5,3,0.014684146673676944,64,3,1,0.03276051492445777,128,5,1,0.03789192395244478,256.0,5.0,2.0,0.04574680327951805,256.0,3.0,1.0,256,0.2743485606968864,8.0,5,Adam,,,,44.0,0.8586078309509012,0.8327417516987184,"{""block_0_dropout"": 0.039622543563587076, ""block_0_filters"": 8, ""block_0_kernel"": 5, ""block_1_dropout"": 0.014684146673676944, ""block_1_filters"": 64, ""block_1_kernel"": 3, ""block_1_stride"": 1, ""block_2_dropout"": 0.03276051492445777, ""block_2_filters"": 128, ""block_2_kernel"": 5, ""block_2_stride"": 1, ""n_blocks"": 5}",COMPLETE
95,0.41037742469116456,2026-10-02 13:27:24.478967,2026-10-02 13:27:56.000444,0 days 00:00:31.521477,0.9009836339668464,0.9975390181617101,0.00015936521158935513,0.0067432408398655636,200.0,0.04960966724052881,8,5,3,0.01755210991557179,64,3,1,0.027892644981744926,128,5,1,0.03420768728265616,256.0,5.0,2.0,0.04596950593163677,256.0,3.0,1.0,256,0.30868503863630103,8.0,5,Adam,,,,,,,"{""block_0_dropout"": 0.04960966724052881, ""block_0_filters"": 8, ""block_0_kernel"": 5, ""block_1_dropout"": 0.01755210991557179, ""block_1_filters"": 64, ""block_1_kernel"": 3, ""block_1_stride"": 1, ""block_2_dropout"": 0.027892644981744926, ""block_2_filters"": 128, ""block_2_kernel"": 5, ""block_2_stride"": 1, ""n_blocks"": 5}",PRUNED
96,0.3828228340282687,2026-10-02 13:27:56.053268,2026-10-02 13:28:30.415325,0 days 00:00:34.362057,,,,,64.0,0.04290472820773495,16,5,3,0.013865907718106127,64,3,1,0.014445705027756174,128,5,1,0.02787948187490821,256.0,3.0,2.0,0.0474325909977144,256.0,3.0,1.0,256,0.26905164496998263,7.0,5,SGD,0.02528455137297973,0.8509649363873876,8.192069465335966e-05,,,,"{""block_0_dropout"": 0.04290472820773495, ""block_0_filters"": 16, ""block_0_kernel"": 5, ""block_1_dropout"": 0.013865907718106127, ""block_1_filters"": 64, ""block_1_kernel"": 3, ""block_1_stride"": 1, ""block_2_dropout"": 0.014445705027756174, ""block_2_filters"": 128, ""block_2_kernel"": 5, ""block_2_stride"": 1, ""n_blocks"": 5}",PRUNED
97,0.5147542460164625,2026-10-02 13:28:30.481511,2026-10-02 13:29:24.910051,0 days 00:00:54.428540,0.8737938950253603,0.9948709758698426,0.00013379242575510696,0.0032900178835024115,128.0,0.04351363305122319,8,5,3,0.010004969166893378,64,3,1,0.030578996149650234,128,5,1,0.03308567111148113,256.0,5.0,2.0,0.04534576575237078,256.0,3.0,1.0,256,0.35925553290193774,9.0,5,Adam,,,,,,,"{""block_0_dropout"": 0.04351363305122319, ""block_0_filters"": 8, ""block_0_kernel"": 5, ""block_1_dropout"": 0.010004969166893378, ""block_1_filters"": 64, ""block_1_kernel"": 3, ""block_1_stride"": 1, ""block_2_dropout"": 0.030578996149650234, ""block_2_filters"": 128, ""block_2_kernel"": 5, ""block_2_stride"": 1, ""n_blocks"": 5}",PRUNED
98,0.8293444282575889,2026-10-02 13:29:24.963058,2026-10-02 13:32:16.650098,0 days 00:02:51.687040,0.8858879587305178,0.9900176884408299,0.00011178659854510925,0.002355334416449505,64.0,0.04193679329095885,8,5,3,0.017288423238425093,64,3,1,0.02994321631843256,128,5,1,0.031169666793348472,256.0,5.0,2.0,0.049016925181469696,128.0,3.0,1.0,256,0.3425856452649278,14.0,5,Adam,,,,50.0,0.8454008701056557,0.8132879864095222,"{""block_0_dropout"": 0.04193679329095885, ""block_0_filters"": 8, ""block_0_kernel"": 5, ""block_1_dropout"": 0.017288423238425093, ""block_1_filters"": 64, ""block_1_kernel"": 3, ""block_1_stride"": 1, ""block_2_dropout"": 0.02994321631843256, ""block_2_filters"": 128, ""block_2_kernel"": 5, ""block_2_stride"": 1, ""n_blocks"": 5}",COMPLETE
99,0.8304054516636589,2026-10-02 13:32:16.707924,2026-10-02 13:34:45.329458,0 days 00:02:28.621534,0.8696691123006846,0.9990737181811419,0.0001524861012660739,0.0013445233477093724,200.0,0.042383746882077626,16,7,3,0.019333833437216306,64,3,1,0.010871885707753928,128,5,1,0.04168703737509084,256.0,5.0,2.0,0.042972205086363145,256.0,3.0,1.0,256,0.2673648169035917,6.0,5,Adam,,,,45.0,0.8363890615288999,0.8244218417984178,"{""block_0_dropout"": 0.042383746882077626, ""block_0_filters"": 16, ""block_0_kernel"": 7, ""block_1_dropout"": 0.019333833437216306, ""block_1_filters"": 64, ""block_1_kernel"": 3, ""block_1_stride"": 1, ""block_2_dropout"": 0.010871885707753928, ""block_2_filters"": 128, ""block_2_kernel"": 5, ""block_2_stride"": 1, ""n_blocks"": 5}",COMPLETE
