number,value,datetime_start,datetime_complete,duration,params_adam_beta1,params_adam_beta2,params_adam_lr,params_adam_wd,params_batch_size,params_block_0_dropout,params_block_0_filters,params_block_0_kernel,params_block_0_stride,params_block_1_dropout,params_block_1_filters,params_block_1_kernel,params_block_1_stride,params_block_2_dropout,params_block_2_filters,params_block_2_kernel,params_block_2_stride,params_block_3_dropout,params_block_3_filters,params_block_3_kernel,params_block_3_stride,params_fc_hidden,params_first_conv_filters,params_first_conv_kernel_size,params_lr_factor,params_lr_patience,params_n_blocks,params_optimizer,params_sgd_lr,params_sgd_momentum,params_sgd_wd,user_attrs_best_epoch,user_attrs_validation_accuracy,user_attrs_validation_macro_f1,state
57,0.8411849571399261,2026-10-01 19:59:18.801387,2026-10-01 20:01:21.724247,0 days 00:02:02.922860,0.8935480624855799,0.9201070834412259,0.0003010631579458939,8.281320690992602e-05,64.0,0.016175375873040666,32,5,3,0.036958412482328964,32,3,2,0.08635114425447775,128,5,1,0.09693739682857733,256.0,3.0,1.0,512,256,7,0.6331897167463119,10.0,4,Adam,,,,50.0,0.8333333333333334,0.8490365809465189,COMPLETE
58,,2026-10-01 20:01:21.861392,2026-10-01 20:01:21.933608,0 days 00:00:00.072216,,,,,,0.014944312996604136,32,5,3,0.03632553160383774,32,5,2,0.09350498803739973,128,5,1,0.09700383402549077,64.0,3.0,1.0,,256,7,,,4,,,,,,,,PRUNED
59,0.8544772223451271,2026-10-01 20:01:22.078583,2026-10-01 20:03:25.077375,0 days 00:02:02.998792,0.8954163836121319,0.9178460377573353,0.0006935977675659573,6.555291006173539e-05,64.0,0.018791364960980453,32,5,3,0.051630181126809706,32,3,2,0.08566145672974951,128,5,1,0.09918532303803906,256.0,3.0,1.0,512,256,7,0.6339178035878925,10.0,4,Adam,,,,38.0,0.8478260869565217,0.8611283577337325,COMPLETE
60,0.8305204976695084,2026-10-01 20:03:25.220807,2026-10-01 20:05:27.090705,0 days 00:02:01.869898,0.8961152113708258,0.9208390260946019,0.0004937673097788688,9.912045305143256e-05,64.0,0.01881768025283262,32,5,3,0.05135848530627199,32,3,2,0.08742183241789814,128,5,1,0.09858804896403549,256.0,3.0,1.0,512,256,7,0.5746475174213744,9.0,4,Adam,,,,50.0,0.8333333333333334,0.8277076620056834,COMPLETE
61,0.8399876530441158,2026-10-01 20:05:27.224381,2026-10-01 20:07:30.134716,0 days 00:02:02.910335,0.8843940930955941,0.9053586583171558,0.0006301855813132304,6.732688325756225e-05,64.0,0.020405527024443017,32,5,3,0.05761823541538501,32,3,2,0.09835331559508959,128,5,1,0.08639097005022765,256.0,3.0,1.0,512,256,7,0.6357763289213777,10.0,4,Adam,,,,43.0,0.8333333333333334,0.8466419727548983,COMPLETE
62,0.8023110706687856,2026-10-01 20:07:30.265974,2026-10-01 20:09:33.136432,0 days 00:02:02.870458,0.8803081749809281,0.9156559205860321,0.0006567016413721302,5.651549861680674e-05,64.0,0.015627551572807416,32,5,3,0.05711319143563469,32,3,2,0.09738227974583123,128,5,1,0.08788622975645825,256.0,3.0,1.0,512,256,7,0.6435804311694207,10.0,4,Adam,,,,42.0,0.7898550724637681,0.8147670688738031,COMPLETE
63,0.8537175739817675,2026-10-01 20:09:33.272879,2026-10-01 20:11:36.110379,0 days 00:02:02.837500,0.8931188150851009,0.903649291095753,0.0007252350204150011,8.318141390691336e-05,64.0,0.023764479189618437,32,5,3,0.0626316347293963,32,3,2,0.09564905138185004,128,5,1,0.09259809193312982,256.0,3.0,1.0,512,256,7,0.6783321735193708,9.0,4,Adam,,,,50.0,0.8478260869565217,0.8596090610070133,COMPLETE
64,0.6521329653676096,2026-10-01 20:11:36.244552,2026-10-01 20:12:57.342308,0 days 00:01:21.097756,0.8926695673100298,0.9010964251643513,0.0007349952599647118,9.765921029438062e-05,64.0,0.02556678425682571,32,5,3,0.07368183460084471,32,3,2,0.09067809303280278,128,5,1,0.09326655982658136,256.0,3.0,1.0,512,256,7,0.6928974257923312,9.0,4,Adam,,,,,,,PRUNED
65,0.8289846767459728,2026-10-01 20:12:57.476909,2026-10-01 20:14:21.254133,0 days 00:01:23.777224,0.900848634125914,0.9313457884434726,0.0002292062078322723,0.0002002997332145046,64.0,0.011922783684575534,32,5,3,0.06490822534207716,32,3,2,0.0849129178433032,128,5,1,0.09992142021987015,64.0,3.0,1.0,512,128,7,0.6684484051564575,7.0,4,Adam,,,,40.0,0.8260869565217391,0.8318823969702063,COMPLETE
66,0.8532794092719722,2026-10-01 20:14:21.392812,2026-10-01 20:16:30.761405,0 days 00:02:09.368593,0.8632631524839792,0.9211217031093295,0.0008269840858892539,0.00033109203549822974,128.0,0.023613737127236883,32,5,3,0.06303550673576323,32,3,2,0.09522940963402875,128,5,1,0.08306723410370544,256.0,3.0,1.0,512,256,7,0.6004199566765067,8.0,4,Adam,,,,36.0,0.855072463768116,0.8514863547758285,COMPLETE
67,0.5676300970899808,2026-10-01 20:16:30.901608,2026-10-01 20:16:56.784901,0 days 00:00:25.883293,,,,,128.0,0.027840238375104034,32,5,3,0.06257865365484157,32,3,2,0.09380474904322889,128,5,1,0.08411819299343216,256.0,3.0,1.0,512,256,7,0.6003077105436843,8.0,4,SGD,0.013974334067651209,0.7760313261969211,5.114259501575754e-06,,,,PRUNED
68,0.841789492042468,2026-10-01 20:16:56.918063,2026-10-01 20:19:03.804111,0 days 00:02:06.886048,0.8604736429069381,0.9218863739156677,0.0008055540191206502,0.000517453014973194,128.0,0.023281846182905398,16,5,3,0.06897988606316853,32,3,2,0.09640241023874956,128,5,1,0.09631724076796337,256.0,3.0,1.0,512,256,7,0.5828186668476544,6.0,4,Adam,,,,47.0,0.8405797101449275,0.8429992739400084,COMPLETE
69,,2026-10-01 20:19:03.936230,2026-10-01 20:19:03.997924,0 days 00:00:00.061694,,,,,,0.03264780056929646,16,5,3,0.06437591738668477,32,5,2,0.09390631454889334,128,5,1,0.09071890159481513,256.0,3.0,1.0,,256,7,,,4,,,,,,,,PRUNED
70,0.6741474272172767,2026-10-01 20:19:04.141574,2026-10-01 20:19:55.031934,0 days 00:00:50.890360,0.8582310395062936,0.9069997152062311,0.000993709772302281,0.0006706659598351751,128.0,0.02356894771697546,16,5,3,0.08224843725301167,32,3,2,0.09586951355417521,128,5,1,0.07706712432975663,256.0,3.0,1.0,512,256,7,0.5784936563311577,6.0,4,Adam,,,,,,,PRUNED
71,0.5992354932572324,2026-10-01 20:19:55.164924,2026-10-01 20:20:20.637743,0 days 00:00:25.472819,0.8675378169016555,0.9211854864317737,0.0007963281223319586,0.0003890572760268898,128.0,0.02318623425067912,16,5,3,0.06975389686108197,32,3,2,0.09999054045230317,128,5,1,0.09566418223542106,256.0,3.0,1.0,512,256,7,0.6144323822465431,7.0,4,Adam,,,,,,,PRUNED
72,0.6600599703067183,2026-10-01 20:20:20.771847,2026-10-01 20:21:11.599794,0 days 00:00:50.827947,0.8555100955594491,0.9188014208418294,0.0011004171267643109,0.00025157259361656333,128.0,0.02737411471385514,16,5,3,0.06903877940629108,32,3,2,0.0808767199296042,128,5,1,0.08369175936887409,256.0,3.0,1.0,512,256,7,0.5461448110709095,5.0,4,Adam,,,,,,,PRUNED
73,0.6078325879531035,2026-10-01 20:21:11.743182,2026-10-01 20:21:49.854674,0 days 00:00:38.111492,0.8706012111374487,0.9247831441582078,0.0007582751027918894,0.0005860839493101544,128.0,0.03656745562735646,16,5,3,0.07467910904397275,32,3,2,0.08610969946697791,128,5,1,0.08991587784815219,256.0,3.0,1.0,512,256,7,0.6738375984843447,6.0,4,Adam,,,,,,,PRUNED
74,0.7420457207517394,2026-10-01 20:21:49.988841,2026-10-01 20:23:23.044558,0 days 00:01:33.055717,0.860295932554857,0.9369667163047128,0.00016545867356444248,0.0016208418686785655,128.0,0.0218700930364389,32,5,3,0.06177976983594952,32,3,2,0.08924801420785815,128,5,1,0.010507388050071405,256.0,3.0,1.0,512,256,7,0.5902099841159674,8.0,4,Adam,,,,,,,PRUNED
75,0.6204271333867624,2026-10-01 20:23:23.178326,2026-10-01 20:23:48.878974,0 days 00:00:25.700648,0.8946585176703827,0.9236154317318223,0.0015226212694138257,0.0011009745573719936,128.0,0.01785553836094557,32,5,3,0.05004374607576312,32,3,2,0.09601190037947162,32,5,1,0.09731947072104509,256.0,3.0,1.0,512,256,7,0.622468893737476,11.0,4,Adam,,,,,,,PRUNED
76,0.41017030225522766,2026-10-01 20:23:49.013293,2026-10-01 20:24:57.945490,0 days 00:01:08.932197,,,,,128.0,0.024858981936199807,8,5,3,0.05968686862814769,16,3,2,0.09234958995194295,128,5,1,0.02250334866124079,256.0,3.0,1.0,512,512,7,0.6510731739439525,9.0,4,SGD,0.0012372241993872512,0.8685489096034074,0.001223356709682527,,,,PRUNED
77,0.8221480432439559,2026-10-01 20:24:58.079342,2026-10-01 20:26:06.848293,0 days 00:01:08.768951,0.9017497368869059,0.9294515521764231,0.0004372600815332449,0.00028349674804790064,128.0,0.03254896566371158,32,5,3,0.07187257178092078,32,3,2,0.08259229943989979,128,5,1,0.03343338325739694,256.0,3.0,1.0,128,128,7,0.5606707380569439,8.0,4,Adam,,,,42.0,0.8260869565217391,0.8182091299661725,COMPLETE
78,0.8040478067870719,2026-10-01 20:26:06.985901,2026-10-01 20:28:16.109018,0 days 00:02:09.123117,0.8761419617049335,0.9422966860304021,0.0003485765965194367,0.0004803742085395672,128.0,0.016306869036897532,32,5,3,0.05216057736800065,32,3,2,0.0757863309616798,128,5,1,0.09055138595569162,256.0,3.0,1.0,512,256,7,0.12772787257658358,10.0,4,Adam,,,,48.0,0.8115942028985508,0.796501410675593,COMPLETE
79,0.6079129979751099,2026-10-01 20:28:16.241591,2026-10-01 20:28:40.573983,0 days 00:00:24.332392,,,,,64.0,0.027493339490259228,32,5,3,0.07849955542988372,32,3,2,0.09084920642931464,128,5,1,,,,,512,256,7,0.5259226746079152,6.0,3,SGD,0.0039635197439479245,0.8107496607113738,4.691390206343048e-06,,,,PRUNED
80,0.5519127429024184,2026-10-01 20:28:40.707623,2026-10-01 20:29:04.891542,0 days 00:00:24.183919,0.8885458688533119,0.9144920871675285,0.0006229772339699148,8.330579070329177e-05,64.0,0.08920056742446576,16,5,3,0.06675537959105148,32,3,2,0.08673673370377845,128,5,1,0.09662257250487433,256.0,3.0,1.0,512,256,7,0.605324367917162,10.0,4,Adam,,,,,,,PRUNED
81,0.8408450780631231,2026-10-01 20:29:05.024912,2026-10-01 20:31:07.013665,0 days 00:02:01.988753,0.883723342213418,0.9109277609469599,0.0008299936118118676,1.9741228638961164e-05,64.0,0.013714076317006043,32,5,3,0.033196683858487896,32,3,2,0.0436566944089503,128,5,1,0.09314872842204451,64.0,3.0,1.0,512,256,7,0.6361569252364109,9.0,4,Adam,,,,49.0,0.8333333333333334,0.848356822792913,COMPLETE
82,0.6156225391787786,2026-10-01 20:31:07.147767,2026-10-01 20:31:39.200461,0 days 00:00:32.052694,0.8653090049224599,0.9099673210474915,0.0008460616025349082,2.0096924982597843e-05,64.0,0.018993656928508466,32,5,3,0.02792323179155374,32,3,2,0.037522499634420475,128,5,1,0.09480191695907346,256.0,3.0,1.0,512,256,7,0.653212806785208,9.0,4,Adam,,,,,,,PRUNED
83,0.816909110591975,2026-10-01 20:31:39.337271,2026-10-01 20:33:39.805095,0 days 00:02:00.467824,0.9060209625901743,0.9178362508134257,0.0014712193251617874,5.1829936244156754e-05,64.0,0.013197782222127565,32,5,3,0.09012253133879,32,3,2,0.042372332215706174,128,5,1,0.09941819389982409,64.0,3.0,1.0,512,256,7,0.6205626283745453,8.0,4,Adam,,,,50.0,0.8188405797101449,0.8149776414738052,COMPLETE
84,0.8413241217288503,2026-10-01 20:33:39.950484,2026-10-01 20:35:40.464859,0 days 00:02:00.514375,0.8914838577092054,0.9003845142494047,0.00109841525334905,9.66924653591007e-06,64.0,0.02013930018350839,32,5,3,0.03259003089023249,32,3,2,0.03385593956518973,128,5,1,0.08819975244994294,256.0,3.0,1.0,512,256,7,0.6796753239475248,9.0,4,Adam,,,,50.0,0.8405797101449275,0.842068533312773,COMPLETE
85,0.5996051382494234,2026-10-01 20:35:40.598621,2026-10-01 20:36:04.097399,0 days 00:00:23.498778,0.8931081566168247,0.9032265282673388,0.0010130519118489107,0.00013379142000458395,64.0,0.021607433229730445,32,5,3,0.02331944339623021,16,3,2,0.027314397202728012,32,5,1,0.0816539907289784,256.0,3.0,1.0,512,256,7,0.6968391483388421,11.0,4,Adam,,,,,,,PRUNED
86,0.8330687673227272,2026-10-01 20:36:04.236751,2026-10-01 20:38:04.280295,0 days 00:02:00.043544,0.8510425207264103,0.9328704713075765,0.00030243819597089856,8.801008133739261e-06,64.0,0.024997122521662675,32,5,3,0.05473836039079683,32,3,2,0.033877055073310784,128,5,1,0.08602634303295174,256.0,3.0,1.0,512,256,7,0.6802962805174456,10.0,4,Adam,,,,42.0,0.8333333333333334,0.832804201312121,COMPLETE
87,0.8650653345175592,2026-10-01 20:38:04.435335,2026-10-01 20:40:04.070839,0 days 00:01:59.635504,0.8981305552815025,0.906918880398615,0.0006682213540155521,0.00020248711607174705,64.0,0.01808722664189215,32,5,3,0.06250348632062308,32,3,2,0.030834700333532843,128,5,1,0.077480780973298,256.0,3.0,1.0,512,256,7,0.5781831256256171,8.0,4,Adam,,,,42.0,0.855072463768116,0.8750582052670025,COMPLETE
88,0.4410687915189801,2026-10-01 20:40:04.208586,2026-10-01 20:40:29.612986,0 days 00:00:25.404400,,,,,128.0,0.019146772499870856,32,5,3,0.06309715883334689,32,5,2,0.03639387249721501,128,3,1,0.07635370593684349,256.0,3.0,1.0,512,256,7,0.5805071900910663,7.0,4,SGD,0.0002852442032538845,0.9561635552847455,6.002344663668198e-05,,,,PRUNED
89,,2026-10-01 20:40:29.750372,2026-10-01 20:40:29.813138,0 days 00:00:00.062766,,,,,,0.029359762244164908,8,5,3,0.05749355572750496,32,3,2,0.030393607496821247,128,5,2,0.04751704886346413,256.0,3.0,1.0,,512,7,,,4,,,,,,,,PRUNED
90,0.8411078874451181,2026-10-01 20:40:29.948023,2026-10-01 20:42:33.629067,0 days 00:02:03.681044,0.9129159613546091,0.9066689192452249,0.000678504981958776,3.1309883611835438e-06,64.0,0.023340259774352026,32,5,3,0.06132321307515432,32,3,2,0.028892402658703867,128,5,1,0.0791524763108482,256.0,3.0,1.0,512,256,7,0.598279793060816,7.0,4,Adam,,,,50.0,0.8405797101449275,0.8416360647453086,COMPLETE
91,0.8254274247743629,2026-10-01 20:42:33.784736,2026-10-01 20:44:31.702500,0 days 00:01:57.917764,0.8984252055567662,0.9010392117165402,0.0011469780287006002,0.00024060932728633437,64.0,0.017519102803507405,32,5,3,0.06715010079899203,32,3,2,0.02296482743129605,128,5,1,0.08839434933784018,256.0,3.0,1.0,512,256,7,0.6631513703164349,8.0,4,Adam,,,,49.0,0.8260869565217391,0.8247678930269867,COMPLETE
92,0.6968635875999529,2026-10-01 20:44:31.836058,2026-10-01 20:45:37.145141,0 days 00:01:05.309083,0.8907413922962135,0.9079334474064994,0.00010322721888595293,1.1097568377360216e-06,64.0,0.02090089312098107,32,5,3,0.06809765434792889,32,3,2,0.0920299959270385,128,5,1,0.02717130002564639,256.0,3.0,1.0,512,256,7,0.5657011949928609,9.0,4,Adam,,,,,,,PRUNED
93,0.8472027433379423,2026-10-01 20:45:37.292509,2026-10-01 20:47:34.078176,0 days 00:01:56.785667,0.904834110520446,0.9275750966946028,0.0004653778353220696,0.00011813872339050724,64.0,0.01608357264593016,32,5,3,0.03207020764414289,32,3,2,0.016654940087049562,128,5,1,0.08467226153617737,256.0,3.0,1.0,512,256,7,0.6162279563370099,10.0,4,Adam,,,,44.0,0.855072463768116,0.8393330229077686,COMPLETE
94,0.8370395862530302,2026-10-01 20:47:34.213725,2026-10-01 20:49:29.848829,0 days 00:01:55.635104,0.9079488855861121,0.9000621638646669,0.0004458447660575474,0.00019561275976327948,64.0,0.026424584099181147,32,5,3,0.031593366945984726,32,3,2,0.04614178390696975,128,5,1,0.08404021260553368,256.0,3.0,1.0,512,256,7,0.603472146052748,9.0,4,Adam,,,,47.0,0.8405797101449275,0.8334994623611329,COMPLETE
95,0.5679274885878351,2026-10-01 20:49:29.982343,2026-10-01 20:49:47.076087,0 days 00:00:17.093744,0.9161000822782723,0.9147788154800159,0.0005981367749089579,0.0004786037138632688,64.0,0.021971937526181207,32,5,3,0.040856390098886475,32,3,1,0.01634598801005331,32,5,1,0.07431893519303136,128.0,3.0,1.0,512,256,5,0.6783441992278599,8.0,4,Adam,,,,,,,PRUNED
96,0.6724955158099537,2026-10-01 20:49:47.208450,2026-10-01 20:50:28.009900,0 days 00:00:40.801450,0.9033876477383863,0.9261008728466891,0.0003882800321069302,0.0003504788593227586,64.0,0.015182395528072955,32,5,3,0.07130750218963741,16,3,2,0.018924911770267266,128,5,1,0.0707441010680816,256.0,3.0,1.0,128,256,7,0.4977579270469005,5.0,4,Adam,,,,,,,PRUNED
97,0.6182196264599018,2026-10-01 20:50:28.144867,2026-10-01 20:50:49.029955,0 days 00:00:20.885088,0.9296335361132633,0.9043268226917475,0.002218923987663377,9.221084944826448e-06,64.0,0.011979580813019457,32,5,3,0.026173140842040782,64,3,2,0.09630353966857863,128,5,1,0.08222141284375599,256.0,3.0,1.0,256,128,7,0.5522685689372221,11.0,4,Adam,,,,,,,PRUNED
98,0.5873699908796092,2026-10-01 20:50:49.174282,2026-10-01 20:51:12.683857,0 days 00:00:23.509575,,,,,64.0,0.032092967565420294,32,5,3,0.015691077949685148,32,3,2,0.012847395678865788,128,5,1,0.08654217630429752,256.0,3.0,1.0,512,256,7,0.6175826509509347,8.0,4,SGD,0.02789350859928204,0.736170201455846,0.0020436854357301693,,,,PRUNED
99,0.6052154774950431,2026-10-01 20:51:12.825075,2026-10-01 20:51:35.633791,0 days 00:00:22.808716,0.9100193286166519,0.9133202442289823,0.0013724877785146602,0.00011718747723137627,64.0,0.019790962401677444,16,5,3,0.06475214021225417,32,3,2,0.03604841632646262,128,3,1,0.09111082800443773,256.0,3.0,1.0,512,256,7,0.6482555258250307,19.0,4,Adam,,,,,,,PRUNED
