number,value,datetime_start,datetime_complete,duration,params_adam_beta1,params_adam_beta2,params_adam_lr,params_adam_wd,params_batch_size,params_block_0_dropout,params_block_0_filters,params_block_0_kernel,params_block_0_stride,params_block_1_dropout,params_block_1_filters,params_block_1_kernel,params_block_1_stride,params_block_2_dropout,params_block_2_filters,params_block_2_kernel,params_block_2_stride,params_block_3_dropout,params_block_3_filters,params_block_3_kernel,params_block_3_stride,params_fc_hidden,params_first_conv_filters,params_first_conv_kernel_size,params_lr_factor,params_lr_patience,params_n_blocks,params_optimizer,params_sgd_lr,params_sgd_momentum,params_sgd_wd,user_attrs_best_epoch,user_attrs_validation_accuracy,user_attrs_validation_macro_f1,state
0,0.664019526574932,2026-10-01 18:52:45.329054,2026-10-01 18:54:45.754134,0 days 00:02:00.425080,0.8926459276842719,0.9097574441892378,0.00853618986286683,0.0017123375973163992,128.0,0.08491983767203796,8,5,3,0.06506676052501416,16,3,2,0.06331731119758383,128,3,1,,,,,256,256,7,0.5105398159072941,12.0,3,Adam,,,,42.0,0.6594202898550725,0.6686187632947915,COMPLETE
1,0.7193299643783269,2026-10-01 18:54:45.889033,2026-10-01 18:56:57.381470,0 days 00:02:11.492437,,,,,128.0,0.06381099809299767,16,7,3,0.08458637582367365,16,3,2,0.07950202923669918,128,3,1,0.07361716094628554,256.0,3.0,1.0,256,256,7,0.13813501017161417,9.0,4,SGD,0.038842777547031436,0.8807564567799918,2.106648601704221e-05,47.0,0.717391304347826,0.7212686244088278,COMPLETE
2,0.7459433755320377,2026-10-01 18:56:57.512538,2026-10-01 18:58:09.488901,0 days 00:01:11.976363,0.970502281655888,0.9006945178400659,0.0007148510793512986,0.0018709365688887364,64.0,0.019710228429397403,8,7,3,0.07799960246887438,32,3,1,0.0884314531168946,128,3,2,0.05854080177240857,256.0,3.0,1.0,256,256,3,0.4064483815465394,11.0,4,Adam,,,,33.0,0.7246376811594203,0.767249069904655,COMPLETE
3,,2026-10-01 18:58:09.619329,2026-10-01 18:58:09.674023,0 days 00:00:00.054694,,,,,,0.013319825261907952,8,7,3,0.05405074842498068,16,3,2,0.06690752475342215,32,5,2,0.08517722460303143,64.0,3.0,1.0,,256,5,,,4,,,,,,,,PRUNED
4,0.7422310681343711,2026-10-01 18:58:09.804222,2026-10-01 18:59:06.724722,0 days 00:00:56.920500,0.8642060160012445,0.9662838267338948,0.0016325185294676916,1.088399181393814e-06,128.0,0.09430569898630611,16,7,3,0.08354999801810943,32,5,1,0.04051268119438307,32,3,2,0.08983777818386056,256.0,3.0,1.0,128,128,5,0.10303695030773122,7.0,4,Adam,,,,48.0,0.7318840579710145,0.7525780782977278,COMPLETE
5,,2026-10-01 18:59:06.859998,2026-10-01 18:59:06.909634,0 days 00:00:00.049636,,,,,,0.03386821309135529,8,5,3,0.06192134961637233,32,5,2,0.09464127259176229,128,5,2,0.011391095487598068,64.0,3.0,1.0,,512,3,,,4,,,,,,,,PRUNED
6,0.6029131057457309,2026-10-01 18:59:07.047326,2026-10-01 19:04:53.261047,0 days 00:05:46.213721,0.897319321959215,0.9375207369687304,0.0039046790191830895,0.0036309591863459105,128.0,0.07264268170074757,8,5,3,0.0766691755978784,64,5,1,0.09219164973008243,64,3,1,,,,,512,512,7,0.1563891639045214,14.0,3,Adam,,,,47.0,0.5942028985507246,0.611623312940737,COMPLETE
7,0.5620455877819133,2026-10-01 19:04:53.392810,2026-10-01 19:05:19.073671,0 days 00:00:25.680861,0.8891907455724319,0.9953910415382531,0.0026865309327169084,0.00043731009905162676,64.0,0.01768127184943912,32,5,3,0.03906608256471214,64,3,2,0.07263767854843282,32,5,2,,,,,128,512,3,0.5427381500174611,13.0,3,Adam,,,,,,,PRUNED
8,0.48175542423640366,2026-10-01 19:05:19.205831,2026-10-01 19:05:52.304660,0 days 00:00:33.098829,,,,,64.0,0.05261245937025092,8,5,3,0.06632739241428127,32,3,1,0.0627198023146117,64,5,2,,,,,128,512,5,0.6767143382943485,19.0,3,SGD,0.004333615420461955,0.9730247945451923,3.502761367842316e-05,,,,PRUNED
9,0.5741831976532379,2026-10-01 19:05:52.437934,2026-10-01 19:06:07.338986,0 days 00:00:14.901052,,,,,128.0,0.06660485621018956,16,5,3,0.0991454627800606,16,5,1,0.07757839610123476,128,3,2,0.05547271352030715,256.0,3.0,1.0,512,128,7,0.6700371802304829,20.0,4,SGD,0.0520170752104338,0.7264731362679787,1.8934530915191556e-05,,,,PRUNED
10,0.5181655546938319,2026-10-01 19:06:07.471369,2026-10-01 19:06:22.669467,0 days 00:00:15.198098,0.977218037853279,0.9009409975228837,0.00011004396061565607,1.0748958551982896e-05,64.0,0.04094807897017133,32,7,3,0.011108005260844378,32,3,1,0.020560191911985395,128,3,1,,,,,256,256,3,0.31969431875426024,5.0,3,Adam,,,,,,,PRUNED
11,0.5388884610590656,2026-10-01 19:06:22.803794,2026-10-01 19:06:36.903807,0 days 00:00:14.100013,0.9862336188038249,0.9704222155518909,0.0007198704881461937,1.9469783916597203e-06,64.0,0.097849817189906,16,7,3,0.09297771142002567,32,5,1,0.03978215576261334,32,3,2,0.09921467391621898,256.0,3.0,1.0,128,128,5,0.3309694611006726,7.0,4,Adam,,,,,,,PRUNED
12,0.5872578228887879,2026-10-01 19:06:37.037428,2026-10-01 19:06:53.245972,0 days 00:00:16.208544,0.9396653680937433,0.94491027683938,0.0007611430913796458,7.716974871211788e-05,64.0,0.09795398190355704,16,7,3,0.07899712865131596,32,5,1,0.044989227530774764,32,3,2,0.050384471149230614,128.0,3.0,1.0,128,128,3,0.2989067910219503,10.0,4,Adam,,,,,,,PRUNED
13,0.7468318941402143,2026-10-01 19:06:53.393613,2026-10-01 19:07:50.343072,0 days 00:00:56.949459,0.8507553313339922,0.9345392844481469,0.0005932780282744936,6.897507035283137e-05,128.0,0.035523013109840164,16,7,3,0.044151450596321834,32,5,1,0.01305701231154524,32,3,2,0.04739550502320124,256.0,3.0,1.0,256,128,5,0.4412230351734097,16.0,4,Adam,,,,46.0,0.7463768115942029,0.7472869766862258,COMPLETE
14,0.8386637659016176,2026-10-01 19:07:50.475730,2026-10-01 19:09:07.088808,0 days 00:01:16.613078,0.9396742186711883,0.9268592938604859,0.00031267524784913704,0.00019038025426783864,64.0,0.02925374085776966,32,7,3,0.039913088083726414,32,3,1,0.022645747110608933,64,3,2,0.041353135857851664,256.0,3.0,1.0,256,256,3,0.4364570690203013,16.0,4,Adam,,,,48.0,0.8405797101449275,0.8367478216583076,COMPLETE
15,0.7715851359259023,2026-10-01 19:09:07.227840,2026-10-01 19:10:10.889122,0 days 00:01:03.661282,0.8507525221486042,0.9289578736180947,0.00020950404875746335,6.361226904953444e-05,128.0,0.03537494058857631,32,7,3,0.035053317723320286,32,5,1,0.010275114404859988,64,3,2,0.03027613096984376,128.0,3.0,1.0,256,128,5,0.47511638201392864,16.0,4,Adam,,,,50.0,0.7608695652173914,0.7823007066344132,COMPLETE
16,0.09866160916133059,2026-10-01 19:10:11.022458,2026-10-01 19:10:28.044422,0 days 00:00:17.021964,,,,,128.0,0.02643344825757643,32,7,3,0.023998322107479757,64,5,1,0.02584018063149826,64,3,2,0.026790036381427483,128.0,3.0,1.0,256,256,3,0.5722735352724759,17.0,4,SGD,0.00013434934091716434,0.7097525765857359,0.008893934833381944,,,,PRUNED
17,0.779558637396166,2026-10-01 19:10:28.176653,2026-10-01 19:11:49.197776,0 days 00:01:21.021123,0.9379596469398979,0.9259812035137308,0.0001508067937051621,0.00011757017874659676,64.0,0.050579663692736254,32,7,3,0.03330021289641804,32,3,1,0.011087923630918031,64,3,2,0.031502985382640125,128.0,3.0,1.0,256,128,5,0.4174136784131289,16.0,4,Adam,,,,47.0,0.782608695652174,0.776508579140158,COMPLETE
18,0.6041508850914541,2026-10-01 19:11:49.336734,2026-10-01 19:12:13.584248,0 days 00:00:24.247514,0.9372663641612584,0.9208882279400799,0.00020410823429778115,0.00026534532287821906,64.0,0.049562606786882075,32,7,3,0.027954787189761743,32,3,1,0.030576417266010052,64,5,1,0.030808545150587112,128.0,3.0,1.0,512,128,3,0.23875344500740492,18.0,4,Adam,,,,,,,PRUNED
19,0.8043078192375348,2026-10-01 19:12:13.716800,2026-10-01 19:13:46.958882,0 days 00:01:33.242082,0.9417531787156745,0.9555977160374063,0.0002861859266456461,1.501466724689011e-05,64.0,0.049728779716433455,32,7,3,0.05050105258726162,64,3,1,0.05110796493091743,64,3,2,0.03946584446429184,128.0,3.0,1.0,256,256,5,0.40532450453047314,15.0,4,Adam,,,,40.0,0.8043478260869565,0.8042678123881132,COMPLETE
20,0.1703876842271584,2026-10-01 19:13:47.099847,2026-10-01 19:14:03.210693,0 days 00:00:16.110846,,,,,64.0,0.02646870920942239,32,7,3,0.04805235718354789,64,3,1,0.050218220832467825,64,3,2,,,,,256,256,3,0.5902823632617471,14.0,3,SGD,0.00010605802050141145,0.8330217930118423,0.005283552020906754,,,,PRUNED
21,0.7827904795371823,2026-10-01 19:14:03.353770,2026-10-01 19:15:36.460981,0 days 00:01:33.107211,0.9379509014115535,0.9564629351687739,0.000260626579004113,1.2439940637740356e-05,64.0,0.05042704704363146,32,7,3,0.025152158256535162,64,3,1,0.019910375658162567,64,3,2,0.03937220972675942,128.0,3.0,1.0,256,256,5,0.383039562990642,15.0,4,Adam,,,,44.0,0.782608695652174,0.7829722634221907,COMPLETE
22,0.7920849155321205,2026-10-01 19:15:36.592249,2026-10-01 19:17:09.725452,0 days 00:01:33.133203,0.9557873292224722,0.9562520903009307,0.00033955182403218385,1.3448720222159017e-05,64.0,0.059123710533132395,32,7,3,0.018072119592558725,64,3,1,0.03314578375010213,64,3,2,0.04434723487285784,128.0,3.0,1.0,256,256,5,0.3641543254177224,14.0,4,Adam,,,,33.0,0.7898550724637681,0.7943147586004728,COMPLETE
23,0.7982075390384714,2026-10-01 19:17:09.859689,2026-10-01 19:18:43.022049,0 days 00:01:33.162360,0.9600910692634844,0.9520874796932629,0.00037593491071529525,1.2246330583342472e-05,64.0,0.05939991880948324,32,7,3,0.013221263804032483,64,3,1,0.053763736739958545,64,3,2,0.04234642834710019,128.0,3.0,1.0,256,256,5,0.2358334655367775,13.0,4,Adam,,,,42.0,0.7971014492753623,0.7993136288015805,COMPLETE
24,0.5476993202605187,2026-10-01 19:18:43.154040,2026-10-01 19:19:03.726342,0 days 00:00:20.572302,0.9211336110156229,0.9838619553344684,0.0004010604115851946,4.5845444170145795e-06,64.0,0.07647773246660748,32,7,3,0.05294487147144583,64,3,1,0.05599076915547444,64,3,2,0.06466236209948165,128.0,3.0,1.0,256,256,5,0.2363499576089907,12.0,4,Adam,,,,,,,PRUNED
25,0.7950068325449898,2026-10-01 19:19:03.859794,2026-10-01 19:20:36.755962,0 days 00:01:32.896168,0.9572149011688832,0.9467730588487581,0.0004440963661896036,3.5508498260213924e-05,64.0,0.044486410889095586,32,7,3,0.013024008490145319,64,3,1,0.04620453435946172,64,3,2,0.022301148841409834,64.0,3.0,1.0,256,256,5,0.25593977562142156,18.0,4,Adam,,,,45.0,0.7971014492753623,0.7929122158146173,COMPLETE
26,0.8192839368502761,2026-10-01 19:20:36.893224,2026-10-01 19:22:09.696610,0 days 00:01:32.803386,0.9171811279603588,0.9729953594208094,0.0012871352383343369,2.4981305791333332e-05,64.0,0.058001766920660267,32,7,3,0.04187702788868199,64,3,2,0.05319357687515469,64,5,1,0.037528282354966414,128.0,3.0,1.0,512,256,5,0.46976952782195647,13.0,4,Adam,,,,48.0,0.8260869565217391,0.8124809171788131,COMPLETE
27,0.7646982498921959,2026-10-01 19:22:09.829004,2026-10-01 19:23:42.604904,0 days 00:01:32.775900,0.9133740743916124,0.9765239788172838,0.0012559452929621624,0.0003352250200013419,64.0,0.04322154453410755,32,7,3,0.04339520015155237,64,3,2,0.05956275099902292,64,5,1,0.017093961515592223,128.0,3.0,1.0,512,256,5,0.46916801392565705,15.0,4,Adam,,,,47.0,0.7681159420289855,0.7612805577554064,COMPLETE
28,0.848486103642655,2026-10-01 19:23:42.753191,2026-10-01 19:25:56.343587,0 days 00:02:13.590396,,,,,64.0,0.027267302524118714,32,7,3,0.054519014807884826,64,3,2,0.038425364130598924,64,5,1,0.03725237243522769,256.0,3.0,1.0,512,256,7,0.6184339211708569,17.0,4,SGD,0.0015337462850203462,0.9713592092748604,1.4196040858432639e-06,49.0,0.8478260869565217,0.8491461203287881,COMPLETE
29,0.6751157248843456,2026-10-01 19:25:56.476863,2026-10-01 19:27:01.589157,0 days 00:01:05.112294,,,,,64.0,0.01006627708711531,32,5,3,0.06078266747151121,16,3,2,0.03367679418771669,64,5,1,,,,,512,256,7,0.6268069381639633,20.0,3,SGD,0.0020304376230530787,0.9862442263774448,1.016684284334951e-06,,,,PRUNED
30,0.5382556056593314,2026-10-01 19:27:01.720619,2026-10-01 19:27:28.530457,0 days 00:00:26.809838,,,,,64.0,0.0255224914288424,32,7,3,0.0667609067107853,64,3,2,0.024200493029952294,64,5,1,0.035895661917227845,256.0,3.0,1.0,512,256,7,0.5163091411418046,17.0,4,SGD,0.0017414701120960175,0.8254112527936485,0.0005093715441465018,,,,PRUNED
31,0.7031146289788919,2026-10-01 19:27:28.665741,2026-10-01 19:28:51.549932,0 days 00:01:22.884191,,,,,64.0,0.08208743416349396,32,7,3,0.055006360081666344,64,3,2,0.03980980962519887,64,5,1,0.03729798306800361,256.0,3.0,1.0,512,256,7,0.46397452013531526,15.0,4,SGD,0.009805406617628503,0.9161596621007079,1.2805957472215705e-06,,,,PRUNED
32,0.4839127113295911,2026-10-01 19:28:51.687601,2026-10-01 19:29:18.482115,0 days 00:00:26.794514,,,,,64.0,0.030474618950911303,32,7,3,0.04871536151173054,64,3,2,0.04872933689781328,64,5,1,0.0484011837498748,256.0,3.0,1.0,512,256,7,0.5099048246763705,17.0,4,SGD,0.0004613916686391273,0.7622274789220876,0.00044858483651629734,,,,PRUNED
33,0.8390746950694996,2026-10-01 19:29:18.625477,2026-10-01 19:31:32.268975,0 days 00:02:13.643498,0.9187184783324063,0.9864947543329737,0.00128030713862315,3.050403386362906e-05,64.0,0.019826947796597084,32,7,3,0.03880150462399334,64,3,2,0.06744362821337066,64,5,1,0.05548950477118181,256.0,3.0,1.0,512,256,7,0.6288629048216813,12.0,4,Adam,,,,45.0,0.8333333333333334,0.8448160568056657,COMPLETE
34,0.5877557056305521,2026-10-01 19:31:32.405649,2026-10-01 19:32:01.751029,0 days 00:00:29.345380,,,,,64.0,0.017795860263114638,32,7,3,0.03799848588037805,16,3,2,0.06956108749498169,64,5,1,0.06800105902449326,256.0,3.0,1.0,512,256,7,0.6410543635179498,12.0,4,SGD,0.013955331180700149,0.787018609027404,0.0002205539084263422,,,,PRUNED
35,0.8475547934684907,2026-10-01 19:32:01.892947,2026-10-01 19:34:15.570589,0 days 00:02:13.677642,0.9155776511892705,0.9975620302055559,0.001397176982519612,0.00017002301584247018,64.0,0.019561198098380878,32,7,3,0.03186265856091368,64,3,2,0.07922455624252711,64,5,1,0.05214584907771748,256.0,3.0,1.0,512,256,7,0.6016229751442951,9.0,4,Adam,,,,47.0,0.8478260869565217,0.8472834999804597,COMPLETE
36,0.49185627344439997,2026-10-01 19:34:15.719032,2026-10-01 19:34:42.084696,0 days 00:00:26.365664,,,,,64.0,0.023133158487615626,8,7,3,0.030495275218579004,16,3,2,0.0845114287398607,128,5,1,0.05708184923479952,256.0,3.0,1.0,512,256,7,0.6114498710046286,9.0,4,SGD,0.0005947268025307135,0.920635815164759,4.832115657346412e-06,,,,PRUNED
37,0.6582854471763079,2026-10-01 19:34:42.217432,2026-10-01 19:35:48.985878,0 days 00:01:06.768446,0.9060537887759003,0.9853076172397199,0.0026765864947896913,0.0006942529239983169,64.0,0.01362163183289702,32,7,3,0.03536135939259361,64,3,2,0.08320252911771045,64,5,1,0.07275881030190424,256.0,3.0,1.0,512,256,7,0.5602594881794766,8.0,4,Adam,,,,,,,PRUNED
38,0.39076270421651155,2026-10-01 19:35:49.122401,2026-10-01 19:36:39.318810,0 days 00:00:50.196409,0.9260839317043457,0.9995035892397165,0.008424918083608348,0.0001663861619706055,64.0,0.020839436207685365,8,5,3,0.020630644708167428,64,3,2,0.09899070979642105,128,5,1,0.061981921461922614,256.0,3.0,1.0,512,512,7,0.6899224893279278,11.0,4,Adam,,,,,,,PRUNED
39,0.5260808322142057,2026-10-01 19:36:39.451276,2026-10-01 19:37:08.926845,0 days 00:00:29.475569,0.8777301674498796,0.9910377060331517,0.004461489183826382,0.0007810725626664759,128.0,0.031184580978676008,32,7,3,0.058958957728937215,64,3,2,0.0759415919341688,64,5,1,0.05165075192770553,256.0,3.0,1.0,512,256,7,0.6546160485072412,10.0,4,Adam,,,,,,,PRUNED
40,0.4622949251374133,2026-10-01 19:37:09.059610,2026-10-01 19:37:58.352728,0 days 00:00:49.293118,,,,,64.0,0.014200283329442499,16,5,3,0.06977949008298959,16,3,2,0.06747108211988717,32,5,1,0.05267149140997582,256.0,3.0,1.0,512,512,7,0.5328098664587155,5.0,4,SGD,0.08838740723127571,0.8645327468450703,0.0017748753079281044,,,,PRUNED
41,0.8144678992505079,2026-10-01 19:37:58.494295,2026-10-01 19:40:02.708628,0 days 00:02:04.214333,0.9234276790102295,0.982049329847287,0.001193931035986115,3.560179207410351e-05,64.0,0.03848974057490795,32,7,3,0.0424608707094912,64,3,2,0.05777154368284978,64,5,1,0.043860952054102786,256.0,3.0,1.0,512,256,7,0.5874444624781602,12.0,4,Adam,,,,49.0,0.8115942028985508,0.8173415956024651,COMPLETE
42,0.831756053301835,2026-10-01 19:40:02.843996,2026-10-01 19:42:13.017752,0 days 00:02:10.173756,0.9125260202518549,0.9909910498555932,0.001742598568282004,3.514848628724137e-05,64.0,0.030468068520860897,32,7,3,0.04071328649125927,64,3,2,0.07367421634393173,64,5,1,0.058885028040729606,64.0,3.0,1.0,512,256,7,0.608641689771776,13.0,4,Adam,,,,39.0,0.8260869565217391,0.8374251500819309,COMPLETE
43,0.5586455029047687,2026-10-01 19:42:13.152422,2026-10-01 19:42:39.821304,0 days 00:00:26.668882,0.9083501332037075,0.989572126479015,0.0018568069489013582,0.0001604495022198931,64.0,0.030077604329493766,32,7,3,0.029785749061681698,64,3,2,0.0899837512778116,64,5,1,0.06153641461614258,64.0,3.0,1.0,512,256,7,0.6125013139998033,10.0,4,Adam,,,,,,,PRUNED
44,0.48757675125340655,2026-10-01 19:42:39.955577,2026-10-01 19:43:06.201593,0 days 00:00:26.246016,0.9009232266681574,0.9990151432838794,0.0024655854373584773,6.253530846596249e-06,64.0,0.021753274761886328,8,7,3,0.03879373175782438,64,3,2,0.07319590790674364,64,5,1,0.06985696155105942,64.0,3.0,1.0,128,256,7,0.692342039742766,7.0,4,Adam,,,,,,,PRUNED
45,0.8313580799383596,2026-10-01 19:43:06.334287,2026-10-01 19:45:19.573408,0 days 00:02:13.239121,0.8874707564947697,0.9130507763254239,0.0009491126029967168,4.5509881477653294e-05,64.0,0.01744399293864274,32,7,3,0.046752745714357044,32,3,2,0.06124470533878275,128,5,1,0.0773909268680207,64.0,3.0,1.0,512,256,7,0.662650034867954,11.0,4,Adam,,,,48.0,0.8260869565217391,0.8366292033549801,COMPLETE
46,0.5549526538940206,2026-10-01 19:45:19.712568,2026-10-01 19:45:57.298165,0 days 00:00:37.585597,0.9289745645390974,0.9645268988787611,0.003849414455386285,0.0001335706027349698,128.0,0.02871387740584559,32,7,3,0.055455553502160755,64,3,2,0.08148079090680715,64,5,1,0.0555911931724347,64.0,3.0,1.0,512,512,3,0.5466049960796542,19.0,4,Adam,,,,,,,PRUNED
47,0.4521093364882185,2026-10-01 19:45:57.433617,2026-10-01 19:46:21.429737,0 days 00:00:23.996120,0.9477481379259768,0.9902284060949945,0.0019168290163373537,0.006955551360215989,64.0,0.03430769750332807,16,5,3,0.03160066575546327,32,3,2,0.06524426220054984,32,5,1,0.08069903308564717,256.0,3.0,1.0,128,256,7,0.5941476356961432,8.0,4,Adam,,,,,,,PRUNED
48,,2026-10-01 19:46:21.571731,2026-10-01 19:46:21.623792,0 days 00:00:00.052061,,,,,,0.03968773423463873,32,7,3,0.03870805056751464,64,5,2,0.08778895338331628,64,5,1,,,,,,256,3,,,3,,,,,,,,PRUNED
49,0.48699122208438983,2026-10-01 19:46:21.755386,2026-10-01 19:46:48.505121,0 days 00:00:26.749735,,,,,64.0,0.023253770701600382,32,7,3,0.025296954381969973,32,3,2,0.015489650881013579,64,5,1,0.059558596570729316,256.0,3.0,1.0,512,256,7,0.5014033670934603,13.0,4,SGD,0.0003966386712811554,0.9388983983832895,9.49438044389209e-05,,,,PRUNED
50,,2026-10-01 19:46:48.637885,2026-10-01 19:46:48.698844,0 days 00:00:00.060959,,,,,,0.01617227083626283,8,7,3,0.04537619620938922,64,5,2,0.07766376238389348,128,5,1,0.05303850235307685,256.0,3.0,1.0,,512,3,,,4,,,,,,,,PRUNED
51,0.8373862006791417,2026-10-01 19:46:48.838666,2026-10-01 19:49:02.172987,0 days 00:02:13.334321,0.8874852267564507,0.9112784166342511,0.0009169704347266365,3.398073003868896e-05,64.0,0.019954769834363704,32,7,3,0.04557505843181073,32,3,2,0.06229866873488376,128,5,1,0.08129672276740431,64.0,3.0,1.0,512,256,7,0.6551963585053993,11.0,4,Adam,,,,48.0,0.8333333333333334,0.8414390680249502,COMPLETE
52,0.8403993917421029,2026-10-01 19:49:02.315321,2026-10-01 19:51:15.546787,0 days 00:02:13.231466,0.8819775372392479,0.9122164601863478,0.0005379042332417602,2.810729536136698e-05,64.0,0.0100034970824309,32,7,3,0.03493872206037655,32,3,2,0.07150660946345576,128,5,1,0.09267191457225002,64.0,3.0,1.0,512,256,7,0.6348232334890069,9.0,4,Adam,,,,45.0,0.8478260869565217,0.8329726965276839,COMPLETE
53,0.8569112953192459,2026-10-01 19:51:15.686475,2026-10-01 19:53:28.879283,0 days 00:02:13.192808,0.8827485438245467,0.911584949845958,0.0005313863707651573,2.1498045042762526e-05,64.0,0.01980179842526994,32,7,3,0.03618858340812589,32,3,2,0.07004022476063472,128,5,1,0.08453835940474548,64.0,3.0,1.0,512,256,7,0.6451686277028299,9.0,4,Adam,,,,48.0,0.8623188405797102,0.8515037500587818,COMPLETE
54,0.834512998167436,2026-10-01 19:53:29.014286,2026-10-01 19:55:42.257242,0 days 00:02:13.242956,0.8730621678443476,0.917121530826769,0.0005194060484864914,5.778100060529663e-06,64.0,0.012114761035758688,32,7,3,0.0343043966328537,32,3,2,0.07079548471354022,128,5,1,0.09260451039153907,64.0,3.0,1.0,512,256,7,0.6322114058724515,9.0,4,Adam,,,,39.0,0.8405797101449275,0.8284462861899444,COMPLETE
55,0.8383380652287309,2026-10-01 19:55:42.390909,2026-10-01 19:58:01.591429,0 days 00:02:19.200520,0.8730778373391632,0.9085777261172416,0.0005388400513943127,0.0014410919652833168,128.0,0.025174171307638236,32,7,3,0.027583426336587172,32,3,2,0.07898096070528007,128,5,1,0.09419021438292312,64.0,3.0,1.0,512,256,7,0.5627570726105295,8.0,4,Adam,,,,43.0,0.8333333333333334,0.8433427971241283,COMPLETE
56,0.8386144661902791,2026-10-01 19:58:01.724768,2026-10-01 19:59:18.668480,0 days 00:01:16.943712,0.864331442186682,0.9040211470004639,0.0009261538774991573,2.202440670277665e-05,64.0,0.01009622115124922,16,7,3,0.02074610538708186,32,3,2,0.06480333596986154,128,5,1,0.08811443520586837,256.0,3.0,1.0,128,128,3,0.6723777491424123,6.0,4,Adam,,,,38.0,0.8333333333333334,0.8438955990472249,COMPLETE
