number,value,datetime_start,datetime_complete,duration,params_adam_beta1,params_adam_beta2,params_adam_lr,params_adam_wd,params_batch_size,params_block_0_dropout,params_block_0_filters,params_block_0_kernel,params_block_0_stride,params_block_1_dropout,params_block_1_filters,params_block_1_kernel,params_block_1_stride,params_block_2_dropout,params_block_2_filters,params_block_2_kernel,params_block_2_stride,params_block_3_dropout,params_block_3_filters,params_block_3_kernel,params_block_3_stride,params_fc_hidden,params_first_conv_filters,params_first_conv_kernel_size,params_lr_factor,params_lr_patience,params_n_blocks,params_optimizer,params_sgd_lr,params_sgd_momentum,params_sgd_wd,user_attrs_best_epoch,user_attrs_validation_accuracy,user_attrs_validation_macro_f1,state
0,0.5264436453924781,2026-09-28 08:07:22.083677,2026-09-28 08:13:49.308548,0 days 00:06:27.224871,0.8926459276842719,0.9097574441892378,0.00853618986286683,0.0017123375973163992,128.0,0.08491983767203796,8,5,3,0.06506676052501416,16,3,2,0.06331731119758383,128,3,1,,,,,256,256,7,0.5105398159072941,12.0,3,Adam,,,,37.0,0.5238095238095238,0.5290777669754323,COMPLETE
1,0.6293703812489095,2026-09-28 08:13:49.432865,2026-09-28 08:20:47.409485,0 days 00:06:57.976620,,,,,128.0,0.06381099809299767,16,7,3,0.08458637582367365,16,3,2,0.07950202923669918,128,3,1,0.07361716094628554,256.0,3.0,1.0,256,256,7,0.13813501017161417,9.0,4,SGD,0.038842777547031436,0.8807564567799918,2.106648601704221e-05,47.0,0.6285714285714286,0.6301693339263904,COMPLETE
2,0.5894521429476439,2026-09-28 08:20:47.535542,2026-09-28 08:24:33.418467,0 days 00:03:45.882925,0.970502281655888,0.9006945178400659,0.0007148510793512986,0.0018709365688887364,64.0,0.019710228429397403,8,7,3,0.07799960246887438,32,3,1,0.0884314531168946,128,3,2,0.05854080177240857,256.0,3.0,1.0,256,256,3,0.4064483815465394,11.0,4,Adam,,,,49.0,0.580952380952381,0.5979519049429068,COMPLETE
3,,2026-09-28 08:24:33.543270,2026-09-28 08:24:33.591592,0 days 00:00:00.048322,,,,,,0.013319825261907952,8,7,3,0.05405074842498068,16,3,2,0.06690752475342215,32,5,2,0.08517722460303143,64.0,3.0,1.0,,256,5,,,4,,,,,,,,PRUNED
4,0.6690154803104436,2026-09-28 08:24:33.719924,2026-09-28 08:27:32.635414,0 days 00:02:58.915490,0.8642060160012445,0.9662838267338948,0.0016325185294676916,1.088399181393814e-06,128.0,0.09430569898630611,16,7,3,0.08354999801810943,32,5,1,0.04051268119438307,32,3,2,0.08983777818386056,256.0,3.0,1.0,128,128,5,0.10303695030773122,7.0,4,Adam,,,,48.0,0.669047619047619,0.668983341573268,COMPLETE
5,,2026-09-28 08:27:32.765695,2026-09-28 08:27:32.813028,0 days 00:00:00.047333,,,,,,0.03386821309135529,8,5,3,0.06192134961637233,32,5,2,0.09464127259176229,128,5,2,0.011391095487598068,64.0,3.0,1.0,,512,3,,,4,,,,,,,,PRUNED
6,0.47784862053690935,2026-09-28 08:27:32.939525,2026-09-28 08:45:31.035132,0 days 00:17:58.095607,0.897319321959215,0.9375207369687304,0.0039046790191830895,0.0036309591863459105,128.0,0.07264268170074757,8,5,3,0.0766691755978784,64,5,1,0.09219164973008243,64,3,1,,,,,512,512,7,0.1563891639045214,14.0,3,Adam,,,,41.0,0.4714285714285714,0.4842686696452473,COMPLETE
7,0.6880743131210191,2026-09-28 08:45:31.155815,2026-09-28 08:52:14.275895,0 days 00:06:43.120080,0.8891907455724319,0.9953910415382531,0.0026865309327169084,0.00043731009905162676,64.0,0.01768127184943912,32,5,3,0.03906608256471214,64,3,2,0.07263767854843282,32,5,2,,,,,128,512,3,0.5427381500174611,13.0,3,Adam,,,,46.0,0.7023809523809523,0.6737676738610858,COMPLETE
8,0.44802005817375146,2026-09-28 08:52:14.425369,2026-09-28 08:54:29.962398,0 days 00:02:15.537029,,,,,64.0,0.05261245937025092,8,5,3,0.06632739241428127,32,3,1,0.0627198023146117,64,5,2,,,,,128,512,5,0.6767143382943485,19.0,3,SGD,0.004333615420461955,0.9730247945451923,3.502761367842316e-05,,,,PRUNED
9,0.615092045939721,2026-09-28 08:54:30.089633,2026-09-28 08:57:46.842713,0 days 00:03:16.753080,,,,,128.0,0.06660485621018956,16,5,3,0.0991454627800606,16,5,1,0.07757839610123476,128,3,2,0.05547271352030715,256.0,3.0,1.0,512,128,7,0.6700371802304829,20.0,4,SGD,0.0520170752104338,0.7264731362679787,1.8934530915191556e-05,46.0,0.6166666666666667,0.6135174252127753,COMPLETE
10,0.6723370208203723,2026-09-28 08:57:46.969253,2026-09-28 09:04:33.267650,0 days 00:06:46.298397,0.9740823912733333,0.9925265187462552,0.00011276182231780688,1.0341591364653288e-05,64.0,0.04094807897017133,32,5,3,0.020186058701089256,64,3,2,0.02058969429153098,32,5,1,,,,,128,512,3,0.31969431875426024,5.0,3,Adam,,,,48.0,0.6785714285714286,0.6661026130693161,COMPLETE
11,0.6995607413102893,2026-09-28 09:04:33.416685,2026-09-28 09:11:14.690613,0 days 00:06:41.273928,0.9802081999542284,0.9977378168152762,0.00010183198380260875,2.1744245799734513e-05,64.0,0.03771614503357396,32,5,3,0.025248848622237034,64,3,2,0.011182628414602769,32,5,1,,,,,128,512,3,0.33998841963022897,6.0,3,Adam,,,,46.0,0.6928571428571428,0.7062643397634357,COMPLETE
12,0.6809387076264781,2026-09-28 09:11:14.815494,2026-09-28 09:17:52.806967,0 days 00:06:37.991473,0.9352541592559447,0.9974585522093126,0.00010625721497327485,8.022759411944702e-05,64.0,0.029285066640766418,32,5,3,0.027823453244801555,64,3,2,0.012405334063632163,32,5,1,,,,,128,512,3,0.5123506792526356,16.0,3,Adam,,,,49.0,0.6904761904761905,0.6714012247767659,COMPLETE
13,0.7379479133511944,2026-09-28 09:17:52.950993,2026-09-28 09:24:41.122007,0 days 00:06:48.171014,0.9315109299364555,0.9768639629537282,0.0004995505615800058,0.00011363827435224601,64.0,0.04392963736897407,32,5,3,0.03991530819189748,64,3,2,0.03946021640029533,32,5,1,,,,,128,512,3,0.30897897095169613,5.0,3,Adam,,,,49.0,0.7380952380952381,0.7378005886071505,COMPLETE
14,0.724849749700458,2026-09-28 09:24:41.251667,2026-09-28 09:31:22.497900,0 days 00:06:41.246233,0.9326257540353675,0.9676080471902616,0.00041070749899604187,4.599225626542919e-05,64.0,0.05069676532624793,32,5,3,0.011324117011386218,64,3,2,0.034995854230170716,32,5,1,,,,,128,512,3,0.2843205844088878,5.0,3,Adam,,,,48.0,0.7261904761904762,0.7235090232104399,COMPLETE
15,0.7183175952840162,2026-09-28 09:31:22.619209,2026-09-28 09:37:53.825397,0 days 00:06:31.206188,0.9322177185345477,0.9651541604823171,0.00044017732420810387,9.45569908304001e-05,64.0,0.051444056169721857,32,5,3,0.010629762701632638,64,3,2,0.04006003073436889,32,5,1,,,,,128,512,3,0.22796717721048787,8.0,3,Adam,,,,49.0,0.7142857142857143,0.7223494762823182,COMPLETE
16,0.15362395315430058,2026-09-28 09:37:53.946208,2026-09-28 09:38:30.738473,0 days 00:00:36.792265,,,,,64.0,0.05084683972132399,32,5,3,0.040739402693513775,64,3,2,0.04225859748603618,32,5,1,,,,,128,128,3,0.26910571774343445,9.0,3,SGD,0.00011877964997161456,0.7040126788907952,0.002144225215662579,,,,PRUNED
17,0.7532941781208,2026-09-28 09:38:30.864395,2026-09-28 09:45:01.040916,0 days 00:06:30.176521,0.9318858238215286,0.9667343882810313,0.0004807634193947991,0.00016562968323355763,64.0,0.04486758903528748,32,5,3,0.010823914361986526,64,3,2,0.026888341312349292,64,5,1,,,,,512,512,3,0.3998866199207036,6.0,3,Adam,,,,43.0,0.7619047619047619,0.7446835943368383,COMPLETE
18,,2026-09-28 09:45:01.166401,2026-09-28 09:45:01.213005,0 days 00:00:00.046604,,,,,,0.028820831208271183,32,7,3,0.04174061049389735,64,5,2,0.052918445445283825,64,5,1,,,,,,512,3,,,3,,,,,,,,PRUNED
19,0.7050608644550956,2026-09-28 09:45:01.336812,2026-09-28 09:48:18.352677,0 days 00:03:17.015865,0.9459167608602891,0.9484260213809266,0.0008063936010229794,0.000495907742224997,64.0,0.06062121712100045,32,5,3,0.05080838719602214,64,3,2,0.024280237247276754,64,5,1,,,,,512,128,5,0.40908910724272746,10.0,3,Adam,,,,44.0,0.7095238095238096,0.7005979193863817,COMPLETE
20,0.7448284469429732,2026-09-28 09:48:18.477232,2026-09-28 09:54:55.082365,0 days 00:06:36.605133,0.9134276829747154,0.9778816567093644,0.0002701518695046938,0.00022230718097769153,64.0,0.0431649277465154,32,5,3,0.029712252351292195,64,3,2,0.028898147155708074,64,5,1,,,,,512,512,3,0.4172402756381345,7.0,3,Adam,,,,49.0,0.75,0.7396568938859465,COMPLETE
21,0.7228484779779034,2026-09-28 09:54:55.205597,2026-09-28 10:01:33.711092,0 days 00:06:38.505495,0.9158771421981761,0.9794745937513829,0.0002639649730536928,0.0002513283489854968,64.0,0.042396193124872555,32,5,3,0.03276464146577457,64,3,2,0.028802902812904378,64,5,1,,,,,512,512,3,0.41071972575619586,7.0,3,Adam,,,,44.0,0.7285714285714285,0.7171255273843784,COMPLETE
22,0.7315657135691844,2026-09-28 10:01:33.843714,2026-09-28 10:08:15.546247,0 days 00:06:41.702533,0.9126673852455531,0.9779055955407099,0.0002577731692935115,0.0001975528256117361,64.0,0.04538190200872254,32,5,3,0.016463459179211666,64,3,2,0.04918479000660442,64,5,1,,,,,512,512,3,0.452254947384774,5.0,3,Adam,,,,50.0,0.7309523809523809,0.7321790461859878,COMPLETE
23,0.7079305098086259,2026-09-28 10:08:15.669064,2026-09-28 10:15:01.403863,0 days 00:06:45.734799,0.9572221258874578,0.9506868013916764,0.0008729248422670566,0.0007479837735628229,64.0,0.025899413999181976,32,5,3,0.032490952093104083,64,3,2,0.031759379177008745,64,5,1,,,,,512,512,3,0.3538284060571516,7.0,3,Adam,,,,40.0,0.7071428571428572,0.7087181624743947,COMPLETE
24,0.7594414603516575,2026-09-28 10:15:01.528199,2026-09-28 10:21:46.760185,0 days 00:06:45.231986,0.9175921377932784,0.9796506354573156,0.0002458996026700031,8.237966781367579e-06,64.0,0.05936741489543352,32,5,3,0.020542622697378304,64,3,2,0.0210944569313629,64,5,1,,,,,512,512,3,0.21265428577584095,8.0,3,Adam,,,,50.0,0.7642857142857142,0.7545972064176008,COMPLETE
25,0.29650559607109617,2026-09-28 10:21:46.881253,2026-09-28 10:23:05.074229,0 days 00:01:18.192976,,,,,64.0,0.07784677648783041,16,5,3,0.0215067721863584,64,3,2,0.019082714647237417,64,5,1,,,,,512,512,3,0.21384224106354063,9.0,3,SGD,0.00010594134428257736,0.8319921111667751,0.0072142505027882504,,,,PRUNED
26,0.713258214905589,2026-09-28 10:23:05.198555,2026-09-28 10:31:10.700079,0 days 00:08:05.501524,0.9129623755667227,0.9544620728099587,0.0002484295395650934,4.212945180057304e-06,64.0,0.058096933112133584,32,7,3,0.016479817840815085,64,5,1,0.025848889963302157,64,5,1,,,,,512,512,3,0.5961912940035032,8.0,3,Adam,,,,48.0,0.7142857142857143,0.7122307155254637,COMPLETE
27,0.7211587323979289,2026-09-28 10:31:10.823453,2026-09-28 10:37:56.602555,0 days 00:06:45.779102,0.8753062585894446,0.9835531973645145,0.00019428487722432413,2.810552479305703e-06,64.0,0.06930512516395937,32,5,3,0.029050023354103283,64,3,2,0.018898539410287175,64,5,1,,,,,512,512,3,0.454721295158775,11.0,3,Adam,,,,46.0,0.7214285714285714,0.7208888933672863,COMPLETE
28,0.4844502335293619,2026-09-28 10:37:56.733296,2026-09-28 10:38:53.164080,0 days 00:00:56.430784,0.905822174448766,0.9314230217587148,0.00017470942645574802,1.96389268691064e-05,64.0,0.05850768531297065,32,5,3,0.020868515162901415,32,3,2,0.05010119358770897,64,5,1,,,,,512,128,5,0.20186780592384007,7.0,3,Adam,,,,,,,PRUNED
29,0.44375544153643887,2026-09-28 10:38:53.286676,2026-09-28 10:40:08.859669,0 days 00:01:15.572993,,,,,128.0,0.0762537183830854,16,5,3,0.049261783537265416,16,3,2,0.03220397757696746,64,3,1,,,,,512,256,7,0.37217224235633495,10.0,3,SGD,0.001526864498377944,0.976516857731363,1.2489433448065917e-06,,,,PRUNED
30,0.4883307916797307,2026-09-28 10:40:08.995334,2026-09-28 10:41:21.563304,0 days 00:01:12.567970,0.9475981881311064,0.9598479468971085,0.0003873789844756342,0.00884424131971797,64.0,0.08235212888941348,32,5,3,0.03387943852345051,16,3,2,0.016301673946842725,64,5,1,,,,,512,256,7,0.5890693683526946,8.0,3,Adam,,,,,,,PRUNED
31,0.7350586476107868,2026-09-28 10:41:21.695263,2026-09-28 10:48:05.105134,0 days 00:06:43.409871,0.923952218674082,0.9740066519227071,0.0005509867418633751,0.00011147816177224967,64.0,0.04470132016459292,32,5,3,0.015548850082275589,64,3,2,0.034904257366869265,64,5,1,,,,,512,512,3,0.2867922386475624,6.0,3,Adam,,,,48.0,0.7380952380952381,0.7320220571263354,COMPLETE
32,0.5722863570465951,2026-09-28 10:48:05.227755,2026-09-28 10:51:20.425674,0 days 00:03:15.197919,0.9226303203943848,0.9855841254910775,0.0010806804682253841,4.04314375936757e-05,64.0,0.0360471064823969,32,5,3,0.04560872274622328,64,3,2,0.044261880475191376,64,5,1,,,,,256,512,3,0.24225153742367042,6.0,3,Adam,,,,,,,PRUNED
33,0.7498664687600058,2026-09-28 10:51:20.550640,2026-09-28 10:58:10.956740,0 days 00:06:50.406100,0.9425976613706202,0.9729634800547012,0.00033885021200847043,0.0002091090287517996,64.0,0.04739110922324662,32,5,3,0.024353602454281826,64,3,2,0.023988488449751183,128,5,1,,,,,256,512,3,0.4549685560528771,5.0,3,Adam,,,,49.0,0.7595238095238095,0.7402091279962023,COMPLETE
34,0.6041187501106032,2026-09-28 10:58:11.079783,2026-09-28 11:00:21.380857,0 days 00:02:10.301074,0.9509348484812294,0.9870845117917771,0.00032833267796434485,0.00025779421634471953,64.0,0.055618907669963885,32,7,3,0.025051452955219836,64,3,2,0.025505043394630205,128,3,1,,,,,256,256,3,0.4561089576861874,6.0,3,Adam,,,,,,,PRUNED
35,0.4896864216666883,2026-09-28 11:00:21.507300,2026-09-28 11:02:11.998080,0 days 00:01:50.490780,0.9626870294329152,0.9712528865759962,0.00016672043947831624,0.0009735681677446122,128.0,0.06402557250730978,16,7,3,0.01144957293330287,16,3,2,0.022437392967714805,128,5,1,,,,,256,512,3,0.4923656916319353,8.0,3,Adam,,,,,,,PRUNED
36,0.466062093436981,2026-09-28 11:02:12.127975,2026-09-28 11:03:33.151637,0 days 00:01:21.023662,0.9048899233639,0.9597090724782862,0.0003036489592660294,8.442332234294297e-06,64.0,0.048470061711334445,8,5,3,0.022311558448744856,32,3,1,0.029265814680797454,128,3,1,0.011344676611381124,128.0,3.0,1.0,256,512,3,0.5747548488989249,7.0,4,Adam,,,,,,,PRUNED
37,,2026-09-28 11:03:33.282894,2026-09-28 11:03:33.342631,0 days 00:00:00.059737,,,,,,0.031864428508885614,32,5,3,0.03508405015808779,64,5,2,0.013207793724165227,128,5,2,0.03459882989744971,128.0,3.0,1.0,,256,5,,,4,,,,,,,,PRUNED
38,0.4818837936126674,2026-09-28 11:03:33.467528,2026-09-28 11:08:53.688328,0 days 00:05:20.220800,0.9425799446561826,0.987536643640271,0.0005988306579941157,0.00020796219422786154,128.0,0.02208402172498604,8,7,3,0.02883917124049423,64,3,1,0.016384316394764863,128,5,1,,,,,256,512,7,0.4842230905820942,9.0,3,Adam,,,,,,,PRUNED
39,0.7298823578665061,2026-09-28 11:08:53.810285,2026-09-28 11:15:39.548293,0 days 00:06:45.738008,0.9184576445455218,0.9724703164076574,0.000161890903942018,3.422870125787419e-05,64.0,0.096483586134473,32,5,3,0.015896500472648137,32,3,2,0.03624012751056075,128,3,2,,,,,256,512,3,0.3822246043384721,10.0,3,Adam,,,,48.0,0.7404761904761905,0.7192885252568216,COMPLETE
40,,2026-09-28 11:15:39.681338,2026-09-28 11:15:39.736688,0 days 00:00:00.055350,,,,,,0.01059573809065427,8,5,3,0.0187028408548314,16,5,2,0.0281823839177631,64,5,1,,,,,,128,3,,,3,,,,,,,,PRUNED
41,0.7275358580756045,2026-09-28 11:15:39.875460,2026-09-28 11:22:24.582397,0 days 00:06:44.706937,0.9304277886432744,0.977922355677162,0.0005190000084471267,9.764892311667774e-05,64.0,0.03904269523935974,32,5,3,0.056872998174129656,64,3,2,0.03970173738247583,32,5,1,,,,,512,512,3,0.3206631869501568,5.0,3,Adam,,,,49.0,0.7309523809523809,0.7241193351988281,COMPLETE
42,0.5745018750388449,2026-09-28 11:22:24.705314,2026-09-28 11:25:34.048340,0 days 00:03:09.343026,0.9396885547514847,0.9621203926373794,0.001166234419518944,0.0004052976446745552,64.0,0.04611701293366749,32,5,3,0.036820775030031616,64,3,2,0.05958205144047789,128,5,1,,,,,256,512,3,0.15113517305697513,6.0,3,Adam,,,,,,,PRUNED
43,0.44539318034870745,2026-09-28 11:25:34.176002,2026-09-28 11:26:52.137278,0 days 00:01:17.961276,0.926433534649146,0.9804592990665476,0.009628132852793875,0.00017798234415129888,64.0,0.0549435855428567,32,5,3,0.04419013004324909,64,3,2,0.045560027909197894,64,5,1,,,,,512,512,3,0.4241565856295732,5.0,3,Adam,,,,,,,PRUNED
44,0.7976995589462041,2026-09-28 11:26:52.264873,2026-09-28 11:33:21.352553,0 days 00:06:29.087680,0.8879108343189873,0.9727375090702384,0.0003616294650151404,0.0014538866923809726,64.0,0.04149755351757941,32,5,3,0.026689754698430542,64,3,2,0.023073921113401175,32,5,2,,,,,512,512,3,0.11674848816225941,7.0,3,Adam,,,,50.0,0.8071428571428572,0.788256260749551,COMPLETE
45,0.449094252006553,2026-09-28 11:33:21.479271,2026-09-28 11:35:11.988646,0 days 00:01:50.509375,,,,,128.0,0.03879156185157391,16,5,3,0.0255719805702357,64,3,1,0.021672958815492575,64,5,2,,,,,512,512,5,0.12730556213554844,7.0,3,SGD,0.0015074752760663947,0.8031225167955225,0.00034998445702290147,,,,PRUNED
46,0.7942899465741374,2026-09-28 11:35:12.117695,2026-09-28 11:47:47.604415,0 days 00:12:35.486720,0.8824896102769731,0.9693077762301285,0.00022139334411926437,0.002010641878332204,64.0,0.03443880643602901,32,5,3,0.030632004413324386,64,3,2,0.016001423895347457,32,5,2,,,,,512,512,7,0.10254179739567704,8.0,3,Adam,,,,41.0,0.8023809523809524,0.7861989407673224,COMPLETE
47,0.7523282186870177,2026-09-28 11:47:47.725554,2026-09-28 12:00:23.506405,0 days 00:12:35.780851,0.8555943039983065,0.9688606367084096,0.0002156580528122305,0.0024682122024965378,64.0,0.03387185366782264,32,5,3,0.025332041528200656,32,3,2,0.015427070572621384,32,3,2,,,,,512,512,7,0.18498827301015752,8.0,3,Adam,,,,48.0,0.7714285714285715,0.733227865945464,COMPLETE
48,0.7666803381367826,2026-09-28 12:00:23.632615,2026-09-28 12:12:59.663429,0 days 00:12:36.030814,0.8521670515975542,0.9458419620169981,0.0001980399358869505,0.002281786313359083,64.0,0.03314954886787693,32,5,3,0.0988513059614149,32,5,2,0.0159665808783963,32,3,2,,,,,512,512,7,0.17904319449400524,12.0,3,Adam,,,,50.0,0.7928571428571428,0.7405035334164224,COMPLETE
49,0.3914776842118237,2026-09-28 12:12:59.788184,2026-09-28 12:14:12.479519,0 days 00:01:12.691335,,,,,64.0,0.02474592888883094,8,7,3,0.0965657472688766,32,5,1,0.013240235051176386,32,3,2,,,,,512,256,7,0.10649173310510884,13.0,3,SGD,0.009669804633436288,0.9084752444990661,1.4970668500711762e-06,,,,PRUNED
50,,2026-09-28 12:14:12.614482,2026-09-28 12:14:12.678057,0 days 00:00:00.063575,,,,,,0.016838138408103227,32,5,3,0.07050833265007517,32,5,2,0.018725242852130373,32,3,2,0.03448524538228623,64.0,3.0,1.0,,512,7,,,4,,,,,,,,PRUNED
51,0.7479221632429843,2026-09-28 12:14:12.818108,2026-09-28 12:26:48.512412,0 days 00:12:35.694304,0.8515326964459974,0.9247738016297031,0.00021010984204362606,0.002335093463574549,64.0,0.03362343917673342,32,5,3,0.0853130687150071,32,5,2,0.011002419072127326,32,3,2,,,,,512,512,7,0.18150843206310313,15.0,3,Adam,,,,47.0,0.7595238095238095,0.7363205169621592,COMPLETE
52,0.7540632704783339,2026-09-28 12:26:48.632883,2026-09-28 12:39:24.062582,0 days 00:12:35.429699,0.8666299824370811,0.9424002908654757,0.00021307828959448935,0.0046740628213694435,64.0,0.031052438647191493,32,5,3,0.09371346843622831,32,5,2,0.01703843038546502,32,3,2,,,,,512,512,7,0.17666666536928158,17.0,3,Adam,,,,46.0,0.7619047619047619,0.7462217790519058,COMPLETE
53,0.7705823428668624,2026-09-28 12:39:24.185545,2026-09-28 12:51:59.926080,0 days 00:12:35.740535,0.8711794917637948,0.9454467932783435,0.00015567652799108395,0.006110882747692074,64.0,0.029048949640926615,32,5,3,0.09253106055055042,32,5,2,0.010333419755388946,32,3,2,,,,,512,512,7,0.13096765835669366,17.0,3,Adam,,,,47.0,0.7785714285714286,0.7625932571622963,COMPLETE
54,0.5206844430123658,2026-09-28 12:52:00.051615,2026-09-28 12:54:31.241836,0 days 00:02:31.190221,0.8773497126968037,0.9375774179199676,0.00013909411669270138,0.005787931010471837,64.0,0.028786003414655946,32,5,3,0.09251484517552788,32,5,2,0.0155006431482826,32,3,2,,,,,512,512,7,0.16620146808925754,16.0,3,Adam,,,,,,,PRUNED
55,0.7293631476401676,2026-09-28 12:54:31.370445,2026-09-28 12:58:11.492473,0 days 00:03:40.122028,0.8692893225644815,0.9426989566132307,0.00012639715047303544,0.00383806302265378,64.0,0.017586542917624362,32,5,3,0.08557676023319741,32,5,2,0.01014236084601377,32,3,2,,,,,512,128,7,0.12636686918362997,18.0,3,Adam,,,,42.0,0.7261904761904762,0.7325358190898592,COMPLETE
56,0.741047161999425,2026-09-28 12:58:11.613644,2026-09-28 13:10:47.399174,0 days 00:12:35.785530,0.8862081528853925,0.9185147282808794,0.00014168522252942686,0.0013051434333896264,64.0,0.021233262793102392,32,5,3,0.09045868756065864,32,5,2,0.02057593500110445,32,3,2,,,,,512,512,7,0.10740871886923964,16.0,3,Adam,,,,45.0,0.7523809523809524,0.7297133716178975,COMPLETE
57,0.476900809229172,2026-09-28 13:10:47.525499,2026-09-28 13:14:19.246560,0 days 00:03:31.721061,0.8629236028928297,0.9399957411130845,0.00021071544378150337,0.009203929193872156,128.0,0.024824261481971734,32,5,3,0.07869078634100032,32,5,2,0.01629573860023643,32,3,2,,,,,512,512,7,0.2484027843935675,17.0,3,Adam,,,,,,,PRUNED
58,0.37144818140094604,2026-09-28 13:14:19.377555,2026-09-28 13:16:50.456540,0 days 00:02:31.078985,0.8850904705542059,0.9456798682513584,0.0033740310628926364,0.004684096461225576,64.0,0.029925674874524355,32,5,3,0.09827599686508147,32,5,2,0.023037526090876587,32,3,2,,,,,512,512,7,0.1545662569126611,20.0,3,Adam,,,,,,,PRUNED
59,0.41390036409335673,2026-09-28 13:16:50.591621,2026-09-28 13:19:19.216271,0 days 00:02:28.624650,0.8632084680977561,0.9319576116452049,0.005552009669072511,0.0015867144707635084,64.0,0.03612179520328074,16,5,3,0.09356322225171965,32,5,2,0.013521518380915578,32,3,2,,,,,512,512,7,0.18933923732414865,18.0,3,Adam,,,,,,,PRUNED
