number,value,datetime_start,datetime_complete,duration,params_adam_beta1,params_adam_beta2,params_adam_lr,params_adam_wd,params_batch_size,params_block_0_dropout,params_block_0_filters,params_block_0_kernel,params_block_0_stride,params_block_1_dropout,params_block_1_filters,params_block_1_kernel,params_block_1_stride,params_block_2_dropout,params_block_2_filters,params_block_2_kernel,params_block_2_stride,params_block_3_dropout,params_block_3_filters,params_block_3_kernel,params_block_3_stride,params_fc_hidden,params_first_conv_filters,params_first_conv_kernel_size,params_lr_factor,params_lr_patience,params_n_blocks,params_optimizer,params_sgd_lr,params_sgd_momentum,params_sgd_wd,user_attrs_best_epoch,user_attrs_validation_accuracy,user_attrs_validation_macro_f1,state
60,0.44665609170291165,2026-09-28 13:19:19.347314,2026-09-28 13:21:50.528294,0 days 00:02:31.180980,0.8937308239447614,0.9543322588848273,0.00034756785587131996,0.002768933635416275,64.0,0.08919902144820516,32,5,3,0.0900132014640117,32,5,2,0.010104196117428054,32,3,2,,,,,512,512,7,0.1355858298832165,12.0,3,Adam,,,,,,,PRUNED
61,0.5264118690698616,2026-09-28 13:21:50.650119,2026-09-28 13:25:07.197337,0 days 00:03:16.547218,0.8755307951709667,0.9562550762508628,0.00023391070805090704,0.005252963536826697,64.0,0.03954451998120658,32,5,3,0.09978194269962197,32,5,2,0.026320234716512216,32,3,2,,,,,512,512,7,0.16133612111674767,14.0,3,Adam,,,,,,,PRUNED
62,0.7908200638520955,2026-09-28 13:25:07.320518,2026-09-28 13:37:43.202753,0 days 00:12:35.882235,0.8573386248204892,0.9008133351705628,0.00043296154847757037,1.1317928555575155e-06,64.0,0.02780968249980317,32,5,3,0.07957725237368081,32,5,2,0.019217935684271492,32,3,2,,,,,512,512,7,0.10226080559984596,18.0,3,Adam,,,,47.0,0.8023809523809524,0.7792591753232385,COMPLETE
63,0.753442283787525,2026-09-28 13:37:43.339357,2026-09-28 13:50:19.709154,0 days 00:12:36.369797,0.857800132681701,0.9023205218217394,0.00010076192783461684,2.7731555667729586e-06,64.0,0.026618713489335245,32,5,3,0.07964430547109325,32,5,2,0.01994755862770309,32,3,2,,,,,512,512,7,0.10941213691505791,19.0,3,Adam,,,,49.0,0.75,0.7568845675750501,COMPLETE
64,0.758327283317298,2026-09-28 13:50:19.830805,2026-09-28 14:02:55.930560,0 days 00:12:36.099755,0.8697001955677283,0.9138020978243154,0.00014914894683053654,1.651432018304735e-06,64.0,0.03256472418012886,32,5,3,0.08226640170704681,32,5,2,0.01816137072745968,32,3,2,,,,,512,512,7,0.20833951163185763,17.0,3,Adam,,,,49.0,0.7619047619047619,0.7547498047298343,COMPLETE
65,0.3877768553541188,2026-09-28 14:02:56.064052,2026-09-28 14:05:27.401630,0 days 00:02:31.337578,,,,,64.0,0.033876039058016005,32,5,3,0.07378768398985958,32,5,2,0.03059173320684216,32,3,2,,,,,512,512,7,0.20243814533509252,18.0,3,SGD,0.0006544587067532486,0.7744757321258214,0.00032408381499815064,,,,PRUNED
66,0.4622613721121933,2026-09-28 14:05:27.521929,2026-09-28 14:06:11.632311,0 days 00:00:44.110382,0.8811370385226984,0.9088714166628858,0.00012436317386910642,1.1191730666355703e-06,64.0,0.023185951373255284,32,5,3,0.0879518218865324,32,5,2,0.09685361422135108,32,3,2,,,,,128,128,7,0.22584305294251814,19.0,3,Adam,,,,,,,PRUNED
67,0.7671249897811298,2026-09-28 14:06:11.753593,2026-09-28 14:18:47.901115,0 days 00:12:36.147522,0.8710358250822817,0.914159960964855,0.00016714985891655348,1.4588192620140005e-06,64.0,0.027898299863591505,32,5,3,0.08188273250437306,32,5,2,0.02248316013104384,32,3,2,,,,,512,512,7,0.1405907858688455,17.0,3,Adam,,,,49.0,0.780952380952381,0.7532975986098785,COMPLETE
68,0.4718895943844619,2026-09-28 14:18:48.023276,2026-09-28 14:21:32.385667,0 days 00:02:44.362391,0.8580439782859712,0.9003049767918742,0.0004119165921863597,1.038073949070055e-06,64.0,0.027881043246533174,32,7,3,0.06040844600434053,16,5,1,0.022598352770613676,32,3,2,,,,,512,512,7,0.1403583261671298,11.0,3,Adam,,,,,,,PRUNED
69,0.7658458727255719,2026-09-28 14:21:32.513909,2026-09-28 14:34:08.670873,0 days 00:12:36.156964,0.9012364043972032,0.9067403485954882,0.0002634872265768444,4.734146740643459e-06,64.0,0.04211727513575857,32,5,3,0.06672815921948282,32,5,2,0.013840725131971179,32,3,2,,,,,512,512,7,0.12450317826818358,14.0,3,Adam,,,,49.0,0.7738095238095238,0.7578822216416201,COMPLETE
70,0.5185866531791697,2026-09-28 14:34:08.794823,2026-09-28 14:36:40.033435,0 days 00:02:31.238612,0.8972371292808178,0.9067764288665993,0.0006464482386694358,2.1747860946062707e-06,64.0,0.041220265190627076,32,5,3,0.06679112608585058,32,5,2,0.08807423468144807,32,3,2,,,,,512,512,7,0.10295173734880962,15.0,3,Adam,,,,,,,PRUNED
71,0.7778962421091196,2026-09-28 14:36:40.155549,2026-09-28 14:49:16.387434,0 days 00:12:36.231885,0.9031001831897791,0.9161360242679665,0.0002742428359968478,6.640592310815577e-06,64.0,0.03676342730143693,32,5,3,0.07347583165852702,32,5,2,0.013370381014538975,32,3,2,,,,,512,512,7,0.12744804887551783,15.0,3,Adam,,,,50.0,0.7880952380952381,0.767697246123001,COMPLETE
72,0.768271868942211,2026-09-28 14:49:16.509903,2026-09-28 15:01:52.946622,0 days 00:12:36.436719,0.9038149765112511,0.9142257047754305,0.0002850989874086407,1.5632811511168264e-06,64.0,0.036234232639405686,32,5,3,0.07137689615512818,32,5,2,0.012930295940508207,32,3,2,,,,,512,512,7,0.130457825190655,15.0,3,Adam,,,,46.0,0.7690476190476191,0.767496118836803,COMPLETE
73,0.7664454504175722,2026-09-28 15:01:53.076688,2026-09-28 15:14:29.379186,0 days 00:12:36.302498,0.8913832185052601,0.9164532783600647,0.0002969034645090048,1.5148665195125662e-06,64.0,0.03632807084728964,32,5,3,0.0716577440384978,32,5,2,0.012962831092050476,32,3,2,,,,,512,512,7,0.13923080285915868,15.0,3,Adam,,,,49.0,0.7785714285714286,0.7543194722637158,COMPLETE
74,0.48536521748190437,2026-09-28 15:14:29.512197,2026-09-28 15:17:00.832937,0 days 00:02:31.320740,0.8811705706786555,0.9228774139981604,0.00018612881326497506,2.015388484517675e-06,64.0,0.03727303535008487,32,5,3,0.08193024269852497,32,5,2,0.019822171146349914,32,3,2,,,,,512,512,7,0.15243158710083551,13.0,3,Adam,,,,,,,PRUNED
75,0.7576830600122233,2026-09-28 15:17:00.960010,2026-09-28 15:22:37.966723,0 days 00:05:37.006713,0.8513532526519052,0.9140705839800121,0.00039718134250868665,3.433349157394008e-06,64.0,0.02011584360658239,32,5,3,0.07372746103567743,32,5,2,0.024026610323099416,32,3,2,,,,,512,256,7,0.11969006548376857,17.0,3,Adam,,,,46.0,0.780952380952381,0.7344137390720655,COMPLETE
76,0.40921805925482396,2026-09-28 15:22:38.097415,2026-09-28 15:26:08.185151,0 days 00:03:30.087736,0.9878593380880292,0.9294202519079114,0.00028783711756934476,1.3473740781014856e-05,128.0,0.014272697197355622,8,5,3,0.07655310369054762,32,5,2,0.014864235759962121,32,3,2,,,,,128,512,7,0.17158166646557954,16.0,3,Adam,,,,,,,PRUNED
77,0.4277310812602535,2026-09-28 15:26:08.308160,2026-09-28 15:27:49.085034,0 days 00:01:40.776874,,,,,64.0,0.0309565888472354,16,5,3,0.06330456501188751,32,5,2,0.018570479819161455,32,3,2,,,,,512,512,5,0.1471920331527684,19.0,3,SGD,0.0963993140266046,0.9003583563643648,0.00019212334378997678,,,,PRUNED
78,0.7657121351463296,2026-09-28 15:27:49.208339,2026-09-28 15:40:25.635778,0 days 00:12:36.427439,0.9056928753230475,0.9235918173996751,0.00017603444251487318,4.696859418664598e-06,64.0,0.03498545074797752,32,5,3,0.08869759327020774,32,5,2,0.03274494698207817,32,3,2,,,,,512,512,7,0.12100859725269526,12.0,3,Adam,,,,41.0,0.7666666666666667,0.7647576036259925,COMPLETE
79,0.5224505951894614,2026-09-28 15:40:25.758455,2026-09-28 15:43:09.670218,0 days 00:02:43.911763,0.8970762698674929,0.9116415698988939,0.0004756333831070775,0.000791762185915839,64.0,0.049341063393263454,32,7,3,0.09501334114280933,32,5,2,0.026603504824725063,32,3,2,,,,,512,512,7,0.1661441449496018,18.0,3,Adam,,,,,,,PRUNED
80,0.583406823023745,2026-09-28 15:43:09.807978,2026-09-28 15:44:24.951190,0 days 00:01:15.143212,0.8739737971021038,0.9041365177721996,0.00036924336943721113,1.4102964885897527e-06,64.0,0.026866818842952608,32,5,3,0.08116243765421982,16,5,2,0.011644846287836663,32,3,2,,,,,512,128,7,0.1005382171894838,15.0,3,Adam,,,,,,,PRUNED
81,0.7768679861035581,2026-09-28 15:44:25.080350,2026-09-28 15:57:01.491998,0 days 00:12:36.411648,0.8901166223790377,0.9191825801654212,0.0002749037273167915,1.2443667780610716e-06,64.0,0.03714746902924908,32,5,3,0.0710022514949073,32,5,2,0.012538480725280216,32,3,2,,,,,512,512,7,0.13796057695466912,14.0,3,Adam,,,,41.0,0.7857142857142857,0.7680216864928306,COMPLETE
82,0.7696660624055917,2026-09-28 15:57:01.621501,2026-09-28 16:09:37.982713,0 days 00:12:36.361212,0.8860598559492086,0.9197510459993582,0.00024357286335554366,2.258066412560768e-06,64.0,0.04033715017974243,32,5,3,0.06853421317619701,32,5,2,0.010109221547056915,32,3,2,,,,,512,512,7,0.13837172871195044,16.0,3,Adam,,,,50.0,0.780952380952381,0.7583797438588024,COMPLETE
83,0.7615519721204085,2026-09-28 16:09:38.108409,2026-09-28 16:22:14.525461,0 days 00:12:36.417052,0.8889985636440262,0.9206357077009095,0.00031064723658477824,1.00347224564041e-06,64.0,0.03899370211933616,32,5,3,0.07550027557242245,32,5,2,0.010016350947671785,32,3,2,,,,,512,512,7,0.14250322478879568,16.0,3,Adam,,,,43.0,0.7714285714285715,0.7516753728122456,COMPLETE
84,0.7466819460521903,2026-09-28 16:22:14.653008,2026-09-28 16:34:51.006550,0 days 00:12:36.353542,0.8807776850486426,0.9195365507063511,0.0002609758813179556,1.7852678862285541e-06,64.0,0.04103424835653867,32,5,3,0.06833479996277508,32,5,2,0.012679793805941487,32,3,2,,,,,512,512,7,0.12755602066514996,17.0,3,Adam,,,,42.0,0.7666666666666667,0.7266972254377139,COMPLETE
85,0.4976030735993968,2026-09-28 16:34:51.143245,2026-09-28 16:37:23.221395,0 days 00:02:32.078150,0.9097926824080693,0.9278790810057371,0.00024208932514559382,2.3576576394037684e-06,64.0,0.042628615122828624,32,5,3,0.05948262837693992,32,5,1,0.01809533120762136,32,3,2,,,,,512,512,7,0.11676420592134569,16.0,3,Adam,,,,,,,PRUNED
86,0.5392751006524726,2026-09-28 16:37:23.343415,2026-09-28 16:40:09.773020,0 days 00:02:46.429605,0.9013554151107467,0.9115027937195423,0.00045983958338927344,3.5774811284535503e-06,64.0,0.046331675673495165,32,5,3,0.06994945876952653,32,5,2,0.021081723746631042,32,3,2,,,,,512,512,7,0.15394223861021172,14.0,3,Adam,,,,,,,PRUNED
87,0.5286005021528168,2026-09-28 16:40:09.895153,2026-09-28 16:41:53.228458,0 days 00:01:43.333305,0.8930144974296848,0.9142061135414293,0.0003421444312288851,5.951402070471351e-05,64.0,0.029424743450203232,32,5,3,0.07338458408241297,32,5,2,0.014786311525724046,32,3,2,,,,,128,512,5,0.18977321874206182,15.0,3,Adam,,,,,,,PRUNED
88,0.45275656049677954,2026-09-28 16:41:53.350483,2026-09-28 16:43:06.588662,0 days 00:01:13.238179,0.8863216685047102,0.9261033160110665,0.00011853375798255033,1.3133187422365282e-06,128.0,0.023606712907516418,8,5,3,0.06455442205342533,32,5,2,0.01209473508271092,32,3,2,,,,,512,256,7,0.13460772276744307,14.0,3,Adam,,,,,,,PRUNED
89,0.6587692985718727,2026-09-28 16:43:06.725681,2026-09-28 16:50:40.571065,0 days 00:07:33.845384,,,,,64.0,0.0441695582701385,32,5,3,0.05392737944846879,32,5,2,0.02426906499256863,32,3,2,,,,,512,512,7,0.10052637000253238,18.0,3,SGD,0.00916643881695159,0.7515986516101516,6.2466392917505525e-06,,,,PRUNED
90,0.7609605930519666,2026-09-28 16:50:40.695131,2026-09-28 17:03:17.259803,0 days 00:12:36.564672,0.8736254311483216,0.9085234411024411,0.00016527096190872901,0.006876918493318433,64.0,0.035895626097445704,32,5,3,0.08418197154313237,64,5,2,0.017306565761718053,32,3,2,,,,,512,512,7,0.16529386713216257,17.0,3,Adam,,,,48.0,0.7833333333333333,0.7385878527705999,COMPLETE
91,0.5212351178685898,2026-09-28 17:03:17.383644,2026-09-28 17:05:48.742309,0 days 00:02:31.358665,0.8600507271252953,0.9332516173229196,0.0001828995625849864,0.003056277895805197,64.0,0.03208134890816318,32,5,3,0.0798620363748552,32,5,2,0.015504447990388068,32,3,2,,,,,512,512,7,0.11841354306534115,16.0,3,Adam,,,,,,,PRUNED
92,0.7421638138209079,2026-09-28 17:05:48.866257,2026-09-28 17:18:25.310691,0 days 00:12:36.444434,0.8797444916496896,0.921473334393465,0.00019911768352515752,0.001975978601623732,64.0,0.03979320187075572,32,5,3,0.0968752735086452,32,5,2,0.017146764567460417,32,3,2,,,,,512,512,7,0.19284629083834248,15.0,3,Adam,,,,47.0,0.7476190476190476,0.7367085800227681,COMPLETE
93,0.7697594752654864,2026-09-28 17:18:25.438340,2026-09-28 17:31:01.731748,0 days 00:12:36.293408,0.8716157103964522,0.9164360426470791,0.00022654822124929308,0.001331872648192182,64.0,0.03791782567511057,32,5,3,0.07218849938670466,32,5,2,0.01410816110111647,32,3,2,,,,,512,512,7,0.17465451876141913,13.0,3,Adam,,,,49.0,0.7857142857142857,0.7538046648166871,COMPLETE
94,0.7710127731582183,2026-09-28 17:31:01.861736,2026-09-28 17:43:38.134197,0 days 00:12:36.272461,0.8704587880030975,0.9172700961988274,0.00022788578029103,5.798457591353182e-06,64.0,0.037125472586595196,32,5,3,0.07617070666584871,32,5,2,0.013798822067864003,32,3,2,,,,,512,512,7,0.13867293039269915,13.0,3,Adam,,,,41.0,0.780952380952381,0.7610731653640556,COMPLETE
95,,2026-09-28 17:43:38.264211,2026-09-28 17:43:38.314410,0 days 00:00:00.050199,,,,,,0.03753164815284156,16,5,3,0.07736761673441521,32,5,2,0.01242704488026265,32,5,2,,,,,,512,7,,,3,,,,,,,,PRUNED
96,0.49696534074923715,2026-09-28 17:43:38.440691,2026-09-28 17:46:22.284416,0 days 00:02:43.843725,0.865464010228917,0.9175757207294877,0.000292016367155209,0.0005302062356485388,64.0,0.05348921693064033,32,7,3,0.07504770703841533,16,5,2,0.014124137632304827,32,3,2,,,,,512,512,7,0.13203603856411966,13.0,3,Adam,,,,,,,PRUNED
97,0.7799279887248395,2026-09-28 17:46:22.405629,2026-09-28 17:58:58.464359,0 days 00:12:36.058730,0.8854070419153716,0.916610815256413,0.00024158042054500713,6.417787574243153e-06,64.0,0.03471638975982846,32,5,3,0.07215774298868806,32,5,2,0.011375464650965374,32,3,2,,,,,512,512,7,0.2267787183487393,14.0,3,Adam,,,,48.0,0.7857142857142857,0.7741416917353933,COMPLETE
98,0.6424907376246956,2026-09-28 17:58:58.601490,2026-09-28 18:04:20.601308,0 days 00:05:21.999818,0.883376038819991,0.9642818950210311,0.00023023439494541947,7.201254956236939e-06,64.0,0.03477950314095425,32,5,3,0.06935317745368481,64,3,1,0.010175906879531836,32,5,2,,,,,512,512,5,0.2515734191497466,14.0,3,Adam,,,,,,,PRUNED
99,0.4867582954554866,2026-09-28 18:04:20.739149,2026-09-28 18:05:18.325904,0 days 00:00:57.586755,0.8877493198192318,0.9161392559700281,0.00023156298664933834,1.1973566886175694e-05,64.0,0.043437897970365395,32,5,3,0.07272074245605828,32,5,2,0.06940730416738619,32,3,2,,,,,512,128,7,0.2285848520720299,12.0,3,Adam,,,,,,,PRUNED
