number,value,datetime_start,datetime_complete,duration,params_adam_beta1,params_adam_beta2,params_adam_lr,params_adam_wd,params_batch_size,params_fc_dropout,params_fc_hidden,params_gru_hidden,params_lr_factor,params_lr_patience,params_optimizer,params_sgd_lr,params_sgd_momentum,params_sgd_wd,user_attrs_best_epoch,user_attrs_validation_accuracy,user_attrs_validation_macro_f1,state
0,1.0,2026-10-08 16:44:01.412932,2026-10-08 16:44:23.986921,0 days 00:00:22.573989,,,,,128,0.3005575058716044,512,128,0.24545997376568052,7,SGD,0.0812324508558869,0.9414083658321223,7.068974950624607e-06,2.0,1.0,1.0,COMPLETE
1,1.0,2026-10-08 16:44:24.127623,2026-10-08 16:44:54.601214,0 days 00:00:30.473591,,,,,64,0.2571172192068058,256,128,0.8591084298026667,20,SGD,0.006647135865318031,0.7494519958693145,1.8205657658407268e-06,3.0,1.0,1.0,COMPLETE
2,1.0,2026-10-08 16:44:54.742812,2026-10-08 16:45:26.071887,0 days 00:00:31.329075,0.958518595270556,0.9938559442622625,0.00023426581058204064,0.00755681014127443,64,0.15585553804470548,128,64,0.815861880342119,14,Adam,,,,2.0,1.0,1.0,COMPLETE
3,1.0,2026-10-08 16:45:26.214472,2026-10-08 16:45:45.703686,0 days 00:00:19.489214,,,,,200,0.07046211248738132,64,256,0.10441769369888193,18,SGD,0.09133995846860977,0.9239509830960306,6.235377135673162e-06,1.0,1.0,1.0,COMPLETE
4,1.0,2026-10-08 16:45:45.843674,2026-10-08 16:46:08.817812,0 days 00:00:22.974138,,,,,128,0.16259166101337352,64,512,0.670595829778396,17,SGD,0.04588156549160976,0.8369423282969652,3.0086868214458464e-06,1.0,1.0,1.0,COMPLETE
5,1.0,2026-10-08 16:46:08.958248,2026-10-08 16:46:28.558724,0 days 00:00:19.600476,0.860777187376031,0.9289461701460855,0.0032441600887341587,8.22607494622104e-06,200,0.4537832369630465,128,64,0.22897702980320356,19,Adam,,,,1.0,1.0,1.0,COMPLETE
6,1.0,2026-10-08 16:46:28.700560,2026-10-08 16:46:51.820226,0 days 00:00:23.119666,0.9215046223608592,0.941699359214563,0.005265761277157428,1.0661259689433902e-06,128,0.11396758127097084,128,256,0.2776862483765842,6,Adam,,,,1.0,1.0,1.0,COMPLETE
7,1.0,2026-10-08 16:46:51.962737,2026-10-08 16:47:15.219126,0 days 00:00:23.256389,0.8890105049931256,0.9907357620080687,0.0010124137770478635,1.6066267921727714e-06,128,0.1424202471887338,64,512,0.29164951253357796,7,Adam,,,,1.0,1.0,1.0,COMPLETE
8,0.6937313819844177,2026-10-08 16:47:15.360133,2026-10-08 16:47:19.345692,0 days 00:00:03.985559,,,,,200,0.04514488502720415,256,128,0.642051489473826,5,SGD,0.0003627066608804413,0.7118247910508815,0.00023097861492693574,,,,PRUNED
9,1.0,2026-10-08 16:47:19.488094,2026-10-08 16:47:51.524368,0 days 00:00:32.036274,0.9241510809698409,0.9241610438609551,0.004309673808203458,0.00016626592254031863,64,0.4386696766904905,512,512,0.17448221424471938,19,Adam,,,,2.0,1.0,1.0,COMPLETE
10,0.895569354451359,2026-10-08 16:47:51.666207,2026-10-08 16:47:56.354385,0 days 00:00:04.688178,,,,,128,0.3480589016791605,512,128,0.42621278356998393,10,SGD,0.00012637268261792882,0.9632227906319301,0.0069037170554346996,,,,PRUNED
11,1.0,2026-10-08 16:47:56.495412,2026-10-08 16:48:27.174123,0 days 00:00:30.678711,,,,,64,0.2886031653384483,256,128,0.897983462713807,13,SGD,0.006500680205231919,0.7082391522748519,1.12480264296506e-06,3.0,1.0,1.0,COMPLETE
12,1.0,2026-10-08 16:48:27.321109,2026-10-08 16:48:57.856317,0 days 00:00:30.535208,,,,,64,0.28869434643716857,256,128,0.47129274322054915,10,SGD,0.0069527727260754015,0.8226334120666466,2.260939122696824e-05,3.0,1.0,1.0,COMPLETE
13,1.0,2026-10-08 16:48:57.999563,2026-10-08 16:49:28.589512,0 days 00:00:30.589949,,,,,64,0.24169375572068388,512,128,0.5383950547702598,15,SGD,0.008311692998519249,0.8338074034511974,2.7340679272843e-05,2.0,1.0,1.0,COMPLETE
14,0.9983806975807064,2026-10-08 16:49:28.732307,2026-10-08 16:49:33.371777,0 days 00:00:04.639470,,,,,128,0.3771115882305568,256,128,0.7357162912896711,10,SGD,0.0015543415970421359,0.8927392115942876,2.0464153798486234e-05,,,,PRUNED
15,1.0,2026-10-08 16:49:33.514202,2026-10-08 16:49:56.260657,0 days 00:00:22.746455,,,,,128,0.213015612264284,512,128,0.41373566355554947,12,SGD,0.02866538450261492,0.7692481501878534,1.0048802521731842e-06,1.0,1.0,1.0,COMPLETE
16,1.0,2026-10-08 16:49:56.401917,2026-10-08 16:50:27.184808,0 days 00:00:30.782891,,,,,64,0.34875262419891584,256,128,0.599797007271762,20,SGD,0.0015770063038952262,0.9702268778426302,0.0001353113314143317,2.0,1.0,1.0,COMPLETE
17,1.0,2026-10-08 16:50:27.326620,2026-10-08 16:50:58.109571,0 days 00:00:30.782951,,,,,64,0.28487429798487546,512,64,0.3792831738634399,16,SGD,0.01962116917992928,0.7702215615998731,6.096393461206913e-06,2.0,1.0,1.0,COMPLETE
18,1.0,2026-10-08 16:50:58.252094,2026-10-08 16:51:20.931705,0 days 00:00:22.679611,,,,,128,0.22105406402516284,512,256,0.7773625227496351,7,SGD,0.0019750284592868544,0.8878906339931918,0.00011363827435224601,7.0,1.0,1.0,COMPLETE
19,1.0,2026-10-08 16:51:21.074160,2026-10-08 16:51:40.486796,0 days 00:00:19.412636,,,,,200,0.4981126922026228,256,128,0.885050469406635,12,SGD,0.09725501632936334,0.7696227629333837,3.5898785633183133e-06,1.0,1.0,1.0,COMPLETE
20,1.0,2026-10-08 16:51:40.635232,2026-10-08 16:52:11.289575,0 days 00:00:30.654343,,,,,64,0.40195079063807543,256,128,0.529464932626945,8,SGD,0.014329089650875093,0.9209725080040257,0.006974425952565119,1.0,1.0,1.0,COMPLETE
21,1.0,2026-10-08 16:52:11.432506,2026-10-08 16:52:43.010581,0 days 00:00:31.578075,0.9858531726862527,0.9966783836700993,0.000128776051317125,0.009769656942728053,64,0.17944463479662964,128,64,0.7991962372901166,14,Adam,,,,6.0,1.0,1.0,COMPLETE
22,1.0,2026-10-08 16:52:43.153343,2026-10-08 16:53:14.585348,0 days 00:00:31.432005,0.989917889172276,0.961406526107593,0.00015592909915154122,0.007609571827388239,64,0.005301365685437376,128,64,0.8148318564734891,16,Adam,,,,3.0,1.0,1.0,COMPLETE
23,1.0,2026-10-08 16:53:14.728032,2026-10-08 16:53:46.313510,0 days 00:00:31.585478,0.9450895617598649,0.9654953516119078,0.0005581364395161335,0.0003873914417855201,64,0.26106749425047765,128,64,0.7081338241112414,9,Adam,,,,1.0,1.0,1.0,COMPLETE
24,1.0,2026-10-08 16:53:46.455948,2026-10-08 16:54:17.928794,0 days 00:00:31.472846,0.9561641336902341,0.9013161786866084,0.00048205638280334514,0.00012113264883906514,64,0.1148301759040084,128,64,0.8412978801704134,12,Adam,,,,2.0,1.0,1.0,COMPLETE
25,1.0,2026-10-08 16:54:18.073324,2026-10-08 16:54:41.006658,0 days 00:00:22.933334,0.8510871962787233,0.9750167539336848,0.001579359289049003,0.0011158833004946606,128,0.3248415310895951,128,64,0.7364614056654826,14,Adam,,,,1.0,1.0,1.0,COMPLETE
26,1.0,2026-10-08 16:54:41.148039,2026-10-08 16:55:14.970865,0 days 00:00:33.822826,0.8877305624105759,0.9025225743564163,0.0002802287426947312,1.961127995666095e-05,64,0.20620848751949178,512,256,0.6059253809608157,20,Adam,,,,1.0,1.0,1.0,COMPLETE
27,1.0,2026-10-08 16:55:15.115921,2026-10-08 16:55:46.659326,0 days 00:00:31.543405,,,,,64,0.260051912478406,64,512,0.31571428135599877,17,SGD,0.003177006711905028,0.9855988572155746,0.0007335484607354498,2.0,1.0,1.0,COMPLETE
28,1.0,2026-10-08 16:55:46.802900,2026-10-08 16:56:06.520126,0 days 00:00:19.717226,0.9611689288337257,0.949475917503,0.007721995018057831,0.0013671857892267889,200,0.32577581921332854,512,128,0.8599145345397455,5,Adam,,,,1.0,1.0,1.0,COMPLETE
29,0.9509386377814544,2026-10-08 16:56:06.661877,2026-10-08 16:56:11.316191,0 days 00:00:04.654314,,,,,128,0.08147127601650368,64,256,0.11295627529595176,18,SGD,0.00038866764924773043,0.7421985470916721,1.0631921076731615e-05,,,,PRUNED
30,0.8066454382710556,2026-10-08 16:56:11.459900,2026-10-08 16:56:15.389461,0 days 00:00:03.929561,,,,,200,0.1838211238303765,128,64,0.7692257635872495,11,SGD,0.0005553602525053792,0.8016797594344486,5.495658412540857e-05,,,,PRUNED
31,1.0,2026-10-08 16:56:15.530173,2026-10-08 16:56:35.083556,0 days 00:00:19.553383,,,,,200,0.055552270028223744,64,256,0.13697201660631045,18,SGD,0.09459526454484286,0.9241563848654223,2.6296383393546625e-06,1.0,1.0,1.0,COMPLETE
32,1.0,2026-10-08 16:56:35.226795,2026-10-08 16:56:54.834110,0 days 00:00:19.607315,,,,,200,0.15422311798016436,64,256,0.19627439829618254,18,SGD,0.04361666609430634,0.8767842204779352,7.907353700148394e-06,1.0,1.0,1.0,COMPLETE
33,1.0,2026-10-08 16:56:54.974431,2026-10-08 16:57:14.604677,0 days 00:00:19.630246,,,,,200,0.12392312679604185,64,256,0.2378795055103487,19,SGD,0.046761882281658576,0.9532749582708,2.15379138926181e-06,2.0,1.0,1.0,COMPLETE
34,1.0,2026-10-08 16:57:14.745980,2026-10-08 16:57:34.396157,0 days 00:00:19.650177,,,,,200,0.0020346162094565523,64,512,0.3297327495381107,17,SGD,0.06484691104519225,0.8628081711693605,9.224922476430067e-06,1.0,1.0,1.0,COMPLETE
35,1.0,2026-10-08 16:57:34.538541,2026-10-08 16:57:57.729741,0 days 00:00:23.191200,0.8987952830152882,0.9823614220397617,0.0017647974238785382,2.2127075293602086e-05,128,0.07881545064485326,128,256,0.16992118969906625,20,Adam,,,,1.0,1.0,1.0,COMPLETE
36,1.0,2026-10-08 16:57:57.874873,2026-10-08 16:58:17.385501,0 days 00:00:19.510628,,,,,200,0.09232827030032364,64,512,0.24202617466530169,16,SGD,0.019911183323715626,0.9173727306226784,5.34288210628721e-06,2.0,1.0,1.0,COMPLETE
37,1.0,2026-10-08 16:58:17.527230,2026-10-08 16:58:40.636814,0 days 00:00:23.109584,0.9161343218814132,0.9158676678192704,0.0002526952424276043,4.960033626323705e-06,128,0.04886527234709975,256,128,0.11184050451402494,19,Adam,,,,2.0,1.0,1.0,COMPLETE
38,1.0,2026-10-08 16:58:40.777713,2026-10-08 16:59:11.347957,0 days 00:00:30.570244,,,,,64,0.14563941243963455,256,64,0.690466060666597,17,SGD,0.004156501096397349,0.9325531197128918,1.8276011030466825e-06,2.0,1.0,1.0,COMPLETE
39,1.0,2026-10-08 16:59:11.492880,2026-10-08 16:59:34.884640,0 days 00:00:23.391760,0.8714596939488823,0.9415848380932806,0.009741006954424015,5.305239654822781e-05,128,0.17736606973900806,512,128,0.6305755571445564,14,Adam,,,,2.0,1.0,1.0,COMPLETE
40,1.0,2026-10-08 16:59:35.025582,2026-10-08 16:59:54.512355,0 days 00:00:19.486773,,,,,200,0.3109488471175035,128,256,0.26369992005109266,6,SGD,0.012320392897935116,0.9899108150152339,1.1590301153287804e-05,3.0,1.0,1.0,COMPLETE
41,1.0,2026-10-08 16:59:54.653474,2026-10-08 17:00:17.488501,0 days 00:00:22.835027,,,,,128,0.2432129913424584,64,512,0.6707618337793745,19,SGD,0.03940088019382188,0.8497991859764288,2.8768716759267707e-06,1.0,1.0,1.0,COMPLETE
42,1.0,2026-10-08 17:00:17.633520,2026-10-08 17:00:40.617646,0 days 00:00:22.984126,,,,,128,0.15268763086627485,64,512,0.8354145369700846,15,SGD,0.06612067255226423,0.8063410562936757,3.891933956162947e-06,1.0,1.0,1.0,COMPLETE
43,1.0,2026-10-08 17:00:40.764457,2026-10-08 17:01:03.594308,0 days 00:00:22.829851,,,,,128,0.03231921859435727,64,512,0.5475922445294001,18,SGD,0.029898596349477412,0.9463159822746094,1.6311597499021766e-06,2.0,1.0,1.0,COMPLETE
44,1.0,2026-10-08 17:01:03.749083,2026-10-08 17:01:26.613767,0 days 00:00:22.864684,,,,,128,0.38213343009851075,64,128,0.881473516485439,20,SGD,0.060531996941319645,0.9034490147680533,1.512275138690136e-05,2.0,1.0,1.0,COMPLETE
45,1.0,2026-10-08 17:01:26.756194,2026-10-08 17:01:57.752302,0 days 00:00:30.996108,,,,,64,0.1277912051721951,256,512,0.20194103568446164,17,SGD,0.09067202308774634,0.7331207509967839,4.879871979333212e-06,1.0,1.0,1.0,COMPLETE
46,1.0,2026-10-08 17:01:57.904570,2026-10-08 17:02:20.665362,0 days 00:00:22.760792,,,,,128,0.0985920452050793,512,128,0.4859081978520516,15,SGD,0.0293589625949398,0.862596195665745,4.363156858073536e-05,1.0,1.0,1.0,COMPLETE
47,0.9967240696737336,2026-10-08 17:02:20.805938,2026-10-08 17:02:27.037311,0 days 00:00:06.231373,,,,,64,0.20227339620413415,256,128,0.7620172324818267,8,SGD,0.000760386233575988,0.7974971577111692,0.000603848225395029,,,,PRUNED
48,0.8367155707069815,2026-10-08 17:02:27.178925,2026-10-08 17:02:31.880181,0 days 00:00:04.701256,,,,,128,0.25765364479577385,512,512,0.37810146642587183,19,SGD,0.00020102822262786974,0.7027399416202574,1.472224016892928e-06,,,,PRUNED
49,1.0,2026-10-08 17:02:32.024052,2026-10-08 17:03:03.617041,0 days 00:00:31.592989,0.9714721061103088,0.9571275926732231,0.00010414112000381409,0.002400497743110368,64,0.23208076861508986,64,128,0.8045649646787965,13,Adam,,,,3.0,1.0,1.0,COMPLETE
