number,value,datetime_start,datetime_complete,duration,params_adam_beta1,params_adam_beta2,params_adam_lr,params_adam_wd,params_batch_size,params_block_0_dropout,params_block_0_filters,params_block_0_kernel,params_block_0_stride,params_block_1_dropout,params_block_1_filters,params_block_1_kernel,params_block_1_stride,params_block_2_dropout,params_block_2_filters,params_block_2_kernel,params_block_2_stride,params_block_3_dropout,params_block_3_filters,params_block_3_kernel,params_block_3_stride,params_fc_hidden,params_first_conv_filters,params_first_conv_kernel_size,params_lr_factor,params_lr_patience,params_n_blocks,params_optimizer,params_sgd_lr,params_sgd_momentum,params_sgd_wd,user_attrs_best_epoch,user_attrs_validation_accuracy,user_attrs_validation_macro_f1,system_attrs_tpe:relative_params:0,state
0,0.3920408069632492,2026-09-17 20:11:12.823100,2026-09-17 20:13:54.253385,0 days 00:02:41.430285,0.9828439752154666,0.9964666401041485,0.00021930485556643703,1.8205657658407268e-06,64.0,0.2216968971838151,8,5,1,0.41407038455720546,16,5,3,,,,,,,,,256,16,7,0.5850384088698767,9.0,2,Adam,,,,48.0,0.40828402366863903,0.3757975902578594,,COMPLETE
1,0.3401123449200372,2026-09-17 20:13:54.406403,2026-09-17 20:16:43.129891,0 days 00:02:48.723488,0.9372617377558581,0.9330567126827797,0.0001705053926026929,0.0028340904295147754,256.0,0.1783931449676581,32,5,2,0.15636968998990508,64,3,3,0.42618457138193366,128.0,3.0,1.0,,,,,256,32,5,0.13813501017161417,9.0,3,Adam,,,,46.0,0.3609467455621302,0.31927794427794426,,COMPLETE
2,0.32031204448786865,2026-09-17 20:16:43.253819,2026-09-17 20:18:51.090782,0 days 00:02:07.836963,0.9215046223608592,0.941699359214563,0.005265761277157428,1.0661259689433902e-06,64.0,0.19971689165954998,8,3,3,0.35336150260416943,32,3,2,0.45843651996939727,32.0,3.0,1.0,,,,,64,32,3,0.23326468628243816,6.0,3,Adam,,,,20.0,0.34911242603550297,0.2915116629402344,,COMPLETE
3,0.18481367526062578,2026-09-17 20:18:51.213384,2026-09-17 20:22:55.849926,0 days 00:04:04.636542,,,,,256.0,0.2957811041110252,32,7,1,0.3534118843043579,16,5,1,,,,,,,,,256,32,7,0.1099526973567137,13.0,2,SGD,0.0001325334260006654,0.8713589535245901,0.0005131654955148327,45.0,0.24260355029585798,0.12702380022539358,,COMPLETE
4,0.24682323931773553,2026-09-17 20:22:55.983881,2026-09-17 20:25:01.792281,0 days 00:02:05.808400,,,,,64.0,0.35324058290930715,32,7,3,0.1646514856378455,64,5,1,0.16432322056699947,32.0,3.0,2.0,0.2301598792637071,128.0,3.0,2.0,256,16,3,0.24639378602745016,20.0,4,SGD,0.000190996013855054,0.8066375828872356,1.150295632191274e-05,46.0,0.26627218934911245,0.22737428928635858,,COMPLETE
5,0.19675874946997268,2026-09-17 20:25:01.923235,2026-09-17 20:25:31.609340,0 days 00:00:29.686105,0.9728322300699137,0.974002784913645,0.00019061980918553997,0.00011839097834757703,256.0,0.48666192761746785,32,7,2,0.47446190966431245,16,3,3,,,,,,,,,64,16,5,0.5182094445971608,16.0,2,Adam,,,,,,,,PRUNED
6,,2026-09-17 20:25:31.739053,2026-09-17 20:25:31.828314,0 days 00:00:00.089261,,,,,,0.21461650085131379,16,3,3,0.1863284109987373,16,5,3,0.3904365334890646,32.0,3.0,3.0,0.1313825525369064,64.0,3.0,1.0,,16,5,,,4,,,,,,,,,PRUNED
7,0.18047960092539542,2026-09-17 20:25:31.937273,2026-09-17 20:26:09.314016,0 days 00:00:37.376743,,,,,256.0,0.267840024971116,32,3,1,0.3814631437520095,64,3,3,,,,,,,,,256,16,7,0.48105619052058624,5.0,2,SGD,0.002002418955187057,0.8155663729752383,0.0002906701215322915,,,,,PRUNED
8,,2026-09-17 20:26:09.417251,2026-09-17 20:26:09.491609,0 days 00:00:00.074358,,,,,,0.1783164539157186,32,3,2,0.10930877429433035,32,3,3,0.3940284175215544,32.0,3.0,3.0,0.26504707076457057,64.0,3.0,3.0,,8,7,,,4,,,,,,,,,PRUNED
9,0.15516140334022643,2026-09-17 20:26:09.582811,2026-09-17 20:33:33.417780,0 days 00:07:23.834969,,,,,256.0,0.46215279056770553,32,5,1,0.2314658181479664,64,5,1,0.12302350400665772,128.0,3.0,1.0,0.40460425268698896,256.0,3.0,1.0,64,16,7,0.15090262845111516,20.0,4,SGD,0.02921327035221024,0.904810245875384,2.1154127741888562e-06,,,,,PRUNED
10,0.2889207502117258,2026-09-17 20:33:33.547182,2026-09-17 20:35:49.705132,0 days 00:02:16.157950,0.8663147368044435,0.999036441842644,0.0024792013326598596,1.368363201474311e-06,32.0,0.33125155544848317,8,5,1,0.2502746524800842,16,5,3,0.2775394130445563,64.0,3.0,2.0,,,,,128,8,7,0.6613371256488547,11.0,3,Adam,,,,,,,"{""block_0_dropout"": 0.33125155544848317, ""block_0_filters"": 8, ""block_0_kernel"": 5, ""block_0_stride"": 1, ""block_1_dropout"": 0.2502746524800842, ""block_1_filters"": 16, ""block_1_kernel"": 5, ""block_1_stride"": 3, ""first_conv_filters"": 8, ""first_conv_kernel_size"": 7, ""n_blocks"": 3}",PRUNED
11,0.24450435892095357,2026-09-17 20:35:49.819567,2026-09-17 20:38:11.165652,0 days 00:02:21.346085,0.9880226306370306,0.9011273725717035,0.00017879177567110856,0.009639757903159489,128.0,0.17127347459965686,8,5,1,0.4613915011110072,16,5,3,,,,,,,,,256,32,7,0.3787217785991117,9.0,2,Adam,,,,,,,"{""block_0_dropout"": 0.17127347459965686, ""block_0_filters"": 8, ""block_0_kernel"": 5, ""block_0_stride"": 1, ""block_1_dropout"": 0.4613915011110072, ""block_1_filters"": 16, ""block_1_kernel"": 5, ""block_1_stride"": 3, ""first_conv_filters"": 32, ""first_conv_kernel_size"": 7, ""n_blocks"": 2}",PRUNED
12,0.26185865474745834,2026-09-17 20:38:11.291681,2026-09-17 20:40:33.840362,0 days 00:02:22.548681,0.9396599001867274,0.9353250570837559,0.0001015123825150418,0.00562658180492871,64.0,0.2680025590139372,32,5,3,0.3210759180418873,64,3,3,0.23201292762482023,128.0,3.0,1.0,0.44034571788967014,256.0,3.0,3.0,256,32,5,0.6876553550636466,9.0,4,Adam,,,,,,,"{""block_0_dropout"": 0.2680025590139372, ""block_0_filters"": 32, ""block_0_kernel"": 5, ""block_0_stride"": 3, ""block_1_dropout"": 0.3210759180418873, ""block_1_filters"": 64, ""block_1_kernel"": 3, ""block_1_stride"": 3, ""first_conv_filters"": 32, ""first_conv_kernel_size"": 5, ""n_blocks"": 4}",PRUNED
13,0.5086796755824605,2026-09-17 20:40:33.946945,2026-09-17 20:43:18.782325,0 days 00:02:44.835380,0.9377070478972264,0.9588434704435519,0.0007259457479364275,5.1905519853860966e-05,128.0,0.2055649785902877,32,5,2,0.22690241308090559,64,3,3,0.2961881509128239,128.0,3.0,1.0,,,,,128,32,5,0.37098036164825715,8.0,3,Adam,,,,50.0,0.5266272189349113,0.4907321322300097,"{""block_0_dropout"": 0.2055649785902877, ""block_0_filters"": 32, ""block_0_kernel"": 5, ""block_0_stride"": 2, ""block_1_dropout"": 0.22690241308090559, ""block_1_filters"": 64, ""block_1_kernel"": 3, ""block_1_stride"": 3, ""first_conv_filters"": 32, ""first_conv_kernel_size"": 5, ""n_blocks"": 3}",COMPLETE
14,0.41187862868252256,2026-09-17 20:43:18.931374,2026-09-17 20:46:23.077394,0 days 00:03:04.146020,0.9085415715194903,0.9961146071857502,0.000780987381338768,2.3204538977022535e-05,128.0,0.1082912923872042,32,5,1,0.3472148539998572,64,3,3,0.29937865333021163,64.0,3.0,1.0,0.3544973862256166,128.0,3.0,2.0,128,32,5,0.5477463095015158,7.0,4,Adam,,,,44.0,0.4319526627218935,0.3918045946431517,"{""block_0_dropout"": 0.1082912923872042, ""block_0_filters"": 32, ""block_0_kernel"": 5, ""block_0_stride"": 1, ""block_1_dropout"": 0.3472148539998572, ""block_1_filters"": 64, ""block_1_kernel"": 3, ""block_1_stride"": 3, ""first_conv_filters"": 32, ""first_conv_kernel_size"": 5, ""n_blocks"": 4}",COMPLETE
15,0.42266845894082405,2026-09-17 20:46:23.215863,2026-09-17 20:49:22.701773,0 days 00:02:59.485910,0.8954226754131689,0.9689209104332411,0.0008717854608689005,3.89441649808242e-05,128.0,0.13351345491650946,32,5,1,0.31380711653262705,32,3,3,0.2881117492312341,64.0,3.0,1.0,,,,,128,32,5,0.38636623282858534,7.0,3,Adam,,,,39.0,0.4437869822485207,0.40154993563312746,"{""block_0_dropout"": 0.13351345491650946, ""block_0_filters"": 32, ""block_0_kernel"": 5, ""block_0_stride"": 1, ""block_1_dropout"": 0.31380711653262705, ""block_1_filters"": 32, ""block_1_kernel"": 3, ""block_1_stride"": 3, ""first_conv_filters"": 32, ""first_conv_kernel_size"": 5, ""n_blocks"": 3}",COMPLETE
16,0.16381567197232239,2026-09-17 20:49:22.832036,2026-09-17 20:49:55.999788,0 days 00:00:33.167752,0.8719577647904572,0.9633378979581148,0.0008313492322905595,4.553727373930543e-05,128.0,0.31328869800968523,32,5,1,0.348457625249637,32,3,3,0.321550294283921,64.0,3.0,1.0,,,,,128,16,5,0.37734567556675536,14.0,3,Adam,,,,,,,"{""block_0_dropout"": 0.31328869800968523, ""block_0_filters"": 32, ""block_0_kernel"": 5, ""block_0_stride"": 1, ""block_1_dropout"": 0.348457625249637, ""block_1_filters"": 32, ""block_1_kernel"": 3, ""block_1_stride"": 3, ""first_conv_filters"": 16, ""first_conv_kernel_size"": 5, ""n_blocks"": 3}",PRUNED
17,0.4704146478586687,2026-09-17 20:49:56.124942,2026-09-17 20:52:41.067751,0 days 00:02:44.942809,0.8895519316540555,0.9634094322392063,0.0008903171097161028,0.0002806947344153205,128.0,0.3211182774533561,32,5,2,0.2513786359799904,64,3,2,0.21097939985432823,128.0,3.0,1.0,,,,,128,32,5,0.4028687569005909,7.0,3,Adam,,,,48.0,0.4911242603550296,0.4497050353623078,"{""block_0_dropout"": 0.3211182774533561, ""block_0_filters"": 32, ""block_0_kernel"": 5, ""block_0_stride"": 2, ""block_1_dropout"": 0.2513786359799904, ""block_1_filters"": 64, ""block_1_kernel"": 3, ""block_1_stride"": 2, ""first_conv_filters"": 32, ""first_conv_kernel_size"": 5, ""n_blocks"": 3}",COMPLETE
18,0.5108170817365657,2026-09-17 20:52:41.179284,2026-09-17 20:55:39.437817,0 days 00:02:58.258533,0.8501682858363813,0.9514426929133146,0.001505054316476214,0.0005164158061089661,128.0,0.25589088955546324,32,5,2,0.26495242925649465,64,3,2,,,,,,,,,128,32,7,0.44668582735443796,11.0,2,Adam,,,,34.0,0.5443786982248521,0.47725546524827933,"{""block_0_dropout"": 0.25589088955546324, ""block_0_filters"": 32, ""block_0_kernel"": 5, ""block_0_stride"": 2, ""block_1_dropout"": 0.26495242925649465, ""block_1_filters"": 64, ""block_1_kernel"": 3, ""block_1_stride"": 2, ""first_conv_filters"": 32, ""first_conv_kernel_size"": 7, ""n_blocks"": 2}",COMPLETE
19,0.2771763480192223,2026-09-17 20:55:39.581390,2026-09-17 20:56:33.325012,0 days 00:00:53.743622,0.8521647727158504,0.9512805800757691,0.0021564143737035995,0.0006789746020298115,32.0,0.23027823235056621,32,5,2,0.35205939336733233,64,3,2,0.35583574639832083,128.0,3.0,3.0,,,,,128,32,7,0.4533463529358347,12.0,3,Adam,,,,,,,"{""block_0_dropout"": 0.23027823235056621, ""block_0_filters"": 32, ""block_0_kernel"": 5, ""block_0_stride"": 2, ""block_1_dropout"": 0.35205939336733233, ""block_1_filters"": 64, ""block_1_kernel"": 3, ""block_1_stride"": 2, ""first_conv_filters"": 32, ""first_conv_kernel_size"": 7, ""n_blocks"": 3}",PRUNED
20,0.1447506061752013,2026-09-17 20:56:33.435568,2026-09-17 20:57:04.918842,0 days 00:00:31.483274,,,,,128.0,0.20607664825228197,8,5,2,0.18728073848002844,16,3,3,,,,,,,,,128,32,5,0.31257841306607825,16.0,2,SGD,0.07061567170837073,0.985598047175544,0.0067272725254837115,,,,"{""block_0_dropout"": 0.20607664825228197, ""block_0_filters"": 8, ""block_0_kernel"": 5, ""block_0_stride"": 2, ""block_1_dropout"": 0.18728073848002844, ""block_1_filters"": 16, ""block_1_kernel"": 3, ""block_1_stride"": 3, ""first_conv_filters"": 32, ""first_conv_kernel_size"": 5, ""n_blocks"": 2}",PRUNED
21,0.45619684340708966,2026-09-17 20:57:05.051240,2026-09-17 20:59:46.626992,0 days 00:02:41.575752,0.8811826239907072,0.9627344601061025,0.0017103360577111792,0.0003686050689657103,128.0,0.286322915875842,32,5,2,0.25347141375416965,64,3,3,0.2209156160415731,128.0,3.0,1.0,,,,,128,32,5,0.4280938147305269,11.0,3,Adam,,,,35.0,0.47928994082840237,0.4331037459857769,"{""block_0_dropout"": 0.286322915875842, ""block_0_filters"": 32, ""block_0_kernel"": 5, ""block_0_stride"": 2, ""block_1_dropout"": 0.25347141375416965, ""block_1_filters"": 64, ""block_1_kernel"": 3, ""block_1_stride"": 3, ""first_conv_filters"": 32, ""first_conv_kernel_size"": 5, ""n_blocks"": 3}",COMPLETE
22,0.2443936440998345,2026-09-17 20:59:46.766257,2026-09-17 21:00:21.379559,0 days 00:00:34.613302,0.8869329324799242,0.951259179322097,0.0004317245761758955,0.0006852420731098953,128.0,0.3499030071258606,16,5,2,0.24413611705485738,64,3,2,0.2066175040015347,128.0,3.0,2.0,,,,,128,32,5,0.31882360254128383,7.0,3,Adam,,,,,,,"{""block_0_dropout"": 0.3499030071258606, ""block_0_filters"": 16, ""block_0_kernel"": 5, ""block_0_stride"": 2, ""block_1_dropout"": 0.24413611705485738, ""block_1_filters"": 64, ""block_1_kernel"": 3, ""block_1_stride"": 2, ""first_conv_filters"": 32, ""first_conv_kernel_size"": 5, ""n_blocks"": 3}",PRUNED
23,0.45329647435470305,2026-09-17 21:00:21.517251,2026-09-17 21:03:01.770481,0 days 00:02:40.253230,0.850597686828439,0.9796907712252322,0.0004836978084588489,0.00018834208030556345,128.0,0.14359374850099071,32,5,2,0.2650000998657467,64,3,3,,,,,,,,,128,32,5,0.31865956798826933,10.0,2,Adam,,,,47.0,0.4970414201183432,0.4095515285910629,"{""block_0_dropout"": 0.14359374850099071, ""block_0_filters"": 32, ""block_0_kernel"": 5, ""block_0_stride"": 2, ""block_1_dropout"": 0.2650000998657467, ""block_1_filters"": 64, ""block_1_kernel"": 3, ""block_1_stride"": 3, ""first_conv_filters"": 32, ""first_conv_kernel_size"": 5, ""n_blocks"": 2}",COMPLETE
24,0.4835892304734022,2026-09-17 21:03:01.892896,2026-09-17 21:06:12.939078,0 days 00:03:11.046182,0.9558662660756004,0.9208712221223239,0.0013732414875522033,1.2852352786638927e-05,128.0,0.24810078119485313,32,7,2,0.29795044772017487,64,3,2,,,,,,,,,128,32,7,0.4427467915294681,5.0,2,Adam,,,,43.0,0.5088757396449705,0.45830272130183397,"{""block_0_dropout"": 0.24810078119485313, ""block_0_filters"": 32, ""block_0_kernel"": 7, ""block_0_stride"": 2, ""block_1_dropout"": 0.29795044772017487, ""block_1_filters"": 64, ""block_1_kernel"": 3, ""block_1_stride"": 2, ""first_conv_filters"": 32, ""first_conv_kernel_size"": 7, ""n_blocks"": 2}",COMPLETE
25,0.2510866095549264,2026-09-17 21:06:13.080701,2026-09-17 21:06:50.139966,0 days 00:00:37.059265,0.955657453370048,0.9184713898757756,0.003922505873382274,7.860422074209677e-06,128.0,0.24994950865959412,32,7,2,0.2925076242272726,64,3,2,,,,,,,,,128,16,7,0.5946096665082586,5.0,2,Adam,,,,,,,"{""block_0_dropout"": 0.24994950865959412, ""block_0_filters"": 32, ""block_0_kernel"": 7, ""block_0_stride"": 2, ""block_1_dropout"": 0.2925076242272726, ""block_1_filters"": 64, ""block_1_kernel"": 3, ""block_1_stride"": 2, ""first_conv_filters"": 16, ""first_conv_kernel_size"": 7, ""n_blocks"": 2}",PRUNED
26,0.27526863389025935,2026-09-17 21:06:50.247005,2026-09-17 21:07:35.626676,0 days 00:00:45.379671,0.9608374927911438,0.9119281889135596,0.001464506693165615,6.183196694859851e-06,32.0,0.34296580602183135,32,5,2,0.40433329290660536,64,3,2,,,,,,,,,128,32,7,0.48825237324019366,8.0,2,Adam,,,,,,,"{""block_0_dropout"": 0.34296580602183135, ""block_0_filters"": 32, ""block_0_kernel"": 5, ""block_0_stride"": 2, ""block_1_dropout"": 0.40433329290660536, ""block_1_filters"": 64, ""block_1_kernel"": 3, ""block_1_stride"": 2, ""first_conv_filters"": 32, ""first_conv_kernel_size"": 7, ""n_blocks"": 2}",PRUNED
27,0.21326803346681816,2026-09-17 21:07:35.758018,2026-09-17 21:08:26.187500,0 days 00:00:50.429482,0.9383037235693028,0.9233563967278655,0.008759894607127993,1.2644211556591928e-05,128.0,0.27901930971714806,32,7,2,0.4144492955792942,64,3,2,0.4930809651964778,128.0,3.0,3.0,,,,,128,32,7,0.2612083041992981,5.0,3,Adam,,,,,,,"{""block_0_dropout"": 0.27901930971714806, ""block_0_filters"": 32, ""block_0_kernel"": 7, ""block_0_stride"": 2, ""block_1_dropout"": 0.4144492955792942, ""block_1_filters"": 64, ""block_1_kernel"": 3, ""block_1_stride"": 2, ""first_conv_filters"": 32, ""first_conv_kernel_size"": 7, ""n_blocks"": 3}",PRUNED
28,0.22334411455290573,2026-09-17 21:08:26.302334,2026-09-17 21:09:03.217798,0 days 00:00:36.915464,,,,,128.0,0.25828644053079947,32,5,2,0.169914037829702,64,3,1,,,,,,,,,64,32,7,0.4370072428802988,14.0,2,SGD,0.004204473343392827,0.7103768822768942,3.8469771076121546e-05,,,,"{""block_0_dropout"": 0.25828644053079947, ""block_0_filters"": 32, ""block_0_kernel"": 5, ""block_0_stride"": 2, ""block_1_dropout"": 0.169914037829702, ""block_1_filters"": 64, ""block_1_kernel"": 3, ""block_1_stride"": 1, ""first_conv_filters"": 32, ""first_conv_kernel_size"": 7, ""n_blocks"": 2}",PRUNED
29,0.48612481140190067,2026-09-17 21:09:03.349030,2026-09-17 21:11:38.590881,0 days 00:02:35.241851,0.9215474246851584,0.9512252234908734,0.0013604105692999473,6.346023969088265e-05,128.0,0.36616274167033513,32,5,2,0.24879842003883373,64,3,2,,,,,,,,,128,32,5,0.3306014994638214,11.0,2,Adam,,,,45.0,0.514792899408284,0.4574567233955173,"{""block_0_dropout"": 0.36616274167033513, ""block_0_filters"": 32, ""block_0_kernel"": 5, ""block_0_stride"": 2, ""block_1_dropout"": 0.24879842003883373, ""block_1_filters"": 64, ""block_1_kernel"": 3, ""block_1_stride"": 2, ""first_conv_filters"": 32, ""first_conv_kernel_size"": 5, ""n_blocks"": 2}",COMPLETE
30,0.19871877161976226,2026-09-17 21:11:38.725103,2026-09-17 21:12:10.078955,0 days 00:00:31.353852,0.9183680123553986,0.9513975314502785,0.0005482783702298098,9.424345163779929e-05,128.0,0.3672587984535128,32,5,2,0.2889431539894945,32,3,2,,,,,,,,,128,32,5,0.1927457141926281,11.0,2,Adam,,,,,,,"{""block_0_dropout"": 0.3672587984535128, ""block_0_filters"": 32, ""block_0_kernel"": 5, ""block_0_stride"": 2, ""block_1_dropout"": 0.2889431539894945, ""block_1_filters"": 32, ""block_1_kernel"": 3, ""block_1_stride"": 2, ""first_conv_filters"": 32, ""first_conv_kernel_size"": 5, ""n_blocks"": 2}",PRUNED
31,0.2486119889468621,2026-09-17 21:12:10.214142,2026-09-17 21:12:56.899129,0 days 00:00:46.684987,0.9532025517133697,0.943715036933841,0.0013781789116173555,5.5715172053268874e-05,128.0,0.17546524822661017,32,3,1,0.3067300923550641,64,3,2,,,,,,,,,128,32,7,0.33452633547632754,12.0,2,Adam,,,,,,,"{""block_0_dropout"": 0.17546524822661017, ""block_0_filters"": 32, ""block_0_kernel"": 3, ""block_0_stride"": 1, ""block_1_dropout"": 0.3067300923550641, ""block_1_filters"": 64, ""block_1_kernel"": 3, ""block_1_stride"": 2, ""first_conv_filters"": 32, ""first_conv_kernel_size"": 7, ""n_blocks"": 2}",PRUNED
32,0.5043080519899489,2026-09-17 21:12:57.008551,2026-09-17 21:15:35.870516,0 days 00:02:38.861965,0.9280146512348589,0.9812854065855489,0.0029686015707583837,2.1745999254454612e-05,128.0,0.33406648201450234,32,5,2,0.18702902428021778,64,5,2,,,,,,,,,128,32,5,0.35445701189571543,10.0,2,Adam,,,,48.0,0.5325443786982249,0.4760717252816729,"{""block_0_dropout"": 0.33406648201450234, ""block_0_filters"": 32, ""block_0_kernel"": 5, ""block_0_stride"": 2, ""block_1_dropout"": 0.18702902428021778, ""block_1_filters"": 64, ""block_1_kernel"": 5, ""block_1_stride"": 2, ""first_conv_filters"": 32, ""first_conv_kernel_size"": 5, ""n_blocks"": 2}",COMPLETE
33,0.28699260363812895,2026-09-17 21:15:35.986693,2026-09-17 21:16:32.302652,0 days 00:00:56.315959,0.9238482579657299,0.9869177998823984,0.0031554533268435886,0.0014624747225032652,128.0,0.41384699273531655,32,5,2,0.2967482491861514,64,3,2,0.10170625943873474,32.0,3.0,2.0,,,,,128,32,5,0.3567026151719846,10.0,3,Adam,,,,,,,"{""block_0_dropout"": 0.41384699273531655, ""block_0_filters"": 32, ""block_0_kernel"": 5, ""block_0_stride"": 2, ""block_1_dropout"": 0.2967482491861514, ""block_1_filters"": 64, ""block_1_kernel"": 3, ""block_1_stride"": 2, ""first_conv_filters"": 32, ""first_conv_kernel_size"": 5, ""n_blocks"": 3}",PRUNED
34,0.5108357079607,2026-09-17 21:16:32.443743,2026-09-17 21:19:11.985171,0 days 00:02:39.541428,0.9041745547475929,0.9577675422214655,0.005149117095721424,8.077277543520573e-05,128.0,0.3068079379212616,32,5,2,0.18597918604624794,64,5,2,,,,,,,,,128,32,5,0.2848586247891178,10.0,2,Adam,,,,39.0,0.5384615384615384,0.48320987745986166,"{""block_0_dropout"": 0.3068079379212616, ""block_0_filters"": 32, ""block_0_kernel"": 5, ""block_0_stride"": 2, ""block_1_dropout"": 0.18597918604624794, ""block_1_filters"": 64, ""block_1_kernel"": 5, ""block_1_stride"": 2, ""first_conv_filters"": 32, ""first_conv_kernel_size"": 5, ""n_blocks"": 2}",COMPLETE
35,0.2892900270114542,2026-09-17 21:19:12.130420,2026-09-17 21:19:58.354382,0 days 00:00:46.223962,0.9029941664036332,0.9830419640122355,0.005062345497728717,2.4740291025257838e-05,64.0,0.19636385904929676,32,5,2,0.3720420813226645,64,3,2,,,,,,,,,128,32,7,0.2879382339890982,8.0,2,Adam,,,,,,,"{""block_0_dropout"": 0.19636385904929676, ""block_0_filters"": 32, ""block_0_kernel"": 5, ""block_0_stride"": 2, ""block_1_dropout"": 0.3720420813226645, ""block_1_filters"": 64, ""block_1_kernel"": 3, ""block_1_stride"": 2, ""first_conv_filters"": 32, ""first_conv_kernel_size"": 7, ""n_blocks"": 2}",PRUNED
36,0.25042329246141437,2026-09-17 21:19:58.477940,2026-09-17 21:20:32.898724,0 days 00:00:34.420784,0.9316218968397328,0.9581911214578596,0.008068924063570857,0.00012108314804237364,32.0,0.33409310789944247,32,5,2,0.15477943602562902,64,5,2,,,,,,,,,64,32,5,0.20327435772310476,10.0,2,Adam,,,,,,,"{""block_0_dropout"": 0.33409310789944247, ""block_0_filters"": 32, ""block_0_kernel"": 5, ""block_0_stride"": 2, ""block_1_dropout"": 0.15477943602562902, ""block_1_filters"": 64, ""block_1_kernel"": 5, ""block_1_stride"": 2, ""first_conv_filters"": 32, ""first_conv_kernel_size"": 5, ""n_blocks"": 2}",PRUNED
