number,value,datetime_start,datetime_complete,duration,params_adam_beta1,params_adam_beta2,params_adam_lr,params_adam_wd,params_batch_size,params_dropout,params_fc_hidden,params_lr_factor,params_lr_patience,params_optimizer,params_sgd_lr,params_sgd_momentum,params_sgd_wd,user_attrs_best_epoch,user_attrs_validation_accuracy,user_attrs_validation_macro_f1,state
0,1.0,2026-10-08 17:20:35.132384,2026-10-08 17:21:04.925348,0 days 00:00:29.792964,,,,,64,0.1624074561769746,128,0.11646759543664197,20,SGD,0.0396760507705299,0.8743233534055306,0.0006796578090758161,1.0,1.0,1.0,COMPLETE
1,1.0,2026-10-08 17:21:05.060234,2026-10-08 17:21:26.362582,0 days 00:00:21.302348,,,,,128,0.21649165607921678,256,0.728140769114411,8,SGD,0.0007523742884534858,0.8062449345551705,6.672367170464208e-05,22.0,1.0,1.0,COMPLETE
2,1.0,2026-10-08 17:21:26.498309,2026-10-08 17:21:47.756458,0 days 00:00:21.258149,,,,,128,0.4862528132298237,512,0.19763058787582308,12,SGD,0.00019634341572933326,0.8984275776885255,5.762487216478604e-05,40.0,1.0,1.0,COMPLETE
3,1.0,2026-10-08 17:21:47.900822,2026-10-08 17:22:06.399633,0 days 00:00:18.498811,,,,,200,0.17394178221021084,64,0.8374993880184934,6,SGD,0.06584106160121614,0.9594999316240181,0.0002463768595899747,3.0,1.0,1.0,COMPLETE
4,1.0,2026-10-08 17:22:06.531247,2026-10-08 17:22:27.887510,0 days 00:00:21.356263,,,,,128,0.2123738038749523,256,0.717795815437326,8,SGD,0.025502980701628937,0.7216196866671335,0.008862326508576254,1.0,1.0,1.0,COMPLETE
5,0.9966971381145524,2026-10-08 17:22:28.027017,2026-10-08 17:22:32.386697,0 days 00:00:04.359680,,,,,128,0.1463476238100519,128,0.36014665762139764,16,SGD,0.0009833181933644897,0.7184319215829468,1.753594952976443e-05,,,,PRUNED
6,1.0,2026-10-08 17:22:32.521701,2026-10-08 17:22:54.059464,0 days 00:00:21.537763,0.8651047997790626,0.9031397756501047,0.0007162786999897341,1.263794633808288e-06,128,0.40838687198182444,256,0.6091283290110243,10,Adam,,,,1.0,1.0,1.0,COMPLETE
7,1.0,2026-10-08 17:22:54.191768,2026-10-08 17:23:12.819254,0 days 00:00:18.627486,0.9720044826262805,0.9802868404822216,0.004132765459466363,0.000341676434183297,200,0.21590058116550723,128,0.24925604710882868,19,Adam,,,,1.0,1.0,1.0,COMPLETE
8,1.0,2026-10-08 17:23:12.952532,2026-10-08 17:23:40.840067,0 days 00:00:27.887535,,,,,64,0.42720590636899725,512,0.19589229386694626,10,SGD,0.0034059785435329977,0.8210491909131459,7.7344821566468e-06,3.0,1.0,1.0,COMPLETE
9,0.9824507129026581,2026-10-08 17:23:40.976294,2026-10-08 17:23:45.333684,0 days 00:00:04.357390,,,,,128,0.20071291833014568,256,0.5021432185830892,5,SGD,0.000715354779469316,0.7106972147328144,0.000274319913977967,,,,PRUNED
10,1.0,2026-10-08 17:23:45.466441,2026-10-08 17:24:14.212665,0 days 00:00:28.746224,0.9770730713395525,0.9958810975199475,0.00010862348973937149,0.007645683783605599,64,0.323540359302987,128,0.422359922501545,20,Adam,,,,5.0,1.0,1.0,COMPLETE
11,1.0,2026-10-08 17:24:14.347097,2026-10-08 17:24:42.188511,0 days 00:00:27.841414,,,,,64,0.10321648831143171,64,0.8889443507086571,14,SGD,0.011172508747844114,0.8317290273423104,0.0013941165518456247,1.0,1.0,1.0,COMPLETE
12,0.9411681269331709,2026-10-08 17:24:42.320812,2026-10-08 17:24:47.985732,0 days 00:00:05.664920,,,,,64,0.28455177586829483,256,0.6527521939995483,17,SGD,0.0001454699438128176,0.8257384029307472,1.94099403289878e-06,,,,PRUNED
13,1.0,2026-10-08 17:24:48.120892,2026-10-08 17:25:16.271531,0 days 00:00:28.150639,,,,,64,0.28261734266038524,128,0.3448400509416969,14,SGD,0.003987009996875617,0.8846418190929981,0.00045042834710787066,4.0,1.0,1.0,COMPLETE
14,1.0,2026-10-08 17:25:16.415230,2026-10-08 17:25:35.014639,0 days 00:00:18.599409,0.859332234868209,0.9283914118467068,0.009917608120507165,1.3962100266000202e-06,200,0.2600977892936006,256,0.49555582910893176,17,Adam,,,,1.0,1.0,1.0,COMPLETE
15,1.0,2026-10-08 17:25:35.147614,2026-10-08 17:25:56.614449,0 days 00:00:21.466835,,,,,128,0.10439567569750857,128,0.7614864950156898,8,SGD,0.08872754604813389,0.7753829087944386,0.0022569599258310505,1.0,1.0,1.0,COMPLETE
16,0.995319714123851,2026-10-08 17:25:56.754554,2026-10-08 17:26:02.446747,0 days 00:00:05.692193,,,,,64,0.34872818936664396,64,0.11054337150473875,13,SGD,0.0008496318594228032,0.8905721382549928,5.718796004394957e-05,,,,PRUNED
17,1.0,2026-10-08 17:26:02.582818,2026-10-08 17:26:23.942363,0 days 00:00:21.359545,,,,,128,0.15291234318191305,512,0.5716299599149587,11,SGD,0.008974835513193231,0.7807178289715576,2.8315782940027832e-05,1.0,1.0,1.0,COMPLETE
18,1.0,2026-10-08 17:26:24.075959,2026-10-08 17:26:52.860364,0 days 00:00:28.784405,0.9175988105045949,0.9554222965937597,0.00013159405537260094,7.272499656034689e-05,64,0.2426815878832284,128,0.10754858444071225,15,Adam,,,,4.0,1.0,1.0,COMPLETE
19,0.9983440886646049,2026-10-08 17:26:52.994908,2026-10-08 17:26:56.728460,0 days 00:00:03.733552,,,,,200,0.1577479399853468,256,0.32190494173729983,7,SGD,0.00038490209497786716,0.9542143574176719,0.00012063488952886118,,,,PRUNED
20,1.0,2026-10-08 17:26:56.862058,2026-10-08 17:27:24.923968,0 days 00:00:28.061910,,,,,64,0.31308597303556374,256,0.7800510130195956,18,SGD,0.0033905085927758323,0.8573230306073899,0.0008868308571530527,2.0,1.0,1.0,COMPLETE
21,0.9322659059343157,2026-10-08 17:27:25.058049,2026-10-08 17:27:29.390968,0 days 00:00:04.332919,,,,,128,0.4893716564113969,512,0.20764214114449422,12,SGD,0.00010325284363778834,0.9150611709356693,7.572849695261565e-05,,,,PRUNED
22,0.9918069656201678,2026-10-08 17:27:29.523132,2026-10-08 17:27:33.865363,0 days 00:00:04.342231,,,,,128,0.48509178244080814,512,0.2658936277714672,9,SGD,0.0003111115930724189,0.9138922708972126,1.0831838530636372e-05,,,,PRUNED
23,0.988657419489535,2026-10-08 17:27:34.000423,2026-10-08 17:27:38.335420,0 days 00:00:04.334997,,,,,128,0.38154973155918104,512,0.1747896538973724,5,SGD,0.00028976713527133067,0.877053970685817,2.8083433326867717e-06,,,,PRUNED
24,1.0,2026-10-08 17:27:38.468150,2026-10-08 17:27:59.819478,0 days 00:00:21.351328,,,,,128,0.4478591524143371,512,0.43275256127832784,13,SGD,0.0016754641888188629,0.7782425465170097,0.004768845380805224,7.0,1.0,1.0,COMPLETE
25,0.978993270645107,2026-10-08 17:27:59.955322,2026-10-08 17:28:04.276696,0 days 00:00:04.321374,,,,,128,0.36746460008792137,512,0.1599918467994662,20,SGD,0.0001871439595321716,0.9119482062187728,3.564788674411224e-05,,,,PRUNED
26,1.0,2026-10-08 17:28:04.410267,2026-10-08 17:28:26.043572,0 days 00:00:21.633305,0.9185651757105271,0.952569116087763,0.0008891959815138327,0.008053548891769556,128,0.12530073389008278,128,0.27913266463501046,11,Adam,,,,1.0,1.0,1.0,COMPLETE
27,1.0,2026-10-08 17:28:26.174894,2026-10-08 17:28:47.709118,0 days 00:00:21.534224,,,,,128,0.18265727247278507,64,0.6926704655607323,7,SGD,0.03158600684184047,0.8562030112718952,0.0005182607569692148,1.0,1.0,1.0,COMPLETE
28,1.0,2026-10-08 17:28:47.840962,2026-10-08 17:29:06.198907,0 days 00:00:18.357945,,,,,200,0.2546264454471452,128,0.1039124478740838,9,SGD,0.001587608292541265,0.9406563191658766,0.0001463243643326611,10.0,1.0,1.0,COMPLETE
29,1.0,2026-10-08 17:29:06.331921,2026-10-08 17:29:34.503063,0 days 00:00:28.171142,,,,,64,0.46141560085812383,64,0.8225127556710291,7,SGD,0.00048789725985653093,0.9881471786207305,4.2484746755840044e-06,3.0,1.0,1.0,COMPLETE
30,1.0,2026-10-08 17:29:34.636969,2026-10-08 17:29:53.005520,0 days 00:00:18.368551,,,,,200,0.1754693820637774,512,0.5339352171822247,6,SGD,0.007506176619890013,0.8053039978538832,4.9548073937280195e-05,3.0,1.0,1.0,COMPLETE
31,1.0,2026-10-08 17:29:53.139337,2026-10-08 17:30:11.590139,0 days 00:00:18.450802,,,,,200,0.22589585211678864,64,0.8517931931043382,6,SGD,0.059610888931774304,0.9784150436313195,0.0001326331314769226,2.0,1.0,1.0,COMPLETE
32,1.0,2026-10-08 17:30:11.724461,2026-10-08 17:30:30.108987,0 days 00:00:18.384526,,,,,200,0.1877287215587079,64,0.7184697045885658,8,SGD,0.02442549718111793,0.9399846038295605,0.00028909709530549216,1.0,1.0,1.0,COMPLETE
33,1.0,2026-10-08 17:30:30.240511,2026-10-08 17:30:48.591757,0 days 00:00:18.351246,,,,,200,0.13348547936336308,256,0.8945909491092041,6,SGD,0.05090066780727239,0.9603266356207153,0.00022297159364709622,3.0,1.0,1.0,COMPLETE
34,1.0,2026-10-08 17:30:48.724695,2026-10-08 17:31:10.271601,0 days 00:00:21.546906,,,,,128,0.16927713059152052,64,0.793239466977818,9,SGD,0.012719951564299817,0.857674668512006,0.0006884288789779973,3.0,1.0,1.0,COMPLETE
35,1.0,2026-10-08 17:31:10.406255,2026-10-08 17:31:29.059010,0 days 00:00:18.652755,0.9285227087660517,0.9024953252619158,0.0009392449615052684,3.571344592510507e-05,200,0.21247562595015565,256,0.7330553580635045,10,Adam,,,,1.0,1.0,1.0,COMPLETE
36,1.0,2026-10-08 17:31:29.191086,2026-10-08 17:31:50.452556,0 days 00:00:21.261470,,,,,128,0.1318632864462749,128,0.6112032339360634,16,SGD,0.09972583815944672,0.7446905869018761,0.001825374623087064,1.0,1.0,1.0,COMPLETE
37,1.0,2026-10-08 17:31:50.589295,2026-10-08 17:32:11.929962,0 days 00:00:21.340667,,,,,128,0.22935235355503658,64,0.2217003196039945,5,SGD,0.02203857409922358,0.9040029400742283,8.126047278839931e-05,1.0,1.0,1.0,COMPLETE
38,1.0,2026-10-08 17:32:12.065403,2026-10-08 17:32:40.919752,0 days 00:00:28.854349,0.8888380730757438,0.9351849276495087,0.0002622940430973794,0.0007410785953495474,64,0.4092194703467876,256,0.3969822278574724,19,Adam,,,,2.0,1.0,1.0,COMPLETE
39,1.0,2026-10-08 17:32:41.055641,2026-10-08 17:32:59.400205,0 days 00:00:18.344564,,,,,200,0.20717748882048959,128,0.6626305348973824,11,SGD,0.04001379601481075,0.7536206512910402,0.00976751412838765,2.0,1.0,1.0,COMPLETE
40,1.0,2026-10-08 17:32:59.533536,2026-10-08 17:33:27.593894,0 days 00:00:28.060358,,,,,64,0.295734418016028,512,0.8431315728641406,15,SGD,0.019506296000167934,0.9319164632323204,2.628257096990347e-05,1.0,1.0,1.0,COMPLETE
41,1.0,2026-10-08 17:33:27.726663,2026-10-08 17:33:49.050276,0 days 00:00:21.323613,,,,,128,0.1932561471677655,256,0.1426663923459629,8,SGD,0.05740122362792441,0.7375805181791293,1.6283135533217465e-05,1.0,1.0,1.0,COMPLETE
42,1.0,2026-10-08 17:33:49.182031,2026-10-08 17:34:10.458977,0 days 00:00:21.276946,,,,,128,0.26650973831868596,256,0.6344111039956182,10,SGD,0.06885693074855619,0.7996728399931052,0.005304341423323241,1.0,1.0,1.0,COMPLETE
43,1.0,2026-10-08 17:34:10.592068,2026-10-08 17:34:32.043743,0 days 00:00:21.451675,,,,,128,0.15064229523270017,256,0.7041757379137551,7,SGD,0.04031672554236196,0.7054592974087066,0.0002341769201799679,1.0,1.0,1.0,COMPLETE
44,1.0,2026-10-08 17:34:32.179500,2026-10-08 17:34:53.453995,0 days 00:00:21.274495,,,,,128,0.11362017786069623,256,0.803940280540763,8,SGD,0.001379392865944049,0.8423953171888641,0.0010007016508767693,8.0,1.0,1.0,COMPLETE
45,1.0,2026-10-08 17:34:53.586536,2026-10-08 17:35:22.297087,0 days 00:00:28.710551,0.9446140182524503,0.9742590952683388,0.002527500324479543,1.0638297999881121e-05,64,0.34078104093949313,128,0.7649114881102964,12,Adam,,,,1.0,1.0,1.0,COMPLETE
46,1.0,2026-10-08 17:35:22.436016,2026-10-08 17:35:43.767491,0 days 00:00:21.331475,,,,,128,0.23768259867480288,256,0.5671581950579433,6,SGD,0.004697749555689616,0.8105331057963048,0.0030512634862925997,2.0,1.0,1.0,COMPLETE
47,1.0,2026-10-08 17:35:43.899543,2026-10-08 17:36:11.887813,0 days 00:00:27.988270,,,,,64,0.16970941091306416,64,0.8616345758943657,17,SGD,0.016163809271715224,0.8761116822350488,0.00038906042108498344,2.0,1.0,1.0,COMPLETE
48,0.9902708880451239,2026-10-08 17:36:12.022611,2026-10-08 17:36:16.366676,0 days 00:00:04.344065,,,,,128,0.205575258081955,256,0.3081990289968161,19,SGD,0.0005816831834861195,0.7306204425292449,8.643196528822587e-05,,,,PRUNED
49,0.4627518388349298,2026-10-08 17:36:16.507092,2026-10-08 17:36:20.263336,0 days 00:00:03.756244,,,,,200,0.27407796131624584,128,0.499931575830211,9,SGD,0.00016519516680951643,0.7617107097145466,1.4454553964539816e-05,,,,PRUNED
