number,value,datetime_start,datetime_complete,duration,params_adam_beta1,params_adam_beta2,params_adam_lr,params_adam_wd,params_batch_size,params_block_0_dropout,params_block_0_filters,params_block_0_kernel,params_block_0_stride,params_block_1_dropout,params_block_1_filters,params_block_1_kernel,params_block_1_stride,params_block_2_dropout,params_block_2_filters,params_block_2_kernel,params_block_2_stride,params_block_3_dropout,params_block_3_filters,params_block_3_kernel,params_block_3_stride,params_fc_hidden,params_first_conv_filters,params_first_conv_kernel_size,params_lr_factor,params_lr_patience,params_n_blocks,params_optimizer,params_sgd_lr,params_sgd_momentum,params_sgd_wd,user_attrs_best_epoch,user_attrs_validation_accuracy,user_attrs_validation_macro_f1,system_attrs_tpe:relative_params:0,state
0,0.4962368011281404,2026-09-16 11:58:50.959972,2026-09-16 12:04:19.622438,0 days 00:05:28.662466,0.9265394391080591,0.9184669601070001,0.0004201672054372534,0.00012030178871154674,32.0,0.3099025726528951,16,7,3,0.1798695128633439,64,3,3,0.4795542149013333,64.0,3.0,1.0,0.14881529393791154,64.0,3.0,2.0,256,32,7,0.6817507766587351,17.0,4,Adam,,,,49.0,0.5096774193548387,0.4827961829014421,,COMPLETE
1,0.38742935429192793,2026-09-16 12:04:19.765933,2026-09-16 12:29:25.392026,0 days 00:25:05.626093,0.909855742570197,0.9025393707617352,0.0009718319944817398,0.00012329098365270507,256.0,0.42618457138193366,16,3,1,0.23235920994105969,64,3,2,0.28888597006477973,128.0,3.0,3.0,,,,,256,128,3,0.16473485619598266,5.0,3,Adam,,,,41.0,0.4129032258064516,0.3619554827774043,,COMPLETE
2,,2026-09-16 12:29:25.525472,2026-09-16 12:29:25.610815,0 days 00:00:00.085343,,,,,,0.22720138998874556,32,3,3,0.1888431241882921,64,3,2,0.2454518409517176,128.0,3.0,3.0,0.11475477894181313,64.0,3.0,1.0,,64,5,,,4,,,,,,,,,PRUNED
3,0.444659913014259,2026-09-16 12:29:25.729593,2026-09-16 12:34:16.725534,0 days 00:04:50.995941,,,,,128.0,0.31430987362990337,8,7,3,0.3048372233197124,32,5,2,0.1550083776583973,64.0,3.0,3.0,,,,,256,16,7,0.41779034701360385,8.0,3,SGD,0.009548873458201667,0.9369944380583526,0.00016626592254031863,49.0,0.46774193548387094,0.421577890544647,,COMPLETE
4,0.35184113753862245,2026-09-16 12:34:16.829468,2026-09-16 12:53:21.791589,0 days 00:19:04.962121,,,,,64.0,0.37675807907707737,16,3,3,0.3630451569201374,64,3,3,,,,,,,,,64,128,7,0.4786831755983577,17.0,2,SGD,0.08299112738466033,0.8139983401533605,0.0036998679204890915,25.0,0.3741935483870968,0.32948872669014806,,COMPLETE
5,0.40407088265117963,2026-09-16 12:53:21.935856,2026-09-16 12:58:22.983288,0 days 00:05:01.047432,0.8631574715777216,0.9577701860855178,0.0004742314081112146,3.179302199939539e-05,128.0,0.44045466860674276,32,5,1,0.4960215400417053,64,5,3,0.24379646048790207,128.0,3.0,1.0,0.30060651787487985,256.0,3.0,2.0,64,16,3,0.12156536427804526,12.0,4,Adam,,,,46.0,0.42258064516129035,0.38556112014106886,,COMPLETE
6,0.26578658347091527,2026-09-16 12:58:23.118158,2026-09-16 12:59:55.339053,0 days 00:01:32.220895,,,,,64.0,0.41807447790748153,32,3,1,0.16931772802833833,32,3,1,0.4819461122652776,128.0,3.0,1.0,,,,,64,32,5,0.16964358430414975,5.0,3,SGD,0.0011692786931726754,0.9197753720346671,1.1417577140741136e-06,,,,,PRUNED
7,0.5309450611871882,2026-09-16 12:59:55.439251,2026-09-16 13:04:29.335012,0 days 00:04:33.895761,,,,,32.0,0.11060452421664874,32,5,3,0.2544410551203097,32,3,3,0.13777718430237137,32.0,3.0,2.0,,,,,64,32,3,0.5180422992184904,15.0,3,SGD,0.027759104241881914,0.781737884684286,2.96933577312964e-06,48.0,0.5387096774193548,0.5231804449550217,,COMPLETE
8,0.21290174206982682,2026-09-16 13:04:29.472689,2026-09-16 13:09:05.591038,0 days 00:04:36.118349,0.899128101757291,0.9116949949411178,0.0007639430825545341,0.003554812765190896,256.0,0.2280198404122447,8,5,1,0.3293751552493145,16,5,3,0.4166316174903394,32.0,3.0,3.0,,,,,64,128,3,0.1857950092317015,17.0,3,Adam,,,,,,,,PRUNED
9,0.28137893100072287,2026-09-16 13:09:05.741944,2026-09-16 13:11:08.206324,0 days 00:02:02.464380,,,,,64.0,0.46254175403789444,32,7,1,0.39841795170616934,32,5,3,0.4852890157762445,64.0,3.0,2.0,,,,,128,32,5,0.6815815213714593,13.0,3,SGD,0.09525644914201474,0.7214010037732657,0.00016421663082032186,,,,,PRUNED
10,,2026-09-16 13:11:08.334193,2026-09-16 13:11:08.487459,0 days 00:00:00.153266,,,,,,0.1322158631913536,32,5,2,0.2615867116934109,32,3,3,0.12007079050631499,32.0,3.0,2.0,0.47832388798948516,128.0,3.0,3.0,,32,3,,,4,,,,,,,,"{""block_0_dropout"": 0.1322158631913536, ""block_0_filters"": 32, ""block_0_kernel"": 5, ""block_0_stride"": 2, ""block_1_dropout"": 0.2615867116934109, ""block_1_filters"": 32, ""block_1_kernel"": 3, ""block_1_stride"": 3, ""first_conv_filters"": 32, ""first_conv_kernel_size"": 3, ""n_blocks"": 4}",PRUNED
11,0.18141095764171639,2026-09-16 13:11:08.593587,2026-09-16 13:12:35.022566,0 days 00:01:26.428979,0.9854411076851551,0.9979830674410208,0.009149281771224285,1.356069190596685e-06,32.0,0.3865340255459203,8,7,3,0.197040292125964,64,3,3,0.36120126405768543,32.0,3.0,1.0,0.12672256476347368,64.0,3.0,2.0,256,32,7,0.6996174631849307,20.0,4,Adam,,,,,,,"{""block_0_dropout"": 0.3865340255459203, ""block_0_filters"": 8, ""block_0_kernel"": 7, ""block_0_stride"": 3, ""block_1_dropout"": 0.197040292125964, ""block_1_filters"": 64, ""block_1_kernel"": 3, ""block_1_stride"": 3, ""first_conv_filters"": 32, ""first_conv_kernel_size"": 7, ""n_blocks"": 4}",PRUNED
12,,2026-09-16 13:12:35.145448,2026-09-16 13:12:35.303044,0 days 00:00:00.157596,,,,,,0.18485013234483086,32,7,3,0.22403988911096967,64,3,3,0.36049117241691964,64.0,3.0,2.0,0.31566636579968776,64.0,3.0,2.0,,32,7,,,4,,,,,,,,"{""block_0_dropout"": 0.18485013234483086, ""block_0_filters"": 32, ""block_0_kernel"": 7, ""block_0_stride"": 3, ""block_1_dropout"": 0.22403988911096967, ""block_1_filters"": 64, ""block_1_kernel"": 3, ""block_1_stride"": 3, ""first_conv_filters"": 32, ""first_conv_kernel_size"": 7, ""n_blocks"": 4}",PRUNED
13,0.15670999507405037,2026-09-16 13:12:35.435668,2026-09-16 13:13:36.810089,0 days 00:01:01.374421,,,,,32.0,0.21519839782348604,32,5,3,0.24008026696204887,32,3,1,,,,,,,,,128,32,3,0.5634715940366181,15.0,2,SGD,0.00019721786020638796,0.701374634699396,1.1263762662387672e-06,,,,"{""block_0_dropout"": 0.21519839782348604, ""block_0_filters"": 32, ""block_0_kernel"": 5, ""block_0_stride"": 3, ""block_1_dropout"": 0.24008026696204887, ""block_1_filters"": 32, ""block_1_kernel"": 3, ""block_1_stride"": 1, ""first_conv_filters"": 32, ""first_conv_kernel_size"": 3, ""n_blocks"": 2}",PRUNED
14,0.4480149181457755,2026-09-16 13:13:36.941409,2026-09-16 13:19:35.530940,0 days 00:05:58.589531,0.9782530668667826,0.9441685463687366,0.00011819786349763388,0.009483866909069077,32.0,0.37567708419027385,16,7,3,0.1441921369222075,64,3,2,0.19242674706692914,64.0,3.0,2.0,,,,,256,32,7,0.5699084692258158,19.0,3,Adam,,,,46.0,0.45483870967741935,0.4411911266141316,"{""block_0_dropout"": 0.37567708419027385, ""block_0_filters"": 16, ""block_0_kernel"": 7, ""block_0_stride"": 3, ""block_1_dropout"": 0.1441921369222075, ""block_1_filters"": 64, ""block_1_kernel"": 3, ""block_1_stride"": 2, ""first_conv_filters"": 32, ""first_conv_kernel_size"": 7, ""n_blocks"": 3}",COMPLETE
15,0.28417553832047365,2026-09-16 13:19:35.660208,2026-09-16 13:20:49.540043,0 days 00:01:13.879835,0.9377124488135512,0.9983915678194154,0.009849375323536047,0.00021375427464421902,32.0,0.18777890066314146,16,7,3,0.3056359529242877,64,3,3,0.3372427244425864,32.0,3.0,1.0,,,,,256,32,7,0.3560245054725908,12.0,3,Adam,,,,,,,"{""block_0_dropout"": 0.18777890066314146, ""block_0_filters"": 16, ""block_0_kernel"": 7, ""block_0_stride"": 3, ""block_1_dropout"": 0.3056359529242877, ""block_1_filters"": 64, ""block_1_kernel"": 3, ""block_1_stride"": 3, ""first_conv_filters"": 32, ""first_conv_kernel_size"": 7, ""n_blocks"": 3}",PRUNED
16,,2026-09-16 13:20:49.663596,2026-09-16 13:20:49.805654,0 days 00:00:00.142058,,,,,,0.32290245593965555,16,7,3,0.11964728661457752,64,5,3,0.10032476313323874,32.0,3.0,2.0,0.2708614531305974,256.0,3.0,3.0,,32,7,,,4,,,,,,,,"{""block_0_dropout"": 0.32290245593965555, ""block_0_filters"": 16, ""block_0_kernel"": 7, ""block_0_stride"": 3, ""block_1_dropout"": 0.11964728661457752, ""block_1_filters"": 64, ""block_1_kernel"": 5, ""block_1_stride"": 3, ""first_conv_filters"": 32, ""first_conv_kernel_size"": 7, ""n_blocks"": 4}",PRUNED
17,0.30196567893998216,2026-09-16 13:20:49.909214,2026-09-16 13:21:51.420231,0 days 00:01:01.511017,,,,,32.0,0.40819657669573317,32,7,3,0.3050510252551811,64,3,3,0.41277347841436285,64.0,3.0,1.0,,,,,64,32,3,0.5865032113066107,15.0,3,SGD,0.004854240619361119,0.8276661748162583,2.4655068425936463e-05,,,,"{""block_0_dropout"": 0.40819657669573317, ""block_0_filters"": 32, ""block_0_kernel"": 7, ""block_0_stride"": 3, ""block_1_dropout"": 0.3050510252551811, ""block_1_filters"": 64, ""block_1_kernel"": 3, ""block_1_stride"": 3, ""first_conv_filters"": 32, ""first_conv_kernel_size"": 3, ""n_blocks"": 3}",PRUNED
18,0.47329026497393,2026-09-16 13:21:51.537818,2026-09-16 13:27:04.863355,0 days 00:05:13.325537,0.8561888168701102,0.9507630556906035,0.0023800206225251916,1.6044004971096476e-06,32.0,0.14921572150079804,32,5,3,0.3939242917450223,64,3,3,,,,,,,,,128,32,5,0.29787504155916095,10.0,2,Adam,,,,45.0,0.46774193548387094,0.4788385944639891,"{""block_0_dropout"": 0.14921572150079804, ""block_0_filters"": 32, ""block_0_kernel"": 5, ""block_0_stride"": 3, ""block_1_dropout"": 0.3939242917450223, ""block_1_filters"": 64, ""block_1_kernel"": 3, ""block_1_stride"": 3, ""first_conv_filters"": 32, ""first_conv_kernel_size"": 5, ""n_blocks"": 2}",COMPLETE
19,0.24805581555378248,2026-09-16 13:27:05.000621,2026-09-16 13:30:24.823915,0 days 00:03:19.823294,,,,,32.0,0.4203546458661871,32,5,3,0.23289600574169841,32,3,3,0.2230096758482344,32.0,3.0,1.0,0.48426535233715823,128.0,3.0,1.0,64,128,3,0.5166577519820998,17.0,4,SGD,0.00012024287761985272,0.8338915858050988,0.00608989957112782,,,,"{""block_0_dropout"": 0.4203546458661871, ""block_0_filters"": 32, ""block_0_kernel"": 5, ""block_0_stride"": 3, ""block_1_dropout"": 0.23289600574169841, ""block_1_filters"": 32, ""block_1_kernel"": 3, ""block_1_stride"": 3, ""first_conv_filters"": 128, ""first_conv_kernel_size"": 3, ""n_blocks"": 4}",PRUNED
20,0.11274198818688475,2026-09-16 13:30:24.959354,2026-09-16 13:34:58.275446,0 days 00:04:33.316092,,,,,32.0,0.46261517345012865,32,5,3,0.23784100251013857,32,3,3,,,,,,,,,256,128,3,0.6237555403636676,15.0,2,SGD,0.012635140902450109,0.9863093108683637,1.3333935969223605e-05,,,,"{""block_0_dropout"": 0.46261517345012865, ""block_0_filters"": 32, ""block_0_kernel"": 5, ""block_0_stride"": 3, ""block_1_dropout"": 0.23784100251013857, ""block_1_filters"": 32, ""block_1_kernel"": 3, ""block_1_stride"": 3, ""first_conv_filters"": 128, ""first_conv_kernel_size"": 3, ""n_blocks"": 2}",PRUNED
21,0.49111689558776384,2026-09-16 13:34:58.394162,2026-09-16 13:39:10.041563,0 days 00:04:11.647401,0.8511407086878499,0.9371578392969315,0.0023823379047042963,1.2419003798918091e-06,32.0,0.16314152559930872,32,5,3,0.238664211598132,32,3,3,0.3002816906998512,64.0,3.0,2.0,,,,,128,16,3,0.33085615382456557,9.0,3,Adam,,,,42.0,0.4967741935483871,0.4854595976271406,"{""block_0_dropout"": 0.16314152559930872, ""block_0_filters"": 32, ""block_0_kernel"": 5, ""block_0_stride"": 3, ""block_1_dropout"": 0.238664211598132, ""block_1_filters"": 32, ""block_1_kernel"": 3, ""block_1_stride"": 3, ""first_conv_filters"": 16, ""first_conv_kernel_size"": 3, ""n_blocks"": 3}",COMPLETE
22,0.30065738195190206,2026-09-16 13:39:10.173142,2026-09-16 13:39:59.304226,0 days 00:00:49.131084,0.9417579524846047,0.9292891536918528,0.0001689739518719597,7.523455396989662e-06,32.0,0.24035430721184847,32,5,3,0.20010819599604274,32,3,3,0.29670993834749215,64.0,3.0,2.0,,,,,128,16,3,0.2650285490141423,8.0,3,Adam,,,,,,,"{""block_0_dropout"": 0.24035430721184847, ""block_0_filters"": 32, ""block_0_kernel"": 5, ""block_0_stride"": 3, ""block_1_dropout"": 0.20010819599604274, ""block_1_filters"": 32, ""block_1_kernel"": 3, ""block_1_stride"": 3, ""first_conv_filters"": 16, ""first_conv_kernel_size"": 3, ""n_blocks"": 3}",PRUNED
23,0.2967847223266447,2026-09-16 13:39:59.427668,2026-09-16 13:40:57.010774,0 days 00:00:57.583106,0.8895690467233524,0.9270957546089482,0.00269297452678872,0.0008093381268407661,32.0,0.15180789610497286,32,5,3,0.2930032604900404,32,3,3,0.4426179202915099,64.0,3.0,2.0,,,,,128,32,3,0.4407769129351021,9.0,3,Adam,,,,,,,"{""block_0_dropout"": 0.15180789610497286, ""block_0_filters"": 32, ""block_0_kernel"": 5, ""block_0_stride"": 3, ""block_1_dropout"": 0.2930032604900404, ""block_1_filters"": 32, ""block_1_kernel"": 3, ""block_1_stride"": 3, ""first_conv_filters"": 32, ""first_conv_kernel_size"": 3, ""n_blocks"": 3}",PRUNED
24,0.3373653632353383,2026-09-16 13:40:57.127245,2026-09-16 13:42:09.437434,0 days 00:01:12.310189,0.9391239923115943,0.9698505064460936,0.00028505805638964776,1.2957675149131202e-05,256.0,0.12301469196016743,16,7,3,0.16365171582278484,64,3,3,0.16936483390043788,64.0,3.0,2.0,,,,,128,16,7,0.36253008757800115,18.0,3,Adam,,,,,,,"{""block_0_dropout"": 0.12301469196016743, ""block_0_filters"": 16, ""block_0_kernel"": 7, ""block_0_stride"": 3, ""block_1_dropout"": 0.16365171582278484, ""block_1_filters"": 64, ""block_1_kernel"": 3, ""block_1_stride"": 3, ""first_conv_filters"": 16, ""first_conv_kernel_size"": 7, ""n_blocks"": 3}",PRUNED
25,0.343777687215356,2026-09-16 13:42:09.579002,2026-09-16 13:44:44.867659,0 days 00:02:35.288657,0.8763482958662095,0.9268342949285103,0.0022399353046349455,6.325215877118765e-05,128.0,0.46742346373610155,16,7,1,0.2706732637571086,64,3,3,0.29509934474966915,64.0,3.0,2.0,0.21005376191567643,64.0,3.0,2.0,256,32,7,0.6405744591869268,14.0,4,Adam,,,,,,,"{""block_0_dropout"": 0.46742346373610155, ""block_0_filters"": 16, ""block_0_kernel"": 7, ""block_0_stride"": 1, ""block_1_dropout"": 0.2706732637571086, ""block_1_filters"": 64, ""block_1_kernel"": 3, ""block_1_stride"": 3, ""first_conv_filters"": 32, ""first_conv_kernel_size"": 7, ""n_blocks"": 4}",PRUNED
26,0.5233310647504619,2026-09-16 13:44:44.991285,2026-09-16 13:50:18.153152,0 days 00:05:33.161867,0.9227714085075336,0.9172151274306594,0.0011269847893993594,0.0004667484206722531,32.0,0.10275122098578243,32,5,2,0.18790271026722932,32,3,3,0.3345633859403414,64.0,3.0,2.0,,,,,128,32,5,0.5146371343722098,11.0,3,Adam,,,,46.0,0.5258064516129032,0.5208556778880207,"{""block_0_dropout"": 0.10275122098578243, ""block_0_filters"": 32, ""block_0_kernel"": 5, ""block_0_stride"": 2, ""block_1_dropout"": 0.18790271026722932, ""block_1_filters"": 32, ""block_1_kernel"": 3, ""block_1_stride"": 3, ""first_conv_filters"": 32, ""first_conv_kernel_size"": 5, ""n_blocks"": 3}",COMPLETE
27,0.28323229645719233,2026-09-16 13:50:18.278315,2026-09-16 13:51:24.984179,0 days 00:01:06.705864,,,,,32.0,0.12995042212620256,32,5,2,0.2337593345790242,32,3,3,0.3888241265997727,32.0,3.0,1.0,,,,,64,32,5,0.523643610072502,11.0,3,SGD,0.0011633094905930822,0.7617312421409452,0.0006260779798058462,,,,"{""block_0_dropout"": 0.12995042212620256, ""block_0_filters"": 32, ""block_0_kernel"": 5, ""block_0_stride"": 2, ""block_1_dropout"": 0.2337593345790242, ""block_1_filters"": 32, ""block_1_kernel"": 3, ""block_1_stride"": 3, ""first_conv_filters"": 32, ""first_conv_kernel_size"": 5, ""n_blocks"": 3}",PRUNED
28,0.4810193174668322,2026-09-16 13:51:25.096264,2026-09-16 13:56:40.824997,0 days 00:05:15.728733,0.9198985638547493,0.9146622173027529,0.001018009395366031,0.0006276698367192498,32.0,0.201644025007569,16,5,2,0.16098763471509986,32,3,3,,,,,,,,,256,32,5,0.4228107235971167,16.0,2,Adam,,,,37.0,0.4838709677419355,0.4781676671917289,"{""block_0_dropout"": 0.201644025007569, ""block_0_filters"": 16, ""block_0_kernel"": 5, ""block_0_stride"": 2, ""block_1_dropout"": 0.16098763471509986, ""block_1_filters"": 32, ""block_1_kernel"": 3, ""block_1_stride"": 3, ""first_conv_filters"": 32, ""first_conv_kernel_size"": 5, ""n_blocks"": 2}",COMPLETE
29,0.5218867585384434,2026-09-16 13:56:40.960644,2026-09-16 14:06:11.625658,0 days 00:09:30.665014,0.9551723611291331,0.9030906773036796,0.0003737393775143555,0.0005162741902165032,32.0,0.12030838724465613,32,5,2,0.11927552872232491,32,3,3,,,,,,,,,128,64,5,0.5032522605536915,13.0,2,Adam,,,,48.0,0.5225806451612903,0.5211928719155964,"{""block_0_dropout"": 0.12030838724465613, ""block_0_filters"": 32, ""block_0_kernel"": 5, ""block_0_stride"": 2, ""block_1_dropout"": 0.11927552872232491, ""block_1_filters"": 32, ""block_1_kernel"": 3, ""block_1_stride"": 3, ""first_conv_filters"": 64, ""first_conv_kernel_size"": 5, ""n_blocks"": 2}",COMPLETE
30,0.23716110374454524,2026-09-16 14:06:11.753053,2026-09-16 14:07:11.928007,0 days 00:01:00.174954,,,,,128.0,0.11929762901027194,32,5,2,0.10693375175383793,32,3,3,,,,,,,,,128,32,5,0.5011440578126312,13.0,2,SGD,0.000786697258711029,0.8881712230842548,9.681977466342341e-06,,,,"{""block_0_dropout"": 0.11929762901027194, ""block_0_filters"": 32, ""block_0_kernel"": 5, ""block_0_stride"": 2, ""block_1_dropout"": 0.10693375175383793, ""block_1_filters"": 32, ""block_1_kernel"": 3, ""block_1_stride"": 3, ""first_conv_filters"": 32, ""first_conv_kernel_size"": 5, ""n_blocks"": 2}",PRUNED
31,,2026-09-16 14:07:12.045776,2026-09-16 14:07:12.179390,0 days 00:00:00.133614,,,,,,0.15946986772804495,32,5,3,0.16085795349617715,32,3,3,0.45340183700263176,64.0,3.0,2.0,0.39933053585532924,64.0,3.0,2.0,,32,3,,,4,,,,,,,,"{""block_0_dropout"": 0.15946986772804495, ""block_0_filters"": 32, ""block_0_kernel"": 5, ""block_0_stride"": 3, ""block_1_dropout"": 0.16085795349617715, ""block_1_filters"": 32, ""block_1_kernel"": 3, ""block_1_stride"": 3, ""first_conv_filters"": 32, ""first_conv_kernel_size"": 3, ""n_blocks"": 4}",PRUNED
32,0.3705940304130985,2026-09-16 14:07:12.290750,2026-09-16 14:09:03.459785,0 days 00:01:51.169035,0.9611529832824688,0.9002724253843806,0.00034201598703107394,0.0004925075837655853,32.0,0.1879890223933344,32,5,2,0.15177924049532673,32,3,3,0.32949025266046295,32.0,3.0,1.0,,,,,128,32,5,0.45693194609589377,14.0,3,Adam,,,,,,,"{""block_0_dropout"": 0.1879890223933344, ""block_0_filters"": 32, ""block_0_kernel"": 5, ""block_0_stride"": 2, ""block_1_dropout"": 0.15177924049532673, ""block_1_filters"": 32, ""block_1_kernel"": 3, ""block_1_stride"": 3, ""first_conv_filters"": 32, ""first_conv_kernel_size"": 5, ""n_blocks"": 3}",PRUNED
33,0.36553797472275046,2026-09-16 14:09:03.587530,2026-09-16 14:10:55.036239,0 days 00:01:51.448709,0.9234201641583242,0.9152099316037249,0.0007231790145040268,0.0019240553621572508,32.0,0.11818109907626359,32,5,3,0.3187648047993373,32,3,3,,,,,,,,,128,16,3,0.6262040441490003,11.0,2,Adam,,,,,,,"{""block_0_dropout"": 0.11818109907626359, ""block_0_filters"": 32, ""block_0_kernel"": 5, ""block_0_stride"": 3, ""block_1_dropout"": 0.3187648047993373, ""block_1_filters"": 32, ""block_1_kernel"": 3, ""block_1_stride"": 3, ""first_conv_filters"": 16, ""first_conv_kernel_size"": 3, ""n_blocks"": 2}",PRUNED
34,0.38559259817170266,2026-09-16 14:10:55.161093,2026-09-16 14:13:18.713982,0 days 00:02:23.552889,0.9535219204738465,0.9158466022978853,0.00022988888815988348,0.00018783508004420105,32.0,0.10900067533566941,32,5,3,0.19310882177842323,32,3,3,,,,,,,,,128,32,3,0.540920780827715,13.0,2,Adam,,,,,,,"{""block_0_dropout"": 0.10900067533566941, ""block_0_filters"": 32, ""block_0_kernel"": 5, ""block_0_stride"": 3, ""block_1_dropout"": 0.19310882177842323, ""block_1_filters"": 32, ""block_1_kernel"": 3, ""block_1_stride"": 3, ""first_conv_filters"": 32, ""first_conv_kernel_size"": 3, ""n_blocks"": 2}",PRUNED
35,0.23251652201951134,2026-09-16 14:13:18.848170,2026-09-16 14:15:24.426039,0 days 00:02:05.577869,0.9649088604810709,0.9064541317291678,0.00044903736694868753,0.0013568125351289385,256.0,0.24038565842194395,32,5,2,0.14908775635879956,16,3,3,0.4976391626618667,64.0,3.0,2.0,,,,,64,64,5,0.6001566147864419,16.0,3,Adam,,,,,,,"{""block_0_dropout"": 0.24038565842194395, ""block_0_filters"": 32, ""block_0_kernel"": 5, ""block_0_stride"": 2, ""block_1_dropout"": 0.14908775635879956, ""block_1_filters"": 16, ""block_1_kernel"": 3, ""block_1_stride"": 3, ""first_conv_filters"": 64, ""first_conv_kernel_size"": 5, ""n_blocks"": 3}",PRUNED
36,0.48607978800370927,2026-09-16 14:15:24.558479,2026-09-16 14:20:48.334378,0 days 00:05:23.775899,0.9278859048098602,0.9199478344692809,0.001213269484508365,0.00036565340890542625,32.0,0.19071599672822465,32,5,2,0.27945976773897047,32,5,3,,,,,,,,,256,32,5,0.3978460783450634,14.0,2,Adam,,,,43.0,0.4935483870967742,0.47861118891064436,"{""block_0_dropout"": 0.19071599672822465, ""block_0_filters"": 32, ""block_0_kernel"": 5, ""block_0_stride"": 2, ""block_1_dropout"": 0.27945976773897047, ""block_1_filters"": 32, ""block_1_kernel"": 5, ""block_1_stride"": 3, ""first_conv_filters"": 32, ""first_conv_kernel_size"": 5, ""n_blocks"": 2}",COMPLETE
