number,value,datetime_start,datetime_complete,duration,params_adam_beta1,params_adam_beta2,params_adam_lr,params_adam_wd,params_batch_size,params_block_0_dropout,params_block_0_filters,params_block_0_kernel,params_block_0_stride,params_block_1_dropout,params_block_1_filters,params_block_1_kernel,params_block_1_stride,params_block_2_dropout,params_block_2_filters,params_block_2_kernel,params_block_2_stride,params_block_3_dropout,params_block_3_filters,params_block_3_kernel,params_block_3_stride,params_block_4_dropout,params_block_4_filters,params_block_4_kernel,params_block_4_stride,params_fc_hidden,params_lr_factor,params_lr_patience,params_n_blocks,params_optimizer,params_sgd_lr,params_sgd_momentum,params_sgd_wd,user_attrs_best_epoch,user_attrs_validation_accuracy,user_attrs_validation_macro_f1,system_attrs_tpe:relative_params:0,state
0,0.19679179363931207,2026-10-04 15:51:21.088926,2026-10-04 15:51:28.339078,0 days 00:00:07.250152,,,,,128.0,0.012323344486727979,8,7,3,0.017336180394137354,16,5,2,0.02465447373174767,64,3,1,0.016820964947491662,128.0,3.0,1.0,,,,,512,0.19763058787582308,12.0,4,SGD,0.00019634341572933326,0.8984275776885255,5.762487216478604e-05,36.0,0.19881889763779528,0.19476468964082885,,COMPLETE
1,0.24530479497310098,2026-10-04 15:51:28.391927,2026-10-04 15:51:36.248523,0 days 00:00:07.856596,,,,,128.0,0.041005312934444586,32,5,3,0.02554709158757928,16,7,1,0.012982025747190833,64,3,1,0.04085081386743783,64.0,3.0,1.0,,,,,256,0.36014665762139764,16.0,4,SGD,0.0009833181933644897,0.7184319215829468,1.753594952976443e-05,50.0,0.24803149606299213,0.2425780938832098,,COMPLETE
2,0.5101376013718129,2026-10-04 15:51:36.300239,2026-10-04 15:51:44.049980,0 days 00:00:07.749741,0.9754527819892891,0.9317685471496893,0.0011986281799901185,0.0016973078532467015,200.0,0.030909313175279764,16,7,3,0.019971689165955,16,5,1,0.04232481518257668,64,3,1,,,,,,,,,256,0.18804153962214143,8.0,3,Adam,,,,50.0,0.5039370078740157,0.51633819486961,,COMPLETE
3,0.5973408091971921,2026-10-04 15:51:44.116358,2026-10-04 15:51:53.538667,0 days 00:00:09.422309,0.9519502888056603,0.9367415349586534,0.003336101309469784,8.923807143379781e-06,200.0,0.04771638815650077,8,5,3,0.022035132392670787,64,5,1,0.019582475626678898,128,5,1,,,,,,,,,512,0.6058446644748636,15.0,3,Adam,,,,44.0,0.5984251968503937,0.5962564215439906,,COMPLETE
4,0.41007367581014675,2026-10-04 15:51:53.594436,2026-10-04 15:52:01.414950,0 days 00:00:07.820514,,,,,64.0,0.03048372233197124,32,7,3,0.014538940849623563,32,3,1,0.01967409163601807,32,3,2,,,,,,,,,512,0.8096691394120938,17.0,3,SGD,0.0011159088550343414,0.9105271468723695,0.0038765111709116325,49.0,0.41338582677165353,0.40676152484864,,COMPLETE
5,,2026-10-04 15:52:01.466739,2026-10-04 15:52:01.482534,0 days 00:00:00.015795,,,,,,0.016432322056699946,8,7,3,0.035985315961888587,32,5,1,0.048920422190097824,32,3,2,0.01780971951192178,128.0,5.0,2.0,0.03581889183628671,128.0,3.0,1.0,,,,5,,,,,,,,,PRUNED
6,,2026-10-04 15:52:01.616958,2026-10-04 15:52:01.631527,0 days 00:00:00.014569,,,,,,0.04713274250350902,16,7,3,0.0167797098674437,32,7,2,0.015603360609460961,64,5,1,,,,,,,,,,,,3,,,,,,,,,PRUNED
7,,2026-10-04 15:52:01.716063,2026-10-04 15:52:01.730550,0 days 00:00:00.014487,,,,,,0.021743673770579737,8,7,3,0.038078675090308135,64,7,2,0.02862392072529841,64,5,2,0.015082420506075393,256.0,3.0,2.0,,,,,,,,4,,,,,,,,,PRUNED
8,,2026-10-04 15:52:01.799138,2026-10-04 15:52:01.813652,0 days 00:00:00.014514,,,,,,0.03125418526272592,8,7,3,0.027558856828225446,64,7,2,0.016257481706843442,128,5,2,0.032174162100456025,256.0,5.0,2.0,,,,,,,,4,,,,,,,,,PRUNED
9,,2026-10-04 15:52:01.881395,2026-10-04 15:52:01.896692,0 days 00:00:00.015297,,,,,,0.01464290562027665,8,7,3,0.016928074796400606,64,7,2,0.030125450343203505,128,5,1,0.04760920965699831,64.0,3.0,1.0,,,,,,,,4,,,,,,,,,PRUNED
10,0.6199518643930155,2026-10-04 15:52:01.965510,2026-10-04 15:52:11.388536,0 days 00:00:09.423026,0.9079517194939879,0.9627768386841636,0.009444811794638241,1.5681694641610638e-06,200.0,0.04036207752276006,32,5,3,0.013699189578280573,64,3,1,0.013446685364581459,128,5,1,,,,,,,,,128,0.8155565840291188,20.0,3,Adam,,,,49.0,0.5984251968503937,0.6414785319356372,"{""block_0_dropout"": 0.04036207752276006, ""block_0_filters"": 32, ""block_0_kernel"": 5, ""block_1_dropout"": 0.013699189578280573, ""block_1_filters"": 64, ""block_1_kernel"": 3, ""block_1_stride"": 1, ""block_2_dropout"": 0.013446685364581459, ""block_2_filters"": 128, ""block_2_kernel"": 5, ""block_2_stride"": 1, ""n_blocks"": 3}",COMPLETE
11,0.6573328351170515,2026-10-04 15:52:11.443974,2026-10-04 15:52:18.693822,0 days 00:00:07.249848,0.9250098755312106,0.9537484795905934,0.00960994055704251,1.5530519390924744e-06,200.0,0.031203171371680355,32,5,3,0.012287072940566609,64,3,1,0.014801873104301276,32,5,1,,,,,,,,,128,0.7775968987109323,20.0,3,Adam,,,,49.0,0.6515748031496063,0.6630908670844968,"{""block_0_dropout"": 0.031203171371680355, ""block_0_filters"": 32, ""block_0_kernel"": 5, ""block_1_dropout"": 0.012287072940566609, ""block_1_filters"": 64, ""block_1_kernel"": 3, ""block_1_stride"": 1, ""block_2_dropout"": 0.014801873104301276, ""block_2_filters"": 32, ""block_2_kernel"": 5, ""block_2_stride"": 1, ""n_blocks"": 3}",COMPLETE
12,0.7003226179830229,2026-10-04 15:52:18.749753,2026-10-04 15:52:26.015386,0 days 00:00:07.265633,0.8886271018971063,0.9854818784290856,0.00770481704338813,1.085035078085121e-06,200.0,0.019110479025544646,32,5,3,0.013871202281622821,64,3,1,0.025282035849599042,32,5,1,,,,,,,,,128,0.8862327488926018,20.0,3,Adam,,,,49.0,0.6909448818897638,0.7097003540762821,"{""block_0_dropout"": 0.019110479025544646, ""block_0_filters"": 32, ""block_0_kernel"": 5, ""block_1_dropout"": 0.013871202281622821, ""block_1_filters"": 64, ""block_1_kernel"": 3, ""block_1_stride"": 1, ""block_2_dropout"": 0.025282035849599042, ""block_2_filters"": 32, ""block_2_kernel"": 5, ""block_2_stride"": 1, ""n_blocks"": 3}",COMPLETE
13,0.2859953242562619,2026-10-04 15:52:26.072691,2026-10-04 15:52:29.138052,0 days 00:00:03.065361,0.8677754171207518,0.9899314621946222,0.009236707931295118,1.0043853827491134e-06,200.0,0.025554433914914975,32,5,3,0.020069415408610493,64,3,1,0.02486542170838165,32,5,1,0.02899434815991921,256.0,5.0,1.0,,,,,128,0.8916711379929562,20.0,4,Adam,,,,,,,"{""block_0_dropout"": 0.025554433914914975, ""block_0_filters"": 32, ""block_0_kernel"": 5, ""block_1_dropout"": 0.020069415408610493, ""block_1_filters"": 64, ""block_1_kernel"": 3, ""block_1_stride"": 1, ""block_2_dropout"": 0.02486542170838165, ""block_2_filters"": 32, ""block_2_kernel"": 5, ""block_2_stride"": 1, ""n_blocks"": 4}",PRUNED
14,0.23278249574842402,2026-10-04 15:52:29.216223,2026-10-04 15:52:30.638054,0 days 00:00:01.421831,0.9039520002849664,0.9904065776905181,0.00019983715570842382,2.0155991635048306e-05,200.0,0.013783090034747394,32,5,3,0.010339405982275517,64,3,1,0.014228233247397278,32,3,1,,,,,,,,,128,0.6223514629016952,20.0,3,Adam,,,,,,,"{""block_0_dropout"": 0.013783090034747394, ""block_0_filters"": 32, ""block_0_kernel"": 5, ""block_1_dropout"": 0.010339405982275517, ""block_1_filters"": 64, ""block_1_kernel"": 3, ""block_1_stride"": 1, ""block_2_dropout"": 0.014228233247397278, ""block_2_filters"": 32, ""block_2_kernel"": 3, ""block_2_stride"": 1, ""n_blocks"": 3}",PRUNED
15,0.5946305937660139,2026-10-04 15:52:30.693654,2026-10-04 15:52:40.432550,0 days 00:00:09.738896,0.9114322461237193,0.9605278775621027,0.0038342001318135556,1.1742695069077788e-05,64.0,0.03504677042754417,8,5,3,0.01144899133909994,64,3,1,0.024283875115384636,32,5,1,,,,,,,,,128,0.6792390791971117,17.0,3,Adam,,,,50.0,0.5846456692913385,0.6046155182406893,"{""block_0_dropout"": 0.03504677042754417, ""block_0_filters"": 8, ""block_0_kernel"": 5, ""block_1_dropout"": 0.01144899133909994, ""block_1_filters"": 64, ""block_1_kernel"": 3, ""block_1_stride"": 1, ""block_2_dropout"": 0.024283875115384636, ""block_2_filters"": 32, ""block_2_kernel"": 5, ""block_2_stride"": 1, ""n_blocks"": 3}",COMPLETE
16,0.6337722418491241,2026-10-04 15:52:40.499315,2026-10-04 15:52:47.983881,0 days 00:00:07.484566,0.8715004778508558,0.902050148160856,0.0030893877225297538,1.455026814799605e-06,200.0,0.03977395949573476,32,5,3,0.032772628856183005,64,3,1,0.017728146362291433,32,5,1,,,,,,,,,128,0.7357851969214171,18.0,3,Adam,,,,50.0,0.6259842519685039,0.6415602317297442,"{""block_0_dropout"": 0.03977395949573476, ""block_0_filters"": 32, ""block_0_kernel"": 5, ""block_1_dropout"": 0.032772628856183005, ""block_1_filters"": 64, ""block_1_kernel"": 3, ""block_1_stride"": 1, ""block_2_dropout"": 0.017728146362291433, ""block_2_filters"": 32, ""block_2_kernel"": 5, ""block_2_stride"": 1, ""n_blocks"": 3}",COMPLETE
17,0.7782768965565512,2026-10-04 15:52:48.036432,2026-10-04 15:52:57.080803,0 days 00:00:09.044371,0.9362116313918941,0.9636867553799485,0.008048464912276067,7.062706686916536e-05,200.0,0.011453210825758871,32,5,3,0.019873497684987425,64,3,1,0.039320940997910406,64,5,1,0.028122998424383518,128.0,5.0,2.0,,,,,128,0.5331277229035946,14.0,4,Adam,,,,50.0,0.7618110236220472,0.7947427694910552,"{""block_0_dropout"": 0.011453210825758871, ""block_0_filters"": 32, ""block_0_kernel"": 5, ""block_1_dropout"": 0.019873497684987425, ""block_1_filters"": 64, ""block_1_kernel"": 3, ""block_1_stride"": 1, ""block_2_dropout"": 0.039320940997910406, ""block_2_filters"": 64, ""block_2_kernel"": 5, ""block_2_stride"": 1, ""n_blocks"": 4}",COMPLETE
18,0.784611404365205,2026-10-04 15:52:57.132918,2026-10-04 15:53:07.776361,0 days 00:00:10.643443,0.9443346699870376,0.9772935777545677,0.0012289002136298417,0.00037596196290108435,64.0,0.014751857959343374,32,5,3,0.017874187124929157,64,3,1,0.040046538682068866,32,5,1,0.02931752207095982,128.0,5.0,2.0,,,,,128,0.48695629311737854,13.0,4,Adam,,,,47.0,0.7834645669291339,0.7857582418012761,"{""block_0_dropout"": 0.014751857959343374, ""block_0_filters"": 32, ""block_0_kernel"": 5, ""block_1_dropout"": 0.017874187124929157, ""block_1_filters"": 64, ""block_1_kernel"": 3, ""block_1_stride"": 1, ""block_2_dropout"": 0.040046538682068866, ""block_2_filters"": 32, ""block_2_kernel"": 5, ""block_2_stride"": 1, ""n_blocks"": 4}",COMPLETE
19,0.7305634151271976,2026-10-04 15:53:07.828262,2026-10-04 15:53:18.091332,0 days 00:00:10.263070,,,,,64.0,0.012009674004450101,32,5,3,0.02292456278344738,64,3,1,0.03594340440443331,32,5,1,,,,,,,,,128,0.4854523060982552,12.0,3,SGD,0.089732313643986,0.708064380354301,1.2315825976004816e-06,49.0,0.7165354330708661,0.7445913971835292,"{""block_0_dropout"": 0.012009674004450101, ""block_0_filters"": 32, ""block_0_kernel"": 5, ""block_1_dropout"": 0.02292456278344738, ""block_1_filters"": 64, ""block_1_kernel"": 3, ""block_1_stride"": 1, ""block_2_dropout"": 0.03594340440443331, ""block_2_filters"": 32, ""block_2_kernel"": 5, ""block_2_stride"": 1, ""n_blocks"": 3}",COMPLETE
20,0.8587921643827359,2026-10-04 15:53:18.143977,2026-10-04 15:53:28.476646,0 days 00:00:10.332669,0.9468769160000136,0.9766837904173878,0.0006655735795919003,0.0003019907324740297,64.0,0.02060572462482106,32,5,3,0.03219041538051196,64,3,1,0.033685553629064405,64,5,1,0.02789344475005187,128.0,5.0,2.0,,,,,256,0.4783095677525482,13.0,4,Adam,,,,48.0,0.8562992125984252,0.8612851161670464,"{""block_0_dropout"": 0.02060572462482106, ""block_0_filters"": 32, ""block_0_kernel"": 5, ""block_1_dropout"": 0.03219041538051196, ""block_1_filters"": 64, ""block_1_kernel"": 3, ""block_1_stride"": 1, ""block_2_dropout"": 0.033685553629064405, ""block_2_filters"": 64, ""block_2_kernel"": 5, ""block_2_stride"": 1, ""n_blocks"": 4}",COMPLETE
21,0.8768383475485076,2026-10-04 15:53:28.531281,2026-10-04 15:53:38.772190,0 days 00:00:10.240909,0.9436314835109401,0.9739309027437201,0.0005647372569421395,0.00035065906784534644,64.0,0.019998678192284236,32,5,3,0.03279410931069884,64,3,1,0.028767471008110477,64,5,1,0.027978999522008125,128.0,5.0,2.0,,,,,256,0.464351545342451,13.0,4,Adam,,,,45.0,0.8759842519685039,0.8776924431285114,"{""block_0_dropout"": 0.019998678192284236, ""block_0_filters"": 32, ""block_0_kernel"": 5, ""block_1_dropout"": 0.03279410931069884, ""block_1_filters"": 64, ""block_1_kernel"": 3, ""block_1_stride"": 1, ""block_2_dropout"": 0.028767471008110477, ""block_2_filters"": 64, ""block_2_kernel"": 5, ""block_2_stride"": 1, ""n_blocks"": 4}",COMPLETE
22,0.861681117894898,2026-10-04 15:53:38.828566,2026-10-04 15:53:49.924402,0 days 00:00:11.095836,0.9560096785270682,0.9756591092307371,0.0005592751065362952,0.0005320545269113791,64.0,0.017497553203546477,32,5,3,0.03722296884055538,64,5,1,0.0235094038937718,64,5,1,0.0250562762129607,128.0,5.0,2.0,,,,,256,0.34061935058892023,11.0,4,Adam,,,,46.0,0.8661417322834646,0.8572205035063314,"{""block_0_dropout"": 0.017497553203546477, ""block_0_filters"": 32, ""block_0_kernel"": 5, ""block_1_dropout"": 0.03722296884055538, ""block_1_filters"": 64, ""block_1_kernel"": 5, ""block_1_stride"": 1, ""block_2_dropout"": 0.0235094038937718, ""block_2_filters"": 64, ""block_2_kernel"": 5, ""block_2_stride"": 1, ""n_blocks"": 4}",COMPLETE
23,0.8549355956019669,2026-10-04 15:53:49.980723,2026-10-04 15:54:01.944110,0 days 00:00:11.963387,0.968641538441187,0.9749857114152446,0.0004311090875560472,0.0007101220931482146,64.0,0.019824502545888554,32,5,3,0.03591643210301501,64,5,1,0.022164156101949054,64,5,1,0.022928592365294896,128.0,5.0,2.0,,,,,256,0.3410235514545913,9.0,4,Adam,,,,47.0,0.8582677165354331,0.8516034746685006,"{""block_0_dropout"": 0.019824502545888554, ""block_0_filters"": 32, ""block_0_kernel"": 5, ""block_1_dropout"": 0.03591643210301501, ""block_1_filters"": 64, ""block_1_kernel"": 5, ""block_1_stride"": 1, ""block_2_dropout"": 0.022164156101949054, ""block_2_filters"": 64, ""block_2_kernel"": 5, ""block_2_stride"": 1, ""n_blocks"": 4}",COMPLETE
24,0.8327888501091315,2026-10-04 15:54:01.997159,2026-10-04 15:54:12.258397,0 days 00:00:10.261238,0.9895606144203171,0.9991891136897973,0.0005425068941689078,0.009705682625253271,64.0,0.025231395679659582,32,5,3,0.039570573792927874,64,3,1,0.03286186877564512,64,5,1,0.0353292528753076,128.0,5.0,2.0,,,,,256,0.3559430462021517,10.0,4,Adam,,,,48.0,0.8326771653543307,0.8329005348639323,"{""block_0_dropout"": 0.025231395679659582, ""block_0_filters"": 32, ""block_0_kernel"": 5, ""block_1_dropout"": 0.039570573792927874, ""block_1_filters"": 64, ""block_1_kernel"": 3, ""block_1_stride"": 1, ""block_2_dropout"": 0.03286186877564512, ""block_2_filters"": 64, ""block_2_kernel"": 5, ""block_2_stride"": 1, ""n_blocks"": 4}",COMPLETE
25,0.8499670015412046,2026-10-04 15:54:12.314601,2026-10-04 15:54:23.243977,0 days 00:00:10.929376,0.9595032393466502,0.968626957934723,0.0005685803577553673,0.00019508970141451177,64.0,0.018591220172155015,32,5,3,0.03313106980042682,64,3,1,0.03665717456530058,32,5,1,0.023024540140814228,128.0,5.0,2.0,,,,,256,0.4116400411988387,5.0,4,Adam,,,,45.0,0.8464566929133859,0.8534773101690235,"{""block_0_dropout"": 0.018591220172155015, ""block_0_filters"": 32, ""block_0_kernel"": 5, ""block_1_dropout"": 0.03313106980042682, ""block_1_filters"": 64, ""block_1_kernel"": 3, ""block_1_stride"": 1, ""block_2_dropout"": 0.03665717456530058, ""block_2_filters"": 32, ""block_2_kernel"": 5, ""block_2_stride"": 1, ""n_blocks"": 4}",COMPLETE
26,0.8102041171481734,2026-10-04 15:54:23.298061,2026-10-04 15:54:33.514443,0 days 00:00:10.216382,0.9336171397321774,0.948982403664113,0.0002423473519979422,0.0016515863295230324,64.0,0.027513323669427343,8,5,3,0.030574985115275538,64,3,1,0.02930360081863066,64,5,1,0.023542811007189832,128.0,5.0,2.0,,,,,256,0.2796384528671818,11.0,4,Adam,,,,48.0,0.8208661417322834,0.7995420925640634,"{""block_0_dropout"": 0.027513323669427343, ""block_0_filters"": 8, ""block_0_kernel"": 5, ""block_1_dropout"": 0.030574985115275538, ""block_1_filters"": 64, ""block_1_kernel"": 3, ""block_1_stride"": 1, ""block_2_dropout"": 0.02930360081863066, ""block_2_filters"": 64, ""block_2_kernel"": 5, ""block_2_stride"": 1, ""n_blocks"": 4}",COMPLETE
27,0.8426672149593419,2026-10-04 15:54:33.571740,2026-10-04 15:54:43.164544,0 days 00:00:09.592804,0.9550106615687278,0.9771988941566476,0.0009703699533167157,0.00012641979964168347,64.0,0.013531532956516554,32,5,3,0.03153601971425311,64,3,1,0.02914166765579197,64,3,1,0.03558408021964818,128.0,5.0,2.0,,,,,256,0.10384894470203182,7.0,4,Adam,,,,49.0,0.844488188976378,0.8408462409423058,"{""block_0_dropout"": 0.013531532956516554, ""block_0_filters"": 32, ""block_0_kernel"": 5, ""block_1_dropout"": 0.03153601971425311, ""block_1_filters"": 64, ""block_1_kernel"": 3, ""block_1_stride"": 1, ""block_2_dropout"": 0.02914166765579197, ""block_2_filters"": 64, ""block_2_kernel"": 3, ""block_2_stride"": 1, ""n_blocks"": 4}",COMPLETE
28,0.12230219884107942,2026-10-04 15:54:43.220968,2026-10-04 15:54:45.564614,0 days 00:00:02.343646,,,,,64.0,0.010240011769359396,32,5,3,0.03537862141200186,64,5,1,0.018185237501833294,64,5,1,0.02471996515784044,128.0,5.0,2.0,,,,,256,0.4422911156885482,14.0,4,SGD,0.09328499542752121,0.9824257128289791,0.00942339588957209,,,,"{""block_0_dropout"": 0.010240011769359396, ""block_0_filters"": 32, ""block_0_kernel"": 5, ""block_1_dropout"": 0.03537862141200186, ""block_1_filters"": 64, ""block_1_kernel"": 5, ""block_1_stride"": 1, ""block_2_dropout"": 0.018185237501833294, ""block_2_filters"": 64, ""block_2_kernel"": 5, ""block_2_stride"": 1, ""n_blocks"": 4}",PRUNED
29,0.7612495874518844,2026-10-04 15:54:45.617858,2026-10-04 15:54:55.492644,0 days 00:00:09.874786,0.9254671114075295,0.9802670878108607,0.00010384146868640946,0.0009661194171921015,128.0,0.02542104542857162,32,5,3,0.025863395283181205,64,7,1,0.03480384915291331,64,5,1,0.011251475519382846,64.0,5.0,2.0,,,,,256,0.5579386016081688,11.0,4,Adam,,,,49.0,0.7539370078740157,0.7685621670297531,"{""block_0_dropout"": 0.02542104542857162, ""block_0_filters"": 32, ""block_0_kernel"": 5, ""block_1_dropout"": 0.025863395283181205, ""block_1_filters"": 64, ""block_1_kernel"": 7, ""block_1_stride"": 1, ""block_2_dropout"": 0.03480384915291331, ""block_2_filters"": 64, ""block_2_kernel"": 5, ""block_2_stride"": 1, ""n_blocks"": 4}",COMPLETE
30,0.817627549060812,2026-10-04 15:54:55.548093,2026-10-04 15:55:07.977597,0 days 00:00:12.429504,0.9732466709141103,0.9997071600486913,0.0008129452681267551,0.0036228214585820547,64.0,0.029581004961121565,32,5,3,0.041020969908813806,64,5,1,0.022267409974950393,128,5,1,0.03509878515854246,128.0,5.0,2.0,,,,,256,0.2668198785418978,13.0,4,Adam,,,,50.0,0.8169291338582677,0.8183259642633562,"{""block_0_dropout"": 0.029581004961121565, ""block_0_filters"": 32, ""block_0_kernel"": 5, ""block_1_dropout"": 0.041020969908813806, ""block_1_filters"": 64, ""block_1_kernel"": 5, ""block_1_stride"": 1, ""block_2_dropout"": 0.022267409974950393, ""block_2_filters"": 128, ""block_2_kernel"": 5, ""block_2_stride"": 1, ""n_blocks"": 4}",COMPLETE
31,0.8341315555288294,2026-10-04 15:55:08.036694,2026-10-04 15:55:19.365102,0 days 00:00:11.328408,0.9725679681548399,0.9713840067064299,0.00039358982166259605,0.0005713184087847122,64.0,0.024062870738542918,32,5,3,0.033639563602882894,64,5,1,0.022583372704593204,64,5,1,0.021268448274990494,128.0,5.0,2.0,,,,,256,0.32681033204843213,9.0,4,Adam,,,,49.0,0.84251968503937,0.8257434260182889,"{""block_0_dropout"": 0.024062870738542918, ""block_0_filters"": 32, ""block_0_kernel"": 5, ""block_1_dropout"": 0.033639563602882894, ""block_1_filters"": 64, ""block_1_kernel"": 5, ""block_1_stride"": 1, ""block_2_dropout"": 0.022583372704593204, ""block_2_filters"": 64, ""block_2_kernel"": 5, ""block_2_stride"": 1, ""n_blocks"": 4}",COMPLETE
32,0.8777320126947148,2026-10-04 15:55:19.423518,2026-10-04 15:55:32.177073,0 days 00:00:12.753555,0.9605207988004607,0.9756533608243633,0.0002857011584594846,0.0002547675316342794,64.0,0.01785223661777391,32,5,3,0.03479444775972983,64,5,1,0.01240840953818829,128,5,1,0.02641044582320245,128.0,5.0,2.0,,,,,256,0.4130713137080509,10.0,4,Adam,,,,49.0,0.8858267716535433,0.8696372537358862,"{""block_0_dropout"": 0.01785223661777391, ""block_0_filters"": 32, ""block_0_kernel"": 5, ""block_1_dropout"": 0.03479444775972983, ""block_1_filters"": 64, ""block_1_kernel"": 5, ""block_1_stride"": 1, ""block_2_dropout"": 0.01240840953818829, ""block_2_filters"": 128, ""block_2_kernel"": 5, ""block_2_stride"": 1, ""n_blocks"": 4}",COMPLETE
33,0.8689594496174534,2026-10-04 15:55:32.230140,2026-10-04 15:55:44.737324,0 days 00:00:12.507184,0.9398633261433984,0.9863877695176354,0.000301771845060869,0.00021002400845712043,64.0,0.020508943707067483,32,5,3,0.04210241821266592,64,7,1,0.01004204787043234,128,5,1,0.02698841452379247,128.0,5.0,2.0,,,,,256,0.4489936314423593,11.0,4,Adam,,,,50.0,0.8759842519685039,0.8619346472664029,"{""block_0_dropout"": 0.020508943707067483, ""block_0_filters"": 32, ""block_0_kernel"": 5, ""block_1_dropout"": 0.04210241821266592, ""block_1_filters"": 64, ""block_1_kernel"": 7, ""block_1_stride"": 1, ""block_2_dropout"": 0.01004204787043234, ""block_2_filters"": 128, ""block_2_kernel"": 5, ""block_2_stride"": 1, ""n_blocks"": 4}",COMPLETE
