number,value,datetime_start,datetime_complete,duration,params_adam_beta1,params_adam_beta2,params_adam_lr,params_adam_wd,params_batch_size,params_block_0_dropout,params_block_0_filters,params_block_0_kernel,params_block_0_stride,params_block_1_dropout,params_block_1_filters,params_block_1_kernel,params_block_1_stride,params_block_2_dropout,params_block_2_filters,params_block_2_kernel,params_block_2_stride,params_block_3_dropout,params_block_3_filters,params_block_3_kernel,params_block_3_stride,params_block_4_dropout,params_block_4_filters,params_block_4_kernel,params_block_4_stride,params_fc_hidden,params_lr_factor,params_lr_patience,params_n_blocks,params_optimizer,params_sgd_lr,params_sgd_momentum,params_sgd_wd,user_attrs_best_epoch,user_attrs_validation_accuracy,user_attrs_validation_macro_f1,system_attrs_tpe:relative_params:0,state
34,,2026-10-04 15:55:44.812618,2026-10-04 15:55:44.852135,0 days 00:00:00.039517,,,,,,0.018970988080023364,32,5,3,0.04781799948178888,64,7,1,0.0189494949591626,128,5,2,0.02643598347073962,128.0,5.0,2.0,,,,,,,,4,,,,,,,,"{""block_0_dropout"": 0.018970988080023364, ""block_0_filters"": 32, ""block_0_kernel"": 5, ""block_1_dropout"": 0.04781799948178888, ""block_1_filters"": 64, ""block_1_kernel"": 7, ""block_1_stride"": 1, ""block_2_dropout"": 0.0189494949591626, ""block_2_filters"": 128, ""block_2_kernel"": 5, ""block_2_stride"": 2, ""n_blocks"": 4}",PRUNED
35,0.8545130702761541,2026-10-04 15:55:44.967355,2026-10-04 15:55:56.381394,0 days 00:00:11.414039,0.9606044370108663,0.9862662642722376,0.00027329958684155177,8.47181349657154e-05,64.0,0.023613113216852735,32,5,3,0.043646507110908055,64,5,1,0.011707358521705319,128,3,1,0.03198440058526855,128.0,5.0,2.0,,,,,256,0.40525183756479355,10.0,4,Adam,,,,50.0,0.8523622047244095,0.8566639358278988,"{""block_0_dropout"": 0.023613113216852735, ""block_0_filters"": 32, ""block_0_kernel"": 5, ""block_1_dropout"": 0.043646507110908055, ""block_1_filters"": 64, ""block_1_kernel"": 5, ""block_1_stride"": 1, ""block_2_dropout"": 0.011707358521705319, ""block_2_filters"": 128, ""block_2_kernel"": 3, ""block_2_stride"": 1, ""n_blocks"": 4}",COMPLETE
36,0.8145881512059181,2026-10-04 15:55:56.449917,2026-10-04 15:56:07.168097,0 days 00:00:10.718180,,,,,128.0,0.0158688537733593,32,5,3,0.04183516182578228,64,7,1,0.01023152940448113,64,5,1,0.020012679946032612,128.0,5.0,2.0,,,,,512,0.22792277196209923,11.0,4,SGD,0.008931523574621868,0.8003670990577274,0.00033916519297336195,48.0,0.812992125984252,0.8161841764275841,"{""block_0_dropout"": 0.0158688537733593, ""block_0_filters"": 32, ""block_0_kernel"": 5, ""block_1_dropout"": 0.04183516182578228, ""block_1_filters"": 64, ""block_1_kernel"": 7, ""block_1_stride"": 1, ""block_2_dropout"": 0.01023152940448113, ""block_2_filters"": 64, ""block_2_kernel"": 5, ""block_2_stride"": 1, ""n_blocks"": 4}",COMPLETE
37,0.4316717093909075,2026-10-04 15:56:07.220585,2026-10-04 15:56:09.338813,0 days 00:00:02.118228,0.9370531682774076,0.9926310926766637,0.00013279269699416276,3.907456033744949e-05,64.0,0.015595701550646556,32,5,3,0.02702823744153989,64,5,1,0.023994575522737777,64,3,1,0.03289501793108761,64.0,5.0,2.0,,,,,256,0.4059558546864063,12.0,4,Adam,,,,,,,"{""block_0_dropout"": 0.015595701550646556, ""block_0_filters"": 32, ""block_0_kernel"": 5, ""block_1_dropout"": 0.02702823744153989, ""block_1_filters"": 64, ""block_1_kernel"": 5, ""block_1_stride"": 1, ""block_2_dropout"": 0.023994575522737777, ""block_2_filters"": 64, ""block_2_kernel"": 3, ""block_2_stride"": 1, ""n_blocks"": 4}",PRUNED
38,0.6301103865107041,2026-10-04 15:56:09.406574,2026-10-04 15:56:20.765579,0 days 00:00:11.359005,,,,,128.0,0.03211086919794172,32,5,3,0.04600610985987174,64,7,1,0.011718977832459017,128,5,1,0.04072995567278732,256.0,3.0,1.0,,,,,256,0.5479043315470624,7.0,4,SGD,0.011499744153651717,0.810436200909657,1.54012327488467e-06,,,,"{""block_0_dropout"": 0.03211086919794172, ""block_0_filters"": 32, ""block_0_kernel"": 5, ""block_1_dropout"": 0.04600610985987174, ""block_1_filters"": 64, ""block_1_kernel"": 7, ""block_1_stride"": 1, ""block_2_dropout"": 0.011718977832459017, ""block_2_filters"": 128, ""block_2_kernel"": 5, ""block_2_stride"": 1, ""n_blocks"": 4}",PRUNED
39,0.4799821360788553,2026-10-04 15:56:20.818431,2026-10-04 15:56:27.092562,0 days 00:00:06.274131,0.9865283586968825,0.9683530648467248,0.0003501609574690108,0.0002209502070529841,64.0,0.016864908907097246,32,5,3,0.03580270042750846,64,5,1,0.016189236776408426,128,5,1,,,,,,,,,256,0.3116407105969843,9.0,3,Adam,,,,,,,"{""block_0_dropout"": 0.016864908907097246, ""block_0_filters"": 32, ""block_0_kernel"": 5, ""block_1_dropout"": 0.03580270042750846, ""block_1_filters"": 64, ""block_1_kernel"": 5, ""block_1_stride"": 1, ""block_2_dropout"": 0.016189236776408426, ""block_2_filters"": 128, ""block_2_kernel"": 5, ""block_2_stride"": 1, ""n_blocks"": 3}",PRUNED
40,0.8518579118173908,2026-10-04 15:56:27.146580,2026-10-04 15:56:37.425848,0 days 00:00:10.279268,0.9237218687342865,0.9542857900691686,0.00018200758535538787,0.00013146885738971002,64.0,0.01774576876587592,32,5,3,0.026912492162301967,64,3,1,0.03078755565903321,64,5,1,0.02579416091187503,128.0,5.0,2.0,,,,,256,0.44839275981213267,12.0,4,Adam,,,,50.0,0.8523622047244095,0.851353618910372,"{""block_0_dropout"": 0.01774576876587592, ""block_0_filters"": 32, ""block_0_kernel"": 5, ""block_1_dropout"": 0.026912492162301967, ""block_1_filters"": 64, ""block_1_kernel"": 3, ""block_1_stride"": 1, ""block_2_dropout"": 0.03078755565903321, ""block_2_filters"": 64, ""block_2_kernel"": 5, ""block_2_stride"": 1, ""n_blocks"": 4}",COMPLETE
41,0.8484264260359482,2026-10-04 15:56:37.479577,2026-10-04 15:56:49.870935,0 days 00:00:12.391358,0.9481963502438967,0.9841064259189122,0.0006819331421108537,0.00030792166667282123,64.0,0.020620752592070034,16,5,3,0.0407603961836764,64,7,1,0.013064251860145284,128,5,1,0.027799065707307804,128.0,5.0,2.0,,,,,256,0.49183013013335647,13.0,4,Adam,,,,50.0,0.8582677165354331,0.8385851355364632,"{""block_0_dropout"": 0.020620752592070034, ""block_0_filters"": 16, ""block_0_kernel"": 5, ""block_1_dropout"": 0.0407603961836764, ""block_1_filters"": 64, ""block_1_kernel"": 7, ""block_1_stride"": 1, ""block_2_dropout"": 0.013064251860145284, ""block_2_filters"": 128, ""block_2_kernel"": 5, ""block_2_stride"": 1, ""n_blocks"": 4}",COMPLETE
42,0.8935617029519729,2026-10-04 15:56:49.924316,2026-10-04 15:57:04.632803,0 days 00:00:14.708487,0.9474513717776885,0.9775858016721344,0.0003216410949846011,0.00044216211962897574,64.0,0.01770418425957248,32,5,3,0.04842027486725383,64,7,1,0.011650966302604532,128,5,1,0.0301708980783274,128.0,5.0,2.0,0.010202291185011224,512.0,3.0,1.0,256,0.444957722270529,15.0,5,Adam,,,,49.0,0.8996062992125984,0.8875171066913474,"{""block_0_dropout"": 0.01770418425957248, ""block_0_filters"": 32, ""block_0_kernel"": 5, ""block_1_dropout"": 0.04842027486725383, ""block_1_filters"": 64, ""block_1_kernel"": 7, ""block_1_stride"": 1, ""block_2_dropout"": 0.011650966302604532, ""block_2_filters"": 128, ""block_2_kernel"": 5, ""block_2_stride"": 1, ""n_blocks"": 5}",COMPLETE
43,0.8981351413617291,2026-10-04 15:57:04.684994,2026-10-04 15:57:19.188802,0 days 00:00:14.503808,0.9601498441404924,0.9826022915905276,0.0002930569268384636,0.0005386926255075997,64.0,0.023005160825420607,32,5,3,0.043102420980718786,64,7,1,0.017620986800515277,128,5,1,0.03108699003281611,128.0,5.0,2.0,0.01010050450632601,512.0,3.0,1.0,512,0.384217881619344,15.0,5,Adam,,,,43.0,0.9015748031496063,0.8946954795738521,"{""block_0_dropout"": 0.023005160825420607, ""block_0_filters"": 32, ""block_0_kernel"": 5, ""block_1_dropout"": 0.043102420980718786, ""block_1_filters"": 64, ""block_1_kernel"": 7, ""block_1_stride"": 1, ""block_2_dropout"": 0.017620986800515277, ""block_2_filters"": 128, ""block_2_kernel"": 5, ""block_2_stride"": 1, ""n_blocks"": 5}",COMPLETE
44,0.8985779002009961,2026-10-04 15:57:19.240635,2026-10-04 15:57:34.003675,0 days 00:00:14.763040,0.965135133881342,0.9832279798381005,0.0003034488252654277,0.0013376864009962146,64.0,0.022622690267805997,32,5,3,0.04738271082862093,64,7,1,0.02740006415132784,128,5,1,0.030981888718619587,128.0,5.0,2.0,0.010364301755445072,512.0,3.0,1.0,512,0.3837339027063622,15.0,5,Adam,,,,47.0,0.9035433070866141,0.8936124933153782,"{""block_0_dropout"": 0.022622690267805997, ""block_0_filters"": 32, ""block_0_kernel"": 5, ""block_1_dropout"": 0.04738271082862093, ""block_1_filters"": 64, ""block_1_kernel"": 7, ""block_1_stride"": 1, ""block_2_dropout"": 0.02740006415132784, ""block_2_filters"": 128, ""block_2_kernel"": 5, ""block_2_stride"": 1, ""n_blocks"": 5}",COMPLETE
45,0.4525003269242973,2026-10-04 15:57:34.066587,2026-10-04 15:57:38.859089,0 days 00:00:04.792502,,,,,64.0,0.02321662993943371,32,5,3,0.04746992772649285,64,7,1,0.010849617429460091,64,5,1,0.03947707539154339,128.0,3.0,1.0,0.011459800790634616,512.0,3.0,1.0,512,0.3953679569038099,16.0,5,SGD,0.00010350276906784313,0.9884480675087177,0.0008713193249021935,,,,"{""block_0_dropout"": 0.02321662993943371, ""block_0_filters"": 32, ""block_0_kernel"": 5, ""block_1_dropout"": 0.04746992772649285, ""block_1_filters"": 64, ""block_1_kernel"": 7, ""block_1_stride"": 1, ""block_2_dropout"": 0.010849617429460091, ""block_2_filters"": 64, ""block_2_kernel"": 5, ""block_2_stride"": 1, ""n_blocks"": 5}",PRUNED
46,0.44111829085925625,2026-10-04 15:57:38.912379,2026-10-04 15:57:41.725135,0 days 00:00:02.812756,0.9631530742578174,0.9685417184497248,0.00016016043153651175,0.0014566058606114807,128.0,0.02520313804005296,32,5,3,0.04713563563328464,64,7,1,0.02685916958926344,128,5,1,0.031370816019757816,128.0,5.0,2.0,,,,,512,0.3736536927900965,15.0,4,Adam,,,,,,,"{""block_0_dropout"": 0.02520313804005296, ""block_0_filters"": 32, ""block_0_kernel"": 5, ""block_1_dropout"": 0.04713563563328464, ""block_1_filters"": 64, ""block_1_kernel"": 7, ""block_1_stride"": 1, ""block_2_dropout"": 0.02685916958926344, ""block_2_filters"": 128, ""block_2_kernel"": 5, ""block_2_stride"": 1, ""n_blocks"": 4}",PRUNED
47,0.8561972439193714,2026-10-04 15:57:41.781755,2026-10-04 15:57:55.091162,0 days 00:00:13.309407,0.9805072542347766,0.9815041746154647,0.0002620061278293897,0.003558507321894609,64.0,0.026157080686414105,32,5,3,0.04482586232558765,64,7,1,0.017256187841626996,128,5,1,0.03803240636602627,64.0,3.0,2.0,0.01023312756169222,512.0,3.0,1.0,512,0.5238028577517448,15.0,5,Adam,,,,50.0,0.860236220472441,0.8521582673663017,"{""block_0_dropout"": 0.026157080686414105, ""block_0_filters"": 32, ""block_0_kernel"": 5, ""block_1_dropout"": 0.04482586232558765, ""block_1_filters"": 64, ""block_1_kernel"": 7, ""block_1_stride"": 1, ""block_2_dropout"": 0.017256187841626996, ""block_2_filters"": 128, ""block_2_kernel"": 5, ""block_2_stride"": 1, ""n_blocks"": 5}",COMPLETE
48,0.3393968154612659,2026-10-04 15:57:55.146145,2026-10-04 15:58:00.673465,0 days 00:00:05.527320,0.9666932487956909,0.9609285197711451,0.0014313904690832818,0.0009758154342374925,64.0,0.017081904261141968,32,5,3,0.04535286675005135,64,7,1,0.015769794835867205,128,5,1,0.030243528258612828,128.0,5.0,1.0,0.010225231824078971,512.0,3.0,1.0,512,0.29645851104474924,16.0,5,Adam,,,,,,,"{""block_0_dropout"": 0.017081904261141968, ""block_0_filters"": 32, ""block_0_kernel"": 5, ""block_1_dropout"": 0.04535286675005135, ""block_1_filters"": 64, ""block_1_kernel"": 7, ""block_1_stride"": 1, ""block_2_dropout"": 0.015769794835867205, ""block_2_filters"": 128, ""block_2_kernel"": 5, ""block_2_stride"": 1, ""n_blocks"": 5}",PRUNED
49,0.8832936747014913,2026-10-04 15:58:00.729079,2026-10-04 15:58:18.182436,0 days 00:00:17.453357,0.9514756017098935,0.9932159671983949,0.00043054167546931747,0.00048610027340923915,64.0,0.015965041314390107,32,5,3,0.04824241049682947,64,7,1,0.020665332758420113,128,5,1,0.03382461909405755,256.0,5.0,2.0,0.017000195550968804,512.0,3.0,1.0,512,0.6130118377922493,18.0,5,Adam,,,,43.0,0.8877952755905512,0.8787920738124315,"{""block_0_dropout"": 0.015965041314390107, ""block_0_filters"": 32, ""block_0_kernel"": 5, ""block_1_dropout"": 0.04824241049682947, ""block_1_filters"": 64, ""block_1_kernel"": 7, ""block_1_stride"": 1, ""block_2_dropout"": 0.020665332758420113, ""block_2_filters"": 128, ""block_2_kernel"": 5, ""block_2_stride"": 1, ""n_blocks"": 5}",COMPLETE
50,0.8444531541049654,2026-10-04 15:58:18.256067,2026-10-04 15:58:36.085075,0 days 00:00:17.829008,0.9529260833271069,0.9903342377779012,0.00036316044581544154,0.0024727779058960047,64.0,0.012966068571747893,32,5,3,0.04531878602992469,64,7,1,0.02295173367421281,128,5,1,0.03408772410783913,256.0,3.0,2.0,0.015193746412385863,512.0,3.0,1.0,512,0.6159372242513059,18.0,5,Adam,,,,48.0,0.8622047244094488,0.8267015838004819,"{""block_0_dropout"": 0.012966068571747893, ""block_0_filters"": 32, ""block_0_kernel"": 5, ""block_1_dropout"": 0.04531878602992469, ""block_1_filters"": 64, ""block_1_kernel"": 7, ""block_1_stride"": 1, ""block_2_dropout"": 0.02295173367421281, ""block_2_filters"": 128, ""block_2_kernel"": 5, ""block_2_stride"": 1, ""n_blocks"": 5}",COMPLETE
51,0.8662273696498456,2026-10-04 15:58:36.146554,2026-10-04 15:58:51.774061,0 days 00:00:15.627507,0.9782840733951756,0.9953402866440711,0.0004646849380155688,0.0003887007283339382,64.0,0.013879277842173713,32,5,3,0.04663108002581744,64,7,1,0.028715910179107417,128,5,1,0.030506162819455538,256.0,5.0,2.0,0.020162276068688246,256.0,3.0,1.0,512,0.6956001485132127,17.0,5,Adam,,,,46.0,0.8779527559055118,0.8545019833941794,"{""block_0_dropout"": 0.013879277842173713, ""block_0_filters"": 32, ""block_0_kernel"": 5, ""block_1_dropout"": 0.04663108002581744, ""block_1_filters"": 64, ""block_1_kernel"": 7, ""block_1_stride"": 1, ""block_2_dropout"": 0.028715910179107417, ""block_2_filters"": 128, ""block_2_kernel"": 5, ""block_2_stride"": 1, ""n_blocks"": 5}",COMPLETE
52,0.8771884000968326,2026-10-04 15:58:51.830801,2026-10-04 15:59:09.217579,0 days 00:00:17.386778,0.9510033366319098,0.982523396500855,0.00021756231983262862,0.000895643809900768,64.0,0.02579626841915071,32,5,3,0.04820264895438392,64,7,1,0.024861568478978573,128,5,1,0.03366151367741229,256.0,5.0,2.0,0.02171117772114626,512.0,3.0,1.0,512,0.5839440299108337,19.0,5,Adam,,,,44.0,0.8917322834645669,0.8626445167290984,"{""block_0_dropout"": 0.02579626841915071, ""block_0_filters"": 32, ""block_0_kernel"": 5, ""block_1_dropout"": 0.04820264895438392, ""block_1_filters"": 64, ""block_1_kernel"": 7, ""block_1_stride"": 1, ""block_2_dropout"": 0.024861568478978573, ""block_2_filters"": 128, ""block_2_kernel"": 5, ""block_2_stride"": 1, ""n_blocks"": 5}",COMPLETE
53,0.8707565975075491,2026-10-04 15:59:09.274357,2026-10-04 15:59:26.889916,0 days 00:00:17.615559,0.9517609390160565,0.9818590242268387,0.00024721279567718036,0.0010624550027842176,64.0,0.018836638567228177,32,5,3,0.04765831295505107,64,7,1,0.03447573150380627,128,5,1,0.037235297884556984,256.0,5.0,2.0,0.02318415645222239,512.0,3.0,1.0,512,0.6448221990234629,19.0,5,Adam,,,,50.0,0.8799212598425197,0.8615919351725786,"{""block_0_dropout"": 0.018836638567228177, ""block_0_filters"": 32, ""block_0_kernel"": 5, ""block_1_dropout"": 0.04765831295505107, ""block_1_filters"": 64, ""block_1_kernel"": 7, ""block_1_stride"": 1, ""block_2_dropout"": 0.03447573150380627, ""block_2_filters"": 128, ""block_2_kernel"": 5, ""block_2_stride"": 1, ""n_blocks"": 5}",COMPLETE
54,0.8798410138189012,2026-10-04 15:59:26.947112,2026-10-04 15:59:42.611124,0 days 00:00:15.664012,0.9649505092591298,0.98714463075121,0.000193624921721434,0.0006000531752701429,64.0,0.022626996996984186,32,5,3,0.04897436381078336,64,3,1,0.021003585409105956,128,5,1,0.04326372425035789,256.0,5.0,2.0,0.021565579643487917,512.0,3.0,1.0,512,0.5766116552214791,19.0,5,Adam,,,,49.0,0.8917322834645669,0.8679497441732356,"{""block_0_dropout"": 0.022626996996984186, ""block_0_filters"": 32, ""block_0_kernel"": 5, ""block_1_dropout"": 0.04897436381078336, ""block_1_filters"": 64, ""block_1_kernel"": 3, ""block_1_stride"": 1, ""block_2_dropout"": 0.021003585409105956, ""block_2_filters"": 128, ""block_2_kernel"": 5, ""block_2_stride"": 1, ""n_blocks"": 5}",COMPLETE
55,0.8257204848871142,2026-10-04 15:59:42.664235,2026-10-04 16:00:24.809224,0 days 00:00:42.144989,0.9649733744616782,0.9875289306017492,0.00014820004672890124,0.0005238619661488596,200.0,0.01710748377556845,32,5,3,0.04972513491603731,64,7,1,0.02461098487546287,128,5,1,0.04609487460848187,256.0,5.0,1.0,0.017344762119045783,512.0,3.0,1.0,512,0.6628088156648011,18.0,5,Adam,,,,47.0,0.8287401574803149,0.8227008122939135,"{""block_0_dropout"": 0.01710748377556845, ""block_0_filters"": 32, ""block_0_kernel"": 5, ""block_1_dropout"": 0.04972513491603731, ""block_1_filters"": 64, ""block_1_kernel"": 7, ""block_1_stride"": 1, ""block_2_dropout"": 0.02461098487546287, ""block_2_filters"": 128, ""block_2_kernel"": 5, ""block_2_stride"": 1, ""n_blocks"": 5}",COMPLETE
56,0.8697737648361246,2026-10-04 16:00:24.872507,2026-10-04 16:00:39.227491,0 days 00:00:14.354984,0.9809217484078543,0.9941409173226837,0.0003122690074439986,0.0023294580966471395,64.0,0.015910425280297028,32,5,3,0.045570364721338075,64,7,1,0.01595721574276468,128,5,1,0.044203408026467966,256.0,5.0,2.0,,,,,512,0.5872435411535255,19.0,4,Adam,,,,50.0,0.8799212598425197,0.8596262698297293,"{""block_0_dropout"": 0.015910425280297028, ""block_0_filters"": 32, ""block_0_kernel"": 5, ""block_1_dropout"": 0.045570364721338075, ""block_1_filters"": 64, ""block_1_kernel"": 7, ""block_1_stride"": 1, ""block_2_dropout"": 0.01595721574276468, ""block_2_filters"": 128, ""block_2_kernel"": 5, ""block_2_stride"": 1, ""n_blocks"": 4}",COMPLETE
57,0.8939654000099215,2026-10-04 16:00:39.288805,2026-10-04 16:00:55.212351,0 days 00:00:15.923546,0.9604693816090116,0.9163291127602256,0.00019839900131970653,3.237126360469023e-06,64.0,0.014147431679011179,32,5,3,0.04706729087065314,64,3,1,0.01772389925873019,128,5,1,0.04952239034689134,256.0,5.0,2.0,0.01000445167370785,512.0,3.0,1.0,512,0.7450397091531644,15.0,5,Adam,,,,38.0,0.8996062992125984,0.8883245008072446,"{""block_0_dropout"": 0.014147431679011179, ""block_0_filters"": 32, ""block_0_kernel"": 5, ""block_1_dropout"": 0.04706729087065314, ""block_1_filters"": 64, ""block_1_kernel"": 3, ""block_1_stride"": 1, ""block_2_dropout"": 0.01772389925873019, ""block_2_filters"": 128, ""block_2_kernel"": 5, ""block_2_stride"": 1, ""n_blocks"": 5}",COMPLETE
58,0.8992533914558514,2026-10-04 16:00:55.269100,2026-10-04 16:01:11.079289,0 days 00:00:15.810189,,,,,64.0,0.015447441429530025,32,5,3,0.048616932752461185,64,3,1,0.013787767673838219,128,5,1,0.04912867908543081,256.0,5.0,2.0,0.010585872061309681,512.0,3.0,1.0,512,0.7819658014448737,14.0,5,SGD,0.014572992771517954,0.7962897082092126,1.1699407836548381e-05,48.0,0.9035433070866141,0.8949634758250885,"{""block_0_dropout"": 0.015447441429530025, ""block_0_filters"": 32, ""block_0_kernel"": 5, ""block_1_dropout"": 0.048616932752461185, ""block_1_filters"": 64, ""block_1_kernel"": 3, ""block_1_stride"": 1, ""block_2_dropout"": 0.013787767673838219, ""block_2_filters"": 128, ""block_2_kernel"": 5, ""block_2_stride"": 1, ""n_blocks"": 5}",COMPLETE
59,0.8837753610771202,2026-10-04 16:01:11.138030,2026-10-04 16:01:26.603824,0 days 00:00:15.465794,,,,,128.0,0.01657766289319319,32,5,3,0.04472288437912984,64,3,1,0.02185958036449922,128,5,1,0.04961084091761464,256.0,5.0,2.0,0.010314289180132729,512.0,3.0,1.0,512,0.8086232522023185,14.0,5,SGD,0.01050906780209223,0.7883653156483128,1.749167489658927e-05,44.0,0.8917322834645669,0.8758184386896735,"{""block_0_dropout"": 0.01657766289319319, ""block_0_filters"": 32, ""block_0_kernel"": 5, ""block_1_dropout"": 0.04472288437912984, ""block_1_filters"": 64, ""block_1_kernel"": 3, ""block_1_stride"": 1, ""block_2_dropout"": 0.02185958036449922, ""block_2_filters"": 128, ""block_2_kernel"": 5, ""block_2_stride"": 1, ""n_blocks"": 5}",COMPLETE
60,0.43656212930154437,2026-10-04 16:01:26.657237,2026-10-04 16:01:29.862754,0 days 00:00:03.205517,,,,,128.0,0.021524196880866122,32,5,3,0.044060892026509806,64,7,1,0.023773751113845,128,5,1,0.0498745764609164,256.0,3.0,2.0,0.010012001464274726,512.0,3.0,1.0,512,0.8444199468182587,14.0,5,SGD,0.01193079051070201,0.7952369694946156,1.2971476526847089e-05,,,,"{""block_0_dropout"": 0.021524196880866122, ""block_0_filters"": 32, ""block_0_kernel"": 5, ""block_1_dropout"": 0.044060892026509806, ""block_1_filters"": 64, ""block_1_kernel"": 7, ""block_1_stride"": 1, ""block_2_dropout"": 0.023773751113845, ""block_2_filters"": 128, ""block_2_kernel"": 5, ""block_2_stride"": 1, ""n_blocks"": 5}",PRUNED
61,0.4431385687441114,2026-10-04 16:01:29.933811,2026-10-04 16:01:33.286503,0 days 00:00:03.352692,,,,,128.0,0.016056924041908453,32,5,3,0.04975142413183588,64,3,1,0.018814247818210162,128,5,1,0.04541657730439289,256.0,5.0,2.0,0.01357743245504477,512.0,3.0,1.0,512,0.7599571022273941,15.0,5,SGD,0.0035627508459901724,0.7590338932821188,9.753733206960381e-06,,,,"{""block_0_dropout"": 0.016056924041908453, ""block_0_filters"": 32, ""block_0_kernel"": 5, ""block_1_dropout"": 0.04975142413183588, ""block_1_filters"": 64, ""block_1_kernel"": 3, ""block_1_stride"": 1, ""block_2_dropout"": 0.018814247818210162, ""block_2_filters"": 128, ""block_2_kernel"": 5, ""block_2_stride"": 1, ""n_blocks"": 5}",PRUNED
