number,value,datetime_start,datetime_complete,duration,params_adam_beta1,params_adam_beta2,params_adam_lr,params_adam_wd,params_batch_size,params_block_0_dropout,params_block_0_filters,params_block_0_kernel,params_block_0_stride,params_block_1_dropout,params_block_1_filters,params_block_1_kernel,params_block_1_stride,params_block_2_dropout,params_block_2_filters,params_block_2_kernel,params_block_2_stride,params_block_3_dropout,params_block_3_filters,params_block_3_kernel,params_block_3_stride,params_block_4_dropout,params_block_4_filters,params_block_4_kernel,params_block_4_stride,params_fc_hidden,params_lr_factor,params_lr_patience,params_n_blocks,params_optimizer,params_sgd_lr,params_sgd_momentum,params_sgd_wd,user_attrs_best_epoch,user_attrs_validation_accuracy,user_attrs_validation_macro_f1,system_attrs_tpe:relative_params:0,state
62,0.872079208489622,2026-10-04 16:01:33.338978,2026-10-04 16:01:49.663987,0 days 00:00:16.325009,,,,,128.0,0.014252858317318371,32,5,3,0.04029273843856697,64,7,1,0.021632279956706635,128,5,1,0.0432442167389826,256.0,5.0,2.0,0.010312440702378902,512.0,3.0,1.0,512,0.7117115385333052,14.0,5,SGD,0.029767094453756467,0.8550588194922714,7.331730522341764e-05,47.0,0.8720472440944882,0.8721111728847557,"{""block_0_dropout"": 0.014252858317318371, ""block_0_filters"": 32, ""block_0_kernel"": 5, ""block_1_dropout"": 0.04029273843856697, ""block_1_filters"": 64, ""block_1_kernel"": 7, ""block_1_stride"": 1, ""block_2_dropout"": 0.021632279956706635, ""block_2_filters"": 128, ""block_2_kernel"": 5, ""block_2_stride"": 1, ""n_blocks"": 5}",COMPLETE
63,0.41469536755188957,2026-10-04 16:01:49.722737,2026-10-04 16:01:52.532771,0 days 00:00:02.810034,,,,,128.0,0.016765211393651027,32,5,3,0.04872913050857906,64,3,1,0.01228635653543133,64,5,1,0.04982400155147131,256.0,5.0,2.0,0.015005490065967318,512.0,3.0,1.0,512,0.7864646397558658,15.0,5,SGD,0.0024617239372252135,0.7607014307055593,4.448722990620534e-06,,,,"{""block_0_dropout"": 0.016765211393651027, ""block_0_filters"": 32, ""block_0_kernel"": 5, ""block_1_dropout"": 0.04872913050857906, ""block_1_filters"": 64, ""block_1_kernel"": 3, ""block_1_stride"": 1, ""block_2_dropout"": 0.01228635653543133, ""block_2_filters"": 64, ""block_2_kernel"": 5, ""block_2_stride"": 1, ""n_blocks"": 5}",PRUNED
64,0.9105632746210512,2026-10-04 16:01:52.590041,2026-10-04 16:02:07.239402,0 days 00:00:14.649361,,,,,200.0,0.01043510552666167,32,5,3,0.049085480696799265,64,3,1,0.017103013915111858,128,5,1,0.047971485003623665,256.0,5.0,2.0,0.014415946854916144,512.0,3.0,1.0,512,0.8182512590080488,17.0,5,SGD,0.029960024974579804,0.8429210803703473,5.338291646771571e-05,43.0,0.9114173228346457,0.9097092264074568,"{""block_0_dropout"": 0.01043510552666167, ""block_0_filters"": 32, ""block_0_kernel"": 5, ""block_1_dropout"": 0.049085480696799265, ""block_1_filters"": 64, ""block_1_kernel"": 3, ""block_1_stride"": 1, ""block_2_dropout"": 0.017103013915111858, ""block_2_filters"": 128, ""block_2_kernel"": 5, ""block_2_stride"": 1, ""n_blocks"": 5}",COMPLETE
65,0.8963437366422837,2026-10-04 16:02:07.298267,2026-10-04 16:02:21.594356,0 days 00:00:14.296089,,,,,200.0,0.012843096958821814,32,5,3,0.046195561039344496,64,3,1,0.011860780253873434,128,5,1,0.047914562118554174,256.0,5.0,2.0,0.01358144679881707,512.0,3.0,1.0,512,0.856006887782145,16.0,5,SGD,0.028730313687531216,0.8632039312476621,6.30585805747181e-05,44.0,0.9015748031496063,0.8911126701349612,"{""block_0_dropout"": 0.012843096958821814, ""block_0_filters"": 32, ""block_0_kernel"": 5, ""block_1_dropout"": 0.046195561039344496, ""block_1_filters"": 64, ""block_1_kernel"": 3, ""block_1_stride"": 1, ""block_2_dropout"": 0.011860780253873434, ""block_2_filters"": 128, ""block_2_kernel"": 5, ""block_2_stride"": 1, ""n_blocks"": 5}",COMPLETE
66,0.8859612091557945,2026-10-04 16:02:21.647262,2026-10-04 16:02:34.312445,0 days 00:00:12.665183,,,,,200.0,0.013073104179679893,32,5,3,0.047339622222964776,64,3,1,0.01358864206669724,128,5,1,0.04826267980671694,256.0,5.0,2.0,0.01440843919463113,256.0,3.0,1.0,512,0.8513306961020007,16.0,5,SGD,0.03372383767073172,0.8551154015078999,6.82700546505349e-05,41.0,0.889763779527559,0.8821586387840299,"{""block_0_dropout"": 0.013073104179679893, ""block_0_filters"": 32, ""block_0_kernel"": 5, ""block_1_dropout"": 0.047339622222964776, ""block_1_filters"": 64, ""block_1_kernel"": 3, ""block_1_stride"": 1, ""block_2_dropout"": 0.01358864206669724, ""block_2_filters"": 128, ""block_2_kernel"": 5, ""block_2_stride"": 1, ""n_blocks"": 5}",COMPLETE
67,0.3840923949740974,2026-10-04 16:02:34.390631,2026-10-04 16:02:39.955366,0 days 00:00:05.564735,,,,,200.0,0.012865975671953403,32,5,3,0.045107781893766206,32,3,1,0.017605329895937192,128,5,1,0.04737080368532921,256.0,5.0,1.0,0.01444673752296307,128.0,3.0,1.0,512,0.8610759778466732,17.0,5,SGD,0.03143826478393443,0.8498383206512872,0.00017885039341715675,,,,"{""block_0_dropout"": 0.012865975671953403, ""block_0_filters"": 32, ""block_0_kernel"": 5, ""block_1_dropout"": 0.045107781893766206, ""block_1_filters"": 32, ""block_1_kernel"": 3, ""block_1_stride"": 1, ""block_2_dropout"": 0.017605329895937192, ""block_2_filters"": 128, ""block_2_kernel"": 5, ""block_2_stride"": 1, ""n_blocks"": 5}",PRUNED
68,0.878317474398375,2026-10-04 16:02:40.012683,2026-10-04 16:02:51.346371,0 days 00:00:11.333688,,,,,200.0,0.010955463761137018,32,5,3,0.04322262191640599,64,3,1,0.012361143628642823,128,5,1,0.0473386016464441,64.0,5.0,2.0,0.013204905101887874,512.0,3.0,1.0,512,0.7382843185501045,16.0,5,SGD,0.027711237962683453,0.8903060836646358,4.086908115534267e-05,45.0,0.8759842519685039,0.8806506968282461,"{""block_0_dropout"": 0.010955463761137018, ""block_0_filters"": 32, ""block_0_kernel"": 5, ""block_1_dropout"": 0.04322262191640599, ""block_1_filters"": 64, ""block_1_kernel"": 3, ""block_1_stride"": 1, ""block_2_dropout"": 0.012361143628642823, ""block_2_filters"": 128, ""block_2_kernel"": 5, ""block_2_stride"": 1, ""n_blocks"": 5}",COMPLETE
69,0.651197081718615,2026-10-04 16:02:51.398618,2026-10-04 16:02:58.200816,0 days 00:00:06.802198,,,,,200.0,0.015746314809691398,32,5,3,0.03980593811109042,64,3,1,0.01589279552438999,128,5,1,0.04503339709243609,256.0,5.0,2.0,0.013921421785021933,512.0,3.0,1.0,512,0.8980088262909012,15.0,5,SGD,0.005030887554804498,0.8360444609999053,0.00031122790910404185,,,,"{""block_0_dropout"": 0.015746314809691398, ""block_0_filters"": 32, ""block_0_kernel"": 5, ""block_1_dropout"": 0.03980593811109042, ""block_1_filters"": 64, ""block_1_kernel"": 3, ""block_1_stride"": 1, ""block_2_dropout"": 0.01589279552438999, ""block_2_filters"": 128, ""block_2_kernel"": 5, ""block_2_stride"": 1, ""n_blocks"": 5}",PRUNED
70,,2026-10-04 16:02:58.277625,2026-10-04 16:02:58.311903,0 days 00:00:00.034278,,,,,,0.01033634525212275,32,5,3,0.04855231086798021,64,3,2,0.015237613303615945,128,5,1,0.04235154909411017,256.0,5.0,2.0,0.017702603620917245,512.0,3.0,1.0,,,,5,,,,,,,,"{""block_0_dropout"": 0.01033634525212275, ""block_0_filters"": 32, ""block_0_kernel"": 5, ""block_1_dropout"": 0.04855231086798021, ""block_1_filters"": 64, ""block_1_kernel"": 3, ""block_1_stride"": 2, ""block_2_dropout"": 0.015237613303615945, ""block_2_filters"": 128, ""block_2_kernel"": 5, ""block_2_stride"": 1, ""n_blocks"": 5}",PRUNED
71,0.522401903924202,2026-10-04 16:02:58.465712,2026-10-04 16:03:01.532302,0 days 00:00:03.066590,,,,,200.0,0.018173337912539025,32,5,3,0.04949683715849201,64,7,1,0.016069339988793167,128,5,1,0.04828797786022187,256.0,5.0,2.0,0.013127390976877342,256.0,3.0,1.0,512,0.8364971466002676,16.0,5,SGD,0.042363469817916694,0.8665212920674488,5.0186549117469164e-05,,,,"{""block_0_dropout"": 0.018173337912539025, ""block_0_filters"": 32, ""block_0_kernel"": 5, ""block_1_dropout"": 0.04949683715849201, ""block_1_filters"": 64, ""block_1_kernel"": 7, ""block_1_stride"": 1, ""block_2_dropout"": 0.016069339988793167, ""block_2_filters"": 128, ""block_2_kernel"": 5, ""block_2_stride"": 1, ""n_blocks"": 5}",PRUNED
72,0.5314047996737192,2026-10-04 16:03:01.584375,2026-10-04 16:03:04.140178,0 days 00:00:02.555803,,,,,200.0,0.013967975734938914,32,5,3,0.04737081467805044,64,3,1,0.014035376159882089,128,5,1,0.04622736230565843,256.0,5.0,2.0,0.013163410991826916,256.0,3.0,1.0,512,0.87083857426063,17.0,5,SGD,0.01957322349487873,0.9225251478059188,0.0001253343261735552,,,,"{""block_0_dropout"": 0.013967975734938914, ""block_0_filters"": 32, ""block_0_kernel"": 5, ""block_1_dropout"": 0.04737081467805044, ""block_1_filters"": 64, ""block_1_kernel"": 3, ""block_1_stride"": 1, ""block_2_dropout"": 0.014035376159882089, ""block_2_filters"": 128, ""block_2_kernel"": 5, ""block_2_stride"": 1, ""n_blocks"": 5}",PRUNED
73,0.4838463191736106,2026-10-04 16:03:04.192723,2026-10-04 16:03:06.618230,0 days 00:00:02.425507,,,,,200.0,0.021203273799054727,32,7,3,0.04605319568073794,64,3,1,0.01230482662380556,128,5,1,0.048213268395019424,256.0,5.0,2.0,0.012737976480390257,256.0,3.0,1.0,512,0.7985057150133894,15.0,5,SGD,0.049649908607520624,0.8194098291970155,5.502083550486081e-06,,,,"{""block_0_dropout"": 0.021203273799054727, ""block_0_filters"": 32, ""block_0_kernel"": 7, ""block_1_dropout"": 0.04605319568073794, ""block_1_filters"": 64, ""block_1_kernel"": 3, ""block_1_stride"": 1, ""block_2_dropout"": 0.01230482662380556, ""block_2_filters"": 128, ""block_2_kernel"": 5, ""block_2_stride"": 1, ""n_blocks"": 5}",PRUNED
74,0.5351557144286916,2026-10-04 16:03:06.671004,2026-10-04 16:03:09.630009,0 days 00:00:02.959005,,,,,200.0,0.010666733905382147,32,5,3,0.04954024406775477,64,3,1,0.019003459220326948,128,5,1,0.048385746074515304,256.0,5.0,2.0,,,,,512,0.8225735068960527,16.0,4,SGD,0.0186438422305641,0.8755772392244647,3.3787763849486796e-05,,,,"{""block_0_dropout"": 0.010666733905382147, ""block_0_filters"": 32, ""block_0_kernel"": 5, ""block_1_dropout"": 0.04954024406775477, ""block_1_filters"": 64, ""block_1_kernel"": 3, ""block_1_stride"": 1, ""block_2_dropout"": 0.019003459220326948, ""block_2_filters"": 128, ""block_2_kernel"": 5, ""block_2_stride"": 1, ""n_blocks"": 4}",PRUNED
75,0.4668459943024288,2026-10-04 16:03:09.683271,2026-10-04 16:03:12.546761,0 days 00:00:02.863490,,,,,200.0,0.014650152339735545,32,5,3,0.044503768743293086,64,3,1,0.010758207993847767,128,5,1,0.04687354403477776,256.0,5.0,2.0,0.016802760652399034,512.0,3.0,1.0,128,0.7690738680990865,16.0,5,SGD,0.056642030647165185,0.8345942559728468,0.00010926064331938228,,,,"{""block_0_dropout"": 0.014650152339735545, ""block_0_filters"": 32, ""block_0_kernel"": 5, ""block_1_dropout"": 0.044503768743293086, ""block_1_filters"": 64, ""block_1_kernel"": 3, ""block_1_stride"": 1, ""block_2_dropout"": 0.010758207993847767, ""block_2_filters"": 128, ""block_2_kernel"": 5, ""block_2_stride"": 1, ""n_blocks"": 5}",PRUNED
76,,2026-10-04 16:03:12.605477,2026-10-04 16:03:12.627488,0 days 00:00:00.022011,,,,,,0.010264241901204691,32,5,3,0.046470885834203314,64,3,1,0.016938347819297338,128,5,2,0.02902557115187862,64.0,5.0,2.0,0.010042334346209476,256.0,3.0,1.0,,,,5,,,,,,,,"{""block_0_dropout"": 0.010264241901204691, ""block_0_filters"": 32, ""block_0_kernel"": 5, ""block_1_dropout"": 0.046470885834203314, ""block_1_filters"": 64, ""block_1_kernel"": 3, ""block_1_stride"": 1, ""block_2_dropout"": 0.016938347819297338, ""block_2_filters"": 128, ""block_2_kernel"": 5, ""block_2_stride"": 2, ""n_blocks"": 5}",PRUNED
77,0.909535092111424,2026-10-04 16:03:12.688904,2026-10-04 16:03:26.413251,0 days 00:00:13.724347,,,,,200.0,0.02113980248460922,32,5,3,0.0455954836227027,64,7,1,0.019922941158711217,128,5,1,0.012376442292962992,128.0,5.0,2.0,0.012923480291961066,512.0,3.0,1.0,512,0.7399027562379977,14.0,5,SGD,0.01855276053643891,0.7682680302939943,2.968910044862183e-05,49.0,0.9133858267716536,0.9056843574511945,"{""block_0_dropout"": 0.02113980248460922, ""block_0_filters"": 32, ""block_0_kernel"": 5, ""block_1_dropout"": 0.0455954836227027, ""block_1_filters"": 64, ""block_1_kernel"": 7, ""block_1_stride"": 1, ""block_2_dropout"": 0.019922941158711217, ""block_2_filters"": 128, ""block_2_kernel"": 5, ""block_2_stride"": 1, ""n_blocks"": 5}",COMPLETE
78,0.3733498244956063,2026-10-04 16:03:26.501341,2026-10-04 16:03:29.146830,0 days 00:00:02.645489,,,,,200.0,0.018147551611763124,32,5,3,0.0467205463637147,64,7,1,0.012285986962033334,128,5,1,0.010309218539057995,128.0,5.0,2.0,0.012649891892138084,128.0,3.0,1.0,512,0.7400817884532598,14.0,5,SGD,0.005738579880140752,0.7611524118582103,2.5363801911394013e-05,,,,"{""block_0_dropout"": 0.018147551611763124, ""block_0_filters"": 32, ""block_0_kernel"": 5, ""block_1_dropout"": 0.0467205463637147, ""block_1_filters"": 64, ""block_1_kernel"": 7, ""block_1_stride"": 1, ""block_2_dropout"": 0.012285986962033334, ""block_2_filters"": 128, ""block_2_kernel"": 5, ""block_2_stride"": 1, ""n_blocks"": 5}",PRUNED
79,0.4410783601848882,2026-10-04 16:03:29.199643,2026-10-04 16:03:31.646501,0 days 00:00:02.446858,,,,,200.0,0.01031148447016908,32,5,3,0.048435218219218236,64,3,1,0.022298224030040115,128,5,1,0.016205421508743368,128.0,5.0,2.0,0.04329463015257919,512.0,3.0,1.0,512,0.1710848547576574,14.0,5,SGD,0.015426691371579395,0.7771387984587685,4.314869193330146e-06,,,,"{""block_0_dropout"": 0.01031148447016908, ""block_0_filters"": 32, ""block_0_kernel"": 5, ""block_1_dropout"": 0.048435218219218236, ""block_1_filters"": 64, ""block_1_kernel"": 3, ""block_1_stride"": 1, ""block_2_dropout"": 0.022298224030040115, ""block_2_filters"": 128, ""block_2_kernel"": 5, ""block_2_stride"": 1, ""n_blocks"": 5}",PRUNED
80,0.5170211746918614,2026-10-04 16:03:31.699604,2026-10-04 16:03:35.192746,0 days 00:00:03.493142,,,,,200.0,0.020277554160964235,32,5,3,0.040705608190528306,64,7,1,0.014066783059007019,128,5,1,0.014162894120370627,128.0,5.0,2.0,0.01228246857477562,512.0,3.0,1.0,512,0.7078678683094933,13.0,5,SGD,0.006662501578188851,0.9352477888406393,7.87457016222072e-06,,,,"{""block_0_dropout"": 0.020277554160964235, ""block_0_filters"": 32, ""block_0_kernel"": 5, ""block_1_dropout"": 0.040705608190528306, ""block_1_filters"": 64, ""block_1_kernel"": 7, ""block_1_stride"": 1, ""block_2_dropout"": 0.014066783059007019, ""block_2_filters"": 128, ""block_2_kernel"": 5, ""block_2_stride"": 1, ""n_blocks"": 5}",PRUNED
81,0.8851492629764368,2026-10-04 16:03:35.246126,2026-10-04 16:03:47.375034,0 days 00:00:12.128908,,,,,200.0,0.021060227780015654,32,5,3,0.0489006783293772,64,3,1,0.012347650206057617,128,5,1,0.018633181688523195,128.0,5.0,2.0,0.01529704014748099,512.0,3.0,1.0,512,0.8155834949949186,15.0,5,SGD,0.023322868600159374,0.8217005175631299,2.666041022608002e-05,50.0,0.889763779527559,0.8805347464253145,"{""block_0_dropout"": 0.021060227780015654, ""block_0_filters"": 32, ""block_0_kernel"": 5, ""block_1_dropout"": 0.0489006783293772, ""block_1_filters"": 64, ""block_1_kernel"": 3, ""block_1_stride"": 1, ""block_2_dropout"": 0.012347650206057617, ""block_2_filters"": 128, ""block_2_kernel"": 5, ""block_2_stride"": 1, ""n_blocks"": 5}",COMPLETE
82,0.6179021261165414,2026-10-04 16:03:47.429448,2026-10-04 16:03:53.748076,0 days 00:00:06.318628,,,,,200.0,0.013052831140807727,32,5,3,0.040610092338562324,64,3,1,0.01753572419996596,128,5,1,0.013409355306738587,128.0,5.0,2.0,0.012007351649994273,512.0,3.0,1.0,512,0.8690803047559282,15.0,5,SGD,0.04487038600798327,0.8776592685599313,0.0002212055133432459,,,,"{""block_0_dropout"": 0.013052831140807727, ""block_0_filters"": 32, ""block_0_kernel"": 5, ""block_1_dropout"": 0.040610092338562324, ""block_1_filters"": 64, ""block_1_kernel"": 3, ""block_1_stride"": 1, ""block_2_dropout"": 0.01753572419996596, ""block_2_filters"": 128, ""block_2_kernel"": 5, ""block_2_stride"": 1, ""n_blocks"": 5}",PRUNED
83,0.624762257131249,2026-10-04 16:03:53.802232,2026-10-04 16:03:59.398181,0 days 00:00:05.595949,,,,,200.0,0.021719098001847206,32,7,3,0.03915610396672085,64,7,1,0.017913412122850754,128,5,1,0.04898017671720243,128.0,5.0,2.0,0.011775439962981516,512.0,3.0,1.0,512,0.759870919325726,17.0,5,SGD,0.06627433221393424,0.737488995431734,4.387031391272973e-05,,,,"{""block_0_dropout"": 0.021719098001847206, ""block_0_filters"": 32, ""block_0_kernel"": 7, ""block_1_dropout"": 0.03915610396672085, ""block_1_filters"": 64, ""block_1_kernel"": 7, ""block_1_stride"": 1, ""block_2_dropout"": 0.017913412122850754, ""block_2_filters"": 128, ""block_2_kernel"": 5, ""block_2_stride"": 1, ""n_blocks"": 5}",PRUNED
84,0.5276349769082572,2026-10-04 16:03:59.451395,2026-10-04 16:04:02.829237,0 days 00:00:03.377842,,,,,200.0,0.021190312820544368,32,5,3,0.04650241259363213,64,7,1,0.01940707046915426,128,5,1,0.021078719105425837,128.0,5.0,2.0,0.010112841624868588,512.0,3.0,1.0,128,0.3774203935175315,16.0,5,SGD,0.03423286806590186,0.8436810679849247,8.687182853800778e-05,,,,"{""block_0_dropout"": 0.021190312820544368, ""block_0_filters"": 32, ""block_0_kernel"": 5, ""block_1_dropout"": 0.04650241259363213, ""block_1_filters"": 64, ""block_1_kernel"": 7, ""block_1_stride"": 1, ""block_2_dropout"": 0.01940707046915426, ""block_2_filters"": 128, ""block_2_kernel"": 5, ""block_2_stride"": 1, ""n_blocks"": 5}",PRUNED
85,0.574777910255768,2026-10-04 16:04:02.893529,2026-10-04 16:04:08.523180,0 days 00:00:05.629651,,,,,200.0,0.015693714908707128,32,5,3,0.04125522310470881,64,3,1,0.011903057640408117,128,5,1,0.04116621792457692,256.0,3.0,2.0,0.015508172576302997,512.0,3.0,1.0,512,0.8470757117928148,14.0,5,SGD,0.015456114129481642,0.8971544556593992,0.0005026396304829095,,,,"{""block_0_dropout"": 0.015693714908707128, ""block_0_filters"": 32, ""block_0_kernel"": 5, ""block_1_dropout"": 0.04125522310470881, ""block_1_filters"": 64, ""block_1_kernel"": 3, ""block_1_stride"": 1, ""block_2_dropout"": 0.011903057640408117, ""block_2_filters"": 128, ""block_2_kernel"": 5, ""block_2_stride"": 1, ""n_blocks"": 5}",PRUNED
86,0.48735356396091883,2026-10-04 16:04:08.575856,2026-10-04 16:04:12.210208,0 days 00:00:03.634352,,,,,64.0,0.021697045983790696,32,5,3,0.04401363656645781,64,7,1,0.03840503093885422,128,5,1,0.04495887524411647,128.0,5.0,1.0,0.018974615754530227,128.0,3.0,1.0,512,0.7880985624652025,13.0,5,SGD,0.02035157743454556,0.7376612569628341,1.948340764537092e-05,,,,"{""block_0_dropout"": 0.021697045983790696, ""block_0_filters"": 32, ""block_0_kernel"": 5, ""block_1_dropout"": 0.04401363656645781, ""block_1_filters"": 64, ""block_1_kernel"": 7, ""block_1_stride"": 1, ""block_2_dropout"": 0.03840503093885422, ""block_2_filters"": 128, ""block_2_kernel"": 5, ""block_2_stride"": 1, ""n_blocks"": 5}",PRUNED
87,0.33448619087897036,2026-10-04 16:04:12.262971,2026-10-04 16:04:15.624224,0 days 00:00:03.361253,,,,,64.0,0.025720876317634624,32,5,3,0.04071202841916245,64,7,1,0.02209310733860193,128,5,1,0.04658350837544868,256.0,5.0,2.0,0.011647197843614945,512.0,3.0,1.0,512,0.8328635236503855,17.0,5,SGD,0.06217679570921042,0.865945614445555,6.361282603721933e-05,,,,"{""block_0_dropout"": 0.025720876317634624, ""block_0_filters"": 32, ""block_0_kernel"": 5, ""block_1_dropout"": 0.04071202841916245, ""block_1_filters"": 64, ""block_1_kernel"": 7, ""block_1_stride"": 1, ""block_2_dropout"": 0.02209310733860193, ""block_2_filters"": 128, ""block_2_kernel"": 5, ""block_2_stride"": 1, ""n_blocks"": 5}",PRUNED
88,,2026-10-04 16:04:15.676340,2026-10-04 16:04:15.720126,0 days 00:00:00.043786,,,,,,0.013009790077149882,32,5,3,0.04833468093805687,64,3,2,0.010485309462667904,128,5,1,0.048520754151274825,128.0,5.0,2.0,0.015708412464728906,256.0,3.0,1.0,,,,5,,,,,,,,"{""block_0_dropout"": 0.013009790077149882, ""block_0_filters"": 32, ""block_0_kernel"": 5, ""block_1_dropout"": 0.04833468093805687, ""block_1_filters"": 64, ""block_1_kernel"": 3, ""block_1_stride"": 2, ""block_2_dropout"": 0.010485309462667904, ""block_2_filters"": 128, ""block_2_kernel"": 5, ""block_2_stride"": 1, ""n_blocks"": 5}",PRUNED
89,0.5167878557195632,2026-10-04 16:04:15.900227,2026-10-04 16:04:18.376533,0 days 00:00:02.476306,,,,,64.0,0.02222252379826877,32,5,3,0.04765039909388962,64,3,1,0.014812927835763727,128,5,1,0.03685511517201928,64.0,5.0,2.0,0.028781934708393585,512.0,3.0,1.0,512,0.8832126330690698,16.0,5,SGD,0.00807568432164965,0.7757395525669483,0.00014923198214981763,,,,"{""block_0_dropout"": 0.02222252379826877, ""block_0_filters"": 32, ""block_0_kernel"": 5, ""block_1_dropout"": 0.04765039909388962, ""block_1_filters"": 64, ""block_1_kernel"": 3, ""block_1_stride"": 1, ""block_2_dropout"": 0.014812927835763727, ""block_2_filters"": 128, ""block_2_kernel"": 5, ""block_2_stride"": 1, ""n_blocks"": 5}",PRUNED
90,0.8828481380458479,2026-10-04 16:04:18.429050,2026-10-04 16:04:34.382398,0 days 00:00:15.953348,0.8550058704773601,0.9098953668943401,0.00010265901895136677,2.8800728140716544e-06,200.0,0.02175081222216044,32,5,3,0.04279219529891753,64,7,1,0.028085020189899557,128,5,1,0.039619474857016244,256.0,5.0,2.0,0.011390368360158996,512.0,3.0,1.0,512,0.43094749594279447,15.0,5,Adam,,,,49.0,0.8858267716535433,0.8798695044381526,"{""block_0_dropout"": 0.02175081222216044, ""block_0_filters"": 32, ""block_0_kernel"": 5, ""block_1_dropout"": 0.04279219529891753, ""block_1_filters"": 64, ""block_1_kernel"": 7, ""block_1_stride"": 1, ""block_2_dropout"": 0.028085020189899557, ""block_2_filters"": 128, ""block_2_kernel"": 5, ""block_2_stride"": 1, ""n_blocks"": 5}",COMPLETE
