number,value,datetime_start,datetime_complete,duration,params_adam_beta1,params_adam_beta2,params_adam_lr,params_adam_wd,params_batch_size,params_block_0_dropout,params_block_0_filters,params_block_0_kernel,params_block_0_stride,params_block_1_dropout,params_block_1_filters,params_block_1_kernel,params_block_1_stride,params_block_2_dropout,params_block_2_filters,params_block_2_kernel,params_block_2_stride,params_block_3_dropout,params_block_3_filters,params_block_3_kernel,params_block_3_stride,params_block_4_dropout,params_block_4_filters,params_block_4_kernel,params_block_4_stride,params_fc_hidden,params_lr_factor,params_lr_patience,params_n_blocks,params_optimizer,params_sgd_lr,params_sgd_momentum,params_sgd_wd,user_attrs_best_epoch,user_attrs_validation_accuracy,user_attrs_validation_macro_f1,system_attrs_tpe:relative_params:0,state
91,0.8954030379571638,2026-10-04 16:04:34.435293,2026-10-04 16:04:48.293820,0 days 00:00:13.858527,,,,,200.0,0.01720387702053225,32,5,3,0.04193306384822574,64,7,1,0.014619461517583192,128,5,1,0.01849259245748726,128.0,5.0,2.0,0.014797374158470222,512.0,3.0,1.0,512,0.8102018136175009,15.0,5,SGD,0.021785626889350446,0.8247532313612007,2.69296897386244e-05,50.0,0.9015748031496063,0.8892312727647215,"{""block_0_dropout"": 0.01720387702053225, ""block_0_filters"": 32, ""block_0_kernel"": 5, ""block_1_dropout"": 0.04193306384822574, ""block_1_filters"": 64, ""block_1_kernel"": 7, ""block_1_stride"": 1, ""block_2_dropout"": 0.014619461517583192, ""block_2_filters"": 128, ""block_2_kernel"": 5, ""block_2_stride"": 1, ""n_blocks"": 5}",COMPLETE
92,0.9024167817632098,2026-10-04 16:04:48.369099,2026-10-04 16:05:02.258909,0 days 00:00:13.889810,,,,,200.0,0.019587135149923194,32,5,3,0.044054100294292436,64,7,1,0.015202012097714969,128,5,1,0.01875594951948374,128.0,5.0,2.0,0.014299786209470299,512.0,3.0,1.0,512,0.8002812765971741,14.0,5,SGD,0.013827364596930534,0.826289761243737,1.3321940267905067e-05,50.0,0.905511811023622,0.8993217525027977,"{""block_0_dropout"": 0.019587135149923194, ""block_0_filters"": 32, ""block_0_kernel"": 5, ""block_1_dropout"": 0.044054100294292436, ""block_1_filters"": 64, ""block_1_kernel"": 7, ""block_1_stride"": 1, ""block_2_dropout"": 0.015202012097714969, ""block_2_filters"": 128, ""block_2_kernel"": 5, ""block_2_stride"": 1, ""n_blocks"": 5}",COMPLETE
93,0.9069858237519105,2026-10-04 16:05:02.311612,2026-10-04 16:05:14.228967,0 days 00:00:11.917355,,,,,200.0,0.014550829111604147,32,5,3,0.04295345203422375,64,3,1,0.01426703345105771,128,5,1,0.017897022285204477,128.0,5.0,2.0,0.01171701068550325,512.0,3.0,1.0,512,0.724673622743961,14.0,5,SGD,0.013704593548965098,0.8116638329885291,1.3953412560118541e-05,46.0,0.9153543307086615,0.8986173167951595,"{""block_0_dropout"": 0.014550829111604147, ""block_0_filters"": 32, ""block_0_kernel"": 5, ""block_1_dropout"": 0.04295345203422375, ""block_1_filters"": 64, ""block_1_kernel"": 3, ""block_1_stride"": 1, ""block_2_dropout"": 0.01426703345105771, ""block_2_filters"": 128, ""block_2_kernel"": 5, ""block_2_stride"": 1, ""n_blocks"": 5}",COMPLETE
94,0.9108658001830539,2026-10-04 16:05:14.282088,2026-10-04 16:05:28.184723,0 days 00:00:13.902635,,,,,200.0,0.01469648122092762,32,5,3,0.043156563105541265,64,7,1,0.01526218657624862,128,5,1,0.018639285360017643,128.0,5.0,2.0,0.01177052567502719,512.0,3.0,1.0,512,0.7262301035880576,14.0,5,SGD,0.013451779320530485,0.81184002790524,1.1530224205233919e-05,48.0,0.9153543307086615,0.9063772696574462,"{""block_0_dropout"": 0.01469648122092762, ""block_0_filters"": 32, ""block_0_kernel"": 5, ""block_1_dropout"": 0.043156563105541265, ""block_1_filters"": 64, ""block_1_kernel"": 7, ""block_1_stride"": 1, ""block_2_dropout"": 0.01526218657624862, ""block_2_filters"": 128, ""block_2_kernel"": 5, ""block_2_stride"": 1, ""n_blocks"": 5}",COMPLETE
95,0.8890770536482342,2026-10-04 16:05:28.237405,2026-10-04 16:05:41.892073,0 days 00:00:13.654668,,,,,200.0,0.017435593614781343,32,5,3,0.04132727093073856,64,7,1,0.020340246455849958,128,5,1,0.01970998179824709,128.0,5.0,2.0,0.01685927771377786,512.0,3.0,1.0,512,0.7225934632803661,13.0,5,SGD,0.01369566335502058,0.8134946098709387,1.2600986657600647e-05,43.0,0.8956692913385826,0.8824848159578856,"{""block_0_dropout"": 0.017435593614781343, ""block_0_filters"": 32, ""block_0_kernel"": 5, ""block_1_dropout"": 0.04132727093073856, ""block_1_filters"": 64, ""block_1_kernel"": 7, ""block_1_stride"": 1, ""block_2_dropout"": 0.020340246455849958, ""block_2_filters"": 128, ""block_2_kernel"": 5, ""block_2_stride"": 1, ""n_blocks"": 5}",COMPLETE
96,0.5260454581446816,2026-10-04 16:05:41.945040,2026-10-04 16:05:44.491028,0 days 00:00:02.545988,,,,,200.0,0.013320133182633403,32,5,3,0.044451634485261904,64,3,1,0.020196231463300168,128,5,1,0.016023413288379307,128.0,3.0,2.0,0.011945606161240527,512.0,3.0,1.0,512,0.6656719717591381,14.0,5,SGD,0.01993859351291922,0.8277609697040297,1.9405757730822696e-05,,,,"{""block_0_dropout"": 0.013320133182633403, ""block_0_filters"": 32, ""block_0_kernel"": 5, ""block_1_dropout"": 0.044451634485261904, ""block_1_filters"": 64, ""block_1_kernel"": 3, ""block_1_stride"": 1, ""block_2_dropout"": 0.020196231463300168, ""block_2_filters"": 128, ""block_2_kernel"": 5, ""block_2_stride"": 1, ""n_blocks"": 5}",PRUNED
97,0.8627419145862925,2026-10-04 16:05:44.543836,2026-10-04 16:05:56.428130,0 days 00:00:11.884294,,,,,200.0,0.012942652642444525,32,5,3,0.04958494546492162,64,3,1,0.01555304078218032,128,5,1,0.012308368654072553,128.0,5.0,2.0,0.014272849008489675,512.0,3.0,1.0,512,0.7829537049875387,13.0,5,SGD,0.00990488618967721,0.8003773387819151,9.71844093239875e-06,45.0,0.8700787401574803,0.8554050890151047,"{""block_0_dropout"": 0.012942652642444525, ""block_0_filters"": 32, ""block_0_kernel"": 5, ""block_1_dropout"": 0.04958494546492162, ""block_1_filters"": 64, ""block_1_kernel"": 3, ""block_1_stride"": 1, ""block_2_dropout"": 0.01555304078218032, ""block_2_filters"": 128, ""block_2_kernel"": 5, ""block_2_stride"": 1, ""n_blocks"": 5}",COMPLETE
98,0.2457829555184049,2026-10-04 16:05:56.486286,2026-10-04 16:05:59.395657,0 days 00:00:02.909371,,,,,200.0,0.020344476283346333,32,5,3,0.046510367653938185,64,7,1,0.026888140311727312,128,5,1,0.017970137086048606,128.0,5.0,2.0,0.018830347621646586,512.0,3.0,1.0,512,0.6823054618931174,12.0,5,SGD,0.0003470218539284741,0.8067335519105069,2.696158445162081e-06,,,,"{""block_0_dropout"": 0.020344476283346333, ""block_0_filters"": 32, ""block_0_kernel"": 5, ""block_1_dropout"": 0.046510367653938185, ""block_1_filters"": 64, ""block_1_kernel"": 7, ""block_1_stride"": 1, ""block_2_dropout"": 0.026888140311727312, ""block_2_filters"": 128, ""block_2_kernel"": 5, ""block_2_stride"": 1, ""n_blocks"": 5}",PRUNED
99,0.5334273434283674,2026-10-04 16:05:59.448878,2026-10-04 16:06:05.161816,0 days 00:00:05.712938,,,,,200.0,0.010353062061626731,32,5,3,0.04604892003495173,64,3,1,0.012205611954406793,128,5,1,0.02394340427713751,128.0,5.0,1.0,0.01592161675246094,512.0,3.0,1.0,512,0.8176355434527086,14.0,5,SGD,0.013608461573515486,0.7842943302589614,1.4422884453008728e-05,,,,"{""block_0_dropout"": 0.010353062061626731, ""block_0_filters"": 32, ""block_0_kernel"": 5, ""block_1_dropout"": 0.04604892003495173, ""block_1_filters"": 64, ""block_1_kernel"": 3, ""block_1_stride"": 1, ""block_2_dropout"": 0.012205611954406793, ""block_2_filters"": 128, ""block_2_kernel"": 5, ""block_2_stride"": 1, ""n_blocks"": 5}",PRUNED
