number,value,datetime_start,datetime_complete,duration,params_adam_beta1,params_adam_beta2,params_adam_lr,params_adam_wd,params_batch_size,params_block_0_dropout,params_block_0_filters,params_block_0_kernel,params_block_0_stride,params_block_1_dropout,params_block_1_filters,params_block_1_kernel,params_block_1_stride,params_block_2_dropout,params_block_2_filters,params_block_2_kernel,params_block_2_stride,params_block_3_dropout,params_block_3_filters,params_block_3_kernel,params_block_3_stride,params_fc_hidden,params_first_conv_filters,params_first_conv_kernel_size,params_lr_factor,params_lr_patience,params_n_blocks,params_optimizer,params_sgd_lr,params_sgd_momentum,params_sgd_wd,user_attrs_best_epoch,user_attrs_validation_accuracy,user_attrs_validation_macro_f1,system_attrs_tpe:relative_params:0,state
38,0.256402870916659,2026-09-19 19:22:07.554682,2026-09-19 19:22:39.642311,0 days 00:00:32.087629,0.9114080198026052,0.9864275505409767,0.004377100498138179,0.0006405841743585825,32.0,0.15973438413982147,8,5,3,0.1592562252554501,32,3,1,,,,,,,,,512,128,3,0.4113169416044717,10.0,2,Adam,,,,,,,"{""block_0_dropout"": 0.15973438413982147, ""block_0_filters"": 8, ""block_0_kernel"": 5, ""block_1_dropout"": 0.1592562252554501, ""block_1_filters"": 32, ""block_1_kernel"": 3, ""block_1_stride"": 1, ""first_conv_filters"": 128, ""first_conv_kernel_size"": 3, ""n_blocks"": 2}",PRUNED
39,0.18678001430472302,2026-09-19 19:22:39.758922,2026-09-19 19:22:56.705975,0 days 00:00:16.947053,,,,,32.0,0.14213639603862654,16,5,3,0.12815777978796092,32,3,1,,,,,,,,,512,64,3,0.2350818923838497,8.0,2,SGD,0.000993098160394994,0.714470174845192,0.0005468080115230912,,,,"{""block_0_dropout"": 0.14213639603862654, ""block_0_filters"": 16, ""block_0_kernel"": 5, ""block_1_dropout"": 0.12815777978796092, ""block_1_filters"": 32, ""block_1_kernel"": 3, ""block_1_stride"": 1, ""first_conv_filters"": 64, ""first_conv_kernel_size"": 3, ""n_blocks"": 2}",PRUNED
40,0.33604699944814054,2026-09-19 19:22:56.802346,2026-09-19 19:23:47.912713,0 days 00:00:51.110367,0.9715740546316626,0.9820526217344097,0.001858923997550262,0.000571597311411699,32.0,0.12537958836889707,32,5,3,0.24890445068986433,16,3,1,0.1536502001293846,64.0,3.0,1.0,,,,,512,128,3,0.5588002086812638,11.0,3,Adam,,,,,,,"{""block_0_dropout"": 0.12537958836889707, ""block_0_filters"": 32, ""block_0_kernel"": 5, ""block_1_dropout"": 0.24890445068986433, ""block_1_filters"": 16, ""block_1_kernel"": 3, ""block_1_stride"": 1, ""first_conv_filters"": 128, ""first_conv_kernel_size"": 3, ""n_blocks"": 3}",PRUNED
41,0.2932471820354391,2026-09-19 19:23:48.019249,2026-09-19 19:24:19.372835,0 days 00:00:31.353586,0.8919112522888057,0.9679105276450557,0.000984099645309831,0.0027199745071001106,128.0,0.1237025577998393,32,5,3,0.23033504410086122,16,5,2,0.14201458529698113,32.0,3.0,1.0,,,,,512,128,3,0.36138354990769395,9.0,3,Adam,,,,,,,"{""block_0_dropout"": 0.1237025577998393, ""block_0_filters"": 32, ""block_0_kernel"": 5, ""block_1_dropout"": 0.23033504410086122, ""block_1_filters"": 16, ""block_1_kernel"": 5, ""block_1_stride"": 2, ""first_conv_filters"": 128, ""first_conv_kernel_size"": 3, ""n_blocks"": 3}",PRUNED
42,0.3901306353882904,2026-09-19 19:24:19.490445,2026-09-19 19:26:20.142519,0 days 00:02:00.652074,0.9013376115790129,0.9917552962175292,0.0006286002258106096,0.006681300495682243,64.0,0.16699689214110344,16,5,3,0.13799445708880542,32,3,1,0.11924017714464245,32.0,3.0,1.0,,,,,512,128,3,0.4102260255062751,6.0,3,Adam,,,,,,,"{""block_0_dropout"": 0.16699689214110344, ""block_0_filters"": 16, ""block_0_kernel"": 5, ""block_1_dropout"": 0.13799445708880542, ""block_1_filters"": 32, ""block_1_kernel"": 3, ""block_1_stride"": 1, ""first_conv_filters"": 128, ""first_conv_kernel_size"": 3, ""n_blocks"": 3}",PRUNED
43,0.5625434644452931,2026-09-19 19:26:20.247562,2026-09-19 19:28:34.395835,0 days 00:02:14.148273,0.8872270749218252,0.9583353765092703,0.001696324773056174,0.002630434967387718,64.0,0.1168839734885352,16,5,3,0.19141055949669458,32,3,1,,,,,,,,,512,128,3,0.45812747430603107,8.0,2,Adam,,,,49.0,0.5798816568047337,0.5452052720858526,"{""block_0_dropout"": 0.1168839734885352, ""block_0_filters"": 16, ""block_0_kernel"": 5, ""block_1_dropout"": 0.19141055949669458, ""block_1_filters"": 32, ""block_1_kernel"": 3, ""block_1_stride"": 1, ""first_conv_filters"": 128, ""first_conv_kernel_size"": 3, ""n_blocks"": 2}",COMPLETE
44,0.5472514398092656,2026-09-19 19:28:34.509874,2026-09-19 19:31:35.502526,0 days 00:03:00.992652,,,,,32.0,0.12988738780876208,16,5,3,0.19361856972430785,32,3,1,,,,,,,,,512,128,5,0.47977486496169564,7.0,2,SGD,0.019151119930145462,0.8042553525917421,1.7991033363856915e-06,50.0,0.5739644970414202,0.5205383825771112,"{""block_0_dropout"": 0.12988738780876208, ""block_0_filters"": 16, ""block_0_kernel"": 5, ""block_1_dropout"": 0.19361856972430785, ""block_1_filters"": 32, ""block_1_kernel"": 3, ""block_1_stride"": 1, ""first_conv_filters"": 128, ""first_conv_kernel_size"": 5, ""n_blocks"": 2}",COMPLETE
45,0.5668756682871896,2026-09-19 19:31:35.609883,2026-09-19 19:34:09.342826,0 days 00:02:33.732943,,,,,32.0,0.11386084555266603,16,5,3,0.17672594672202893,32,5,1,,,,,,,,,512,128,3,0.4720185777428387,5.0,2,SGD,0.014625866219962157,0.8054465917177529,1.3757124658359802e-06,50.0,0.5680473372781065,0.5657039992962727,"{""block_0_dropout"": 0.11386084555266603, ""block_0_filters"": 16, ""block_0_kernel"": 5, ""block_1_dropout"": 0.17672594672202893, ""block_1_filters"": 32, ""block_1_kernel"": 5, ""block_1_stride"": 1, ""first_conv_filters"": 128, ""first_conv_kernel_size"": 3, ""n_blocks"": 2}",COMPLETE
46,0.570503455328039,2026-09-19 19:34:09.458511,2026-09-19 19:37:11.005240,0 days 00:03:01.546729,,,,,32.0,0.13971422560893054,16,5,3,0.19923539073478805,32,3,1,,,,,,,,,512,128,5,0.583884184101281,5.0,2,SGD,0.020773026448832135,0.8047627805635702,1.5566915563495948e-06,47.0,0.6035502958579881,0.5374566147980898,"{""block_0_dropout"": 0.13971422560893054, ""block_0_filters"": 16, ""block_0_kernel"": 5, ""block_1_dropout"": 0.19923539073478805, ""block_1_filters"": 32, ""block_1_kernel"": 3, ""block_1_stride"": 1, ""first_conv_filters"": 128, ""first_conv_kernel_size"": 5, ""n_blocks"": 2}",COMPLETE
47,0.31664516421739786,2026-09-19 19:37:11.118856,2026-09-19 19:37:54.300510,0 days 00:00:43.181654,,,,,32.0,0.15603622854300864,16,5,3,0.18045000408724546,32,3,1,,,,,,,,,512,128,3,0.6004091352491405,5.0,2,SGD,0.019977166057169114,0.8020820603862768,1.1873409871834302e-06,,,,"{""block_0_dropout"": 0.15603622854300864, ""block_0_filters"": 16, ""block_0_kernel"": 5, ""block_1_dropout"": 0.18045000408724546, ""block_1_filters"": 32, ""block_1_kernel"": 3, ""block_1_stride"": 1, ""first_conv_filters"": 128, ""first_conv_kernel_size"": 3, ""n_blocks"": 2}",PRUNED
48,0.3053479757527263,2026-09-19 19:37:54.415061,2026-09-19 19:38:31.500365,0 days 00:00:37.085304,,,,,32.0,0.13557300981623582,16,5,3,0.18061509087660405,32,3,1,,,,,,,,,128,128,5,0.597104143203552,5.0,2,SGD,0.019377111168331212,0.7756099072345674,1.047721565783132e-06,,,,"{""block_0_dropout"": 0.13557300981623582, ""block_0_filters"": 16, ""block_0_kernel"": 5, ""block_1_dropout"": 0.18061509087660405, ""block_1_filters"": 32, ""block_1_kernel"": 3, ""block_1_stride"": 1, ""first_conv_filters"": 128, ""first_conv_kernel_size"": 5, ""n_blocks"": 2}",PRUNED
49,0.5128852516562109,2026-09-19 19:38:31.618541,2026-09-19 19:41:32.657526,0 days 00:03:01.038985,,,,,32.0,0.12040522408230485,16,5,3,0.20324932088945452,16,3,1,,,,,,,,,512,128,5,0.4743673938710665,16.0,2,SGD,0.02365125326374943,0.8640281070685891,5.147283461461532e-06,50.0,0.5325443786982249,0.49322612461419696,"{""block_0_dropout"": 0.12040522408230485, ""block_0_filters"": 16, ""block_0_kernel"": 5, ""block_1_dropout"": 0.20324932088945452, ""block_1_filters"": 16, ""block_1_kernel"": 3, ""block_1_stride"": 1, ""first_conv_filters"": 128, ""first_conv_kernel_size"": 5, ""n_blocks"": 2}",COMPLETE
