number,value,datetime_start,datetime_complete,duration,params_adam_beta1,params_adam_beta2,params_adam_lr,params_adam_wd,params_batch_size,params_dropout,params_fc_hidden,params_lr_factor,params_lr_patience,params_optimizer,params_sgd_lr,params_sgd_momentum,params_sgd_wd,user_attrs_best_epoch,user_attrs_validation_accuracy,user_attrs_validation_macro_f1,state
0,1.0,2026-10-09 13:17:38.575551,2026-10-09 13:18:04.752473,0 days 00:00:26.176922,,,,,64,0.1624074561769746,128,0.11646759543664197,20,SGD,0.0396760507705299,0.8743233534055306,0.0006796578090758161,1.0,1.0,1.0,COMPLETE
1,1.0,2026-10-09 13:18:04.886339,2026-10-09 13:18:25.525772,0 days 00:00:20.639433,,,,,128,0.21649165607921678,256,0.728140769114411,8,SGD,0.0007523742884534858,0.8062449345551705,6.672367170464208e-05,3.0,1.0,1.0,COMPLETE
2,1.0,2026-10-09 13:18:25.667693,2026-10-09 13:18:47.649609,0 days 00:00:21.981916,,,,,128,0.4862528132298237,512,0.19763058787582308,12,SGD,0.00019634341572933326,0.8984275776885255,5.762487216478604e-05,5.0,1.0,1.0,COMPLETE
3,1.0,2026-10-09 13:18:47.789271,2026-10-09 13:19:08.402600,0 days 00:00:20.613329,,,,,200,0.17394178221021084,64,0.8374993880184934,6,SGD,0.06584106160121614,0.9594999316240181,0.0002463768595899747,1.0,1.0,1.0,COMPLETE
4,1.0,2026-10-09 13:19:08.544694,2026-10-09 13:19:30.446262,0 days 00:00:21.901568,,,,,128,0.2123738038749523,256,0.717795815437326,8,SGD,0.025502980701628937,0.7216196866671335,0.008862326508576254,1.0,1.0,1.0,COMPLETE
5,1.0,2026-10-09 13:19:30.584715,2026-10-09 13:19:52.656629,0 days 00:00:22.071914,,,,,128,0.1463476238100519,128,0.36014665762139764,16,SGD,0.0009833181933644897,0.7184319215829468,1.753594952976443e-05,4.0,1.0,1.0,COMPLETE
6,1.0,2026-10-09 13:19:52.799264,2026-10-09 13:20:14.907651,0 days 00:00:22.108387,0.8651047997790626,0.9031397756501047,0.0007162786999897341,1.263794633808288e-06,128,0.40838687198182444,256,0.6091283290110243,10,Adam,,,,1.0,1.0,1.0,COMPLETE
7,1.0,2026-10-09 13:20:15.048570,2026-10-09 13:20:35.742239,0 days 00:00:20.693669,0.9720044826262805,0.9802868404822216,0.004132765459466363,0.000341676434183297,200,0.21590058116550723,128,0.24925604710882868,19,Adam,,,,1.0,1.0,1.0,COMPLETE
8,1.0,2026-10-09 13:20:35.883222,2026-10-09 13:21:00.334052,0 days 00:00:24.450830,,,,,64,0.42720590636899725,512,0.19589229386694626,10,SGD,0.0034059785435329977,0.8210491909131459,7.7344821566468e-06,1.0,1.0,1.0,COMPLETE
9,1.0,2026-10-09 13:21:00.473432,2026-10-09 13:21:20.637090,0 days 00:00:20.163658,,,,,128,0.20071291833014568,256,0.5021432185830892,5,SGD,0.000715354779469316,0.7106972147328144,0.000274319913977967,7.0,1.0,1.0,COMPLETE
10,1.0,2026-10-09 13:21:20.769737,2026-10-09 13:21:44.717273,0 days 00:00:23.947536,0.9770730713395525,0.9958810975199475,0.00010862348973937149,0.007645683783605599,64,0.323540359302987,128,0.422359922501545,20,Adam,,,,1.0,1.0,1.0,COMPLETE
11,1.0,2026-10-09 13:21:44.858036,2026-10-09 13:22:08.570057,0 days 00:00:23.712021,,,,,64,0.10321648831143171,64,0.8889443507086571,14,SGD,0.011172508747844114,0.8317290273423104,0.0013941165518456247,1.0,1.0,1.0,COMPLETE
12,1.0,2026-10-09 13:22:08.701220,2026-10-09 13:22:32.315940,0 days 00:00:23.614720,,,,,64,0.28455177586829483,256,0.6527521939995483,17,SGD,0.0001454699438128176,0.8257384029307472,1.94099403289878e-06,9.0,1.0,1.0,COMPLETE
13,1.0,2026-10-09 13:22:32.448783,2026-10-09 13:22:56.002974,0 days 00:00:23.554191,,,,,64,0.28261734266038524,128,0.3448400509416969,14,SGD,0.003987009996875617,0.8846418190929981,0.00045042834710787066,1.0,1.0,1.0,COMPLETE
14,1.0,2026-10-09 13:22:56.138502,2026-10-09 13:23:15.271952,0 days 00:00:19.133450,0.859332234868209,0.9283914118467068,0.009917608120507165,1.3962100266000202e-06,200,0.2600977892936006,256,0.49555582910893176,17,Adam,,,,1.0,1.0,1.0,COMPLETE
15,1.0,2026-10-09 13:23:15.403986,2026-10-09 13:23:35.814884,0 days 00:00:20.410898,,,,,128,0.10439567569750857,128,0.7614864950156898,8,SGD,0.08872754604813389,0.7753829087944386,0.0022569599258310505,1.0,1.0,1.0,COMPLETE
16,1.0,2026-10-09 13:23:35.952831,2026-10-09 13:24:00.484427,0 days 00:00:24.531596,,,,,64,0.34872818936664396,64,0.11054337150473875,13,SGD,0.0008496318594228032,0.8905721382549928,5.718796004394957e-05,2.0,1.0,1.0,COMPLETE
17,1.0,2026-10-09 13:24:00.616261,2026-10-09 13:24:21.687152,0 days 00:00:21.070891,,,,,128,0.15291234318191305,512,0.5716299599149587,11,SGD,0.008974835513193231,0.7807178289715576,2.8315782940027832e-05,1.0,1.0,1.0,COMPLETE
18,1.0,2026-10-09 13:24:21.819722,2026-10-09 13:24:46.414493,0 days 00:00:24.594771,0.9175988105045949,0.9554222965937597,0.00013159405537260094,7.272499656034689e-05,64,0.2426815878832284,128,0.10754858444071225,15,Adam,,,,2.0,1.0,1.0,COMPLETE
19,1.0,2026-10-09 13:24:46.549909,2026-10-09 13:25:06.245163,0 days 00:00:19.695254,,,,,200,0.1577479399853468,256,0.32190494173729983,7,SGD,0.00038490209497786716,0.9542143574176719,0.00012063488952886118,9.0,1.0,1.0,COMPLETE
20,1.0,2026-10-09 13:25:06.377053,2026-10-09 13:25:30.820107,0 days 00:00:24.443054,,,,,64,0.31308597303556374,256,0.7800510130195956,18,SGD,0.0033905085927758323,0.8573230306073899,0.0008868308571530527,1.0,1.0,1.0,COMPLETE
21,0.9922427102142546,2026-10-09 13:25:30.955891,2026-10-09 13:25:35.253770,0 days 00:00:04.297879,,,,,128,0.4893716564113969,512,0.20764214114449422,12,SGD,0.00010325284363778834,0.9150611709356693,7.572849695261565e-05,,,,PRUNED
22,1.0,2026-10-09 13:25:35.393860,2026-10-09 13:25:56.495620,0 days 00:00:21.101760,,,,,128,0.48509178244080814,512,0.2658936277714672,9,SGD,0.0003111115930724189,0.9138922708972126,1.0831838530636372e-05,9.0,1.0,1.0,COMPLETE
23,1.0,2026-10-09 13:25:56.630437,2026-10-09 13:26:17.690992,0 days 00:00:21.060555,,,,,128,0.38154973155918104,512,0.1747896538973724,5,SGD,0.00028976713527133067,0.877053970685817,2.8083433326867717e-06,5.0,1.0,1.0,COMPLETE
24,1.0,2026-10-09 13:26:17.824722,2026-10-09 13:26:38.887754,0 days 00:00:21.063032,,,,,128,0.4478591524143371,512,0.43275256127832784,13,SGD,0.0016754641888188629,0.7782425465170097,0.004768845380805224,2.0,1.0,1.0,COMPLETE
25,0.9978028849485465,2026-10-09 13:26:39.026116,2026-10-09 13:26:43.322242,0 days 00:00:04.296126,,,,,128,0.36746460008792137,512,0.1599918467994662,20,SGD,0.0001871439595321716,0.9119482062187728,3.564788674411224e-05,,,,PRUNED
26,1.0,2026-10-09 13:26:43.455445,2026-10-09 13:27:04.521657,0 days 00:00:21.066212,0.9185651757105271,0.952569116087763,0.0008891959815138327,0.008053548891769556,128,0.12530073389008278,128,0.27913266463501046,11,Adam,,,,1.0,1.0,1.0,COMPLETE
27,1.0,2026-10-09 13:27:04.655774,2026-10-09 13:27:25.596753,0 days 00:00:20.940979,,,,,128,0.18265727247278507,64,0.6926704655607323,7,SGD,0.03158600684184047,0.8562030112718952,0.0005182607569692148,1.0,1.0,1.0,COMPLETE
28,1.0,2026-10-09 13:27:25.730136,2026-10-09 13:27:45.462960,0 days 00:00:19.732824,,,,,200,0.2546264454471452,128,0.1039124478740838,9,SGD,0.001587608292541265,0.9406563191658766,0.0001463243643326611,2.0,1.0,1.0,COMPLETE
29,1.0,2026-10-09 13:27:45.598068,2026-10-09 13:28:10.063089,0 days 00:00:24.465021,,,,,64,0.46141560085812383,64,0.8225127556710291,7,SGD,0.00048789725985653093,0.9881471786207305,4.2484746755840044e-06,1.0,1.0,1.0,COMPLETE
30,1.0,2026-10-09 13:28:10.196454,2026-10-09 13:28:30.012434,0 days 00:00:19.815980,,,,,200,0.1754693820637774,512,0.5339352171822247,6,SGD,0.007506176619890013,0.8053039978538832,4.9548073937280195e-05,1.0,1.0,1.0,COMPLETE
31,1.0,2026-10-09 13:28:30.145532,2026-10-09 13:28:49.837537,0 days 00:00:19.692005,,,,,200,0.22589585211678864,64,0.8517931931043382,6,SGD,0.059610888931774304,0.9784150436313195,0.0001326331314769226,1.0,1.0,1.0,COMPLETE
32,1.0,2026-10-09 13:28:49.970745,2026-10-09 13:29:09.751016,0 days 00:00:19.780271,,,,,200,0.1877287215587079,64,0.7184697045885658,8,SGD,0.02442549718111793,0.9399846038295605,0.00028909709530549216,2.0,1.0,1.0,COMPLETE
33,1.0,2026-10-09 13:29:09.882709,2026-10-09 13:29:29.639019,0 days 00:00:19.756310,,,,,200,0.13348547936336308,256,0.8945909491092041,6,SGD,0.05090066780727239,0.9603266356207153,0.00022297159364709622,1.0,1.0,1.0,COMPLETE
34,1.0,2026-10-09 13:29:29.782480,2026-10-09 13:29:50.701001,0 days 00:00:20.918521,,,,,128,0.16927713059152052,64,0.793239466977818,9,SGD,0.012719951564299817,0.857674668512006,0.0006884288789779973,1.0,1.0,1.0,COMPLETE
35,1.0,2026-10-09 13:29:50.831977,2026-10-09 13:30:10.751669,0 days 00:00:19.919692,0.9285227087660517,0.9024953252619158,0.0009392449615052684,3.571344592510507e-05,200,0.21247562595015565,256,0.7330553580635045,10,Adam,,,,1.0,1.0,1.0,COMPLETE
36,1.0,2026-10-09 13:30:10.884952,2026-10-09 13:30:31.768469,0 days 00:00:20.883517,,,,,128,0.1318632864462749,128,0.6112032339360634,16,SGD,0.09972583815944672,0.7446905869018761,0.001825374623087064,1.0,1.0,1.0,COMPLETE
37,1.0,2026-10-09 13:30:31.900264,2026-10-09 13:30:52.739733,0 days 00:00:20.839469,,,,,128,0.22935235355503658,64,0.2217003196039945,5,SGD,0.02203857409922358,0.9040029400742283,8.126047278839931e-05,1.0,1.0,1.0,COMPLETE
38,1.0,2026-10-09 13:30:52.872437,2026-10-09 13:31:17.520465,0 days 00:00:24.648028,0.8888380730757438,0.9351849276495087,0.0002622940430973794,0.0007410785953495474,64,0.4092194703467876,256,0.3969822278574724,19,Adam,,,,1.0,1.0,1.0,COMPLETE
39,1.0,2026-10-09 13:31:17.654081,2026-10-09 13:31:37.365071,0 days 00:00:19.710990,,,,,200,0.20717748882048959,128,0.6626305348973824,11,SGD,0.04001379601481075,0.7536206512910402,0.00976751412838765,1.0,1.0,1.0,COMPLETE
40,1.0,2026-10-09 13:31:37.497108,2026-10-09 13:32:02.086572,0 days 00:00:24.589464,,,,,64,0.295734418016028,512,0.8431315728641406,15,SGD,0.019506296000167934,0.9319164632323204,2.628257096990347e-05,1.0,1.0,1.0,COMPLETE
41,1.0,2026-10-09 13:32:02.218635,2026-10-09 13:32:23.297321,0 days 00:00:21.078686,,,,,128,0.1932561471677655,256,0.1426663923459629,8,SGD,0.05740122362792441,0.7375805181791293,1.6283135533217465e-05,1.0,1.0,1.0,COMPLETE
42,1.0,2026-10-09 13:32:23.429767,2026-10-09 13:32:44.401637,0 days 00:00:20.971870,,,,,128,0.26650973831868596,256,0.6344111039956182,10,SGD,0.06885693074855619,0.7996728399931052,0.005304341423323241,1.0,1.0,1.0,COMPLETE
43,1.0,2026-10-09 13:32:44.534094,2026-10-09 13:33:05.542674,0 days 00:00:21.008580,,,,,128,0.15064229523270017,256,0.7041757379137551,7,SGD,0.04031672554236196,0.7054592974087066,0.0002341769201799679,1.0,1.0,1.0,COMPLETE
44,1.0,2026-10-09 13:33:05.676220,2026-10-09 13:33:26.686549,0 days 00:00:21.010329,,,,,128,0.11362017786069623,256,0.803940280540763,8,SGD,0.001379392865944049,0.8423953171888641,0.0010007016508767693,6.0,1.0,1.0,COMPLETE
45,1.0,2026-10-09 13:33:26.818102,2026-10-09 13:33:51.463443,0 days 00:00:24.645341,0.9446140182524503,0.9742590952683388,0.002527500324479543,1.0638297999881121e-05,64,0.34078104093949313,128,0.7649114881102964,12,Adam,,,,1.0,1.0,1.0,COMPLETE
46,1.0,2026-10-09 13:33:51.596881,2026-10-09 13:34:12.630199,0 days 00:00:21.033318,,,,,128,0.23768259867480288,256,0.5671581950579433,6,SGD,0.004697749555689616,0.8105331057963048,0.0030512634862925997,1.0,1.0,1.0,COMPLETE
47,1.0,2026-10-09 13:34:12.763349,2026-10-09 13:34:37.213070,0 days 00:00:24.449721,,,,,64,0.16970941091306416,64,0.8616345758943657,17,SGD,0.016163809271715224,0.8761116822350488,0.00038906042108498344,1.0,1.0,1.0,COMPLETE
48,1.0,2026-10-09 13:34:37.344306,2026-10-09 13:34:58.315224,0 days 00:00:20.970918,,,,,128,0.205575258081955,256,0.3081990289968161,19,SGD,0.0005816831834861195,0.7306204425292449,8.643196528822587e-05,4.0,1.0,1.0,COMPLETE
49,0.7984085174895907,2026-10-09 13:34:58.448045,2026-10-09 13:35:02.494349,0 days 00:00:04.046304,,,,,200,0.27407796131624584,128,0.499931575830211,9,SGD,0.00016519516680951643,0.7617107097145466,1.4454553964539816e-05,,,,PRUNED
