number,value,datetime_start,datetime_complete,duration,params_adam_beta1,params_adam_beta2,params_adam_lr,params_adam_wd,params_batch_size,params_block_0_dropout,params_block_0_filters,params_block_0_kernel,params_block_0_stride,params_block_1_dropout,params_block_1_filters,params_block_1_kernel,params_block_1_stride,params_block_2_dropout,params_block_2_filters,params_block_2_kernel,params_block_2_stride,params_block_3_dropout,params_block_3_filters,params_block_3_kernel,params_block_3_stride,params_fc_hidden,params_first_conv_filters,params_first_conv_kernel_size,params_lr_factor,params_lr_patience,params_n_blocks,params_optimizer,params_sgd_lr,params_sgd_momentum,params_sgd_wd,user_attrs_best_epoch,user_attrs_validation_accuracy,user_attrs_validation_macro_f1,system_attrs_tpe:relative_params:0,state
61,0.739795024303929,2026-09-30 15:24:32.382331,2026-09-30 15:26:40.784635,0 days 00:02:08.402304,0.9068823066161683,0.9836097236125164,0.0006273330538077715,6.150248239589711e-05,64.0,0.015253387194123827,32,7,3,0.039744155592560934,64,5,2,0.027711460294566833,64,3,2,,,,,512,128,5,0.5914348291087146,17.0,3,Adam,,,,48.0,0.7487373737373737,0.7308526748704842,"{""block_0_dropout"": 0.015253387194123827, ""block_0_filters"": 32, ""block_0_kernel"": 7, ""block_1_dropout"": 0.039744155592560934, ""block_1_filters"": 64, ""block_1_kernel"": 5, ""block_1_stride"": 2, ""block_2_dropout"": 0.027711460294566833, ""block_2_filters"": 64, ""block_2_kernel"": 3, ""block_2_stride"": 2, ""first_conv_filters"": 128, ""first_conv_kernel_size"": 5, ""n_blocks"": 3}",COMPLETE
62,0.7397778559434216,2026-09-30 15:26:40.836696,2026-09-30 15:28:49.643894,0 days 00:02:08.807198,0.8993248551898205,0.9839087112000524,0.0003803851308198023,7.10916005957961e-05,64.0,0.025131213772218233,32,7,3,0.03619231638679117,64,5,2,0.025289986201198857,64,3,2,,,,,512,128,5,0.591320301919026,17.0,3,Adam,,,,44.0,0.7474747474747475,0.7320809644120958,"{""block_0_dropout"": 0.025131213772218233, ""block_0_filters"": 32, ""block_0_kernel"": 7, ""block_1_dropout"": 0.03619231638679117, ""block_1_filters"": 64, ""block_1_kernel"": 5, ""block_1_stride"": 2, ""block_2_dropout"": 0.025289986201198857, ""block_2_filters"": 64, ""block_2_kernel"": 3, ""block_2_stride"": 2, ""first_conv_filters"": 128, ""first_conv_kernel_size"": 5, ""n_blocks"": 3}",COMPLETE
63,0.7124502362920038,2026-09-30 15:28:49.696615,2026-09-30 15:30:57.453764,0 days 00:02:07.757149,0.8989580143555957,0.9846739741131098,0.0003851763774746695,7.039254150783625e-05,64.0,0.011583472015330273,32,7,3,0.04098824332891327,64,5,2,0.04122847347004811,64,3,2,,,,,512,128,5,0.5435164295978894,19.0,3,Adam,,,,43.0,0.7247474747474747,0.700152997836533,"{""block_0_dropout"": 0.011583472015330273, ""block_0_filters"": 32, ""block_0_kernel"": 7, ""block_1_dropout"": 0.04098824332891327, ""block_1_filters"": 64, ""block_1_kernel"": 5, ""block_1_stride"": 2, ""block_2_dropout"": 0.04122847347004811, ""block_2_filters"": 64, ""block_2_kernel"": 3, ""block_2_stride"": 2, ""first_conv_filters"": 128, ""first_conv_kernel_size"": 5, ""n_blocks"": 3}",COMPLETE
64,0.7460159473675874,2026-09-30 15:30:57.506253,2026-09-30 15:33:05.427487,0 days 00:02:07.921234,0.8912771385697584,0.9830858252669554,0.000513749798172619,0.0004124560712314433,64.0,0.02879517813323667,32,7,3,0.02850265138939233,64,5,2,0.02260797360245442,64,3,2,,,,,512,128,5,0.5839846339033031,17.0,3,Adam,,,,50.0,0.7575757575757576,0.734456137159417,"{""block_0_dropout"": 0.02879517813323667, ""block_0_filters"": 32, ""block_0_kernel"": 7, ""block_1_dropout"": 0.02850265138939233, ""block_1_filters"": 64, ""block_1_kernel"": 5, ""block_1_stride"": 2, ""block_2_dropout"": 0.02260797360245442, ""block_2_filters"": 64, ""block_2_kernel"": 3, ""block_2_stride"": 2, ""first_conv_filters"": 128, ""first_conv_kernel_size"": 5, ""n_blocks"": 3}",COMPLETE
65,0.7321470013858292,2026-09-30 15:33:05.480552,2026-09-30 15:35:14.016650,0 days 00:02:08.536098,0.8903216501417998,0.9811345460074012,0.00017096720577793812,0.0004367395308327281,64.0,0.013262625190313224,32,7,3,0.03879007294092459,64,5,2,0.02730773710860602,64,3,2,,,,,512,128,5,0.5841677030688004,17.0,3,Adam,,,,50.0,0.7462121212121212,0.7180818815595372,"{""block_0_dropout"": 0.013262625190313224, ""block_0_filters"": 32, ""block_0_kernel"": 7, ""block_1_dropout"": 0.03879007294092459, ""block_1_filters"": 64, ""block_1_kernel"": 5, ""block_1_stride"": 2, ""block_2_dropout"": 0.02730773710860602, ""block_2_filters"": 64, ""block_2_kernel"": 3, ""block_2_stride"": 2, ""first_conv_filters"": 128, ""first_conv_kernel_size"": 5, ""n_blocks"": 3}",COMPLETE
66,0.45367232811685726,2026-09-30 15:35:14.106447,2026-09-30 15:35:45.275150,0 days 00:00:31.168703,0.8722936507012043,0.9998080796639478,0.0005326923981269988,0.0023625999531727633,64.0,0.02411891043886986,32,7,3,0.03881612019049719,64,5,2,0.022966975799085743,64,3,2,,,,,512,128,5,0.6194343250449864,18.0,3,Adam,,,,,,,"{""block_0_dropout"": 0.02411891043886986, ""block_0_filters"": 32, ""block_0_kernel"": 7, ""block_1_dropout"": 0.03881612019049719, ""block_1_filters"": 64, ""block_1_kernel"": 5, ""block_1_stride"": 2, ""block_2_dropout"": 0.022966975799085743, ""block_2_filters"": 64, ""block_2_kernel"": 3, ""block_2_stride"": 2, ""first_conv_filters"": 128, ""first_conv_kernel_size"": 5, ""n_blocks"": 3}",PRUNED
67,0.4193029812322596,2026-09-30 15:35:45.359683,2026-09-30 15:36:11.538666,0 days 00:00:26.178983,0.9042125992527289,0.9734459783649392,0.00024743092870069315,0.0059920784318626494,64.0,0.025847529104409864,32,7,3,0.028067277651284663,64,5,2,0.02010121892545925,64,3,2,,,,,128,128,5,0.6027643349825115,18.0,3,Adam,,,,,,,"{""block_0_dropout"": 0.025847529104409864, ""block_0_filters"": 32, ""block_0_kernel"": 7, ""block_1_dropout"": 0.028067277651284663, ""block_1_filters"": 64, ""block_1_kernel"": 5, ""block_1_stride"": 2, ""block_2_dropout"": 0.02010121892545925, ""block_2_filters"": 64, ""block_2_kernel"": 3, ""block_2_stride"": 2, ""first_conv_filters"": 128, ""first_conv_kernel_size"": 5, ""n_blocks"": 3}",PRUNED
68,0.6507912317772071,2026-09-30 15:36:11.591310,2026-09-30 15:37:45.778293,0 days 00:01:34.186983,0.8974069125347958,0.9856780379797422,0.0004229694265171718,0.0004099738018634379,128.0,0.017296943299928882,32,7,3,0.029739557748318428,64,5,2,0.01684407106126006,64,3,2,,,,,256,128,5,0.5494097158227598,15.0,3,Adam,,,,,,,"{""block_0_dropout"": 0.017296943299928882, ""block_0_filters"": 32, ""block_0_kernel"": 7, ""block_1_dropout"": 0.029739557748318428, ""block_1_filters"": 64, ""block_1_kernel"": 5, ""block_1_stride"": 2, ""block_2_dropout"": 0.01684407106126006, ""block_2_filters"": 64, ""block_2_kernel"": 3, ""block_2_stride"": 2, ""first_conv_filters"": 128, ""first_conv_kernel_size"": 5, ""n_blocks"": 3}",PRUNED
69,0.4775832354731758,2026-09-30 15:37:45.831121,2026-09-30 15:38:26.799681,0 days 00:00:40.968560,0.888857912424926,0.9817434024845337,0.0007494718438727031,0.00014570902108172664,64.0,0.022970527926001932,32,7,3,0.030197345782279453,64,5,2,0.017355405667771377,64,3,2,,,,,512,128,5,0.633159168759559,17.0,3,Adam,,,,,,,"{""block_0_dropout"": 0.022970527926001932, ""block_0_filters"": 32, ""block_0_kernel"": 7, ""block_1_dropout"": 0.030197345782279453, ""block_1_filters"": 64, ""block_1_kernel"": 5, ""block_1_stride"": 2, ""block_2_dropout"": 0.017355405667771377, ""block_2_filters"": 64, ""block_2_kernel"": 3, ""block_2_stride"": 2, ""first_conv_filters"": 128, ""first_conv_kernel_size"": 5, ""n_blocks"": 3}",PRUNED
70,0.6233621095367241,2026-09-30 15:38:26.856292,2026-09-30 15:39:29.464322,0 days 00:01:02.608030,0.8792720065848817,0.915394357415801,0.0003480825073684294,8.627235383083596e-05,200.0,0.023128816339675267,32,7,3,0.03645088110834451,64,5,2,0.027369301529499124,64,3,2,,,,,512,128,5,0.5665020575519576,17.0,3,Adam,,,,,,,"{""block_0_dropout"": 0.023128816339675267, ""block_0_filters"": 32, ""block_0_kernel"": 7, ""block_1_dropout"": 0.03645088110834451, ""block_1_filters"": 64, ""block_1_kernel"": 5, ""block_1_stride"": 2, ""block_2_dropout"": 0.027369301529499124, ""block_2_filters"": 64, ""block_2_kernel"": 3, ""block_2_stride"": 2, ""first_conv_filters"": 128, ""first_conv_kernel_size"": 5, ""n_blocks"": 3}",PRUNED
71,0.7336526918445252,2026-09-30 15:39:29.516780,2026-09-30 15:41:38.154789,0 days 00:02:08.638009,0.9061453158457262,0.990608942721649,0.0005181105040057916,2.8400418871721318e-05,64.0,0.030004219307144336,32,7,3,0.03591789717215631,64,5,2,0.025844221595889335,64,3,2,,,,,512,128,5,0.5304338920051397,14.0,3,Adam,,,,46.0,0.73989898989899,0.7274063937900603,"{""block_0_dropout"": 0.030004219307144336, ""block_0_filters"": 32, ""block_0_kernel"": 7, ""block_1_dropout"": 0.03591789717215631, ""block_1_filters"": 64, ""block_1_kernel"": 5, ""block_1_stride"": 2, ""block_2_dropout"": 0.025844221595889335, ""block_2_filters"": 64, ""block_2_kernel"": 3, ""block_2_stride"": 2, ""first_conv_filters"": 128, ""first_conv_kernel_size"": 5, ""n_blocks"": 3}",COMPLETE
72,0.7368113117089907,2026-09-30 15:41:38.236661,2026-09-30 15:43:47.104118,0 days 00:02:08.867457,0.8954958936895667,0.9873639479148154,0.00047909339588782295,3.0459465990354574e-05,64.0,0.032103786252695644,32,7,3,0.03295728531609953,64,5,2,0.026228566435243416,64,3,2,,,,,512,128,5,0.5297361310636705,14.0,3,Adam,,,,45.0,0.7474747474747475,0.7261478759432339,"{""block_0_dropout"": 0.032103786252695644, ""block_0_filters"": 32, ""block_0_kernel"": 7, ""block_1_dropout"": 0.03295728531609953, ""block_1_filters"": 64, ""block_1_kernel"": 5, ""block_1_stride"": 2, ""block_2_dropout"": 0.026228566435243416, ""block_2_filters"": 64, ""block_2_kernel"": 3, ""block_2_stride"": 2, ""first_conv_filters"": 128, ""first_conv_kernel_size"": 5, ""n_blocks"": 3}",COMPLETE
73,0.7581778839849249,2026-09-30 15:43:47.157512,2026-09-30 15:45:55.546408,0 days 00:02:08.388896,0.8965154864118379,0.9824801134138564,0.00044497146066814106,6.34884099278145e-05,64.0,0.028540044490738607,32,7,3,0.039893318324218406,64,5,2,0.027519665125893093,64,3,2,,,,,512,128,5,0.5840577128306919,16.0,3,Adam,,,,48.0,0.7676767676767676,0.7486790002930821,"{""block_0_dropout"": 0.028540044490738607, ""block_0_filters"": 32, ""block_0_kernel"": 7, ""block_1_dropout"": 0.039893318324218406, ""block_1_filters"": 64, ""block_1_kernel"": 5, ""block_1_stride"": 2, ""block_2_dropout"": 0.027519665125893093, ""block_2_filters"": 64, ""block_2_kernel"": 3, ""block_2_stride"": 2, ""first_conv_filters"": 128, ""first_conv_kernel_size"": 5, ""n_blocks"": 3}",COMPLETE
74,0.708988090236349,2026-09-30 15:45:55.598653,2026-09-30 15:48:04.593419,0 days 00:02:08.994766,0.8964596676313833,0.9756375952843364,0.00045861239938386783,0.00025394059870639953,64.0,0.021326172620146196,32,7,3,0.03479166303124717,64,5,2,0.018945914835960878,64,3,2,,,,,512,128,5,0.5904465154193402,16.0,3,Adam,,,,42.0,0.7234848484848485,0.6944913319878496,"{""block_0_dropout"": 0.021326172620146196, ""block_0_filters"": 32, ""block_0_kernel"": 7, ""block_1_dropout"": 0.03479166303124717, ""block_1_filters"": 64, ""block_1_kernel"": 5, ""block_1_stride"": 2, ""block_2_dropout"": 0.018945914835960878, ""block_2_filters"": 64, ""block_2_kernel"": 3, ""block_2_stride"": 2, ""first_conv_filters"": 128, ""first_conv_kernel_size"": 5, ""n_blocks"": 3}",COMPLETE
75,0.4282171997291989,2026-09-30 15:48:04.645237,2026-09-30 15:48:30.196782,0 days 00:00:25.551545,0.9152767326832876,0.9820216526012645,0.0007144338672420431,0.0012868881123857076,64.0,0.029405273858162516,32,7,3,0.04172346736731725,64,5,2,0.028553902426324145,64,3,2,,,,,512,128,5,0.49967775371019113,15.0,3,Adam,,,,,,,"{""block_0_dropout"": 0.029405273858162516, ""block_0_filters"": 32, ""block_0_kernel"": 7, ""block_1_dropout"": 0.04172346736731725, ""block_1_filters"": 64, ""block_1_kernel"": 5, ""block_1_stride"": 2, ""block_2_dropout"": 0.028553902426324145, ""block_2_filters"": 64, ""block_2_kernel"": 3, ""block_2_stride"": 2, ""first_conv_filters"": 128, ""first_conv_kernel_size"": 5, ""n_blocks"": 3}",PRUNED
76,0.43046402720858856,2026-09-30 15:48:30.279700,2026-09-30 15:49:26.451763,0 days 00:00:56.172063,0.9014577489674883,0.9870858706176149,0.00018246200042386254,6.419533697971867e-05,64.0,0.02865630193758938,32,7,3,0.031137802605967973,64,5,2,0.022505533555406985,64,3,2,,,,,512,512,5,0.6199814595321518,17.0,3,Adam,,,,,,,"{""block_0_dropout"": 0.02865630193758938, ""block_0_filters"": 32, ""block_0_kernel"": 7, ""block_1_dropout"": 0.031137802605967973, ""block_1_filters"": 64, ""block_1_kernel"": 5, ""block_1_stride"": 2, ""block_2_dropout"": 0.022505533555406985, ""block_2_filters"": 64, ""block_2_kernel"": 3, ""block_2_stride"": 2, ""first_conv_filters"": 512, ""first_conv_kernel_size"": 5, ""n_blocks"": 3}",PRUNED
77,0.6800797385870229,2026-09-30 15:49:26.586107,2026-09-30 15:51:24.500037,0 days 00:01:57.913930,0.8918993927039461,0.9957267611482041,0.0002492674245077078,0.00011366549699119599,64.0,0.014167796498980215,32,7,3,0.036168017560794186,64,5,2,0.03259568322125151,64,3,2,,,,,512,128,5,0.6504330850341452,18.0,3,Adam,,,,,,,"{""block_0_dropout"": 0.014167796498980215, ""block_0_filters"": 32, ""block_0_kernel"": 7, ""block_1_dropout"": 0.036168017560794186, ""block_1_filters"": 64, ""block_1_kernel"": 5, ""block_1_stride"": 2, ""block_2_dropout"": 0.03259568322125151, ""block_2_filters"": 64, ""block_2_kernel"": 3, ""block_2_stride"": 2, ""first_conv_filters"": 128, ""first_conv_kernel_size"": 5, ""n_blocks"": 3}",PRUNED
78,0.7596154715509058,2026-09-30 15:51:24.553772,2026-09-30 15:53:33.338707,0 days 00:02:08.784935,0.897101006724233,0.9831213224076173,0.0003446713975199472,2.1552273155951945e-05,64.0,0.02786745537446921,32,7,3,0.03114443343141318,64,5,2,0.026059331623822717,64,3,2,,,,,512,128,5,0.5900480237167013,19.0,3,Adam,,,,49.0,0.773989898989899,0.7452410441119127,"{""block_0_dropout"": 0.02786745537446921, ""block_0_filters"": 32, ""block_0_kernel"": 7, ""block_1_dropout"": 0.03114443343141318, ""block_1_filters"": 64, ""block_1_kernel"": 5, ""block_1_stride"": 2, ""block_2_dropout"": 0.026059331623822717, ""block_2_filters"": 64, ""block_2_kernel"": 3, ""block_2_stride"": 2, ""first_conv_filters"": 128, ""first_conv_kernel_size"": 5, ""n_blocks"": 3}",COMPLETE
79,0.4226008682390491,2026-09-30 15:53:33.393257,2026-09-30 15:53:59.024542,0 days 00:00:25.631285,0.8779806393461922,0.9798329552498669,0.0009415780111852684,2.2687804609689454e-05,64.0,0.02818832648692962,32,7,3,0.028669571040489263,64,5,2,0.030645751075661552,64,3,2,,,,,256,128,5,0.5774287311307499,19.0,3,Adam,,,,,,,"{""block_0_dropout"": 0.02818832648692962, ""block_0_filters"": 32, ""block_0_kernel"": 7, ""block_1_dropout"": 0.028669571040489263, ""block_1_filters"": 64, ""block_1_kernel"": 5, ""block_1_stride"": 2, ""block_2_dropout"": 0.030645751075661552, ""block_2_filters"": 64, ""block_2_kernel"": 3, ""block_2_stride"": 2, ""first_conv_filters"": 128, ""first_conv_kernel_size"": 5, ""n_blocks"": 3}",PRUNED
80,0.3154631294312672,2026-09-30 15:53:59.078133,2026-09-30 15:54:24.592502,0 days 00:00:25.514369,,,,,64.0,0.03210772740677301,32,7,3,0.028861032443592078,64,5,2,0.02847287918746032,128,3,2,,,,,512,128,5,0.4486275497899513,20.0,3,SGD,0.0009185388164917119,0.7511540517501503,4.3014146807484455e-05,,,,"{""block_0_dropout"": 0.03210772740677301, ""block_0_filters"": 32, ""block_0_kernel"": 7, ""block_1_dropout"": 0.028861032443592078, ""block_1_filters"": 64, ""block_1_kernel"": 5, ""block_1_stride"": 2, ""block_2_dropout"": 0.02847287918746032, ""block_2_filters"": 128, ""block_2_kernel"": 3, ""block_2_stride"": 2, ""first_conv_filters"": 128, ""first_conv_kernel_size"": 5, ""n_blocks"": 3}",PRUNED
81,0.5125185280658087,2026-09-30 15:54:24.649634,2026-09-30 15:55:10.309150,0 days 00:00:45.659516,0.8975469680875648,0.9863612690517636,0.0003546905794637095,3.425942470142219e-05,64.0,0.03212017842844397,32,7,3,0.027432949792719007,64,5,2,0.024665254784434043,64,3,2,,,,,512,128,5,0.6025735354551242,15.0,3,Adam,,,,,,,"{""block_0_dropout"": 0.03212017842844397, ""block_0_filters"": 32, ""block_0_kernel"": 7, ""block_1_dropout"": 0.027432949792719007, ""block_1_filters"": 64, ""block_1_kernel"": 5, ""block_1_stride"": 2, ""block_2_dropout"": 0.024665254784434043, ""block_2_filters"": 64, ""block_2_kernel"": 3, ""block_2_stride"": 2, ""first_conv_filters"": 128, ""first_conv_kernel_size"": 5, ""n_blocks"": 3}",PRUNED
82,0.5090387801051881,2026-09-30 15:55:10.361801,2026-09-30 15:55:54.480668,0 days 00:00:44.118867,0.9050685538597639,0.9824587838987254,0.000430159092551367,1.845383359454402e-05,64.0,0.03158443399398768,32,7,3,0.03495063470649938,64,5,2,0.03053969285648768,64,3,2,,,,,512,128,5,0.558382126047233,16.0,3,Adam,,,,,,,"{""block_0_dropout"": 0.03158443399398768, ""block_0_filters"": 32, ""block_0_kernel"": 7, ""block_1_dropout"": 0.03495063470649938, ""block_1_filters"": 64, ""block_1_kernel"": 5, ""block_1_stride"": 2, ""block_2_dropout"": 0.03053969285648768, ""block_2_filters"": 64, ""block_2_kernel"": 3, ""block_2_stride"": 2, ""first_conv_filters"": 128, ""first_conv_kernel_size"": 5, ""n_blocks"": 3}",PRUNED
83,0.7647478843042033,2026-09-30 15:55:54.534162,2026-09-30 15:58:02.824649,0 days 00:02:08.290487,0.8923711962666362,0.9724589656108159,0.0005338710496318021,5.848835647849547e-05,64.0,0.019703587853400022,32,7,3,0.03774051830156517,64,5,2,0.03839509201746818,64,3,2,,,,,512,128,5,0.40876519244411874,17.0,3,Adam,,,,49.0,0.7651515151515151,0.7643442534568915,"{""block_0_dropout"": 0.019703587853400022, ""block_0_filters"": 32, ""block_0_kernel"": 7, ""block_1_dropout"": 0.03774051830156517, ""block_1_filters"": 64, ""block_1_kernel"": 5, ""block_1_stride"": 2, ""block_2_dropout"": 0.03839509201746818, ""block_2_filters"": 64, ""block_2_kernel"": 3, ""block_2_stride"": 2, ""first_conv_filters"": 128, ""first_conv_kernel_size"": 5, ""n_blocks"": 3}",COMPLETE
84,0.733445410324925,2026-09-30 15:58:02.879045,2026-09-30 16:00:11.234336,0 days 00:02:08.355291,0.8927968137181722,0.9706639158982,0.0005053158082642335,3.0168200317613666e-05,64.0,0.02329269213357139,32,7,3,0.039357897316385754,64,5,2,0.01778354362521936,64,3,2,,,,,512,128,5,0.377081540671634,18.0,3,Adam,,,,44.0,0.7348484848484849,0.7320423358013652,"{""block_0_dropout"": 0.02329269213357139, ""block_0_filters"": 32, ""block_0_kernel"": 7, ""block_1_dropout"": 0.039357897316385754, ""block_1_filters"": 64, ""block_1_kernel"": 5, ""block_1_stride"": 2, ""block_2_dropout"": 0.01778354362521936, ""block_2_filters"": 64, ""block_2_kernel"": 3, ""block_2_stride"": 2, ""first_conv_filters"": 128, ""first_conv_kernel_size"": 5, ""n_blocks"": 3}",COMPLETE
85,0.5925405268366544,2026-09-30 16:00:11.318237,2026-09-30 16:01:21.834557,0 days 00:01:10.516320,0.8814495247414839,0.9622435655823477,0.0005521625906913702,0.0001701147140253094,64.0,0.032512017878233046,32,7,3,0.03306294294726474,64,5,2,0.027434082927213638,64,3,2,,,,,512,128,5,0.4055633154759346,19.0,3,Adam,,,,,,,"{""block_0_dropout"": 0.032512017878233046, ""block_0_filters"": 32, ""block_0_kernel"": 7, ""block_1_dropout"": 0.03306294294726474, ""block_1_filters"": 64, ""block_1_kernel"": 5, ""block_1_stride"": 2, ""block_2_dropout"": 0.027434082927213638, ""block_2_filters"": 64, ""block_2_kernel"": 3, ""block_2_stride"": 2, ""first_conv_filters"": 128, ""first_conv_kernel_size"": 5, ""n_blocks"": 3}",PRUNED
86,0.4264798551961826,2026-09-30 16:01:21.887259,2026-09-30 16:01:46.666251,0 days 00:00:24.778992,0.8872895961785394,0.9757350935144681,0.0006549197304146129,9.692460870189945e-05,128.0,0.025896758120023476,32,7,3,0.028124776132611995,64,5,2,0.02445159737563482,64,3,2,,,,,128,128,5,0.5385942350057581,17.0,3,Adam,,,,,,,"{""block_0_dropout"": 0.025896758120023476, ""block_0_filters"": 32, ""block_0_kernel"": 7, ""block_1_dropout"": 0.028124776132611995, ""block_1_filters"": 64, ""block_1_kernel"": 5, ""block_1_stride"": 2, ""block_2_dropout"": 0.02445159737563482, ""block_2_filters"": 64, ""block_2_kernel"": 3, ""block_2_stride"": 2, ""first_conv_filters"": 128, ""first_conv_kernel_size"": 5, ""n_blocks"": 3}",PRUNED
87,0.7576456809472571,2026-09-30 16:01:46.724520,2026-09-30 16:03:53.683148,0 days 00:02:06.958628,0.895236319818889,0.971845819390877,0.0008452114769607986,6.289108269068284e-05,64.0,0.017013058929880295,32,7,3,0.025483811822355217,64,5,2,0.019175973517683315,64,3,2,,,,,512,128,5,0.4103182435015119,16.0,3,Adam,,,,47.0,0.76010101010101,0.7551903517935042,"{""block_0_dropout"": 0.017013058929880295, ""block_0_filters"": 32, ""block_0_kernel"": 7, ""block_1_dropout"": 0.025483811822355217, ""block_1_filters"": 64, ""block_1_kernel"": 5, ""block_1_stride"": 2, ""block_2_dropout"": 0.019175973517683315, ""block_2_filters"": 64, ""block_2_kernel"": 3, ""block_2_stride"": 2, ""first_conv_filters"": 128, ""first_conv_kernel_size"": 5, ""n_blocks"": 3}",COMPLETE
88,0.43727780274255545,2026-09-30 16:03:53.735803,2026-09-30 16:04:24.632443,0 days 00:00:30.896640,0.9401392341040439,0.9719574059041884,0.0008458432286932466,5.982002706009278e-05,64.0,0.019283918700432987,32,7,3,0.024831637777930276,64,5,2,0.019418544313100514,64,3,2,,,,,512,128,5,0.33855777464288456,17.0,3,Adam,,,,,,,"{""block_0_dropout"": 0.019283918700432987, ""block_0_filters"": 32, ""block_0_kernel"": 7, ""block_1_dropout"": 0.024831637777930276, ""block_1_filters"": 64, ""block_1_kernel"": 5, ""block_1_stride"": 2, ""block_2_dropout"": 0.019418544313100514, ""block_2_filters"": 64, ""block_2_kernel"": 3, ""block_2_stride"": 2, ""first_conv_filters"": 128, ""first_conv_kernel_size"": 5, ""n_blocks"": 3}",PRUNED
