number,value,datetime_start,datetime_complete,duration,params_adam_beta1,params_adam_beta2,params_adam_lr,params_adam_wd,params_batch_size,params_block_0_dropout,params_block_0_filters,params_block_0_kernel,params_block_0_stride,params_block_1_dropout,params_block_1_filters,params_block_1_kernel,params_block_1_stride,params_block_2_dropout,params_block_2_filters,params_block_2_kernel,params_block_2_stride,params_block_3_dropout,params_block_3_filters,params_block_3_kernel,params_block_3_stride,params_fc_hidden,params_first_conv_filters,params_first_conv_kernel_size,params_lr_factor,params_lr_patience,params_n_blocks,params_optimizer,params_sgd_lr,params_sgd_momentum,params_sgd_wd,user_attrs_best_epoch,user_attrs_validation_accuracy,user_attrs_validation_macro_f1,system_attrs_tpe:relative_params:0,state
33,0.7231102878609799,2026-09-30 14:51:44.808084,2026-09-30 14:53:52.821433,0 days 00:02:08.013349,0.885403908919225,0.9887897519318224,0.0014737301969910883,2.2593503433893204e-06,64.0,0.014736404203851722,32,7,3,0.048865960359110144,64,5,2,0.022816774600506635,64,3,2,,,,,512,128,5,0.5645282514103854,12.0,3,Adam,,,,49.0,0.7297979797979798,0.7164225959239798,"{""block_0_dropout"": 0.014736404203851722, ""block_0_filters"": 32, ""block_0_kernel"": 7, ""block_1_dropout"": 0.048865960359110144, ""block_1_filters"": 64, ""block_1_kernel"": 5, ""block_1_stride"": 2, ""block_2_dropout"": 0.022816774600506635, ""block_2_filters"": 64, ""block_2_kernel"": 3, ""block_2_stride"": 2, ""first_conv_filters"": 128, ""first_conv_kernel_size"": 5, ""n_blocks"": 3}",COMPLETE
34,0.43296232642177135,2026-09-30 14:53:52.881049,2026-09-30 14:54:12.336718,0 days 00:00:19.455669,0.8502191118674968,0.9908106186954676,0.0012166201364624072,2.569069519996138e-06,64.0,0.017079195701154733,8,7,3,0.04358732496328032,64,5,2,0.015068330506027525,64,3,2,,,,,512,128,5,0.593372637798707,12.0,3,Adam,,,,,,,"{""block_0_dropout"": 0.017079195701154733, ""block_0_filters"": 8, ""block_0_kernel"": 7, ""block_1_dropout"": 0.04358732496328032, ""block_1_filters"": 64, ""block_1_kernel"": 5, ""block_1_stride"": 2, ""block_2_dropout"": 0.015068330506027525, ""block_2_filters"": 64, ""block_2_kernel"": 3, ""block_2_stride"": 2, ""first_conv_filters"": 128, ""first_conv_kernel_size"": 5, ""n_blocks"": 3}",PRUNED
35,0.38448890092827825,2026-09-30 14:54:12.392246,2026-09-30 14:54:37.456112,0 days 00:00:25.063866,0.8910097722600167,0.9896888710827446,0.002445164960828383,1.969386347423637e-06,128.0,0.011056464009102068,32,7,3,0.04985980211108296,64,5,2,0.022911968207894005,64,3,2,,,,,128,128,5,0.5090723190511011,12.0,3,Adam,,,,,,,"{""block_0_dropout"": 0.011056464009102068, ""block_0_filters"": 32, ""block_0_kernel"": 7, ""block_1_dropout"": 0.04985980211108296, ""block_1_filters"": 64, ""block_1_kernel"": 5, ""block_1_stride"": 2, ""block_2_dropout"": 0.022911968207894005, ""block_2_filters"": 64, ""block_2_kernel"": 3, ""block_2_stride"": 2, ""first_conv_filters"": 128, ""first_conv_kernel_size"": 5, ""n_blocks"": 3}",PRUNED
36,0.7136017200020375,2026-09-30 14:54:37.568449,2026-09-30 14:56:46.832239,0 days 00:02:09.263790,0.8845829968802508,0.9683606146527349,0.001224195232860411,6.718593840436009e-06,64.0,0.01970413459159987,32,7,3,0.04649055456364847,64,5,2,0.04013660024964293,64,3,2,,,,,512,128,5,0.5688360796412536,13.0,3,Adam,,,,50.0,0.7196969696969697,0.7075064703071051,"{""block_0_dropout"": 0.01970413459159987, ""block_0_filters"": 32, ""block_0_kernel"": 7, ""block_1_dropout"": 0.04649055456364847, ""block_1_filters"": 64, ""block_1_kernel"": 5, ""block_1_stride"": 2, ""block_2_dropout"": 0.04013660024964293, ""block_2_filters"": 64, ""block_2_kernel"": 3, ""block_2_stride"": 2, ""first_conv_filters"": 128, ""first_conv_kernel_size"": 5, ""n_blocks"": 3}",COMPLETE
37,0.382191322672375,2026-09-30 14:56:46.892120,2026-09-30 14:57:04.391086,0 days 00:00:17.498966,0.8840709357172728,0.9648497220475598,0.006088698819867714,7.044284127092595e-06,200.0,0.01540859883329021,32,7,3,0.04907470774297175,64,5,2,0.03396439700199631,64,3,2,,,,,512,128,5,0.5498990924866958,13.0,3,Adam,,,,,,,"{""block_0_dropout"": 0.01540859883329021, ""block_0_filters"": 32, ""block_0_kernel"": 7, ""block_1_dropout"": 0.04907470774297175, ""block_1_filters"": 64, ""block_1_kernel"": 5, ""block_1_stride"": 2, ""block_2_dropout"": 0.03396439700199631, ""block_2_filters"": 64, ""block_2_kernel"": 3, ""block_2_stride"": 2, ""first_conv_filters"": 128, ""first_conv_kernel_size"": 5, ""n_blocks"": 3}",PRUNED
38,0.3101670554372459,2026-09-30 14:57:04.443458,2026-09-30 14:57:29.076318,0 days 00:00:24.632860,,,,,128.0,0.013250654012213068,32,7,3,0.04407870825404645,64,3,2,0.047724715889719146,64,3,2,,,,,512,128,5,0.6160486404386784,15.0,3,SGD,0.08422785120385093,0.7060283744606768,0.006494450243814496,,,,"{""block_0_dropout"": 0.013250654012213068, ""block_0_filters"": 32, ""block_0_kernel"": 7, ""block_1_dropout"": 0.04407870825404645, ""block_1_filters"": 64, ""block_1_kernel"": 3, ""block_1_stride"": 2, ""block_2_dropout"": 0.047724715889719146, ""block_2_filters"": 64, ""block_2_kernel"": 3, ""block_2_stride"": 2, ""first_conv_filters"": 128, ""first_conv_kernel_size"": 5, ""n_blocks"": 3}",PRUNED
39,0.36443382620012343,2026-09-30 14:57:29.129068,2026-09-30 14:57:54.731200,0 days 00:00:25.602132,0.8632904608023593,0.9694038899230932,0.0028495320144415926,2.1722278606004566e-05,64.0,0.019388647158207643,32,7,3,0.042269899540920995,64,5,1,0.04068977895306275,64,3,2,,,,,512,128,5,0.680883112955873,11.0,3,Adam,,,,,,,"{""block_0_dropout"": 0.019388647158207643, ""block_0_filters"": 32, ""block_0_kernel"": 7, ""block_1_dropout"": 0.042269899540920995, ""block_1_filters"": 64, ""block_1_kernel"": 5, ""block_1_stride"": 1, ""block_2_dropout"": 0.04068977895306275, ""block_2_filters"": 64, ""block_2_kernel"": 3, ""block_2_stride"": 2, ""first_conv_filters"": 128, ""first_conv_kernel_size"": 5, ""n_blocks"": 3}",PRUNED
40,0.35894098885779224,2026-09-30 14:57:54.783571,2026-09-30 14:58:21.033228,0 days 00:00:26.249657,,,,,64.0,0.027470054711111472,32,7,3,0.04451031492569357,64,5,1,0.042873914098705855,64,3,2,,,,,128,128,5,0.48819680379752733,13.0,3,SGD,0.007525335146384671,0.8056582025393455,0.00019307310224174785,,,,"{""block_0_dropout"": 0.027470054711111472, ""block_0_filters"": 32, ""block_0_kernel"": 7, ""block_1_dropout"": 0.04451031492569357, ""block_1_filters"": 64, ""block_1_kernel"": 5, ""block_1_stride"": 1, ""block_2_dropout"": 0.042873914098705855, ""block_2_filters"": 64, ""block_2_kernel"": 3, ""block_2_stride"": 2, ""first_conv_filters"": 128, ""first_conv_kernel_size"": 5, ""n_blocks"": 3}",PRUNED
41,0.39910052007760255,2026-09-30 14:58:21.086215,2026-09-30 14:58:51.775586,0 days 00:00:30.689371,0.8827466662823469,0.9774882537107155,0.0012272902132796054,6.898393069227162e-06,64.0,0.019607404108252267,32,7,3,0.04960363425319441,64,5,2,0.023961120955539327,32,3,2,,,,,512,128,5,0.5255527211570613,10.0,3,Adam,,,,,,,"{""block_0_dropout"": 0.019607404108252267, ""block_0_filters"": 32, ""block_0_kernel"": 7, ""block_1_dropout"": 0.04960363425319441, ""block_1_filters"": 64, ""block_1_kernel"": 5, ""block_1_stride"": 2, ""block_2_dropout"": 0.023961120955539327, ""block_2_filters"": 32, ""block_2_kernel"": 3, ""block_2_stride"": 2, ""first_conv_filters"": 128, ""first_conv_kernel_size"": 5, ""n_blocks"": 3}",PRUNED
42,0.7273901820757269,2026-09-30 14:58:51.847473,2026-09-30 15:00:27.432508,0 days 00:01:35.585035,0.9080275775517825,0.9781452105611939,0.0006212192492490572,2.1830275092359184e-06,64.0,0.010256499013233422,16,7,3,0.028482076118183042,64,5,2,0.037561383510171686,64,3,2,,,,,512,128,5,0.47535233513525194,10.0,3,Adam,,,,50.0,0.7411616161616161,0.7136187479898377,"{""block_0_dropout"": 0.010256499013233422, ""block_0_filters"": 16, ""block_0_kernel"": 7, ""block_1_dropout"": 0.028482076118183042, ""block_1_filters"": 64, ""block_1_kernel"": 5, ""block_1_stride"": 2, ""block_2_dropout"": 0.037561383510171686, ""block_2_filters"": 64, ""block_2_kernel"": 3, ""block_2_stride"": 2, ""first_conv_filters"": 128, ""first_conv_kernel_size"": 5, ""n_blocks"": 3}",COMPLETE
43,0.7323351419310348,2026-09-30 15:00:27.489422,2026-09-30 15:02:34.672566,0 days 00:02:07.183144,0.90960975813664,0.9900091283037641,0.0006062034253940233,1.5168118706405241e-05,64.0,0.010735551258306527,32,7,3,0.03631266395735098,64,5,2,0.044073874850867764,64,3,2,,,,,512,128,5,0.47524743540892805,13.0,3,Adam,,,,50.0,0.7487373737373737,0.7159329101246958,"{""block_0_dropout"": 0.010735551258306527, ""block_0_filters"": 32, ""block_0_kernel"": 7, ""block_1_dropout"": 0.03631266395735098, ""block_1_filters"": 64, ""block_1_kernel"": 5, ""block_1_stride"": 2, ""block_2_dropout"": 0.044073874850867764, ""block_2_filters"": 64, ""block_2_kernel"": 3, ""block_2_stride"": 2, ""first_conv_filters"": 128, ""first_conv_kernel_size"": 5, ""n_blocks"": 3}",COMPLETE
44,0.36311354554622377,2026-09-30 15:02:34.727366,2026-09-30 15:02:55.525988,0 days 00:00:20.798622,0.8949842776091319,0.9897047440289124,0.0006001589354028636,1.3443543926022627e-05,64.0,0.02212200671528731,16,7,3,0.011623479110020502,64,5,2,0.03858064831141521,64,3,2,,,,,512,128,5,0.631007385126452,13.0,3,Adam,,,,,,,"{""block_0_dropout"": 0.02212200671528731, ""block_0_filters"": 16, ""block_0_kernel"": 7, ""block_1_dropout"": 0.011623479110020502, ""block_1_filters"": 64, ""block_1_kernel"": 5, ""block_1_stride"": 2, ""block_2_dropout"": 0.03858064831141521, ""block_2_filters"": 64, ""block_2_kernel"": 3, ""block_2_stride"": 2, ""first_conv_filters"": 128, ""first_conv_kernel_size"": 5, ""n_blocks"": 3}",PRUNED
45,0.45841348293426265,2026-09-30 15:02:55.583743,2026-09-30 15:03:21.912758,0 days 00:00:26.329015,,,,,200.0,0.011354075486494144,32,7,3,0.04707967068397244,64,5,2,0.014095714602439982,32,3,2,,,,,512,128,5,0.48519654547118996,15.0,3,SGD,0.01254027193183149,0.7985910780465585,0.0002740263958471168,,,,"{""block_0_dropout"": 0.011354075486494144, ""block_0_filters"": 32, ""block_0_kernel"": 7, ""block_1_dropout"": 0.04707967068397244, ""block_1_filters"": 64, ""block_1_kernel"": 5, ""block_1_stride"": 2, ""block_2_dropout"": 0.014095714602439982, ""block_2_filters"": 32, ""block_2_kernel"": 3, ""block_2_stride"": 2, ""first_conv_filters"": 128, ""first_conv_kernel_size"": 5, ""n_blocks"": 3}",PRUNED
46,0.7337462018062513,2026-09-30 15:03:22.053975,2026-09-30 15:05:30.127600,0 days 00:02:08.073625,0.8876244210477453,0.9925905757525787,0.0002990818637791115,4.896328171589265e-05,64.0,0.014724612954626655,32,7,3,0.025575881594291423,64,5,2,0.045747263680837515,64,3,2,,,,,512,128,5,0.5682972462055199,14.0,3,Adam,,,,50.0,0.7487373737373737,0.7187550298751288,"{""block_0_dropout"": 0.014724612954626655, ""block_0_filters"": 32, ""block_0_kernel"": 7, ""block_1_dropout"": 0.025575881594291423, ""block_1_filters"": 64, ""block_1_kernel"": 5, ""block_1_stride"": 2, ""block_2_dropout"": 0.045747263680837515, ""block_2_filters"": 64, ""block_2_kernel"": 3, ""block_2_stride"": 2, ""first_conv_filters"": 128, ""first_conv_kernel_size"": 5, ""n_blocks"": 3}",COMPLETE
47,0.7402377580402826,2026-09-30 15:05:30.180193,2026-09-30 15:07:37.893449,0 days 00:02:07.713256,0.9026890373712939,0.9922829419762564,0.00029956120824330395,4.88411835233574e-05,64.0,0.018524274899008666,32,7,3,0.035117596372175805,64,5,2,0.03339650778474943,64,3,2,,,,,512,128,5,0.4626011614651677,14.0,3,Adam,,,,45.0,0.7449494949494949,0.7355260211310704,"{""block_0_dropout"": 0.018524274899008666, ""block_0_filters"": 32, ""block_0_kernel"": 7, ""block_1_dropout"": 0.035117596372175805, ""block_1_filters"": 64, ""block_1_kernel"": 5, ""block_1_stride"": 2, ""block_2_dropout"": 0.03339650778474943, ""block_2_filters"": 64, ""block_2_kernel"": 3, ""block_2_stride"": 2, ""first_conv_filters"": 128, ""first_conv_kernel_size"": 5, ""n_blocks"": 3}",COMPLETE
48,0.2532416948657377,2026-09-30 15:07:37.945367,2026-09-30 15:08:03.635300,0 days 00:00:25.689933,,,,,128.0,0.013178848835471919,32,7,3,0.029583382416310564,64,5,2,0.03752857412612399,64,3,2,,,,,512,128,5,0.523028136294512,16.0,3,SGD,0.0006408004693702656,0.8056838147300915,2.3190527801212e-05,,,,"{""block_0_dropout"": 0.013178848835471919, ""block_0_filters"": 32, ""block_0_kernel"": 7, ""block_1_dropout"": 0.029583382416310564, ""block_1_filters"": 64, ""block_1_kernel"": 5, ""block_1_stride"": 2, ""block_2_dropout"": 0.03752857412612399, ""block_2_filters"": 64, ""block_2_kernel"": 3, ""block_2_stride"": 2, ""first_conv_filters"": 128, ""first_conv_kernel_size"": 5, ""n_blocks"": 3}",PRUNED
49,0.7350958200471425,2026-09-30 15:08:03.686812,2026-09-30 15:10:12.052230,0 days 00:02:08.365418,0.9005098863415623,0.9939144450844617,0.0002778967553739864,4.979235352069449e-05,64.0,0.021531479734411083,32,7,3,0.03214290929319909,64,5,2,0.020441906699614175,64,3,2,,,,,512,128,5,0.6045331271503378,14.0,3,Adam,,,,49.0,0.7436868686868687,0.7265047714074162,"{""block_0_dropout"": 0.021531479734411083, ""block_0_filters"": 32, ""block_0_kernel"": 7, ""block_1_dropout"": 0.03214290929319909, ""block_1_filters"": 64, ""block_1_kernel"": 5, ""block_1_stride"": 2, ""block_2_dropout"": 0.020441906699614175, ""block_2_filters"": 64, ""block_2_kernel"": 3, ""block_2_stride"": 2, ""first_conv_filters"": 128, ""first_conv_kernel_size"": 5, ""n_blocks"": 3}",COMPLETE
50,,2026-09-30 15:10:12.104938,2026-09-30 15:10:12.118504,0 days 00:00:00.013566,,,,,,0.010976013425947081,32,7,3,0.038020335381850685,64,5,2,0.03776187481552515,64,5,2,,,,,,128,5,,,3,,,,,,,,"{""block_0_dropout"": 0.010976013425947081, ""block_0_filters"": 32, ""block_0_kernel"": 7, ""block_1_dropout"": 0.038020335381850685, ""block_1_filters"": 64, ""block_1_kernel"": 5, ""block_1_stride"": 2, ""block_2_dropout"": 0.03776187481552515, ""block_2_filters"": 64, ""block_2_kernel"": 5, ""block_2_stride"": 2, ""first_conv_filters"": 128, ""first_conv_kernel_size"": 5, ""n_blocks"": 3}",PRUNED
51,0.7648107666133859,2026-09-30 15:10:12.168711,2026-09-30 15:12:19.920084,0 days 00:02:07.751373,0.8987839520200502,0.9926598075143486,0.0003000397102206347,4.042548224195875e-05,64.0,0.018016696154512315,32,7,3,0.027855419286319842,64,5,2,0.018451760714853688,64,3,2,,,,,512,128,5,0.6450244247346179,14.0,3,Adam,,,,46.0,0.7777777777777778,0.7518437554489941,"{""block_0_dropout"": 0.018016696154512315, ""block_0_filters"": 32, ""block_0_kernel"": 7, ""block_1_dropout"": 0.027855419286319842, ""block_1_filters"": 64, ""block_1_kernel"": 5, ""block_1_stride"": 2, ""block_2_dropout"": 0.018451760714853688, ""block_2_filters"": 64, ""block_2_kernel"": 3, ""block_2_stride"": 2, ""first_conv_filters"": 128, ""first_conv_kernel_size"": 5, ""n_blocks"": 3}",COMPLETE
52,0.7182474367667662,2026-09-30 15:12:19.972374,2026-09-30 15:14:28.033525,0 days 00:02:08.061151,0.902691691185936,0.9945698719186615,0.0002940496807140373,4.747936775574184e-05,64.0,0.021421755782413673,32,7,3,0.038261051065955044,64,5,2,0.03307894827237874,64,3,2,,,,,512,128,5,0.6607207191385848,14.0,3,Adam,,,,50.0,0.7335858585858586,0.7029090149476737,"{""block_0_dropout"": 0.021421755782413673, ""block_0_filters"": 32, ""block_0_kernel"": 7, ""block_1_dropout"": 0.038261051065955044, ""block_1_filters"": 64, ""block_1_kernel"": 5, ""block_1_stride"": 2, ""block_2_dropout"": 0.03307894827237874, ""block_2_filters"": 64, ""block_2_kernel"": 3, ""block_2_stride"": 2, ""first_conv_filters"": 128, ""first_conv_kernel_size"": 5, ""n_blocks"": 3}",COMPLETE
53,0.728644313638046,2026-09-30 15:14:28.085936,2026-09-30 15:16:36.787948,0 days 00:02:08.702012,0.9165576239473749,0.9932582409596509,0.0002897908939322998,4.400031643489093e-05,64.0,0.01382529431274355,32,7,3,0.02899971370720024,64,5,2,0.049249994414601934,64,3,2,,,,,512,128,5,0.6976735789095263,16.0,3,Adam,,,,47.0,0.7424242424242424,0.7148643848518497,"{""block_0_dropout"": 0.01382529431274355, ""block_0_filters"": 32, ""block_0_kernel"": 7, ""block_1_dropout"": 0.02899971370720024, ""block_1_filters"": 64, ""block_1_kernel"": 5, ""block_1_stride"": 2, ""block_2_dropout"": 0.049249994414601934, ""block_2_filters"": 64, ""block_2_kernel"": 3, ""block_2_stride"": 2, ""first_conv_filters"": 128, ""first_conv_kernel_size"": 5, ""n_blocks"": 3}",COMPLETE
54,0.6665546222930385,2026-09-30 15:16:36.840056,2026-09-30 15:18:34.979167,0 days 00:01:58.139111,0.9160101475019391,0.9935599308015083,0.0001065372013920868,4.637430887374746e-05,64.0,0.017141207783924004,32,7,3,0.03506382504426976,64,5,2,0.04523568751725344,64,3,2,,,,,512,128,5,0.6981379825529589,18.0,3,Adam,,,,,,,"{""block_0_dropout"": 0.017141207783924004, ""block_0_filters"": 32, ""block_0_kernel"": 7, ""block_1_dropout"": 0.03506382504426976, ""block_1_filters"": 64, ""block_1_kernel"": 5, ""block_1_stride"": 2, ""block_2_dropout"": 0.04523568751725344, ""block_2_filters"": 64, ""block_2_kernel"": 3, ""block_2_stride"": 2, ""first_conv_filters"": 128, ""first_conv_kernel_size"": 5, ""n_blocks"": 3}",PRUNED
55,0.4053018091475555,2026-09-30 15:18:35.031657,2026-09-30 15:19:00.466489,0 days 00:00:25.434832,0.9006960930636048,0.999357402795198,0.00028032699357352197,7.946114430883913e-05,64.0,0.011435059437333646,32,7,3,0.026728523051477725,64,5,2,0.04419436335061963,64,3,2,,,,,128,128,5,0.6101648481039155,16.0,3,Adam,,,,,,,"{""block_0_dropout"": 0.011435059437333646, ""block_0_filters"": 32, ""block_0_kernel"": 7, ""block_1_dropout"": 0.026728523051477725, ""block_1_filters"": 64, ""block_1_kernel"": 5, ""block_1_stride"": 2, ""block_2_dropout"": 0.04419436335061963, ""block_2_filters"": 64, ""block_2_kernel"": 3, ""block_2_stride"": 2, ""first_conv_filters"": 128, ""first_conv_kernel_size"": 5, ""n_blocks"": 3}",PRUNED
56,0.40583188292648775,2026-09-30 15:19:00.518677,2026-09-30 15:19:18.532269,0 days 00:00:18.013592,0.9316841132528757,0.9938652514660282,0.00031030477382848015,4.236031573063059e-05,200.0,0.020113693056156207,32,7,3,0.02888156068746305,64,5,2,0.04988211576657011,64,3,2,,,,,512,128,5,0.6653974180832344,14.0,3,Adam,,,,,,,"{""block_0_dropout"": 0.020113693056156207, ""block_0_filters"": 32, ""block_0_kernel"": 7, ""block_1_dropout"": 0.02888156068746305, ""block_1_filters"": 64, ""block_1_kernel"": 5, ""block_1_stride"": 2, ""block_2_dropout"": 0.04988211576657011, ""block_2_filters"": 64, ""block_2_kernel"": 3, ""block_2_stride"": 2, ""first_conv_filters"": 128, ""first_conv_kernel_size"": 5, ""n_blocks"": 3}",PRUNED
57,0.7174940860551737,2026-09-30 15:19:18.586213,2026-09-30 15:21:27.295454,0 days 00:02:08.709241,0.8939486832524037,0.9852021848756306,0.00020331226636836414,0.00011094013657593482,64.0,0.016693279929830936,32,7,3,0.030990875378818988,64,5,2,0.024853494591898735,64,3,2,,,,,512,128,5,0.6384060422474265,16.0,3,Adam,,,,45.0,0.7272727272727273,0.7077154448376203,"{""block_0_dropout"": 0.016693279929830936, ""block_0_filters"": 32, ""block_0_kernel"": 7, ""block_1_dropout"": 0.030990875378818988, ""block_1_filters"": 64, ""block_1_kernel"": 5, ""block_1_stride"": 2, ""block_2_dropout"": 0.024853494591898735, ""block_2_filters"": 64, ""block_2_kernel"": 3, ""block_2_stride"": 2, ""first_conv_filters"": 128, ""first_conv_kernel_size"": 5, ""n_blocks"": 3}",COMPLETE
58,0.7260234137835669,2026-09-30 15:21:27.347864,2026-09-30 15:23:36.113844,0 days 00:02:08.765980,0.9112320572159788,0.9982903447125405,0.0003615192794808041,3.3067709152465436e-05,64.0,0.014117908741799554,32,7,3,0.021390715861302874,64,5,2,0.04657772192073403,64,3,2,,,,,512,128,5,0.6478001813585942,19.0,3,Adam,,,,48.0,0.7373737373737373,0.7146730901933965,"{""block_0_dropout"": 0.014117908741799554, ""block_0_filters"": 32, ""block_0_kernel"": 7, ""block_1_dropout"": 0.021390715861302874, ""block_1_filters"": 64, ""block_1_kernel"": 5, ""block_1_stride"": 2, ""block_2_dropout"": 0.04657772192073403, ""block_2_filters"": 64, ""block_2_kernel"": 3, ""block_2_stride"": 2, ""first_conv_filters"": 128, ""first_conv_kernel_size"": 5, ""n_blocks"": 3}",COMPLETE
59,0.44122826528997383,2026-09-30 15:23:36.168596,2026-09-30 15:24:07.071926,0 days 00:00:30.903330,0.9285131722383065,0.9938231542123324,0.00022472656257605184,1.4032453726312305e-05,64.0,0.011559428134904416,32,7,3,0.04274099090361477,64,5,2,0.03339992160725129,64,3,2,,,,,512,128,5,0.5962629665731681,15.0,3,Adam,,,,,,,"{""block_0_dropout"": 0.011559428134904416, ""block_0_filters"": 32, ""block_0_kernel"": 7, ""block_1_dropout"": 0.04274099090361477, ""block_1_filters"": 64, ""block_1_kernel"": 5, ""block_1_stride"": 2, ""block_2_dropout"": 0.03339992160725129, ""block_2_filters"": 64, ""block_2_kernel"": 3, ""block_2_stride"": 2, ""first_conv_filters"": 128, ""first_conv_kernel_size"": 5, ""n_blocks"": 3}",PRUNED
60,0.35153148471348017,2026-09-30 15:24:07.127287,2026-09-30 15:24:32.330284,0 days 00:00:25.202997,,,,,64.0,0.02284260711232377,32,7,3,0.03374566047284159,64,5,2,0.01469406355842973,64,3,2,,,,,256,128,5,0.6805752940845546,14.0,3,SGD,0.019827191127624922,0.872115923369363,0.001199807751942189,,,,"{""block_0_dropout"": 0.02284260711232377, ""block_0_filters"": 32, ""block_0_kernel"": 7, ""block_1_dropout"": 0.03374566047284159, ""block_1_filters"": 64, ""block_1_kernel"": 5, ""block_1_stride"": 2, ""block_2_dropout"": 0.01469406355842973, ""block_2_filters"": 64, ""block_2_kernel"": 3, ""block_2_stride"": 2, ""first_conv_filters"": 128, ""first_conv_kernel_size"": 5, ""n_blocks"": 3}",PRUNED
