number,value,datetime_start,datetime_complete,duration,params_adam_beta1,params_adam_beta2,params_adam_lr,params_adam_wd,params_batch_size,params_block_0_dropout,params_block_0_filters,params_block_0_kernel,params_block_0_stride,params_block_1_dropout,params_block_1_filters,params_block_1_kernel,params_block_1_stride,params_block_2_dropout,params_block_2_filters,params_block_2_kernel,params_block_2_stride,params_block_3_dropout,params_block_3_filters,params_block_3_kernel,params_block_3_stride,params_fc_hidden,params_first_conv_filters,params_first_conv_kernel_size,params_lr_factor,params_lr_patience,params_n_blocks,params_optimizer,params_sgd_lr,params_sgd_momentum,params_sgd_wd,user_attrs_best_epoch,user_attrs_validation_accuracy,user_attrs_validation_macro_f1,system_attrs_tpe:relative_params:0,state
89,0.5041403472775576,2026-09-30 16:04:24.694625,2026-09-30 16:04:52.698216,0 days 00:00:28.003591,0.9118344555149296,0.9565927798719811,0.0003298939569541617,6.574210145046486e-05,200.0,0.018450021416325547,32,7,3,0.03824984701704048,64,5,2,0.026035257568086275,64,3,2,,,,,512,128,5,0.408635958502283,16.0,3,Adam,,,,,,,"{""block_0_dropout"": 0.018450021416325547, ""block_0_filters"": 32, ""block_0_kernel"": 7, ""block_1_dropout"": 0.03824984701704048, ""block_1_filters"": 64, ""block_1_kernel"": 5, ""block_1_stride"": 2, ""block_2_dropout"": 0.026035257568086275, ""block_2_filters"": 64, ""block_2_kernel"": 3, ""block_2_stride"": 2, ""first_conv_filters"": 128, ""first_conv_kernel_size"": 5, ""n_blocks"": 3}",PRUNED
90,0.3906751498913109,2026-09-30 16:04:52.752664,2026-09-30 16:05:18.154722,0 days 00:00:25.402058,0.8684396427243319,0.9670068915153116,0.0010094234065851548,1.0885574545549291e-05,64.0,0.03436524328770615,32,7,3,0.02697405792867029,64,5,2,0.019047470146873975,64,3,2,,,,,512,128,5,0.4160133874724219,18.0,3,Adam,,,,,,,"{""block_0_dropout"": 0.03436524328770615, ""block_0_filters"": 32, ""block_0_kernel"": 7, ""block_1_dropout"": 0.02697405792867029, ""block_1_filters"": 64, ""block_1_kernel"": 5, ""block_1_stride"": 2, ""block_2_dropout"": 0.019047470146873975, ""block_2_filters"": 64, ""block_2_kernel"": 3, ""block_2_stride"": 2, ""first_conv_filters"": 128, ""first_conv_kernel_size"": 5, ""n_blocks"": 3}",PRUNED
91,0.7638319852770683,2026-09-30 16:05:18.207838,2026-09-30 16:07:25.751444,0 days 00:02:07.543606,0.8944830540832122,0.9776786319368304,0.0004038609535503474,0.00024156420073127266,64.0,0.032422253521038134,32,7,3,0.02964882026146216,64,5,2,0.020606649636583062,64,3,2,,,,,512,128,5,0.45409597669009616,15.0,3,Adam,,,,45.0,0.773989898989899,0.7536740715642375,"{""block_0_dropout"": 0.032422253521038134, ""block_0_filters"": 32, ""block_0_kernel"": 7, ""block_1_dropout"": 0.02964882026146216, ""block_1_filters"": 64, ""block_1_kernel"": 5, ""block_1_stride"": 2, ""block_2_dropout"": 0.020606649636583062, ""block_2_filters"": 64, ""block_2_kernel"": 3, ""block_2_stride"": 2, ""first_conv_filters"": 128, ""first_conv_kernel_size"": 5, ""n_blocks"": 3}",COMPLETE
92,0.7432951934063277,2026-09-30 16:07:25.804437,2026-09-30 16:09:33.631601,0 days 00:02:07.827164,0.9068778130118664,0.9767897212192993,0.0003958587488679376,0.00022134645715650694,64.0,0.03023259309142287,32,7,3,0.03165484208430615,64,5,2,0.018690373436753716,64,3,2,,,,,512,128,5,0.11169232760818887,15.0,3,Adam,,,,48.0,0.7626262626262627,0.7239641241863927,"{""block_0_dropout"": 0.03023259309142287, ""block_0_filters"": 32, ""block_0_kernel"": 7, ""block_1_dropout"": 0.03165484208430615, ""block_1_filters"": 64, ""block_1_kernel"": 5, ""block_1_stride"": 2, ""block_2_dropout"": 0.018690373436753716, ""block_2_filters"": 64, ""block_2_kernel"": 3, ""block_2_stride"": 2, ""first_conv_filters"": 128, ""first_conv_kernel_size"": 5, ""n_blocks"": 3}",COMPLETE
93,0.453071155704396,2026-09-30 16:09:33.685340,2026-09-30 16:10:04.272122,0 days 00:00:30.586782,0.907680106348268,0.9769353517227429,0.00042680818309732743,0.00028936365192845474,64.0,0.03373743389081418,32,7,3,0.029780621140450138,64,5,2,0.02241782860330438,64,3,2,,,,,512,128,5,0.12831479448184663,15.0,3,Adam,,,,,,,"{""block_0_dropout"": 0.03373743389081418, ""block_0_filters"": 32, ""block_0_kernel"": 7, ""block_1_dropout"": 0.029780621140450138, ""block_1_filters"": 64, ""block_1_kernel"": 5, ""block_1_stride"": 2, ""block_2_dropout"": 0.02241782860330438, ""block_2_filters"": 64, ""block_2_kernel"": 3, ""block_2_stride"": 2, ""first_conv_filters"": 128, ""first_conv_kernel_size"": 5, ""n_blocks"": 3}",PRUNED
94,0.4356543760197215,2026-09-30 16:10:04.331256,2026-09-30 16:10:30.026787,0 days 00:00:25.695531,0.8917926437511271,0.9739592196412508,0.0005869507762573667,0.0006799949918750732,64.0,0.015579766025187312,32,7,3,0.02383312819824117,64,5,2,0.018012717971260642,64,3,2,,,,,512,128,5,0.31174068756805035,15.0,3,Adam,,,,,,,"{""block_0_dropout"": 0.015579766025187312, ""block_0_filters"": 32, ""block_0_kernel"": 7, ""block_1_dropout"": 0.02383312819824117, ""block_1_filters"": 64, ""block_1_kernel"": 5, ""block_1_stride"": 2, ""block_2_dropout"": 0.018012717971260642, ""block_2_filters"": 64, ""block_2_kernel"": 3, ""block_2_stride"": 2, ""first_conv_filters"": 128, ""first_conv_kernel_size"": 5, ""n_blocks"": 3}",PRUNED
95,0.4697836994028402,2026-09-30 16:10:30.080268,2026-09-30 16:11:06.550821,0 days 00:00:36.470553,0.9215402375436996,0.9789698184258565,0.0007219762999822526,0.0002839535481710845,64.0,0.030870710914527186,32,7,3,0.03415880437427468,64,5,2,0.016610848053664785,64,3,2,,,,,512,128,5,0.25607954126139665,16.0,3,Adam,,,,,,,"{""block_0_dropout"": 0.030870710914527186, ""block_0_filters"": 32, ""block_0_kernel"": 7, ""block_1_dropout"": 0.03415880437427468, ""block_1_filters"": 64, ""block_1_kernel"": 5, ""block_1_stride"": 2, ""block_2_dropout"": 0.016610848053664785, ""block_2_filters"": 64, ""block_2_kernel"": 3, ""block_2_stride"": 2, ""first_conv_filters"": 128, ""first_conv_kernel_size"": 5, ""n_blocks"": 3}",PRUNED
96,0.7152583678581521,2026-09-30 16:11:06.603960,2026-09-30 16:13:14.494966,0 days 00:02:07.891006,0.9032208724793961,0.9656251705617089,0.00041657334467884303,0.0004052027649898175,64.0,0.02311275387738998,32,7,3,0.0344830048193196,64,5,2,0.030219224879642816,64,3,2,,,,,512,128,5,0.17440141468459552,16.0,3,Adam,,,,42.0,0.7247474747474747,0.7057692609688295,"{""block_0_dropout"": 0.02311275387738998, ""block_0_filters"": 32, ""block_0_kernel"": 7, ""block_1_dropout"": 0.0344830048193196, ""block_1_filters"": 64, ""block_1_kernel"": 5, ""block_1_stride"": 2, ""block_2_dropout"": 0.030219224879642816, ""block_2_filters"": 64, ""block_2_kernel"": 3, ""block_2_stride"": 2, ""first_conv_filters"": 128, ""first_conv_kernel_size"": 5, ""n_blocks"": 3}",COMPLETE
97,0.360005495071826,2026-09-30 16:13:14.555031,2026-09-30 16:13:39.857834,0 days 00:00:25.302803,,,,,64.0,0.02031972782601713,32,7,3,0.0345351160614656,64,5,2,0.029555225764515358,64,3,2,,,,,512,128,5,0.45302205607212476,15.0,3,SGD,0.0003521612215677434,0.9319681223888675,1.4026775170792524e-06,,,,"{""block_0_dropout"": 0.02031972782601713, ""block_0_filters"": 32, ""block_0_kernel"": 7, ""block_1_dropout"": 0.0345351160614656, ""block_1_filters"": 64, ""block_1_kernel"": 5, ""block_1_stride"": 2, ""block_2_dropout"": 0.029555225764515358, ""block_2_filters"": 64, ""block_2_kernel"": 3, ""block_2_stride"": 2, ""first_conv_filters"": 128, ""first_conv_kernel_size"": 5, ""n_blocks"": 3}",PRUNED
98,0.7199207603416169,2026-09-30 16:13:39.911730,2026-09-30 16:15:48.230606,0 days 00:02:08.318876,0.9123148613966329,0.9699076909361712,0.00024402659379331633,0.0007616902819118914,64.0,0.02586753856589414,32,7,3,0.0237803962683514,64,5,2,0.018402261574975622,64,3,2,,,,,512,128,5,0.19634360914225013,13.0,3,Adam,,,,46.0,0.7373737373737373,0.7024677833094966,"{""block_0_dropout"": 0.02586753856589414, ""block_0_filters"": 32, ""block_0_kernel"": 7, ""block_1_dropout"": 0.0237803962683514, ""block_1_filters"": 64, ""block_1_kernel"": 5, ""block_1_stride"": 2, ""block_2_dropout"": 0.018402261574975622, ""block_2_filters"": 64, ""block_2_kernel"": 3, ""block_2_stride"": 2, ""first_conv_filters"": 128, ""first_conv_kernel_size"": 5, ""n_blocks"": 3}",COMPLETE
99,0.4437795273649531,2026-09-30 16:15:48.283934,2026-09-30 16:16:16.524201,0 days 00:00:28.240267,0.8869840981707237,0.9613530179680292,0.0008307999631105335,0.0002112516123569164,64.0,0.01598259776563165,32,7,3,0.03953816747682606,64,5,2,0.04136784237267695,64,3,2,,,,,512,128,5,0.39179185355247614,16.0,3,Adam,,,,,,,"{""block_0_dropout"": 0.01598259776563165, ""block_0_filters"": 32, ""block_0_kernel"": 7, ""block_1_dropout"": 0.03953816747682606, ""block_1_filters"": 64, ""block_1_kernel"": 5, ""block_1_stride"": 2, ""block_2_dropout"": 0.04136784237267695, ""block_2_filters"": 64, ""block_2_kernel"": 3, ""block_2_stride"": 2, ""first_conv_filters"": 128, ""first_conv_kernel_size"": 5, ""n_blocks"": 3}",PRUNED
