number,value,datetime_start,datetime_complete,duration,params_adam_beta1,params_adam_beta2,params_adam_lr,params_adam_wd,params_batch_size,params_block_0_dropout,params_block_0_filters,params_block_0_kernel,params_block_0_stride,params_block_1_dropout,params_block_1_filters,params_block_1_kernel,params_block_1_stride,params_block_2_dropout,params_block_2_filters,params_block_2_kernel,params_block_2_stride,params_block_3_dropout,params_block_3_filters,params_block_3_kernel,params_block_3_stride,params_fc_hidden,params_first_conv_filters,params_first_conv_kernel_size,params_lr_factor,params_lr_patience,params_n_blocks,params_optimizer,params_sgd_lr,params_sgd_momentum,params_sgd_wd,user_attrs_best_epoch,user_attrs_validation_accuracy,user_attrs_validation_macro_f1,system_attrs_tpe:relative_params:0,state
0,0.2124804000338122,2026-09-30 14:06:08.941222,2026-09-30 14:08:53.042833,0 days 00:02:44.101611,0.8926459276842719,0.9097574441892378,0.00853618986286683,0.0017123375973163992,128.0,0.043297705632016875,8,5,3,0.03447411578889518,16,3,2,0.0336965827544817,128,3,1,,,,,256,256,7,0.5105398159072941,12.0,3,Adam,,,,19.0,0.27146464646464646,0.15349615360297791,,COMPLETE
1,0.4394150894643479,2026-09-30 14:08:53.170068,2026-09-30 14:10:13.232662,0 days 00:01:20.062594,0.8662216683335181,0.9862240322449718,0.00014063366777718192,2.7155819552829413e-05,200.0,0.04687496940092468,8,7,3,0.024270133067743574,32,3,1,0.017948627261366895,64,5,2,,,,,256,128,3,0.4739788760965348,10.0,3,Adam,,,,47.0,0.45454545454545453,0.4242847243832412,,COMPLETE
2,,2026-09-30 14:10:13.285400,2026-09-30 14:10:13.301961,0 days 00:00:00.016561,,,,,,0.011016765069763807,16,7,3,0.026415316921425187,64,3,2,0.03533615026041694,32,5,2,0.04570235993959911,64.0,3.0,1.0,,512,3,,,4,,,,,,,,,PRUNED
3,0.5648247273620166,2026-09-30 14:10:13.360136,2026-09-30 14:15:59.601365,0 days 00:05:46.241229,,,,,128.0,0.01888431241882921,16,7,3,0.04887128330883843,64,3,2,0.030107160929154463,32,5,1,,,,,512,512,7,0.5032813284435271,17.0,3,SGD,0.002940074130903307,0.9858386316920742,9.294394155644998e-06,47.0,0.5618686868686869,0.5677807678553463,,COMPLETE
4,0.48685029905655297,2026-09-30 14:15:59.652823,2026-09-30 14:19:06.015143,0 days 00:03:06.362320,,,,,64.0,0.01905983100791752,32,5,3,0.014538940849623563,64,3,1,0.01967409163601807,32,3,2,,,,,512,256,5,0.6322518545590703,17.0,3,SGD,0.0011159088550343414,0.9105271468723695,0.0038765111709116325,50.0,0.48484848484848486,0.488852113264621,,COMPLETE
5,0.3679344584497432,2026-09-30 14:19:06.066469,2026-09-30 14:20:27.742671,0 days 00:01:21.676202,,,,,64.0,0.019489963499872004,16,5,3,0.024708632122377342,32,5,2,0.030105483724207682,128,3,1,,,,,128,128,5,0.6642751506117486,20.0,3,SGD,0.00011828996391101285,0.8871869658130787,5.110256715654393e-06,49.0,0.3851010101010101,0.3507679067984763,,COMPLETE
6,0.09444904313988509,2026-09-30 14:20:27.793861,2026-09-30 14:21:20.604225,0 days 00:00:52.810364,0.897319321959215,0.9375207369687304,0.0039046790191830895,0.0036309591863459105,200.0,0.03784119186699892,8,5,3,0.03963074471016818,64,5,1,0.046529622102258854,64,3,1,,,,,512,512,7,0.1563891639045214,14.0,3,Adam,,,,,,,,PRUNED
7,0.6491004850839419,2026-09-30 14:21:20.656910,2026-09-30 14:24:05.449955,0 days 00:02:44.793045,0.9836811392928472,0.9737159019779072,0.0020911960669713066,1.3174543864342763e-05,64.0,0.01206726884674431,16,7,3,0.04180744779074815,64,3,2,0.026358117776570794,64,3,2,,,,,512,256,5,0.43261243150684037,14.0,3,Adam,,,,50.0,0.6590909090909091,0.6391100610769749,,COMPLETE
8,0.1798131789150792,2026-09-30 14:24:05.501939,2026-09-30 14:24:21.979479,0 days 00:00:16.477540,,,,,200.0,0.02735406596951892,32,7,3,0.044259593647532895,64,3,2,0.03301896711503516,32,5,1,0.031824671572637395,128.0,3.0,1.0,512,128,3,0.15666577645355703,15.0,4,SGD,0.0001614670469622493,0.7292256203994537,1.1827346017839088e-06,,,,,PRUNED
9,,2026-09-30 14:24:22.037579,2026-09-30 14:24:22.049494,0 days 00:00:00.011915,,,,,,0.042273389570690566,16,5,3,0.027159761095000734,16,5,2,0.04582092913984802,64,5,2,0.013651467071445343,256.0,3.0,1.0,,256,5,,,4,,,,,,,,,PRUNED
10,,2026-09-30 14:24:22.200094,2026-09-30 14:24:22.235607,0 days 00:00:00.035513,,,,,,0.044183489324351316,8,7,3,0.040235740261758295,64,3,2,0.026057880854674156,64,3,2,0.013107701648057437,256.0,3.0,1.0,,256,3,,,4,,,,,,,,"{""block_0_dropout"": 0.044183489324351316, ""block_0_filters"": 8, ""block_0_kernel"": 7, ""block_1_dropout"": 0.040235740261758295, ""block_1_filters"": 64, ""block_1_kernel"": 3, ""block_1_stride"": 2, ""block_2_dropout"": 0.026057880854674156, ""block_2_filters"": 64, ""block_2_kernel"": 3, ""block_2_stride"": 2, ""first_conv_filters"": 256, ""first_conv_kernel_size"": 3, ""n_blocks"": 4}",PRUNED
11,0.26027588523106193,2026-09-30 14:24:22.338536,2026-09-30 14:25:44.942464,0 days 00:01:22.603928,,,,,128.0,0.0249291234419154,16,7,3,0.044689760857455484,64,3,2,0.03491156113616455,32,5,1,,,,,512,512,7,0.3812231313327053,6.0,3,SGD,0.04805481567542263,0.9776211723045665,0.00018837804404186193,,,,"{""block_0_dropout"": 0.0249291234419154, ""block_0_filters"": 16, ""block_0_kernel"": 7, ""block_1_dropout"": 0.044689760857455484, ""block_1_filters"": 64, ""block_1_kernel"": 3, ""block_1_stride"": 2, ""block_2_dropout"": 0.03491156113616455, ""block_2_filters"": 32, ""block_2_kernel"": 5, ""block_2_stride"": 1, ""first_conv_filters"": 512, ""first_conv_kernel_size"": 7, ""n_blocks"": 3}",PRUNED
12,0.6724214183568245,2026-09-30 14:25:44.994603,2026-09-30 14:27:19.446259,0 days 00:01:34.451656,0.9781389931626887,0.9977352441512432,0.0006827657674063931,1.1020325755035114e-06,64.0,0.014818367374090799,16,7,3,0.03661754503331296,64,3,2,0.02334199577063257,64,3,2,,,,,512,128,5,0.3302501562203257,17.0,3,Adam,,,,50.0,0.6830808080808081,0.6617620286328408,"{""block_0_dropout"": 0.014818367374090799, ""block_0_filters"": 16, ""block_0_kernel"": 7, ""block_1_dropout"": 0.03661754503331296, ""block_1_filters"": 64, ""block_1_kernel"": 3, ""block_1_stride"": 2, ""block_2_dropout"": 0.02334199577063257, ""block_2_filters"": 64, ""block_2_kernel"": 3, ""block_2_stride"": 2, ""first_conv_filters"": 128, ""first_conv_kernel_size"": 5, ""n_blocks"": 3}",COMPLETE
13,0.5952036058478609,2026-09-30 14:27:19.498083,2026-09-30 14:29:53.806495,0 days 00:02:34.308412,0.9868173051833109,0.9969485387912187,0.0009208436400307075,1.0819881402414234e-06,64.0,0.019376234381767804,16,7,3,0.035662141778677985,64,3,2,0.02228141270425396,64,3,2,,,,,128,256,3,0.3038562213412807,20.0,3,Adam,,,,38.0,0.5984848484848485,0.5919223632108732,"{""block_0_dropout"": 0.019376234381767804, ""block_0_filters"": 16, ""block_0_kernel"": 7, ""block_1_dropout"": 0.035662141778677985, ""block_1_filters"": 64, ""block_1_kernel"": 3, ""block_1_stride"": 2, ""block_2_dropout"": 0.02228141270425396, ""block_2_filters"": 64, ""block_2_kernel"": 3, ""block_2_stride"": 2, ""first_conv_filters"": 256, ""first_conv_kernel_size"": 3, ""n_blocks"": 3}",COMPLETE
14,0.6896522135768587,2026-09-30 14:29:53.858106,2026-09-30 14:31:28.466070,0 days 00:01:34.607964,0.9808658540078671,0.9755278632179368,0.000806241559190014,1.7156386499262848e-06,64.0,0.014486879848419967,16,7,3,0.03317413789000419,64,5,2,0.030394748917894072,64,3,2,,,,,512,128,5,0.3427906866084083,10.0,3,Adam,,,,50.0,0.6906565656565656,0.6886478614971517,"{""block_0_dropout"": 0.014486879848419967, ""block_0_filters"": 16, ""block_0_kernel"": 7, ""block_1_dropout"": 0.03317413789000419, ""block_1_filters"": 64, ""block_1_kernel"": 5, ""block_1_stride"": 2, ""block_2_dropout"": 0.030394748917894072, ""block_2_filters"": 64, ""block_2_kernel"": 3, ""block_2_stride"": 2, ""first_conv_filters"": 128, ""first_conv_kernel_size"": 5, ""n_blocks"": 3}",COMPLETE
15,,2026-09-30 14:31:28.517782,2026-09-30 14:31:28.528526,0 days 00:00:00.010744,,,,,,0.016136463587920608,16,7,3,0.03278041326619901,64,5,2,0.03979351999312278,64,5,1,,,,,,128,5,,,3,,,,,,,,"{""block_0_dropout"": 0.016136463587920608, ""block_0_filters"": 16, ""block_0_kernel"": 7, ""block_1_dropout"": 0.03278041326619901, ""block_1_filters"": 64, ""block_1_kernel"": 5, ""block_1_stride"": 2, ""block_2_dropout"": 0.03979351999312278, ""block_2_filters"": 64, ""block_2_kernel"": 5, ""block_2_stride"": 1, ""first_conv_filters"": 128, ""first_conv_kernel_size"": 5, ""n_blocks"": 3}",PRUNED
16,0.6065311838448473,2026-09-30 14:31:28.578211,2026-09-30 14:33:03.278193,0 days 00:01:34.699982,0.9582539217734976,0.9681364134947078,0.0004815438851626752,1.2849922125186388e-06,64.0,0.019712917181094296,16,7,3,0.0206718704649609,64,3,2,0.014756224904676905,64,3,2,,,,,512,128,5,0.2795530120821651,5.0,3,Adam,,,,45.0,0.6174242424242424,0.5956381252654522,"{""block_0_dropout"": 0.019712917181094296, ""block_0_filters"": 16, ""block_0_kernel"": 7, ""block_1_dropout"": 0.0206718704649609, ""block_1_filters"": 64, ""block_1_kernel"": 3, ""block_1_stride"": 2, ""block_2_dropout"": 0.014756224904676905, ""block_2_filters"": 64, ""block_2_kernel"": 3, ""block_2_stride"": 2, ""first_conv_filters"": 128, ""first_conv_kernel_size"": 5, ""n_blocks"": 3}",COMPLETE
17,0.6210848320225751,2026-09-30 14:33:03.329823,2026-09-30 14:38:05.183733,0 days 00:05:01.853910,0.9475292682110453,0.9579749948137404,0.0004622033892985011,8.73908759225226e-06,64.0,0.02185066155879884,16,7,3,0.03124612962698263,16,5,2,0.026571316064643358,64,3,2,,,,,512,512,5,0.28224416996083657,9.0,3,Adam,,,,43.0,0.6275252525252525,0.6146444115198978,"{""block_0_dropout"": 0.02185066155879884, ""block_0_filters"": 16, ""block_0_kernel"": 7, ""block_1_dropout"": 0.03124612962698263, ""block_1_filters"": 16, ""block_1_kernel"": 5, ""block_1_stride"": 2, ""block_2_dropout"": 0.026571316064643358, ""block_2_filters"": 64, ""block_2_kernel"": 3, ""block_2_stride"": 2, ""first_conv_filters"": 512, ""first_conv_kernel_size"": 5, ""n_blocks"": 3}",COMPLETE
18,0.4067866906791574,2026-09-30 14:38:05.241961,2026-09-30 14:38:30.323535,0 days 00:00:25.081574,0.9514783375785523,0.9984459396148188,0.0009450713451981054,3.3824886361720215e-06,64.0,0.011597587472794029,8,7,3,0.03354622986402247,32,3,2,0.04054877103184696,64,3,2,,,,,128,128,5,0.21603779074585458,8.0,3,Adam,,,,,,,"{""block_0_dropout"": 0.011597587472794029, ""block_0_filters"": 8, ""block_0_kernel"": 7, ""block_1_dropout"": 0.03354622986402247, ""block_1_filters"": 32, ""block_1_kernel"": 3, ""block_1_stride"": 2, ""block_2_dropout"": 0.04054877103184696, ""block_2_filters"": 64, ""block_2_kernel"": 3, ""block_2_stride"": 2, ""first_conv_filters"": 128, ""first_conv_kernel_size"": 5, ""n_blocks"": 3}",PRUNED
19,0.667953328596363,2026-09-30 14:38:30.375767,2026-09-30 14:40:04.853500,0 days 00:01:34.477733,0.9681663706770859,0.953785955211715,0.00021819017696362805,7.053463994876508e-05,64.0,0.018167881310145163,16,7,3,0.04274270999543782,64,5,2,0.033736513798770754,64,3,2,,,,,256,128,5,0.35933721427560716,11.0,3,Adam,,,,50.0,0.6767676767676768,0.6591389804250491,"{""block_0_dropout"": 0.018167881310145163, ""block_0_filters"": 16, ""block_0_kernel"": 7, ""block_1_dropout"": 0.04274270999543782, ""block_1_filters"": 64, ""block_1_kernel"": 5, ""block_1_stride"": 2, ""block_2_dropout"": 0.033736513798770754, ""block_2_filters"": 64, ""block_2_kernel"": 3, ""block_2_stride"": 2, ""first_conv_filters"": 128, ""first_conv_kernel_size"": 5, ""n_blocks"": 3}",COMPLETE
20,,2026-09-30 14:40:04.907626,2026-09-30 14:40:04.924005,0 days 00:00:00.016379,,,,,,0.015110325591682858,16,7,3,0.037180598136759085,64,5,2,0.02578331450574587,32,3,2,0.049532219295975455,128.0,3.0,1.0,,128,7,,,4,,,,,,,,"{""block_0_dropout"": 0.015110325591682858, ""block_0_filters"": 16, ""block_0_kernel"": 7, ""block_1_dropout"": 0.037180598136759085, ""block_1_filters"": 64, ""block_1_kernel"": 5, ""block_1_stride"": 2, ""block_2_dropout"": 0.02578331450574587, ""block_2_filters"": 32, ""block_2_kernel"": 3, ""block_2_stride"": 2, ""first_conv_filters"": 128, ""first_conv_kernel_size"": 7, ""n_blocks"": 4}",PRUNED
21,0.6694117333024205,2026-09-30 14:40:05.094058,2026-09-30 14:41:36.783696,0 days 00:01:31.689638,0.9691953554927398,0.9478451788016468,0.00016359711362141702,0.00013830528196733124,64.0,0.018681619819295545,16,7,3,0.04935856965517312,64,5,2,0.03155699559320488,128,3,2,,,,,256,128,3,0.36098865229340554,11.0,3,Adam,,,,47.0,0.6818181818181818,0.6570052847866593,"{""block_0_dropout"": 0.018681619819295545, ""block_0_filters"": 16, ""block_0_kernel"": 7, ""block_1_dropout"": 0.04935856965517312, ""block_1_filters"": 64, ""block_1_kernel"": 5, ""block_1_stride"": 2, ""block_2_dropout"": 0.03155699559320488, ""block_2_filters"": 128, ""block_2_kernel"": 3, ""block_2_stride"": 2, ""first_conv_filters"": 128, ""first_conv_kernel_size"": 3, ""n_blocks"": 3}",COMPLETE
22,0.66957351039499,2026-09-30 14:41:36.835949,2026-09-30 14:43:11.766964,0 days 00:01:34.931015,0.9325375980065311,0.9313797106070623,0.00038950108982535624,0.00019948481256938736,64.0,0.01250641481094643,16,7,3,0.0280698050146402,64,5,2,0.023091774229577318,64,3,2,,,,,256,128,5,0.3669302528746066,7.0,3,Adam,,,,49.0,0.6679292929292929,0.6712177278606871,"{""block_0_dropout"": 0.01250641481094643, ""block_0_filters"": 16, ""block_0_kernel"": 7, ""block_1_dropout"": 0.0280698050146402, ""block_1_filters"": 64, ""block_1_kernel"": 5, ""block_1_stride"": 2, ""block_2_dropout"": 0.023091774229577318, ""block_2_filters"": 64, ""block_2_kernel"": 3, ""block_2_stride"": 2, ""first_conv_filters"": 128, ""first_conv_kernel_size"": 5, ""n_blocks"": 3}",COMPLETE
23,0.6850246765770583,2026-09-30 14:43:11.819128,2026-09-30 14:44:32.750715,0 days 00:01:20.931587,0.9248694322311591,0.9220003919751796,0.0004707185622663264,0.00019823105178686385,64.0,0.012524271361836687,16,5,3,0.03232418848574864,64,5,2,0.02130388270923351,64,3,2,,,,,256,128,5,0.429775927674277,7.0,3,Adam,,,,44.0,0.6868686868686869,0.6831806662854298,"{""block_0_dropout"": 0.012524271361836687, ""block_0_filters"": 16, ""block_0_kernel"": 5, ""block_1_dropout"": 0.03232418848574864, ""block_1_filters"": 64, ""block_1_kernel"": 5, ""block_1_stride"": 2, ""block_2_dropout"": 0.02130388270923351, ""block_2_filters"": 64, ""block_2_kernel"": 3, ""block_2_stride"": 2, ""first_conv_filters"": 128, ""first_conv_kernel_size"": 5, ""n_blocks"": 3}",COMPLETE
24,0.41304034587522354,2026-09-30 14:44:32.818157,2026-09-30 14:44:52.137875,0 days 00:00:19.319718,0.9229673521528499,0.9075962003042946,0.0008230090979831869,0.0007097484380767867,64.0,0.012194055820862928,16,5,3,0.03311556071644012,64,3,2,0.010920612340408992,64,3,2,,,,,256,128,5,0.5465008713901076,8.0,3,Adam,,,,,,,"{""block_0_dropout"": 0.012194055820862928, ""block_0_filters"": 16, ""block_0_kernel"": 5, ""block_1_dropout"": 0.03311556071644012, ""block_1_filters"": 64, ""block_1_kernel"": 3, ""block_1_stride"": 2, ""block_2_dropout"": 0.010920612340408992, ""block_2_filters"": 64, ""block_2_kernel"": 3, ""block_2_stride"": 2, ""first_conv_filters"": 128, ""first_conv_kernel_size"": 5, ""n_blocks"": 3}",PRUNED
25,0.6875970705783208,2026-09-30 14:44:52.195708,2026-09-30 14:46:12.962949,0 days 00:01:20.767241,0.9197355095050491,0.9814063757131236,0.0015693877337893132,3.484719227013659e-06,64.0,0.016171681016634576,16,5,3,0.04350105394250618,64,5,2,0.025955130456374514,64,3,2,,,,,512,128,5,0.43731521365289827,5.0,3,Adam,,,,48.0,0.7058080808080808,0.6693860603485607,"{""block_0_dropout"": 0.016171681016634576, ""block_0_filters"": 16, ""block_0_kernel"": 5, ""block_1_dropout"": 0.04350105394250618, ""block_1_filters"": 64, ""block_1_kernel"": 5, ""block_1_stride"": 2, ""block_2_dropout"": 0.025955130456374514, ""block_2_filters"": 64, ""block_2_kernel"": 3, ""block_2_stride"": 2, ""first_conv_filters"": 128, ""first_conv_kernel_size"": 5, ""n_blocks"": 3}",COMPLETE
26,0.7002697521958166,2026-09-30 14:46:13.051414,2026-09-30 14:48:21.940966,0 days 00:02:08.889552,0.9116099074852214,0.9793372005112028,0.001984880740179803,5.473746300717671e-06,64.0,0.018681328262069752,32,7,3,0.046008356957925364,64,5,2,0.02033126514979343,64,3,2,,,,,512,128,5,0.43014669069611416,5.0,3,Adam,,,,43.0,0.7083333333333334,0.6922061710582996,"{""block_0_dropout"": 0.018681328262069752, ""block_0_filters"": 32, ""block_0_kernel"": 7, ""block_1_dropout"": 0.046008356957925364, ""block_1_filters"": 64, ""block_1_kernel"": 5, ""block_1_stride"": 2, ""block_2_dropout"": 0.02033126514979343, ""block_2_filters"": 64, ""block_2_kernel"": 3, ""block_2_stride"": 2, ""first_conv_filters"": 128, ""first_conv_kernel_size"": 5, ""n_blocks"": 3}",COMPLETE
27,0.41759322605549803,2026-09-30 14:48:21.992569,2026-09-30 14:48:44.300266,0 days 00:00:22.307697,0.90325937969145,0.9781014013703854,0.0018951640511489466,4.73699944986453e-06,128.0,0.024311320922154836,16,5,3,0.04621517620904878,64,5,2,0.027655223187444667,64,3,2,,,,,512,128,5,0.5748858127276351,5.0,3,Adam,,,,,,,"{""block_0_dropout"": 0.024311320922154836, ""block_0_filters"": 16, ""block_0_kernel"": 5, ""block_1_dropout"": 0.04621517620904878, ""block_1_filters"": 64, ""block_1_kernel"": 5, ""block_1_stride"": 2, ""block_2_dropout"": 0.027655223187444667, ""block_2_filters"": 64, ""block_2_kernel"": 3, ""block_2_stride"": 2, ""first_conv_filters"": 128, ""first_conv_kernel_size"": 5, ""n_blocks"": 3}",PRUNED
28,0.3600718483034995,2026-09-30 14:48:44.351790,2026-09-30 14:49:01.755125,0 days 00:00:17.403335,0.8746835827037912,0.9834311174630589,0.001862505006509983,3.694025143322888e-06,200.0,0.026585454683031383,32,7,3,0.0380442209403546,64,5,2,0.012644209961953524,64,3,1,,,,,512,128,5,0.42994951603496884,5.0,3,Adam,,,,,,,"{""block_0_dropout"": 0.026585454683031383, ""block_0_filters"": 32, ""block_0_kernel"": 7, ""block_1_dropout"": 0.0380442209403546, ""block_1_filters"": 64, ""block_1_kernel"": 5, ""block_1_stride"": 2, ""block_2_dropout"": 0.012644209961953524, ""block_2_filters"": 64, ""block_2_kernel"": 3, ""block_2_stride"": 1, ""first_conv_filters"": 128, ""first_conv_kernel_size"": 5, ""n_blocks"": 3}",PRUNED
29,0.3591895860352318,2026-09-30 14:49:01.807418,2026-09-30 14:49:28.089817,0 days 00:00:26.282399,0.9081468300720721,0.9645154272194714,0.003396287300941312,2.1274022973837042e-05,64.0,0.016941620654962852,32,7,3,0.04234690256636864,64,5,1,0.021716965141652212,64,3,2,,,,,512,128,5,0.22643598463675743,7.0,3,Adam,,,,,,,"{""block_0_dropout"": 0.016941620654962852, ""block_0_filters"": 32, ""block_0_kernel"": 7, ""block_1_dropout"": 0.04234690256636864, ""block_1_filters"": 64, ""block_1_kernel"": 5, ""block_1_stride"": 1, ""block_2_dropout"": 0.021716965141652212, ""block_2_filters"": 64, ""block_2_kernel"": 3, ""block_2_stride"": 2, ""first_conv_filters"": 128, ""first_conv_kernel_size"": 5, ""n_blocks"": 3}",PRUNED
30,0.7169618505314781,2026-09-30 14:49:28.141740,2026-09-30 14:51:04.933006,0 days 00:01:36.791266,0.8500843737682089,0.987668646351202,0.0012881030513557511,2.7486546339643636e-06,64.0,0.012532137237892158,16,7,3,0.01715036475063229,64,5,2,0.03793488205813584,64,3,2,,,,,512,128,5,0.4661299736925773,9.0,3,Adam,,,,50.0,0.7209595959595959,0.7129641051033602,"{""block_0_dropout"": 0.012532137237892158, ""block_0_filters"": 16, ""block_0_kernel"": 7, ""block_1_dropout"": 0.01715036475063229, ""block_1_filters"": 64, ""block_1_kernel"": 5, ""block_1_stride"": 2, ""block_2_dropout"": 0.03793488205813584, ""block_2_filters"": 64, ""block_2_kernel"": 3, ""block_2_stride"": 2, ""first_conv_filters"": 128, ""first_conv_kernel_size"": 5, ""n_blocks"": 3}",COMPLETE
31,0.41052221583654835,2026-09-30 14:51:05.013722,2026-09-30 14:51:28.188308,0 days 00:00:23.174586,0.8544507592946701,0.9851495606159254,0.001312592580444437,3.1459787946652626e-06,64.0,0.014237688727977059,16,7,3,0.0277999303356061,32,5,2,0.033115164848951974,64,3,2,,,,,512,128,5,0.4626411802118246,9.0,3,Adam,,,,,,,"{""block_0_dropout"": 0.014237688727977059, ""block_0_filters"": 16, ""block_0_kernel"": 7, ""block_1_dropout"": 0.0277999303356061, ""block_1_filters"": 32, ""block_1_kernel"": 5, ""block_1_stride"": 2, ""block_2_dropout"": 0.033115164848951974, ""block_2_filters"": 64, ""block_2_kernel"": 3, ""block_2_stride"": 2, ""first_conv_filters"": 128, ""first_conv_kernel_size"": 5, ""n_blocks"": 3}",PRUNED
32,0.36100578359698554,2026-09-30 14:51:28.268599,2026-09-30 14:51:44.755648,0 days 00:00:16.487049,0.8741384397420997,0.9730740818875742,0.0033856872729804205,8.400274025890562e-06,64.0,0.015777947061857395,16,5,3,0.018057649291641848,64,5,2,0.0362745091638803,64,3,2,,,,,512,128,5,0.3917174839078902,6.0,3,Adam,,,,,,,"{""block_0_dropout"": 0.015777947061857395, ""block_0_filters"": 16, ""block_0_kernel"": 5, ""block_1_dropout"": 0.018057649291641848, ""block_1_filters"": 64, ""block_1_kernel"": 5, ""block_1_stride"": 2, ""block_2_dropout"": 0.0362745091638803, ""block_2_filters"": 64, ""block_2_kernel"": 3, ""block_2_stride"": 2, ""first_conv_filters"": 128, ""first_conv_kernel_size"": 5, ""n_blocks"": 3}",PRUNED
