number,value,datetime_start,datetime_complete,duration,params_adam_beta1,params_adam_beta2,params_adam_lr,params_adam_wd,params_batch_size,params_block_0_dropout,params_block_0_filters,params_block_0_kernel,params_block_0_stride,params_block_1_dropout,params_block_1_filters,params_block_1_kernel,params_block_1_stride,params_block_2_dropout,params_block_2_filters,params_block_2_kernel,params_block_2_stride,params_block_3_dropout,params_block_3_filters,params_block_3_kernel,params_block_3_stride,params_fc_hidden,params_first_conv_filters,params_first_conv_kernel_size,params_lr_factor,params_lr_patience,params_n_blocks,params_optimizer,params_sgd_lr,params_sgd_momentum,params_sgd_wd,user_attrs_best_epoch,user_attrs_validation_accuracy,user_attrs_validation_macro_f1,system_attrs_tpe:relative_params:0,state
36,0.5996121012201872,2026-09-16 21:52:52.138327,2026-09-16 21:56:49.356183,0 days 00:03:57.217856,0.9246546163679217,0.9482025433220014,0.00386408283373199,6.575538930011395e-05,128.0,0.24523690883762764,32,5,3,0.10131388629106615,64,5,2,0.3614767950955785,64.0,3.0,2.0,,,,,256,32,3,0.6902193528619557,8.0,3,Adam,,,,40.0,0.603225806451613,0.5959983959887613,"{""block_0_dropout"": 0.24523690883762764, ""block_0_filters"": 32, ""block_0_kernel"": 5, ""block_0_stride"": 3, ""block_1_dropout"": 0.10131388629106615, ""block_1_filters"": 64, ""block_1_kernel"": 5, ""block_1_stride"": 2, ""first_conv_filters"": 32, ""first_conv_kernel_size"": 3, ""n_blocks"": 3}",COMPLETE
37,0.296916721357687,2026-09-16 21:56:49.463341,2026-09-16 21:58:11.125140,0 days 00:01:21.661799,0.918395809465211,0.9406734783796047,0.0055691892691260665,7.1756135388435865e-06,64.0,0.174144275455147,32,5,1,0.1535946472310022,64,5,2,0.30382032760229993,64.0,3.0,2.0,,,,,64,32,3,0.6265059142590201,6.0,3,Adam,,,,,,,"{""block_0_dropout"": 0.174144275455147, ""block_0_filters"": 32, ""block_0_kernel"": 5, ""block_0_stride"": 1, ""block_1_dropout"": 0.1535946472310022, ""block_1_filters"": 64, ""block_1_kernel"": 5, ""block_1_stride"": 2, ""first_conv_filters"": 32, ""first_conv_kernel_size"": 3, ""n_blocks"": 3}",PRUNED
38,0.5239758138547095,2026-09-16 21:58:11.235642,2026-09-16 22:02:42.188435,0 days 00:04:30.952793,0.893414555279475,0.945550843620721,0.004664903043363348,4.963679674024171e-05,32.0,0.332800899622802,32,5,3,0.10287661414301014,64,5,2,0.274092609821219,64.0,3.0,2.0,,,,,128,32,3,0.6979206441560863,10.0,3,Adam,,,,48.0,0.5290322580645161,0.5189193696449027,"{""block_0_dropout"": 0.332800899622802, ""block_0_filters"": 32, ""block_0_kernel"": 5, ""block_0_stride"": 3, ""block_1_dropout"": 0.10287661414301014, ""block_1_filters"": 64, ""block_1_kernel"": 5, ""block_1_stride"": 2, ""first_conv_filters"": 32, ""first_conv_kernel_size"": 3, ""n_blocks"": 3}",COMPLETE
39,0.3473890400290358,2026-09-16 22:02:42.308147,2026-09-16 22:03:29.856700,0 days 00:00:47.548553,0.9356274599996531,0.9760877771469982,0.008786748095443461,2.376147965257036e-06,128.0,0.22198777777742137,32,5,3,0.15466760404048294,64,5,2,0.34538505511455964,64.0,3.0,3.0,,,,,256,32,3,0.568184738098657,7.0,3,Adam,,,,,,,"{""block_0_dropout"": 0.22198777777742137, ""block_0_filters"": 32, ""block_0_kernel"": 5, ""block_0_stride"": 3, ""block_1_dropout"": 0.15466760404048294, ""block_1_filters"": 64, ""block_1_kernel"": 5, ""block_1_stride"": 2, ""first_conv_filters"": 32, ""first_conv_kernel_size"": 3, ""n_blocks"": 3}",PRUNED
40,,2026-09-16 22:03:29.969442,2026-09-16 22:03:30.074926,0 days 00:00:00.105484,,,,,,0.1694570214094215,32,3,3,0.14974385294408415,64,5,2,0.37507731763008845,64.0,3.0,2.0,0.11484659127919433,256.0,3.0,1.0,,32,3,,,4,,,,,,,,"{""block_0_dropout"": 0.1694570214094215, ""block_0_filters"": 32, ""block_0_kernel"": 3, ""block_0_stride"": 3, ""block_1_dropout"": 0.14974385294408415, ""block_1_filters"": 64, ""block_1_kernel"": 5, ""block_1_stride"": 2, ""first_conv_filters"": 32, ""first_conv_kernel_size"": 3, ""n_blocks"": 4}",PRUNED
41,0.516540474779724,2026-09-16 22:03:30.177329,2026-09-16 22:09:01.609454,0 days 00:05:31.432125,0.9247676242511375,0.9504389488232652,0.0036743239430611693,0.00011577906193921799,128.0,0.2175991529791833,32,5,1,0.10463620548330137,64,5,2,0.35899420616686617,64.0,3.0,2.0,,,,,256,32,3,0.6993869676613972,8.0,3,Adam,,,,50.0,0.5193548387096775,0.5137261108497705,"{""block_0_dropout"": 0.2175991529791833, ""block_0_filters"": 32, ""block_0_kernel"": 5, ""block_0_stride"": 1, ""block_1_dropout"": 0.10463620548330137, ""block_1_filters"": 64, ""block_1_kernel"": 5, ""block_1_stride"": 2, ""first_conv_filters"": 32, ""first_conv_kernel_size"": 3, ""n_blocks"": 3}",COMPLETE
42,0.6256983426849922,2026-09-16 22:09:01.710538,2026-09-16 22:13:24.898626,0 days 00:04:23.188088,0.9109833414129045,0.93862487685607,0.0021656370308890047,5.2080869133084624e-05,128.0,0.29115604916779303,32,5,3,0.11360956987179874,64,5,3,0.303746014949986,64.0,3.0,2.0,,,,,256,32,5,0.6522351781835642,6.0,3,Adam,,,,48.0,0.6225806451612903,0.6288160402086941,"{""block_0_dropout"": 0.29115604916779303, ""block_0_filters"": 32, ""block_0_kernel"": 5, ""block_0_stride"": 3, ""block_1_dropout"": 0.11360956987179874, ""block_1_filters"": 64, ""block_1_kernel"": 5, ""block_1_stride"": 3, ""first_conv_filters"": 32, ""first_conv_kernel_size"": 5, ""n_blocks"": 3}",COMPLETE
43,0.5085006583278473,2026-09-16 22:13:25.002412,2026-09-16 22:17:45.120931,0 days 00:04:20.118519,0.8976294205181893,0.9366930818968321,0.0021590581049476605,1.2190600170075901e-05,128.0,0.2507552012146317,8,5,3,0.12049798250300771,64,5,3,0.30237676766995586,32.0,3.0,2.0,,,,,256,32,5,0.6491472593172273,6.0,3,Adam,,,,47.0,0.5129032258064516,0.504098090849243,"{""block_0_dropout"": 0.2507552012146317, ""block_0_filters"": 8, ""block_0_kernel"": 5, ""block_0_stride"": 3, ""block_1_dropout"": 0.12049798250300771, ""block_1_filters"": 64, ""block_1_kernel"": 5, ""block_1_stride"": 3, ""first_conv_filters"": 32, ""first_conv_kernel_size"": 5, ""n_blocks"": 3}",COMPLETE
44,0.5263874500937724,2026-09-16 22:17:45.231961,2026-09-16 22:21:50.946893,0 days 00:04:05.714932,0.9099560754621014,0.923392013783187,0.0009877243154465122,2.9065063438238573e-05,256.0,0.142072707960487,32,5,3,0.10092235190040985,64,3,2,,,,,,,,,256,32,3,0.6062529235534683,5.0,2,Adam,,,,50.0,0.5258064516129032,0.5269684485746416,"{""block_0_dropout"": 0.142072707960487, ""block_0_filters"": 32, ""block_0_kernel"": 5, ""block_0_stride"": 3, ""block_1_dropout"": 0.10092235190040985, ""block_1_filters"": 64, ""block_1_kernel"": 3, ""block_1_stride"": 2, ""first_conv_filters"": 32, ""first_conv_kernel_size"": 3, ""n_blocks"": 2}",COMPLETE
45,0.5297134924506373,2026-09-16 22:21:51.051706,2026-09-16 22:26:11.440699,0 days 00:04:20.388993,0.8902493309337819,0.9553419154564807,0.0019025797421645084,0.00016504297870780307,64.0,0.10195377076178486,32,5,3,0.1397962595966344,64,5,1,0.4444358616514228,64.0,3.0,2.0,,,,,256,32,3,0.5422684816779042,16.0,3,Adam,,,,49.0,0.5290322580645161,0.5303947268367583,"{""block_0_dropout"": 0.10195377076178486, ""block_0_filters"": 32, ""block_0_kernel"": 5, ""block_0_stride"": 3, ""block_1_dropout"": 0.1397962595966344, ""block_1_filters"": 64, ""block_1_kernel"": 5, ""block_1_stride"": 1, ""first_conv_filters"": 32, ""first_conv_kernel_size"": 3, ""n_blocks"": 3}",COMPLETE
46,0.3295725160652934,2026-09-16 22:26:11.543146,2026-09-16 22:27:05.948353,0 days 00:00:54.405207,0.9146527177520206,0.9223780088439705,0.00010749669066913583,2.044940097014611e-06,128.0,0.272210803330054,32,5,3,0.12878189570585763,64,5,1,,,,,,,,,64,32,5,0.6564806778857721,9.0,2,Adam,,,,,,,"{""block_0_dropout"": 0.272210803330054, ""block_0_filters"": 32, ""block_0_kernel"": 5, ""block_0_stride"": 3, ""block_1_dropout"": 0.12878189570585763, ""block_1_filters"": 64, ""block_1_kernel"": 5, ""block_1_stride"": 1, ""first_conv_filters"": 32, ""first_conv_kernel_size"": 5, ""n_blocks"": 2}",PRUNED
47,,2026-09-16 22:27:06.058456,2026-09-16 22:27:06.151969,0 days 00:00:00.093513,,,,,,0.21171535060675414,32,5,3,0.12151430626163401,64,5,2,0.2644683150094759,32.0,3.0,2.0,0.49606701791154406,64.0,3.0,2.0,,32,3,,,4,,,,,,,,"{""block_0_dropout"": 0.21171535060675414, ""block_0_filters"": 32, ""block_0_kernel"": 5, ""block_0_stride"": 3, ""block_1_dropout"": 0.12151430626163401, ""block_1_filters"": 64, ""block_1_kernel"": 5, ""block_1_stride"": 2, ""first_conv_filters"": 32, ""first_conv_kernel_size"": 3, ""n_blocks"": 4}",PRUNED
48,0.5302304050467531,2026-09-16 22:27:06.251908,2026-09-16 22:32:22.908969,0 days 00:05:16.657061,0.9049682206628406,0.9413270175307014,0.0006053144002250733,9.664576650608248e-06,256.0,0.17627677804719125,32,5,3,0.1446840533309861,64,3,2,,,,,,,,,256,32,7,0.6229060147611996,6.0,2,Adam,,,,44.0,0.5225806451612903,0.5378801649322159,"{""block_0_dropout"": 0.17627677804719125, ""block_0_filters"": 32, ""block_0_kernel"": 5, ""block_0_stride"": 3, ""block_1_dropout"": 0.1446840533309861, ""block_1_filters"": 64, ""block_1_kernel"": 3, ""block_1_stride"": 2, ""first_conv_filters"": 32, ""first_conv_kernel_size"": 7, ""n_blocks"": 2}",COMPLETE
49,0.3269824481108774,2026-09-16 22:32:23.017028,2026-09-16 22:33:36.369165,0 days 00:01:13.352137,0.9337390986743802,0.9678765120607995,0.003152463730374832,3.3234014607542642e-06,128.0,0.27391342609745944,8,5,3,0.15439780809849382,64,5,2,0.31525426497100284,64.0,3.0,3.0,,,,,128,32,3,0.16359767573347478,5.0,3,Adam,,,,,,,"{""block_0_dropout"": 0.27391342609745944, ""block_0_filters"": 8, ""block_0_kernel"": 5, ""block_0_stride"": 3, ""block_1_dropout"": 0.15439780809849382, ""block_1_filters"": 64, ""block_1_kernel"": 5, ""block_1_stride"": 2, ""first_conv_filters"": 32, ""first_conv_kernel_size"": 3, ""n_blocks"": 3}",PRUNED
